start	end	text
0	7840	me stesso, quindi posso essere più libero e alla domanda adesso così articolata che
7840	16280	ha fatto Giaia Ramponi, io rispondo forse proponendo più dei dubbi, cioè in un modo
16280	25860	problematico che non delle soluzioni, perché ho il timore che un tema che esiste da sempre
25860	35260	da quasi sempre, quello che una vera unione politica non può non avere la sua forza militare,
37420	45220	però con una accelerazione in un certo senso, se si può dire così di un tema pure di lunghissima
45220	53980	data, a Helsinki, adesso è stato ricordato, si è presa una decisione, allora io mi domando
53980	62400	su quale strada noi camminiamo e in che senso dico questo, innanzitutto noi dovremo sapere
62400	72560	che cos'è l'Europa, noi abbiamo troppe Europe, noi nel nostro continente noi abbiamo l'Unione
72560	82520	Europea, abbiamo l'Organizzazione della Sicurezza e Cooperazione Europea, abbiamo l'Unione Europea
82520	91040	occidentale, abbiamo l'Organizzazione della Cooperazione Europea, qui sono presenti anche
91800	99160	gli Stati Uniti e il Giappone, e abbiamo la Iniziativa per il Centro Europa, quindi è
99160	109340	un quadro europeo molto affollato, noi oggi ci occupiamo qui della Unione Europea, ma
109340	119040	è chiaro che il collegamento deve essere fatto tanto più che ed è il secondo rilievo,
119340	128660	modificando un poco la linea della prudenza nell'allargamento dell'Europa, adesso si
128680	138740	parla anche l'ultima relazione del Ministro dopo il Consiglio che si è stato, si parla
138740	147180	con, non voglio dire con disinvoltura, ma di un'Europa a 28, di un'Europa a 30, che
147180	155420	significa questo? Da parecchi punti di vista, noi oggi lo vediamo da un angolo molto specifico,
155420	163440	però il problema è certamente più vasto, anche perché il giorno in cui ci fosse veramente
163440	171920	un'Europa a 28, a 30, quelli che sono al di fuori, e lo sono volontariamente, non la
171920	178680	Svizzera che non desidera entrarci, ma quelli che sono al di fuori verrebbero a costituire
178680	191700	un terzium nel quale, non so se poi le tentazioni allora di avere un specie di collante di non
191700	207400	allineati eventualmente non con dispiacere della Russia, anche se la Russia direi che
207400	214840	in questi ultimi giorni ha con la NATO ripreso un certo contatto che negli ultimi mesi era
214840	228720	rimasto bloccato. Non rifaccio storie passate, però ricordo un dato su cui si parlò poco,
228720	240940	ma che fu poi una delle cause, quando si elaborò il patto atlantico, si portò al ratifica il patto
240940	251760	atlantico, i motivi, chiamiamo politici, erano prevalenti, ma c'era anche un motivo che l'Europa
252680	264040	sapeva che se avesse dovuto da sola far fronte alle proprie esigenze di difesa, avrebbe dovuto,
264040	270420	e forse non sarebbero state nemmeno sufficienti, destinare a questo tutte le risorse, allora tutti
270420	275860	i programmi di ricostruzione, di sviluppo, e sarebbero rimasti sostanzialmente bloccati.
275860	282400	Certo non era l'argomento prevalente, però era uno di quegli argomenti che contava,
282560	288660	tanto è vero che anche poi nonostante la storia si fa in un modo un po' diverso, quando poi
288660	300900	alla iniziativa della comunità europea di difesa che come tutti ricordano formalmente fallì perché
300900	309140	l'assemblea nazionale francese non ratificò, però questo argomento di preoccupazione era molto
309140	318300	forte in tutti, noi compresi, tanto è vero che il governo Pella non presentò nemmeno per la ratifica,
318960	324740	e il governo Schebler lo presentò ma non chiese mai l'inscrizione all'ordine del giorno, questo
324740	331360	dobbiamo ricordarci perché è un problema che in parte esiste anche oggi, l'ultimo punto,
331600	338140	io se non vado nell'ordine però ho presente benissimo tutti i punti che sia pure nel
338140	347840	brevissimo tempo che ad ognuno di noi è riservato, si pone allora certamente anche un problema che
348440	356340	è stato posto, Helsinki è molto bello come testo, ha solo il difetto come tutti i testi dell'Unione
356340	372200	di essere lunghissimo così che nessuno legge, qui mi riferisco solo al punto 26 e 27 dove si stabilisce
372200	382440	l'autorità massima e rimane l'Organizzazione delle Nazioni Unite e poi si crea questa formula,
382560	387560	il Consiglio Europeo sottolinea la propria determinazione a sviluppare una capacità
388240	395500	decisionale autonoma e, dove non sia impegnata la NATO nel suo complesso, a lanciare e condurre
395500	402180	operazioni militari dirette dall'Unione Europea in risposta a crisi internazionali. Questo
402180	409840	processo eviterà sovrapposizioni inutili e così via. Qui è certo il rapporto NATO,
410380	418540	che qui il discorso sarebbe molto lungo, e veda già i Ramponi, lei cita giustamente la nuova strategia
418540	427760	della NATO. Questa nuova strategia però, a mio giudizio, io ripeto il vantaggio del primo avviso,
427760	436080	la NATO è un patto estremamente preciso, che aveva il suo compito di creare un deterrente
436080	443180	tale da scoraggiare l'avversario e lo ha tanto realizzato che addirittura l'avversario è finito,
443200	453000	insomma, quindi senza dover mai sparare un colpo. Questo è molto preciso. Che vuol dire la nuova
453200	462760	strategia? Io sinceramente ho dei dubbi che senza una ratifica di questa, che è una modifica del,
463320	469160	uno può accettarla o non accettarla, però è una modifica della NATO, è una modifica del trattato,
470180	481060	perché è vero, si dice, ma già nel coso era stata data questa interpretazione della possibilità che
481060	489080	i motivi umanitari così, vabbè, una volta può fare anche una cosa extraordine in casi di urgenza,
489480	495340	ma a mio giudizio, e questo non per dire che deve esserci o no, ma deve essere approfondito questo
495340	502300	punto, perché da allora, da Washington, dove si è creata questa nuova strategia, c'è una specie di
502300	508420	silenzio su questo aspetto, che è un aspetto giuridico, ma anche un aspetto politico molto
508420	519320	importante secondo me. Qui nel testo di Elzich, si fa salva questo, perché è un qualche cosa
519320	526100	senza la NATO, ma non contro la NATO, inserita però nello stesso ambito. Ora, a me sembra,
526820	534700	e questo lo dico con molta chiarezza, che la connessione nel nostro quadro difensivo europeo
534700	544000	con gli Stati Uniti deve rimanere, deve rimanere per molti motivi, uno è quello che ho detto prima,
544120	550880	e qui lo anticipo subito, noi diciamo sì, ci vogliono maggiori istanziamenti, è giusto,
551200	559260	ma siamo in condizione di avere questi maggiori istanziamenti? Noi abbiamo degli altri legami,
559260	567960	oltretutto con l'euro, una certa elasticità di bilancio che noi una volta avevamo, adesso non c'è più,
568460	573820	quindi noi dobbiamo sapere, perché non si può lavorare a sezioni staccate, insomma,
574020	579820	il giorno si parla dell'euro, l'altro giorno si parla dei programmi di difesa comune, quindi sotto
579900	589940	questo aspetto io ho dei forti dubbi che no, in una prospettiva le scadenze sono queste, le scadenze poi
589940	599160	della prima applicazione di questo nuovo modello, questo è del 2003, però se si si mette su questa
599160	608660	via è chiaro che poi qui ci sarà una espansione. Io mi domando anche da un punto di vista se si
608660	615140	invadere il campo dei militari, ma quando si fa un programma di sicurezza bisogna sapere chi è
615140	623880	l'ipotetico nemico, in questo caso sicurezza verso di chi, io non lo capisco molto, chi è il nemico
623880	634660	contro il quale noi ci creiamo per quali cose, tanto più la mia, mi dispiace di dare solo un
634990	643470	contributo ai dubbi, però serve anche questo io ritengo. Tanto più che noi qualche mese fa in
643470	648750	un altro ambito di quelle tante europe a cui prima ho fatto riferimento l'organizzazione della
648750	655470	sicurezza e cooperazione, nella riunione di Istanbul abbiamo previsto la creazione di un
655470	662930	corpo di polizia della cooperazione e della sicurezza proprio per fronteggiare queste
662930	674850	situazioni che sono delle situazioni di una certa anormalità. Anche qui come si coordinano
675430	692910	queste due prospettive non mi rimane molto facile. Certamente perché dico, noi quando facciamo i
694090	700770	generali già dette delle cifre importanti di quella che è la spesa degli Stati Uniti e quella
700770	707030	che è la spesa europea probabilmente ne avrete già riparlati in questi giorni, noi come numero
707030	713510	di soldati noi ne abbiamo il doppio di quello che hanno gli Stati Uniti, ma la spesa per soldato
713510	725490	che da noi è circa la metà senza dire che spese di ricerca che sono estremamente più basse. Quindi
725490	738510	io penso che Helsinki forse si è avuta troppa fretta nel concretare già addirittura nello
738900	748240	stabilire delle date e nel concretare poi questa forza comune, ma senza dire poi altro capitolo,
748440	756780	oppure ci sono adesso anche degli accordi di cooperazione militare bilaterali con alcune
758260	771780	quindi un'altra cosa che si aggiunge questo quadro che io qui ho cercato di affrontare
773620	786620	pensando che ci vuole veramente una riconsiderazione di tutta la concezione globale di questa Europa e
788640	796540	quando io ho parlato prima della NATO mi sono domandato perché immediatamente dopo la caduta
796540	805020	del muro di Berlino dopo la fine dell'est i primi disegni non prevedevano la continuazione
805020	812000	della NATO, prevedevano altre cose, poi si diceva no la NATO ringraziando Dio ha raggiunto il suo
812000	819180	fine sociale e si scioglie poi e si crea una cosa diversa. Ci dissero poi molte cose diverse,
819260	827480	la verità qual era la preoccupazione nel fare una cosa nuova? Qui forse Ledin può dire se era
827480	836460	una preoccupazione fondata o no che il congresso americano mentre per il mantenimento di una cosa
836460	843940	che esisteva non aveva bisogno di prendere delle misure di fare delle votazioni probabilmente
844520	853600	s'avessero dovuto votare un qualche cosa di nuovo per un intervento così massiccio quando il Senato
853600	860060	americano votò il 480 anzio credo non si pensasse nemmeno lontanamente che per 50 anni sarebbe
860220	867640	rimasto uno sforzo così massiccio quindi probabilmente questa è stata e penso qui può
867640	876000	essere che io sia maligno ma penso che forse anche questo sorvolare sul problema adesso
876000	884580	della ratifica delle modifiche e classificarle come nuova strategia in modo che non ci debba
884810	897410	forse un voto può darsi che sia anche nel sfondo di questa preoccupazione. Allora che cosa vorrei
897410	907510	dire? Non tutto quello che è nuovo è sempre buono c'è un reformatio in peius nel diritto
907510	916810	processuale penale ma anche nella vita qualche volta. Allora io mi domando se si è fatto da noi
916810	929550	e anche dagli altri paesi se si è fatta una valutazione globale concreta attuabile di tutto
929550	936470	questo tenendo conto e poi ho finito che una delle ragioni per cui ci ha sempre aiutato l'esistenza
936540	944140	di questo collegamento con gli Stati Uniti è che non ha creato una posizione di debolezza
945200	952960	all'interno dell'Europa tra i due paesi nucleari e gli altri paesi. Abbiamo potuto aggirare questo
952960	962320	problema non aggiungo altro siccome ci sarà un secondo giro se dalle risposte che daranno gli
962320	970220	altri convenuti io avrò elementi di tranquillizzazione il primo ad esserne contento sono io oggi io sono
970220	991360	fortemente preoccupato. Grazie Presidente Andreotti è ovvio che oggi non cerco di fare nessun assunto
991360	1000400	o di esaltare le highlights di quanto detto da ciascun oratore perché è uno scambio di idee
1000400	1009080	e quindi preferisco cedere la parola invitando il professor Lydine ad esprimere le sue opinioni.
1010660	1020220	Grazie generale prima di tutto devo dire che è un enorme piacere scendere dall'aereo e trovarmi
1020220	1027540	per il nostro Paese e per l'Unione Europea. Volevo sottolineare solo questi aspetti la ringrazio
1027540	1029940	molto generale dell'invito ringrazio molto il Presidente.
1052340	1060080	Senza dubbio tanto vorrei chiarire che quando io ho detto prima che è venuto meno il fine
1060080	1066860	per cui la NATO esisteva una certa logica avrebbe consigliato di fare una cosa diversa
1066860	1073200	questo riguarda un fatto in cui credo ma che ha ormai un valore semplicemente di cronaca.
1073900	1083920	Oggi io ritengo che noi dobbiamo fare tutto il possibile per legare sempre di più il concetto
1083920	1091720	di sicurezza nostro europeo con il concetto di sicurezza americana cioè questo apporto americano
1091720	1101000	per me è indispensabile anzi è crescente e dobbiamo qui prescindono è verissimo quello che ha detto
1101000	1106060	Lydine normalmente anche nelle loro campagne elettorali di politica estera non si parla
1106060	1113580	quasi mai e capisco anche perché il presidente Clinton non parli né del coso e nemmeno della
1113580	1121580	Bosnia perché l'accordo di Dayton e devo dire che nell'accordo di Dayton ha previsto che i 300 mila
1121580	1127800	serbi che erano stati messi fuori dalla Craina dovessero ritornare in territorio croato nemmeno
1127800	1136080	il 5 per cento è ritornato quindi Clinton non fa credo l'esperienza anche di Bush fu interessante
1136080	1142400	perché Bush si trovò incastrato perché dopo avere per convincere l'opinione pubblica che era
1142400	1149540	necessaria la guerra del golfo avere dipinto per alcune settimane Saddam Hussein come il diavolo
1149540	1158660	e poi però cittadino normale so forse è stato un po impietoso Lydine nella cultura media degli
1158660	1164500	americani però credo che molta gente il costumo non sapeva nemmeno dove stesse e anche il cuvette
1164500	1171040	non sapeva dove stesse ma quando ti diceva Saddam Hussein è ancora al tuo posto quindi
1171040	1179080	siccome Milošić è ancora al suo posto penso che sia utile di metterlo fuori delle preoccupazioni
1179080	1186200	però a me pare importante io accentuo questa necessità anzi di una collaborazione maggiore
1187380	1193300	proprio perché se adesso spesamente all'età mia andrò a guardare quello che accade tra vent'anni
1196240	1207280	insomma mi piacerebbe molto ma non ci spero proprio perché c'è questo ambito più vasto
1207280	1212420	mondiale nel quale dobbiamo porre il problema della sicurezza abbiamo necessità di una
1212420	1221920	collaborazione maggiore e semplifico se ad esempio si potrà creare un sistema di scudo
1221920	1229320	spaziale il giorno in cui lo scudo spaziale lo avessero soltanto gli americani e gli altri
1229320	1235780	non lo avessero noi saremo certamente molto più esporti e qualche piccola esperienza di
1235780	1240580	preoccupazione a riguardo noi l'abbiamo sicura quando si cominciò a discutere dello scudo
1241520	1249500	spaziale come per avere l'adesione del congresso il governo richiese che molti parlamenti europei
1249500	1256820	esprimessero un senso di favore a questo e noi lo facevamo poi è successo però che nella ratifica
1256820	1263120	del congresso un personaggio importante glen che si vede andando nello spazio ha imparato molte
1263120	1276960	cose anche come fare il senatore signore non scherzo perché la prospettiva di prima era poi
1277560	1283120	alle industrie europee una larga partecipazione a questi programmi il senatore glen fece un
1283120	1288880	piccolo emendamento disse che potevano essere date commesse e induce a tenere tutto quello
1288880	1300300	che non si poteva fare negli stati uniti e che allora questo mi porta e lo dico in termini così
1300300	1307140	non drammatici però fu un trauma veramente per noi quel momento allora anche in questa
1307140	1312980	collaborazione che certamente anche l'europe deve fare molto di più utilizzando l'invito è
1312980	1320960	più che giusto di utilizzando le sue risorse le sue capacità moltiplicando quelle che sono anche
1320960	1328520	qui però le forme di cooperazione anche nel campo della ricerca nel campo di questo comune sforzo
1329560	1338500	allora del punto secondo punto rapidissimo non dobbiamo sfuggire a un problema signore è
1338500	1346380	verissimo oggi diciamo vedete la moneta è unica signori la moneta su 15 stati è unica per 11 se
1346380	1352740	andiamo a 28 che succede questo per questo io opposto il problema non per creare delle
1353340	1362920	perché ritengo che l'allargamento sia dell'unione sia della nato deve essere considerato intanto in
1362920	1369460	un modo abbastanza coordinato e poi anche con molta prudenza discutendone come in fondo stiamo
1369460	1376540	facendo qui noi cosa ma anche abbastanza rara che avvenga di avere un approfondimento dedicare
1376540	1383980	le giornate a questi tempi perché abbiamo sempre tutti molta fretta e molte inconvenzi penultima
1383980	1393740	questione ripresa necessaria della discussione sul disarmo ricordiamoci che nel corso della
1393740	1403580	presidenza regan bus si agì in modo parallelo sul disarmo nucleare e sui diritti umani era
1403580	1410520	un discorso importante quando una volta proprio il presidente regan dopo uno degli incontri con
1410520	1418200	gorbachev disse che avevano gli americani avevano presentato ai sovietici una bozza di modifica
1418200	1423980	al loro codice penale per evitare dei soprusi per esempio di mandare agenti in manicomio senza
1423980	1431460	nemmeno il certificato medico a noi sembro quasi che fosse impossibile che l'unione soviete potesse
1432140	1439580	niente affatto invece si ebbe questo parallelismo di questo discorso noi dobbiamo cercare di riprendere
1439580	1447600	un po quella stagione perché oltretutto questo poi si consentirebbe anche di frenare o di limitare
1447600	1457220	quella corsa al desiderio di contare di più anche sotto questo aspetto che alcuni paesi hanno e
1457220	1465360	poi è difficile anche filosoficamente convincerli che ci sono paesi che hanno diritto ad avere
1465360	1470820	alcune cose e altri paesi che non hanno diritti buoni e i cattivi ma chi è che stabilisce questo
1470820	1477060	in via stabile e in via accettabile quindi anche sotto questo aspetto questa ripresa è importante
1477060	1483900	vorrei dire la penultima cosa rapidissima sull'esercito chiamiamo professionale oggi mi
1484210	1491830	siamo avviati tutti la cosa importante adesso è di cercare poi di avere anche facendo un aspetto
1491830	1498390	soltanto di avere anche degli incentivi perché una parte di questi giovani poi potrà rimanere
1498390	1503530	nel sergio professionale allora nulla a questioni ma quelli che andranno a ferma per un certo numero
1503530	1509290	di anni cerchiamo per esempio di stabilire ipodizio solo un discorso da approfondirsi
1509290	1513250	cerchiamo di stabilire per esempio che nelle liste di collocamento abbiano una priorità
1513530	1521290	proprio perché hanno in fondo reso alla collettività un servizio esonerando la collettività dal
1521290	1530430	servizio militare obbligatorio quindi non è un regalo che noi facciamo ultimissima ultimissima
1530430	1537690	cosa ultimissima cosa noi siamo affermati su questa decisione di elzinghi è proprio il fatto che
1538030	1548170	a me invece incute un affetto ancora più grande per il disegno di elzinghi che è quello più largo
1548170	1555030	cioè il disegno della cooperazione e sicurezza europea nella quale fra l'altro in tempi
1555030	1559990	difficilissimi e pioneristici sotto questo aspetto si trovò
