start	end	text
0	7440	io credo che dobbiamo però adesso dato che siamo qui raccolti per parlare del
7440	14300	libro di Boliti che certamente si presta molto a considerazioni di
14300	21440	carattere più generale ma non confondere, non che voglio girare attorno alla
21440	27880	questione, con una conferenza stampa sul cosiddetto caso Buttiglione perché...
27880	33040	No, sulla questione cattolica. No, no, certamente, vabbè, io credo che su questo
33660	41440	bisogna tener conto di due cose, primo il dato cattolicessimo è intimamente
41980	46800	presente nella storia della nostra nazione,
47360	54440	basti andare in ognuno dei centri, a parte la storia sul piano nazionale, ma la
54620	59960	vita di ognuno dei centri, alcuni dei quali sono stati individuati così bene da
59960	68320	Boliti e poi ne parleremo, per vedere come sia piuttosto permeata la vita delle
68320	75260	comunità con quella che è stata una tradizione cattolica. E' semplifico, sarà
75260	81740	un modo empirico, ma sono stato ieri in una situazione buona, anzi in due
81740	90400	situazioni. Una Velletri, città quantomai laicista, città garibaldina,
91840	100200	festeggiavano i 100 anni della società sportiva locale, Velitre, creata da, adesso
100200	107860	è morto, da Mozio Moresi, che proprio riteneva che per avvicinare insieme
108540	113720	abituarli a guardare le cose concordemente, a non essere schiavi di un
114360	119620	passato, forse anche giustamente di contestazione, bisognava far fare insieme
119620	128420	a loro delle attività e sono cento anni che questa società ha festeggiato ieri il
128420	132560	centenario, io ero stato anche al cinquantennario, non potrò essere per
134000	139940	disponibilità ulteriormente, però l'uscito poi, qui c'è il senatore Zander, eravamo poi
139940	145820	insieme a Segni, altro comune qui della provincia, che cosa celebravano?
145820	154220	Celebravano 150 anni fa quando in un'epidemia di colera che fu terribile in
154220	159760	tutta Italia in quel 1854 e che venne dalla Crimea a Falato dove noi avevamo
160100	167600	il corpo di spedizione, la città poi aveva fatto un voto collettivo nei
167600	173960	confronti della doloranza e ancora adesso tutti, poi chi va messo, chi non va messo,
174740	179960	chi rispetta tutti e dieci comandamenti, chi ne rispetta qualcuno,
182180	188420	perché adesso voglio dire questo? Dobbiamo star attento, mi pare, a fare un
188740	194480	problema, direi, di indirizzo fondamentale rispetto a quelle che sono
194480	200580	delle contingenze di carattere politico. Qual è l'indirizzo fondamentale?
200660	205600	Certamente l'indirizzo fondamentale non può, non risentire, non potevano
205600	214560	risentire di quelle che erano le situazioni storiche. 1904, fondo del
214560	220920	Corriere della Sera, affirma Albertini, parla delle elezioni amministrative e
220920	227360	dice, bontà loro, che i cattolici potevano partecipare alle elezioni
227360	231780	amministrative e anche perché quello che era accaduto a cavallo del secolo
231780	236880	faceva sì che se non partecipavano i cattolici, se la vedevano piuttosto male,
238200	243360	certi ceti io ritengo in modo particolare, però dice, nessuno pensi
243360	248640	con questo che voglia dire il diritto dei cattolici ad andare in Parlamento
250100	258300	1904, poi dopo fatto Gentiloni, seci, per fare soltanto due esempi. Cosa è stato
258300	266260	il dopoguerra da noi? Il dopoguerra era un momento nel quale vi era sotto
266260	272600	scacco la situazione, anche dal punto di vista religioso, ad opera dei sovietici
272600	278360	Prendiamo chiaro, quando Piotro Dicesimo, hanno speculato poi su questa frase
278360	285460	traducendo forse in un modo non preciso il telegramma di Myron Taylor, quando
285460	292980	Piotro Dicesimo aveva detto, beh, gli americani però si illudono che dopo la
292980	302180	guerra saranno loro e saranno gli inglesi a avere peso in Europa, chi avrà peso
302180	309800	sarà Stalin, e questo poi di fatto fu così, mai la chiesa aveva avuto
309800	314760	tante persecuzioni come ha avuto in quel momento, Hitler non si era mai permesso
314760	320460	di arrestare il carniare Faulhaber, il carniare von Galen, allora c'era la
320460	325140	chiesa, che cosa doveva fare in quel momento? A mio avviso schierarsi in una
325140	331760	posizione che non era per un partito, ma era per evitare che si arrivasse ad una
331760	336220	situazione, anche dal punto di vista religioso, ma non solo dal punto di vista
336220	341540	religioso, fosse una situazione negativa, e come nessuno contestava ai
341540	346520	coltivatori diretti di battersi per evitare che le terre diventassero
347160	352360	proprietà collettive, così i coltivatori diretti di anime avevano non solo il
352900	358240	diritto ma il dovere, a mio avviso, e da lì nacquero i comitati civici, eccetera,
358240	363200	chi poi ne voleva trarre invece una formula di carattere generale che
363200	368280	purché si fosse anticomunisti tutto andava bene, questo non è vero per niente,
368540	372700	questo era il contrario di quello in cui noi credevamo insomma, quindi di
372700	380200	qui le operazioni di Stulzo e di Intorni. Allora io credo che non sia giusto dire
380200	385400	beh oggi la chiesa è più libera perché non c'è la democrazia cristiana, mi pare
385400	392880	che insomma non sia giusto dire così, perché ogni cosa ha il suo tempo,
393680	398560	esistono anche delle stagioni fisiologiche, l'Italia aveva una stagione
398560	404560	ventennale, geolitica ha dominato la politica all'inizio del secolo scorso,
405380	410460	durò vent'anni, il fascismo che pure si chiamò un'era, addirittura aveva riformato
410460	417380	il calendario, era fascista, durato vent'anni, siamo durati 40, quindi può
417380	424080	darsi che a parte altre circostanze, a parte così dei volontari guastatori di
424080	433460	varie appartenenze, poi sia stata questa così mai una bandiera, però io non credo
433740	441900	assolutamente che sia questo il vero problema. Oggi vedo certamente, non mi
441900	449240	pare giusto adesso prendersi in questa maniera con bottiglione, non mi pare
449240	456460	giusto farne una questione adesso di libertà generale o di non libertà
456460	462220	generale, sono stato attenti a queste massimalizzazioni che teoricamente ce
462220	467340	l'abbiamo tutti con i fondamentalisti, ma poi un po' di fondamentalismo ce l'
467340	472580	abbiamo tutti un po', nel nostro modo di ragionare e di pensare, quindi da sotto
472580	483300	questo aspetto dobbiamo, io credo, stare piuttosto attenti. Certo che se oltre i
483300	488140	quattro Vangeli, c'è anche un quinto Vangelo scritto a due mani da
488140	492940	bottiglione da Giuliano Ferrara, io aspetto di poterlo leggere un po' meglio
492940	504740	per poter capire, insomma io sono un popolano romano, non mi muovo in
504740	510500	questi sceli così alti, però vorrei essere un po' prudente, ma non per essere
510500	521380	reticente. Direi che non è stato reticente il Presidente Andreotti, Ezio
521380	526820	Mauro, anche a lei vorrei rivolgere una domanda necessariamente analoga, al di
526820	532080	là della valutazione di merito, ha senso promuovere una lobby
532080	540260	cattolica in Italia, lei ha scritto in un bell'editoriale che la minoranza vera
540260	544680	in nome dei diritti, in nome di tante cose, forse anche in nome della carità
544680	551480	cristiana di essere meno duri, meno massimalisti, però stiamo attenti adesso
551480	558760	che addirittura le innaturalità diventino la norma e che siano anormali
558760	563980	coloro che sono normali, questo scusate, lo dico in una maniera estremamente
563980	569140	riassuntiva, ho avuto pure una denuncia penale per aver detto una frase di
569140	573560	questo in televisione, però per fortuna che hanno sbagliato perché hanno poi
573560	578620	portato la cassetta sbagliata nel processo e quindi anche lì
578620	584960	hanno avuto una forma di così, allora me la sono cavata senza danni su questo
584960	593660	aspetto, ma vorrei però dire tornando un momento alla linea che mi è
593660	598680	veramente estremamente piaciuta di questo tipo di analisi, perché ci porta
598680	604380	allora a considerare certe cose, certo, magari nel momento hanno suscitato una
604380	609900	grande emozione, nessuno ha fatto contestato, o quasi nessuno, quando
609900	616520	trovandoci noi dinanzi ad un problema nuovo, i muti latini, e perché la
616520	622700	seconda guerra mondiale tra le realtà infami che ha creato è stato quello di
622700	627420	non aver più le guerre e guerreggiate ai fronti di combattimento, ma di bombardare
627420	633940	le città ed è diventato anzio adesso quasi una norma che si possano
633940	638300	distruggere interamente una città e questo è un'operazione di carattere
638300	643800	bellico. Allora noi ci trovavamo impreparati, è benvenuto un sacerdote
643800	651900	Doniocchi e affidò a Doniocchi questa missione nuova anche dal punto di
651900	660060	vista civile. L'ho citato perché non sono dei casi isolanti, non abbiamo avuto dei
660060	668380	casi splendidi Don Zeno, la riconsacrazione di Fossoli, chi ha citato
668380	674880	Fossoli dando forma nuova a questo tipo di famiglie, se si vuole un po'
676320	685080	Vorrei dire una cosa, non crediamo che questo indirizzo, chiamiamo di
685660	689900	permissivismo, dirò due cose solo poi se fate altre domande va benissimo,
690460	696240	questo indirizzo chiamiamo di permissivismo è sia un indirizzo in cui
696240	706140	poi il confine, lo spartiacque sia esser cattolico o non esser cattolico, è una
706140	712420	concezione di vita secondo me che noi dobbiamo guardare, un eccesso in
712420	722680	questa direzione va fuori. Allora prendiamo un esempio, l'oscenità, io per
723170	730690	esempio polemizzo o no con il Presidente del Consiglio su questioni politiche, ce
730690	735910	l'ho con lui per il grande fratello, dico la verità, perché è una delle cose che
735910	742470	mi ha turbato di più, perché mi ha turbato? Perché certe cose sono atti o
742470	746490	sceni il luogo pubblico, detto questo è che io sembro un bacchettone, non mi
746490	752550	importa niente insomma. Presidente però ho visto, ho letto che hanno espulso uno dei
752550	759630	partecipanti per una bestemmia, il grande fratello. Anche quello di aver
759630	765570	ritenuto di abolire penalmente la bestemmia, insomma il Dio se ne infisca altamente
765570	769110	credo da questo punto di vista, dal punto di vista scivite non mi pare che sia
769110	773630	stato una delle cose buone che sia stato fatto, ma tornando un momento, scusi
773630	778910	al tema per cui voglio dire, io cito l'articolo 21 della Costituzione della
778910	784690	Repubblica, non di un testo della conferenza episcopale o dell'ottocento,
784970	792690	l'articolo 21 quando parla della oscenità parla anche della ipotesi di
792690	800270	misure preventive e l'assemblea costituente, prima di sciogliersi, appena
800520	806900	la costituzione rimane perché doveva fare la legge elettorale, votò una legge
806900	812420	che è legge dello stato nella quale equipara allo sceno la stampa
813360	818860	raccapricciante e la stampa atta a turbare gli adolescenti. Signori questo è
818860	823900	la Repubblica italiana, non è qualche cosa che l'ha voluto padre Lombardi o
823900	830180	l'ha voluto il terzo ordine francescano, insomma io credo che certamente non è
830180	838380	che si può esaurire tutto di questa analisi, ma ci sono, ne fa un accenno ma
839220	843720	non ha esaminato a fondo questo quando parla dei movimenti, parla della
843720	848980	comunità di Santegilio che è una cosa stupenda anche dal punto di vista di che
848980	853620	cosa significa questo, cosa hanno fatto nel Mozambico, quando vedo che è una
853620	859340	comunità romana del Trastevere che va nel Mozambico e partecipa alla loro
862380	868240	liberazione di carattere civile, ma partecipa anche a trovare il modo
869520	874660	scientificamente di far sì che una donna malata di AIDS possa avere un
874660	882500	bambino e il bambino non sia malato di AIDS, cioè cito cose concrete, sono tanti
883160	888540	fasci di luce secondo me su una situazione che è complessa, siamo
888540	893860	migliori o siamo peggiori del passato, io non lo so, c'entra qui partito o non
893860	901760	partito, direi di no, non c'entra, siamo molto al di fuori, io ritengo che bisogna
901760	909460	stare attenti per carità a non creare degli steccati, questa è stata una delle
910140	916060	linee di fondo certamente dei gas, dei gas aveva un grande vantaggio, dei gas
916060	919760	era venuto alla politica italiana dato che apparteneva a una regione
919760	925600	irredenta, quando non c'era più la questione romana, quando era risolto, lui
925600	931340	non aveva avuto questa tragedia in fondo che ha per tanti anni, qui tutta la
931340	936920	nostra storia, se politico una volta si dedicherà forse un po' di attenzione,
937260	942580	tutto il problema di quello che è stato il fermento
942580	948820	di inizi del secolo scorso, quello che è stata la tragedia, le figure, adesso tra
948820	953840	tante rivalutazioni cerchiamo di far rivalutare anche Bonaiuti e Santa
953840	959860	Pace, perché noi da studenti non potevamo avvicinarsi a lui, ma Bonaiuti
961440	968340	oltretutto fu uno degli undici soli che pur di non giurare al regime fascista
968340	973940	rimase fuori da qualunque occupazione, quindi era a Dio spiacente dai nemici
973940	979580	suoi, io penso che oggi si possa rivedere un po' questo, allora anche qui
980700	987460	importante a mio avviso un qualche cosa, però di non arrivare poi a un
987460	992240	relativismo, nel senso di considerare che è buono ogni cosa e può essere buono
992240	997640	anche il contrario, questo sarebbe certamente un grossissimo errore e anche
997640	1004040	attorno alla ecclesia pauperum si è fatto anche un certo coascerbo di
1004040	1009420	confusioni, perché che certamente la chiesa sia carità, quello è fuori di
1009420	1016820	dubbio, in fondo i primi cristiani erano degli integralisti sul serio e poi
1016820	1023860	man mano ci si è differenziati, però lo sfondo a mio avviso deve
1023860	1033160	rimanere quello, ma non nelle forme, non nella esteriorità, perché fra l'altro se
1033160	1040800	si fossero costruite solo baracche, beh insomma noi non avremmo le vasiglie, non
1040800	1044820	avremmo le chiesa, non avremmo più dell'arte italiana e così via,
1045100	1053920	vorrei fare soltanto un'ultima considerazione, io penso che prima ho
1053920	1061640	accennato alla necessità di non generalizzare e poi questo concetto
1061640	1071720	molto umano del rapporto è stato citato prima questo dirizzo abbastanza critico
1071720	1076440	il fatto che la chiesa non sape a parlare o non parli o non possa
1077400	1085140	parlare all'individuo, è veramente, certo la comunicativa vuol dire molto, poi
1085140	1089020	dopo se ci fare delle domande per carità, ma una delle cose mi è rimasta
1089700	1095240	impressa era di un sacerdote romano splendido il cardinal Traia, era
1095240	1100620	veramente una figura straordinaria, mi è rimasta impressa ancora dal
1102680	1112160	1938, quindi sono anni, noi come giovani universitari andavamo a pietralata come
1112160	1117680	la conferenza di san vincenzo, ci chiamavano i signorini, poi signorini niente
1118580	1124580	e quando ci furono le cresima a pietralata per dire la capacità che ha un
1125040	1132820	sacerdote si indovina il tono giusto e la frase giusta, ci invidarono anche il
1132820	1138660	giorno delle cresime e il cardinal Traia, allora non era ancora cardinal, fece un
1138660	1144680	discorsetto, la pedagogia è straordinaria, quando disse ragazzi tanto
1144680	1149940	voi in chiesa per il momento ci venite, io devo profittare che se non parlo
1149940	1154860	adesso ai grandi, qui se non è un'occasione come questa, un fulerale, chi
1154860	1160760	vede, e allora no è stata e disse una cosa, lui che aveva due lauree eccetera
1160760	1166900	però sapeva avere questa comunicativa, disse beh quando io stavo entrando uno
1166900	1172120	mi ha detto sì monsignor lei ha ragione il cristianesimo ma so a du mila anni che
1172120	1176940	c'è il cristianesimo e tanta gente ancora è cattiva, lo sa che io ho
1176940	1183840	risposto, guardate pure il sapone c'è chi è zozzo, ma non è il corpo del sapone,
1183840	1192860	è il corpo sua, adesso scusate se, io banalizzo le cose però vorrei dire
1192860	1198520	e che io penso che il nuovo catechismo, il vecchio catechismo, il riassunto del
1198520	1205540	nuovo, io ricordo che in Romagna c'era già quei repubblicani, i repubblicani
1205540	1212040	avevano un cristianesimo laico, non andavano a messa però diciamo avevano i
1212040	1218140	valori della famiglia, della lealtà, della responsabilità, della parola data e
1218140	1225140	diciamo del senso dello stato che diciamo a volte insegnava anche ai
1226400	1233440	catolici, ora questo si riproduce continuamente, c'è uno scambio, c'è un
1233440	1240360	osmosi fra l'uno e gli altri, questo è un valore, se invece si intende per laico
1240360	1246640	questa diciamo, lasciar perdere diciamo a questo soggettivismo è chiaro che non è
1246640	1252860	possibile. Credo che siamo alle battute finali, volevo due brevissimi flash, mi ha
1252860	1257280	chiesto di farli il presidente Andriotti su Islam e fecondazione, poi un'ultima
1258040	1263300	battuta con Susanna Tamaro e poi credo che Marco Politi possa tirare le fila.
1263960	1267840	Eminenzi, in Romagna qualcuno il senso dello stato ce l'ave anche troppo ma
1268030	1276210	questo prende i romagnoli spuri, scherzo, faccio perché questo io sono
1276210	1282610	stanco, forse voi siete molto più giovani, no, vorrei solo di due cose, intanto quello
1282610	1287490	che ha detto prima Mauro è giustissimo nel senso, lui stesso ha usato
1287490	1292790	l'espressione dei naturalmente cristiani, l'espressione di Sant'Agostino, quindi
1292790	1297590	fra l'altro è di attualità perché le reliquie di Sant'Agostino sono a Roma
1297590	1302090	per questa settimana, c'è una serie di iniziative anche culturali
1302090	1306890	importanti che consentiranno anche di avere qualche scambio utile.
1307270	1312650	C'ho due piccole cose che vorrei dire, ma soltanto come accenno,
1313090	1321410	una prima è quella di battaglie perché farsi contare o non farsi contare,
1321870	1326570	noi siamo dinanzi ad un problema, questo problema della legge sulla fecondazione
1327250	1331870	io sto dedicando, faccio ancora una volta reclamo a trenta giorni, un articolo di
1331870	1336710	ossicini che fate uno scienziato oltretutto in questo campo ed è molto
1336710	1342570	utile, noi riteniamo e credo che su questo non ci dovrebbero essere dei dubbi
1342570	1347210	che la cosa peggiore è non avere delle regole, non avere la legislazione perché
1347210	1352890	si presta a volte a dei commerci, ad un sottofondo tutt'altro che approvabile
1352890	1359850	quindi noi abbiamo ritenuto, io stesso ho votato dicendo non è certamente la
1359850	1364370	legge perfetta e anzi la legge che va migliorata e modificata, però la cosa
1364370	1369270	peggiore era se non votavamo e rinviavamo la navette che durava da tanto
1369270	1374750	tempo con la camera dei deputati non avevamo alcuna legge, cosa che penso che
1374750	1380370	non sarebbe giusto, quindi io penso che attualmente lavorare, ho visto c'è anche
1381170	1386810	di campo cattolico lo pensa diversamente, di lavorare invece per vedere come si
1386810	1392090	possa modificare, io credo anche per una ragione, tanto è un campo
1392090	1398050	estremamente delicato, dobbiamo anche rispettare per qualcosa vuol dire per
1398050	1402890	una donna, il volere della maternità, quindi dobbiamo veramente stare molto
1402890	1408290	attenti insomma in questo campo, però noi abbiamo avuto due volte che ci
1408290	1414530	siamo contati, ma su due cose che erano opinate, io feci tutte e due le volte
1414530	1420410	uno sforzo per evitare che si arrivasse al referendo, per carità sono rimasti
1421330	1425530	in minoranza nella seconda volta, la prima volta su la questione del
1425530	1430750	divorzio io per esempio penso che saremo stati forse più nel giusto se
1430750	1436890	avessimo detto benissimo per i matrimoni civili si può essere il divorzio, per il
1436890	1442790	partito lateranese e tutto, però fumo accusati perché c'era un'illusione
1442790	1446710	fra l'altro, ricordo che Gabriele Lombardi mi disse
1446710	1451130	ah perché voi politici vivete come i pesci rossi in una vasca, non siete a
1451130	1456730	contatto con la gente, però l'abbiamo visto e quel
1456730	1465050	referendo ha fatto del male mi ha visto, indubbiamente se a Roma
1465050	1470710	su una posizione molto precisa che era stata della chiesa, beh la risposta era
1470710	1476690	questa risposta così di minoranza, beh non so se la curia fa, non so al Vescovo
1477830	1483330	di Calcutta un rimprovero dicendo stai più attento con i tuoi fedeli, ma
1483330	1489530	cominci a curarti tuoi insomma, più difficile era per l'aborto su cui però
1489530	1494330	discorso non si può fare solo di striscio, se scientificamente si
1494330	1499110	dimostra che dal momento della concezione c'è vita, beh allora
1499110	1505470	indubbiamente signori è abbastanza arbitrare il fatto di dire però fino a
1505470	1509310	quattro mesi devi rispettare, dopo quattro mesi
1509310	1513210	allora che cosa perché chi l'ha stabilito uno che ha due mesi se è
1513210	1519510	veramente vivo, se io lo uccido forse è come uccidere me anzi forse è più di
1519510	1526710	d'anno perché ormai sono in linea di uscita, questo direi, allora se si può
1526710	1533010	trovare ma discutendo ma non facendo dei soprusi, discutendo se si può
1533010	1538290	trovare un modo di evitare perché? Perché il referendum poi di fatto non è che si
1538290	1543930	fa su questo tema, si fa indubbiamente su tutto, si ripete come è stato per le
1543930	1547830	altre due volte, si mettevano insieme tutte le storie insomma allora era
1547830	1553750	libertà o non libertà, si rimetteva a me, dava un fastidio terribile per esempio a vedere
1554370	1558350	Malagodic che per il resto era scomunicato da una gran parte della
1558350	1563430	politica italiana però quando andava sul palco a predicare per l'abborso e per il
1563430	1568130	divorcio era una creatura molto utile, quindi questo vorrei dire siccome è un
1568130	1573670	tema di attualità approfondiamo di sapere bene i termini di questo, se si
1573670	1579130	può modificare evitando che ci sia un ricorso insomma che è generico perché non
1579130	1583530	è poi un ricorso che finisce su questo tema, l'altro aspetto è finisco e
1583530	1588710	riguarda tutto il problema che c'è adesso il famoso pericolo islamico,
1589070	1599110	devo dire scusate, io con grande amarezza ho letto il libro di Oriana Fallaci e mi
1599110	1603170	ha impressionato il fatto che abbia avuto un milione di copie, nemmeno la
1603170	1607270	Commedia credo sia arrivata ad un milione di copie, questo allora che cosa
1607270	1611730	ti dici? Perché mi ha impressionato? Perché l'impostazione che lei dà,
1611790	1616470	il padre dice che è altro, un diritto, però poi l'impostazione è di difendere
1616470	1620050	la civiltà cristiana nei confronti di questo terribile
