start	end	text
1665210	1672110	che il governo italiano, attraverso la sua parola, abbia equiparato i morti delle ardiatine
1672630	1679630	presi a teatro di Ottavia in quel modo in mezzo agli altri con le vittime, vittime dolorosissime
1680630	1689370	in un quartier generale nell'ambio nazionale militare, militare, e i tunisini, adesso verremo
1689370	1695630	anche i tunisini, ma devo dire che anche il richiamo del diritto internazionale, cari
1695630	1700710	compagni comunisti e altri colleghi, o lo si fa in pieno, signor Ministro, o non lo
1700710	1707870	si fa, secondo il diritto internazionale che il quartier generale di una forza rappresentativa
1707870	1716950	non armata sia con diritto di extraterro-orientalità installato in un Paese, è flagranza costante
1716950	1723750	del diritto internazionale e il diritto di rappresaglia al quale il governo israeliano
1724510	1732370	si richiama, a me non interessa perché non il terrorismo ma la guerra Ministro, le azioni
1732370	1739350	militari Ministro, la vendita delle armi a Assad e Medio Oriente Ministro del governo
1739910	1746130	italiano, queste sono barbarie, sono azioni militari e le azioni militari sono barbare,
1746810	1752430	ma sentire e dire che l'azione contro i tre edifici condotto in quel modo, quando lei
1752430	1761150	dice che contro il quartier generale, lei dice quattro volte, da quando in qua il quartier
1762250	1771750	generale è posto in un altro Stato e gode delle immunità di diritto negli altri posti,
1772050	1781790	abbiamo noti esempi e dibattiti sull'OAS e sul 62, ho capito, non avete mormorato quando
1781790	1788570	un momento fa a nome vostro è stato detto che Israele non deve più far parte del consorzio
1788570	1795190	delle nazioni civili, non l'avete mormorato e adesso interrompetemi se volete, di conseguenza
1795190	1802250	signor Ministro dico semplicemente che lei ha bene interpretato pare la posizione del
1802250	1807330	governo, devo dargliene atto perché anche il signor Presidente del Consiglio rimprovara
1807330	1817490	con un comunicato di poche ore fa l'aggressione terroristica in Tunisia, se questo è terrorismo
1817490	1822610	io credo che voi state arrivando alla mia conclusione di non violenta, che le armi e
1822610	1829670	le azioni militari sono tutte terroristiche, questa è la verità, ma non potete questa
1829670	1836270	verità usarla a vostro piacimento a seconda signor Ministro che siano i vostri alleati
1836270	1842790	che stanno passando, questi criminali che ammazzano nel loro Paese ogni giorno almeno 80 persone,
1843250	1852730	che le ammazzano fuori e poi al solito avere la propria coscienza che ripugna ogni volta
1852730	1858830	che il morto assassinato è assassinato in una azione israeliana e la logica di questo
1858830	1866250	nostro tempo è che con fierezza non mi unisco da non violenta non ne ho bisogno, ma comunque
1866270	1872390	non mi unisco a questo coro di critica, a questo concerto di esaltazioni del diritto
1872390	1881690	internazionale e dei diritti dell'uomo e dico semplicemente che sono in modo convinto
1881690	1888730	totale e radicale contro le posizioni assunte dal nostro governo, da lei e dal Presidente
1888730	1894610	del Consiglio così come sono contro e spero che un giorno ci verremo perché qui veniamo
1894610	1900290	per Shabra e Shatila e veniamo per questa cosa, per tutti gli attrichinimi in Aula non
1900290	1904330	si viene a discutere, quando ci discuterà della politica medio orientale del nostro
1904330	1910730	governo e si discuterà in Aula se loro vorranno i grandi gruppi che deliberano quello che
1910730	1916550	si discute in Aula o meno, ebbene anche la nostra assoluta avversione per la politica
1916550	1923510	irresponsabile dettata in realtà da interessi inconfessabili dei nostri governi al plurale
1923510	1929330	da 15, come Michel sa benissimo e non c'è, da 15 anni ad oggi, da 20 anni ad oggi nel
1929330	1934430	Medio Oriente, grazie signor Presidente. Con questo intervento di Marco Pannella del
1934430	1940910	3 ottobre 1985 pronunciato alla Camera dei Deputati si conclude qui l'odierno programma.
