start	end	text
0	3760	una responsabilità di muovere da questo verso un assetto di pace.
4760	14160	Era il 24 settembre 1982 Jean Fabre e Francesco Rutelli a Teleroma 56 sul viaggio in Israele
14160	19900	agli incontri che gli espandenti radicali avevano avuto con le forze politiche israeliane
19900	20840	e palestinesi.
21960	28020	L'ultima registrazione che vogliamo farvi riascoltare è invece dal 3 ottobre 1985 quando
28020	34300	alla camera si discusse sul raid israeliano al quartier generale dell'Holpe in Tunisia.
34400	39740	Riascoltiamo quanto dissero in quella sede l'allora ministro degli esteri Giulio Andreotti,
40460	44860	il comunista Giancarlo Paietta e Marco Pannella.
45660	51500	Con il bombardamento israeliano del quartier generale dell'Holpe in Tunisia, avvenuto
51580	57960	martedì, siamo in presenza di uno dei fatti più gravi e inquietanti verificati se negli
57960	59920	ultimi tempi sulla scena mondiale.
60700	66080	L'iniziativa militare israeliana rappresenta uno sviluppo particolarmente preoccupante
66080	67420	sotto diversi profili.
68460	75140	Vi è innanzitutto la gravità stessa dell'atto, essa viola a giudizio del governo i principi
75140	80780	del diritto internazionale e non può essere giustificato da alcun richiamo al principio
80780	83140	dell'autodifesa, comunque inteso.
84280	89960	Vi è un ulteriore elemento da considerare ed è quello rappresentato dal quadro politico
89960	92940	in cui l'azione israeliana si è inserita.
93680	99420	Un quadro caratterizzato dall'incerto procedere dell'iniziativa diplomatica per una soluzione
99420	106700	negoziale nel Medio Oriente che, evidentemente, forze di varia natura mirano invece a far
106700	107380	fallire.
108060	112980	E per di più l'assassinio di uno dei quattro diplomatici sovietici ad opera di un gruppo
112980	120240	finora sconosciuto che si richiama l'integralismo islamico e che agisce il Libano aggrava ulteriormente
120240	121300	il quadro.
121700	127760	Assai fosche infine appaiono le incidenze che il bombardamento israeliano è suscettibile
127760	131740	di provocare sul complesso della situazione medio orientale.
132760	138020	Vorrei chiarire in maggior dettaglio il punto di vista del Governo su ciascuno di questi
138020	138540	aspetti.
139820	148280	Noi abbiamo assunto, assieme ai nostri partners comunitari, una posizione di ferma ed inequiacabile
148280	154640	condanna nei confronti dell'iniziativa israeliana ed abbiamo subito espresso, attraverso una
154640	160000	ferma presa di posizione della Presidenza del Consiglio, solidarietà con le vittime del
160000	165880	bombardamento e con il Governo della Tunisia sul cui territorio si è verificato il deplorevole
165880	166320	fatto.
167220	173320	La dinamica materiale dell'attacco israeliano è abbastanza nota. Gli aerei di Gerusalemme
173320	178580	hanno colpito il quartier generale palestinese nei pressi di Tunisia, ritornando indenni
178580	189980	alla base ma lasciando dietro di essi un tragico strascico di morte e di distruzione. Il Governo
189980	193160	di Tunisia ha realizzato una nuova situazione, riconducendola alla fattispecie giuridica
193160	199700	della rappresaglia in relazione all'assassinio di tre cittadini israeliani avvenuto all'Arnaca
199700	203560	il 25 settembre ad opera di un commando palestinese.
204340	211000	Ora, il diritto di rappresaglia, per quanto umanamente terrificante, non è escluso dall'ordinamento
211000	217340	giuridico internazionale, si è inserito nel quadro più ampio del diritto all'autodifesa.
217580	223500	Lo stesso diritto internazionale, tuttavia, ne definisce caratteristiche e limiti. A giudizio
223500	228700	del Governo, l'azione israeliana non può essere giustificata, con alcun richiamo ai
228700	234560	principi dell'autodifesa comunque intesi proprio perché essa oltrepassa in maniera
234560	240360	ragrante ed inaccettabile, i limiti stabiliti dal diritto e dalla prassi internazionale.
241820	246480	Rilevo, anzitutto, che almeno fino a questo momento in cui parlo, non appare per nulla
246480	251080	provato il nesso fra gli autori del delitto di l'Arnaca e le vittime del bombardamento
251800	257300	israeliano, ma anche a prescindere da questo fatto, nulla, dico nulla, può giustificare
257300	263040	un'azione militare sul territorio di uno Stato terzo che non è in alcun modo responsabile
263040	269240	di atti terroristici. E di fronte al verificarsi di atti di tale tipo, noi ribadiamo l'assoluta
269240	275100	esigenza che la valutazione delle relative responsabilità venga portata nelle opportune
275100	280140	sedi internazionali, come io stesso ho avuto modo di dire al Ministro Shamir la settimana
280140	286280	scorsa a New York, perché è davvero assurdo celebrare solennemente il quarantesimo anniversario
286280	292180	delle Nazioni Unite e nello stesso tempo assistere a ripetuti atti di violenza e di
292180	301620	rappresaglia. Il crimine perpetato all'Arnaca ripugna ad ogni coscienza civile, ma uno Stato
301620	306660	democratico non può certamente fondare la legittimità del proprio intervento armato
306660	313940	in uno Stato terzo su un'azione criminale, non può e non deve stabilirsi alcun parallelismo
313940	320100	tra un comando che agisce nell'ombra e nella illegalità ed uno Stato che è tenuto ad
320100	325540	adeguare i propri comportamenti ai principi accettati dalla comunità internazionale e
325540	331500	sanciti dal diritto delle genti. Il nostro giudizio tiene ovviamente conto della circostanza
331500	337660	che in questi ultimi mesi la Sir Giordania è stata a teatro di gravi ripetuti attentati
337660	342720	a danno di cittadini israeliani che hanno suscitato una vasta eco emotiva in Israele
342720	348400	e non solo in Israele. Sappiamo anche che le autorità di Tel Aviv hanno reagito adottando
348400	353840	misure che a loro volta hanno provocato incidenti e vittime tra la popolazione araba dei territori
353840	360480	occupati, ma l'incursione israeliana in Tunisia non appare inaccettabile soltanto sotto il
360480	365880	profilo giuridico e condannabile sotto quello morale. Questa incursione infatti rappresenta
365880	372240	un fatto particolarmente grave sotto il profilo politico. Non possiamo certo ignorare che
372240	378440	la decisione del governo israeliano è intervenuta in un momento delicato per la Tunisia. I
378440	383360	suoi rapporti con la Libia attraversano attualmente una fase di tensione che è alimentata da
383360	389600	una atmosfera di reciproche accuse e in particolare dal riflusso dei lavoratori tunisini rimpatriati
389600	395000	dalla Libia. La tensione tra i due Paesi ha raggiunto livelli inquietanti ed è culminata
395000	401020	il 26 settembre nella rottura delle relazioni diplomatiche. Questa crisi aperta si fra due
401020	405700	importanti Paesi mediterranei, in cui l'Italia è legata da una vasta ed amichevole collaborazione,
407120	412120	rappresenta per il governo italiano un ulteriore motivo di grave preoccupazione proprio perché
412120	419480	aggiunge un nuovo fattore di destabilizzazione in quest'area. Ancor più grave ci appare l'inevitabile
419480	424380	incidenza che l'iniziativa è destinata ad avere sul quadro della controversia medio orientale.
425240	430600	Negli ultimi mesi si è rapprofilata come noto un'iniziativa negoziale giordano-palestinese,
431480	437600	sulla scorta dell'intesa raggiunta fra Reussein e Arafat l'11 febbraio scorso. Si tratta di
437600	443560	un'iniziativa che ha indubbiamente creato nuovi spazi di dialogo e di negoziato, e che ha
443560	448160	dischiuso la prospettiva di una soluzione pacifica della controversia arabo-israeliana
448160	453220	nella quale possano trovare realizzazione i diritti legittimi del popolo palestinese.
454080	459020	L'azione diplomatica giordano-palestinese coadiuvata dall'appoggio egiziano ha ricevuto
459020	465360	tra l'altro un non trascurabile incoraggiamento al vertice arabo a Casa Blanca il 7 agosto
465360	473080	scorso. Il nostro Paese è stato tra i primi a sottolineare gli aspetti positivi di tale
473080	478680	iniziativa. Ci siamo pertanto adoperati sia sul piano nazionale che nell'ambito europeo
478680	484280	per rafforzare il movimento diplomatico in atto verso un approccio negoziale. In particolare
484280	489040	il governo italiano, avvalendosi anche dei poteri delle prerogative della presidenza
489040	494460	comunitaria che abbiamo esercitato nel passato semestre, ha fatto in modo che sull'iniziativa
494460	500980	giordano-palestinese si catalizzasse l'appoggio dei partners europei, appoggio che si è espresso
500980	506560	nella dichiarazione di dieci ministri degli estri a Lussemburg il 29 aprile e nelle conclusioni
506560	512940	del vertice di Milano il 30 giugno. Tuttavia, proprio nelle ultime settimane, questo sviluppo
512940	518800	diplomatico ha incontrato notevoli difficoltà. In particolare non si è concretato l'incontro
518800	524880	tra l'assistente segretario di Stato Marfi e una delegazione giordano-palestinese. Ricordo
524880	529800	che una delegazione giordano-palestinese era stata ricevuta dal Presidente Craxi e da me
529800	536280	nel giugno scorso oltre che al più alto livello a Parigi. Un'altra difficoltà del processo
536280	541060	avviato dall'iniziativa giordano-palestinese è rappresentata dalla richiesta giordana
541060	546420	di una conferenza internazionale con la partecipazione dei cinque membri permanenti del Consiglio
546420	552160	di Sicurezza. Tale richiesta si urta contro la convinzione americana ed israeliana che
552160	561100	tale conferenza non sia più idoneo elemento per promuovere l'avvio di un negoziato fra
561100	567560	le parti. Di è stata, tuttavia, proprio lunedì scorso la notizia di una valutazione non negativa
567560	573820	di Simon Peres sulle dichiarazioni all'ONU del Re Hussein e questo rafforzi il sospetto
573820	580040	di manovre di chi a ogni costo vuole opporsi a qualsiasi negoziato. Non posso quindi non
580040	584820	esprimere il timore che tra le macerie del quartier generale dell'Olpe possa essere
584820	590160	stata travolta una parte delle speranze in un processo di distensione di pace in Medio
590160	595480	Oriente. Sarebbe infatti deplorevole se a seguito dell'incursione israeliana dovesse
595480	600840	andare distrutto quel patrimonio di sforzi politici e diplomatici che hanno impegnato
600840	606960	in questi ultimi mesi le diplomazie di tanti paesi compreso il nostro. Se il processo in
606960	612380	atto dovesse arrestarsi o venisse addirittura vanificato rischieremmo di innescare una spirale
612380	618400	involutiva assai pericolosa. Potrebbero determinarsi conseguenze imprevedibili nei rapporti tra
618400	623460	i giordani e i palestinesi la cui intesa è recente e non ha certo ancora risolto tutti
623460	628200	i problemi di una convivenza difficile. Si avrebbero inoltre temibili ripercussioni
628200	632620	in sena all'Olpe o velazione politica che da tre anni noi cerchiamo di incoraggiare
632620	638100	perderebbe terreno a vantaggio di una nuova svolta radicale. Vi sarebbero riflessi negativi
638100	642560	anche per l'Egitto che molto ha investito nel rapportamento di un polo arabo moderato
642560	648180	ed impegnato nel processo di pace. Infine più in generale vi è il rischio di un parziale
648180	653380	rialineamento sulla spinta del regalismo islamico che mina gli equilibri interni di
653380	659560	numerosi Stati della Regione. Non può non destare profondo sconcerto il constatare che
659560	664900	la condotta del governo israeliano si colloca in una rigida logica di reattività esasperata
664900	670260	che mette deliberatamente da parte ogni più ampia valutazione di opportunità politica.
670900	676820	Del resto l'intesa fra Usseine e Arafat era indicativa del fatto che la leadership palestinese
676820	682820	stava gradualmente avviandosi con crescente convinzione sul sentiero del negoziato l'unico
682820	688840	in effetti idone a fornire una risposta adeguata alle legittime istanze del popolo palestinese.
689560	694320	Certamente israele non poteva ignorare quanto la scelta negoziale risultava difficile e
694320	700460	quanto questa stessa scelta si urtava all'interno del movimento palestinese a resistenze e contrasti.
701200	705580	Da parte del governo italiano nello sviluppo della sua azione politica e diplomatica non
705580	712060	si era mancato di fare presenti in termini pressanti ai leaders palestinesi la necessità
712060	718200	che l'OLPE procedesse senza remore ed ambiguità verso un approccio negoziale con Israele,
718540	723540	ed avevamo insistito nel corso di contatti anche al più alto livello sulla necessità
723540	728900	di una piena e completa attuazione delle pertinenti risoluzioni del Consiglio di Sicurezza delle
728900	735520	Nazioni Unite. L'affermazione di una volontà negoziale comporta da parte di tutti la rinuncia
735520	741400	all'attività militare e alla violenza terroristica, ciò abbiamo anche detto pubblicamente prendendo
741400	746740	lo spunto dal recente attentato agli uffici della compagnia britannica in via bisolati.
747520	752940	La recente iniziativa, giovane a sottolinearlo, ha dunque obiettivamente indebolito l'azione
752940	759160	di quanti come noi si preoccupano sinceramente di garantire l'esistenza e la sicurezza di
759160	765760	Israele. Questa esistenza e questa sicurezza debbono inserirsi in un contesto di rispetto
765760	771340	dei principi di pacifica convivenza fra tutti gli Stati della Regione e di adempimento delle
771340	776980	esigenze di giustizia per il popolo palestinese. Come potremmo infatti invocare la rinuncia
776980	783180	alla violenza, se alla violenza si fa ricorso con tanta improbida facilità? Anche se non
783180	788500	dobbiamo e non vogliamo dar per scontato che il filo negoziale si sia definitivamente
788500	793840	spezzato dopo quanto è avvenuto martedì in Tunisia, è certo che tutto è diventato
793840	799900	più difficile. È più difficile di creare quel minimo di reciproca fiducia che può indurre
799900	804440	le varie parti a riprendere le fila di un dialogo superando l'ostacolo delle rigide
805320	810400	pregiudiziali. È più difficile per l'Italia e per i partners europei continuare ad operarsi
810400	817140	presso l'Holp per una scelta pacifica, chiara e coerente. E in questo senso mi sembra importante
817140	822500	il mandato affidato dai ministri degli esteri della comunità europea di invitare a Lussemburgo
822500	827500	la delegazione giordano-palestinese che tra qualche giorno si recherà a Londrove e sarà
827500	832720	ricevuta dal Primo Ministro britannico. È più difficile per il mondo arabo moderato
832720	837820	e per l'Egitto in particolare puntare su un processo di normalizzazione dei rapporti
837820	843840	con Israele in una prospettiva di pacifica convivenza e di collaborazione. Oggi, più
843840	849100	che mai, peraltro, occorre che tutti i Paesi che in Medio Oriente esercitano un ruolo utile
849100	854420	e responsabile non si lasciino scoraggiare dalle difficoltà ed agiscano con rinnovati
854420	860500	impegno per ricucire le lacerazioni e ridurre i contrasti. Questo l'Italia ha fatto finora,
860980	866580	con un'azione che le balza generale apprezzamento e rispetto. E in questa linea il Governo intende
866580	871860	continuare a muoversi con una tenace ed una coerenza che la drammaticità degli eventi
871860	878340	recenti non è giunta a scalfire. Siamo incoraggiati in questo dalla completa sintonia che si
878340	883700	registra tra la nostra posizione e quella dei partners europei, come è emerso con chiarezza
883700	888760	nella riunione dei Ministri degli Esti della Comunità martedì scorso a Lussemburgo. Questa
888760	894420	solidarietà, son certo, non mancherà di esercitare un impulso positivo e rappresenterà una
894420	900640	voce di moderazione, di legalità e di razionalità in un'area in cui il richiamo a questi valori
900640	907460	deve essere puntuale e costante. Un'altra considerazione a modo di conclusione. Ho già
907460	914100	detto che la rappresaglia trova in generale giustificazioni molto labili. Essa non è un
914100	920480	modo per difendersi efficacemente, perché finisce con l'alimentare una spirale di violenze
920480	927060	inarrestabile. Gli eventi del secondo conflitto mondiale hanno prodotto anche sul nostro suolo,
927060	932500	anche nella capitale, episodi tremendi di ritorzione e di rappresaglia, il cui ricordo
932500	937780	è dopo più di quaranta anni vivo in tutti noi e nei giovani. Dobbiamo fare in modo di
937780	945300	operare perché tali fatti non abbiano a ripetersi. Non soltanto qui, ma ovunque, nella convinzione
945300	951760	che i morti, e pensa quelli delle fosse ardeatine che a noi erano ottanta ebrei, costituiscono
951760	957340	un momento per agire, sempre e dovunque, per soluzioni politiche delle controversi
957340	960200	internazionali che risparmino vittime innocenti.
962920	967680	La ringrazio iscritto parla all'onorevole Paietta, nella facoltà.
967960	975280	Signor Presidente, onorevoli colleghi, certo noi abbiamo discusso questa mattina di argomenti
975280	983560	molto importanti con un'aula affollata, poi avendo parlato un Ministro che io credevo
983560	993840	fosse del Governo e quindi avesse l'attenzione, almeno dalla parte dei colleghi governativi,
994440	1003740	l'aula si è svuotata. Non vorrei e non credo, non voglio dare questo significato a questo
1003740	1013420	vuoto che in Italia si considerasse quello che è avvenuto come un fatto minore di ordinare
1013420	1021700	amministrazione. Ormai siamo abituati ai delitti, siamo abituati alle immunità, alle omerta
1021700	1028280	grandi e piccole, perché uno di più dovrebbe toccarci.
1028880	1035220	Qui noi siamo di fronte non soltanto a un avvenimento tragico, ma siamo di fronte a
1035220	1046280	qualche cosa che è pericoloso e a qualche cosa che mette, più che in forse, un principio
1046280	1056200	che potrebbe ispirare, se non le speranze di pace, almeno alla fiducia che possa alla
1058440	1064020	fine di un'ora, a un'ora che non è mai avuto.
1064920	1076940	Io credo che l'On. Andriotti abbia detto questa mattina queste cose come il rappresentante
1076940	1085520	non della maggioranza, ma come il rappresentante del Governo italiano e che le sue parole non
1085520	1091900	possono trovare, almeno per quello che ci riguarda, che un eco favorevole.
1092200	1099600	Dove va il diritto internazionale? Ma che concezione se ne ha oggi? Ho visto che i giornali
1099600	1109340	italiani portati in generale ai fatti di cronaca, al colore, anche quando è macabro, più che
1109340	1117980	alla riflessione, hanno sottolineato un aspetto che riguarda il diritto internazionale, cioè
1117980	1127160	il fatto che il Presidente Mitterrand ha affrontato subito la questione dei diritti civili e che
1128020	1136280	un rappresentante del Governo francese a qualcuno che interrogava in Parlamento se avrebbe
1136280	1141740	risposto questa questione, diceva, certo, non si ritrarrà dal farlo.
1142680	1148320	Già, ma vi immaginate se Gorbachev dall'altra parte avesse detto, vorrei avere notizie
1149280	1159080	anche di un fotografo portoghese che è stato assassinato dai servizi speciali francesi
1159080	1166260	e nelle acque territoriali di un paese amico. No, proprio davvero, questa questione di alcune
1166260	1174980	regole che dovrebbero essere, se non rispettate, che forse chiedere troppo sempre, ricordate
1174980	1186280	sempre per poter essere fatte rispettare quando si travalica ogni limite, non soltanto, diciamo,
1187460	1196240	della decenza politica, ma dell'umanità, ma quando si rischia qualche cosa come la
1196240	1203420	pace nel nostro Paese. Oggi non è assicuro neppure la nuova Zelanda. Figurarci, se noi,
1203780	1210180	che siamo a poche centinaia di chilometri dalla Tunisia e a qualche migliaio di chilometri
1210180	1217160	da Israele, potremmo considerare questi avvenimenti come qualche cosa che richiedono soltanto
1218220	1226220	un giudizio di carattere morale, una deplorazione formale e non ci può nessun invece risultato
1226240	1235380	in invece degli interrogativi importanti. Dico che davvero l'impudicizia si sposa ormai
1235380	1243720	con il ritorno alle barbari e vorrei ricordare a quelli che lo avessero dimenticato che non
1243720	1250080	aveva a che fare con l'arnaca, non aveva a che fare con le trattative in corso, il redd,
1250080	1257900	e io trovo persino di cattivo gusto usare questo termine che sa di sportivo per un'aggressione
1257900	1266260	barbara e selvaggia. Comunque gli israeliani avevano mandato delle loro imbarcazioni armate
1266260	1272740	con degli armati che sono sbarcati qualche anno fa a Beirut per chi non se lo ricordasse,
1272740	1280660	sono penetrati nella città, sono andati nelle sedi dove c'erano gli uffici dell'Organizzazione
1280660	1287520	per la Liberazione della Palestina e hanno ucciso barbaramente quelli che hanno trovato.
1287900	1294660	Ora io credo che noi dobbiamo condannare il terrorismo, ma dobbiamo sapere non confondere
1295880	1302360	perché è stato detto, ma forse va ripetuto e anche con più forte e più chiarezza,
1303880	1314940	che il terrorismo di Stato provoca un terrorismo illegale come dovrebbe essere l'unica forma
1314940	1324060	possibile e l'unica forma contro cui intervenire con la legge per reprimerlo. Ora il terrorismo
1324060	1332540	palestinese, che è come quello dell'inglese, quando gli palestinesi combattevano contro
1332540	1339460	l'Inghilterra, non solo non può giustificarsi in nessun modo, ma può essere esasperato
1349540	1362540	e noi dobbiamo temere questo perché dei gesti voluti da uno Stato creano, direi, più naturalmente
1362540	1369760	anche se non giustificano degli esasperati atti di ritorzione. Ecco quindi che il terrorismo
1370700	1370720	che è stato detto non è una cosa che è stata indossata, ma è stata indossata perché
1370720	1377400	noi dobbiamo preoccuparci. E' inaudita la prima reazione di Reagan, sì, sarà stata
1377400	1384100	inaudita, ma noi l'abbiamo ascoltata e devo dire che su questa dichiarazione c'è stata
1384100	1399760	un'impassibilità italiana che mi ha colpito. Ora è certo che l'onorevole Craxi, con il
1399780	1406780	parolo dell'onorevole Andreotti qui, non certo il Parlamento col vuoto della sua indifferenza
1407600	1414200	e con la premura di sbrigare questa faccenda regolamentare, hanno dimostrato che anche
1414200	1424720	in Italia si sente il bisogno di fare qualche cosa. Noi vorremmo dichiarare che siamo stati
1424720	1430660	compliciti sempre contro il terrorismo, ma abbiamo anche cercato di fare in modo che
1430660	1442500	potesse essere davvero visto. Concludo, vorrei che concludessimo facendo qualche cosa. Ecco
1442500	1452880	perché chiedo al governo di dare una conclusione anche pratica, politica alle espressioni
1452880	1460320	che condivido, che sono state quelle dell'onorevole Andreotti. Ecco perché noi ricordiamo che
1460320	1467660	ci pare necessario, e oggi avrebbe un significato particolare, il riconoscimento dell'Organizzazione
1467660	1474920	per la Liberazione della Palestina, accettare far nostra la proposta per una conferenza
1475830	1486410	internazionale ed esprimere prima di tutto non soltanto come da tante parti avviene l'ammarico
1486410	1494410	dolore o trovare quelle possono essere cause che come è stato già detto qui dal Ministro
1494410	1504230	non possono essere giustificate. Noi dobbiamo condannare Israele, un Paese che si è comportato
1504230	1510990	in un modo selvaggio, è un governo che non è degno di far parte delle comunità, delle
1510990	1517550	nazioni, e che dovrebbe essere condannato dall'ONU per quello che è stato compiuto,
1518510	1524210	dovrebbe essere anche considerato da noi come un Paese con il quale noi non possiamo...
1524210	1534210	Onorevole Presidente, la prego, il suo tempo è scaduto. Onorevole Presidente, lei mi
1534230	1542730	obbliga a finire dicendo che proprio lei, il partito di cui fa parte, non dovrebbe interrompere
1542730	1549070	qualcuno quando dice di Israele quello che Israele si mi... No, onorevole, lei ha parlato
1549070	1557270	4 minuti e mezzo più del tempo che il regolamento le concede, quindi non facciamo. Mi auguro
1557270	1563910	ed è possibile che il collega Paietta sia andato con le sue parole oltre il suo pensiero
1563910	1570670	e gli ha dichiarato testualmente che con quest'atto Israele si pone fuori e deve essere
1570670	1576950	posta fuori dal Consorzio delle Nazioni Civili. Qualcun altro ha già provato nella storia
1576950	1583750	il farlo, mi auguro che questo sarà espresso il rammarico per questo equivoco sicuramente
1583750	1592710	dello speaker del gruppo del Partito Comunista. Non è andata oltre il significato del suo
1592710	1599230	pensiero quando lei afferma, signor Ministro, perché venne conferma scritta, che il crimine
1599230	1610930	perpetrato all'Arnaca ripugna ad ogni coscienza civile e che, chiedo scuse, col bombardamento
1610930	1617890	israeliano del quartiere generale dell'Olpe in Tunisia siamo in presenza di uno dei fatti
1617890	1624410	più gravi ed inquietanti verificati negli ultimi tempi della scena mondiale. Non è
1624410	1633390	andato oltre, credo, il suo pensiero, anzi è un pensiero appassionato ed accorato, l'equiparazione
1633390	1640770	che lei fa in questa occasione dei morti del quartier generale militare dell'Olpe e degli
1640770	1647870	80 assassinati ebrei, lei mette 80, 80, 80, pare che siamo arrivati a 80 anche là. Ora
1647890	1653710	o è vero che i morti sono sempre uguali, quelli nazisti e quelli antinazisti, quelli
1653710	1658930	dei criminali e quelli delle vittime dei criminali e questa è una cosa superflua da non ricordare
1658930	1665210	o altrimenti, per usare una parola che lei usa nel suo dire, signor Ministro, a me ripugna
