start	end	text
0	6700	le imprese sono in questo momento la punta di diamante sulla via del mercatonico. Ma
6700	12280	la costruzione dell'Europa andrà a vantaggio anche dei consumatori, perché avranno prodotti
12900	19840	migliori e a prezzi più bassi, e anche dei lavoratori, per i quali cresceranno le opportunità
19840	27440	di lavoro. Come Confindustria, noi abbiamo lavorato per favorire in sede unice la ripresa
27440	34260	del dialogo sociale europeo. E' stato questo il primo tavolo sul quale abbiamo trovato
34260	40900	un'intesa con i sindacati italiani. Sarà nostro impegno di seguire con attenzione
40900	48580	questo dialogo, al quale contiamo di apportare tutto il peso delle nostre convinzioni circa
48580	56900	un'Europa che sia sentita come svolta fondamentale per tutti i cittadini. L'insieme di libertà
57660	64120	che si amplieranno con l'Europa Unita, la libertà di stabilimento delle persone e dell'impresa,
64560	70020	la libertà di collocare risparmio dove è più sicuro e rende di più, la libertà di
70020	76940	circolazione delle merci e dei servizi, tutto concorrerà a rendere piena e completa la
76940	83940	libertà dei sindaci, a dare nuove occasioni economiche e culturali per il miglioramento
83940	87200	della qualità della vita di tutti i cittadini.
87460	93700	Signor Ministro, mi permetta di ringraziarla come padrone di casa per la sua presenza.
94220	101140	È veramente un piacere avere oggi lei qui fra noi, sia per me che per i Presidenti
101140	107240	delle nostre associazioni, ma anche mi permetta anche come experimentare europeo, perché
107240	114080	ho conosciuto da tempo il suo impegno europeistico e ho sentito all'estero, e io ne ho avuto
114080	121420	la prova diretta come parlamentare, del grande prestigio europeo e internazionale che la
121420	127120	sua persona gode. Grazie.
134040	140680	Grazie Presidente Pietalina per la sua relazione, compiudenti. Ora abbiamo un piccolo metodo
140680	157100	di programma, invece della relazione del Dr. Gazzani-Fascara, do la parola al Presidente
157100	164680	Gazzani-Fascara. Io ringrazio per l'invito che ho ricevuto, ringrazio per il saluto che
164680	173420	il Presidente Galgano e il Presidente Pininfarina mi hanno rivolto, mi scuso con Gazzani-Fascara
173420	187040	se ho scavaltato nell'ordine, mi accorgo di essere vecchio perché ero molto amico di
187040	194180	andare troppo contro il galateo. E sono venuto volentieri ed ho ascoltato con molto piacere
194180	203260	quello che è stato detto fino ad ora, perché vi è una constatazione da fare. All'inizio
203260	211280	l'idea della comunità europea lasciò molto scettici la gran parte degli italiani, in
211280	217920	modo particolare il mondo economico non era molto favorevole, vi era una lunga tradizione
217920	228620	di aggiustamento con Roma sulle tariffe doganali, di un certo protezionismo endenico, già aveva
228620	236280	avuto delle piacevoli rotture con alcune innovazioni delle dopo guerra, anche quelle accolte all'inizio
236280	246300	con molta diffidenza. Poi man mano noi assistiamo ad una inversione di posizione. Oggi ritengo
246300	252580	che il mondo economico, abbiamo avuto adesso la riproa da quello che ha detto il Presidente
252580	262280	confederale, il mondo economico è all'avanguardia di questa costruzione europea e qualche volta
263990	274050	occorre dare spinte al mondo politico che non sempre è coerente. Noi da un lato siamo
274050	281950	i primi della classe, abbiamo con Spinelli e con altri fatto le proposte più avanzate,
282390	292530	abbiamo una percentuale di votanti straordinariamente alta, l'81% nelle ultime elezioni europee,
292530	303350	se si piacciono a conto, a parte il 32% dell'Inghilterra, ma gli altri sono aggirati sul 50%, la Germania
303350	309910	un po' di più ha toccato quasi il 60%, comunque sono dati questi ed altri che ci dovrebbero
309910	319530	lasciare molto soddisfatti, però sono aspetti ai quali si contrappongono altri aspetti abbastanza
320930	329790	inquietanti, uno dei quali ad esempio il fatto che l'Italia è la cliente più presente
329790	336370	in seno alla Corte Europea di Giustizia, se noi ci mettiamo in regola quei giudici possono
336370	345150	fare metà anno di vacanza esattamente rispetto ai carichi pendenti attuali e non è che uno
345150	354530	l'altro dato è a mio giudizio che non si è ancora acquisita veramente la coscienza di che cosa
354530	364150	è questa Europa che si sta costruendo davvero, mentre per alcuni settori vi è una informazione
365130	375130	a livello popolare straordinaria, non c'è contadino che non conosca cosa sono i montanti compensativi,
375130	383130	i prezzi di riferimento, tutti quei marchigini della politica agricola comune, non c'è addetto
383130	389450	a tutti i livelli alla siderurgia che non segua che cosa significa questa disciplina comune,
389490	399450	ma se si tolgono alcuni settori direi noi vediamo che ancora non si è acquisita questa coscienza
399450	407570	del cambiamento e di un cambiamento profondo che si sta avverando e che cammina sia che noi
407570	415430	adeguiamo il nostro passo sia che noi eventualmente invece ci contentiamo delle enunciazioni
415430	422490	di carattere generale e quindi poi troveremo gli altri che invece si stanno preparando e come,
422490	430470	ho modo per il mio lavoro di constatarlo e vedo come in maniera diversa gli altri 11
430470	439750	paesi stanno camminando su questa strada di preparazione al 1992 che non è una data
439750	452470	fatidica per cui si può nella notte di San Silvestro del 92 fare tutto quello che non
453470	462110	è un processo che naturalmente continuerà ma guai a ritenere che è una di quelle cose
462110	468470	che si può poi affidare a quella specie di corte dei rinvii che è un po' uno dei punti
469010	478690	di ancoraggio a cui noi spesso facciamo riferimento. Allora ritengo che sia molto importante proprio
479710	488530	affrontare come voi fate voi rappresentanti di un tipo di lavoro che se nel passato era
488530	495790	utile oggi diviene indispensabile. Sottolineo con molto piacere quello che è stato detto
495790	508670	per la impresa media e piccola che veramente rappresenta un po' un cardine, oggi si è
508670	515130	in cima alle filosofie politiche correnti che solcanto le grandi dimensioni consentivano
515130	523450	le economie di scala, allora grande successo di coloro che moltiplicavano le proposte per
523450	527990	fusioni, concentrazione e così via, ora ci sono dei settori dove questo indubbiamente
527990	538650	è necessario. Però se noi vogliamo coerentemente tener conto che oltretutto delle economie che
538650	542830	sono le piccole dimensioni, se vogliamo tener conto che questa deve essere la strada, allora
542830	549650	è necessario da un lato proprio utilizzare queste forme che consentano la creazione,
550810	558430	consentano l'avvio e consentano poi un aggiornamento continuo e quindi la sopravvivenza di questo
558430	565090	tipo di imprese. A me è stato chiesto di dire qualche cosa sulla politica italiana
565090	574330	per l'Europa e io credo che possiamo partire, sarò molto conciso, possiamo partire dalle
574330	581530	ultime tappe, abbiamo avuto questo consiglio di Madrid che aveva un suo significato in
581530	589410	quanto avevamo avuto dai saggi della commissione dell'Or che rappresentavano le banche centrali
589410	596510	dei 12 paesi un documento importante, un documento che merita certamente ulteriori sviluppi ma
596510	603450	che ha dato una traccia essenziale per come devono essere impostati questi problemi della
603450	615430	unione monetaria verso la quale noi dobbiamo avviarsi. Allora Madrid era in gioco se si
615430	625250	potevano prendere degli impegni al riguardo o se invece era una di quelle riunioni provvisorie,
625290	634030	riunioni che magari prendono in considerazione un rapporto, mi ricordo un famoso rapporto
634030	643150	di Tindemans che ebbe dei complimenti straordinari per 3 o 4 consigli europei in fila e poi dopo
643150	649810	è finito assolutamente negli archivi. Allora si doveva constatare se questa era invece
650970	660030	la sorte di questa attività della commissione dell'Or e si è constatato che con diversi
660030	667850	gradi di entusiasmo ma in un certo senso con l'importanza di riconfermare per il primo
667850	676590	di luglio dell'anno venturo questa prima tappa e di far tempo da allora ma senza una
676590	683530	di quelle frasi troppo generiche, infatti la frase del documento della presidenza spagnola
684090	697830	che diceva che poi sarebbe allora indetta la conferenza per intergovernativa, perché sono
697830	704130	fosse adeguatamente preparata, questo quando naturalmente era debole perché significava
704130	710770	di poter lasciare allora uno all'altro di dire non siamo ancora preparati e la conferenza
710770	717030	non poteva essere indetta, invece si è potuto cambiare dicendo che questa conferenza deve
717030	725550	essere indetta dopo il primo di luglio dell'anno venturo con un'adeguata preparazione che
725550	731530	inizierà subito ad opera della presidenza francese in modo che quando noi l'anno venturo
731530	738950	avremo secondo semestre la presidenza italiana potremo indubbiamente non solo indire la conferenza
738950	744670	ma cercare di dare un grosso addio, solo non dimenticare perché qualche volta mi è sembrato
744670	750510	che questo sfuggisse che la conferenza è anche un negoziato, quindi la preparazione
750510	757030	è un conto, ma poi la conferenza è un negoziato, non è che la conferenza è lo spolverino
757030	764430	su quello che in precedenza è stato...
773910	782530	Dato il quantum e il contenuto della preparazione a quello che deve essere lo svolgimento della
782530	789890	conferenza stessa e vorrei dire, qui la presenza dell'ambassiatore inglese mi richiama a questo,
789890	796470	sono anche star attenti a non dare dei giudizi troppo facili sull'uno o sull'altro paese,
796530	806330	perché ogni paese ha delle sue caratteristiche particolari e in modo particolare ha alcune
806330	813090	sue realtà, se noi vediamo la bilanza commerciale dell'Inghilterra nei confronti di tutti gli
813090	818830	altri paesi della comunità è una bilanza disastrosa per l'Inghilterra da punto di vista
818830	825330	della passività, quindi indubbiamente che ci siano preoccupazioni, non è derivante
825330	832390	da un orientamento che sia un orientamento da doversi come tale demonizzare e questo
832390	838690	non toglie che naturalmente dobbiamo insieme cercare un sistema più equilibrato attraverso
838690	847430	quella che con una parola un po' multivalente è stata fissata come filosofia della comunità,
847430	855250	quel concetto della coesione, cioè quel concetto di ridurre nei vari settori quelle che sono
855250	862170	le particolari diseguaglianze, quelle che sono le sfassature maggiori, in alcuni casi
862170	871370	veramente di carattere molto preoccupante. L'altro aspetto che occorre per prepararsi
871370	878090	alla comunità e per vivere nella comunità in un modo serio è quello di migliorare
878090	887330	la coscienza economica dei cittadini. Noi ci gloriamo, andiamo adesso al summit dei paesi
887330	892250	industrializzati, siamo con il linguaggio del campionato di calcio, siamo i quarti,
892270	901350	i quinti, non lo so, di queste storie, però di fatto ancora c'è una forte sensibilità
901370	907350	in preparazione di carattere economico. L'uno più uno fa due nel campo economico e non
907350	914410	sempre è patrimonio comune. Prendiamo un giornale qualunque, i giornali a giorni alterni
914410	921470	negli articoli di fondo ci richiamano ed è sacrosanto al problema molto grave del debito
921470	928790	pubblico, però lo stesso il giornale se va in cronaca e parla per esempio che una municipalizzata
928790	934450	ha bisogno di crescere 50 lire il biglietto perché il suo bilancio è disastroso, per
934450	941670	carità presenta questo come una cattiveria sordida dei pubblici amministratori. Il poveretto
941670	948090	legge i giornali e si orienta e naturalmente forse l'articolo di fondo normalmente lo salta,
948130	953130	specialmente se su questi problemi di carattere generale, però vedere chi lo richiama a dire
953130	959770	quanto sono cattivi coloro che ti vogliono far pagare 50 lire di più, diseduca profondamente.
960110	967150	Io credo che abbiamo bisogno, siamo già in una fase molto migliore di quanto non fossimo
967150	974970	trent'anni fa, ritengo come concezione di una obiettività di certe leggi economiche,
975050	983110	però abbiamo bisogno proprio in vista di questo traguardo, di questa svolta del 1990, nel
983130	991510	1992, 1993 e seguenti, abbiamo bisogno di rafforzare molto in questo e in molti altri
991510	998030	settori se dovessi individuare un settore nel quale veramente la comunità che si amplia
998030	1005030	e si integra non comporta delle necessità di aggiornamento non lo saprei trovare perché
1005030	1010950	noi dovremo abituarci veramente ad operare, a ragionare, a programmare in maniera del
1010950	1022070	tutto diversa. La riunione di Madrid ha allora sotto questo aspetto potuto raggiungere questo
1022070	1028350	risultato che vuole essere fra l'altro la conferma che quello che è stato stabilito
1028350	1035190	nell'atto unico che ha fatto seguito alla conferenza di Lussemburgo è un processo che
1035630	1042630	cammina veramente e cammina allora con una coerenza perché sarebbe veramente impensabile
1043590	1052430	ritenere che le nostre economie si devono omogenizzare, si devono integrare e poi lasciare
1052430	1060330	che la parte monetaria possa essere regolata a sé stante o che l'aspetto politico del
1060330	1066670	Parlamento europeo e di quello che significa una conduzione armonizzata nella comunità
1066670	1075550	possa anche questo essere considerato un fattore non necessariamente collegato al primo dei
1075550	1081750	fattori, questa integrazione di carattere economico. C'è un processo che sarà fatale e quindi
1081750	1089610	io ritengo che si possa avere sotto questo aspetto un certo ottimismo perché sarà questione
1089610	1099370	di piccoli o margini di tempo in più o in meno, ma questo processo caminerà con la
1099370	1113770	globalità delle sue particolari differenziazioni di settore. Noi abbiamo avuto fra l'altro
1114370	1123410	perché rimanesse abbastanza chiaro, c'era stata alla vigilia della nostra riunione un
1123410	1131750	articolo di Roy Jenkins molto interessante per dire che cosa vogliono dire queste monete
1131750	1139530	così come sono oggi non armonizzate. Lui fa l'esempio di un turista inglese che parte
1139530	1148130	con 100 sterline dall'Inghilterra e fa il giro degli altri 11 paesi senza comprare niente,
1148870	1156970	ma facendo semplicemente il cambio della moneta nella situazione a Troyes senza comprare niente,
1156990	1163690	senza spendere niente per acquisire qualche cosa, ritorna dal giro degli altri 11 paesi
1163690	1171930	e le sue 100 sterline sono diventate 29. Questo qualche volta serve qualcosa di immagine
1171930	1179130	per poter, forse più che non dei discorsi politici o dei grandi saggi academici, dimostrare
1179130	1187070	come certe spinte siano fatali, non se ne può certamente prescindere. Come pure è fatale
1187070	1193370	il concetto di Europa sociale, un concetto complesso. I spagnoli avevano preparato un
1193370	1203850	testo che non è stato ritenuto maturo da uno dei dodici paesi, però veramente dobbiamo
1203850	1210750	dire che questo testo rappresenta certo un indirizzo, ma molto generico ancora perché
1211540	1217260	starà attenti il termine sociale, uno di quegli aggettivi, si va dalle laterie a un partito
1217260	1223460	politico, non si scopre mai che cosa vuol dire nella stessa nostra lingua, figurarsi in
1223460	1229740	dodici lingue che cosa questo significa dichiaro, però l'indirizzo che cosa deve essere? E
1229740	1236840	deve essere che indubbiamente quello che ho detto prima della coesione, come la coesione
1236840	1244320	dovevo operare nell'ambito comparativo dei dodici paesi, così anche all'interno indubbiamente
1244320	1252240	si deve essere nelle popolazioni un qualche cosa che spinge verso una maggiore, quella
1252240	1259820	che una volta chiamavamo giustizia sociale, che si crea naturalmente, questo è forse
1259820	1265440	il segreto anche di un'acquisizione che lo stesso mondo politico, lo enunzio o no,
1265440	1273700	ha fatto, cioè si crea non con un binario parallelo separato da quella che è la costruzione
1273700	1280600	economica, ma è in funzione della validità di una costruzione economica che deve essere
1281420	1289860	compiuta. Il concetto se questa socialità interna migliore nell'ambito dei dodici paesi
1289860	1297420	deve essere affidata anche alla comunità o soltanto ai singoli paesi, è un concetto
1297420	1302300	che può essere anche ozioso, è chiaro che ognuno dei paesi deve fare tutta una parte
1302300	1308660	del suo lavoro e non a caso anche la stessa struttura degli interventi comunitari, il
1308660	1316200	fondo regionale, il fondo sociale, i progetti integrati mediterranei, gli interventi del
1316200	1321080	Banco Europeo di Investimenti, lo Sportello Speciale e così via, presuppongono quasi
1321080	1327000	sempre una compartecipazione di fondi nazionali, quindi anche da questo lato si è voluto dare
1327000	1334560	un messaggio implicito che non è un dono che si può ottenere dagli altri, ma è una
1334560	1341040	partecipazione articolata e differenziata nella quantità rispetto alle proprie possibilità,
1341040	1348240	ma le proprie possibilità devono essere messe in campo tutte in maniera molto impegnata
1348240	1355380	e forse in maniera superiore di quello che non si sia fatto fino ad oggi. Certamente
1355380	1366440	questo poi a mio avviso comporta un aspetto che forse può sebbene articolato superare
1366440	1371240	anche le difficoltà che abbiamo avuto per avere l'unanimità, cioè quando si parla
1371240	1378180	di socialità può essere inteso soltanto come una specie di banca dei diritti in cui
1378180	1385020	si possono andare a riscuotere dei diritti senza versare dei doveri, è un po' un concetto
1385020	1391600	che qualche volta abbiamo avuto anche dell'interno, cioè come se fossero delle cose che potessero
1391600	1398480	essere viste disgiuntamente e io credo invece che la socialità ci deve comportare ed è
1398480	1405000	uno dei settori di cui dobbiamo cambiare il registro veramente in un modo radicale, intanto
1405000	1409780	sarebbe ridicolo pensare che noi siamo l'unico paese sociale e che gli altri non lo sono,
1410520	1415960	quindi non è che possiamo dire tutto quello che noi abbiamo va mantenuto perché altrimenti
1415960	1422300	è un ritorno indietro, no, se veramente questa comunità, ed è così, ci dà un respiro
1422300	1428400	molto maggiore, quindi il conto globale è sicuramente un conto positivo ed è un conto
1428400	1434640	positivo che aiuterà in un modo cospicuo chi non ha avuto modo in un ambito più ristretto
1434640	1439720	qual era l'ambito meramente nazionale o l'ambito parzialmente comunitario come abbiamo avuto
1439840	1448500	fino ad oggi, non si può allora non tener conto che bisogna pagare dei prezzi, faccio
1448500	1455080	un esempio, qui si è detto ed è giusto, noi abbiamo molti deficit ancora, non parlo solo
1455080	1465440	di quello di bilancio del debito pubblico, lì vede perché purtroppo io più invecchio
1465440	1472800	più mi affeziono alle cose precedenti, se noi avessimo rispettato la Costituzione della
1472800	1479000	Repubblica che ha un articolo, articolo 81 che dice che non si può fare una spesa se
1479000	1485320	non c'è una copertura adeguata e la copertura o con una nuova entrata o cancellando una
1485320	1491080	spesa equipollente, è una cosa di aritmetica da scuole serali, non occorrivano molte però
1491080	1497460	invece abbiamo avuto gli esperti, questo concetto un po' strano che qualche volta c'è,
1497620	1506960	noi attribuiamo spesso questa bellissima espressione a coloro che non sempre poi lo so, hanno cominciato
1506960	1512080	a dire ma per le spesse di investimento questo non vale perché sono produttrici di ricchezza
1512080	1520940	loro il volano, da questo volano di vanoniana memoria che però era enunciato direi seriamente
1520940	1528020	in queste limitazioni, poi invece ci si è spostati, si finisce finanziare con il debito
1528020	1534100	la spesa corrente, allora arrivando naturalmente ad un qualche cosa che poi nella bizzarria
1534100	1539380	dei conti economici porta anche dei vantaggi, noi oggi se guardiamo a certi aspetti valutari
1539380	1543900	sembriamo un Paese molto ricche, lo siamo, di valuta perché? Perché sicuramente diamo
1543900	1549020	dei tassi piuttosto alti, allora abbiamo una chiamata di valuta ma quella non è un arricchimento,
1549020	1554640	a mio avviso un impoverimento della nostra, però quando dobbiamo fare i bollettini della
1554640	1561240	vittoria perché in alcuni momenti sono necessari noi ci riempiamo di queste soddisfazioni efimere.
1562800	1570260	Io ritengo che su alcune cose, anzi su molte anche in questo campo dei doveri, noi dobbiamo
1570260	1577780	fare dei salti di qualità notevoli, per esempio il fatto che alcuni servizi pubblici, non
1577780	1584440	parlo solo dell'apparecchiatura tecnica, delle strutture che pure sono cose importanti
1584440	1591620	che ci devono spingere a farle le scadenze a cui ci stiamo riferendo, ma parlo ad esempio
1591620	1597180	proprio della funzionalità di alcuni servizi essenziali, io credo che quello che riguarda
1597180	1603440	alcuni trasporti essenziali, l'acqua e la luce, quello che riguarda gli ospedali, noi
1603440	1611060	non possiamo consentirsi di avere delle sospensioni di lavoro, sia pure per un fine nobile, qual
1611060	1616100	è quello della tutela di chi ci lavora, bisogna trovare delle forme di tutela di chi lavora
1616100	1621220	in alcuni servizi pubblici essenziali che siano diverse, come del resto altri paesi
1621220	1627560	li hanno e ripeto sarebbe veramente assurdo ritenere che noi siamo gli unici sociali perché
1628360	1629180	consentiamo questo.
1629180	1634320	Se poi apriamo veramente le frontiere, si può arrivare, però uno arriva ma è tutto
1634320	1642000	fermo e non può progredire, perché accenno questo, è un discorso delicato, va più applicato
1642000	1646760	che teorizzato, perché sennò creiamo delle difficoltà forse non necessarie, però è
1646760	1653060	un discorso di coerenza, allora noi diciamo l'Europa dei cittadini che certamente comporta
1653060	1658440	tutta una serie di problemi, le modifiche del nostro sistema scolastico, perché dobbiamo
1658440	1663080	adeguarci la preparazione professionale, dobbiamo adeguarla ad un ambito che è un
1663080	1670180	ambito molto più ampio e articolato e diversificato dell'ambito attuale, quindi abbiamo tutta
1670180	1677000	una serie di iniziative, io sto cercando di prenderla perché non ci sono riuscito quando
1677000	1683000	ero ministro della difesa, lo dico per incerti, ma ci devo riuscire, fare in modo che si studiano
1683000	1688560	le lingue durante il servizio militare, fra l'altro dando un contenuto molto piacevole
1688560	1694920	e utile per i ragazzi, che non è male al mio giudizio, tante di queste cose, ma allora
1694920	1700800	deve essere un pacchetto d'insieme nel quale noi ci dobbiamo abituare a guardare rinunce
1700800	1706600	e a guardare acquisizione, io credo che questo, che naturalmente è un problema che riguarda
1706600	1713220	tutti, ma riguarda noi in un modo particolare, perché? Perché da noi c'è qualche volta
1713220	1721940	questo senso di dire, ma tutto sommato poi, questa nazione è cresciuta, le cose poi non
1721940	1727640	vanno male per molti indici, qualche volta vediamo addirittura forse esagerati anche
1727640	1732560	qui un tipo di bollettini della vittoria, qualche impresa specie bancaria se le potrebbe
1732560	1738820	risparmiare, perché vedendo le pagine intere di dire, ma siamo nel paradiso del resto,
1739080	1743960	allora poi quei poverazzi devono andare a discutere i contratti di lavoro, poi si trovano
1743960	1751520	piuttosto male, perché viene la psicosi dei cattivi, allora che non vogliono invece far
1751520	1758880	partecipare a questa distribuzione di miele non avvelenate, tutta la collettività, quindi
1758880	1766040	anche qui rientra forse in un tipo di educazione economica che non è male a tutti i livelli,
1766080	1772120	forse si abbia un poco di più io credo, perché altrimenti disorientiamo molto la gente, chi
1772120	1778060	deve impostare una politica piuttosto seria sembra una specie così, di anacoreta pazzo
1778060	1783200	che vogliono imporre, ora qualche volta c'è questo senso di pigrice per dire, ma forse
1783300	1789720	meglio lasciare che le cose in questa specie di babbele istituzionalizzata vada avanti
1789720	1795900	così, perché se ci si mette le mani magari noi possiamo rovinare, e questo non è più,
1796380	1801140	nel foro interno può darsi pure che fosse così, perché poi non sempre le riforme sono
1801140	1807280	in meglio, nel diritto penale c'è la reformazione in peius, ma anche nelle altre riforme si
1807280	1813600	può fare qualche cosa in peius, però noi riteniamo che oggi questo discorso veramente
1813600	1820460	non vale più, perché la competitività che si deve avere con tutti gli altri, cercando
1820460	1827400	poi di analizzare bene, perché poi non è detto poi che gli altri siano tutti dei santi
1827400	1831700	e che noi siamo dei diavoli, questo non è vero, lo sappiamo tutti, infatti, guardare
1831700	1837460	anche bene come alcune cose possano avvenire, perché ci possono essere anche, ci sono delle
1837460	1843700	forme un po' surrettizie di sostegno, che naturalmente essendo surrettizie non vanno
