start	end	text
1843700	1849540	a finire in inazio a nessuna corte di giustizia, che però ci sono e che spiegano, ma so, quando
1849540	1856040	io vedo l'occasione recentemente di guardare un minuto, la vita dei cantieri, insomma,
1856140	1860740	ci sono alcuni paesi europei che spuntano dei prezzi che non mi convincono per la verità,
1860740	1866960	tenendo conto di quelli che sono le loro retribuzioni, quelli che sono i loro costi, anche dei costi
1866960	1876560	del danaro, però dobbiamo abituarci a questo tipo diverso di trasparenza, questo tipo diverso
1876560	1883480	di impostazione globale e anche il problema dell'ambiente, un problema che esiste, adesso
1883480	1892000	non è solo perché si politicizzano queste idee che noi ce ne dobbiamo occupare, è un
1892000	1899360	problema che esiste indubbiamente, tanto più un paese aumenta la propria attività produttiva,
1899640	1905740	tanto più migliora la propria qualità di vita e tanto più questa sensibilità cresce, allora
1905740	1915900	dobbiamo cercare naturalmente di impostarlo, di impostarlo bene tempestivamente, di non caricare
1915900	1925620	tutto sulle spalle dello Stato, come è capitato l'estate scorsa quando i maledetti residui nocivi
1926260	1932940	erano finiti in un paese africano, in parte anche nel Libro, dove mancava anche questo per creare
1932940	1940720	una confusione ancora più completa, però siccome era estate, tutti parlano della deregulation,
1940800	1947660	ma tutti chiedevano allo Stato di intervenire direttamente, di doversi fare, anche qui è una
1947660	1953780	sensibilità che c'è, tant'è vero che direi per la prima volta nel Consiglio Atlantico dove,
1955880	1961640	ricoperando un fatto importante, quell'articolo 2 che parla della collaborazione anche in altri
1962300	1967880	campi della sicurezza militare, sia anche qui portato avanti questo discorso che è un discorso
1969380	1977260	divenuto di grande attualità, forse anche con un po' di egoismo da parte, chiamiamo di noi, occidentali,
1977340	1984960	perché egoismo? Perché quando adesso si comincia ad avere l'acquisizione, che non sono delle fantasie,
1984960	1992140	ne sono delle previsioni così opinabili come erano i club di Roma su cui si discuteva, ma quando
1992140	1998640	adesso si dimostra che quello che accade nell'Amazonia ha una ripercussione per tutta,
1998880	2004780	allora noi ce ne diamo carico e forse qualche volta, come capita sempre quando si affronta dei
2004780	2012320	problemi in modo emotivo e affrettato, anche creando non soluzioni adeguate e forse suscitando
2012320	2021520	alcuni problemi, ma sappiamo allora che anche questo è uno dei punti, ne abbiamo parlato a Madrid,
2021760	2028680	ne parleremo ancora la settimana prossima a Parigi al summit dei Paesi industrializzati, questo del
2028680	2037020	ambiente nel senso più ampio di questa espressione che deve essere uno dei motivi centrali nei quali
2037020	2046220	credo si deve cercare di impostare una politica comune. Voglio fare un'ultima osservazione che
2046220	2057060	riguarda appunto questa Europa politica, oggi noi abbiamo del Parlamento Europeo, oggi abbiamo un
2057060	2063140	Parlamento Europeo che è un organismo consultivo in un certo senso, ha alcuni poteri ma sostanzialmente
2063140	2071500	è un organismo consultivo. Dico subito consultivo ma è importante perché per esempio in questi anni
2071500	2079160	questo quinquennio, fortunatamente il Parlamento Europeo ha dei tempi di durata fissi, non dei
2079160	2084500	tempi mobili come i nostri dove qualche volta cinque anni diventano quattro, altre volte tre,
2084800	2090360	qualche volta qualcuno può avere la tentazione anche di accorciarli ulteriormente, ma in questi
2090360	2099060	cinque anni sarà importantissimo il lavoro di pareri perché è chiaro che poi teoricamente sia
2099060	2105060	il Consiglio dei Ministri, sia pure in questo caso per alcuni aspetti all'unanimità e quindi con una
2105060	2112440	certa salvaguardia, ma la Commissione nel dare i suoi pareri e fare le sue proposte hanno anche
2112440	2118920	dei margini di autonomia, però sarà molto importante indubbiamente quello che sarà l'apporto
2118920	2127720	esperto e responsabile nella discussione su questi temi che sono temi anche molto difficili perché
2128460	2138160	adesso noi ci confortiamo diciamo dei 300 atti, 300 risoluzioni che dovevano essere prese secondo
2138160	2147120	lo schema di Delor per attuare l'atto unico, la metà circa sono state fatte. Io non mi commuovo
2147120	2153560	con queste statistiche perché avere la direttiva sui cuscinetti a sfere e non avere quella
2153560	2160160	dell'armonizzazione fiscale, beh, una vale l'altra statisticamente, però indubbiamente le cose più
2160160	2167140	importanti e noi le abbiamo ancora sul tavolino e quindi sono anni di enormi impegno, è giusto
2167140	2176360	rafforzare anche la nostra presenza anche tecnica nel centro dell'attività comunitaria, però noi
2176360	2186240	dobbiamo anche qui in prospettiva vedere un aumento dei poteri del Parlamento europeo perché
2186820	2193880	l'ho accendato all'inizio non è concepibile allora arrivare ad una politica economica,
2194060	2200400	ad una politica monetaria, ad una politica sociale armonizzate senza invece poi avere
2200460	2207420	una centralità di decisione in un organismo rappresentativo e lazzare che i dodici paesi
2207420	2213500	possano nei singoli parlamenti fare tutto quello che vogliono. D'altra parte questo non è poi
2214380	2222600	un innovare molto sotto alcuni aspetti perché già adesso una parte di queste attribuzioni non
2222600	2228160	sono più proprie dei parlamenti nazionali, solo che sono proprie della Commissione che fa le
2228160	2234040	proposte del Consiglio dei Ministri che a sua volta è esecutivo e legislatore in seno alla
2234040	2243180	comunità, quindi si tratta di trasferirle nell'organo rappresentativo dando un'importanza che
2243180	2254400	finora non ha avuto perché io credo che se si domanda a quanti degli 81 italiani sul 100
2254400	2259680	elettori che hanno il diritto a votare che hanno votato, ditemi bene cosa fa il Parlamento
2259680	2268140	Europeo, non so quanti veramente lo sappiano né l'informazione politica quotidiana spicciola
2268140	2273600	viene in soccorso di questo e un po' adesso mi auguro che nella nuova edizione sia diverso
2273600	2279640	un po' quello che è capitato per il Consiglio delle Economie del Lavoro, in fondo un organismo
2280400	2287740	previsto dalla nostra Costituzione ed è bello in un momento nei quali questi problemi sembravano
2287740	2292420	abbastanza lontani per aver visto invece che un organismo che dev'essere di vera consulenza
2292420	2301220	del legislatore e del governo dando attraverso un dibattito misto tra imprenditori, lavoratori,
2301980	2308640	esperti, rappresentanti delle categorie, questo organismo è esistito e ha fatto anche alcuni
2308640	2313660	documenti molto belli, molto ben fatti, io credo di essere uno dei pochi oltre i correttori
2313660	2320520	di Bozze che leggono queste cose e poi se voi cercate un giornale che parli di quando
2320520	2327220	si riunì, se era aperto, se era chiuso, non è esistito proprio questa cosa, per fortuna
2327220	2334040	loro hanno questa bella seda vilaborgese, quindi era il conforto di un ambiente esterno
2334040	2342620	molto significativo, però adesso dobbiamo anche qui recuperare nel quadro della coscienza
2342620	2349440	comunitare, recuperare questa necessità in parte di trasferimento, in parte di armonizzazione
2350160	2358920	della nostra attività interna con l'attività parlamentare di carattere comunitario, abbiamo
2358920	2364600	fatto dei passi amanti notevoli, per fortuna un uomo di grande prestigio come è stato
2365160	2371200	Antonio La Pergola che venendo da, a parte la sua esperienza di professore a livello
2371200	2377680	internazionale, ma avendo la grande autorevolezza di essere stato presidente della Corte, poteva
2377680	2383120	anche fare delle cose e proporre delle cose che altrimenti rimanevano lì in un ambito
2383230	2392390	difficile, siamo abbastanza attrezzati adesso per recepire in tempi giusti le direttive comunitarie,
2393590	2402970	però credo su questo camminare molto di più e camminare senza che si perda del tempo ulteriore,
2403090	2410630	io ritengo anche che forse una riforma di cui non si parla mai ma che reputo utile sarebbe
2410630	2417610	anche la di creare un organismo di collegamento proprio istituzionale tra Parlamento nazionale
2417610	2424370	e il Parlamento comunitario, cosa che fino a questo momento non vi è stato e alcuni
2424370	2433770	non ne hanno nemmeno ritenuto che fosse necessario, allora morale della favola, certo dobbiamo
2433770	2440770	cercare di ritenere che questo dell'Europa è per noi il quadro di carattere generale
2441750	2450310	nel quale dobbiamo camminare, al quale dobbiamo coordinare e condizionare ogni altro tipo
2450310	2457210	di scelta, ogni altro tipo di decisione in modo particolare in questi anni e dobbiamo
2457950	2466550	mantenere sempre il discorso globale, possiamo cercare di farlo acquisendo il consenso di
2466550	2473310	tutte le forze che altrimenti se non ne vedono questo disegno unico potrebbero essere colpiti
2474290	2482150	da posizioni in cui devono essere fatte delle rinunce e non essere disponibili quindi ad
2482970	2487950	progettarle, si è detto e l'ho concluso, qualche volta si è detto come un'immagine
2487950	2495270	che noi viviamo un periodo analoga a quello nel quale dai vari Ducati in cui era divista
2495270	2500890	l'Italia abbiamo dovuto creare una realtà nazionale e io credo che questo sia vero ma
2500890	2508090	dobbiamo fare qualche cosa di più, dobbiamo cercare questa occasione, questa stagione,
2508090	2515750	che non è una stagione brevissima ma una stagione che non accetta dei ritardi o delle
2515750	2521610	pigrizie e per far qualcosa di più è di meglio perché l'Italia ancora non è poi
2521610	2527250	molto unificata, questo lo sappiamo tutti, non lo sarà mai perché non è che possiamo
2527250	2534910	pretendere di avere una formella che valga per tutti, questa è una grossa illusione
2534910	2541210	ma ci sono ancora tutta una serie di disparità, alcune volte per ragioni storiche, altre
2541210	2548630	volte per ragioni di una certa pigrizia e allora l'obiettivo che credo possa essere
2549450	2557690	suggestivo ed è un obiettivo anche abbastanza visibile è quello di poter far sviluppare
2557690	2563170	una convinzione che quando si parla di avvio agli Stati Uniti d'Europa non si dice una
2563170	2572490	cosa utopistica o una cosa che non abbia il senso del possibile concretizzazione, io
2572490	2583630	qualche volta dovendo fare una opera di convinzione a questo riguardo presento il quadro del
2583630	2593150	continente americano, io credo che con tutto il rispetto della fraternità latina di altre
2593150	2597610	regioni non possiamo uspicere di diventare come un paese dell'America latina, questo
2597610	2603490	credo che non ce lo sogneremo, mentre io credo che uno può essere più occidentale o meno
2603490	2609810	occidentale, poi mi pare che l'andamento sia che lo diventino quasi tutti, di vedere quelli
2609810	2616210	che sono gli Stati Uniti d'America certo sono un obiettivo, non è che non ci siano per
2616210	2621450	carità dei difetti o non ci siano delle cose che non vanno, però se noi guardiamo i punti
2621450	2628650	di partenza e guardiamo le risorse in fondo che c'erano, le risorse del sud sono delle
2628650	2633770	risorse potenziali maggiori di quelle che erano le risorse del nord e i punti di partenza
2633770	2639650	dei vari Stati che poi sono diventati uniti erano dei punti più divisi di quello che
2639650	2645150	oggi sono i nostri punti di partenza, anche quello che hanno dovuto fare tra guerre di
2645150	2649190	indipendenza, guerre civili o meno hanno dovuto fare delle cose terribili, noi ci dobbiamo
2649190	2656670	riguardare certamente con sistemi molto diversi. Allora a me pare che però c'è questa grande
2656670	2661910	possibilità di aprire in modo particolare a quelli che sono giovani, quindi potranno
2661910	2670610	vedere lo sviluppo di tutta questa realtà che cambia, che ha avuto una premessa nel rasserrenamento
2670610	2679170	di carattere politico generale dell'Europa a molti sfuggicchi, quando nel 1977, quando
2679190	2687610	nel 1975 a Helsinki si fece l'accordo per la cooperazione e la sicurezza, a molti sfuggicchi
2687610	2693750	dicendo ma che cosa significa questo e poi si diceva come a Brest va lì e firma un qualche
2693750	2700010	cosa che riguarda i diritti umani, che riguarda la cooperazione economica e riguarda la fiducia
