start	end	text
14980	19300	Lui mi pare che già è venuto altre volte, quindi ha letto la formula, sempre sotto il
19300	24040	bincolo della formula, si può accomodare, ci fornisce le sue generalità complete ai
25680	39840	traschizioni. Quali sono le sue manzioni? Brigatieri dei Carabinieri.
41420	49620	Prego, a difesa, puoi eserciare la sala. Brigadier Tormina, lei ha fatto attività
49620	53840	di indagine delegata dalla Procura della Repubblica a seguito delle dichiarazioni di
53840	59280	maggio Valdas? Sì. E segnatamente si può dire...
