start	end	text
7820	13340	L'attuale Presidente della Repubblica, Francesco Cossiga, nel discorso di Capodanno già aveva
13340	19240	sollecitato in tema di giustizia un'opera complessa, articolata e realistica di modernizzazione
19240	25220	degli strumenti legislativi e amministrativi previsti dalla nostra Costituzione. Da tempo
25220	31380	nel nostro Paese si dibatte il tema delle grandi riforme tra le quali la giustizia
31380	39060	riveste una particolare urgenza. Sempre nel messaggio di Capodanno Cossiga indicava come
39060	43060	strada da percorrere rapidamente quella dell'ambordernamento del servizio della
43060	48140	giustizia e, anzitutto, la piena e puntuale attuazione della delega legislativa per il
48140	53540	nuovo codice di procedura penale. Questa attuazione c'è stata, abbiamo in questo momento
53540	58880	al microfono un illustre interlocutore, si tratta del Senatore Giovanni Leone, già Presidente
58880	65380	della Repubblica. Buongiorno Presidente. Ecco il Senatore Leone, il Presidente Leone è un
65380	70600	giurista di Chiarafama, autore di un testo di procedura penale in uso nelle Università
70600	76580	italiane. Presidente Leone, con il nuovo codice di procedura penale, sappiamo che ormai è cosa
76580	81040	fatta, tra un anno entreranno in vigore i decreti approvati dal Consiglio dei Ministri, dicevo
81040	87280	con il nuovo codice di procedura penale, secondo lei, si potrà rimediare ai mali che da tempo affliggono la giustizia penale?
87640	107700	Secondo me, assolutamente no, io sono stato contrario alla legge delega per questo nuovo codice di procedura penale e ritengo che sia un codice completamente sbagliato e, soprattutto, non serve agli intenti per i quali sembra che sia stato emanato.
107700	126480	Questo codice avrebbe dovuto rendere più breve i procedimenti, accelerare il corso della giustizia, che è scandaloso attualmente, e mettere in una situazione anche di maggiore tuffera processuale di imbufato.
126480	146840	Ambedue le cose non accadranno, non accadranno prima, perché il codice è così complesso e complicato, soprattutto dal punto di vista del dibattimento, perché ogni processo durerà molto di più di quello che dura adesso,
146840	163260	perché il processo, in sostanza, si celebra in dibattimento, dove a luogo quello che si dice all'inglese la cross-examination, cioè l'interrogatorio ingrossiato, cioè il processo da Perry Mason,
163260	173460	in questo dibattimento le parti si presentano di rei nude, ciascuno senza alcun pregiudizio preliminare.
174560	184640	Il pubblico ministero tutte le prove che ha raccolte durante la fase preliminare non le può mettere in evidenza,
184640	197880	può soltanto indicare, naturalmente, tali prove e portare le prove in dibattimento, lo stesso accade per le parti private.
199060	213960	Poi, naturalmente, comincia l'interrogatorio ingrossiato tra le parti, ora questo è un punto molto delicato sul quale io ho più volte combattuto e non ho avuto mai una risposta.
214640	220840	Io, fin da molti anni fa, questo processo non è mai il processo dei ricchi,
222000	234780	perché nell'interrogatorio ingrossiato si mettono in evidenza le personalità del riputato, del pubblico ministero, del testimone e dell'avvocata che sia.
234780	250340	I due contendenti che devono in certo momento scontrarsi devono avere una preparazione ed è soprattutto una capacità professionale ed una grande esperienza,
250620	263980	altrimenti possiamo trovarci il che accadrà spesso, che un imputato viene a dibattimento fornito da un grande avvocato, dall'assistenza di un grande avvocato,
264780	277040	e l'altra parte, sempre la parte civile, naturalmente assistita da un modestissimo e inesperto avvocato o un pubblico ministero giovane e poco esperto.
277240	282980	E viceversa, possiamo avere una parte civile agguerrita, questa sarà molto più frequente,
283220	300420	perché potranno svolgersi ad avvocati di grande prestigio e cometale costosi e l'imputato con un piccolo avvocadicchio di paese non avendo la possibilità di pagare e di assumere avvocati di grande prestigio.
300880	313900	Tutto questo porta naturalmente uno squilibrio del dibattimento, non solo porta uno squilibrio, porta una grande perdita di tempo,
313900	326220	più che perdita, diciamo, grande destinazione come tempo, perché il dibattimento, come ho detto, si fa tutto.
326420	338560	Il Presidente quando esce per cominciare la causa, non conosce niente dalla causa, sa soltanto il nome delle parti e la imputazione,
338560	352380	e lui stesso deve seguire e solo non può fare domande, il che è veramente grave, solo alla fine dello scontro della cross examination può porre qualche tema.
353160	360020	Cioè, colui che deve decidere, resta estraneo in gran parte all'assunzione delle prove.
360020	373360	Che cosa accade? Che tutto quello che accade in dibattimento, siccome è accaduto oralmente e non ci sono precedenti scritti che si possono allegare,
373920	382540	il cancelliere deve verbalizzare tutto quello che accade col sistema dell'stenografia.
382540	390020	La legge aggiunge che se il cancelliere non è stenografo lo può assumere anche al di fuori,
390080	398760	la immagine questa specie di ricerca per il mercato di uno stenografo che serva a dare assistenza al cancelliere,
399060	404880	ma soprattutto si dimentica quello che costa assumere uno stenografo.
404880	412360	Oggi uno stenografo, per lo meno per quello che risulta a me, per un'ora costa non meno di 200 mila lire.
415080	418080	Se allungo il dibattimento soprattutto per la verbalizzazione,
419820	426080	perché anche quando è stato dal cancelliere o dal suo assistente a sostituto,
426160	435360	è stato formato lo stenogramma, bisogna poi tradurlo naturalmente in documento leggibile,
436300	441800	il Presidente lo deve approvare, dopodiché il Tribunale può decidere.
442120	447540	E si crea anche un distacco tra la fine del dibattimento e la decisione,
447540	457300	che è veramente grave perché è nostra tradizione sapere che subito dopo la fine dell'assunzione delle prove,
457700	462820	subito dopo il dibattimento, il Tribunale, la Corte che sia, il Predore,
463080	468820	si ritira in camera di consiglio immediatamente per procedere alla decisione.
468900	475020	Qui invece il Presidente o il Predore che sia deve aspettare tutti quei giorni
475020	481220	il cancelliere di cui il cancelliere ha bisogno o il suo sostituto per tradurre lo stenogramma
482040	485600	e poterlo approvare dopodiché può riunire il collegio.
487820	490220	Presidente, Presidente, ecco, mi scusi se lo interrompo,
491140	494080	lei ha fatto una sorta, sta facendo, ecco, anche per i nostri ascoltatori,
494200	496560	per la chiarezza di quello che noi stiamo dicendo,
496580	498980	lei è veramente un tecnico in questa materia.
499300	502520	Ecco, un po' la comparazione tra il sistema anglosassone,
502520	505720	quindi quello tendenzialmente accusatorio, e il nostro inquisitorio.
506780	508940	Quindi, praticamente, con questo nuovo codice,
509080	513120	il nostro legislatore sembrerebbe confermare una vocazione per i sistemi misti,
513140	517800	cioè sopravvive ancora la natura inquisitoria propria del processo,
518720	521340	diciamo, non anglosassone, del processo italiano.
522940	525800	Non ho capito bene perché non ho sentito bene.
526160	528960	Ecco, dico, con il nuovo codice, Presidente,
528960	534160	sopravvive quindi, sopravvivono i connotati inquisitori del processo?
535280	539520	No, sopravvivono pochi, pochi spunti inquisitori,
539760	541300	direi quasi nessuno,
541700	545160	perché inquisitori oggi era soltanto l'istruzione
545980	550160	la quale, però, attraverso una serie di modifiche del codice rocco,
551340	554540	cosiddette novelle, si chiama la novelle,
554680	557880	delle piccole leggi, modifiche aprici dei codici,
558960	564160	con queste modifiche la parte inquisitoria era in gran parte scombarsa,
565480	568160	rimbutato le parti, rimbutato il difensore,
569340	575240	partecipavano molto all'assunzione delle prove durante la istruttoria,
575320	579340	quindi di parte inquisitoria era rimasta ben poco.
580700	582980	Ho capito. Presidente, ecco, chiedo scusa,
583460	586600	ma, ad esempio, diciamo,
586600	590800	la parte più importante per quello appunto che mi risulta
591380	594880	di un procedimento di carattere accusatorio
594880	599840	è costituita dall'immediatezza praticamente del giudizio
599840	601780	e dall'assenza dell'istruttoria.
601900	605100	Ecco, nel nuovo codice questo principio accusatorio
605100	607620	non è contraddetto dal fatto
607620	610120	che c'è un'indagine, ad esempio, del pubblico ministero
610120	612360	che può dilungarsi per due anni.
612360	616620	Senza dubbio, qui il carattere accusatorio
616620	618560	è più nominale che effettivo,
619640	622140	è più un... per l'epatete de bourgeois
622140	626000	è più una bandiera che si porta avanti
626560	628800	che è effettiva, accusatorio,
629180	633040	perché se la parte delle indagini preliminari
633560	638480	breve che possa essere, naturalmente, chiederà del tempo,
639320	641260	senza dire che il codice
641260	645360	non si occupa affatto dei maxi processi,
645520	646680	dei processi con la connessione,
647600	648680	non se ne occupa.
649320	650440	Quindi, per esempio,
650940	654200	se si dovesse domani celebrare un processo sul tipo
654200	655560	di quelli che sono in corso,
657700	660160	naturalmente il codice non si presta,
660260	662580	non sono le norme.
662960	666040	Presidente Leone, ecco un'altra cosa.
666040	676240	Scusi, si diletta a sezionarsi in tanti procedimenti
676920	679280	che sono cinque, c'è un procedimento,
679280	683420	un giudizio abbreviato, c'è un giudizio immediato,
683720	686180	c'è il procedimento per decreto
686180	688540	e c'è il giudizio direttissimo.
688820	692620	Tra questi vi è quello della battuizione,
692620	696760	la parte può con il giudice mettersi in accordo,
697000	699820	io riconosco la responsabilità,
700000	701560	mettiamoci in accordo sulla pena.
701720	704660	Questa è una cosa assurda in materia penale.
704900	706820	In materia penale non c'è possibilità
707480	710300	di accordo tra l'imputato e il giudice
710300	713180	sull'esistenza della responsabilità e sulla pena.
714720	715520	Presidente Leone, ecco,
715540	717800	lei parlava appunto di rapporto dialettico
717800	721260	tra imputato e giudice.
721260	723460	Ecco, un altro principio basilare
724080	725580	del sistema accusatorio
726460	729300	è quello dell'equidistanza del giudice,
729480	730940	sia dall'accusa che dalla difesa.
731020	733160	Ecco, lei ritiene che nel nuovo processo
733160	735120	questo principio venga osservato?
735800	736880	Non lo penso,
738460	740460	perché il giudice del dibattimento
741180	743860	non conosce niente della causa
743860	745460	fino all'inizio del dibattimento,
746380	747280	questa porta,
748360	749500	quella che lei diceva,
749500	750700	la sua impartialità.
752260	752700	Però, naturalmente,
753800	754520	è un errore,
754800	758200	perché il giudice deve cominciare la causa
758200	760700	e uscire, naturalmente, il dibattimento,
761520	763140	avendo letto qualcosa
763140	764840	di quello che è stato assortato,
765480	768700	non per farsi un'opinione già determinata,
769500	770700	ma per poter orientare,
771360	772080	è vero,
772800	775740	la sua indagine e, soprattutto,
776320	777180	la sua ricerca.
778880	779900	Presidente Reone,
780200	783440	ecco, io vorrei chiederle ancora una cosa,
785420	786500	anche con questo nuovo codice,
787040	788620	diciamo, nel nostro sistema giuridico
788620	789580	pubblico-ministero
789580	791380	le giudici appartengono allo stesso ordine,
792120	794640	cioè sono entrambi dei magistrati,
794880	795660	ecco,
795960	798160	questa appartenenza allo stesso ordine
798160	799720	sopravvive anche in questo nuovo codice,
799780	802180	vorrei sapere lei, appunto, da giurista
802180	803000	come giudica
803000	805040	se secondo lei questa è un'anomalia o no?
806160	807240	Sono entrambi due magistrati?
808500	809040	Sì.
809060	810480	Non ho capito bene la domanda.
810860	812000	Sì, è proprio così,
812220	813880	questa è la domanda.
816280	817040	Presidente Reone,
817200	819360	dicevo, ecco, come giudica lei
819360	821240	il fatto che anche in questo nuovo codice,
822880	824680	come giudica sotto il profilo tecnico,
825640	826980	che pubblico-ministero e giudici
826980	829980	appartengono ancora, diciamo, allo stesso ordine,
830060	831440	cioè alla magistratura ordinaria,
831460	831840	entrambi?
831840	834420	Questo non è una contraddizione,
835380	836040	perché, naturalmente,
836140	838380	l'ordine giudiziaria possono appartenere
838380	841220	allo stesso cancellino e appartiene all'ordine giudiziaria,
841480	843420	il fatto che il pubblico-ministero e i giudici
843420	845040	siano appartenenti all'ordine giudiziaria
845680	847140	non porta confusione,
848020	851580	cioè invece gli errori inaccentabili
851580	853180	sono quelli che riguardano
853180	855380	la deglassazione della funzione
855380	856040	del pubblico-ministero
856760	858080	durante l'istruzione,
858200	860080	che il pubblico-ministero può assumere
860080	861020	le prime parole,
861460	862720	può pegnare di appunti,
862780	864920	ma non può portare un verbale
864920	866520	scritto in dibattimento.
870280	871060	Voglio dire,
871060	872300	raggiungere una cosa
872300	873820	che mi pare fondamentale,
874080	876560	perché finora abbiamo discusso del contenuto,
877360	879260	questo codice per essere
879260	880960	– le mi sente?
882040	882400	Mi sente?
882900	884300	Ma sento benissimo, Presidente.
884500	887280	Dunque, questo codice per essere attuato
887280	888600	ha bisogno
890080	893240	di avere numerosissime strutture
893240	895680	materiali e personali.
896280	897780	Strutture materiali sono
897780	899580	i palazzi di giustizia,
900340	901280	perché i giorni attuali
901940	905560	sono veramente assolutamente inidonei,
905820	908280	ma i futuri palazzi di giustizia
910280	912260	dovranno essere
912260	914280	più ambi e più accoglienti,
915760	916660	perché tutto si fa,
916700	918500	come abbiamo detto, in dibattimento.
920000	921520	Sono, naturalmente,
921880	924700	le strutture carcerarie,
926380	928040	sono gli uffici
928040	929540	del pubblico ministero,
929720	930700	sono gli uffici
931360	932400	del cancelliere,
933140	934580	sono naturalmente
934580	935520	quelle che chiamo
935520	937100	le strutture materiali,
937160	940160	ma le gravi strutture sono
940160	942480	le strutture personali.
942880	943480	Occorre che
943480	945380	il codice sia applicato
945380	947460	da magistrati che
947460	948960	alcuni per qualche anno,
949180	950600	altri forse da 40 anni,
950720	951980	hanno sempre applicato
951980	954300	il vecchio codice di procedura penale.
954560	956220	Hanno quindi una preparazione
956220	957900	ed una mentalità
957900	959420	in un certo senso,
959560	962320	devono completamente capovolgerla
962320	963980	e non lo possono fare
963980	965480	in pochi mesi,
965640	967100	perché il governo
967100	969420	non ha avuto il buon senso
969420	970720	da molti anni
970720	973440	di creare le basi
975380	976540	del codice.
977580	978120	Bisognava fare
978120	980120	dei corsi speciali
980120	981660	per i magistrati
983580	984460	sui principi
984460	985860	che sarebbero stati
985860	988060	gli animatori del nuovo codice.
988260	989660	Bisognava fare
989660	990700	dei corsi
990700	992500	per i giovani magistrati.
992520	994620	Bisognava nei concursi
994620	995960	per portare
995960	997700	come materia
997700	1001100	di preparazione
1001100	1002620	nozioni
1005380	1006440	del nuovo codice.
1006740	1008380	È uno, naturalmente.
1008580	1010240	Dal punto di vista personale,
1010500	1011580	due cancellieri
1011580	1013660	sono abituati
1013660	1014940	alla vecchia struttura.
1015000	1016480	Il cancelliere si reputa
1016480	1017620	sia pure in giustamente
1017620	1019100	una specie di scrivano.
1019220	1020660	Il presidente che ha detto
1020660	1021460	la verità,
1021760	1023440	dovrebbe fare il verbale
1023440	1025060	e il presidente controllare,
1025660	1026420	però noi sappiamo
1026420	1027220	che il presidente
1035380	1036100	potrebbe fare il verbale
1036100	1036860	e verbarizzare,
1036860	1037760	come abbiamo detto,
1038200	1039380	con la stenografia
1039380	1041700	o con l'aiuto stenografo.
1042540	1043420	Naturalmente,
1043600	1046200	dal punto di vista personale,
1046340	1047340	naturalmente,
1047500	1049300	avremmo avuto bisogno
1049300	1051380	della preparazione
1051380	1054100	di tutti gli uffici giudiziari
1054100	1056440	che si fossero dovuti
1056440	1058140	utilizzare per i codici
1058140	1059400	di procedura penale.
1059820	1061620	Tutto questo importa
1065380	1066720	per tutti gli uffici
1066720	1068100	in Parlamento.
1068400	1069300	In un discorso
1069300	1070840	quando ministro era
1070840	1072560	l'onorevole Rognoni,
1073220	1075280	il problema della giustizia
1075280	1077740	non è un problema qualunque.
1077800	1079180	La giustizia oggi
1079180	1080860	è una voragine,
1081080	1082360	è una voragine
1082360	1084240	che bisogna riempire.
1084420	1086180	Tant'è vero che io proposi
1086180	1088700	una cosa quasi assurda,
1089080	1090340	ma di cui ero convinto?
1090620	1092160	Quello di istituire
1095640	1096500	una tassa,
1096520	1098220	un'imposta
1098220	1100140	generale per la giustizia,
1100540	1102080	come noi paghiamo
1102080	1103400	la tassa per la salute,
1103820	1105520	la tassa per la giustizia.
1105760	1108120	Se invece consideriamo
1108120	1110160	che l'ultimo bilancio
1110160	1112040	che è stato presentato,
1112240	1113480	il bilancio in corso,
1113640	1114820	quello che dobbiamo approvare,
1114840	1115980	è vero,
1118380	1120740	il governo ha tolto
1120740	1121880	un milione,
1122080	1123220	siamo un milione,
1125660	1127300	cifra preesistente
1127300	1128380	di destinazione
1128960	1130160	vera delle somme,
1130380	1131460	e non ha invece
1131460	1134240	apportato modifiche
1134240	1136380	che fossero proprio meno impurenti,
1138280	1138380	nonostante
1139100	1140460	la personalità
1140460	1142780	e la vigoria del ministro Nassali,
1143180	1144380	e noi dobbiamo dire che veramente
1145120	1146720	stiamo giocando,
1146720	1147920	stiamo giocando male,
1148300	1150140	stiamo giocando veramente
1150140	1151980	con le sorti della giustizia,
1152220	1154640	perché occorre soprattutto
1155380	1156380	creare queste strutture,
1158380	1158940	per esempio
1158940	1160700	a proposito di strutture,
1161200	1162380	io in varie occasioni
1163400	1165080	mi sono posto anche il problema
1165080	1166160	della cassazione,
1166320	1168480	voi sapete che la cassazione penale
1168480	1171560	è supervera operata,
1172260	1173240	e allora ho proposto
1173240	1176700	di scindere la cassazione penale
1176700	1179600	in tante sezioni regionali,
1180240	1181400	ogni regione
1181400	1183700	ha una cassazione penale,
1183700	1186500	e a Roma resta soltanto
1186500	1188040	la cassazione penale
1188040	1189200	a sezioni unite
1189200	1190640	per i problemi
1190640	1192740	strettamente giuridici,
1193700	1195360	poiché i ricorsi penali
1195360	1196620	sono in gran parte
1196620	1199080	ricorsi che attengono la motivazione,
1199580	1201600	non occorre la grande scienza
1201600	1203220	della cassazione di Roma,
1203660	1204860	a parte che non sempre
1204860	1206380	ne dà prova,
1207700	1208520	perché ci sia
1208520	1210380	una cassazione unitaria.
1210640	1212460	Torniamo a quella che era il sistema
1213700	1214140	del Milano,
1214140	1215200	non so quando,
1215440	1217480	furono soppresse naturalmente
1217480	1219680	e fu unificata la cassazione
1219680	1221160	penale a Roma,
1221980	1223800	questo renderebbe possibile
1225700	1226700	smaltire moltissimi processi,
1227920	1228260	non solo,
1228380	1229880	ma renderebbe anche più facile
1229880	1231800	e più agevole per le parti,
1232360	1234260	perché un'avvocata per venire
1234260	1235980	a discutere un ricorso
1235980	1237480	modestissimo a Roma
1237480	1238460	da Milano,
1238620	1238920	da altrove,
1244180	1244760	pronto?
1246740	1247320	Presidente?
1248220	1248800	Presidente?
1248960	1249540	Ecco, mi sente?
1250520	1252400	Ecco, vorrei tornare un po'
1252640	1254780	dalla parte del cittadino,
1255240	1257160	lei diceva prima un processo per ricchi,
1257200	1258620	ha parlato poi del lavoraggio
1258620	1259260	e della giustizia,
1259400	1261360	ma sotto il profilo del cittadino,
1261980	1263820	il cittadino con questo nuovo codice
1263820	1265140	guadagna o perde?
1266300	1268760	Avrà più giustizia o meno giustizia?
1269180	1270560	Con questo codice?
1270560	1273580	Ma il fatto di avere più o meno giustizia
1273580	1274420	lo sappiamo,
1275320	1277560	perché il contenuto della decisione
1278280	1279620	è che dal punto di vista
1279620	1281200	di quelle cassazioni poteri,
1281400	1283220	il cittadino in dibattimento
1283220	1285500	naturalmente deve battersi
1285500	1287800	naturalmente con,
1287800	1289320	se c'è la parte civile,
1289540	1291020	col pubblico ministero
1291020	1292440	e con i testimoni,
1292620	1295020	e allora deve essere provveduto
1295020	1297240	e o perlomeno assistito
1297240	1299000	da un avvocato esperto
1300560	1301560	e naturalmente esodilito.
1302720	1303560	Questo naturalmente
1304900	1308400	è un punto veramente grave.
1308920	1309780	Io ho proposto
1309780	1311560	che si istituisca un'avvocatura
1312200	1313520	per i poveri,
1313700	1316340	un'avvocatura vera e propria.
1316700	1318040	Oggi esiste
1318040	1319980	il difensore
1320560	1321800	di ufficio,
1321880	1323560	ma è una cosa veramente
1324080	1326060	quasi ridicola vera,
1326380	1327900	difensore di ufficio,
1328060	1329740	viene chiamato dal Presidente
1330560	1331740	e a un certo punto dice
1331740	1333040	la giustizia è finita,
1333240	1335400	sono vari casi di un difensore
1335400	1337240	di ufficio che si innamori
1337240	1339480	della causa gratuitamente.
1339680	1340880	Noi siamo degli uomini
1340880	1342400	e la professione è fatta,
1342400	1343540	ho fatto l'avvocata,
1343740	1346640	è fatta anche per guadagnare,
1346840	1349700	per guadagnare perché
1349700	1350680	è una fonte di vita.
1351120	1352500	Allora, per esempio,
1352780	1354200	avrebbe dovuto il governo
1354800	1355360	preparare,
1355440	1356680	se ne è guardata bene,
1360560	1361840	è modesta e ridicola,
1362120	1363620	ma preparare invece
1363620	1365800	una legge che istituisse
1365800	1368120	un'avvocatura dello Stato
1368120	1369340	per i poveri,
1369700	1371560	in cui siano assunti
1372280	1373560	gli avvocati per concorso,
1374620	1375560	pagati decorosamente
1376200	1377560	e tenuti naturalmente
1378420	1379880	in dibattimento
1380560	1382940	e nella stessa istruttoria
1382940	1384560	ad assistere naturalmente
1385140	1386760	l'imputato povero,
1386860	1388360	che non abbia possibilità
1388360	1389440	di un difendere.
1390240	1390780	Presidente,
1391720	1392980	io vorrei concludere
1392980	1395360	questa intervista con i futuribili,
1395420	1397200	come si fa nei trattati
1397200	1397840	di diritto,
1398900	1400320	ma secondo lei,
1400320	1401800	lo ripetiamo ancora per gli ascoltatori,
1401840	1403000	è un esperto della materia,
1403120	1404720	autore di un...
1406180	1407220	Ecco, volevo dire,
1407260	1408660	vorrei concludere questa intervista
1408660	1409540	con i futuribili,
1409600	1410660	come si fa nei trattati
1410660	1411680	di giurisprudenza,
1418360	1418520	e quindi,
1418920	1421140	di cosa ha bisogno
1421140	1423080	la giustizia penale italiana
1423080	1425340	per garantire al cittadino
1425340	1426680	il servizio di cui
1426680	1428320	il cittadino ha bisogno?
1428700	1430620	La domanda veramente
1430620	1432000	mi spaventò,
1432120	1433620	perché ecco il problema
1433620	1435280	che chiamava lavoraggi
1435280	1436640	della giustizia,
1437580	1438840	ha bisogno di tutto,
1439860	1440660	e questo codice
1440660	1442120	non risolve niente,
1442400	1444700	ha bisogno di un processo breve,
1448360	1449580	che è stato preparato,
1449600	1452040	ha bisogno di difensori per i poveri,
1452240	1453020	naturalmente,
1454300	1455540	io direi
1455540	1456680	ha bisogno di tutto,
1457120	1459280	e mentre si stava via via
1459280	1460580	con le varie novelle,
1460660	1461700	come ho detto prima,
1462300	1463840	cercando di adeguare
1463840	1466600	il processo alle necessità attuali,
1466940	1468680	lei ha fatto cortesemente
1468680	1471460	il mio manuale di procedura penale,
1471660	1474360	che è arrivato al 13° edizione,
1475380	1475960	è vero?
1475960	1478140	Mentre via via,
1478220	1479440	è vero,
1480260	1481360	il legislatore
1481960	1482960	cercava di attenuare
1483860	1486960	tutte le situazioni scabrose,
1488300	1489420	è venuto il nuovo codice
1489420	1492420	che ha creato tutto, direi,
1492840	1494100	tutta una rivoluzione,
1494220	1496160	una rivoluzione non benefica,
1496220	1496960	naturalmente,
1497340	1498960	una rivoluzione che...
