start	end	text
0	5360	sinistra, che in particolare saranno protagonisti del dibattito del pomeriggio, non possono
5360	10560	rinunciare. Quindi non si tratta di una cosa facoltativa, ma di un vincolo.
11980	16160	Detto questo, do la parola a Giuliano Amato per l'intervento introduttivo.
40560	47460	Problemi di tempo che Massimo ha illustrato. E' intollerante verso la regola che consente
47460	52880	al primo che parla di parlare un'ora dicendo poi agli altri per ciascuno di voi ora ci
52880	63240	sono cinque minuti. Vi costringerò ad ascoltare una cosa già scritta, cosa eccezionalissima
63240	70000	nella mia vita, ma era il modo più sicuro per non fare la parte che ora dicevo, che
70000	77180	è assolutamente intollerabile e sgradevo. Comunque lasciatemi almeno dire che ritrovare
77180	85440	la sinistra all'eliseo ha per me, che sono vecchio, un senso. L'eliseo ha rappresentato
85440	96440	già in passato un luogo dove la sinistra ha raccolto forze e nuove idee per orientarsi
96440	103080	meglio verso il futuro. Il senso del nostro appuntamento è anche questo qui all'eliseo,
103160	113620	se lo porta dietro con la nostra lunga storia, che è anche una storia molto positiva. Oggi
113620	122020	ci attanaglia il timore di una società sempre più povera di valori sociali e che non siano
122020	129780	solo ritualmente religiosi. Una società che rimanga per questo senza tessuto connettivo
129780	137320	e risulti incapace di missioni che vadano oltre il perseguimento da parte di ciascuno
137320	145480	dell'egoismo individuale o di gruppo. Si tratti di gruppo economico, etnico, professionale,
145840	153480	locale. Ci attanaglia per ciò stesso il timore di una società che possa definirsi liberale
153480	160280	e che sia invece acquisitiva, appropriativa, segnata solo dall'accaparramento privato.
160280	170040	Non è un incubo solo nostro, né è un incubo di oggi. Per quanto riguarda l'Italia, e almeno
170040	176680	da quando Pasolini lamentò la scomparsa delle lucciole, che la modernizzazione, la caduta
176680	182800	delle gerarchie, la scoperta e la pratica estesa della libertà individuale, che pure
182800	189620	sono state e sono il più straordinario sviluppo per noi di civiltà e di crescita, tuttavia
189620	196340	hanno dimostrato di portare con sé questi rischi. Ed oggi non è soltanto il Papa dei
196340	204220	cattolici a lamentarli, a mettere in guardia contro l'aridità di società senza più
204220	211460	trascendente, dove per trascendente si intende non necessariamente la divinità, ma piuttosto
211460	219600	ciò che trascende le ragioni egoistiche dell'io. Non in una enciclica, ma nella rivista americana
220280	228580	Harper's, leggevo giorni addietro che, virgolette, facendo cadere quelli che i brokers classificano
228580	235540	come valori non di mercato, siamo lasciati con una società definita non come unione
235540	244060	delle sue energie e delle sue speranze collettive, ma come un labile aggregato di interessi egoistici
244060	251140	muniti ciascuno del proprio manifesto, leali ciascuno alla propria agenda, sicuri di sé
251140	259320	soltanto entro l'armatura dei rispettivi linguaggi. La democrazia diviene così null'altro che
259320	266340	un gradevole nome greco per una carta dell'American Express o per un catalogo natalizio, mentre
266340	272560	il Governo è visto come un hotel della Florida, con il suo assortimento di beni e di servizi
272560	278020	che merita rispetto nella esatta misura in cui soddisfa i desideri dei suoi sponsors
278600	286580	e offre ai suoi diversi clienti i previsti sconti vacanze. Basta sostituire la Florida
286580	293820	con qualche regione più vicina. Non sono soltanto ragioni morali quelle che portano
293820	300400	a contrastare il radicamento di una società del genere, e ragioni morali è in dubbio
300400	307000	se ne sono. Essa è anche pericolosa per le esclusioni che può generare e quindi per
307000	314460	i conflitti che può aprire. Ed è inefficiente sul piano economico, per le risorse che spreca
314460	319880	in termini di capitale sociale e per quelle a cui rinuncia in termini di maggiore e più
319880	328140	diffusa conoscenza e quindi di più estesa e pagante innovazione. Non so se è questa
328140	335140	la società a cui aspira il centro-destra da cui oggi siamo governati. A dirvi la verità,
335280	343180	ritengo ragionevolmente di no, perché non credo possa esservi alcuno che aspiri ad una
343180	349200	società del genere. Ma se è questa la società verso la quale rischiamo e rischiamo da tempo
349200	355700	di andare, di sicuro le azioni e i messaggi del centro-destra, lungi dal contrastarla,
355700	363700	la favoriscono, le aprono la strada, le costruiscono addirittura degli scivoli con le sue offerte
363700	370140	di libertà di fare da soli, di arrangiarsi, di appropriarsi di quanto ciascuno è in grado
370140	377500	di far suo, sotto l'occhio di una legge a questi fini benevola e lassista, salvo che
377500	384660	con gli immigrati. Ma questo fa parte simmetricamente del quadro e meno male che almeno su questo
384660	391560	hanno finalmente aperto gli occhi le gerarchie della Chiesa. Si è arrivati a trasformare
391560	398620	beni collettivi come era la correttezza dell'informazione societaria in un bene privato degli azionisti
398620	405440	e se nessuno di loro protesta anche buona parte dei falsi in bilancio rientrano nella
405440	412400	norma e sono tollerati. Pensavamo di passare dal welfare state alla welfare community e
412820	419000	quanto spirito comunitario, quanta voglia di non lasciare solo gli altri, di cooperare
419000	426000	con gli altri sono già in campo in questo Paese e temiamo invece di passare al welfare
426000	433420	del voucher, ciascun italiano solo con i suoi 100 euro in mano e se uno ne ha di più si
433420	439480	trova da solo i servizi che gli servono. Se ha soltanto quelli finirà metaforicamente
439480	447820	per Bersely come non metaforicamente faceva il padre di Franky McCourt. Pensavamo di passare
447820	454120	dall'economia del nanismo industriale che si arrabatta sui costi corretta soltanto da
454120	460940	poche grandi imprese di origine pubblica all'economia di imprese che crescono in un nuovo contesto
460940	466620	di conoscenza e di innovazione e temiamo di rimanere invece con gli stessi nani che
466620	473660	hanno solo maggiore libertà legale di arrabattarsi sui costi. Insomma l'incubo si può avverare,
474940	481820	ciascuno per sé in un habitat sociale senza coesione e tutti per uno in un habitat politico
481820	487460	che è l'unico ad offrire attraverso una visione parossistica e totalizzante del principio
487460	494860	maggioritario un collante che non è tuttavia solidale ma antagonista, una prospettiva tanto
494860	500680	più lacerante in un Paese come il nostro che, a differenza di altri pur attraversati
500680	507900	da rischi simili, ha perso nei decenni trascorsi i contenitori al loro modo ordinanti delle
507900	514740	sue antiche diversità, i grandi partiti della Repubblica. E queste diversità vede oggi riemergere
515400	521060	come falle in movimento, ha scritto Alfredo Reitlin, in un pericoloso disordine.
522280	529340	Dovrei soffermarmi a questo punto sulle responsabilità che abbiamo e ne abbiamo, non per non aver
529340	535480	fatto ma per non aver fatto abbastanza per prevenire un'evoluzione come questa negli
535480	541080	anni dei nostri governi. Sarebbe un passaggio doveroso che tuttavia mi porterebbe via il
541080	547220	poco tempo che ho. Preferisco soffermarmi su ciò che dobbiamo fare ora per spingere
547220	552980	l'Italia e ritrovare la rotta e questo fra l'altro farà capire cosa penso degli stessi
552980	560680	anni appena trascorsi. Dobbiamo reagire e dobbiamo farlo perché come ho accennato una società
560680	567300	di individui che ha il maggioritario al posto del trascendente di ciò che trascende l'egoismo
567300	575940	di sé non solo è fonte inevitabile di esclusioni e quindi di lacerazioni e conflitti ma non
575940	582060	è neppure conveniente per l'economia, lo ripeto, perché manca di quelle missioni e
582060	588820	di quegli impegni collettivi dai quali dipende largamente la nostra competitività e quindi
588820	596780	la nostra crescita. Attenzione però, guai se nell'evocare missioni e impegni che ci
596780	604700	appaiono simili a quelli che ci caratterizzarono in passato pensiamo questo passato di poterlo
604700	610980	restaurare e c'è chi lo pensa, c'è chi ha subito i cambiamenti di questi anni con
610980	618260	il silenzio imposto dalla rovinosa sconfitta del comunismo ma con l'insofferenza e la diffidenza
618260	624420	di chi aspetta al varco la società libera per poter dire che non funziona e che in fondo
624420	631120	aveva ragione lui con il suo statalismo, il suo dirigismo, la sua fiducia nella potenziale
631120	637300	razionalità della decisione pubblica contro la sicura irrazionalità delle decisioni private.
638260	646260	No, questo passato è proprio finito. Il bisogno che pure c'è di decisione pubblica e il confine
646260	652440	che pure c'è fra economia di mercato e ambiti nei quali non è ai meccanismi di mercato
652440	658860	che ci si può affidare non cambiano la premessa dalla quale dobbiamo partire e la premessa,
658860	665720	che ce lo insegnerebbe Marx, è che le nostre società sono profondamente, strutturalmente
665720	673740	cambiate. Sono cambiati i processi produttivi, sono cambiate le tecnologie, è cresciuta
673740	681800	grazie anche a noi la coscienza di sé, l'istruzione, la consapevolezza dei propri diritti da parte
681800	688440	di milioni e milioni di individui. Viva Dio nelle nostre società, l'aspirazione alla
688860	694880	società, al diritto di scegliere e di dire la propria non è più dei pochi ma è dei
694880	702540	più. Sono società libere e proprio perché lo sono noi dobbiamo fare i conti con i frutti
702540	709560	positivi della nostra storia che era iniziata come un grande moto di libertà per chi non
709560	717740	l'aveva. Il socialismo fu scritto è la libertà che si fa per la povera gente. Non dobbiamo
717740	725140	pretendere questa storia di riviverla nei suoi successivi passaggi e quanto più sapremo
725140	731180	farlo tanto più ci accorgeremo che la società degli individui senza trascendente non è
731180	737760	la società libera ma è una devianza resa possibile dalle nostre insufficienze, dalle
737760	745440	nostre latitanze sul terreno della libertà. Ci dobbiamo riappropriare della libertà perché
745440	751700	nessuno ne inquini la natura di stupendo, straordinario valore universale che non ammette
751700	759440	esclusi ma c'è in quanto l'abbia l'altro e non soltanto io, che non è fondato sull'egoismo
759960	766600	ma sulla facoltà e quindi sulla responsabilità di scegliere un bene che non ci è un posto
766600	773480	ma che tocca a noi trovare, che non chiude nella solitudine ma sollecita tutti a quei
773480	779820	momenti di impegno e di azione collettiva e pubblica che sono necessari ad allargarne
779820	786140	gli ambiti a beneficio di chi manca delle capacità per farlo da solo oltre che a combattere
786140	792680	i poteri soverchianti che la libertà restringono nell'economia, nell'informazione e altrove.
793480	798980	Ci dobbiamo riappropriare della libertà perché è una domanda di libertà quella che viene
798980	805220	da una società in cui il valore del poter scegliere è venuto crescendo non meno del
805220	811420	tradizionale bisogno di essere protetti davanti ai rischi fondamentali della vita, sino al
811420	817980	punto di connotare i modi in cui questo stesso bisogno di essere protetti ha preso a manifestarsi.
818700	825160	Ed è attenzione una domanda di libertà quella che viene dai movimenti che manifestano contro
825160	831380	la povertà del mondo o più di recente da noi per testimoniare un'opposizione più vigorosa.
831640	838700	Migliaia e migliaia di persone che dimostrano così di volersi riappropriare della politica
838700	844600	e che certo non lo fanno perché i politici, che a volte neppure accettano al loro fianco,
844900	853100	li governino poi dall'alto come benevoli ma inamovibili angeli custodi. Ci dobbiamo riappropriare
853100	860000	la libertà perché è la libertà intesa appunto come capacità di scelta di cui ciascuno
860000	867300	deve essere dotato e come assunzione di responsabilità per sé per gli altri di cui ciascuno deve
867300	875620	essere capace, il fattore ordinante di una lungimirante e aggregante piattaforma di governo
875620	882480	per la sinistra del nostro tempo. Ed eccoli i capitoli del nostro lavoro culturale e politico.
882480	888520	In un mondo segnato dalla mobilità e dalla velocità del cambiamento e dell'innovazione,
889040	895900	la libertà senza esclusi e quindi come chiave per la lotta all'esclusione, significa esattamente
895900	902940	le cose che ci ha insegnato Amartya Sen e che a sinistra si ama più citare che praticare.
903460	910160	Significa fornire le sicurezze essenziali perché non può essere libero chi è preda dell'insicurezza
910160	917160	sull'ABC della sua vita futura, ma significa al di là di questo allargare le capacità,
917700	923360	mettere in condizioni di scegliere, mettere in condizioni di non essere spiazzati né
923360	931160	dalla mobilità né dal cambiamento, di cui la centralità della formazione e delle opportunità
931160	937300	di adeguamento e di aggiornamento per tutti, di cui la centralità dei servizi alla famiglia
937300	942700	senza i quali nessuna donna è davvero in condizioni di scegliere, di cui la lotta
942700	950540	al degrado urbano e ad una scuola troppo precocemente selettiva, ci pensi il governo italiano, per
950540	957100	evitare ai figli di nascere in serie B e dalla serie B essere condannati per il resto della
957100	962640	vita, di cui la necessità di configurare tutto questo in termini di nuovi assetti,
962640	968820	di nuovi diritti, di istituzioni sociali adeguate ai rischi del nuovo secolo, perché
968820	974960	i rischi della mobilità e del cambiamento si è in condizioni di fronteggiarli in ragione
974960	981200	dei diritti che si posseggono, diritti ad essere difesi, ma anche diritti a difendersi
981200	988580	e a farsi valere. Ma la libertà come allargamento delle capacità non investe soltanto il mondo
988580	994960	del lavoro, la scuola e la sicurezza sociale. Investe l'impresa e l'economia nel suo insieme,
995320	1001700	che per essere competitive hanno bisogno non soltanto di ridurre i loro costi. Sono anni
1001700	1008740	che ne parlo col mio quasi omonimo, ma una D a volte fa una differenza bisade. Se fosse
1008740	1017580	soltanto per ridurre i loro costi tantè restarsene sommersi o andare tutti in Romania lasciando
1017580	1026500	emerge in Italia le sole attività finanziarie. In fondo c'è chi questo sogno assurdo lo
1026500	1033760	coltiva e lo persegue. Ma l'impresa ha bisogno di crescere alle dimensioni necessarie ad
1033760	1040080	avvalersi di tutte le patenzialità oggi offerte dal mercato finanziario, di crescere nella
1040080	1047000	qualità necessaria a offrire al mercato finanziario opportunità superiori di investimento, di
1047000	1052800	avvalersi di un capitale collettivo circostante che promuova questa crescita e ne potenzi
1052800	1059520	i risultati. Di qui l'essenzialità di politiche volte non soltanto ad assolvere le imprese
1059520	1065940	nane dai loro peccati, ma a promuoverne la crescita dimensionale, la trasparenza richiesta
1065940	1072040	dal mercato, la propensione all'investimento in ricerca e innovazione, la propensione
1072040	1079900	ad occupare management innovativo, la propensione all'europeizzazione e all'internazionalizzazione
1079900	1087060	e inoltre adottarle dei servizi e delle infrastrutture in cui giustamente vedono il sacrosanto ritorno
1087060	1095620	delle tasse che pagano, quando le pagano. Sono solo esempi, ma sufficienti spero, a
1095620	1101560	illustrare le potenzialità dei cardini di un programma riformista per la società delle
1101560	1107440	libertà e dei diritti e per chiarire il senso complessivo della missione culturale
1107440	1114340	e politica di cui dobbiamo assumerci la responsabilità. La missione è quella di un Paese che, dopo
1114340	1120980	la caduta del vecchio ordine in cui era comunque cresciuto, sa leggere nelle incognite della
1120980	1128240	nuova realtà in cui si trova muoversi le ragioni e le tracce di un ordine nuovo e si impegna
1128240	1134980	ad inverarlo come, promuovendo l'esercizio responsabile delle libertà dei suoi cittadini
1134980	1142100	e quindi la valorizzazione di ciascuno e di tutti. Eccola allora la competitività dell'Italia,
1142520	1148220	che non discende dalla possibilità conferita ai pochi di licenziare più facilmente i
1148220	1155380	più, ma da rendere i più indispensabili alla crescita complessiva, dotandoli di competenze,
1155380	1161180	mettendoli in condizioni di aggiornarle in ogni fase della loro vita, portando tutti
1161180	1167180	idealmente alla possibilità di essere loro, a licenziare i loro datori di lavoro e di
1167180	1173960	scegliere liberamente il proprio futuro. Per questo vedrete, io sono certo, che i figli
1173960	1180820	saranno arrabbiati accanto ai padri nel protestare contro un governo che si ripromette di licenziare
1180820	1187520	i padri e di mandare i figli all'avviamento e di privarli di una scuola che dia a loro
1187520	1198440	la possibilità di farsi valere per il futuro. Non è il capitale umano oggi e domani il
1198440	1205540	bene maggiore di cui può disporre un Paese che ha fiducia in se stesso. Ne è nel mercato
1205540	1212140	del lavoro la ragione che rende oggi così esigua la presenza delle nostre imprese nei
1212140	1218580	processi industriali di integrazione europea e nell'investimento diretto. Anche qui sono
1218580	1224940	altre le capacità da allargare per rafforzare la competitività italiana.
1229740	1235340	Eccolo inoltre nell'orizzonte di questa stessa missione il ruolo dell'Italia in
1235340	1242320	Europa che non si realizza battendo il pugno sul tavolo contro gli altri ma perseguendo
1242320	1249340	insieme agli altri quegli interessi comuni che nessuno stato può oggi assicurare da
1249340	1259140	solo dallo sviluppo ambientalmente sostenibile alla lotta alla criminalità organizzata
1259140	1266140	dalla sicurezza dei cibi alla garanzia che il mercato integrato sia l'arena della libertà
1266140	1273960	economica e non di poteri dominanti dal coordinamento del nostro enorme potenziale di ricerca a
1273960	1279500	quello della formazione di un personale di eccellenza che abbia la stessa Europa come
1279500	1286840	habitat comune dalla stabilizzazione delle regioni che ci circondano alla riduzione
1286840	1295200	delle intollerabili diseguaglianze che segnano il mondo e quindi la pace. La pace di cui
1295200	1301780	anche ai nostri amici ed alleati dobbiamo avere la forza di far condividere le ragioni
1301780	1309500	e le radici che non escludono certo la reazione al male e la sua punizione specie quando il
1309500	1316700	male è così terribile come quello che si è manifestato l'11 settembre ma non ci consentono
1316700	1323660	di estendere al mondo la biblica spietatezza che ha portato il governo di un Paese amico
1323660	1336040	Israele a diffondere i semi di una violenza senza fine in Palestina. Rispetto a tutto questo,
1336260	1344340	la somma delle nostre sovranità nazionali è solo la somma delle nostre impotenze e qui
1344340	1350020	siamo già al ruolo dell'Europa e al ruolo dell'Europa nel mondo, un ruolo che nei
1350020	1356680	fini e nelle modalità siamo ora nella impegnativa condizione di poter riplasmare in funzione
1356680	1362240	delle domande e delle aspirazioni dei nostri cittadini, i quali chiedono anche qui più
1362240	1370120	democrazia e più trasparenza ma anche meno intrusioni burocratiche e più efficacia nell'attuare
1370120	1377040	le tante promesse che i capi di governo europei fanno nei loro comunicati comuni salvo poi
1377040	1384840	a paralizzarsi a vicenda nella trappola non europea ma intergovernativa delle loro procedure
1384840	1392100	di non decisione. È davvero difficile il mondo che abbiamo davanti, è difficile in
1392860	1400200	politica, se è ancora vero, che fare politica è dare un senso e un ordine finalizzati a
1400200	1407460	mete comuni. C'è chi questo senso lo trova immaginando un semplicistico ordine avverso
1407460	1415320	che si tratta solo di abbattere perché i fiori riescano armoniosamente a fiorire, ma l'immaginazione
1415320	1421420	di un mondo in via di assorbimento da parte di una gigantesca idrovora che tutto lo assimila
1421420	1428760	al suo accento americano seppure segnala squilibri che ci sono e che vanno corretti deforma
1428760	1436380	pericolosamente una realtà fatta invece di identità molteplici e di diversità frammentate
1436380	1443460	che dobbiamo caso mai comporre rispettandole e disinnescando allo stesso tempo i veleni
1443460	1450640	ora particolaristici ora distruttivamente ideologici che molte hanno in sé. Per noi
1450640	1463400	situati in Italia questo significa dare un'arizonte morale civile e comune alle tante dimensioni
1463400	1471000	degli italiani, alle loro libertà individuali, alle formazioni sociali in cui, come dice la
1471000	1480440	nostra Costituzione, si svolge la loro personalità, alle loro comunità territoriali, al loro
1480440	1488260	aspirazione, perché molti hanno questa aspirazione a un mondo più sicuro e più giusto. Occorrono
1488260	1495220	a tal fine prima di tutto e al di sopra di tutto il coraggio e il candore delle grandi
1495220	1503360	idealità che alimentano un tessuto comune. E in questo si va di l'anima, il filo teso
1503360	1509760	del riformismo che non è solo proposta, non è solo articolazione di commi tecnicamente
1509760	1516740	corretti, ma è progetto d'insieme, è tratto finalistico di identità comune, è visione
1516740	1524400	del futuro in cui proposte e commi tecnicamente corretti trovano il loro senso e la loro ragione.
1525020	1530820	Ma oggi, più ancora di ieri, il coraggio delle grandi idealità che va chiesto in primo
1530820	1538400	luogo alla dirigenza politica deve accompagnarsi da parte di questa al coraggio e all'umiltà
1538400	1546220	di saper contare sugli altri, di stimolare e far crescere la responsabilità dei cittadini
1546220	1554420	in modo da affidarsi poi ad essa affinché, direbbe Sen, le capacità si realizzino e
1554420	1561040	si realizzino con esse le idealità di cui avremo saputo nutrire il tessuto cosociale.
1561800	1568940	Solo così si potrà davvero entrare nel profondo della società di oggi e muoverla
1568940	1574720	verso i fini e i valori comuni. Non si conti su gerarchie che non ci sono più,
1575460	1583420	non si conti su deleghe che sono sempre revocabili, non si pensi che la retorica del populismo possa
1583420	1590880	andare oltre adesioni superficiali e retoriche. E qui entra in campo l'ultimo capitolo, quello
1590880	1596580	delle regole delle istituzioni che sono oggi in discussione per il mondo nel suo insieme,
1596780	1604520	per l'Europa, per l'Italia. Ovunque la domanda è di democrazia, ma non ne capiremmo il senso
1604520	1611240	negli sbocchi possibili se non capissimo le insoddisfazioni e le aspirazioni che in essa
1611240	1618680	si esprimono. Insoddisfazioni e aspirazioni che certo partono dagli squilibri oggi esistenti
1618680	1625740	e quindi dal bisogno di contrapporre in primo luogo nell'arena globale poteri sovranazionali
1625740	1632120	legittimi ai soverchianti poteri economici e finanziari che in essa si muovono senza regole
1632120	1641880	e senza argini. E tuttavia sono le insoddisfazioni e le aspirazioni di quei milioni di io che sono
1641880	1648160	arrivati finalmente alla ribalta della storia e che per democrazia intendono non solo dei
1648160	1655040	poteri in cui riconoscersi, ma anche spazi per sé, garanzie non manipolabili per le
1655040	1661960	proprie libertà, strumenti efficaci per il proprio diritto a far valere le responsabilità
1661960	1668600	di chiunque sia stato acciamato ad agire per conto loro e in nome dei loro interessi. Non
1668600	1674640	è dunque esaurita la democrazia di cui c'è bisogno da un potere legittimato dal voto
1675420	1681480	in una chiave tutta russoiana che assegna alla volontà della maggioranza e di chi la
1681480	1688640	rappresenta il tratto divino della verità al di sopra di qualunque legge superiore.
1688760	1695640	Più di questa chiave, che sembrava esaurita con le democrazie totalitarie del XX secolo,
1695720	1701920	quelle chiamate comuniste, e che viene invece ripresa dai popurismi di destra del nostro
1701920	1710020	tempo, è la chiave locchiana in versione madisoniana, quella che risponde di più alla
1710020	1716000	domanda che abbiamo davanti. Una chiave che non nega affatto la centralità del principio
1716000	1722720	maggioritario per il governo della democrazia, ma la colloca in un contesto di doppia divisione
1722720	1730760	dei poteri, da una parte di autorità indipendenti a partire dall'autorità giudiziaria, dall'autorità
1730760	1739340	giudiziaria, a garanzia di diritti e libertà non prevaricabili dalla maggioranza né assorbiti
1739340	1747440	dall'esserne eventualmente partecipi dall'altra di effettiva sussidiarietà e quindi di limitazione
1747440	1753380	reciproca e di necessaria reciproca integrazione fra diversi livelli di governo.
1754480	1761020	È un tempo di trasformazione profonda, quello che abbiamo l'avventura di vivere. Perdute
1761020	1769680	le vecchie certezze, alcuni cedono alla tentazione di mantenerle artificialmente in vita, altri
1769680	1776840	rischiano di smarrire il senso del possibile e dell'osabile e in nome della modernità
1778160	1786320	predicano e praticano i piccoli aggiustamenti e la navigazione a vista. No, guardiamo al
