start	end	text
0	7080	Salvatore Vecca, Alfredo Reichlin, Claudia Mancina, Biagio De Giovanni, Paolo Onofri e molte altre.
7680	18000	Io quindi, prima di dare la parola a Giuliana Amate e Massimo D'Alema, voglio ricordare che questa occasione
18900	24260	rivolta al pubblico della festa nazionale e in particolare alla stampa, trattandosi di una presentazione
24260	34260	quindi anche se è particolarmente difficile in questi giorni parlare di cose che non siano legate ai fatti drammatici che conosciamo
35540	39500	cercherò, diciamo, il mio dovere sarà quello di privilegiare le domande dei giornalisti
39500	46360	e nello stesso tempo di chiedere ai giornalisti, per quanto possibile, di fare domande relative a questa specifica occasione
46360	51700	ricordando tra l'altro che sia Giuliana Amato questa sera, sia Massimo D'Alema domani sera
51700	60740	avranno occasione inserata, diciamo, di parlare dei temi più specificatamente politici nel corso di iniziative dedicate proprio a questo
60740	62700	quindi la parola a Giuliana Amato
71460	77840	Ho bene, via, è la prima volta che presento una rivista ad un pubblico così numeroso
77840	88160	quindi allora mi fa piacere, mi fa molto piacere anche perché, buoni, buoni, che dopo viene il bello
88160	100400	No, anche perché noi presentiamo la rivista sperando che almeno per scrivere una rivista vi fidiate di noi
100400	110280	e quindi dando per acquisito che la rivista esce a noi farebbe piacere che cominciaste ad abbonarvi a questa rivista
110280	121780	che è un po' una cambiale, è un po' una cambiale, ma se vi fidate, ora, lui che ama il futuro, gli italiani europei, la nostra fondazione
121780	125460	ed è anche il titolo della rivista, quindi il prezzo è in euro
128360	136280	lo dico in italiano, ma in italiano è complicato, è bene che lo sappiate perché noi siamo qui a chiedervi in primo luogo
136400	155660	Di farvi abbonati ordinari 69.700 l'anno, è gradito anche essere sospenitori 151.000 lire l'anno, il benemerito sgancia 499.950
159760	166620	Noi abbiamo fatto i conti su un certo numero di abbonamenti ordinari, a dire la verità
166620	171720	fateci un pensierino se riusciamo a convincervi
171720	181660	Noi abbiamo da tempo, lo sapete, questa fondazione che porta proprio questo nome italiani europei tutto attaccato
181660	190660	e che esprime l'idea di una nuova dimensione della politica nella quale ci dobbiamo comunque muovere
191640	199660	che è quella del nostro stare in Europa, ne abbiamo parlato sere fa proprio in questo stesso spazio
199740	211680	e io ne fui molto confortato quella sera, quindi non è uno sforzo da intellettuali quello di proporre la dimensione europea della politica
211680	214040	c'era tanta gente quanto ce n'era ora
214040	220280	e notammo addirittura che la gente aumentava via via che si parlava dell'Europa
220280	226320	quindi si è cominciato a capire che buona parte delle nostre questioni sono europee
226320	238780	ma non siamo così preparati a capire noi stessi, a capire noi stessi come a quella dimensione le questioni debbano essere affrontate
238780	246500	e di qui abbiamo pensato la necessità di una rivista, di un bimestrale
246500	259500	che al di là di quello che una fondazione fa normalmente, fa seminari, fa convegni che però finiscono sempre per coinvolgere un numero limitato di addetti ai lavori
260140	267360	con una rivista come facevamo una volta, come facevamo una volta, si coinvolgono tante persone
267360	278660	perché uno dei problemi che ha la politica del nostro tempo è che è diventata una sorta di torneo riservato a pochi addetti ai lavori
278660	290460	rispetto ai quali tutti gli altri sono spettatori, sono condannati al ruolo di tifosi e questo non va bene, questo per noi non va bene, non va bene
290460	301720	altri possono fare una politica che chiama l'insieme dell'opinione ad essere soltanto spettatrice magari tifosa
301720	310780	per noi è cruciale ristabilire, io ve lo dico con tutta franchezza, cambiando tutto quel che va cambiato
310780	322940	ma un po' come era nei vecchi partiti un circuito di comunicazione più largo, degli strumenti di comunicazione che siano più larghi e più coinvolgenti
322940	333000	e che abbiano anche un'altra delle caratteristiche che aveva la vecchia politica, non so se mi è capitato di citarlo qui, quando ero qui l'altra sera
333860	342200	o in un'altra festa da qualche altra parte, non me lo ricordo, ma avevo davanti un pubblico di festa e ho citato un bel saggio
342200	353320	non ancora uscito di Salvatore Biasco il quale ricorda che quando eravamo giovani noi facevamo precedere tutto dall'analisi della società
353320	360380	non so se i giovani non se lo ricordano, quelli della mia generazione se lo ricordano
360380	367680	magari ci sbagliavamo sull'analisi della società, non sempre ci coglievamo
367680	379120	e tuttavia qualunque decisione, al limite anche quella se andare al gabinetto o no, la facevamo precedere dall'analisi della società
379120	387120	Oggi si adottano decisioni che riguardano il destino di un paese senza conoscere il paese
387760	400880	o attribuendo a mezzo sondaggio o a quattro sondaggi la capacità di interpretare i sentimenti di un paese, le figure sociali che questo paese ha prodotto
400880	411060	i bisogni di cui queste figure sociali sono portatrici, le convergenze e le divergenze oggettive che ci possono essere fra di loro
411060	416280	questa era a suo tempo la nostra analisi della società
416280	424880	e si parlava di bisogni di certi ceti, di possibili alleanze ora tra produttori, ora tra altri
424910	436910	tutta la storia del movimento operaio nacque riflettendo sulla possibile connessione tra la questione operaia e la questione contadina
437470	452910	e quanto ci si è lavorato sopra per cogliere i punti di coesione e di contraddizione tra queste componenti sociali base della società del primo novecento
454270	461910	siamo sicuri di conoscere oggi la nostra società nei grandi cambiamenti che sono intervenuti
462910	466910	le nuove figure sociali, i bisogni che esprimono
468570	474830	abbiamo cominciato ora, se ci pensate, in queste settimane dopo le elezioni fra l'altro
476190	485830	allora abbiamo cominciato a riflettere sul mondo dei lavori e non più del lavoro, sui nuovi soggetti
486890	491830	sulle differenze che ci sono all'interno del mondo del lavoro dipendente
492950	502770	sul fatto che tanti di coloro che erano lavoratori dipendenti sono diventati lavoratori autonomi e magari sono le stesse persone di prima
502770	510890	tuttavia in quanto lavoratori autonomi hanno oggi bisogni diversi, hanno oggi aspettative diverse
510890	520610	come si fa a mettere insieme questo mondo? Quali sono le piattaforme? Quali sono le esigenze?
521830	530770	i soggetti della politica sono cambiati, dicevo prima italiani europei sono cambiati i confini della politica
531710	536330	oggi ne parlavamo proprio l'altra sera parlando di Europa
536330	544030	sono tante le cose che vengono da fuori e che entrano nella nostra vita da fuori
544030	547010	l'ultima è terrificante
547010	558350	può da fuori attraverso un aereo di linea di voli nazionali essere sconvolta la vita di un intero paese
558350	562630	con le bruciate decine centinaia forse migliaia di vite
563350	576430	e allora si può da soli fronteggiare un mondo in cui il cambiamento climatico, il terrorismo, la sicurezza dei cibi, la sicurezza dei mari
576430	583990	vengono messi a repentaglio da minacce, da fatti, da vicende che avvengono tutte al di fuori di noi
583990	595750	allora come facciamo a costruire una politica che abbia un impatto adeguato su tutte queste vicende e che tuttavia non si perda lassù in alto
595750	601970	e continui ad essere radicata tra di noi, continui ad essere la nostra politica
601970	607350	di cui tutti noi dobbiamo essere in qualche modo protagonisti
607350	613990	su cui tutti noi dobbiamo essere in grado di poter dire la nostra e di poter far valere la nostra
613990	618350	questa è una dimensione totalmente nuova
619050	629090	una dimensione badate che è talmente complessa che facilmente si cerca di aggirarla
629090	639150	e di risponderle attraverso il grande messaggio populista che così attraverso i mass media cerca di coinvolgere tutti
639150	645090	allora attraverso il messaggio rapido, allora attraverso il messaggio che colpisce le emozioni
645610	658310	noi non conosciamo ancora le risposte che dobbiamo dare a queste domande ma una cosa traiamo dal nostro patrimonio di valori e di cultura comune della sinistra
658310	668310	il fatto che la risposta non può essere mai una risposta semplice, emotiva, imposta attraverso un'adesione di sentimenti
668950	678050	ma deve essere una risposta ragionata, dove il ragionato è non la ragione mia o quella di Andrea o quella di Massimo
678050	687310	ma è la ragione che viene da tutti noi che ci lavoriamo sopra, che interagiamo, che ci pensiamo, che ne discutiamo
689710	701310	era un valore enorme questo che aveva la nostra politica di molti anni fa, nasceva dal fatto che ne discutevamo
701310	715230	non che stavamo a guardare porta a porta gli spot televisivi, capite? non solo questo, ne discutevamo noi
718650	730790	allora non voglio abolire porta a porta, non è questo il mio problema ma voglio che ciascuno di noi se gli capita di passare un'ora davanti a porta a porta
730790	739170	abbia un suo bagaglio, non penda dalle labbra, dico Storo, abbia partecipato e possa partecipare dopo
739170	751930	e allora dico, certo rinascita in mondo operaio erano pizze enormi a volte, ne sono consapevole, uno si sentiva un po' obbligato
751930	767650	quant'è questo? 40 pagine, ci avrei anche da lavorare, però almeno uno se la faceva trovare sotto braccio, dava l'impressione che faceva parte un po' di quel mondo
767650	779090	però almeno lì c'era il nostro sforzo di pensarci sopra, di rifletterci, di ragionarci, di problematizzare, c'era
779090	786650	vogliamo in qualche modo ripristinare, sì signori, ripristinare questo tipo di abitudini
788290	800910	alcuni che ci si mettono sopra, che ci pensano e questa cosa circola, questa rivista passa da una mano all'altra, è pensiero mio che entra
800910	812690	perché io glielo porto direttamente attraverso questa carta a lui e lui può rispondere e quindi c'è una circolazione diversa, una circolazione più pensata
812690	819710	una circolazione in cui nessuno è spettatore e nessuno è protagonista con un limite
819710	828690	io ho stabilito nella rivista una regola che discende dalle moderne tecnologie ferroviarie
828690	845390	dato un nostro lettore che inizia la lettura su Neurostar a Roma, la lettura a Orte deve essere finita senza che si sia rotto il pantografo dell'Eurostar che è lì da quattro ore
845390	859050	perché allora non vale, in questo caso non vale, deve essere finita nell'ipotesi fisiologica che l'Eurostar abbia percorso quel tratto alla velocità prevista
859050	875050	se a Orte il lettore si è addormentato su quell'articolo l'errore è nostro direttore della rivista, però è già una dimensione alla quale si può ragionare
878470	888050	naturalmente ci possono essere alcune domande perfide su questa cosa qui, perché Amato ed Alema si mettono a fare questa rivista insieme?
889750	900690	io trovo più legittima la domanda fatta quando uno chiede a Tronchetti Provera perché ha comprato Telecom insieme a qualcun altro
904510	922690	questa parte un'avventura economica, finanziaria, industriale, non è un partito, è una rivista offerta a tutta la sinistra
922690	938090	non è una piattaforma di una iniziativa politica, è una piattaforma di una iniziativa di cultura politica che ha un senso soltanto se non è esclusiva
938090	960910	è una rivista di tendenza, perché è una rivista del riformismo, perché è una rivista fatta da persone che sono convinte che i problemi del nostro tempo sono spaventosamente diversi di quelli di cento anni fa
960910	974070	e che tuttavia il bagaglio di cui noi possiamo disporre sia pure aggiornato, riveduto, corretto per poterli risolvere è il bagaglio riformista
974070	996650	che ha al fondo l'idea che una società funziona quando c'è il massimo di eguaglianza possibile non nel subire ma nel decidere ciascuno per sé, dove il ciascuno per sé non vale soltanto per chi ha ma vale anche per chi non ha e deve essere messo in condizioni di avere
996650	1023070	questo è tutto il senso del riformismo, il quale appunto prevede che ciascuno di noi abbia forse per i fedeli un angelo custode ma non prevede che noi siamo necessariamente noi esseri umani gli angeli custodi di qualcun altro
1023070	1028770	vorremmo un mondo in cui ciascuno è il proprio angelo custode
1028770	1057090	perché Amato Edalema ha un senso la domanda in un'altra prospettiva, cioè perché il riformismo è un'esperienza che in modi diversi è stato praticato nella storia passata della sinistra italiana da partiti diversi che si sono anche a spramente combattuti
1057090	1080090	che si sono divisi, che nell'ultimo capitolo della loro storia sono addirittura arrivati a in qualche modo praticare l'uno nei confronti dell'altro l'antico principio mors tua vita mea
1081730	1100610	questo ha fatto del male, questo fa parte di un male che sia da lei ma sia io pensiamo debba essere alle nostre spalle
1100610	1123710	siccome siamo entrambi convinti, siccome siamo entrambi convinti che c'è un patrimonio comune che la sinistra in quanto tale ha costruito attraverso decenni difficili di lotta nel paese e nelle istituzioni
1123710	1150030	siccome pensiamo che di questo patrimonio comune il futuro abbia bisogno è nostro compito in primo luogo intellettuale, culturale e poi anche politico fare in modo che gli elementi comuni di questo patrimonio prevalgano e che le divisioni rimangano sul passato
1150030	1173030	il futuro non ha ne bisogno di queste divisioni né ragioni ulteriori per farle valere e stimolarle davanti ai problemi che abbiamo davanti, alla dimensione europea in cui ci dobbiamo muovere, alla famiglia della quale siamo partecipi
1173110	1187450	e nella quale le ragioni delle nostre vecchie divisioni sono ormai tutte filtrate e assorbite in realtà politiche e omogenee quali sono quelle dei grandi partiti socialisti dell'Occidente
1188770	1217290	Amato ed Alema significano soltanto questo messi insieme, poi può darsi che ci siano vicende singole della politica su cui non saranno d'accordo ma saranno d'accordo su un punto che fanno parte della stessa famiglia politica e hanno il compito di contribuire con le loro teste insieme alle teste degli altri ad elaborare una cultura politica comune per il futuro
1217450	1227930	Questo è il senso della nostra rivista, il senso della nostra iniziativa
1227930	1240350	Vedrete nel primo numero che già vi ho invitato non a comprare ma ad essere il primo numero per il quale pagate l'abbonamento che poi vale anche per quelli dopo naturalmente
1240350	1255610	Ecco nel primo numero vedrete che appunto ci sono, cominciamo proprio intervistando sulle prospettive del riformismo i leaders del socialismo europeo
1255610	1272190	Probabilmente il primo numero avrà le interviste a Antonio Guterres come sapete presidente dell'internazionale socialista e primo ministro portoghese e a Tony Blair
1281570	1295190	Ci saranno pezzi sull'Europa, ci saranno pezzi sulle questioni che la realtà drammatica di questi stessi giorni ci ha messo davanti
1295310	1313510	Ci saranno pezzi che testimonieranno con la loro problematicità la ricerca di cui tutti abbiamo bisogno per orientarci davanti a temi che sappiamo di dover affrontare ma delle cui risposte sappiamo troppo poco
1313510	1320810	Questioni che riguardano per esempio i cibi transegenici, questioni che riguardano l'elettrica
1320810	1331010	Che la risposta degli Stati Uniti sarà una risposta ampia, prolungata ed efficace e Bush oggi ha allertato l'esercito
1331010	1339150	Oggi c'è anche un'altra presa di posizione che è nuova che è quella di Saddam indirizzata a Bush
1339890	1350010	E Saddam dice a Bush che le prove muscolari, lui lo sa, all'Occidente non sono mai riuscite
1351250	1357010	Questa era la prima domanda che volevo rivolgere al Senatore Amato
1358590	1362010	Un commento su quello che si sta preparando
1362010	1384330	La seconda domanda, ecco, mentre c'è questo, mentre succede tutto questo, oggi un Ministro della Repubblica sulle rive del POA, le Sorgenti del POA
1384330	1389230	Continuo a parlare di immigrazione, referendum e devolution
1390330	1400330	E sinceramente le agenzie che si leggono, poche agenzie che si leggono da questo evento alle Sorgenti del POA
1400990	1408650	Sembrano agenzie che arrivano da Marte, come se l'onorevole Bossi fosse un marziano
1408650	1414070	Anche su questo volevo un parere del Senatore Amato
1417270	1432130	Presidente Dalema, ancora una volta la sinistra si trova di fronte alla guerra o comunque a quello che ancora adesso si definisce una guerra, di guerra si parla
1432130	1437610	Ecco, in un momento però in cui il maggior partito della sinistra italiana non è più al governo
1449290	1453490	Si può rispondere rapidamente
1453490	1463870	Non mi è facile commentare una dichiarazione del Presidente degli Stati Uniti dalla quale emerge semplicemente ciò che era prevedibile
1463870	1469490	Cioè che gli Stati Uniti stanno preparando una risposta militare
1471890	1482490	Quando avrò conoscenza dei termini di questa risposta militare sarò in grado di commentare e di valutare in primo luogo la risposta
1482810	1492810	Devo dire che è mia opinione, l'ho espressa già per iscritto e credo che sia un'opinione nulla a fatto originale
1493670	1498810	Che una risposta militare in un'occasione come questa sia necessaria
1499690	1509710	E che l'Europa, perché questo è un problema che riguarda l'Europa, deve rendersi conto di qual è la posta in gioco
1509710	1519270	Perché la propensione degli europei ad essere solidale con i morti ma ad avere dei problemi quando poi la solidarietà è con i vivi
1519270	1525410	Questo è notoriamente davanti a noi
1528110	1544410	Deve essere chiaro, vede, davanti a queste azioni terroristiche, vi è chi dice che si è indifesi perché a differenza di quello che accadeva nelle classiche guerre non c'è deterrenza
1546270	1551410	Sono kamikaze, vanno ad uccidersi, la deterrenza non funziona
1551550	1561550	Questo è un atteggiamento sbagliato che ci espone passivamente ed espone tutte le nostre collettività dei rischi giganteschi
1561550	1573550	E chi organizza i kamikaze sente la deterrenza perché vuole vivere, vuole organizzare questo tipo di azioni
1573550	1583550	Chi finanzia questo tipo di azioni vuole vivere, vuole continuare la sua vita ordinaria per finanziare questo tipo di azioni
1583770	1594190	La deterrenza non funziona nei confronti dei kamikaze, funziona nei confronti di coloro che li mandano a morire e ad uccidere altri
1594190	1598770	E allora è necessario farla funzionare
1598770	1610910	So che questo è duro, so che questo è duro, ma so anche quanti morti innocenti ci sono, compresi italiani
1610910	1620030	So quante vite si potrebbero in futuro distruggere di altrettanti innocenti se non intervenisse
