start	end	text
0	6860	In quanto sulla vicenda Abu Omar, sentiamo quello che è dichiarato fuori dall'Aula del Parlamento il ministro degli interni Giuliano Amato
30000	40160	Io lo considero un tema centrale perché sennò fino a quando non lo chiariremo lui mi può dire no questa è un'operazione di polizia internazionale
40160	48660	e io gli replico no questo è sequestro di persona dice ma gli Stati Uniti hanno agito insieme agli italiani
48660	57660	non hanno agito da solo se questa ipotesi di spataro risulta corretta e quindi ha un'operazione a maggior ragione di polizia internazionale
57660	64620	e io rispondo no è sequestro di persona con l'aggravante del concorso del pubblico ufficiale capite?
64820	73900	Ecco questo tipo di problema noi dobbiamo affrontarlo dando una risposta certa cioè il nostro operatore dei servizi deve poter sapere
73900	85860	che per esempio un'operazione come questa è comunque illegittima e quindi sarà perseguibile mentre se si tratta di rubare non una persona un documento
85860	89860	ecco nessuno lo imputerà mai di sequestro di documento
90640	97060	Invece sul fatto che poi debbano rimanere sempre due strutture anziché una cosa che poi sia discusso a tutta la precedente
97060	109920	Questo è un grande tormentone appunto oggi se in Italia si prova a fare il servizio unico si pone magari un problema vero ma difficilmente si approda
109920	121920	Lo dico da osservatore da lunghi anni di queste vicende ci possono essere obiettivi massimi e obiettivi minori certo un rafforzamento del cesis non guasterebbe per cominciare
