start	end	text
0	7440	Nel solco di quella delega in bianco, delega totalitaria data al manovratore, data a chi
7440	14200	comanda per cinque anni senza contropoteri, la magistratura sarebbe uno di questi contropoteri.
14240	23240	Ecco, io proprio per immaginare un possibile futuro, per immaginare come possa essere il
23660	35860	nostro possibile futuro, quando arriveremo a governare, vorrei lasciare la parola al
35860	43560	presidente Amato chiedendo non tanto cosa è necessario costruire, ma dove è necessario
43560	50160	ripensare l'assetto costituzionale dei rapporti fra i poteri, laddove se ne presenti non
50160	56020	solo una necessità concreta, ma laddove noi vogliamo porci chiaramente come forza
56020	59280	innovatrice, riformatrice della società.
62280	71560	Vorrei riprendere però i temi che loro hanno toccato, perché ci rendiamo conto di dove
71560	80720	sta l'inaccettabilità e l'errore di quello che è stato fatto in questi anni, perché
80720	88640	è qui il cambiamento sbagliato ed è qui che vengono negate radici che noi abbiamo
88640	95620	nella Costituzione della Repubblica e che hanno avuto nel corso degli anni enormi difficoltà
95620	103120	questo è il nostro problema e che poi si riconducono alla nozione stessa di divisione
103120	111960	dei poteri al plurale in paesi come il nostro che per antica tradizione sono piuttosto
111960	125580	abituati all'idea della divisione del potere, cioè che il potere sia unico, che il potere
125580	133440	funzioni pubbliche ma non governano sono in realtà dei rimasugli secondari del potere,
134420	143340	questa è una nozione forte che spesso scatta anche nelle reazioni popolari agli esercizi
143340	152220	sgraditi dei poteri diversi dal potere politico e quindi dobbiamo essere consapevoli di quello
152220	159360	in cui vogliamo credere, specie dopo aver visto in questi quattro anni che cosa succede
159360	167140	prendendo strade diverse, se voi ci pensate quello che ha fatto il governo di centrodestra
167140	178540	poggia su un imbrione diffuso di sentimento populista che può incontrarsi in qualunque
179740	187200	ma questi giudici non fanno un fico secco di niente, fanno vacanze extra lunghe, non
187200	198200	rispondono a nessuno e poi gira gira sono tutti comunisti, allora qual è il senso per
198200	205520	me di dover sottostare a gente del genere, perché è venuto a cercare proprio me, non
206040	210800	ho pagato le tasse, ma uno se ne può anche dimenticare di una cosa, cosa c'entra questo
210800	215940	giudice comunista che mi viene a rompere le scatole, perché mi sono dimenticato di pagare?
218000	225680	Ogni volta che io mi vedo come il possibile destinatario di un procedimento giudiziario
225680	233020	a mio carico sono propenso a ritenere che questi giudici sono gente che se insomma venisse
233020	241320	mandata a lavorare secondo una regola si occuperebbe di cose serie e non di me. Inutile
241320	247040	ironizzare sul fatto che chi governa oggi l'Italia l'aveva pensato 70 volte esattamente
247040	252060	in questi termini il problema ed avendolo pensato 70 volte in questi termini ha cercato
252060	258680	di risolverlo esattamente su questa base, cioè cercando di far leva su questo sentimento.
259520	269360	E questo sentimento se voi ci pensate è tanto diffuso quanto contrastante con l'atteggiamento
269360	276280	che le medesime persone hanno tutte le volte che subendo un torto cercano qualcuno che
276280	283200	glielo risolva, vanno dal giudice. L'Italia è il paese dove se ti bocciano il figlio
283200	288260	magari giustamente tu ricorri dal giudice perché è impensabile che tuo figlio abbia
288260	294480	una ragione per essere bocciato e quindi lo vuoi promosso con sentenza del TAR e se
294480	298940	magari il TAR non te lo promuove è perché è comunista il presidente del TAR, a quel
298940	305640	punto la cosa gira esattamente dall'altra parte, ma ecco in ciascuno di noi c'è questa
305640	312460	specie di ossimoro o di sentimento misto, chiamatelo come volete, una disponibilità
313260	321540	ad andar dietro a quel sentimento corrosivo che nega la dignità della funzione del giudice
321540	328060	e allo stesso tempo a sentire l'invincibile bisogno che se c'è un torto che mi viene
328060	335260	fatto ci sia qualcuno che abbia il potere di accorgersene e di ripararlo a mio favore
335260	343440	e questo qualcuno è necessariamente il giudice. In genere noi non usciamo da questo doppio
344440	353680	sentimento, mia convenzione sulla base dei principi di fondo del nostro ordinamento è
353680	360600	che noi dobbiamo costruire il nostro rapporto con la giustizia e il nostro ordinamento della
360600	367600	giustizia sulla base della seconda parte di questo sentimento, non sulla prima parte,
369020	379320	su quel bisogno che avvertiamo quando ci succede qualcosa che ci sta sottoponendo ad un evento
379320	385840	che sentiamo come ingiusto sia esso un evento oggettivo sia esso un evento dovuto alla
385840	392840	volontà prevaricante di qualcuno su di noi che ci sia una istanza nel sistema pubblico
393400	399700	che rimette a posto le cose, che accerta la verità, che dice che io non ho rubato perché
399700	406420	io sono una persona per bene, che dice che io sono figlio suo anche se lui non mi vuole
407080	415020	riconoscere ma è giusto che venga accertato che io sono figlio suo o che dice che quel
415020	421800	bene appartiene a me perché io ci ho lavorato per averlo, ecco sento una parte della mia
421800	427800	vita che dipende dall'accertamento della verità sulla mia vita, la funzione giudiziaria
427800	434760	è stata inventata dagli esseri umani esattamente per rispondere a questo nostro bisogno, cioè
434760	441180	piaccia o non piaccia a lui, lui questa missione ce l'ha, cioè lui è quello che la civiltà
441180	447000	umana ha inventato, non lui personalmente, lui l'hanno fatto sua madre e suo padre però
447000	454020	poi a un certo punto ha deciso di fare questo mestiere ma questo mestiere incorpora dentro
454020	464280	di sé una delle conquiste principali della nostra civiltà da quando ci siamo organizzati
464280	470760	di avere qualcuno il cui compito è accertare la verità rispetto a questioni che altrimenti
470760	476860	ci rovinano la vita, a questioni sulle quali noi percepiamo che è in gioco la nostra dignità,
477040	482420	che è in gioco la nostra immagine, che è in gioco il senso di quello che siamo e di
482420	490360	quello che abbiamo fatto, il cuore di questa missione è l'indipendenza di colui al quale
490360	497840	l'avete affidata perché se sentite dentro di voi irrinunciabile questo bisogno di verità
497840	504040	non assolute, non quelle di Marcello Pera ma che riguardano voi, la vostra vita, i vostri
504700	510760	sentimenti, il modo in cui gli altri vi guardano, il modo in cui voi potete guardare gli altri,
511540	520340	questo bisogno è soddisfatto soltanto se qualcuno che non dipende da nessuno sta lì
520340	527820	all'esclusivo scopo di accertare la verità, poi arriveranno gli studiosi di diritto proceduto
527840	531980	e di verità processuale che vi spiegheranno che la verità non esiste, che la verità
531980	538680	non si raggiunge, che la verità della sentenza è la verità processuale, vabbè è ovvio
538680	543880	perché tutte le cose umane si possono costruire su ciò che gli esseri umani sono in grado
543880	549020	di mettere insieme ma alla fine questa è l'unica verità possibile su questa terra
549020	556060	e questa verità ve la accerta questa figura qua chiamata giudice, se non è indipendente
556060	563400	non è in grado di farlo, se non è indipendente scodellerà la verità che fa comodo a qualcuno
563400	570900	e se voi siete i più deboli non sarete mai voi quello in funzione del quale la verità
570900	576880	è scodellata, sarà sempre l'altro quello che l'ha messa in discussione mettendo a
576880	586040	repentaglio voi stessi, la vostra immagine, i vostri sentimenti, i vostri diritti, la
586800	594140	idea della divisione dei poteri e non del potere nasce di qua, chi esercita questa funzione
594140	600400	non può dipendere da altri perché se dipende da altri accade quello che ho detto, il sistema
600400	608580	va costruito garantendo l'indipendenza dell'ordine giudiziario come lo chiama la nostra costituzione
608580	614700	ma anche del singolo giudice e questo che non sempre viene capito ma per bacco ogni
614700	624000	volta che si va a lavorare c'è un capufficio, se la verità dipende dal capufficio allora
624000	635580	non è più quella, i giudici devono essere quanti ne abbiamo, 7.000 erotti, devono essere
635580	644680	9.000 teste che funzionano ciascuna per conto suo e l'unico, l'unica sovraordinazione
645460	652340	che è ammissibile è quella in ragione della quale se voi non siete soddisfatti del giudice
652340	658820	che ha deciso come si dice in primo grado potete fare appello ad un giudice che può
658820	665580	rivedere la sua decisione ma che la deve rivedere con le stesse caratteristiche di indipendenza
667040	673240	evidentemente ha un cervello diverso, valuterà diversamente ma voi vi affidate alla sua indipendenza
673240	680080	se questi fossero in un imbuto gerarchico ma che senso avrebbe avere più gradi di giurisdizione
680080	687160	basta che decida quello che sta sopra, non c'è nessuna ragione di averne tanti, di questo
688040	694380	dobbiamo essere convinti perché se non siamo convinti di questo allora non c'è nulla
694380	701160	che possa poi funzionare rispetto ad una critica giusta secondo me al lavoro che ha fatto
701160	708020	il centrodestra perché il lavoro che ha fatto il centrodestra è stato tutto all'insegna
708020	717780	non di questa indipendenza ma mettiamoli a posto questi comunisti e se non sono comunisti
717780	728120	mettiamoli a posto questi lavativi è ovvio che nel sistema giudiziario ci sono cose che
728120	737020	non funzionano ci sono lavativi c'è gente che lavora di più ma se tu imposti una riforma
737020	745440	in questi termini poi ci sono tutte le conseguenze che vengono fuori non solo ma tu ti trovi
745440	752660	in una inesorabile contraddizione perché tu fai leva su un sentimento non vanno bene
752660	759820	perché sono tutti comunisti che in linea di principio e logica evocherebbe l'indipendenza
759820	767200	come situazione contraria ottimale e invece poi fai una riforma che ti garantisca che
767200	773500	possibilmente li controlli tu anziché controllarli qualcun altro non è che ci arrivi non è
773500	779760	che ci arrivi perché fortunatamente noi abbiamo dei paletti costituzionali abbastanza forti
779760	786460	questa riforma è andata a sbattere in più punto in questi paletti ma più di tanto
786460	796220	non ha potuto fare io insegnavo ai miei studenti quando insegnavo costituzionale che il ministro
796220	803000	della giustizia è il furiere del sistema ed è questo il ruolo fondamentalmente che
803280	813180	deve garantire che ci sono le infrastrutture necessarie ora il furiere ha cercato di diventare
813180	820940	direttore d'orchestra in questi 4 anni più di tanto non può fare però tutto quello che
820940	827980	poteva fare per trasformarsi da furiere inaspirante direttore d'orchestra ha cercato di farlo
827980	839720	ed ecco le cose che ricordava massimo appunto ecco da un lato i fumi ancora più disposti
839720	846720	sulle fatti specie dell'ecito disciplinare dall'altro l'uso dell'azione disciplinare
846720	853560	per il contenuto delle decisioni ma sul contenuto delle decisioni decide il giudice superiore
854120	860980	per grado di giurisdizione non per grado gerarchico cosa cavolo c'entra il ministro della giustizia
860980	869000	se quella decisione non va bene da noi è praticamente tutto impugnabile io mi ricordo una volta che
869000	875620	volevo sottrarre i provvedimenti dell'antitruste secondo me avevo ragione al giudizio per
875620	881100	eccesso di potere del tarmi beccai del fascista per una cosa del genere il che fa capire
881100	886800	che viviamo in un sistema dove tutto è assolutamente impugnabile quindi sarà impugnato quindi lo
886800	894040	vedrà l'altro giudice ecco quindi c'è anche questa reazione contraddittoria che appare
894040	902900	proprio in principio contraddittoria accompagnata poi da quell'altro palmare esercizio come
902900	911040	evidenza di intenti che è stata la sequenza delle leggi ad personam della quale in qualche
911040	920380	modo fa parte la sequenza degli interventi di bricolage sulla giustizia perché se ci
920380	926780	sono stati due tipi di interventi legislativi che hanno caratterizzato il settore in questa
926780	934380	legislatura sono da una parte le cirielli le cirami tutte queste che cominciano per
934380	947960	P come minimo come finalità legislativa e poi le leggi di intervento minuto cioè questo
947960	955400	voleva riformare tutti i codici li ha scassati quasi completamente perché una leggina dopo
955400	962840	l'altra ha ficcato un granellone di sabbia in un ingranaggio modificando il processo
962840	970000	per direttissima su questo infilando una diversa disciplina della recidiva su quest'altro modificando
971040	978360	un congegno procedurale su una rotella sola anziché sull'insieme e quindi questi sistemi
978360	986520	molto delicati che sono il processo nel suo insieme figure di reato correlate fra di loro
986520	994700	e hanno finito per essere esposte a questi bastoni infilati di traverso che oggi chi
994700	1002180	fa il mestiere di giudice non sa neanche in che modo mettere insieme ora questo è tutto
1002180	1008560	completamente sbagliato in questo senso è vero che questo deve essere profondamente
1010620	1016500	modificato. Noi dobbiamo essere convinti delle ragioni
1016520	1024440	per cui è sbagliato io insisto molto su questo punto io sono dentro di me permettetemi di
1024440	1036100	dirlo in qualche modo non completamente certo che siamo tutti veramente persuasi che se
1036100	1043180	i giudici non sono davvero indipendenti non servono a noi ecco di questo noi dobbiamo
1043180	1050180	essere veramente convinti perché la tentazione di credere che il sistema potrebbe funzionare
1050980	1057820	meglio essere più efficiente se essi sono un po' meno indipendenti questa tentazione
1058460	1069140	c'è c'è anche tra di noi perché la mancanza di indipendenza esterna è la stessa cosa
1069140	1076200	della mancanza di indipendenza interna il sistema dei concorzi che viene adottato appunto
1076200	1084520	oggi e che ricordava lui per primo io non sono soddisfatto del sistema com'è cioè di questo
1084520	1092200	ruolo aperto senza alcun tipo di possibile verifica che è esattamente quello che permette
1092200	1099120	a noi in università dopo aver vinto il concorso a cattedra di dedicarci al canottaggio a
1099140	1106540	arrivando ciò non di meno ai massimi dello stipendio senza alcuna verifica ulteriore
1106540	1113100	cioè questo non è giusto che accada se occorre che il sistema abbia degli stimoli al suo
1113100	1122060	interno sufficienti a selezionare il meglio ma il meglio non è quello che sapendo che
1122060	1129000	poi dovranno giudicarli quelli là decide in conformità a come quelli là dovranno
1129140	1136320	decidere sulla sua carriera quelli della mia generazione si ricordano che prima che
1136320	1143500	la costituzione repubblicana entrasse davvero in vigore dovettero passare due generazioni
1143500	1150980	di giudici di cassazione e se la costituzione cominciò effettivamente ad entrare in vigore
1150980	1158980	lo si deve a quei giovani che avevano studiato dopo l'entrata in vigore formale della costituzione
1159140	1166960	e che non avendo remore di carriera avevano anche se allora la legge gliele avrebbe date
1166960	1172620	avevano il coraggio di decidere così come pensavano ed era il contrario di ciò che
1172620	1180620	pensava la cassazione dell'epoca allora se voi fate venire meno questi meccanismi e invogliate
1180620	1188180	al conformismo come veniva detto fin dall'inizio voi vi private della cosa di cui avete più
1188180	1193680	bisogno di avere dei giudici che ragionano con la propria testa e non con la testa di
1193680	1200120	chi li potrà giudicare loro per fargli guadagnare qualche lira di più quindi un sistema lo
1200120	1208900	dobbiamo trovare ma non è quello che in questa occasione qui è stato trovato cioè la preservazione
1208900	1216540	dell'indipendenza come chiave fondamentale per avere non tanto un ordinamento giudiziario
1216540	1222320	che funziona quanto una giustizia che serve perché la prima cosa è che serva perché
1222320	1229040	se non serve può anche non funzionare una volta che abbiamo dato le condizioni essenziali
1229040	1235900	perché serva a quel punto possiamo su questa premessa e senza alterarla occuparci delle
1235900	1244080	condizioni per farla per farla funzionare ora io sono tra quelli convinti che quando
1244080	1251280	noi intanto vabbè per fare una migliore riforma istituzionale bisognerà sbarazzarsi
1251280	1258760	di questa che è ancora lì insomma non è che non è ancora lì io mi auguro che loro
1258760	1264120	non riescano ad approvarla in questa legislatura se ci riescono dovremo fare un referendum nella
1264120	1270400	prossima per eliminarla perché fino a quando è lì non possiamo cominciarne un'altra
1270400	1281760	ma nel nostro lavoro appunto i rapporti tra la magistratura e il potere politico e tra
1281760	1288520	le autorità quasi giurisdizionali perché ci sono anche loro e il potere politico deve
1288520	1297380	essere di assoluta indipendenza io devo dire che qui e ora la smetto stiamo assistendo
1297380	1306820	a dei fenomeni a cui noi non dovremmo in alcun modo collaborare che a prescindere dai dati
1306820	1317640	ordinamentali e legislativi stanno lentamente trasformando le autorità indipendenti in
1317640	1327040	seconda carriera di chi sta lasciando la carriera politica ecco questo mi auguro che quando
1327040	1334180	ci sarà la legislatura di centro-sinistra questo veramente si porrà fine perché il
1334180	1339780	tipo di cultura e il tipo di lealtà che si determinano a quel punto non sono quelle
1339780	1353160	proprie delle autorità indipendenti sì appunto poi uno che è entrato nell'autorità garante
1353160	1361540	della privacy aveva un procedimento penale per violazione della privacy l'unica giustificazione
1361540	1366640	era che se non era competente lui chi altro era competente in materia di privacy lui
1367740	1375620	qualcosa ne sapeva quindi qui dobbiamo stare molto attenti appunto noi stessi a quello
1375620	1382040	che facciamo a non collaborare a questo tipo di trasformazione io su questa premessa sono
1382040	1387800	pronto a discutere di tutto mi fermo qua ne dovremo parlare ne devono parlare loro
1387800	1393200	che sono più tecnici di me in queste cose un consiglio superiore che deve funzionare
1393200	1399180	meglio ci sono molte azioni disciplinari che sono pretestuose ma ce ne sono che non
1399180	1405120	sono pretestuose e vanno in cavalleria anche loro quindi io mi aspetto che il consiglio
1405120	1412020	superiore di magistratura funzioni meglio dell'ordine dei giornalisti e cioè non sempre
1412040	1419320	difendere i propri ma dimostrare ai propri che quelli che sbagliano vengono colpiti
1419320	1424440	ed è giusto che sia il consiglio superiore perché se non lo fa il consiglio superiore
1424440	1431340	cresce la tentazione di farlo fare a qualcun altro quindi alla fine questo diventa controproducente
1431340	1441640	meccanismi che attengono però proprio alla vita complessiva del sistema giudiziario che
1442640	1448920	garantiscano una qualche forma di verifica nell'andare avanti e non siano il cosiddetto
1448920	1454820	ruolo aperto senza io sono contrario devo dire alla separazione delle carriere sono
1454820	1466740	proprio contrario perché non vedo la ragione per non avere dei pubblici ministeri magistrati
1466740	1474300	di avere un raddoppio dei commissari di polizia e quindi di avere una situazione ingestibile
1474300	1480540	sul piano delle indagini per il rapporto che si viene a determinare tra un pubblico ministero
1480540	1489180	poliziotto e un poliziotto poliziotto infine ed è evidente se tu vuoi riformare insomma
1489180	1494980	non si può fare la riforma dell'Alitalia da quel che vedo se non c'è l'accordo di
1494980	1502180	tutti i sindacati dei lavoratori all'Italia è possibile pensare di intervenire in quella
1502180	1509360	cosa specialissima che è l'ordine giudiziario facendolo di proposito contro i magistrati
1509360	1514120	cioè questo è di per sé una disennatezza perché comunque la tua riforma la dovranno
1514120	1520460	applicare loro se tu gli fai capire dalla mattina alla sera che il senso della riforma
1520460	1526540	è tunirli ma per quale ragione dovrebbero sentirsi motivati ad applicare la tua riforma
1526540	1533900	questo è una cosa che non accadrà mai e questo non significa far autoregolare il regolato
1533900	1540560	ma in questa situazione tu hai bisogno che abbia capito e condiviso gli scopi fondamentali
1540560	1546200	perché poi gli dovrà applicare lui insomma non sono complesse le regole che dobbiamo
1546200	1553240	applicare noi nella prossima legislatura è stata al di là dell'incredibile l'esperienza
1553240	1555900	che abbiamo vissuto in questa legislatura
