start	end	text
0	11440	E questo, quando uno lo presenta al direttore de la ASL, lui capisce da solo, non c'è nulla
11440	20880	di politico nel cromatismo. Poi, guarda, io sarò anche invecchiato, ma che il rosso sia
20880	29440	il peggio io non lo ammetterei mai, e quindi lì il rosso è il peggio. Quindi non è quello
29440	45240	il significato. E quindi questo ci può dare molto, ben guidato. La soddisfazione del
45240	53060	cittadino. Qui operano diversi fattori. Alcuni hanno a che fare col costume nazionale, perché
53060	61480	noi siamo fatti in un certo modo. Un episodio di malpractice a Firenze, quella povera donna
61480	69620	che sbagliò, mischiò, sovrappose quelle due analisi, è chiaro che poi finisce per
69620	80080	avere effetti devastanti. Vi ripeto, noi misuriamo il ciò che non va con gli errori del nostro
80080	86040	sistema che c'è. Altri Paesi misurano ciò che non va col fatto che non c'è cura per
86040	93200	niente e quindi non c'è possibilità di errore. Cerchiamo di mantenere sempre una realistica
93940	99680	percezione di questa differenza. E noi stessi abbiamo settori, vi ricordavo alla fine del
99680	106300	suo intervento Olivia, sui quali ci dobbiamo impegnare di più e sui quali so che questo
106300	115560	osservatorio partecipato che Ignazio ha impiantato ai italiani europei intende soffermarsi dopo
115560	124060	questa prima overview sui grandi pilastri di cui è stata testimonianza questo. Però noi
124060	130920	qui dobbiamo fare due cose fondamentali e chiudo immediatamente così siamo in anticipo di
131560	140740	La prima, esiste un problema proprio in ragione della complessiva qualità delle cure che
140740	151580	noi offriamo ai nostri concittadini di moderare le aspettative sul sistema sanitario. Si sta
151580	160440	diffondendo anche da noi l'idea che sia mal practice sanitaria quella che non ha portato
160440	172880	alla mia guarigione. In altre parole si comincia ad allargare la nozione del medico come attività
172880	181100	di risultato e non di prestazione, per dirla con parole di diritto privato. E per Bacco
181100	186820	non è così, è molto lusinghiero che siamo arrivati a questo punto. Significa che abbiamo
186820	193860	fatto dei passi da gigante rispetto ai tempi in cui il chirurgo era il barbiere ed erano
193860	201820	in fondo alcune decine di anni fa, non centinaia di anni fa. Però diamoci una calmata, dobbiamo
201820	210340	educare i cittadini al fatto che il sistema sanitario assicura loro le migliori cure possibili,
210340	216240	ma non sempre può garantire, anzi non deve garantire la guarigione, non deve assumere
216240	224200	l'impegno di garantire la guarigione. Perché non è questo, è fare il possibile per curare. Questo
224200	229240	è un punto importante, anche perché sennò poi l'attività del medico diventa difficile,
229480	236880	pericolosa e costosissima in termini assicurativi come sappiamo dagli Stati Uniti. La seconda cosa
236880	245640	è interagire. Questo è fondamentale. Se c'è qualcosa che la politica può fare di utile,
245900	254280	oltre a organizzare il sistema nel suo insieme, a organizzarne le regole, destinare le risorse che
254280	259500	peraltro non sono sue, ma sono quelle dei contributi di tutti i cittadini che noi abbiamo
259500	268960	la responsabilità di amministrare e di organizzare le valutazioni, deve organizzare l'interazione.
269660	277900	L'informazione sul ciò che è il sistema, ciò che può dare, ciò che sta dando come valutato,
278680	286200	cambia il cittadino. Guardate, noi siamo gente che è subito pronta a dire, succede solo in Italia,
286200	293540	ma che schifo questa roba qui, ma non si è visto un Paese al mondo dove succede quel che succede qui,
293740	299840	dice quello che torna da Chitro dove ha perso la valigia, ma se l'ha persa a Roma, succede solo a
299840	307600	Roma, eccetera. Guardate, ve ne è successa una. Ieri tengo un articolo sul Corriere dove un
307600	315920	giornalista ha fatto una cosa complicatissima per riuscire ad arrivare sotto falso nome in curva
315920	326020	durante una partita. Ora credo che Viminale abbia già spiegato che cosa lui ha fatto e come non ci
326020	334100	fosse nulla di particolarmente sorprendente per noi in quello che aveva fatto, ma vi dico quali
334100	341800	erano i titoletti che raccontavano la cosa e non è il giornalista, è proprio il modo italiano di
341990	354330	vivere una vicenda simile. I controlli farza sugli Stadi fa acqua il decreto pisano. Il minimo di
354330	363330	critica tende ad essere questo. Ma se ci si discuta e ci si ragiona, l'italiano è un essere
363330	371130	assolutamente razionale. La regione razio ha introdotto e quanto vorrei che si generalizzasse
371130	378910	questo strumento del deliberative poll inventato da un professore texano di nome John Fishkin che
378910	384710	è una tecnica molto semplice. Io prendo delle persone e gli faccio una domanda cosa pensano
384710	391130	sui sondaggi e questi dicono le sciocchezze più inaudite in genere perché non sono informati.
392970	398310	Se mi permettete di dire, fessi siamo noi che prendiamo questa come l'espressione della volontà
398310	407330	dei cittadini e ci accodiamo subito al sondaggio. Se uno poi li riprende e li sottopone ad un
407330	414470	processo informativo su temi su cui chiunque di noi se non li conosce dice un sì o un no non informato,
415670	425070	molte opinioni cambiano. Sul sistema sanitario la regione razio ha fatto varie domande. Una di
425070	433510	quelle che mi colpirono di più era siate d'accordo a ridurre i posti letto nella regione. La risposta
433510	440110	assolutamente maggioritaria è no, perché la mia prima reazione di cittadini non informati mi vogliono
440110	445910	fregare, mi vogliono ridurre i posti letto, mi vogliono mettere su marcia piede. Sottoposta
445910	453230	a discussione con degli esperti che dimostrava che i posti letto erano per certe cose in eccesso che
453890	459990	poche ore dopo una serie di interventi, tu torni a casa tua e non ne hai più bisogno, che si fa in
459990	467070	dei ospital quello che prima si faceva quando ti squarciavano tutto, prima che le costole ritornassero
467070	473630	apposta ai vogli a te. Tutta questa roba qui è e quindi quei soldi si possono utilizzare diversamente
473630	480110	per darti altre prestazioni. Ovviamente la maggioranza è cambiata opinioni. Partiamo da
480110	489590	questo. Non ci trattiamo a pallettoni. Questi politici sono assolutamente cretini e noi a
489590	500690	nostra volta dire questi italiani incarnati da giornalisti misterici non fanno che. Così è blow
500690	508650	up. Discutiamo come abbiamo fatto oggi. Organizziamo altre occasioni e allora
508650	515190	vedrete che insomma siamo un Paese migliore di quello che diciamo di essere.
515190	535110	Bene, figli, grazie a tutti per essere stati qui tutto questo tempo e naturalmente grazie
535990	540390	a ministro Turco, Amato e al professor Marino. Arrivederci.
