start	end	text
4640	10060	Le interviste alla gente che avete sentito insomma in copertina ci offrono naturalmente
10060	14620	parecchi spunti per parlare dell'Europa, avete sentito soprattutto la gente ponere
14620	21180	l'accento sulla differenza, la grande questione, Europa dei popoli, Europa dei mercanti, dei
21180	27080	banchieri, noi stasera però dobbiamo parlare di un banchiere molto importante del quale
27240	34440	si è parlato moltissimo, sapete benissimo, in queste settimane, in questi mesi, quindi
34440	40120	è un argomento di estrema attualità, oggi l'attesa relazione del governatore della Banca
40120	47040	d'Italia, Fazio, al Comitato interministeriale per il credito e per il risparmio, sostanzialmente
47600	53240	Fazio si è difeso, ha detto la vicenda ben nota anche questa credo la conoscete, la vicenda
53240	58360	delle scalate bancarie che ha tenuto Banco durante tutta l'estate, Fazio ha detto nulla
58360	63900	e ha avvenuto fuori dalla legge, per cui da questo punto di vista si è difeso, ci sono
63900	69900	molte reazioni soddisfatte da parte di vari esponenti della maggioranza, molto critiche
69900	76880	da parte del centro sinistro, però noi qua abbiamo tre autorevoli esponenti dello schiaramento
76880	81320	di opposizione, quindi la prima cosa che mi pare giusto per doveri giornalisti di chiedere
81320	87040	loro è che impressione ne avete avuto e poi sostanzialmente la domanda chiave, perché
87040	91820	insomma visto che siamo in televisione cerchiamo di arrivare subito al noccio dei problemi,
92900	98720	Fazio, amato, se ne deve andare che cosa deve succedere, qual è la sua posizione? Io non
98720	108360	lo so in questo momento e non esprimo neanche un'opinione sulla conformità o diformità
108360	115360	dalla legge di quello che Fazio ha fatto, questo lo sta giudicando la magistratura,
117220	125360	ci sono altri organismi, lo dovrà valutare lo stesso CICRE, io dico che il governatore
125360	133340	della Banca d'Italia è il massimo reggitore di una delicatissima istituzione che è posta
133340	141880	al vertice di un sistema, il sistema bancario e che deve la sua forza e il suo prestigio
141880	150460	alla trasparenza con cui sa operare, alla imparzialità che rivela nei confronti degli
150460	158520	operatori, è importante che tutti ci possiamo fidare delle autorità cosiddette indipendenti
158520	165960	perché se emerge a prescindere dalla legge che un'autorità indipendente dipende da qualcuno
165960	178660	o da qualcosa, a quel punto cade completamente la fiducia, allora se in presenza di un ingresso
178660	186460	principale dell'edificio in cui questa autorità indipendente opera, uno dei protagonisti del
186460	192840	mondo bancario ha accesso dalla porta di dietro per non farsi vedere e lo ha perché
192840	197800	glielo ha telefonato il governatore, questo governatore ha fatto una cosa che non va bene,
197920	205460	che non si deve fare, che contrasta con le aspettative che io ho su di lui, se si trova
205460	214760	a presiedere un incontro di banchieri non può uscire da questo incontro prendendone uno
214760	221620	che si mette alla sua destra, l'altro che se lo mette alla sua sinistra e fa una passeggiata
221620	231820	nel Paese in cui fa vedere chi sono i suoi preferiti, se lui sta gestendo una operazione
231820	239680	come è accaduto per la BNL alla quale sono interessati dei banchieri chiamati patto e
242720	250080	lui riceve esclusivamente i banchieri del contropatto e non vede mai quelli del patto,
250140	255960	quelli del patto hanno ragione di ritenere che lui stia dalla parte del contropatto,
256480	263120	allora queste sono ragioni sufficienti per dire una persona che si comporta così, io
263120	267860	non capisco perché, perché io ho avuto Fazio che ha lavorato con me quando ero ministro
267860	274360	del Tesoro, quando era Presidente del Consiglio ed era una persona di qualità che si occupava
274360	280340	di economia internazionale con grande competenza, che diavolo gli sia successo non sono in grado
280340	288040	di capirlo, quali grandi dote abbia questo signor Fiorani che riescono ad essere così
288040	294600	efficaci nei confronti dell'intera famiglia Fazio io non sono in grado di dirlo, ma se
294600	300980	il governatore della mia banca centrale e la sua famiglia cadono tra le bacche, a suo
300980	307500	tempo rifiutava addirittura l'Europa perché diceva che era l'Europa dei mercati, l'Europa
307500	316760	del capitale eccetera, questo tipo di distinzione e così anatema contro l'Europa perché era
316760	324580	contro l'Europa quando l'Europa nacque, insomma si è poi molto molto ridotta da questa distinzione,
324600	334480	l'Europa nella sua forza, da quando in particolare larghissima parte della sinistra, tutta quella
334480	342000	che è diventata o che già era riformista ha saputo riconoscere nel mercato non la panacea
342000	349440	di tutti i mali, ma un meccanismo che può produrre efficienza economica a beneficio
349440	358620	dei consumatori sottoposto a regole che garantiscano che sul mercato non sono i potenti a fare
358620	366900	il bello e il cattivo tempo, ma attraverso l'antitrust e tutte le altre regole si garantisce
366900	374860	che il più possibile ci siano più produttori che producono a prezzi il più possibile vicini
374860	382280	di un mercato concorrenziale. Tutta la vicenda europea è stata una vicenda di costruzione
382280	391880	di un mercato concorrenziale ed è servita proprio a rimuovere ostacoli, a rimuovere rendite.
392440	401040	Oggi se vogliamo capire che cos'è un mercato concorrenziale, capiamo che è un mercato sul quale
401040	410480	non si possono formare rendite, ma si è costretti a vendere a un prezzo il più possibile vicino ai costi,
410620	417000	tant'è vero che quelli che vivono di rendite e basta sono un po' squalificati dall'insieme.
417720	424860	Un problema, al di là di quella distinzione manichea, ha finito per sorgere negli ultimi anni
424860	430860	in ragione di fenomeni anche più grossi di noi come la cosiddetta globalizzazione
431640	440720	che hanno dato la legittima sensazione che i meccanismi economici ci stessero scappando di mano
440720	451120	e che ci fosse un mercato più grande della stessa Europa in nome delle esigenze del quale, delle ragioni del quale,
451120	460280	le garanzie del lavoro, i livelli salariali, la possibilità stessa di trovare lavoro qui in Europa
460280	467760	venissero abbassate tutte in ragione della concorrenza globale.
467880	476840	Qui c'è stata secondo me una giusta rivolta di molti europei i quali hanno detto in lingue ben più forti
476840	485580	di quella che posso usare ora io, quello che io penso e io penso che noi ci dobbiamo adattare al mondo,
486200	493400	ci dobbiamo adattare al fatto che la Cina c'è, ci dobbiamo adattare al fatto che il lavoro per tutta la vita non lo possiamo avere,
493820	502340	ci dobbiamo adattare al fatto che dobbiamo avere professionalità perché altrimenti Mamma Monte dei Paschi o altre mamme,
502340	510760	io vengo dalla Toscana, 15 queste vecchie cose, se ti si laureava il figlio al Monte dei Paschi 20 anni fa te lo assumeva comunque,
510940	519640	se tu eri tra Grosseto e Siena, ora queste cose non accadono più, però porca miseria deve essere anche il mondo che si adatta a noi,
520020	528340	noi non possiamo portare le condizioni del lavoro in Europa al livello in cui sono nei paesi dell'estremo oriente
528340	538400	dove ancora i diritti del lavoratore non ci sono affermati, questo noi non lo possiamo fare, questo noi non lo dobbiamo fare
538400	546120	e allora ecco, a metà o meno di quell'operazione, per dire che a sinistra c'è una questione morale io mi zittisco subito,
546180	554660	non discuto l'operazione e dico che la questione morale è stata una vergognosa invenzione che non ha nessuna ragione di essere posta
554660	568660	nel centro-senistra italiano, punto e basta. Se al netto di questo genere di osservazione qualcuno mi chiede, e questo è un ragionamento economico,
569700	583100	Unipol ritiene di avere un interesse, e lo ha, a legarsi ad una banca per fare quel tipo di combin economico-finanziaria che è il Banco Assicurazione,
583100	591100	che è una combin che molti hanno fatto, che fra l'altro vi faccio notare, interessa più le banche che le assicurazioni,
591860	601100	io me ne sono viste passare tante davanti nei tempi in cui cominciarono a partire, io ero presidente dell'antitrust e ponevano sempre problemi di concorrenza,
601100	613400	capì che interessavano più ancora le banche che le assicurazioni perché i margini che le banche avevano sulle loro operazioni tipicamente bancarie
613400	626040	tendevano a stringersi e per loro il margine delle polizze vita ed altro genere era molto interessante per recuperare risorse,
626040	634100	comunque è un'operazione che ha un senso, però questa può essere una domanda legittima, ma io l'ho fatta come domanda,
634760	648860	ed è ben possibile che Unipol abbia la risposta, Unipol si trova a comprare questa banca ad un prezzo che gli speculatori immobiliaristi che vivono non di lavoro ma di rendita,
648860	661840	hanno fatto lievitare dal valore reale ad un valore che è quasi il doppio, il titolo di BNL valeva tra l'1,3 e l'1,5 attraverso tutte queste manfrine speculative,
666840	678420	comunque gli spagnoli, a me non interessa chi è stato, voglio dire se abbiamo opinioni diverse sugli immobiliaristi io li tolgo anche dalla scena, sono stati gli spagnoli,
678420	691880	comunque si trova a comprare una banca ad un valore doppio circa di quello che vale impegnando molte risorse, impegnando la bellezza di circa 8 mila miliardi di vecchie lire,
691880	703880	allora la mia domanda è quando uno arriva ad impegnare una somma di quelle proporzioni un economista si chiede qual è il costo opportunità di questa operazione,
705860	719400	cioè dovendo impegnare 8 mila miliardi che è addirittura di più di quello che io valgo, non posso non chiedermi con 8 mila miliardi che cosa di diverso ci potrei fare e cercare di fare il confronto.
720320	734900	Cos'è che è andato sui giornali questa estate? La questione morale è la lite su BNL tra Margherita e DS, se noi facciamo prevalere l'elemento della competizione questo è inevitabile,
734900	744140	allora non è colpa dei giornalisti, a me questa storia è colpa dei giornalisti che mettono solo l'elemento di divisione in prima pagina e non l'elemento di unità,
744140	756120	è vero, c'è un po' la storia dell'uomo che morde il cane in questo quadro, ma è vero però che se noi non torniamo indietro sul punto che riguarda la federazione,
756180	765640	noi non rilanciamo prima delle elezioni la federazione dell'Ulivo, noi alimenteremo una situazione nella quale, adesso qualcuno si è inventato la questione morale,
765640	775640	tra un mese un altro pirla si inventa un'altra cosa, perché non c'è dubbio che andiamo in una situazione nella quale la competizione è l'elemento prevalente.
778060	788660	Non le chiedo chi è il pirla, no nessuno, uno ricomorando che per interesse dei DS sollevo una questione nei confronti della Margherita.
788660	796660	E poi chiudiamo la prima parte e nella seconda anche con l'aiuto dei colleghi riprendiamo un po' i teni europei, però Presidente Amato,
797720	802920	io mi prendo la colpa dei giornalisti perché tento ancora di ribanalizzare questo per cercare di capire,
803100	813460	allora questo è lo schema classico che si riproduce da anni a questa parte, prima si fa centrosinistra, si spacca le ossa pubblicamente e poi tutti a dire così non si fa,
813460	819620	se facciamo così andiamo a dire, bene tutti d'accordo, bisogna fare così, il giorno dopo se ne inventano.
819980	822400	Fino a arrivare a cose impensate come la questione morale,
823180	830460	adesso chissà su che cosa in questi sei mesi, forse sul calcio, come se ne esce fuori?
831160	837340	Ce lo spieghi in una formula, come se ne esce fuori?
838180	847280	Se ne esce sì, ma scherziamo, se ne esce, se ne esce vincendo le elezioni, ma se ne esce prima,
849560	856660	perché io seguivo il filo di quello che diceva Enrico Morando da ultimo,
856660	867720	tra le cose che i partiti, è verissimo che c'è questa tendenza se non prevale la logica cooperativa, prevale la logica competitiva,
868140	877720	queste sono regole addirittura meccaniche, per ora noi abbiamo davanti una vicenda che è cruciale che è le primarie,
877720	884800	per le primarie ci sono numerosi candidati, ma è un dato di fatto,
885040	893720	che è un dato politico fondamentale che di esse, Margherita, Sdì, Repubblicani,
895820	903880	che erano i partiti che si erano riconosciuti nella federazione, hanno un unico candidato che è Romano Prodi,
903880	914260	per cui non c'è niente da fare, questo nucleo che è destinato a lavorare insieme, a tener conto delle ragioni degli altri,
914420	919880	perché attenzione, questa è un'unione e non può mettere gli altri nell'angolino,
920660	928880	deve sapere tener conto delle ragioni degli altri, ma partendo da una impostazione che è quella di questo nucleo,
928880	934120	questo nucleo gli piace o no esiste perché è la politica che lo fa esistere,
934720	939260	è la cultura riformista che si è venuta formando in anni in Italia,
939860	945180	ed eccoli ora impegnati a portare un unico candidato che è Romano Prodi,
945600	955940	la vittoria di Romano Prodi alle primarie, la vittoria dell'impostazione del programma che attraverso le primarie Romano Prodi
955940	964840	espliciterà nel corso delle prossime settimane, sarà necessariamente anche perché sarà convalidato da tutti,
965220	974240	perché saranno gli elettori cittadini che voteranno, sarà necessariamente il cemento con cui noi arriveremo alle elezioni.
974300	979280	Guardate, ora non abbiamo il tempo, c'abbiamo la televisione, bisogna parlar poco,
980280	987500	in quelle belle feste dell'unità di provincia dove io posso parlare quanto mi pare a Piombino, Follonica da dove vengo,
987740	997280	l'altra sera ho raccontato per filo e per segno i vari punti essenziali della politica futura italiana su cui noi siamo d'accordo,
998120	1007460	ma su cui addirittura l'accordo investe l'intera Unione, cerchiamo di smetterla con questo disfattismo che noi sappiamo soltanto litigare,
1007460	1017720	che c'è della sostanza, che è sostanza unitaria ed è sostanza forte, quindi voglio dire dobbiamo farla venire fuori,
1018040	1020240	il compito di Romano è quello di farla venire fuori.
1020540	1028240	Credo che il mondo musulmano saprà arricchire l'Europa come peraltro l'avevano arricchiti gli Unni, l'avevano arricchiti gli Logovardi,
1029160	1031460	credo che sarà una grande e bella avventura.
1032560	1041640	Allora vogliamo cominciare da Pera, come sapete il presidente del Senato ha parlato di pericolo di relativismo culturale in Europa,
1042260	1049700	del rischio che aprire porta all'immigrazione ci faccia diventare tutti meticci, un discorso che ha aperto polemiche molto forti,
1049780	1057460	insomma non molti neppure del centro-destra sono d'accordo con lui, ieri il ministro Pisano ha detto che l'identità europea nasce proprio dai meticciamenti,
1059140	1068460	amato e morando che prima non avete parlato, andiamo incontro dritti e dritti al rischio di guerre, di civiltà.
1070340	1083960	Da agosto si discute di tutto, ma insomma quello è un messaggio per quel che capisco io profondamente anticristiano,
1085240	1096120	e ho apprezzato molto il fatto che i giovani che lo hanno sentito al meeting di Rimini sono rimasti molto scossi
1096120	1105420	e che ci sono state reazioni critiche da diversi esponenti della Chiesa, per una ragione molto semplice,
1105420	1114420	perché Pera dice una cosa giusta quando dice che l'Europa non può esistere se non ha un'identità, perché nessuno esiste se non ha un'identità,
1117300	1129220	e dice anche una seconda cosa giusta quando dice che in questa identità i valori cristiani che sono parte della religione di buona parte degli europei
1129220	1136220	e comunque della cultura anche degli europei che non sono cristiani entrano nel formare questa identità.
1137240	1148720	Comincia a diventare blasfemo in senso tecnico nel momento in cui costruisce un'identità fondata sui valori cristiani contro altri,
1148720	1162480	perché il cristianesimo è per definizione un insieme di valori e di principi religiosi che riconoscono l'umanità dell'altro chiunque esso sia
1162480	1170720	allo stesso modo in cui riconosce la propria, perché il cristianesimo è la religione fondata sull'amore e non sull'odio,
1171940	1183000	perché papi diversi hanno insegnato che c'è il segno di Dio in ogni uomo e ogni uomo porta in sé il segno di Dio.
1183320	1193360	A quel punto utilizzare i valori cristiani per dire difendiamoci dagli altri con questa bandiera significa fare un'operazione
1193360	1204860	che abbatte e umilia il senso dei valori cristiani e fa rinunciare. Non c'è una posizione comune che io ricordi.
1207080	1213340	Questo è eccessivo. Intanto no, lei non ha da farci perdonare domande.
1213460	1226860	Io ho avuto un momento di reazione del quale mi scuso, quando parlavo di un aumento del prezzo delle azioni di BNL attribuendola agli immobiliaristi,
1226860	1242320	lei ha detto che c'è stata l'offerta degli spagnoli. L'offerta degli spagnoli è arrivata dopo che gli immobiliaristi avevano fatto lievitare il valore del titolo acquistandolo nel cosiddetto contropatto.
1242320	1246540	Per questo io dicevo ci sono gli immobiliaristi di mezzo.
1246800	1250080	Questo riprendiamo nello stand della Coppa.
1250980	1269080	Quello che lei dice, intanto non per ribadire un partito preso che è stato proprio del centrosinistra, ma per ribadire quello che Timothy Gordon-Ash ha scritto oggi su Repubblica,
1269080	1286420	negli Stati Uniti è ormai tanto cresciuta da rendere minoritario George W. Bush la consapevolezza che la guerra in Iraq è stata un disastro per loro e che non è servita a combattere il terrorismo.
1286420	1303900	Quindi mettiamola, perché qui c'è stato un détour nella lotta al terrorismo rappresentato dagli uomini, dalle risorse, dalle energie impegnate in Iraq,
1303900	1320100	che ha potuto solo dare del fiato a Bin Laden consentendogli addirittura di acquisire l'Iraq come zona di manovra per i suoi, che prima lì non c'erano, c'erano altri briganti che governavano,
1321460	1327240	ma di sicuro non c'era il terrorismo che entra in qualunque paese del mondo.
1327240	1331440	Mi scusi Presidente, non basta più dire soltanto che è stata sbagliata?
1331920	1345960	No, io intendo dire che lei no, certo che non basta, ci mancherebbe altro, ma siccome lei dice l'Europa è stata divisa sull'Iraq, l'Europa è stata divisa sull'Iraq che non era una risposta al terrorismo.
1345960	1368080	Se cominciamo a metterla così, ci accorgiamo che la divisione dell'Europa è stata nei confronti di una guerra che ha posto a noi europei il problema di essere un forte, con conseguenze imprevedibili, impegno militare che secondo molti di noi serviva a rafforzare il terrorismo e non a ridurlo.
1368080	1377000	Quindi questo lascia fuori il discorso dell'allora qual è la risposta europea in materia di terrorismo.
1377060	1392240	La risposta europea in materia di terrorismo è una risposta, e questo le do ragione, che noi stiamo dando con notevole unanimità, ma la stiamo più predicando che non praticando.
1392240	1417560	Io in questo le do ragione, perché la lotta al terrorismo si fa in primo luogo rafforzando le democrazie nei paesi nei quali queste non ci sono, rafforzando le possibilità educative dei giovani che vivono in regimi islamici affinché non leggano soltanto il Corano,
1418520	1436840	spingendo i riformisti a darsi da fare perché noi non possiamo cambiare quei paesi in democrazie, li devono cambiare loro, quindi in qualche modo una politica molto più attiva, io ho parlato di doroteismo globale per l'atteggiamento dell'Europa rispetto al mondo,
1436840	1455940	in questo siamo d'accordo, il quieta non muovere è stata per troppi anni la nostra politica, siccome l'Egitto è moderato facciamo finta di non accorgersi che lì la libertà di pensiero e di critica proprio non esiste e teniamoci l'alleato moderato,
1455940	1475320	siccome l'Arabia Saudita ci dà il petrolio ed è un paese moderato facciamo finta di non accorgersi che, questo è un modo sbagliato di stare al mondo e rende il mondo estremamente insicuro, ma poi la lotta al terrorismo al punto al quale siamo arrivati è una lotta che si fa nei nostri paesi,
1475320	1498700	evitando di trovarci davanti a situazioni come quella del 7 di luglio a Londra, isolando i giovani che si legano fra di loro nell'estremismo attraverso internet in comunità non reali ma virtuali dalle comunità islamiche che ormai abbiamo al nostro interno,
1498700	1523700	non dimentichiamo che Al-Qaeda ormai è una rete che fa capo a tutti questi giovani sparsi per il mondo e isolarli significa fare una politica di integrazione dei musulmani, integrare quelli che noi abbiamo, renderli partecipi della nostra cittadinanza altrimenti li renderemo solidali dei giovani che poi ci ritroviamo a fare gli attentati,
1523740	1544740	insomma le tecniche sempre quelle sono, le Brigate Rosse furono sconfitte quando larghissima parte della sinistra, oponendosi al terrorismo, desolidarizzò tutta quell'area di confine che c'era tra terroristi a sinistra e li fece restare isolati,
1545120	1560120	non ci sono altre tecniche quindi io intendo dire che se noi riconosciamo la lotta al terrorismo solo nel faccima faccia feroce facciamo un gravissimo errore perché quando ci vuole la faccia feroce...
1560380	1587060	il quale sostanzialmente prova a riassumere, l'ha detto che l'unica via percorribile per fare nel nostro Paese le riforme che necessitano i cambiamenti è il centro, lei ha detto la risposta al giovane sul Corriere dicendo no, non necessariamente, possiamo fare benissimo anche noi, certo è che dopo le lezioni è possibile che i moderati dei due schieramenti possano riavvicinarsi, è diventato centrista, simpatizzante centrista anche lei?
1587060	1616880	No, io non ho espresso un auspicio, ho detto una cosa che può accadere secondo me e che noi dobbiamo saper contrastare, io ci credo al bipolarismo, sono abbastanza vecchio da aver vissuto il centrismo e da sapere che il centrismo dopo un po' va in implosione e diventa in realtà impotente, si paralizza e che oggi non è la soluzione delle riforme che stanno a cuore a Monti,
1617060	1640000	io nel rispondergli dicevo, la prima riforma che Monti ha in testa, eredità del suo stare all'antitrust europeo è la riforma delle professioni, ora non mi venga a dire che Bertinotti è un ostacolo a liberalizzare le professioni, a porre fine alle rendite inaudite che oggi ci sono nel mondo delle professioni,
1640000	1658900	ma ne volete sapere una che io ho saputo giorni fa? Non credevo ai miei orecchi, in una di queste vicende bancarie è stato chiesto un parere, tra gli altri ad un mio collega che io conosco, professore avvocato che si intende di queste cose,
1658900	1680100	il parere consisteva in tre pagine, tre pagine nelle quali egli sosteneva con argomentazioni giuridiche che ritengo sicuramente forti che tutto era legittimo, il parere è stato prezzato un milione e duecentomila euro, un milione e duecentomila euro, allora non mi aspetto che sia...
