start	end	text
0	4300	Siamo diventati un paese medio in un mondo grande ed è un po' come quando
4300	8500	uno rovesce il binocolo, legge i viaggi di Gulliver, ha bisogno di riposizionarsi, di
8500	12600	trovare il giusto passo. Però permettetemi di lasciarvi con un
12600	17320	apprezzamento. Io credo che la politica internazionale, quella europea che faccio
17320	20320	fatica ormai a chiamare politica internazionale, ormai una proiezione di
20320	26500	quella domestica, sia una politica, ripeto, che vive due estremi opposti, cioè
26500	31180	quella di essere, come ha insegnato il capo comico del governo di questi anni, il
31180	35640	palcoscenico in cui si cercano lustrini, pacche sulla spalla col bacchi, stivaletti
35640	39780	a seconda dell'interlocutore, o di essere il capitolo che noi dedichiamo agli
39780	43460	especti del partito perché non si può scrivere un programma senza avere il
43460	48220	capitoletto sulla parte internazionale. Ecco attenzione, io apprezzo la scelta
48220	52720	fatta oggi a Firenze dai democratici di sinistra di aprire con la politica
52720	56480	internazionale e la politica europea, perché rivela un fatto nel quale mi
56480	61940	conosco appieno. L'orizzonte europeo e l'orizzonte mondiale internazionale sono
61940	66800	oggi l'orizzonte strategico e ineludibile nel quale siamo chiamati a
66800	70940	declinare non fatemi dire il vostro, il nostro amore per l'Italia. Grazie.
71440	79460	Grazie. La parola Giuliano Amato, seguiranno Fancelli e Silvana Pisa.
85180	95360	Mamma mia quanta luce c'è qua, com'è sta cosa? Io riprendo proprio dal punto su cui,
95500	101140	se l'avete ascoltato in questo caos un po' serale, comprensibile, siete stanchi,
102180	108620	il punto di Pistelli, il rapporto tra la politica internazionale che non è una
108620	115340	materia per specialisti e non è una materia per grandi potenze, è una parte di voi,
115480	125180	della vostra politica di ciò in cui credete. Comincio per dimostrarvelo rievocando quelli
125180	131620	che erano gli anni in cui io iniziai a fare vita politica, circa quasi 50 anni fa,
131620	139360	quando le relazioni con cui si aprivano le riunioni dei partiti da cui la maggior parte
139360	146060	di noi anziani qua vengono, il Partito Comunista e il Partito Socialista, dalla riunione del
146060	153360	Comitato Centrale a quella dell'ultima sezione, partivano tutte dalla situazione internazionale
153360	159720	e poi scendendo per l'Irami arrivavano alla scelta degli assessori del Comune che magari
159720	167380	si doveva fare. Ora mi direte che non c'è ragione di rimpiangere quei tempi, che soprattutto
167380	174500	nel Partito Comunista tanta attenzione ai profili internazionali in qualche modo presupponeva
174500	181180	quel legame con l'Unione Sovietica e quindi quell'appartenenza di campo che nessuno oggi
181180	188180	impiange e che è oggi da tutti ritenuta un tragico ancorchera di catissimo errore.
189460	196080	Sì, c'era questo che oggi non c'è più, però state attenti, non c'era soltanto questo,
196960	205000	c'era anche qualcos'altro che in modie su premesse diverse dobbiamo ripristinare e dobbiamo
205000	213900	sentire dentro di noi, vale a dire l'essere noi sinistra italiana partecipi di un movimento
213900	221700	più ampio fondato sulla solidarietà con tutti coloro che si battono per un mondo migliore,
221780	230420	di solidarietà con tutti coloro che non si battono perché non sono neanche in condizioni
230420	235640	di farlo ma che di un mondo migliore hanno bisogno perché sono negati i loro diritti,
235920	242980	perché sono negati i loro bisogni essenziali, perché vivono in contesti totalitari e repressivi.
244320	251480	Il che vedete aveva e dà un'implicazione, ed è questa l'implicazione alla quale dovete
251480	260040	pensare, quella di vedere la politica internazionale non tanto e non soltanto come l'arena dei
260040	268000	conflitti e degli equilibri fra gli Stati, ma anche ancora più come la proiezione di
268000	275860	quelle stesse politiche che servono a diffondere quella democrazia e quella giustizia che noi
275860	285880	vogliamo per noi stessi, che noi abbiamo procurato a noi stessi e a cui ogni essere umano ha
285880	293120	avuto l'avventura di nascere a questo mondo. E questo è il senso dell'internazionalismo,
293640	301680	non è una cosa da vecchi legati al marzismo e all'eninismo, è una delle cose più belle
301680	308540	che danno il senso alla politica e ancora più glielo danno nel nostro tempo. Ad alcuni
308620	315900	sembrerà ingenuo davanti alle prospettazioni di politica internazionale come giochi tra
315900	324340	le potenze, ma non lo è, perché se ci riflettiamo bene noi ne abbiamo dato la prova. È stato
324340	331540	ed è ancora questo il principale significato della costruzione europea. Ma che cos'è stata
331540	339500	questa costruzione, se non la ricerca della pace fra i praesi europei non più con gli
339500	346840	equilibri degli eserciti, non più con le alleanze e le controalleanze militari, non più con
346840	361320	i negoziati su questo sfondo delle cancellerie, ma con la creazione di un solido tessuto di
361320	368220	radicamento di forme di coesione sociale fra i nostri Paesi. L'Europa è stata questo
368220	374700	e ha realizzato lo scopo della pace tra i Paesi che erano storicamente tra i maggiori
374700	382020	responsabili delle guerre, che avevano insanguinato il mondo intero con due guerre mondiali nel
383020	392480	secolo, e i padri fondatori dell'Europa hanno fatto attraverso politiche economiche e sociali
392480	400220	la migliore politica estera che la storia abbia mai conosciuto. E se mi è permesso
400220	407720	un inciso voglio riprendere come tema di attualità quello che alcuni hanno toccato, questa coesione
407720	417340	sociale tra i Paesi europei che non venga oggi messa a repentaglio in nome di un rimborso
417340	425420	inglese intangibile dagli altri Paesi europei ad opera di un Primo Ministro socialista.
425540	434260	Questo è davvero difficile da accettare. Vedere un Primo Ministro socialista accusato
434260	441260	dal signor Barroso di voler fare lo sceriffo di Nottingham che rubava ai poveri per dare
441260	450240	ai ricchi ti prende qui nello stomaco. Ed è grave perché tocca quei nuovi Paesi nei
450240	456720	confronti dei quali questa solidarietà è più essenziale e può provocare una frattura
456720	463760	in una costruzione che per anni abbiamo cercato di mantenere unita. Ma vado avanti, se è
463760	471880	stata questa la politica estera con cui abbiamo costruito l'Europa, è ancora questa la politica
471880	478620	estera, si dice, la migliore politica estera europea che abbiamo utilizzato nei confronti
478620	485860	dei Paesi dell'allargamento. Come abbiamo realizzato la stabilità e la sicurezza ai
485860	493800	confini dell'Europa, creando stati democratici ed economie convergenti con le nostre al di
493800	499680	là di quelli che erano i nostri confini. Ora lo so bene che perché gli stessi principi
499680	506160	si affermino in ogni parte del mondo, noi non possiamo allargare l'Europa al mondo intero
506160	512300	e quindi non possiamo avvalerci delle leve che l'allargamento ci offre e quindi tutto
512300	520480	è più difficile, ma fermo deve rimanere l'impianto, dimostrando che nei rapporti
520480	529240	fra i Paesi europei la continuazione della politica non è la guerra, ma è la stessa
529240	540140	politica su più larga scala, noi abbiamo sconfitto Klausiewicz, dobbiamo riuscire a
540140	547660	configerlo nel mondo e questo è il grande impegno della politica internazionale oggi,
548080	556140	muoversi nel mondo ispirati dalle stesse visioni e dagli stessi principi con cui abbiamo costruito
556140	564980	l'Europa e lavoriamo sul suo allargamento, senza candore, con realismo, respingendo l'unilateralismo
564980	570740	della guerra, ma senza escludere che l'uso della forza possa essere in situazioni estreme
570740	579200	necessarie e tuttavia facendo nostro, perché è nostra l'esortazione che unisce e che mobilita
579200	586300	tanti giovani di ogni parte del mondo, un altro mondo è possibile, è questo che ha
586720	594220	i giovani che si ritrovano a Porto Alegre e in altre parti del mondo, un altro mondo
594220	602980	è possibile e lo è, e questo è il punto, e lo è, alcuni della mia generazione si ricordano
602980	611320	che Marcuse al suo tempo, fonte di tanti errori ma anche di cose giuste, una cosa giusta la
611620	619300	disse quando disse che probabilmente era finito il tempo dell'utopia, intendendosi per utopia
619300	626780	il perseguimento del sogno non realizzabile, perché l'utopia maggiore dell'umanità stava
626780	633720	diventando realizzabile, stava diventando possibile che ci fosse cibo per nutrire ogni essere
633720	640280	umano e che ci fossero diritti che potevano raggiungere ogni essere umano, questo era
640280	648240	possibile negli anni 60, questa è l'utopia realizzabile del nostro tempo ed è quindi
648240	656980	su questa base che dobbiamo impostare la nostra agenda di politica internazionale. Nella nostra
656980	663580	agenda di politica internazionale è più importante la creazione nelle Nazioni Unite
663580	670860	di un Consiglio Economico e Sociale che coordini il governo globale delle politiche economiche
670860	677940	delle politiche sociali di quanto non lo sia la riforma del Consiglio di Sicurezza. Vogliamo
677940	684760	unirci al movimento che c'è nel mondo affinché questo accada, affinché le priorità del
684760	693560	mondo siano davvero i Millennium Goals, quegli obiettivi per il terzo millennio, per il
693580	702580	mondo che i paesi del mondo si sono impegnati a realizzare entro il 2010-2015, eccola l'agenda
702580	711660	da realizzare, di strada fra l'altro se ne è fatta. In qualche modo se i G7 e i G8 degli
711660	720060	ultimi anni si occupano molto meno della stabilità delle banche dell'Occidente e molto più
720060	730560	dell'educazione, della liberazione dei paesi poveri dalla malattia, della presenza positiva
730560	739300	anche delle tecnologie nel mondo in via di sviluppo, questo si deve al fatto che l'opinione
739300	745940	pubblica mondiale di coloro che si battono perché un altro mondo sia possibile ha cominciato
745940	753840	a dare i suoi frutti. L'Africa non deve più essere soltanto il luogo al quale destiniamo
753840	761140	i nostri buoni sentimenti. L'Africa ha preso a svilupparsi e col nostro aiuto, con la nostra
761140	767560	cooperazione può svilupparsi sempre di più. Oggi dall'Africa abbiamo un dato medio di
767560	775420	sviluppo che è il 4%, il che significa che è possibile che l'Africa non è lì soltanto
775420	781800	per rappresentare la nostra cattiva coscienza che diventa buona proprio perché sa di essere
781800	790140	cattiva, ma l'Africa diventa un luogo di impegno operativo non soltanto compassionevole affinché
790140	797300	ci possa essere lo sviluppo che ha cominciato a radicarci. Ma certo la malattia lì è rimasta
797300	805140	un male devastante, oggi ci veniva ricordato è la Giornata Mondiale contro la IDS e ancora
805140	812640	ci sono paesi dove la vita media non raggiunge i 35 anni e dove ci sono cohorti di orfani
812640	818560	che devono provvedere a se stessi perché nessuno si occupa di loro. Certo l'ambiente
818560	825400	è un problema enorme ancora e dobbiamo mettere sulla nostra agenda che cosa accadrà dopo
825400	834340	il 2012 quando sarà scaduto il protocollo di Chioto. Certo l'affermazione del principio
834340	842500	che ciaschionque lavori ha diritto ad un lavoro che si svolge in condizioni decenti è qualcosa
842500	849300	lo ricordava giustamente la Lucia annunciata prima di cui noi ci dobbiamo far carico quando
849300	855400	andiamo in Cina. La Cina sta diventando la più gigantesca pattumiera del mondo oltre
855400	861240	ad essere il paese che si sviluppa di più nel mondo. La Cina è un paese nel quale i
861240	868240	ditti del lavoratore non sono oggi rispettati e se qualcosa di quell'internazionalismo socialista
868860	875600	è rimasto fra di noi, se qualcosa ci dobbiamo portare dietro in qualunque partito qualunque
875600	882840	nome esso abbia nel futuro, portiamoci dietro questo tratto originario dei partiti socialisti
882840	890780	che sono nati per assicurare a ciascuno decenza nelle condizioni di lavoro per far sì che
890780	896900	i bambini vadano a scuola e non in fabbrica, per far sì che ci siano ore di vita e non
896900	903760	soltanto ore di lavoro, per far sì che i Mineros che ancora ci sono in America Latina
903760	912160	non muoiano di silicosi a 35-40 anni come ancora continuano a morire. Certo, i conflitti ci
912160	918340	sono, c'è il terrorismo, c'è l'affermarsi di nuovi paesi che possono determinare nel
918340	926360	mondo nuovi equilibri e nuovi squilibri. Come li dobbiamo fronteggiare? Con questa
926360	933280	agenda portata dall'Europa. E qui che vi accorgete della essenzialità dell'Europa? Noi siamo
933280	941880	un piccolo Paese e siamo consapevoli di esserlo e per questo vogliamo fare dell'Europa il
941880	949200	nostro amplificatore, il pantografo col quale portare le nostre politiche nel mondo. Se
949200	955360	lo caccino nella testa anche i Paesi europei con una tradizione imperialista superiore
955360	961400	alla nostra che ha generato in loro l'illusione di poter essere anche domani degli attori
961400	969460	globali. Non lo saranno. Regno Unito, Francia e Germania in un mondo che tra vent'anni avrà
969460	977400	Cina e Stati Uniti come grandi colossi non conteranno assolutamente nulla e avranno
977400	983040	solo un piccolo potere di veto nel Consiglio di Sicurezza per quelli che a quel punto
983040	990800	ci saranno. È l'Europa che può inserirsi in questo concerto. Senza l'Europa il mondo
990800	998580	che vogliamo cambiare sarà un mondo che rischia di non cambiare e di caderci addosso in una
998580	1006400	politica di potenze di cui noi non faremo parte. Lo deve capire l'Italia che oggi non
1006400	1013260	lo capisce. Ma non mi aspetto che qualcosa cambi nei prossimi mesi. Noi abbiamo pregiudicato
1013900	1020940	una posizione che avevamo in Europa e nel concerto europeo inseguendo un'alleanza privilegiata
1021460	1027760	con l'amministrazione di Washington, oggi più screditata negli stessi Stati Uniti,
1027760	1035040	tra quante Washington abbia avuto negli ultimi 40 anni. Lo capiremo di sicuro noi. Se un
1035040	1043320	impegno dobbiamo chiedere al Governo di centrosinistra quando lo avremo nei prossimi mesi e nei prossimi
1043320	1051380	anni sarà quello di ricollocare l'Italia in Europa, di profittare della finestra di
1051380	1057800	opportunità che si aprirà a partire dall'anno prossimo per ripristinare quel rapporto con
1057800	1065020	la Germania che è stato per l'Europa ben più del rapporto franco-tedesco un motore
1065020	1075060	di grandi e importanti innovazioni in passato. Ma nel mondo noi abbiamo attraverso l'Europa
1075060	1082080	il ruolo da esercitare di cui parlavo e sarò molto breve ora e andrò veramente per teste
1082080	1088660	di capitolo. Noi abbiamo una saggezza che altri non hanno. Noi abbiamo l'esperienza
1088660	1096320	del colonialismo e sappiamo che cosa significa presentarsi davanti agli altri Paesi che ti
1096320	1103340	vedono avendo ancora nella retina il passato di cui tu sei responsabile. Diceva giustamente
1103340	1109060	Massimo in un recente seminario che abbiamo fatto, questa è una ragione perché noi ci
1109060	1115000	presentiamo con la nostra faccia migliore, perché la faccia che si vede è la faccia
1115000	1123060	del potere coloniale. Questo ce ne dobbiamo rendere conto e quindi non avendo basi militari
1123060	1131000	nel mondo da difendere noi europei, non avendo lobby forti al nostro interno che ci portino
1131000	1136480	a privilegiare l'una e l'altra cosa, noi dobbiamo avere per il Medio Oriente quella
1136480	1144300	proposta che altri non può fare. Una proposta che sia per i due Stati nella questione palestinese,
1144380	1150440	ma essere per i due Stati significa dare una mano all'autorità palestinese perché sappia
1150440	1157300	governare effettivamente i suoi territori. Perché non fatevi grandi illusioni. In Israele
1157300	1163480	c'è ancora chi pensa che il governo dei territori da parte dei palestinesi sia solo
1163480	1169860	l'occasione per dimostrare che essi sono incapaci di governarli e per arrivare alla conclusione
1169860	1177680	che l'unico Stato palestinese è la Giordania. Questo aleggia ancora in Israele, non cadiamo
1177680	1187280	nella retorica che a un certo momento prende tutti per cui tutti diventano buoni. Non è
1187280	1195040	così. E allora è importante rafforzare i palestinesi, rafforzare la loro capacità
1195040	1202060	di governo che è l'unica che assicurerà il futuro dello Stato palestinese. È chiaro
1204020	1211160	che Ahmadinejad è un Presidente che viene dai meandri più oscuri del conservatorismo
1211160	1221880	e azionario iraniano, ma noi europei dobbiamo sapere che l'Iran è uno dei paesi nei quali
1221880	1228680	di più c'è una società che sta maturando e che può andare verso un'evoluzione democratica,
1229680	1237000	che è un paese nel quale non dando nulla all'attuale Presidente si può fare molto
1237000	1243240	perché le cose cambino. Ci vuole una prospettiva, una grande prospettiva di sicurezza regionale,
1243420	1250940	una grande prospettiva in ragione della quale ciascuno cessi di ritenere necessario di avere
1250940	1262220	armi nucleari contro qualcun altro. Dobbiamo occuparci dell'Asia, dobbiamo evitare noi
1262220	1270280	gli errori che altri fanno, stando incerti tra il coinvolgimento e l'isolamento dei
1270280	1278960	grandi paesi asiatici. Se si prova ad isolarli, si mettono insieme contro di noi. Non ha destato
1278960	1285180	a Washington nessuna particolare reazione il fatto che cinesi e russi hanno fatto le
1285180	1292200	manovre militari insieme, che si sono uniti gli stessi indiani. Stiamo attenti a tutti
1292220	1301360	queste cose. Abbiamo mille ragioni per evitare che la Russia si metta in Asia con un'Asia
1301360	1310180	che si mette contro l'Occidente. L'Europa è il terreno nel quale il dialogo interreligioso
1310180	1318600	può essere il più fecondo e c'è chi in Europa si occupa di far sì che questo dialogo interreligioso
1318600	1325600	abbia luogo ed è una delle chiavi essenziali per isolare il terrorismo. Il terrorismo
1325600	1330880	è un problema che ormai abbiamo in casa, che non viene più da lontano. E il terrorismo
1330880	1337560	voi lo combattete in casa come fu combattuto il terrorismo delle Brigate Rosse, isolandole
1337560	1345480	e mettendole a nudo nella loro criminalità, ormai priva di coperture sociali. E allora
1345480	1352960	dimostrate che è possibile dimostrare che l'Islam non è terrorista. Create nel rapporto
1352960	1359860	tra le religioni un tessuto che respinge la violenza come stranea e nemica di tutte le
1359860	1372280	religioni, almeno di quelle monoteiste. E allora avete creato le premesse per togliere le radici
1372280	1382040	al terrorismo. E l'America, attenti a non confondere un'amministrazione con un Paese. Se seguite
1382040	1389740	l'America dovreste sapere che oggi la maggioranza degli americani anche sull'Iraq la pensa
1389740	1397720	esattamente come voi. Che ragione avete di essere antiamericani in nome dell'Iraq quando
1397720	1404240	gli americani sono contro l'intervento militare in Iraq esattamente come lo siete voi. Hanno
1404240	1411260	dovuto perdere oltre 2.000 dei loro figli. Hanno dovuto constatare che si è alimentato
1411260	1418480	il terrorismo anziché ridurlo. Hanno dovuto prendere atto che in nome della democrazia
1418480	1425020	si erano distrutti basilari i principi democratici, quelli che ricordava prima Luciano Violante.
1425020	1432240	Nulla è stato più devastante di battersi per la democrazia combattendo la rule of law
1432240	1439020	con prigioni che noi chiediamo alla Turchia di chiudere perché possa entrare in Europa
1439020	1446400	battendosi nel Senato americano perché non passasse una norma che vietava la tortura.
1446620	1452780	La Presidenza degli Stati Uniti si è battuta nel Senato americano perché non passasse
1452780	1459040	una norma contro la tortura. Ebbene, questo Presidente oggi gode negli Stati Uniti di
1459040	1468300	consensi non superiori a quelli di cui gode in Europa. Rifletteteci prima di essere anti-americani.
1468900	1474900	Voi c'eravate arrivati prima. Vi assicuro che negli Stati Uniti in questi due anni criticare
1475860	1482760	il Presidente era un rischio enorme di antipatriottismo che nessuno di voi ha mai capito.
1485080	1491920	Nell'America abbiamo bisogno. Non è possibile fare nessuna delle politiche di cui il mondo
1491920	1499340	ha bisogno, intestandocele noi senza di loro. Amici e compagni, noi siamo per un governo
1499340	1505840	del mondo attraverso le istituzioni multilaterali. Nessuna istituzione multilaterale è in grado
1505840	1512760	di funzionare se gli Stati Uniti sono contro il suo funzionamento. Guardate che ai tempi
1512780	1523740	dell'Impero Romano governare le periferie dell'Impero contro Roma non era facile. Allora
1523740	1533760	era anche peggio. C'è un punto che noi dobbiamo metterci in condizioni di discutere con gli
1533760	1541360	Stati Uniti in base alla formula dell'1 a 1. Dobbiamo vincere la loro idea che il foro
1541360	1547360	nel quale Stati Uniti ed Europa discutono è la NATO. Lo ha detto Gerhard Schröder,
1547640	1555220	è stato fortemente criticato, Gerhard Schröder aveva ragione e su questo principio noi dobbiamo
1555220	1563620	impostare i rapporti con loro. Concludo. Ci si illuse che l'ordine mondiale sarebbe
1563620	1571300	scaturito naturalmente attraverso l'espansione della democrazia e dell'economia di mercato
1571300	1578860	dopo la caduta del muro di Berlino. Il mondo tende naturalmente al disordine e questa è
1578860	1588720	la lezione degli ultimi 10 anni. Tocca allora a noi sulla base dei nostri principi creare
1588720	1594960	questo ordine, sulla premessa che sicurezza è in primo luogo giustizia, che è in prima
