start	end	text
620	5420	Radio Radicale, abbiamo qui di fronte a noi il Presidente Giuliana Amato. Presidente Amato,
5900	11200	riforma e situazione del nostro sistema bancario. Lei definì il sistema bancario, ormai venti
11200	16760	anni fa credo, una foresta pietrificata di cui era necessario intervenire e innovare
16760	21640	per renderla più aperta. Tra l'altro è stata proprio lei, insieme col Dottor Draghi, in
21640	26640	qualche modo protagonista del cambiamento di questa foresta pietrificata. Ma ora il
26860	34640	sistema bancario è diventato una fungaia velenosa. Questa è divertente con me. Io
34640	41520	capisco bene che c'è un caso che in questo momento interessa le cronache, che è quello
41520	52720	dell'MPS, ma i vizi che si potranno riscontrare, che stanno emergendo in quella situazione, non
52720	62000	li attribuirei al nostro sistema bancario nella sua inchierezza, se non per una parte che è
62000	73000	importante e che riguarda una delle aspettative non realizzate di chi come me, Draghi e Ciampi
73000	86080	prima aveva pensato per spietrificare la foresta ad una trasformazione che facesse delle banche
86080	102980	delle società per azioni, con queste azioni inizialmente trasferite a fondazioni che sono
102980	112680	dovuto perdere non solo il controllo della banca, ma addirittura il ruolo di azionisti
112680	122260	rilevanti per diventare fondazioni non profit, come le grandi fondazioni non profit che ci sono
122260	130020	in altri paesi, il cui portafoglio include l'investimento nella banca come include
130020	137820	qualunque altro investimento che serve solo ad avere dei ritorni destinati ad essere investiti
137820	147860	su quello che in Italia chiamiamo il territorio. Il destino di queste fondazioni doveva essere
147860	158560	quello di perdere il controllo della banca e quindi di alleggerire via e più la partecipazione
159580	167540	la legge cosiddetta amato, questo non lo prevedeva ancora, è stato un processo lungo e difficile
167540	179760	io per far passare, anzi Carli, perché poi io avviai la legge che porta il mio nome ma
179760	189260	poi la legge passò nel 90 quando mio successore al tesoro era diventato Guido Carli. Per farla
189260	198620	passare in parlamento Carli dovette accettare che le fondazioni avrebbero mantenuto il controllo
198620	208000	della banca e quindi il parlamento del 1990 non fu in grado di accettare il disegno che
208510	217970	stiamo in testa della sconnessione poi fu attraverso il lungo tormentone degli anni
217970	226510	90 che si arriva alla legge Ciampi amato qui alla rovescia, qui era Ciampi che aveva elaborato
226510	235570	la legge e amato che firma il decreto delegato quando Ciampi va al Quirinale e bene lì dentro
235570	244790	si era riusciti finalmente a dar corpo al disegno, le fondazioni devono lasciare il controllo
244790	257450	della banca. E' accaduto poi. Piano piano questo è venuto accadendo e con gli anni abbiamo
257450	265970	avuto oggi abbiamo 88 fondazioni, ne abbiamo circa mi pare 18 giù di lì che non hanno più
265970	276250	nemmeno la partecipazione bancaria, molte l'hanno portata sotto il 50 per cento e poco più di una
276250	284490	diecina ce l'hanno sopra il 50 per cento ma sono tutte molto piccole salvo la fondazione Monte
284490	293370	dei Paschi che sotto il 50 è scesa appena appena ora. Perché la Monte dei Paschi? Aspetti perché
293370	301650	dobbiamo capire, qui ci sono due cose da capire, una che riguarda l'Italia, il capitalismo italiano
301650	311310	e quant'altro l'altra che riguarda Siena. Mentre era in corso il processo di discesa delle fondazioni
311310	323730	dal capitale delle banche sopraggiunge la grande crisi e sopraggiunge l'esigenza di rafforzare
323730	331230	patrimonialmente le banche, il loro capitale non basta davanti ai rischi che sono accresciuti,
331710	340450	devono capitalizzarsi. Il processo di riduzione della presenza delle fondazioni aveva già messo
340450	348830	in evidenza la grande difficoltà del capitalismo italiano di offrire azionisti diversi dalle
348830	355790	fondazioni. Noi avevamo previsto fin dall'inizio che potesse esserci la partecipazione come azionisti
355790	362970	delle imprese industriali ma era stato giustamente stabilito un tetto perché altrimenti la banca
362970	370050	diventa banca di casa di un'industria e si creano conflitti di interesse.
372010	380050	Gli investitori istituzionali tanto agognati, i fondi pensione e quant'altro sono rimasti
380050	386950	quando in Italia sono riusciti ad esistere un po' fuori dalla porta. Cosa accade? Che
386950	393570	quando sorge quell'esigenza di capitalizzare le banche è la stessa banca d'Italia che chiede
393640	401180	alle fondazioni. Voi dovete contribuire a questa missione di interesse nazionale e le
401180	413860	fondazioni nell'arco di pochi anni dal 2007-2008 al 2011 impegnano la bellezza di 6 miliardi
413860	422200	in capitalizzazioni oltre un miliardo nell'acquisto di obbligazioni cioè dal punto di vista sistemico
422200	430000	la fondazione che doveva cancellare la partecipazione bancaria viene chiamata a
430000	437780	mantenerla viene chiamata ad assolvere al ruolo di investitore di lungo periodo investitore
437780	444180	istituzionale di investitore istituzionale e quindi come mi è capitato di scrivere più volte
444180	450400	diventa una specie di giano bifronte è la fondazione del territorio che non dipende
450400	455620	dalla banca e che in quanto fondazione del territorio non ha interesse a dipendere dalla
455620	463000	banca perché in quel ruolo ha più interesse a differenziare il rischio ad evitare di dipendere
463000	471600	dalle sorti di un'unica impresa dall'altra parte la missione nazionale di ricapitalizzare le banche
471600	479700	in tutto questo c'è il caso ancora più speciale di Siena perché alla missione di stare con la
479700	491120	la chiama la città non la chiama la banca d'italia in realtà e questa fondazione arriverà in
491120	501500	occasione dell'ultima capitalizzazione della banca a indebitarsi pur di mantenere il controllo
502040	514680	due anni fa la fondazione mps contrae un debito di centinaia di milioni per mantenere il 51% il
514680	524240	paradosso della storia sarà che non avendo altro poi per ripagare il debito dovrà vendere le
524240	531440	azioni che aveva comprato indebitandosi per pagare i suoi creditori questo fa capire che
531440	537000	lisi era innestata a una spirale negativa per lei era favorevole a questa fusione bnl montere
537000	546700	base io ero favorevole a una questione è una cosa che si pose molti anni fa ed era del tutto
546700	555180	con il disegno che stava dietro la legge amato la quale in realtà non è che fosse stata fatta
555180	563320	solo per scindere le banche dalle fondazioni ma per mettere le banche nella condizione di
563320	570880	aggregarsi fra di loro avere delle banche italiane più forti in una fase nella quale si era aperto
570880	579380	mercato europeo e le nostre banche più graciline di quelle degli altri paesi europei rischiavano
579380	587580	di diventare dei bocconi che le banche di altri paesi si sarebbero mangiati per conquistare il
587580	594940	mercato del risparmio italiano quindi era bene presidiarlo con banche più robuste e questo
594940	602240	complicava accoppiamenti che la legge amato infatti favoriva con una norma fiscale scritta
602240	608220	da bruno visentini l'articolo 7 me lo ricordo ancora di questa legge che
611280	618820	venne ritenuta dopo la norma più bella della legge ed io ne sono convinto gli accoppiamenti
618820	626020	furono anzi si crearono anche famiglie plurime tra le casse di risparmio piccole e rimanevano
626020	635800	alcuni single di media dimensione che era bene si unissero fra di loro bnl ed mps aveva caratteristiche
635800	644840	di una utile fusione banca d'italia quando arrivò il momento non la ritenne approvabile
644840	653320	perché c'era già allora il problema che la fondazione voleva stare a mps ad un livello
654040	658800	troppo elevato secondo banca d'italia e qui il problema è sempre quello il ruolo di che
658800	664200	la fondazione mps voleva e ha inteso avere nel controllo di monte dei paschi di siena
664200	674820	esattamente e che deve essere fatta di tutta questa vicenda di monte dei paschi di siena
674820	683680	e mps percepiva che doveva sposarsi e allora dopo che venne meno l'ipotesi bnl cominciò
683680	693040	a ipotizzare un rapporto col san paulo che ancora non si era sposato con insomma non
693040	704020	era ancora nata intesa con i milanesi e l'ipotesi aveva un po camminato ma li veniva fuori che
704020	712660	con questo grosso azionista che era la fondazione di siena il grosso della banca eventualmente
712660	718500	unita sarebbe stato a torino ma il quartier generale dove c'è l'azionista più forte
718500	728540	a siena e questo i torinesi lo trovarono inaccettabile la pressione era forte e a quel punto comprarono
728540	736860	anton veneta che si stava liberando e i guai del monte dei paschi in realtà sono cominciati
736860	749060	lì allora qui si aprono due vicende appunto una è quella del come mps ha ritenuto di sostenere
749060	758260	l'enorme sforzo finanziario fatto per comprare anton veneta e l'altra è il senso a quel punto
758260	767640	della fondazione che vuole mantenere questo controllo perché la città non è tutta la
767640	777500	città in realtà che non accetta che l'mps perda questo suo connotato è stata nel quando
777500	786180	sono cominciate le disgrazie un'evoluzione positiva che siena si sia dotata di un amministratore
786180	796140	delegato e di un presidente venuti da fuori e che la fondazione sia finalmente stata convinta
797000	803860	dalla lezione della storia a scendere nella sua partecipazione parla dell'attuale gestione
803860	812280	profumo io mi ricordo insomma i quelli venuti da fuori sono l'amministratore delegato viola e
812280	820440	il presidente ci ha voluto questo disastro e infatti insomma se si fosse ascoltato chi lo
820440	826000	proponeva prima forse il prezzo sarebbe stato meno alto ora come uscirne però presidente amato
826000	830920	perché ci sono stati questi monti bonds se non ho capito male si tratta di un prestito che può
830920	836860	essere convertito in nazioni qualore il monte di paschi non riesca a ridare i soldi le risorse
836860	841740	finanziarie avuti in prestito ma sarebbe meglio a questo punto una nazionalizzazione della banca
842700	848500	se lei parla con gli attuali amministrati la nazionalizzazione è sempre un rimedio
848500	856740	estremo io non ritengo che sia utile assumerlo come rimedio iniziale qui è previsto come rimedio
856740	867000	estremo perché una volta che la banca riceve questi monti bonds o è in grado di ripagarli
867000	875320	o se non li ripaga nei termini previsti lo stato diventa azionista all'ottanta per cento
875320	883520	quindi la cosa si risolve da sola e se la banca si mette nella condizione di ripagarli
885180	892840	rinvigorendosi e ristrutturandosi beh è molto meglio che non nazionalizzarla quindi confidiamo
892840	899460	nella nuova gestione e speriamo per il meglio sistema bancario secondo lei è davvero il nostro
899460	904560	sistema bancario solido o a causa dei credit in sofferenza dai 100 150 miliardi le cifre sono
904560	911220	un po ballerine e ammette di essere un po superficiale nel darle ci sono alcune problematiche
911220	915300	alcune contraddizioni e specialmente il sistema bancario non sta finanziando l'industria
915300	920160	l'impresa delle piccole e meno imprese come avrebbero e questo è assolutamente vero ma
920160	935460	siamo ancora sotto il sotto la tempesta in realtà perché le banche sono ancora nella fase che è
935460	943500	cominciata quando si è chiesto alle fondazioni non lasciate le banche non fate come dice la
943500	955880	ma rimanete azioniste di riferimento le banche hanno tuttora bisogno sempre più di ricapitalizzarsi
955880	963400	di rafforzarsi e quindi i soldi che riescono a rastrellare sono ancora nella fase che li
963400	969000	rastrellano per rafforzare se stesse non per darli a le imprese che però provoca un pochi
970120	978180	provoca giganteschi problemi ma noi siamo alle prese con questo appunto riuscire ad arrivare
978180	987900	al più presto ad un equilibrio e un ritorno degli scambi nel mercato bancario che permetta
987900	996120	ai soldi di girare di più e di fare in modo che ne arrivino anche alle imprese da questo punto
996120	1003100	di vista la cosa più utile che è accaduta in questi mesi è stato l'avvio dell'unione bancaria
1003100	1009840	europea perché l'avvio dell'unione bancaria può rimettere in moto quello che si chiama il mercato
1009840	1017600	interbancario cioè le banche che prestano i soldi l'una all'altra e che si rimettono a far girare
1017600	1026000	soldi con una maggior fiducia l'una nell'altra a quel punto è chiaro che l'accesso alle risorse
1026560	1034460	da parte delle banche non è più quello delle obbligazioni che emettono per accrescere ciò di
1034460	1041760	cui dispongono ma degli scambi che ci sono fra di loro dei vasi comunicanti che tornano ad essere
1041760	1048760	comunicanti e che al momento sono in larga parte solo in italia o in tutta europa no questo è in
1048760	1054500	tutta europa naturalmente ci sono banche che dispongono di più e banche che dispongono anche
1054500	1058580	sistemi capitalisti in germania stendoci molte grandi imprese probabilmente non hanno problemi
1058580	1064280	di accesso al credito in italia situazione esattamente molto poi del problema bravo
1064280	1071000	dipende dalla struttura del sistema industriale le imprese italiane e che vanno bene in questo
1071000	1077400	periodo le nostre migliori imprese esportatrici sono del tutto disinteressate al funzionamento
1077400	1083020	del sistema bancario perché i soldi se li trovano comunque sul mercato la piccola e media
1083020	1092080	impresa italiana che non riceve soldi dall'agenzia bancaria del suo paese e non viene pagata dallo
1092080	1100700	stato che le paga i propri debiti a 190 giorni di distanza e quella si trova senza ossigeni come
1100700	1105060	fare però perché qui la situazione è molto grave la situazione sociale è abbastanza grave
1105060	1114020	è certo che è molto grave ma non mi chieda non mi chieda ad un vecchio ex medico una ricetta per
1114020	1121540	una situazione così difficile la mia opinione è che lo stato dovrebbe fare il possibile per
1122420	1130520	accelerare i suoi tempi di pagamento e questo trovo davvero che lo trovo incomprensibile devo
1130520	1138660	dire che lo trovo incomprensibile ecco l'altra cosa che ha ricominciato si dice ad accadere che
1138660	1145760	nell'ultimo trimestre del 2012 il credito a differenza di quello che diceva lei un pochettino
1145760	1151760	si sarebbe riaperto insomma non c'è lo stampare moneta purtroppo non c'è non si può fare come in
1151760	1157980	gioco non si può fare non si può fare come in giappone.
