start	end	text
0	5880	Gli ospiti in questa sala, evidentemente alcuni di voi erano senza ombrella e non sapevano
5880	13400	dove era, rifugiamoci in una sala dove non piove, però allora starete qua fino a lunedì
13400	23060	a giudicare dalle previsioni del tempo che sono piuttosto negative, non solo loro.
26140	33940	Beh, insomma, io non so questo titolo se è stato fatto prima o dopo le elezioni, Gianfranco,
34000	34320	prima?
34320	35340	Prima, prima, sì.
35440	42100	Beh, insomma, se l'ha fatto lui merita un premio speciale, perché tutto da rifare,
42240	47140	alle urne cittadini tutto da rifare, punto interrogativo, insomma...
47140	53700	Il tutto da rifare è della direttrice della rivista, il mio ospito interrogativo.
55160	61500	No, perché allora, dopo fossimo a Napoli, ci faremmo dare i numeri da voi da giocare
61500	73480	questa settimana con alcune certezze, perché in realtà, come sapete, questo è un numero
73480	80200	di una bella rivista che è dedicato alle elezioni, ma non al risultato elettorale,
80260	88460	né alle prospettive che esso ha aperto o non ha aperto per il futuro degli italiani.
88900	101940	Ci sono diversi saggi, in parte incarnati qua, che si occupano di temi diversi, naturalmente
102680	109380	forse c'è chi non li considera tutti, ma secondo me sono molti, insomma, si va da un'analisi
109380	116220	dell'astenzionismo e degli astenzionisti, a un'analisi delle primarie, a un'analisi
116220	125780	degli indecisi, delle quote, di se stesso, perché come confessa Alessandro Campi, in
126060	132280	realtà scrive un suo saggio e alla fine dice, ma in fondo è la mia autobiografia
132280	140540	di questi mesi, ed è verissimo per chi lo conosce quando lo si scorre, e infine, ovviamente,
140760	148980	all'inizio un saggio con orizzonti, no, perché prende questi diversi orizzonti e li mette
149120	161780	insieme con una serie di osservazioni ed analisi sue. Gianfranco è di grande interesse e ciascuno
161780	168500	di noi ritrova un po' domande che lo riguardano. Ecco, l'indeciso, ammesso che qui qualcuno
168500	175160	di voi sia stato indeciso, può domandarsi se rispetto alle due figure di indeciso che
175480	183240	emergono. Sono uno indeciso perché nessuno è venuto a dirmi di che si tratta o sono uno
183240	189760	indeciso perché lo so anche troppo di che si tratta ed è per questo che sono indeciso? Ecco,
189980	196420	ci sono queste due figure, ora io le ho un po' estremizzate, ma più o meno va bene così. La
196420	202380	questione delle quote, su cui Claudio e io a partire da una certa data della nostra vita,
202380	211240	non ricordo la data, ma ricordo che è arrivata, abbiamo preso atteggiamenti diversi. Ecco, lei
211240	218940	continua a pensare che la quota sostituisca qualcosa, è una protesi che sostituisce la
219830	230470	in qualche modo. L'impegno, insomma l'impegno, è ciò che naturaliter dovremmo fare. Io,
230650	239490	così che insomma sono più vicino di lei storicamente alla guerra di Spagna, penso che
239490	246350	quando c'è un inesorabile collo di bottiglia, un po' di dinamite per farlo saltare e passare oltre
246350	257130	serve. L'avevo visto anche al cinema e quindi non che si possa passare la vita utilizzando dinamite
257130	265310	per far saltare i colli di bottiglia, ma una tantum la cosa in realtà serve. E qui si può
265310	272510	valutare, è certo, Claudia oggi ha un ottimo argomento, mi può dire hai visto le primarie,
272510	284010	bene o male che essi siano valutate, di sicuro sono un congegno più naturale rispetto all'artificio
284010	291470	della dinamite per far emergere una presenza femminile che la tradizionale cooptazione
292230	302330	maschile dei candidati non avrebbe sicuramente fatto arrivare ai numeri ai quali con le candidature
302330	310170	femminili si è arrivati. Io comunque ecco leggendo il capitolo sulle primarie di Valbruzzi mi sono
310170	319850	chiesto ma io forse sono un benaltrista, chi lo legge qui capisce il senso perché sono tra quelli
319850	326450	che pensano, sì certo le primarie sono importanti ma io credo che il cuore della democrazia sia la
326750	334510	interazione che chiamiamo in gergo tecnico democrazia deliberativa, ecco che sia questo ciò che
335210	342210	soprattutto ci è venuto a mancare e a cui le primarie non portano rimedio, portano rimedio
342210	351230	ad altro attenuano il peso della cooptazione quindi diciamo sono anche benaltrista. Ci sono poi tante
351230	364270	altre domande che trovano risposta nel saggio di Gianfranco del quale vi dico una cosa e poi la
364270	371270	lascio, Antonio è un commentatore in questo caso non ha partecipato al volume quindi è nella mia
371270	383090	condizione che gioca da l'inverno in questa faccenda, dopo aver tracciato attraverso varie
383090	391330	tracce il profilo complessivo dell'elettore italiano che esce dall'insieme del volume c'è
391330	399830	una frase finale che le elite politiche italiane che sono state e rimangono sostanzialmente elite
399830	407990	politiche sono ancora più responsabili degli elettori dei loro elettori della bassa qualità
407990	423070	della democrazia italiana e questa è una sentenza in doppio senso abbastanza pesante insomma cioè
424690	434190	vari profili dell'elettore e non l'aveva detto prima ma alla fine dice la bassa qualità allora
434190	443950	poi la domanda per lui è questo era un presupposto implicito o via via che scriveva gli è venuto
443950	452050	fuori che andasse detto o pensa che il lettore lo desuma da ciò che gli ha detto prima comunque
452050	460630	bassa qualità effettivamente ci sono rimasto un po male però può darsi che tu abbia ragione
460630	469810	insomma allora la lascio lì perché il mio compito qui io lo considero sempre quello di presentare il
469810	479370	padrone di casa deve essere un moderato e vi do la parola di essere di un partito non possono
479370	486170	essere solo un episodio che poi finisce lì però credo che sia uno strumento appunto di
486170	492770	partecipazione dei cittadini certo non sarà neanche quello risolutivo però è importante che i
492770	500490	partiti si aprano e quindi che la democrazia si allarghi il più possibile non credo che questo
500490	505770	avvenga soltanto attraverso la rete c'è anche qui credo che ci sia una mitologia della rete perché
505930	511050	credo che la rete è una cosa importantissima da tutti i punti di vista e credo che sia anche
511050	516450	una cosa democratica non credo che possa essere una forma nuova di democrazia ecco su questo mi
516450	524390	piacerebbe anche sentire altre opinioni a questo credo che dedicheremo qui un seminario tra non
524390	531990	molto fra l'altro sulla scia di un seminario al quale ho partecipato tre giorni fa al Politecnico
531990	540510	di Milano con una serie di dati che sono stati portati con persone che avevano atteggiamenti
542090	551970	diversi minore entusiasmo gli studiosi di scienze politiche come Alberto Martinelli o Bruno Dente
551970	561390	più disponibili alle identificazioni semplici e non complesse gli studiosi di altre discipline
562890	571450	la cosa dal punto di rispetto alle elezioni più interessante che è venuta fuori è la fondamentale
571450	580190	equivalenza tra la televisione e la rete che è stata sfruttata in modo opposto ma alla fine
580190	587930	ugualmente efficace da quelli che questa ricerca considerava i due migliori sfruttatori dei mezzi
587930	596530	cioè Berlusconi e Grillo alla rovescia cioè Berlusconi che parte dalla televisione e ha un forte
596530	605810	rebound in rete l'altro che parte dalla rete più provocatoria possibile il partito democratico non
605810	611930	ha vinto le elezioni forse le ha perse non arriverai fino a quel punto ma i suoi dirigenti
611930	622370	sono tutti tornati in Parlamento prima che anche a scopo augurale da parte di tutti noi
622370	630050	vorremmo sapere se stai suonare la fisa armonica è uno strumento che non ho mai suonato ma lo
630050	637890	amo molto lo amo molto perché è parte che è uno strumento popolare è uno strumento attraverso
637890	648110	il quale si suonano molti spartiti che usualmente esigono strumenti diversi no soltanto per dire
648110	656990	che quando dissi quella cosa uscivo da una conversazione con Pietro Ingrao che insieme
656990	662990	ad altri c'eravamo sforzati di convincere dell'importanza della riforma della Corte dei
662990	672110	Conti lui ci ascoltò come faceva sempre sulle cose istituzionali le masse come le mobilitiamo
672110	678950	sulla riforma della Corte dei Conti io dissi no effettivamente insomma forse è meglio trovare
678950	687810	altri argomenti ma in realtà nell'insieme vale per qualunque riforma istituzionale cioè o sei
687810	695710	in grado di dimostrarne la strumentalità alla soluzione dei problemi quotidiani degli esseri
695710	703950	umani oppure se la presenti come se fai l'errore anche l'errore puramente formale di presentarla
703950	711390	come un insè ti viene subito l'obiezione va beh ma queste sono cose che riguardano voi insomma
711390	719590	perché non è così evidente al cittadino che vive la sua vita e che non ha tempo per queste
719590	726150	cose di essere sufficientemente esperto del funzionamento dello stato per capire l'importanza
726150	734490	di modificarlo che non ha tempo e quindi devi parlare dei suoi problemi è il tema che abbiamo
734490	743330	oggi sull'europa appunto perché mai come in questo momento è chiarissimo che senza l'integrazione
743330	752010	politica va a catafascio tutto o rischiamo che vada catafascio tutto e che quindi realizzare
752010	758410	l'integrazione politica non è realizzare una vecchia utopia di un vecchio signore e altri
759410	768610	ma è fare ciò che serve ciò che serve ad avere ancora una valuta rispettata e un sistema economico
768610	777410	che funziona eppure io ho parlato con diversi politici che ne sono convinti e gli ho detto allora
777410	785470	lanciatelo questo tema e no non ce la fanno cioè parlano della necessità dell'europa sociale di
785470	791710	europa che riesca ad apparire meno arcinia che funziona ma poi quando si arriva al tema
791710	802610	istituzionale è di difficile trasmissione nella sua importanza agli elettori io fondamentalmente
802610	811590	mi limitavo a quello dico certo che insomma chissà se avremo un governo che riuscirà a fare delle
811590	818630	cose ma non c'è dubbio che dovrebbe riformare la legge elettorale insomma se c'è stata un'occasione
818630	830030	nella quale è emerso che senza un sistema elettorale che la assecondi la volontà degli
830030	838530	elettori oggi così suddivisa non riesce a esprimere una maggioranza e d'altra parte con
838530	848330	un sistema di partiti così polarizzato loro tra di loro non riescono a formarla e bisogna aiutare
848330	856650	il sistema politico a trovare la maggioranza attraverso gli elettori e quindi a spingere
856650	864990	gli elettori allora è chiaro che gente come noi due pensa che il doppio turno trova in questa
864990	872570	fase politica italiana proprio la prova approvata della sua necessità perché tu offri agli elettori
872570	882490	la possibilità in un primo turno di e poi però è certo che anche il secondo turno viene messo in
882490	890950	difficoltà perché la legge più drastica che esiste sul secondo turno è quella francese in
891340	899900	momento che ammette al secondo turno che supera il 12 qui ne abbiamo tre che superano il 12 non
900740	908460	credo in tutti i colleghi e mettere una soglia superiore poi vedi questi tre che si si domandano
908460	916780	a chi tocca allora un secondo turno a tre diventa duro ma in ogni caso ne vanno scelti due perché
916780	926700	poi devi sceglierne due e alla fine comunque gli eletti sono quelli eletti da una maggioranza
927580	934640	perché non c'è dubbio che avere alla camera una maggioranza dei seggi che corrisponde al
934640	945700	29 per cento dei voti è qualcosa che non abbiamo mai vissuto e no perché la legge acerbo dava il
945700	953820	25 ma con la legge acerbo la prima volta che fu applicata il partito nazionale fascista superò
953820	961460	comunque il 60 per cento non ricordo quanto prese quindi la legge acerbo gli fece da sostegno ma
961460	968340	non fu risolutiva risolutiva fu la volontà degli elettori e il porcellum le altre due volte che
968680	976940	abbiamo usato ha dato il 55 per cento dei seggi a coalizioni che erano entrambe al di sopra del
976940	987320	40 e quindi superiori in genere ai voti della maggioranza dei seggi nel parlamento britannica
988700	998140	la camera dei comuni britannica quindi questa diventa una forte esigenza vi dirò per concludere
999120	1009000	che io ne ho parlato e da alcune voci del pd mi sono sentito rispondere che non c'è dubbio il
1009000	1017580	pd lo deve sostenere perché è il sistema che propone da anni se viene e sì se viene sul tavolo
1018580	1036380	però attenzione perché se nei collegi in cui c'è il nostro e quello dei grillini l'elettorato
1036380	1046020	di destra vota quello dei grillini i flussi che abbiamo verificato fino ora non dimostrano questo
1046020	1055620	dimostrano che rischia che lo votano quelli del pd e allora diventa una strana no il sistema
1055620	1063560	dal punto di vista sistemico va comunque bene perché alla fine garantisce una maggioranza e
1063560	1069900	quindi costringe chi l'ha avuta a sottoporsi alla prova del governo che è una cosa che conta
1070720	1079380	vabbè per ora la lasciamo lì c'era un tutto da rifare punto interrogativo abbiamo provato
1079380	1083040	anche a rispondere a questo grazie a tutti e buonasera
