start	end	text
8840	12340	Presidente Amato, nel corso di un convegno che si è svolto appunto ieri, in cui prima
12340	16120	faceva riferimento, si è parlato di cambiamento, che nell'ultima legislatura c'è stato quasi
16120	19900	un cambiamento della forma di governo, con l'adozione di molti decreti d'emergenza,
20120	24080	dei decreti legge e così via. Lei ritiene che anche nella prossima legislatura c'è
24080	28000	il rischio che questo cambiamento della forma di governo in qualche modo venga ulteriormente
28000	30420	confermato. Cosa ne pensa il Goal istituzionale?
31420	40420	L'ultima legislatura, il convegno a cui lei fa gentilmente riferimento, l'ha giustamente
40420	46940	definita come una legislatura di transizione, che della transizione aveva alcune caratteristiche
46940	53380	destinate a transittare nel futuro, alcune destinate a scomparire perché figlia della
53380	60840	eccezionalità della transizione. Allora la domanda è in parte diversa. La prossima
60840	68160	legislatura sarà la legislatura di una avviata democrazia dell'alternanza o farà ancora
68160	74080	parte della transizione perché le forze politiche non saranno state ancora in grado
74080	80880	di dar vita alla democrazia dell'alternanza? Se questa difficoltà delle forze politiche,
80880	90980	perché per la verità è un po' preannunciata dalla caotica disomogeneità di due dei tre
90980	96300	poli che fingono di essere poli di governo, allora è ben possibile che la prossima sia
96300	99660	ancora una legislatura di transizione. Con tutte le caratteristiche negative?
100700	110160	Con caratteristiche positive e negative. La transizione è transizione. Lei come considera
110160	115640	i brufoli di un adolescente, positivi o negativi? All'adolescente non piacciono ma fanno parte
115640	122540	della pelle ad una certa età. In questo caso noi avremo un'adolescenza
122540	130500	prolungata, questo me ne rendo conto, però io l'ho sempre sostenuto, quindi non è che
130500	136180	mi stupisco. L'Italia ha bisogno della democrazia dell'alternanza, non basta una legge elettorale
136180	143500	per farla nascere, occorre che le forze sociali e politiche, le opinioni collettive entrino
144380	151760	effettivamente nelle coesioni necessarie perché questa democrazia si realizza. Se noi siamo
151760	157220	così ancora figli della provvidenza e dello Stato, per cui fatta la legge abbiamo cambiato
157220	164680	il mondo, allora siamo soltanto degli eterni ingenui. Fatta la legge abbiamo innescato un
164680	171540	meccanismo attraverso il quale il mondo può cambiare, ma poi ci sono altri passi da fare.
171600	174560	Per esempio qualche riforma nuova elettorale, il doppio ruolo nell'elezione elettorale?
174720	183980	In questo sono convintissimo, infatti mi rubo una cosa che ho scritto per panorama che uscirà
183980	192520	sabato, ma io sono convinto che se invece di contrapporsi su tante formule di governo
192520	198540	che poi gira gira significano tutte la stessa cosa, per cui voi dovreste smascherarla questa
198540	203960	cosa qui, ma lei dice governo istituzionale, ma allora è diverso dal governo di ricostruzione
203960	213640	democratica che è a sua volta diverso dal governo istituzionale. Questo secondo me risale
213640	219520	al concilio vaticano primo questa roba qui e una parte del nuovo dovrebbe essere che
219520	225820	questo latino viene smascherato. Tutte queste formule significano che se non ci sarà nessuno
225820	231620	che avrà la maggioranza bisognerà farne una un po' larga e che non ha un chiaro orientamento
231620	238620	politico, insomma la chiami come vuole. Il problema è che se invece di contrapporsi
238620	239980	su queste formule...
