start	end	text
0	9520	Ecco, il Parlamento sia aperto a questa ridislocazione dei poteri, perché io penso che avrà da
9520	17780	noi, se porterà come mi auguro davvero, a conclusione una riforma profonda, nell'interesse
17780	23760	della capacità competitiva del Paese e di un maggiore principio di responsabilità dunque
23760	31360	di democraticità, avrà da noi con lealtà e convinzione sostegno al disegno di riforma
31360	32340	della Costituzione.
44000	52880	Io vi ringrazio molto per il contributo che dal mondo delle autonomie è venuto e sta
52880	61940	venendo al processo di riforma costituzionale e ritengo doveroso anche dare poi qualche
61940	69680	risposta di merito, per cui chiedo qualche minuto in più, alle questioni che sono poste
69680	77560	nella interlocuzione assai feconda e corretta, a mio giudizio, con il lavoro del Parlamento
78160	85260	che sono poste nel documento che è stato qui illustrato dal Presidente Chiti.
86520	93240	Io credo che sia importante lo sforzo compiuto dal sistema delle autonomie per costruire
93240	96940	e definire proposte comuni nel dialogo con il Parlamento.
97260	105440	Non era semplice, ciò ha comportato il superamento di divergenze, anche qualche compromesso.
106780	116780	Ha dimostrazione del fatto che in realtà, sul tema della riforma dello Stato, il dibattito
116780	122300	è molto più complesso che non quello raffigurato nella immagine di un conflitto fra centro
122300	123720	e periferia.
126360	132040	Per ragioni che sono evidenti a chiunque conosca la storia e la complessa realtà istituzionale
132040	141080	del nostro Paese, c'è un conflitto tra comuni e regioni che è venuto via via divenendo
141080	149720	più acuto nel corso del lungo periodo di esperienza del regionalismo italiano, una esperienza
149720	156600	con luci ed ombre in cui hanno pesato sicuramente le responsabilità di una resistenza centralistica
156600	162560	ma anche la tendenza in diverse regioni a caratterizzare il regionalismo nella forma
162560	167960	di una ipertrofia amministrativa, Chiti lo ha sottolineato, il documento lo dice.
169280	177240	C'è un problema di rapporto tra comuni e province, il tema del superamento delle province
177240	183200	è stato un tema lungamente dibattuto nella discussione istituzionale italiana, agli
184180	189400	poi accantonato, ha avuto un ritorno di fiamma, visto che vi volevano abolire ma siete al
189400	198180	comando addirittura, una vicenda molto complessa che soltanto così un propagandismo di maniera
198180	204980	può raffigurare nella forma di un fronte dell'innovazione federalista che si contrappone
204980	212040	al centralismo del Parlamento nazionale, queste cose non sono vere e quando le cose non sono
212040	220080	vere fondano delle battaglie inefficaci. Anche in Parlamento si confrontano posizioni
220080	227640	diverse e non c'è dubbio che il risultato finale è quello, è un modello di federalismo
227640	234800	originale, spurio, non c'è dubbio. Non è vero, vorrei aggiungere un'altra cosa,
234960	239060	per amore di verità, quelle verità anche spigolose, non si dicono ai conventi, non
239060	247140	è vero che il conflitto vecchio-nuovo si configura soltanto come un conflitto centro-periferio,
247480	256420	basta pensare come un accentuato a autonomismo è stato un freno all'innovazione, le regioni
256420	261820	che godono di un'autonomia speciale non sono state l'avanguardia dell'innovazione istituzionale,
262040	267520	sono stato un centro di resistenza dove i ceti politici locali hanno innovato molto
267520	277140	del Parlamento nazionale. Una delle ragioni che ha conferito al sistema delle autonomie
277140	283000	un accentuato protagonismo sono state le riforme fatte dal Parlamento nazionale, direzione
283000	288660	diretta del sindaco, la nuova legge elettorale regionale con tutti i suoi difetti. Detto
288660	293460	questo per amore di verità e per uscire da una discussione falsa in cui non ci sono
293460	299000	capponi di Renzo, non ci sono zecca garbugli, ma c'è un processo riformatore che muove
299000	305180	dalla peculiare vicenda italiana, da quel peculiare intreccio tra funzione dei comuni,
305280	312040	esperienza regionale che è tipicamente nostra e sulla quale secondo me era assai problematico
312040	320600	calare un modello riportato da altre esperienze. Non c'è dubbio per esempio che nel dibattito,
320600	326580	nel confronto c'è una posizione federalista assai più pura, penso alle posizioni che
326580	338000	sostiene la legge, che ha un'idea quando dismette i panni del secessionismo, propone
338000	344700	un federalismo per certi aspetti assai più puro, che guarda al modello di un fedus tra
344700	352980	regioni-stato dotate di un potere, penso per esempio al potere ordinamentale sull'autonomia
352980	361380	locale, che dubbio c'è che dal punto di vista della grammatica costituzionale questa
361380	366380	idea è un'idea più propriamente federalista, nello stesso tempo che dubbio c'è che se
366380	371560	il Parlamento l'approvasse i primi a scendere in piazza contro sarebbero quei sindaci di
371560	379000	cui, o mi sbaglio, e quindi basta vedere qui la complessità del problema se vogliamo
379000	385920	discuterne con un senso di verità, basta vedere qui dove è il punto e dove la necessità
386640	393260	a mio giudizio non per resistenza centralistica ma per rispetto della peculiarità del nostro
393260	399620	Paese è di costruire un modello in cui questa differenziazione di funzioni sia garantita
399620	406500	costituzionalmente e quindi i soggetti che partecipano al fedus non possono essere soltanto
406500	416220	le regioni-stato, ma i diversi livelli istituzionali devono essere garantiti costituzionalmente,
416260	420980	non per una resistenza centralistica ma per la garanzia di un equilibrio che corrisponde
420980	426260	al modo in cui i cittadini considerano la necessità di una riforma federalistica, perché alla
426500	434460	fine va date questa questione, poi Bassanini spero riprenderà questo tema, il metro vero
434460	443720	della riforma, il principe è il cittadino e se noi riduciamo il tema della riforma dello
443720	450440	Stato ad un conflitto di ceti politici, che tali siamo, è poco da fare, centro e periferia,
451540	456300	di rappresentanze istituzionali, io credo che alla fine questo non porta da nessuna parte,
456440	462880	la cosa fondamentale è che alla fine il cittadino vuole avere uno Stato più efficiente, in
462880	468400	grado di funzionare meglio, di corrispondere meglio ai suoi bisogni, di garantire meglio
468400	474360	i suoi diritti e il metro della riforma deve essere questo e non l'equilibrio di potere
474360	482540	che si realizza tra segmenti istituzionali e tra aree del ceto politico. Allora io credo
482540	491080	che noi abbiamo disegnato un modello che è venuto formandosi con un contributo importante
491080	496140	anche a vincere l'esistenza conservatrice che è venuto da parte del sistema delle autonomie,
496400	504060	è un modello fortemente innovativo a mio giudizio, che non è ricalcato su nessun modello straniero
504060	508840	e che può presentare problemi, infatti io considero che la riforma avvierà una fase
508840	517260	costituente, anche di sperimentazione, perché il sistema dovrà mettersi in grado di funzionare
517260	522580	complessivamente in modo nuovo e credo che dobbiamo immaginare questa fase costituente
522580	528400	come una fase che coinvolga anche dal basso fortemente e che non venga soltanto calata
528400	539060	dall'alto. Le novità sono importanti e qui entro, comincio a entrare nel merito rapidamente
539060	545760	dei punti sollevati, le città metropolitane, le città metropolitane sono una grande novità
546400	552300	perché noi sciogliamo con un'innovazione costituzionale un dibattito che si trascina
552300	565600	da molto tempo e che non era riuscito. Qui si dice una cosa che su questo punto non condivido,
565740	571860	cioè che questo processo di formazione delle città metropolitane deve procedere dal basso
571860	581520	senza norme e parametri. Se noi immaginiamo la città metropolitana come l'abbiamo scritta
581520	590140	in costituzione, un livello istituzionale, un soggetto istituzionale che nell'area di
590140	600940	competenza sostituisce le funzioni della provincia, non si sovrappone e che ridisegna
600940	606580	anche il ruolo dei comuni. Mi pare difficile nel momento in cui sorgirà la città metropolitana
606580	612540	di Roma, che abbraccerà un complesso di comuni, che l'amministrazione della città possa
612540	619080	continuare ad avvenire nella forma comunale. Mi pare inevitabile che si andrà verso municipi
619080	625140	subcomunali, perché le attuali circoscrizioni prenderanno un peso diversi. È un processo
625140	630380	di riorganizzazione, ma noi possiamo aprire in modo indeterminato una rincorsa con tutti
630380	637500	i rischi localistici, a inventarci le città metropolitane, una forma pensata per le grandi
637500	644140	aree urbane del Paese, come se fare la città metropolitana fosse un mettersi un fiore all'occhiello,
644260	649680	con un rischio di che si apra un conflitto tra provincia e comuni capo il luogo, di tipo
650300	655360	generalizzato. Io ho qualche dubbio che questo corrisponde al modello federalista, ho paura
655360	665220	della confusione, sarà che ho una mentalità. Temo l'esplodere di localismi. Credo che la
665220	670660	soluzione verso la quale il Parlamento si oriente, cioè di stabilire in Costituzione, che intanto
670660	677160	partono le grandi aree metropolitane del Paese, che non sono trenta, secondo me non sono neanche
677160	685340	dodici. Le consideriamo con un criterio, diciamo, guardando all'estero. Dopo di che questo
685360	692620	non è preclusivo, non è preclusivo. All'atto della riforma costituzionale lì si comincia.
692820	699420	Dopo di che con legge del Parlamento è possibile individuare sulla base di una istanza che venga
699420	706900	dal basso altre aree metropolitane, ma con un filtro e con un criterio. Altrimenti qui,
706900	712840	stiamo attenti, questa la trovo una cosa politichese proprio, cioè è una cosa che è scritta per
713010	718570	un amore di compromesso tra di voi. Io rispetto i compromessi, ma dal punto di vista istituzionale
718570	725150	questo compromesso, non sono maestro, sono allievo, poi cerco di farne comunque guardando
725150	733610	all'interesse del Paese. Quindi da questo punto di vista io credo che occorra una misura
734450	740690	che valorizzi questa grande innovazione, che comincia a sperimentarla nelle grandi aree
740690	747870	metropolitane del Paese, che non chiuda, ma se noi vogliamo aprire il processo confuso
747870	754430	che poi non è avuto, io credo che una griglia ci vuole, lo difendono, non come fatto centralistico,
755070	761410	come garanzia di equilibrio del sistema autonomistico, per evitare l'aprirsi di un conflitto disordinato
761410	766050	nel sistema autonomistico, non si aprirebbe con il Centro, si aprirebbe tra i Comuni,
766050	772150	le Regioni e le Provinze, il Centro non c'entrerebbe nulla, anzi sarebbe assai più saggio cinicamente
772150	778170	lavarsene mai, direi mettiamo lì una bomba, poi si arrangeranno. Invece su altri punti
778170	788170	io credo, ne sottolineo uno, io penso che sia giusta la richiesta di forzare, nel senso
788170	794210	di un rafforzamento della forma di governo regionale. Noi intendiamo provvederli con
794210	799910	una norma transitoria che secondo me è stata, non l'ho pensata di, una felice intuizione,
801130	809530	perché la norma si inserisce sulla legge esistente e in sostanza la rafforza, dando alla legge
809530	816390	esistente il carattere di elezione popolare del Presidente della Regione con un rafforzamento
816390	822050	anti ribaltone di cui a mio giudizio si avvertiva la necessità. Questo secondo me può dare
822050	827850	alle Regioni, sin dalle prossime elezioni, maggiore forza necessaria per guidare il
827850	836610	processo costituente dal basso. Questo processo costituente deve allargarsi, deve coinvolgere
836610	845190	comuni e province. Ho qualche dubbio sul fatto anche qui di ingabbiare questo coinvolgimento
845190	853750	nella forma di un bicameralismo regionale, il Consiglio delle Autonomie, che davvero
853750	859810	qui se vorrete deciderete voi, perché sinceramente di che poi la Costituzione debba, una volta
859810	864650	stabilita l'autonomia statutaria delle Regioni, saranno le Regioni a decidere, a me interessa
864650	870470	che si scriva nella norma costituzionale che comuni e province partecipano alla definizione
870470	876270	degli statuti regionali. Se poi questa partecipazione dei comuni e province debba essere prevista
876270	882670	nella forma di una deliberazione dei Consigli comunali che discutono, che propongono emendamenti,
882850	887610	o nella forma di un Consiglio, cioè di un'Assemblia di secondo grado, ma questo sinceramente io
887610	892530	credo non si può chiedere al Costituente che stabiliranno le Regioni, le Regioni decideranno
892530	898610	le procedure attraverso le quali. Il Costituente invece può dare ai sindaci il potere di promuovere
898610	907750	il referendum sullo Statuto. E' un potere vero, e questo potere vero consiglierà le Regioni
907750	914070	a coinvolgerli, nel senso che le Regioni sanno di potere avere nei sindaci un interlocutore
914070	919470	che ha un potere vero, non è quello di esprimere il Consiglio, ma è quello di dire se io obietto
919470	928250	posso promuovere il referendum. Io ritengo che il punto vero, non vengo sul tema poteri
928250	935130	esclusivi dello Stato, poteri delle Regioni, noi dobbiamo affrontare dei nodi specifici,
935950	942650	ogni riferimento al fatto che bisogna ridurre i poteri. Su questo tema c'è un confronto
942650	949290	aperto molto forte, noi siamo di fronte non ad una resistenza centralistica politica,
949630	958110	noi siamo di fronte a forti preoccupazioni del mondo intellettuale, è molto forte nella
958110	964810	società civile, non nel ceto politico, la tendenza a considerare che su alcuni punti
964810	971670	la garanzia statale non debba venire meno. Nel Parlamento ci sarà un confronto aperto,
971730	977450	per voi non è che decido io, lì si vota, ma voi dovete sapere che il punto è questo,
977650	983870	cioè non è il conflitto verso le Forze Partiti o il Parlamento nazionale, no, se sul tema
983870	990150	del territorio, noi ci troveremo di fronte ad una forte richiesta di avere una garanzia
990150	993890	nazionale da questo punto di vista, questo non viene dall'interno del sistema politico,
994070	1000050	viene dalle forze intellettuali, dell'urbanistica italiana, dell'ambientalismo e questo è
1000050	1004710	un grande problema perché il sistema dell'autonomia, oltre a dialogare con noi lodevolmente, deve
1004710	1011150	anche cercare di convincere questa parte della società civile che il venire meno di una garanzia
1011150	1017330	statale su alcuni punti non significa attenuare quelle finalità positive che questi, questi
1017330	1022590	intellettuali, queste associazioni si propongono. Quindi voi dovete sapere che su questo tema
1022590	1028670	c'è un terzo interlocutore, c'è una parte della società che si è mobilitata con la
1028670	1035270	preoccupazione di difendere una potestà e una garanzia statale in certe materie perché
1035270	1040890	si teme che l'autonomia corrisponda ad un abbassamento del livello di tutela, della difesa
1040890	1048310	dell'ambiente, della tutela del territorio o della tutela dei beni culturali, eccetera.
1048430	1053730	Ma detto questo che quindi anche qui cercherei di spostare il confronto sul merito tenendo
1053730	1060110	conto del carattere reale del confronto, io penso che il punto su cui è possibile fare
1060110	1065550	un passo in avanti, esprimo un'opinione del tutto personale ma anche un forte auspicio
1065550	1071190	e se volete su questo anche un ringraziamento per il contributo che viene da voi è il tema
1071190	1077290	del rapporto centro periferia, cioè il modo in cui questo ordinamento federale dello Stato
1078270	1085350	si incardina nelle istituzioni centrali. Non c'è dubbio, mio giudizio, che malgrado gli
1085350	1089050	sforzi compiuti, e capisco che questo è il punto più delicato perché il punto in cui
1089050	1095310	il riformatore riforma se stesso e quindi capisco che non è facile, la soluzione trovata
1095310	1102210	nel tipo di bicameralismo dal quale partiamo è un punto debole della proposta della commissione
1103030	1111150	bicameralica, perché ancora confuso nella distinzione di ruoli tra le due assemblee,
1111450	1117950	perché il meccanismo dell'assemblea mista delle sessioni a cui partecipano i rappresentanti
1117950	1124750	locali a cui non partecipano è un meccanismo molto complesso nel suo funzionamento, perché
1124750	1130130	la rappresentanza del territorio comunque è presente in questo Senato come una sorta
1135270	1144370	di forza che si aggiunge, di ospiti che partecipano ogni tanto, e questo non mi sembra giusto,
1144590	1151190	io credo che questo è un punto da rivedere. Io non credo sinceramente, credo che la proposta
1151190	1158450	di bum des rata l'italiana è una proposta che a mio giudizio non corrisponde, io non
1158450	1167290	l'ho mai condivisa, è un modello tutto sommato estraneo e difficilmente compatibile con quella
1167290	1171850	complessità di soggetti istituzionali che caratterizzeranno il federalismo italiano.
1173090	1178930	E temo anzi che, stante la nostra tradizione, un Parlamento di secondo grado finisca per
1178930	1183350	non avere l'autorevolezza necessaria per rappresentare il territorio nelle istituzioni
1183350	1189870	centrali in modo adeguato. La mia opinione è che si debba andare verso un Senato federale
1189870	1197370	elettivo. Ho visto anche l'intervista stamane del Presidente Chiti che sottolinea la possibilità
1197370	1204470	che questo legame con il territorio muova anche dalla contestualità tra elezioni regionali
1204470	1212290	e scelta dei rappresentanti di una singola regione nel Senato federale, io credo che
1212290	1218330	sia un'idea giusta. Io trovo che questa idea è giusta, questo non vuol dire che passerà
1218330	1225750	perché sarà molto contrastata, ma secondo me è uno stimolo interessante. Un Senato
1225750	1234270	federale elettivo, eletto contestualmente ai consigli regionali, facendo venire meno determinate
1235510	1240550	incompatibilità e quindi consentendo anche ad amministratori locali di candidarsi e di
1240550	1245410	essere eletti dai cittadini, non di essere open legis senatori, ma in quanto eletti dai
1246130	1254570	cittadini, a me sembra che corrisponda ad una esigenza in modo equilibrato perché un
1254570	1259350	Senato federale elettivo, a mio giudizio, può svolgere anche le determinate funzioni di
1260350	1266770	non soltanto diciamo essere lo snodo di un rapporto centro periferica e allora in questo modo il
1266770	1273750	rapporto centro periferica si articola al livello dei governi nella conferenza stato regioni autonomie
1273750	1281190	che costituzionalizziamo e che diventa un punto di coordinamento a livello dei governi, a livello
1281190	1289090	parlamentare nel rapporto Senato federale elettivo, Camera dei Reputati, che diventa il modo in cui si
1289090	1294710	costruisce un equilibrio tra centro e periferica. Io credo che su questo punto davvero, se noi
1294710	1300470	riusciamo, dico se riusciamo perché bisogna convincere, se riusciamo a fare questo passo
1300470	1309470	in avanti, io credo che noi mettiamo in campo una grande riforma e mi farà piacere, ci ritroveremo
1309470	1318070	tra qualche anno, a scoprire quanto risulterà essere difficile secondo me, porre in essere
1318070	1324790	questa riforma e confronteremo le difficoltà a porla in essere con i dibattiti di prima quando
1324790	1333870	si diceva che era poco perché anche il regionalismo sembrò poco, ci vogliono vent'anni per farle e io
1333870	1340390	credo che questa riforma che appunto delinea un generale mutamento esposto alle funzioni
1340390	1345110	amministrative verso i comuni che attribuisce alle regioni compiti assai più rilevanti sarà
1345110	1352450	una grande sfida per il centro e per la periferia. Io vi ringrazio anche per la
1352450	1359550	sollecitazione, diciamo che spero giunga a chi ha il potere di decidere, noi abbiamo bisogno di
1359550	1364150	rendere più stringente anche l'esame, io capisco che il Parlamento è obberato di moltissimi impegni,
1365710	1371690	ma abbiamo bisogno di rendere più incalzante l'esame, noi non abbiamo problemi politici,
1371690	1379030	quelli che ci sono si risolveranno discuterne votando, non ci sono impedimenti da parte della
1379030	1385950	commissione, il progetto è depositato, il comitato lavora, anzi lavoriamo troppo poco semmai perché
1385950	1392370	non siamo sufficientemente, c'è bisogno di accelerare i tempi dell'esame della riforma ma
1392910	1400090	c'è bisogno di farla domani la riforma, ma la riforma deve essere fatta nei tempi giusti per il
1400090	1407270	Paese, sono le principali scadenze istituzionali. Se il Parlamento confermerà l'idea che il
1407270	1412790	Presidente della Repubblica aveva una legge dei cittadini, dopo averne tanto parlato,
1412930	1416910	se dovessimo arrivare l'anno prossimo a dire sì, nel frattempo lo eleggio il Parlamento perché
1416910	1421870	non ci siamo riusciti, credo che non ci capirebbe nessuno, credo che questa preoccupazione non sia
1421870	1427930	soltanto quella del Presidente della Bigamerale ma credo dovrebbe un po' preoccupare l'intero
1427930	1429730	sistema politico. Grazie.
