start	end	text
3740	19000	che stava pubblicato, che non stava pubblicato, sull'immagine della politica, terribile, presso
21100	32000	alla domanda, qual'è la parola politica, quale parola di politica, perché il concetto è stata una cosa spontanea,
35480	42360	in assoluto è la prima, il 13% di riferizioni spuntate, è conciso.
47120	58360	Poi seguono una serie di connotazioni, questo è il neutro, e poi alla fine c'è un gruppo
58380	75380	che non gli dà l'opinione, questo è il neutro. Ora, questo, io mi sono chiesto, chi, oltre
75380	82800	a questa parola politica, risponde di più a questa connotazione negativa, e badate la risposta
82800	90380	a questa domanda, è inciso, per fare le cose di molto tempo, secondo me, dove dovete,
91380	96140	ha eseguito prima, ha fatto prima l'opinione, diciamo, perché anche autotiticamente sono
96140	101240	quelli che hanno fatto l'opinione, però ora siamo in una condizione che ha fatto il primo
101240	111380	l'opinione, ora non c'è dubbio che lo schieramento politico sarà più individuale, più esprimibile
111380	121280	nella parola conciusura, potrà condevere, dicevo conciusura, le cose più belle del mondo,
121840	139780	ma è inevitabilmente portato, destinato, sulle muschie, e quindi io ritengo che per il
139780	150200	momento, se, attraverso tante vie, decidiamo insieme di appuntamenti comuni, di momenti
150200	159180	di sicurezza, i momenti in cui viene alla luce una cultura e una proposta del centro
159180	167720	silenzio, nella quale, ovviamente, concorrono diverse esprimazioni, ma che si presenti come
167720	173380	una realtà, io sono convinto che questo elemento coesivo è molto più importante
173380	181960	di quelli coercitivi elettorali, alla fine la forza, l'unità di una coalizione non è
181960	187480	nell'obbligo di stare tutti insieme, perché la luce elettorale c'entra, ma è nella
187480	192120	condivisione di un progetto comune, anche perché abbiamo visto quell'obbligo elettorale
192120	203800	che si evace dopo l'inizio del cielo, fece la convinzione di un progetto comune. Grazie.
218920	225380	Bene, abbiamo un poco più di un'ora di lavoro con la nota interruzione, abbiamo
225380	254940	chiesto a Bruno Manchi di aprire una discussione, lasciamo un minuto, perché forse in questa
254940	260460	condizione, ma forse c'è qualche posto là in mezzo, se quelli che sono presso le
260460	270620	porte vogliono cercare o essere aiutati a trovare posto. Venendo da fuori ho accettato
270620	278820	di fare questo intervento di snellimento dei lavori, anche se il tema che mi è stato
278820	285560	richiesto di trattare ha un tono cupo, che è il tono lavoro, come è stato trattato
285560	296820	negli ultimi dieci anni. Quindi mi limiterò a poche... calma. Tema lavoro, mi limiterò
297840	306560	a poche osservazioni che tengono conto dell'esperienza di molti antipresenti che, sulla questione
306560	316560	del lavoro in varia veste, si sono occupati e si occupano. A me sembra che i politici
317180	325620	di varia posizione, i vescovi, i sindacalisti e altre categorie sociali abbiano con straordinaria
326760	334140	convergenza, dato del lavoro negli ultimi dieci anni, un'immagine pericolosa per chiunque
334140	342740	voglia trattarlo come una questione risolvibile. Nel senso che, agli occhi nostri, il lavoro
342740	348560	viene, nel messaggio finale, insomma, come viene percepito, trattato come in maniera
348560	356220	ossessiva e compatta, coi tassi di disoccupazione, tassi di attività, giovani disoccupati, col
356220	365280	colpo e anche il corpo, questo crea una parete non scalabile, non attaccabile se non con
365280	371220	mezzi artificiali, per cui, se capita qualche successo, deriva da variabili internazionali
371880	381640	e non è mai sufficiente. Ma anche un limitato successo viene sempre giudicato al di sotto
381640	387960	della parete che è stata proposta. Questa è stata una svista che è unanime, c'è sinistra,
388000	393020	destra, centro, ma che ha le sue radici più forti nella sinistra, non c'è dubbio, che
393020	398640	ha usato storicamente, quando era il caso, questo tema come un ribaldello per affermarsi
399300	411480	come forza positiva. Io credo che questo sia uno dei primi punti di chiarimento tra chi
411480	417920	è un informista, cioè a trattare in maniera diversa e non retorica questo tema. Vale
417920	426320	a dire che non è compito delle politiche pubbliche, complessivamente scalare tutta la
426320	433960	parete, ma ci sono dei compiti che vanno definiti. Perché? Perché anzitutto ci sono delle difficoltà
433960	438780	nella nostra testa strategica, io parlo a quelli che si occupano della cosa, facciamo
438780	443400	un sacco di errori, sbagliamo molto spesso, anche parlando con gli amici che in altri
443400	449640	paesi si occupano di queste cose, sono terreni difficili se non sono microprogetti, di cui
449640	457180	va sempre valutato il costo. Ma soprattutto abbiamo risorse limitate, come raramente nella
457180	462740	storia è stato dato, cioè noi abbiamo poche risorse da offrire per il lavoro, come risorse
463360	469740	pubblico. Queste risorse tra l'altro, se sono, come andrebbero, indirizzate volontaristicamente,
470760	474600	alla fine non vengono spese, perché la pubblica amministrazione e altri inghippi, come è
474600	480740	stato notato nei patti territoriali, ne rendono difficile l'utilizzo. Quindi ridimentano risorse
480740	490360	automatiche, ma le risorse automatiche, anche se quotate secondo le aree, vanno sempre a
490360	497820	un certo. Quindi noi, un sistema pubblico che ha poche risorse e con poche libertà d'azione
497820	505500	fa male ad accettare, a inventarsi una sfida generale sul lavoro che non esiste, e a non
505500	511620	lasciare alla società e ai soggetti di farsi loro una parte di questa sfida. Questa è
511620	516920	una revisione, capisco, può apparire in popolare all'interno di un ceto che non è solo politico,
516920	523660	ma anche sindacale, vescovile, ceto pubblico, in senso largato, però secondo me, se non
523660	530520	si fa questo, non si produce qualcosa di interessante sull'aroma. Questo va alla maggior ragione
530520	537600	per il sindacato e per le azioni industriali. Io, praticato amo e vivo nel sindacato, insomma,
537800	543260	nella storia occidentale del sindacato ci sono dati pochissimi episodi in cui il sindacato
543260	550160	ha potuto per brevi momenti rappresentare i non occupati. Il mestiere del sindacato è
550160	557820	un altro, può non impedire l'espansione, può, voglio dire, non essere un ostacolo, però
557820	562160	si è visto raramente, certo, gli accordi che vi aggiungo stabilmente al sud, ma anche
562160	567480	nella storia nordamericana, sono casi molto delimitanti, quelli in cui il sindacato agisce
567480	573600	per chi non ha lavoro. Fingere altro è fare veramente, per non parlare dell'associazione
573600	579420	imprenditoriale. Esistono qui invece singoli imprenditori e padroni, come dico io, che hanno
579420	585480	avuto a cuore e hanno a cuore l'occupazione, specialmente se legati ad una certa area geografica
586280	593940	in una dimensione comunitaria, in un forte espritusino, ma le rappresentanze imprenditoriali
593940	598780	non hanno tra i loro compiti quello di espandere. Possono sperare, augurarsi, che ci espandi
598780	604580	il lavoro, però lì c'è la domanda. Non hanno strumenti di comando nei confronti dei loro
604580	612620	associati per politiche di questo tipo. Questo mi porta a ritenere che mentre la concertazione
612620	619520	ogni tanto nella storia non sempre per risanare o fare una politica dei redditi è uno strumento
619520	625840	di straordinaria importanza, il ripetersi e succedersi di eventuali fatti sociali sul
625840	634580	lavoro non porta niente, porta poco. Porta dei risultati assolutamente affidabili, meglio
634580	642000	conflitti negli ozziati, purché la relazione in questo mi confortava. Mi sta parlando che
642000	648260	non serva una mentalità cooperativa tra le pare, che non ci sia un modo di intendere
648260	653160	le questioni nazionali che va al di là degli interessi. Questo è essenziale, ma di qui
653160	658940	ha un patto in cui si scambiano delle cose importanti tra i interessi. Io questa strada
658940	666440	sul lavoro, francamente la vedo difficile, è già tentata con scarso successo. Solo singoli
666440	675460	accordi certamente possono essere in conclusione. Questo, diciamo, pulire questo modo di vedere
675460	683120	più tranquillo, insomma, la questione, porta però a rendere più responsabili delle cose
683120	687460	che effettivamente bisogna fare. Si è di fronte alla grande parete, si è irresponsabile,
688420	694360	si è soltanto dei turisti. Se si vuole salire, insomma, bisogna fare l'altro. Primo punto
694360	700020	qui, studi, ricerche, esperienze, i Chino a Cornero, il primo punto è che non solo da
700020	705080	Cornero, ma anche nei famoli statuli dell'America, questo mercato del lavoro ha delle difficoltà
705080	711120	informativa interna, straordinaria, che assigla padroni e lavoratori. E quindi la crescita
711120	715960	dei sistemi informativi privati, non parlo pubblici, non le polistiche, qui vedo anche
715960	722920	il sitacato, altri noi sono, sono fondamentali, nel senso che la perdita di risorse dovuta
722920	728460	al non incontro di domande offerta aumenterà sempre di più e la nuova economia, in questo
728460	735720	senso, sarà più lucidioso, più un punto di regolazione, dico secondo, come ci insegnano
735720	741520	gli amici inglesi che i casi di occupazione sono ben diversi? Beh, guardate che ci sarà
741520	748640	comunque, c'è e ci sarà un gruppo di persone che via mercato al lavoro non c'è mai. E queste
748640	754760	persone non diminuiranno, ma aumenteranno la nuova economia, perché il livello di dotazione
754760	761340	è richiesto qui, dove non funziona il mercato, qui ci vuole la politica pubblica e lasciamo
761340	766680	stare assistenziali o no, dimisuriamo l'efficienza delle forme di assistenzialismo, perché è
766680	772440	ugualmente assistenziale dare un reddito o dare un lavoro in maniera privilegiata. L'importante
772440	778360	è cosa risolve socialmente questa cosa, questo è un dovere pubblico, questo io credo venga
778360	783820	a essere richiesto da tutti. E questa è una cosa che evidentemente va fatta e va fatta
783820	789640	anche in paesi dove è più di modo un certo liberalismo. Il terzo compito, tutto nostro
789640	794600	più difficile, è come nelle grandi aree metropolitane del sud, perché poi di questo
794600	800220	si tratta, si affronta il problema dell'inoccupazione e dell'asilo di occupazione. Qui ovviamente
800220	806660	tutti i dati CTC chiamano alla cautela, al coraggio, ma la cautela è già molto importante.
806660	813860	E qui ci sono il mercato dell'idee non male, creare in queste situazioni due poli, uno
813860	819580	di economia legale, che sia in qualche misura competitivo dal punto di vista della mentalità
819580	824420	delle regioni e delle generazioni con quello tradizionale. Questo è possibile, sta in
824420	836140	qualche misura avvenendo, va premato. E infine il quarto punto sono tutte le pratiche, qui
837140	842020	sono tutte le pratiche. E' un po' stinco, come si sente piemontese da cui vengo, ma
842020	849980	tutti in nord centro-nord. E' un assurdo pensare che un pensionato di 59 anni e 61 non va da
849980	854140	la donatina. E si, a scuore già c'è una cosa proprio voglio dire, antropologicamente
854680	860660	non prevista, ci vorranno venti generazioni per arrivare a questo. Per cui questa, nei
860660	867200	nostri luoghi, è la risorsa prima della nascita di un grande sorpresso. Il sorpresso non è
867200	872640	soltanto nei campi, ora con olo olo, c'è nelle fabbriche, negli uffici, nei servizi,
873180	878780	eccetera. Quindi questo accanimento contro il cumulo, questa regolarizzazione, è una
878780	883260	follia, una follia che nella mentalità della gente è cargata a sinistra. Cioè, su questo
883260	888480	non c'è dubbio. Nella mentalità della provincia di Cuneo, questa Sicorica, questa Livia, questa
888480	893920	cosa è cargata a sinistra. Ora, possiamo stare a sinistra o a destra. A volte noi abbiamo
893920	900900	dei sistemi regolamentari che producono delle aree di sommesso, perché contrastano non con
900900	907480	dei meri interessi, ma con dei costumi, dei sistemi di vita, insomma, che noi violiamo,
908580	918460	ma non impunimenti. L'ultimissima cosa, c'è un alto sull'orario, eccetera, ma c'è
918460	923660	un alto sull'orario. Chi percorre i mondi del lavoro si rende conto che le modalità,
923720	931280	i modi di lavorare, non solo quanti, non solo infelici, si stanno moltiplicando. Intanto
931280	939520	nel terzo settore, le economie di comunione, gli artigiani informatici, c'è un orizzontano,
939540	945860	c'è, si stanno sfondando delle modalità giuridiche del lavoro, sia per scelta volontaria,
945860	952060	sia per l'economia comunitaria, sia perché c'è la nuova economia, che vanno in qualche
952060	957400	misura aiutate, viste, c'è molta più libertà nel scegliere un apporto tra vita e lavoro
957400	962940	oggi di quanto la mia generazione giovane abbia conosciuto. Questo è una risorsa civile
962940	968100	di grande importanza. Dentro questo, però, è strano che nel centro-sinistra, eccetera,
968200	973140	si ha sottovalutato una cosa che in altri paesi viene fatta, che là dove i lavoratori
973140	979180	dipendenti, nelle loro imprese, vogliono sperimentare la partecipazione, devono essere
980080	985300	facilitati, che sia questa partecipazione azionaria collettiva, sia questa partecipazione
985300	990560	ai rischi, sia questa partecipazione all'organizzare il lavoro. Questo è un orizzonto, un orizzonto
990560	995160	storico del movimento operaio, e non è un orizzonto solo incantologico di altri, è
995160	1000240	una forma di emancipazione collettiva rispetto al rapporto di lavoro subordinato. Questo
1000240	1005180	non dico che sia una cosa programmatica, però questo nel momento in cui si è discusso
1005180	1010180	il governo delle società e delle imprese, questo è stato tagliato fuori, completamente,
1010640	1015240	dall'orizzonte riformatore del centro-sinistra.
1018560	1024140	Ho chiesto a Andrea Ranieri se poteva continuare su questi temi del lavoro.
1030240	1036700	Io parlerò, vorrei molto sinteticamente esprimere una tesi, prima, che siamo davvero di fronte
1036700	1044380	a una trasformazione rivoluzionaria del modo di lavorare, e che questa trasformazione
1044380	1050400	rivoluzionaria bisogna reagire costruendo un nuovo paradigma di tutelle che ha al suo
1050400	1059040	centro la formazione come modalità fondamentale per riascurare le sicurezze al mondo della
1060240	1066580	flessibilità. Cercherò di farlo, ovviamente per scontato la dimostrazione della prima
1066580	1072580	tesi, cioè che siamo di fronte a una svolta molto particolare, cercherò di farlo cercando
1072580	1079820	di vedere due situazioni, i lavoratori che evocava Massimo D'Alema nel suo intervento,
1080120	1085980	i lavoratori della conoscenza, quelli che vengono chiamati, definiti ormai così, i
1085980	1090680	nuovi lavoratori delle tecnologie informatiche e della comunicazione, ma non solo, anche
1090680	1096880	quelli che applicano le nuove tecnologie nella vecchia economia e quelli che hanno come
1096880	1103880	obito la produzione e la riproduzione del servere. Questi lavoratori ormai sono tanti,
1105220	1109980	nessuno li mette al di sotto del 30%, sono un po' meno in Italia che nel resto d'Europa
1109980	1116920	forse del peso grosso della piccola impresa, non so se bastano affondare un nuovo paradigma
1116920	1121740	sociale, dico solo che quando si parlava di paradigma taylorista, di operai tayloristi
1121740	1129620	non sono mai arrivati a essere più del 22% dell'intera popolazione lavorativa. Sono
1129620	1135660	quindi una massa con un problema rispetto al vecchio modello taylorista, che sono una
1135660	1141740	massa di individui, di persone, uno diverso dall'altro, anzi, utili alle organizzazioni,
1142940	1147780	se hanno un sapere proprio, che permette quello scambio tra organizzazioni e persone,
1147780	1152760	che è quello arricchimento continuo che è il punto di forza della learning organization,
1152800	1159780	dell'organizzazione basata sull'apprendimento. Badate, queste organizzazioni tendono a fidelizzarli,
1160680	1169160	non a precarizzarli, le vorrebbero il più possibile e fedeli all'azienda. Parlando
1169160	1174700	con la federazione delle industrie informatiche viene fuori che loro propongono che quando
1174700	1178820	si fa un contratto di formazione e lavoro per questi lavoratori ci si è subito scritto
1178820	1184280	che saranno assunti a tempo indeterminato. Sono questi lavoratori che hanno qualche
1184280	1188700	difficoltà in più a accettare questa regola, a accettare il modello di tempo indeterminato
1189340	1196140	come modello di tutela, perché pensano che possono avere più opportunità restando liberi
1196140	1204480	e chiedendo soldi per la riconferma all'interno di quel sistema. Sono il nuovo centro della
1204480	1209960	produzione del valore e non imparano semplicemente attraverso l'estramento, hanno bisogno di
1209960	1215060	una cultura forte alle spalle che preceda il loro ingresso in azienda, che permette
1215060	1220740	a loro di essere sì specialisti, ma specialisti di tecnologie che hanno come caratteristica
1220740	1227900	la specificità, cioè un'illimitata varietà di usi e di applicazioni. Da questo punto
1227900	1233900	di vista il ruolo della politica dello Stato è decisivo, si fonda con loro uno degli elementi
1233900	1239600	fondamentali delle possibilità di sviluppo del Paese, con loro attraverso la loro formazione.
1239900	1245140	Non hanno bisogno di sicurezze collettive, non hanno bisogno di diritti, io dico di
1245140	1250680	sì, però dobbiamo in qualche modo pensarli con loro, anche vedendo come si comporta.
1250920	1257500	Da dove hanno possibilità di scelta, scelgono inesorabilmente le organizzazioni che assicurano
1257500	1265780	a loro le maggiori possibilità di apprendimento, più del reddito, più della sicurezza attraverso
1265780	1271820	il tipo di rapporto di lavoro. Scelgono in questo senso. Ne balate bene, non tutte lo sono,
1272960	1279520	perché non ragioni insite della tecnologia, ma io dico ragioni di dominio e di potere,
1280000	1284500	permettetemi queste termine, fanno sì che in molte organizzazioni le nuove tecnologie
1284500	1291080	vengono introdotte con modalità neo-tailoriste e costruiscono ruoli e professioni anche per
1291080	1296380	quelli delle nuove tecnologie a professionalità bloccate. Non è ineluttabile, ma spesso è
1296380	1303660	così. Allora forse loro hanno bisogno da un lato di qualcuno che assicuri loro la formazione
1303660	1308560	continua delle proprie competenze, che il loro valore di forza all'interno di questo
1308560	1313840	tipo di mercato del lavoro da un lato e dall'altro hanno bisogno di una nuova attenzione della
1313840	1319220	sinistra e del movimento dei lavoratori alle questioni delle organizzazioni del lavoro.
1319480	1323720	Guardate, una cosa, io continuo a considerare una cosa paradossale, la sinistra ha discusso
1323720	1328140	per anni di organizzazione del lavoro quando l'organizzazione del lavoro era tailorista.
1328420	1333880	Non ho mai pensato che nemmeno nel tailorismo ci fosse la one best way, la via migliore
1333880	1340520	e assoluta. Avevano qualche motivo in più per provare a farcelo credere. Oggi non è
1340520	1345560	così, le nuove tecnologie permettono davvero possibilità di scelta, un'organizzazione
1345560	1351320	che introietta nuove tecnologie mette a disposizione possibilità di scelta più grandi
1351320	1356280	che nel passato. Non è scritto nel libro di economia, non è scritto in qualche necessità,
1356440	1362860	in qualche determinismo tecnologico, se sapere va in un cor di pochi rendendo precarie ignoranti
1362860	1369880	che non resta, dipende dalle scelte che si fanno. Per queste scelte bisogna forse ricostruire
1369880	1377760	una cultura collettiva di sinistra. Guardiamo i lavoratori esecutivi che continueranno
1377760	1383480	ad aumentare, non vengono meno, non sbettono, ci saranno ancora e ci saranno tanti, ma guardate
1383480	1389340	bene anche per essi, la tecnologia e la globalizzazione che sottopongono la tensione di cambiamento
1389340	1395880	molto forte, molto forte. Le nuove tecnologie cambiano anche loro e diffondono in maniera
1395910	1402910	che inedita ruoli di responsabilità anche all'interno dei lavori tradizionalmente esecutivi.
1403890	1409310	La globalizzazione anche nei distretti di piccole imprese chiede comunque uno spostamento
1409310	1413770	delle produzioni verso quelle a maggior valore aggiunta che richiedono lavoratori più competenti
1413770	1418410	e più professionalizzati, cioè la possibilità di esternalizzare, di inseguire il costo del
1418410	1424110	lavoro là dove è minore, fa sì che tutti i distretti ormai rispondono positivamente
1424110	1429870	che la tensione sia a radicare la cultura e la professionalità del distretto nei settori
1429870	1434970	più alti della produzione, succedono i test, il meccanico, ma succede insomma in tutti i
1434970	1440110	distretti che reagiscono in maniera positiva all'esternalizzazione. Anche per loro quindi
1440750	1446290	la formazione continua è una necessità e la formazione continua e la certificazione
1446290	1451950	delle competenze può diventare un nuovo fattore di sicurezza e opportunità ad aggiungere
1451950	1458130	sicurezza di terra alla produzione. Un poco tempo fa ho partecipato con Luciano Gallino
1458130	1464470	alla presentazione di una ricerca sulle tre testi del distretto di Carpi, non hanno problemi
1464470	1479570	di disoccupazione, il 3,0 condotto dal... non c'è tensione, non rischiano disoccupazione,
1479570	1485910	ma la mobilità riguarda il 25% delle lavoratrici, all'anno il 25% delle lavoratrici di questo
1485910	1493410	settore, il 25%. Non c'è lavoratrice, quasi insomma l'80% delle lavoratrici durante il
1493410	1499990	corso della loro vita ha cambiato impresa e spesso sono passate dallo statuto dei diritti
1499990	1507670	a fuori e le sono rientrate, passando da imprese di 15 dipendenti a prese di meno di 15 dipendenti
1507670	1515070	a qualche volta facendo il percorsionese, cioè sono state garantite, tutelate secondo lo statuto,
1515150	1521730	sono state non tutelate durante il lavoro. Conevano un problema a queste lavoratrici durante l'impianto
1521730	1526570	della ricerca di non essere costrette a cominciare da zero ogni volta che cambia l'impresa in
1526570	1534510	cario di un lavoro. Cioè avere qualcuno che, qualche sede, che certifichi la loro professionalità
1534510	1540990	e le loro competenze, la loro storia professionale individuale, convinta di una cosa che per essere
1540990	1546410	flessibile l'identità personale e professionale è fondamentale, è flessibile, è una cosa che si piega ma
1546410	1551510	ricomma a punto di partenza, le vite spezzate non sono possibili, pensare di costruire la flessibilità
1552270	1560150	spezzando vite non si può. E allora ci chiedevano e ci sfidavano su cose importanti, di descrivere anche
1560150	1565570	il loro lavoro, considerato tradizionalmente un lavoro povero in termini di competenze e di sapere,
1565890	1572630	di scoprire l'atto intelligente del loro lavoro, di dargli attraverso questa via dignità,
1573330	1578110	di aggiungere alla sicurezza tutela, alla sicurezza opportunità del ricorso continuo di strumenti
1578110	1585890	e percorsi di formazione. Guardate, una cosa grossa e decisiva, io sostengo la vera tutela
1585890	1594190	dentro un'organizzazione del lavoro di questo fatto, perché vedete i disoccupati sopra i 45 anni,
1594190	1601350	quelli che hanno avuto la vita spezzata, sono gente che spesso hanno lavorato spesso nello stesso posto di lavoro,
1601770	1610390	facendo lo stesso lavoro e si sono trovati a 45 anni quando c'è una crisi aziendale o quando cambiano rapidamente
1611430	1618390	a essere considerati inutili, si è sopperita questa cosa attraverso i prepensionamenti, attraverso tante cose strane
1619650	1626810	e però sono quelli, quelli che hanno perso, quelli che hanno perso, e che hanno perso erano tutte le caratteristiche in comune,
1626910	1633390	il passo al livello di scolarità è non essere mai stati coinvolti in tutta la loro vita in percorsi di formazione di aggiornamento.
1633390	1645630	Non tanto se erano, se avevano timbro del lavoro al tempo indeterminato, se non l'avevano, e questi discano oggi di essere più esclusivi,
1646390	1651350	cioè la bassa qualificazione, il basso livello di scolarità è oggi il maggior discchio occupazionale,
1651390	1659150	i diplomati e i laureati ci mettono di più a trovare lavoro, ma è quasi impossibile trovare i disoccupati sopra i 45 anni,
1659150	1668070	certo il linguaggio vuole un salto culturale forte, cioè assumere la cura del lavoratore come elemento essenziale delle politiche di flessibilità
1668070	1677430	e su questo costruire un nuovo patto con le imprese, una nuova dimensione di scambio, che costruisca flessibilità assieme a questa nuova generazione di sicurezza
1677430	1683470	che ha nella formazione, che ha nella formazione il suo punto, il suo punto carico.
1683470	1693670	Abbiamo fatto su questa strada tante cose importanti, io credo però che se vogliamo presentare su questo terreno,
1693670	1701510	presentarci con il 2001 con un programma forte, devono cercare di fare, lo dico al Presidente del Consiglio di qua al 2001,
1701510	1712510	tutte le cose possibili per portare a fondo il ciclo di riforme che su questo terreno abbiamo avviato in questa legislatura.
