start	end	text
1715410	1724850	Insomma, sul terreno della scuola, dell'università, della formazione forse possiamo dire di avere completato quasi tutto il programma dell'Uni.
1724850	1737070	Portarlo in fondo diventa l'imperativo di questi dieci mesi. Questo significa alzare, innalzare complessivamente i livelli di sapere, l'obbligo formativo a 18 anni,
1737330	1745770	completare la riforma dei cicli, assumere la formazione come un nuovo diritto. Vedete, se la discussione sullo statuto dei diritti dei lavoratori,
1745770	1759710	invece che partire sulla soglia dei 15, partisse da questo nuovo diritto che tiene insieme uguaglianza e libertà, interesse collettivo, interesse della persona,
1760230	1766910	e forse credo che potremo fare un salto in avanti anche nel ridisegnare i diritti dei lavoratori.
1766910	1780190	E qualche passino avanti, dobbiamo fare anche sul terreno della contratazione. Insomma, o la formazione diventa un elemento contratuale come l'orario, come il salario,
1780510	1790410	o se no abbiamo davvero difficoltà a costruire questi nuovi momenti di tutela. L'ultima cosa e poi finisco. La formazione continua.
1791610	1801850	Dato da quel codetto appare l'elemento decisivo. A inizio legislatura, nel patto sociale, col sindacato che su questo si è speso davvero molto,
1802090	1812410	e in senso innovativo, avevamo costruito una strada per dotare l'italia di un sistema di formazione continua. C'è stata la Corte dei conti, ci sono state varie vicende.
1812530	1823710	L'impressione mia e nostra è che tutte queste vicende, se c'è davvero una volontà politica, non sono in grado di impedire il varo,
1823710	1832410	entro la legislatura, di un sistema moderno di formazione continua all'interno di questo Paese. Io credo che questo è un impegno ad assumersi davvero.
1832410	1840410	Cioè se vogliamo fare della prossima campagna elettorale una cosa che parla al futuro, all'innovazione, è difficile farlo con un Paese
1840410	1850410	in cui il governo di centro-sinistra non è riuscito in 4 anni a innalzare lo zoccolo duro del 2% dei lavoratori adulti coinvolti in processi di formazione.
1850410	1857430	E guardate bene, ci vorrà probabilmente un nuovo patto sociale, io sono lento d'accordo con le cose che diceva Massimo D'Alema,
1857690	1866370	ma è impossibile fare un nuovo patto sociale con la formazione dei lavoratori adulti che coinvolge il 2% dei lavoratori adulti.
1866570	1876870	È impossibile cioè passare dalla logica del risarcimento a quella della promozione, dalle sicurezze tutela, dalle sicurezze e opportunità con questo sistema di formazione continua
1876870	1888170	e ricorrente nel nostro Paese. Mi credo che su questo valga davvero la pena di spenderci le risorse complessive, le risorse di impegno complessivo del governo.
1888450	1896850	Io credo che davvero questo sia uno dei messaggi più forti che centro-sinistra può dare per parlare al futuro.
1899250	1907850	Per parlare, c'è un'idea della politica che parla al mondo della produzione, dell'educazione, dello sviluppo oltre la redistribuzione.
1909090	1917370	Perché vedete, parlare di formazione, di innovazione, di ricerca significa dare al pubblico un ruolo che lo mette a monte,
1917610	1924950	che ne fa una condizione degli stessi processi di sviluppo e non semplicemente il momento finale della redistribuzione.
1926290	1938050	Io credo che sia possibile ricostruire su questo terreno un'utopia, una voglia collettiva che ha a che fare con le persone che ti parlano,
1938390	1948690	ricollegare il valore di mercato del lavoro alla soddisfazione che le persone nel lavoro possono trovare, quelle più alte ma anche quelle esecutive.
1948690	1956110	Che poi, la cosa che sta provando a fare Amartya Singh, questo libro sviluppo e libertà in cui la proposta di fondo
1956110	1963810	è quest'idea di rileggere i diritti universali sul terreno delle capabilità, delle competenze delle persone, della costruzione delle capacità delle persone,
1964190	1970690	non solo negli operari e tessi di cui parlavo, ma anche nelle donne dei paesi africani più sottosvilupati.
1971430	1982830	Io credo che solo in questi termini, riproponendo una ipotesi grande di questo tipo, riproponendo insomma qualche sogno e qualche speranza per il futuro,
1983110	1988770	possiamo pensare di vincere, perché vedete, tra tutte le cose che diceva la Rena che io condivido, ne dico un'altra,
1989550	1994690	l'economia del sapere, la new economy è fino ad oggi stata il sogno dei ricchi.
1995370	2003910	Ricchi di soldi, ricchi di sapere, sapere con i soldi nella città di mercato spontaneamente da solo che ce l'ha già.
2004550	2011070	Io credo che attraverso un discorso rigoroso e serio sulla formazione e sulle promozioni dell'opportunità,
2011790	2017610	forse possiamo far diventare la nuova economia anche un sogno e una speranza per chi lavora a operazione.
2055610	2062690	Io vorrei fare alcuni commenti sul tema di cui mi occupo, che credo che potrebbe succedere,
2063990	2075690	e vorrei partire cercando di declinare su questo tema alcune delle cose generali che sono state dette da Massimo De Lema nella sua relazione introduttiva,
2077070	2089110	per poi fare alcune brevi proposte su quali ingredienti potrebbero trovare collocazione in quel nuovo patto sociale
2089110	2097470	dal quale dovrebbe avere origine il nuovo welfare anche in vista delle scadenze elettorali.
2097470	2109570	Allora, l'agenda nel campo della politica sociale è emersa in Italia nella metà dello scorso decennio,
2109950	2120710	perché accompagnato alla legislatura che si verrà l'anno prossimo, prevedeva essenzialmente tre operazioni,
2122030	2132710	il termine generale è quello dell'equilibrio della ricalibratura, una ricalibratura funzionale del nostro sistema di welfare,
2133410	2140690	spostando risorse ad alcuni rischi sopraprotetti verso alcuni altri rischi sottoprotetti,
2140690	2148610	in particolare dalla vecchiaia sopravvivenza che sono nel nostro sistema di welfare in cui rischi sopraprotetti
2148610	2156550	a famiglie, famiglia, povertà e politiche attive del lavoro che sono quelli sottoprotetti,
2157210	2164790	una ricalibratura distributiva che ha a che fare non con i rischi ma con le categorie sociali
2164790	2178790	e infine una ricalibratura, un riequilibrio organizzativo che ha a che fare con la divisione del lavoro tra livelli e attori decisioni.
2180730	2193810	Rispetto a questa agenda sicuramente come è stato riconosciuto nella relazione di abertura sono state effettuate alcune significative realizzazioni,
2194770	2202810	pensiamo alle riforme in campo finanziale, alle riforme in campo sanitario, eccetera eccetera.
2203950	2218310	Sono state in questi settori introdotte delle nuove impalcature, i nuovi sistemi di regole che però avranno come è stato riconosciuto tempi lunghi per di spiegare i doppio effetti
2218310	2231690	e difatti se osserviamo gli indicatori classici da gli andamenti della spesa o la sua distribuzione interna a un impatto distributivo di questa spesa
2231690	2240670	facciamo fatica ad oggi a rintracciare gli effetti di queste riforme che pure sono state incorpate.
2240670	2252670	L'agenda, questa agenda di ricalibratura è però in buona misura incompiuta e anche questo è stato riconosciuto.
2253690	2267070	I tempi di realizzazione di alcune riforme sono troppo lunghi tipicamente per la pensionistica, vi sono stati e vi sono tuttora dei ritardi su alcuni fronti critici,
2267070	2281070	penso alla previdenza integrativa, penso alla riforma non fatta degli ammortizzatori sociali, penso alla mancata approvazione, ad oggi, della legge quadro sull'assistenza.
2282370	2292610	Vi è stata una timidezza eccessiva nel riorientamento concreto della spesa sociale verso le fasce davvero più bisognose.
2293510	2307610	Penso all'avvio faticoso del nuovo strumento di verifica della situazione economica, l'ISE, e all'ambito di applicazione molto ristretto di questo strumento che pure è molto promettente,
2308730	2324650	penso al ritardo nell'avvio del sanitometro, che è l'equivalente dell'ISE in campo sanitario, e vi sono state anche alcune incertezze sul piano della progettazione organizzativa e istituzionale.
2325690	2336830	Quindi se questa diagnosi è corretta, e come ho detto in parte questa diagnosi declina in maniera più specifica quello che è stato detto nella relazione di apertura,
2337190	2346050	allora la prima conclusione, la prima applicazione da trarre è che bisogna al più presto portare a compimento questo progetto, questo disegno.
2346050	2360930	E vi sono delle cose, dei passi, delle riforme che possono e forse debbano essere portate a compimento, fatte e effettuate ancora prima del termine della legislatura.
2360930	2380930	Non credo che bisogna avere troppa paura sul piano del consenso, perché anzi il mancar non riusciva a portare a compimento alcuni tasselli di questo importante progetto di ricalibratura
2380930	2399930	che stato di atto potrebbe lasciare nell'elettorato proprio quella impressione di confusione e di bassa capacità di agire di cui parlano le ricerche citate da Massimo Dall'Elito.
2403550	2418430	Ma, vorrei passare al secondo punto, e cioè quali potrebbero essere gli ingredienti di un rilancio, di un nuovo progetto da presentare per il futuro.
2420170	2430430	Qui avrei, ovviamente non ho un progetto sistematico da prospettare, ma avrei tre idee da sottoporre alla vostra attenzione.
2431070	2445430	La prima è quella di lanciare in maniera più coraggiosa e esplicita, nel dibattito italiano, quella nozione che ha avuto molto successo in molti paesi europei negli ultimi anni a cominciare dall'Olanda,
2445430	2463230	che in inglese è flex security, che in italiano potrebbe essere tradotta con flex sicurezza, se vi piace il termine, e che è il tentativo di conciliare in una parola sola quelle due esigenze che sono state richiamate prima,
2463230	2485150	cioè di accomodare, di rispondere a quella esigenza di autonomia, di libertà e di flessibilità che emerge dalla transizione verso la nuova economia da un lato, ma anche quella esigenza di un campo da gioco livellato e di un sistema di garanzie certe, sicure per tutti, dall'altro.
2488870	2512430	La flex sicurezza ha una Parse Constituents che ha a che fare con queste nuove garanzie da introdurre o da livellare per tutti, che sono garanzie di protezione minima verso il bisogno, garanzie di una rete di servizi omogenea per le famiglie e soprattutto per le donne,
2513290	2531430	garanzia minima in campo previdenziale per quei lavoratori atipici, che sono già stati più volte ricordati, che con la nuova impalcatura istituzionale messa in piedi nel 1995 rischiano di arrivare alla pensione con trattamenti inadevuati.
2533150	2560690	Ma la flex sicurezza ha anche una Parse Destruents che ha a che fare con alcuni aspetti del nostro sistema previdenziale che non sono stati toccati o sufficientemente riformati, con certe tutele nei rapporti di lavoro, con la strutturazione del lavoro nelle pubbliche amministrazioni.
2562750	2590590	Conciliare le due parti, quella Destruents e quella Construents, non è facile, si può imparare da alcuni paesi che ne sono riusciti, la Spagna ha per esempio deciso di ridurre la tutela dei contratti di lavoro a tempo indeterminato per i nuovi lavoratori, quelli che convertono i contratti di lavoro atipi con i contratti di lavoro a tempo indeterminato.
2591430	2613490	Inolvendo o aggirando quelle resistenze che inevitabilmente si generano a fronte della rimozione delle tutele in essere, anche se qua credo che bisognerà fare uno sforzo di progettazione originale, dato il particolare tram del nostro Paese.
2613490	2623490	E' un problema particolarmente critico che ha estinzione marcatissima sul piano comparato dell'economia sommersa, dove le tutele proprie non ci sono.
2623490	2650650	E altre due idee, del quale cito solo il capitolo e poi potranno essere oggetto di approfondimenti futuri, sono, proporre soluzioni organizzative concrete che dimostrino la possibilità di originare circoli virtuosi tra stato e mercato, tra pubblico e privato, nei settori dell'istruzione, della sanità e dei servizi sociali.
2653750	2671490	Alcuni passi significativi e importanti in questa direzione, secondo me, sono stati fatti da il centro-sinistra nel settore della sanità e nel settore dell'assistenza, che potrebbero essere valorizzati anche sul profilo della comunicazione, ma molti altri potrebbero essere fatti.
2672990	2681810	Infine, l'ultima idea, l'ultima proposta, riguarda il modello di governance complessivo del nostro stato sociale.
2681810	2711410	E qua, due cose, benissimo, per concludere, è assolutamente essenziale rafforzare le capacità istituzionali del livello di governo centrale, potenziando quelle strutture tecniche che all'interno dell'esecutivo possono essere capaci di conoscere, progettare e valutare, proprio perché stiamo trasferendo competenze e compiti,
2711810	2730670	quindi verso i livelli di governo regionali e locali corre che ci sia quella capacità di guida dal centro che adesso lateralmente manca, non soltanto in termini di stabilità dell'esecutivo, ma anche nella sua capacità, ripeto, di conoscere, progettare e valutare.
2730670	2758710	La seconda ed ultima idea è quella di cercare di incorporare all'interno del nostro sistema amministrativo i rapporti tra stato, regioni ed enti locali, con particolare riferimento alla sfera del UEF, la logica europea basata su l'identificazione di linea e guida a livello centrale,
2759710	2769710	la formulazione di obiettivi quantificabili sulla base di indicatori condivisi, il monitoraggio e la identificazione delle pratiche migliori, il cosiddetto benchmarking,
2771630	2790190	e un elemento importantissimo, un sistema rigoroso di premi e condizioni che valorizzino la capacità di innovazione e di implementazione da parte delle regioni ed enti locali, ma sanzionino in modo trattanto certo le inadevvianze e eclinazioni.
2790190	2806590	Tre spunti, tre idee, che forse potrebbero essere approfondite al fine di tracciare il profilo di quel nuovo modello sociale che potrebbe essere proposto come nuova tampa della stagione riferistica italiana. Grazie.
2806590	2817090	Grazie Maurizio Fernera, abbiamo 25 minuti, io speravo di avere tre interventi, la faremo, chiederei a Mauro Magatti di prendere la parola,
2817090	2828930	raccomando agli intervenuti, quello che voglio dire, di contenerci entro dieci minuti, per mettere non solo ora, prima dell'interruzione, ma anche successivamente, oltre i nostri lavori.
2829190	2835090	Mauro Magatti insegna all'Università Cattolica di Milano e ha scritto di questione settentrionali e di leghismo.
2836910	2847090	Sì grazie, io sarò sollevato dalle cose che volevo dire anche perché la DEMA ha bloccato alcuni dei punti che mi ero segnato nel libro La Scaletta,
2848230	2854090	per cui mi permetto di richiamarne alcuni e di fare un paio di sottolineature che mi sembrano importanti.
2855050	2867910	Partendo da una domanda che è stata posta anche oggi che francamente è un po' impietante, cioè se il Nord è costitutivamente ostile al centro-sinistra,
2867950	2883510	se il Nord è costitutivamente di destra, perché mi sembra che questo sia un assunto un po' implicito che ritorna e che poi blocca tutti gli altri discorsi evidentemente.
2883510	2906510	E questa domanda non è, diciamo così, irrilevante anche perché è figlia di una storia, evidentemente, di una storia dove...
2906510	2916610	...se è identificato largamente come un certo operaio e si è confrontato storicamente con quelli che il giorno chiamava negli anni settanta i famosi Cetti Medici.
2918050	2923510	Gran parte, come dire, della storia politica di quelle regioni è costruita su questa pensione.
2924390	2932130	Allora, di fatto, essendo cambiati gli equilibri di forza, il discorso sembra andare fatalmente da una parte.
2932750	2944130	Allora, io credo che, o si riesce a rompere questo schema, oppure, come dire, la partita è chiusa in partenza, perché, come dire, i dati sono molti di più.
2944750	2956690	A titolo così, per dare un po' il senso della questione, cito due dati, di come sono cambiati, di come è cambiata la struttura sociale al Nord,
2957850	2971850	affermando poi che, evidentemente, tra Lombardia, Piemonte e Veneto ci sono molte differenze, ma negli ultimi 25 anni la convergenza tra queste tre regioni è stata maggiore della divergenza.
2972050	2977430	E, di fatto, negli anni sessanta la distanza tra Piemonte e Veneto era molto maggiore di quanto non fosse oggi.
2977570	2983690	E oggi siamo di fronte a un Nord che ha sostanzialmente uno stesso modello di sviluppo socio-economico.
2984780	2989980	Quindi, se prendete dieci persone, chiaramente, le potete distinguere, nel maggiore rumbo sono più o meno in un posto di un assenso.
2990800	2996920	Il modello di sviluppo è sostanzialmente un lipo al Nord, ed è convergente, non divergente.
2996920	3012040	Detto questo, due dati, tra gli ultimi degli anni settanta e metà degli anni novanta, se voi sommate i lavoratori indipendenti e i dipendenti di un'impresa con meno di cinquanta addetti,
3012040	3021040	è ovviamente un'indicazione puramente convenzionale, ma che dà un segno di un appartenente dell'imprenditore all'impresa più della categoria.
3023360	3032040	Siamo passati da 3,8 milioni di persone a 5,7 e in termini di percentuali di popolazione attiva siamo intorno ad 80%.
3032980	3046140	Se ci mettete di meglio la famiglia, in senso che questo è il nostro anno, di tre stesse famiglie, voi capite che praticamente tutti, diciamo così, al Nord, o la stragrande maggioranza delle persone che stanno al Nord, hanno a che fare con questo sistema di interesse.
3047060	3057140	Quindi non è che si tratta di essere pro o contro, diciamo che si tratta di essere pro o contro delle altre regioni che, lentamente, con un quarto problema di azione politica.
3059120	3078460	Secondo dato che mi sembra rilevante, sempre nel nostro periodo, sono grossolani, sono importanti questi, mentre i dirigenti, gli impiegati erano 3 milioni, sono diventati 7 milioni, gli operai, che erano quasi 10 milioni, sono scesi a 7 milioni, probabilmente ancora meno ormai.
3078460	3087460	E, di fatto, dovremmo poi dire che anche dentro del mondo operario, molte cose sono cambiate, quindi usiamo la categoria operai, ma ci sono, certamente, più o meno di operai di 30 milioni.
3088320	3104160	Allora, mi sembra che la prima sottolineatura che vorrei fare è che credo che sia forse utile abbandonare l'attesamento moralistico nei confronti della società del Nord, dove al Nord ci sono dei golisti cattivi.
3104840	3121160	E' una società che ha i suoi problemi, i suoi problemi bravi, le sue tensioni, attraversata da un fortissimo senso del rischio personale, del rischio soggettivo e del timore. Che aspetta risposte?
3121160	3145160	Ci sono gli egoismi che si sentono abbastanza e completamente distribuiti. Credo anche che il Centrosinistra sia a dare qualche tipo di risposta a questo mondo con due naturalmente cave al primo, che cerca di integrarlo a questo mondo, soprattutto per quanto riguarda le fasce deboli,
3145230	3160230	e secondo cerca di tenerlo legate a dei fatti di solidarietà più grandi, cercando di suggerirli di non scegliere la strada della chiusura, della chiusura identitaria, della chiusura che non riconosce la solidarietà.
3162910	3181670	Credo che si debba sottolineare per fare questo ragionamento, e questo modello di sviluppo socio-economico ha due dipendenze, dal mercato e dal territorio. Dal mercato, perché la gente, questo modello di sviluppo, fa sì che le persone si fidano più del mercato.
3182710	3205610	Come dire, la gente, per paradosso e quasi provocatoriamente, crede che sia meglio affidarsi al mercato che non alla burocrazia. E crede, con molta ingenuità, spagliando i nostri altri, che il mercato offra più sicurezza,
3205610	3217610	che impegnarsi nel mercato in maniera individualistica sia meglio che non aspettare una garanzia che degli apparati pubblici possano avere. La seconda dipendenza è dal territorio.
3217660	3227540	Il territorio, si parla tanto di globalizzazione, che naturalmente, diciamo così, è la parola più ideologica che c'è in cerco della circolazione con quanto riguarda.
3227540	3240180	Lei, il sistema socio-economico del nord, è vincolato al territorio. Certo, uno che sempre andrà a mettere la sua patricchetta in romania, il teoria può. In pratica, spesso, non può, o non vuole, o non riesce.
3240720	3250040	E la sua dipendenza dal territorio è molto più marcata. Il territorio, o gli dà delle risposte, o lui, o quelli che gli stanno intorno, evidentemente, paga molto più.
3250040	3272440	Noi sappiamo che il Polo dà delle risposte, diciamo così, precise a queste domande, che sono la somma, daremmene a citate due, ne aggiungo una terza, di efficienza, diciamo così, di autorità, di popolismo, efficienza, liberismo, autorità, popolismo, io aggiungo una terza, localismo, identità.
3272440	3283800	Queste sono le tre risposte del Polo, e, come dire, potremmo anche fare un riferimento in vari partiti, diciamo così, ma non è una questione di partito. Sono delle risposte sbagliate, evidentemente.
3284740	3294440	Il secondo punto che voglio sottolineare è questo. Non si può, per cercare di avere voce sulla vicenda del nord, abbandonare la battaglia della libertà.
3295240	3306500	Non è, secondo me, accettabile che il tema della libertà sia nelle mani esclusive del centro-desto. Il tema della libertà è un tema che il centro-desto declina.
3310540	3320240	Il tema della libertà può essere ripreso, e deve essere ripreso, credo, da una proposta sensata del centro-sinistra che si rivolte a questi centri, a queste luci, a queste regioni.
3320560	3330800	Su questo si innesterete, ma naturalmente non posso dire niente su questo punto, la questione delle diverse anime che compongono il centro-sinistra.
3330800	3348540	Perché, evidentemente, sul tema della libertà, il rapporto che ci può essere tra la tradizione di sinistra, generalmente intesa, le sue tradizioni, e il mondo cattolico, una patria in un mondo cattolico, è evidentemente un tema problematico, un tema sul cui è corretto, come dire, andare col più di più.
3349760	3360540	Altrimenti, su questo tema, ciò che si costruisce da parte, lo si dispera lì. Aggiungo un'altra parola, che è stata nominata, e chieda da me, ma che ha responsabilità.
3361380	3377520	Io credo che la parola solidarietà sia inutilitabile. La parola solidarietà sia sostanzialmente inutilitabile, diciamo così, non perché io non credo nel valore della solidarietà, ma perché è una parola che attiva una serie di riferimenti.
3377520	3407500	Credo che la parola responsabilità, e, come dire, mi permetto di citare Bauman su questo, che dice, siamo cresciuti in una situazione in cui, come dire, i contesti sociali erano dati, e dall'ordine sociale, come dire, derivavano i riferimenti personali.
3407500	3429500	Mi sembra che, rispetto a queste regioni più efficace che ci sono, credo che, per queste regioni ci siano due strade, o imboccare nella versione italica, che sicuramente è molto diversa dalla versione anglosassica, la strada liberista o paraliberista.
3430300	3439500	Mi sembra che, in una situazione come questa, si inutili, sostanzialmente, accentuare la commentazione sociale concentrando il futuro.
3441400	3469080	Oppure, l'altra strada che abbiamo di fronte a noi, che in particolare il nord ha di fronte a sé, è quella di credere che il nord è una società evoluta, ricca di valori, oltre che di beni, diciamo così, che ci sono molti soggetti in questa società che semplicemente non pensano i soldi, pensano i soldi, ma pensano anche qualcos'altro, e ci sono molte realtà che possono costruire una convivenza civile più elevata, migliore.
3469880	3485680	E, come dire, sono cattolico, so che la parola sta civile, come dire, impronunciabile, non la voglio pronunciare, non è questo il punto, però il superamento dello Stratalismo, così il tempo, può passare solo attraverso questa scommessa.
3485680	3498960	Ciudo veramente con un'ultima postilla, diciamo così. Naturalmente, per, come dire, interpretare questo discorso ci vogliono politiche concrete e così via, ma risotto via un punto che d'Alema ha sollevato perché non sembra ciò che fa.
3498960	3518080	Una società così complessa, Neapola del Nord, trova sintesi a un livello simbolico molto elevato. Non è pensabile, a mio modo di vedere, sintetizzare una società come Neapola del Nord, se non avendo dei riferimenti simbolici molto forti, molto chiari, molto alti.
3518080	3527640	Questa non è una questione, come dire, di presentazione di se, è una questione di sostanza, o si è in grado di realizzare questa sintesi, oppure, come dire, no, discorso.
3528960	3535220	Grazie, ragazzi, posso avere, all'occhio anche a Giovanni Sartori di prendere la parola.
3558220	3565200	Io non mi avete visto perché cercavo di scappare, quindi c'era una ragione vera, un oggettivo.
3565200	3580040	C'era una ragione vera che cercava di scappare perché non sapevo di dove parlare, non sapevo di chi era il cliente, sulle quale, forse, li potevo intrattenere ora, non sapevo bene che...
3582520	3609020	Comunque, comunque, immagino che ci sia il Toto Sartori che spomette che scoporterò dei miei elettorali, ma voglio deludere questa aspettativa anche se negli ultimi dieci minuti mi sono sforzato a ripensare a un'idea nuova, però non è semplice.
3610040	3625760	Quindi vi dovrete contentare del ripetito che però giova alle voi e quindi di qualche osservazione previstima su questo tema.
3627900	3650720	Io ho molto apprezzato la relazione di Massimo D'Alema su questo aspetto, con l'andare degli anni siamo diventati molto vicini e conto che fra vent'anni o trenta D'Alema ci confonderà e non ci sarà nessuna differenza.
