start	end	text
3660220	3667520	Comunque, molto volevo dire, io spero di no, non sono andato da nessuna parte, mi dova non ne anche, dove catturare.
3667520	3690520	Due osservazioni, anzi tre. La prima mi viene dalla Città Stato, cioè il famoso voto dei nostri, che se io ricordo effettivamente il cento sinistra del collegio in nominale alle scorsese siamo vinti un cento.
3692260	3711840	94. Un seggio. Ora vince un seggio appunto perché il sistema non ha importanza. E allora mi può smentire di persona.
3717400	3731260	Ecco, vince un seggio appunto perché il sistema era majoritario. Perché se il sistema fosse proporzionale uno vince in proporzione ai seggi che ha.
3731260	3744560	Se la sinistra rendiamo gli voti a una media nazionale del 40 per cento e se abbiamo un sistema correttonale la sinistra vince il 40 per cento.
3744660	3756500	Se il sistema è un'enominale e la distribuzione fosse uniforme la sinistra vincerebbe 0 seggio. Non è vero ovviamente, perché le distribuzioni vanno uniforme.
3756500	3773660	Ma questa gara ha un'importanza che non è come, non so se conoscete la favola, Mangelle, ma era un po' romantico, poetica, un organismo.
3773660	3793660	Ma no, è solo un meccanismo di conversione di voto di seggio. E se il Paese ha le distribuzioni come l'Italia il sistema maggioreitario è,
3793660	3804360	pezzi, secondo me, è un gioco d'azzarro, perché col 40 pezzi si può restare con un'azzarro.
3805820	3813940	Proporzionale è impossibile, col 40 pezzi si resta col 40 pezzi, perché ritengo anche più eco.
3819320	3832940	Il punto a questo proposito, allora, è che anche a me il sistema tedesco in seconda istanza andava bene.
3832990	3842310	O va bene, andrebbe bene, perché è anche un tema in cui gli obiettivi di voi chiamano,
3842310	3845990	e quindi è anche un tema che non si deve, esattivamente.
3846730	3852470	Se adottato come Nonna, adottato Cipandolo, soprattutto,
3853830	3859450	se adottato come indubbiamente avrebbe fortemente risolto la propria situazione.
3861810	3869450	E questo è una promessa importante per arrivare alla cosa di cui si parla pochissimo,
3870050	3875450	ma è quello importante, che non è la scabilità, la durata e carica di governi impotenti,
3876090	3880450	ma è la governabilità, la capacità di governi esecutivi.
3884610	3891630	Quello che vedo al momento è la sparizione assoluta del sistema tedesco,
3891770	3896450	tradito di sotto, di sopra, di destra, di basso e di distra,
3896670	3904690	perché basta dire che nel visto i voti maggioritari si contano come voti maggioritari,
3904690	3907890	e quelli proporzionali, come proporzionali, si chiudiscono.
3909870	3914030	Basta dire che si fa un premio di maggioranza, ma si chiudisce la soglia.
3915510	3921090	E basta dire tutte le altre cose, che creiamo un sistema che non è nemmeno più parlamentare,
3921350	3925770	ma che è un sistema ingestato di governi che durano a forti.
3925810	3927530	Secondo me, più morti così.
3934750	3938530	Comunque, a me sembra che l'alternativa oramai,
3939650	3944530	senza l'avere, sia il mattarello fortemente peggiorato, o il nulla.
3945850	3951970	Io se il mattarello fortemente peggiorato è il nulla, se non è nulla, perché poi se ne riparla,
3951970	3958330	marchiamo di 10 o 20 e forse alla fine si arriva al meglio.
3960970	3966470	Al solo punto, vedete la nostra letta, vedete,
3966890	3969750	vado erratta, erratta a me,
3970730	3976750	al solo punto nel quale mi permetto di mangiare quel d'accordo,
3979350	3982750	è quello dell'elezione a diretta del Presidente.
3983970	3988750	Lasciamo stare ora che non si stia avendo visto una cerchia con il Presidente
3989290	3994550	che porta fino alla presidignazione, alla presidignazione del Presidente,
3994550	4000830	ma non è l'elezione a diretta del Presidente, ma se ci fosse,
4003490	4009830	io la troverei veramente rischiosissima,
4011090	4016830	in modo che di solito devo combattere la mia natura.
4017530	4022350	La trovo veramente rischiosissima, perché intanto, come ho scritto in Fugoli,
4023830	4026630	non mi garantisce dall'elezione del Presidente,
4026630	4031230	perché è una frequenza altissima nella politica.
4032750	4037570	Anche perché i criteri per essere eletti sono sempre più criteri
4037570	4041370	che favoriscono gli imbecille rispetto al competente al governo.
4043790	4047210	Quindi, grossissimo rischio di elezione.
4048910	4054730	È elezione di imbecille che poi non ha forza di governare,
4054730	4057950	semplicemente perché è l'elezione diretta.
4057970	4063150	L'elezione diretta gli dà la forza di rimandare se stessi ai quotidiani a casa.
4063390	4066470	Cioè gli dà solo uno commento a dirmi.
4068610	4072850	Ora, c'è chi in Italia dice che dobbiamo fare il sistema italiano.
4074070	4076530	Quali, tedeschi, orrore tedesche.
4077750	4079690	Francesi, orrore francese.
4083230	4084690	A questo è israeliano.
4085770	4087730	Per te, francese, no?
4087810	4089450	Tedescono è israeliano.
4090230	4093070	E siccome noi spesso stiamo praticando in Israele,
4093230	4095570	andiamo a vedere come funziona in Israele.
4095810	4096650	Non mi basta.
4097770	4101410	Che che sia va in Israele, se lo sento lì.
4102230	4107770	Dico, questo povero prende l'israeliano,
4107770	4111770	che tra l'altro ha impoverito i partiti di sostegno,
4112410	4115890	vive su una coalizione, diciamo, pure all'italiano.
4116650	4119210	Lì le analogie sono fortissime.
4119630	4121930	Una cosa è perfettamente fatta.
4123110	4125890	Deve pagare un prezzo esoso.
4126510	4129890	Un prezzo esoso è il partito polonese.
4130350	4134790	Lì quale sbanca lo spazio, lo manda in bancarocca,
4134790	4138190	che pretende di avere il 20 per cento della colazione
4138190	4141510	mantenuto dalla pulla all'altare senza fare nulla.
4141610	4143990	Non ne me ne c'è più niente.
4144250	4148030	E questo è il posto del grande sistema dell'italiano,
4148290	4151570	da quale poi torna via la costruzione di un meccanismo
4151570	4152930	che non ci ripara.
4153770	4155570	Cioè, chi fa un orologio.
4155830	4159190	Se l'orologio si ferma, bisogna andare a nuove legioni,
4159290	4162750	perché l'orolograio è stato il giro di questo processo
4162750	4165430	di creazione di presenza.
4165890	4167410	Ho due minuti e che ti dico?
4168610	4170050	Io non sono contrario.
4170350	4177790	Posso parlare veramente contro questa soluzione,
4178030	4181210	perché, come d'Alema sta benissimo,
4182290	4185290	io ero molto favorevole al sistema semi-presidenziale.
4185570	4188070	Il mio sistema, nel quale ho fatto,
4188070	4189710	è che è un sistema di elezione diretta,
4190230	4194010	ma a certe condizioni ha anche capo del governo.
4194650	4197070	Però il sistema semi-presidenziale
4197710	4200930	prevede due cose che l'elezione diretta dependerà.
4202030	4205050	L'invecebile, alla fine, viene accambiato.
4205490	4208030	E secondo che, se non ha una maggioranza,
4208350	4210210	il Parlamento trè una maggioranza.
4210810	4213770	E' un sistema di elezione diretta
4213770	4216370	con poteri forti dell'Estatus
4216370	4218710	che, però, si autore.
4219130	4222390	Quindi, avendo due minuti,
4222530	4224110	non ho l'impostanza.
4224910	4227250	Tutto bene, grazie.
4229050	4232490	A questo punto direi che ci dobbiamo anche ormai
4232490	4234830	comunque ripeto che contiamo di riprendere i lavori
4234830	4238030	alla fine dell'intervizione.
4238710	4244370	Quindi, alle 20, la partita,
4244690	4245830	per chi vuole vederla,
4246070	4248750	viene trasmessa su questi schermi, questa sala.
4249510	4252010	A sinistra e a destra.
4252910	4254790	Per chi vuole vederla.
4274690	4276790	E' un sistema di elezione diretta
4276790	4281750	con poteri forti dell'Estatus
4281750	4281770	che, però, si autore.
4285250	4287250	Quindi, avendo due minuti,
4288810	4289790	non ha una maggioranza.
4289870	4291150	Tutto bene, grazie.
4291150	4292850	A questo punto direi che ci dobbiamo anche
4292850	4294850	riprendere le lavori alla fine dell'intervizione.
4295930	4298050	Quindi, avendo due minuti,
4298050	4299290	non ha una maggioranza.
4301210	4302650	Tutto bene, grazie.
4302650	4304150	A questo punto direi che ci dobbiamo anche
4304150	4304810	riprendere le lavori alla fine dell'intervizione.
4309830	4311910	Quindi, avendo due minuti,
4313090	4314130	non ha una maggioranza.
4314130	4315690	Tutto bene, grazie.
4319330	4322870	A questo punto direi che ci dobbiamo anche
4322870	4322970	riprendere le lavori alla fine dell'intervizione.
4349610	4352610	E' un sistema di elezione diretta
4352610	4352610	
4352610	4352650	che, però, si autore.
4352710	4352810	Tutto bene, grazie.
4381130	4382530	Grazie.
4411150	4412550	Grazie.
4441170	4442570	Grazie.
4471150	4472550	Grazie.
4501150	4502550	Grazie.
4531170	4532570	Grazie.
4561170	4562570	Grazie.
4591190	4592590	Grazie.
4621110	4622510	Grazie.
4651150	4652550	Grazie.
4681150	4682550	Grazie.
4711550	4712950	Grazie.
4741110	4742510	Grazie.
4771110	4772510	Grazie.
4801130	4802530	Grazie.
4831150	4832550	Grazie.
4861150	4862550	Grazie.
4891150	4892550	Grazie.
4921170	4922570	Grazie.
4951170	4952570	Grazie.
4981110	4982510	Grazie.
5011150	5012550	Grazie.
5041290	5042690	Grazie.
5071150	5072550	Grazie.
5098610	5100010	Grazie.
