start	end	text
2580	11920	Grazie all'onorevole Urbani, Presidente D'Alema, questa transizione finirà o non finirà?
12740	21180	Finirà, non sappiamo come, certamente è difficile prevederlo in questo momento, però
21180	34980	io vorrei per un momento sottrarmi al carattere di attualità, di confronto politico, di proiezione
34980	45220	verso il futuro che Giorgio Namalfa ha voluto dare a questo dibattito, perché credo che
45220	55920	sia giusto che anch'io non ho avuto il piacere di conoscere Guglielmo Negri nel 1959, quando
55920	66980	militavamo con Urbani nella sinistra, ma io più piccoli all'epoca. Però avendo avuto
66980	78440	l'onore e il piacere di conoscerlo più tardi, credo che il vuoto che gli lascia sia qualcosa
78440	88140	di significativo, di dolorosamente significativo per la politica italiana, che non è ricca
88980	105840	di servitori dello Stato, di uomini disinteressati e impegnati sul terreno civile e culturale per
105840	117720	amore della comunità, della collettività nella quale viviamo. E questo, nel mio ricordo,
117720	127760	è stato il tratto più forte della sua personalità, questo amore per le istituzioni, che ne hanno
127760	133740	fatto un testimone di un protagonista discreto. Questo è il libro di un testimone e di un protagonista
133740	144760	discreto. Testimone del declinare della Prima Repubblica, naturalmente nella posizione estremamente
144760	155460	privilegiata di servitore del Parlamento, in quell'area dove si preparano e si costruiscono
155460	164320	le condizioni della decisione politica e legislativa. E poi, nel corso di questa transizione,
164520	171100	anche chiamato ad un compito di protagonista politico, egli indubbiamente fu in una posizione
171100	180540	discreta ma, direi, molto significativa di anima politica di quel governo eccezionale,
180700	187640	così viene ricordato, il governo che sotto la presidenza di Lamberto Dini succede alla
187640	195720	crisi del governo Berlusconi. Protagonista politico delle relazioni politiche, delle
196720	205540	di un governo tecnico che, tuttavia, ha rappresentato un passaggio di grande importanza politica
205540	212440	nella vita del Paese degli ultimi anni e che, io credo, ha avuto un merito importante riprendendo
213020	220320	il filo dell'azione condotta dal governo Amato, poi dal governo Ciampi, sulla strada di un
220320	230420	risanamento del Paese e di un reinserimento dell'Italia come protagonista tra le grandi
230420	240200	nazioni europee. In fondo, se noi guardiamo a questi anni tormentati, diciamo, che abbiamo
240200	245720	alle spalle, che, sì, certamente sono gli anni di una transizione incompiuta, certo,
245720	252840	ma sono anche gli anni in cui questo Paese è stato salvato dal rischio di un collasso,
252900	261960	di un declino rovinoso, Paese investito contemporaneamente da una crisi delle istituzioni, dal tracollo
261960	268540	dei partiti che avevano rappresentato l'ossatura del sistema democratico, da una delegittimazione
268540	275700	morale della classe dirigente e da un collasso della finanza pubblica, è un Paese che, effettivamente,
276400	285820	ha corso il rischio di precipitare nel baratro di un declassamento e tale sarebbe stato per
285820	293020	noi mancare l'appuntamento dell'Euro. Ora, il Paese è stato salvato da questo rischio,
293060	299000	poi vedremo dove arriverà la transizione, ma, insomma, io tanto credo che dobbiamo considerare
299000	307820	il rischio dal quale Paese è stato salvato e io penso che in questa operazione di salvezza
307820	317980	del Paese hanno avuto un ruolo, uomini di diversa estrazione, tuttavia uniti da questa
317980	326040	amore per le istituzioni, per la patria, si direbbe con un'espressione che non è molto
326040	337540	consueta, che appare esclusivamente retorica, uomini che potrebbero essere definiti secondo
337540	345460	la politologia, tecnocrati, uomini che non erano per loro formazione uomini politici
345460	351300	di tipo tradizionale, che spesso non erano stati eletti dai cittadini e che, tuttavia,
351300	358500	hanno svolto una funzione democratica estremamente importante, hanno rappresentato una riserva
360520	370200	di spirito democratico e di amore per le istituzioni. Questo è, si parla in questo libro del fascino
370200	374120	descritto della Banca d'Italia, perché la Banca d'Italia certamente è stata una delle
374120	381280	riserve cui il Paese ha tinto, ma non c'è dubbio che anche in altri settori del Paese
381300	388560	della vita pubblica, dell'apparato dello Stato, il Paese ha attinto e ha trovato energie,
389100	394440	cioè personalità che in un momento difficile si sono messe al servizio delle istituzioni,
394500	403940	non delle fazioni, e hanno concorso a salvare il Paese dal rischio di un tracollo. Non so
403940	411280	se questo effettivamente in quell'opera di salvezza non sempre si è avvertito il leader
411300	419860	in sentire, però qualcuno vi ha provveduto e fortunatamente con successo, altrimenti
419860	425960	credo che oggi una discussione sulle prospettive della transizione italiana sarebbe molto più
425960	437400	difficile e sarebbe molto meno aperta alla speranza, ancorché la speranza secondo me
437400	444800	sarebbe essere considerata con molta attenzione e qualche motivo di scetticismo. Dico questo
444800	450180	perché Guglielmo Negri è stato uno di questi uomini che si è trovato, un uomo certamente
450180	454460	animato ad una forte passione politica, il Partito d'Azione, il Partito Repubblicano,
454580	461600	ma tuttavia aveva esercitato questa funzione, l'ha esercitata in una posizione più defilata
461820	468780	rispetto a quella dell'impegno squisitamente politico, la dimensione più tecnica, più
468780	475660	tecnico intellettuale, che si è trovato a dovere fare la politica, anzi direi ad essere
475660	483240	un po' l'anima politica di un governo, tra virgolette, tecnico in questo ruolo. Io l'ho
483240	487740	conosciuto anche come un combattente politico abbastanza appassionato nel momento in cui
487740	496100	si doveva fronteggiare anche lo sforzo convergente per far cadere quel governo, per precipitare
496100	501260	il Paese verso uno scontro che certamente non ci avrebbe avvicinato alle scadenze europee.
502180	508340	Lo dico perché al di là dell'IDEM sentire c'è anche bisogno di passione civile e di
508340	517040	spirito di battaglia, tanto più quando questo viene vissuto con senso dell'ironia, con grande
517040	524440	umanità, come era la caratteristica dell'uomo che stiamo ricordando, che lo rendeva simpatico
524440	529740	anche alle persone che si trovavano in quel momento in una posizione diversa e che gli
529740	539940	consentivano di avere un rapporto umano estremamente gradevole, cosa importante. Anche questo di
539940	547020	per sé non risolve quel problema così complesso che Urbani ha posto e tuttavia questo sforzo
547040	553340	di umanità, questa capacità di dialogare al di là delle diverse opinioni, è comunque
553340	560080	qualcosa che si pone al di sopra di uno spirito fazioso che purtroppo lo riconosco, velena
561440	571260	troppo spesso il confronto politico nel nostro Paese. Noi non abbiamo risolto se non parzialmente
571260	580200	i problemi della transizione italiana. Abbiamo una cattiva legge elettorale che garantisce
580200	589800	un confuso bipolarismo, perché la legge elettorale così come organizzata incoraggia al massimo
589800	596740	delle alleanze elettorali e al minimo della coesione politica di governo. Sembra proprio
596740	603820	che la legge elettorale sia solviata per farci del male, perché con la legge a turno unico
605820	612960	la paura che vincano gli altri sollecita al massimo delle alleanze elettorali, senza curarsi
612960	619380	della coerenza politico-programmatica. Ma il permanere di un meccanismo proporzionale
619380	626720	accanto al meccanismo maggioritario poi sollecita le stesse forze politiche che si aggregano
626740	634160	in funzione elettorale a differenziarsi in una logica di visibilità. Il sistema politico
634160	642420	è una realtà che funziona anche sulla base degli input, degli stimoli e la legge elettorale
642420	650460	è il principale input che il sistema politico riceve dalle regole. Ora, se la legge elettorale
650460	658420	dice alla politica contemporaneamente aggregatevi e dividetevi, l'esito non può che essere
658420	664620	schizofrenico. Il sistema politico riceve sollecitazioni contrastanti, fra l'altro
664620	670520	noi siamo anche l'unico Paese al mondo che credo che abbia in vigore sette leggi elettorali
670520	677800	diverse, il che oltretutto, oltre ad essere un problema per il sistema dei partiti, è
677800	685480	un problema piuttosto complicato per i cittadini, i quali oramai, a seconda della natura della
685480	694200	scadenza elettorale, hanno bisogno di consulenze specialistiche, che ci sono elezioni nelle
694200	698400	quali il voto per il sindaco vale anche per la coalizione, elezioni nelle quali il voto
698400	706660	per il Presidente della Provincia invece non è valido. Ancora recentemente mi è capitato
706660	715780	di discutere con valenti servitori dello Stato e di scoprire che nessuno di loro sarebbe
715780	722780	in grado di spiegare come funziona il meccanismo dello scorpolo, e io credo che è un punto
722780	727940	cruciale del nostro attuale e vigente sistema elettorale, che credo in Italia soltanto una
727940	735240	ventina di persone sarebbero in grado di spiegare. Noi votiamo con un sistema elettorale che
735240	741340	il 99,9 per cento dei cittadini e la gran parte dei politici non sarebbero in grado
741340	747620	di spiegare, ma non per ignoranza, perché effettivamente è quasi impossibile e in questo
747620	753980	c'è un idem sentire, salvo che siamo poi l'unico Paese al mondo che trovandosi in questa
753980	765220	condizione con l'unanime giudizio circa la non validità del sistema in corso non trova
765220	775140	lunga su quello che viene chiamato in questo libro il riformismo immobile, questa impotenza
775140	782840	al riformismo anche laddove si è di fronte a nodi che universalmente si ritiene di dovere
782840	788860	sciogliere. Quindi un cattivo bipolarismo, impegniato su una legge elettorale imperfetta
788860	795500	che ha creato il bipolarismo ma non lo ha strutturato in un modo europeo, in un modo
795500	804200	virtuoso. A questo si aggiunge che il processo delle riforme che ha, come è stato ricordato,
805980	812540	costituito poteri periferici forti attraverso i meccanismi della elezione diretta non ha
812540	819180	toccato il cuore delle istituzioni e quindi noi abbiamo un cattivo bipolarismo, abbiamo
819180	831540	anche un cattivo federalismo dal basso confuso rivendicativo che in un Paese come il nostro
831540	837820	che certamente non ha una grande tradizione di unità nazionale mette a rischio l'unità
837820	844720	del Paese. Questo deve essere detto con molta forza. Siamo diventati tutti federalisti quindi
844720	850260	io vado tranquillamente controcorrente. Io credo che il vero grande problema oggi sia
850260	859880	l'unità d'Italia e che noi siamo in un Paese in cui si approfondiscono contraddizioni
859880	867800	profonde di carattere sociale, culturale, geografico e che l'assetto delle istituzioni dovrebbe
867820	878140	garantire l'unità d'Italia e così non è. E soltanto la forza delle istituzioni nazionali
878140	883480	e essendoci tra l'altro una crisi dei grandi partiti, delle grandi culture politiche che
883480	889820	hanno tessuto l'unità del Paese. La forza delle istituzioni dovrebbe essere il punto
889820	897800	di riferimento e queste istituzioni sono deboli. E' debole il Parlamento, debole il Paese,
897820	905120	oppresso da regole garantiste che avevano un senso nella Repubblica dei Partiti ma che
905120	913660	oggi al mio giudizio sono paralizzanti e debole il Governo che non ha una base di stabilità
913660	921340	e una possibilità di spiegare con efficacia la sua azione. E' debole la figura del capo
921340	927800	del Governo, debole in un modo persino imbarazzante rispetto ai nostri partner, perché poi è
927800	934420	discorso sarebbe lungo, ma noi siamo parte di una comunità politica e oramai le nostre
934420	940480	debolezze sono un problema anche per i nostri interlocutori. Io sono stato recentemente
940480	946440	a Parigi in una serie di iniziative, di conferenze, di convegni, etc., ho registrato un sentimento
946440	952360	nuovo che da una parte ci deve far piacere, dall'altra parte ci carica di nuova responsabilità.
952360	959920	Mentre una volta si sorrideva delle difficoltà dell'Italia, oggi almeno in quei Paesi che
959920	966840	hanno in comune con noi la moneta, la difesa, etc., ci si preoccupa perché c'è la consapevolezza
966840	972980	che il prezzo della nostra instabilità, della nostra confusione, etc., sarà pagato anche
972980	979200	da altri Paesi. Noi siamo l'unico Paese al mondo del cui il Capo del Governo non può
979200	984800	evocare un Ministro, fare l'esempio di uno degli aspetti più surreali del nostro ordinamento,
986080	990180	che naturalmente aveva un certo significato nell'epoca in cui erano i segretari dei partiti
990180	996380	che disegnavano i Ministri, quindi erano loro che li potevano evocare, ma quella Repubblica,
996440	1002500	con le sue virtù, perché io credo che fino a una certa epoca quella Repubblica ha costruito
1002500	1008800	la democrazia in un Paese che veniva dal fascismo, tuttavia oggi non c'è più, quindi rimangono
1008800	1016100	i tratti di un ordinamento che non ha più l'anima, la struttura portante che era rappresentata
1016100	1022840	dai partiti, da quei partiti. Ora io penso che, ma non voglio ripercorrere il passato
1022840	1028780	che è pieno di, può darsi che abbia ragione urbane, non voglio fare l'elenco dei nasi
1028780	1034020	di Cleopatra in cui ci siamo imbattuti, io vorrei dire l'unica battuta che mi consenta
1034020	1041680	anche qualche naso di Pinocchio che è capitato in questa rassegna di nasi nei quali le riforme
1041680	1050940	sono inciampate via via, certo ci sono aspetti che meriteranno, sarà materia per gli storici
1050940	1058900	se ne avranno voglia o per quelli che scrivono le loro memorie, le cronache, pochi ricordano
1058900	1064060	che la commissione bicamerale in realtà ha concluso i suoi lavori con un successo straordinario,
1064500	1071840	e cioè con il voto a larghissima maggioranza di un progetto di riforma di grande portata
1072540	1079360	e che nel votare quel progetto di riforma il leader dell'opposizione rivendicò a sé
1079360	1085660	giustamente il merito di avere avuto fiducia nel presidente della commissione bicamerale
1085660	1093700	e di avere condotto questo processo pure dall'opposizione e disse e concluse motivando
1093700	1099900	il suo voto favorevole al progetto di riforma è stato bello esserci, noi siamo stati qui
1099900	1105560	in questa commissione e abbiamo onorato le istituzioni perché abbiamo fatto prevalere
1105560	1111460	l'interesse del Paese sull'interesse di parte, la citazione è testuale non vi stupisca
1111460	1121120	diciamo che io la ricordi a memoria, comunque diciamo quello era il primo tempo, il primo
1121120	1127900	tempo si è concluso con l'approvazione di un testo e lì consegnato agli atti parlamentari,
1128220	1135720	non si è concluso con un impegno generico l'approvazione di un testo, per cui io credo
1135720	1143700	io sono per l'idem sentire e credo che il momento in cui è più difficile dimostrare
1143700	1153560	questo senso delle istituzioni non è quando si pensa di stare per vincere, è facile onestamente
1154400	1159780	nel senso che a quel punto è chiaro si chiede una campagna elettronale civile, chi pensa
1159780	1165580	di essere in vantaggio addormenta il gioco anche nelle partite di calcio, è più difficile
1165580	1171740	farlo quando ci si trova di fronte a certi nodi, a certi passaggi, io temo che in realtà,
1172100	1178080	in realtà vediamoci chiaro, questo risponde anche a Giorgio Lamaffa col quale io condivido
1178080	1184100	del tutto il ragionamento, io ho una mia idea sulla riforma delle istituzioni però penso
1184100	1190860	che è persino più importante trovare un punto di intesa più che fare valere un proprio
1190860	1196620	punto di vista, la mia convinzione è che per un paese come l'Italia, se uno deve guardare
1196620	1204560	i modelli stranieri diciamo, la soluzione più convincente è una soluzione di tipo semipresidenziale,
1204820	1213340	io credo che noi abbiamo bisogno di un'autorevolezza dello Stato che nella condizione presente
1213340	1219120	di frammentazione del sistema politico, anche io vorrei il tripartitismo, non lo so, però
1219120	1225380	si fai conti con quel che c'è, nella condizione presente, a mio giudizio, può essere garantita
1225380	1231280	dall'elezione di un capo dello Stato, a parte dei cittadini, che sia più che un arbitro
1232440	1237340	e in questo, non c'è dubbio, il disegno della bicamerale era timido per i condizionamenti
1237340	1241060	conservatori che venivano anche dall'interno del centro-sinistra, con i quali io mi sono
1241060	1249100	misurato che non ho mai negato, l'ho denunciato pubblicamente e penso che insieme ad un sistema
1249120	1254480	di impianto semipresidenziale, il doppio turno in nominare alla francese sia il sistema
1254480	1258820	elettorale più conveniente per l'Italia, in questo condivido l'opinione scientifica
1258820	1265240	di Giovanni Sartorima, capisco che è una posizione molto minoritaria a questo punto e interessa
1265240	1272580	persino poco, diciamo, il far valere un proprio punto di vista, io credo che si debba trovare
1272580	1281040	un'intesa in grado di garantire uno sbocco e in particolare di dare maggiore forza e
1281040	1285900	maggiore stabilità al governo, ecco, nel rapporto con il Parlamento, nel rapporto con
1285900	1292120	il sistema delle autonomie, cosa che a me sembra il nodo, diciamo, il blocco legge elettorale
1292120	1298460	forma di governo, poi ci sono tanti aspetti che sarebbe sbagliato considerare secondari
1298460	1305260	e che furono oggetto, secondo me, di ipotesi di riforma avanzate nel lavoro della bicamerale
1305260	1312020	che riguarda il riordino delle magistrature, degli organi ausiliari del governo, il superamento
1312020	1319620	di confusioni non tollerabili tra funzioni consultive e funzioni giurisdizionali e altri
1319620	1326740	aspetti del nostro ordinamento su cui noi mettemmo mano, direi, con una concordia e
1326740	1334320	un spirito di collaborazione che io ricordo con un momento positivo e non c'è dubbio
1334320	1340400	che anche per quanto riguarda l'assetto politico il problema italiano è quello di integrare
1340400	1347140	la politica italiana nel sistema politico europeo e questa è la prospettiva verso la
1347140	1355060	quale si deve lavorare sapendo che rispetto a quel modello astratto di una grande forza
1355060	1360680	moderata, di una forza social democratica, di una forza liberaldemocratica che possa
1360680	1365920	essere l'ago della bilancia, anche ambientalista, oramai anche questo è una delle famiglie
1365920	1370380	politiche che sono cresciute in Europa, che per esempio hanno un po' cambiato il panorama
1370380	1376380	politico in Germania, per fare un esempio, in realtà noi abbiamo un peso assai rilevante
1376380	1383300	della destra nel nostro Paese ed è poco da fare per ragioni storiche, per ragioni sociali,
1384180	1391200	anzi direi delle destre. Il problema non è esclusivamente italiano, anche il bipartitismo
1391200	1398060	austriaco a un certo punto è stato scardinato dall'insorgere di una destra, anche in Belgio
1398060	1404820	viene avanti una destra, c'è tutta una riflessione su questa destra europea anche come frutto
1404820	1410660	di una risposta alla globalizzazione, alle sue sfide, come effetto delle paure che i
1410660	1415420	nuovi processi di mondializzazione suscitano in settori importanti, dei ceti medio, dei
1415420	1421620	ceti popolari, come forma di ripulsa verso la sfida dell'immigrazione, comunque diamo
1421620	1433440	ci chiaro, quel sistema politico europeo ideale di cui Giorgio Namalfa ha parlato è stato
1434580	1440000	vigorosamente messo in discussione dall'insorgere di fenomeni di destra che secondo me in Italia
1440000	1445060	hanno uno dei loro epicentri più significativi, da questo punto di vista per ragioni anche
1445060	1449940	comprensibili che riguardano la fragilità del sistema democratico italiano non c'è
1449940	1454780	dubbio che qui il peso di queste destre è particolarmente rilevante e questo è visto
1454780	1459300	con preoccupazione in gran parte d'Europa, ci possiamo girare intorno quanto vogliamo,
1459640	1465020	è un dato che si percepisce se uno va in giro e parla con gli osservatori politici,
1465020	1472480	ma detto questo è un problema che certamente riguarda in modo particolare chi sull'altro
1472480	1480160	versante del conflitto politico intende accreditare il centro destra con una forza democratica
1480160	1487020	di tipo europeo, io non posso che auspicarlo devo dire da verità, la posizione non è
1487020	1494700	mai stata quella di coltivare nuove anomalie italiane ma di coltivare l'obiettivo della
1494700	1500480	normalità e questo vale anche per il rapporto tra ulivo e i partiti, l'ulivo è una coalizione,
1502020	1507900	essere per un grande partito socialista quale noi abbiamo cominciato ad essere e più coerentemente
1507900	1512720	con maggiore slancia dobbiamo sempre più essere, non significa essere contro l'ulivo,
1512920	1518780	significa considerare l'ulivo quello che è una coalizione di forze diverse e non la prefigurazione
1518780	1523220	di un partito democratico all'americana che non si capisce perché dovrebbe nascere qui
1523220	1531200	in questa parte del mondo, in mezzo al Mediterraneo, cosa che mi pare però oramai abbandonata
1531200	1537880	da tutti, anche se questa ideologia ha serpeggiato nel momento in cui da una parte si costruisce
1537880	1553200	la margherita, mi pare che oramai finalmente questa visione più europea della evoluzione
1553200	1560360	non significa che il cammino sarà semplice, io ritengo che la prossima legislatura dovrà
1561120	1568320	continuare ad essere inevitabilmente una legislatura costituente, io credo che ci troveremo di
1568320	1573180	fronte agli stessi nodi che abbiamo scartato, aggirato nel corso degli anni che abbiamo
1573180	1581300	alle spalle, temo che dire assemblea costituente è un modo di aggirare la questione perché
1581300	1590360	alla fine al di là dello strumento diventa inevitabile che ci sia un'intesa tra le
1590360	1595720	grandi forze politiche del Paese altrimenti l'assemblea costituente se diventerà il luogo
1595720	1601820	di uno scontro lacerante e drammatico avrà degli effetti sugli equilibri politici quindi
1601820	1606520	diventerà un fattore di destabilizzazione anche degli equilibri politici di governo,
1606520	1618780	quindi il punto alla fine riguarda il fatto che noi dobbiamo cominciare a chiamarci con
1618780	1625800	nomi europei a comportarci secondo una responsabilità, d'altro canto se noi ci guardiamo alle spalle
1625800	1634200	parliamoci chiaro in questo Paese che usciva dalla guerra e che entrava nella guerra fretta
1634200	1639600	e con contrapposizioni ideologiche ben più drammatiche di quelle vere non di quelle
1639600	1644360	artificiose costruite per fine di potere ma di quelle vere che oggi vive l'Italia in
1644360	1651020	questo Paese ci fu una classe dirigente che seppe scrivere la Costituzione e dare avvio
1651020	1658480	ad una lunga fase di sviluppo democratico poi si è esaurito ma questo c'è stato quindi
1658480	1663780	non è vero che in questo Paese sono state soltanto le fazioni c'è stata anche una
1663780	1669780	classe dirigente di grandi personalità che pur o erano divise da cose ben più profonde
1671740	1679280	Stalin e la NATO e che pur seppe scrivere la Costituzione e dare un fondamento democratico
1679280	1679980	alla Repubblica.
