start	end	text
0	8680	Milenium e i progetti che questa fondazione cercherà di sviluppare.
9240	14880	E' stato detto che devo fare la funzione di moderatore, sarò soprattutto il moderatore
14880	20400	del tempo, perchè il Presidente del Consiglio deve lasciarsi per altri impegni un po' dopo
20400	28140	le sei, e dunque chiederò che ciascuno non parla più di dieci minuti e chiedo per anticipo
28140	35140	scusa se interrompo o faccio dei segnali disesperati a coloro che stanno parlando, vi ringrazio.
43840	46860	Bisogna che i segnali siano autorevoli, non disperati.
47760	49960	Saranno disesperati e autorevoli.
53940	62460	Io vorrei prima dire qualche parola sul tema di questo incontro che inaugura l'attività
62460	64400	del Centro Milenium.
66980	69920	E' un tema di grande importanza e di grande attualità.
71500	78120	Noi siamo alla vigilia di questo Consiglio europeo molto atteso e caricato anche di
78120	79120	grande significato.
83100	90500	Forse, come spesso è accaduto nella storia dell'Unione, lo svolgimento della Reunione
90500	92480	tradirà in parte le attese.
94380	99000	Ma io non credo che il Consiglio d'inizio risolverà tutte le questioni.
99480	106120	Importante è che ci consenta di compiere un passo in avanti netto nella direzione giusta
107080	111640	ed è anche importante che l'Europa ne esca con una visione chiara di quello che
111640	112120	deve fare dopo.
117660	121120	L'Unione è attraversata da incertezze e inquietudini.
123700	130120	La relativa debolezza dell'Euro, anche se certamente non è dannosa per le nostre
132910	139230	commerci, tuttavia tocca una larga opinione pubblica, in particolare in quei paesi che
139230	140990	erano abituati ad una moneta forte.
143270	152830	I timori suscitati dalle prospettive di allargamento sono visibili e significativi, così come
152830	159350	anche i segni di delusione che cominciano a maturare nei paesi che hanno lungamente
159350	165570	atteso l'integrazione nell'Unione come sanzione del compimento di una rivoluzione
165570	166670	democratica.
169430	175350	Tensioni si manifestano tra i governi e le istituzioni comuni.
178470	182130	L'apparente tecnicismo del dibattito sulle istituzioni, sulle regole, non deve ingannare.
185510	190190	Il governo italiano fa eccezione da questo punto di vista, ma non c'è dubbio che la
190190	197390	lettura dei giornali lascia intravedere non di rado tensioni tra i governi e le istituzioni
198370	198930	comuni.
198930	205370	L'apparente tecnicismo del dibattito sulle istituzioni, sulle regole, non deve ingannare.
206430	213930	La sostanza è rilevante, perché tocca la concezione stessa, il futuro dell'Unione Europea.
215930	223750	I temi come noto sono i temi che ad Amsterdam rimasero fuori dalle decisioni finali.
223750	234890	Voto a maggioranza e quindi potere di veto, passaggio come io auspico, fa il voto a maggioranza
235770	243410	come criterio generale, unanimità come eccezione, ponderazione del voto, questione molto complessa,
243590	251550	molto delicata che tocca anche ragioni di prestigio per paesi fondatori, struttura della
253590	258590	commissione, nel senso di una commissione in grado di funzionare come un vero governo
258590	265990	europeo, non una somma di rappresentanze, per evitare il rischio di una pletoricità
265990	269930	che con l'allargamento dell'Unione diventerebbe insostenibile.
271070	281530	E poi il tema della cooperazione rafforzata, tema importante, non contraddittorio con il
281530	287710	giudizio, qui dobbiamo dirci con realismo l'Europa è e continuerà ad essere a lungo
287710	296950	una complessa architettura istituzionale di istituzioni comuni e di organi intergovernativi
296950	300530	e questi due momenti dovranno convivere tra di loro e collaborare.
302950	310650	E un'Europa come noi vogliamo più larga, anzi io sono per usare decisamente il termine
310650	317930	unificazione dell'Europa perché il termine allargamento mi sembra francamente infelice,
318650	326710	l'allargamento dell'Unione è l'unificazione dell'Europa, questo processo se vuole realisticamente
326710	338050	accompagnarsi ad un sviluppo dell'integrazione deve comportare una maggiore e più flessibile
338050	344050	possibilità di cooperazione rafforzata intesa non come la formazione di un club esclusivo
344590	351430	o di più club esclusivi, in fondo non è detto che gli stessi paesi che hanno dato vita
351430	356830	all'Euro come forma di cooperazione rafforzata siano i medesimi che possano muoversi sul
356830	360950	terreno della difesa, certamente sul terreno della difesa per esempio la Gran Bretagna
360950	367990	non è un paese in, non è un paese out, ma se noi vogliamo che l'Europa non si fermi
367990	375950	e non si svuoti abbiamo bisogno di una cooperazione rafforzata intesa come esempio, stimolo,
377490	383950	come processi che sono aperti e che progressivamente si allargono all'insieme dei Paesi dell'Unione.
385790	394690	E poi c'è questa grande novità, la Carta Europea dei Diritti che definisce non solo
394690	401610	un elenco di diritti ma che indica un quadro di valori condivisi in qualche modo i confini
401610	408930	di una civiltà, una civiltà europea di cui storicamente sarebbe difficile definire i
408930	416650	confini geografici ma che certamente ha dei confini culturali che sono confini aperti
416650	423230	se abbiamo fiducia nei nostri valori, aperti anche al di là dei limiti geografici dell'Europa
423230	432930	in fondo stiamo lavorando perché la Turchia si renda in grado di uniformarsi ai principi
432950	441990	non soltanto alle regole economiche dei principi per esempio di rinunciare alla pena di morte
441990	450590	perché l'Europa l'ha messa al bando ed è importante che nei trattati questo primo pilastro
450590	459190	di una Costituzione europea possa essere almeno menzionato per aprire quella che noi ospichiamo
459190	466830	che possa essere poi una nuova fase, una volta risolti con un compromesso che speriamo sia
466830	473470	più avanzato possibile questi temi, una nuova fase più impegnativa, la fase di un processo
473470	484530	costituente per l'Europa. Vedete a me io vengo da Parigi mentre mi abbiamo intercettato
487230	493530	e ho partecipato a una serie di colloqui, di incontri sul tema dell'Europa
496050	503830	e tra i nostri amici francesi che ne sono di accesamente europeisti e di più prudenti
505170	512290	e discutendo con amici intellettuali francesi all'Istituto Italiano di Cultura vi sono sentito dire
512290	521290	ma come rispetto a questi pericoli, a queste inquietudini che tu stesso denunci, questi obiettivi
521810	528670	non appaiono troppo avanzati, non è irrealistico lanciare obiettivi così avanzati nel momento
528670	536290	in cui siamo tutti consapevoli che semmai una certa spinta europeista sembra affivolirsi
536290	545110	nel settore dell'opinione pubblica. Io credo che sia esattamente il contrario, noi mettiamo
545110	554190	le istituzioni dell'Unione in grado di funzionare e di dare una risposta ai problemi che sorbono
554190	562050	nelle nostre società, problemi e sfide che gli Stati nazionali isolatamente non saranno
562050	570190	in grado di affrontare, oppure l'Europa andrà indietro, l'Europa è un processo che non si ferma
570190	576650	è un processo in qualche modo contro natura, la formazione di un potere sovranazionale
576650	585730	è come spingere un carro lungo una salita, se si smette di spingere rotola indietro facilmente
585730	592730	e il dibattito sulle istituzioni non è un tema tecnico perché istituzioni europee che funzionano
593310	597730	sono la condizione per dare una risposta alle sfide, la sfida del lavoro e dell'innovazione
598490	604730	e quindi della competitività, la sfida di un nuovo patto sociale di cui l'Europa ha bisogno
606790	612730	perché questa fase dello sviluppo fondato sulla conoscenza non è soltanto un mutamento
612930	619070	dell'organizzazione della produzione, del rapporto tra scienza e produzione, è anche una grande rivoluzione sociale
620510	626970	la sfida della protezione della salute e dell'ambiente, pensiamo a vicenda della mucca pazza
626970	634930	e a quanto questa vicenda ci parli anche dei limiti dei nostri strumenti comuni di controllo e di prevenzione
636450	648330	la sfida della lotta contro un crimine internazionale e quella così complessa del governo del grande fenomeno migratorio
648330	654970	tutti i problemi che ci pone dal punto di vista non solo sociale e della sicurezza ma anche dal punto di vista culturale, antropologico
656210	663870	nessuno di questi problemi sarà risolvibile senza una unione più forte
663870	674710	in questo processo è importante non soltanto il lavoro della politica
674710	679870	lasciatemi fare una parte che può sembrare strana fatta da me però è il lavoro che sto facendo in questi mesi in modo appassionato
681150	686870	io credo che noi abbiamo bisogno di fare crescere, certo anche una società politica europea
687950	694910	e c'è un dibattito politico europeo, partiti europei, non soltanto istituzioni
694910	701950	perché istituzioni senza demos, senza popolo, società, partiti, sono istituzioni deboli
703090	707290	ma abbiamo bisogno anche di fare crescere un impegno di ricerca e di cultura
707290	714450	questo è il senso di questo centro millennio che non è un'altra fondazione
715450	731790	è la fondazione italiana europea che insieme al CESPI con la compresione, l'accoglienza da parte della città di Firenze
731790	743450	ha ritenuto di dare vita ad un centro di cultura che sta a Firenze perché riteniamo che questa città abbia una grande vocazione cosmopolita
743490	752950	che è scritta nella sua storia, che ha preso origine, l'idea ha preso origine da quell'incontro che anche il sindaco Leonardo Domenici ha ricordato
754290	763490	sapete che dopo quell'incontro si è formato anche un comitato d'onore di cui fanno parte i capi dei governi europei di sinistra, di centrosinistra
764150	769490	e personalità europee come romano parodice Fabia Solana
770630	786490	Ora questo centro intende sviluppare iniziative, convegni, dibattiti, seminari, ma anche se ce la faremo un'attività di formazione sui temi in particolare dell'Europa
786490	803730	intende farlo in collegamento con una rete europea in modo da essere un punto di un sistema tra questi centri che sono in Europa, innanzitutto c'è la fondazione Notre Europe di Parigi
803730	814950	che si usa da Jacques Delors, c'è il Center for European Reform di Londra diretto da Charles Grant, c'è il centro Carnegie a Mosca e altri se ne aggiungeranno
814950	825290	quindi noi vogliamo collegarci ad una rete di centri di ricerca e lavorare con loro per mantenere un collegamento
826510	837950	vedete si è discusso, noi abbiamo anche fatto una cosa molto interessante che essendo interessante non ha avuto molta eco, per fare capire meglio al di là delle polemiche un po' strumentali
837950	851950	abbiamo ospitato qualche giorno fra i rappresentanti delle due grandi fondazioni di cultura politica americana, anche per far capire come funzionano
851950	861950	non so come in Italia sta un dibattito se le fondazioni sono partiti, sono partiti in fieri e altre cose di questo genere, qui c'è un frutto di mancanza di conoscenza spesso
862690	873810	allora abbiamo fatto venire in Italia i rappresentanti della Heritage Foundation del Brooklyn Institution per spiegare come funziona questo rapporto tra politica e cultura
873810	883150	e come queste istituzioni siano poi in retroterra di ricerca, di formazione della politica americana
883150	894690	noi crediamo molto, dicono noi, Giuliano Amato è stato Presidente di questa fondazione e ci onora dell'essere Presidente del Comitato Scientifico con il grado di impegno che ha
894690	899870	noi crediamo molto alla necessità di dare un fondamento più solido
899870	908770	Pari Istituto Universitario Europeo, sarò rapidissimo, due questioni, la prima è l'Europa, l'Europa è uno spazio culturale, uno spazio intellettuale
908770	914330	qui ci sono alcuni miei colleghi dell'Istituto Universitario Europeo, molti studenti dell'Università di Firenze
914330	922870	e allora la domanda è, visto che l'Europa è anche la costruzione di uno spazio appunto culturale da parte degli intellettuali, qual è il ruolo degli intellettuali
922980	930840	in particolare degli intellettuali progressisti nel costruire la nuova Europa, una volta che il loro ruolo è definitivamente e profondamente mutato
930840	945160	la seconda, sempre l'Europa, l'Europa è rimproverata di essere, diciamo così, una emanazione dei banchieri, una emanazione di istituzioni difficilmente controllabili da parte della cittadinanza, della collettività
945160	954400	il popolo di Seattle che è stato il popolo di Genova, il popolo di Praga è forse l'unica forma della società civile globalizzata che ha cercato di opporsi a questo
954400	963640	allora la storia del novecento è stata una storia di attori che sono stati i partiti, i sindacati, l'onorevole Dalema ricordava prima la polemica fondazione i partiti
963640	972640	ebbene, i progressisti, coloro che vogliono realizzare la progressive governance oggi, quali nuovi attori, gli attori che stanno nel titolo di questa conferenza
973460	985640	vogliono mettere in campo perché le esigenze di democraticità, partecipazione che furono di quei sindacati e di quei partiti siano oggi difese, rinvigorite e rilanciate nell'epoca della globalizzazione, grazie
986780	991780	Grazie, sentiamo ancora altre domande
1001700	1018780	Mi chiamo Alana Lentin, sono dall'Istituto Europeo Universitario, la mia domanda si tratta anche del soggetto dell'immigrazione e vorrei sapere come è possibile parlare di una democrazia europea, di un'Europa pluralista inclusiva e tolerante
1019070	1033070	quando poi allo stesso momento i governi europei costruiscono centri di detenzione per colore, che chiedono asilo politico, dove si registrano casi di tortura e si può addirittura anche morire
1046490	1051630	Buonasera, sono Gabriella Panarese, vorrei porre due domande sulla difesa europea
1051630	1061870	L'attuazione di una politica di difesa comune, inclusa la creazione di una forza militare europea entro il 2003, comporterà un aumento della spesa per la difesa
1061870	1074630	Ora, in assenza di una minaccia diretta alla sicurezza europea, quale poteva essere rappresentata dall'Unione Sovietica negli anni della guerra fredda, come si giustifica questa scelta agli occhi dei cittadini europei?
1074650	1084650	E poi il secondo quesito, la scelta di dare una dimensione militare all'Unione Europea implica anche un mutamento nel suo ruolo come attore internazionale
1085430	1101630	E' possibile ipotizzare che questo sia il primo passo di un percorso che potrebbe condurre quella che è stata fino ad oggi una potenza civile a divenire una grande potenza? Grazie
1130010	1131410	Scylla?
1131410	1139370	Nella prospettiva dell'apertura di un nuovo round dell'OMC, questo sembra il momento migliore per avanzare una tale proposta
1140010	1148410	Lei ha però proposto a tale fine l'applicazione del voto di maggioranza qualificata per la sola materia del commercio estero
1148410	1156110	Perché la Commissione non ha osato di più? Vorrei fare questa domanda provocativa
1156110	1169410	In tal modo il commercio dei servizi e del settore della proprietà interattuale rimangano ancora soggetti alla complessa procedura delle competenze miste tra Stati membri e Commissione
1170310	1196130	Come dunque i partner commerciali dell'Unione possono aspettarsi che l'Unione Europea parli ad una sola voce quando non hanno stabilito una procedura efficace che consenta a tutte le materie attindenti al commercio estero di diventare di competenza esclusiva della comunità? Sono state le riserve degli Stati membri? E come vuole garantire la coerenza delle attività dell'Unione?
1197330	1201130	Grazie per l'assistente di partimento di economia
1205750	1210130	Grazie, Giorgetti Giuliano, Dipartimento politico e sociale della Cigella regionale Coscana
1211250	1222350	La domanda è questa, alcuni scenari che si riferiscono in maniera particolare agli Stati Uniti d'America ipotizzano tra gli altri per gli anni prossimi un fortissimo calo occupazionale
1222350	1246450	In Europa sappiamo che le cose non vanno comunque benissimo, quindi la domanda è questa, cosa potrebbe fare, cosa pensate che possa fare una vera Unione Europea allargata ma soprattutto una vera Unione di popoli e non soltanto di istituti finanziari per proporre scenari diversi e soprattutto per concretizzare, per fare in modo che questi scenari anche in Europa non avvengano? Grazie
1256030	1259650	Buongiorno, Ilaria Menicucci, Università degli Studi di Firenze
1259650	1279650	Volevo fare una domanda al Presidente Maso, avendo parlato di un collegamento tra globalizzazione ed Europa, volevo sapere qual è la posizione dell'Italia rispetto alla posizione della Germania che cerca una posizione in un certo senso di supremazia, in una ponderazione dei voti della Commissione
1279650	1295650	Vedo in questa posizione una presa di potere, di nazionalismo da parte della Germania in un'Europa che dovrebbe essere più integrata se istituzionalmente in visione di globalizzazione, grazie
1297390	1314650	Buonasera, Andrea Spielmayer, l'Istituto Europeo, la mia domanda mi rivolge soprattutto al Presidente del Consiglio nel processo di creazione della Banca Centrale Europea, una delle principali preoccupazioni è stata quella di garantirne l'indipendenza
1315610	1333850	Alla quale, fatto cenno mio collega prima, si è seguito poi l'esempio della Bundesbank tedesca che gode di una massima indipendenza dalle pressioni della politica fiscale, cioè il governo tedesco, prima vista a livello europeo questo governo non c'è
1333850	1352870	E' indipendente di chi allora? La mia domanda un po' provocatoria è questa, ai singoli governi nazionali può andar bene una banca centrale così indipendente? Oppure bisogna trovare anche un modo di coordinazione rafforzata per quanto riguarda la politica fiscale?
1352870	1366090	Non parlo necessariamente di un governo europeo al quale si è riferito l'onorevole Dalema prima, ma ci vuole un contrapeso alla politica monetaria comune? Grazie
1367630	1380010	Sono Nicola Cintrone, studenta dell'Università di Fiense. Allora io volevo una questione abbastanza di attualità su Nizza, credo che a Nizza si aprirà un...
