start	end	text
0	10580	presa, teorizzato, anche autorevolmente teorizzato e cioè che l'impresa altro non è, è soltanto
10580	16340	esclusivamente di coloro che ci investono i propri soldi dentro e niente a che vedere
16340	29980	con un rapporto con l'altra parte della società, perfino con l'ambiente. Quindi questi sono
29980	38460	di riflessione supplementare in chiave diciamo così di strategia, di conflitto, di contenimento
38460	49560	e di proposta, alternative a questa posizione. Grazie, grazie molte. Prego, se vuole per
49560	59960	favore passare il microfono lì. Sì, io volevo avere un approfitto interiore
59980	66880	ma se volete, per favore visto che anche poi ci sarà modo di conoscere tra di voi,
67000	70000	però se volete dire da dove venite perché è anche interessante capire.
70020	80480	Io sono Enrico Grighetta da Gorizia. Volevo avere un maggior approfondimento su una questione,
80620	87540	io condivido le cose dette qua oggi da Massimo, c'è una questione secondo me però che ancora
89840	96700	dobbiamo elaborare e cioè come riusciamo a introdurre questi elementi di innovazione
96700	104340	del sistema, dell'economia, del nostro stesso modello di riformismo o come qui è stato
104340	114540	detto di un nuovo modello di competizione all'interno di un sistema di sicurezza perché comunque
114540	124500	il tema della insicurezza che non è solo il tema dell'albanese o della criminalità
124500	130320	o dell'estacomunità e di quant'altro, ma è un tema globale nel senso di sicurezza
131360	138180	verso l'Europa, il futuro, l'ignoto che da sempre nella vita delle persone, è uno
138180	145520	degli aspetti come si può dire presenti nel vissuto soprattutto delle parti più ricche
145520	150200	anche della nostra società italiana che sono anche le stesse a cui noi chiediamo
150200	155660	poi lo sforzo di innovazione maggiore ed è questa secondo me una delle questioni su
155660	158300	cui vorrei avere un approfondimento, grazie.
158500	168160	Grazie molto, ci sono altri che vogliono intervenire, prego se per favore, mi scusi
168180	170680	se, fate arrivare il microfono qui.
178620	191760	Io mi chiamo Luca Basile dalla Spezia, su tre punti, più che altro elementi di lucidazione,
191760	205080	ecco il primo, io riprendendo l'espressione dello storico Enzo de' Felice, l'integrazione
205080	212360	europea è stata matrice in Italia della composizione e della scomposizione dei blocchi
212360	221180	sociali tradizionali e della ridefinizione di due grandi blocchi sociali, uno come dire
221180	231360	che andava in maniera nuova dalle nuove forme di tipologie produttive all'impresa diciamo
231360	239220	così, dalle nuove forme di lavoro subordinato all'impresa ed un altro invece che andava
239220	246100	diciamo da settori della vecchia economia italiana fino a segmenti anche della tradizione
246100	256520	del movimento operaio, di fronte a questo io credo che il problema è stato da parte
256520	262200	della sinistra e della coalizione di centrosinistra di recepire i processi di modernizzazione
262200	270140	aggregando un nuovo blocco sociale come Dall'Emma metteva in dice, ecco quando si parla di riaggregazione
270140	276800	della coalizione dell'Ulivo non bisogna pensare anzitutto a mettere al centro questo tema
276800	283400	di una ricomposizione di un compromesso sociale per la modernizzazione dell'Italia in questo
283400	291820	punto e diciamo così capire se c'è all'ordine del giorno del dibattito italiano questo
291820	297740	punto. La seconda cosa è sarebbe interessante capire
298700	307080	dal momento che a mio modesto parere la sinistra italiana è stata, ha avuto un ruolo di avanguardia
307080	313060	anche rispetto alle altre componenti dell'internazionale socialista e del partito socialista europeo
313060	320100	nel sospingere almeno per certi versi un processo di integrazione europea anche rispetto alle
320100	327720	rigidità di altri paesi europei a che punto sia diciamo così nel dopo anche il processo
327740	335740	il momento di crisi che si è aperto a che punto sia un processo e se c'è un processo
335740	341660	di ridefinizione di una strategia sovranazionale se si è posto questo elemento nel dibattito
341660	346880	del partito socialista europeo e quale può essere il ruolo della sinistra italiana di
346880	355800	incarse in questo senso. Terzo ed ultimo punto mi persuade l'idea che come dire il conflitto
355800	363460	è distributivo e il grimaldello del conflitto tra capitale e lavoro non sia più come dire
363460	370980	la chiave di lettura centrale della società alla parte della sinistra e che anzi il nostro
370980	385780	problema sia quello di indicare un quadro di proposta politica che si riarticoli sul
385780	393340	lavoro. Tuttavia ecco un elemento secondo me rimane di caratteristica più spiccata
393340	400140	che deve avere di interesse la sinistra riformista rispetto al mondo del lavoro e cioè il carattere
400140	407020	della diciamo così subordinazione che era un carattere proprio del lavoro dipendente
407660	415760	fordista e che oggi si allarga verso la realtà del lavoro invece autonomo. Ecco questo carattere
415760	422260	quindi il carattere che anche riarticola la linea dell'inclusione e dell'esclusione sociale
422260	429700	penso debba essere mantenuto come chiave di lettura anche conflittuale se si vuole in
429700	435340	qualche maniera in senso nuovo all'interno del ruolo della sinistra riformista e anche
435340	438160	rispetto alle nuove generazioni su questi tre punti.
438540	443560	Io prenderei ancora due domande per poi dare la possibilità a Dallema di replicare come
443700	448780	lo sappiamo poi. Qui davanti in prima fila se per favore fate, ecco dopo di lui ne prendo
448780	473320	una sola, Sessarico. Sessarico sono di estrazione socialista. Faccio questa domanda, il termine
473320	483340	di intervento ha detto che si può parlare di riformismo anche di destra e quindi anche
483340	490560	Petracca ieri sul sole 24 ore in un breve articolo parlava di riformismo di destra.
490820	497440	Ora il discorso sarebbe molto lungo naturalmente però mi limita a fare una domanda molto rapida.
497440	503860	La sfida riformista, il titolo che abbiamo voluto dare a questo incontro, se non mettiamo
503860	509380	qualche aggettivo, non corre il rischio di essere qualche ulteriore spiegazione, non
509380	514400	corre il rischio di essere qualcosa di un po' equivoco specie in un dibattito italiano
517860	527300	dove non si capisce bene a cosa si ancori di riformismo se all'internazionale...
529080	534840	...se non mettiamo qualche aggettivo, non corre il rischio di essere qualche ulteriore
534840	540020	spiegazione, non corre il rischio di essere qualcosa di un po' equivoco specie in un dibattito
540020	551300	italiano dove non si capisce bene a cosa si ancori di riformismo se all'internazionale...
558660	566540	...chiamiamo sempre più spesso come un'esigenza di riformismo e l'anima per poter intercedere
566540	573260	consenso e rapporto con la propria cittadinanza e una dimostrazione delle ultime consultazioni
573260	579000	elettorali, poi nell'aggiro politico più generale contraddiciamo spesso questa grande esigenza.
584080	590860	Mi chiamo Marco Ruggeri, vengo da Livorno. Volevo fare una domanda molto rapida e è
590860	600440	questa. D'Alema diceva prima che noi dobbiamo scomporre un blocco sociale per costruirne
600440	608980	i presupposti per aggregarne un altro e credo che questo lo si fa poi su alcuni temi, voglio
608980	612940	dire specialmente sui temi della riforma dello stato sociale o quantomeno dalla visione
612940	618920	del blocco sociale, paradossalmente possiamo correre il rischio di avere maggiore difficoltà
618920	623180	nell'affrontare questo tipo di processo laddove siamo forza di governo, specialmente anche
623180	629300	da lungo tempo, perché questo comporta anche mettere in discussione alcuni punti che sono
629300	636920	fermi e che sono elemento anche di consenso elettorale e quindi credo che sia paradossalmente
636920	643320	più facile farlo come proposta di opposizione ma poi diventa anche difficile tradurlo in
643320	648060	proposte concrete di governo laddove siamo forza di governo. Come si riesce poi a tenere
648060	658280	insieme tutto questo? Grazie, una parola a D'Alema per la replica. Intanto vi ringrazio
658280	663260	perché le domande sono talmente belle che secondo me non vanno sciupate rispondendo,
663260	674000	no lo dico molto seriamente, sì ma è vero, cioè nel senso che ponendo dei problemi reali
674000	679760	diciamo, problemi in cui non esiste una soluzione rapida, i problemi reali normalmente sono
679760	688760	problemi che richiedono di essere reottematizzati e su cui bisogna lavorare, quindi non si possono
688760	700800	dare delle risposte compiute, bisogna limitarsi a indicare un percorso di riflessione. La risposta
701800	712240	è sì, cioè non c'è dubbio che i frutti avvelenati della deregulation sono da una
712240	721820	parte un'impresa, venire meno del senso della responsabilità sociale dell'impresa e dall'altra
721820	728180	parte una finanziarizzazione dell'economia che arriva all'estremo di diventare gioco
728180	736240	d'azzardo, un gioco d'azzardo con la roulette truccata, perché evidentemente il croupier,
737200	745380	ha il diritto di puntare, e cioè il manager ha le azioni della sua società e più interessato
745380	751920	a successo di borsa che non alla forza economica, reale e se per avere successo di borsa viene
751920	757340	a truccare i conti fa parte del gioco diciamo. Non c'è dubbio che noi siamo arrivati ad
757340	765880	un punto estremo, frutti avvelenati della deregulation impongono persino al presidente conservatore
765880	772880	degli Stati Uniti la necessità di una svuota, perché il rischio è che appunto la deregulation
773540	780220	porti a rompere il giocatto, a far saltare quel rapporto di fiducia fra il cittadino
780220	789240	investitore e il sistema che è il fondamento per cui il sistema possa funzionare. Per
789240	793800	questo io dico che il paradosto è che oggi c'è un grande bisogno di riformismo e cioè
793800	806740	bisogno di regolazione. Questa questione è enorme in America, sta esplodendo in modo
806740	813200	enorme e per la forza che ha l'economia americana rischia di coinvolgere e coinvolge l'intero
813200	822360	sistema dell'economia mondiale. Il secondo punto, il rapporto fra competizione, società
822360	831860	aperta e sicurezza, è una questione difficilissima da risolvere in modo teorico. In modo teorico
831860	837700	uno deve combinare i vantaggi del modello americano con i vantaggi del modello europeo,
839660	852280	è un grandissimo problema di ingegneria sociale. Io sono d'accordo che la nozione di sicurezza
853280	859260	è un grande problema e comporta la capacità di costruire nuove reti di sicurezza. Oggi
859260	865960	non c'è dubbio, per esempio, che il principale fattore di sicurezza è il livello di cultura
867580	872380	individuale. Il livello di cultura individuale e la capacità di apprendimento permanente
872380	879380	è un fattore straordinario non solo di forza professionale sul mercato del lavoro, che
880100	884620	muta completamente l'ottica con cui si guarda il tema della mobilità. Ragione amato è
885360	891180	diverso l'atteggiamento del lavoratore altissimamente qualificato che può licenziare il suo datore
891180	896860	di lavoro, nel senso che ne trova un altro che gli è più vantaggioso, che gli offre
896860	899980	maggiori prospettive e la parola mobilità è un fattore straordinario. Il livello di
