start	end	text
1813370	1819590	l'avversione di una parte più radicale, più estremista, che si è manifestata anche in
1819590	1827490	forme che sono tipiche della sinistra, perché la sinistra purtroppo c'è nella sinistra
1827490	1844750	la tendenza a demonizzare l'avversario, in particolare l'avversario interno. Mi sono
1844750	1855550	state delle ricostruzioni leggendarie, nel senso che mi trovo di fronte a delle persone
1855550	1862250	che mi scrivono, io ho un'intensa comunicazione via email con tante persone, mail, letter,
1862870	1868510	fax, insomma penso che ci sono molti italiani a cui piace scrivere, poi quelli di sinistra
1868510	1883390	sono acculturati. Io lo ritengo per me una fonte preziosa di conoscenza, io tuttora mi
1883390	1889350	viene in mente di parlare tu che sei responsabile del fatto che non si è fatta la legge sul
1889350	1900130	conflitto di interessi. Ora, questa accusa, diciamo, muove dalla più totale ignoranza
1900130	1906910	di quello che è accaduto nella scorsa legislatura, dove senza il minimo dubbio, qui non abbiamo
1906910	1911290	tra noi Stefano Passigli, che su questo ha scritto un libro, i libri sono lunghi e faticosi
1911290	1919670	da leggere, senza il minimo dubbio, l'unico sforzo serio di fare una seria legge sul conflitto
1919670	1926710	di interessi è stato fatto sotto il mio governo, senza il minimo dubbio. Cioè l'unico leader
1926710	1931330	del centrosinistra che ha cercato di fare una seria legge sul conflitto di interessi
1931330	1938590	sono stato io. E se si vuole fare una graduatoria delle responsabilità, certamente ci sono altri
1938590	1945030	che vengono molto prima di me, basta leggere gli atti parlamentari, ma nessuno si è dato,
1945150	1950770	perché naturalmente la tesi che c'è un traditore, diciamo, è una tesi talmente comoda, diciamo,
1950870	1954850	che uno poi non si dà pere ad andare a leggere gli atti parlamentari, diciamo, che è faticoso
1954850	1962070	ed è difficile. Così come io sono l'unico che ha fatto quel proposto al Parlamento, quelle
1962070	1966670	norme sulla par con diccio, che danno tanto fastidio a Berlusconi che le vuole togliere
1966670	1973670	di mezzo. Cioè in definitiva molti di quelli che si proclamano anti-Berlusconiani hanno
1974550	1979570	dato a Berlusconi molto meno fastidio di quanto non abbia fatto io, onestamente. Tanto è
1979570	1985330	vero che Berlusconi non è andato nel loro collegio a dire bocciateli, è venuto nel
1985330	1994150	mio. E quindi mi trovo nella disgraziata situazione di essere accusato di collusione con Berlusconi
1994150	2000270	da una parte così un po' fanatica e dall'altra parte invece Berlusconi la pensa completamente
2000270	2005130	diversamente, diciamo. E quindi mi trovo a prenderle da una parte e dall'altra. E' una
2005130	2012890	posizione dolorosa, ma succede, esatto. Andrea, scusa, non so se è già l'ora di dare la
2012890	2021310	parola ai nostri giovani. Ancora una domanda. Una domanda un po' così, un po' più lieve,
2021310	2030310	diciamo. Vedendo la TV in questi ultimi tempi, tutta la TV, ma soprattutto i programmi politici,
2030370	2036150	anzi soprattutto Vespa, diciamo, qual è il punto? Lei lo fa per ragioni professionali,
2037670	2048810	non lo fa per diletto, certamente. Io ho come l'impressione che lei si sia o sia, non so
2048810	2057090	la parte di chi si è voluta a cosa, è defilato. Adesso non la vedo partecipare alla politica
2057090	2063930	in TV. Allora mi chiedo, è lei che snobba la TV o è la TV e Vespa in particolare che
2063930	2071350	snobba lei? No, no. Devo dire a difesa del collega Bruno Vespa che mi ha invitato molte
2071350	2078790	volte. Ah, è lei che snobba la TV? Ma io ho deciso da qualche tempo di dire a Vespa
2078810	2084110	di dedicare tempo alla riflessione, come lei sa, presiede una fondazione culturale,
2085890	2093750	cioè di fare una politica più... Io penso che il centro-sinistra ha bisogno di rimettere
2093750	2100750	mano ad un progetto politico, progetto politico coraggioso che riguarda la struttura del
2100750	2108790	centro-sinistra, che riguarda la sua visione del futuro del Paese e questo richiede un
2108790	2116890	po' di ricerca. E poi lo faccio anche per una ragione ancora più precisa. Io ho un
2116890	2124110	grande stima, considerazione e sostegno verso l'attività del segretario del mio partito
2124110	2130830	e penso che una presenza troppo invadente della mia persona possa finire in qualche
2130830	2138130	modo per un di costacolare, perché noi siamo d'accordo su tutto, ma in qualche modo per
2139150	2146630	mettere un po' in minore evidenza il suo lavoro. Quindi mi sono ritagliato in uno spazio
2146630	2151610	diverso. Non credo che ci sia bisogno di essere presenti tutte le sere. No, no, per carità,
2151690	2160210	no. Cerco di fare ogni tanto un'intervista, quando mi sembra di avere qualcosa da dire,
2161370	2167790	di scrivere qualche articolo che è un esercizio faticoso ma utile, proprio anche fisicamente
2167790	2175450	scrivo così, e di andare ogni tanto a dire la mia in modo più misurato. È una scelta
2175450	2180470	che ho fatto io, non l'ha fatta la tipo. Bene. Allora, per quattro minuti cada grazie
2180470	2187450	al Presidente. Allora diamo una parola a numerosi giovani che sono in platea. Allora, il primo
2187450	2195810	della lista a porre domande al Presidente è Christian Braulis. Ho detto bene? Sì,
2195810	2204850	grazie. Salve. Il ruolo di un politico è quello di rappresentare ma anche al tempo
2204850	2209090	stesso quello di orientare il proprio elettorato. C'è un alimento nel pensiero dell'elettorato
2209090	2223950	del sinistra che lei non condivide che vorrebbe cambiare? Io penso questo, io penso che la
2223950	2234410	grande sfida è di carattere storico. Cioè, noi veniamo da un secolo che in Europa è
2234410	2244790	stato fortemente segnato dall'azione della sinistra. Le nostre società portano il segno
2244790	2253930	della sinistra. La sinistra ha conquistato diritti, istituzioni e naturalmente la sinistra
2254630	2261650	espone a rischio di concepire il suo ruolo fondamentalmente come il ruolo di conservare
2261650	2266290	ciò che ha conquistato. Tendiamoci, in questo c'è anche qualcosa di legittimo, di nobile.
2266470	2273390	Abbiamo conquistato dei diritti, li difendiamo. Io penso che però se la sinistra si riduce
2273390	2283590	a questo perde la sua capacità di essere una forza che concorre a trasformare la società.
2283590	2290410	Noi non dobbiamo confondere i nostri valori, che a mio giudizio non solo restano validi,
2290530	2299170	ma per certi aspetti oggi tornano di moda. Se noi guardiamo al mondo oggi non c'è dubbio
2299170	2308070	che la necessità di ridurre le diseguaglianze, di governare politicamente i processi internazionali
2308070	2314410	torna ad essere prepotentemente alla ribalta, cioè l'illusione che il mercato riservesse
2314410	2320330	i problemi e non l'illusione che sta tramontando, torna di moda la politica. C'è un bisogno
2320330	2328450	di riduzione delle diseguaglianze perché senza una lotta alla diseguaglianza, alle intolleranze
2328450	2338050	e ai fanatismi il mondo non va avanti. Quindi i valori della sinistra sono attuali. Le strutture
2338670	2345270	in cui questi valori si sono incarnati sono invecchiati. Noi non ci dobbiamo innamorare
2345270	2352110	di ciò che abbiamo conquistato. Dobbiamo capire che per esempio se noi vogliamo l'eguaglianza
2354970	2360550	dobbiamo rinnovare lo stato sociale, perché lo stato sociale oggi tutela solo una parte
2360550	2368010	della popolazione e ne esclude un'altra. E se noi ci limitiamo a difendere ciò che
2368010	2374970	abbiamo passato, difendiamo una struttura materiale, ma finiamo per negare un valore.
2376330	2386350	Questo a dirsi così sembra facile. Naturalmente questo comporta dei problemi molto seri perché
2386350	2390930	quando tutto questo discorso si traduce nel fatto che bisogna fare una certa riforma
2390930	2397110	delle pensioni, noi l'abbiamo fatta col governo Dini, poi magari ne parliamo e che a mio
2397110	2401810	giudizio la completata, anche se in modo del tutto diverso da come lo propone Berlusconi.
2402090	2409310	Questo discorso tocca interessi, quindi non è un discorso facile, è un discorso che
2409310	2416130	comporta una discussione anche sofferta, delle scelte anche difficili. Io credo di non essermi
2416130	2421550	mai sottratto a queste discussioni. Questo naturalmente fa di me una persona che a volte
2421550	2428350	scomoda, però io penso che è un dovere di un leader politico e non sottrarsi neppure
2429450	2433370	alle questioni scomode, altrimenti uno fa un altro mestiere.
2451550	2455790	La scelta è una scelta che non è solita a certa parte della sinistra. Si dice certo
2455790	2464070	che quella di ora è un'amministrazione particolare, c'è uno sceriffo, ma ci sembra però anche
2464070	2469630	d'intuire anche dal suo, quando lei era al governo, che non è quest'amministrazione,
2469670	2478330	ma è l'America stessa che ha una natura particolare. Qua vicino ai nostri confini è la affrontata
2478330	2485070	facendone risentire pochissimo al Paese. Questo va detto, era una guerra più difficile
2485070	2492250	perché era in Europa, ma è anche come l'America si pone. Io vorrei citare la filmografia a
2492250	2497610	tale proposito che è cambiata molto ultimamente. Dopo l'11 settembre l'America non ha più
2498610	2505490	riflettuto su quelli che era la guerra e altri fattori. Vorrei citare per esempio Stanley
2505490	2512150	Kubrick che diceva in un film che è Full Metal Jacket, già aveva intuito questa cosa,
2512230	2517810	poiché nella preghiera del soldato che fanno giochi e degli altri sulla branda diceva,
2518150	2523930	uccidere, uccidere fino a che non ci sarà più nemico, ma soltanto pace. Non è forse
2524490	2530390	quella di una democrazia particolare, che è quella americana, che ricerca sempre il confine
2530390	2537910	di oggi su Marte e da altre parti. Ecco, come la sinistra europea possa limitare questa
2537910	2543850	incidenza particolare che ha la democrazia americana e che certo va difesa, ma bisogna
2543850	2549630	anche cercare di limitare, penso, con quella che è l'intelligenza tipica, ci viene da dire,
2549670	2555750	della sinistra europea, non della destra, che vediamo troppo lassista da questo punto
2555750	2570690	di vista. Posto una domanda epocale, guardi, io ho una grande ammirazione per la società
2570690	2582090	americana, innanzitutto perché l'America è una società aperta, una società aperta,
2582090	2590790	una società multietnica, una società ricettiva. Io sono stato a fare delle conferenze in
2590790	2596090	California, la California probabilmente è la parte dell'America dove queste caratteristiche
2596930	2604630	sono persino più accentuate, diciamo, e sono stato in visita al Senato della California
2605770	2614090	e sono stato ricevuto da una bella signora, io venivo dal Brasile dove ero andato a fare
2614090	2624470	una campagna elettorale per Lula, che è un grande leader, ma questo è un altro ho capito,
2625070	2631830	e dopo essere andato in Brasile a fare qualche iniziativa di carattere elettorale, soprattutto
2631830	2640050	nelle aree dove ci sono gli italiani, il Brasile è pieno di figli, 25 milioni di figli
2640050	2646030	dei redi di italiani, abbiamo un'Italia in Brasile, andai in California e mi diceva
2646030	2652250	questa signora che era responsabile delle relazioni internazionali, forse ancora, del
2652250	2659210	Senato della California, e io le disse, vengo dal Brasile, lei mi disse anch'io, e mi disse,
2659210	2665210	io sono venuto in California sette anni fa per fare dei corsi di lingua, mi è piaciuto
2666870	2674310	ed era vice segretario generale addetta alle relazioni internazionali del Senato della
2674310	2681330	California, California ha 50 milioni di abitanti e se si separasse dagli Stati Uniti sarebbe
2681330	2686210	la quinta o la quarta potenza industriale del mondo, quindi non parliamo del Consiglio
2686210	2698670	della sgurgola barsicana, io mi sono chiesto se potrebbe essere mai pensabile che una
2698670	2705130	ragazza che viene a fare un corso di lingua in Italia dopo sette anni possa trovarsi ad
2705130	2716190	essere tra i più alti gradi della pubblica amministrazione, è impensabile, bene in
2716190	2723190	Italia, c'è poco da fare, sarà un Paese selettivo, ma un Paese capace di dare spazio
2723810	2730930	all'intelligenza, al talento, senza quelle chiusure corporative che opprimono le società
2731530	2736230	europee. Quando dissi questo al Presidente degli Stati Uniti, Clinton, quello con cui
2736230	2742730	ho avuto i rapporti, e che considera un uomo di straordinaria intelligenza politica e di
2742730	2750650	grande apertura e lungimiranza, questo era il mio giudizio personale, gli disse noi invidiamo
2750650	2760390	agli Stati Uniti, lui mi rispose anche con un atto che forse voleva essere di cortesia,
2760710	2770110	disse e noi invidiamo all'Europa il sistema sanitario. Infatti lui non è mai riuscito
2770110	2775790	nel corso della sua Presidenza a riformare il sistema sanitario americano che ha punte
2775790	2780210	di grande eccellenza e che tuttavia lascia alcune decine di milioni di persone privi
2780210	2787970	di qualsiasi assistenza. Allora certamente da questo scambio di battute
2788990	2795950	risulta un'idea utopistica, l'ideale sarebbe avere una società aperta, dinamica come
2795950	2801430	quella americana e in grado di garantire lo stesso livello di diritti sociali che nella
2801430	2807630	vecchia Europa dove si vive meglio, dove si vive meglio come qualità della vita media
2807630	2814110	dei cittadini, non a caso che nella vecchia Europa, vecchia ricca, nella vecchia Europa
2814110	2820990	si garantisce alla media dei cittadini. Naturalmente questo ideale è un ideale probabilmente
2820990	2826850	irraggiungibile diciamone e quindi noi dobbiamo pensare che il mondo occidentale conosce diversi
2826850	2836970	modelli che devono convivere, collaborare tra di loro, integrarsi, rispettarsi a vicenda.
2837450	2843810	Ecco la cosa che mi preoccupa di più di questa nuova leadership americana e soprattutto
2843810	2857530	dei gruppi intellettuali che l'hanno accompagnata, sostenuta e preparata è questo senso unilaterale
2857530	2864050	della missione americana, il senso di dire noi dobbiamo mettere in ordine il mondo, poi
2864050	2873110	chi ci sta ci sta. Questo è molto pericoloso, per gli Stati Uniti è pericoloso, c'è un
2873110	2878750	bellissimo libro da cui ho tratto spunto io per il primo capitolo di un mio libro, perché
2878750	2883490	lo vedi negli Stati Uniti, adesso è stato tradotto, cioè adesso, da qualche tempo anche
2883490	2890310	in Italia, il paradosso del potere americano, della superpotenza, Joseph Nye che è stato
2890310	2895090	anche un collaboratore dell'amministrazione Clinton, che è un libro contro l'unilateralismo
2895090	2903090	degli Stati Uniti, sui rischi di questa visione che mette al centro diciamo l'uso della
2903110	2911850	hard power, la forza militare, a cui questo intellettuale, in questo caso della East Coast
2911850	2920450	diciamo, contrappone invece l'idea del soft power, che lui fra l'altro, questo mi ha colpito
2920450	2933090	molto in questo volume, accosta al concetto gramsciano di hegemonia, lui dice la forza
2933090	2935030	di l'uffsidie, non è la forza della nostra musica, non è la forza della nostra cinema,
2935050	2940810	della nostra musica, non è la forza delle nostre armi, la politica americana non deve
2940810	2947690	basarsi fondamentalmente sulla forza delle nostre armi, ecco io guardo naturalmente all'America
2947690	2953950	sperando che prevalgano queste componenti, questo è il mio punto di vista, io credo
2953950	2959330	l'Occidente certamente è di fronte ad una grande sfida che è quella del
2959330	2964190	terrorismo, una sfida drammatica di cui sarebbe sbagliato sottovalutare la
2964190	2969310	portata e sarebbe ugualmente sbagliato che l'Europa pensasse che questo è un
2969310	2975150	problema degli Stati Uniti, perché non è così. Io direi che il terrorismo è una
2975150	2980630	sfida all'umanità intera, non è neppure soltanto una sfida all'Occidente, ma la
2980850	2990330	discussione è come si vince questa sfida. Ora non c'è dubbio che l'idea che
2991390	2996690	la lotta contro il terrorismo si possa vincere attraverso quasi esclusivamente
2996690	3002130	l'uso della forza, l'uso unilaterale preventivo della forza, questa idea si è
3002130	3007530	rivelata sbagliata. Non c'è il minimo dubbio che la guerra preventiva in Iraq
3007530	3014690	al di là del fatto che è certamente positivo che sia caduto Saddam Hussein, ma
3014690	3020070	dal punto di vista della lotta al terrorismo, la guerra in Iraq ha reso il
3020070	3025150	terrorismo più pericoloso di prima, non meno pericoloso, ha determinato una
3025150	3029890	preoccupante saldatura tra le componenti nazionaliste e quelle
3029890	3033690	fondamentaliste religiose del mondo islamico, che tra di loro erano divise,
3033690	3039090	anzi, contrapposto, ha determinato un'ondata di odio occidentale in tutto
3039090	3043770	il mondo arabo. Io ho molti amici che mi dicono preoccupati, ma voi lo sapete che
3043770	3052150	c'è la fila nelle moschee per iscriversi alla guerra santa, anche nei paesi più
3052150	3057290	amici dell'Occidente. L'odio antioccidentale, il senso di una
3057290	3063670	dignità ferita, umiliata, l'idea che un grande paese islamico come e come è
3063670	3069790	l'Iraq, sia occupato da un'armata occidentale. Io trovo che c'è una
3069790	3075290	rozzezza culturale, non vedere persino l'aspetto religioso, antropologico di
3075290	3081790	questo fatto. Cioè, a me un arabo ha detto, senti, è come se la Francia o la Spagna
3081790	3089790	fossero occupati da un esercito musulmano, voi non potreste accettarlo. Che cosa
3089790	3094730	succederebbe nelle vostre chiese, nelle vostre case? Quale sentimento si
3094730	3101770	genererebbe in Europa? Io credo che, diciamo, in questo modo noi non
3102450	3107350	sconfiggeremo mai il terroresumo. Ecco Presidente, ma alla luce di questo, di
3107350	3112290	questo che ha appena detto, della unilateralità della forza anche, cioè
3112290	3117390	come se ne esce dal pantano iracheno? Perché il problema è anche questa, a parte
3117390	3123310	la guerra santa, ma abbiamo, stiamo capendo, ma forse l'avamo capito anche
3123310	3129690	prima, che la democrazia non è che si può imporre con l'occupazione, cioè la
3129690	3135630	democrazia è un processo lento. Presidente, dopo l'attacco alle Twin Towers,
3135810	3142410	gli Stati Uniti avevano imboccato la via giusta, e cioè una grande coalizione
3142410	3148270	contro il terroresmo, che era una coalizione che comprendeva anche una
3148270	3157730	larga parte del mondo islamico. E non a caso la azione in Afghanistan ha avuto un
3157730	3165810	largo consenso internazionale. Io credo che sia stato sbagliato uscire dal
3166370	3173250	di questa politica, e cioè a un certo punto decidere un'accelerazione unilaterale
3174070	3178090	che ha isolato gli Stati Uniti, c'è isolato certamente un certo numero di
3178090	3181890	paesi, si sono accodati, ovvio una grande potenza,
3183390	3188970	tuttavia ha diviso le Nazioni Unite, diviso la NATO, diviso l'Europa, diviso il
3188970	3193870	mondo arabo, e questo è stato, io ritengo sia stato un errore politico da parte del
3193870	3201070	Governo degli Stati Uniti d'America, e penso che una via d'uscita consiste nel
3201070	3205090	fatto di prendere atto che la pacificazione e la stabilizzazione
3205090	3209530	dell'Iraq non potranno essere fatte dall'esercito che ha vinto la guerra lo
3209530	3215710	ha occupato, e ci vuole un cambio di passo, che significa che gli americani
3215710	3218950	devono fare un passo indietro, non dico andare via, perché probabilmente una
3218950	3226330	presenza militare americana come garanzia per evitare il caos è necessaria, ma una
3226330	3232610	presenza in una sorta di seconda linea, mentre in prima linea bisogna che ci
3232610	3239410	siano gli iracheni e le Nazioni Unite, cioè che ci sia un mutamento politico, io
3239410	3243570	capisco che non è facile chiedere una cosa di questo tipo all'amministrazione
3243570	3254030	di Bush, ma io sono stato a giugno a Bagdad, dopo la guerra, in una situazione
3254030	3261010	in cui il terrorismo e la guerriglia erano all'inizio, ma era già del tutto chiaro
3261810	3267730	che la situazione tendeva a precipitare nel caos, lo dico perché lo
3268020	3276540	dici allora, lo dici tornando, io sono stato a Bagdad in una città, diciamo che faceva
3276540	3282480	abbastanza paura per la confusione, la sporcizia, la mancanza di qualsiasi ordine eccetera,
3282520	3288100	in cui questi militari americani stanno lì dentro spazi, sono sostanzialmente trincerati,
3288900	3294160	cioè il paradosso è che non sono i terroristi trincerati, sono gli americani trincerati,
3294160	3301900	questo basta andare in giro, non lo vede, in cui si capiva benissimo che la situazione
3301900	3310280	andava verso il caos, se non ci fosse stato immediatamente un mutamento di indirizzo,
3310340	3315220	invece le cose sono andate di peggio in peggio, gli americani hanno sciolto le forze armate
3315220	3322340	irakene, un esercito professionale, 300 mila persone licenziate da un giorno all'altro
3322340	3328640	con il piccolo particolare che si tratta di disoccupati con le armi diciamo, dando in
3328640	3333580	questo modo una base di massa alle azioni di guerrigli eccetera e via via il rapporto
3333580	3341700	con la popolazione è diventato più difficile, e secondo me le cose andranno avanti così
3341700	3348680	se non c'è un mutamento e ripeto il mutamento con tutti i rischi del caso consisterebbe
3348680	3355100	nel fatto di dire benissimo, si forme un governo provvisore irakeno sotto l'autorità con un
3355100	3359880	mandato delle Nazioni Unite, perché un governo provvisore irakeno, siccome è difficile che
3359880	3367040	ci possono essere ora le elezioni generali, o lo nominano gli americani, ma un governo
3367040	3373940	provvisore irakeno nominato dagli americani a mio giudizio rischia di non essere legittimato
3373940	3378700	agli occhi della popolazione, perlomeno di una parte importante di essa, oppure lo si
3378700	3384720	costituisce sotto l'autorità delle Nazioni Unite. Io ritengo che bisogna avere il coraggio
3384720	3391120	di un cambiamento radicale, ho detto in quale senso, aggiungo un'altra cosa che io considero
3391120	3397500	di importanza per certi aspetti, persino maggiore del rapporto col mondo arabo e riguarda la
3397700	3403920	necessità di riprendere in mano da parte della comunità internazionale la situazione
3403920	3410700	del Medio Oriente, essendo chiaro che la situazione del Medio Oriente nelle mani dei soggetti
3410700	3425360	protagonisti non farà nessun passo verso la pace, è puramente illusorio pensare che sulla
3425360	3431360	base della roadmap israeliani e palestinesi andranno verso la pace, questa roadmap non
3431360	3439080	abbiamo fatto un solo passo in avanti e secondo me non ci sarà un solo passo in avanti, occorre
3439080	3445860	un approccio del tutto diverso da parte della comunità internazionale. Io ritengo che l'unico
3445860	3454300	messaggio in questi mesi è venuto dall'accordo di Ginevra, il fatto che si sono messi intorno
3454300	3459500	a un tavolo rappresentanti delle società civili. E' appunto peccato che era solo informale.
3459620	3464980	Ho capito, ma è certo che è informale, però quella è una pace vera. Può essere un esempio,
3465080	3470440	però... Quella è una pace vera se la comunità internazionale
3470440	3482980	la facesse propria e dicesse su questa base, io credo che le paci si impongono anche, perché
3482980	3490540	se in tutto il mondo si fosse atteso che facessero la pace quelli che facevano la guerra, avremmo
3490540	3497320	solo guerra. Nei Balcani la comunità internazionale è intervenuta, ha imposto la pace, perché
3497320	3501280	altrimenti i Serbi, i Croati e i Mussumali erano sempre lì che si ammazzavano, se non
3501280	3507040	gli lanciavamo un appello o gli mandavamo un pezzo di carta dicendo, vedete, vi indichiamo
3507040	3513280	un percorso. No, a un certo punto abbiamo mandato delle forze armate sotto la responsabilità
3513280	3519480	dell'ONU, della NATO, abbiamo detto basta. Io penso che non vedo perché nel Medio Oriente
3519480	3526060	noi non dobbiamo pensare che si deve dire adesso basta, adesso mandiamo una forza di
3526720	3533540	interposizione. Creiamo una situazione che tuteili palestinesi e difenda anche la sicurezza
3533540	3540900	di Israele e vi imponiamo di venire intorno ad un tavolo, cioè io ritengo che questa
3541500	3547960	inerzia della comunità internazionale, questa è una cosa che ferisce profondamente il mondo
3548600	3556460	arabo, perché quelli dicono, e beh, insomma, parliamoci chiaro, ci sono due pesi e due
3557160	3561380	misure. Questa è il ragionamento che si fa nel mondo arabo. Il problema è che forse
3561380	3569200	è già troppo tardi, a mio modestissimo parere. Comunque, ancora una domanda dai giovani,
3569420	3578880	Fabio Ayo. Ecco. Buonasera. Abbiamo letto recentemente che lei considera il riformista
3578880	3585080	sul Corriere della Sera, l'abbiamo letto, come il quotidiano ormai della destra intelligente.
3585460	3590860	Stando così le cose, le vorrei chiedere a questo punto come dovrebbe essere strutturato
3590860	3594220	un quotidiano per poter essere letto dalla sinistra intelligente.
3595720	3605960	Guardi, io spesso sui giornali escono indiscrezioni virgolettate che uno ha riferito ad un altro,
3606040	3613340	che ha riferito ad un altro, eccetera. Nel nostro Paese non esiste l'abitudine di pubblicare
