start	end	text
0	10740	Spero interessante chiacchierata con il Presidente dei DS, io partirei subito con la stretta attualità
11500	22160	e chiederei al Presidente D'Alema che cosa pensa lui, che cosa cambia nella politica
22160	28560	italiana se cambia qualcosa dopo la bocciatura del Lodo Schifano, sappiamo tutti che cosa
28560	37480	significa e Giuliano Ferrara mi sembra qualche sera fa ha detto secondo me l'unico risultato
37480	44560	è che assisteremo a una campagna elettorale lunga due anni e mezzo da qui, non alle regionali,
45400	51320	alle europee ma addirittura alle politiche, io per la verità non vedo che cosa ci sia
51320	56040	di diverso in fondo da quello che è accaduto finora, secondo me è un mio modestissimo
56040	64780	parere, stiamo assistendo da mesi a una campagna elettorale continua, basta di vedere i programmi
64780	73000	televisivi sulla politica. Presidente, secondo lei in concreto cosa cambia dopo la bocciatura
73000	80880	del Lodo Schifano? Grazie, innanzitutto vorrei ringraziare per
80880	99500	questo invito, per l'accoglienza così gentile credo con parole, non ho dubbio, che sono l'espressione
99500	105800	di un'attenzione verso la persona, verso ciò che io posso rappresentare, cioè una parte
106400	113940	della sinistra italiana. Mi sembra che il ciclo sia molto interessante, l'onorevole
113940	119200	Andreotti ci unisce anche un'altra passione come è noto che non è condivisa qui dal
119200	127260	nostro interlocutore, anzi è presidente onorario, l'onorevole Andreotti di un club di cui io
127260	135480	sono un modesto socio diciamo di tifoseria giallorossa, ma devo dire che certamente
135480	144860	con gli altri invitati a questo ciclo di conversazioni mi unisce la passione per la politica, una
144860	152300	volta il presidente Cossiga ha detto che tra i protagonisti di questa seconda repubblica
152300	161300	ci sono due categorie di persone, una che egli, non io, ma egli guarda con una certa
161300	166720	diffidenza, di parveneux diciamo, e poi dice sempre ci sono quelli che invece da ragazzi
166720	175560	hanno attaccato i manifesti al muro e lui si sente orgogliosamente parte di questa categoria,
175560	184860	vorrei dire che voi avete invitato tre attaccatori di manifesti, quindi che hanno in comune l'essere
185800	192640	espressione di tradizioni politiche del Paese, di partiti che hanno la loro tradizione,
192800	200120	che hanno la loro storia, con luce ed ombre naturalmente, la storia dei partiti non è
200120	204860	stata anche una storia di sconfitte e anche di fallimenti, noi non possiamo dimenticare
204860	210260	che questa stagione della politica italiana è iniziata ormai oltre un decennio fa da
211080	219500	un fallimento dei partiti, però a grado di questi partiti restano necessari, alla dita
219500	227720	politica di una grande democrazia ne costituiscono la struttura, sono la forma più ragionevole
227720	234840	della partecipazione dei cittadini e una democrazia senza partiti è come un corpo che non abbia
235560	242880	ossatura, rischia di non stare in piedi, rischia di afflosciarsi su se stessa e questo è un
242880	252720	pericolo che secondo me noi non dobbiamo correre. Io sinceramente non credo, vengo alla risposta,
253180	260700	non credo che cambi nulla di sostanziale, aggiungo purtroppo, a mio giudizio questa
260700	270640	sentenza sarebbe l'occasione per un cambiamento. Noi abbiamo avuto due eventi di grande rilievo
270640	277640	costituzionale nell'ultimo mese, il Capo dello Stato ha rinviato in modo motivato
277640	287600	alle camere la legge Gasparri sull'informazione con una decisione che davvero ha una natura
287600	296700	abbastanza straordinaria. Noi siamo in una Repubblica parlamentare nella quale di norma
296700	302180	la controfirma delle leggi è atto dovuto da parte del Presidente della Repubblica,
302540	311140	il Presidente può in circostanze straordinarie rinviare una legge al Parlamento, naturalmente
311140	317260	tutti sappiamo che se poi il Parlamento la riapprova egli deve firmarla. Lo dico questo
317260	324320	perché nella confusione corrente si attribuiscono al Presidente della Repubblica compiti e responsabilità
324320	330040	che non ha, lo si tira per la giacchetta. Fortunatamente noi abbiamo un Capo dello Stato
330040	338120	che ha un'idea molto chiara dei suoi compiti e delle sue funzioni. Se il Capo dello Stato
338120	347240	dunque ha deciso di rinviare una legge, questo è un atto che ha un grande significato, una
347240	351760	legge che si può operare con la necessaria serietà. A distanza di meno di un mese la
351760	360520	Corte Costituzionale ha borciato il cosiddetto Lodo Schifani. Io credo che queste due decisioni
361400	369740	siano una salutare lezione, vorrei dire, per l'opposizione o parte di essa e per la maggioranza.
370840	377220	All'opposizione che cosa dicono queste due decisioni? Dicono questo, dicono questo,
377240	386600	dicono questo. Noi non viviamo in un regime, viviamo in uno stato di diritto. Non è vero
386600	393840	che l'Italia è vittima di un regime, si possono discutere questa e quella misura, no, viviamo
393840	401240	in uno stato di diritto perché in un regime ovviamente nessuna autorità avrebbe potuto
401240	406300	bocciare le leggi del Capo del Governo, poi leggi che stanno così a cuore il Capo del
406980	415420	Governo. Noi viviamo in uno stato di diritto nel quale esistono istituzioni che sovraintendono
415420	424800	alle regole che presiedono al vivere collettivo. Dunque l'opposizione non ha ragione di abbandonarsi
424800	431960	ad un radicalismo antistituzionale, deve esercitare con molta fermezza la sua battaglia ma dentro
431960	439240	un quadro di istituzioni che hanno confermato la loro forza. Queste due decisioni confermono
439240	446540	la forza e il pluralismo delle istituzioni del Paese, ma queste due decisioni contengono
446540	454780	anche un messaggio molto forte alla maggioranza di Governo, e cioè la maggioranza di Governo
455440	462440	e il Capo del Governo a mio giudizio hanno preso le mosse da una concezione sbagliata
463660	471520	della loro funzione in un regime democratico. L'idea della sovranità popolare che ha l'onorevole
471520	483260	Berlusconi è che chi ha la maggioranza dispone delle istituzioni, non è così, come è noto
483260	491340	diciamo, questa idea della democrazia è quella che Tokevil bollò come l'idea della dittatura
491340	500860	della maggioranza, che è inaccettabile perché in uno stato di diritto esiste il limite delle
500860	507380	leggi e delle garanzie delle minoranze, che è esattamente ciò che distingue la democrazia
507380	516000	in un regime tirannico. Dunque la maggioranza non è padrona delle istituzioni, è tenuta
516000	521280	al rispetto delle leggi, a cominciare dal rispetto della legge fondamentale, la Costituzione,
523860	530060	tanto più una maggioranza che grazie alla legge maggioritaria è in maggioranza parlamentare
530060	537300	ma non rappresenta neppure la maggioranza assoluta del Paese. E dunque se si volesse
537300	546340	entrare una lezione da queste decisioni della Corte e del Capo dello Stato sarebbe quello
546340	553260	di cambiare il carattere della lotta politica in Italia, cioè di avere una lotta politica
554040	563560	che sia meno violenta, più rispettosa dell'insieme delle regole che presiedono anche al funzionamento
563560	571280	delle istituzioni, che si ritorni a quel metodo che io ritengo fondamentale, e cioè
571280	579340	il metodo secondo cui sulle regole si ricerca un'intesa, il metodo che io ho seguito pagando
579340	593540	un prezzo altissimo diciamo, ma io difendo, tuttavia è vero, però io ritengo che questo
595040	603720	principio non è un principio opzionabile, non è un optional, è un principio fondamentale
603720	611780	per una forza democratica, cioè chi vince governa, ma le regole costituiscono diciamo
612300	618020	la struttura di una casa comune e non possono essere decise con l'arbitro di una maggioranza,
618820	625920	non foss'altro perché le maggioranze cambiano e siccome le regole fondamentali in un paese
626440	630920	civile non si possono cambiare ad ogni cambio di maggioranza politica, perché sennò la
630920	636280	gente diventa matta, perché si può cambiare alla Costituzione ogni volta che cambia la
636280	641600	maggioranza politica e quindi è evidente che per evitare questo impazzimento del sistema
642160	651240	bisogna che ci si metta d'accordo. Io credo che purtroppo non cambierà nulla, però penso
651240	656800	che se non cambierà nulla sarà un'occasione perduta, un'occasione di rinsadimento del
656800	665960	sistema, il sistema ha l'occasione per rinsavire, purtroppo i segnali non sono questi, io penso
665960	672180	al modo in cui si è avviato al Senato il dibattito sulle riforme costituzionali devo
672180	678680	dire che non si può che essere estremamente preoccupati. Quindi neanche le sto chiedere
678680	683340	che cosa pensa dell'affermazione di molti esponenti della maggioranza che la decisione
683340	695840	della consulta è frutto della politicitazione dei giudici? Sarebbe come negli Stati Uniti
695960	700900	i democratici non accettassero le decisioni della Corte Suprema perché i giudici rinomino
700900	709260	il Presidente, penso che verrebbero considerati dei matti. Queste sono le regole, queste
709260	716200	sono le istituzioni, non è pensabile mettere in discussione anche il Capo dello Stato,
716300	724180	è stato eletto dal Parlamento, tuttavia è il Capo dello Stato. I giudici sono nominati
724180	729860	parte dal Parlamento, parte dal Presidente della Repubblica, parte dalle magistrature,
730660	737840	questo stabilisce la Costituzione. È evidente che i giudici, non è che i giudici si straggono
737840	753180	a sorte, questa obiezione è disarmante perché rivela un analfabetismo costituzionale. In
753180	760340	Stati Uniti addirittura i giudici, i procuratori sono elettivi, più politicizzati di così,
761380	767900	eppure una volta che sono eletti sbocca una funzione pubblica. Qui siamo veramente di
767900	775300	fronte ad una visione primordiale della democrazia e dello Stato di diritto. Sulla base di questa
775300	783160	logica tutto è delegittimato, tutto è delegittimato, questo è pericolosissimo, stupendo pericolosissimo
783180	791360	se ci si mette su questa strada. Io credo che alla fine non ritroviamo più le coordinate
791360	802380	del vivere comune. Io trovo per esempio che per completare il tema delle regole, la maggioranza
802380	809720	vuole affrontare alcune riforme della Costituzione. L'opposizione, dopo aver discusso perché
809720	815700	non ne avevamo una parte che diceva non bisogna discutere nulla, siccome lo propongono loro
815700	822140	non si deve discutere, posizioni anch'esse primordiali. L'opposizione tuttavia ha scelto
822140	830620	un'altra strada, ha discusso e ha elaborato un suo documento da parte di un gruppo presieduto
830620	837520	da Giuliano Amato nel quale si sono avanzate una serie di proposte, serie interlocutorie
838620	846160	per avviare un confronto, documento che è stato giudicato valido anche da diverse forze
846160	853060	della maggioranza. Stavamo per avviarci a questo confronto quando l'onorevole Bossi
855240	867680	ha preteso che, diciamo, in primo luogo il Senato votasse la proposta più controversa
867700	872980	cioè di tutte le proposte della maggioranza. C'era una che l'opposizione aveva dichiarato
872980	879380	che non avrebbe potuto accettare, una proposta strampalata, pericolosa e dannosa per il
880060	886160	Paese, l'istituzione dei Parlamenti interregionali, cioè noi siamo un Paese che ha i Consigli
886160	891900	quartiere, i Consigli comunali, i Consigli provinciali, i Consigli regionali, il Parlamento
892460	900720	e in mezzo a questo caso dovremmo istituire i Parlamenti interregionali perché l'onorevole
900720	908840	Bossi vuole che ci sia il Parlamento della Padania, un'idea che in questo contesto, come
908840	920000	omaggio alla regione che ci ospita, potremmo definire una bischerata, ma che oltre a essere
920000	925800	una bischerata è anche un'idea pericolosa perché in un Paese come il nostro che ha
925800	932860	già tante tensioni e tanti pericoli di divisione l'idea che cominciamo a creare questi parlamenti,
932960	939700	cioè l'Italia ce li avevamo queste cose quando c'erano i Granducati, poi dopo ci fu un grande
939700	949040	sforzo per creare una nazione, quindi una follia, ebbene anziché avviare il dialogo
949040	955340	su tutte quelle parti su cui vi era stato uno sforzo di avvicinamento e di proposta,
955560	963180	come dicono che noi non proponiamo, no, il documento elaborato da Giuliano Amato è indiscutibilmente
963180	969840	una proposta seria, anziché discutere di tutte le cose su cui si poteva trovare hanno
969840	977620	voluto innanzitutto cercare il punto di rottura e votare sulla proposta più strampalata e
977620	985980	più controversa, ora questo modo di procedere è secondo me veramente allarmante e mi ha
985980	992520	fatto piacere che non un pericoloso estremista girotondino, ma il Presidente Fisichella,
993860	1000300	Vicepresidente del Senato e autorevole esponente di Alleanza Nazionale, abbia voluto rivolgere
1000300	1006780	all'ulivo l'appello di un impegno comune per difendere l'unità del Paese, che dimostra
1006780	1012340	che in fondo su alcuni grandi temi, almeno con una parte della destra, si può collaborare,
1012420	1017120	anche se il Governo sembra essere prigioniero delle posizioni più estremiste.
1017380	1027260	A proposito di girotondi, Presidente, è noto che a lei non stanno molto simpatici, diciamo
1027260	1032680	le cose come stanno, poi magari preciserà meglio il suo pensiero. Lei prima ha fatto
1032680	1036780	un'occasione di non accendere il fatto che i partiti continuano ad essere necessari
1036780	1043240	nel nostro sistema politico, io personalmente per quel che conta sono d'accordo. Però a
1043240	1049580	vedere un po' le cose all'interno del centro-sinistra del vostro schieramento sembra che qualche
1049580	1056040	certezza su questo terreno venga messa in discussione, cioè l'importanza, almeno mediatica
1056040	1061940	per carità dei cosiddetti movimenti, dei girotondi, eccetera, è un fatto importante.
1061940	1068460	Adesso si dà il caso che un esponente anche importante di questo movimento, che è un
1068460	1074680	collega giornalista, Marco Travaglio, ha usato addirittura delle parole molto pesanti, oggettivamente,
1074760	1082480	al di là di come uno la pensa, parole oggettivamente pesanti nei suoi confronti, anche se non diretti,
1082560	1087540	ma comunque nei confronti del suo Governo. Ha detto sostanzialmente che siete, poi non
1087540	1092780	mi ricordo bene il soggetto, non so neanche se lo ha pronunciato, siete entrati a Palazzo
1092780	1100900	Chigi con le pezze al sedere e siete usciti ricchi. Detta da un esponente dello stesso
1100900	1106520	schieramento, diciamo così, perché è questa la verità, perché si discute addirittura
1106520	1113060	di una lista unitaria tra il centro-sinistra e i cosiddetti girotondi, quindi mi sembra
1113270	1118210	un'informazione abbastanza pesante. Presidente, come si fa a fare un'alleanza politica con
1118210	1123350	queste premesse, che per la verità non sono le sole, c'è anche altro, però c'è anche
1123350	1126230	questo? Questa però è particolarmente impegnativa,
1126450	1136830	diciamo, ma naturalmente, diciamo, io non penso minimamente di poter fare alleanza innanzitutto
1136830	1140930	con questo signore, diciamo, con il quale se la vedrà il mio avvocato, evidentemente,
1140930	1143970	non solo mio, perché... E' stato anche un giornalista dell'unità Presidente.
1144090	1152450	Sì, sì, e cosa vuole? L'unità, come lei sa, appartiene ad alcuni imprenditori privati
1152450	1161170	quali hanno, ovviamente, nel rispetto della libertà, dell'informazione, certo noi non
1161170	1164470	possiamo essere accusati di essere oppressivi, diciamo, semmai di...
1164470	1169810	Non c'è regima anche per... Ecco, di un liberalismo, direi quasi eccessivo,
1169810	1175950	ognuno ha diritto di... Non è questo il punto, ma io non ho nulla che dire con l'unità,
1176150	1180590	ma sicuramente chi ha lanciato queste accuse, peraltro non solo mie, perché siccome era
1180590	1186910	molto generica, diciamo, io credo che ci siano parecchie persone che sono piuttosto seccate,
1187670	1195090	diciamo, che come lei sa, Palazzo Chigi, entrano sottosegretari, consiglieri, diciamo, l'espressione
1195230	1204490	era generica e genericamente ingiusta, direi che all'uniosa, poi sa, io sono di un parere,
1204570	1211710	io credo che... Io sono un garantista, sono sempre stato un garantista, penso che se si
1211710	1218550	hanno delle accuse da rivolgere, innanzitutto bisogna fare dei nomi, dei cognomi, non bisogna
1218730	1228450	dire sono entrati, anche di torrubido, no? Anche di vile, se si vuole, e bisogna essere
1229470	1237190	circostanziati, precisi, nel rivolgere delle accuse, non si può, diciamo, in modo generico
1238070	1244290	dire delle cose che non sono vere, diciamo, altrimenti se ne risponde nelle forme previste
1244430	1249550	da lei. Comunque sono da provare, questo è certo, voglio dire, sono cose... Il minimo
1249550	1255330	è uno, ma comunque uno deve rivolgere delle accuse specifiche, deve dire hanno fatto questo
1255330	1262190	atto scorretto, hanno compiuto questo... almeno in uno stato di diritto, insomma, fino a quando
1263630	1270050	non ci troveremo in una pericolosa dittatura delle Guardie Rosse, diciamo, o nere, quello
1270050	1276570	che sia, perché questo personaggio è uno che ha avuto anche su queste tendenze bicolori,
1277450	1284690	diciamo, uno che è sempre stato su posizioni estreme, ma di colori diversi. Però, a parte
1284690	1292850	questo episodio abbastanza... che appartiene, diciamo così, alla barbarie di certi aspetti
1292850	1299890	del scontro politico in Italia, ma insomma, bisogna essere anche preparati a queste cose
1300050	1308330	purtroppo. Io non confondo, diciamo, né la persona in questione, né il movimento che
1308330	1316210	è stato chiamato dei girotondi, diciamo, con queste posizioni, queste posizioni estreme
1316210	1325710	non sono, diciamo, non ci danno il senso di questo movimento. Questo movimento io ritengo
1325710	1333950	ha avuto una funzione positiva, nel senso che noi, in un momento di estrema difficoltà
1333950	1342070	dell'opposizione, che era uscita sconfitta dalle elezioni, divisa abbastanza frastornata,
1342350	1351250	diciamo, noi abbiamo avuto nel Paese un sommovimento di una parte dell'opinione pubblica, di protesta
1351250	1358610	contro il governo, che ha avuto diversi caratteri, ha avuto un carattere sociale, le grandi manifestazioni
1358610	1364330	sindacali, che hanno coinvolto milioni di persone, e che ha avuto anche un carattere
1364330	1371250	più di rivolta civile, sui temi della giustizia, della libertà dell'informazione. Io, sinceramente,
1372090	1379290	credo che quella stagione di mobilitazione abbia avuto un effetto positivo, sia stato
1379290	1386790	un momento positivo, il mio partito ha condotto un dialogo con queste forze, soprattutto
1386790	1392010	con l'impegno anche personale dell'onorevole Fassino, che io ho condiviso e sostenuto.
1392170	1397510	Dall'altro, sono presidente di quel partito, se avessi un'opinione diversa la direi pubblicamente.
1398330	1407390	Ho sempre avuto una diffidenza, una contrarietà nei confronti delle posizioni di un determinato
1407390	1414270	gruppo, di intellettuali o di giornalisti, che costituiscono tuttavia una parte di tutto
1414270	1420330	quello di cui parliamo. Questo è vero, però c'è molta attenzione da parte dei partiti
1420330	1427250	nei confronti di questo gruppo, perché evidentemente si è convinti che sia una realtà importante.
1427470	1432350	Io non voglio discutere di quanto sia importante, siamo un Paese democratico, con cui si può
1432350	1440330	presentare alle elezioni e misurare quanto è importante. Io, sinceramente, nell'esaminare
1440330	1449390	le posizioni politiche, non parto dall'idea che se uno è grosso ha ragione. Poi si vede
1449390	1453190	dopo chi ha i voti, diciamo, io esamino le posizioni politiche.
1454430	1462110	Nel nome dell'anti-berlusconismo, comunque, avendo come prospettiva quello di farti adere
1462350	1467730	legittimamente il Governo di centrodestra, non c'è il rischio da parte vostra che si
1467730	1474590	voglia mettere insieme, d'accordo, posizioni che poi sono oggettivamente quasi inconciliabili,
1475330	1483790	cioè la causa è ovviamente legittima e, dal vostro punto di vista, ottima. Ma il metodo
1483790	1490730	per raggiungerlo non si presta a qualche indebolimento futuro. In fondo, la prima esperienza
1490730	1497390	di Governo di centro-sinistra è stata caratterizzata da questo, con l'esperienza di rifondazione.
1497610	1503470	Questo è un problema che riguarda tutti e due gli schieramenti. E dopo ne parlerò,
1503630	1509170	perché questo è il tema di fondo, cioè di come costruire nel nostro Paese un bipolarismo
1509170	1518170	che sia più efficace, meno frantumato, meno litigioso, che è un processo politico e istituzionale
1518170	1525810	molto impegnativo e importante. Ma, per tornare a noi, io non credo che, ed è proprio questo
1525810	1530370	uno dei punti di contrasto tra quello che penso io e quello che pensano alcuni di questi
1530370	1535670	esponenti, poi saranno una decina di persone che, fra l'altro, conosco da quarant'anni,
1535790	1542550	quindi sono nuovissimi sulla scena della politica italiana, sono dei militanti, degli intellettuali
1542550	1553750	quali discutiamo da tanto tempo. Io contesto, diciamo, l'idea che la sostanza della posizione
1553750	1561710	politica culturale del centro-sinistra debba essere un acceso anti-Berlusconismo. Ma non
1561710	1567050	perché abbia delle simpatie verso Berlusconi, che è critico e che ritengo del tutto inadeguato
1567050	1572550	a guidare il nostro Paese, penso anche che i fatti lo abbiano dimostrato. Ma perché
1572550	1579390	penso che la forza di una coalizione politica è data dal suo progetto, dalla sua visione
1579390	1586410	del futuro del Paese, non dalla demonizzazione dell'avversario, che ritengo non utile né
1586410	1591730	alla civiltà del confronto politico e neppure sotto il profilo del vantaggio elettorale,
1591730	1597950	essendo che è stato persino dimostrato che le campagne personali contro il leader del
1597950	1604530	centro-destra fanno perdere voti al centro-sinistra, non ne fanno guadagnare. Sono contrario a questa
1604530	1610150	visione della lotta politica. Ritengo che sia stato sbagliato all'indomani della vittoria
1610150	1616290	elettorale di Berlusconi proclamare che in Italia era finita la democrazia. Sbagliato
1616290	1624630	è pericoloso e venne a Firenze a dirlo in un altro, numerosissima e vivace assemblea.
1624810	1630690	Nel senso di sì, no. Non c'è stato un colpo di Stato. Abbiamo perso le elezioni, che
1630690	1636550	è un'altra cosa e dobbiamo cercare di capire perché abbiamo perso le elezioni, per quale
1636550	1640810	ragione non siamo riusciti a conquistare il consenso della maggioranza degli italiani,
1641370	1647370	quali sono le ragioni della vittoria della destra che non può essere ridotta al fatto
1647370	1653430	hanno la televisione, perché questa componente c'è anche, ma non è quella determinante
1653430	1659430	al mio giudizio. Sono delle ragioni politiche, sociali, culturali. Io ho sempre cercato di
1659430	1665950	spingere la sinistra e il centro-sinistra a cercare di capire che cosa si muove nel profondo
1665950	1673810	della società italiana e non a pensarsi vittima di un complotto, perché se a partire dal
1676450	1682090	94 i partiti del centrodestra hanno avuto il consenso della maggioranza degli italiani
1682090	1687410	e questo è avvenuto anche nel 96 quando noi abbiamo vinto le elezioni. Io mi sono sforzato
1687410	1692350	di dirlo, mi hanno detto che ero un complottatore. No, erano i numeri, i numeri non complottano,
1692350	1698950	erano studiati, perché nel 96 noi vincemmo le elezioni, ma a causa delle divisioni del
1698950	1704750	centrodestra, perché la somma dei voti della lega sul polo era più della sinistra. Quindi
1704750	1714010	io penso che innanzitutto compito della sinistra è capire come mai da circa un decennio la
1714010	1720270	maggioranza degli italiani ha votato per il centrodestra. E naturalmente questo...
1720270	1724950	Io ho dato tantissimo, ho scritto dei libri per dare delle risposte perché non è così
1724950	1736050	sempre. Ma perché io credo che la crisi del sistema parlamentare, dei partiti, abbia creato
1736050	1745150	nel Paese un forte bisogno di novità, di modernizzazione e una grande parte del Paese,
1745150	1750110	questo è avvenuto particolarmente in alcune delle aree più dinamiche, penso al nord,
1750570	1756870	si è convinta che la destra fosse in grado di rimuovere quelle chiusure corporative,
1757130	1763590	quegli impedimenti che avevano ostacolato lo sviluppo moderno del Paese, cioè quel bisogno
1763590	1772150	di una società con meno regole, con meno tasse, con meno burocrazia, che era un bisogno
1772150	1779670	reale della società italiana, è stato incarnato dalla destra. E io ho sempre pensato che il
1779670	1787770	centrodestra poteva e può vincere se si mostra in grado di modernizzare il Paese sulla base
1787770	1793810	di valori diversi, ma se invece il centrodestra appare come una forza sostanzialmente di
1793810	1800450	conservazione, il centrodestra è sconfitto. Io ritengo che la ragione della sconfitta
1800450	1806630	del centrodestra è piuttosto questa, che non invece, come si è in modo fantasioso,
1806770	1813370	è la bicamerale, non c'entra nulla. Naturalmente questa mia posizione politica ha attirato
