start	end	text
3613340	3620840	i virgolettati soltanto prima, dopo averli prima confrontati con l'autore, diciamo. Questa
3620860	3625340	è un'abitudine che c'è sulla stampa americana, per esempio, che è una buona cosa dell'America
3625340	3632320	che dovremmo copiare, diciamo. Da noi si scrive e basta. E se uno smentisce ti rispondono
3632320	3636360	ma noi l'abbiamo saputo da una fonte sicura, quindi non vale neanche la pena rismentire
3636360	3642140	per essere presi in giro, diciamo, nella risposta. Comunque, in questo caso la fonte non era
3642140	3649420	sicura, diciamo. Io semplicemente, siccome invece si è detto, anche qui sempre da parte
3649420	3657280	di un'altra fonte, anch'essa sicura, che il Riformista era il mio giornale, il giornale
3657280	3662480	della proprietà del Riformista, diciamo. Non c'entrò nulla e naturalmente ci sono
3662480	3667400	anche delle persone che conosco, come ci sono nella redazione dell'Unità, come ci sono
3667400	3674420	nella redazione della Repubblica, della Corea della Sera. Fa parte, ovviamente, sono giornalista
3675180	3684380	e un uomo politico. In quale ordine legge il giornale di la mattina? Spazio. Questa
3684380	3688980	è una domanda, diciamo, alla quale... Se c'è un ordine, magari è pura casualità,
3689040	3696380	non lo so. C'è un ordine? A cominciare dai maggiori quotidiani, diciamo, perché non
3696380	3702120	c'è il minimo dubbio, diciamo, che i maggiori quotidiani hanno una notevole quantità di
3702780	3708940	informazioni. Mi guardo i giornali con una certa distrazione, devo essere sincero.
3709500	3721300	Allora, Rudi Caparrigni. Buonasera. Nel mese di marzo in Europa si terranno due importantissime
3721300	3726880	elezioni in grandi paesi mediterranei, quali sono la Spagna e la Grecia. Si tratterà di
3726880	3733020	una competizione perfettamente europea con un partito popolare, uno social democratico,
3733260	3739200	con totale esclusione degli estremismi. Eppure questi due paesi hanno visto finire delle
3739200	3745520	dittature militari soltanto negli anni settanta e sono riusciti ad avere una simile coesione
3745520	3751920	ed un simile tasto di democrazia. L'Italia ha visto finire una dittatura ben trenta anni
3751920	3758960	prima, ma ancora non è riuscita a fare altrettanto e anzi, come dimostra il libro di Panza, quel
3758960	3767140	periodo qui in Italia fa ancora tanta paura. Quando saremo in grado, noi italiani, di essere
3767140	3773180	capaci di apprendere quella che Peres Diaz ha chiamato la lezione spagnola, ma che io
3773180	3777840	chiamo anche la lezione greca, questi paesi ce l'hanno fatta partendo trenta anni dopo
3777840	3783540	di noi. Cos'hanno avuto loro in più di noi e cosa si deve fare come italiani per raggiungere
3783540	3786980	un traguardo necessario per guardare avanti? Grazie.
3789240	3798380	Io non esagererei perché in Spagna i movimenti nazionalisti hanno un contenuto di estremismo
3799400	3805780	quale noi fortunatamente non conosciamo. Io trovo che questo fatto che ogni tanto in Italia
3805780	3811060	ci innamoriamo di qualche modello, di qualcuno che ci ha dato una lezione. Questo fa parte
3811060	3818360	della nostra generosa esterofilia. Adesso va di moda questo amore per il modello spagnolo.
3818800	3824500	In Spagna, nei Paesi Baschi sparano da 50 anni. Da noi, fortunatamente, questi fenomeni
3824500	3832440	sono più ridotti. Se lei guarda agli ultimi risultati elettorali in Spagna, la forza delle
3832440	3840140	posizioni più estremiste è crescente. Tanto è vero che in Catalogna i socialisti, per
3840140	3846460	potere governare, non essendo riusciti a vincere le elezioni da soli, hanno dovuto fare una
3846460	3852960	coalizione con l'escherra repubblicana. In un Paese come la Spagna essere repubblicani
3852960	3859100	non è precisamente essere moderati, sarebbe come da noi essere monarchici, diciamo. Quindi,
3859620	3866700	che è una forza nazionalista, una forza molto radicale, io credo che la situazione sia
3866700	3877360	un po' diversa. Io credo che tendenze radicali siano presenti a destra e a sinistra in tutte
3877360	3884200	le società europee. Penso che questo derivi da ragioni profonde che riguarda la crisi
3884200	3891240	delle nostre società, gli effetti della globalizzazione, i processi di emarginazione sociale, le paure
3891800	3899820	di ceti sociali che temono di perdere identità o privilegi, il vero problema è un altro
3899820	3908740	che in tutti questi Paesi, pur essendoci tendenze di tipo estremista e radicale, esistono tuttavia
3908740	3917180	delle grandi forze politiche collocate sulle mezze ali, diciamo così, in rozzamente, diciamo,
3917980	3923860	nel centrosinistra o nel centrodestra, che danno una maggiore stabilità al sistema.
3924660	3931140	Noi non abbiamo questo. Quando, per esempio, io ho accolto con favore, diciamo, la proposta
3931140	3936900	di Romano Prodi, di una lista unitaria del centrosinistra alle elezioni europee, cioè
3936900	3945020	una convergenza e non unica lista delle maggiori forze del centrosinistra, è perché io vedo
3945020	3952680	in questa proposta la speranza di costruire una grande forza democratica, riformatrice
3952680	3960020	del centrosinistra italiano del tipo delle grandi forze politiche che ci sono in Spagna,
3960120	3965560	in Germania, in Gran Bretagna e che in Italia non c'è. E devo dire sinceramente che io
3965560	3971060	guarderei con favore anche ad un analogo processo dall'altra parte. Io penso che sarebbe un
3971060	3978920	grande passo in avanti per il Paese se nell'area del centrodestra e nell'area del centrosinistra
3978920	3985560	si formassero non due partiti unici, perché questo non è realistico, ma due grandi formazioni
3986120	3994740	in grado di dare maggiore stabilità al nostro bipolarismo. Quindi, in questo senso lei ha
3994740	3999200	ragione, non nel senso che non c'è il radicalismo negli altri Paesi, ma nel senso che noi abbiamo
3999200	4006320	un sistema politico più frantumato e che mancano questi due pilastri del bipolarismo. Penso
4006320	4012400	che il compito nostro della politica dovrebbe essere quello di costruirli, a partire da
4012400	4016520	queste elezioni europee, se ci riusciamo, almeno per quanto riguarda il centrosinistra.
4031040	4038140	Buonasera. Sarà Prodi il nuovo Presidente o leader dell'Ulivo?
4040260	4047700	Sì, questo è uscito sul giornale, non è stato smentito da nessuno. L'indicazione
4047700	4054720	che viene dalle forze politiche del centrosinistra è che candidato alla guida del Governo,
4054740	4059060	nelle prossime elezioni politiche, sarà il Professor Romano Prodi.
4060760	4064040	Ferma, come ha detto lei, che i giornalisti scrivono.
4064300	4068180	No, no, no, ma questo è stato più volte confermato. Comunque lo confermo anch'io.
4068420	4071860	Benissimo, grazie. Massimiliano Lari.
4083160	4092260	Sì, buonasera. Lei è stato il primo Premier con un passato nell'ex partito comunista.
4092780	4098400	Cosa ha significato questo per la sinistra in Italia e per la sinistra in generale?
4100800	4112200	Io credo che il fatto che nel giro di relativamente pochi anni, diciamo, gli eredi dell'ex partito
4112200	4117380	comunista da una parte e dall'altra parte gli eredi del movimento sociale, cioè del
4117380	4127320	partito neo-fascista, siano stati al governo del nostro Paese, io ritengo che sia un segno
4127320	4133200	della crescita democratica del Paese, il fatto che sono finiti gli steccati ideologici,
4133340	4141620	le preclusioni e che siamo diventati sotto questo profilo un Paese nel quale chi vince
4141620	4149780	le elezioni governa, senza dovere avere particolari passaporti democratici che non siano il voto
4149780	4157300	dei cittadini. Sinceramente, io penso che questo carattere più aperto del sistema, questo
4157320	4162700	sistema, dopo che per 50 anni avevano sempre governato le stesse persone, non solo gli
4162700	4169120	stessi partiti, sia un passo in avanti. Ritengo che il bipolarismo è stato un grande passo
4169120	4175760	in avanti, lo vorrei migliorare ma riterrei pericoloso tornare indietro. Per la sinistra
4175760	4182060	il governo è stato una grande prova. Adesso al di là del periodo in cui io sono stato
4182060	4188780	capo del governo, comunque noi siamo stati al governo per 5 anni direttamente e prima
4188780	4195200	abbiamo sostenuto in modo determinante governi per altri anni. La sinistra italiana ha avuto
4195200	4201100	una responsabilità di governo diretta, indiretta e persino al massimo livello per un periodo
4201100	4208020	abbastanza lungo nella vita del Paese, io ritengo che questa prova l'abbiamo superata.
4209600	4215340	Non abbiamo minacciato la libertà di nessuno, non abbiamo mangiato bambini, non abbiamo
4215340	4220900	soffocato le libertà fondamentali. Io ritengo che abbiamo governato abbastanza bene, ma
4220900	4228420	su questo il mio giudizio è partigiano. Abbiamo rispettato gli impegni internazionali del
4228420	4238000	nostro Paese, tutto sommato per essere una forza che non era mai stata al governo e che
4238520	4240500	la profondità non era mai stata a
4246300	4249380	lungo l'obiettivo韓ico, per esempio.
4249380	4256580	Trichiamo every way we can welcome bike shed,
4257400	4265340	anche in posto HIMMA, selfish way we can get carbon aud Loop.
4265340	4267980	operation'll be a biggest one e
4267980	4272940	per quanto riguarda la regione Toscana. Non so se lei ha conoscenza, ma adesso dici che
4272940	4279640	in Toscana si sta cercando di approvare una nuova legge elettorale, come sembrerebbe l'abolizione
4279640	4286200	del voto di preferenza. Non pensa che questo possa essere una cosa che allontani, diciamo,
4286320	4290160	le persone dalla politica? Grazie.
4291300	4296600	Guardi, il voto di preferenza è anche... io adesso non voglio entrare in decisione della
4296600	4301840	Toscana. Dico la mia opinione sul voto di preferenza, che è un problema generale, non solo Toscana.
4302600	4311340	Il voto di preferenza ha anche alimentato fenomeni degenerativi e competizioni all'interno
4311340	4325760	degli stessi partiti che secondo me finiscono per oscurare il dato vero di una competizione
4325760	4331020	politica tra diversi programmi, non è uno scontro di persone all'interno degli stessi
4331020	4341260	partiti. Per cui io ritengo che l'abolizione del voto di preferenza possa essere un modo
4341260	4347920	per restituire alle elezioni quel carattere di un confronto fra programmi, fra visioni
4347920	4355160	diverse che dovrebbero avere. Personalmente ritengo che questo potrebbe essere, tuttavia,
4355940	4362540	integrato da un meccanismo di primarie per la formazione delle liste dei partiti. Cioè,
4363040	4369040	se tolto di mezzo il voto di preferenza sono di fatto i partiti a decidere l'ordine dei
4369040	4375620	candidati e quindi la loro probabilità di essere eletti, io ritengo che si potrebbe
4375620	4382820	prevedere per legge che le liste dei candidati si formano attraverso un meccanismo di elezioni
4382820	4389120	primarie, in modo da garantire sia il momento democratico della scelta delle persone, sia
4389120	4393700	il momento democratico in cui si vota per un programma, per una prospettiva di governo,
4394100	4399880	come due momenti distinti che si integrano. Secondo me questo sistema sarebbe il migliore.
4402160	4409840	Non voglio propormi come esperto per la regione Toscana. Andrea, ultima domanda? Bene, allora
4409840	4420760	Marzio Cacciaamani. Buonasera Presidente. Si assiste sempre di più ad uno scollamento
4420760	4426840	tra la società civile e il mondo politico. In questo contesto, come può essere ricucito
4426840	4434760	questo strappo e, soprattutto, come i partiti politici potrebbero ricucire appunto questo
4434760	4439540	elemento? In virtù anche del fatto che c'è sempre una minore democrazia interna e minore
4439540	4449300	informazioni dei classi dirigenti. Grazie. Ma io non lo so se c'è, diciamo, si dice
4449300	4455360	che c'è questo strappo tra la società civile e i partiti. Tuttavia, io osservo, noi siamo
4455360	4460840	tra i paesi del mondo dove è più alta la partecipazione elettorale dei cittadini. Tuttavia
4460840	4469460	più alta. Siamo tra i paesi del mondo dove i partiti hanno un più alto numero di iscritti.
4473080	4479660	Sono centinaia di migliaia di persone che sono iscritte ai partiti ciascuno al suo partito
4479660	4487540	e, complessivamente, insomma, una quota della popolazione. Siamo un paese che conosce molte
4487540	4494340	altre forme di partecipazione, associazioni, movimenti girotondi, movimenti ambientalisti,
4496640	4501480	movimenti pacifisti. Insomma, certamente non si può dire che la società italiana sia
4501480	4507700	una società in cui non esistano. La vostra associazione è una forma di partecipazione,
4507860	4516420	di interesse alla politica. Io starei attento, diciamo, che poi questa partecipazione abbia
4516420	4523280	spesso anche un contenuto critico. Questo è naturale, è giusto ed è persino utile
4523280	4530820	che sia, diciamo. Però quando la gente partecipa, quando le persone partecipano in una misura
4530820	4536080	abbastanza significativa rispetto agli altri paesi, non voglio dire, non è una misura
4536080	4544580	assoluta, io credo che questo stia a manifestare che c'è una società civile viva, appassionata
4544580	4553260	ai temi politici. Certo, i partiti debbono funzionare di più come i partiti che hanno
4553280	4560660	come strumenti di selezione e di promozione. Lei dice che non c'è democrazia. Io sono
4560660	4566180	cresciuto in un partito, quando ero piccolo, dove c'era parecchio meno democrazia, diciamo,
4566300	4570980	rispetto a quella che c'è nel partito dove sono ora, diciamo. Ce n'è molta, qualche
4570980	4577440	volta mi serve abbessino troppa, diciamo, nel senso del dibattito, del confronto delle
4577440	4587000	opinioni, diciamo. Non lo so, ecco, io sono, sono piuttosto, ho una visione un po' diversa,
4587240	4596140	diciamo. Io penso questo, io penso che il Paese ha bisogno di partiti più forti. Non
4596140	4605020	è vero che la debolezza dei partiti aiuta la democrazia. Lo abbiamo pensato, la maggioranza
4605020	4611600	degli italiani lo ha pensato per dieci anni e a questo punto, secondo me, gli italiani
4611600	4618260	cominciano a cambiare opinioni. Noi abbiamo bisogno di partiti più forti, più radicati
4618260	4635000	nella società, più numerosi, più chiaramente organizzati, perché partiti forti sono in
4635000	4642860	modo che partiti deboli. Noi avevamo partiti forti, che erano figli di un'altra epoca,
4642900	4650280	di grandi ideologie, quei partiti forti non li abbiamo più, non possiamo pensare di ricrearli
4650280	4658940	quei partiti. Dobbiamo costruire un nuovo sistema di partiti e questa è la sfida che non abbiamo
4658940	4664840	ancora vinto, che la mia generazione e la generazione che viene, diciamo, deve riuscire
4664840	4676660	a vincere. Questa seconda repubblica è un copione senza attori, nel senso robusto, diciamo,
4677460	4687420	e mancano i soggetti, i soggetti radicate nella società. E allora, noi abbiamo tanta partecipazione,
4688420	4695220	ma una debolezza delle strutture politiche. Per questo, io torno a dire, noi abbiamo bisogno
4695220	4701820	di ricostruire il sistema politico. Su quale modello? L'Europa. Se noi guardiamo all'Europa,
4701920	4708200	in tutti i paesi europei, l'alternanza è tra grandi forze di sinistra, di centrosinistra
4708200	4717080	e di centrodestra. Noi dobbiamo, anche in Italia, sulla base di questo modello, rafforzare
4717080	4724460	il sistema politico. Io penso, ripeto, che anche tanti critici dei partiti si rendano
4724460	4733260	conto che è meglio avere meno partiti più forti che averne tanti deboli, perché tanti
4733260	4740000	deboli fanno confusione. Pochi forti danno una struttura al sistema democrazioso.
