start	end	text
1901690	1908590	in Italia è non a caso un esperimento che attira curiosità e interessi, quindi fatto
1908590	1914050	del mondo. L'idea di qualche nostro compagno che non ci ha creduto, che ha detto in questo
1914050	1921690	modo ci isoliamo dalla sinistra mondiale, è sbagliata. Io sono testimone del fatto che
1922600	1931780	oggi noi siamo tornati per certi aspetti ad essere guardati come un paese laboratorio
1931780	1940500	della sinistra, come fu tanti anni fa con l'esperienza del comunismo italiano e mi ha
1940500	1945820	colpito in America Latina, mi hanno detto finalmente la sinistra italiana torna ad essere un punto
1945820	1955660	di riferimento innovativo perché si percepisce ovunque l'insufficienza delle vecchie ricette
1955660	1962640	tradizionali della sinistra e la necessità di nuovi orizzonti culturali, nuovi orizzonti
1962640	1971980	sociali. Allora io credo che il Partito Democratico sia questa, sia questa nuova sinistra che
1971980	1978720	si presenta poi tutto il mondo come un centro-sinistra, perché una forza che pretende di essere
1978720	1987140	maggioranza, una forza maggioritaria non si confina in una parte dello schieramento, ma
1987140	1992800	cerca di portare le idee e i valori della sinistra al centro dello schieramento politico e sociale,
1993840	1999980	perché punta a conquistare la maggioranza del paese e lo fa attraverso una sintesi dell'esperienza
2000180	2008420	di un mondo cattolico che in Italia ha avuto sempre una fortissima componente, riformista,
2008640	2018180	progressista, pacifista, universalista e di una sinistra che appartiene ad una tradizione
2019400	2031880	originale del socialismo, non dogmatica, creativa, oggi mi viene in mente un nome anche perché
2031880	2042340	purtroppo questa mattina è morto il figlio di Antonio Gramsci, ecco, ma Giuliano Mosta
2042340	2048680	è stato un fatto che ci ha preoccupato in questi ultimi giorni, stava male, stavano
2048680	2053300	per buttarlo fuori dall'ospedale perché non è assicurato, come se sono Americanizzati
2053300	2063940	in fretta, diciamo, ecco, e purtroppo, diciamo, era veramente arrivato allo strevo, ecco,
2063980	2072180	ma quello è in pezzo di una tradizione creativa della sinistra italiana e una sinistra non
2072180	2078500	dogmatica, un mondo cattolico che non ha mai cessato neppure negli anni della guerra
2078500	2088300	fredda di guardare oltre il confine e di proporsi una visione universale, che costruiscono
2088300	2102160	insieme con altre componenti, laiche, ambientaliste, un nuovo grande partito, è qualcosa che al
2102160	2108900	tempo ha avuto anche una capacità di stimolo, insomma, mentre dicevano che noi ci isolavamo,
2109140	2114720	nel nostro congresso sono venuti il Presidente dell'Internazionale Socialista e il Presidente
2114720	2122700	dei Democratici Americani a dirci bravi andate avanti, e voglio dire, non si tratta di forza
2122700	2131180	marginale, si tratta delle due maggiori componenti del mondo progressista, oggi nel mondo occidentale.
2131840	2139560	Allora, io credo che questo progetto ha bisogno di tante intelligenze, ha bisogno di una leadership,
2139860	2147680	la sceglieremo, c'è più di un candidato, e questo è, io ho grande rispetto di tutti
2147680	2153740	i candidati, continuo a pensare che quello più adeguato sia Walter Beltrombi, ma ha un
2153740	2161760	po' di rispetto, diciamo, e della convinzione che la dialettica che si aprirà sarà una
2161760	2168000	dialettica positiva, penso che c'è bisogno delle idee non soltanto dei candidati, ma
2168000	2172860	di tutti quelli che hanno delle idee da proporre, e che la costituente di un grande partito
2172860	2180920	non è solo la primaria dei dirigenti, ma è anche il momento in cui si raccolgono progetti,
2180920	2192740	idee, proposte, non ci sono precedenti di un grande partito che nasce dicendo, è aperto,
2193040	2201180	chi vuole ha il diritto di candidarsi e di votare, non ci sono precedenti di un'operazione
2201180	2207920	che ha questo grado di apertura e questa carica di novità, un partito che nasce il giorno
2207920	2215900	in cui si va a votare per costituirlo, e l'atto del votare è anche l'atto di aderire
2215900	2222640	a questo nuovo grande partito, e noi dovremmo costruirne insieme le modalità democratiche
2222640	2230080	che dovranno essere innovative, perché noi continuiamo ad avere in mente un modello di
2230080	2236660	partito che è quello nel quale siamo cresciuti, meno io, che è stato un grande partito, ma
2236660	2242660	non c'è più, e la politica di oggi non può vivere del ricordo di quella del passato
2242660	2249560	e fra le macerie di quella del passato, e la novità di questo progetto nuovo è anche
2249560	2255860	qui nel fatto di essere il primo grande partito di una nuova stagione, più la verità, diciamoci
2255860	2262280	la verità, c'è un altro partito nuovo in questo Paese che si chiama Forza Italia, è così,
2262280	2271760	però ecco, noi abbiamo opposto a Forza Italia la novità della vecchia politica molte volte,
2272120	2281280	e teniamoci, non ne era prima, adesso noi opponiamo al modello del partito azienda,
2282080	2289980	del partito proprietario, invece qualcosa di nuovo che nasce a sinistra, che nasce da
2289980	2295340	un'altra cultura, ma che non è più una vecchia politica, è qualcosa di nuovo, è
2295340	2299920	un partito del quale siamo tutti proprietari, sono proprietari tutti quelli che domenica
2299920	2309980	14 ottobre si presentano e con il loro voto lo costituiscono, e questo, se non tenessi
2310540	2316820	di essere indicato come complice direi quasi è una proprietà cooperativa, ma non vorrei
2316820	2328540	usare una parola proibita, comunque è sicuramente una proprietà condivisa, non appartiene ad
2328540	2336820	una singola persona, io ritengo questo esperimento una grande occasione per la democrazia italiana,
2337820	2345380	perché io che difendo la novità della politica so bene che non basta predicare la novità
2345380	2352300	della politica per resistere a chi disprezza la politica e penso che bisogna anche avere
2352300	2360360	il coraggio di innovare, noi lo stiamo facendo, qualcuno pensava che ci saremmo inciampati
2360360	2370900	nelle deghe di carattere personale, noi possiamo avere avuto dei conflitti politici, ma non
2370900	2378940	delle deghe personali, io questo lo rivendico perché noi che siamo un gruppo di persone
2378940	2384220	che vengono dall'esperienza di un partito che non c'è più e ci conosciamo da tanti anni,
2384500	2392240	e che in qualche occasione abbiamo anche avuto budini di scontrarci, però alla fine siamo
2392240	2393640	qui davanti...
