start	end	text
0	5800	spalle non è stato facile e insomma in qualche momento mi sono, ci siamo sentiti
5800	10120	un po' come quelli che stavano nell'avamposto, a tenere una posizione.
10360	15760	Mi dispiacerebbe molto se adesso arrivasse il fuoco amico a crearci un
15760	19220	po' di problemi che noi speravamo di poter risolvere.
20080	20640	Grazie.
24860	32200	Più volte questa sera tu hai usato questa espressione, io penso al mio lavoro, il tuo
32200	36300	lavoro è quello di ministro degli esseri, soprattutto se anche vicepresidente del
36300	41060	Consiglio, quello prevalente è quello di ministro degli esseri. Ora, parlare della
41060	48140	politica essere italiana ci porterebbe ad andare avanti per ore, io mi limiterò a
48140	55480	uno spunto, domani il Senato ci sarà un ribattito sulle missioni italiane all'estero
56760	65660	e queste missioni rappresentano Libano e Afghanistan punti delicatissimi di grande
65660	72620	tensione internazionale. Allora, c'è un aspetto di politica interna, quindi
73620	81140	quando si tratterà di rifinanziare la missione afghanesta mi chiedo che tipo di missione
81880	87120	rifinanzieremo, vorrei che fosse un discorso troppo anticipato, ma insomma è chiaro che
87120	94440	qualcosa già bolle in pinto, ma c'è soprattutto l'aspetto di politica internazionale e la
94440	100740	sicurezza dei nostri soldati e qui soprattutto il Libano mi sembra il punto più delicato.
101660	110180	Quali saranno, se le vuoi anticipare, le linee della tua esposizione e dove pensi che il
110180	116800	nostro Paese debba operare, in che modo, non solo per garantire la pace, ma per garantire
116800	118660	anche la nostra sicurezza?
120780	126140	Domani sarà un dibattito sulla politica estera, non solo sulle missioni, perché così è
126140	134180	stato chiesto, ma anche perché io credo che investendo l'Aula del Senato, è chiaro che
134180	139080	hanno voluto che fosse investita l'Aula del Senato anche per altre ragioni, nel senso
139080	147560	che ogni volta che si vota il Senato è un bribido e quindi è chiaro che il centrodestra
147560	155640	cerca di dare una spallata, ecco la logica della spallata è ancora la logica prevalente
156140	165840	ma, tuttavia, io vado a illustrare le scelte fondamentali che in questi ultimi mesi hanno
165840	173320	caratterizzato la politica estera italiana e in questo quadro anche lo sviluppo delle
173320	178520	missioni internazionali all'est. Il finanziamento delle missioni verrà a gennaio, verrà all'anno
178520	183560	prossimo, vedremo in quale contesto si inserirà.
184840	193900	Ma io credo una cosa, io credo di, voglio sottolineare un punto, noi ci siamo trovati
193900	200300	in un contesto della politica internazionale molto particolare, siamo arrivati al governo
200300	211780	nel momento in cui forse più aspro era il conflitto fra mondo occidentale, mondo islamico,
213020	219720	sulla base di quella politica che la destra americana ha voluto, che è stata la politica
219720	227980	della guerra preventiva, dell'azione unilaterale che è culminata nella guerra in Iraq, e noi
227980	234240	ci siamo impegnati con un obiettivo, era quello che ci eravamo proposti nel corso della campagna
234240	241760	elettorale, cioè cambiare strade, cioè questa politica non funziona e se non funziona e
241780	251840	se noi vogliamo davvero sconfiggere il terrorismo, bisogna lavorare per una politica di pace
251840	256820	che non significa rinunciare all'uso della forza contro il terrorismo, perché è chiaro
257480	266200	che chi ti vuole uccidere è anche un nemico che tu come all'interno di un paese la polizia
266200	273500	ferma, combatte il criminale così internazionalmente, l'uso della forza è una componente non eliminabile
273500	278620	della lotta al terrorismo, però noi abbiamo detto che questa lotta la si vincerà innanzitutto
278620	286120	sul piano politico, culturale, e la si vincerà nel momento in cui la grande maggioranza del
286120	296180	mondo islamico comprenderà che il terrorismo fondamentalista è un loro nemico, non è
296180	301380	solo un paragone che può sembrare roso ma rende l'idea per noi che abbiamo vissuto
301380	307620	con l'esperienza, noi abbiamo sconfitto le Brigate Rosse quando abbiamo convinto gli
307620	316120	operai e i giovani che quelli erano i loro nemici e quando quindi abbiamo tolto l'acqua
316120	326160	in cui il terrorismo si muoveva e su vasta scala il problema è separare il mondo islamico
327420	334600	dal fanatismo di una minoranza che usa la violenza e che predica la guerra di religione
334600	341480	e la guerra di civiltà. Noi ci siamo ammossi con questo obiettivo, riportare in campo le
341480	348860	Nazioni Unite, che la politica americana avevano messo al bando, rimettere insieme all'Europa
348860	354600	che si era divisa di fronte alla guerra in Iraq tra un'Europa filoamericana che si era
355320	361360	codata alla guerra e un'Europa che si era opposta, tutte e due impotenti, vete, sia
361360	366840	chi è andato dietro gli americani non ha affrontato granché e anzi uno dopo l'altro
366840	374220	hanno dovuto lasciare il potere, compreso il nostro diciamo, ma anche chi si era opposto
374220	379900	gli americani non era riuscito a cambiare i corsi delle cose. Quindi noi ci siamo ammossi
379900	388140	con l'obiettivo, ripeto, voltare pagina, rilanciare l'idea di una grande coalizione
388140	394440	contro il terrorismo che sappia innanzitutto coinvolgere il mondo islamico e il mondo arabo,
394740	400520	rimettere in campo le Nazioni Unite, lavorare per l'unità dell'Europa e naturalmente
400520	408520	tutto questo non in chiave anti americana, perché in definitiva poi le cose cambiano
408520	413700	se in qualche modo anche gli americani cambiano strada, perché noi viviamo in un mondo nel
413700	419580	quale senza gli americani è difficile fare qualsiasi cosa, io dico che senza gli americani
419580	425260	non si può neanche porre rimedio agli errori che hanno fatto gli americani e siccome fortunatamente
425260	432100	gli Stati Uniti sono un grande paese democratico è innanzitutto lì che si è aperta una riflessione
432100	437980	critica sugli errori di questi anni, come dimostrano le elezioni americarane, come dimostra
437980	444980	il dibattito in corso e persino qualche cambiamento che è in corso già con l'amministrazione
446300	457580	Bush. Se uno pidi l'ultimo numero della rivista Time, c'è un straordinario servizio su come
457580	464860	venire via dall'Iraq, se vi dicesse io quelle cose immediatamente vi accoserebbero quindi
464860	470340	potrebbe essere un feroce anti-americano, io dico per scherzo io sono anti-americano
470340	476760	come il 70% degli americani e in questo modo la penso come la pensano il 70% degli americani.
477140	484700	Allora io credo che questa presenza dell'Italia, io non sarebbe sciocco dire che questa presenza
484700	493140	dell'Italia è stata risolutiva, tuttavia questa presenza dell'Italia è stata avvertita
493140	502780	da tutti come un elemento importante di novità. A cominciare dal Liban, quando l'Europa
502780	509860	è intervenuta unita e sotto le bandiere delle Nazioni Unite, non per fare la guerra preventiva
509860	518800	ma per fermare un conflitto e per cercare di introdurre in un'area che è attraversata
518800	526660	da drammatici conflitti almeno un elemento di stabilità e di contenimento. Allora io
526660	534620	credo che noi dobbiamo rivendicare i risultati di una politica, d'altro canto la politica
534620	540680	estera è fatta anche di cose che si possono enumerare, se noi siamo stati eletti in modo
541560	547600	plebiscitario membri del consiglio di sicurezza è perché ci viene riconosciuto un ruolo internazionale
547750	554370	di primo piano. Se l'Italia è stata eletta a membro del consiglio delle Nazioni Unite
554370	561550	per i diritti umani, candidatura che abbiamo persino esitato a presentare, perché all'indomane
561550	569250	del voto per il consiglio di sicurezza sembrava un eccesso e tuttavia abbiamo vinto, è perché
569250	575910	godiamo di un largo consenso internazionale, che è testimoniato dalla molteplicità di
575910	581630	Nazioni, Berlusconi aveva tagliato i ponti con mezzo mondo, non aveva messo piede in
581630	590730	Asia in 5 anni, non avevamo rapporti con America Latina, oggi noi siamo tornati ad essere interlocutori
590730	596530	dei grandi paesi emergenti. La politica estera ha a che fare non solo con la sicurezza,
596550	603950	anche con l'economia, dovete sapere che uno dei grandi problemi che l'umanità avrà
603950	609450	in fronte a sé nei prossimi anni è la questione energetica. Il Brasile è il principale produttore
609450	616930	al mondo di biocombustibili, cioè di benzina e diesel che si produce con i vegetali, una
616930	627450	fonte rinnovabile. Ebbene il governo del Brasile ha fatto due grandi accordi internazionali
627450	633890	per la produzione dei biocombustibili, uno con gli Stati Uniti d'America, e l'altro
633890	646970	di tutti i pretendenti europei ha scelto l'Italia per andare a produrre insieme in Africa i
646970	653210	biocombustibili e l'ENI diventerà il più grande produttore europeo di biocombustibili.
653210	658730	Ora con tutto il rispetto degli amministratori dell'ENI a proposito di rapporti tra economia
658730	667470	e politica, questa è politica, questa è una scelta che il Brasile fa nel nome di un
667470	677190	rapporto politico con questa Italia. Potrei aggiungere il fatto che l'Enel ha acquistato
677190	685570	l'indesa, anziché essere cacciati via, diventando in questo modo il secondo gruppo elettrico
685570	692530	d'Europa, il quinto del mondo e il principale produttore di energia elettrica in tutta l'America
692530	699690	Latina, e anche questo se Zapatero non avesse voluto o qualche dubbio che sarebbe accaduto.
699830	706890	Allora, la politica estriitaliana è lì, è fatta della leadership che ci viene riconosciuta
706890	713370	nel Libano, è fatta del riconoscimento che è stato dato al nostro Paese, rendendoci
713370	719630	uno dei membri del Consiglio di Sicurezza, è fatta delle mille opportunità economiche
719630	726570	che si sono aperte nel momento in cui abbiamo finito di guardare con paura e con ostilità
727190	732030	la globalizzazione economica, di dire che i cinesi mangiavano i bambini e invece siamo
732030	739030	andati a discutere con i grandi Paesi emergenti per lavorare insieme. Io credo che personalmente
740050	747070	per me, ti devo dire la verità, se non fossi costretto ogni tanto, paio di giorni alla
747070	755990	settimana, a ripassare dall'Italia, questo lavoro è talmente appassionante, è talmente
755990	762410	a volte drammatico, ma ti misuri con dei drammi veri, con certi nostri dibattiti, capito?
763670	770150	Ed è anche talmente pieno di opportunità per un Paese come il nostro che io davvero
770150	778290	sono grato a chi mi ha consentito di farlo, i risultati secondo me ci sono, certo sono
778290	785590	sfide difficili, certo lo sappiamo che quando i nostri soldati sono impegnati in missioni
785590	794230	di pace c'è un rischio, però noi dobbiamo sapere che noi viviamo in un mondo in cui
794230	804770	il rischio è globale e in definitiva in questo mondo si rischia anche se uno piglia un aereo
804770	811670	per andare a passare una settimana di vacanze in un luogo esotico, perché il terrorismo
811670	819710	non è una guerra lontana, è una minaccia incombente e allora di fronte a questa sfida
819710	824970	a mio giudizio non ci si può ritallare in casa propria, la si deve affrontare, certo
824970	830810	la si deve affrontare con la forza dell'intelligenza, io vorrei dire una cosa sui nostri militari,
830870	838110	io vengo da un mondo lontano se vuole da un mondo militare, ma io credo che tra le risorse
838110	845110	della politica estera italiana ci sia la straordinaria capacità dei nostri militari
846710	854970	di svolgere missioni di mantenimento della pace, perché oltre alla qualità militare
854970	868090	i nostri soldati ci mettono una dimensione umana che è assolutamente fondamentale, allora
869370	877950	come negli ospedali dei militari italiani mentre altri eserciti sono eserciti e fanno
877950	886750	paura alla gente dove si muove i nostri militari normalmente una buona parte del loro lavoro
886750	893310	è assistere alle persone, curare i bambini gratis, portare sostegno nel sud del Libano,
893310	898990	il Libano è un paese tormentato da mille problemi, da mille rischi, infiltrazioni
898990	904710	terroristiche, al-Qaeda, ma il rapporto che si è costruito tra le popolazioni del sud
904710	912390	del Libano, i nostri militari, è un rapporto straordinario, io ricorderò sempre quando
912390	922110	andando nel coso dove albanesi e serbi ortodossi e musulmani si erano ammazzati di uni con gli
922110	929670	altri fino al giorno prima, io andavo lì per un cambio parlo di qualche anno fa di
929670	937170	contingente italiano a salutare i nostri militari che andavano via, c'era una folla di ragazze,
937270	944270	di ragazzi, di preti ortodossi, di mamma, era una cosa impressionante, uno dei principali
944270	952090	fattori multi etnici era rappresentato dai nostri militari, Radio West che era la radio
952110	960530	dei nostri militari, è stata l'unica esperienza in coso di un organo di informazione dove
960530	968210	lavoravano fianco a fianco serbi e albanesi in un rapporto di collaborazione, e io devo
968210	972670	dire la verità che questo è qualcosa che mi fa sentire orgoglioso perché devo dire
972670	982090	che siamo un paese che ha la pace nel suo DNA e questa è la grande esperienza di un
982110	991010	grande risorsa del dettaglio e che ha una cultura della pace che è il frutto del fatto
991010	997870	che in questo paese la cultura cattolica per un verso, la cultura della sinistra per altro
997870	1004790	verso hanno messo nella testa della gente l'idea della convivenza, l'idea del fatto
1005310	1010970	che la vita è un grande valore che va difeso, l'idea della solidarietà verso gli altri
1012450	1018610	appartengono al senso comune degli italiani e neppure cinque anni di berlusconismo hanno
1018610	1022450	potuto sradicare, diciamo, questo sentimento degli italiani.
1026690	1032930	Andiamo ancora a qualche minuto, io vorrei prima di chiudere col Partito Democratico
1032930	1039470	fatti per una domanda che è un po' riassume le cose che abbiamo detto questa sera, indubbiamente
1039470	1046370	questo governo sta facendo delle cose importanti, abbiamo parlato prima dei provvedimenti sulla
1046370	1056550	previdenza ma ci sono tante altre cose, adesso hai illustrato i punti focali della nostra
1056550	1062470	politica estera, una politica estera importante, questo viene riconosciuto da tutti, come
1062710	1070530	mai allora il consenso di questo governo secondo i sondaggi è così basso e come
1070530	1075230	mai, questa è una domanda che ho sulla punta della lingua dall'inizio di questo nostro
1075230	1081150	incontro, la cosiddetta grande stampa è così ostile a questo governo?
1084450	1090150	La prima parte della domanda mi preoccupa di più, che la seconda non sempre coincide
1090450	1098650	con la prima, io credo che, parliamoci chiaro, fino all'inizio, un secondo punto, c'è stata
1098650	1107710	una ostilità, l'idea bisognava dimostrare che questa coalizione non era in grado di
1107710	1116290	governare il Paese e una delle ragioni per cui a un certo punto il fuoco dell'artiglieria
1116290	1124270	si è imbirizzato verso la mia persona, non è per una solita ragione che io sono un
1124270	1133970	bersaglio che fa gola, perché questa è una cosa antica, non è nuova, ma anche perché
1135510	1142210	dava enormemente fastidio che proprio la politica estera, che avrebbe dovuto essere il punto
1143730	1149950	più debole di questo governo, e che fin dall'inizio dissero ma è impossibile avere una politica
1149950	1155570	estera comune con la sinistra radicale, o sarete antiamericani e quindi finirete fuori
1155570	1161550	dalla NATO, chissà dove ci porterete, oppure se sarete filoamericani la maggioranza crollerà,
1161950	1169610	questa era la profezia, il fatto è che noi abbiamo ritirato soldati dall'Iraq, quindi
1169610	1177350	con un atto fortissimo siamo partiti, ma nello stesso tempo abbiamo stabilito un rapporto
1177350	1185710	di collaborazione con gli americani, quindi io li conosco, si mangiavano i comiti dall'Arabia,
1185850	1190250	perché noi la conferenza sul Libano l'abbiamo fatta a Roma grazie al sostegno del Dipartimento
1190250	1196650	di Stato, se no non avremmo mai potuto fare, quindi l'opposizione, la destra, una parte
1196650	1204070	della grande stampa, ha vissuto una grande frustrazione, per il fatto che siamo riusciti
1204070	1209110	a fare una politica estera che si portava dietro il centrosinistra e che non solo non
1209110	1214450	ci ha isolato nel mondo occidentale, ma per molti aspetti ci ha reso più autorevole,
1214730	1220610	perché? Perché gli americani che stavano in mezzo a un mucchio di guai hanno capito
1220610	1225270	che tutto sommato avere come interlocutore un governo come il nostro, che rispetto a
1225270	1231790	Lusconi, aveva più ascolti in Europa ed era anche capace di dialogare col Brasile, col
1231790	1238170	mondo arabo, con la Cina, poteva essere utile anche agli americani. Quindi io direi che
1238170	1245370	da questo punto di vista, noi siamo riusciti a rovesciare un pronostico e a creare una
1245370	1251550	grande irritazione, dietro a quell'irritazione c'è anche un disegno politico, che via via
1251550	1257510	si è affacciato, e cioè di uscire dalla logica del bipolarismo, di spingere l'Italia
1257510	1264370	verso una stagione neocentrista, c'è questo disegno politico. È vero, quando un so
1264370	1269710	giordano di Liberto lo denunciano, secondo me non denunciano un pericolo sbagliato,
1269950	1278690	mi domando però perché essi facciano di tutto per favorirlo, ma questo è un altro
1278690	1286010	problema, appartiene a quel rischio di auto lesionismo che a volte si manifesta. Invece
1286010	1291730	il più serio è il problema del rapporto con l'opinione politica. A mio giudizio qui hanno
1291730	1308670	pesato, innanzitutto ha pesato, quella vera e proprio urto tra Paese e Governo che è
1308670	1314970	l'opinione politica. Negli anni del centrodestra c'era stata una compressione di tantissime
1315750	1323350	esigenze, di esigenze popolari come dei comuni per esempio, e l'avvento di un governo di
1323350	1330530	centrosinistra era atteso dal Paese come un allentamento di questa pressione. Invece noi
1330530	1336070	ci siamo trovati, al di là di quello che ci aspettavamo, di fronte ad una situazione
1336070	1344270	finanziaria drammatica, e abbiamo deciso, direi persino oltre il segno, perché altrimenti
1344270	1355150	poi dopo non avremmo trovato quelle risorse in più, abbiamo deciso di partire con una
1355150	1364950	stretta. Il Paese non lo ha capito e io credo che qui ci sia stata anche una nostra responsabilità
1364950	1371310	che quando un governo non si fa capire l'opinione pubblica, evidentemente anche perché, diciamo,
1371570	1379190	sbaglia nel modo in cui si pone nei confronti del Paese. A questo poi si è aggiunto la
1379190	1387170	questione disastrosa di cui ho parlato prima, cioè questo tasso di litigiosità, di chiacchiericcio,
1387990	1396030	tu dici una cosa, allora io subito non dico un'altra, che io lo capisco anche che noi
1396030	1404310	dobbiamo dimostrare che siamo una coalizione democratica, però ho l'impressione che la
1404310	1408930	gente lo sapesse già, che vuole capire se noi siamo in grado di governare insieme il
1408930	1413510	Paese, perché se gli diciamo soltanto che siamo democratici c'è l'impressione che
1413510	1420470	questo non basta più, diciamo, a sedurre l'opinione pubblica. Quindi in questo c'è
1420470	1429750	una dose di... c'è un sistema politico schizofrenico, perché noi abbiamo un sistema politico nel
1429750	1435810	quale i partiti sono indotti ad unirsi per vincere le elezioni, ma siccome continua
1435810	1443670	ad essere dominante la logica del proporzionale e quindi ogni partito, ogni partitino deve
1443670	1451830	sopravvivere, diciamo, alla coalizione, il giorno dopo delle elezioni tutti quanti cominciano
1451830	1459350	a mettersi in mostra in una infinita competizione, senza capire che in questo modo si logra quando
1459350	1462710	la fiducia dei cittadini verso il sistema politico.
1462810	1468490	Guardate, questo è un male generale della politica italiana, perché adesso noi parliamo
1468490	1473770	delle divisioni del centro-sinistra, ma le divisioni che sono incorso nel centrodesto
1474350	1482350	non sono meno nevastante, fra mai il conflitto è aperto, tra casini, perbusconi, perbusconi,
1484050	1490110	fini, però devo dire la verità che questa è una magra consolazione.
1492010	1499410	Io avverto piuttosto la preoccupazione di chi pensa, e questa è la mia convinzione,
1500230	1507750	che se impazzisce la maggioriese della democrazia è un male per tutti, perché il rischio che
1507750	1514230	alla fine i cittadini si allontanino dalle istituzioni democratiche e che torni a prendere
1514230	1520470	di gove l'anticolitica, il qualunquismo più becero, il rifiuto di tutto e di tutti,
1520950	1527230	e questi sono sentimenti che in generale favoriscono sempre e soltanto la destra.
1527350	1533690	Questo dice l'esperienza storica e io su questo non ho dubbio.
1534690	1543930	Allora noi dobbiamo cercare di reagire a questi rischi, il Partito Democratico è una risposta,
1545830	1553810	forse da sola insufficiente, perché deve accompagnarsi anche a coraggiose riforme delle istituzioni
1553810	1561250	e della legge elettorale, però il Partito Democratico è una risposta, perché va nel
1562070	1569250	senso della coesione e non della frammentazione, perché va nel senso dell'apertura democratica
1570270	1577970	e non della chiusura corporativa del ceto politico, perché va nel senso del futuro
1577970	1586470	e non della memoria del passato. Io credo che questa sia in questo momento la più grande
1586470	1593730	speranza che c'è nella politica italiana, io dico sempre non guastiamola, perché è
1593730	1600470	la risorsa su cui contare per restituire slancio e credibilità alla politica democratica.
1614630	1621070	Quando si è al 10%, un paese si cambia con un grande partito e io credo da questo punto
1621070	1627470	di vista che da una regione come la nostra, che ha saputo in questi anni scommettere anche
1627470	1633470	il suo rinnovamento, deve avvenire uno sforzo di generosità e se noi andremo in tantissimi
1634050	1640210	a votare per le primarie del 14 ottobre, il giorno dopo sarà più forte il governo e
1640210	1645030	sarà più forte soprattutto la democrazia e la politica di questo paese, che per me
1645030	1650890	è una cosa fondamentale e permettetemi di dirlo, si fa in queste settimane...
1651890	1664370	ma è non solo DDS come candidato alla segreteria già numero uno, i sondaggi sul Partito Democratico
1664370	1671890	hanno mostrato subito un'impennata che parlava addirittura di un 35% e io vorrei chiedere
1672230	1680390	in maniera conclusiva a Massimo Delema questo, sulla base della sua politico di lungo corso,
1680790	1689190	sulla base della tua esperienza, è un'esperienza però che si ferma a fatti nuovi, c'è una
1689190	1695150	novità enorme della politica italiana e quindi tutta da vedere, secondo te quale deve essere
1695150	1704830	il percorso migliore, da adesso a prossimi mesi, per far sì che questo consenso, finora
1704830	1711410	indicato dai sondaggi, diventi reale e che il Partito Democratico diventi effettivamente
1711410	1714990	il centro, il cuore della politica italiana?
1718490	1727150	Ma guarda, io qualche cosa dirò, qualche cosa no, perché è anche giusto lasciare un po'
1727250	1744970	che si dipane, innanzitutto penso che la scelta che ha fatto Veltrone di candidarsi non c'è
1745970	1762050	è stata una scelta generosa e coraggiosa, in fondo Walter poteva aspettare che il flutto,
1762190	1771590	come dice il poeta, depositasse le armi di Achille sulla sua spiaggia, perché in fondo
1771590	1777970	la difficoltà del governo, il fatto di tenersi fuori alla mischia, in qualche modo gli conferivano
1777970	1790590	un vantaggio di posizione. Ha scelto di rischiare oggi e io credo che questo sia stato percepito
1791290	1796730	dal Paese, innanzitutto dalla nostra gente, come una scelta coraggiosa, una scelta generosa
1796730	1804750	e anche per questo secondo me c'è stata un'impernata di consenso e la gente ha capito
1804750	1813750	che questa idea del Partito Democratico è una cosa nuova, è una cosa importante ed è un progetto
1813750	1825510	non per il futuro, ma che parte da oggi. Io ritengo che noi partiamo dall'esperienza dell'Ulivo,
1825510	1833310	l'Ulivo ha avuto il 31,5% dei voti, per cui il 35% non è poi una meta così noviutale.
1833570	1842950	Lasciamo stare ad ondeggiare dei sondaggi, l'Ulivo è già oggi la principale forza del Paese
1843510	1851330	e se la Costituente del Partito Democratico assumerà quelle forme a cui faceva riferimento
1851330	1858550	ma anche con i contenuti, perché io credo che ovviamente c'è anche un grande sforzo
1858550	1869290	di cultura politica, di elaborazione, di proposta, di analisi del futuro, che al mio giudizio
1869290	1875330	deve anche collocare il Partito Democratico nel quadro di un mondo che cambia, ma non nel senso
1875330	1884930	banale di aderire a questo. Ci sono anche questi aspetti, ma nel senso che oggi il campo
1884930	1893470	delle forze progressiste è attraversato in tutto il mondo da un grande processo di ripensamento
1893470	1901690	dell'esperienza del passato e della ricerca del futuro e l'esperimento del Partito Democratico
