start	end	text
0	21240	Abbiamo chiesto Massimo D'Alema, deputato europeo iscritto al gruppo del PSE, presidente dei Democratici Sinistra, cosa pensa del programma della Presidenza britannica in materia di lotta al terrorismo presentato dopo gli attentati del 7 luglio scorso a Londra in questa sessione del Parlamento europeo.
24100	47020	Abbiamo avuto una lunga e appassionata discussione nel gruppo socialista, è ovvio che la sinistra e i socialisti sono in prima fila nella lotta contro il terrorismo, non è questo il problema, ma che proponiamo una linea morbida contro il terrorismo, giusto, sosteniamo una linea di grande fermezza contro il terrorismo.
49400	76020	Nello stesso tempo riteniamo che nell'esame delle misure concrete si possano trovare delle soluzioni efficaci e rispettose dei principali diritti dei cittadini, l'abbiamo detto con molta chiarezza anche nel dibattito, quindi non è un tema di discussione generale, bisogna esaminare concretamente le misure che vengono proposte.
77400	105360	Perché siamo persuasi che se si tratta di difendere la democrazia, i nostri valori, adottare dei mezzi che negano questi valori sarebbe un cedimento al terrorismo, sarebbe una vittoria del terrorismo se noi nel combattere il terrorismo dovessimo rinegare i valori democratici nel nome dei quali combattiamo il terrorismo, quindi non è un gioco di parole.
105360	122100	Quindi vedremo, esaminiamo le misure concrete e giudichiamo della loro efficacia e anche della loro compatibilità con quel quadro di diritti fondamentali che l'Unione Europea garantisce.
124060	149020	Poi naturalmente si tratta anche di capire, al di là delle misure di contrasto che pure sono necessarie del coordinamento delle forze di polizia, dell'intelligence, tutte cose che sono molto importanti, se c'è anche una strategia politica, culturale, dato che siamo di fronte a un terrorismo la cui natura è del tutto peculiare.
149020	174020	Questo terrorismo affonda le sue radici nel fondamentalismo islamico, quindi non è un gruppetto terroristico, è una grande sfida che ha una dimensione politica, culturale, religiosa che non può essere trascurata perché se tutto si riduce alle misure di polizia temo che soprattutto questa lotta si riveli inefficace dal punto di vista dei risultati.
175400	187100	Sulle misure, perché una serie di misure sono state presentate a livello europeo, per esempio la data retention generalizzata, a livello inglese, l'aumento della carcerazione preventiva con tempi lunghissimi.
187100	207300	Non voglio giudicare l'ordinamento britannico, su questa questione europea si sta discutendo in commissione, noi abbiamo preso posizione in commissione che si occupa degli affari giuridici, abbiamo anche proposto delle nostre perplessità, c'è una discussione concreta, ci sono gli atti, ci sono quelli che hanno preso posizione, basta andarseli a vedere.
224300	237140	Sulle misure sono state presentate a livello europeo, per esempio la data retention generalizzata, a livello inglese, l'aumento della carcerazione preventiva con tempi lunghissimi.
