start	end	text
0	7780	italiane se questa vicenda della revisione costituzionale degli
7780	18040	aggiustamenti della costituzione francese del 58 ci dice qualcosa, ci insegna
18040	29980	qualcosa, ci indica una traccia oppure in negativo ci dice quello che non
29980	36260	dovremmo fare, noi stiamo attraversando una fase che oramai secondo me
36260	39760	impropriamente viene detta di transizione perché le transizioni non
39760	49700	durano tanto tempo, non durano 15 anni, dobbiamo ancora riformare la parte della
49700	55980	costituzione della forma di governo, mi consentite di ricordare,
55980	61420	io sono stato accanto al presidente de Alema come segretario della
61420	67420	commissione bicamerale e in precedenza dello stato anche segretario della
67420	77260	commissione bicamerale dei mitagliotti, è una sorta di masso di sisifo che è una
77260	82260	fatica di sisifo, questo masso che viene portato sempre in cima alla montagna e
82260	88200	ricade e ricade continuamente, questa volta si è detto sarà una legislatura
88200	96500	costituente, sentiamo, i francesi hanno fatto in poco tempo quello che noi
96500	103380	cerchiamo di fare da da 30 anni, io non devo aggiungere altro, do quindi
103380	107940	immediatamente la parola al presidente de Alema,
108860	116300	vi ringrazio, risponderò ai quesiti relativi diciamo all'interesse per
116300	122460	l'Italia, anche se non nascondo che mi è spiaciuto non seguire i lavori di un
122460	131240	convegno che considero interessante anche per capire l'evoluzione in Francia dove
131240	141200	indubbiamente il modello della quinta repubblica appare oramai oggetto di
141200	149160	revisioni in parte di aggiustamenti e sicuramente di una evoluzione rispetto
149160	159720	al peculiare esperienza semipresidenziale e credo tutto sommato che
159720	165720	anche nel sistema francese si sia avvertito il bisogno di un equilibrio
165720	171500	maggiore tra assemblee elettive, il ruolo del parlamento, potere del
171500	177720	presidente tanto più che i potere del presidente tendono a scivolare verso un
177720	183540	modello americano diciamo di un presidente di fatto capo di governo al
183540	191380	meno quando, come avviene più normalmente nel sistema francese, egli è anche di
191380	199340	fatto il capo della maggioranza parlamentare ma penso anche che
199340	205320	l'esperienza francese consigli dal punto di vista delle regole elettorali un
205320	213520	sistema che pure favorendo la formazione di una maggioranza coesa non porti alla
214540	222660	drastica esclusione dal parlamento di forze rappresentative e in questo senso
222660	228480	da tempo in atto una grazie, molto grazie, considero diciamo un favore tra colleghi
228480	233440	più che un momento del rapporto tra governo e opposizione diciamo comunque va
233440	243040	bene va bene lo stesso diciamo e credo che come noto anche sotto questo profilo
243040	249340	in Francia in atto un certo dibattito cerca la possibilità di attenuare l'effetto
249340	254700	non l'effetto maggioritario ma l'effetto drastico di esclusione di quella legge
254700	259720	elettorale le cui virtù naturalmente io non voglio sottacere fra l'altro non è
260540	265480	mistero che verso quel modello si inclinano le preferenze non solo mie
265480	269680	personali ma anche la preferenza politica del partito cui appartenco
269680	276820	però adesso al di là di una riflessione che comunque è utile anche per capire
276820	282260	come poi certi modelli istituzionali elettorali modelli costituzionali sono
282260	288880	comunque oggetto dell'usura del tempo necessitano di un lavoro di
288880	293520	manutenzione di uno sforzo di mantenimento di un equilibrio di poteri
293520	300420	diciamo che è comunque una necessità del costituzionalismo almeno nell'esperienza
300420	308040	europea io non mi sottragguo al tema diciamo noi abbiamo avuto un'evoluzione
308820	317800	assai più affaticata complessa meno ordinata nella vicenda italiana della
318400	330420	seconda repubblica io devo dire francamente che considero abbastanza
330420	334820	preoccupante il modo in cui è venuto assestandosi il sistema politico
334820	341720	istituzionale del nostro paese non penso allo stato dei fatti diciamo che una
341720	347780	rivoluzione costituzionale nel segno del semipresidenzialismo sia attuabile
347780	358000	e neppure oramai auspicabile nel contesto italiano una finestra di
358000	366800	opportunità indubbiamente vi era stata con la bicamerale naturalmente il
366800	373640	risultato della bicamerale fu abbastanza casuale nel senso che lezione popolare
373640	380260	del presidente della repubblica scaturì da una vicenda politica formarsi di una
380260	389020	maggioranza abbastanza casuale tuttavia noi decidemmo intorno a quel voto di
389020	393640	cercare di costruire una soluzione che fosse sostenibile per il nostro paese
394220	399280	forse più simili ad un modello di elezione popolare diretta del capo dello
400640	407320	finlandio in austria che non ad un vero e proprio modello francese e tuttavia
407840	414140	nella consapevolezza del grande valore simbolico istituzionale che avrebbe
414140	419200	avuto per il nostro paese una elezione popolare diretta del capo dello stato
421100	427100	la figura del capo dello stato è nel nostro paese una figura forte e lo è
427100	433500	particolarmente nella esperienza tormentata della seconda repubblica di
433500	438180	fronte alle fragilità politiche istituzionali del sistema che è
438180	445000	scaturito dai cambiamenti degli anni 90 il presidente della repubblica è venuto
445000	449560	assumendo nelle diverse esperienze un ruolo molto forte di garanzia
449560	455940	istituzionale e di rappresentanza dello stato democratico nel rapporto con
455940	463900	l'opinione pubblica con i cittadini ora è evidente che sia pure senza dotare un
463900	469900	capo del capo dello stato di poteri ulteriori e di governo la elezione
469900	474080	popolare diretta di un presidente della repubblica che comunque è una figura
474080	479280	istituzionale molto forte nel nostro sistema ne accrescerebbe la
481440	490600	forza persino con un rischio di conflitto oggettivo diciamo con il governo e il
490600	497640	capo del governo ora un sistema di questo tipo indubbiamente rischia di
497640	504560	compromettere la funzione di garanzia del presidente della repubblica tanto più
505040	510080	in un bipolarismo come il nostro caratterizzato da una contraposizione
511080	515220	che rimane così aspra e
517220	524200	venata di aspetti di carattere ideologico direi che in qualche modo il
524200	529540	fallimento della bicamerale è testimonianza della impossibilità di
529540	533920	andare verso questo modello non soltanto perché di fatto lo ha fatto
533920	539620	decadere diciamo ma anche perché ha dimostrato la mancanza di quel clima
539620	546640	costituente di quel di quel clima di comune riconoscimento nei valori
546640	550620	repubblicani diciamo che consentirebbe un'elezione popolare diretta di un
550620	555000	presidente della repubblica senza produrre una laceratione del sistema
555000	563700	politico istituzionale io non credo che l'italia sia in
564480	569260	d'altro canto una riforma il cuore del sistema francese sistema elettorale a
569260	575020	doppio turno che conferisce non soltanto al presidente della repubblica la
575020	582560	legittimazione di un voto a maggioranza dei cittadini ma che nella similitudine
582560	586720	sia pure con delle differenze che sono note tra sistema elettorale presidenziale
586720	592920	sistema elettorale per il parlamento favorisce quel naturale formarsi di una
592920	600220	maggioranza parlamentare presidenziale che il modo naturale di funzionamento del
600220	606600	sistema naturalmente è un sistema che ammette l'eccezione e l'ha conosciuta ma
606600	613460	ha una sua logica naturale ora è noto in italia che il sistema doppio turno
613460	618000	incontra una resistenza pressoché insormontabile nelle posizioni del
618000	624080	destra che lo ha sempre considerato un sistema elettorale non praticabile
625620	629600	io non credo dunque che l'esperienza francese in questo momento possa
629600	636080	rappresentare per noi un punto di riferimento ripeto era un'altra
636080	642440	stagione quella della bicamerale direi era un momento in cui l'esperienza
642440	646240	della seconda repubblica era un'esperienza più fresca e si poteva
646240	651760	sperare che evolvesse verso un quadro di legittimazione reciproca e di
651760	657240	bipolarismo di tipo europeo ci si provo anche diciamo devo dire
657240	663640	sinceramente che tuttavia questo non è stato possibile e mi pare molto
663640	669320	difficile oggi nel frattempo parliamo oramai di più di dieci anni fa è
669320	674640	radicalmente mutato lo scenario e direi che anche dal punto di vista politico
674640	680640	istituzionale sono altri i problemi che il paese ha di fronte a sé sono altre
680640	687600	le esigenze prioritarie a cui a mio giudizio si deve dare una risposta e
689520	695700	l'evoluzione del sistema istituzionale nel nostro paese è andata nel senso di
695700	704560	una sorta di presidenzialismo de facto perché sostanzialmente attraverso
704560	710980	le modificazioni della legge elettorale si è determinato un sistema nel quale i
710980	718040	cittadini sono persuasi di eleggere il capo del governo cosa che in realtà non
718040	723640	avviene dal punto di vista legale e costituzionale
724300	728760	questo avviene nel quadro a costituzione immutata diciamo si è determinato
728760	736700	questa sorta di presidenzialismo di fatto il che a mio giudizio ha innescato
736700	741600	una situazione piuttosto pericolosa dal punto di vista del funzionamento della
744960	752280	democrazia in cui diciamo il il capo del governo che viene designato in quanto
752280	759300	se ne scrive il nome sulla scheda che è piuttosto strano diciamo sistemi
759300	763360	politici democratici perché si scrive sulla scheda il nome di una persona che
763360	770540	però tecnicamente non viene eletto si determina quindi una sorta di forzatura
770540	775860	dal basso dei poteri costituzionari del capo dello stato una sorta di
775860	780360	investitura popolare di un primo ministro che però formalmente è scelto
780360	784880	al presidente della repubblica e trova la sua legittimazione nella fiducia
785820	788740	parlamentare questo avviene anche in altri sistemi ma
788740	791680	viene con un alto grado di informalità
793620	799280	è vero che di fatto anche in altri sistemi il leader del maggior partito
799280	806980	diciamo è designato ad essere capo di governo ma parte il fatto che da noi non
806980	812520	è stato così perché diciamo più che avere un bipartitismo abbiamo avuto una
812520	820180	sorta di biliderismo fondato su coalizioni variopinte e in qualche modo
820180	826080	non mi pare che siamo ancora del tutto usciti da questa situazione ma questo
826080	830600	presidenzialismo di fatto cioè questo sovrapporsi di una legittimazione
830600	836240	popolare informale ad un impianto costituzionale invariato a mio giudizio
837320	848120	ha creato una situazione abbastanza confusa nella quale poi con l'ultima
848920	859280	legge elettorale la dipendenza del parlamento dal capo eletto non eletto
859280	866700	dai cittadini è diventata fortissima anche per il carattere anonimo e quasi
866700	874420	dinomina che ha assunto l'elezione dei parlamentari della repubblica che sono
874420	878560	delle liste anonime in cui il cittadino non sa bene per chi vota non sa bene se
878560	884200	col suo voto scatterà l'undicesimo e il dodicesimo di queste liste di
884200	887120	parlamentari sostanzialmente designati
889280	895480	io ritengo questa situazione una situazione francamente abbastanza
895480	901240	originale per un grande paese democratico c'è molto di simile diciamo e una
901240	908560	situazione dalla quale si dovrebbe uscire innanzitutto con riforme che
908560	914480	favoriscano il ricostituirsi di quei fondamentali mediatori nel
914480	919120	funzionamento della democrazia che sono i partiti politici che aiutino un
919120	924000	processo di riorganizzazione del sistema politico italiano favorendo una
924000	934680	semplificazione rispetto all'estrema frammentazione e ricostituendo le basi di
934680	942000	un sistema di tipo parlamentare sia pure profondamente rinnovato in un diverso e
942000	948040	più avanzato equilibrio nei rapporti tra governo e parlamento partiti più
948040	954580	un governo più forte in un rapporto equilibrato con un parlamento che
954580	959460	ritrovi pienamente la sua legittimazione in una legge elettorale che restituisca
959460	963700	ai cittadini il potere di scegliere i propri rappresentanti
965980	971780	devo dire sinceramente che questa mi pare la linea evolutiva più ragionevole al
971780	979060	punto in cui sono arrivate le cose anche per questo penso che le proposte
979060	984020	intorno a cui nel corso della passata legislatura si era così concentrata
984020	989980	l'attenzione del parlamento penso la cosiddetta bozza violante che tutto
989980	996700	sommato si ispira notevolmente ad un sistema di tipo neoparlamentare di tipo
996700	1003000	tedesco a mio giudizio vanno nella direzione giusta e credo che sarebbe
1003000	1006180	ragionevole completare una riforma di questo tipo con una legge elettorale
1006740	1015360	coerente diciamo che è grossomodo la legge tedesca che consente quella
1015360	1024500	razionalizzazione del quadro politico che ragionevolmente diciamo consolida
1024500	1028700	grossomodo la situazione dal punto di vista del quadro politico che si è
1029620	1034900	determinata all'indomani delle ultime elezioni non per forza di una riforma
1035420	1039420	ma per la forza di scelte politiche che sono state compiute dei maggiori partiti
1040060	1044120	e che sono andati nel senso di una razionalizzazione
1044120	1049940	io credo che questa razionalizzazione andrebbe consolidata e credo che
1049940	1055520	l'evoluzione oggi del sistema democratico italiano dovrebbe portarci ad
1055520	1061900	una intesa del tipo di quella ripeto che si è delineata nel corso della
1061900	1067020	precedente legislatura rafforzata da una riforma della legge elettorale nel senso
1067020	1071880	di una legge di tipo tedesco io penso che non so se sia possibile
1071880	1076160	onestamente che io parlo veramente non ho responsabilità politiche che mi
1076160	1081420	consentano di valutare se è possibile muovere verso si è parlato di una
1081420	1085540	legislatura costituente però non enfatizzerei perché lo si dice da parecchie
1085540	1090380	volte non succede praticamente mai quindi diciamo sì lo si dice quasi
1090380	1093860	all'inizio di una legislatura quindi sarei molto prudente nel valutare le
1093860	1099720	condizioni politiche di un'effettiva fase costituente che mi sembra
1100820	1108320	abbastanza problematica certo il fatto che si vada avanti giusto diciamo
1108320	1114480	nella attuazione delle norme costituzionali in materia di federalismo
1114480	1119980	comunque di riforma del titolo quinto consiglierebbe di riprendere una
1119980	1124720	riflessione sul funzionamento del governo del parlamento anche perché una
1125120	1133120	di questo tipo consentirebbe di uscire da quel bicameralismo perfetto che in
1133120	1140500	realtà appesantisce molto la democrazia parlamentare non rafforza l'autorità
1140500	1145080	del parlamento senza ovviamente in alcun modo prefigurare orientamenti
1145080	1149380	parlamentari è ovvio che uno può discutere se c'è la lista bloccata in
1149380	1154240	una di queste elezioni o no ma è molto grave se non c'è più la lista se c'è la
1154240	1158460	preferenza di nessuna parte tranne magari dei piccoli comuni occorre
1158460	1162240	capire siamo parlati in un sistema nel quale la democrazia si esprime ancora in
1162240	1166760	parte dal territorio verso il centro o no se si esprime in questo modo occorre
1166760	1170420	che queste cose siano fatte capire questo è il problema che rende la
1171340	1175160	costituente in atto la decisione della costituzione diceva da prima prima il
1175160	1179680	pessimista io ritengo non so se condividere il pessimismo capisco che è
1179680	1183500	molto complicato ma occorre capire che ogni volta che abbiamo messo le mani a
1183500	1187780	questo argomento abbiamo avevamo un problema imminente che in questo
1187780	1191960	momento sembrano esserci sembrano esserci perché il giorno che ci sarà
1191960	1196060	tra un anno quello del federalismo fiscale nei contenuti con le cifre si
1196060	1199620	porrà il problema del tipo di governo nazionale e allora probabilmente si
1199620	1203340	cambierà che la maggioranza di governo da sola se vuol fare lo può fare l'ha
1203340	1206520	fatto un'altra legislatura ma se lo vuol fare d'intesa con gli altri dovrà
1207420	1211020	discutere dello spazio del tempo e termini diversi da come immaginava
1211020	1213480	nell'ultima elezione della prima e scorsa
1219060	1227500	io penso che forse possiamo chiedere agli ospiti un altro breve giro di
1227500	1235620	replica sugli argomenti che sono quindi il presidente d'alema non c'è molto da
1236060	1242800	mi pare che sono emerse delle impressionanti dissonanze dal punto
1242800	1248680	di vista dell'analisi forse sulle proposte insomma io vorrei dire al
1248680	1255040	ministro Vito insomma che l'idea che in definitiva la legislatura costituente
1255040	1261600	come appunto un po' solennemente è stata annunciata si riduca alla
1261600	1267120	modifica dei regolamenti parlamentari per rafforzare i poteri del governo nel
1267120	1276080	determinare l'agenda del parlamento a me sembra ma il federalismo fiscale sono
1276080	1281300	norme attuative di una riforma costituzionale che è stata fatta ma io
1281300	1285960	vorrei dire che parte del fatto che vedremo le norme attuative si
1285960	1291380	svilupperanno attraverso l'esercizio della delega da parte del governo
1291380	1297880	ma vorrei dire che quanto più il cambiamento sarà effettivamente radicale
1297880	1304860	noi non lo sappiamo perché la delega è un documento abbastanza vago e
1306700	1312080	effettivamente diciamo si apre a determinazioni che possono avere un
1312080	1315940	grado diverso di radicalità se per esempio teoricamente la delega non
1315940	1323380	dice che il governo affidi alle regioni il compito di decidere su imposte
1323380	1330580	fondamentali ma quanto più io ritengo che non sarebbe saggio perché questo
1330580	1335080	tipo di federalismo fiscale non esiste da nessuna parte ma quanto più sarà
1335080	1341580	radicale quel cambiamento tanto più a mio giudizio noi saremmo chiamati a
1341960	1348400	pensare il funzionamento delle istituzioni dello stato nazionale in
1348400	1354040	relazione al potenziamento del sistema dei poteri decentrati regionali e locali
1354760	1361380	insomma a me sembra che se la legislatura costituente debba ridursi a
1361380	1367480	potenziare i poteri del governo e del capo del governo non ci sarà o quantomeno
1367480	1371660	ci sarà in un clima di aspra contrapposizione tra il governo e
1371660	1378900	opposizione se invece questa esigenza che pure è reale di un governo che si è
1378900	1383900	messo nelle condizioni di gli abbi gli strumenti per realizzare il suo
1383900	1388520	programma anche se io vi tengo abbastanza propagandistica l'idea
1388520	1392580	suggerita anche l'altra sera in un'intervista secondo cui il presidente
1392580	1397060	del consiglio non ha poteri in italia insomma onestamente non è vero
1397060	1402180	essendo mi trovato a ricoprire quel ruolo ritengo questa versione una
1403820	1409640	versione non rispondente alla realtà dei fatti e quasi di natura
1410620	1414500	autogiustificatoria diciamo la maggiore difficoltà all'esercizio dei poteri del
1414500	1421380	capo del governo è spesso in maggioranze frammentarie e precarie ma non è
1421380	1428800	che non ha questo problema perché gode di una maggioranza ampia e largamente
1428800	1434180	coesa intorno alla sua persona vi assicuro dispone di poteri assai forti
1434180	1439500	anche a costituzione invariata diciamo parlo come testimone in questo caso
1439500	1443500	quindi non è vero questo ma al di là di queste esagerazioni
1444060	1449060	io ritengo che c'è bisogno di rafforzare i poteri del governo penso che il capo
1449060	1453620	il governo debba essere messo nelle condizioni di scegliere ed eventualmente
1453620	1461020	di sostituire i ministri potere che gli ha di fatto oggi ma insomma ma non di
1461020	1465020	diritto tuttavia non credo che una riforma di
1465020	1472160	questo tipo la si possa fare se non si mette mano più complessivamente a
1472160	1476960	qualcosa di più che sia che non lo statuto delle opposizioni ma ad una
1476960	1483000	riforma del parlamento che attraverso il superamento del bicameralismo perfetto
1483000	1488000	la riduzione del numero dei parlamentari contribuisca anche a rafforzare una
1488000	1497360	centralità politica del parlamento e a bilanciare i poteri accresciuti del
1497360	1505520	governo con un parlamento più forte non nel senso ostativo alla realizzazione
1505520	1509760	del programma di governo ma che disponga di più efficaci strumenti di controllo
1509760	1515720	di indirizzo effettivamente efficaci rispetto a quelli di cui oggi dispone
1515720	1522180	aggiungo che una riforma di questo tipo implica una riforma della legge
1522180	1530100	elettorale che a mio giudizio non può venire prima o essere sostitutiva perché
1530100	1534940	noi abbiamo compiuto l'errore nel passato di considerare la legge elettorale come
1534940	1540960	sostitutiva di una riforma costituzionale e di un riassetto delle istituzioni con
1540960	1545840	l'effetto di trovarci con una legge elettorale che ci consente di eleggere un
1545840	1549880	capo del governo senza che a questo corrisponda un sistema di regole formali
1549880	1556020	cosa che secondo me ripeto costituisce il fondamento di un presidenzialismo di
1556020	1560820	fatto piuttosto anomalo dal punto di vista democratico e incerto nel suo
1561700	1568020	ma detto questo che non penso che la legge elettorale sostituisca una
1568020	1573720	necessaria riforma costituzionale io dico che se la riforma costituzionale si
1573720	1580260	deve fare cosa che riterei auspicabile pure diciamo non pronunciandomi sulle
1580900	1586300	condizioni politiche beh allora si deve fare una riforma costituzionale che
1586300	1590600	tocchi diversi aspetti della forma di governo che comporti una
1590600	1595920	semplificazione insieme un rafforzamento del sistema parlamentare che ci dia un
1595920	1601300	sistema parlamentare che sia compatibile con una articolazione federale dello
1601300	1604360	stato l'idea che ce l'accaviamo soltanto
1604360	1611080	rafforzando i poteri del premier davvero questa non mi sembra realistica perché
1611080	1617800	non è sufficiente e squilibrante e in questi termini aprirebbe un inutile
1617800	1623840	conflitto io credo a proposito di equilibrio costituzionale credo che al
1623840	1629520	di là delle regole scritte insomma l'esperienza ci dice che le riforme
1629520	1636360	durature sono le riforme condivise perché altrimenti diciamo in qualche
1636360	1644180	modo vengono svuotate o contrastate insomma solo le riforme condivise sono
1644180	1648640	fondative di una nuova stagione della storia della repubblica diciamo
1648640	1655440	soprattutto quando sono riforme che non constano di mutamenti marginali che sono
1655440	1660400	sempre possibili della carta costituzionale ma che hanno un'ampiezza
1660400	1664600	tale da coinvolgere le istituzioni fondamentali dello stato
1664600	1671540	io personalmente non ero favorevole alla e lo dissi allora alla decisione del
1671540	1675140	centro sinistra di andare all'approvazione della riforma del titolo
1675140	1682540	quinto con una esigua maggioranza in chiusura di legislatura tuttavia
1682540	1689080	tuttavia ricordo come giustamente ha ricordato Donofrio che quel testo che il
1689080	1693520	centro sinistra approvò con un'esigua maggioranza era pure nella sua
1693780	1701340	sostanza il frutto di un lungo lavoro comune e non fu improvvisato dal centro
1701340	1707200	sinistra era il frutto di un lungo lavoro comune e condiviso che eravamo
1707200	1708020	fatto nella beccata
