start	end	text
2011700	2029700	Lo dico perché, purtroppo, naturalmente, nell'attuale situazione parlamentare non è stata un'opinione condivisa, tuttavia, siccome sono fatti pubblici, li ricordo per dire che il segreto di Stato è uno strumento molto delicato,
2031890	2055930	che deve essere usato con estrema cautela, oltre a durare soltanto trent'anni, diciamo, e secondo me, al di là del controllo parlamentare, che, ripeto, nelle condizioni date si può esercitare limitatamente, secondo me è anche bene che ci sia un controllo di opinione pubblica.
2057210	2079930	Nel senso che, in fronte a vicende di questo tipo, forse l'opinione pubblica dovrebbe un po' di più fare sentire la sua presenza, per segnalare che il segreto di Stato, per proteggere le attività di più pompa, sembrerebbe non precisamente volto a garantire la sicurezza del Paese.
2080150	2101630	Però io non credo che il segreto di Stato costituisca davvero il principale ostacolo o un ostacolo rilevante rispetto all'accertamento della verità nelle vicende relative alle stragi, non solo perché in nessuna di queste vicende risulta esplicitamente opposto.
2103290	2129310	Anche se qui ci siamo posti un interrogativo, diciamo, e cioè in che misura l'opposizione del segreto di Stato, pur non potendo riguardare le vicende di stragi, ma opposto in altre vicende, e poi estensivamente utilizzato, possa avere ostacolato la ricerca della verità anche in questo campo.
2129310	2159270	E qui si possono fare degli esempi, diciamo. La vicenda Eni Petromin, il caso Tony De Palo e il presunto traffico di armi tra Olpo e Brigate Rosse, per esempio, sono vicende sulle quali si è esercitato il segreto di Stato.
2160850	2180250	Indirettamente, diciamo, aiutare ad accertare la verità in altre vicende. Quindi da questo punto di vista, io credo che una certa vigilanza sugli effetti indiretti che l'uso del segreto può avere avuto, è giusto farla.
2180250	2202530	In gran parte si tratta di segreti che sono in scadenza e evidentemente non dovrebbero esserci difficoltà a trasmettere all'autorità giudiziaria documenti su cui scada il segreto di Stato, che possano essere utili in quanto collegati.
2202530	2217010	Magari anche per ricostruire un insieme di rapporti, di relazioni, diciamo, a vicende che sono direttamente interessate da indagini per i gravi reati di cui abbiamo parlato qui.
2217010	2246990	Nella vicenda Tony De Palo, il Copasir è intervenuto al fine di consentire ai familiari e dei due giornalisti scomparsi di prendere visione di gran parte di questi documenti, dei documenti, diciamo, che erano depositati presso gli archivi, e questo è stato un primo caso in cui la collaborazione tra Parlamento e cittadini, eccetera, ha consentito un accesso importante.
2247010	2253010	A una documentazione che fino ad oggi era stata praticamente non disponibile.
2253010	2277410	Infine qualcosa voglio dire sulle classifiche di segretezza. Anche qui, diciamo, io non sono del tutto d'accordo, innanzitutto ritengo che bisognerebbe vivamente consigliare a tutte le amministrazioni un uso meno estensivo, meno arbitrario, diciamo, più limitato di questo strumento di riservatezza,
2277410	2301510	ma credo che si debba respingere ogni interpretazione che voglia limitare la portata dell'innovazione prevista dalla legge 124, e cioè che prevede un meccanismo di declassifica automatica e la durata massima di 15 anni per le diverse denominazioni.
2301510	2325510	A meno che tutto questo non venga superato da una decisione politicamente motivata del Presidente del Consiglio, ma non da sbarramenti di natura burocratica che possono essere opposti dalle amministrazioni. Questo, francamente, sarebbe assolutamente inaccettabile.
2325510	2347690	Quindi, riassumendo i temi relativi all'attuazione della legge 124, sì, io accolgo la critica che il processo di attuazione della riforma è un processo lento e potrebbe riguardare anche altri aspetti, diciamo, di natura ordinamentale, è un processo lento.
2347690	2362350	Penso a questioni che non riguardano questa sede, come per esempio la difficile applicazione del principio, pure così importante che la selezione del personale avvenga attraverso concorsi e non attraverso i meccanismi che sono stati adottati sin qui, ecc.
2362350	2392330	O, per esempio, una decisione che pure è stata presa, poi contestata in sede giurisdizionale con un appello al tardellazio, che costituisce per molti aspetti, secondo me, il cuore della riforma vera, e cioè la decisione di un ampio turnover che porti fuori dai servizi circa 590 funzionari, che sono quelli che stanno lì da più di 20 anni, che questo vale più di tutte le leggi che si possono sapere.
2392350	2409670	Siamo sulla materia, diciamo, e che intorno alla quale si sta lavorando per favorire quel ringiovanimento, quel ricambio, quella acquisizione di nuove professionalità, proprio in relazione ai compiti che i servizi segreti hanno.
2409670	2433670	Perché la riforma individua i compiti nuovi di questi servizi che riguardano l'economia nazionale, che riguardano l'idea di servizi segreti proiettati oltre la logica della guerra fredda, ecc., che ne ha fortemente segnato tutta la storia nel corso del dopoguerro.
2434270	2450410	Non si può parlare dei servizi segreti al di fuori di una considerazione storica che riguarda la storia del nostro Paese. C'è una profonda differenza tra la trattazione dei segreti in un Paese come gli Stati Uniti, in America e in Italia.
2450410	2466410	La differenza è che i segreti italiani riguardano la storia interna dell'Italia, i segreti della CIA riguardano le operazioni che la CIA ha fatto il giro per il mondo, i segreti italiani riguardano la storia del nostro Paese.
2466410	2493870	E cioè il fatto che questo Paese è stato un Paese attraversato dalla guerra fredda, nel quale una parte degli apparati dello Stato hanno, non per deviazione, ma perché era il loro compito, esercitato una parte fondamentale delle loro funzioni nel controllare la vita politica interna del Paese.
2493870	2515530	Questo è una peculiarità che rende molto difficile affrontare questa questione come se fosse soltanto un esame di diritto comparato. La CIA ci ha raccontato quello che ha fatto in Guatemala, ma noi chiediamo ai nostri servizi di sapere che l'hanno fatto qui, il che è molto più impegnativo da ogni punto di vista.
2515530	2544990	Il nostro è stato un Paese attraversato da un conflitto e ho visto questo recente volume, d'altro canto basta leggere la monumentale storia del deluzis dei servizi segreti italiani, uno si rende conto che i servizi segreti italiani furono ricostituiti nel dopoguerra dagli inglesi e un po' dagli americani recuperando tutto il vecchio personale fascista.
2545530	2559530	Perché era quello più adatto ad organizzare una struttura la cui fondamentale mission non era quella di vigilare sulla sicurezza del Paese ma combattere la sinistra, il Partito Comunista e la sinistra in generale.
2560470	2573530	Andarono prestino a recuperare il generale rea Roatta, che era quello accusato del domicilio dei Fratelli Rosselli, quindi c'è poco da fare. Parliamo di questa storia.
2573530	2596930	Poi naturalmente è passato molto tempo, sono cambiate molte cose, è cambiato, oggi sarebbe sbagliato considerare soltanto in questi termini la realtà dei servizi, ma parliamo di un cambiamento culturale molto profondo che va al di là delle cose belle che si possono scrivere in un testo di riforma.
2596930	2618290	Fra l'altro io ho cercato più volte di convincere i servizi segreti che una maggiore trasparenza dei documenti relative alla loro storia consentirebbero forse persino agli storici di fare una storia dei servizi che non sia soltanto una storia delle deviazioni dei servizi.
2618290	2639570	Perché oggi gran parte della stereografia sui servizi segreti è fatta su fonti giudiziarie, perché siccome la magistratura ha acquisito gli atti laddove non c'è il segreto di Stato, ma una storia dei servizi segreti fatta quasi esclusivamente sulle fonti giudiziarie è una storia delle deviazioni dei servizi segreti.
2639570	2652990	Mentre la storia di tutte le cose che i servizi segreti hanno fatto nel corso degli anni per proteggere la sicurezza del Paese viene custodita in archivi inaccessibili, il che secondo me non è neppure dell'interesse dei servizi segreti.
2652990	2665830	Questo ragionamento fatica ad aprire una breccia, ma tuttavia si può sperare che lentamente si apra una breccia.
2665830	2688830	Però ecco, io credo che tutta questa considerazione non ci può sfuggire. Si tratta di riformare uno dei gangli più delicati di un apparato pubblico che è stato per lungo tempo segnato da un conflitto drammatico che ha attraversato il nostro Paese.
2689790	2701190	Il che rende indiscutibilmente questo problema molto più delicato di come possa essere in altri Paesi in cui non si tratta.
2701190	2717750	Ora, io penso che per molti aspetti la verità storica su tutto questo, la verità storica nelle sue grandissime linee e oramai sia una verità di cui siamo abbastanza consapevoli.
2717750	2731550	E via via, la ricerca storica ci ha reso consapevoli. Io parlavo prima di questo saggio sul piano solo, che siamo trovati a presentare insieme con Miguel Gotor.
2731550	2747350	Che è interessante anche perché ha potuto utilizzare, con lo studioso che lo ha scritto, fonti archivistiche di natura privata. Gli hanno consentito di aprire uno squarzo sul piano solo.
2747350	2773510	La cosa interessante di questo voluminoso saggio è che rende in gran parte giustizia ai servizi segreti. Perché si capisce che il piano solo non fu una deviazione del gen. Lorenzo, ma fu un programma di azione contro la sinistra che fu commissionato al gen. Lorenzo da un'altissima autorità politica del tempo.
2776130	2802410	Non una deviazione istituzionale, che naturalmente poi uno che esegue non può che eseguire le indicazioni che vengono dalle autorità politiche istituzionali. Lo dico perché spesso si è parlato di deviazioni a proposito di cose che forse deviazioni non erano nel senso che era l'indirizzo che concretamente certi apparati avevano e svolgevano.
2803510	2833490	E' stato, perlomeno a partire da una certa fase storica, un indirizzo inaccettabile e contrario alla legge. Ma appunto si è parlato per il nostro Paese della complessa realtà di un doppio stato, di una doppia lealtà, del convivere insieme di una democrazia costituzionale e di una costituzione materiale in cui invece il peso della guerra fredda ha fortemente condizionato l'opera di
2833490	2859490	delicatissimi apparati dello Stato. La riforma è sia pure tardivamente, perché bisogna dire la verità che una certa mentalità, anche per responsabilità politica, ha continuato ad operare anche quando questo non aveva più alcun senso, cioè nel tempo della seconda Repubblica.
2859490	2888310	C'è stato che ha cercato di far sopravvivere il fantasma della guerra fredda anche in un tempo in cui questo storicamente non ha più significato. Con molto ritardo, perché 2007 è tardi rispetto al 1989, una riforma coraggiosa ha, secondo me, ha aperto, può aprire una stagione nuova. Bisogna attuarla pienamente.
2890210	2916430	Superando resistenze corporative, timidezze politiche, e questo è esattamente l'impegno nel quale noi ci mentiamo. Sapendo quali sono i limiti del nostro agire, lo dico perché ho sentito qui un overdose di domanda, di cui il Copassi non può dare delle risposte, perché il massimo che possiamo fare è esprimere delle raccomandazioni al Governo.
2916430	2930570	E perché le raccomandazioni al Governo siano condivise dalla maggioranza, io devo convincere anche, non vi dico l'elenco, perché vi impressionereste, i parlamentari che rappresentano la maggioranza di Governo che ne fanno parte.
2930570	2952610	Quindi i nostri poteri sono piuttosto limitati, ma entro questi limiti io credo che noi abbiamo detto con chiarezza alcuni no, alcuni sì, e stiamo cercando di spingere questa riforma nel senso di un effettivo cambiamento.
2952610	2975770	Detto questo, io credo che questa discussione lo conferma, noi abbiamo bisogno, più in generale, di qualcosa che vada molto oltre la questione dei servizi segreti, noi abbiamo bisogno, in Italia, di qualcosa che somigli al Freedom of Information Act.
2975770	2992770	Ne abbiamo bisogno per quanto riguarda l'insieme della pubblica amministrazione, e quindi anche in quella occasione abbiamo bisogno di mettere in mano all'insieme dell'organizzazione e dell'ordinamento archivistico del Paese.
2992980	3019260	Ripeto che così com'è, è povero di mezzi, frantumato, soggetto a norme diversamente restrittive, e tutto questo crea un labirinto che rende molto molto difficile un lavoro prezioso, che è quello innanzitutto dei ricercatori e degli storici che vogliono ricostruire la vicenda del Paese,
3019260	3031660	portare alla luce le verità storiche e politiche di questa vicenda, che è il fondamento essenziale per poter andare avanti meglio insieme. Grazie.
3052380	3064000	Si, credo che dopo questo intervento che ha, a mio parere, messo in chiaro ed evidente le prospettive all'interno del quale si può inserire...
