start	end	text
0	6960	che ci entrerà nel merito di tutte le questioni che sono state qui sollevate per affrontare
6960	12240	in particolare il tema del segreto di Stato e dell'accesso agli archivi, prego.
14180	23760	Grazie, molte grazie. Lasciate solo che io con una battuta diciamo, dica una cosa su
23760	29260	quello che probabilmente sta a cuore a tutti gli astanti diciamoci, in materia di qualità
29260	34520	se non di trasparenza della nostra democrazia, oggi è una giornata di festa, diciamo.
55560	63120	Nel senso che i cittadini si sono reimpadroniti di uno strumento democratico fondamentale
63120	70420	che sembrava completamente obsoleto e che invece ha ritrovato, grazie ad un sussulto
70420	78720	di spirito civico diciamo, ha ritrovato un suo significato e un suo valore, è tempo
78720	84660	di una ripresa di spirito civico, di impegno civile, che quindi speriamo che ci aiuti a
84660	90900	fare dei passi in avanti anche sulle delicate questioni che sono state all'esame di questo
90900	98400	convegno. Io non ho la competenza per riprendere l'insieme dei problemi che sono stati sollevati,
98620	110100	che riguardano più in generale diciamo la disponibilità delle fonti per la ricerca
110100	119380	storica oltre che per la ricerca della verità, in sede giudiziaria qui si sono accavallati
119380	131420	temi abbastanza diversi tra di loro e cioè quella legittima e insaziabile volontà di
131420	141780	verità su vicende che hanno insanguinato e fortemente condizionato la storia del Paese
141780	148540	nelle sedi proprie ancora, perché su alcune di queste vicende sono ancora aperte delle
148540	159220	indagini di carattere giudiziario e la necessità e la possibilità di indagare in sede storiografica
160140	166340	su pagine cruciali della vicenda italiana, della storia contemporanea del nostro Paese.
167840	174200	Naturalmente non tutto questo ruota intorno ai servizi segreti diciamo che certo godono
174200	182060	di una cattiva fama e di una denominazione che attira molte curiosità e aspettative
182060	189580	in quanto a essendo segreti diciamo si suppone che lì si concentri una quantità enorme
189580	196920	di informazioni nascoste di verità da scoprire in realtà come poi cercherò di dire queste
196920	202700	verità da scoprire riguardano diverse amministrazioni dello Stato diversi corpi dello Stato e non
202700	204900	soltanto i servizi segreti.
205120	214120	Però ecco io quindi vi chiedo scusa se molti degli stimoli che sono venuti in un convegno
214120	221840	come questo di notevolissimo livello scientifico non potranno trovare una risposta nel mio
221840	227580	intervento conclusivo ma saranno ovviamente come dire consegnati ad una riflessione che
228000	235380	anche in altre sedi perché io mi concentrerò di più su quello che mi competi dal punto
235380	243240	di vista istituzionale cioè il ruolo dei servizi, la stato di attuazione della legge 124 della
243240	250680	riforma dei servizi sia in materia di segreto di Stato, classificazione e declassificazione
250680	256000	di documenti, accessibilità degli archivi, questioni sulle quali cercherò di fornire
256000	259800	risposte puntuali sullo Stato dell'arte.
261220	266040	Vorrei anche dire che ho apprezzato moltissimo le iniziative che qui sono state presentate
266040	272880	o annunciate e anche che sono il frutto di una collaborazione insomma tra istituzioni
272880	281520	pubbliche, associazioni, organismi come le fondazioni che svolgono soprattutto in questa
281520	292020	parte del Paese che dispone di queste strutture, spesso un ruolo di carattere sociale e culturale
292020	300040	insostituibile, questo è molto importante anche perché difficilmente tutto può essere
300040	306560	sulle spalle di un'amministrazione pubblica però non c'è dubbio che il ruolo insostituibile
306560	312880	in condizioni difficilissime come sono quelle denunciate oggi da Mario Pirani, diversi hanno
312880	319320	ricordato il suo articolo, il ruolo che svolge l'amministrazione archivistica è un ruolo
319320	327100	fondamentale e si deve dare atto della passione, dell'impegno non solo professionale e civile
327100	332980	con cui operano tantissimi operatori in questo campo.
333960	341100	Quindi diciamo la discussione mi sento chiamato in causa della discussione non solo come Presidente
341100	346000	del Comitato per la Sicurezza della Repubblica o come parlamentare ma anche come cittadino,
346220	353020	come militante democratico, come persona curiosa della storia del Paese ma partirò
353020	360180	dai problemi che mi toccano istituzionalmente, gli interrogativi che investono nella riforma,
361180	370180	cioè lo stato di attuazione della legge 124 e dell'azione parlamentare in questo senso.
372180	378540	Questione che mi tocca sotto vari profili anche perché di quella riforma che si ha
378540	386180	detto per inciso fra l'altro recepisce in toto l'obiettivo a cui si è fatto riferimento
386180	399460	fin dal 1984, cioè l'obiettivo che il segreto di Stato non possa essere opposto in procedimenti
399460	408440	che riguardano stragi, come ricordava il Presidente Paolo Bolognesi, quello obiettivo è stato
408440	414280	ricevito in toto nella legge 124 e ne costituisce una delle novità.
415340	425320	Io sono stato tra i proponenti perché fu fatta nel periodo non lungo del governo Prodi,
427420	432160	in qualità di Vicepresidente del Consiglio e di Ministro degli Esteri ero uno dei proponenti
432160	441020	di quella riforma di cui poi mi sono trovato successivamente diciamo ad essere partecipe
441020	446480	nella fase di attuazione nella sede del controllo parlamentare.
446780	455060	Devo dire la verità che la riforma dei servizi è un'operazione molto molto complessa, adesso
455060	461040	qui io necessariamente devo fare un discorso di carattere generale, oltretutto l'attività
461040	469040	del Copasire è un'attività coperta per legge da segreto, quindi io cercherò di violare
469660	477040	la legge il meno possibile nel corso della mia esposizione nel senso di limitarmi a ciò
477720	488480	che oramai è materia pubblica e non vorrei neppure eccedere nella polemica con chi poi
488480	494220	ha gli effettivi poteri per i quali io sono stato chiamato in causa, nel senso che poi
494220	503420	l'attuazione della riforma procede attraverso l'emanazione di regolamenti sui quali è
503420	516080	pur vero che il Copasire ha il potere di esprimere dei pareri, ma appunto dei pareri e l'autorità
516080	522520	delegata ad emanare questi regolamenti è l'autorità di governo, in particolare come
522520	533200	voi sapete la riforma fa perno intorno ad una responsabilità politica che viene messa
533200	539260	in capo innanzitutto al Presidente del Consiglio dei Ministri, perché la grande novità della
539260	546660	riforma è di avere superato una frammentazione di poteri e di responsabilità, cioè il rapporto
546660	551460	tra il servizio segreto così detto interno civile che faceva capo al Ministero degli
551460	557300	Interni, il servizio segreto militare che faceva capo al Ministero della Difesa e solo
557300	562920	diciamo come collaborazione al Ministero degli Esteri e invece tutto viene ricondotto al
562920	567260	Dipartimento per la Sicurezza e quindi alla Presidenza del Consiglio dei Ministri.
567260	574560	Rispetto a questa responsabilità altissima, noi abbiamo un compito di interlocuzione e
574560	583200	di controllo, si è detto per inciso tra l'interlocuzione e il controllo deve tenere
583200	587480	conto di certe peculiarità come ciò del fatto che per esempio il Presidente del Consiglio
587480	593260	non ha mai accettato di venire a discutere con noi, che costituisce certamente una singolarità
593260	599820	rispetto al controllo parlamentare, ma forse questa è una delle particularità che si
599820	606540	spera siano avviate verso una positiva soluzione, diciamo, dalle vicenze generali del Paese.
607460	615040	Ancorché la legge dica, non se come quando, ma dica testualmente il Presidente del Consiglio
615040	622760	risponde al COPASI per le materie di sua esclusiva competenza, cioè prevede questo come un
622760	629100	rapporto ordinario non si è mai realizzato nel corso dell'attuale legislatura.
629900	642760	Ma comunque, la riforma introduce importanti novità, innanzitutto nella materia degli archivi,
644560	652520	organizzazione ed accesso limitatamente al comparto intelligence, invece la materia del
652520	658920	segreto di Stato riguarda tutte le amministrazioni dello Stato, così come anche la materia
658920	667480	relativa alle classifiche di segretezza. Ora, questa questione degli archivi è una questione molto
667480	675880	complicata, e io non ho nessuna difficoltà a dire che lo stato di attuazione della riforma è
675880	684700	faticosamente indietro, perché prima ancora di discutere delle limitazioni derivanti dal segreto di Stato,
684920	690000	dalla classificazione dei documenti, bisogna dire che c'è un delicatissimo problema che riguarda
690000	701080	l'accessibilità fisica di questi archivi, dei quali non è stato facile neppure sapere quanti siano
701080	714080	e dove siano informazioni che neppure in toto abbiamo ricevuto. Quindi c'è un enorme problema di riordino,
715480	731060	secondo quello che dice la legge, perché la legge prevede che ci sia un accentramento presso il
731060	738420	che la legge definisce impropriamente storico, ma che gli archivisti definirebbero un archivio di deposito,
739860	750060	dei materiali che provengono dai diversi settori dei servizi segreti, e da lì poi, trascorsi i 40 anni,
750400	757980	questo materiale dovrebbe essere avviato verso l'archivio centrale dello Stato. Noi stiamo premendo,
757980	766980	insistendo, perché questo complesso sistema sia messo a regime. Devo dire che si sono fatti alcuni passi in avanti,
768420	780000	e questo attraverso tuttavia la necessità di superare enormi difficoltà di carattere corporativo e burocratico.
780000	789080	Il passo in avanti principale che si è fatto in questa direzione non è soltanto quello di aver stabilito,
789080	798980	lo stabilisce la legge, ma poi rendo l'operativo in Italia fare le leggi una cosa, poi dopo farle applicare a un'impresa estremamente più complessa.
799160	808000	Ma è che intanto il Comitato deve essere informato della istituzione dei nuovi archivi, il che può sembrare una banalità,
808000	821880	ma invece è essenziale lo scopo di esercitare un controllo circa la possibilità di attività improprie, di archiviazione e di dossieraggio.
822360	831320	Tornerò su questo tema a proposito del segreto di Stato, ma negli ultimi anni noi abbiamo assistito ad un episodio noto di attività impropria,
831320	842460	ed è la formazione di un archivio presso gli uffici di via nazionale del SISMI che non sembrava propriamente volto a tutelare la sicurezza del Paese.
842800	849020	E qui non parlo di stragi lontane, parlo di eventi molto vicini a noi.
850020	859000	Quindi non soltanto noi abbiamo messo sotto controllo queste attività raccogliendo le informazioni circa gli archivi esistenti
859000	871840	e stabilendo il principio che di tutto questo il Comitato deve essere informato, ma questo archivio cosiddetto storico è stato istituito,
871840	886920	questo archivio cosiddetto storico è in realtà di deposito, e quindi l'attività di trasmissione dei materiali si avvia concretamente
886920	903960	In questa circostanza il Comitato ha formalmente richiesto all'autorità delegata che il passaggio di documenti attualmente custoditi presso le agenzie, cioè l'AISI e l'AISI,
903960	916960	consenta contestualmente l'accesso ai sensi della legge 241 anche a storici e a studiosi e non soltanto la formazione di un archivio riservato interno.
920280	925740	Naturalmente la legge prevede il versamento presso l'archivio centrale dello Stato.
925740	934780	Quindi noi stiamo lavorando per mettere a regime questo sistema, abbiamo fatto alcuni passi in avanti, è un processo molto complesso.
935020	949000	Tutto questo non risolve il problema degli archivi perché come giustamente è stato detto purtroppo gli studiosi si scontrano con la complessità di un'organizzazione archivistica
949000	960560	che ha portato in parte persino con decisioni abbastanza recenti, penso a una decisione abbastanza sciagulata di istituire un archivio storico della Presidenza del Consiglio.
961260	979900	Ma noi siamo in una situazione di frammentazione che è del tutto sbagliata oltre che costosa per una pubblica amministrazione che è ridotta all'umicino per quanto riguarda settori cruciali.
979900	986720	Non torno qui appunto sulle cose che sono state dette anche da Giulia Barrera sulla situazione dell'archivio centrale dello Stato,
986720	998660	in generale dell'amministrazione archivistica, sulla mancanza di ricambio del personale, sul rischio che un'intera generazione di archivisti, che è un patrimonio della cultura italiana,
1000120	1009560	piano piano se ne vada tra non molto tempo in pensione e che nessuno sia in grado di sostituirli degnamente, con un colpo drammatico alla ricerca storica.
1009560	1021720	Questo è un problema. È una vera emergenza nazionale che fa parte della più larga emergenza che riguarda la cultura e i beni culturali del Paese.
1021720	1034060	E' abbastanza assurdo in questo contesto che noi abbiamo gli archivi degli organi costituzionali per ciascuno per quanto proprio e della Presidenza del Consiglio.
1034260	1046720	E in questo campo i carabinieri, lo Stato Maggiore della Difesa, la Guardia di Finanza, non parliamo dello Stato assai problematico dell'archivio del Ministero degli Esteri.
1051020	1058600	Qui davvero occorrerebbe qualcosa che va molto al di là della portata della legge 124.
1058600	1074720	Io credo che dovrebbe essere un grande obiettivo, ma non è una mia competenza diciamo specifica, ma io credo che la comunità scientifica in primo luogo e la politica dovrebbero studiare un'organica riforma di questo comparto.
1074720	1092980	In grado di mettere ordine e in particolare per quanto riguarda la conservazione dei documenti relativi alla storia unitaria del nostro Paese, tali documenti dovrebbero essere conservati fondamentalmente dall'archivio centrale dello Stato.
1092980	1106200	Che dovrebbe essere adeguatamente potenziato attraverso un superamento di un'articolazione delle strutture archivistiche che non ha molto senso.
1106460	1121680	Oltretutto diversi di questi archivi hanno discipline diverse e normalmente norme più restrittive per quanto riguarda l'accesso e tutto questo veramente crea un labirinto per la ricerca storica.
1122380	1136680	Ripeto, la cui complessità va molto al di là del problema che pur è piuttosto complicato, come ho cercato di dire, che riguarda gli archivi dei servizi segreti.
1137980	1143180	Poi che cosa si troverà negli archivi dei servizi segreti? Non lo so.
1144260	1154540	Io penso sempre, un po' lo diceva Michele Gautorno nel suo intervento, si si alimentano anche aspettative.
1155460	1164340	Io ho qualche ragionevole dubbio che negli archivi dei servizi segreti siano documentate tutte le deviazioni dei servizi segreti.
1164340	1175340	E temo che una parte di queste deviazioni siano state, come dire, appartengono ad una tradizione orale che difficilmente troverà riscontro nei documenti scritti.
1175480	1185580	E' pur vero che soprattutto gli archivi di strutture burocratiche possono tradire.
1186040	1193920	Ho sempre pensato magari che difficilmente si troverà un documento nel quale c'è scritto, e quindi siamo stati mandati a mettere la bomba.
1193980	1204000	Ma chissà si può trovare la nota spese, perché quello è più facile che lo si trovi che non il documento nel quale fu dato l'ordine.
1204000	1222920	Ma tuttavia, lo dico perché poi tornerò su questo punto, al di là degli archivi, il vero problema è in che misura questi organismi dello Stato hanno contribuito attivamente alla ricerca di una verità.
1222920	1232920	Che in molti casi non è una verità archivisticamente documentabile, ma che appartiene ad una tradizione, ad una memoria.
1235500	1238920	E questo riguarda la complessa vicenda degli archivi.
1241100	1250840	Il tema assai delicato e complesso è il tema del segreto di Stato. Notatamente qui noi dobbiamo intenderci con chiarezza che cosa è il segreto di Stato.
1250920	1258920	Il segreto di Stato riguarda specificamente il segreto che viene opposto alla magistratura.
1258920	1268840	Perché la consontabilità dei documenti, da parte dei cittadini e degli studiosi, è disciplinata da altre normative.
1270120	1283920	Quindi noi parliamo di quella forma estrema di sbarramento, che è il potere di impedire ai magistrati di poter esaminare un documento.
1283920	1292180	È un potere che comporta un'altissima responsabilità politica.
1292840	1308780	Solo il Presidente del Consiglio può decidere di opporre il segreto di Stato o di confermare l'opposizione del segreto di Stato nel caso in cui un funzionario sottoposto ad un procedimento opponga il segreto di Stato.
1308780	1312820	Questo può riguardare un documento, può riguardare anche una deposizione.
1314100	1327420	Se un funzionario o un magistrato chiede una cosa e questo signore dice no, io oppongo il segreto di Stato, a quel punto è il Capo del Governo che può confermare o meno l'opposizione del segreto di Stato.
1327420	1355420	La Corte Costituzionale è intervenuta su questa delicatissima materia con una sentenza che fa giurisprudenza, nel senso che è una sentenza che sottolinea con molta forza la responsabilità politica del Capo del Governo e la insindacabilità in sede giurisdizionale di questo potere del Capo del Governo.
1357300	1376420	L'unico controllo sull'esercizio di questo potere, e parlo di una sentenza dopo che è intervenuta molto recentemente, quando sulla base della iniziativa dei giudici di Milano che si sono rivolti alla Corte,
1376420	1389740	contro i governi, perché in quel caso il segreto di Stato, nel caso della vicenda relativa al rapimento a Buomara, fu opposto sia dal Governo dello Scoli che dal Governo Proti.
1389740	1406880	E la Corte Costituzionale dette ragione totalmente ai governi, oponendo alla magistratura milanese una sentenza durissima che diceva che non potesse mettere il naso in un potere che appartiene.
1408520	1422020	Naturalmente la delicatezza di questo potere fa sì che, innanzitutto, la Corte Costituzionale, ma già la legge, fissa dei limiti.
1422020	1430100	Il segreto di Stato non può riguardare reati eversivi dell'Ordine Costituzionale, fatti di terrorismo, stragi e mafia.
1432960	1446600	Oppone dei limiti, già la legge, ma anche la sentenza della Corte, fissa dei limiti all'esercizio di questo potere, proprio perché è un potere così forte, insindacabile.
1446600	1464860	E in particolare, nella tipizzazione che fa la Corte, il riferimento riguarda le relazioni internazionali, quando siano minacciate le relazioni internazionali del Paese, o il funzionamento, gli interna corporis dei servizi.
1464860	1477840	Io dico questo, se detto per inciso, che è una delle ragioni per cui noi abbiamo cercato di capire perché è stato classificato come il regolamento.
1478240	1488240	E ci faremo di nuovo parte attiva per chiedere che almeno le norme relative agli accessi all'Archivio dei Sibili Segreti siano rese pubbliche.
1488240	1506200	Il problema è, dal punto di vista di chi ha classificato il regolamento, che non siamo noi ovviamente, ma l'amministrazione, che in quel regolamento ci sono norme attraverso le quali si evince la struttura, il funzionamento interno.
1506200	1517200	E per tutto ciò che sono gli interna corporis dei servizi c'è una estrema ritrosia a rivelare.
1518680	1534200	Intendiamoci, anche io, tornerò poi parlando delle classifiche dei documenti, io credo che l'uso della classifica riservato segreto, segretissimo, è un uso eccessivo, persino ridicolo in qualche caso.
1537300	1544200	Oltretutto, tutta la vicenda di WikiLeaks dimostra che l'enorme estensione dei segreti li rende indifendibili.
1544200	1564480	Quindi sarebbe piuttosto saggio limitare molto queste forme di protezione a ciò che veramente deve essere tenuto riservato e non farne un uso discrezionale da parte, in questo caso, delle amministrazioni, enormemente esteso e spesso del tutto ultroneo.
1564480	1591600	Ma tornando al segreto di Stato, è vero che è stato ricordato la Commissione Granata, la Commissione ha proposto una protezione di secondo livello, e cioè il fatto che dopo l'accessazione del segreto, che la legge stabilisce in 15 anni reiterabili a 30, non 30, 15 reiterabili a 30,
1591600	1610600	è con decisione politica di cui si assuma la responsabilità il Capo del Governo e non con decisione burocratica, ed è molto importante far rispettare anche questo principio della legge, e poi prevede la possibilità di una protezione di secondo livello.
1610820	1638160	Noi ci siamo opposti a questo, in senso che in sede di parere il Copa si ha espresso, vorrei dire per inciso, il Comitato per la Sicurezza dei Pubblici è un organismo di funzionamento assai complesso, non solo perché le sue attività sono segrete, ma perché è un organismo perfettamente paritario.
1638840	1653480	E quindi per potere deliberare a maggioranza, è vero che è presieduto per legge da un esponente dell'opposizione, ma è composto di 5 esponenti della maggioranza e 5 esponenti dell'opposizione.
1653480	1681600	Per potere deliberare a maggioranza, ogni deliberazione non può che essere bipartisan, lo dico perché voi potete immaginare quale fatica questo comporti, in un contesto culturale nel quale la dialettica governo-parlamento sembra essere stata totalmente sostituita dalla dialettica maggioranza-opposizione.
1681600	1701060	Lo dico perché nel passato il Parlamento, indipendentemente direi da maggioranza e minoranza, aveva la cultura del controllare il Governo. Oggi noi siamo in un'epoca in cui c'è una maggioranza parlamentare che si ritiene un puro prolungamento dell'esecutivo.
1703560	1719400	E quindi prendere delle decisioni che in qualche modo pretendano di sindacare le attività di Governo in un organismo perfettamente paritario, è un'attività estremamente impegnativa.
1719400	1742460	Questo vorrei che fosse chiaro. Noi invece su questo punto abbiamo chiesto al Governo di rispettare alla legge 124 e vorrei anche dire che abbiamo avuto assicurazione dal Governo che il Governo lo farà.
1742460	1754120	E cioè che la raccomandazione di istituire una protezione di secondo livello che era contenuta nelle conclusioni della Commissione Granata non sarà tenuta in considerazione.
1754120	1782000	Invece sul problema relativo al concetto di segreto di Stato internazionale, c'è la possibilità che ci sia un regime speciale per documenti relativi a vicende che coinvolgono la responsabilità di altri servizi.
1782000	1791640	E su questo il Copasir non ha raggiunto un parere condiviso e questo tema è ancora oggetto di una discussione con l'esecutivo.
1791640	1812640	La mia opinione è che questo principio sia molto discutibile a meno di casi di piena reciprocità, nel senso a meno di situazioni con paesi con i quali un principio di questo genere sia reciprocamente accettato.
1813960	1828920	Altrimenti non si capisce perché noi dovremmo farci carico di una protezione speciale per operazioni o vicende che coinvolgono altri Paesi che non ci ricambiano la cortesia, per dirlo in termini brutali.
1829000	1831980	Ma comunque è un tema che è ancora in discussione con il Governo.
1831980	1859700	Ora, il segreto di Stato è certamente un strumento molto delicato e voglio dire molto sinceramente, traccanto che non ho nascosto questa mia opinione, anche se questa opinione non è poi stata condivisa dalla maggioranza, ancora in tempi recenti si è fatto un uso a mio giudizio arbitrario dello strumento del segreto di Stato.
1859700	1879060	Ancora in tempi recenti. Parlo in complesso di vicende controverse, per esempio nel caso del processo Abu Omar io credo che effettivamente io condiviso la decisione in quel caso del Presidente del Consiglio Romano Prodi di confermare l'opposizione del segreto di Stato.
1879060	1899120	Non c'è dubbio, qualsiasi cosa si voglia pensare di quella vicenda, che tuttavia in quel caso il segreto di Stato proteggeva una delicatissima vicenda che coinvolgeva le responsabilità di un Paese amico e alleato del nostro Paese.
1899120	1909480	E in quel caso effettivamente rientravamo, come la Corte Costituzionale ha riconosciuto, nei casi di specie in cui il segreto di Stato è legittimo.
1911060	1921160	Ma, egualmente, io lo dico perché tutto questo è avveruto con scarsa eco di opinione pubblica. Sono fatti pubblici quelli di cui parlo.
1921160	1945420	In vicende recenti, come la vicenda del processo Telecom a Milano, dove con il segreto di Stato si è protetto un funzionario del servizio segreto militare coinvolto nei dossieraggi promossi da un'agenzia privata di investigazioni insieme all'ufficio di sicurezza della Telecom,
1945420	1962820	devo dire sinceramente, non si capisce quale valore si tutelasse in quel caso, e il segreto di Stato è intervenuto a rendere difficile l'accertamento della verità in una vicenda che ha tutti gli aspetti di una deviazione dell'attività dei servizi.
1962820	1980820	Ancora di più nel processo presso il Tribunale di Perugia relativo alla vicenda di via nazionale, dove senza alcun dubbio si svolgeva un'attività del tutto estranea alle attività istituzionali dei servizi segreti,
1982300	1991700	come è emerso chiaramente dalle indagini di polizia giudiziaria che hanno portato alla luce dossier relativi a magistrati, giornalisti, etc.
1992480	2011700	Attività che gli stessi servizi segreti hanno dichiarato essere strani ai loro compiti e alle loro finalità, e in questo caso il ricorso al segreto di Stato, a mio giudizio, è stata una decisione chiaramente forzata rispetto ai limiti.
