start	end	text
11900	29980	Grazie, grazie dell'invito e la possibilità di affrontare un tema così importante a mio
29980	40200	curiosa situazione personale di incrociare diversi modelli di fondazione. Sono Presidente
40200	48580	della Fondazione italiana europea che esiste dal nata a cavallo della fine del 1997, all'inizio
48580	57020	del 1998, non fa parte della più recente proliferazione che onestamente è nata dopo
57020	62580	la fine del finanziamento pubblico dei partiti e che secondo me ha un po' inquinato il mercato,
62760	69020	come poi cercherò di spiegare. L'istituzione, che lavora oramai da molti anni, non ha mai avuto
69020	76140	un carattere partitico innanzitutto perché fu costituita per la volontà convergente di tre
76140	85520	persone impegnate nella vita politica, Carlo Azzelio Ciampi e Giuliano Amato a Dio, che non
85520	96560	ha mai avuto un carattere partitico, sicuramente è nata con l'intenzione di accompagnare il
96560	103200	centrosinistra italiano inteso come insieme di forze e di personalità con un'attività
103200	111360	culturale, di ricerca, di approfondimento, creando un contatto sia con il mondo della
111360	119220	ma poi soprattutto con l'intento, testimoniato anche da questo curioso nome unico, di sprovincializzare
119220	124660	il dibattito politico italiano e di creare un collegamento con l'Europa e con il mondo.
127580	136800	Sono stati molti anni difficili e abbiamo potuto vivere non solo grazie a contribuzioni private,
136800	142900	ma anche grazie all'impegno di tantissime persone. Noi pubblichiamo una rivista che viene
142900	149120	considerata, diciamo, secondo i criteri di valutazione, diciamo una rivista di alto
149120	157200	livello scientifico e io devo dire a testimonianza, lo possiamo fare perché nessuno degli autori,
159240	166440	e si tratta di personalità di primo piano della cultura italiana e internazionale, ha mai voluto
166440	173100	un euro di retribuzione. Quindi è un'attività che si fonda, perché si è parlato molto di
173100	180140	finanziamento, ma anche molto su attività volontari, volontariato che è senza il quale
180140	186700	noi non potremmo svolgere questo ruolo. Abbiamo anche svolto un ruolo di supplenza in una
186700	193440	certa misura, come dire, di formazione della classe vigente, perché tutto sommato potrei
193440	200400	scherziosamente, ma non troppo, dire che il Ministro dell'Economia è nato all'impegno
200400	205640	politico come direttore della fondazione italiana europea, il Sottosegretario della Presidenza
205640	210040	del Consiglio, la vicepresidenta del nostro Consiglio scientifico, potrebbe continuare
210040	216320	un elenco non piccolo, diciamo, di persone in vario titolo impegnate nella vita politica
216880	226840	hanno iniziato il loro impegno proprio attraverso l'azione di questa fondazione. Nello stesso
226840	234140	tempo io sono presidente della fondazione dei socialisti europei o vicina ai socialisti
234140	240700	europei, qui si è parlato della fondazione Martens, che è quella vicina al Partito Popolare,
241460	249100	la fondazione vicina, il Parlamento europeo ha varato un provvedimento un po' sul modello
249100	255280	tedesco, molto attenuato, perché ovviamente la differenza è nella quantità di fondi,
256220	265380	che è infinitamente minore, però rispetto alla situazione di difficoltà in cui si
265380	274020	vive in Italia, si tratta di un finanziamento rispettabile con l'idea proprio di offrire
274020	284420	ai partiti politici un retroterra di analisi, di riflessione proprio per fare crescere una
284420	292360	società politica europea in grado di promuovere un pensiero europeo, un pensiero politico
293200	299480	europeo, che va da oltre la somma delle esperienze nazionali, la fondazione dei socialisti si
299480	305580	chiama Foundation for European Progressive Studies, il nome non l'ho scelto io perché
305580	311460	io ho cercato anzi di dire che gli studi o sono seri o non lo sono non possono essere
311460	321080	progressisti, però non è stato più possibile cambiare e è rimasta questa vicitura un po'
321080	328160	così curiosa. Però è un'esperienza molto interessante che funziona anche come network
329160	335600	delle fondazioni di ispirazione progressista esistenti in Europa, per cui la Friedrich
335600	342520	Heber Stiftung è uno dei miei stakeholder, perché poi il Presidente è eletto dall'assemblea
342520	349540	dei soci, la fondazione è una fondazione di diritto belga e somiglia molto al diritto
349540	358680	italiano in materia. Infine io sono membro, diciamo, fin dalla sua costituzione del board
358680	365640	internazionale della fondazione Clinton, che è stato accompagnato fin dall'inizio dalla
365640	371180	creazione di questo Clinton Global Initiative, che è una sorta di board internazionale di
371180	376980	amici e quindi conosco abbastanza bene anche l'esperienza americana, anglosassona in particolare
376980	386140	americana, che è molto diversa, ma che è fondata su una estrema facilità di finanziamento
386140	393160	privato e su una fortissima incentivazione fiscale del finanziamento privato.
394940	402260	Ora, quindi noi abbiamo sostanzialmente due modelli, un modello di finanziamento pubblico
402260	412480	che ha in Germania la sua punta più, diciamo, la manifestazione più generosa, però la
412480	417400	Germania investe centinaia di milioni sulla sua democrazia, però è una democrazia che
417400	428680	funziona e, diciamo, questo è un punto di forza del sistema tedesco. Avere una classe
428680	435000	dirigente, un sistema democratico che funziona, dicono agli studiosi che la coesione sociale
435000	441180	e il funzionamento del sistema politico è uno dei fattori di competitività dei sistemi
441180	446840	paesi. Noi abbiamo modelli di finanziamento pubblico
446840	452540	sono molto più astesi di quello che pensiamo, per esempio in Francia esiste un fondo della
452540	457680	presidenza del consiglio dei ministri che viene attribuito alle fondazioni più significative
457680	465960	vicine ai diversi partiti politici. Io conosco i bilanci dei miei soci, diciamo, e la fondazione
465960	473700	Jean Chavez riceve ogni anno milioni di euro dal governo francese, si tratta di finanziamenti
473700	478740	non commensurabili rispetto a quelli tedeschi, ma comunque c'è una garanzia, c'è un cespite
478740	487660	sicuro su cui fondare un programma di attività. Ora, rispetto a questi diversi modelli o modelli
487680	499700	fondati essenzialmente sulla certezza del contributo pubblico e o modelli fondati sul
499700	506680	rapporto tra politica e finanziatori privati, che nel modello americano è estremamente
506680	513500	aperto, sprogiudicato. La fondazione Clinton poi è una cosa molto strana, perché naturalmente
513500	518420	svolge un'attività di dibattito, di ricerca ad altissimo livello. L'assemblea annuale
518420	524500	della fondazione Clinton normalmente vi partecipano dal Presidente degli Stati Uniti, una ventina
524500	530160	di capi di Stati e di governo, quindi sono dei seminari abbastanza impressionanti rispetto
530160	539960	ai nostri modelli europei, i capi delle maggiori imprese del mondo, insomma lì siamo nella
539960	547900	capitale dell'impero. Nello stesso tempo la fondazione Clinton promuove molte iniziative
547900	556720	di charity, nel senso che esiste questo modello del commitment, cioè le grandi imprese finanziatrici
556720	563600	della fondazione si impegnano anche a costruire un ospedale in Africa o adottare un territorio
563600	571980	che è un mix tra il modello americano della charity e una fondazione politica, che anche
571980	578180	è una forma potente di organizzazione di un pezzo del sistema politico americano, nel
578180	585680	senso che se la signora Hillary può partecipare alla campagna delle primarie con qualche buona
585680	592320	possibilità di vincere, è anche perché ha dietro questa potente struttura che è stata
592320	599920	costruita nel corso degli anni. Ora noi in Italia siamo arrivati ad un punto
599920	609600	estremo, il non modello italiano è il nulla, noi non abbiamo nessuna forma di sostegno
611060	620360	pubblico, abbiamo un notevole grado di criminalizzazione del contributo privato, perché in quanto finanziare
620880	625880	una fondazione di cultura politica appare comunque come una forma di finanziamento della
625880	633460	politica, questo gode di un consenso sociale molto basso, anzi c'è una forte aggressione
633460	642660	del sistema dei media, una pressione negativa su chi potesse avere quest'idea, anche una
642660	648320	legislazione che crea molti dubbi, perché la legge sul traffico di influenze per esempio
648320	658680	tende a criminalizzare, rende molto problematico. Si sostiene che questi flussi di naro non
658680	665120	sono controllati, il che non è vero, perché c'è una legge che prevede un controllo estremamente
665120	678300	rigoroso, noi siamo oggetto, poi si può discutere, io farò una proposta su come questo controllo
678300	683680	è potuto dire anche qui entrando, ma questa è una forma di finanziamento dei partiti,
683760	692100	non c'è controllo, non è vero, le fondazioni riconosciute devono depositare i loro bilanci
692100	700940	presso le prefetture, devono depositare un bilancio della loro attività e sono oggetto
700940	705660	di un controllo da parte del governo e degli organi periferici dell'amministrazione dello
705660	712680	Stato e la legge prevede addirittura che se una fondazione compie con i finanziamenti
712680	719840	privati raccolti attività estrane a quelle statutariamente previste, cioè se noi finanziassimo
719840	728940	una campagna elettorale, è previsto che il prefetto possa commissariare la fondazione
728940	736020	e sequestrarne il patrimonio, quindi noi siamo oggetto di controlli estremamente penetranti,
737220	748720	dobbiamo depositare tutto, e passibili di sanzioni assai radicali. Può darsi, ma questo dipende
748720	752360	dalla volontà politica del governo, non è che la legge non preveda controlli, questa
752360	763440	è una teoria che circola, spesso l'informazione pretende di informare, ma evita di informarsi
763440	774640	prima di informare. Questo che cosa accade? Aggiungo una cosa, lo dico sinceramente, non
774640	780940	devo scusarmi perché l'attività della fondazione italiana è lì, è un'intera biblioteca
781460	788800	di volumi, di numeri di riviste, di ricerche, di convegni, non bisogna raccontare nulla
788800	794900	da questo punto di vista, anche di momenti di discussione che hanno notevolmente contribuito
794900	799960	ad arricchire il dibattito pubblico italiano. Abbiamo aperto un dibattito sulle politiche
799960	805260	di austerità che ha coinvolto economisti di ogni parte del mondo e che è culminato in
805260	810980	un dibattito pubblico tra l'allora Presidente del Consiglio Mario Monti e il premio nobre
810980	819100	per l'economia Joe Stiglitz, è venuto in Italia a spese nostre, nel senso che quello
819100	825000	che noi abbiamo raccolto lo abbiamo investito e lo abbiamo investito nell'interesse del
825000	833760	paese, comunque del dibattito pubblico italiano, non certamente per finalità di tipo personali
836160	843920	e però non c'è dubbio, io credo che se noi vogliamo salvare questo sistema, vogliamo
843920	854560	salvare un insieme di organismi, di istituzioni che nascono da iniziativa privata che si sostengono
854560	860700	di denaro privato, nulla è meno realistico che proporre in Italia forme di finanziamento
860700	868240	pubblico per essere crocifissi dai giornali, questo tipo di crociate, io sono nella felice
868240	874880	situazione che potrei ritirarmi all'estero, tentazione che non dirà di rado mi coglie
874880	879780	essendo che il mio principale ufficio è a Brusseli e che lì non c'è nessuno che viene
879780	888860	a contestare, che si possa lavorare, però amando questo paese non volendo rendermi ad
888860	895760	una tendenza che considero molto pericolosa, perché sostanzialmente su questa strada si
895760	902480	va verso un degrado della vita politica, un decadimento della qualità della classe dirigente,
902900	909440	un allontanamento della politica dalla cultura e tutto questo viene pagato dal paese, non
909440	917880	è gratis, il paese poi paga un prezzo a tutto questo, se noi vogliamo mantenere una possibilità
917880	926200	di relazione tra ricerca, innovazione, cultura e sistema politico e quindi anche canali
926200	933180	di formazione di classe dirigente di alto livello, io credo che noi ci dobbiamo mettere
933180	947820	mano, allora io concludo suggerendo delle ipotesi di lavoro. Primo, io preferirei di
947820	954860	un'autorità indipendente, non al governo, abbiamo tante, alcune anche inutili, uminissimo
955460	964620	creare un'autorità indipendente che esercita un controllo non solo sui bilanci ma sull'attività,
964620	976940	sull'attività delle fondazioni culturali, perché io sono per disboscare il territorio
976940	984580	da finte fondazioni che sono effettivamente segreterie politiche o modalità per aggirare
984580	991160	il problema del finanziamento privato alla politica e quindi l'unico modo di disboscare
991160	996480	è effettuare un controllo, se hai una fondazione culturale cosa fai? Io mi sento di avere le
996480	1002820	carte in regola e credo che sia giusto per preservare chi ha le carte in regola che ci
1002820	1011680	sia un controllo severo. Penso che si debba fare una selezione e che quindi un'autorità
1011680	1018740	indipendente possa avere il compito di creare un albo delle fondazioni che effettivamente
1018740	1027700	svolgono un ruolo di pubblica utilità e ritengo che si debba trovare un modo per facilitare
1027700	1035760	attraverso forme di incentivazione fiscale, il sostegno a queste fondazioni che svolgono
1035760	1041820	un ruolo pubblico, i di compreso il fatto che ci potrebbe essere un fondo creato non
1041820	1050200	dallo Stato ma per esempio dalle fondazioni bancarie che sono fondazioni erogatrici e
1050200	1057680	che spesso erogano contributi non sempre per iniziative così fondamentali, perché
1058260	1065660	magari per ragioni anche comprensibili di rapporto con il territorio, quanti libri d'arte
1065660	1075840	diciamo, si potrebbe pensare che tra le destinazioni e per liberare le fondazioni bancarie per
1075840	1084040	esempio dall'imbarazzo di scegliere organismi di diverso indirizzo politico potrebbe confluire
1084040	1091920	un fondo a cui in ragione delle attività effettivamente svolte o sulla base di criteri
1091920	1097860	che un'autorità indipendente individua le diverse fondazioni di cultura politica possano
1097860	1105920	accedere. Io ritengo che si dovrebbe mettere mano a questa materia con un dubbice intento,
1105920	1114020	con un intento moralizzatore, nel senso di sboscare di ciò che non è fondazione culturale
1114040	1120960	e con l'intento di trovare delle modalità ragionevoli perché questa attività possa
1120960	1128000	continuare, perché io ritengo che sia utile alla democrazia italiana, espressione fuori
1128000	1136660	moda chiedo scusa, è utile al sistema politico, è utile al sistema paese che la politica
1136660	1144020	e la cultura mantengano un rapporto, una dialettica, si arricchiscano vicendevolmente. Grazie.
