start	end	text
0	9500	Se aveste visto il dibattito per le elezioni francesi, era stato cavalcato davvero da Marine Le Pen, è stato vinto da Marine Le Pen.
9900	18380	Quindi bisogna sì parlare, ripensare alla realtà economica dell'Europa, ma dobbiamo anche ripensare ai nostri valori politici, sociali.
18500	25160	Forse dobbiamo tornare indietro e ripensare a cosa vuol dire giustizia sociale nel XXI secolo.
25160	31240	Quindi ora vorrei parlare dell'Eurozona stessa.
32160	36100	Come possiamo avanzare? Come possiamo andare avanti? Qualcuno ha parlato già di questo tema?
36560	38840	Come possiamo ripensare l'Eurozona?
40640	51600	Attualmente l'Eurozona funziona con delle politiche subottimali che devono essere ripensate, ma perché non funzionano?
55460	62160	Visti i problemi della democrazia e i problemi dell'economia europea, noi dobbiamo ripensare le regole.
65620	72700	Dovremo, ad esempio, rendere l'esercizio del semestre europeo con qualcosa che si vada più dal basso verso l'altro e non viceversa.
72780	77240	Dobbiamo ricentralizzare le prese delle decisioni a livello nazionale.
77240	87880	Dobbiamo dare nuova responsabilità alle capitali nazionali, così che possano decidere delle loro politiche,
88560	94840	così che ci possano anche essere dibattiti politici a livello nazionale sul tipo di politiche che vogliono i stati nazionali.
94960	97600	Ma secondo me non dobbiamo ricentralizzare le politiche.
97600	103600	Oltre questo dobbiamo anche completare l'Unione bancaria.
107620	114700	Dobbiamo avere delle idee innovative per il rilancio dell'Europa, ma dobbiamo anche ripensare l'UE.
115020	117460	Come possiamo andare avanti? Come possiamo procedere?
117980	125700	Qui abbiamo già sentito parlare di questo tema e anche negli ultimi mesi abbiamo sentito parlare di cosa è l'UE.
125700	135740	Come farla avanzare, come farla procedere? Si tratterà di un'Europa a più velocità, a due velocità.
136160	142240	Secondo me non solo l'Europa deve essere a più velocità, ma deve essere un'Europa a più cluster.
144280	155120	Dovremo avere dei cluster di vari stati europei, in cui ci sono ad esempio due o tre stati, cluster di due o tre stati membri
155120	161420	che si occupano di sicurezza difesa, oppure potremmo, non so, rinvitare gli inglesi a rientrare.
162040	169220	Schengen potrebbe essere concepito in modo diverso, le politiche sull'asilo potrebbero essere diverse.
169540	176820	Quindi invece di pensare a un'Europa che si basa solamente attorno all'Eurozona,
176820	183560	pensiamo a vari cluster di stati che possono occuparsi di varie questioni.
183700	188880	E poi le istituzioni, le istituzioni che devono essere quelle che gestiscono l'Europa.
189220	193660	Tutti quanti stati membri devono essere impegnati nel dialogo.
194120	201800	I pages possono essere dei stati membri che possono condividere un budget, ci possono essere dei stati membri che hanno un voto
201800	207220	e tutti devono avere la possibilità di sedersi attorno al tavolo dei negoziati e a farsi sentire.
207440	209860	Chiaramente abbiamo bisogno di regole ben precisi.
209960	212960	Ma poi pensiamo al Parlamento.
214880	219680	Non solo dobbiamo avere il Parlamento europeo che viene coinvolto in tutto questo processo,
220580	226900	ma dobbiamo avere non solo il sovranazionalismo,
226900	231900	ma dobbiamo anche avere il contributo dei Parlamenti nazionali all'interno del Parlamento europeo.
232840	242380	Questo è fondamentale perché il popolo è contrario alle istituzioni rappresentate alla rappresentatività.
242840	248900	Ma quello che abbiamo visto nel semestre europeo è che vari processi tecnocratici
252360	258340	si sono allontanati dal sistema attuale della rappresentatività a livello europeo.
258720	264900	E fino a quando non facciamo capire al popolo, ai cittadini, che noi tutti siamo parte dell'Europa,
265260	271900	allora non ci sarà la possibilità di avere un dibattito ampio e siamo aperto a livello nazionale.
271940	274600	Noi dobbiamo convincere il popolo, i cittadini,
275820	279360	che i populisti non sono quelli che gli dicono la realtà.
279640	282540	Come possiamo riprendere noi questo controllo?
282580	285920	Come possiamo noi riprendere il controllo a livello nazionale?
286560	289940	Noi dobbiamo cooperare con l'Europa, a livello europeo.
290040	293800	Questa è la grande sfida che ci troviamo davanti, noi progressisti.
294180	299440	Noi dobbiamo avere dei valori, progressisti positivi, che dobbiamo far valere. Grazie.
303160	308600	Allora, Massimo D'Alema, per le conclusioni avrete notato che vi ho fatto finire tutti molto presto
308600	312400	perché gli organizzatori mi hanno detto che nessuno sarebbe rimasto fino alle 2.
313040	318680	Come abbiamo accorciato tutto di mezz'ora, almeno che D'Alema non sia lunghissimo.
318680	321680	Sì, sì, sì.
325920	326060	Sì.
326820	338400	Sono stato molto contento di quello che Michel-Alain Le Pencolle ha detto su questo movimento che c'è in Germania,
338560	341660	su questa realtà che c'era in Germania.
341680	346960	Io ero una di queste manifestazioni a colonia a favore dell'Unione Europea
348460	356340	e una persona mi ha detto, sono contento che nessun palettito politico sia convolto in queste manifestazioni per Europa.
356820	360460	E questo mostra proprio qual è la crisi dei nostri partiti politici.
360580	367140	Noi sì, dobbiamo impegnarci maggiormente su questo, dobbiamo lavorare maggiormente su questo.
367180	370140	So che Michael sta lavorando in Germania, ma anche in altri paesi.
370500	372960	Sì, sì, anche io ho visto questa stessa esperienza.
372960	380560	Alcuni dei miei amici mi hanno chiesto di fare una piccola presentazione a Sandamensmark a Berlino,
380620	391460	ma gli organizzatori hanno deciso di non invitare alcun politico a queste iniziative pro Europa.
392060	398820	Sono contento perché c'erano molte persone a queste manifestazioni, sono molto sentite queste manifestazioni in Europa,
398820	408260	però molte persone, diciamo, i politici sono visti come un qualcosa di separato da queste manifestazioni.
408360	411820	Questo è un grave danno per noi politici, grazie.
414800	428860	Se posso dire qualcosa, probabilmente anche se avremo bisogno della conferenza di Messina,
429480	436820	che è stata menzionata da altri oratori, dovremo organizzare una conferenza simile per decidere ciò che vogliamo davvero fare.
436820	443180	Ma è importante avere a prima una nuova discussione sulla riforma dei trattati,
443200	451160	dobbiamo davvero definire le priorità dei valori, ma credo che comunque è necessario di produrre qualcosa.
451220	460820	Come Michael ha detto, in un periodo di sei mesi potremmo produrre un libro bianco,
464160	468580	perché questo potrebbe stimolare un ampio dibattito tra i cittadini.
468640	476140	Quello che tu hai detto è assolutamente fondamentale, è vero, abbiamo avuto un problema simile,
478080	488840	abbiamo un grande problema noi in tutti i paesi, che è quello di far capire ai cittadini quali sono le bugie, quali sono le verità.
488840	504840	Questo è un qualcosa che è difficile per noi, perché noi siamo stati educati a pensare che le verità sono più forti delle bugie,
505580	513820	chiaramente, ma dobbiamo far capire ai cittadini, pertanto è molto importante dare una possibilità ai cittadini di condividere una discussione,
513820	517900	di essere impegnati in una discussione aperta. Cosa vogliamo fare insieme?
518120	528580	Mostriamo loro cosa vogliamo fare insieme e organizziamo una specie di stati generali per fare modo che tutti i cittadini partecipino,
529180	532820	per fare modo che ci sia davvero un approccio Potomap.
538740	552780	Potremmo presentare le varie possibilità, le varie scenarie, le persone dovranno anche spiegarci quali sarebbero le situazioni
552780	560180	nella quale decidessero i paesi di rinunciare all'Europa. Dobbiamo far capire loro cosa potrebbe succedere se rinunciassimo all'Europa
560180	573000	e credo che dobbiamo poi far capire ai cittadini che le decisioni vengono prese dagli stati nazionali e dobbiamo far capire anche loro che il trattato ci dà molta flessibilità.
573000	583280	Sì, chiaramente noi abbiamo Schengen, abbiamo tanti benefici che ci sono rivetti all'Europa. Dobbiamo farli capire ai cittadini.
583600	593860	Ovviamente non possiamo accettare che uno o due paesi decidano di impedire la libera circolazione dei cittadini o di sospendere Schengen.
593960	599280	Noi dobbiamo parlare e coinvolgere i cittadini e il Parlamento nazionale. Questo è importantissimo, grazie.
599280	604720	Massimo, sì, se potrei, puoi commentare, ma voglio solo dire qualcosa sulla verità.
604860	610340	Prima di passare la parola a Massimo, vorrei dire qualcosa sulla verità e sulle bugie.
610720	620480	Commetteremo un errore se ci definissimo i detentori della verità contro i populisti.
620480	635480	La verità è che le persone hanno una solta di repulsione verso il sistema, sono infastiditi dal sistema, perché il sistema, la classe politica, ha mentito.
638640	654760	Anche la creazione, l'adesione all'Euro, sono state caratterizzate da bugie, i conti sono stati truccati, le previsioni erano menzogne.
654760	664460	Quindi credete che alcune persone, credete di poter cambiare le cose?
665840	674020	Per farlo, dobbiamo fare in modo di non mentire più. Questo era un commento come giornalista. Via le menzogne.
674400	677060	La parola a Massimo D'Alema.
682980	685020	Giuro di dire la verità.
688560	700160	Innanzitutto voglio ringraziare tutti gli amici, gli intellettuali, le personalità politiche che hanno contribuito a questo seminario
700160	718640	e che hanno sicuramente arricchito la discussione con molte idee che io non voglio naturalmente riprendere, che costituiscono anche uno stimolo.
718640	738560	Per noi, come fondazione europea e per i nostri partners, le fondazioni nazionali per sviluppare e approfondire il lavoro di ricerca, di analisi e di elaborazione di nuove proposte.
738560	752860	Quindi dirò poche alcune cose sul tema che è stato al centro del nostro dibattito.
752860	770580	In modo schematico. Primo, credo che noi non dobbiamo porci sulla difensiva in una posizione di chi deve giustificare.
770580	795580	Noi vogliamo rilanciare e anche introdurre delle coraggiosi riforme, ma vogliamo rilanciare un progetto che ha rappresentato, non solo nella storia europea, ma nella storia dell'umanità, uno straordinario successo.
798580	803580	Che ha determinato irrinunciabili conquiste.
807500	822580	Noi dovremmo solo pensare ad immaginare che cosa potrebbe significare nel mondo di oggi una disgregazione dell'Unione Europea e una regressione dei paesi europei verso il nazionalismo.
826720	843920	Quali rischi di guerra, di conflitti, quale non pericolo, certezza di marginalità dell'Europa un processo di questo genere porterebbe con sé.
843920	867360	Noi non ci dobbiamo giustificare, perché dall'altra parte non c'è un progetto e vengono avanti delle spinte i cui effetti sarebbero catastrofici per il nostro continente e per i cittadini europei.
867360	874660	E io credo che questo debba essere detto, con molta forza.
875260	890880	Abbiamo qualcosa da celebrare, anche se naturalmente abbiamo voluto dare a questa celebrazione il carattere di una riflessione critica e soprattutto di uno sguardo rivolto al futuro.
893880	913520	Io ritengo che questa necessità di guardare ad un'Europa diversa non nasce soltanto o fondamentalmente dai difetti interni, da una crisi interna dell'Europa.
913520	919240	Dobbiamo stare attenti a non avere una visione chiusa.
920440	924820	In realtà noi siamo di fronte ad un mutamento dello scenario mondiale.
927500	945820	Noi avevamo immaginato lo sviluppo del processo di integrazione europea in un mondo in cui la globalizzazione economica si accompagnasse ad un processo di distensione,
945820	971680	di cooperazione pacifica, di progressiva affermazione di nuovi strumenti di governance internazionali, di progressiva affermazione del sistema delle Nazioni Unite e di altre istituzioni.
971680	995640	In questo quadro l'Europa rappresentava un modello di organizzazione sovranazionale e regionale considerata con ammirazione in ogni parte del mondo come un modello.
995640	1014640	Io ricordo quando Lula vinse le elezioni in Brasile, in una sua intervista, lui disse che voglia lavorare per promuovere nell'America del Sud un processo di integrazione che abbia come modello l'esperienza europea.
1016500	1040520	Noi dopo le cose sono state più difficili per loro, ma se lui ha governato, non lo possiamo dimenticare, per lunghi anni e con grandi successi, un processo di trasformazione di quel Paese che ha sottratto alla povertà 40 milioni di persone
1040520	1058000	e che ha cresciuto le classi medie di circa 30 milioni di persone, quindi non è che sia stato lì a trascorrere il tempo, si è avvicinato all'Europa con molta fiducia, ne è rimasto in parte deluso.
1058780	1084220	Una volta mi disse una bellissima battuta, l'Europa è come quelle stelle, le super nove, di cui si continua a vedere la luce, ma non ci sono più. E quando uno si avvicina, si accorge che non ci sono più. Era una battuta molto amara.
1086000	1094660	Potevi dirgli che anche per lui vale a un certo punto? Questa battuta vale anche per lui? Una volta gli avresti potuto fare una telefonata in merito?
1094660	1108420	Non lo so, perché lui ha vissuto una sua stagione, che è stata una grande stagione di trasformazione, di modernizzazione di quel Paese, che rimane per molti aspetti incancellabile.
1111220	1136420	Io credo che il rischio che il Brasile torni indietro è molto forte. E con tutti i problemi che lui ha dovuto affrontare, comprese le accuse personali, è tuttora nei sondaggi il candidato più forte,
1136680	1150760	se si votasse alle presidenziali domani. Vuol dire che nel cuore dei brasiliani è rimasto qualcosa di abbastanza profondo, un'impronta abbastanza significativa.
1151540	1164920	Ma è chiusa questa parentesi. Dicevo, noi ci misuriamo con uno scenario mutato. Viviamo in un mondo non pacificato.
1167440	1187240	La globalizzazione economica, priva di una governance, di una regolazione, priva di un governo politico, ha portato ad una moltiplicazione dei conflitti
1187240	1211220	Il timore che la globalizzazione si traducesse in una occidentalizzazione del mondo ha sollevato una reazione identitaria, perché una parte del fenomeno islamista nasce esattamente da questo,
1211220	1227640	da l'idea di reagire ad una sorta di occidentalizzazione del mondo islamico. Non a caso i testi del fondamentalismo islamico sono uno dei testi fondamentali.
1228480	1241640	Parla dell'Occidente come malattia. C'è una difesa identitaria, ovviamente che avviene in forme inaccettabili, ma c'è un forte elemento di difesa identitaria.
1242840	1267800	E in più, dal punto di vista economico, si sono determinate contraddizioni. Certamente vi è stata anche una grande crescita, interi popoli sono entrati sul mercato mondiale, ma questo è avvenuto in un modo estremamente più contraddittorio, tumultuoso, drammatico di quanto non si potesse prevedere,
1270360	1290800	generando diseguaglianze e elementi di instabilità che non erano stati previsti. E badate che quando si parla, si è parlato molto qui di crisi della democrazia, io penso che la diseguaglianza economica è il principale fattore di crisi della democrazia.
1290900	1318200	Parliamoci chiaro. Quando la concentrazione del potere economico finanziario raggiunge i livelli impressionanti che ha raggiunto in questi ultimi 10-15 anni, cancellando i risultati di un secolo di politiche sociali e redistributive,
1319280	1337700	questo diventa una minaccia per la democrazia, c'è poco da fare. E non è un caso che cresce il fenomeno di una diretta presa del potere politico da parte del potere economico.
1337700	1367380	Non abbiamo vissuto questa esperienza in Italia con Berlusconi, Trump non è un altro esempio. La politica tende verso fenomeni di plutocrazia, si direbbe con una parola arcaica, ma tecnicamente ineccepibile, che sembravano relegati alla realtà di secoli fa.
1370600	1392340	Ora, in questa situazione, e di fronte alla grande crisi del 2008, e alla incapacità di dare una risposta efficace a questa crisi, ma non soltanto, e non mi riferisco soltanto alla capacità di promuovere la ripresa economica in Europa,
1392340	1407700	io mi riferisco al fatto che la crisi finanziaria del 2008 poneva il problema di una nuova governance, e cioè di una regolazione dei mercati finanziari.
1407700	1431880	Mi riferisco alla piattaforma del G20 di Londra, non chiedo delle svolte rivoluzionarie, ma semplicemente ciò che i potenti del mondo promisero in quel momento, e di cui nulla è stato fatto.
1431880	1444860	A partire dalla lotta ai paradisi fiscali, nulla è stato fatto. Perché tutto apparve chiaro in quel momento, ma nulla è stato fatto.
1444860	1468140	Di fronte a questo, io credo che c'è un forte ritorno a questo bisogno di controllo. Il soveranismo, il nazionalismo sono anche una reazione al fallimento di una globalizzazione non regolata.
1469280	1489480	E noi ci troviamo mentre l'Europa era un progetto di sovranazionalità, di fronte ad un prepotente ritorno delle nazioni e delle grandi potenze.
1489480	1506500	Solo che il ritorno della potenza americana, America First, il ritorno della potenza russa, anche per gli errori dell'Occidente, pensate agli spazi che la Russia ha riconquistato sulla scena internazionale.
1506500	1531000	La presenza della grande potenza economica, culturale, militare, cinese, non può essere bilanciata dal ritorno al nazionalismo in Europa. Perché il nazionalismo dei singoli paesi europei è un fenomeno ridicolo di fronte a queste potenze.
1532000	1550920	Nessun paese europeo sarebbe in grado di sedere al tavolo delle potenze. E vorrei anche dire che la difficoltà del rapporto tra Europa e Stati Uniti segna una crisi complessiva del mondo occidentale.
1550920	1566920	Ma voi ci avete pensato che il più grave conflitto oggi in atto nel mondo, che è il conflitto in Siria, che tocca direttamente noi, viene discusso.
1566920	1594900	Cioè, la soluzione la stanno cercando ad Astana, l'Iran, la Turchia e la Russia. È la prima volta, credo negli ultimi due secoli, che avviene un vertice internazionale su un conflitto di portata mondiale e non c'è l'Occidente.
1597980	1611860	Non c'è l'Occidente. Non ci sono gli americani, anche per gli errori che hanno compiuto, e non c'è l'Europa, che ha un interesse vitale alla soluzione.
1614460	1626860	E in tutta la vicenda mediorientale, diciamo, i nazionalismi europei, diciamoci la verità, hanno giocato più per ritagliarsi degli spazi.
1627020	1642020	Ma io penso alla Libia, più per destabilizzare in una logica nazionalistica che non per creare stabilità attraverso un impegno comune dell'Europa.
1644980	1653920	Magari nell'illusione ciascuno di ritagliarsi la propria zona petrolifera, diciamo. Ecco.
1655580	1676920	Allora, siccome questo è il nuovo contesto internazionale, è quello del ritorno ad un mondo delle grandi potenze e non è quello di un appannamento del ruolo delle Nazioni Unite e della governance sovranazionale,
1682660	1698320	io credo che l'Europa deve reagire. E questa è la prima questione. Perché se l'Europa non reagisce a questa situazione e rischia la marginalità, io sono d'accordo.
1698320	1715320	Reagire non significa fare le guerre commerciali, significa semmai chiedere il rispetto delle cose, ma significa sicuramente anche rendersi conto che o c'è un salto di qualità nell'integrazione politica,
1716400	1740320	il che significa che io non sono un teorico delle molte velocità, però io sostengo la necessità di agire. Il problema non è quante sono le velocità, il problema è che non si può stare fermi in un mondo che capre, perché stare fermi è, diciamo, la velocità peggiore.
1742880	1765320	E reagire significa che un gruppo dei paesi europei più importanti, diciamo, più significativi, devono mettere in comune la politica estera, la politica di difesa. Devono metterla in comune, non in contrapposizione con le istituzioni comunitarie.
1765700	1787580	Perché io penso che se un gruppo dei principali paesi europei mette in comune la politica estera e di difesa, questo dà anche più forza all'alto rappresentante per la politica europea. Certo, bisogna approfondire il rapporto tra cooperazioni rafforzate e istituzioni comuni.
1787580	1794580	E' un tema su cui approfondire, anche la nostra riflessione, lo studio, ma si può stare fermi.
1796980	1813160	Io credo che soltanto un'Europa che sia in grado di riproporsi come grande potenza. Scusate questa espressione, questa è una espressione francese, diciamo.
1813160	1835160	Io credo che l'Europa nel mondo di oggi, nel mondo dell'America di Trump, America First, della Russia del nazionalismo assertivo di Putin, nel mondo della grande potenza cinese, o l'Europa è una grande potenza.
1836160	1851340	E per affermarsi come potenza l'Europa non può affidarsi al nazionalismo dei singoli paesi europei. Una grande potenza coerente con i suoi valori.
1851340	1864340	Quindi, in questo senso, una grande potenza che deve giocare la sfida non della chiusura, ma del dialogo, della costruzione della pace, della difesa dei diritti umani.
1865140	1876340	Però noi sappiamo che senza la forza questi valori rimangono una pura predicazione. E questo è il primo problema, il problema politico.
1876340	1900420	La sinistra ha una forte torsione economicistica, ma non perché voglio sottovalutare gli aspetti economici, ma perché penso che noi dobbiamo anche riprendere in mano un grande progetto politico, che in prospettiva è un progetto federalista.
1905220	1919680	Ma innanzitutto comporta una cooperazione rafforzata nel campo della politica estera, nella politica di difesa, tra i paesi che sono pronti a farlo.
1919680	1922000	Perché se noi ci raccontiamo...
