start	end	text
1670630	1672670	Gli operai di crotone sono stati
1672670	1675230	diffamati dal Corriere della Sera,
1675830	1678330	perché non è vero che essi difendono
1678330	1680550	necessariamente quel posto di lavoro
1680550	1683750	improduttivo. Al contrario, sono due
1683750	1685890	anni che il sindacato, la sinistra, gli
1685890	1689650	operai di crotone, chiedono di discutere
1689650	1693130	investimenti produttivi alternativi.
1693470	1697210	Chiedono ad una città dove c'è il 30%
1697210	1701830	di disoccupazione la garanzia di una
1701830	1703770	speranza di lavoro di fronte al fatto
1703770	1705630	che probabilmente certe aziende o
1705630	1707530	certe produzioni dovranno essere chiusi
1707530	1709430	a essere dimensionati. Questa è la
1709430	1712690	verità sugli operai di crotone. Non che
1712690	1715330	difendono il vecchio stato assistenziale,
1716130	1717790	difendono il diritto ad avere una
1717790	1719870	speranza di lavoro e di sviluppo per un
1719870	1722970	area del mezzogiorno. Allora, io dico
1722970	1724950	questo, non si risolve con la
1724950	1727130	bacchetta magica il problema dell'occupazione,
1727910	1731150	ma certamente oggi occorre un potere
1731150	1735330	politico forte, non che gestisca e faccia
1735330	1738330	dell'assistenzialismo, ma che governi
1739010	1740790	un processo di riorganizzazione
1740790	1743270	produttiva, di rilancio degli
1743270	1746530	investimenti qualificati nei settori
1746530	1749630	più avanzati, un governo che faccia
1749630	1751850	dell'innovazione e della ricerca un
1751850	1754970	volano della riconversione produttiva, un
1754970	1757270	governo che assuma il tema dell'ambiente
1757270	1759510	della riconversione ecologica dell'economia
1759510	1761750	come una grande possibilità di lavoro,
1762670	1765670	un governo che metta a mano ad una
1765670	1767750	ricostruzione democratica del Paese,
1769930	1773110	che non metta in svendita l'Italia,
1773530	1775290	perché qui noi vediamo a rischio non
1775290	1776750	solo posti di lavoro assistiti,
1778010	1779990	pensiamo alla vicenda del nuovo Pignone,
1780590	1782130	che è un'azienda d'avanguardia, che è
1782130	1785170	un'azienda produttiva e competitiva, ma
1785170	1787750	in quale Paese del mondo le
1788930	1791170	privatizzazioni si sono fatte come in un
1791170	1794870	su carabò, mettendo le imprese sulle
1794870	1797490	bancarelle e aspettando che arrivi quello
1797490	1800770	che offre di più. In Inghilterra la
1800770	1804170	signora Thatcher, quando ha privatizzato,
1805310	1807150	ha fatto una legge, quella sulla Golden
1807150	1811050	Share, che nelle aziende di interesse
1812610	1814670	nazionale riservavano alla proprietà
1814670	1817530	pubblica che rimaneva in minoranza, ma
1817530	1820390	rimaneva il diritto di veto sulle
1820390	1823590	decisioni di carattere strategico. In
1823590	1826390	Francia, quando hanno privatizzato, il
1826390	1828910	governo ha deciso dall'alto i cosiddetti
1828910	1831030	noccioli duri, cioè chi dovevano essere
1831030	1835450	i gruppi che controllavano le imprese. E
1835450	1838510	figuriamoci se in un Paese come la Francia
1838510	1840970	danno un'azienda leader nelle mani del
1840970	1843870	loro concorrente straniero. Sarebbe
1843870	1850530	questa la modernità dell'Italia. Questa
1850530	1853750	è una borghesia stracciona. Ecco, questa
1853750	1857250	è la verità. Nei grandi Paesi europei
1857250	1859530	non si è proceduto così. Ecco perché
1859530	1861850	noi non siamo i difensori del vecchio
1861850	1864770	assistenzialismo, ma vogliamo governare
1864770	1867770	un processo di modernizzazione del Paese
1867770	1871010	che tuttavia difenda e rilanci le basi
1871010	1873130	produttive fondamentali dell'Italia,
1873630	1875670	che crea nuove occasioni di lavoro
1875670	1880490	nell'ambiente, nel recupero delle città,
1880710	1883330	dei centri storici, in una politica di
1883330	1886350	trasporti pubblici. Questo è il punto.
1886550	1888990	In una politica delle telecomunicazioni
1888990	1894330	qui c'è, diciamo, l'alternativa. Tra un
1894330	1897670	liberismo selvaggio che fa pagare ai
1897670	1900390	lavoratori e alle nuove generazioni il
1900390	1902610	posto dello sfascio del vecchio regime
1902610	1904590	e una politica di ricostruzione
1904590	1906550	democratica che certo deve passare
1906550	1909330	attraverso anche sacrifici, rigore,
1910170	1911730	perché quello che hanno fatto ha
1911730	1915150	lasciato guasti profondissimi, ma che
1915150	1918410	assuma il lavoro e l'occupazione come
1918410	1922010	obiettivo centrale. Può essere un
1923050	1926590	interlocutore della sinistra e del PDS o
1926590	1931310	no? Prima, la risposta che la darò
1931310	1934210	certo a me, però prima ti hai fatto
1934210	1938590	un escursus su Camper. Io non ho mai
1939590	1942170	accettato volentieri di essere chiamato
1942170	1948070	antisocialisti, perché penso, e non è una
1948070	1951630	facile battuta, che i veri antisocialisti
1951630	1964990	erano loro. E continuo a pensare che per
1964990	1968790	l'avvenire della sinistra italiana c'è
1968790	1972910	bisogno di una tradizione, di una cultura
1972910	1976130	socialista e riformista. Anche è una delle
1976130	1978630	componenti importanti della sinistra
1978630	1981330	italiana. E spero che il Partito
1982030	1984950	Socialista si liberi dal retaggio del
1984950	1988690	craxismo, che non è solo la corruzione e
1988690	1992110	anche la subalternità ai moderati. È
1992110	1994630	quella coazione a ripetere che fa sì
1994630	1996530	che del turco, un giorno sì, un giorno no,
1996730	1998330	dica male di Occhetto e dica bene di
1998330	2001630	Martinazzoli, diciamo. È questa
2003050	2006070	subalternità ai moderati che ha
2006070	2009070	presentato, a mio giudizio, la distorsione
2009750	2011690	e la ragione di una sconfitta del
2011690	2016550	Partito Socialista. Ed è anche vero che,
2016690	2018550	magari meritandomi la fama di essere
2018550	2022130	settario, nei tempi in cui noi rischiavamo
2022130	2024430	di dividerci tra filo socialisti e filo
2024430	2026950	democristiani, io ho sempre cercato di
2026950	2029750	essere filo PC, persino quando questa
2029750	2031930	tendenza rischiava di essere minoranza
2031930	2035010	in mezzo a noi, diciamo. Nel senso di
2035010	2038890	di mettere l'accento su quello che
2038890	2040910	potevamo dare noi a un processo di
2040910	2044870	trasformazione del Paese. Detto questo,
2045150	2048910	ora sono cambiate molte cose. Io ci
2048910	2053230	tengo a dirlo, ma quando Craxi è caduto
2053230	2058030	in disgrazia, io ho smesso di attaccarlo
2058850	2063110	perché non ho nessuna simpatia verso
2063110	2067410	quella borghesia italiana che è servile
2067410	2070970	verso i potenti e che è vile verso
2070970	2073110	quelli che cadono in disgrazia.
2076310	2082010	Nessuna simpatia. Oggi si pongono altri
2082950	2085110	problemi. Poi magari possiamo ragionare
2085710	2089110	sul perché Craxi è stato sconfitto e
2089110	2092550	su quanto in questo abbia inciso la
2092550	2097490	nostra svolta. Ora, noi abbiamo il
2097490	2099710	problema innanzitutto in questo Paese di
2099710	2103010	costruire uno schieramento di sinistra e
2103010	2106130	progressista credibile per governare
2106130	2110870	l'Italia. Questo è il problema. Questo lo
2110870	2118550	si fa anche mantenendo una corrente di
2118550	2120750	soldi verso il travaglio del mondo
2120750	2126430	cattolico. Il mondo cattolico è in Italia
2126430	2131070	un patrimonio straordinario per la sua
2131070	2135250	ricchezza culturale, per le radici
2135250	2137830	profonde che ha nella società italiana,
2139370	2142470	per la forza delle realtà associative,
2144170	2147170	per la grande idealità che spesso anima
2147170	2150950	questi gruppi, queste associazioni. E una
2150950	2153070	sinistra che non guardi al mondo
2153070	2157590	cattolico in Italia sarebbe una sinistra
2157590	2162850	secondo me senza prospettiva. Martinazoli
2162850	2164170	sta tentando di fare un'operazione
2164990	2168030	ambiziosa ma carica di ambiguità.
2169170	2173550	Ricostruire un partito cattolico magari
2173550	2175870	più piccolo della democrazia cristiana,
2175870	2180270	ma sempre un partito che ha la pretesa
2180270	2182830	di tenere insieme i conservatori e i
2182830	2187610	progressisti e quindi di mantenere al
2187610	2190910	centro della politica italiana quell'equivoco
2190910	2193550	dell'unità dei cattolici che a mio
2193550	2197130	giudizio è qualcosa che appartiene alla
2197130	2200770	storia passata dell'Italia e che non può
2200770	2203430	appartenere alla storia futura del nostro
2203430	2208430	Paese. Per questo noi diciamo, noi non
2208430	2212270	siamo disponibili ad un'alleanza con
2212270	2214450	questa democrazia cristiana o con questo
2214450	2216950	partito popolare che tiene in piedi
2216950	2222130	questa ambiguità, ma dentro quel mondo ci
2222130	2226990	sono forze, personalità, gruppi che
2226990	2229310	domani possono essere alleati della
2230370	2233310	sinistra. E il modo migliore per favorire
2233990	2237070	quella separazione fra progressisti e
2237070	2239330	conservatori nel mondo cattolico che è
2239330	2242490	essenziale per l'Italia, il modo migliore
2242490	2244230	è quello di uscire da una logica
2244230	2248210	consociativa, perché se noi invece
2248210	2251590	cedessimo all'idea oggi di una intesa
2251590	2257350	fra noi e la DC, l'idea di Rosi Bindi o
2257350	2260350	forse anche l'idea carezzata da segni,
2261630	2265430	questo secondo me non aiuterebbe la DC
2265430	2268290	ad uscire dalle sue ambiguità e aprirebbe
2268290	2270470	la strada ad una vittoria della Lega,
2270850	2272730	perché apparirebbe come il patto dei
2272730	2276270	vecchi partiti contro la Lega. Per cui
2276270	2279150	nessuna alleanza con una democrazia
2279150	2281210	cristiana che reste del proletariato,
2281310	2282930	cioè non è uno che abbia portato i soldi
2282930	2286570	al partito e che lo neghi per difendere
2286570	2290370	in onore del partito. Io voglio dire una
2290370	2295790	cosa, noi siamo impegnati, io trovo un po'
2295890	2303130	come dire bizzarro, perché con un minimo
2303130	2309410	di onestà intellettuale, minima, nel
2309410	2312670	momento in cui oramai si è scoperchiato
2312670	2314330	una parte non piccola di questa
2315850	2318570	tangentopoli, nel senso che hanno
2318570	2321170	parlato centinaia di imprenditori,
2321370	2325590	grandi, piccoli, medie, ed è venuto alla
2325590	2327590	luce già un giro di almeno 2 mila
2327590	2334330	miliardi di tangenti. Beh, il fatto che il
2334330	2337110	coinvolgimento del PDS, a parte episodi
2337110	2341630	locali di persone, laddove la magistratura
2341630	2344290	mi ha portato alla luce fenomeni di
2344290	2346150	corruzione che avevano inquinato il
2346150	2349290	nostro partito, non è vero che noi,
2349610	2351690	perché si dice quando toccano voi
2351690	2353310	protestate, no, a Milano non abbiamo
2353310	2355590	mica protestato, li abbiamo cacciati via.
2359810	2363230	E anche in altre realtà, certo abbiamo
2363230	2365050	protestato quando ci hanno arrestato un
2365050	2367630	sindaco per scoprire il giorno dopo che
2367710	2370310	i soldi li avevano pesi gli altri, certo.
2372190	2376710	Ma al di là, ripeto, di questi episodi
2378570	2382070	il coinvolgimento del nostro partito
2382070	2384010	come struttura nazionale in
2384010	2389090	Tangentopoli ruota esclusivamente,
2389810	2392910	mentre le autorizzazioni a procedere per
2392910	2395430	Craxi riguardano oramai circa 80
2395430	2397710	miliardi che gli avrebbe personalmente
2397710	2402030	preso, il coinvolgimento di questo grande
2402030	2405430	partito in Tangentopoli ruota intorno al
2405430	2408430	fatto che un certo signor Panza Volta
2409130	2412610	avrebbe dato 600 milioni aggreganti.
2412970	2416650	E basta, perché non c'è altro.
2417390	2420370	L'avviso di garanzia al nostro tesoriere,
2421170	2424430	peraltro non fondato su alcun elemento
2424430	2428390	probatorio, né testimoniale, nel senso
2428390	2430430	che Stefanini è l'unico uomo politico
2431110	2432830	che ha ricevuto un avviso di garanzia
2432830	2435210	senza che nessuno abbia detto, non dico
2435210	2437310	ho dato i soldi a Stefanini, ma neanche
2437310	2441510	gli ho telefonato. E infatti non hanno
2441510	2443090	mandato ancora l'autorizzazione a
2443090	2445770	procedere, perché considerano giustamente
2445770	2449190	insufficiente questa base probatoria, ma
2449190	2451350	l'avviso di garanzia a Stefanini ruota
2451350	2454670	intorno al fatto se noi abbiamo avuto o
2454670	2458210	no questi 600 milioni, mentre non fa più
2458210	2460410	notizia, diciamo, le centinaia di
2460410	2462990	miliardi che si sono spartiti gli altri.
2463750	2471130	Ora, io capisco, capisco diciamo, c'è un
2471130	2473310	lato cattivo, c'è un lato cattivo ed
2473310	2478270	evidente l'interesse di forze politiche,
2478270	2481690	di forze economiche a coinvolgere il
2481690	2483250	più grande partito della sinistra in
2483250	2486270	tangente opere. È evidente l'insofferenza
2487010	2489590	di gruppi di potere per il fatto che
2489590	2491830	questa vicenda giudiziaria travolge una
2491830	2493570	classe dirigente e lascia in piedi il
2493570	2495330	più grande partito dell'opposizione.
2495830	2503750	È come dire, lo capisco. È un
2504990	2506890	sentimento comprensibile, tuttavia
2506890	2509230	insufficiente a tradursi in arresti,
2509430	2511210	diciamo, i sentimenti, ci vogliono le
2511210	2514810	prove, ecco. E poi forse c'è persino un
2514810	2517690	lato buono, cioè come dire, gli altri
2517690	2520570	erano ladri e vabbè questi sono persone
2520570	2523390	perbene, quindi i 600 milioni che forse
2523390	2526410	ha preso il PDS fanno più notizia delle
2526410	2528370	centinaia di miliardi degli altri,
2528550	2532550	pigliamola per buona. Tuttavia, insisto,
2532710	2535190	noi non abbiamo preso questi 600 milioni.
2535190	2538570	Io, dato che questa vicenda che è l'unica
2538570	2542150	che ci tormenta oramai da mesi sulla
2542150	2544190	quale si sono scritti fiumi di inchiostro,
2545010	2548130	di editoriali, di interviste, diciamo, è
2548130	2551510	una storia, è un giallo che appassiona
2551510	2554950	il Paese, io credo, come certi... sì,
2555070	2558230	perché a questo punto anch'io ho la
2558230	2560810	curiosità di capire come può essere
2560810	2565270	andata questa misteriosa vicenda. E
2565270	2567730	chissà se la Procura di Milano mi
2567730	2569690	desse l'incarico, potrei svolgere delle
2569690	2574290	indagini. E forse io dico, io ho un
2574290	2577230	vantaggio, perché siccome so che la pista
2577230	2580090	sulla quale lavorano loro è una pista
2580090	2583090	che non conduce da nessuna parte, potrei
2583090	2585410	cominciare a muovermi su altre piste.
2586310	2588350	Adesso non voglio tediare la gente,
2588350	2591070	perché ovviamente la curiosità mi ha
2591070	2593430	portato ad approfondire questa vicenda.
2594570	2597350	Ma, insomma, se io fossi un magistrato,
2599290	2601150	come ve ne sono di molto capaci a
2601150	2604690	Milano, che tuttavia si sono occupati di
2604690	2607490	altre cose e che spero che possano
2607490	2609610	occuparsi con maggiore attenzione di
2609610	2611930	questa vicenda, noi abbiamo interesse
2611930	2613930	che la magistratura scopra la verità.
2614890	2617210	Io comincerei a pormi alcuni
2618690	2620890	interrogativi. E io elenco solo gli
2620890	2626290	interrogativi. Cioè, Greganti era, perché
2626290	2629210	questa è l'ipotesi accusatoria, il
2629210	2633910	raccoglitore di tangenti per il PC, è
2633910	2638610	stato scritto il citaristi del PC, ma se
2638610	2642630	fosse stato così, dopo che centinaia di
2642630	2645330	imprenditori hanno confessato che ne
2645330	2649770	sarebbero stati 10, 15, i quali
2649770	2651730	avrebbero detto abbiamo dato soldi
2651730	2655170	aggreganti. Citaristi, che era il
2655170	2657930	citaristi della DC, ha 41 avvisi di
2657930	2661790	garanzia. E cioè, ad ogni...
2661790	2664870	Siamo a 50. Siamo, credo, a 50, ma
2664870	2667670	poveretto, un'ottima persona, arriverà a
2667670	2671570	60. Cioè, era un sistema. Ogni appalto
2671570	2674290	lui passava e pigliava i soldi. Cioè,
2674290	2680550	era un sistema. Ora è pensabile, ecco,
2680650	2682670	va bene, noi eravamo meno potenti della
2682670	2686630	DC, ma è pensabile che il citaristi del
2686630	2690290	PC avrebbe aperto tre conti in Svizzera
2691750	2694810	soltanto per estorcere 600 milioni a un
2694810	2696990	certo panzavolto. Sono sfigato questo
2696990	2702070	panzavolto. Una vittima. Cioè, noi non
2702070	2704310	abbiamo chiesto soldi a De Benedetti,
2704550	2705930	noi non abbiamo chiesto soldi a
2705930	2707750	Dagnelli, noi non abbiamo chiesto soldi
2707750	2709470	a Berlusconi. Lo dicono loro, non credo
2709470	2711550	che ci proteggano. Noi non abbiamo chiesto
2711550	2713590	soldi a Lodigiani, non abbiamo chiesto
2713590	2715930	a Ligresti, a nessuno. Non abbiamo
2715930	2718610	disturbato nessuno, solo stupanzavolta.
2719650	2722850	È un complotto, è un'aversione
2722850	2726470	personale, ma è possibile che i magistrati
2726470	2728910	non sospettino che questa vicenda, proprio
2728910	2731910	nella sua singolarità, deve poter
2732510	2736210	avere un'altra spiegazione. Poi avanza
2736210	2738470	un altro. Io ho letto tutte le carte
2738470	2739910	perché in Italia, come noto, il segreto
2740870	2743990	istruttore è stato abolito e quindi si
2743990	2747710	legge tutto sui settimanali. E allora mi
2747710	2749190	sono chiesto, i magistrati mi avranno
2749190	2751170	chiesto a questo panzavolta, ma lei come
2751170	2753050	mai ha dato questi soldi aggreganti?
2754950	2757750	Perché la risposta di panzavolta, che lui
2757750	2760130	abbia dato i soldi aggreganti per
2760750	2763030	influenzare, per avere l'appoggio del
2763030	2766930	nostro partito, perché la sua impresa
2766930	2768270	avesse l'appalto per la
2768270	2770990	desolforazione, è un falso clamoroso.
2772790	2775530	Perché quegli appalti erano stati
2775530	2779570	assegnati tre anni prima, tre anni
2779570	2782190	prima che la tangente fosse pagata.
2783290	2786130	Quindi, diciamo, la motivazione della
2786130	2788350	corruzione, cioè ti do i soldi, tu mi
2788350	2793350	dai l'appalto, è manifestamente falsa.
2793950	2797470	E allora perché? Infatti gli hanno chiesto
2797470	2801330	chi le ha presentato Greganti, chi le ha
2801330	2803890	garantito che Greganti era il tramite con
2803890	2806930	il partito comunista. E panzavolta ha
2806930	2809630	dato una risposta che io, conoscendo un
2809630	2811650	po' il PC, se fossi un magistrato avrei
2811650	2814150	fatto un salto sulla sedia. Ha detto, è
2814150	2819370	stato l'onorevole Balsamo. Allora io
2819370	2822650	conosco il PC, poi all'epoca ero il
2822650	2824150	capo del direttore generale, responsabile
2824890	2827750	dell'ufficio di segreteria. Mi metto nei
2827750	2832570	miei panni. Cioè, noi abbiamo
2832570	2834290	licenziato Greganti, perché l'avevamo
2834290	2836790	licenziato. Tanto è vero che la signora
2836790	2838610	Parenti dice sì, ma l'avete fatto
2838610	2840370	apposta per creare una struttura
2841130	2844010	clandestina, per prendere le tangente.
2844010	2847390	Allora io, licenzo Greganti, creo una
2847390	2849750	struttura clandestina per prendere le
2849750	2851290	tangenti e lo mando a prendere le
2851290	2853130	tangenti d'accordo con Balsamo.
2854490	2856630	Sinceramente, diciamo, soltanto uno
2856630	2858750	stupido può pensare che questa cosa
2858750	2861930	abbia un minimo di fondatezza. Allora
2861930	2863890	perché io richiamo questi fatti,
2864090	2865870	facendo anche un po' il mio mestiere di
2865870	2869870	giornalista? Perché questa vicenda si
2869870	2871870	presenta in una forma talmente
2873910	2875870	incredibile, talmente paradossale,
2876710	2879210	talmente fragile, che la verità
2879210	2881190	deve essere un'altra. C'è questa partita
2881190	2883150	sulla tassa del medico di famiglia,
2883190	2885350	che non è chiusa e che non si sa
2885350	2889750	quando si chiuderà. Ecco, rispetto a
2889750	2896050	questi elementi, l'astensione del
2896990	2900790	PDS al governo non è da rimettere in
2900790	2904950	questione, oppure comunque sia la
2904950	2906930	questione della legge elettorale e
2906930	2909930	poi dei successivi accorgimenti
2909930	2914830	tecnici impone comunque di garantire
2914830	2916470	ancora questo atteggiamento di
2916470	2919050	astensione al governo? Io non vedo,
2919130	2920790	parto da quest'ultima questione,
2921590	2923190	secondo me non c'è questione di
2923190	2926710	astensione o non astensione. Noi ci
2926710	2930770	siamo astenuti nella fiducia al
2930770	2931370	governo per le ragioni che ho
2931370	2933590	detto, un governo di garanzia e di
2933590	2935850	transizioni per votare dopo la
2935850	2942990	nuova legge elettorale. Adesso che
2942990	2946050	significato avrebbe? In che modo si
2946050	2947610	dovrebbe manifestare il fatto che
2947610	2950270	noi ritiriamo l'astensione? Cosa
2950270	2951790	dobbiamo chiedere? Una crisi di
2951790	2954870	governo? Adesso? Magari perché ci
2954870	2956850	fanno un nuovo governo peggiore di
2956850	2958750	questo per evitare le elezioni? Io
2958750	2961970	non vedo il senso politico. Noi ci
2961970	2963670	siamo astenuti nella fiducia al
2963670	2966490	governo, ma questo non è che ha
2966490	2968570	vincolato in alcun modo l'autonomia
2968570	2969750	delle nostre posizioni politiche.
2970610	2972110	Tanto è vero che abbiamo votato
2972110	2973790	contro diversi provvedimenti del
2973790	2976070	governo, su altri abbiamo votato a
2976070	2977850	favore, cioè abbiamo valutato nel
2977850	2979510	merito le questioni, ma non è che
2979510	2982070	siamo entrati in una maggioranza o
2982070	2985310	abbiamo vincolato. Il problema è
2985310	2986970	un altro, il problema non è se noi
2986970	2989630	ritiriamo l'astensione, noi diciamo
2989630	2991670	che questo governo, dopo la
2991670	2993250	finanziaria, dopo gli adempimenti, se
2993250	2994370	ne deve andare, se deve andare alle
2994970	2997770	elezioni e non vedo veramente utilità
2997770	2999630	di fare crisi di governo in questo
2999630	3001590	momento, per fare nuovi governi,
3001730	3003690	magari dicendo gli adempimenti non
3003690	3005050	sono ancora compiuti, solo
3005050	3008650	pasticci che... Quindi il problema
3008650	3012230	vero è quale finanziaria si fa? Il
3012230	3013590	governo ha presentato una sua
3014330	3015970	proposta e noi presentiamo
3016050	3018850	delle nostre proposte e faremo una
3018850	3021370	battaglia parlamentare. Il problema
3021370	3023090	vero, la questione si sposta sul
3023090	3027410	merito delle scelte e noi siamo
3027410	3029610	abbastanza critici verso la proposta
3029610	3033850	di legge finanziarie. Per tanti
3033850	3036850	aspetti, ma io voglio sottolineare
3036850	3038790	quello che a mio giudizio è il più
3040050	3043250	rilevante e cioè un impegno
3043250	3045670	assolutamente inadeguato per
3045670	3046770	fronteggiare il dramma della
3046770	3050850	disoccupazione. Questa è la critica
3050850	3053430	di fondo che noi muoviamo alla legge
3053430	3056430	finanziaria e cioè una legge
3056430	3060590	finanziaria che ancora è ispirata ad
3060590	3063670	una filosofia di politica economica
3064610	3067210	secondo cui è sufficiente contenere il
3067210	3070030	debito pubblico e ridurre il costo del
3070030	3072670	denaro, due cose certamente importanti,
3072670	3075670	ma per garantire di per sé una ripresa
3076970	3078850	e io non credo che le cose stiano
3078850	3081670	così, cioè io penso che senza
3083490	3086850	investimenti pubblici qualificati e
3086850	3089030	senza un impegno dall'alto per
3089030	3091890	rilanciare l'economia non basterà
3091890	3093990	ridurre il costo del denaro perché
3093990	3097670	riparta l'economia e l'occupazione e
3098210	3100010	quindi innanzitutto su questo sfideremo
3101010	3103430	con proposte concrete, stiamo lavorando
3103430	3105070	a definire quello che chiamiamo un
3105070	3109010	piano per il lavoro, che sarà la
3110150	3112450	questione fondamentale che porremo nel
3112450	3115130	dibattito sulla finanziaria. Poi ci sono
3115130	3118790	altri aspetti che riguardano la
3118790	3121290	manovra fiscale, i tagli, la qualità dei
3121290	3124550	tagli, qui ci sono anche dei punti
3126190	3128650	positivi. Questo governo si impegna a
3128650	3131830	restituire ai lavoratori almeno in parte
3131830	3135330	i soldi del drenaggio fiscale, questo è
3135330	3138710	un fatto positivo, che restituirà ai
3138710	3142730	lavoratori 1.200 miliardi. Il governo
3143570	3146350	intende abolire, diciamo, togliere dal
3146350	3149670	pagamento IRPF la prima casa, se ha un
3149670	3152610	rendimento catastale, diciamo, non di
3152610	3155470	case di lusso, si tratta di vedere in
3155470	3157110	che modo si fa questa operazione, sono
3157110	3158470	tutti dei problemi tecnici, ma insomma
3158470	3162930	l'idea è giusta. Il governo intende
3164210	3167550	anche varare una politica di risparmi
3167550	3170850	sulle spese dei ministeri per beni e
3170850	3174090	servizi, anche attraverso la revisione
3174090	3177230	di contratti in essere, e questo può
3177230	3179350	sembrare un discorso tecnico, ma invece
3179350	3182270	è una cosa giusta e importante, perché
3182270	3184170	una delle ragioni che hanno fatto
3184170	3187390	di evitare la spesa pubblica in Italia
3187390	3190970	sta nel fatto che lo Stato, quando
3190970	3196110	compra un bene, per esempio i computer, o
3196110	3198490	quando finanzia un'opera pubblica in
3198490	3203490	Italia, li paga molto di più di quanto
3203490	3206990	non paghino le altre nazioni europee,
