start	end	text
3207710	3209210	una delle ragioni l'abbiamo scoperta,
3209310	3210830	se l'avete capito che non erano i
3210830	3214670	padroni che pagavano le tangenti, era
3214670	3217550	una partita di giro, davano un tot
3217550	3220110	ai politici e poi si rifacevano con gli
3220110	3222090	aumenti dei prezzi, quindi pagavate voi
3222090	3225630	anche le tangenti avete pagato, quelle
3225630	3228250	sulle medicine come quelle sulle
3228250	3232910	autostrade, e quindi mettere mano,
3232910	3234830	diciamo, nella spesa per beni e servizi
3236010	3237830	per colpire delle rendite
3238830	3240970	intollerabili è un'operazione giusta,
3241810	3244770	io lo dico perché bisogna valutare
3244770	3247410	anche con onestà intellettuale
3247410	3249610	quello che c'è di buono e poi di
3249610	3254330	negativo, io considero inquietante il
3254330	3259230	capitolo delle pensioni anche per il
3259230	3264970	costo sociale che ha, ancora confuso e
3264970	3269270	per certi aspetti negativo il capitolo
3269270	3272370	della sanità, perché non si ha il
3272370	3275210	coraggio di affondare il bisturi, in
3275210	3278510	senso proprio qui, nello spreco
3278510	3283470	farmaceutico e nella sanità privata e si
3283470	3286190	continua invece ad imporre balzelli ai
3288290	3291970	cittadini, pare che la tassa sul medico
3292150	3297330	venga prorogata al 31 ottobre e venga
3297330	3300070	annullata per l'anno prossimo.
3300890	3302510	La politica internazionale, il contributo
3302510	3305890	che la sinistra italiana e il PDS, il
3305890	3308290	partito che tu rappresenti, possono
3308290	3311310	svolgere in questo mondo dilaniato dalle
3311310	3314790	guerre, spesso guerre fratricide e che
3314790	3317150	non sembra, salvo casi eccezionali come
3317150	3319110	appunto questo di oggi che salutiamo, io
3319110	3322110	ho sentito questo applauso sgorgato
3322990	3325030	spontaneamente dalla Genita, cosa si
3325030	3329790	può fare per riuscire veramente a dare
3329790	3331590	un contributo a una pacificazione di
3331590	3334310	questo continente? Ricordo Enrico
3334310	3337470	Berlinguer che concluse un festival
3337470	3339070	proprio qui in Toscana, un festival
3339070	3340370	nazionale dell'unità, quello di
3340370	3343130	Tirrenia, con una parola d'ordine e
3343130	3344750	questa parola d'ordine era prima di
3344750	3351510	tutto la pace. Ecco dico, vale ancora
3351510	3353910	oggi? E in che senso?
3354850	3361670	Io intanto dico che oggi è veramente
3361670	3365370	una grande giornata, anche se noi
3365370	3368070	sappiamo che poi il cammino della
3368070	3372050	costruzione della pace potrà essere
3372050	3375010	difficile e potrà anche conoscere
3375010	3379090	momenti drammatici, tuttavia quello che
3379090	3384810	è accaduto oggi apre secondo me un
3384810	3388710	processo non reversibile e bisogna far
3388710	3394450	sì che non sia reversibile e ritengo
3394450	3396530	un processo destinato ad avere un
3396530	3400090	grandissimo valore nel mondo arabo e
3400090	3404090	nel mondo mediterraneo, perché il
3405810	3409090	conflitto tra israeliani e palestinesi
3410090	3414690	ha contrapposto due popoli che per
3414690	3418090	tante ragioni della storia rappresentano
3418770	3422550	in quella parte del mondo il meglio che
3422550	3426470	c'è. I palestinesi sono la parte più
3426470	3429810	rivoluta, più laica, più cosmopolita
3429810	3434450	del mondo arabo. Il loro destino di
3434450	3438470	popolo costretto alla diaspora, come gli
3438470	3442170	ebrei per altro aspetto, ne ha fatto un
3442170	3448730	popolo aperto, tollerante, colto e la
3448730	3452150	presenza di una nazione palestinese può
3452150	3454910	essere un grande fattore di crescita
3454910	3459190	civile per tutto il mondo arabo. E
3459190	3462670	dall'altra parte c'è il popolo israeliano,
3464990	3468790	ne conosciamo la storia, straordinaria,
3469030	3473230	terribile e apprezziamo il coraggio di
3473230	3475770	chi ha saputo scegliere la via della
3475770	3481090	pace. Io voglio dire, perché è giusto
3481090	3485470	dirlo, quello che accade è anche un
3485470	3487910	successo della sinistra e dei
3487910	3492590	democratici italiani. Pochi paesi come
3492590	3496410	l'Italia e poche forze politiche come
3496410	3500090	prima il PC, poi il PDS, hanno lavorato
3500930	3504770	perché avvenisse questo incontro, hanno
3504770	3509310	mantenuto aperto un dialogo col mondo
3509310	3512750	israeliano e col mondo palestinese, hanno
3512750	3515270	cercato di ritessere le fila, quanto era
3515270	3518270	difficile quando noi nelle nostre feste
3518270	3521790	dell'unità invitavamo allo stesso tavolo
3521790	3524690	il pacifista israeliano e l'intellettuale
3524690	3529970	palestinese, perché noi che pure abbiamo
3529970	3532310	sostenuto la lotta del popolo palestinese
3533250	3536250	non abbiamo mai accettato né condiviso
3536250	3538130	l'idea che questa lotta dovesse essere
3538130	3541590	rivolta a distruggere Israele, abbiamo
3541590	3543710	sempre detto che doveva essere la
3543710	3546150	lotta per costruire la convivenza fra
3546150	3549490	due popoli e abbiamo lavorato perché
3549490	3552270	potesse esservi il dialogo fra due
3553210	3556930	popoli. Vedete dicono che destra e
3556930	3561610	sinistra sono due parole prive di senso
3562610	3566790	eppure quella pace l'ha costruito la
3566790	3569990	sinistra. Quella pace è stata possibile
3569990	3572470	anche perché in Israele ha vinto la
3572470	3576670	sinistra e non le forze oltranziste e
3576670	3579650	nazionaliste, che non avrebbero fatto la
3579650	3590250	pace. E lo dico anche ad una certa
3590250	3594050	sinistra settaria, che ci dicevano
3594050	3595050	voi volete andare nell'internazionale
3596670	3598690	socialista insieme ai laboristi
3598690	3601050	israeliani come se ci si contaminasse
3602270	3604270	poi ci siamo andati con le nostre idee
3604270	3607570	nell'internazionale socialista e però
3607570	3609370	credo che si sia visto che poi i
3609370	3611670	laboristi israeliani non erano la stessa
3611670	3615310	cosa delle forze conservatrici in
3615310	3618450	Israele. E questo lo dico anche
3618450	3622810	guardando all'Europa, io penso che le
3622810	3625730	grandi speranze di pace di un nuovo
3627350	3630470	ordine sono state in parte notevole
3630470	3634530	tradite e che la crisi del vecchio
3634530	3637550	ordine in Europa, che certo era un
3637550	3640730	ordine non più tollerabile, fondato sul
3640730	3644010	ricatto nucleare, fondato su dittature
3644810	3646870	e tuttavia la crisi di quel vecchio
3646870	3650190	ordine sta producendo un rischio
3650190	3655310	pauroso di disgregazione, ma anche di
3656410	3660570	ritorno agli egoismi nazionalistici, alle
3660570	3663390	guerre di religione, alla barbaria della
3663390	3666630	pulizia etnica, sembra un mondo che
3666630	3669710	torna indietro rispetto alle sue
3669710	3676470	conquiste di civiltà. Perché quando
3676470	3680970	entrano in crisi quei grandi valori di
3680970	3683550	internazionalismo, di tolleranza, di
3683550	3686710	solidarietà fra i popoli, che sono stati
3686710	3690250	i valori della sinistra, non si
3690250	3692790	ricostruisce un ordine mondiale soltanto
3692790	3698470	nella logica del mercato, tanto più in
3698990	3702770	una logica del mercato che si intreccia
3702770	3706750	con un rigurgito di una cultura di
3707510	3710990	destra, di uno spirito di comunità
3710990	3713790	fondato sulla terra e sul sangue.
3714510	3716850	Queste proprio sono i fondamenti di una
3716850	3720570	cultura di destra in Europa. Ora io sono
3720570	3725410	convinto che o in Europa torna ad essere
3725410	3728830	protagonista, una sinistra, certo
3728830	3730850	consapevole delle sconfitte del
3730850	3732230	movimento comunista, del movimento
3732230	3737470	socialista. Le sconfitte ammaestrano, ma
3737470	3741910	noi non possiamo restare ripiegati
3741910	3746050	nell'autocritica o smarrire la nostra
3746050	3749930	identità o l'orgoglio di essere sinistra.
3750650	3753590	Di fronte al razzismo, di fronte agli
3753590	3757350	egoismi nazionalisti, di fronte a crisi
3757350	3759850	sociali che producono effetti laceranti
3759890	3764910	e di emarginazione umana, disoccupazione,
3765090	3768770	prostituzione, miseria, c'è bisogno di
3768770	3771090	una sinistra orgogliosa della sua
3771090	3775030	funzione e delle sue idee, rinnovata e
3775030	3778450	capace di dare battaglia. Il tema della
3778450	3781830	pace non è soltanto una questione di
3781830	3784970	diplomazia internazionale, si costruisce
3784970	3787730	un ordine di pace se si affrontano le
3787730	3789830	grandi ingiustizie sociali in Europa,
3790450	3793130	se si riapre un dialogo tollerante fra
3793130	3795850	popoli e culture diverse, se si
3795850	3797630	costruisce un ordine internazionale
3797630	3799790	fondato sulla democrazia e sui diritti
3799790	3801910	dei popoli e non sulla logica di
3801910	3805650	potenze e queste idee stanno a sinistra
3805650	3809110	e solo una sinistra europea forte, unita
3809110	3811850	e consapevole può essere protagonista di
3811850	3815510	questa svolta. Gli altri, quelli che hanno
3815510	3821070	vinto perché il crollo del comunismo è
3821070	3824010	stata anche la vittoria del capitalismo
3824010	3827910	e però come spesso accade nella storia
3827910	3831510	il vincitore non è in grado di dominare
3832050	3836130	i problemi che ha di fronte a sé. Io non
3836130	3838710	voglio rilanciare un'archeologia ideologica
3838710	3843750	anticapitalista. Fino a qualche tempo fa
3843750	3847250	la stampa, parlando del PDS e prima
3847250	3849750	ancora del PC, disegnava un partito
3850810	3852610	sostanzialmente diviso in due anime.
3853250	3855850	Di un'anima lei era il leader, dell'altra
3855850	3859230	lo era occhetto. La stampa andava oltre,
3859310	3861750	la disegnava anche come il probabile
3862670	3865470	segretario del partito. Da un po' di tempo
3865470	3867870	a questa parte tutto questo è cessato.
3868270	3870610	Erano i giornali immaginifici prima o sono
3870610	3872010	distratti adesso?
3876130	3877950	Io non so se possiamo considerare
3877950	3881090	l'ultima domanda questa qui, no.
3882070	3883750	Io avrei ancora un'altra cosa da chiedere.
3884110	3886650	No, non lo so. Era per l'economia della
3886650	3889510	risposta. Facciamo la stringata.
3889990	3892070	La risposta può essere anche molto rapida
3892070	3896590	diciamo. Prima eravamo divisi in aree e
3896590	3898510	siamo stati divisi in aree. Adesso questa
3898510	3902010	cosa sta... Non dico che nel nostro partito
3902010	3903990	non ci sia una pluralità di opinioni, che
3903990	3906150	è giusto che ci sia, ma quella
3906870	3908490	cristallizzazione che si era creata dopo
3908490	3911290	il congresso si va stemperando in un
3911290	3916110	dibattito più laico, meno correntizio.
3916310	3918990	Poi a un certo punto c'erano due anime
3918990	3922990	diciamo così. Io sono profondamente
3922990	3925110	laico, non so neanche se ne esista una
3925110	3927610	quantità di anime, ma penso che comunque
3927610	3930790	due per un partito siano troppe.
3931350	3934110	Ritengo che ci fosse molto di costruito,
3936470	3939710	ma siccome naturalmente quando si vuole
3939710	3941550	smantellare qualcosa che viene
3941550	3944210	costruito bisogna prendere delle misure,
3944970	3947550	io per quanto mi riguarda sono stato
3947550	3951370	molto attento in questi mesi a non
3951370	3954550	fornire pretesti a che potesse
3954550	3956970	continuare questa campagna.
3957630	3959830	Io ritengo che noi siamo impegnati in una
3960490	3961130	battaglia...
3961130	3965350	Ha pubblicato le liste degli
3965350	3967550	aderenti ad alcune di queste loge
3967550	3970410	masoniche, per l'istruzione circa 2.000 su
3970410	3973890	i 4.000 circa iscritti
3973890	3976050	alle loge di Firenze. Pare che
3976050	3978570	praticamente non ci sia famiglia che non
3978570	3980830	ha un iscritto alla masoneria in casa.
3981830	3986850	Pare, 4.000, non lo voglio dire.
3991890	3995350	Ci sono casi di omonimia strani che hanno
3995350	3998690	creato anche problemi in città,
3998810	4001670	volevo chiedere a Massimo D'Alema che
4001670	4004650	cosa pensa il Partito Democratico della
4004650	4006070	sinistra e che cosa pensa lui
4007370	4008830	personalmente sulla masoneria,
4009780	4012020	sulla adesione alla masoneria e sulle
4012020	4015180	inchieste che in questo periodo per
4015180	4017500	effetto del giudice Cordoba, per mano del
4017500	4019460	giudice Cordoba per esempio, e di altri
4019460	4021040	si stanno conducendo.
4068340	4068780	Sottotitoli a cura di QTSS
4098820	4099020	Sottotitoli di QTSS
4099040	4101680	Parlare della masoneria sarebbe molto
4101680	4103860	complesso. Un giudizio sintetico e
4103860	4105800	politico. Ma io penso questo in termini
4105800	4108580	sintetici e politici, intanto una cosa
4108580	4113740	generale, che non sia compatibile con la
4113740	4116960	trasparenza della vita democratica
4116960	4122640	l'associarsi fra di loro in modo segreto
4122640	4126320	di uomini della classe dirigente.
4127320	4130840	Io sono perché ovviamente in un Paese
4130840	4133320	Democratico sia tutelata la più assoluta
4133900	4138740	libertà di associazione, ma sono perché
4138740	4140980	le associazioni siano un fatto
4140980	4146580	trasparente, accessibile, conoscibile dai
4146580	4150780	cittadini. La logica di un'associazione
4150780	4154800	segreta è incompatibile con la
4154800	4157120	trasparenza di una grande democrazia
4157120	4160660	moderna e alimenta ovviamente il
4160660	4163800	sospetto che la segretezza dell'associazione
4165340	4168860	nasconda una comunanza di interessi non
4168860	4172700	sempre leciti. Questo mi sembra un
4172700	4176240	principio generale al quale ci si deve
4176240	4179520	attenere e al quale la masoneria si
4179520	4181800	attiene in tanti Paesi Democratici.
4181800	4186980	Nel senso che la masoneria è un'organizzazione
4186980	4190200	internazionale, ma in tanti Paesi
4190200	4193200	Democratici ha abolito quei caratteri di
4193200	4195540	segretezza che avevano a loro origine in
4195540	4197800	altre epoche e per ben altre ragioni
4198960	4200800	quando ci si associava segretamente
4201680	4204280	perché c'erano dei regimi tirannici.
4205260	4207180	Oggi non è questa la condizione del
4207180	4209520	nostro Paese e degli altri Paesi di
4209520	4213780	democrazia europea. Più in particolare
4213780	4218780	noi sappiamo purtroppo che proprio questa
4218780	4221840	segretezza ha fatto sì che nella
4221840	4224520	masoneria italiana si determinassero
4225060	4229520	delle deviazioni e cioè si potessero
4230040	4234680	come dire costituire dei gruppi i quali
4234680	4240160	oramai questo è attestato, hanno agito
4240160	4244060	consapevolmente nell'ombra per tramare
4244060	4246760	contro il sistema democratico. Quindi
4246760	4249640	nella masoneria italiana si è determinato
4249640	4253120	un fenomeno grave di inquinamento che
4253120	4255680	avrebbe dovuto a maggior ragione spingere
4256240	4260500	verso un'operazione di trasparenza. I
4260500	4262900	generali che avevano giurato fedeltà alla
4262900	4266260	pubblica e aggelli diciamo con qualche
4266260	4269380	contraddizione fra le due cose ma
4269380	4271780	comunque anche senza venire a questi
4271780	4275040	casi estremi diciamo è evidente che un
4275040	4277140	funzionario pubblico ha un dovere
4277940	4281780	supplementare di trasparenza. Queste sono
4281780	4284720	i termini generali della questione e
4284720	4286300	penso che nel momento in cui si fa
4286300	4288160	pulizia e si volta a pagina in questo
4288160	4290080	Paese era giusto che anche questa
4290080	4292500	questione venissi al pettine e la si
4292500	4295580	affrontasse in modo da sgombrare il
4295580	4298840	campo da logge segrete da associazioni
4298840	4301800	occulte di uomini potenti di cui questo
4301800	4303080	Paese non ha bisogno.
4311340	4317440	Una domanda anch'io a proposito di trame
4317440	4320440	segrete e di cose che agiscono
4321100	4323860	nell'oscurità e ai danni della vita
4323860	4325040	democratica.
4325900	4328660	Io volevo fare una domanda sulla mafia,
4329020	4330220	sul fenomeno mafia.
4331680	4335000	Questione che spesso riempie i titoli
4335000	4336780	dei giornali, riempie il dibattito
4336780	4342320	politico. Ne abbiamo purtroppo dovuto
4342320	4346580	discutere a lungo in questi ultimi mesi
4346580	4350580	anche qui a Firenze per la triste e
4352960	4356480	deprecabilissima discenda dell'attentato
4356480	4360320	in via dei georgofili e nonostante
4360320	4363780	questo dopo un certo periodo di mafia si
4363780	4367820	smette di parlare. Magari ci si rallegra
4367820	4372980	di aver avvestato un boss o di avere un
4372980	4375880	pentito in più da iscrivere appunto
4375880	4377500	nella lista dei collaboratori della
4378200	4382120	giustizia, ma tutto finisce qui. Non è
4382120	4384660	che si corre il rischio in uno di questi
4384660	4386560	giorni di risvegliarci di nuovo alle
4386560	4389180	prese con un altro attentato? Non è che
4389180	4390820	si sta facendo un po' troppo poco?
4394140	4396280	Io ritengo che noi non possiamo
4399180	4401500	sottovalutare dei risultati che vi sono
4401500	4403100	state nella lotta contro la mafia.
4404120	4408080	E in generale è un risveglio dell'azione
4410280	4416140	pubblica. Purtroppo dopo le stragi nelle
4416140	4417980	quali hanno perso la vita oltre ad
4417980	4421600	agenti di pubblica sicurezza, i due
4421600	4424020	magistrati che in modo più significativo
4424020	4426700	rappresentavano la lotta contro la mafia,
4427040	4428540	Falcone e Borsellino.
4433300	4437500	Bisogna dire la verità, c'è un
4437500	4440200	impegno coraggioso e forte della
4440200	4444560	magistratura che ha inviato a Palermo
4444560	4448400	uno dei suoi uomini migliori, un uomo
4448400	4450100	che già ha avuto una funzione grandissima
4450940	4454080	nella lotta contro il terrorismo e che
4454080	4456480	forse poteva pensare di avere già
4456480	4460600	rischiato abbastanza e di avere già dato
4461820	4465300	abbastanza al suo Paese e invece
4465300	4467600	Caselli ha accettato di tornare in
4467600	4470520	prima linea e questo è veramente stato
4470520	4473800	un segnale, io l'ho vissuto così, di
4473800	4477500	quali risorse umane, morali ci siano in
4477500	4479860	questo Paese e nello Stato italiano.
4480260	4481920	Caselli è un servitore dello Stato.
4484840	4487600	Le forze di polizia, i carabinieri
4489340	4493080	stanno svolgendo un'azione assai più
4493080	4496840	forte e impegnata e sono anche riusciti
4496840	4500020	a operare un certo risanamento di
4500020	4502740	gruppi, settori, persone che invece
4503660	4506020	avevano un atteggiamento ambiguo e
4506020	4507740	forse anche dei collegamenti con la
4507740	4511480	mafia. Qualche risultato positivo sta
4511480	4515980	dando sia la Costituzione della Procura
4515980	4518980	nazionale antimafia, sia la
4518980	4520640	Costituzione di quel corpo
4520640	4522980	investigativo, la DIA, che rappresenta
4523640	4527000	un primo rilevante esempio di
4527000	4529980	collaborazione tra i diversi corpi di
4529980	4534240	polizia del nostro Paese. Quindi
4534240	4537460	aggiungo a tutto questo, da ultimo
4537460	4539520	senza alcuno spirito di parte,
4541200	4544200	certamente uno straordinario impegno
4544200	4547480	parlamentare. La Commissione antimafia
4547480	4551500	ha svolto un lavoro straordinario e non
4551500	4555600	solo di studio, ma in prima fila come
4555600	4557800	centro di coordinamento della lotta
4557800	4560440	contro la mafia. E anche qui, che le
4560440	4563580	persone ci sono e vanno riconosciute, un
4563580	4566480	merito notevole. Ce l'ha avuto Luciano
4566480	4569560	Violante, prima di essere un
4569560	4574180	esponente del nostro Partito, è stato
4574180	4576180	anche lui un magistrato di grandissimo
4576700	4579300	valore. Io dico, queste sono cose
4579300	4583340	confortanti, che esistono e che hanno
4583340	4586180	consentito l'arresto di numerosi boss,
4587500	4594480	di dare dei colpi, non uno, dei colpi.
4595140	4599460	Tuttavia, noi non ci possiamo illudere,
4600820	4603180	cioè la lotta contro la mafia è un
4603280	4608140	problema enorme. La mafia non è un gruppo
4608140	4609920	di malviventi, anche numeroso e
4609920	4614280	organizzato, la mafia è un potere
4615640	4617700	profondamente radicato nell'economia
4617700	4621420	italiana, nella società. Basta pensare che
4621420	4624060	la mafia è un potere finanziario che
4624060	4628120	gestisce ogni anno 10, 15, 20 mila
4628120	4631280	miliardi di profitti illeciti. Voi capite
4631350	4636870	che quale capacità di penetrazione, di
4636870	4641410	inquinamento, quale dimensione oltre ai
4641410	4645350	boss, la mafia è anche organizzazione di
4645350	4647170	esperti finanziari, di gruppi
4647170	4651250	internazionali, cioè è una cosa che per
4651250	4654670	essere sradicata richiede una lotta di
4654670	4660030	lungo per il. E anche un cambiamento
4660710	4663310	politico, perché la forza della mafia è
4663310	4666170	consistita anche molto nel fatto che la
4666170	4669030	mafia ha avuto un vero e proprio patto
4669030	4671130	con un pezzo dello Stato italiano. Questo
4671130	4674250	mi sembra oramai sotto gli occhi di
4674250	4677970	tutti, diciamo, questa realtà. E ha anche
4677970	4680550	goduto di protezioni internazionali. Io,
4680570	4683070	per esempio, spero e ho notizie positive
4683070	4686690	da questo punto di vista, di un mutamento
4686690	4691070	di atteggiamento, che i servizi segreti e
4691070	4693690	la Polizia federale degli Stati Uniti
4695390	4697570	vogliano collaborare nella lotta contro
4697570	4701550	la mafia italiana. E so che c'è una
4701550	4705010	svolta di questo tipo, che nel passato
4705010	4708010	non è stato così, o non è stato sempre
4708010	4711910	così. Quindi noi dobbiamo mettere
4711910	4714910	insieme tutti questi fattori, di
4714910	4717110	risanamento economico, politico, di
4717110	4721090	riforma dello Stato e di lotta sul terreno
4721090	4724050	propriamente dell'azione investigativa e
4724050	4728710	giudiziaria. Siamo all'inizio, già con dei
4728710	4731170	risultati positivi, ma sarà una lotta
4731170	4734970	ancora lunga e difficile, nella quale la
4734970	4739890	mafia può tentare delle operazioni, anche
4739890	4743530	sul piano politico. Io, per esempio,
4743530	4746370	ritengo, perché la mafia è una... voi
4746370	4748110	capite che un'associazione che ha
4748110	4751710	migliaia di miliardi uomini armati,
4751990	4753750	controlla pezzi di apparato dello Stato,
4753830	4756450	pezzi di apparato economico, è una grande
4756450	4759710	forza politica. Io, per esempio, ritengo
4759710	4761270	tutt'altro che è infondato, il
4761270	4764530	ragionamento di chi pensa che la mafia
4764530	4766430	possa cercare di promuovere nel
4766430	4771370	mezzogiorno un movimento di destra, un
4771370	4772650	movimento di destra in base di massa.
4773710	4776310	Magari con l'obiettivo politico, ci sono
4776310	4778070	uomini dell'apparato dello Stato che lo
4778070	4781390	pensano da tempo, di favorire un
4781390	4785130	processo di disgregazione del Paese,
4785570	4787690	perché un'Italia divisa, diciamoci la
4787690	4792550	verità, Bossi può illudersi di
4792550	4794410	entrare in Europa con il lombardo
4794410	4799370	veneto, ma un'Italia fatta a pezzi
4799550	4803290	vedrebbe in una parte d'Italia un
4803290	4805650	potere forse condizionante della mafia,
4805970	4807830	che forse può pensare di trasformare
4807830	4810170	la Sicilia e un pezzo dell'Italia
4810170	4812470	meridionale in una specie di Colombia
4812470	4815710	nel cuore del Mediterraneo, regno del
4815710	4818490	riciclaggio e del narcotraffico. Non è
4818490	4822550	fantapolitica questo. Questa è una delle
4822550	4825170	ipotesi possibili, perché noi dobbiamo
4825170	4827510	avere, diciamo, il senso, la dimensione
4827510	4829250	di cosa significa lotta alla mafia.
4830230	4833250	Lotta alla mafia fa tutt'uno con un
4833250	4834510	progetto di ricostruzione democratica
4835070	4837370	di questo Paese, non è solo affare di
4837370	4841070	polizia e di magistratura. E allora io
4841070	4843970	penso che se noi vediamo le cose così
4843970	4847610	ci rendiamo conto che siamo all'inizio,
4847810	4850470	ma che il successo in questa battaglia
4850470	4853450	è legato alla possibilità di dare al
4853450	4855890	Paese una nuova classe dirigente, un
4855890	4858370	nuovo corso democratico. Solo questo
4858890	4861890	garantisce che nel corso di anni, alla
4861890	4865310	fine, si possa sradicare questo potere
4865310	4866130	criminale.
4879010	4881910	Non le pare molto discutibile da parte
4881910	4884590	dell'Unità la pubblicazione dei nomi
4884590	4887930	dei massoni toscani come giornale di
4887930	4892190	partito e quindi facendo qualcosa che
4892190	4893810	è oltre l'informazione.
4898470	4901290	Ma guardi, io non voglio, diciamo, dire
4901290	4904810	quello che lo dico da ex direttore
4904810	4908750	dell'Unità, che l'Unità non è un
4908750	4912770	giornale di partito, non lo è oramai da
4912770	4914910	nessun punto di vista, diciamo, neanche
4916030	4918930	giuridico, dato che ha persino tolto
4918930	4920990	dalla sua testata il fatto di essere
4920990	4924390	giornale di partito. Ma accertamento non
4924390	4926270	lo è dal punto di vista delle scelte
4926270	4931150	editoriali e giornalistiche. Noi non
4931150	4934690	sappiamo nulla di che cosa l'Unità
4934690	4936870	decida di mettere in prima pagina, in
4936870	4939070	seconda pagina, in terza pagina e così
4939070	4942550	via. Lo apprendiamo la mattina leggendo
4942550	4945450	l'Unità. Questo vorrei che fosse
4945450	4949890	chiaro, diciamo. Sì, è molto spesso,
4949890	4952590	diciamo, anche quando siamo divisi
