start	end	text
4952590	4955330	tra di noi, diciamo, poi ritroviamo la
4955330	4957730	nostra Unità dicendo male dell'Unità.
4958670	4960490	Nelle riunioni del gruppo dirigente del
4961670	4963910	partito, quando si dice male dell'Unità
4963910	4966430	si riscuote l'unanimità dei consensi.
4966450	4968190	Lo so perché io ho vissuto la dolorosa
4968190	4969870	condizione di essere il direttore
4969870	4972270	dell'Unità, cioè quello che poi tutti
4972270	4974150	guardavano male per una ragione o per
4974150	4977810	l'altra. Io personalmente non credo che
4977810	4979630	ecco, detto questo, che si tratti di una
4979630	4984290	scelta sbagliata. Certo, è un'operazione
4984290	4986290	se vogliamo anche molto forte, molto
4986290	4989370	scioccante, ma è un'operazione
4989370	4993010	informativa. Questi elenchi ci sono,
4995890	4998970	circolano. Certamente, diciamo, negli
4999810	5002590	ambienti della Firenze, del potere
5002590	5005970	politico, economico, questi elenchi ci
5005970	5010550	sono, circolano. Io, per esempio, sono
5010550	5012450	deputato della Puglia e ho ricevuto
5012450	5014370	quattro mesi fa l'elenco dei Mazzoni
5014370	5015610	Pugliesi. Non ho un giornale per
5015610	5018370	pubblicarli, diciamo. Allora, io dico,
5018490	5020410	quando questi elenchi ci sono e
5020410	5023450	circolano e le elitte politiche
5023450	5025730	economiche li conoscono, non vedo
5025730	5027370	perché non li possano conoscere i
5027370	5034670	cittadini, sinceramente. Che vi sia
5034670	5037890	consentito, è il modo migliore, di
5037890	5041370	fare trasparenza, di evitare il gioco
5041370	5043910	dei condizionamenti e dei ricatti tra
5043910	5048830	quelli che sanno e quelli che non sanno.
5049050	5051370	Dato che queste cose oramai si sanno
5051890	5054850	in determinati ambienti, anche
5054850	5058170	abbastanza non ristrettissimi, è giusto
5058170	5061250	che le sappiano i cittadini. È un'operazione
5061250	5064910	di... io non credo, naturalmente, io non
5064910	5066810	lo so, io non seguo le croniche di
5066810	5069170	Firenze, ne che si pubblicano elenchi di
5069170	5073850	malfattori. Il giudizio, poi, è affidato a
5073850	5078230	ciascuno su queste appartenenze, eccetera
5078230	5080950	e, tuttavia, a me sembra che a questo
5080950	5083950	punto, diciamo, dire le cose come stanno,
5085210	5086950	introdurre un elemento di trasparenza,
5087810	5090750	non è cosa negativa. Siamo arrivati a un
5090750	5093690	punto, insomma, è bene che tutti sappiano
5093690	5096390	tutto in questo Paese. Poi vedremo come si
5096390	5098970	risolveranno questi problemi, diciamo. Io
5098970	5100710	sono contrario alla ghigliottina, senza
5100710	5105550	alcun condizionamento. E cioè, io non
5105550	5107930	vorrei, diciamo, che si passasse dalla
5107930	5110610	spartizione partitocratica ad altre
5111590	5114610	spartizioni, persino meno pluralistiche
5115150	5118530	rispetto che nel passato. Io spero che
5118530	5120850	davvero prevalga un criterio di
5120850	5124970	professionalità, che non si mascheri
5124970	5127770	dietro alla professionalità una nuova
5127770	5131930	logica lottizzatoria e che si tenga anche
5131930	5134610	conto dell'esigenza del pluralismo,
5135830	5139870	perché il pluralismo per la RAI è
5139870	5142110	importante per due ragioni. Primo,
5142290	5144370	perché la RAI è un servizio pubblico e
5144370	5147450	l'informazione rappresenta un valore
5147450	5150410	democratico da tutelare. Secondo, per una
5150410	5154050	ragione di mercato, perché se l'informazione
5154050	5158270	è pluralistica, accontenta più cittadini
5158270	5160870	e più cittadini guardano la televisione
5161870	5164610	pubblica. Se invece l'informazione non è
5164610	5166870	pluralistica, la gente non la guarda.
5166870	5169690	Ora si potrà pensare quello che si
5169690	5174030	vuole del TG3. Piacere, non piacere, ma
5174030	5177870	una cosa è sicura, che molta gente guarda
5177870	5186410	il TG3. E si tratta di cittadini che
5186410	5188970	probabilmente non avrebbero mai guardato
5188970	5192770	il TG1 e il TG2, anche per difendere la
5201850	5202370	cittadina.
5202370	5208090	Mi sembra innegabile a luce dei fatti
5208090	5210610	che oggi fra PDS e Lega l'antagonismo è
5211510	5214170	evidente. Però, appena poco più di un anno
5214170	5216610	fa, voi avete appoggiato delle giunte a
5216610	5222750	maggioranza leghista alle Nord. Perché
5222750	5228850	per tutta una fase PDS e Lega hanno
5228850	5232270	rappresentato indiscutibilmente le due
5232270	5235970	forze, che da una parte e dall'altra
5235970	5238670	avevano il comune interesse a
5238670	5241350	smantellare il vecchio apparato di
5242410	5249230	potere, democristian-socialista. E c'era
5249230	5252990	questa priorità, smantellare un
5252990	5254730	apparato di potere corrotto che
5254730	5258530	soffocava il Paese. Abbiamo marciato
5258530	5263450	divisi, ma colpito uniti. E forse anche
5263450	5266330	con qualche elemento di simpatia
5266330	5272130	reciproca. Ma a mano che questo problema
5272130	5273790	dell'apparato di potere democristiano
5273790	5277950	e socialista si va ridimensionando, si
5277950	5280750	rilinea sempre di più, invece, quello
5280750	5282610	che ho detto a un certo punto di questa
5282610	5285890	serata, cioè che il nuovo può avere
5288150	5289750	volti assolutamente diversi e
5291230	5293170	contrapposti. Cioè, man mano che il
5293170	5295950	vecchio potere declina, l'antagonismo
5296570	5300090	fra noi e la Lega si fa e si farà più
5300090	5303870	forte. La Lega è la forza che vuole
5303870	5307750	uscire a destra dal vecchio regime. È
5307750	5309870	la forza che cavalca il neoliberismo,
5309870	5313070	l'egoismo. Noi siamo la forza che vuole
5313070	5316930	ricostruire la solidarietà. E quindi è
5316930	5319690	evidente che progressivamente, questo
5319690	5324090	spiega anche il perché, noi si era votato
5324090	5327070	con le vecchie leggi elettorali. La Lega
5327070	5329270	aveva raggiunto un'ampia maggioranza
5329270	5335270	relativa. E noi rifiutammo l'idea di un
5335270	5338050	patto di tutti i partiti contro la Lega,
5338290	5340570	sarebbe stato un errore, proprio sotto il
5340570	5343150	profilo della necessità di liquidare il
5343150	5345910	vecchio regime e dicemmo, la Lega, bene,
5345910	5348310	governate, vi diamo l'appoggio esterno.
5348730	5351370	Perché avevano avuto il 35 e il 40% dei
5351370	5353390	voti della gente, quindi di questo si
5353390	5356270	doveva tenere conto. Si è trattato di una
5357350	5359490	stagione, ma questa stagione oramai sta
5359490	5362670	finendo. E questo appare molto chiaramente
5362670	5366510	anche dalle posizioni della Lega. Oramai
5366510	5368230	Bossi non attacca più la democrazia
5368230	5372930	cristiana. O si attacca la DC, attacca la
5372930	5375130	parte più avanzata, più progressista della
5375130	5379530	DC. Oramai Bossi tende la mano alla
5379530	5383130	vecchia democrazia cristiana. Lui, che si
5383130	5385430	è presentato come il campione della
5385430	5388550	lotta contro la partitocrazia, fa
5388550	5391990	l'occhiolino al club di Cepaloni, che io
5391990	5394370	credo, diciamo, un pezzo di archeologia
5394370	5396930	partitocratica forse il più indecente
5396930	5399110	che ci sia nel nostro Paese, cioè
5399110	5402950	inottabili della DC meridionale. E
5402950	5405070	individua nel PDS il suo nemico
5405070	5409430	principale, con atteggiamenti sempre più
5410450	5414450	virulenti e gladiatori. Non so se voi
5414450	5418810	avete letto questa intervista di
5418810	5422450	questo Maroni che Bossi ha nominato
5422990	5425850	leader della sinistra italiana, perché
5425850	5427950	ha deciso che la sinistra deve essere
5427950	5431710	una corrente della Lega. E' uscito
5431710	5433630	sull'ultimo numero di un diffuso
5433630	5437650	settimanale. Beh, c'è una vera perla
5437650	5441550	all'inizio. Maroni racconta che Bossi
5441550	5444550	lo ha convocato alle due di notte,
5445350	5447990	già fiorisce questa aneddotica
5447990	5450930	intorno a Bossi. Il capo è sempre in
5450930	5453290	sonne, no? Come si diceva di Mussolini, di
5453290	5456010	Stalin. Quindi alle due di notte Bossi
5456010	5459010	convoca Maroni, gli dà una serie di
5459010	5461570	direttive su come dirigere il gruppo
5461570	5463670	parlamentare e quando Maroni,
5463690	5465350	probabilmente assonnato, sta per
5465350	5467370	andarsene, dice un momento devo dirti
5467370	5469550	ancora una cosa, ho un compito da
5469570	5472850	chiederti, vai e distruggi il PDS.
5474070	5476610	Letto, sì, e testuale, virgolettato
5476610	5479570	diciamo. Ora, a parte la rodomontata,
5480410	5482890	per cui la notte è meglio dormire,
5483150	5485810	diciamo, che organizzare incontri di
5485810	5489570	questo genere, a parte il fatto che,
5490170	5491770	diciamo, mi viene da dire che tutto
5491770	5494110	sommato Bossi dovrebbe studiarsi la
5494110	5497110	storia recente dell'Italia. C'è stato
5497110	5499430	uno che ha dedicato 15 anni della sua
5499430	5503910	vita a cercare di distruggerci e noi
5503910	5507430	siamo sempre che lui
5508910	5511810	si sa più dov'è, diciamo.
5513510	5515370	Sta cercando di far perdere le sue
5515370	5518430	tracce, diciamo. Ma come a dire che
5519410	5520370	insomma noi siamo gente per
