start	end	text
0	640	di un'attivazione al
640	1880	riavvicinamento segni
2620	4820	parlano di un partito
4820	6800	democratico della sinistra e in
6800	9000	special modo di un un occhetto
9000	12100	che avrebbe perso uno spazio di
12100	14440	manovra all'interno eh degli
14440	17100	schieramenti possibili in in
17100	21240	questo paese e eh estremizzano
21240	23260	dicendo che in questo momento
23260	25840	per il PDS esiste soltanto una
25840	29260	prospettiva di un ritorno ad a
29260	32000	un rialacciamento dei rapporti
32000	33860	con con rifondazione comunista
33860	35780	e praticamente solo con questa.
36160	38900	Io ehm allora volevo chiederle
38900	41320	se eh lei condivide questo tipo
41320	44440	di analisi e invece se non la
44440	46940	condivide quale è il tipo di
46940	48660	lavoro che il PDS invece fa in
48660	50780	vista delle elezioni e in vista
50780	52600	del dei futuri scenari politici
52600	53360	in Italia.
58740	61880	Innanzitutto buonasera anche se
61880	63440	purtroppo io non vi vedo
63440	65800	assolutamente diciamo vedo delle
65800	72760	luci e delle ombre poi c'è un
74280	76840	suono che ulteriormente
76840	79560	accresce un clima un po'
79560	81260	più sul reale. La domanda è
82360	85540	molto impegnativa perché riguarda
85540	87440	le elezioni amministrative, il
87440	93080	futuro politico dell'Italia, io
93080	94780	ne affronto un pezzettino, poi
94780	96620	magari nel corso della serata
99720	104420	io non so e non do per scontato
105180	108160	che il fatto che Martinazzoli e
108160	113260	Segni si siano incontrati abbia
113260	118380	di per sé ricostituito una
118380	121900	unità di intenti fra la
121900	125880	democrazia cristiana e quelle
125880	129360	forze cattoliche, laiche che
129360	130920	consegni e con alleanza
130920	133280	democratica si sono allontanate
133280	134540	dalla vecchia maggioranza di
134540	138720	governo. Io penso che la
138720	141300	situazione sia molto più aperta
144040	145700	e comunque se guardiamo al
145700	147500	panorama delle elezioni
147500	150700	amministrative che si preparano
150700	153800	francamente mi sembra che per
153800	157180	molti aspetti questo panorama
157180	158000	non si può confermi il mio
159300	163660	giudizio. A Genova siamo
163660	166420	impegnati insieme ad alleanza
166420	169020	democratica intorno alla
169020	171880	candidatura di un magistrato
171880	176620	che è anche uomo impegnato dal
176620	179900	punto di vista civile, culturale
179900	184760	e che è il dottor Sansa che si
184760	186320	presenta come il candidato di
186320	187960	uno schieramento progressista,
189180	191740	la DC ha un suo candidato
191740	196720	chiaramente contrapposto. A Roma
197860	200460	almeno fino a questo momento
200460	203160	alleanza democratica e anche
203160	205700	Segni sono certamente impegnati
205700	208300	a sostenere un leader
208300	209880	ambientalista che è anche il
209880	211520	candidato della sinistra o di
211520	214080	gran parte della sinistra. La
214080	215620	democrazia cristiana non si sa
215620	217220	ancora che candidato avrà se
217220	218980	avrà un candidato ma comunque
218980	223240	diciamo fuoricampo. La DC aveva
223240	225160	addirittura cercato di candidare
225160	228000	Segni a Roma contro la sinistra
228000	232320	ma Segni ha detto di no. In
232320	233560	altre città invece c'è una
233560	238520	situazione più difficile e
238520	242180	certamente c'è il rischio che
242180	245440	Segni giochi la carta da qualche
245440	248380	parte di allearsi con la sinistra
248380	250240	e da qualche altra parte di
250240	251460	allearsi con la democrazia
251460	256600	cristiana. Io ritengo che
256600	260600	sarebbe un errore, lo vorrei
260600	262080	mettere in guardia perché in
262080	263520	questo modo Segni rischia di
263520	266320	giocarsi la sua credibilità.
267740	269240	Segni è stato l'uomo della
269240	271220	nuova politica, della
272940	275200	trasparenza, della fine delle
275200	278380	manovre partitocratiche, ora
278380	281400	francamente in Italia, di
281400	283300	partiti che da qualche parte si
283300	284800	alleavano con la sinistra e da
284800	286280	qualche parte con la DC a
286280	287940	seconda delle convenienze, a
287940	288940	seconda di chi gli dava il
289860	292580	sindaco, ce ne è già stati. Non
292580	294000	mi pare che si tratti di una
294000	296300	grande novità sulla scena
296300	299740	politica italiana e su questa
299740	301640	strada Segni rischia di
301640	304700	consumare la novità che gli ha
304700	307800	rappresentato e di tornare ad
307800	309680	essere un uomo della vecchia
309680	311820	politica. Sarebbe un errore
311820	314220	molto grave. Io spero che
314220	315180	questo errore non venga
316000	317980	compiuto e comunque non per
317980	320800	colpa nostra. Noi siamo
320800	324480	impegnati a costruire in tutte
324480	327020	le città che votano la più
327020	330820	larga alleanza progressista e di
330820	334280	sinistra. Ed anche io ne sono
334280	338380	persuaso con buone probabilità
338380	340860	di vincere e di andare al
340860	343040	governo di grandi e importanti
343040	345160	città, decisive per certi aspetti
345160	348540	del nostro Paese. Se guardo al
348540	351560	campo delle forze moderate, vedo
351560	354040	una grande confusione. Noi
354040	355700	abbiamo già definito quasi
355700	357520	ovunque dei candidati, dei
357520	362180	programmi. Siamo già entrati
362180	364480	nella battaglia. Siamo
364480	367460	indiscutibilmente la sinistra,
367760	371360	la forza più organizzata, più
371360	373500	fiduciosa nelle sue possibilità
374640	377160	e che a mio giudizio ha
377160	380020	effettivamente buone probabilità
380600	383360	di avere anche a novembre un
383360	386100	nuovo risultato positivo. A
386100	388760	giugno abbiamo vinto nella
388760	390520	maggioranza dei comuni che hanno
390520	392820	votato e questo poi alla fine è
392820	395300	il dato e a novembre possiamo
395300	397940	ripetere questo risultato. E a
397940	401980	segni dico c'è volontà,
402180	404860	disponibilità di costruire
404860	407740	un'alleanza. Ma chiediamo
407740	411140	chiarezza, scelte trasparenti,
411140	413400	non c'è spazio per un nuovo
414320	416840	pendolarismo, non c'è spazio per
416840	419640	raggi della dilancia. L'ultimo
419640	420880	che c'è stato ha fatto una
420880	422820	fine bruttissima, diciamo.
432660	433660	Tutto qui.
435380	436540	Della base.
436720	437880	Della?
446500	448480	Ma guarda io non lo so perché
448480	452820	l'espressione la base è un'espressione
455540	457640	che rischia di confondere tante
457640	460120	persone, tante idee, tanti
460120	461060	sentimenti.
463660	467880	Io sono tornato e ho già fatto
467880	470240	tantissime manifestazioni,
470920	472820	tantissimi incontri come questi.
474140	476040	Proprio negli ultimi tre giorni
477420	479360	sette manifestazioni come
479360	483300	questo, incontri, dibattiti. Mai
483300	487360	come quest'anno ho visto, non
487360	489160	dico il consenso, ma la
489160	491700	curiosità, l'interesse, la
492090	494530	presenza di cittadini intorno al
494530	500150	nostro partito. Guardate, la mia
500150	502770	è una costatazione empirica.
503490	506210	Se l'informazione si occupasse
506210	508250	di meno delle dichiarazioni di
508250	511690	qualche leader vero o presunto e
511690	514070	si occupasse di più di quel che
514070	515950	succede nella società italiana,
517010	522070	i giornali dovrebbero, come
522070	524810	sono state, fare una notizia
525310	527690	quantomeno sorprendente, cioè che
527690	529190	in epoca di fine della
529870	531890	partitocrazia, di crisi dei
531890	534270	partiti e di sfiducia dei
534270	535930	cittadini nella politica e nelle
535930	539190	istituzioni, c'è un partito che
539190	541890	come non si vede. Anzi, diciamo
541890	544370	le cose come stanno. Se noi non
544370	547490	avessimo avuto il problema di
547490	549990	una nuova legge elettorale,
549990	553310	voluta dagli italiani e che è
553310	554930	stata l'unica ragione per la
554930	556330	quale questo Parlamento è
556330	559350	rimasto in piedi, francamente in
559350	561510	un Paese civile, dopo il voto
561510	562830	contro l'autorizzazione a
562830	564430	procedere per craxi, si doveva
564430	568250	chiudere. Chiudere e andare alle
568250	572470	elezioni. Ma c'era la necessità
573230	576190	di dare una risposta ad un
576190	578130	referendum popolare che in modo
578130	580010	larghissimo ha chiesto una
580010	582610	nuova legge elettorale. Questa
582610	584890	legge l'abbiamo fatta, bella,
585010	587230	brutta, a me non piace, non
587230	589470	credo che sia la migliore legge
589470	591050	che potevamo avere, ma comunque
591050	594410	si è fatta. Ora ci sono gli
596310	597910	adempimenti tecnici, ma non sono
597910	599670	solo un fatto tecnico, perché la
599670	601550	definizione dei collegi con il
601550	603130	Sistemo Nominale Maggioritario
603690	605210	è una questione molto
605210	608730	importante. Non appena questi
608730	611970	adempimenti saranno compiuti, noi
611970	614050	diciamo bisogna andare alle
614050	617650	elezioni. Non abbiamo dubbio su
617650	621710	questo e questo significa, siccome
621710	624270	io ritengo che per i primi di
624270	628070	dicembre si completerà, poi c'è
628070	630130	Natale, nessuno è pazzo, non si
630130	632850	può votare a Natale, febbraio,
633850	636690	marzo. Io ritengo ragionevolmente
636690	639590	che queste elezioni nuove
639590	642870	richiederanno un certo tempo di
642870	644690	preparazione, conosceremo i
644690	646330	collegi, bisognerà individuare le
646850	649170	candidature, le alleanze, non si
649170	651950	improvvisa, ma il tempo è questo.
653010	654890	E perché noi chiediamo con
654890	658010	estrema fermezza questo? Per noi
658010	659790	è chiaro che quell'atteggiamento
659790	661990	positivo che abbiamo avuto verso
661990	664430	il governo Ciampi era legato
664430	667570	all'impegno di un governo di
667570	669150	transizione e di garanzia
669910	672190	democratica, di un governo che
672190	674050	chiedeva, perché questo disse
674050	676590	Ciampi, la fiducia per
676590	678810	amministrare il Paese nel tempo
678810	680630	necessario a fare la riforma
680630	683430	elettorale. Quando scade questo
683430	685290	tempo il governo se ne deve andare
685290	687350	per noi, oppure diventa un'altra
687350	690190	cosa, diventa il governo del
690190	691450	vecchio regime e della vecchia
691450	694370	maggioranza, non più un governo
694370	698570	di garanzia. E siccome io ho
699970	701190	fiducia nella sensibilità
702030	703510	democratica del Presidente del
704590	706830	Consiglio penso che egli non
706830	708770	voglia diventare il governo del
708770	709950	vecchio regime, il capo del
709950	714690	governo quadripartito. Ma perché?
715810	717730	Non ci muove un interesse di
717730	719550	partito, io non starò qui ad
719550	722910	manaccare su chi abbia vantaggio
722910	725310	a ritardare le elezioni.
725590	726850	Secondo me chi ne trae più
726850	729110	vantaggio di tutti è la Lega,
729890	734050	perché il perdurare di un
734050	736590	Parlamento che non ha più la
736590	738530	fiducia dei cittadini
739530	741470	approfondisce il varco fra i
741470	742530	cittadini e le istituzioni
743750	745070	democratiche, genera
745070	748110	qualunquismo. Bossi non ha
748110	749130	bisogno neanche di fare i
749130	750290	vantaggi, quando uno apre la
750290	751550	televisione e vede l'Aula del
751550	752810	Parlamento con De Michele,
752890	754910	Cirino Pomicino, eccetera, c'è
754910	756130	poco da fare.
760390	762730	Cioè in un momento così
762730	764610	drammatico della vita del nostro
764610	766630	Paese, di fronte a problemi
767810	769650	sociali, noi abbiamo bisogno di
769650	770770	un Parlamento che sia
770770	774210	credibile. Ora il Parlamento che
774210	777790	c'è riflette un'Italia che non
777790	780490	c'è più, ci sono momenti nella
780490	783570	vita di un popolo nei quali un
783570	788550	anno ne vale 50 e sono passati
788550	790270	50 anni dalle elezioni
791970	792790	politiche, politicamente,
793650	794770	crollato un regime.
796590	798830	Io metto l'accento persino più
798830	800790	su questo che non sul dato pure
800790	802910	rilevante della massa degli
802910	806110	inquisiti, sul fatto che noi
807590	811030	abbiamo in verità dei record di
811030	812750	presenza in questa legislatura
813530	815970	repubblicana, perché sono presenti
815970	819750	in massa uomini del potere i
819750	822730	quali stanno lì perché se vanno
822730	824730	per strada la gente li rincorre e
824730	826730	quindi non hanno nulla da fare,
828010	831170	perché in parte il loro potere
831170	834350	l'hanno perduto, per strada non
834350	836170	possono andare e stanno lì dalla
836170	838670	mattina della sera, ma si può
838670	840850	diciamo pensare che in un momento
840850	843570	come questo le istituzioni si
843570	846950	presentano in questo modo, ecco
846950	848530	questo è il senso, noi vogliamo
848530	851470	davvero le elezioni e lo diciamo
851470	854750	con estrema serenità, siamo
854750	859330	disposti a batterci, non solo a
859330	862350	chiedere, il nostro è un
863810	865330	preannuncio, è una richiesta
865330	867310	ferma ed è un preannuncio, abbiamo
867310	868610	chiesto che il Presidente del
868610	871610	Consiglio venga in Parlamento e
872310	874310	dica che cosa pensa di fare,
875070	876770	il Presidente del Consiglio ha
876770	879810	accettato questa richiesta, sarà
879810	882730	la Camera il 21 settembre prossimo
882730	884930	e in quella occasione ci aspettiamo
884930	887450	un chiarimento, il Paese deve
887450	889810	avere la sicurezza entro qualche
889810	892910	mese di poter votare e di potersi
892910	895430	dare una nuova classe dirigente,
895770	898590	almeno questo, al popolo italiano
898590	900550	di fronte al dramma, aveva
900550	903030	attraverso una combinazione, una
903030	904870	coalizione di gruppi, di partiti
906530	909030	diversi e quindi certamente dentro
909030	912210	quello schema con chi vi volete
912210	913810	alleare, un'alleanza democratica,
914570	916410	con di fondazione, un discorso
916410	918350	che aveva una sua ragionevolezza,
918350	924410	noi siamo invece alla vigilia di un
924410	926950	sistema politico del tutto nuovo,
927630	931690	nel quale progressivamente la
931690	933610	questione non sarà quella di una
933610	937030	combinazione di partiti, ma la gente
937030	939610	voterà fra grandi orientamenti,
940010	943310	grandi aree politico culturali,
943470	946510	parliamoci chiaro, se nei collegi
946510	949890	sono uni nominali, ogni partito di
949890	952690	quelli che ci sono vecchi e nuovi
952690	955130	dovesse presentare un candidato,
955490	958450	16 candidati per collegio, beh,
958570	961150	avremmo fatto una tale frittata,
962730	965390	sarebbe una cosa talmente assurda
965390	967530	diciamo, che converrebbe ritornare al
967530	970810	vecchio sistema elettorale, e quindi
970810	973770	noi puntiamo invece ad una
973770	977990	semplificazione, questo è l'obiettivo,
978530	980970	e quindi al fatto che grandi aree
980970	984910	politiche esprimano in ogni collegio un
985890	989930	candidato, ora in Italia questo significa
989930	993270	lavorare a costruire un grande partito
993270	996030	progressista di sinistra, di tipo
996030	999710	europeo, in grado di candidarsi al
999710	1004310	governo del Paese. Se noi guardiamo la
1004310	1007510	realtà europea e ai sistemi
1008870	1009710	maggioritari,
1011210	1013250	attenzione, questi grandi partiti di
1013250	1015510	sinistra europei sono partiti che hanno
1015510	1022650	in sé sia una cultura di governo, sia
1022650	1025730	spinte radicali di cambiamento, la
1025730	1027910	sinistra laborista tanto per dirne una
1027910	1031250	sinistra, è una sinistra la cui
1031250	1034950	radicalità è sconosciuta persino al
1034950	1036830	compagno Possutta, che in fondo è un
1036830	1039410	uomo della vecchia politica, propaganda
1039410	1044650	e compromessi diciamo, ecco. O in Francia
1044650	1048630	il sistema maggioritario costrinse il
1048630	1050650	partito socialista ad allearsi con i
1050650	1052550	comunisti per poter avere la maggioranza,
1053170	1056350	e non è che tra Roccar e Marché ci
1056350	1058690	fosse minore distanza di quanto non
1058690	1062350	venessia tra Iala e Lucio Magri. Quindi
1063250	1067570	io insisto su questo punto, noi siamo la
1067570	1069310	più grande forza della sinistra del
1069310	1072930	mondo progressista, noi non possiamo che
1072930	1078210	porci l'obiettivo di unire la più
1078210	1080470	grande parte della sinistra del mondo
1080470	1082430	progressista, senza pregiudiziali
1082430	1086210	ideologiche, verso nessuno, assumendo
1086210	1090090	come unica discriminante la ricerca di
1090090	1092050	un programma comune che sia un
1092050	1094210	programma per il governo del Paese.
1095770	1099710	Sarebbe miope accettare una posizione
1099710	1103410	pregiudiziale che da una parte, perché
1103410	1105450	anche di fondazione, una parte di
1105450	1108130	fondazione dice alleanza democratica
1108130	1111010	sono dei reazionari, come se in questo
1111010	1112750	Paese non ci fossero ben altri
1112750	1115090	reazionari, cominciare dalla Lega di
1115090	1117690	Corsi, e dall'altra parte alleanza
1117690	1119230	democratica che dice, se c'è
1119230	1122570	rifondazione non deve esserci perché si
1122570	1124010	chiamano comunisti.
1125970	1127990	Io posso rompere con rifondazioni, per
1127990	1130090	quello che propongono, ma sinceramente
1130690	1134090	chiedere a noi di assumere in piccolo
1135210	1139090	una pregiudiziale anticomunista al
1139930	1142570	nostro popolo, diciamo, che ha patito
1142570	1144530	sulla sua pelle un'esclusione
1144530	1146590	pregiudiziale di questo genere per 50
1146590	1148290	anni, è una showcase.
1161910	1164630	Il difetto di rifondazione, il difetto
1164630	1166310	principale di rifondazione, non stanno
1166310	1169090	il fatto che si chiamano comunisti, molto
1169090	1171110	spesso in quel che dicono, in quel che
1171110	1173590	propongono, ma allora è su quel terreno
1173590	1176370	che vengono a spostare il confronto, e
1176370	1181450	quindi noi rifiutiamo la logica di
1181450	1187970	opposte pregiudiziali ideologiche, che se
1187970	1190970	noi accettassimo quelle di rifondazione
1191590	1194410	la sinistra si chiuderebbe in sostanza in
1194410	1199570	un ghetto da sinistra di opposizione, e
1199570	1203570	invece noi siamo convinti che in questo
1203570	1206450	modo, e se noi accettassimo quelle
1207570	1212050	disegni, noi favoriremmo il crearsi di
1212050	1217190	un polo di estrema sinistra che ci
1217190	1219010	porterebbe probabilmente alla sconfitta
1219570	1221930	elettorale, perché mi sia consentito un
1221930	1225590	gruppo dirigente, deve anche fare due
1225590	1230130	conti, io mi sono fatto due conti, se
1230130	1232250	rifondazione o rifondazione rete
1232250	1235510	insieme presentassero candidati in tutti
1235510	1238030	i collegi uninominali d'Italia,
1238830	1242750	probabilmente ne eleggerebbero 2 o 3, ma
1242750	1247110	la sinistra ne perderebbe 100, perché il
1247110	1248630	nuovo sistema elettorale badato è
1248630	1254170	spietato, chi arriva primo è eletto, chi
1254170	1257030	arriva secondo non gli danno neanche una
1257030	1258750	medaglietta per la partecipazione,
1258750	1262910	diciamo al concorso, quindi queste sono
1262910	1264790	le condizioni reali nelle quali ci
1265410	1269250	muoviamo, queste sono, io ritengo che in
1269250	1271110	questa situazione il nostro compito è
1271110	1273410	quello di lavorare per la più larga
1273410	1275430	unità delle forze di sinistra e
1275430	1279810	progressiste, chi non ci vuole stare si
1279810	1282750	tirerà indietro per il suo settarismo,
1283970	1286490	non perché qualcuno stabilisce prima
1286490	1288730	chi si può sedere a tavola e chi non si
1288730	1292230	può sedere a tavola, e questa politica
1292230	1294890	è una politica che dà i suoi frutti,
1295310	1296730	perché è con questo spirito unitario
1297650	1300450	che abbiamo vinto le elezioni in
1300450	1302730	primavera e che io ritengo possiamo
1303550	1305990	vincere le elezioni anche a novembre,
1306490	1308530	poi vedremo, diciamo, se questa spinta
1308530	1310790	potrà essere fermata.
1320270	1321970	La difesa dell'occupazione,
1324110	1328530	allora, D'Alema, come si riesce a
1329410	1332330	difendere l'occupazione e come si
1332330	1335850	riesce a dare un impulso nuovo a
1335850	1337530	questa economia italiana che pare così
1337870	1339870	disastrata e allo sbando?
1343970	1346050	Naturalmente, sapendo che non è che
1346050	1350590	c'è una bacchetta magica, però intanto
1350590	1352490	io voglio fare una premessa, quello che
1352490	1357910	accade ci fa vedere con maggiore
1359690	1362870	chiarezza che cos'era quel vecchio
1363410	1364870	regime che si sta disgregando.
1367870	1370030	Quel vecchio regime non era soltanto
1370030	1371870	un pugno di politici corrotti.
1374030	1375890	Il vecchio regime non era la
1376650	1378370	partitocrazia, come si è detta con una
1378370	1382090	parola che non mi piace e che ambigua,
1382290	1384330	tra l'altro perché rischia di
1384330	1386510	confondere le responsabilità di tutti
1386510	1390190	i partiti come se tutti fossero stati
1391030	1393990	eguali. Il vecchio regime era un
1393990	1397130	sistema di potere, un meccanismo di
1398710	1402370	sviluppo, era insieme l'occupazione
1402370	1404290	dello Stato da parte dei partiti di
1404290	1406990	governo, la distorsione in senso
1406990	1409410	clientelare e assistenziale dello Stato
1409410	1413570	sociale, ma anche un rapporto torvido
1413570	1417450	tra la politica e l'economia, un
1417450	1419890	rapporto all'insegna dello scambio,
1419970	1423810	della protezione, dei favori, delle
1424490	1427770	tangenti, altro che il libero mercato.
1430310	1432210	In fondo l'ha detto anche De Benedetti
1432210	1434430	che Tangentopoli è stato anche un modo
1434430	1436150	di essere del capitalismo italiano.
1438210	1442290	Di un capitalismo che ha vissuto più
1442290	1444190	di commesse pubbliche, di appalti
1444190	1446290	truccati, di trasferimenti di denaro
1446290	1449370	dello Stato, che non di capacità di
1449370	1453570	innovare, di rischiare, di competere sui
1453570	1458330	mercati internazionali. Questa è la
1458330	1462470	verità e oggi questa verità ci appare
1462470	1464770	sotto gli occhi in tutta la sua
1464770	1468490	evidenza. E voglio anche aggiungere che
1468490	1470070	non c'era molta differenza tra
1470070	1471710	capitalismo pubblico e capitalismo
1471710	1477650	privato. Anche qui la crisi sta facendo
1477650	1480070	giustizia di una chiacchiera ideologica
1480070	1482830	che ci ha attormentato per anni, secondo
1482830	1484830	cui l'economia pubblica era l'inefficienza
1485370	1488170	e lo spreco e quella privata era l'efficienza
1488170	1491430	e la produttività. Per cui quando si
1491430	1494470	diceva privatizzazioni in sostanza non
1494470	1496850	si intendeva un'operazione di
1496850	1499170	ricapitalizzazione, no, si intendeva che
1499170	1502210	gratis naturalmente, che i loro signori
1502210	1503890	non hanno mai tirato fuori una lira,
1505570	1508310	bisognava cedere il bastone di comando
1508310	1510430	alle grandi famiglie del capitalismo
1510430	1513350	italiano che loro avrebbero risolto il
1513350	1516350	problema. Alla famiglia Ferruzzi per
1516350	1519850	esempio, a Sama, ecco, adesso appare
1519850	1523070	chiaro, tra il crack del gruppo Ferruzzi
1523070	1524730	e quello dell'EFI non c'è nessuna
1524730	1528390	differenza, stessi metodi, stessa cultura
1528390	1532270	imprenditoriale, stessa classe dirigente
1533030	1537090	e la crisi del Paese è il fallimento di
1537090	1540410	una classe dirigente, non solo di un
1540410	1545970	una classe dirigente. Ecco, di fronte a
1545970	1548410	questa crisi si aprono due strade
1549970	1553730	nettamente diverse, cioè il nuovo di cui
1553730	1557530	tanto si parla, si può presentare con due
1558430	1560410	volti che oggi sono drammaticamente
1561970	1564790	contrapposti. C'è chi pensa che dal vecchio
1564790	1567410	regime assistenziale si esce attraverso
1567730	1571850	il liberismo selvaggio, attraverso la
1571850	1573670	disgregazione di un patrimonio di
1574910	1577590	solidarietà, persino attraverso una
1577590	1579910	separazione fra gli italiani, quelli del
1579910	1583930	nord e quelli del sud. C'è chi pensa che
1583930	1586970	quei pezzi di sistema produttivo, che
1586970	1588930	certamente tra loro erano assistiti,
1589010	1591950	improduttivi, vanno semplicemente
1591950	1597010	spazzati via, senza curarsi, né del carico
1597010	1600010	di sofferenze umane e sociali che questo
1600010	1603310	produce, né poi del fatto che un grande
1603310	1607170	paese, se certo deve tagliare le aziende
1607170	1609390	improduttive, dovrà anche cercare di
1609390	1611650	avere delle aziende produttive, sennò
1611650	1614490	diventeremo una specie di parco
1614490	1618110	turistico dell'Europa. Quindi viene
1618110	1623190	avanti un nuovo che ha il volto di un
1623190	1625770	liberismo selvaggio, di una nuova
1626650	1631550	destra, c'è la Lega di Bossi, ma basta
1631550	1632970	leggere l'editoriale del Corriere della
1632970	1636310	Sera di Angelo Pan e Bianco, dove si
1636310	1638770	invita il governo ad usare il pugno di
1640070	1642730	ferro contro gli operai di crotone.
1643950	1646830	Sì, proprio così, è una citazione
1648370	1650230	testuale, tanto per cominciare a dare
1650230	1654750	un esempio. Beh, io penso che questo
1654750	1657710	nuovo rischia di essere peggio del
1657710	1661390	vecchio e penso che il compito nostro
1661390	1663450	è invece mettere in campo una proposta
1663450	1667110	di governo alternativa, che non è la
1667110	1669070	difesa del vecchio assistenzialismo.
