start	end	text
5740	16980	Cioè di quel blocco di interessi che ha sostenuto la maggioranza di penta partito e che si ritrova
16980	25500	largamente come sostegno delle forze che hanno vinto le elezioni e di quello schieramento
25500	36700	di centrodestra che si va componendo sulla base della crisi del Partito Popolare. Da
36700	43780	questo punto di vista c'è una sostanziale continuità e cioè l'asse di governo del Paese
43780	58660	continua ad escludere le forze più rappresentative del lavoro dipendente e del mondo intellettuale.
58860	65000	Se si fanno delle ricerche, sono state fatte anzi, su quali siano le basi sociali della
65000	72340	sinistra si scopre che queste basi sociali sono tanto più forti, tanto più ci si sposta
72340	80180	verso il lavoro dipendente a più alto contenuto intellettuale. Questo è un elemento di continuità
80180	86840	della storia italiana, cioè nel senso, nel trascorrere di tutti i regimi, di tutte le
86840	101780	repubbliche la storia dell'Italia unita ha visto questo mondo all'opposizione. La seconda
101780	119460	questione, secondo punto di continuità molto forte è rappresentato con la eccezione della
120720	131380	destra da una sostanziale continuità di classe dirigente. Certo se noi isoliamo il ceto politico
132300	139340	nel ceto politico c'è stato un cambiamento, ma se noi adottiamo una nozione più ampia
139340	149240	di classe dirigente, classe dirigente del Paese, e cioè guardiamo al mondo imprenditoriale
149240	162000	della finanza, dell'alta burocrazia dello Stato, noi abbiamo nel passaggio una sostanziale
162000	171020	continuità della classe dirigente. Mutano le forme di organizzazione, mutano le forme
171020	177780	politiche, finora mutano perché è anche in campo il disegno di sostanza di ricostituire
177780	184200	la democrazia cristiana. Non so se questo disegno riuscirà, ma in buona sostanza il
184200	191300	disegno politico dell'onorevole Buttiglione è quello di ricostituire un po' più a destra
191300	201180	una forza che sia erede di quel blocco interclassista della democrazia cristiana. Io quindi vedo
201340	212000	fortissimi gli elementi di continuità, vedo un rischio che della Prima Repubblica si disperdano
212000	221200	alcuni valori positivi nella sostanziale continuità del blocco sociale e delle classi dirigenti
221200	230620	che sin qui esprimono la maggioranza del Paese. Un elemento positivo era quel complesso di
232100	240080	rapporti tra le forze politiche che sia pure nel quadro di una democrazia bloccata ed anomala
240080	249200	tuttavia hanno garantito la democrazia del Paese, cioè quella comune responsabilità
249200	256460	delle forze politiche per cui c'era un limite dello scontro politico. Lo scontro politico
256460	264900	poteva essere anche molto aspro, ma nel momento in cui metteva in gioco alcuni valori fondamentali,
265000	274240	interessi fondamentali del Paese, lì lo scontro politico si arrestava. In fondo tra la democrazia
274240	280000	cristiana e il Partito Comunista c'è stato un conflitto storico, ma il giorno del rapimento
280000	287160	di Aldo Moro, ricordo la riunione della direzione del Partito Comunista, che era di tutt'altro avviso
287160	293300	che non votare alla fiducia del governo Andreotti anche per la sua composizione, ma ricordo anche
293300	301880	che di fronte a questioni che mettevano in gioco il sistema democratico, la lotta politica si arrestava.
301920	309980	C'era un senso della comune responsabilità delle forze che avevano dato vita alla Repubblica,
309980	317740	la Repubblica Democratica. Io oggi vedo smarrirsi il senso di questa comune responsabilità.
318940	325880	E la seconda questione che mi preoccupa è che un tessuto di regole, che certamente erano usurate,
327080	336380	consumate, si è lacerato, ma io non vedo la preoccupazione dell'insieme delle forze in campo
336940	348260	a definire un tessuto di regole nuove. Questo è il vuoto che è stato lasciato anche dalla precedente
348260	358940	legislatura. Noi rischiamo di concluderne un'altra, in buona sostanza, nel vuoto di un nuovo assetto
359070	369550	costituzionale. Il rischio è che ad un assetto costituzionale fatto di regole condivise si
369550	378070	sostituisca una costituzione materiale del maggioritario, ma un maggioritario senza contrapesi,
378070	390910	senza garanzie, è un maggioritario di comando e in questo Paese non si governa, se non in un quadro
390910	398750	di regole di valori condivisi. Nessuno si illuda di comandare. Chiunque vinca le elezioni non
398750	405510	governerà, se non in un quadro di regole di valori condivisi. Questo è un elemento fortissimo di rischio.
408750	420810	Queste sono le preoccupazioni, sono anche le ragioni che ci hanno spinto a proporre in diversi
420810	428110	momenti l'esigenza di una fase costituente, l'esigenza di una comune assunzione di responsabilità.
428830	441390	Torneremo su questo punto. Della Prima Repubblica penso che l'aspetto fondamentale da ricostruire,
441450	446950	da recuperare, è la comune responsabilità di fronte alla democrazia, di fronte agli interessi
446950	452170	del Paese. Il sistema politico non vive senza questo. Poi mi consente a Pirani un'osservazione
452170	468850	di carattere personale. Io respingo un'immagine. Non è affatto detto che la compostezza e la
468850	480810	tranquillità nel fare il proprio lavoro debbano essere interpretati come assenza di riferimento
480810	486330	a valori, tradizioni, passioni. Ognuno di noi è profondamente legato per quanto riguarda
486330	495050	un mondo, una tradizione, un sistema di valori. Il problema vero è che noi viviamo in una
495050	504010	fase già talmente delicata che soprattutto per chi si trova a rappresentare da una parte
504010	514230	e dall'altra il grosso delle forze, della destra e della sinistra, lo sforzo che conviene
514230	522970	fare è quello di contribuire alla serenità. A me qualche volta scappadetto anche qualcosa
522970	530090	di troppo. Semmai da questo punto di vista bisogna fare uno sforzo ancora maggiore,
530650	539450	ma sono convinto che se da parte di alleanza nazionale del PDS si contribuisse, se io dicessi
539450	544730	una cosa del tipo, vorrei porre un quesito ad onorevole fini su questo, del tipo di quello
544730	551630	che ho letto sui giornali di oggi, specularmente, che l'Italia è dominata dai comunisti, come ha
551630	558210	detto l'onorevole Berlusconi, quando gli unici comunisti che esistono ancora in questo paese
558210	565490	sono su molte importanti questioni, più d'accordo con Berlusconi che con me, e che questi comunisti
565490	572270	che dominano il paese attentano alla mia vita, e questo ho detto ieri, vogliono eliminarmi
572270	579950	fisicamente, se mi mettessi anch'io e se mi mettessi anche i fini a dare alla vita politica
579950	585330	italiana un'intonazione di questo tipo, io non so dove andremo a finire e quindi le
585360	591120	passioni ci sono, ma penso che ci debba essere anche quella serenità e quell'autocontrollo
591120	595520	che consentono di governare un passaggio così delicato e difficile per la nostra storia
595520	607000	nazionale. Grazie, Salema Gianfranco Fini. Io vedo sui cartellone delle nostre strade per la
607000	614840	parola d'ordine delle elezioni regionali di Forza Italia è per rimanere nella libertà, cioè addirittura
614840	621480	l'idea è che se dovesse vincere il centrosinistra a livello delle regioni sarà soppressa la libertà
621480	629720	regionale. Quindi questo è un punto essenziale. Io ritengo che Alleanza nazionale farebbe
629720	638760	cosa utile alla democrazia italiana se aprisse una dialettica e un'aperta polemica contro
638760	647280	il modo strumentale con il quale il suo principale alleato conduce la battaglia politica attraverso
648760	655660	la riproposizione di una pregiudiziale ideologica che non ha più alcun senso e che si presenta in
655660	664340	forme talora persino ridicole. Io, capo di una fazione, ora mi dovete consentire che questo
664340	671500	tipo di campagna che a mio giudizio non aveva nessun fondamento né nel risultato elettorale
672040	680880	né in qualsiasi interpretazione al mondo si possa dare del maggioritario, è una campagna che rivela
680880	688060	una cultura plebiscitaria e anche una cultura antiparlamentare. Ora vogliamo costruire una
688060	693980	democrazia più diretta? Costruiamola. D'altro canto il senatore Cossiga che ne è stato uno
693980	699840	dei massimi propagandisti ha anche detto durante la crisi di governo, primo che era del tutto
699840	705120	legittimo fare un'altra maggioranza parlamentare, secondo che egli è favorevola ad una democrazia
705120	710820	diretta ma che in Italia non essendoci non si può dire che un'altra maggioranza parlamentare sia la
710820	723280	violazione della democrazia. Ma allora bisogna che noi ne definiamo le regole ed è per questo a
723280	733560	dire che noi stiamo commettendo un errore, l'errore di andare, vi andremo giugno-ottobre ad una campagna
733560	740720	elettorale che sarà uno scontro drammatico, nel corso della quale noi diffonderemo una grande
741640	753260	illusione, l'illusione cioè che con il risultato elettorale i cittadini scelgano un premier, un
753260	759620	scontro di mediazione dei partiti perché abbiamo una legge elettorale che in realtà affida alla
759620	765080	mediazione dei partiti la stabilità dei governi, perché abbiamo una costituzione nella quale i
765080	771380	parlamentari è scritto operano senza vincolo di mandato. Noi andremo ad una campagna elettorale
771380	779080	drammatica fondata su una grande illusione anziché fare quello che una classe dirigente responsabile
779080	783600	avrebbe dovuto fare, avrebbe dovuto dire un momento. Noi abbiamo avuto una falsa partenza
783600	793120	del maggioritario. Adesso ci pigliamo 6, 7, 8 mesi di tregua, riscriviamo alcune regole fondamentali
806240	812840	non è scritta nella legge, nell'ordinamento e dopo andiamo alle elezioni in un clima diverso
813780	822600	e avendo creato le condizioni effettive perché le elezioni garantiscano stabilità e io credo
822600	827860	che anche in questo errore che viene soprattutto dalla destra, non mi spaventano le elezioni,
827960	833500	le faremo, c'è l'illusione che anche il problema delle regole si possa risolvere con
833500	841160	una spallata elettorale, ma in questa illusione c'è secondo me un residuo plebiscitario e
841160	843840	illiberale di questa destra che mi preoccupa.
844720	852640	Dall'Emma credo che per finire avrà occasione nella prossima ed ultima domanda di rispondere
852640	859500	dopo darò la parola ad Antonio Maccanico. Ecco, vorrei chiedervi da ultimo. Voi andrete
859500	867060	alle elezioni ognuno dietro un altro leader che non siete voi, riuni dietro Prodi gli altri
867060	874500	dietro Berlusconi, pur essendo ambedue le forze politicamente fondamentali anche dal
874500	878640	punto di vista dell'elaborazione del pensiero, dell'elaborazione di una politica dei due
879580	886320	schieramenti. Ecco, ma voi con quale idea andate in modo particolare nel libro di Maccanico?
886360	895580	Ci sono molti punti che riguardano un momento che vedo da lui, viene un po' l'età di
895580	899520	risultato un po' merica dal punto di vista della svolta economica. Il governo Ciampi,
899560	904480	il primo governo amato è il governo Ciampi, dice che con il governo Ciampi si è dimostrato
904480	910120	che esiste una strada virtuosa di gestione del debito. Nonostante le difficoltà della
910120	914860	fase ciclica negativa, il momento culminante della peggiore recessione degli ultimi 20
914860	921060	anni, l'obiettivo rappresentato dalla stabilizzazione del rapporto tra debito e prodotto interno
921060	926100	negli orizzonti concreti della politica economica italiana. Lui poi qui parla di aver recuperata
926100	931720	credibilità del Paese, dell'abbassamento dei tassi di interesse, di una stagione che
931720	939260	sembrava, come dire, innestare in modo permanente un circolo virtuoso che si è rotto. Adesso
939260	946120	voi gli uni o gli altri andate dal governo. Ecco, siete in grado in modo, come dire, schematico
946120	953500	ma sostanziale di dirci con quale idea, dal punto di vista del debito pubblico, voi ci
953500	964940	andrete, cosa porterete in dote alla immagine di Prodi e Berlusconi. Berlusconi sembra soltanto
964940	972340	esprimersi in termini molto generali di un miracolo che verrebbe dalla mancanza delle
972340	976940	intercettazioni, che fosse da un'economia dell'offerta che dovrebbe rinnestarsi, ma
976940	982340	più in là di così non si va. Mi pare che da questo punto di vista resta un interrogativo
982340	990840	generale a cui l'elettorato non sa ancora quali contenuti dare. Ecco, comincerei adesso
990840	991780	forse da fini.
997340	1002320	Il famoso principio dell'alternanza. Mi applico il principio dell'alternanza.
1004980	1021700	Io credo che noi andiamo in questo Paese verso la costituzione di due coalizioni che certamente
1021700	1032120	per una fase saranno costituite di una pluralità di soggetti politici, ma che secondo me individuano
1032120	1045500	molto chiaramente i tratti comuni di ciascuna. Io credo che al di là di chi sia il candidato
1045500	1054740	Premier del centrodestra, io vedo una forte continuità culturale, politica tra l'onorevole
1054740	1062100	fini e l'onorevole Berlusconi. È difficile vedere dov'è il Paese, è difficile vedere
1062120	1071520	il punto di cesura e per quanto mi riguarda io sento una forte affinità culturale e politica
1071520	1078920	con il Professor Romano Proti. Vedo che c'è un terreno comune di giudizio sul nostro Paese.
