start	end	text
0	9920	sulle ragioni per cui il patriottismo suscitato dalla resistenza non divenne cultura comune,
11200	20520	per usare un'espressione che fu di Benedetto Croce, anche se evidentemente quella rottura
20520	28860	ha continuato a operare nella storia del nostro Paese, come un elemento importante
33820	45700	di appartenenza di un mondo democratico italiano, come elemento comune nel rapporto tra le
45700	55820	grandi forze politiche che senza dubbio hanno rappresentato i grandi partiti popolari, i
55820	61960	mediatori di quella forma di coscienza nazionale che si è determinata nel nostro Paese in
61960	70940	questi 50 anni. Sono stati la corda, per dire con Bodei assolutamente, una corda alla quale
71740	78740	ha pensato che l'Italia rischiasse di rimanere in piccata, ma che per molti anni hanno svolto
79600	91840	una funzione di coesione avendo in comune quella radice antifascista e la Costituzione come elemento
91840	121820	di appartenenza. Nella storia italiana il nesso nazionale internazionale si
121820	132280	presenta sempre come dominante, che poi significa a partire dalla rottura dell'unità antifascista
132280	142140	innesso antifascismo e anticomunismo, e quindi il coesistere di due elementi di coesione,
142140	153160	di unità. L'elemento dato dalla appartenenza comune delle forze democratiche alla scelta
153160	161320	antifascista e dalla Costituzione, e l'elemento dato dalla scelta occidentale, dalla collocazione
161320	170280	del nostro Paese dentro un sistema di alleanze politico-militari. Questi due elementi giocano
170280	183020	fra di loro in una persistente coabitazione e contraddizione. Si potrebbe persino dire
183020	192620	che sono gli elementi costitutivi delle due dimensioni dello Stato, che hanno caratterizzato
192620	199040	la storia italiana di questi cinquant'anni. L'antifascismo è l'ideologia dello Stato
199040	206700	democratico, dello Stato legale, dello Stato del Parlamento, dei partiti. L'anticomunismo
206700	216520	è l'ideologia del doppio Stato, dello Stato degli apparati, dei poteri, poteri rilevanti
216520	223860	che hanno agito nella storia nazionale. In questo senso, io credo che solo guardando
223860	230720	le cose in questa ottica, noi capiamo perché nel momento in cui giunge ad una disgregazione,
230780	240280	ad una crisi la Repubblica democratica, la legittimazione dell'estrema destra avviene
240280	247100	come un passaggio naturale largamente condiviso. In realtà l'estrema destra è stata una
247100	253840	forza ai margini della Repubblica del Parlamento e dei partiti, ma è stata una forza costitutiva
256860	264540	di quell'altra dimensione dello Stato, una forza ben interna, diciamo, ad una dimensione
264540	272000	importante del potere nel nostro Paese. E d'altro canto, diciamo, la forza di quei collegamenti,
272300	277400	di quei rapporti sono venuti in evidenza, diciamo, in un processo che non ha conosciuto
278000	284780	non ha conosciuto traumi, poi Fini ha provveduto a mettere il tutto in bella copia, diciamo,
285240	292600	ma non c'è stato bisogno che Fini riconoscesse il valore dell'antifascismo perché una parte
292600	296920	della borghese italiana scendesse in campo e dicesse si vota Fini e non Rutelli a Roma,
297280	303100	è venuto dopo, diciamo, ma non c'era bisogno, c'era qualcosa di naturale, c'era un legame
303100	311200	che aveva una forza. E questa è la prima considerazione che volevo fare. Faccio un salto all'altro
311200	319480	momento che De Felice considera effettivamente come cruciale, e cioè quella grande operazione
319480	327400	di modernizzazione, quel tentativo di costruire un modello inclusivo, e gli dice di appartenenza
327400	339040	nazionale e quindi di avviare un superamento delle ragioni di quella frattura che si ha
339040	345960	con la lunga stagione del centro-sinistra. La stagione del centro-sinistra, in realtà,
347520	355720	attraversa gli anni sessanta e settanta, a mio giudizio con una sostanziale continuità e la
356160	362220	nazionale altro non è, a me pare, che non il punto culminante della stagione del centro-sinistra,
362260	368820	cioè il momento in cui il centro-sinistra diviene pienamente tentativo di collaborazione fra il
368820	374560	centro e la sinistra. E, d'altro canto, la linea togliattiana, diciamo, di fronte al primo
374560	382820	centro-sinistra imposta chiaramente quella che Beppe Vacchia chiamava la politica di un reciproco
382820	389260	assedio, diciamo, che culmina in continuità con la scelta togliattiana nella politica della
389260	396980	solidarietà nazionale del compromesso storico, cioè l'idea di concepire la collaborazione di
396980	403120	governo tra socialisti e democristiani come un passaggio verso una più larga collaborazione
403120	415480	tra la sinistra e il Centro Democratico Cattolico. Ora, io credo che bisogna continuare a ragionare
415480	426260	sul perché dell'esaurimento e del fallimento di questa grande operazione. Certamente, ancora una
426260	436020	volta ha giocato un ruolo molto importante, il nesso nazionale internazionale. E non soltanto
436020	445580	nel senso che questo decisivo passaggio politico è stato continuamente insidiato, diciamo,
448220	459160	dalle forze di un doppio Stato che hanno combattuto questo processo politico, attraverso
459160	468180	anche gli strumenti illegali del terrorismo, del condizionamento, anche attraverso mezzi
468180	473860	illegali del processo politico democratico. Ma, direi, il nesso nazionale internazionale
473860	483740	ha giocato anche attraverso fatti ben più chiaramente visibili, l'acquirsi di una contrapposizione
483740	498500	fra i blocchi che, penso a tutta la vicenda euromissili, che sicuramente ha rappresentato
498500	507780	un punto di difficoltà di quella politica e l'intervenire negli Stati Uniti, in Inghilterra,
507880	515620	di una svolta neoconservatrice, neoliberista, di una spinta a destra internazionale che ha agito
515620	520980	anche qui come elemento di lacerazione della possibile collaborazione tra le forze politiche
520980	527980	democratiche. E, tuttavia, io penso che abbia giocato, nella sconfitta di questa grande
527980	537680	operazione di costruzione, di ricostruzione di una appartenenza nazionale, ha giocato
537680	543300	anche l'assenza di un progetto riformatore nazionale, cioè una debolezza delle classi
544210	555330	che sono state protagoniste di questo processo. L'assenza di un progetto riformatore nel campo
556030	568810	economico e istituzionale, io considero decisivo questo nesso, che lì, secondo me, si avvia un
569290	575170	processo di disgregazione dello Stato e quindi della sua capacità di guidare i processi di
575170	581670	modernizzazione, di integrazione europea. L'assenza, quindi, di un progetto riformatore,
583410	590250	il prevalere anche, direi soprattutto, nelle forze maggiori della sinistra, di una visione
590250	601370	istituzionale conservatrice, presa di infilata dalla pregiudicatezza, dal cinismo della modernizzazione
601370	607490	craxiana, ma che conteneva in sé un nocciolo di verità, altrimenti non avrebbe tenuto banco per
607830	620310	12 anni nella vita politica italiana, c'è niente da fare. Ed anche la debolezza, al di là di un
620310	629370	riferimento comune, politico, qualche volta Napolitano dice, in qualche caso sconfinato in
629370	637610	una sorta di mito dell'Europa, la debolezza invece di un progetto di integrazione politica, economica,
637610	648110	sociale, culturale in Europa, come condizione non di annullamento della identità nazionale italiana,
649230	660950	ma direi costruzione di un solido legame fra questa identità ed una civiltà europea, anche come
660950	670410	capacità di resistenza, di contrattacco culturale contro una disgregazione della civiltà, dell'identità
671510	678030	europea, nella chiave di un'americanizzazione individualistica, appunto, e disgregante.
680590	686870	Io credo che il fallimento della lunga decisiva stagione del centro-sinistra, che è poi quella
686870	694890	che apre purtroppo la crisi degli anni Ottanta, sta anche qui. E non lo dico, diciamo, perché
694890	703610	ritengo che sia come considerazione sul passato, ma perché penso che il tenere conto di questi
703610	714150	errori, di questi limiti di progetto riformatore sia essenziale oggi, per non ripetere quegli
714380	722020	errori in un momento in cui la sfida si affronta da posizioni assai più difficili e drammatiche.
722180	727440	In fondo, allora, i grandi partiti democratici hanno perso alla fine degli anni Settanta,
727500	733800	all'inizio degli anni Ottanta, la possibilità di essere loro a guidare il processo di trasformazione,
733820	739980	di modernizzazione dell'Italia. E le conseguenze di questa sconfitta le abbiamo sotto gli occhi
740080	748220	e non sono gradevoli, a mio giudizio. E negli anni Ottanta, la disgregazione del sistema
748220	764840	politico-istituzionale dei mediatori, appunto, ed anche l'emergere dell'incapacità di un forte
764940	774300	governo, di affrontare quei nodi strutturali, il carattere asfittico del nostro mercato nazionale,
775000	782900	dominato da ristrette oligarchie attraverso l'uso del denaro pubblico, quel tipo di rapporto sul
782900	791560	quale più volte ci ha intrattenuto Alfredo Reichlin. Io spero che torni a ragionare su questo. Tra
791560	801860	il capitalismo italiano, partiti, spesa pubblica, l'incancrenirsi di questo sistema e quindi le
801860	808280	forme che ha assunto peculiari in Italia, quel fenomeno europeo della crisi del welfare,
810240	821540	hanno gettato le basi del formarsi di una ondata reazionaria di massa. Io penso che la sinistra
821540	833460	sia stata in gran parte inconsapevole e che nel momento della crisi di questo sistema abbia
835500	843400	accettato categorie, modi di ragionare sulla società italiana che erano subalterni. Io penso,
844500	851520	per esempio, per fare un esempio non piccolo di una categoria subalterna, l'idea che la crisi
851520	866020	italiana fosse, derivasse, avesse al centro la nozione di partitocrazia per esempio, quando la
866020	871460	disgregazione del sistema politico, istituzionale, democratico degli anni 80 è appunto crisi dei
871460	880120	partiti e loro trasformazione, certo in una somma di clientele, di gruppi di potere, ma il venire
880120	887800	meno di una loro funzione nazionale. E almeno questo andava chiarito, non tanto per capire
887800	896100	quello che succedeva, quanto per sapere che cosa si deve fare. E invece in questo modo si è aperta
896100	926080	la strada e invece in questo modo si è aperta la strada e invece in questo modo si è aperta la strada
933940	940860	Qui si dovrà un po' ragionare, lo dico a tanti i nostri amici e compagni che hanno visto nella
940860	951080	questione comunista, diciamo, fondamentalmente un fattore di divisione e di arretratezza del
951080	958380	nostro Paese. Si dovrà ragionare sul fatto che nel momento in cui scompare la questione comunista,
958620	969260	diciamo, e invece si presenta di fronte a noi una delle più drammatiche fratture che la società
969260	975320	italiana abbia conosciuto in questi 50 anni. Vuol dire che c'era anche qualcos'altro che appartiene
975320	982860	al modo di essere delle classi dirigenti di questo Paese. Non c'era soltanto questa anomalia
982860	990940	che spaccava l'Italia, la teneva fuori dall'Europa. O sul paradosso che io ieri scherzosamente,
991140	996760	diciamo, il quale ho parlato al congresso radicale, per dire guardate come strana la
996760	1005300	vita. Noi ci siamo separati, purtroppo, un pezzo grande di quella tradizione ha dato vita a un
1005300	1011840	pratica e poi si è formato un partito neocomunista. E il paradosso qual è? Che Bertinotti si è portato
1011840	1019460	il comunismo, sia pure una versione secondo me particolarmente iperbolica e inoffensiva. Ed è,
1019460	1035280	come dire, vezzeggiato da tutti. E noi ci siamo portati l'anticomunismo sulle spalle. Ed è un
1035280	1044580	cultura antidemocratica, diciamo, che percorre il modo di essere, di ragionare, una parte importante
1044580	1053040	delle classi dirigenti del nostro Paese. Cioè che, diciamo, Berlusconi è un uomo che affronta in modo,
1053660	1060120	come dire, concreto e sbrigativo l'intrigo delle culture politiche del Novecento. Per noi i comunisti
1060120	1065380	sono quelli che gli danno fastidio o gli possono contendere il potere, diciamo. Quelli che non gli
1065380	1071640	danno fastidio non gli possono contendere il potere, non meritano questo aggettivo, diciamo. Però lui
1071640	1079260	interpreta bene, diciamo, un modo di ragionare, di una parte della borghesia italiana. Così si è
1079260	1084640	venuto costituendo, io vedo qui l'elemento di rischio per l'unità del Paese, molto più che
1084640	1096680	nella Lega. La Lega è stato lo scricchiolio. Certamente esiste una questione meridionale e
1096680	1106360	una questione settentrionale, ma queste questioni spezzano il Paese, al mio giudizio, non tanto
1107080	1114580	territorialmente. La frattura è verticale. La vera frattura che è emersa, è una frattura
1115780	1122660	verticale, è il formarsi di un blocco sociale illiberale in cui si mescolano, diciamo, una
1122660	1135120	versione italica del liberismo in cui, diciamo, la libertà individuale confina molto con il diritto
1135120	1146280	dell'illegalità, l'illusione collettiva di aggirare il nodo del risanamento e quindi dell'Europa e,
1147400	1152880	naturalmente, dietro l'illusione di aggirare questo nodo si nasconde più concretamente forse
1152880	1159400	la speranza che questa questione possa essere affrontata di nuovo attraverso una feroce scelta
1160000	1167340	cioè una compressione dei diritti del lavoro dipendente, questo impasto di rabbie, paure,
1167480	1179480	di egoismi sociali che rischiano di spaccare in due il Paese e di far sì che il confronto politico
1179480	1186440	non sia più racchiuso dentro un quadro di valori condivisi, di regole, entro il quale,
1186720	1191580	sommato, anche nei momenti più aspri della guerra fredda i grandi partiti popolari proprio
1191580	1201780	perché uniti dalla corda dell'antifascismo hanno saputo regolare i conflitti. Io credo che la
1201780	1207380	sinistra si trovi di fronte a questo grande problema e che non lo si può affrontare soltanto
1207380	1212920	demonizzando questa destra, che certo va vista per quello che è ed è questo il mio giudizio,
1212920	1218680	non come pensa il professor Buttiglione un gruppo di elettori della democrazia cristiana momentaneamente
1218680	1226120	in libera uscita, ma la questione non può essere affrontata soltanto demonizzando questa destra.
1227420	1236540	Io sono molto d'accordo con Rusconi, credo, credo profondamente che intanto affrontare questa
1236540	1246560	sfida comporti per la sinistra prendere di fronte al tipo di idea di nazione, di identità nazionale,
1246680	1253940	di cui questa destra è espressione, che in parte, diciamo, ha quella radice etnica zoologica alla
1253940	1260920	quale lui faceva riferimento e in parte però, perché qui c'è il nuovo, diciamo, proietta questa
1260920	1269240	radice etnica in una dimensione virtuale calcistica, pensiamo al fascino di Forza Italia, quindi
1272640	1280800	il problema è quello se la sinistra oppone a questo, diciamo, uno snobismo cosmopolita
1284220	1293760	si chiude inesorabilmente in una dimensione minoritaria. Se la sinistra invece oppone a questo,
1293960	1301720	diciamo, non soltanto l'indicazione, poi dirò e concludo, di un processo di ricostruzione,
1304220	1309820	perché penso anch'io, diciamo, che l'idea di nazione non è un'idea immediata,
1309820	1317560	comporta una ricostruzione. Allora basta col mito dell'antipolitica, perché la ricostruzione è
1317560	1324580	istituzioni, economia, soggetti, altrimenti non c'è ricostruzione, facendo solo le leggi elettorali,
1326460	1335040	ma quest'opera di ricostruzione deve essere retta dal recupero di un'idea, al fare nostra,
1335040	1343360	un'idea forte di rinnovamento civile dell'Italia, di una tradizione repubblicana che concepisce la
1343360	1350260	nazione come un'etica civile condivisa, come un'ideale superiore, diceva Benedetto Croce,
1350400	1357400	agli interessi di parte, utile anzi necessario a garantire lo svolgersi regolato del conflitto
1360220	1368880	politico. Un'idea di appartenenza nazionale che deve essere fortemente legata, secondo me,
1368960	1374860	si colloca dentro il processo dell'unità europea. Noi siamo per la prima volta nella storia della
1374860	1380540	sinistra italiana, almeno di quella della quale provengo io, nelle condizioni di appropriarci
1380540	1386440	del messo nazionale internazionale che ha giocato sempre contro di noi. Siamo di fronte ad un
1386440	1394560	curioso paradossale rovesciamento dell'anomalia italiana. L'anomalia è la destra oggi e l'unica
1394560	1402160	grande forza accreditata in Europa, o la maggiore, è la sinistra italiana. L'anomalia è la destra.
1403240	1410300	Fini può raccontare agli italiani di essere Ciscar, ma Ciscar non lo considera Ciscar. E invece noi
1410300	1414920	siamo nel paradosso che gli italiani non ci credono quando diciamo che siamo una grande
1414920	1421680	forza socialista europea, ma i socialisti europei ci considerano tali. Quindi in questo momento,
1422240	1432080	diciamo, la forza più europea, la forza che collega l'Italia, l'Italia, Europa, mondo, è la sinistra.
1434540	1441960	E questo deve essere un grande elemento di forza della nostra proposta di ricostruzione di un'idea
1443760	1450680	e l'altro punto è l'innovazione, il coraggio dell'innovazione, l'innovazione della forma
1450680	1457760	dello Stato in senso anti-centralistico, anti-burocratico, il coraggio di assumere gli
1457760	1466760	elementi di verità, anche degli scricchiolì leghisti. L'autogoverno è una ricchezza.
1468630	1473670	L'autogoverno non è quello della Lega, la divisione artificiosa dell'Italia in tre nazioni che non
1473670	1480410	esistono nella nostra storia. L'autogoverno è la capacità di collegarsi ad una grande ricchezza,
1480430	1485790	articolazione. La Lega è stata sconfitta anche per questo. Io me ne sono accorto quando Bossi
1485790	1491730	andava a Venezia e diceva Venezia deve essere la capitale della Padania, diciamo, e naturalmente
1491730	1496350	non è così perché la storia di Venezia non è questa. Quelli hanno passato centinaia di anni a
1496350	1505150	combattere contro i Padani e a difendere la loro proiezione, invece, mediterranea verso l'Oriente e
1505150	1511650	quindi il federalismo della Lega è stato sconfitto anche perché incolto, anche perché al nord si è
1511650	1519170	presentato come una rozza pretesa di egemonia della nazione lombarda, diciamo così. Quindi ha
1519170	1525210	fatto arrabbiare quelli del Friuli, quelli del Trentino. Quindi il problema è di cogliere
1525210	1532850	l'elemento di verità e puntare all'autogoverno, alla sussidiarietà come chiave per costruire un
1532850	1539470	nuovo rapporto fra cittadini e stato, più trasparente. Io so quanto ti do, vedo come tu
1539470	1547070	utilizzi queste risorse e anche la solidarietà diventa un fatto trasparente. So quanto do per
1547070	1555190	la solidarietà e poi mi devi spiegare a che cosa questo deve servire. L'altra questione è forza
1555190	1564510	di governo. C'è un tema della governabilità. A sinistra si è girato intorno. Il risultato è
1564510	1570070	che noi siamo in un Paese dove c'è il presidenzialismo di fatto senza pesi e contrapesi,
1571510	1578410	perché l'uninominale con tanti partiti fonda il presidenzialismo di fatto, perché l'unico modo di
1578410	1584050	tenere insieme coalizioni multipartitiche sta nel fatto che esse si riconoscono in un candidato
1584050	1592170	premio. Io non so che cosa, io so che questo discorso suscita a tante paure e che torna la
1592170	1598790	bellissima espressione bisogna difendere la Costituzione. Io non vorrei che noi pensassimo
1598790	1605250	di schierare le nostre truppe a difesa di una linea del chiave mentre il nemico sta bivaccando
1605250	1614830	e diciamo sì verso la capitale. Noi abbiamo vissuto una crisi politica che è stata una
1614830	1619810	drammatica crisi istituzionale perché alcuni milioni di italiani erano convinti di avere
1619810	1631570	eletto il capo del governo e c'era un elemento di ragione nella loro convinzione e questa falla
1631870	1640050	va riempita con il coraggio di definire le forme di una governabilità che si fondi in modo più
1640050	1647650	diretto sul voto dei cittadini e nello stesso tempo di garantire controlli, di valorizzare
1647650	1655870	espressioni autonome del paese, della società, di controllo e delle istituzioni, di avere sedi
1655870	1662850	luoghi per una verifica delle responsabilità dei governanti e questa questione va affrontata
1662850	1673870	per quello che è e non proponendo difese di cose che non ci sono più e quindi i punti,
1673870	1682170	e concludo, sono due. La sinistra italiana può partecipare a quest'opera di ricostruzione di
1682170	1691650	una identità nazionale innanzitutto ricostruendo se stessa al di fuori di ogni visione provinciale
1691650	1702010	del caso italiano, come una grande sinistra europea, democratica, legata al socialismo europeo,
1702150	1708130	all'internazionale socialista, cioè all'unica sinistra che c'è, che c'è come fatto mondiale,
1708130	1717210	al di fuori di questo non esiste sinistra, sinistra esiste soltanto se è un fatto mondiale e intorno
1717210	1723910	a questa idea bisogna lavorare a rimettere insieme le famiglie, i gruppi, non soltanto di
1723910	1728190	una sinistra di ispirazione socialista, che comunque viene dal movimento operaio, ma anche
1728190	1733970	di una sinistra cattolica, laica, democratica, che può e deve partecipare a questo progetto.
1736230	1740310	Questa riorganizzazione della sinistra a questo punto deve guardare agli elementi di
1740310	1745070	ricomposizione più che agli elementi di frattura, elementi di frattura sono chiari,
1745250	1752510	ciò che non siamo più, il problema essenziale è ciò che vogliamo essere e deve muoversi su
1752510	1760410	un asse di governo, deve essere pensata per il governo del paese in collaborazione con forze
1760410	1767570	moderate, laiche e cattoliche del centro. La seconda questione è quella del patto,
1769430	1779370	io so bene quanto è anche arduo di fronte ad una destra così forte assumere la proposta di un
1779370	1787850	patto costituente e come possa essere forte invece la tentazione di stare sulla parola d'ordine la
1788140	1801080	della costituzione, ma sono convinto che la scelta forte è patto costituente, sfida costituente,
1801840	1809820	assumere noi cioè il grande problema anche della costituzionalizzazione di questa destra,
1811120	1819280	di un negoziato sulle regole e le istituzioni che devono contenere e normare il conflitto,
1820420	1826900	sapendo che non è facile ma che questa è oggi la posizione più forte e più rispondente agli
1826900	1832660	interessi nazionali, poi io non voglio avventurarmi sulle forme, vedo i rischi dell'assemblea
1832660	1840180	costituente, si può ragionare, sono tanti che se ne intendono molto più di me, ma sento che se la
1840180	1847720	sinistra non prende questa bandiera e cioè vogliamo negoziare, vogliamo gettare insieme
1847720	1855680	le basi di una nuova stagione della repubblica e in questo negoziare le regole c'è anche un
1855680	1863780	riconoscimento reciproco e allora forse noi possiamo domare la belva, altrimenti in un
1863780	1868700	conflitto senza regole c'è una lacerazione del paese e c'è una sconfitta della democrazia.
1876720	1882160	Allora ora dopo aver ringraziato Dallema interrompiamo,
1882980	1887980	vi preghiamo di essere nostri ospiti e ci rivediamo fra circa un'ora.
1920120	1930100	Mi pare che è uno dei punti che Franco De Felice indicava la mattina come
1931400	1938900	diciamo forse il primo punto, insomma, costituisce materia della nostra riflessione di oggi,
1939760	1944680	è stato mi pare un po' messo in ombra negli interventi che vi sono stati stamattina e mi
1944680	1949740	riferisco in particolare a quella che lui chiamava addirittura un'endiadi, cioè questo problema
1949740	1957220	della nazione che ci riconduce al problema dello stato, quindi stato e nazione addirittura come
1958960	1966580	equivalenti soprattutto se si riflette sui processi storici che hanno portato all'identificazione
1967600	1972540	della nazione con lo stato, il caso italiano in particolare, e proprio nel caso italiano
1972540	1979220	in particolare è importante sottolineare questo processo di identificazione perché l'Italia,
1979440	1986140	prima delle unità, era una nazione con più stati, quindi l'idea di un'identificazione statuale che
1987260	1993740	in un certo senso fa pensare anche alle contemporanee esperienze di un paese come la
1993740	2004160	Germania, ecco, l'identificazione è un problema che si ripropone nel momento in cui si accerta
2004160	2013260	lo stato di crisi non tanto della nazione quanto del sentimento che unisce gli abitanti di una
2013260	2021000	nazione e mi pare che un punto di riferimento anche importante iniziale proprio della nostra
2021000	2027320	riflessione è che se parliamo o se accertiamo senza drammatizzare l'esistenza di questa crisi
2027320	2034620	lo si fa perché si dà alla nazione, all'idea di nazione, al sentimento nazionale un valore
2034620	2039960	positivo, quindi siamo nella necessità di riflettere sulla positività di un valore
