start	end	text
0	9260	questo Paese sia governato, che questo Paese abbia una classe dirigente, che questo Paese
9260	22500	esca dal caos, da uno scontro senza principi e senza regole, da un falso cambiamento che
22500	36820	porta soltanto insicurezza, paura, dominio del più forte. L'Italia vuole serenità
38060	45240	e vuole qualcuno che cominci a cambiare davvero, cioè a fare le riforme, a far funzionare
45240	54040	meglio la scuola, gli ospedali, i servizi, ad aprire una speranza di lavoro. Ecco, queste
54040	65200	sono le ragioni dell'Ulivo. Per questo noi siamo in questo momento più forti, lo percepiamo
65200	73100	nella società, io non parlo, è proibito dei sondaggi, lo dico per la stampa, noi
73100	83120	non violiamo le regole, ma noi siamo una grande forza popolare e anche senza fare sondaggi
83120	98960	noi viviamo fra gli italiani e avvertiamo, avvertiamo in questi giorni che si sta spostando
98960	108140	qualcosa nella coscienza dei nostri concittadini. Vedete, la destra è stata in questa campagna
108140	120520	elettorale la forza del caos e della protesta, si è presentata con il volto del rancore
120520	128500	e della rabbia, si è preoccupata più di impedire a quelli che non la pensano come
128500	150500	loro di parlare che non di dire i propri argomenti, le proprie idee, le proprie proposte. Questa
150500	159400	pensate un momentino soltanto a che cosa accadrebbe nel rapporto fra le istituzioni
159400	169060	e fra i poteri dello Stato, domani se la destra tornasse al potere. Pensate un attimo a questa
169060	179280	campagna elettorale, a questi giorni decisivi nei quali si dovrebbe discutere del futuro
179280	189160	dell'Italia e la destra invece da destra infuria una confusa campagna contro la magistratura
189680	202440	di insulti, di minacce. Noi siamo una grande forza garantista, noi siamo una forza serena,
203040	211320	non siamo il partito delle manette, noi pensiamo che in un paese civile i diritti del cittadino
211320	221500	imputato siano sacri e che i magistrati possano essere criticati, ma una cosa è difendere
221500	229640	le garanzie o criticare un magistrato, altra cosa è chiamare i magistrati terroristi,
229640	241640	insultarli, minacciarli, pretendere di porli sotto il controllo del potere politico. Chi agisce così,
245600	259620	chi arriva a definire una sentenza, vedete, una sentenza può anche essere sbagliata e in un paese
259620	272680	non la si definisce un complotto o una pugnalata nella schiena, perché in questo modo si colpisce
272680	285000	non solo la magistratura, con una volontà di vendetta contro i magistrati che badate, tradisce,
285960	294200	se non lo sapessimo già, diciamo che all'origine di questo movimento di Forza Italia c'è il
294200	312660	lasciito ereditario di Bettino Craxi, noi ritroveremmo lo stile, no? Questo odio
312660	319820	contro i magistrati non ci ricorda lo stile dell'indimenticabile esule di Amamet, i suoi
319820	330860	assi nella manica. Altro che nuovo, si vuole tornare indietro, ma c'è qualcosa di più grave,
332220	340300	c'è che questo atteggiamento mina la convivenza fra i cittadini, perché quando viene dalla classe
341780	350780	dirigente il rifiuto della legalità, il rifiuto del ruolo e del potere della magistratura, che
350780	356900	cosa deve fare un cittadino comune? Ma perché mai un cittadino comune al fischio di un vigile urbano
356900	366260	si deve fermare anziché pensare che si tratti di un complotto politico, di un'azione di qualcosa
367160	375120	inaccettabile? Voi capite che quando si rompe il tessuto della legalità, si rompe il tessuto
375120	382680	della convivenza civile, quando in una terra come la Sicilia, insanguinata e oppressa dalla mafia,
383220	388340	si dice che la libertà non è minacciata dai mafiosi, ma da Caselli e da Luciano Violante,
388340	405260	allora voi capite bene che in questo modo si offende la coscienza di tutti gli italiani onesti.
406260	416140	Ecco perché questa destra fa paura, suscita un sentimento di preoccupazione,
418080	424400	lascia intravedere una prospettiva che sarebbe quella di un conflitto, d'altro canto li abbiamo
424400	432460	già visti al potere e abbiamo visto come si scagliarono con la forza del potere,
432460	436400	contro i magistrati, contro il capo dello Stato, contro la Corte Costituzionale,
436480	444340	contro la Banca d'Italia, ci hanno dato sette mesi di caos, di conflitto, di instabilità,
444740	454480	questo Paese vuole serenità e proprio chi come me è profondamente convinto che la politica
454480	463080	democratica deve tornare ad avere una funzione centrale in questo Paese e che la magistratura
463080	473160	deve fare il suo dovere ma senza inutili protagonisti, chi pensa questo deve respingere
473860	480740	il rischio che vada al potere una politica rissosa, una politica che vuole lo scontro
480740	485840	con i magistrati e con gli altri poteri dello Stato perché su questa strada ci sarebbe
485840	496320	soltanto l'ingovernabilità, il Paese vuole serenità, il Paese non vuole che alla fine
496320	506000	prevalgano gli egoismi corporativi, le spinte particolari, le proteste anche legittime
506000	513320	ma che la destra ha cavalcato spingendo gli uni contro gli altri, i commercianti contro
513320	521180	i lavoratori, gli artigiani contro la grande industria, il sud contro il nord e viceversa
521180	530280	promettendo tutto a tutti e citando al fischio i commercianti di Torino magari dicendo che
530590	536850	bisogna più pagare le tasse per quei lavativi di meridionali, promettendo più protezione
536850	544890	e più assistenza al sud, dicendo agli artigiani del Veneto che a Roma ci sono tutti lavativi
544890	550610	nei ministeri, andando nei ministeri dicendo che i posti di lavoro non si toccano, promettendo
550610	566250	tutto a tutti. Vedete qui viene fuori la cultura profonda della destra che è una cultura corporativa
567010	576590	che è una cultura che divide il mondo del lavoro e quando si pensa di vincere solleticando
576590	583470	le aspettative di tutte le corporazioni siccome il giorno dopo non si può governare perché
583470	590550	le promesse fatte così non si possono mantenere allora il giorno dopo ci sarà la tentazione
590550	601390	di comandare. Anche per questo questa destra porta con sé come sempre la demagogia porta
601390	611830	con sé un rischio autoritario e plebiscitario, corporazioni e uomo forte torna la vecchia
611830	625190	cultura della destra, non è cambiata. Questo Paese invece ha bisogno di ritrovare le ragioni
625190	635950	della solidarietà. Ha detto il Papa alcuni giorni fa a Siena che lo ha detto rivolto
635950	644130	ai politici e noi rispondiamo a questo messaggio che sbagliano quei politici che ritengono
644130	652090	che basta il mercato a risolvere i problemi dell'uomo, della persona. Ha detto il Papa
652090	662570	che occorre una nuova politica della solidarietà, nuova perché diversa dal vecchio assistenzialismo
662570	669890	e dal clientelismo, nuova perché la solidarietà che noi vogliamo deve essere al servizio dello
669890	677210	sviluppo moderno del Paese, non deve essere contro l'innovazione, non deve essere contro
677210	684370	la valorizzazione dei meriti individuali. Ma guai se questo nostro Paese non ritrova
684370	691130	le ragioni della solidarietà, tra gli italiani del sud e gli italiani del nord, tra quelli
691130	699970	che hanno un lavoro e quelli che non ce l'hanno, tra i più giovani e i più anziani. Solidarietà
699970	708550	e collaborazione tra le grandi forze sociali del Paese sono la condizione per aprire una
708550	717650	nuova stagione di sviluppo. Vedete, in questi anni difficili l'Italia si è salvata, ha
717650	724490	potuto persino avviare un risanamento dei conti pubblici, non grazie alla capacità
724490	732870	di governo della destra, ma grazie al senso di responsabilità, allo spirito di sacrificio,
733090	740170	alla coscienza nazionale dei lavoratori italiani, come sempre nei momenti difficili della storia
740170	755370	del nostro Paese. Noi vogliamo che il patto che in questi anni ha salvato l'Italia, che
755370	762770	è stato un patto per il risanamento finanziario ed economico, un patto contro la bancarotta,
763470	772850	noi vogliamo che questo patto diventi un patto per lo sviluppo, un patto per il lavoro,
773770	781310	un patto per migliorare la qualità della vita degli italiani, che unisca le forze migliori
781310	788750	di questo Paese, il mondo del lavoro, il mondo dell'impresa, il mondo della intellettualità,
788750	800830	in un impegno comune per costruire un'Italia più giusta e più moderna, con una classe
800830	808250	dirigente capace di fare. Ma guardate a questa campagna elettorale, la destra ha cavalcato
808250	817210	per 20 giorni una pirotecnica campagna demagogica contro le tasse, le hanno praticamente abolite
817210	829230	tutte in un succedersi di... Dopo 20 giorni l'altra sera si sono presentati alla televisione
829230	836690	e hanno detto no, dice, ma le tasse non si possono ridurre. Fantastico. E quando io gli
838970	850930	ho detto, ma finalmente, come finalmente? Si è arrabbiato. Quello erano, io veramente
850930	859530	sono rimasto colpito, credo molti cittadini, erano, si incoraggiava una vicenda, quello
859530	875810	marrone, se erano messi, se no, sembravano eccitati, se erano messi una patacca qui,
877630	884530	e quell'altro, quell'altro aveva fatto, aveva lanciato una grande proposta, eliminare
884530	891990	la trattenuta dalla busta paga, ma non, ma non per cambiare il sistema fiscale, no,
892170	896930	perché dice così i lavoratori si rendono conto di quanto, i lavoratori lo sanno già
896930	906530	che pagano le tasse, leggono. Era una follia, perché in questo modo l'operaio, l'impiegato
906530	912490	avrebbe dovuto pagare le stesse tasse, però avrebbe dovuto mettersi il consulente, avrebbe
912670	917550	dovuto mandare il bollettino, avrebbe avuto paura che se passavano due giorni gli facevano
917550	921750	la multa, cioè era una follia, infatti chi ha detto fini dice no, era uno scherzo, era
921750	933330	una provocazione, come sarebbe, era uno scherzo. Ma ma badate, è inquietante, perché è pensabile
933330	944970	due il governo di un grande paese dell'Europa. Hanno inchiodato l'Italia in venti giorni
944970	959930	di campagna demagogica per poi dirci che era uno scherzo, che era una provocazione. L'ingiustizia
962690	970550	fiscale non è uno scherzo, è una cosa seria e noi siamo convinti che il sistema fiscale
970550	981510	può e deve essere riformato, riducendo il peso di un fisco confuso e ingiusto, tante
981510	987270	tasse, peso soprattutto sul mondo del lavoro dipendente, ma anche sui tanti lavoratori
987270	992830	autonomi che fanno il loro dovere. E noi abbiamo avanzato delle proposte concrete,
992870	999570	non degli scherzi, per recuperare l'evasione e l'elusione fiscale, non solo l'evasione,
1000110	1005530	perché quando il piccolo commerciante che guadagna 40 e dichiara 30 non paga le tasse
1005530	1011230	è un evasore, quando non le paga la FIA si chiama elusione fiscale, è un'espressione
1011230	1019550	più elegante. Noi vogliamo allargare la base imponibile perché in questo modo si
1019550	1023430	potranno pagare meno tasse, che è un obiettivo serio e ragionevole.
1038750	1043930	I contributi sanitari, che sono una tassa sul salario e sulle imprese, con una sola
1043930	1051870	imposta regionale per finanziare la sanità, fra l'altro avviando quel federalismo fiscale
1053030	1061570	che consente ai cittadini un rapporto diretto, chi offre il servizio e anche chi chiede
1061570	1067290	la tassa, e così la gente controlla che cosa se ne fa. No, io ho lanciato una proposta
1067290	1070950	in questa campagna elettorale, che non è uno scherzo o una provocazione, è una proposta
1070950	1078790	seria, che è quella di sollevare dall'obbligo dell'iva quei contribuenti, sono tantissimi,
1078790	1084630	che hanno un giro d'affari estremamente modesto, voi pensate che nel nostro mezzogiorno deve
1084630	1089570	pagare la partita IVA, persino il contadino che conferisce tre quintali d'uva alla cooperativa
1089570	1097110	per fare il vino, che è un'assurdità? Abbiamo proposto una cosa seria, sostituire l'iva,
1098050	1103650	l'IRPE, la Tassa sulla Salute, con un solo modello diversamente, su cui si applica una
1105090	1111630	Noi ci sforziamo di indicare delle proposte serie, concrete, per rendere più semplice
1111630	1117570	la vita delle persone, soprattutto la vita del piccolo imprenditore, del piccolo artigiano,
1117630	1122230	del piccolo commerciante, che vuole fare il suo dovere, ma non per questo deve essere
1122230	1128930	obbligato a fare la fila, a mandare certificati. Volevo sapere che in questo Paese, ogni anno,
1128930	1135970	i cittadini che pagano le tasse, che già è un sacrificio pagare le tasse, debbono versare
1135970	1144870	200 milioni di certificati di carte da bollo. È una follia! Oltretutto per fare la carta
1144870	1152850	si abbattono gli alberi. Viviamo nell'epoca dei computer, vogliamo semplificare la vita
1152850	1158950	delle persone e vogliamo farlo con proposte serie e concrete, che non mettono gli uni
1158950	1167070	contro gli altri, commercianti e impiegati, ma che cercano di affrontare insieme i problemi
1167070	1175270	del mondo del lavoro. Questo deve fare una classe dirigente, non soltanto protestare,
1175870	1182870	ma indicare delle soluzioni, delle proposte, dimostrare di essere capace di governare.
1184370	1194130	Noi abbiamo messo in campo in questa campagna elettorale un progetto per l'Italia, un progetto
1194130	1201430	che guarda al futuro. Ne ha parlato qui, ne ha parlato Claudia Mancina. È la prima volta
1201430	1209170	nella storia di questo Paese che una grande coalizione che vuole governare mette al primo
1209170	1217330	punto del suo progetto per l'Italia la parola cultura, la parola scuola, facendo una grande
1217330	1225670	scelta che guarda al futuro dell'Italia, alle nuove generazioni. Una scelta badata che non
1225670	1236790	è soltanto quella necessaria, perché se noi vogliamo competere non abbassando i salari,
1237190	1243050	tanto anche se governa Fini non avremo i salari più bassi di quelli dell'Albania o del Marocco,
1243210	1248670	noi vogliamo competere con la Germania, con la Francia, con l'Inghilterra e allora abbiamo
1249750	1255650	bisogno di più istruzione, più ricerca scientifica, più innovazione. Di questo abbiamo bisogno
1256670	1264850	di una nuova generazione abituata ad usare i computer, abbiamo bisogno di fare in modo
1264850	1271410	che i tanti giovani italiani che sono sparsi nel mondo e che contribuiscono spesso alle
1271410	1279690	più importanti scoperte scientifiche trovino anche qui posto per applicare la loro intelligenza
1279690	1291610	e per rendere più forte il nostro Paese, ma altro che tagliare tutte le spese pubbliche,
1292110	1296970	sì certe spese andranno tagliate, ma dall'altra parte siamo anche il Paese in Europa che
1296970	1302490	spende di meno per la scuola, per l'università, per la ricerca, per il diritto allo studio.
1306290	1313430	Ma dire più cultura non serve soltanto allo sviluppo della nostra economia, non c'è solo
1313430	1319190	l'economia, non c'è solo la ricerca del benessere, dire più cultura significa anche
1320290	1328490	offrire alle persone, alle donne e agli uomini, alle ragazze e ai ragazzi di questo Paese
1328490	1335730	una maggiore conoscenza critica, una maggiore possibilità di vivere una vita dignitosa
1336330	1345150	e felice, di costruire relazioni umane più ricche, perché più cultura vuol dire maggiore
1345150	1356790	possibilità di godere della propria esistenza, di essere persone libere, libere non nel senso
1360990	1367130	di libertà, di cui parla il Polo, che sarebbero la libertà di non pagare le tasse, la libertà
1367130	1372970	di licenziare, queste sono queste le libertà, libere nel senso della libertà, quella con
1372970	1387150	la L maiuscola che è scritta nel programma e nei valori dell'Univo. Noi siamo la forza
1387150	1394710	che vuole affrontare la grande sfida del lavoro, che è la sfida di questo secolo, è la sfida
1394710	1401970	nella quale si impegnano i grandi Paesi, non solo noi che abbiamo questa enorme tragedia
1401970	1410870	del Mezzogiorno, che dobbiamo affrontare insieme nulla più miope che pensare che una parte
1410870	1417870	d'Italia può salvarsi, entrare in Europa e una parte d'Italia può essere lasciata
1417870	1424870	andare alla deriva. Fra l'altro questa città che rappresenta insieme queste due Italie
1426270	1435030	perderebbe ogni funzione, il nord ha bisogno del sud, esattamente come il sud ha bisogno
1435030	1442610	del nord di ricostruire un patto di solidarietà e se non vi commuove la solidarietà sia al
1442610	1448510	meno il senso della convenienza, come ha detto Romiti che ci vuole lo sviluppo del sud anche
1448510	1456710	perché loro non vendono più un'automobile sotto Roma. E' così, se un pezzo d'Italia
1456710	1464190	va in cancrena, se ci sono intere regioni nelle quali il 55 e il 56 per cento dei giovani
1464190	1473230	che hanno meno di 29 anni non trovano lavoro, tutto il nostro Paese ne soffrirà. E allora
1473230	1481110	la grande sfida del lavoro, e più che mai badate parlando di lavoro, bisogna dire non
1481110	1489790	basta il mercato, non basta lo sviluppo. Lo sviluppo c'è in una parte del nostro Paese,
1489790	1496710	ci sono regioni nelle quali le fabbriche appendono il cartello cerco operai e c'è un'altra
1496710	1502770	parte d'Italia dove ci sono operai che cercano fabbriche, che vuol dire che non basta lo
1502770	1509850	sviluppo spontaneo. Per creare lavoro nell'epoca nella quale le macchine sostituiscono il lavoro
1509850	1516110	delle persone, occorre aprire nuovi campi. Vedete il paradosso dell'Italia, noi siamo
1516110	1522030	in un Paese nel quale tanti giovani non trovano lavoro ma ci sono tante cose da fare, ci sono
1522030	1529630	città da recuperare, monumenti da restaurare, ci sono scantinati dove si conservano opere
1529630	1537250	d'arte che potrebbero essere esposte e fatte conoscere, ci sono disabili o anziani lasciati
1537250	1546090	privi di assistenza, ci sono colline sulle quali ripiantare gli alberi, ci sono città
1547550	1557430	da recuperare, ci sono tante cose da fare e una politica per il lavoro deve fare incontrare
1557430	1565290	questo bisogno di lavoro con questi grandi bisogni sociali insoddisfatti. Noi abbiamo
1565290	1571930	lanciato una proposta forte, netta, in Italia non c'è più bisogno, entro due anni se
1571930	1578930	può uscire, che i ragazzi vadano a fare il servizio militare obbligato. Non c'è bisogno,
1582930	1590710	c'è addirittura a destra chi propone che ci vadano anche le ragazze, non ci sono pericoli
1590710	1599890	all'orizzonte, abbiamo bisogno di forze armate efficienti, più ridotte, se volete più qualificate,
1600730	1607790	in grado di rappresentare il nostro Paese se e quando è necessario nelle missioni internazionali
1607790	1614970	di pace, ma non abbiamo bisogno di 280 mila ragazzi a perdere un anno di vita delle caserne,
1615630	1627750	non c'è bisogno. Questo è un campo nel quale si può risparmiare, anziché tagliare gli
1627750	1642930	segni di maternità, consigliatelo alle onorevole fini. In alternativa possiamo offrire la possibilità
1642930	1651050	a chi vuole, ragazze e ragazzi, di un servizio civile e volontario, di un impegno nel momento
1651050	1656830	badato e più delicato della vita di una persona, cioè quando una ragazza e un ragazzo
1656830	1664370	escono dalla scuola e non incontrano il lavoro e rischiano di perdersi, di perdersi in un
1664370	1672450	senso di frustrazione, di umiliazione, di inutilità, allora lo Stato può offrire loro la possibilità
1672450	1681030	di un periodo di un'esperienza collettiva di lavoro modestamente retribuita, ma comunque
1681050	1689290	di un momento di impegno, di un'esperienza collettiva, di una forma di addestramento al
1689290	1695050	lavoro e alla vita sociale. Questa è una cosa utile che si può fare e si può fare
1696070	1709670	subito e poi bisogna governare quel grande processo che i nostri maestri chiamavano della
1709670	1716650	riduzione del tempo di lavoro necessario, il tempo di lavoro che è necessario per
1716650	1725530	la produzione dei beni si riduce perché ci sono le macchine, ci sono i computer e questo
1725530	1731530	grande processo può andare in due direzioni diverse, vedete noi siamo una specie di bivio
1731530	1737730	o la riduzione del tempo di lavoro necessario ridurrà il numero degli occupati, progressivamente
1738330	1744850	e quindi noi vivremo in una società nella quale ci sarà una parte che avrà il lavoro
1744850	1753810	come un privilegio e lo difenderà e intorno ci sarà un mondo di emarginazione, di precariato,
1755290	1763670	di piccoli lavori, di miseria o di disperazione sociale, un mondo profondamente ingiusto questo.
1765070	1769430	Quando vedete quando Berlusconi adesso finalmente ha detto, si capisce, ha detto una cosa, ha
1769430	1778150	detto Reagan, viene a fare come Reagan, questa è un po' l'idea, oppure c'è un'altra possibilità,
1778770	1784310	c'è la possibilità di una guida politica di questo processo che riduca per tutti il
1784310	1789790	tempo di lavoro e che restituisca un tempo alla vita, agli affetti, alla cultura, una
1789950	1799490	società più umana, una società più giusta. Ecco, vedete che di fronte a questi grandi
1800710	1806310	problemi, di fronte a questi grandi problemi noi riscopriamo il senso della differenza
1806890	1815170	fra destra e sinistra, tra una cultura dell'egoismo, tra una cultura dell'individualismo dei forti
1815170	1823190	e una cultura della solidarietà e delle opportunità, è una cultura che vuole dare a tutti almeno
1823190	1830110	la possibilità, la speranza di una vita dignitosa e felice. Vedete, noi abbiamo parlato molto
1830110	1837010	delle parti del programma del Polo, e ve ne sono, che erano copiate da quello dell'Ulivo,
1837990	1845150	e forse non è stata una polemica felice questa, anche se ci sono, perché diciamo,
1846170	1851250	che loro abbiano copiato qualcosa. Va anche bene, in fondo, abbiamo un compito di diffusione
1851250	1859390	di cultura, poi hanno dovuto fare in fretta, non hanno esperienza, ma noi dovevamo al contrario
1859390	1865510	a tirare l'attenzione dei cittadini sulle parti del programma del Polo che hanno scritto
1865510	1872390	da soli, perché sono di gran lunga le più preoccupanti, laddove si parla di privatizzazione
1872390	1878850	degli ospedali, laddove si parla di privatizzazione della scuola, laddove si parla di abolizione
1879390	1886270	della contrattazione nazionale di lavoro, dovesi parla di eliminazione dello statuto
1886270	1895690	dei lavoratori, oppure di passaggio che bisogna rimettere le mani nella riforma pensionistica,
1895850	1901010	che bisogna fare più in fretta a togliere di mezzo le pensioni di anzianità e perché
1901010	1907570	bisogna favorire il sistema a capitalizzazione privata, insomma, a parte quanto c'è di antipatico
1907570	1912090	diciamo nel fatto che a proporre il sistema a capitalizzazione privata sia il padrone
1912090	1922530	delle assicurazioni, che è una cosa anche di cattivo gusto, ma c'è davvero questa
1922530	1927890	volta, l'altra volta Berlusconi fece sognare gli italiani, è una parte del nostro popolo,
1927890	1936690	gli ando dietro, no? Ora un po' perché la gente ha visto, lui ci riprova perché diceva
1936690	1942110	l'altra volta che ha visto un milione di posti di lavoro, adesso dice due per vedere se funziona,
1943050	1949930	ma questa volta c'è qualcosa di nuovo a destra, su cui noi dobbiamo attirare l'attenzione
1949930	1957870	dei cittadini, c'è per la prima volta trasparente un programma di attacco a cittadini, c'è per
1957890	1964150	attacco ai diritti sociali degli italiani, dei lavoratori, della parte più debole di
1964150	1976790	questo Paese, c'è chiaro, trasparente questa volontà, noi dobbiamo parlare a quei nostri
1976790	1983570	con cittadini che hanno avuto fiducia in loro, io mi ricordo, era il tempo della finanziaria
1983570	1989790	di Berlusconi e io mi ricordo incontrando la gente una sera, stavo per una ragione
1989790	1995970	non allegra in un ospedale, e c'erano due portantini che dicevano, o ma dovete la lottare?
1996230	2001310	E dico certo, poi a un certo punto ho detto, ma scusi lei perché ha votato? Dice no, Forza
2001310	2011270	Italia, ecco, voi li conoscete, molti italiani sono così, votano Forza Italia e poi ci dicono
2011270	2018270	dovete la lottare. Adesso noi però siamo in tempo per dire a questi nostri con cittadini
2020530	2032290	che sarà più facile difenderli se si difendono anche da soli con il voto il 21 di aprile,
2035230	2041250	se sanno fare argine ad una destra che ha parlato di un paese che ha avuto fiducia in
2041270	2046350	un paese che ha parlato chiaro su ciò che vuole fare nell'avvenire del nostro paese.
2047510	2058230	Noi abbiamo, dall'altra parte, costruito una coalizione, un programma, un'alleanza
2059070	2067750	che rappresenta l'unica vera grande novità, l'unica vera grande novità per l'Italia,
2067750	2075310	la novità dell'incontro tra le più forti tradizioni democratiche del nostro paese,
2075670	2084250	la novità dell'incontro tra i cattolici, i laici democratici, la sinistra, della collaborazione
2084250	2091410	tra le forze popolari per tanti anni divise dalla guerra fredda e dall'anticomunismo.
2094970	2104590	Noi non siamo rimasti fermi. Noi abbiamo preso, noi, la sinistra sconfitta nel marzo del 94,
2105930	2115950	ha saputo riprendere l'iniziativa politica con grande forza e con grande coraggio, mettendo
2115950	2125550	le strette, la destra, costruendo una forte opposizione sociale e democratica, garantendo
