start	end	text
2125550	2134050	la governabilità del paese di fronte al fallimento di Berlusconi e del Polo e poi costruendo
2134050	2140310	un'alleanza democratica finalmente in grado di vincere e di governare l'Italia. Se noi
2140310	2148450	siamo arrivati a questo punto, non è stato soltanto per i loro errori, per la loro rozzezza
2148450	2155390	e per la loro arroganza, anche per questo, bisogna dare atto anche dei meriti altrui,
2156470	2165330	se noi siamo arrivati a questo punto è anche per la forza, per la passione unitaria che
2165330	2173270	ha animato la nostra politica e che non siamo rimasti chiusi nelle trincee di una sinistra
2173270	2181770	contenta di essere minoranza, ma abbiamo saputo parlare a milioni di italiani, a quelli che
2181770	2194270	non hanno mai avuto fiducia in noi. Ed oggi questa grande novità, l'Ulivo, è la forza
2194270	2202990	in grado di governare il paese. Noi non siamo una forza conservatrice. L'ultima carta della
2203510	2209530	destra, la destra è chiaramente meno rassicurante, più inquietante, ma dicono che loro vogliono
2209530	2215430	cambiare e noi siamo conservatori. No, noi non siamo conservatori. Non lo è l'Ulivo,
2215510	2222590	non lo è il Partito Democratico della Sinistra. Noi siamo talmente appassionati al cambiamento
2223330	2229630	che eravamo pronti a fare le riforme anche insieme alla destra e abbiamo avuto il coraggio
2229630	2239250	di ricercare un accordo per fare le riforme e non abbiamo cercato lo scontro frontale
2239250	2246510	di questa confusa campagna elettorale. Io vi dico, vedete, ho visto l'altra sera che l'onorevole
2247830	2257530	Berlusconi si è tranquillamente rimangiato tutto. Se qualcuno poteva avere dei dubbi
2257530	2266130	sulla serietà e sulla coerenza di quest'uomo, si è tranquillamente rimangiato tutto. Quell'accordo,
2266130	2276490	quella convergenza che costituiva e a mio giudizio costituisce l'intesa necessaria di
2276510	2284450	sbloccare il cammino della innovazione istituzionale, e cioè elezione popolare del Presidente della
2284450	2293950	Repubblica, e doppio turno, condizione di un accordo per fare davvero quelle grandi riforme
2293950	2301030	di cui l'Italia ha bisogno, per dare a questo Paese un potere più vicino ai cittadini,
2301910	2307390	con un federalismo che cominci dal potere dei sindaci e delle città, per avere una
2307390	2313670	sola camera legislativa, per dimezzare il numero dei parlamentari, per avere una democrazia
2313670	2324350	più forte, più capace di governare e più vicina ai cittadini. Noi queste riforme le
2324350	2333110	vogliamo fare e le faremo dopo le elezioni e ripartiremo dalle convergenze che si erano
2333110	2341450	delineate. Vedete, l'Ulivo garantisce due cose. Primo, che la nostra vittoria darà
2341450	2349270	all'Italia un governo serio, che aprirà una stagione di sviluppo di riforme di diritti,
2349270	2357650	secondo che si faranno le riforme costituzionali e si faranno attraverso il dialogo con questa
2357650	2365450	destra che il voto degli italiani renderà meno arrogante e meno prepotente di quanto
2365450	2378870	non sia oggi. Noi siamo persone di parola, onorevole Berlusconi, anche con quelli che
2378870	2387590	non rispettano la parola data. Vedete, essere delle persone serie è un difetto del quale
2387590	2393290	non ci si può liberare, neppure di fronte a quelli che stracciano gli impegni sottoscritti.
2394810	2403390	Ecco perché l'Ulivo è la prospettiva per l'Italia, è l'unica grande forza che può
2404510	2413870	unire l'Italia migliore, l'Italia dell'impresa, l'Italia della intellettualità e l'Italia
2413870	2423310	del lavoro. Può unire queste forze e può portare l'Italia in Europa, con dignità,
2423910	2433370	con fierezza, un grande Paese europeo. Ho visto che ieri, l'altro ieri quando è stato
2433390	2451850	il professor Buttiglione ha fatto in una sua manifestazione un filmino dove c'era Col che
2451850	2463370	dice che lo riconosce come amico. Ora vedete, tutto questo è commovente. Perché? Perché
2463390	2471070	il professor Buttiglione rappresenta l'unico e questo filmino, l'unico modestissimo legame
2471070	2480950	che c'è fra il Polo e l'Europa. L'unico. Noi per la verità abbiamo fatto qualche giorno
2480950	2488950	fa a Torino una manifestazione dove c'erano, non nelle filmine, ma in carne ed ossa i capi
2488950	2497510	di 7 governi europei. I capi di 7 erano venuti in carne ed ossa, non avevano mandato una
2497510	2505710	testimonianza firmata. Perché noi siamo parte del più grande partito d'Europa, di un partito
2505710	2518930	che governa molte nazioni e che raccoglie il consenso di più di 40 milioni di cittadini
2518930	2531070	in Europa. E io non mi stancherò mai di domandare all'onorevole Sini con chi lui. Perché vedete,
2531190	2540010	alla vigilia della conferenza di Torino io, forse indegnamente rappresentandovi, ho partecipato
2540010	2545150	a una riunione dove c'erano appunto i capi di governo e quelli che non sono capi di governo
2545150	2550670	si chiamano Tony Blair, Joe Spence, i capi della sinistra in Europa. E abbiamo discusso
2552470	2558750	insieme dei problemi, degli obiettivi di come impegnare l'Europa non solo per la moneta
2558750	2564030	unica, ma anche per i diritti sociali, per il lavoro, per l'ambiente. E mi domandavo
2564030	2575130	ma con chi si riunirà l'onorevole Sini? Chi lo riceve? E l'onorevole Berlusconi non mi
2575130	2588050	ha mai sentito forza Francia, forza Spagna. Questa destra italiana è una malattia provinciale
2588050	2602510	che non ha nulla a che fare con la destra democratica dell'Europa. E ci terrebbero
2603470	2610370	inesorabilmente fuori dall'Europa con un costo altissimo per la nostra economia e per
2610370	2617270	il nostro Paese, fuori ai margini. È un lusso che non ci possiamo permettere. Noi vogliamo
2617270	2623410	entrare in Europa con la forza, con la dignità, con la fiorezza di un grande Paese, di una
2623410	2630370	grande democrazia e vogliamo che questo processo sia guidato. Vedete ho finito di andare via
2630370	2639110	con quei rodelli televisivi e scadere il tempo. Ma voglio dirvi ancora una cosa, non lasciatemi
2639110	2650690	dire. Badate. Questi giorni sono giorni importanti, molto importanti. Sono i giorni in cui si
2650690	2660350	decide. C'è ancora una quota, una parte dei nostri concettadini che non hanno deciso.
2662370	2670690	C'è una parte della società, e badate purtroppo è la parte più disgregata e più povera,
2670810	2677850	dove c'è malessere, dove c'è incertezza, dove c'è sfiducia e protesta, dove può passare
2678470	2684910	il messaggio primitivo e rozzo della destra, cioè un uomo forte che mette a posto le cose,
2685470	2695770	se visto nel passato, quali disastri produce una cultura di questo tipo. Con questi nostri
2695770	2706070	concettadini incerti e sfiduciati bisogna che voi andiate a parlare. No, no, non so de goccio,
2706670	2714730	si possono convincere, però dico io, si possono convincere. Bisogna che voi mettiate in movimento
2714730	2721750	quella forza. Noi abbiamo unito la sinistra e i cattolici. Noi abbiamo unito quelli che
2721750	2727870	hanno costruito i sindacati, le sezioni e quelli del volontariato, delle associazioni. Insomma,
2728170	2735450	abbiamo creato una forza invincibile, se questa forza si mette in cammino in questi giorni
2735450	2744710	decisivi. Non può essere fermata. E allora, non può essere fermata, non può essere fermata.
2745530	2752970	Io, quando io dico una forza invincibile, io dico che bisogna andare con il sorriso
2752970	2760790	e con la serenità. Lasciatemi citare un principio antico della saggezza cinese che dice che
2760790	2770230	è grande colui che vince senza combattere. Pensateci un po', è una cosa bella. Purtroppo
2770230	2776890	la sinistra italiana è stata abituata per troppi anni a combattere senza vincere. Adesso
2776890	2783450	noi lasciamo che gli altri combattano. Noi abbiamo la forza degli argomenti, la forza
2783450	2797030	delle idee, la forza del sorriso ed è questa la forza che deve vincere. Noi, mai, mai come
2797030	2805710	in questi giorni nella sua storia la sinistra italiana si è posta così da vicino il problema
2805710	2815970	del governo dell'Italia. È una grande occasione. Non bisogna dire, come dicono certi compagni,
2816190	2821850	e io tocco ferro, se non vinciamo ora non vinciamo più, che è una frase sbagliata.
2821850	2828370	Voi non dovete dirla. Perché, perché, momento, lasciatemi dire, perché se non vinciamo ora
2828370	2836870	vinceremo la prossima volta. Ma io dico un'altra cosa, compagni. Noi siamo nelle condizioni
2836870	2848070	di vincere ora. Non lasciamoci sfuggire questa grande occasione. Noi vogliamo essere messi
2848070	2862330	alla prova del governo dell'Italia. Vedete, io voglio ricordare le parole che disse Mitterrand
2862330	2868930	quando per la prima volta portò la sinistra al governo della Francia. Può essere una
2868930	2873770	cosa bene augurale, almeno in questo dopo guerra. Per la prima volta la sinistra tornava
2873770	2880870	dopo il tempo del fronte popolare. Mitterrand disse, penso in questo momento a quei milioni
2880870	2889930	e milioni di donne e di uomini, fermento e lievito del nostro popolo, che per due secoli
2889930	2899450	in Italia, un secolo e 130 anni, nella pace e nella guerra, con il lavoro e con il sangue,
2899450	2907190	che hanno formato la storia del nostro Paese, senza mai avervi accesso, senza mai avere
2907190	2914130	la possibilità di prendere nelle vostre mani il governo e il destino dell'Italia. E allora
2915990	2921770	è a questi milioni e milioni di donne e di uomini che noi dobbiamo pensare in questo
2921770	2929430	momento per dare ad essi la sensazione che possiamo vincere e che con la forza della
2929450	2938630	passione politica e dell'intelligenza vostra, noi possiamo vincere, conquistare il governo
2938630	2948130	e rinnovare profondamente questo Paese e portare nel governo dell'Italia quella passione solidale,
2948650	2955890	quella serietà, quella forza, quell'intelligenza che sono le qualità della nostra sinistra,
2955890	2963310	di una sinistra che ha conquistato la libertà e la resistenza, di una sinistra che è stata
2964090	2973090	alla testa delle grandi lotte sociali e civili e che adesso vuole governare l'Italia per
2973090	2980170	migliorare la vita degli italiani, per costruire un Paese più unito e più giusto, per dare
2980170	2989250	un futuro ai nostri figli, per fare di quest'Italia un Paese rispettato nel mondo, del quale si
2989250	2996410	possa essere orgogliosi, del quale si parli non per la corruzione o per la mafia, ma per
2996410	3006270	l'intelligenza dei nostri lavoratori. Ecco, con questa passione e con questo slancio per
3006270	3008090	vincere e per governare!
3095770	3095990	Sottotitoli creati dalla comunità Amara.org
3125830	3125970	Sottotitoli creati dalla comunità Amara.org
3154450	3155970	Sottotitoli creati dalla comunità Amara.org
3185750	3185990	Sottotitoli creati dalla comunità Amara.org
3215790	3215990	Sottotitoli creati dalla comunità Amara.org
3237970	3239370	Sottotitoli creati dalla comunità Amara.org
