start	end	text
0	7680	più o meno del denaro e se c'è un progetto di libertà che ci fa cittadini e non sudditi.
9680	15220	Forse da qui, dalla resistenza agli effetti negativi della globalizzazione e dal progetto
15220	20240	di umanizzare l'economia con scelte di cittadinanza attiva e di sviluppo sostenibile,
21420	27440	potrebbe ripartire un'iniziativa dei cattolici davvero popolare, davvero originale.
29480	35260	Anziché di sperdersi in mille frammenti o instirelirsi in seguendo un potere che non
35260	43200	c'è più, magari chiegandosi ad ideologie che ci sono estrane, le ACLI vogliono tornare a pensare.
44080	49460	E lo fanno appunto qui, in un luogo simbolo della loro storia. Un laboratorio di idee,
49600	56900	di proposte, di ricerca. Un tempo in cui progettare il domani. Un luogo anche dove
56900	64000	suonare la sveglia alle istituzioni che tardano a riconoscere che l'economia ha preso la guida
64000	70560	della locomotiva. Il macchinista non sempre sa qual è la direzione di marcia, forse non
70560	78480	ha neanche una meta sicura, ma procede con una corsa sempre più veloce. E la politica
78480	82740	rischia di essere vagone che segue trascinata non si sa dove.
84440	91640	Più che una terza via c'è da ritrovare la strada maestra, perché senza un'idea concreta di bene
91640	102840	comune la politica è morta. Sapranno i cattolici non essere mosche e cocchiere del turbocapitalismo,
103500	110740	ma provare a segnare il costume sociale e le istituzioni con dei valori, con un progetto?
111820	119600	La sfida è tutta qui. Quali sono gli obiettivi che ci siamo proposti in questo convegno?
121120	128880	Il primo obiettivo è capire la globalizzazione come un processo di trasformazione del sistema
128880	136580	economico mondiale, le cause, le dinamiche, le prospettive. Secondo, analizzare, giudicare,
136580	145040	individuare i nessi del rapporto tra globalizzazione e democrazia a livello locale, nazionale e internazionale
145040	150760	nell'intento di promuovere una democratizzazione della globalizzazione.
153000	159860	E infine favorire, assumendo il paradigma dei diritti umani, ne abbiamo sentito parlare stamattina,
160080	165740	e dell'etica sociale, una valutazione critica della globalizzazione avanzando proposte per
165740	174080	umanizzare l'economia attraverso una strategia su tre livelli. L'impegno diretto attivo dei cittadini,
174980	181820	un ruolo più consapevole e soprattutto più globale del terzo settore, una riforma delle istituzioni politiche,
182440	191740	giuridiche, economiche e finanziarie internazionali. Insomma, per umanizzare l'economia occorre innanzitutto
191740	198200	che vengano esplicitati i presupposti antropologici dei modelli economici.
198220	203800	Lo ha detto stamattina molto meglio di me il Cardinal Silvestrini. Ci sono delle regole
203800	210500	che sono in qualche modo quasi inconsapevoli, ma altrettanto efficaci, incidono nella realtà.
213080	220980	Secondo, democratizzare la dimensione economica, le istituzioni economiche, evitando che le istituzioni
222880	229060	rappresentative diventino in qualche modo marginali rispetto ai poteri economici.
230060	236540	E infine cercare di coniugare etica ed economia non tanto con un discorso stratto con una predica,
236980	244060	ma proprio a partire dai comportamenti economici quotidiani dei cittadini, di noi, delle nostre famiglie.
246120	248680	Quale sarà l'itinerario che faremo insieme?
250980	257520	L'itinerario spirituale sarà guidato, lo ringrazio di aver accettato di essere con noi
257520	261060	da padre Arturo Paoli e credo
269960	276340	non abbia bisogno di presentazioni. Il suo libro sicuramente più celebre
276340	283440	camminando sapre cammino è stato credo una tappa rilevante della formazione di molti di noi,
283640	287420	della nostra formazione spirituale e sociale insieme.
288920	294420	Poi oggi avremo ed è già qui con noi il professor Stefano Zamagni
296520	308020	che anche lui lo conoscete bene. Io vorrei, gliel'ho già detto in privata, ma vorrei dirlo anche in pubblico
308020	317440	non è affatto piaggeria, Stefano lo sa perché, che a lui veramente un grazie non solo per essere qui
317440	323480	ma per la straordinaria opera di animazione culturale che ha fatto in questi ultimi anni
323480	330800	per dare un fondamento culturale, scientifico e allo stesso tempo anche una carica di entusiasmo
330800	336460	a chi in qualche modo emergeva da questo mondo dell'associazione, del terzo settore, del non profit
336460	343760	dandogli dignità, orgoglio di fare parte di questa realtà e di essere una componente rilevante
343760	351460	della nostra società. Poi c'è qui con noi, accanto al professor Zamagni, il professor Antonio Papisca
354240	364540	che anche molti di voi conoscono, ha dedicato tutta la sua vita a studiare le relazioni internazionali
365240	371000	le istituzioni internazionali per cercare di capire quello che diceva stamattina il presidente Mancina
371000	380360	cioè che se non ci sono delle istituzioni in grado di governare, di indirizzare queste possenti forze del mercato
380360	391460	i guai insomma sono in vista. Avremo poi, più tardi arriverà con noi il ministro del lavoro Cesare Salvi
391460	399440	poi proseguiremo nel pomeriggio. Quest'oggi lavoreremo anche alla sera, avete visto dal programma
400000	408440	credo che sia un momento a cui tutti teniamo, sia quelli che hanno i capelli bianchi sia quelli che sono più giovani
408440	417520	è un omaggio al presidente che ha cominciato questa tradizione qui a Vallombrosa, a Livio Labor che come tutti sapete
418180	437880	è recentemente scomparso. Avremo diversi testimoni poi li presentiamo questa sera, diversi sono già qui con noi
437880	444160	credo che sarà un modo di attraverso delle testimonianze persone di chi gli è stato vicino
444160	453620	di vedere forse i lati magari meno conosciuti dell'uomo e che meritano da parte di tutti, specialmente dei più giovani
453620	460960	io ho avuto modo di imparare molto dalla figura, dall'opera, dalla spiritualità di Livio Labor
462440	472320	domani saranno con noi tre professori, il professor Latouche dell'Università di Parigi, il professor Ilvo Diamanti
472320	481340	che conosciamo forse più direttamente come saggista del sole 24 ore e il professor Wolfgang Sachs
481340	490420	come vedete un francese, un italiano, un tedesco, forse in questa mix manca qualcuno di cultura più direttamente
491860	499080	anglosassone, ma credo sia un modo di guardare a questo fenomeno non solo con la nostra cultura e i nostri occhiali
499080	508420	ma con una cultura proprio europea. Poi graditissimo ospite sarà con noi, credo che giunga già stasera
508540	517620	qui a Vallombrosa, il neopresidente del Pontificio Consiglio Giustizia e Pax che è il vescovo vietnamita
518140	528860	Monsignor Van Thuan. Infine domenica mattina avremo una tavola rotonda finale con diversi interventi
528860	536760	in particolare vorrei cominciare a salutare Carlos Kuster, amico da sempre, delle ACLI, della Clutter
536760	545280	che viene dall'Argentina, poi l'ambasciatore Paolo Fulci, Sandro Calvani, Carlo Borromeo
545280	554700	e infine anche il vicepresidente del Consiglio Sergio Mattarella. Proveremo insieme poi a tirare alcune
554700	563840	conclusioni del nostro lavoro. Concludo, questa mattina abbiamo dato il via a Vallombrosa 99
564050	571130	con un momento simbolico di incontro, di meditazione e di riflessione in abbazia.
572490	578350	Abbiamo rievocato l'opera spirituale e di civilizzazione che i Benedettini hanno svolto
578350	585470	fin dall'11° secolo, uno stile che vorremmo diventasse proprio anche di questo convegno.
586390	593610	Il cristiano non è affatto nemico del mondo, sa utilizzare tutti gli strumenti e tutte le tecniche
593610	602970	per umanizzarlo. È lo sforzo di ricerca e di comprensione che faremo in questo nostro incontro.
603170	610690	Ci accompagnino le parole del Cardinal Martini che mettendo in guardia dal crescente pericolo
611450	621690	di omologazione liberista afferma, Dio ci manda al mondo anche se pochi, poveri, umiliati, poco apparicenti
622010	630090	in circostanze ambigue, contorte ed equivoche. La sua parola non ha paura di niente.
631330	638790	Lo Spirito scioglie tutto e con la dinamica evangelica del seme, del lievito, del sale
638790	646090	lo Spirito che è in noi dà l'assoluta certezza che non c'è realtà umana che sia insensibile
646450	653530	alla forza dell'amore di Dio che ha creato l'uomo e gli ha donato fin dall'inizio lo Spirito.
654310	656690	E a tutti un buon convegno.
665610	672410	Darei ora la parola al Professor Romano Prodi. Il ringraziamento non è affatto d'obbligo
672410	682910	ma è veramente sentito per essere qui con noi in un impegno che veniva da lungo tempo
682910	687650	ma che poi si era un po' complicato strada facendo e ne comprendiamo tutte le ragioni
687650	695190	ma credo che questa sua attenzione, questa sua presenza ci dicono appunto di una sensibilità,
695190	702990	di una vicinanza e credo che soprattutto in un lavoro così affascinante, impegnativo
702990	709950	e difficile di cui ha intrapreso l'itinerario proprio in questi mesi dobbiamo veramente
710850	717570	augurargli un buon successo e soprattutto stargli vicino. Credo che l'Italia, il nostro paese
717570	723950	che ha il Presidente della Commissione in un momento in cui si aprono grandi possibilità
723950	729450	per l'Europa in qualche modo possa svolgere un ruolo in qualche modo di indicatore di
729450	736470	una direzione di marcia e Romano Prodi ne è in qualche modo l'antesignano di questo
736470	740110	cammino. Un grazie sentito e la parola a Romano Prodi.
755270	764650	Grazie Presidente, Excellenza, carissimi amici. Non è retorica neanche la mia, non è d'obbligo
764650	772110	ma sono veramente profondamente contento di essere qui anche se un po' di volata, però
772110	781710	perché desideravo venire. Non l'ho potuto promettere perché non sapevo se in questi
781710	796570	giorni sarebbe stato possibile mantenere la promessa, sono qui e mi ha fatto molto
796570	804970	piacere portare la testimonianza a un convegno che ha proprio l'obiettivo, come ha detto
804970	812590	Bob Aderi, di cominciare a pensare, cosa di cui abbiamo bisogno tutti moltissimo. Mi
812590	817830	spiace solo di non essere con voi anche in seguito e di non venere a andare via subito
818990	827310	perché non amo questo volare, un convegno, parlare e poi andare via, però le circostanze
827310	833470	a volte l'obbligano. Spero in qualche modo di poter seguire questo dibattito perché
834970	839970	è uno dei problemi fondamentali che noi abbiamo davanti, potrebbe essere umanizzare l'economia,
840030	850070	umanizzare la politica, ma dare un'anima al nostro lavoro e d'altra parte senza volere
850070	854970	è stato un po' il tema del mio primo discorso al Parlamento Europeo, proprio il problema
854970	861970	di trovare un'anima per l'Europa e non è affatto solo un riferimento cattolico cristiano,
861970	871750	ma è questo problema di trovare lo spirito di dove si va, di trovare la via che noi dobbiamo
871750	878690	seguire, proprio perché ci troviamo di fronte a una svolta, quella della globalizzazione
882810	889070	che obbliga a una revisione di tantissimi punti di vista. Io mi limiterò in questi pochi
889070	896030	minuti in cui vi faccio questo saluto a pensare proprio la dimensione europea, la grandezza
896030	902630	di questa dimensione europea, le esigenze, il desiderio di Europa che c'è, la scarsa
902630	910450	risposta che stiamo ancora dando, la necessità di dare una risposta forte. Che cosa può
910450	919050	dare sui temi che ha detto Bobba l'Europa? C'ha ancora un patrimonio suo, un patrimonio
919070	926570	europeo? Queste sono i grandi temi perché dobbiamo trovare che questo va ricercato di
926570	932490	nuovo, va ricercato ma soprattutto, ed è la grandezza, è il compito che aspetta a
932490	939350	me, a tutti coloro che sono preposti a queste situazioni europee, ritrovarlo nelle azioni,
939570	945350	negli atti e dare una risposta ai bisogni, che sono i bisogni dell'economia, che sono
945350	955470	però ancora più i grandi bisogni della pace, i grandi bisogni della pace, in cui l'Europa
955470	963130	viene chiamata quotidianamente a un cammino che non sembra ancora in grado di poter fare
963130	971370	nel modo richiesto, però questi sono gli anni che noi abbiamo di fronte, sono gli anni del
971370	980050	grande tentativo di vedere, di conciliare, questo è un straordinario discorso dell'Europa,
980590	989150	conciliare la globalizzazione con le radici locali. L'Europa, come mai l'Europa è diversa
989150	996190	agli Stati Uniti nella sua storia? La storia americana è, entro certi limiti, più semplice,
997190	1004190	questo meraviglioso incrocio di persone che vengono da tutte le parti del mondo, vanno
1004770	1011370	in un grande continente dove non c'era nulla, si fondono con un'unica lingua, creano una
1011370	1024210	realtà comune e ne nasce una straordinaria realtà. L'Europa è la cosa diversa, l'Europa
1024210	1035530	ha state più delle volte ostilie e nemici con i 25 secoli di guerra in interrot, con
1035530	1042110	diverse lingue, con diverse tradizioni che hanno deciso di mettersi assieme conservando
1042110	1052870	le loro radici nazionali e regionali ed è qui il problema per fare fronte a livello
1052870	1059850	allo globalizzazione, ma mantenendo quelle che sono le grandi radici spirituali, le
1059850	1068390	grandi tradizioni delle regioni, delle nazioni, perché è il modo con cui si può preservare
1068390	1075490	la pace in una storia che sempre è stata così controversa. È una sfida straordinaria,
1075490	1083830	sfida importantissima ed è quella in cui noi siamo immersi e la debolezza di fronte a questa
1083830	1094690	sfida ha segnato la crisi dell'Europa, cioè ci si è detti che non c'è la possibilità di superare
1094690	1099910	gli egoismi, le tensioni, le lotte, le guerre passate. L'Europa è proprio invece la sfida
1100850	1106670	ed è straordinario già quello che si è stato realizzato, perché poi quando si vivono i
1106670	1116630	fatti storici non ci siano accorgi. Io mi sono stato molto addolorato negli anni scorsi leggendo
1116630	1126130	sempre questi commenti sulla moneta unica come se fosse solo un fatto economico. Guardate che la
1128550	1136250	moneta e che quindi sono obbligati nel futuro a far convergere la loro economia, ad avvicinare
1136770	1141870	sempre di più, anche se in un tempo lunghissimo, le regole della loro convivenza, a confrontarsi
1141870	1148290	l'uno con l'altro. Non stanno facendo un lavoro puramente economico, stanno facendo la più grande
1148290	1154490	sfida politica che si possa fare. Infatti non è mai successa della storia, non è mai successa perché
1154490	1159450	nessuno è mai stato capace. Ci fu l'Unione monetaria latina poi abbandonata, ci furono alcune
1159450	1166930	unioni monetarie nel nord d'Europa poi abbandonate. Ma questo grande fatto di mettere insieme e
1167970	1176930	rinunciare quindi alla sovranità uno dei due grandi pilastri dello Stato moderno, cioè uno è la
1176930	1183170	spada, l'altro è la moneta, grandi pilastri dello Stato moderno, rinunciare adesso per metterlo
1183170	1193170	insieme significa iniziare una sfida che ci porterà ad una concezione nuova delle strutture
1194790	1202270	politiche straordinariamente importanti in cui dobbiamo proprio redistribuire il livello di potere
1202270	1209810	a livello regionale, a livello nazionale, a livello continentale, a livello europeo. Io ero avuto
1209810	1215050	una bella discussione con il Presidente della Baviera, il Presidente rappresentante,
1215270	1222150	cioè sostanzialmente la più forte, la più significativa regione europea con una fortissima
1222150	1232170	tradizione, con una sua individualità, con degli elementi culturali molto forti. È stato molto
1232170	1238750	importante questo confronto culturale nella riassicurazione da parte mia non retorica che
1238750	1245590	Europa si costruiva rispettando profondamente questo principio di sussidiarità che vediamo
1245590	1255330	nella regione, nelle strutture locali, la concreta attuazione, l'incarnazione della politica e che
1255330	1262110	vedeva alcune delle funzioni fondamentali doveri invece andare a livello nazionale e a livello
1262110	1268350	continentale come la moneta perché questo è indispensabile non solo per rilevare il livello
1268350	1275930	di vita ma per potere nelle grandi decisioni che aspettano l'umanità avere una voce comune. Ecco
1275930	1285810	allora questo grande cammino è veramente uno degli sforzi veri e reali per conciliare globalizzazione
1285810	1295670	e rispetto dell'uomo e attenzione alle radici locali. In Europa questa sfida è straordinariamente
1295670	1302730	importante. Come dicevo negli Stati Uniti una sola lingua ha unificato tutto. Noi abbiamo nell'Unione
1302730	1311550	Europea questo impressionante fattore di avere 15 paesi, 11-12 lingue, in futuro 20 paesi,
1311850	1320990	presto 20 paesi e 15 lingue poi 25 paesi e 18-19 lingue. Quando si analizza la struttura della
1321930	1329130	commissione un terzo dei funzionali graduali, dei lavoriati diremo noi, lavora o come traduttore o
1329130	1334990	come interprete. È guai che non sia così perché le lingue di lavoro possono essere uno, due, tre,
1335170	1342090	poche, pochissime ma le lingue ufficiali che sono la radice dell'Europa devono essere mantenute
1342090	1348430	se no il problema della perdita dell'identità, della perdita della storia, delle radici diventa
1348430	1354430	veramente un problema reale e non è mai stato fatto nella storia dell'umanità questo sforzo di
1354430	1360390	mettersi assieme conservando le radici avendolo come obiettivo fondamentale. Ecco questa è la
1360390	1368430	grandezza dell'Europa, è la grandezza dell'Europa. La sfida è difficilissima perché contemporaneamente
1369150	1375810	questa sfida deve essere fatta non solo rispettando ma fondandosi profondamente sulle radici
1376750	1382990	democratici e quindi il nuovo ruolo del Parlamento e quindi questi rapporti fra Parlamento e Commissione
1382990	1392170	che sono simbolo di crescita, che sono alla radice di ogni affermazione di democrazia. Sempre la
1392170	1400370	democrazia si è affermata con delle tensioni fra il Parlamento del Governo, fra il Parlamento
1400420	1411280	esecutivo. Abbiamo questa grande Europa che tenta di crescere con una sosta che ha avuto negli ultimi
1411280	1418380	mesi con le difficoltà della Commissione ma anche con alcuni elementi nuovi straordinari per importanza
1418380	1427280	che hanno richiamato l'Europa in gioco. Ho parlato prima della pace perché l'Europa è nata per la pace,
1427280	1435380	non è nata per il commercio. Poi ha fortunatamente sviluppato anche una sua economia ma è nata.
1435400	1441820	Quando De Gaspera e De Navarro e Schumann sotto la finestra in tedesco, perché tutte e tre parlavano
1442940	1450800	tedesco, parlavano dell'Europa futura, ne parlavano per la pace, nessuno dei tre era un economista.
1451720	1457440	Ripeto sempre che ci sono degli appunti di De Gasperi in cui chiaramente confonda i miliardi con i milioni,
1459180	1466400	ma la grandezza politica c'era. E parlavano di pace e capivano che bisognava rompere un anello
1466400	1473400	della storia che aveva devastato e noi dove si è allargata l'Europa abbiamo sempre avuto la pace.
1474190	1481350	La guerra è stata fuori dal confine d'Europa, la guerra è stata nei Balcani, immediatamente al di là dell'Europa.
1481510	1492810	La guerra ha preso l'Europa orientale. Questa è la prima grande missione e qui a Roboba verranno dei grandi problemi a noi.
1492810	1498810	L'allargamento, vedete, è una delle prime grandi sfide che noi abbiamo di fronte,
1499770	1512290	significa portare l'Europa da 362-64 milioni a 500 milioni, ma con delle cose straordinariamente nuove,
1513970	1520970	cioè l'allargamento ai dieci paesi che hanno fatto domanda e l'hanno fatta per sentirsi perché sono europei nell'anima,
1520970	1530190	perché fanno parte della stessa famiglia. Guarda, questo vuol dire il 32-33% di territori in più, il 30% di popolazioni in più,
1530730	1543350	ma l'8-9% di reddito in più, solo l'8-9%, quindi voglio vedere poi le nostre associazioni, noi stessi,
1543430	1549130	quando ci sarà da fare questo sforzo che è chiaro non è in dolore dal punto di vista economico,
1549690	1555570	è chiaro che dovrà comportare sacrifici e problemi da parte della nostra società,
1556510	1563630	compreso i settori che ci stanno così cari, come l'agricoltura, come i settori di aiuti regionali,
1563790	1572610	e allora qui cominciano a venire i grandi problemi, fin dove si spinge una solidarietà,
1572610	1584010	fin dove si è disposti a capire che ci sono dei disegni, e quindi la disponibilità verso questa umanizzazione,
1584010	1589990	di cui è uno dei grandissimi problemi, delle grandissime sfide che noi abbiamo,
1590590	1595110	con un concetto assolutamente nuovo della politica estera, anche qui mai successo al mondo,
1595230	1599990	una politica estera che non è in funzione del rapporto con paesi estrani,
1599990	1607610	ma che è in funzione dei rapporti con paesi che diventeranno parte della stessa comunità in cui noi viviamo,
1607770	1615550	quindi con tutta una necessità di precedere la coesione, la unione, con uno sforzo economico,
1615950	1622030	con una capacità di interpretare i loro problemi, con uno scambio culturale, istituzionale,
1622310	1627770	questo grandissimo sforzo, anche qui, che è uno sforzo che l'umanità non ha mai fatto.
1627770	1638570	Quando parliamo di globalizzazione, abbiamo proprio delle cose da fare, abbiamo degli esami concreti,
1638930	1648550	abbiamo dei problemi da affrontare subito, proprio perché non è che noi possiamo poi rinviare questi problemi
1648550	1653690	dall'allargamento all'infinito, lo abbiamo promesso, ci siamo impegnati,
1655390	1660910	questi paesi, se non diamo una risposta rapida, avranno al loro interno delle tensioni,
1660950	1666650	delle frustrazioni terribili che porteranno episodi simili a quelli dei Balcani,
1667730	1671050	accanto al periodo di regnamento c'è poi il mondo dei Balcani,
1671050	1679050	il mondo che ha visto in questa guerra una giusta…
