start	end	text
0	9480	Fra i partecipanti al Congresso, più storie, più tradizioni, più esperienze diverse e
9480	18280	più scuole diverse. Il Congresso le metterà a confronto. Da noi la scuola è prima di
18280	27980	tutto scuola di cultura. Non è stata però sufficiente scuola di democrazia. Come superare
27980	37040	questo ritardo, noi continuiamo a pensare che la scuola sia sempre scuola di cultura,
37340	47580	di conoscenza. Ma crediamo che sia necessario che a scuola si parli di democrazia, si faccia
48740	57960	democrazia, come parte del messaggio dell'insegnante, ma anche come responsabilità di tutti i
57960	66720	giovani dentro la scuola. Una scuola che insegna e coinvolge, che i giovani sentano
66720	78300	come propria, in cui non ci siano più oggetti ma tutti siano soggetti, che misura la responsabilità
78300	86420	di ognuno, che si auto progetta e si auto promuove. Questa è la migliore scuola di
86420	94040	democrazia, perché insegna ad essere responsabili della propria vita e a rispettare gli altri.
94940	99300	Benvenuta in questa città, nel nostro Paese, signora Clinton.
130100	139540	Signora Clinton, cari amiche, cari amici, vorrei fare alcune brevissime riflessioni
140540	149260	sulla problema dell'educazione alla democrazia e sulle riflessioni nel rapporto fra il crimine,
149340	158980	corruzione e democrazia. Vi è infatti una stretta connessione tra criminalità organizzata e
158980	169500	corruzione. Esse sono assimilabile per dimensione economica e esse hanno entrambe la capacità
169500	177500	di inquinare l'economia e la convivenza civile. La loro pericolosità per la legalità e per
177500	186540	la democrazia è enorme, esse sono transnazionali. Esse sono agevolate dalle caratteristiche e
186540	192840	dall'esigenza di un mercato globale e sono le premesse per affermare che la lotta alla
192840	199160	criminalità organizzata e della corruzione rappresentano un momento fondamentale per
199160	207720	la difesa della legalità e, attraverso questa difesa, la difesa della democrazia. La corruzione
207720	215380	è oggi uno strumento privilegiato dei gruppi criminali per conseguire profitti e per acquisire
215380	220920	potere. Da ciò deriva la necessità di combattere i due fenomeni della criminalità organizzata
220920	228980	e della corruzione contemporaneamente nell'ottica nazionale e nell'ottica internazionale. Questa
228980	236000	è l'importanza di questo convegno. Attraverso gli strumenti della cooperazione
236000	242620	giudiziale di polizia e dell'armonizzazione della legislazione, noi dobbiamo fare insieme
242620	250460	nel mondo questa lotta. Ma occorre tener presente anche le forme di corruzione che hanno effetti
250460	257740	negativi e pericolosi sulla società sull'economia e sulle istituzioni di molti paesi. Penso
257740	264500	a tre grandi aree di comportamenti corruttivi. Lo street level, cioè il livello più basso
264500	270220	dei pubblici ufficiali, il livello degli affari e il livello più elevato dei grandi centri
270220	278120	di potere politico, economico e finanziario. E noi dobbiamo affrontarli tutti assieme avendo
278120	286540	il coraggio di riconoscere che la corruzione è un fenomeno complesso e che non può essere
286540	295460	visto solo nell'ottica della repressione giudiziale. In tutte le sue manifestazioni la corruzione
295460	300000	è una presenza correlata a un'ampia gamma di variabili che vanno da...
