start	end	text
0	4980	anche in questa sala. Tutti quelli leonati a lui? Eh sì, ma noi abbiamo un debole per
4980	10680	i leoni di agosto. Esistono due partiti, i leoni di lui, io e i leoni di agosto. Però
10680	22720	sono tutti leoni, sono tutti leoni. Sostanzialmente io avrei finito. Avrei finito perché a me
22720	29980	quello che premeva era dire quanta straordinaria fiducia di futuro, quanta straordinaria speranza
29980	36360	oggi è possibile continuare a coltivare a Palermo, in Sicilia, nell'intero paese e
36360	43480	questo lo facciamo. Con Romano Prodi, dietro Romano Prodi, spingendo Romano Prodi ad andare
43480	48880	avanti vi assicuro che non ha nessun bisogno di essere spinto per andare avanti. Il problema
48880	52600	è nostro di tenere il suo passo per lui che corre. Grazie Romano.
79040	81980	Adesso la parola al presidente Romano Prodi.
83440	88360	Cari amici, Leo Ducca, vi ringrazio molto per questa accoglienza. Ti ringrazio molto
88360	96920	per le parole che hai detto, parole di una sera che sarebbe molto felice se non avessimo
96920	125620	dentro di noi i problemi del cosco. E' una strana, una strana, una strana, non, basta
125620	138860	ragazzi. Grazie, grazie, grazie, grazie, grazie. Prego presidente, grazie, grazie, grazie,
139140	155600	grazie, grazie, prego presidente, continui. Dicevo, dicevo, per favore, per favore, per
155600	162860	favore, grazie, grazie. Avete manifestato il vostro pensiero, è stato ascoltato, consentite
162860	169940	agli altri di continuare ad esprimere il proprio pensiero. Vi sarei grato se adesso, fate parlare
169940	185360	il presidente, prego presidente Prodi. Scusate. Scusate, avete manifestato il vostro
185360	215340	pensiero in maniera democratica, consentite al presidente Prodi di continuare il suo
215340	240860	incontro. Scusate, potete consentire di continuare questo incontro? Grazie. Per favore, grazie,
240860	254500	non è molto garbato anche l'uso di questo linguaggio, grazie, grazie, grazie. Per favore,
254860	263380	adesso, per favore, consentite di continuare il dibattito, consentite di continuare il
267540	293180	dibattito. Presidente, per favore, io la invito. No, ma, cari amici, allora, vi dicevo, vi
293180	301600	sono dei modi e modi di esprimere il proprio dolore. Ma basta, non siete monopolisti della
301600	317180	pace, per favore. Basta, adesso basta, su. Basta. Non è con la violenza, non è con
317180	335240	questa parola che si porta avanti la pace. Allora.
349400	368280	Allora, amici, riprendiamo, riprendiamo il discorso, riprendiamo il discorso. Stavo,
370960	381120	stavo dicendo che questi sono stati per noi giorni di grande importanza, sono stati giorni
381120	391760	in cui ho dovuto assumere una responsabilità nuova, una responsabilità pesantissima e
391760	399080	sono stati giorni soprattutto in cui il problema del Kosovo ha pesato su di noi in modo enorme
399080	406080	e non è certo necessario che ce lo vengono a dire alcuni urlando come matti perché la
406080	415300	sensibilità sulla pace l'abbiamo noi profonda, l'abbiamo nel nostro animo, non abbiamo bisogno
415300	427600	che ce ne insegnino persone poi che non possiamo dimenticare il dolore che il Kosovo porta dentro
427600	439320	di noi, il vedere queste stragi, il vedere un popolo che viene massacrato in modo tremendo,
439320	446960	vedere soprattutto la pace così lontana, avevamo sperato nell'ultima ora, io avevo molto sperato che
446960	452280	la missione del Primo Ministro russo Primakov potesse essere l'inizio di una soluzione del
452280	461220	problema, ho visto con grande dolore che la missione diventa di ora in ora più difficile e
461220	470280	presenta ben pochi spazi di successo e quindi abbiamo questo problema che ci sta di fronte
470280	478560	a noi che anche nei prossimi giorni ci accompagnerà ed è su questo tema che io volevo cominciare
478560	487440	le riflessioni proprio perché dobbiamo ricordare che la pace noi l'abbiamo preservata per tanti
487440	494760	anni, proprio perché la pace l'abbiamo preservata per tanti anni, proprio perché abbiamo costruito
496220	502280	un'alleanza, proprio perché abbiamo costruito delle reti di solidarietà, proprio perché abbiamo
502280	511720	costruito dei rapporti tra i Paesi che hanno visto la pace come principale obiettivo, ma avremmo
511860	518100	fatto poco se questo obiettivo l'avessimo difeso soltanto con un'alleanza militare, ma l'abbiamo
518100	526280	difeso soprattutto con la realizzazione della più grande struttura sovranazionale mai realizzata
526280	534760	dalla storia dell'umanità, cioè l'Europa. Poi questa sera noi stiamo piangendo, stiamo
534760	543280	dolorati fino in fondo per i problemi del Kosovo, due anni fa avevamo, quattro anni fa avevamo i
543280	550700	problemi della Bosnia, abbiamo avuto i problemi della Fugoslavia e guardate sono stati tutti i
550700	557700	problemi che sono nati nelle zone in cui ancora non c'è l'Unione Europea. L'Unione Europea è
557700	562160	stata un'alleanza di pace, l'Unione Europea è stata un'alleanza di progresso, l'Unione Europea
562160	568980	ha permesso di ritenere a mio parere definitivamente finite tutte le tensioni che
568980	576480	c'erano stati per 25 secoli in Europa. Pensate i massacri fra Francia e Germania nell'ultimo secolo,
576940	582600	pensate tutte le guerre che dai romani in poi avevamo avuto, il sangue che era corsa in Europa,
582600	593980	le divisioni che avevamo avuto. Ora dal 1945 questa Europa è un'Europa in pace. Se noi abbiamo
593980	606280	questi problemi è perché ancora noi non abbiamo potuto espandere la nostra Europa al di là dei
606280	614220	confini di quella che era l'Europa occidentale. Ancora non si è andata al di là del muro
614220	622480	di Berlino, ancora si è andata al di là della cortina di ferro, ma guardate che questo è anche
622480	628280	l'unico strumento di pace che noi possiamo offrire. Al di là degli urli, al di là delle
628280	634380	manifestazioni che non sono fatte per costruire, sono fatte per dividere, non sono fatte per dare
634380	641140	speranza per il domani, sono fatte per una rabbia riguarda ieri. Anche se c'è profonda comprensione
641140	650080	per questa ira, guardate che i problemi del Kosovo possono essere guariti soltanto dall'Europa. Se noi
650080	657820	possiamo pensare a una conferenza di pace, se noi possiamo pensare al dopo di questo conflitto e se
657820	663840	noi possiamo pensare che ci sia una qualsiasi speranza per questi paesi che possono ritornare
663840	669920	a una vita normale, la possiamo pensare unicamente in una chiave europea. Noi non possiamo pensare a
669920	674920	una conferenza di pace come quelle tradizionali in cui le grandi potenze di nuovo facciano la
674920	682580	spartizione di questi paesi, perché preparerebbero semplicemente un'altra guerra, ma abbiamo
682580	689900	uno strumento in più. Vi dicevo abbiamo l'Europa. E allora come vedo il futuro, come vedo quando
689900	696460	potrà avvenire questo dialogo di pace, certo oggi non è giorno da parlarne, ma lo dobbiamo
696460	702520	cominciare a pensare, lo dobbiamo cominciare a costruire, le armi taceranno, taceranno,
702560	708980	spero che taceranno presto. E allora è chiaro che dobbiamo metterci tutti attorno a un tavolo,
709890	721270	pensare a ricostruire i confini secondo i rapporti etnici, ma non riusciremo a nulla se non
721270	727030	buttassimo dentro grandi risorse economiche e se non garantissimo che questi piccoli paesi che si
727030	733370	formano in questa intricata etnia balcanica possono avere un riferimento all'unica casa
733370	738270	dell'Europa, possono essere sotto l'unico tetto dell'Europa, possono quindi svilupparsi,
738650	743910	possono quindi di coltivare la loro diversità, la loro autonomia, ma non in urto contro gli altri,
744810	750670	ma in un rapporto che viene mediato, che viene custodito, che viene protetto dalla grande casa
750670	759490	europea. Guardate è chiaro che quando pensiamo a questi fatti uno può anche pensare che sono
759490	765050	sogni, che sono utopie, vi chiedo solo di fare un piccolo pensiero su quello che sta
765050	774830	succedendo in questi giorni. Le truppe in Bosnia, che sono ormai tre anni e mezzo se ben mi ricordo,
774990	783050	che sono in Bosnia, facendo conti in grosso, ma vicino a realtà costano dai 10 ai 15 miliardi
783050	789950	al giorno. Solo questo, fra la Bosnia e la Macedonia si supera questa cifra, vuol dire
790770	797810	4.000-5.000 miliardi all'anno che possono essere portati allo sviluppo senza una lira in più di
797810	804950	quelle che vengono dispesi. Pensate, la guerra di questi giorni, anche qui con rapidi conti,
805130	811410	non costa meno di 200 miliardi al giorno, non costa meno di 200 miliardi al giorno, forse costa
811510	818410	di più. Pensate quello che significa in termini di sviluppo, pensate qual è la drammatica scelta
818410	824990	che fa la guerra, pensate... e allora tutte queste sono risorse che sono pronte per poter
825790	832150	ricostruire, per poter ricucire la ferite che c'è stata, per questo che pur comprendendo queste
832150	839530	manifestazioni, pur comprendendo queste urli, non è con queste che noi ricostruiamo la pace,
839530	845730	non è con queste manifestazioni di odio che noi riprendiamo il filo che si è interrotto,
845850	853170	ma dobbiamo farlo con questa grande proposta che dà una speranza concreta, che dà una speranza
853170	864290	stabile. Certamente i Balcani sono per noi un insegnamento grandissimo, voi sapete,
865590	873650	ripensiamo un attimo la guerra di Bosnia. L'Europa impotente, non si è mossa,
874990	881210	per mesi e mesi abbiamo assistito alle strage, ci siamo sdegnati, ma politicamente l'Europa non
881210	888550	aveva e non ha ancora una politica estera. Allora sono arrivati agli Stati Uniti e mi sono stato
888550	896010	gratissimo che abbiano costruito questa pace chiamata di Detono e l'hanno costruita con la
896010	902670	grande logica, lo grande spirito americano della convivenza fra diverse etnie insieme che è bello,
903230	908470	che è come sono nati gli Stati Uniti, ma che purtroppo nella situazione dei Balcani non può
909990	916750	funzionare o funziona difficilmente o ha bisogno di decenni per poter funzionare. Allora noi ci
917070	922810	troviamo di fronte a questi problemi del passato e ci troviamo di fronte a una ripetizione ancora
922810	929290	più tragica, ancora più forte nel Kosovo con lo stesso ritmo, moltiplicato per tante volte.
929290	949290	L'Europa, l'Europa, l'Europa non riesce. I telefonini sono la più grande caratteristica italiana,
949290	959090	mandate però farci. Allora, parlerò più forte, parlo più forte, va bene? Allora,
959610	967630	dicevo, pensate in Kosovo, lo schema è lo stesso, lo schema è lo stesso. L'Europa che è vicina,
967810	971790	che ha la responsabilità di quest'arrivo, che non hanno gli Stati Uniti, ma che non riesce a
971790	977090	organizzare una politica estero, gli Stati Uniti che riaccorpano, organizzano, è l'Europa che si
977090	985150	trova a vedere la propria politica estera diretta da altri e questo sarà sempre così finché l'Europa
985150	990030	non riaggronizzerà la propria politica estera. Questo è uno dei primi compiti che vi saranno
990030	998630	nei prossimi cinque anni. Un compito che è reso possibile da Trattata di Amsterdam, un compito
998630	1004610	che noi dovremmo costruire, che dovremmo eseguire nel prossimo cinque anni. Quindi pensate alla
1004610	1010370	grande importanza, perché le nuove Bosnie, che spero non avvengano, ma qualora dovessero
1010370	1017350	avvenire, dovranno essere affrontate dall'Europa, perché questo è un problema europeo, anche perché
1017350	1025390	vedete solo chi è vicino a questi problemi li può valutare nei suoi effetti ultimi. L'altra sera
1025390	1034350	quando mi ha trefrato Clinton con molto affetto, congratulandosi per la nomina con parole calde,
1035170	1041170	no? Dice bello per te, bello per l'Italia, bello per l'Europa, bello anche per noi. Abbiamo parlato
1041170	1052030	a lungo poi del coso e la posizione che era non facile da spiegare nei termini politici ma si
1052310	1059490	comeva nel fatto molto semplice. Presidente, noi siamo a 300 km dal coso, voi siete a 6000,
1059970	1065250	quindi noi abbiamo un'opinione pubblica diversa, noi abbiamo questi problemi, noi dobbiamo essere
1065250	1071950	uniti, lo siamo, c'è questa necessità di portare alla pace, ma non può esserci la stessa sensibilità
1073230	1080810	quando ci sono queste grandi differenze. Però la colpa è nostra, la colpa è nostra, non è del
1081510	1087310	colpa nostra che non abbiamo saputo creare questa unità. Però voi vedete perché questo momento
1087310	1094150	dell'Europa è così importante, perché mi sento così onorato ma anche così travolto da grande
1094150	1108790	peso per assumere la presidenza della Commissione Europea, proprio perché accanto a questo c'è
1108790	1114370	immediatamente l'altro tema della sicurezza di tutti i cittadini europei, che ormai non è più
1114370	1119950	garantita dai singoli paesi. I confini nostri non sono più confini nostri, i confini nostri sono i
1119950	1124250	confini tedeschi, i confini della Germania sono i confini dell'Italia, sono tutti i confini dell'Europa,
1124390	1129810	ma dobbiamo questa enorme responsabilità di portare avanti questo continente, verso la sicurezza,
1129990	1136150	verso la giustizia, verso l'unità, con l'obiettivo di arrivare veramente a una cittadinanza europea
1137010	1142390	comune. E' bello, è ancora un sogno, ma è una delle cose che dovremmo studiare, che i bambini
1142390	1150230	che nasceranno dal 2000 in poi nascono cittadini europei e cittadini italiani, nascono cittadini
1150230	1157910	di tutti i paesi dell'Unione. Questo può essere anche nulla, ma quando questi avranno 18 anni
1158610	1164390	avranno assolutamente un'unica cittadinanza, un unico diritto, un'unica struttura. Allora
1164390	1170870	veramente si comincia ad avere questa grande Europa, questo senso di appartenere a un continente
1170870	1177690	con la sua grandezza, con la sua capacità di influire enormemente nel mondo. Allora vedete
1177690	1186650	questo, da tutto questo noi saremmo fuori se non fossimo entrati nell'Euro, perché una cosa è
1186650	1191050	stare fuori dall'Euro per la propria scelta, come ha fatto la Gran Bretagna, che ci può entrare
1191050	1196350	quando vuole, una cosa è stare fuori dall'Euro perché non ci si riesce a entrare come sarebbe
1196350	1206510	accaduto all'Italia quando noi abbiamo fatto questo fuoco. Allora è stato, e in questo senso la battaglia
1206510	1212790	che abbiamo combattuto non è stata la battaglia per creare l'Europa dei banchieri, l'Europa delle
1212790	1220510	banche. Questo è stato un messaggio che è corso per tutti i nostri giornali, per le nostre televisioni,
1220510	1227330	per alcuni tempi. Poi ci si è accorto che questa è stata la più grande decisione politica, non economica
1227330	1233930	negli ultimi anni. Questa ha cambiato la natura dei nostri Stati, ha cambiato e cambierà la nostra
1233930	1244910	testa, perché per la prima volta, eh telefoniti, lasciamo rifare, non c'è problema. Eh! Come nervoso lei!
1255410	1256090	Dicevo...
1256090	1260510	Ma si metta a sedere, che mi preoccupa, mi preoccupa!
1262930	1273250	Dicevo, è stata una decisione che ha cambiato la natura degli Stati in cui viviamo e cambierà la nostra
1273250	1281110	vita quotidiana. Vedete, i fondamenti dello Stato moderno sono soltanto due, i grandi pilastri,
1281590	1292730	no? La difesa, l'esercito e la moneta. Per accordo fra 11 paesi la moneta non è più prerogativa
1292730	1300250	dello Stato, ma va a un'entità superiore. Immediatamente dopo questo il governo inglese,
1300640	1306920	che è rimasto fuori dall'euro e che ha sempre stato tra i più scettici riguardo alla difesa
1306920	1311900	comune, riguardo alla politica estracomune, immediatamente ha cominciato a proporre forme
1311900	1317640	di collaborazioni progressive nella difesa comune. Questo perché, rimanendo fuori della moneta,
1318600	1325740	capiva che poteva essere marginata dall'Europa mentre vuole giocare un ruolo importante in questa
1325740	1331960	grandissima realtà che si va creando e allora proprio il governo inglese, subito dopo la moneta
1331960	1340740	unica, propone una cooperazione nella difesa. Perché questo? Perché l'Europa non si costruisce
1341500	1347740	su queste, solo sulle piccole decisioni, ma su queste grandi scelte e quella della moneta è stata
1347740	1354700	uno dei salti in avanti che nessuno poteva pensare. E guardate questo rafforzo del nostro
1354700	1361340	continente e rende ancora più drammatica la nostra impotenza in politica estra. Se voi pensate
1361340	1371840	che l'area dell'euro è, già oggi, solo quegli paesi, rappresenta l'80% dell'area del dollaro.
1372040	1376880	Quando entreranno gli altri quattro siamo già superiori al dollaro. Quando entreranno i paesi dell'est,
1376880	1379880	diventiamo di gran lunga.
1394660	1402180	A risolvere un problema che ha 300 km dall'Italia, che ha 300 km dai suoi confini e che aspetta
1402180	1408940	e che deve essere coordinato da coloro che sono a 6000 km dei propri confini. E questa
1409680	1415440	differenza, questo senso di impotenza che noi proviamo, questo senso di frustrazione che noi proviamo,
1415740	1421200	ecco però il guai se noi pensiamo alla politica estra di vecchio tipo, come vi dicevo prima.
1421560	1426160	Se noi pensiamo alla politica estra come gioco della componente delle grandi potenze,
1426280	1433320	politica estra europea deve essere una politica estra di pace, di solidarietà, ma anche una politica estra
1435080	1437760	fondata evidentemente su una struttura forte.
1437900	1446540	Se voi pensate, vedete, quando si lascia andare avanti le cose come si è fatto in questa generazione,
1446800	1451360	ci sono delle conseguenze che solo quando le si vivono le si capiscono.
1451580	1460380	Cioè la struttura di difesa americana ed europea sono ormai così diverse come efficienza, come modernità
1460380	1468380	che in operazioni come queste è persino difficile dialogare tra le strutture militari dei due continenti.
1469460	1477280	E la distanza è così grande che, eppure, se sogniamo le spese della difesa europea, sono più piccole
1477280	1484560	di quelle americane, ma non sono un indice così più basso di quelle, non sono un rapporto che non sia
1484560	1491260	paragonato, ma questa dispersione, questo raddoppio di strutture, questa mancanza di coordinamento
1491260	1497680	ha portato a un'unificienza, uno spreco, a una mancanza di espressione, di capacità di espressione politica
1497680	1504920	di azione che ha reso l'Europa veramente marginale nella vita politica del mondo, pur essendo l'Europa
1504920	1513760	una grande realtà, pur essendo l'Europa una struttura di potere immenso dal punto di vista potenziale.
1513760	1520960	Ecco, allora è chiaro che il compito che abbiamo di fronte è proprio quello di riorganizzarsi
1521640	1527900	e arrivare a questo obiettivo, con dei passi che dobbiamo fare di enorme importanza.
1528640	1536580	Abbiamo di fronte a noi chiaro, primo se vogliamo decidere su queste cose dobbiamo riformare il modo con cui si decide.
1537340	1543900	Voi sapete che attualmente le grandi decisioni europee vengono prese dai 15 capi di Stato o capi di Governo
1543900	1548760	all'unanimità, basta uno con un veto per bloccare tutto.
1549440	1555940	Quando, e poi parlermo dopo un po' più approfonditamente, si è parlato di politica mediterranea,
1556060	1562420	per mesi e mesi è stata paralizzata dal fatto che parte di queste aiute andavano anche alla Turchia, ovviamente,
1562420	1568460	e c'è il veto grecco e tutta la politica mediterranea è stata paralizzata dal veto di un paese verso l'altro.
1568520	1571360	Potrei moltiplicare questi esempi in mille modi.
1571620	1580300	Allora è chiaro che il grande compito che adesso noi abbiamo è quello di cambiare la Costituzione, direi buono,
1580380	1587360	cioè il modo di formarsi delle volontà e passare dal veto alla maggioranza, passare dall'unanimità alla maggioranza
1587360	1593380	in modo da poter risparmiare le volontà, perché voi capite che se è difficile prendere decisioni in Europa 15,
1593620	1599080	come sarà difficile prendere decisioni dopo l'allargamento di un'Europa a 25?
1599700	1603580	E questo è l'altro secondo grande compito, l'allargamento.
1604280	1612220	L'Europa si è impegnata anche qui su problemi di pace, si è impegnata ad allargarsi verso est.
1612220	1620780	È un impegno gravosissimo, è un impegno che porta opportunità ma porta anche problemi molto forti, perché porta problemi forti.
1621460	1623760	Faccio un esempio molto semplice.
1625720	1632880	La somma dei paesi che ha fatto domanda costituisce il 30% in più del territorio dell'Europa di oggi,
1633240	1638020	il 29% in più della popolazione e tra l'8 e il 9% del reddito,
1638020	1644600	perché vuol dire che ancora abbiamo questi equilibri enormi, che ancora quindi dobbiamo fare operazioni di equilibri.
1644660	1650620	Per fortuna che molti questi paesi, come la Polonia, stanno crescendo in fretta, stanno crescendo molto più in fretta del dovuto,
1650960	1656560	ma pensate che solo la Polonia ha molto più agricoltori di Francia e Germania messi assieme,
1656700	1660140	ha quasi il numero degli agricoltori di Francia, Germania e Italia messi assieme.
1660140	1663900	Pensate quindi quali problemi si aprono con questa apertura.
1664300	1667940	Ma guai se l'Europa si ferma, guai se l'Europa si ferma.
1668760	1673300	Però, e qui veniamo ai nostri problemi, l'Europa ci arriva addosso a noi.
1674160	1678140	Ecco quello che deve essere il nostro compito e il mio compito nel futuro.
1678140	1692100	Far chiaramente apparire, far chiaramente dimostrare ai colleghi europei, a tutti i paesi europei che non c'è solo l'est,
1692860	1694780	che non c'è solo l'est, ma c'è anche il sud.
1694780	1696900	E c'è il Mediterraneo.
1698920	1710900	E qui abbiamo una problema enorme, creare un legame molto forte fra i paesi del Mediterraneo che appartengono all'Unione Europea,
1711160	1721500	fare in modo che i paesi del sud del Mediterraneo, cioè i paesi africani, si coordinano fra di loro, creare delle istituzioni.
1721500	1730720	Può essere una banca di Mediterraneo, può essere qualcosa d'altro, studiare istituzioni, in modo che questo diventi il centro di sviluppo.
1730800	1732020	Può anche essere questo.
1732460	1734000	La metropolitana Palermo.
1734460	1737100	E oi, questa è tua, questa è tua.
1739900	1741300	Questa è tua, Leo Luca.
1743820	1748500	E vi dicevo, no, la metropolitana Palermo io...
1749960	1751420	Vabbè, allora è anche mia.
1765000	1769260	Mi lasci a parlare? Mi lasci a parlare, scusi un attimo.
1770020	1772740	Grazie, grazie. Molto gentile stasera.
1772740	1786740	Senta, allora, dicevo, qui è il problema, qui è il problema, qui è il problema di come impostare questa politica del Mediterraneo.
1787760	1795740	Questo è un fatto estremamente importante e c'è un nucleo forte di solidarietà su questi problemi.
1796540	1800740	C'è la Francia fortemente impegnata, c'è la Spagna, c'è l'Italia, c'è la Grecia.
1800960	1806140	E si trova un asse di interesse molto forte su questo.
1806820	1812960	Perché se non riusciamo ad avere anche una chiara politica nei confronti della sponda sul Mediterraneo,
1813780	1819960	diventa molto più difficile fare qualsiasi opera di sviluppo nel nostro mezzogiorno,
1820200	1825700	qualsiasi opera di cambiamento per la Sicilia, per la Calabria, per queste zone.
1825700	1833600	Perché se vogliamo uno sviluppo, dobbiamo fare in modo che queste da periferiche diventino centrali nello schema del sviluppo.
1833720	1838180	E quindi bisogna che il Mediterraneo ritorni ad essere alla sviluppo.
1838380	1842280	Diciamo, io in Calabria ci sono molte prospettive di questo.
1842440	1844060	Basta saperlo sfruttare.
1844640	1850960	Ci sono fondi e io immagino, e spero che ne saranno molte di più, verso il Mediterraneo,
1850960	1860000	che ripeto, viene a creare istituzioni ad hoc, ma non è assolutamente detto che ha da approfittarne sia il mezzogiorno d'Italia
1860000	1864160	o che invece non sia piuttosto il mezzogiorno della Spagna.
1865100	1870720	Le risorse vengono messe a disposizione, ma allora è la capacità di azione delle regioni,
1870800	1879060	è la capacità di azione delle comunità locali che deve incontrare la volontà e le decisioni europee.
1879060	1881360	E qui si pone quello che ha detto Leo Luca prima.
1882200	1885720	Le nostre regioni sono incapaci di decidere.
1885840	1888180	Sono incapaci di decidere una crisi dietro l'altra.
1888480	1891920	Non c'è la formazione di volontà ed è straordinaria la differenza fra...
1891920	1894800	Ci saranno tutti i difetti, ci saranno i problemi, lui anche brutto,
1895000	1906000	ma la differenza che c'è fra i comuni e le regioni come media di efficienza in Sicilia, in Campania,
1906000	1910500	prendete qualsiasi regione italiana, voi avete, il comune si muove,
1910740	1917280	il comune comincia a manifestare fatti innovativi, comincia a far vedere capacità di gestione.
1917560	1919000	Le regioni sono assolutamente paralegate.
1920040	1923000	Eppure non mi direte che c'è gente diversa tra comune e regioni,
1923900	1929900	è che la legge elettorale non permette una selezione della classe dirigente capace
1929900	1932120	non dare responsabilità per l'intera legislatura,
1932520	1937740	non permette la stabilità, non permette la formazione di governi forti
1937740	1941800	come è permessa ad essere i comuni e come noi vogliamo che sia il Paese.
1941980	1949820	Per questo non è indifferente a questi nostri obiettivi quello che capita il 18 aprile.
1949940	1952080	Non è indifferente il discorso del referendum.
