start	end	text
1952520	1954400	Entrano il cuore di questi problemi.
1954400	1956580	Perché con il referendum facciamo un altro passo,
1957060	1959560	non il definitivo, ma un altro passo sostanziale
1959560	1966360	verso la formazione di una legge elettorale che permette governi stabili e duraturi.
1966600	1969160	Non facciamo altro, non è che questo ci dia dei miracoli,
1969280	1974880	toglie il 25% delle proporzioni, non lo alloca nel modo migliore,
1974980	1976920	dovrebbe essere allocato nel modo migliore,
1976980	1982900	ma comunque costituisce un passo forte e decisivo verso la possibilità di maggioranza e stabilità.
1982900	1985220	E questo noi dobbiamo poi fare per le regioni,
1985400	1987680	dobbiamo fare in modo che tutte le strutture del nostro Paese
1987680	1988900	di una responsabilità a chi governa.
1990000	1992080	Quando la volontà popolare decide,
1993360	1995240	nulla può cambiare la volontà popolare,
1995640	1999060	basta con il baltone al centro, basta con il baltone alla periferia,
1999260	2004760	il governo si cambia soltanto quando il Paese decide di cambiarlo,
2005000	2010540	e cioè decide di costituire un nuovo governo.
2011940	2017640	Questa è stata la storia e la motivazione della nascita dell'Ulivo.
2017920	2020360	Noi abbiamo raggruppato insieme, lo ha ricordato Luca prima,
2021000	2024540	le forze riformiste di diversissima derivazione,
2025280	2031240	cattolici, democratici, socialisti, verdi, ambientalisti, repubblicani, laici,
2031480	2035980	li abbiamo messo insieme proprio per costituire una coalizione
2035980	2039560	che potesse dare al Paese un governo per cinque anni.
2040060	2045260	L'Ulivo ha insperatamente vinto le elezioni,
2045720	2047240	perché li ha vinti contro ogni speranza.
2047300	2052260	Quando siamo partiti, se vi ricordate, eravamo oggetto anche di derisione,
2052280	2054440	il che non è mai dradevole per chi fa politica.
2055180	2061900	Ma dopo la vittoria si è capito che gli italiani avevano compreso perfettamente
2061900	2063980	che quella che stava dentro questa proposta.
2066000	2069820	Dopo gli avvenimenti del scorso anno,
2070000	2073180	dopo la instabilità che è rientrata nel sistema,
2075440	2078800	dopo l'entrata nell'Euro, dopo la crisi di governo,
2079140	2080920	l'Ulivo è andato in crisi.
2080980	2085080	E noi, con i democratici, vogliamo ricostruire questo,
2085340	2087220	vogliamo ridare forza all'Alleanza,
2087480	2090000	vogliamo ricomporre l'Ulivo dopo le elezioni.
2090380	2092120	Abbiamo solo questo obiettivo.
2092120	2094800	Ricordando con molta semplicità
2096920	2103260	che senza i democratici l'Ulivo non ha alcuna speranza
2103260	2106220	di poter vincere le prossime elezioni.
2106540	2110660	Ma questo potrebbe anche essere un fondo incidentale nella vita del Paese.
2110760	2112220	A me scocerebbe moltissimo.
2112540	2114840	Ma per qualcuno potrebbe anche esistere.
2114880	2116700	Ma c'è qualcosa di ancora più grave.
2116700	2120700	Ricordatevi che senza questo tipo di proposta
2122140	2124480	ricomincia nell'Italia il trasformismo,
2125360	2127200	ricominciano i volti a Gabbani,
2127260	2130360	ricominciano i passaggi di parlamentare di qua e di là,
2130440	2133520	ricomincia quell'instabilità che è stata la rovina del nostro Paese.
2134020	2136700	Io vi posso dire nella mia esperienza
2137720	2140520	come la stabilità sia essenziale.
2140900	2144540	La fatica, la fatica del primo anno di governo,
2144540	2148380	la fatica terribile nell'acquistare fiducia,
2149380	2151840	nell'acquistare standing, nell'essere creduto,
2152040	2153420	è tutto più facile dopo.
2154440	2156880	Con la conoscenza diretta, con i problemi,
2157040	2158840	con la possibilità di prendere il telefono
2158840	2160400	e parlare con i tuoi colleghi,
2160560	2162580	esporgli le tue ragioni.
2164780	2166040	Questo è il nostro Paese.
2166240	2167760	Non abbiamo mai avuto la possibilità
2167760	2170400	di sviluppare una politica costante,
2170500	2171860	una politica di lungo periodo.
2171860	2176900	Allora, noi dobbiamo continuare questa battaglia politica
2176900	2177840	perché questa rende.
2177880	2181100	Sono gratissimo a Leo Luca Orlando e a tu, Bianco,
2181140	2183880	di aver cominciato oggi con la loro candidatura
2183880	2185300	questa battaglia politica.
2185660	2190860	Naturalmente è chiaro che molti si chiedono che cosa faceva io.
2192180	2195720	Al di là di riaffermare quanto ha detto Leo Luca
2195720	2197820	di una mia assoluta fedelità al progetto,
2198000	2199980	di una continuazione a questo,
2199980	2204360	è chiaro che queste settimane non sono state per me
2204360	2206240	settimane facili.
2206400	2207900	Con i miei amici, con i miei collaboratori,
2208260	2209620	tante volte con Leo Luca,
2210240	2215240	io avevo sempre fatto presente che vi era un'ipotesi,
2215520	2219340	che potessi essere indicato
2219340	2223280	per la responsabilità per cui sono stato poi indicato.
2224260	2225980	E ho sempre chiesto
2226780	2228820	quello che vorremmo fare,
2229120	2230980	vorremmo avvenire in mezzo di noi in anticipo.
2231720	2232760	Tutti mi hanno detto no,
2232940	2236260	il nostro paese non può perdere quest'occasione,
2236720	2241980	non può fare a meno di ricoprire la più prestigiosa carica del continente
2242720	2245780	in un momento in cui c'è bisogno di identificazione.
2246420	2247580	E mi è stato sempre anche detto,
2247900	2250800	non te lo perderebbero neanche i democratici,
2251080	2253820	non te lo perderebbero neanche coloro che ti vedono in te.
2253820	2259920	Allora, ho assunto la responsabilità di accettare questo,
2260260	2263040	di accettarlo con tutte le conseguenze che porta,
2263460	2268180	che però non sono le conseguenze di sottrarmi
2268180	2271320	al contributo dei nostri democratici,
2271400	2274300	all'asinello, di far trottare l'asinello ancora.
2278740	2281120	Questo è non solo possibile,
2281120	2282800	ma è sempre stata una tradizione
2282800	2284540	di che il Governo dell'Europa dell'Ono
2284540	2289120	non ha mai perso il rapporto con i socialisti francesi
2289720	2293120	e Sant'Erre con i democristiani luxemburghese,
2294280	2295960	un compito peraltro meno impegnativo.
2299460	2301760	Dato che quella definizione del Luxemburgo,
2301860	2302880	che ho sentito l'altro giorno,
2303120	2306580	dice che il Luxemburgo è grande come il cimitero di Vienna,
2306680	2307720	ma un po' più triste.
2314760	2318320	Poi, dicevo, non hanno mai toccato,
2318320	2320720	non hanno mai cessato di avere questi loro rapporti
2320720	2324220	e quindi neanche io posso cessare di averli.
2324440	2328500	Poi abbiamo avuto una strana situazione
2328500	2332660	di dimostrare una specie di incompatibilità giuridica.
2333560	2334580	Questa dimostrazione,
2334680	2336500	in cui ci sono esibiti tanti rappresentanti
2336500	2338080	dei nostri partiti italiani,
2341460	2344500	questa dimostrazione si è poi perduta
2344500	2346780	e si è trasformata, anzi, in un boomerang
2346780	2350200	per cui recentemente molti padamentari,
2350420	2352380	soprattutto conservatori del Nord,
2353220	2355860	ma di tutti i partiti anche socialisti,
2356260	2358720	hanno cominciato a manifestare l'opinione
2358720	2362940	che sia utile e che sia, anzi, molto utile
2362940	2365640	che quello che regge il Governo europeo
2365640	2367420	aveva avuto un'investitura popolare.
2367420	2370780	Quindi il discorso sta rientrando
2370780	2372080	da un'altra parte.
2372640	2375400	Ora io non ho ancora bisogno di cesare in materia,
2375620	2379380	proprio perché ne discuteremo, ne discuteremo ancora,
2380760	2383480	perché evidentemente che coerentemente
2383480	2385180	con quello che vi ho detto prima,
2385480	2387980	con quello che sono i miei obblighi, i miei compiti,
2388160	2390420	dovremo esaminare che questo non sia interpretato
2391100	2393440	da alcuni colleghi, da alcuni capiti di governo
2393440	2396760	come un elemento di distacco
2396760	2398780	dal compito che dovremmo fare.
2399620	2402640	Ma se questo non avrà, certamente
2405180	2406840	ci presenteremo le lezioni,
2407040	2408960	certamente faremo il nostro aderezzo in fondo.
2409180	2411840	Questo sarà per una decisione secondaria
2412440	2415700	rispetto alla decisione di continuare a lavorare
2415700	2418620	con i democratici, di essere vicino a tutti voi,
2418700	2420420	di essere vicino a quelli che sono candidati,
2420420	2422540	di essere presente.
2422920	2425760	E io credo che essere presente
2425760	2430520	dal alto della responsabilità della Presidente europea
2430520	2433000	sia anche estremamente utile all'obiettivo
2433000	2434300	che noi ci proponiamo.
2434560	2438580	Ecco, quindi lo strumento lo dovremmo esaminare,
2438640	2443780	lo dovremmo studiare, ma noi l'obiettivo è ormai chiaro.
2443880	2446920	L'obiettivo è quello di fare i democratici
2446920	2448380	con una forza politica forte
2448920	2453180	che ci aiuti alla ricomposizione
2453180	2456080	della coalizione di centro-sinistra
2456080	2458940	che è stata l'inizio del nostro lavoro politico.
2459340	2461920	Ecco, quindi, è interessante però
2462460	2464920	che quando noi siamo nati,
2466120	2468580	un'altra obiezione era che eravamo nati per dividere,
2468620	2470300	che avremmo diviso frammentato.
2470740	2475140	Adesso giorno per giorno stiamo riaccorpando
2475140	2476700	tantissime forze politiche,
2476780	2478680	non solo quelle che ha elencato prima
2478680	2480560	Leo Luca, non solo la Rete,
2480720	2485080	ma tutte le forze di rappresentanza regionale
2485080	2489140	o di rappresentanza etnica, specifica,
2489900	2491140	la Suttiro al Forza Partaica,
2491220	2493180	l'Unione Valdottani, l'Unione slovena,
2493480	2495420	adesso la Margherita di Trento,
2495880	2499580	tutti movimenti che si sono raggruppati nei democratici.
2499620	2502900	Per noi rappresentiamo veramente qualcosa di nuovo in Europa.
2502900	2506920	Cioè, siamo nati dopo la caduta del muro di Berlino.
2507040	2510900	Siamo nati non sulle grandi imitazioni delle grandi famiglie,
2511940	2514580	delle grandi famiglie del passato,
2514700	2516000	pur essendo grandissime,
2517120	2521820	pur dovendo ad esse la democrazia del nostro secolo,
2521920	2523620	però sono datate.
2524780	2526520	Invece la proposta dell'univero,
2526660	2528080	proprio di mettere insieme diverse tradizioni,
2528180	2530760	la proposta dei democratici va in questa stessa direzione.
2530760	2535120	E guardate che è l'Europa che ha bisogno di queste proposte innovative.
2535600	2539020	Sono i partiti tradizionali che in Europa si trovano stretti
2539020	2543800	in cui il Partito Popolare in questo momento va dall'estrema destra dei conservatori,
2544140	2546140	più estremi dei paesi scandinavi,
2546500	2547660	fino al gruppo di Atene,
2547680	2551420	che è sempre alleato con i socialisti in qualsiasi paese in cui opera.
2552040	2555660	Ecco, noi abbiamo offerto uno schema di polare
2555660	2559220	che si sta dimostrando come schema innovativo,
2559220	2560300	come schema forte,
2560740	2562520	e noi dobbiamo portarlo avanti,
2563660	2565220	al scapito di tutte le difficoltà,
2565380	2566480	di tutti i problemi,
2566500	2569080	anche di coloro che,
2569260	2572320	dopo la mia accettazione della grande carriera europea,
2572680	2576360	hanno giudito, non tanto perché l'Italia avesse assunto questo ruolo,
2576680	2579960	ma perché sembrava che potesse essere...
