start	end	text
23140	29900	Presidente, vi devo ringraziare di avermi invitato, perché sono veramente personalmente
29900	38280	contento di essere qua. La prima cosa che voglio dire è buon compleanno. Mi sembra
38280	48940	che 90 anni siano un periodo straordinario. Sono 90 anni che hanno segnato la storia
48940	58520	d'Italia, non dimentichiamo che 90 anni vuol dire 1912, vuol dire tutto il grande periodo
58520	67480	in cui al termine della nascita dell'industria e dell'economia italiana si sono create
67480	73760	le nuove forme di aggregazione, vuol dire il lungo passaggio della crisi del mondo cooperativo
73760	81520	durante il fascismo, vuol dire la rinaccia del dopoguerra, vuol dire milioni di soci,
81520	88580	vuol dire un miglioramento reale dell'economia del Paese, e vuol dire, permettetemi, visto
88580	101100	che faccio il mestiere di Presidente della Commissione Europea, anche un legame forte
101100	110320	con l'Europa, per cui mi fa piacere poter in fondo darvi il benvenuto a nome di 83 milioni
110320	127960	557.698 soci cooperativi europei. Mi sembra che questo numero basti a definire l'importanza,
128500	140300	la diffusione e la modernità del sistema cooperativo. Del resto non c'è nessun altro
140860	148360	la cooperativa che distingue il modello sociale europeo, uno dei elementi vivi del modello
148360	158980	sociale europeo, modello sociale che in questo momento cerca di distinguersi da quello che
158980	165540	è il modello di sviluppo di altre parti del mondo, cerca di basarsi sullo sviluppo economico
165540	172920	più equilibrato, sul dialogo sociale e sulla solidarietà. Cerca perché è chiaro che
172920	180200	questo è uno sforzo che non è mai finito, questo è uno sforzo che in questo momento
182120	189540	ha anche difficoltà di affermarsi, ma la grandezza dell'Europa è proprio questa,
189540	201020	di cercare di innovare nei campi in cui agisce, cercare di portare nel mondo una bandiera più
201020	209620	complessa, una bandiera che tenga conto diversi valori. Io penso che in questo momento siamo coloro
209620	218020	che tengono acceso il problema del sviluppo sostenibile, che tengono acceso l'accordo di
218660	223760	con tutti i suoi limiti, con tutte le sue mancanze, ma anche con la grandezza dell'obiettivo di
224460	229500	preoccuparsi, non soltanto di quello che avviene oggi, ma di quello che avviene nel futuro della
229500	238420	nostra bonità. L'Europa che si preoccupa anche, ed è abbastanza singolare, perché non era un
238420	246880	tempo il nostro mestiere, ma quello di portare avanti una globalizzazione che oso chiamare
246880	258400	democratica, in cui ad agio ad agio noi allarghiamo le nostre frontiere, noi abbiamo accordi e
258980	265380	parliamo con noi, allo stesso nostro livello, paesi che hanno un reddito infinitamente più basso
265380	276860	del nostro. E quest'anno proprio l'Europa va avanti con le più grandi sfide che ha preso in
276860	283140	quella che ha coinvolto ogni attività economica e quindi ha coinvolto profondamente anche voi,
283460	291700	che è quella dell'Euro e che ha portato una trasformazione straordinaria, ha portato un
291700	298520	cambiamento radicale in un settore in cui mai i cambiamenti di questi tipi erano stati fatti.
298520	307080	Ricordiamoci che in questo momento noi apparteniamo a un'area monetaria che già quando è nata
308420	317760	rappresentava due terzi della forza del dollaro. Abbiamo quindi uno strumento in mano per potere
317760	325380	unindomani. Quando a questa fiancheremo gli altri strumenti coordinati di decisione, potremmo avere
325380	332560	il modo di esercitare un ruolo di leadership, un serio ruolo di guida al mondo per raggiungere
332560	339260	quegli obiettivi di cui ho parlato prima. E anche l'anno questo, un anno straordinario
341780	349320	dell'allargamento, anche questo cambia la faccia all'Europa. Allargamento significa
352980	359800	assorbire economie, legarci perché nessuno assorbe nessuno nell'Europa, legarci con economie che
359800	365120	hanno un livello di reddito molto inferiore ma che hanno anche un potenziale di crescita superiore.
366440	373640	Vuol dire l'allargamento a dodici paesi quando sarà completata questa prima fase da dieci più due
373940	379820	Bulgarie e Romania che verranno dopo. Vuol dire aumentare del 30% la nostra popolazione europea
381660	391580	e aumentare soltanto il 7-8% del reddito. Quindi significa un enorme sforzo economico ma significa
391580	395580	anche una grande potenzialità come l'allargamento alla Spagna, alla Portugala, alla Grecia. Ha dato
395580	401840	dinamismo a loro e a noi. L'allargamento che stiamo realizzando oggi crea una nuova Europa.
402800	412780	Vuol dire, anche questa è la cosa più importante, chiudere definitivamente le tragedie che in fondo
412780	421880	sono nati quasi contemporaneamente alla cooperativa che noi festegliamo oggi, perché proprio
422400	428000	dall'inizio della Prima Guerra Mondiale è cominciata la frattura dell'Europa. Solo oggi con
428000	434360	l'allargamento noi la chiudiamo definitivamente e portiamo nell'allargamento dei valori che non
434360	444920	solo sono economici. Vi posso assicurare che c'è un livello emozionale fortissimo quando si va
444920	450900	nei paesi dell'allargamento, quando si partecipa alle complicate negoziazioni. Un livello emozionale
451580	457800	fortissimo nel vedere questi parlamenti che giorni e notti sono impegnati per tradurre
457800	466300	in nuove leggi gli accordi che fanno con noi, per tradurre in nuove dettate alla pubblica
466300	471600	amministrazione le disposizioni votate, per cambiare la struttura giudiziaria, per introdurre
471600	479460	le amministrazioni locali, ma soprattutto, e questo ci è caro, soprattutto per imporre
479460	486000	un'uguaglianza assoluta di diritti a tutti i cittadini europei. E quando parlo di un'uguaglianza
486000	491700	assoluta dei diritti, parlo anche dei diritti di minoranze che sono state calpestate per
491700	498300	secoli. E nei paesi dell'allargamento questo è un problema tra i più tragici, tra i più
498300	506080	gravi. In questo momento noi offriamo un modello serio di globalizzazione, io ho chiamato
506920	512600	di globalizzazione umana, di globalizzazione in cui tutti i cittadini abbiano uno stesso
512600	522460	ruolo. Infine, noi stiamo tentando, quest'anno abbiamo cominciato con la convenzione del
523440	531180	grande progetto di trasformazione delle istituzioni perché siano adatte a questa Europa 35 membri.
531180	542460	Ecco, allora che compiamo un cammino di enorme importanza e ho esordito prima elencando il
542460	549120	numero dei cooperatori in Europa non solo perché sono stati io stesso colpito da questo
549120	561160	numero ma per significarvi che quando si fanno imprese di questo tipo occorre avere un ideale
561180	569520	un modello degli obiettivi straordinariamente chiari, straordinariamente diversi da quelli
569520	575700	che sono gli ordinari strumenti di aggregazione del potere nella politica contemporanea e
575700	583980	non contemporanea. E il discorso dei cooperativi è straordinariamente importante perché è
583980	591160	del sottile confine difficilissimo, mai raggiunto in pieno di conciliare che l'economia
591180	598440	è lo spirito di solidarietà con lo spirito imprenditoriale. E la cooperativa lo fa,
598580	604820	è nato per questo motivo, è nato perché i lavoratori possono esprimersi insieme ma
604820	614080	è nato anche perché i lavoratori possono essere tra di loro in condizioni di non disuguaglianza.
614640	623220	E quindi quando noi rafforziamo le strutture europee non abbiamo alcun bisogno, come da
623220	631420	parecchie parti si sente, di affievolire il momento della solidarietà e quando noi ci
631420	638020	poniamo il nostro obiettivo per il futuro e vorrei citare quelle che sono state le decisioni
638020	645600	del Verdice di Lisbona, noi vogliamo trasformare l'Europa nell'economia della conoscenza più
645600	653900	competitiva e più dinamica del mondo, capace di crescita economica sostenibile, con migliore
653900	666920	occupazione e con una maggiore coesione sociale. Nel obiettivo base che ci siamo posti per
666920	673280	tutti i obiettivi, che stanno alla base dello stare insieme del movimento cooperativo.
674880	685480	Ecco, è sostenibile questo in termini realistici? Io credo che il movimento cooperativo lo dimostri
685480	694560	in quanto è l'unica forma di impresa in cui la ricchezza dipende fondamentalmente dal
694560	700860	capitale umano che lavora in questa impresa, dall'armonia e dalle capacità degli uomini
700860	708480	che lavorano in questa impresa e imprese come la vostra dimostrano che è possibile fare
708480	715440	utili, essere innovativi, essere competitivi e nello stesso tempo perseguire gli obiettivi
715440	722760	sociali che stanno alla base della ragione che ha portato alla nascita di questa impresa.
722760	733520	Quindi le imprese cooperative sono imprese, ma sono imprese speciali e rappresentano anche
733520	741560	una delle soluzioni fondamentali perché le piccole imprese possano competere in mercati
741560	747960	vasti pur conservando un'autonomia e una base locale. E allora un altro compito delle
747960	755000	imprese cooperative è proprio quello di mettere in rete le strutture, le imprese minori
755000	762140	di avvicinare al mercato. E abbiamo degli esempi straordinari nel settore agricolo,
762440	767020	anche nel settore dei lavori pubblici, nel settore delle virizie, ma prendo il settore
767020	775500	agricolo anche per compiere riflessioni che l'Italia deve fare riguardo a questo problema
776920	784420	perché la moderna agricoltura europea trova nelle reti delle cooperative il suo punto
784420	791300	di forza e la sua innovazione totale. Ed è chiaro che è uno dei campi in cui l'Italia
791840	801160	ha ancora dei grandi salti in avanti da compere, in cui la competitività di altri paesi nel
801160	806240	settore delle cooperative, cominciando dall'Olanda, passando per la Francia, finendo nel nuovo
806240	813320	dinamismo spagnolo, debbano essere per noi un punto di riferimento per una revisione
813320	824160	totale di questo settore. Ho citato l'agricoltura, ho citato la Spagna, perché è chiaro che
824160	830480	le cooperative spagnole hanno giocato un ruolo straordinario, rompere l'isolamento di regioni
830480	837480	che erano lontani dal mercato, avvicinare il sistema, avvicinare i mercati di sbocco,
839200	844240	rendere tra le più dinamiche imprese di tutta l'agricoltura europea. Questa è un'altra
844240	850680	funzione che il sistema delle cooperative, solo il sistema delle cooperative, può raggiungere.
853200	860460	Ecco, ultima riflessione riguarda le regole, l'istituzione delle cooperative, le regole
861160	867160	che adesso non possono più essere soltanto nazionali o isolati.
869860	875900	Allora, noi stiamo lavorando in questa direzione. Il Librovede della Commissione sulla Responsabilità
875900	885720	Sociale delle Imprese riconosce in modo specifico che le cooperative integrano in modo strutturale
885720	892360	le altre parti del sistema economico. È una funzione estremamente specifica, estremamente
892360	899100	particolare, cioè, come dicevo prima, quella di essere rete di congiungimento, quella di
899100	906220	rendere forti anche i deboli perché portano i piccoli ad essere integrati nel sistema
906220	914560	più ampio. E naturalmente queste cooperative hanno bisogno di un quadro normativo adeguato
914560	921420	alle loro caratteristiche specifiche. Fare un quadro normativo adeguato non significa
921420	928240	assolutamente, come alcuni sottentendono, creare privilegi non dovuti. Un quadro normativo
928240	935580	adeguato significa capire la funzione sociale ed economica specifica del movimento cooperativo.
936480	943900	Ed è in questo campo che la Commissione sta operando a cominciare dallo statuto delle
944560	951940	cooperative europee. Le cooperative, infatti, hanno già una base giuridica su cui operare,
952380	959160	ma dobbiamo vigilare perché il legislatore tenga conto anche dei compiti specifici delle
959160	967720	cooperative stesse. Come voi sapete dopo un lungo, lunghissimo negoziato con vari andamenti,
967800	974480	nell'ottobre del 2001 è stata dotato lo statuto della società cooperativa europea che consiste
974480	979440	in un regolamento che è già direttamente applicabile e di una direttiva che deve essere
979440	989060	ricevuta a livello nazionale. L'obiettivo di questo regolamento che è direttamente
989060	995480	applicabile è quello di fornire alle cooperative gli strumenti giuridici atti a facilitare le
995480	1003540	loro attività transfrontaliere e transnazionali, cioè metterle in rete. La cooperativa potrà
1003540	1009060	finalmente trovarsi in situazione di parità con la società europea, società di capitale
1009060	1017880	in cui il statuto è poco adatto a soddisfare le esigenze delle cooperative. La direttiva
1017880	1026340	sulle società cooperative che è da adottare, che da ricepire a livello nazionale stabilisce
1026340	1031460	una serie di norme adattate alla peculiarità della cooperativa riguardanti di informazione,
1031460	1039120	la consultazione e la partecipazione dei lavoratori dipendenti, cioè fatte in modo
1039120	1046680	perché la cooperativa conservi e possa massimizzare il suo compito che svolge a servizio della
1046680	1056280	società. La cooperativa è quindi un elemento essenziale del sistema di riferimento europeo,
1056280	1067460	non è una peculiarità caratteristica o anomala italiana per ottenere privilegi, ma è un
1067460	1074380	strumento straordinario di promozione imprenditoriale e di solidarietà sociale.
1086280	1087820	Chiedo che la ripeta a tutti.
1090200	1092420	Romano, volevo utilizzarlo...
1092420	1102700	No, no, era solo che a Bologna oggi c'è il Presidente de l'Or, quindi io sono costretto
1102700	1109700	a lasciarvi, quindi volevo darvi un ultimo saluto. Anche con la riflessione, proprio
1109700	1118320	su quello che diceva Prima Guidi, in fondo il suo discorso intendeva una sfiducia nei
1118320	1125260	giovani di avere la capacità di organizzarsi in un mondo cooperativo, sotto molti aspetti
1125260	1139680	e anche possibili, anche vera, ma lo legava a un fatto di ritenere questo come una conseguenza
1139680	1145740	vera e opposta, in cui se non c'è un tipo di legame, un tipo di rapporti, non ho citato
1145740	1151440	a caso prima le cooperative di vendita per il settore agricolo, perché sono l'unico
1151440	1158360	elemento efficiente in una rete mondiale per poter sopravvivere. Poi, da resto, è chiaro
1158360	1169660	che nessuno nega che le imprese deali private, quelle cooperative devono usare gli stessi
1169660	1176700	per essere bravi in tutto, altrimenti è chiaro che non abbiamo un dualismo, ma, e dicevo questo
1176700	1183460	a Guidi, qual è la differenza? La differenza tra una stalla cooperativa e una stalla diciamo
1183460	1189820	così privata, capitalistica, non è nel come vivono le mucche, ma nel come vivono i contadini,
1190220	1191820	questa è la fondamentale differenza.
1199660	1200020	Sottotitoli creati dalla comunità Amara.org
