start	end	text
0	9900	di un colloquio con le giovani generazioni, proprio perché alla fine l'Europa, come vedremo
9900	16180	in queste poche riflessioni che faremo oggi, costituisce una drammatica rottura con la
16180	25320	politica tradizionale, costituisce un tentativo mai fatto nella storia di un cittadino che
26150	32150	lavora, vive, opera con fedeltà multiple, con la fedeltà al suo paese, con la fedeltà alla
32150	37270	sua città e con la fedeltà a questa struttura europea che nasce ad agio ad agio, che c'era
37270	49970	un gruppo assieme e questa Europa non nasce assolutamente e non cresce solo come fatto
50570	58830	ma è eminentemente una realtà politica, l'Europa è nata mettendo insieme il carbone,
58850	65990	l'acciaio, elementi economici, ma è nata con obiettivo solo la pace, quando De Gaspe,
66110	70810	Adenauer e Schumann si sono messi assieme e Giammonè ha elaborato il pensiero dell'Europa,
71690	78910	l'ossessione, la santa ossessione era la pace, non era uno sviluppo del reddito del 2% in più
78910	86150	dell'anno, non erano dei ragionieri contabili dell'economia europea, erano dei visionari,
87290	93150	era gente che è anzianissima perché aveva fatto il gran salto oltre il fascismo e il nazismo,
93530	99430	ma era gente che parlava ai giovani con un linguaggio immediato, dava il segno e il sogno
100850	104530	che si poteva fare qualcosa di estremamente diverso da quello che l'Europa aveva fatto per
104530	115330	un secolo e mezzo di sangue. Ecco, questo era il messaggio dell'Europa e direi che in questo
115330	125730	periodo, dopo una prevalenza degli aspetti economici, noi stiamo veramente tentando di
125850	136090	far fare un salto in avanti alla politica. In quest'anno 2002 ci sono tre decisioni fondamentali,
136970	142090	una che era già costruita nel passato e che è stata interpretata come decisione economica,
142110	149190	cioè l'euro, la seconda l'allargamento e la terza la convenzione, che cambiano. Non c'è
149190	155430	nessuna istituzione al mondo che sta cambiando in questo modo così totale, generale, come stiamo
155430	162650	cercando di fare. Uso termini modesti cercando, perché so benissimo che non abbiamo ancora
162650	169110	raggiunto questi grandi obiettivi, però possiamo proporre alle giovani generazioni degli obiettivi
169110	175330	seri, degli obiettivi forti, degli obiettivi positivi, degli obiettivi che mettono in pratica
175330	182630	tante delle aspirazioni che vengono espresse anche nelle manifestazioni di oggi in modo
182910	194750	in certi casi esasperato, ma che sono le aspirazioni di una globalizzazione democratica. Che cos'è
194750	200830	l'allargamento se non un tentativo su base continentale, non su base universale, con
200830	207230	l'imperfezione che ha questo fatto, ma di una globalizzazione democratica. Con l'allargamento.
208470	215670	Noi aggiungiamo a dicembre ormai, abbiamo lavorato tanti anni perché questo fosse pronto, c'è una
215670	221350	comune volontà politica, c'è un pensiero ormai condiviso, aggiungiamo 10 paesi all'Europa,
223070	232190	77 milioni di nuovi cittadini alla nostra Europa e guardate che questi si costituiscono un aumento
232190	240270	della popolazione dell'Unione Europea del 20% e costituiscono un aumento del reddito di solo il 5%.
243010	250870	E allora quando si fanno queste cose c'è sempre dentro un forte contenuto idealistico, un forte
250870	260170	contenuto di senso della pace, perché altrimenti non si fa questa sfida che poi dal punto di vista
260170	266750	economico porterà conseguenze estremamente positive, ma in un futuro. Intanto esige di seminare,
267450	273910	esige di cambiare tutta la nostra testa, tutte le nostre istituzioni, ma la pedagogia, vedete che è
273910	278410	stata usata dall'allargamento, quando parliamo di pedagogia politica non ti evito solo la pedagogia
279290	285010	che viene fatta a coloro che non sono attori della politica, ma la prima pedagogia viene fatta agli
285210	292330	attori della politica e nei tre anni in cui abbiamo lavorato sull'allargamento i gruppi di lavoro
292330	299610	comuni fra noi e i paesi che entrano sono stati di importanza straordinaria, cioè il problema
299610	307670	dell'educazione alla democrazia, la costruzione dell'autonomia locale, l'affermazione di tutti
307670	314770	i diritti umani pensate al diritto delle minoranze, vengono dentro l'Europa dei paesi in cui le
314770	320790	minoranze sono state sempre schiacciate, sempre, venute di fare delle analisi storiche, sempre,
321770	328110	andare a spiegare ai paesi baltici, alla Lettonia, a Lituania, all'Estonia, che le minoranze russe che
328110	335130	sono state minoranze persecutrici della maggioranza, fino a ieri hanno gli stessi diritti, hanno il
335130	339610	diritto della lingua, hanno il diritto di ricoprire le stesse cariche nelle amministrazioni pubbliche,
340590	348770	hanno un diritto di cittadinanza identico. Questa è una grande pedagogia di democrazia. Ed è questo
348770	354650	lo sforzo, l'importanza etica dello sforzo che si sta facendo con tutte le impervenzioni, con tutti
354650	366230	i difetti. Allora, questa costruzione europea non è neutra di fronte al contenuto di educazione
366230	373670	della condivisione di obiettivi di uguaglianza, degli obiettivi di diritto umano, uguaglianza fra
373670	379910	uomini e donne, protezione dei più deboli, dei bambini, tutta questa grande registrazione che ha
379910	392470	la base di una politica più avanzata. La stessa istituzione dell'euro che è stata da tutti commentata
392470	401170	come un fatto puramente economico e in vano, per mesi ripetevo, guardate che mettere insieme
401170	409730	la moneta è un fatto di un'importanza politica enorme. Adesso si capisce dalle conseguenze che
409730	416770	porta che quando mettete insieme la moneta dovete poi conseguentemente adattare le istituzioni,
416770	423250	coordinare la politica economica, mettere degli strumenti di autorità comuni condivisa,
423490	432810	perché sennò si sfascia tutto. Ecco allora quando la politica obbliga, come avete messo voi nel
432810	441390	titolo del covenio, obbliga a una drammatica fatica di pensare, fatica a cui tutti cerchiamo
441390	449730	di ritrarci. Noi politici, loro giornalisti, nessuno di noi vuol fare fatica per trarne
449730	457710	le conseguenze di queste azioni, di queste operazioni politiche, proprio perché è faticoso e proprio
457710	468750	perché noi procediamo di solito su binari prefissati, ma io credo che questo diventi un
468850	479390	fatto di un'importanza enorme. E ritornando all'allargamento, l'altro problema è di capire
479390	488270	come questa sia un'operazione completamente diversa da quella che nella storia hanno fatto
488270	500290	gli Stati Uniti quando si sono allargati verso ovest, grande poppaia americana, young man go west,
502010	509430	questi hanno trovato le montagne rocciose o degli indiani che hanno distrutto, ma non hanno trovato
510430	517010	strutture civili e politiche con cui mettersi alla pari, hanno trovato le montagne rocciose,
517010	525650	non hanno trovato praga, buddha fest, civiltà che sono di livello identico al nostro livello.
527150	532130	E quando parliamo di allargamento, e io vi dico, e qui voi sentite di gran parte insegnanti,
533710	540530	ci viene anche una sfida l'allargamento, perché l'allargamento vuol dire 5% di aumento del reddito,
540530	550670	ma vuol dire 25% di aumento di scienziati e di tecnici, cioè sono paesi che hanno una tradizione
550670	555830	di cultura tecnica e scientifica più elevata della nostra, con tutti i problemi,
556010	561610	tutte le deviazioni, ma che però hanno tradizioni scolastiche molto forti.
563550	573270	Allora, un problema che dobbiamo forci quando pensiamo al futuro, dobbiamo forci in primo luogo
573270	580290	il problema del ruolo che ha la scuola in una città moderna, democratica, del ruolo che
580290	591650	deve avere la scuola nell'Europa futura, un ruolo che è infinitamente più grande di quello che
591650	602850	nel mondo, un ruolo di guida su alcuni problemi fondamentali su cui farò brevissime riflessioni
602850	610970	fra poco e poi chiudo, ricordatevi che questo ruolo noi non lo possiamo mai giocare se non
610970	616130	diventiamo un punto di riferimento e un punto di attrazione per i cervelli di tutto il mondo.
618710	628810	Finché ragazzi brillanti cinesi vanno esclusivamente negli Stati Uniti, cinesi o indiani o tutti i
628810	636490	paesi che volete, è lì dove si forma la novità, dove si forma la nuova tradizione,
636650	645270	è nel crogiolo, è nell'incrocio delle culture dove avviene il nuovo e se noi non siamo capaci
646030	650930	di attravere queste nuove culture, noi questo ruolo non lo possiamo svolgere nel futuro.
652070	659770	Ecco quindi la prima sfida che noi abbiamo nel discorso di una costruzione europea che
659770	666150	serva da modello è sfida intellettuale, è sfida sulla formazione dei giovani, è sfida sulla
666150	672610	capacità di attravere i cervelli migliori. Vi do un esempio che per me è stata una mia
672610	685410	esperienza impressionante. Quando ho cominciato un po' a attività accademica aperta parecchio
686210	694830	a colloqui, esperienze all'esterno, ho sempre trovato una classe dirigente dell'America Latina,
694850	701630	e parlo di 20-25 anni fa, non parlo dello secolo fa, una classe dirigente dell'America Latina era
701630	710270	tutta educata in Europa, immediatamente si trovavano gli intrecci e le referenze diversitarie. La
710270	715570	classe dirigente con cui ho a che fare oggi, il Brasilio e l'Agentino e sovrano tutti i paesi,
715930	725110	è tutta educata negli Stati Uniti. E' chiaro che se noi perdiamo la capacità di essere punto di
726760	734400	modello nel sistema educativo, non abbiamo più nulla da dire alla società moderna e nemmeno le
734400	739060	nostre idee più profonde, nemmeno questa grande ricchezza di articolazione che si trova nella
739060	755380	società europea, può trovare la sua espressione se non c'è il veicolo che la porta avanti. Ecco
755380	768260	questo è un po' quello su cui quando viaggio cerco di riflettere, perché effettivamente
769460	781240	qualcosa di nuovo c'è, sta succedendo. L'Europa sta dimostrando in tante cose una seria diversità
781240	788400	e una capacità di interpretare le complicità dell'oggi e del domani in modo assolutamente
788400	803440	innovatore. Vi faccio alcuni esempi. Primo il modello politico-sociale, un modello molto più
803440	808800	articolato, molto più complesso, ad esempio, di quello americano, che soprattutto lo sta
808800	820900	diventando ancora di più adesso, dopo che quello che chiamo il pensiero unico degli anni 90 in cui
820900	831680	tutto poteva riassumersi nell'impresa, nel mercato, in modo critico, in modo completo, in cui tutte
833320	841820	pensavano che questo fosse un collante assoluto, che non voglio in questo momento, sono economista
842820	847860	e sostenitore profondo dell'economia di mercato, quindi non ne voglio sottovalutare la grande
847860	856780	importanza, ma quando l'economia di mercato ha dimostrato di avere sbandamenti dal caso
856780	862520	erron, ai problemi delle remunerazioni dei dirigenti, tutte le grandi deviazioni che sono
862520	868900	venute a galla negli ultimi tempi, si è trovato che il nostro sistema non aveva i correttivi
869660	876800	necessari per porre rimedio a queste deviazioni, che ci mancava il pensiero, che avendo fatto 15
876800	886760	anni di pensiero unico non eravamo più pronti a riflettere su queste cose, allora per quello che
886760	895620	non essere fatte, non toccino mai la violenza, ma esasperazione del pensiero, perché c'è bisogno
895620	904940	in questo momento di riprendere un discorso critico e questo discorso in Europa lo cerchiamo di fare,
906480	914800	in che direzione? Prima di tutto l'abbiamo fatto portando avanti con insistenza, contro ogni speranza,
914800	919580	il discorso sul futuro dell'umanità, cioè il problema del sviluppo sostenibile che non è solo
919580	927320	ecologia, non è solo l'aridità carbonica, che sono pure di un'importanza enorme, perché ormai è chiaro
928460	935220	che quando si sveglierà completamente la Cina, l'India, il problema della sostenibilità del
935220	940640	nostro pianeta è un problema enorme e noi ce lo siamo posti in modo imperfetto, in modo difficile,
940640	947480	il protocollo di Chioto è pieno di problemi e di punti interrogativi per bacco, però è un'indicazione
948460	955280	pedagogica, forte, della nostra preoccupazione che non può limitarse oggi, ma deve andare al domani,
955540	966340	questa è una prima. L'altro discorso è la sostenibilità politica, nel verso di Johannesburg,
966340	972440	non c'è stato capo di stato africano con cui mi sono incontrato, che non abbia messo il dito dell'accusa
972440	982100	contro di noi, intendendo noi, non solo gli americani, ma noi, me, dicendo ma vi rendete conto di questa
982100	989460	spaccatura impressionante del mondo? Dove volete andare a finire? Su questo l'Europa sta lavorando,
989560	995220	ha lavorato molto, abbiamo fatto delle decisioni che si chiamano everything but arms, cioè di importare
995220	1000820	dai paesi più poveri, aprire le frontiere in modo unilaterale, naturalmente l'abbiamo fatto solo
1002620	1010920	dai paesi, dai 49 paesi più poveri, per non rompere tutte le strutture economiche, perché non aver
1010920	1016400	contro la nostra società su queste riformi passi in avanti, ma intanto abbiamo mandato un messaggio
1016400	1024600	che ci rendiamo conto del nostro futuro, ecco questo è secondo me un grande fatto pedagogico,
1024600	1036420	da far capire che non viviamo alla giornata, ma che viviamo proiettati nel futuro e anche
1036420	1041440	nelle istituzioni. Volete che io non mi renda conto della imperfezione della Corte Penale
1042380	1054580	Internazionale? Delle difficoltà, dei problemi procedurali, degli errori che può fare, ma mi
1056040	1064120	risolti sempre più in modo ragionevole, sempre più in modo condiviso, sempre più in modo coordinato,
1064500	1067940	e questo è un messaggio d'Europa, è un messaggio che gli Stati Uniti non hanno accettato, che hanno
1067940	1076280	riflettato violentemente e che credo sarà inerrestabile nel futuro. Ecco, il discorso di
1076280	1084100	un ricorso all'ONU come fonte di riferimento continuo dei problemi delle tensioni internazionali è un
1084100	1090560	bandiera che stiamo portando avanti, anche questo non condiviso da tutte le istituzioni, nemmeno da
1090560	1100100	tutti i paesi europei, è qualcosa che si sta facendo breccia nel nostro, e poi c'è il modello
1102020	1109080	che chiamiamo di welfare, un modello di società su cui abbiamo avuto incertezza, badoni, problemi e
1109080	1114080	anche per strutture di conservazione della nostra società non siamo stati sempre capaci di innovare
1114080	1119620	e di renderlo compatibile ad esempio con le nuove strutture demografico, con le nuove età, però guardate
1119620	1126560	questi sono beni preziosi, sono beni che ci dobbiamo portare dietro e che dobbiamo migliorare
1127080	1134380	perché possa andare la prossima generazione. Ecco, queste sono le sfide che noi abbiamo di fronte,
1134540	1141460	questa è una pedagogia rivolta al futuro che noi dobbiamo portare avanti, questo senso incevolo
1141460	1149800	l'Europa è il posto dove si può passare dal pensiero unico a un pensiero più articolato,
1149920	1158180	a un pensiero più approfondito e più discurso. E' ovviamente chiaro che questo significa anche
1158180	1164300	messaggi politici molto seri, quindi non solo all'allargamento ma avere con i paesi che ci stanno
1164300	1170700	vicino dei rapporti sempre più stretti, dalla Russia fino al Marocco, l'anello dei paesi amici,
1170930	1181010	con cui operare e lavorare assieme per un futuro di pace. È chiaro che questo può costare anche
1181010	1188930	risorse economiche, ma io mi sono posto il problema, ma è meglio spendere i soldi che
1188930	1195290	sono anche meno per l'allargamento, per creare un futuro di ricchezza comune, di giustizio e divisione,
1195290	1203430	o è meglio spendere i soldi per mettere a posto il Kosovo o altre aree devastate della guerra.
1204310	1208610	Io credo che la pedagogia sia un fatto preventivo, non sia un fatto successivo,
1208750	1216310	le cose. Ecco allora il grande discorso complesso che noi stiamo cercando di portare avanti e
1217430	1225270	naturalmente e con questo termine gli strumenti sono vari ma sono ancora limitati, sono ancora
1225830	1232590	un corpo in divenire. Poi ci sono strumenti che devono essere efficacissimi, anche gli strumenti
1232590	1237270	più strani, gli strumenti più vari. Pensate a quanto sia stato importante il progetto Erasmus
1237870	1244950	per mettere assieme i ragazzi, per far capire diverse sensibilità, per far capire l'importanza di
1245730	1253670	mettere a confronto modelli di vita, pensieri e da questo andiamo a tutta la serie anche di
1253670	1260550	strumenti politici ma naturalmente questi grandi compiti hanno anche messo in luce le
1260550	1267770	mancanze che abbiamo. E allora il terzo sfida è la convenzione, riunire un'assemblea per fare,
1267810	1273110	per fondare la nuova Europa, un'Europa vasta, un'Europa che arriva a mezzo miliardo di abitanti,
1273950	1280370	quindi che si misura, mi rispondeva ma è indispensabile per il nostro futuro? Io ripeto
1280370	1289490	sempre quando parlo ai ragazzi, è una riflessione che serve a tutti, ho incontrato un mese fa il
1289490	1294570	ministro dell'industria cinese che tranquillamente mi diceva, noi in Cina abbiamo capacità produttiva
1296150	1301890	sufficiente per tutto il mondo e poi dobbiamo assumere ancora 300 milioni di operaio. Ecco,
1302050	1306450	di fronte a queste sfide qui si capisce che il discorso della cobbiazione è una cosa seria,
1307430	1312750	che non la dobbiamo rifiutare, che è importante. Il problema è quella che io chiamo la globalizzazione
1313350	1318270	democratica, è arrivarsi per il consenso, tenendo presente la necessità della protezione
1318270	1336030	delle classi più debole, tenendo presente il tipo di commercio che dobbiamo presentare le sfide
1336030	1343190	della storia. Per se non le rifiutiamo non capiamo più niente. Certo però, se il concetto
1343190	1351250	di globalizzazione si sintetizza nello scontro come è stato fatto per errori politici, per le
1351250	1359090	mancanze, allora è chiaro che la nostra proposta politica che è operativa, che serve, che è concreta,
1359250	1367370	dimostra una enorme debolezza, perché non è capace, è chiaro, se non è fatta molto sul
1367370	1372910	serio di affrontare questi problemi del mondo che abbiamo noi di fronte. Ecco allora le riflessioni
1372910	1382010	che io vi facevo per la conclusione di questo vostro bellissimo convegno, conclusioni molto
1382010	1389510	personali che derivano dal mio mestiere, ma mi sembrava che piuttosto che entrare nelle vostre
1389510	1396390	riflessioni su cui sarei stato sempre periferico, mi sembrava più opportuno comunicarvi quelle che
1396750	1402250	sono le novità, quelle che sono anche le difficoltà del cambiamento, perché allora mi
1402250	1411190	sembra che tutti insieme si possa anche fare un cammino decisivo. Come dicevo all'inizio, guardate
1411190	1421450	che stiamo stiamo cambiando il modo di fare politica, non è mai stato fatto l'allargamento
1421450	1426530	democratico, è sempre stato fatto con il militare, con l'esercito, non è mai stato nella storia che si
1426530	1433870	potessero insieme le monete con un accordo, facendo dei patti, le monete sono sempre state
1433870	1443450	imposte dall'imperatore, dai sovrani, ecco allora se questo non è cambiamento io non so che cosa sia il
1443450	1449210	cambiamento. Poi mentre le cose si fanno non sono capite, ci sono sempre ovviamente interessi che
1449210	1454430	vengono calpestati, ci sono difficoltà, ci sono i contadini polacchi che vorrebbero averli più e
1454430	1460670	hanno anche ragione, ma siccome i soldi sono quelli che sono, poi ci sono mille scontentezze,
1462030	1470950	però c'è una grandezza di disegno e io credo che di disegni grandi ne abbiamo proprio bisogno,
1471070	1477550	abbiamo più bisogno di disegni grandi che di tante altre cose che ti sembrano più importanti,
1477750	1484410	perché senza questo veramente la società si la ridisce e non farà mai più la fatica di pensare,
1484410	1485410	grazie.
1529830	1536910	Bene mi sembra che questo applauso sia il segno di un gratitudine e di un apprezzamento alle parole
1536910	1542450	del professor Romano Prodi, che vi voglio chiamare professore non presidente perché non dimentichiamo
1542450	1549950	che è un professore di questa università, dell'università di Bologna e quindi è venuto a farci una lezione
1549950	1557370	da docente quale è e del quale ha senz'altro la tempra e lo spessore. Per le conclusioni di questo
1559190	1568110	convegno credo pieno di stimoli e di aperture, quindi chiamare conclusioni quelle che Piero Bertolini
1568110	1573510	sta per fare credo sia limitativo rispetto alle tese che possiamo avere, comunque cedo la parola al
1573510	1579470	professor Piero Bertolini che ricordo ha voluto fortissimamente questo convegno e questa iniziativa
1579990	1587370	anche contro certe perplessità dei suoi colleghi e dei suoi allievi, quello che sta avvenendo e che
1587370	1592570	è avvenuto da come al solito ragione a lui e quindi dandogli la parola voglio dargli atto anche di
1592570	1593550	questa lungimiranza.
1603250	1612550	In effetti io devo subito precisare che contrariamente a quello che è stato scritto nel Depliant queste
1612550	1619970	non sono conclusioni, non lo possono essere per due motivi soprattutto, il primo perché
