start	end	text
2420240	2430800	è uno dei problemi più importanti che dobbiamo affrontare, questo della pubblica utilità nel territorio.
2433580	2445060	Io sono preso con un metodo completamente diverso al Governo precedente che ricordiamo spingeva in teoria le grandi opere pubbliche
2445060	2455140	e non ne poteva realizzare perché vi era assolutamente la proibizione del vetro del territorio.
2456520	2465300	Il mio approccio è quello di estenuanti ma fruttuosi conferenze e incontri col territorio.
2466260	2476180	I risultati si cominciano a vedere, si vedono, l'accordo del Mose su Venezia era impossibile,
2477120	2487220	io sono fiducioso che anche su grandi sistemi di rete transeuropee noi troviamo un accordo.
2488180	2495000	È chiaro che sono faticosi anche gli accordi riguardo alla centrale di classificazione
2496260	2503700	ma con questa continua cooperazione i problemi vengono concretamente risolti.
2505380	2515800	Ci sono alcuni su cui la soluzione è più complicata di altri, vi cito solo quello dei rifiuti in Campania,
2517220	2526820	i problemi che sono l'eredità di una lunga storia di illegalità, di soprusi,
2530320	2541560	questi costano molto al Governo, saranno faticosissimi ma non ho nessuna intenzione di cedere nemmeno su questi.
2542520	2552040	Dicevo prima, nei prossimi giorni avremo una lista di tutte le infrastrutture autostradali
2553420	2559800	su cui l'accordo con gli enti locali è stato preso,
2562240	2570740	è una lista che completerà il nostro carnet per un lungo programma in futuro,
2571460	2580440	a riguardo alla quale però non abbiamo solo cercato l'accordo con gli enti locali con le Regioni soprattutto,
2580900	2587960	ma abbiamo anche cercato le risorse finanziarie, un lungo programma in futuro,
2587960	2597520	a riguardo alla quale però non abbiamo solo cercato l'accordo con gli enti locali con le Regioni soprattutto,
2597980	2606000	ma abbiamo anche cercato le risorse finanziarie, perché sennò non si riescano a fare le infrastrutture.
2606840	2612320	Quindi una politica di concertazione come la chiamiamo,
2612320	2615140	qualcuno non può pensare anche che sia una politica di vecchio stile,
2615280	2623200	ma è l'unico modo per poter fare le opere pubbliche in Italia, assolutamente l'unico modo, altri non ce n'è.
2624640	2631580	Estennuante fatiche di riunioni potranno anche essere oggetto di ironia, ma questo è il nostro Paese
2631580	2636020	e con questo si procede e si possono fare le cose.
2636020	2645920	E, ripeto, progetti difficili come il Mose, progressi in tutte le reti transevropee,
2646420	2657160	rinnovamento del sistema autostradale, è un programma che in modo realistico, passo per passo, sta andando avanti
2657160	2671000	e io penso che in questo quinquennio noi potremmo fare il grande passo di avvicinamento verso gli altri Paesi europei.
2671120	2687040	Ci sono alcuni settori in cui la opinione pubblica dominante è ancora contraria,
2687880	2696340	parlo del settore nucleare, soprattutto dell'energia nucleare, in Italia, in Germania, in alcuni altri Paesi europei,
2697120	2706680	si ha una politica completamente diversa rispetto a quella francese o rispetto a quella di altri Paesi non europei,
2706680	2716560	in questo settore penso, non penso, che vi siano novità in futuro negli altri settori che ho indicato prima,
2717240	2732000	io credo che ci sarà un progresso continuo e già abbiamo fatto questi cambiamenti, anche se col metodo faticoso e poco sexy potrete dire
2732000	2740000	di queste lunghe infinite riunioni, ma è l'unico modo per che si possa andare avanti.
2764420	2767940	Sembra che tutti si siano d'accordo con tutto che ha detto il Prime Minister.
2798100	2807280	Quello che ho detto nel mio articolo di Coria della Sera poche settimane fa, che ho ripetuto anche ieri,
2808800	2821200	un terzo di questo va allo sviluppo, prevalentemente infrastrutture, ma questo si deve aggiungere alle risorse già destinate a questo
2821200	2835440	e si deve aggiungere anche al Project Finance e ai finanziamenti che non derivano strettamente dal bilancio pubblico
2836080	2850000	ed è per questo che ho detto prima che abbiamo preparato un finanziamento molto consistente nel settore delle infrastrutture
2850140	2866580	delle opere pubbliche. Alle infrastrutture statiche ho dovuto aggiungere il progetto di mille treni, che se volete non può definirsi investimenti
2866580	2880540	tra strutture in senso stretto, perché è materiale erotabile, ma data la situazione dei pendolari in Italia, abbiamo dovuto rimettere questo
2880540	2890260	nei programmi di priorità del Governo, perché il modo con cui viaggiano i pendolari è semplicemente indegno di un paese civile
2890260	2899540	e quindi è stato un po' uno spostamento di risorse verso questo settore
2904380	2907180	Fioritino Pedrolli di Ponte Italia
2908040	2918320	Signor Presidente, mi rilaccio a due punti delle sue note. La prima è relativa alla bolletta petrolifera che ha penalizzato per tanti anni l'economia italiana
2918320	2930400	La seconda è la necessità di attrarre dei capitali stranieri in Italia. Ne aggiungo una terza, che mi sembra di aver percepito, nel non nucleare per il futuro dell'Italia
2932040	2946720	Ci sono programmi governativi che tendono a favorire la tecnologia dei biofuel e l'utilizzo di energia pulita come quella solare?
2961360	2979260	Noi intendiamo adeguarci completamente al progetto europeo esposto al Consiglio Europeo di Marzo, cioè arrivare rapidamente al 20% di energie rinnovabili
2979260	2997060	Progetto ambiziosissimo, però indispensabile per il futuro del paese, anche tenuto conto, che non prevedo la ripresa produttiva del nucleare nel breve tempo
2997060	3010180	Anche se si riprenderà la ricerca in questo settore, perché è estremamente importante non cadere nel know-how riguardo a questi campi
3010180	3018040	E ora è chiaro che l'accettazione su energie rinnovabili deve essere fortissima
3018920	3039420	Con accettazione particolare nel mettere in pratica le nuove energie derivate dal solare, che nell'ultimo anno stanno rivoluzionando tutto il settore
3039420	3057360	In cui l'Italia è particolarmente debole, ma questo comprende anche altri campi, non solo il vento, ma anche tutto il campo dei carburanti derivati dall'aricoltura
3057360	3074220	Con cui con l'ENI si è costruito un accordo con il Brasile per operare anche nei paesi africani che hanno disponibilità di terreno, cioè un lavoro sistemico in questa direzione
3074860	3086380	Quello che mi preoccupa riguardo a questo è la mancanza di imprese italiane in questo settore
3087520	3093660	Cioè è un settore che nel passato è stato assolutamente trascurato
3094300	3102140	Per cui noi abbiamo ormai applicato una politica di incentivi che è simile a quella degli altri paesi
3102800	3108940	Non è simile a quella degli altri paesi l'attrezzatura industriale in questo settore
3108940	3118660	Se prendete la Germania, la Germania esporta già un miliardo e mezzo di euro nel settore di tecnologie alternative e così via
3118660	3136220	Ed è una cifra già impressionante, la Spagna ha fatto progressi enormi in tutto, diciamo così, il settore olico, i settori connessi
3136220	3146040	Nante i paesi hanno preso specializzazioni e in Italia debbo notare la mancanza di imprese che agiscono in questo settore
3146040	3156600	E noi stiamo specificamente operando per vedere che gli incentivi disponibili possano esser messi subito in atto
3157220	3171640	Trovando imprenditori o italiani o stranieri che investano in Italia in questo nuovissimo campo che avrà un'espansione molto forte in futuro
3171640	3183540	Lo ripeto, finora, ma è un discorso che si è aperto a metà marzo, quindi siamo ancora all'inizio, finora non abbiamo ancora grandi risultati in materia
3183540	3188440	Anche se gli incentivi sono simili a quelli degli altri paesi europei
3193300	3195240	Riccardo Monti di Value Partner
3200260	3208820	Presidente, lei ha appena accennato la importanza per l'Italia di attrarre investimenti stranieri in alcuni settori in cui la nostra industria non solo è presente
3216220	3229460	Lei ha ribadito adesso l'importanza per l'Italia di attrarre investimenti stranieri in alcuni settori industriali in cui l'Italia non è presente o ha una scarsa capacità di sviluppo
3229460	3244480	D'altra parte era stata lei stessa nel suo precedente governo a istituire un'agenzia, Sviluppo Italia, che avesse il compito di promuovere l'Italia e fare politica attiva di attrazione degli investimenti esteri
3245360	3266380	Le polemiche che si sono scatenate negli ultimi due mesi sull'ingresso di alcuni investitori esteri nel settore delle telecomunicazioni ha creato un dibattito sul fatto che l'Italia sia un paese affidabile per gli investitori stranieri
3266380	3278660	In qualche modo quindi non ha migliorato la nostra capacità di attrazione o ha aperto un punto interrogativo
3278660	3294800	Su questo tema dell'attrazione degli investimenti esteri, a cui so che lei è favorevole naturalmente, però sulla nostra capacità di fare politica attiva di attrazione e rendere il paese veramente appetibile, che cosa sta pensando di fare il suo governo?
3309180	3318320	Il discorso dell'Italia chiusa ai capitali stranieri eccetera è stato un discorso indecente, perché non era fondato sui fatti come si è visto
3322720	3344920	Vorrei che gli altri paesi europei fossero ugualmente aperti, vorrei che la polemica che è successa per telecom, che poi è entrato un investitore straniero sempre che nessuno chiesse niente, vorrei averla tradotta in altri paesi, per telecom Germania o per investimenti a dallo negli Stati Uniti
3344920	3372540	In cui il governo mette pesantemente la zampa ogni volta che qualche straniero interviene. Noi siamo apertissimi, tanto è vero. Prendete l'elettricità, uno dei settori più delicati. Noi avevamo l'Endesa già da anni qui, la Edison posseduta dai francesi, ditemi un altro paese europeo che sia come questo
3376080	3395320	Sulla telecom, il governo non ha mosso verbo, li sono stati attribuiti anche dall'economist intenzioni che non sono mai esistite, è arrivata la telecom spagnola, la telefonica
3396560	3409320	Nessuno aveva detto che poi il paese è aperto agli investimenti stranieri, perché la Spagna non è un investimento straniero, c'è stato forse un accordo tra mezza paterno sulla telefonica? No, non c'è stato nessun accordo di governo.
3410100	3428320	La Spagna ha giocato con il mercato e ha lavorato con le alleanze che poteva e voleva prendere. Questa è l'Italia, aperta. I nostri porti sono posseduti in maggior parte dai tedeschi, le infrastrutture essenziali
3430440	3441400	Allora, io vorrei che finalmente si guardasse alla politica di fatto di questo governo, non agli interessi di propaganda
3443040	3464060	Questo io vorrei semplicemente. Adesso le cose vanno meglio, perché appunto tutta la gran commedia che era stata fatta nei mesi scorsi si è affievolita perché annullata dai fatti, e poi cambieranno anche le opinioni internazionali
3465060	3494040	Gli investimenti stranieri sono anche il frutto di un cambiamento dell'opinione internazionale che non è facile da cambiare, proprio perché abbiamo avuto molto spesso regole complicate, proprio perché abbiamo ancora le verità del passato
3497000	3523060	Adesso stiamo portando in Parlamento e ormai sarà approvata, è in calendario nell'ultimo round, già approvata da un ramo, nell'ultimo round fra poche settimane in cui i visti per turisti, per tecnici, scuso quello per studenti che ancora non c'è stato l'accordo in Parlamento ma sugli altri, l'ingresso sarà facilitato
3524040	3554020	Ora si lavora in questa direzione, però io vorrei che, visto che siamo in un ambiente abituato agli aspetti quantitativi, che si verificasse se è più aperta l'economia italiana o se sono più aperte le altre economie europee
3582600	3584000	Grazie
3585520	3608360	Più in generale, mentre Francia e Germania si avviano anche loro a battere l'imposizione fiscale per le aziende e c'è una sempre maggiore competizione fiscale tra paesi europei, l'Italia come si prepara ad attrezzarsi per il prossimo giro, i prossimi due o tre anni quando anche Francia e Germania avranno una politica fiscale più incisiva per attrarre investimenti internazionali? Grazie
3614280	3644000	Noi stiamo lavorando su questo, io ho forti dubbi che la Spagna sia internazionalizzata anche per questo, se volete ha dato un po' di contributo, ma il dinamismo di industria spagnola è stato fondato su altri fattori, cioè un mondo finanziario che ha fatto massa sistema con il mondo industriale e che ha avuto un dinamismo straordinario
3646240	3657020	Questo incentivo che lei alludeva serve in molti casi più per stabilire dove è la sede principale, che poi è utile, intendiamoci che non, per la internazionalizzazione vera dell'economia
3657020	3686120	Detto questo, io quando ero a Bruxelles ero per una armonizzazione di questi aspetti della fiscalità di impresa, perché la concorrenza su questi aspetti alla fine porta solo confusioni nell'economia, questo era, è e sarà per lungo tempo impossibile o ben difficile, quindi bisognerà adeguarsi anche a queste norme
3686120	3709360	Ripeto, il dinamismo dell'economia spagnola secondo me deriva da altri fatti, soprattutto dalla sinergia tra banche, utilities, imprese di costruzioni, che ha creato veramente un sistema con una efficacia straordinaria
3709360	3737060	Basta pensare alla telefonica, perché quando fu privatizzata la telecom era meno della metà della telecom e adesso è il doppio o più del doppio della telecom, questo è un dato di fatto che ha poco a che fare con l'attrattività del fiscale, che in questo caso non ha giocato un ruolo, ma ha giocato tutta una serie di dinamismi
3737060	3757340	Nello stesso discorso delle imprese di costruzione spagnole, che hanno acquistato agli aeroporti di Londra o altre strutture straniere, lo hanno fatto non certo per gli incentivi fiscali, ma proprio per un insito dinamismo del sistema economico-finanziario spagnolo
3760240	3787320	Presidente, sono Raffaele Ciccarelli di Justline, ad un certo punto la ringrazio per il suo intervento lineare preciso, con un linguaggio molto comprensibile da parte nostra, dei uomini d'azienda
3790540	3809580	Il secondo argomento è la cultura di impresa, quanto tra i cittadini italiani è diffusa quella cultura della responsabilità, efficienza, orientamento al risultato, organizzazione
3819320	3839320	La cultura generale del Paese si fanno progressi malenti, cioè il senso di sensibilità al mercato, di apertura all'esterno è lento, sia nel mondo pubblico che in quello privato
3841200	3866400	Generalmente l'accuso si fa al mondo pubblico perché è più comodo, ma quante volte, molti di voi lo sanno, ho fatto un fondo per 25 anni al professoro di economia industriale, quindi la materia più interna e più caratteristica riguarda questi temi
3866400	3894400	Ma quante volte il passaggio di generazione di un'impresa familiare impedisce il salto in avanti, quante volte il discorso della struttura familistica, il non voler andare nei mercati finanziari, il non voler aprirsi, il non perdere il magico ruolo del 100% di proprietà
3894400	3907400	Questo ha impedito all'impresa italiana di crescere, questa è proprio cultura, una cultura profonda che va cambiata ad agio ad agio
3908320	3928480	Dirò che nei recenti anni abbiamo avuto in fondo anche tangibili successi di imprese piccole anche di dimensioni modesti che sono andati in mercati finanziari e attraverso questo ha fatto i grandi salti in avanti, devo dire che nella cultura italiana sono ancora eccezioni e non sono la regola
3928480	3955160	Riguardo alla prima domanda, io penso che ancora ci sia poco cultura del merito, ci sia poco cultura del merito in vari campi, ho fatto un discorso identico a quello che faccio oggi nel campo industriale, l'ho fatto domenica nel campo universitario, a Bologna dove si inaugurava una facoltà di ingegneria
3955160	3977500	Io sono convinto che o apriamo all'estero in tutti i campi, compresi i professori universitari, compresi i funzionari, oppure è difficilissimo avere la cultura del merito, occorrono degli elementi di rottura nella cultura di un paese
3977500	4002560	Io sono favorevole a questo, lo ripeto sempre anche per la storia dell'università in cui ho insegnato, nel cinquecento l'estate di Bologna era al vertice del mondo, tutte le scienze di allora, i cari professori anche allora che controllavano il mercato
4002560	4014260	decisero che nessun professore che non fosse cresciuto nell'estate di Bologna potesse insegnare nell'estate di Bologna in due generazioni, l'università è crollata, c'è niente a fare
4016400	4032420	Il sistema universitario italiano, il sistema della ricerca è ancora un sistema che si nutre al suo interno, che rifiuta con grande intelligenza, con grande capacità di difesa, innovazione in questo settore
4032420	4055460	C'è il ministro della ricerca dell'università su cui io conto moltissimo per questi fatti di innovazione, ma sono indispensabili perché noi abbiamo ricercatori, professori, studenti stranieri
4055460	4076460	C'è una imbridazione oppure rimaniamo con seri problemi, naturalmente è chiaro che in parte dipende anche dalle risorse, in parte noi dobbiamo dedicare alle borse di studio per studenti stranieri più risorse, più energie
4077950	4099550	Ma devo dirvi che naturalmente si sono fatte anche progressi, pensate al progetto Erasmus, l'iscambio degli studenti è una cosa molto elementare, ma che sta cambiando la mentalità di milioni di giovani, questo è indispensabile per una rivoluzione europea
4108950	4125470	Sono Mario Amoroso, gruppo La Marototi. Mio Presidente, lei ha sicuramente ragione quando dice che a livello legislativo il tasso di protezionismo del nostro Paese è sicuramente inferiore a quello di molti altri, sicuramente di gran lungo inferiore a quello degli Stati Uniti
4127450	4144350	Rimane questo senso, tuttavia, che l'accesso al nostro Paese sia più difficile, e io mi chiedo se tra le difficoltà che a livello psicologico l'investitore straniero incontra non ci siano poi le stesse che incontra anche l'imprenditore italiano
4144350	4155890	Mi riferisco soprattutto alla questione a cui lei ha fatto un c'è, della riforma della pubblica amministrazione, della riforma della pubblica amministrazione e del procedimento amministrativo tucur
4157130	4175890	Grande giurista e lei ha sicuramente ben conosciuto, Giuseppe Guarino, diceva che in un aureo libretto che si chiama Quale Costituzioni diceva che questa cultura dell'atto amministrativo contrapposta una cultura dell'azione amministrativa e parte addirittura di una sorta di costituzione materiale del nostro Paese
4176110	4198990	e serve sostanzialmente da contraltare al dilagare, se vogliamo, della pressione della politica. La mia sensazione, anche reggendo i reggenti progetti di riforma, è che addirittura non si stia migliorando, forse si stia andando al di là di quanto proclamano le norme
4198990	4218450	di fatto si sta forse addirittura cercando di circoscrivere le capacità di incidenza di alcune tra le poche istituzioni pubbliche che bene o male, seppure tra mille polemiche, hanno funzionato, mi riferisco fondamentalmente all'autorità garante per la concorrenza e alla conso. Grazie
4218450	4248430	Ma distinguiamo i due problemi, io prima non ho detto solo che l'apertura legislativa è buona, ho detto che di fatto noi siamo un sistema più aperto di altri problemi europei, di fatto, cioè empiricamente, andiamo ad analizzare i settori in cui gli stranieri hanno comprato, perché poi l'assurdo delle colonie italiane è che l'acquisto di imprese da parte dei stranieri per gli italiani non è mica trascurabile, anzi è elevato, sono gli investimenti Greenfield che non
4248430	4277690	vengono fatti, ma gli acquisti di imprese in Italia si fanno abbondantemente anche nel settore delle public utilities, io ho detto di più di quello che aveva del tasso legislativo, poi invece la seconda parte della sua domanda che riguarda la complicazione dell'amministrazione e la regolamentazione, devo dire che non l'ho nascosta nella mia relazione
4278710	4308410	Stiamo lavorando proprio perché è complicata sotto mille aspetti, lenta nelle processi di decisione, soprattutto lenta in tutto il grande processo della giustizia, che per le imprese è di un'importanza assolutamente fondamentale e questa è una realtà che non possiamo nascondere e che vale sia per le imprese italiane che per le imprese stranieri
4308430	4333430	Io nego che l'economia italiana sia più chauvinista di altre, questo è quello che io assolutamente nego, poiché questi legami burocratici, la lentezza della giustizia, le difficoltà che si devono compiere per ogni passo sono naturalmente notevoli
4333570	4360570	Anche se pensate quali passi in avanti abbiamo fatto nella regolamentazione del CTA bancario, nella protezione del consumatore nel campo sia bancario che assicurativo, sono enormi passi in avanti recentemente, pensate a tutta la rivoluzione della politica dei mutui, tutti questi aspetti non sono trascurabili nel cambiare il senso del mercato e la vita economica
4360750	4378890	però abbiamo tante cose ancora da fare e come ho detto a queste mi dedico direttamente come è priorità nostra mandare avanti il disegno di regge che c'è già in parlamento sulle authorities
4382570	4405130	Sono Paolo Catalfamo dell'American Chamber of Commerce in Italia, noi siamo molto dedicati all'attrazione degli investimenti americani in Italia, attualmente partiamo da un punto molto basso, l'Italia infatti è all'ultimo posto in Europa occidentale per investimenti diretti americani e al penultimo per investimenti indiretti
4405130	4435110	Anche noi cerchiamo di fare un grosso lavoro nel dipanare i luoghi comuni da quelle che sono le realtà e in questo senso le chiedo se lei dovesse convincere una grande impresa o un grande investitore di private equity a investire in Italia, quali sono i tre elementi che lei andrebbe a isolare come punti di forza del sistema Italia rispetto a altri paesi europei?
4435130	4464470	Il sistema di forza è come ho detto prima una competitività nei costi di mano d'opera che ormai non lo nega nessuno, compreso skilled manpower, cioè soprattutto nei settori come l'ingegneria, quelle in cui abbiamo una specializzazione, questo è un fatto molto forte
4466070	4490470	Secondo, la localizzazione geografica, volere o volare, c'è più traffico con l'Asia che con l'America, già adesso i tassi di sviluppo sono quello che sono, stiamo ritornando al centro del mondo e ce n'è la differenza tra essere al centro e essere alla periferia, questi sono già due elementi estremamente forti
4490470	4520450	E poi io credo che ci siano anche, è chiaro che in investire in Italia, io non ho mai pensato di attrarre investimenti generici, si attraggono investimenti specifici, per cui la terza ragione dovrebbe essere indicando settori in cui abbiamo vantaggi di investire
4520470	4550270	Ci sono raggi comparativi estremamente elevati, ho citato la meccanica, non c'è storia nella capacità competitiva dei costi di questo settore, ho citato il Made in Italy, è chiaro che mi è più difficile citare la farmaceutica su cui dobbiamo investire in modo addizionale, complementare, cambiare anche tutta una serie di norme e altri settori
4550470	4564830	Allora andiamo in quelle che sono i vantaggi comparati dei paesi, ma vede il problema degli investimenti est in Italia è più un problema di credibilità paese che non di convenienza economica
4564830	4581850	Io stessa mattina sono qui molto grato all'economist per l'invito che mi ha fatto, ma se voi leggete l'outlook sembra fatto per scoraggiarvi i vincimenti stranieri d'Italia, non ci governo però di non dura quel campo
4585350	4610250	Poi ci sbagliano fortunatamente perché non è così, ecco perché c'è una stabilità di fondo nel sistema, però capisco che non è facile di fronte a un'opinione di questo genere
4610250	4632730	non poter affermare un ruolo di paese, cioè c'è un passato così complicato, così difficile da rimediare che è un passato di stabilità di governi, un passato di regole non rispettate
4632730	4647030	E' quello che ho tento con serietà di portare avanti, però ripeto se indubbiamente quando leggete
4647030	4655470	un'other government crisis during the outlook period cannot be ruled out, it would probably be followed by an early election
4655470	4685450	E' quello che ho tento con serietà di portare avanti, però ripeto se indubbiamente quando leggete un'other government crisis during the outlook period cannot be ruled out, it would probably be followed by an early election
4685470	4705470	Però so benissimo che questa è l'opinione sull'Italia e allora è chiaro che devo dire con onestà e non me ne voglio far vanto che nei paesi in cui ci siamo presentati con serietà, in cui ho fatto una missione recentemente
4705540	4725440	Sono già cominciati a seguire gli investimenti perché quando c'è un impegno diretto le cose avvengono, certamente io devo consegnare riguardo agli obblighi sui rigasificatori, su tutte le cose gli impegni presi
4725440	4747900	Io sono convinto che dimostrando serietà in tutti questi cammini gli investimenti arriveranno e anche gli outlook cambieranno, ci vuole tempo
4752040	4760540	Presidente, buongiorno, sono Dario Rinero di Coca-Cola e a dispetto dell'outlook in questo Paese continuiamo a investire e grazie al cielo anche a crescere
4760540	4762540	E anche a guadagnare benissimo
4790740	4798900	In alcune grandi città lavoriamo anche con le circoscrizioni, poi se sei in qualche zona devi anche lavorare con le comunità montane e la storia va avanti
4798900	4805540	Quando noi guardiamo altri Paesi vicino a noi hanno normalmente tre livelli comuni, le Regioni e il Governo, lo Stato centrale
