start	end	text
4806280	4814300	Che cosa si può fare per aiutare questo Paese, i cittadini e le imprese a semplificare un pochino la macchina di gestione dello Stato
4814300	4825560	E soprattutto che esempio si può dare di moralizzazione e di riforma quando una macchina che è già abbastanza complessa e articolata continua a essere appesantita dalla creazione di nuove province
4825560	4839760	Con accordi spesso bipartisan tra tutti i partiti che creano soltanto nuovi costi e nuovi posti di lavoro per occupazioni che ormai tutta l'opinione pubblica non sente più l'esigenza, grazie
4850760	4864040	Signor Presidente, buongiorno, mi chiamo Ciotti, rappresento un'azienda di servizi pubblici locali del centro Italia, quindi è evidente che cambierò leggermente argomento rispetto alle domande precedenti
4864040	4878460	Nel suo intervento lei ha spesso fatto riferimento al Governo locale e poi tra gli esempi di problemi importanti sui quali tirerà diritto ha parlato per esempio del problema delle discariche e dei rifiuti
4878460	4891880	La mia domanda è molto semplice, qual è il programma del Governo Prodi per quanto riguarda i servizi pubblici locali, tenendo presente per esempio quanto ha detto anche il dottor Gross-Pietro prima
4891880	4900820	Se si sente parlare di privatizzazioni, non tutte le privatizzazioni hanno i crismi per poter essere di successo
4900820	4915880	La seconda domanda è questa, lei ha parlato di un programma del suo Governo ambizioso per cercare di portare a circa il 20% la produzione di energia elettrica con energie rinnovabili
4915880	4927940	Noi come aziende pubbliche locali abbiamo delle opportunità in questo, gestiamo dei termovalorizzatori, dei piccoli salti idraulici, produciamo del biogas nei depuratori e quant'altro
4927940	4933880	Esiste nel suo programma qualche cosa che interesse anche le nostre realtà? Grazie
4937350	4950310	Buongiorno, Mario Barbas, Westin Union. Presidente, volevo fare una domanda su quello che è il segmento financial services, specificamente i cross-border payment services, quindi i servizi di pagamento trasfrontalieri
4950310	4958630	Quale sarebbero le misure per incrementare la competitività di questa categoria? Grazie
4964150	4970770	Premier Ministro, sono avvocato austriaco di Vienna e partner dello studio legale Eustaccio & Schar di Vienna
4970770	4978590	Noi ci occupiamo prevalentemente dei clienti italiani in Austria ma anche austriaci in Italia
4978590	4998510	Comunque lei ha spiegato all'inizio che Italia è molto aperta ma io vedo che ci sono delle imprese italiane che vengono in Austria e chiudono l'impresa in Italia perché dicono in Austria la situazione è un po' meglio
4998510	5013710	E adesso magari lei può spiegare come è possibile mantenere le imprese in Italia perché prima abbiamo parlato della situazione come è possibile che le imprese stranieri vengono in Italia
5013710	5026710	Ma io dalla mia esperienza vedo che ci sono delle imprese, delle persone giovani che dicono in Italia l'ambiente imprenditoriale non mi piace più
5031940	5043480	Io ho espresso anche prima per rispondere prima all'ultima domanda che alle altre l'ambiente non mi piace più, ho espresso i problemi che noi abbiamo
5043480	5065500	Ho espresso anche però che stiamo in una fortissima dinamica ripresa, i dati delle nuove attività degli ultimi mesi sono dati di una rinnovata fiducia nel sistema italiano
5067480	5085940	Una ripresa della bilancia commerciale e quindi vuol dire che c'è un nuovo dinamismo vuol dire anche che molte delle imprese che avevano fatto trasferimenti all'estero e all'outsourcing si sono ribilanciate su una nuova struttura produttiva
5092620	5104140	Il processo è ancora finito, stanno creando un posizionamento nell'economia globale che è molto più forte come capacità competitive di come era prima
5104140	5112140	Prendiamo il nord-est, tipicamente il Veneto, le imprese venete oggi sono del tutto diverse dagli imprese di ieri
5113300	5127460	Tipicamente hanno portato all'estero una metà o anche in certi casi due terze della produzione, hanno tenuto in Italia l'upgrading, hanno tenuto in Italia il cervello, la progettazione
5127460	5138500	E adesso possono fare sfide verso i nuovi mercati, alcune imprese non hanno ancora compiuto questa trasformazione ma moltissime lo hanno già fatto
5138500	5158760	No, non voglio fare caso a Die Dali ma se prendiamo parecchie imprese a Veneto hanno fatto il loro sbocco in Robania, in Cina e poi si sono riequilibrati, riorganizzando in Italia e rafforzando la produzione che era rimasta qui
5158760	5175560	Proprio perché nell'ambito di una strategia mondiale, cervello, design, marketing, era bene che rimanesse in Italia, la produzione standard era bene che se ne andasse via
5175560	5199900	Insomma abbiamo 23 mila imprese italiane in Romania, 600 camion al giorno che vanno e vengono dalla Romania, questo non è per caso che è avvenuto, è perché di fronte alla differenza così forte ai costi la produzione più semplice è andata verso paesi con costi da mano d'opera assolutamente non paragonabili
5200440	5210400	Poi ci sarà un assestamento come è avvenuto quando è entrata la Spagna nella Unione Europea, poi i costi spagnoli sono cresciuti e c'è stato un riequilibrio della situazione
5210400	5236280	Il problema è che noi riusciamo a progredire dal punto di vista scientifico, dal punto di vista produttivo, questo ne parlerà poi il Ministro della Ricerca e dell'Unità successivamente, non ho voluto toccare in particolare questo settore proprio perché è nel programma il suo intervento in materia, ma è chiaro che noi dobbiamo salire e salire nella scala della produttività
5236280	5264980	Però ripeto analizziamo anche i fatti positivi, moltissima di questa ristrutturazione è avvenuta perché se no negli ultimi mesi non avremo una bilancia commerciale che si va riaggiustando quando noi siamo nell'Euro a cambio fisso
5264980	5292840	E' un cambio che aggiustava le cose quando la bilancia commerciale andava male, quindi era chiaro che noi avremmo avuto, quando sono entrato nell'Euro sapevo benissimo che cosa voleva dire per i primi anni, volete che non sappia cosa significa passare da una generazione intera di svalutazione continua a una moneta a cambio fisso, però vedete che ci stiamo adattando
5292840	5320920	E adesso comincerà quindi una industria che deve salire sempre di più nella qualità perché non ha più la svalutazione davanti, certo è un passaggio penoso, painful come dicono, ma lo stiamo facendo e io su questo conto, io sono ottimista su questo, sono ottimista perché le imprese hanno imparato questo e quindi andranno avanti a migliorare in questa direzione
5320920	5348500	Però che alcuni britaliani scelgano l'Austria, a me va bene, voglio dire ci sono delle imprese austriali che scelgono l'Italia, credo che abbiamo settori in cui la nostra bilancia commerciale con l'Austria ha degli aspetti assolutamente positivi, sono più preoccupato sulle performance della nostra industria turistica nei rivali dell'Austria
5348500	5368500	In cui veramente vedo un sbilanciamento nei costi, ma nelle manufacturieri in senso stretto non sono preoccupato. Servizi, pagamenti e trasfoltraglieri dobbiamo applicare semplicemente le norme europee, perché non c'è nessun altro da fare, il recipimento e l'applicazione delle norme europee
5368620	5387860	Proprio perché, secondo me, ho lavorato mesi quando ero presidente della Commissione Europea per renderli omogenei e meno cari, si è riuscito in buona parte a fare una legislazione ben più trasparente della precedente, l'unico obbligo che noi abbiamo è quello di applicarla
5389420	5409660	Sulla servizi pubblici locali, qual è la strategia? La strategia, secondo me, è quella di una razionalizzazione e di un rafforzamento di questi servizi, anche senza aver misure specifiche
5409660	5432540	È chiaro che vedo di buon occhio il raccorpamento, fusioni e servizi comuni di queste società pubblico e teledislocali. Non è necessario sempre una fusione, ma certamente nel mercato dell'energia almeno
5432540	5458840	Il problema di un mercato libero deve avere una risposta dagli acquirenti che abbiano una dimensione decente. In questo caso, proprio analizzando risparmi di costi che possono fare, questi processi di fusione e concentrazione sono assolutamente sensibili, oltre che a un livello tecnico molto forte
5458840	5485300	Gli incentivi devono approfittare disponibili a tutto il sistema produttivo, alcuni dei quali li stiamo ancora elaborando riguardo alle energie alternative per utilizzare ogni angolo possibile in questo settore
5485300	5491300	Perché non è che si possa procedere soltanto per grandissimi interventi
5493700	5514300	Sulle domande che riguarda la prima e la seconda domanda, ripeto la risposta che hai dato prima, sulla burocrazia, riforme di lungo periodo si stanno facendo
5515340	5523300	Mi sono messo di traverso per tutto quello che potevo sulle nuove province e sulle molti applicazioni degli enti locali
5524940	5543520	Noi vedrete nelle prossime settimane una sostanziale riduzione di uffici periferici, la chiusura di uffici periferici burocratici di molti settori, proprio è questione di settimane
5543520	5562520	E andremo avanti in queste direzioni, certamente se la regione sarda approfitta dell'autonomia per creare delle province che hanno 60 mila abitanti, l'unica nostra risposta è quella di non aumentare la nostra spesa pubblica centrale in quella provincia
5562520	5572160	Perché non è che possiamo violare la Costituzione, però stiamo rispondendo in questo modo
