start	end	text
1554880	1557060	poi ci sono la Cina, la Russia
1557060	1559760	con cui ho avuto rapporti molto profondi
1559760	1562760	il tempo e le circostanze diranno
1563680	1566500	in quale direzione uno può meglio
1566500	1568660	utilizzare le proprie conoscenze
1568660	1570980	i propri talenti, i propri desideri
1570980	1573680	ecco, adesso comincio questa analisi
1573680	1575620	che poi porterà dove porterà
1575620	1581180	ma la parentesi, la lunga e bella parentesi italiana
1581180	1584900	è finita e credo che sia molto utile
1584900	1586760	anche per il futuro del Partito Democratico
1586760	1589840	cioè che una nuova leva
1589840	1592320	abbia responsabilità
1592320	1594140	e poi, insomma, in politica
1594140	1595840	si è obbligata a prendersela
1597580	1601560	ma poi, insomma, è nella democrazia mondiale
1601560	1604760	che la gente che si toglie dai piedi, si toglie dai piedi
1609160	1611120	guardate che, voglio dire
1611120	1613400	Tony Blair, una politica inglese
1613400	1615940	ma pensate con Zales in Spagna
1615940	1618600	è utile, è importante che questo ci sia
1618600	1621280	sennò noi predichiamo sempre che
1621280	1625440	e non va mai via nessuno, io sono andato via
1630960	1634320	e posso fare una domanda, veramente da uomo della strada
1634320	1637400	com'è il mondo visto dall'alto?
1642400	1644180	la sensazione è che noi
1644180	1646360	comuni mortali siamo come tanti soldatini
1646360	1647900	che tutto il giorno stanno in trincea
1647900	1650380	e purtroppo vediamo soltanto gli occhi del nemico
1650380	1652400	ogni tanto il generale della cima della collina
1653500	1655240	vede le truppe che si spostano
1655240	1658440	e questo è un po' il ruolo dei politici, insomma, dei grandi manovratori
1661640	1662600	guardate che
1662600	1664400	anche i generali
1665400	1668380	i generali seri, gli oggettivi vedono anche
1668380	1671400	e soprattutto le miserie dello Stato maggiore
1672000	1674420	non le miserie della gente solo
1677180	1680560	come dicevo prima, le passioni
1680560	1683900	i piccoli risentimenti, i dispetti
1683900	1687580	sono uguali ai rendi condominio
1687580	1690640	ma perché dovrebbero essere diversi?
1690940	1692580	questo è una bella metafora
1692580	1694640	prendiamo l'Europa come un condominio con
1696400	1697480	27 inquilini
1697480	1701320	c'è qualche inquilino che gli altri non volevano?
1703980	1705880	come ci si mette l'antipatia?
1706140	1709340	il piano è rotto, poi si mette ancora quello del secondo piano
1709340	1711880	poi litigano perché c'è l'asensore sporco
1711880	1714540	è tutto un cambiamento questo
1717180	1720040	il dramma dell'Europa
1720040	1722020	è uno solo
1722020	1725860	guardate se guarisse questo l'Europa diventerebbe
1725860	1728360	il leader mondiale, unanimità
1728360	1730640	e ha fatto il paragone di un condominio
1730640	1733480	immaginate un condominio con 27 famiglie
1733480	1736580	in cui le decisioni si prendono solo a unanimità
1736580	1739220	croata la scala, l'asensore
1739220	1741200	non può funzionare, niente
1741200	1743360	non si arriva mai all'unanimità
1743360	1746640	non si arriva per forza
1746640	1748940	il Consiglio europeo
1748940	1752360	quando c'è qualche problema di interesse
1753840	1755420	specifico per l'elettorato
1755420	1758660	di un paese e ci sono le elezioni
1758660	1760560	ma quello impazzisce
1761360	1764920	voglio dire un governante anche di un paese piccolo
1764920	1768020	come Cipro, Malta o la Slovenia
1768020	1770360	chi ha di fronte le elezioni
1771040	1773820	e lui sostiene a ogni costo
1773820	1776740	la battaglia che lo aiuta
1776740	1778900	e non c'è santo, non gli interessa nulla
1778900	1780480	in quel momento dell'Europa
1780480	1783340	perché l'elezione è il suo fatto importante
1784540	1787600	lo vedete il referendum irlandese
1787600	1791160	l'Irlanda ha 4 milioni di abitanti
1791160	1792740	più o meno delle milie
1793560	1796500	e ha bloccato
1796500	1799500	il processo costituzionale di tutta l'Europa
1800480	1802280	quindi la metà
1802280	1804600	anzi hanno votato poi una piccola parte
1805560	1808300	un paio di milioni di voti
1808300	1810400	hanno bloccato un grande processo
1810400	1813580	di un continente di mezzo miliardo di abitanti
1814840	1817500	ecco questo non ha senso
1818260	1819860	questo non ha senso
1819860	1823500	è chiaro che essendo così le regole
1823500	1826060	in fondo il referendum irlandese
1826060	1828740	è ovvio che deve bloccare la Costituzione Europea
1828740	1830200	perché queste sono le regole
1830200	1835500	io dico solo, questa è una regola che uccide l'Europa
1836080	1837760	ha seguito le Olimpiadi
1838500	1841580	l'intenzione della Cina sembrava
1841580	1844120	dovesse essere almeno quella di far cambiare
1844120	1847500	la percezione di se stessa nei confronti del resto del mondo
1848040	1849760	secondo lei è cambiata?
1851440	1851960	enormemente
1853560	1855580	la visione, voglio dire
1855580	1859000	tutti gli stereotipi che c'erano sulla Cina
1861060	1862900	paese retrato che coppia
1862900	1864900	qui e là, su e giù
1864900	1867220	noi ci siamo di fronte a un modello organizzativo
1868240	1871160	perfetto, di fronte a una macchina
1871160	1873140	di una dimensione colossale
1873140	1876940	gli stadi che funzionano, i ragazzi che fanno le loro cose
1879680	1881880	non doveva esser battuto nessun record
1881880	1883800	perché doveva esserci il fumo
1884360	1886100	doveva esserci l'inquinamento
1886100	1888220	qui e là, il pericolo alle gare
1888220	1891080	salta un record mondiale ogni giorno
1891080	1896040	è chiaro che per la Cina è l'ingresso ufficiale del nuovo mondo
1896040	1898280	ma per chi capiva la storia
1898280	1900640	questo ingresso era già venuto
1900640	1904000	è venuto tra i 10 e i 15 anni fa
1904000	1905840	in cui si capiva già
1905840	1909720	e la Cina cambia molto, io ho avuto la fortuna
1909720	1912440	per i mestieri che ho detto prima negli ultimi 20 anni
1912440	1915620	di andare tutti gli anni in visito ufficiale in Cina
1915620	1918800	la conversazione è cambiata
1918800	1923140	il modo con cui si toccano i problemi è cambiata
1923140	1924180	negli ultimi anni
1924180	1928000	ti parlano dei difetti delle mancanze della Cina
1928680	1931000	sul sistema sanitario in crisi, sulle cose
1931000	1933300	ci sa impressione
1933300	1936480	argomenti che non si potevano nemmeno toccare
1936480	1938380	15 anni fa
1938380	1941340	è per questo che quando mi hanno chiesto
1941340	1944220	tu saresti andato all'inaugurazione
1944220	1946580	ma per bacco se ti sarei andato
1946580	1950780	perché la democrazia ha bisogno di dialogo e di fiducia
1950780	1953440	è chiaro che bisogna ribadire i principi
1953440	1956180	bisogna ribadire continuamente i diritti umani
1956180	1959380	è cosa che si può fare se c'è fiducia
1959380	1961720	e in questi dialoghi degli ultimi anni
1961720	1964920	io ho potuto dire cose che 10 anni fa
1964920	1968160	non ero nemmeno pensabili
1969120	1972140	le Olimpiadi sono il momento
1972140	1974180	in cui questo diventa ufficiale
1975060	1978400	in cui il rapporto col mondo
1978400	1980260	noi dobbiamo
1980260	1983180	per il grande problema della politica futura
1983520	1986520	questo è il problema numero uno della politica futura
1987320	1989520	che nessuno dei paesi occidentali
1990220	1992140	e lo dico perché l'ho chiesto direttamente
1992140	1994240	ai leader tante volte
1994240	1999360	da una risposta a una domanda precisa che facevo
1999360	2002260	quale sarà la politica del tuo paese
2002260	2003940	verso la Cile fra 10 anni?
2004400	2005920	non domani, non oggi perché allora
2006740	2008120	nessuno lo sa
2008780	2011120	allora noi dobbiamo capire
2012500	2014200	che c'è un nuovo paese
2014200	2015720	protagonista del mondo
2015720	2020460	ed è importante capirlo oggi per quello che insiste sul ruolo dell'Europa
2020460	2021800	perché ci deve essere anche l'Europa
2021800	2025760	e cosa è successo in questi ultimi anni?
2026060	2029760	è andato in crisi il monopolarismo americano
2029760	2032120	dopo la fine della guerra fredda sembrava
2032740	2035660	che gli Stati Uniti avessero il comando del mondo
2035660	2039260	se vi ricordate si scriveva per secoli
2039260	2041660	per decenni
2041660	2044200	e poi è partato alcune cose
2044200	2047660	Afghanistan, Iraq, quelle cose che sono successe
2048580	2051620	e il mondo si è articolato di nuovo
2051620	2053660	allora adesso andiamo verso il multipolarismo
2054820	2060620	ci vuole un multipolarismo collaborativo
2060620	2063980	allora bisogna essere
2063980	2065380	severe sui principi
2065380	2067660	ma capire
2067660	2071080	cosa saranno questi paesi fra 20-30 anni
2071080	2074360	usare l'intelligenza e la capacità politica
2074360	2077120	per capirlo perché ormai
2077120	2079580	la Cina è uno inarrestabile del mondo
2079580	2082380	allora quando c'è stata la missione in Libano
2083380	2086340	ho insistito e ci sono riuscito
2086340	2089380	ad avere anche i cinesi
2090800	2092320	tra coloro
2092320	2094380	che sono presenti nelle truppe di pace
2094380	2097540	perché dobbiamo avere una Cina collaborativa nel futuro
2097540	2099520	perché dobbiamo avere la pace
2099520	2101520	una pace garantita
2101520	2105640	e allora perché salta fuori l'Europa
2105640	2108900	perché è un ruolo inestimabile
2108900	2110700	nel multipolarismo
2110700	2113600	perché ha proprio per la sua complessità
2113600	2116600	per il modo con cui è nata e cresciuta
2116600	2118640	mettendosi in interessi diversi
2118640	2122040	nemici precedenti, tutto questo grande processo
2122600	2123800	abbiamo un'esperienza
2123800	2128540	e una capacità di influenza che è spettacolosa
2128540	2130900	ma le divisioni condominiali
2130900	2134600	finora ci impediscono di applicare questo ruolo
2134600	2136760	però guardate che
2136760	2140940	se voi volete dare un significato politico alle Olimpiadi
2140940	2142800	come ho detto già 10 anni
2142800	2144640	anche questo segnale lo seguo
2144640	2147040	ma solo al mondo, al popolo
2147040	2150100	il segnale che è nato
2150100	2153520	una nuova grande potenza
2153520	2154840	del mondo futuro
2156500	2158560	poi gli studiosi non se li stupiscono
2158560	2161180	pensate a due secoli e mezzo fa
2161180	2165360	il reddito pro capita dei cinesi era superiore a quelli degli europei
2165360	2168000	nessuno pensa più a queste cose
2168000	2171220	tutti pensano a qualcosa di così
2171220	2173400	e poi la politica
2174000	2176060	ha massacrato questo paese
2176060	2179700	lo ha ridotto in servitura
2179700	2183460	adesso sta ritornando
2183460	2184700	ad avere un ruolo
2184700	2188040	noi dobbiamo avere la responsabilità morale e politica
2188040	2190720	perché questo ruolo sia costruttivo
2190720	2192620	poi gli studiosi non se li stupiscono
2192620	2195620	era fondamentale
2199040	2199040	
2199040	2199420	proprio perciò
2199420	2199840	doveける parte
2199840	2199840	
2199840	2205720	che cosa Regardless
2205720	2206480	che cosa
2213940	2216460	One
2216460	2219300	subscribe
2219300	2221660	è劣'
2206480	2218600	La politica ha massacrato questo Paese, lo ha ridotto in servitura. Adesso sta ritollando ad avere un ruolo.
2218940	2225480	Noi dobbiamo avere la responsabilità morale politica perché questo ruolo sia costruttivo, pacifico.
2225480	2236480	E allora anche il discorso idioto entra in questa logica. Se non abbiamo la Cina e l'India, tra quelli che discutono sui problemi del domani, non abbiamo un domani.
2243100	2245960	Un paio mi deve rispondere. Le piace Obama?
2248080	2259580	Noi dobbiamo dire che io non lo conosco personalmente, proprio perché è arrivato dopo. Conoscevo o conosco molto bene la Clinton.
2261820	2277580	Obama lo conosco dalla lettura dei discorsi, ma secondo me c'è qualcosa di forte. Non mi sembra costruito artificialmente, mi sembra solido.
2278900	2289960	Poi ragazzi, non andate a vedere la sua vita. Questo viene presentato come un outsider, ma lui è stato il direttore della Harvard Law Review.
2290260	2292120	Sei stato intelligente?
2292120	2304740	No, io ho detto che l'intelligenza non guasta. Ho detto che non è il fattore numero uno. Il fattore numero uno, ripeto, è quello di andare all'essenza del problema.
2305000	2309780	In cui l'intelligenza giova molto. Prima ho parlato di Clinton, adesso parlo di Obama.
2309780	2325340	Ma voglio dire, il concetto che abbiamo noi italiani di intelligenza è quello che complica il discorso. La vera intelligenza è l'opposta, è quello che lo semplifica. Questo è quello che voglio dire.
2331420	2342380	Quanto è importante per l'Europa un'eventuale vittoria di Obama e un'eventuale vittoria, a mio modesto parere più probabile, di McCain? Che cosa può significare per l'Europa?
2345060	2369360	La leggo secondo i loro discorsi. McCain è molto di continuità. Obama, secondo me, riprenderebbe fortemente le idee, pur essendo americano, di multipolarismo che ho descritto prima.
2369360	2391280	Credo che offre un dialogo molto più diretto e molto più forte con l'Europa. Questo mi sembra indubitabile ed è per questo che c'è bisogno anche degli Stati Uniti di questo momento di rottura col passato.
2391280	2393140	È d'accordo col pronostico di Marco?
2393960	2398780	Non lo so perché non fatti l'analista di pronostici.
2399600	2401500	Di solito la paura premi un po' la destra.
2401500	2417380	Per Obama sia una battaglia difficile. Molto difficile proprio perché non votano gli europei ma gli americani. Se votassero gli europei Obama avrebbe già vento.
2417380	2440200	Ma ogni paese ha le sue paure, i suoi problemi. Il problema della diversità di colore di Obama è un problema che nell'inconscio, quante volte chiedo agli analisti, ai miei colleghi universitari se nella cabina verrà fuori o no.
2440200	2449160	E non ti sanno rispondere onestamente. Perché una cosa è la risposta all'opinion poll in cui uno deve essere politically correct.
2449160	2464020	Una cosa è quando l'anima, l'istento, episodi della tua vita ti saltano fuori, antiche rotture. Certamente sotto questo aspetto l'America dimostra di essere un grande paese.
2464020	2481280	Perché nessuno un anno fa avrebbe mai pensato, un anno e mezzo fa, che la lotta per la candidatura impredemocratico fosse fra una donna e un uomo di colore.
2482160	2489280	E' un bel cambiamento, ma in entrambi i casi è un grande cambiamento della società. Quindi questa è una città vitale.
2489360	2492060	...di politiche evidentemente, ma ci sono tanti modi per parlare...
2492060	2493280	...di politiche italiane...
2494220	2502960	Eccola, c'è una domanda. Un attimo che arrivi al microfono, così ti possono sentire tutti. Grazie.
2503680	2514660	Grazie, buonasera. Ho mirato molto tutte le cose che ha fatto nella vita. In particolare quando lei ha rinunciato, poco mi si fa, all'incarico alla Gazprom, dove tutti volevano andare.
2514860	2521020	Avrebbero venduto tutto e lei ha detto no, non sono un uomo per tutte le stagioni. Si vuol dire anche il perché, mi farebbe molto piacere.
2521980	2543000	Perché, vedete, quando un Presidente di Consiglio ha lavorato su un obiettivo per realizzare una cosa, tutti sanno che ovviamente io ho aiutato Lenny come deve fare un Presidente di Consiglio.
2543000	2545700	E poi ci credevo per realizzare questo...
2545700	2549000	Per chi non lo sapesse, la Gazprom è la grande compagnia...
2549000	2577840	...russa di metano, cioè petrolio e gas, e questo è il grande metanodotto che passa dal sud. Perché ero favorevole sul favorevole? Perché chiaramente arriva direttamente all'Italia un rifornimento che, nella mancanza della politica energetica europea comune, mi tranquillise un po' di più rispetto al non averlo.
2578720	2594260	Però quando uno partecipa a questo, secondo me poi non può fare il Presidente di questa società che viene creata, ancorché ben remunerato, che può risolvere problemi di generazione.
2594260	2621380	Perché non perderebbe la sua capacità di giudizio, quindi non è stata una rinuncia eroica, è stato un fatto abbastanza naturale, che non mi ha, avendolo spiegato, anche se all'inizio c'erano un po' di problemi,
2621380	2630380	non mi ha allenato il rapporto con Putin o con Medvedev, perché hanno capito benissimo che non c'era...
2630940	2648920	Volevo chiederle un parere su quanto ha scritto, abbiamo letto di Nanni Morezzi su di noi italiani, quanto ha scritto poi Scalfari nello stesso argomento, e soprattutto, secondo lei, quali sono le cause della nostra situazione da questo punto di vista?
2652940	2668200	Non ho letto i dibattito, nessuno con le meditazioni filosofiche che non ho seguito, quindi in questo caso non è che non le voglio rispondere perché non voglio parlare di poligia italiana,
2668200	2695360	ma proprio perché non ho seguito, mentre se l'ultima parte della sua domanda sul malessere del Paese certamente è una cosa che preoccupa, che mi procuro profondamente, c'è proprio stanchezza, si fa il discorso della demografia, ma io non lo credo.
2695360	2717320	Quando c'è entusiasmo sono giovani anche i vecchi, è proprio un problema di divisione, di mancanza di obiettivi comuni, ed è per questo che il mio disegno politico era un'alternanza chiara con politiche diverse,
2717320	2732320	se vinci tu questo tipo di politiche, questo tipo di preferenza, se vinci tu quest'altro, in modo che il Paese faccia le sue scelte, si articoli, diventi qualcosa in cui il cambiamento è cambiamento.
2733040	2749340	Mentre invece in questa situazione tutto sembra una poltiglia in cui diventa molto difficile trovare un filo conduttore, presentare a un giovane un'idea dicendo questa è la mia idea economica, questa è la mia idea politica.
2749340	2757380	E' proprio dal punto di vista di quelli che sono i concetti di globalizzazione che è stata intesa in maniera assolutamente libera e senza freni.
2758000	2778500	Io credo che bisognerebbe avere un atteggiamento un pochino più prudente nei confronti di questi modi di ragionare perché l'Europa di cui lei parlava probabilmente soffre anche di questi comportamenti un pochino troppo approssimativi e troppo forti dal punto di vista dell'apertura senza controlli e senza attenzione.
2778500	2799820	Prima di tutto non ho detto che la Cina è un Paese democratico, ho detto che si aiuta l'evoluzione della Cina più col dialogo e con l'apertura che non isolandola anche perché è troppo tardi per isolarla.
2799820	2824280	Questo è quello che ho detto e questo quindi non venga di ramesso le pene di morte perché appena appena adesso mi hanno dato il premio nessuno tocchi caino perché ho fatto personalmente la battaglia contro la pene di morte anche nei confronti del governo cinese anche parlando direttamente.
2824280	2851280	Quindi non confondiamo le idee. Adesso dobbiamo prendere la decisione politica. Cosa fa con la Cina? La isola? La butta fuori? E poi certo che la Cina fa concorrenza ma quando però adesso come in questo momento la domanda cinese e la domanda indiana le sostengono i mercati mondiali da una crisi che sarebbe altrimenti irreversibile il discorso va fatto.
2851280	2867280	Poi è chiaro che lei ci mette dentro il problema del copiare, il problema della garanzia del prodotto sul quale mi trovavo perfettamente d'accordo perché battaglia che ho fatto mille volte ma distinguiamo per favore i problemi.
2867860	2886280	Distinguiamo perché nessuno è tutto bianco e nessuno è tutto nero e la razionalità in queste cose è essenziale. C'è un'altra cosa da fare il Presidente. Non è solo la Cina che si sveglia perché poi l'India è uguale.
2886300	2912200	Il discorso della democrazia la può fare sull'India perché è paese democratico e come vedete io sono stato educato, sono cresciuto con un desiderio nella mia vita di vedere, diminuire le differenze di ricchezza nel mondo, di vedere svegliarsi i paesi più miseri e più poveri.
2912200	2937200	Quando questo sta avvenendo in alcune parti del mondo, escluso l'Africa, noi non possiamo dire a questo punto che sta capitando una tragedia perché questo è quello che tutti noi volevamo e per questo noi dobbiamo combattere.
2938480	2955100	Naturalmente in questo momento di congiuntura economica molto difficile i mercati asiatici stanno in qualche modo impedendo che la crisi diventi una recessione tragica. Questo è l'analisi che abbiamo fatto.
2955100	2978540	Naturalmente, ripeto, le regole del combattimento internazionale, le regole della copiatura, dell'imitazione, devono essere fatte rispettare e questo avviene soprattutto quando si fanno presenti le ragioni in modo chiaro, specifico e preciso.
2981240	3000060	L'Europa lo ha fatto più volte, lo sta facendo, abbastanza oggettivi. Il Parlamento Europeo è governato per metà della legislatura da un socialista e per metà della legislatura da un democristiano, quindi anche materialmente.
3000060	3026260	Allora, che cosa vuol dire in concreto, guardando le elezioni del prossimo anno e guardando la gente che andrà per farsi eleggere e per essere letto? Rendiamo onore un attimo ai piccoli meriti. Il libro Prodi l'ha scritto con lo suo collaboratore di Brussel, che si chiama Sadro Gose, che è qui presente, che adesso è deputato italiano, per dire che il rapporto anche di Studioso è un filo rosso che continua.
3026260	3042260	Allora, detto questo, che cosa significa in concreto 9 grandi alleanze europee e che cosa significa andare alle elezioni europee parlando di politica? Di politica europea, ma la politica non credo che sia separabile, la politica di Riccione rispetto alla politica europea. Grazie mille.
3043560	3070100	Se devo rispondere con sincerità, in tutti i paesi europei e non solo in Italia, si andrà alle politiche europee parlando solo di politica nazionale. Purtroppo questa crisi che si è avuta nelle elezioni europee negli ultimi anni, hanno fatto fare un passo indietro a questo disegno che secondo me è indispensabile la creazione di grandi movimenti politici a livello di continente.
3070100	3094100	Però con la trettanta sincerità vi dico che non vedo nel futuro vicino un cambiamento rispetto alla situazione che noi abbiamo, ma l'altra parte, siamo anche sinceri, nelle ultime elezioni italiane la parola Europa non è mai stata pronunciata da nessuno.
3095320	3121320	A un altro si dice che a Bruxelles ha un'enorme influenza su di lui, tuoni, fulmini, per dire l'altro. Nelle elezioni politiche il tema Europa non è stato toccato, nessuno ci ha badato, ma dietro alle spalle degli oratori non c'era mai di fianco la bandiera italiana o la bandiera europea.
3124980	3142820	Secondo lei perché? Perché l'uomo della strada è lontano e quello che ho detto prima, avendo ormai nella politica accorciato i tempi di riferimento.
3143660	3148200	A tale referendum ci fosse una promozione anche nel nostro Paese?
3152640	3171420	La regola europea è che ogni Paese si detta le modalità di approvazione dei trattati, in Italia c'è scritto che i trattati vengono ratificati tramite il Parlamento.
3171420	3185420	In tutti i 26 Paesi l'Europa, scusa l'Irlanda, non c'è il referendum, ogni Paese sceglie la sua regola. Ci fu una lunga discussione a Bruxelles se si era in grado di imporre modalità comune a tutti i Paesi.
3186480	3208000	E poi si è deciso, mi sembra giustamente, che ogni Paese applica le sue regole. In Italia i trattati internazionali si ratificano tramite il voto del Parlamento, così è stato in Italia, in Germania, in Francia, non in Irlanda dove invece la Costituzione in questi casi prevede il referendum.
3208000	3225380	Quello che io dico è che la democrazia è sacra, quindi il referendum va rispettato, quello che io dico però è anche che è una situazione folla e insostenibile che ci voglia l'unanimità per prendere decisioni in Europa perché questo ci paralizzerà.
3225380	3243040	Questo è quello che, non solo, ma aggiungo un'altra cosa, che come avevamo cercato di proporre, sia Ciscarda Estendi che io stessa Presidente della Commissione, bisognerà anche prevedere delle regole che come un Paese entra nella Unione Europea così esca.
3244540	3269660	Se non ci vuole più stare va via, ma non può impedire a tutti gli altri, capisco, che si dovrà attendere, queste sono cose lente da imporre, ma se dobbiamo un giorno essere una struttura politica che ha una voce del mondo e se rimaniamo separati la voce non l'avremmo mai,
3269660	3297080	io ripeto fino alla noia, come lo diceva i miei studenti, prima di entrare in politica, i grandi Stati italiani nel rinascimento erano dominanti nel mondo, nella finanza, pensate a Firenze, a Genova, nelle armi, nella tecnologia, nella scienza, nella filosofia, non ci siamo uniti, siamo scomparsi dalla carta geografica.
3297080	3308560	La Francia, la Gervania, l'Italia, la Spagna sono nella stessa situazione in cui era l'Italia nel 1500, possiamo benissimo rimanere divisi.
3309960	3325060	Sceramente mi sono avvicinata alla politica grazie a lei e soprattutto a quell'idea dell'Ulivo che è stato molto importante, non avendo nessuna collocazione politica, connotazione politica, ho creduto fortemente in questa idea.
3326200	3326700	Anche io.
3326840	3332500	Lo so, lo so professore, lo so. E adesso mi sento un po' orfana.
3332820	3333840	Anche io.
3333840	3346840	Bene, pensatazione dell'Elite, ritiene che quest'Elite abbiano le competenze per affrontare queste crisi che abbiamo di fronte, queste criticità che abbiamo di fronte?
3348500	3362960	Le competenze certo, il problema è la capacità decisionale, i interessi, i legami, i problemi. Le competenze vede se non le hanno in singoli, le hanno le macchine, non c'è alcun dubbio.
3367260	3374080	La macchina del governo americano riunisce tutte le competenze possibili e immaginabili.
