start	end	text
0	3560	di Panema, quella di Riccione, il passo è abbastanza breve, è tutto sommato, no?
4700	6320	Buonasera a tutti, benvenuti
6320	10680	e benvenuto al professor Romano Prodi che ci onora questa sera della sua presenza
11200	15400	si fa un saluto in questi casi, riparifate l'applauso in maniera più ufficiale
18860	22020	dovrebbe arrivare anche a momenti un amico giornalista di Repubblica che ci
22500	22940	aiuterà
22940	25320	un po' così in questo
25320	27140	confronto, in questo incontro
27140	30680	mentre lui finisce parlando di scrivere il suo pezzo io comincerei subito con la domanda
30680	33160	che tutti quanti vorrebbero fare questa sera
33160	35040	come va?
37540	38100	Benissimo!
39300	43120	perché devo essere sincero, benissimo, la trovo veramente bene
43840	48060	ha cercato di convincermi per tutta la cena che in realtà stava benissimo anche
48060	48680	un anno fa
48680	51400	ma francamente non so a quanti ci credono qui
51400	52600	No, sto meglio
52600	55440	sto meglio ma
56000	57400	voglio dire
58320	61060	non sono venuto via per star meglio
61060	62360	ecco
62360	64420	ho atto meglio, sarebbe anche rimasto
64420	67940	sarebbe anche rimasto
67940	70280	e volentieri, quando
71500	73820	è stato ora di venire via
74480	77400	mi è dispiaciuto, mi è dispiaciuto molto
77400	78460	però
78460	80880	le cose hanno un termine
81740	83760	adesso comincio la nuova vita
85640	88200	qui ci sono gli ultra A che
88200	91920	io ho letto un'intervista nei giorni scorsi in cui lei sosteneva che i prodiani non esistono
91920	93740	invece qui abbiamo
97260	99700	non esistono perché
99700	102800	è una parentesi chiusa
102800	104820	e io non voglio
104820	107520	essere strumento né di divisione
107520	109400	né di tensione
109400	110640	avevo detto
110640	112860	che nella vita politica
112860	116280	ci sono dei periodi e quando sono chiusi sono chiusi
116280	118380	Quanto è durato il suo periodo politico? 20 anni?
119100	122300	No, no, sono entrato, è una strana cosa perché
122300	125040	credo di essere l'unico che è entrato in politica con una data
125620	127800	il 2 febbraio del 94
129040	132200	2 febbraio del 95, scusate, del 95
132840	133260	e
134560	137200	è stata una decisione
137200	139840	improvvisa, nel 94 era un altro
140880	143320	in conseguenza nel 94
143320	145200	è cominciato il giro impugno
145200	147520	Dice il nome di quell'altro oppure fa che
147520	149200	si può dire
149800	152060	perché porta male, puoi tra l'altro non nominarlo
152060	156740	è una strana cosa
156740	159860	di solito in politica c'entra da giardaggio
159860	160800	davanti
160800	164260	13 anni, il numero è abbastanza falso
164260	165720	con però
165720	167520	l'allunga
167520	169220	parentesi europea
169220	172140	5 anni e 4 mesi in Europa
172140	174240	quindi una
175020	177080	situazione abbastanza unica
177080	179100	che mi ha permesso tra l'altro
179100	183120	di partecipare a 10 G8
183120	184540	quindi ero
184540	187500	il più anziano del gruppo dei G8
187500	190340	proprio 5 come Presidente del Consiglio Italiano
190340	191520	e 5
191520	193380	come Presidente
193380	194520	della Commissione Europea
194520	201160	di Europa parliamo più tardi perché il libro che è appena uscito, la mia visione dei fatti, racconta appunto 5 anni di governi in Europa
201160	205680	però prima torniamo per un attimo alla politica, senza entrare troppo nella politica
205680	210960	tutti quanti stiamo apprezzando molto il rigore con il quale si tiene fuori
210960	212500	dalle vicende quotidiane
213660	217440	questi 13 anni come sono stati?
218040	220120	Prima le ho detto che
220120	222700	ci stavo bene quindi vuol dire che sono stati belli
223640	225940	sono stati anni
225940	227540	in cui
227540	229240	io ho tentato
229240	231260	veramente un cambiamento
231260	234260	di fare un cambiamento forte della politica italiana
235280	238200	un bipolarismo con alternanza vera
238200	240460	e una grande alleanza
240460	242060	di centro-sinistra
242060	244280	che potesse costituire
244280	246420	un'alterativa di governo concreta
246420	247960	per il Paese
247960	252100	e due volte l'elezione è stata in vinte
252100	257140	due volte la realizzazione di questo disegno molto chiaro, molto preciso
257140	259540	è stata interrotta
259540	260720	dalla
260720	262480	stessa coalizione
262480	265980	quindi quando questi fenomeni accadono
265980	267840	bisogna tranne
267840	270100	le serie conseguenze
270100	272000	è chiuso
272000	273540	questo esperimento
273540	276560	io spero che qualcun altro lo possa portare avanti
276560	278880	perché lo ritengo
278880	281340	l'unico esito positivo
281340	283620	per un Paese come l'Italia
283620	286020	un Paese che altrimenti rimane ingessato
286020	287280	bloccato
287280	289120	senza alternanza vera
289640	291380	quindi non è che
291380	294060	i tentativi, i disegni politici
294060	296580	si debbano realizzare in un colpo solo
296580	298440	basta essere molto chiari
298440	301160	molto coerenti, molto precisi
301160	301900	ho detto
301900	304040	sempre che non ero
304040	305860	muoviamo per tutte le stagioni
305860	306860	finito
306860	310320	almeno per il tempo che ci è dato
311080	312680	su cui riflettere
312680	313800	finito questo
314880	316420	questo sforzo, questo tentativo
316420	318860	io credo che sia giusto
318860	322480	che altri porti avanti disegni alternativi
322480	324360	o che porti avanti questo disegno
324360	327420	la cosa più importante che ha lasciato?
328120	331840	e che magari le dà un po' fastidio che qualcuno possa, diciamo così, cavalcare?
331840	334600	ma sono state tante le cose, voglio dire
335120	336640	la cosa più importante
337360	339600	è il realismo
339600	341380	e l'onestà
341380	342940	con cui bisogna fare la politica di Italia
342940	344720	quando uno
344720	346100	inizia l'anno
346100	347180	sapendo
347180	350980	che ha 70 miliardi gli euro di debiti di interesse
350980	353040	per il debito pubblico
353840	358780	o fa la politica del massacro con i patrimoniali con cose che non si possono fare
358780	361500	o fa la serie politica
361500	367100	di andare avanti con un progetto preciso di vivendo passo per passo il debito pubblico
367100	369340	in modo a poter rilanciare il paese
369340	370460	questa è
370460	375100	l'eredità che bisogna lasciare, un'eredità di realismo, di onestà
375100	376260	perdere
376260	378580	la gente credo non sia molto disposta a perdere, va?
379600	383420	insomma però è un bel po' di tempo che
384040	384640	politica
384640	386280	e gente comune vanno
386280	387740	ognuno nella sua direzione
388620	390660	anche perché, ripeto
390660	394940	è difficile per un politico dire
394940	398800	come stanno veramente le cose e trarne le conseguenze
399340	401620	però nell'Italia
401620	406060	credo che questo debba essere un nostro dovere morale
406060	409280	coerenza e obiettivi precisi
409280	412320	e poi è chiaro che il prezzo
412320	414760	può anche essere un prezzo molto caro
414760	417300	ma nel lungo periodo
417300	418680	la gente capisce
418680	422020	quello che bisognava fare e quello che non bisognava fare
422020	424100	però quando l'ho vista questa sera
424100	426480	le ho detto come prima cosa, la trovo dimagrita
426480	431060	e lei mi ha risposto, ah ma io non c'ho mica le televisioni che mi dimagriscono
432560	433520	tutta la gente mi dice
434460	437520	ma io la credevo grasso e invece non lo è, dico, che volevo farci
439760	441820	le televisioni contano moltissimo
441820	443800	più di quanto lei pensasse forse prima
443800	446960	no, io ho sempre pensato che contavano molto
446960	448620	però cosa ci si può fare?
449840	451960	i rioni, voglio dire
451960	454860	hanno cambiato il paese
454860	457360	e poi ne sono venuti i risultati elettorali
457360	460200	io di questo sono convintissimo che ci sia stato
460200	462580	un cambiamento, come dicono
462580	466020	gli esperti, antropologico
466020	469380	questa è la realtà dei fatti
469380	471860	però guai
471860	473800	guai secondo me
473800	475400	a essere prigioniero
475400	477920	di questo aspetto
477920	481000	è guai a cambiare la propria faccia, la propria testa
481000	483360	e la propria anima per inseguire la televisione
483360	484520	mi dispiace
484520	486780	ma questo è un errore
486780	489720	che non ho mai voluto fare
493500	495140	quindi si dice, ma
495140	496860	po' di un povero comunicatore
497560	498900	può darsi benissimo
498900	501080	non dimentichi però che
501080	504980	la trasmissione televisiva di economia che ha avuto più successo
504980	506140	in tutti gli anni
506140	509100	nella strada televisiva, è stata proprio quella che facevo io, quindi proprio
509100	510380	idiota del tutto
510380	512220	non lo ero
512220	515180	il problema è che comunicare la verità
516060	516660	quando
516660	519680	si tenta invece di
519680	520440	illudere
520440	522520	con la fantasia di cose che non ci sono
522520	523760	è scomodo
523760	526300	e non è certo popolare
526300	530000	questo è indubitabile
530000	532780	però lo rifarei
533700	534300	tutti
534300	535580	sapevano che
535580	538220	l'Italia non poteva stare fuori dall'euro
538220	540660	avrebbe voluto dire la fine dell'Italia
540660	541740	è scritto il prezzo Marco?
541900	543460	è scritto bene, sì
543460	547520	e tu hai già scritto tutto quello che vi anche diremo nella prossima ora?
549080	552200	è tutto scritto qua, abbiamo un copiore, stiamo leggendere
552200	552940	tutto
553460	555300	diciamo la verità
555300	557520	l'euro è stata
557520	559180	una cosa di una
559180	561520	preveggenza, di un'importanza enorme
561520	563080	senza l'euro
563600	564080	avremmo
564080	567620	un livello di inflazione impressionante
567620	569700	avremmo un paese in disfacimento
570560	572260	e le radici
572260	574460	della tragedia italiana
574460	576640	erano che il sistema economico
576640	579960	si lasciavano
579960	583000	che i guai aumentassero e poi si svalutava
583000	586220	si lasciava l'aumento dei guai e poi si svalutava
586220	587000	l'euro
587000	588340	questo lo impedisce
588340	589640	e quindi ci ha messo in forza
590480	591900	ma ha salvato
591900	594860	una deriva del paese che altrimenti sarebbe stata
594860	595700	infrainabile
595700	599260	poi è chiaro, è stato usato per qualche anno come propaganda
600780	603260	approfittando delle difficoltà reali
603260	604140	della gente
604660	606800	che non dipendevano dall'euro ma dipendevano
606800	608440	dall'andamento dell'economia
608440	610740	ed è chiaro che è stata imputata all'euro
610740	612560	perché conveniva politicamente
612560	614480	adesso è arrivata la crisi mondiale
614480	617400	tutti hanno capito che se non c'era l'ancora dell'euro
617400	618740	chissà dove finevamo
618740	620180	con il prezzo del petrolio
620180	620740	e allora
620740	621780	questo
621780	624320	grande momento di propaganda
624320	626180	è finito e si è chiuso
626180	628580	ma non ci ho mai creduto
628580	630940	che la gente lo pensasse veramente
631820	632900	vedi Putin
632900	634340	com'è Putin?
634780	636580	alla casa di Putin e poi il cremino
637320	639360	non è che sia più
639360	640320	che fosse a casa
641060	643920	non ero a villa non so che cosa
644620	646140	era il cremino
649540	650220	e
650220	654280	Putin è un uomo determinato
654280	657100	e nella realtà come appare
658220	660140	con questi occhi
660140	663760	fermi, questi occhi di ghiaccio
663760	665760	vi date del lei o del tu?
666820	668520	ma l'interprete non lo so
668520	669620	traduce
669620	672140	non parla inglese Putin?
672200	675380	Putin parla un perfetto tedesco
675960	677580	e in inglese
677580	678960	quando abbiamo
678960	680340	piccole cose a scappiacci
680340	681680	parlavamo in inglese
681680	682520	però
682520	685960	non la conversazione articolata
685960	689380	e poi come fanno
689380	691180	molti capi di stato
692720	694100	che vogliono conservare
694100	696400	la prudenza del discorso
696400	697800	uso l'interprete anche quando
697800	698460	sa la lingua
699480	701040	come capita
701040	703940	spessissimo come col paese arabino
704720	706560	sanno inglese perfettamente
706560	708340	tu sai inglese perfettamente
708340	710540	ma l'interprete serve
710540	712480	come una specie di
712480	713000	di muro
713740	715080	di riparo
715080	717640	per la prudenza della conversazione
717640	721020	Putin parla un tedesco assolutamente perfetto
721020	725560	è un inglese
725560	728720	da conversazione elementare
728720	733020	ed è un uomo che ritengue di una grandissima intelligenza
733020	733560	cioè
734580	736100	un ragionatore
736100	737660	freddo
737660	739780	che quando dice una parola però
739780	741580	te la tieni fino in fondo
742340	743740	con Putin
743740	744860	occorre
744860	745820	chiarezza
745820	746820	durezza
747580	748320	lealtà
748320	750340	e credo che sia un interlocutore
750340	751280	confidabile
752580	756260	affidabile nei termini dei rapporti di forza
756260	757680	come la politica
758420	762200	però ci sono quelle che anche nei rapporti di forza sono inaffidabili
762200	763500	Putin è
763500	764720	nei rapporti di forza
764720	765760	affidabile
766560	769560	qual è il leader politico che è la più impressionata in questi anni?
774240	775600	due persone
776920	779620	molto diverse fra di loro
779620	782660	il primo è Cole e il secondo è Clinton
782660	784420	voglio dire
785620	786960	molto diverse tra loro
786960	788560	Cole è un semplificatore
789160	793260	come deve essere un grande politico, vedete i politici
793260	797020	non devono essere troppo intelligenti
797020	798560	ma nemmeno gli uomini da affari
798560	800680	non c'è nessun riferimento
800680	804680	no, quelli che devono realizzare le cose
804680	806940	questo vale anche per gli uomini da affari
806940	809380	devono essere dei semplificatori
809380	811540	un'idea precisa, chiara
811540	813120	e fino in fondo
814460	815740	era proprio
815740	818720	a proprio questa bella mente contadina
819380	819860	che
820420	823440	vi sgretela un problema e gli toglie tutta la crosta
823440	826440	e gli lascia il sì e il no
826440	828660	Clinton è
829240	833460	infinitamente più raffinato di quello che non voglio descriverla stampa
833460	834860	c'è l'IG8 che sono
834860	836360	tre giorni di conversazione
836360	838680	dopo le prime tre o quattro ore
838680	842260	non c'è più l'appunto, non c'è più il dossier
842260	844220	che ti ha preparato l'ufficio studi
844220	845900	ma c'è la testa
845900	847760	e Clinton
847760	850040	dalle quattro ore in poi
850880	851920	emergeva come
851920	853020	un leader
853020	854740	diverso dagli altri
854740	857940	come funziona un G8?
858400	859600	ma il G8 è una cosa strana
859600	863380	di fuori si fa fatica a capire a cosa si fa fare insieme otto persone
863380	864340	per pochi giorni
864340	866140	ma realmente serve qualcosa?
866220	868940	adesso le dico proprio quello che penso fino in fondo
869960	873160	il G8 è nato in un'epoca diversa
873160	876340	è nato G7 tra l'altro perché la Russia non c'era
876340	879440	ma è nato come
879440	881780	la riunione una volta all'anno
881780	885520	dei paesi ricchi di quelli che contano
886480	889580	e poi il mondo è cambiato
889580	891260	e se vi daro una verità
891260	892740	secondo me un G8
892740	896660	senza la Cina, il Brasile, l'India
896660	899040	fa abbastanza vero, è un grande paese africano
899040	901600	non rappresenta più il mondo
902680	907960	e allora ha modificato la sua ad agio ad agio senza che la gente se ne accorgesse
907960	909720	la sua strategia
910240	914780	dal posto dove si affrontano i grandi problemi politici è diventato
915940	918200	un posto di conversazione
919780	924540	in cui si affronta un problema particolare ogni anno, un anno ci sono le iute all'Africa
924540	927220	un anno altri problemi specifici
927880	930220	ha però un gran vantaggio
930220	932440	rispetto a tutte le altre riunioni
932440	934600	la sua informalità
934600	939080	cioè nella cena finale del G8 in cui non c'è ordine del giorno
939080	942600	se ne sentono di tutti i colori
942600	947940	ed è importantissimo, guardate, è importantissimo che ti sia
947940	949520	una sede
949520	950540	libera
950540	953540	in cui i grandi della terra si incontrano
954160	955800	e parlano in modo
955800	960020	fuori dai denti, in modo confidenziale, in modo informale saltando anche da
960020	961120	l'un al l'altro
962020	964080	questo è ancora valido
964860	966000	però la formula
967320	969520	è la formazione forse che andrebbe un po'
969560	971640	è la formazione assolutamente cambiata
971640	975460	io sono convintissimo già da quattro anni
975460	977680	che ho la convinzione assoluta
978660	979340	che
979340	980540	o noi
980540	982500	ritorniamo addirittura indietro
982500	985660	a fare una piccola conversazione su temi economici
985660	986480	oppure
986480	988760	i nuovi grandi della terra ci devono essere
988760	990540	e c'è poco da fare
990540	993400	non perché siamo in periodo di olimpiadi
993400	996700	ma l'idea di avere un G8 senza la Cina
998800	1001960	non rappresenta il mondo, non rappresenta il mondo
1001960	1005060	è una formula da rivedere
1005060	1008480	però l'utilità di un incontro informale
1008480	1011560	è molto più importante di quello che non crediate
1011560	1013480	c'era uno che raccontava le barbellette?
1018500	1021000	quando c'ero io no
1021000	1024020	ci alternavano
1024020	1025820	adesso si
1025820	1028720	ci alternavano insomma
1028720	1032100	faccio il giornalista, avete capito cosa significa quando c'ero io?
1033340	1035060	che non ci sono più
1035060	1035480	ma
1039880	1040600	davvero
1040600	1042720	io credo che
1042720	1045540	nella politica
1045540	1048280	non avrei mai pensato
1048280	1052200	che i rapporti personali fossero così importanti
1052200	1053340	mi ho sempre pensato
1053340	1056380	nel tempo dell'università
1056380	1057300	oppure
1060340	1064180	che la politica fosse fatta di razionalità
1064180	1068000	la politica è una delle cose più irrazionali di questo mondo
1068000	1070220	voglio dire
1070220	1071260	anche nei momenti
1071260	1075880	il patto personale ha un aspetto importantissimo
1075880	1077940	prima parlava dell'euro
1077940	1080780	quando sono andato al governo la prima volta
1080780	1083400	l'Italia era rettamente fuori dall'euro
1083400	1087440	poi c'erano i giornalisti in bastito la leggenda di Asnara
1088080	1092500	ma l'inizio della risalita dell'Italia nell'euro
1092500	1094220	è stato proprio in un rapporto con Chirac
1095720	1097480	personalmente molto buono
1097480	1098900	era un incontro
1098900	1103120	dove l'euro non c'entrava niente
1103120	1104180	abbiamo discorso
1104180	1106640	un giornalista
1107840	1110260	diceva come pensate voi
1110260	1114000	di fare queste cose che oggi avete programmato
1114000	1115800	tra cui c'era anche la Torino-Lione
1118340	1120820	quando fra pochi anni
1120820	1123460	la Francia sarà nell'euro
1123460	1125560	e l'Italia no
1126460	1127480	Chirac si è fermato
1127480	1132960	e poi ha detto col suo bel fragile
1132960	1135780	non c'è l'Europa
1135780	1137760	senza l'Italia
1137760	1138800	e quello è stato
1141120	1143200	non si parlava di euro
1143200	1146300	ma c'è stato il messaggio personale
1146300	1147980	di un discorso
1148980	1151400	qui andiamo assieme
1152400	1154460	abbiamo stessi obiettivi
1154460	1156940	e di lì è cominciato il giorno dopo
1156940	1159420	la possibilità che l'Italia entrasse
1159420	1161940	poi è cominciato la corsa, l'ha giusto abito il bilancio
1161940	1165980	ma se non c'era questo scatto di simpatia personale
1165980	1167120	di rapporto umano
1167120	1169360	Cegliere che ha dovuto invitare a teatro
1169360	1172520	all'Arena di Verona per rimediare una gaffa
1172520	1174240	questo c'è scritto nel libro
1176300	1179940	lei era Presidente della Commissione Europea
1179940	1182080	ci fu questo scontro
1182080	1185340	nel Parlamento Europeo
1185340	1187020	era la volta del capò
1188500	1190400	dopo di che
1190400	1193480	poi cominciarono tensioni fra Italia e Germania
1193480	1195960	allora invitata all'Arena di Verona
1195960	1197880	abbiamo passato qualche ora così
1197880	1201840	dando anche in questo caso il messaggio pubblico
1201840	1204580	che non c'era nessun problema
1204580	1205980	fra Italia e Germania
1205980	1211660	e anche in questo non è che abbiamo parlato
1211660	1213320	di politica italiana
1213320	1215280	perché parlavamo di temi europei
1217400	1220540	ma sono questi messaggi
1220540	1223780	che hanno un'enorme importanza nella vita politica
1223780	1225060	e questo ripeto
1225060	1227780	quando leggi i libri di storia del passato
1229300	1231540	non ci crede mai
1231540	1233840	poi invece ci si accorge
1236760	1238560	non ci crede mai
1238560	1240760	poi invece ci si accorge
1240760	1243860	che questa irrazionalità, questo sentimento
1243860	1245920	questo fatto di rapporto personale
1245920	1248240	ha un'importanza dominante
1249160	1252080	com'è questa nuova generazione di politici europei
1252080	1253720	che a noi forse un po' mancano
1253720	1257680	Zapatero, Sarkozy, c'era Tony Blair fino a poco tempo fa
1258320	1260760	hanno una caratteristica
1260760	1262440	che a me mancava
1262440	1265740	e che non rimpiango che mi manchi
1269660	1270220	una
1271460	1272020	esasperazione
1272020	1275200	dell'apporto con l'opinione pubblica
1275200	1276720	una cosa impressionante
1276720	1279880	ogni mattina l'opinione un po'
1279940	1281360	sui singoli temi
1282980	1286600	secondo me questa nel lungo periodo
1286600	1289480	è molto dannosa alla democrazia
1289480	1293040	però si vincono le elezioni
1293040	1296020	nel breve periodo
1299040	1300720	chi ne piace di più dei tre
1300720	1303020	tra Sarkozy, Tony Blair e Zapatero?
1304480	1306160	no, ma quelle che hanno la confessione
1306160	1308720	la confessione non si fa in pubblico
1308720	1310280	non l'ho chiesto di meno
1311440	1313640	è un complimento che possiamo fare
1313640	1316640	quando lei mi chiede le caratteristiche
1316640	1319620	queste sono caratteristiche comuni
1319620	1321580	se mi chiede poi tra le singole persone
1323080	1325580	ho lavorato veramente bene
1325580	1327580	con tutti anche quando ci si scontrava
1328660	1329920	aveva visto nel libro
1329920	1333300	di scontri durissimi con Blair sull'Europa
1333300	1336600	il rapporto personale però si è sempre salvato
1338400	1339580	ma certamente
1340240	1342580	questa caratteristica dell'abbreviare
1343340	1345100	gli orizzonti politici
1345100	1347980	è ormai diventata dominante
1349320	1351040	sembrava per certi versi
1351040	1351980	l'addio alla patria
1352880	1354940	se ne va lì chi sta quando torna
1356020	1357880	non saranno più le ricadute
1357880	1360380	scusate faccio volutamente un po' di politica
1360380	1362960	non saranno ricadute immediate
1365980	1367600	ma potrebbero essere ricadute culturali
1367600	1371980	delle politiche di un altro tipo
1374120	1375880	che cosa c'è?
1375880	1377900	che cosa c'è nel futuro di Romano Prodi
1377900	1380740	e che cosa può incidere
1380740	1383300	il futuro di Romano Prodi non soltanto
1383300	1384260	alla propria vita personale
1384260	1385380	se volesse fare il lobbyista
1385380	1391280	ma che cosa c'è nel futuro di Romano Prodi?
1397240	1399960	l'unica cosa certa
1401680	1404280	è che girerò il mondo
1404280	1406760	nel senso che
1406760	1409960	credo che la cosa che posso fare di più utile
1409960	1413280	è di
1414140	1416300	lavorare sulla mia esperienza personale
1416300	1418620	sulle conoscenze
1419920	1421640	sulle infiniti anni
1423320	1424620	di mediazione
1424620	1426680	ma più che mediazione proprio di processo
1426680	1430540	di saldatura che ho dovuto fare in questi anni
1430540	1433300	di saldatura europea
1434380	1436540	lavorando con i leaders africani
1437460	1440680	e io credo che possa essere utile
1440680	1442900	continuare questo tipo
1442900	1445840	di lavoro esclusivamente
1445840	1449540	al di fuori del nostro Paese
1449540	1451660	e ti posso assicurare che
1451660	1454000	non c'è nessun programma
1454000	1456260	nella prospettiva di ritorno
1456260	1458660	perché mi sembra giusto
1459260	1461940	che quando una parentesi è chiusa
1461940	1464480	e uno dice che è chiusa definitivamente
1465300	1466840	passa ad altro
1466840	1471480	e passa a dedicare quel molto che gli rimane della propria vita
1471480	1474120	agli obiettivi che gli sembrano
1474120	1476160	in quel momento più importanti
1477260	1479740	se volevo rimanere nell'ambito della politica italiana
1479740	1482560	almeno mi presentava alle elezioni
1482560	1484520	dato che un parlamentare
1484520	1486220	può certamente fare più politica
1486220	1488380	è meglio di un non parlamentare
1488380	1491280	quando uno decide di non presentarsi alle elezioni politiche
1491280	1493700	vuol dire che ha preso una decisione coerente
1493700	1497360	perché rinuncia a uno strumento semplice
1497360	1499140	di fare politica
1499140	1502380	non rinuncio a una presenza
1502380	1506340	nell'ambito dei rapporti politici mondiali
1506340	1507580	non rinuncio a una mia gerarchia
1507580	1509040	come desiderio
1509040	1514420	ma poi sapete, un'altra cosa che mi sono prefisso
1514420	1517300	è di non prendere alcuna decisione prima della fine dell'estate
1517300	1520040	quindi in questi mesi ho solo pensato, riflettuto
1520040	1522180	letto, parlato, girato
1523380	1527200	ma se deve esprimere una mia gerarchia
1528240	1529980	certamente come primo obiettivo
1529980	1532040	ci sarebbe l'Africa
1532040	1535320	cioè un rapporto politico
1535320	1538040	e non né discorso economico
1538640	1541620	né discorso di affari, voglio dire, né
1541620	1544040	un discorso di ONG
1544640	1548560	cioè utilizzare quello che è
1548560	1550040	il patrimonio che ho accumulato
1550880	1553040	cioè la conoscenza con tutti i lideri africani
