start	end	text
3374080	3395220	Qua il governo cinese è una macchina di una raffinatezza inimmaginabile, così possiamo dire quello tedesco, in molti campi anche quelli italiani, ma il problema non è mica la conoscenza dei problemi,
3395220	3405220	sono interessi, sono le situazioni della società, ormai sono tutti convinti del problema energetico.
3406240	3422200	Il discorso è che i rapporti di forza e le situazioni di diversi Paesi distano un miliardo di conometri l'una dall'altro, che il petrolio ha l'interesse opposto a chi non le ha.
3422200	3434860	In questo momento il discorso del pezzo del petrolio non è mica solo dominato da un astratto rapporto domande e offerta, ma ci sono dei grandissimi giochi politici dietro.
3434860	3448940	Quindi se lei mi chiede le competenze, certamente ci sono. La capacità politica di risolvere i problemi? No, perché ci vorrebbe quello che non abbiamo, cioè l'autorità mondiale.
3449760	3462020	Quello che lei dice era risolto dal sogno di Wilson nelle Nazioni Unite, che è anche un motivo per cui il mio governo è sempre appoggiato in ogni modo per quanto si poteva l'ONU.
3462020	3468020	Perché è chiaro che se vogliamo affrontare questi problemi dobbiamo avere un'autorità mondiale.
3468020	3479260	Però se lei mi chiede se ci stia vicino, io le dico che ci siamo ancora lontani mille miglia, ma il cammino da perseguire è in quella direzione.
3481480	3499180	Ormai, per esempio, il secondo tema che lei ha toccato, l'energia, il secondo è il riscaldamento globale, chiaramente c'è nella coscienza di tutti che perlomeno devono fermarsi nell'inquilamento,
3500180	3514180	ma gli interessi su come attuarlo sono enormemente diversi, cioè i paesi che hanno un alto livello di consumo energetico e di inquilamento pro capita,
3514560	3527440	dicono prendiamo i parametri partendo da quelli di oggi, gli altri che devono ancora svegliarsi dicono no, prendiamo parametri uguali perché noi abbiamo il diritto anche noi di avere l'automobile e cose di questo genere.
3527440	3547440	E su questi sono interessi oggettivi in cui la mediazione è difficilissima, il fallimento delle tradattive del WTO, del commercio internazionale di poche settimane fa non sono mica dovuti al fatto che il commercio internazionale venga demonizzato,
3547790	3564790	qualcuno lo fa anche, ma dal fatto che c'erano interessi divergenti, fortemente divergenti soprattutto nel campo agricolo, fra India, Cina e Brasile, Stati Uniti e Europa, e qui il problema non è un problema di competenze,
3565000	3586060	qui è proprio un problema di interessi, è un problema di mediare, quello che, e vorrei concludere con questo, perché l'Europa c'è uno spazio enorme, perché io sono convinto che il tentativo di monopolarismo,
3586060	3606500	di un mondo piramidale governato da uno solo si dimostri sempre più difficile, sempre impossibile, allora in un'articolazione come noi avremo in futuro, di 4-5 grandi aggregati politici, l'Europa, proprio per quello che dicevo prima,
3606500	3627500	a un ruolo importantissimo di proposta, di mediazione, di flessibilità, anche di saggezza, però prima di arrivare a questo noi abbiamo ancora dei grandi cammini da compiere, ma ripeto non mancano le conoscenze,
3627800	3645540	non manca la capacità delle macchine politiche, delle macchine governative di conoscere i problemi, manca l'aggregazione degli interessi e l'armonizzazione degli interessi che è necessaria per raggiungere questi obiettivi.
3645540	3647760	Foste ancora più preoccupante però?
3647940	3649720	Sì, è più preoccupante.
3649820	3651040	Era meglio essere stupidi?
3651820	3672760	No, non è mai bello essere stupidi, no, però ripeto, cos'è che mi era piaciuto? La cosa che più mi faceva soffrire della politica di Bush, che poi negli ultimi anni si è modificato un po',
3672760	3683800	era proprio questa umiliazione sistemica delle Nazioni Unite, oppure del protocollo di Chiodo, di tutto quello che raccordo internazionale paritario.
3683980	3688480	Allora io me lo spiegavo benissimo, dico che il interesse americano poteva essere diverso, no?
3689560	3703480	Però c'è sempre la necessità di guardare a un futuro più avanzato e tant'è vero che gli Stati Uniti, Bush spesso ha cambiato fortemente negli ultimi tempi.
3703780	3725580	Quando voi pensate, vedete l'aspetto economico, no? Liberismo oltranza, guai intervento dello Stato, poi arriva la crisi e il governo americano secondo me saggiamente è intervenuto per salvare alcune istituzioni finanziarie che se non lo avesse fatto avrebbe causato una crisi dietro l'altra.
3725580	3753820	Ma è contro tutto quello che io ho sentito in tutti i vertici per tutti gli anni in cui sono stato là, ma proprio l'idea che il governo americano salvasse le grandi società di assicurazioni che governano i grandi mutui è cosa del tutto razionale, perché sennò andrebbe nel disastro.
3753820	3755820	Anche se questi hanno creato disastro, vero?
3755990	3771150	Appunto, ma non solo, ma la dottrina era guai che il governo metta mai la mano in queste istituzioni. La stessa cosa potremmo riprendere su alcuni grandi temi dell'economia.
3771150	3795450	Voglio dire, ma quando io per anni ho sostenuto che Keynes, e quindi la sua discorso di una politica di temperamento del mercato, non antimercato per carità, anzi, ma di regolazione del mercato, che fosse un fatto di grande progresso di umanità, questo veniva ritenuto una folia.
3796410	3812890	Adesso tutto questo nell'ambito della crisi in cui siamo viene ritenuto doveroso, opportuno, ecco allora il grande necessità di pensare a lungo e non a breve.
3812890	3829330	Ed è interessante come, senza fare nessun cambiamento teorico nella politica reale degli Stati Uniti e di molti paesi europei, vi sia stato un cambiamento radicale riguardo all'intervento dello Stato.
3829330	3843330	E ripeto, secondo me, è stato estremamente opportuno e meno male che il sistema statuale americano è intervenuto per evitare che il disastro si espandesse a catena.
3844670	3855390	Ecco allora, cos'è la politica? La politica è proprio quella di capire che le decisioni sono diverse dalla dottrina stratta.
3864210	3880970	Scusate, ma una discorso ottimista? No, credo, ho fatto un discorso realistico stasera e ho messo tutti di fronte ai problemi che noi abbiamo.
3880970	3892570	Ma io per un minuto ho parlato di crollo, di tragedia, che invece voi giornalisti vi riempite di queste parole per emozionare la gente.
3893070	3898150	Ho parlato in modo razionale di come stanno le cose che dovrebbero essere.
3898150	3928130	Ora siamo di fronte a una difficoltà economica diffusa, siamo di fronte a una crescita per ora vicina allo zero, ma nessuno parla di un crollo dell'economia.
3928130	3942130	Gli Stati Uniti e gli Stati Europei hanno dato anche prove di trasformazione estremamente forte, l'economia italiana senza che noi ce l'accordiamo, si sta trasformando in modo radicale.
3943090	3960250	Certamente che alcune fabbriche vengono chiuse e qui c'è il discorso della Cina, ma abbiamo avuto dei settori in espansione enorme e il cambiamento dell'economia è sempre un cambiamento che ha luci ed ombre.
3960250	3977430	Quello che voglio dire è che di fronte alla nuova sfida mondiale noi non risolviamo i problemi ignorandoli o rifugiandoci in una dottrina astratta, come molti invece cercano di fare i nostri dibattiti.
3977430	4004290	Negli anni scorsi, per esempio, sono stato l'unico a ribadire che nell'economia europea, quando tutti parlavano del crollo della Germania, la fine della Germania, analizzando quelle che sono le strutture, vedrete che la Germania se la cadrà bene.
4004290	4011290	In questo momento, pur nella crisi, è il primo isportatore del Mondo.
4012990	4025290	Ecco perché ci sono poi le forze reali dell'economia che reggono, che danno vigore alla trasformazione.
4025750	4052470	Qui apriremo un capitolo che non possiamo aprire stasera, ma certamente per aiutare questo processo è chiaro che c'è una via sola che i Paesi devono percorrere, un investimento colossale, massiccio, totale, prioritario nelle risorse umane, nei giovani, nella scuola, è l'unica cosa che ti garantisce un indomani.
4055930	4074730	Si sono viste i miracoli al Mondo. Prima si toccava l'Asia. L'altro giorno ho chiesto al professor Negroponte, che dirige il MIT, cioè quelli che hanno un centro che studia l'andamento della tecnologia, del futuro.
4074730	4096230	E io ho fatto la domanda così, se volete più diretta e più provocatoria, più ingenua, che se volete, ma secondo te, qual è il Paese che più assorbe la tecnologia e la modernità, che più è capace di trasformarsi, non solo nelle scienze di punta, ma tutto come Paese, con le sue capacità di cambiamento?
4098090	4108890	Uno diceva, di fronte a questo, se ti rispondono gli Stati Uniti, la Finlandia, la Norvegia, c'è un Paese che si distacca da tutti, è la Corea del Sud.
4109670	4131190	Dico, ma perché? Perché hanno messo scuola, ricerca e giovani come una specie di ossessione e di centro di tutte le politiche del Paese? I risultati sono impressionanti. E questo è successo in 25 anni.
