start	end	text
0	7880	dell'ordine per poter servire come tutti quelli altri volontari, quindi mi piace avere a che
7880	18680	fare con gente concreta, molti fatti e poche chiacchiere e in questo stile ho finito. Grazie.
23160	27220	Ringrazio Sua Excellenza e a questo punto passo la parola.
49520	58500	Excellenza, signor sindaco, autorità a tutti. Ho accettato molto volentieri l'invito a venire
58500	63280	qui anche se quel giorno di Santo non avevamo assolutamente il calendario dei campionati
63280	68780	del mondo, quindi siamo innocenti. Abbiamo anticipato di mezz'ora, vi assicuro, siccome
68780	74440	ho sentito che avete bisogno di 27 minuti perché l'ultimo possa andare a vedere la partita,
74440	82620	alle 5 e 33 siamo tutti liberi, d'accordo? D'accordo, compresa la discussione e allora
82620	91020	oggi il tema era proprio tentare una riflessione sul problema, sul momento economico e politico
91020	98040	dell'Europa, una riflessione al di là della semplice attualità, ma cercare di approfondire
99180	106480	alcuni temi di lungo periodo, dove andiamo a finire, perché la crisi in cui siamo,
108180	114120	qualcuno dice che siamo già usciti, ma ho ancora qualche dubbio perché se siamo usciti
114120	120680	non me ne sono accorto, può darsi che siamo usciti, ma la crisi in cui siamo è una crisi
120680	128500	diversa dalle altre, una crisi che ha cambiato l'economia e la politica del mondo e l'ha
128500	134540	cambiato in modo abbastanza divergente, cioè soprattutto dal punto di vista della politica,
134800	143460	se prendiamo l'altra grande crisi, quella del 1929, era estremamente interessante perché
143460	149540	è uscita dalla crisi, è entrata dalla crisi in un mondo in cui gli stati uniti erano dominanti
149540	153740	e se è uscita dalla crisi in un mondo in cui gli stati uniti erano ancora più dominanti,
155240	161560	nonostante la crisi si è nata gli stati uniti. Nella crisi di oggi, una situazione politica
161560	166220	come l'economia, poi ci differenziremo un po', è abbastanza diversa, perché siamo entrati
167800	175840	nella crisi in cui ancora, nonostante l'inizio di un grande cambiamento che è cominciato con la
175840	187780	guerra in Iraq, non dimentichiamo che doveva essere il sigillo del secolo americano, vent'anni
187780	193280	fa fu scritto il famoso libro La fine della storia, perché questo secolo avrebbe dovuto
193280	201700	essere l'indisturbato secolo di dominio americano e la guerra in Iraq ha cominciato a fare oscillare
201700	211560	questa certezza e noi riusciamo dalla crisi economica in un mondo politicamente multipolare,
212180	219240	cioè in cui gli stati uniti sono ancora di gran lunga la potenza più forte del mondo,
219760	226460	ma non possono più esercitare da soli questa potenza, cioè hanno il primato dell'aspetto
226460	233420	militare tecnologico, ma non hanno più la capacità di poterlo utilizzare da solo,
233800	241540	perché il mondo è cambiato, perché abbiamo avuto in questi anni un enorme sviluppo della
241540	256440	Cina, perché la Russia è diventata più assertiva e ha ripreso un ruolo, come vediamo adesso in
257440	265800	nuovi paesi si stanno affacciando alla politica mondiale, quindi abbiamo un multipolarismo
265800	272840	che fa del mondo una realtà estremamente diversa, ma anche più difficile da gestire,
272880	281980	più instabile, a mio parere molto più rispecchiante la realtà del mondo, quindi do un giudizio
281980	288360	di evoluzione non negativa, anzi positiva di questo, ma con degli aspetti di stabilità che
288360	297520	stanno fortissimamente aumentando in questo 2014 e che poi toccheremo. In questo ambito di grandi
299440	311180	cambiamenti non ho parlato dell'Europa, non a caso, perché nella grande gestione di questo passaggio
311180	326500	l'Europa è un soggetto passivo, l'Europa in Libia era divisa, in Siria divisa, sull'Ucraina ogni
326500	334100	paese europeo ha un atteggiamento diverso verso la Russia, cioè improvvisamente ci troviamo di
334100	341160	fronte a uno dei grandi protagonisti del mondo che per le sue divisioni interne non esercita più
341160	347580	questo suo ruolo di protagonista. Prima di tutto allora vi ho detto uno dei grandi protagonisti
347580	356280	dell'economia mondiale, lo è ancora, l'Europa è numero uno nel prodotto interno all'ordo,
357020	362840	cioè nella produzione, numero uno nella manifattura, numero uno nelle esportazioni,
364080	369640	certamente con gli Stati Uniti a distanza molto ravvicinata ma ancora numero uno,
371540	377120	eppure non contiamo nulla nella politica mondiale, non contiamo nulla quando vado
377120	383620	nel Medio Oriente, sento proprio questo atteggiamento, mi dicono ma come voi,
385700	391220	conoscete meglio di tutti la nostra realtà, che siete i più grandi commercianti,
391320	399820	i più grandi investitori, non contate nulla, perché, e qui finisco con le domande poi dovremo
399820	406380	andare con le risposte, nel caso ucraino i grandi protagonisti attorno al tavolo sono la Russia e
406380	413180	gli Stati Uniti, ditemi voi che cosa c'entrano gli Stati Uniti, semplicemente perché un'Europa
413180	419260	divisa non riesce ad avere una politica, e l'ultima volta che ho incontrato Putin,
419420	426120	pochi giorni prima della tesi all'Ucraina, quando discutavamo di questo tema,
426980	437320	la mia tesi in materia è molto chiara che l'Ucraina non può essere né europea né russa,
437320	445780	perché l'Ucraina è europea ed è russa insieme, perché non può che essere un ponte e non un campo
445780	449640	di battaglia, e se noi lo usiamo come è stata fatta adesso come campo di battaglia,
450600	456440	aumentiamo le divisioni e distruggiamo un grande popolo come sta avendo, quindi quando esponevo
456440	467600	queste tesi, la risposta di Putin era una risposta che mi ha fortemente colpito come europeo,
469580	480900	ma anche complessibile, cioè questo dice con chi tratto, i baltici, i polacchi, gli ucraini,
480900	486300	i baltici, i polacchi mi odiano, gli inglesi fanno quello che vogliono gli americani,
488200	494220	i tedeschi, gli italiani un giorno vogliono trattare, l'altro giorno fanno i duri,
495100	503620	quindi vanno di qua e di là, e pochi giorni dopo, tranquillo, puntando sulle divisioni,
503740	510600	si pappava la crimea senza che nessuno potesse dire wow, e questo appare sempre di più
510600	517780	come un dato di fatto, ma allora il problema dell'Europa non è un problema della sua forza
517780	526960	e della sua dimensione che ancora è nel mondo robusta, chiaro che siamo ormai il 7% della
526960	536560	popolazione mondiale, quindi eravamo un secolo fa il 30%, quindi pensate al rapido declino,
536560	543180	però c'è ancora una forza economica e una potenziale forza politica di dimensioni cospicque,
543720	550660	la divisione che abbiamo in noi non ci permette di fare politica estera, non ci permette di fare
550660	555640	politica estera, in parallelo faccio un discorso simile nella politica economica,
555900	567060	la politica economica come stanno le cose, stanno che abbiamo un mondo che globalmente
568460	579040	non sta crescendo male, mentre abbiamo ancora la Cina che si fa il suo 7-8%, gli Stati Uniti
579040	586580	intorno a 2-2 qualcosa, l'Europa intorno all'1 e l'Italia intorno allo 0, insomma poco più di
586580	595940	questo, quindi una uscita dalla crisi o perlomeno una pseudo uscita dalla crisi in modo completamente
596620	603560	diverso nella realtà mondiale e questo è chiaro che se si potrà nel lungo tempo cambi in modo
603560	616440	radicale i rapporti di forza del mondo, quando pensiamo alla Cina parliamo di un paese che fra pochi
616440	622380	anni sarà il paese numero uno dell'economia mondiale, naturalmente è chiaro che non vuol
622380	626640	dire della ricchezza individuale, del reddito individuale perché ha sempre cinque volte gli
627560	635920	Stati Uniti, quindi nel momento in cui sorpassa gli Stati Uniti, in quel momento però il cinese
635920	644020	individuo ha un quinto del reddito americano, però questo vi dà un senso di dinamica e di forza che
644020	651940	cambia la realtà del mondo e la cambia in modo secondo me molto forte e molto stabile anche
651940	660040	perché è la ricostruzione di una storia, cioè se prendiamo i venti secoli del dopocristo per
660040	667380	17 secoli e mezzo la Cina è stata numero uno nel mondo, nel rinascimento quali erano, dicono gli
667380	674660	storici economici, non è il mio mestiere ma leggendo quali erano i due posti, i due paesi più ricchi
674840	684500	del mondo, la Cina e la Toscana, però la dimensione è un po' diversa tra i due,
686720	692180	ma quindi il fatto che la Cina ritorni ad avere questa primazia, adesso sembra che ci
692180	698500	tornasse anche la Toscana ma questo è un altro discorso, il fatto che la Cina ritorni ad essere
698500	704320	in questa sua primazia non è uno sconvolgimento, è uno sconvolgimento rispetto agli ultimi due
704320	717160	secoli in cui il Paese è stato umiliato, ma per i cinesi è un ritorno alla loro storia e io sento
718000	725560	questo cambiamento a una rapidità impressionante, impressionante. I miei studenti della Business
725560	733840	School di Shanghai, quando andai la prima volta, il dialogo con loro, mi chiese, uno studente
733840	739840	mi definisca in tre parole che cosa si aspetta dalla Cina, tre parole, mi ha detto vabbè,
742060	747440	growing cooperative China, cioè una Cina che cresce in modo cooperativo, bravo professori,
749220	754780	quest'anno viene rifatto la stessa domanda e io ho risposto allo stesso modo, una Cina che
754780	760140	cresce in modo cooperativo, che cosa vuol dire cooperativo professore, che noi dobbiamo essere
760140	766680	ancora sotto messi a voi? Tre, quattro anni, questo senso di consapevolezza del Paese, guardate che
766680	774360	sono cose impressionanti queste, quando si vede la gioventù che ti cambia sotto gli occhi, che assume
774360	780300	la mentalità imperiale, che è stata proprio della Gran Bretagna, che è stata proprio degli Stati
780300	787840	Uniti, e che adesso la vedi trasferire in Cina, tu capisci che stanno succedendo cose enormi al
788840	796200	Paese, cose enormi, e che poi, è chiaro, i ragazzi qui vedranno nel loro svolgimento completo,
796960	806760	la mia generazione ne vedrà solo un pezzo, ma è un cambiamento radicale dei rapporti di forza, dei
806760	810860	rapporti di forza dell'umanità, come vi ho detto prima con gli Stati Uniti, ancora lì della
810860	817420	tecnologia, con una Cina che ha una popolazione enormemente superiore, che avanza economicamente,
818900	827720	anche culturalmente, cioè il milione di laureati cinesi di dieci anni fa è diventato credo otto
827720	836680	milioni e mezzo dell'anno scorso, per dire che questa università è impressionante, in cui al
836680	846700	sabato pomeriggio, voi vedete tutti lì che lavorano come matti, questi laboratori che non
846700	853060	c'è l'austriale di ricerca vicino, che dovete andare in automobili, in un autobus, perché a piedi
853060	861820	non la farete mai, intanto è diventata grande, cioè questa dimensione che tocca anche i nostri
861820	875580	problemi, quando io penso al plato con questa idea di che qui i cinesi ci rubano la tecnologia e
875580	891800	così via, poi vado a Shanghai e vedo un edificio enorme che sarà lungo un chilometro e dico ma cosa
891800	901580	ci muoviamo dove andiamo a finire, che è un mondo che è completamente diverso da quello che era
901580	911960	anni fa, di fronte al quale la divisione europea non ci permette assolutamente di avere un ruolo e
912580	918360	tornando appunto all'aspetto economico, quando chiedi come mai noi usciamo dalla crisi in modo
918360	925160	più lento, discorso estremamente semplice, anche qui è un problema politico, cioè quando è cominciata
925160	930680	la crisi Obama pur con tutti i suoi problemi, con tutte le difficoltà politiche che ha avuto, con
930680	938820	le eredità che ha avuto, ha messo 800 miliardi di dollari nell'economia e pur essendo stati gli
938820	945700	Stati Uniti l'origine della crisi ha immediatamente dato impulso all'economia, i cinesi hanno messo
945700	955120	4 trillioni di RMB che sarebbero 585 miliardi di dollari e ha fatto la stessa cosa, ha avuto un
955120	960140	piccola frissione e poi è ripartito e guardate che quando voi leggete i suoi giornali è calata la
960140	968460	crescita della Cina, non è più 10-12% ma è solo 7,5%, un paese a medio livello di reddito che
968460	975680	cresce al 7,5% è molto di più che un paese povero che cresca al 10% perché è una dimensione ormai
975680	987780	che cambia la natura, cambia la natura del mondo e la cambia in modo profondo perché è un messaggio
987780	992920	di politica estradiverso da tutti quelli altri che abbiamo ricevuto, cioè nella storia dell'umanità
992920	1005660	la Cina è l'unico paese che esporta insieme beni, la roba che compriamo noi, capitali, investono da
1005660	1012940	voi e tecnologia, ce n'è mai successa nella storia dell'umanità questo evento e quindi dobbiamo
1012940	1020580	misurarla con un altro cervello e dobbiamo reagire e porci di fronte a questa sfida con una capacità
1021480	1032820	di innovare che potenzialmente noi abbiamo ma che dobbiamo esercitare con una politica forte e una
1032820	1040860	In questi anni questa politica europea c'è stata, formalmente sì, nella sostanza no perché l'unica
1041440	1050940	politica che è stata fatta è controllo dei bilanci, severità e cioè una politica profondamente
1050940	1058080	diversa da quella che era stata l'origine d'Europa e anche i nostri obiettivi quando abbiamo costruito
1058080	1066440	l'euro, i primi anni l'euro è andato bene, è stata una grande sforza perché ancora c'era il discorso
1066440	1076080	della politica di solidarietà con l'idea di uno sviluppo comune, quando con il canciller Col discutevamo
1076080	1081360	del fatto di stabilità io mi ricordo le lunghe conversazioni in cui dicevo bisogna affiancare la
1081550	1089730	politica comune, delle regole di bilancio comune, una solidarietà, un buon tesoro comune, la sua
1089730	1096090	risposta non era no come è stato invece dopo, la sua risposta era politicamente molto intelligente
1096090	1104190	io diceva questo è perfettamente vero, lo faremo, tu sei italiano e quindi sai che Roma non è stata
1104190	1110910	fatta in un giorno, noi lo faremo senz'altro, oggi mi devi dare respiro perché far abbandonare il
1111190	1117490	governo dei tedeschi è stata durissima e quindi c'è ben bisogno, però dopo è cambiato il mondo, sono
1117490	1125270	cambiati i dirigenti tedeschi, sono cambiati gli obiettivi degli altri paesi, l'europa è completamente
1125270	1131630	cambiata allora e parlo non di un secolo fa, parlo di dieci anni fa, era ancora fondata in un equilibrio
1133270	1140890	Francia-Germania, un'europa con un solo motore ma almeno due pistoni, e ha già dato il
1140890	1146870	pistone tedesco, è diventato così il pistone francese è diventato così e abbiamo avuto un
1146870	1155350	cambiamento radicale della politica europea per cui veramente il problema di ricostruire questa
1155350	1164490	unità esigerebbe una classe dirigente come quella che ha costruito l'europa in cui si poneva un
1164490	1172690	problema collettivo non un problema nazionale, è che è cambiata non è casuale questa è cambiata
1174550	1183470	sempre di più il modo di far politica, anche qui permettetemi per capire meglio che vediamo
1183470	1192110	una prospettiva cinese, discuterò di questi problemi con il ministro degli esteri del partito
1192110	1197290	comunista cinese cioè non il ministro degli esteri cinese ma quello che in Italia un tempo si
1197290	1208030	sarebbe detto dava la linea e questo mi diceva come fate voi ad affrontare i problemi di lungo
1208030	1215630	periodo della vostra società, la scuola, la sanità che avete le elezioni comunali, provinciali,
1215630	1223310	regionali, europee, nazionali, la mia risposta è noi siamo affezionati in fondo alle elezioni,
1224590	1231810	la sua contropria dice ma ci arriveremo anche noi però e qui veniamo alla sostanza dice vede quello
1231810	1245610	che noi osserviamo osserviamo è che per effetto di quegli accidenti lì no ipad delle previsioni
1245610	1255530	tutta la grande demoscopia no tutte queste analisi demoscopiche che noi facciamo ogni elezione è
1255530	1262170	diventato un'elezione di importanza nazionale e lo verifichiamo no quando ci fu l'elezione a Milano
1262170	1267390	cambiò l'umore basta l'elezione di una città l'elezione europee che non hanno cambiato il
1267390	1275590	parlamento nazionale però hanno cambiato totalmente l'atmosfera e quindi voi non il politico vostro
1275590	1284570	è obbligato a pensare soltanto a l'elezione successiva cioè per pochi mesi mentre i problemi
1284570	1290370	sono sempre di lungo periodo questo mi preoccupa molto perché diventa una sfida difficile per la
1290370	1300070	democrazia o noi diamo forza a nostra democrazia e infatti con un po' di ironia il ministro cinese
1300070	1305830	e professori sono molto preoccupato per il futuro della vostra democrazia grazie
1309190	1316530	però ecco attenzione che dobbiamo sempre prendere nelle lezioni della storia a capire che non sono
1316530	1322270	sciocchezze queste queste sono i grandi problemi che noi dobbiamo in qualche modo affrontare
1322270	1331510	proprio perché se esaminiamo la crisi europea quando è scoppiato il caso greco era una sciocchezza
1331510	1339350	era un problema morale fortissimo perché gregge hanno imbrogliato completamente ma
1339350	1348970	hanno imbrogliato perché quando costruimmo lo schema nuovo economico europeo il presidente
1348970	1355750	della commissione noi proponemmo con forza un'autorità che controllassi bilanci e la
1355750	1361550	francia la germania e l'italia si sono poste e si sono posti duramente dicendo no no questo è
1361550	1367290	un problema nazionale con il che evidentemente non essendo nessun controllore hanno imbrogliato
1367290	1373970	alla grande no ma detto questo però era un problema di 30 miliardi di euro abbastanza
1373970	1379610	grande ma il fondo della grecia è il 2 per cento del prodotto l'ordo europeo alla fine
1380630	1385450	quando c'erano delle lezioni regionali in germania nel nord tra i vestali in una regione
1385450	1391710	molto importante dicendo no i miei abitanti però una regionale regionale tre mesi dopo
1391710	1399130	nessuna decisione ha voluto prendere la cancelliera per non scontentare il suo elettorato i 30
1399130	1403370	miliardi sono diventati 300 perché nel frattempo la speculazione ha fatto il suo
1403370	1412270	mestiere ciò ha speculato e allora il problema è diventato ecco allora attenzione che questo
1412270	1418550	aspetto del dover del decidere in comune dell'affrontare i problemi di lungo periodo
1418550	1426550	con una capacità di parlare nel lungo termine di agire lungo termine diventa essenziale perché
1426550	1437450	l'europa possa giocare un ruolo un ruolo un ruolo nel un ruolo nel futuro e adesso lo
1437450	1443270	può fare finora lo può fare ancora perché è ancora la forza di fare anche se nell'europa
1445310	1452490	come vi come vi accena opim le differenzioni aumentano sempre di più cioè la Germania
1452490	1460650	è assai più forte di 10 anni fa e se prendiamo ad esempio la produzione industriale a manifattura
1460650	1470170	in senso stretto cioè senza l'utilizia senza le altre cose ma le fabbriche no diremmo in
1470170	1476130	Germania circa in questo momento il 25 per cento del prodotto nazionale l'ordo è fatto
1477070	1485050	costruito dall'industria manifatturiera in Francia e 10 in Gran Britannia siamo tra i 9 e i 10 c'è
1485050	1490510	una bella differenza e in Italia qui l'animale italiano è così strano in questo momento siamo
1490510	1502310	a 16 e 6 e da a rezzo alle Alpi diciamo così siamo come la Germania e il resto di Italia
1502310	1511990	ma noi non siamo fuori da questo tipo con una caratteristica però estremamente diversa
1512910	1520330	dagli altri cioè non abbiamo più grande imprese non abbiamo più grande imprese la Francia e la
1520330	1527250	Gran Britannia hanno solo grande imprese hanno perso il tessuto noi abbiamo ancora questo tessuto
1527250	1532830	ma le nostre grandi imprese sono a uno a uno sono crollate di fronte al governo nazionale quindi
1532830	1539570	abbiamo questo grande possiamo benissimo riferirci in Europa perché ripeto la rete c'è ancora ma la
1539570	1544810	dobbiamo rinforzare attraverso fusioni attraverso l'aiuto dell'impresa familiare attraverso tutta
1544810	1551450	la politica che in un territorio come a rezzo è immediatamente percepita come indispensabile
1551450	1560030	perché è chiaro che non si può agire come protagonisti del mercato europeo con imprese
1560030	1566750	che erano 5 o 6 addetti e il problema è un problema di politica industriale estremamente
1566750	1575670	importante ma ripeto attenzione nel descrivere l'Italia come un cane perduto non è mica vero
1575670	1586390	noi abbiamo ancora una nostra una nostra una nostra forza una nostra forza e naturalmente è chiaro
1589370	1599330	che la politica è il problema più serio che noi abbiamo di fronte cosa che è assolutamente possibile
1599330	1606970	cioè in questo momento non vedo proprio come economista non vedo perché la Germania
1607630	1620590	pese che ha un enorme surplus della bilancia commerciale, 280 miliardi di euro di attivo
1620590	1627390	della bilancia commerciale cioè l'attivo tedesco è a proporzione più forte di quello cinese
1627390	1632910	noi accusiamo la Cina di sbilanciare il quadro mondiale, poi ci accordiamo che abbiamo un Paese
1633610	1640430	Europeo che vive proprio sull'export naturalmente ripeto un attivo dato solo dalla sua virtù cioè
1641330	1647350	quando andate in giro per il mondo ormai l'auto di lusso è tutta tedesca hanno sbaragliato i
1647350	1653070	giapponesi hanno sbaragliato tutti e via via posso moltiplicare gli esempi di questo tipo
1653070	1660770	quindi è una forza che non è data dal vizio è data dalla virtù ma non c'è nessun bisogno di avere
1660770	1668790	un surplus così con una crescita bassa e una inflazione inesistente cioè ci potrebbe essere
1668790	1676230	anzi c'è spazio per una crescita maggiore, qui interveniamo proprio nella diversità delle
1676230	1683590	condizioni riguardo al futuro, in Germania l'ossessione per la inflazione è il sentimento
1683590	1693270	dominante cioè non vogliamo alimentare lo sviluppo economico più di tanto perché questo viene
1693270	1701210	percepito dagli elettori come un favore ai pesi periferici e come un rischio per la stabilità e
1701210	1710850	questo è profondamente inciso nella mentalità tedesca e questo sta costituendo un vero problema
1710850	1717030	all'Europa di per questo che è più alto proposto in questi anni dico ma io sono profondissimo
1717030	1724050	ammiratore della Germania proprio perché faccio mestire l'economista industriale quindi vedo
1724050	1730670	bene la differenza la capacità del sistema di agire ma nello stesso tempo vedo che se non
1730670	1736770	abbiamo politica noi non usciremo mai dal buco e che abbia politica vuol dire un accordo tra la
1736770	1744910	Francia, l'Italia, la Spagna e dopo le elezioni politiche ultime e dopo le difficoltà che ha la
1744910	1753170	Francia finalmente vedo che non c'è più quel senso di superbia, di diversità, di diversi elezioni
1753170	1760470	cioè ci sono le prospettive per poter fare una politica di ripresa in comune e non essere tacciati
1761070	1771990	di essere semplicemente inefficienti e incapaci e allora è chiaro che mi aspetto che questo si
1773810	1789270	possa attuare in un periodo di tempo abbastanza bene e certamente perché dico questo perché
1789810	1798910	quando mi volto indietro i risultati che ha avuto l'Europa sono impressionanti siamo usciti
1798910	1803550	da una guerra sfasiati, abbiamo costruito un'economia, abbiamo costruito la libera
1803550	1809610	circolazione dei beni delle persone, abbiamo costruito tutta una serie di regole comuni
1809610	1816150	dal punto di vista sanitario, dal punto di vista della armonizzazione della concorrenza insomma
1816150	1823550	abbiamo fatto cose che erano le tutte l'aspettate e anche se è difficile parlare ai giovani di questo
1823550	1829590	io non lo faccio quasi mai ormai parlare di pace perché ormai la pace viene ritenuta come un
1829590	1835670	fatto garantito ma guardate che non è mai successo dalla fine dell'impero romano in poi di avere
1835670	1841530	tre generazioni di pace in Europa i nostri genitori nonni, bisnonni, trisnonni si sono
1842850	1851650	scannati nelle guerre e questa garanzia di pace e di sviluppo anche se con le difficoltà è una
1853250	1858530	grandissima grandissima un grandissimo risultato e se non ci voltiamo indietro dobbiamo essere
1858530	1864830	orgogliosi naturalmente quando guardiamo avanti le critiche che ho fatto diventano di un'importante
1864830	1871270	impressionante per cui ritornando sempre agli studenti cinesi quando io spiegavo che l'Europa
1871270	1877890	è stato il più grande laboratorio politico della storia contemporanea e quando voi pensate che
1877890	1885030	lo stato moderno è fondato su due pilasti l'esercito e la moneta quando si mette la moneta
1885030	1891110	in comune si cambia la natura dello stato quindi dico l'Europa è stato il più grande laboratorio
1893590	1900330	della politica contemporanea ma adesso abbiamo delle enorme difficoltà e ho spiegato le
1900330	1906290	difficoltà si alza la storia e dice ma allora professore ho ben capito l'Europa è un laboratorio
1906290	1915630	o è un museo ecco il grande rischio il grande rischio che noi abbiamo di fronte cioè cose
