start	end	text
1915630	1930310	belle no ci voltiamo attorno cose meravigliose ma attenzione che non diventiamo un museo che non
1930310	1936270	grande rischio di un'Europa di un'Europa divisi molto spesso noi italiani proprio perché abbiamo
1936270	1943370	questo meraviglioso passato abbiamo questi monumenti pensiamo che questo possa essere
1943370	1948790	sufficiente per affrontare il futuro non è sufficiente per affrontare il futuro ti vuole
1949310	1958930	tecnologia unione politica ci vuole un modello organizzativo nuovo bisogna affrontare tutti i
1958930	1969130	questo e io in Europa vedo e qui concludo perché sennò dopo tolgo spazio alla discussione e poi
1969130	1978850	dopo alle 5 ho detto 5.33 ho detto 5.33 dobbiamo finire per i 27 minuti per andare a casa no e
1979190	1989230	voglio dire come ci presentiamo nel futuro di questo allora vediamo i punti interrogativi
1990230	2000610	il primo riguarda la Germania cioè paese leader non c'è dubbio ormai come forza economica e
2000610	2008810	soprattutto perché nella sua organizzazione produttiva tantissimi paesi vicino ad essa
2008810	2016250	sono diventati sub fornitori no legati strettamente alla pensiamo alla Polonia
2016250	2023870	la Repubblica Cecchia, la Slovacchia, i paesi baltici sotto molti aspetti anche la Serbia
2023870	2029690	eccetera sono diventati fortemente fornitori della Germania tant'è vero che uno dei nostri
2029850	2040210	problemi è che questi paesi hanno sostituito l'Italia in questo ruolo no ecco questa Germania
2040210	2048390	ha ancora una forte coscienza europea come aveva quando Colmi diceva i tedeschi non vogliono
2048390	2055630	l'euro ma io voglio l'euro perché voglio una Germania europea e non un'Europa germanica ogni
2055630	2063370	tanto vi pongo questo interrogativo proprio perché è il successo stesso che porta la tentazione
2063370	2070630	questa no e anche perché ormai vuole dire con l'indebolirsi dell'istituzione europea e della
2070630	2076370	commissione Obama non telefona a Bruxelles ma telefona a Berlino non telefona nemmeno
2076370	2083950	più a Parigi nemmeno a Londra questa è la cosa di grande interesse perché altro problema è cosa
2083950	2098850	fanno gli inglesi problema serissimo che sta danneggiando l'Europa in modo profondo perché
2098850	2106230	quando un paese fa addirittura indice addirittura un referendum come ha fatto la Gran Bretagna se
2106230	2113630	rimanere dentro o fuori da un'immagine d'Europa pensate mettetevi da punto di vista indiano
2113630	2123650	dell'india che per la sua storia vede l'Europa con l'occhio britannico lingua storia tutto e
2123650	2130790	vede che questo paese di riferimento farà un referendum se stare fuori o dentro che idea
2130790	2141390	può avere del futuro dell'Europa quale immagine queste sono le cose concrete no e Gran Bretagna
2141390	2152110	indetto questo referendum e quindi e naturalmente poi come sono gli inglesi hai detti referendum e
2152110	2160850	poi ti vengono continuamente a chiedere ma questa politica ci indebolirà o meno certo che ci
2160850	2165510	indeboliranno e quando è stato presente la commissione europea a Bruxelles pensavo di
2165690	2173390	in un posto in cui il comando burocratico era francese e tedesco mi sono trovati invece con
2173390	2182970	una forza burocratica inglese impressionante no cioè il funzionario britannico è davvero britannico
2183770	2188890	mentre i miei collaboratori francesi o tedeschi dopo tre giorni sapevo se erano democristiani o
2188890	2194890	socialisti eccetera io coi miei collaboratori del mio stesso gabinetto i collaboratori inglesi
2194890	2203010	ancora non so se erano laboristi o conservatori erano britannici no questa grande forza che gli
2203010	2213170	ha resi indubbiamente ora si va perdendo per cui proprio vedendo su quello che penso essere
2213170	2219690	il futuro dell'Europa io penso che l'Europa coglierà questa sfida andrà avanti perché
2219890	2229890	qualsiasi passo indietro distruggerebbe la sua struttura produttiva e immaginerebbe ancora
2229890	2242130	più nel mondo ma sarà un'Europa a più velocità perché io penso che la grandità non uscirà
2242430	2255730	dall'Unione Europea ma non ci starà a nessuna dei futuri processi di cooperazione comune quindi
2255730	2264350	ad agio ad agio sarà sempre membro del club ma con un ruolo sempre più bardiale allora probabilmente
2264620	2276800	andremo verso un'Europa a più velocità con un nucleo centrale che andrà come dicevo prima
2276800	2285420	verso una politica di maggior coesione maggiore ripresa ma con alcuni paesi che si accontenteranno
2285420	2295400	di vedere l'Europa come un'area commerciale e basta. Quindi avremo questo periodo di costruzione
2295400	2303980	faticosa e lenta proprio perché la velocità è già adesso una diversa velocità da paese a paese
2303980	2311260	ovviamente è chiaro che molte cose dipenderanno dagli esiti di questo referendum, molte cose
2311260	2320160	dipenderanno da tantissimi elementi ma certo l'ultimo, la presa di politica britannica dopo
2320160	2333100	le elezioni europee è quantomeno particolare perché mettere un veto su una persona, un passo indietro
2333100	2343240	La nuova regola del trattato di Lisbona dice che il presidente della commissione deve essere scelto
2343240	2351900	tenendo conto dei risultati delle elezioni, tenendo conto non è un concetto giuridico però
2351900	2361460	è importante soprattutto che cosa ha la conseguenza che siccome il Parlamento deve approvare e qui
2361460	2369920	c'è un fatto giuridico la nomina del presidente della commissione è chiaro che se voi violentemente
2369920	2379500	non tenete conto il Parlamento si inalbera e si riunisce. Il primo ministro britannico dicendo
2379500	2388240	no a Juncker cosa ha fatto? Ha obbligato le forze politiche europee a stringersi attorno a Juncker
2388240	2396180	Per cui dopo la dichiarazione di Cameron del primo ministro britannico il candidato Juncker è diventato
2396180	2404880	molto più forte che non prima perché diventa difficile accettare un veto così espicito mentre
2404880	2410940	se non ci fosse stato questo probabilmente una diplomazia più coperta avrebbe potuto portare
2410940	2416520	un compromesso, diciamo benissimo mettiamo un'altra presidenza però Juncker fra la presidenza del
2416520	2421760	Consiglio europeo un'altra ministra degli esteri cioè si poteva portare un compromesso quando
2421760	2430680	voi portate il conflitto in modo così aperto allora obbligate a una lotta frontale ed è quello
2430680	2437340	che sta avvenendo in questi giorni e questa è la chiave interpretativa di quello che sta venendo
2437340	2446500	in questi giorni a Bruxelles che ha obbligato la cancelliera tedesca a stringersi intorno a
2446500	2456940	in modo molto molto più freddo e questo è appunto un esempio di come la Gran Bretagna
2456940	2463720	abbia scelto agli ultimi tempi di svolgere una politica molto più autonoma rispetto
2463720	2470100	a altri paesi io credo anche per anche credo certamente per motivi di politica interna
2470100	2478440	perché i conservatori hanno tentato hanno continuamente sono continuamente corsi alla
2479520	2487320	soccorso cioè hanno voluto fare concorrenza agli antieuropeisti spostandosi verso una
2487320	2492520	politica sempre più scettica nei confronti europei in modo da assorbire il voto gli
2492520	2498980	antieuropei queste cose queste manove non riescono mai perché se uno è antieuropeo vota per l'antieuropeo
2499320	2506580	non è che vada a votare per i conservatori se queste si spostano più a destra diremmo no ed è
2506580	2512160	quello che è successo per cui ha radicalizzato la posizione britannica senza guadagnare voti
2512740	2520440	quindi si è indebolito e ha indebolito la posizione britannica naturalmente è chiaro
2521120	2528480	che tutto questo non può avere delle evoluzioni future perché gli inglesi hanno un senso della
2528480	2535300	politica talmente empirico da fare spavento sono stati nemici del mercato comune fino a che
2535300	2542160	non hanno capito che era il loro interesse entrarci e in tre giorni hanno deciso di entrarci quindi
2542160	2548340	cambiamenti politici possiamo sempre avere io faccio un'analisi di quello che oggi appare e di
2548340	2555920	come noi lo dobbiamo interpretare quindi ancora più e concludo davvero la necessità di una
2556240	2565040	politica di stringere assieme i partiti i paesi che hanno bisogno di una ripresa politica che
2565040	2573160	credono in una cooperazione europea per contare in qualche modo nel mondo e quindi la necessità di
2573160	2580200	una politica italiana francese spagnola che poi certamente viene seguita da altri in modo
2580200	2585340	avere una piattaforma di riprese e queste sono le osservazioni che volevo fare adesso nella
2585340	2591220	conversazione possiamo toccare tanti altri punti che ho lasciato al Mediterraneo di cui non ho
2591220	2598640	parlato l'Ucraina di cui ho fatto appena accenno cosa sta venendo no questi drammatici problemi
2598640	2607920	sono tornato gli altri giorni fa dal Niger e voi non avete idea di cosa c'è bisogna darci
2607920	2616120	di quello che sta succedendo quando un sindaco di una città in mezzo al deserto ti dice che la
2616120	2625240	popolazione aumenta ogni anno in un modo enorme soprattutto ormai l'equilibrio del deserto si è
2625240	2633800	rotto con la guerra in Libia è successo l'Ira di Dio ai nostri cittadini non riesca l'unica
2633880	2640280	alternativa è morire o scappare e quando c'è questa alternativa aspettatevi di tutto cioè
2640280	2645280	se noi lo leggiamo in un giornale così non ci facciamo attenzione in quanto ve lo sentite
2645280	2658760	dire sul luogo del sindaco pensiamoci a cosa sta succedendo no questi ma ripeto oggi dovevo
2659360	2665100	a questo quadro magari nella discussione se vi interessa possiamo poi allargarlo a
2665100	2676440	questi altri temi che colpiranno la prossima generazione ok terza domanda
2688920	2693240	può risparmiare la domanda un'altra domanda
2715620	2723280	ok allora sulla produzione fede quando io prima ho detto
2723280	2729040	non per nulla ho detto noi abbiamo la forza delle piccole e medie imprese non abbiamo più le
2729040	2736700	grandi imprese ora in piedi di automobili salvo quelle di lusso lusso lusso o sono grandi o non
2736700	2743460	esistono e non per nulla abbiamo questa grande riprese della Maserati, la Ferrari che però sono
2743460	2753260	una piccolissima parte del mercato e allora il problema non è un problema di automobili ma un
2753260	2759740	diverso struttura produttiva la nostra forza sono quelle che vengono chiamate le multinazionali
2759740	2768220	tascabili cioè imprese che vanno dai 100 milioni di euro di fatturato fino ai 2-3 miliardi che hanno
2768220	2780280	la specializzazione molto precisa tipici settori di meccanica strumentale moda di lusso o altri
2780280	2787500	settori in cui noi abbiamo una forza alcune aspetti anche di intermedi di chimica insomma
2787500	2793480	in cui noi abbiamo una forza allora per un paese come l'italia non abbiamo bisogno di agire in
2793480	2801080	tutti i settori abbiamo bisogno però nei settori in cui agiamo di avere la forza di un martello
2801200	2809920	questo è quello di cui noi abbiamo bisogno certamente l'automobile la mancare dell'automobile
2809920	2817880	pesa sulla nostra bilancia commerciale pesa moltissimo e quindi purtroppo mi tocca dare
2817880	2825820	ragione ma nonostante questo vorrei sottolineare che noi abbiamo un leggerativo nella nostra
2825820	2836040	bilancia commerciale quindi non siamo fuori dal giro e lo abbiamo dovendo importare tutte
2836040	2844300	le materie prime e tutte le materie per l'energia quindi ripeto dobbiamo approfondire le nostre
2844300	2853300	specializzazioni e questo se lo facciamo bene ci rende sufficienti naturalmente rimane il
2853300	2867320	nord sud che purtroppo immutato ripeto immutato da 40 anni qua e dovremmo aprire una lunga
2867320	2875540	parentesi formazione giovanile qui il discorso è molto ne faccio una doppia selezione dal punto
2875540	2886600	di vista qualitativo comparativo devo dire che noi non abbiamo accerto una scuola da buttare via
2886600	2894500	perché abbiamo un enorme numero di laureati che migra e fanno tutti successo tutti insomma cioè
2895540	2900940	si affermano all'estero bene insomma io qui ho un'esperienza personale anche molto forte
2900940	2905640	di vedere come i nostri studenti comunque qualcuno può anche dire che vanno via i più
2905640	2912380	intraprendenti forse migliori ma certamente hanno un ruolo che cosa però noi stiamo facendo di
2913120	2920660	pericoloso per il nostro futuro sviluppo riguardo alle risorse umane cioè stiamo trascurando la
2920660	2928440	scuola tecnica la scuola applicata l'ingegneria hai più cioè la scuola applicata a tutti i più
2928440	2936800	io in questo sono chiarissimo brutale fino alla provocazione io darei premi darei incentivi
2936800	2943300	anche finanziare gli studenti scuole tecniche andrei anche agli ingegneri delle facoltà applicate
2943300	2950700	perché questi hanno questi ne abbiamo bisogno per il nostro futuro non c'è niente da fare l'italia
2950700	2958180	il boom italiano che quando ci è stato l'hanno fatto non gli economisti non gli avvocati hanno
2958180	2963420	fatto i periti e hanno fatto gli operari speciali dati e gli ingegneri e non c'è niente queste
2963420	2975520	sono le regole dello sviluppo piaccia o non piaccia ecco questo è questo e questo vale a
2975520	2984140	qualsiasi livello per cui la ripresa di un apprendistato scientificamente seguito è
2984140	2991200	un'importanza enorme cioè quando io vedo che in germania c'è la gara tra i panificatori con
2991200	2999540	la medaglia no perché ci sono queste cose di riconoscimento sociale è importantissimo
2999540	3007900	mentre invece se voi sentite a fondo nella maggior parte dei genitori c'è l'idea che ormai la scuola
3008220	3016760	sia per i figli dei migranti se noi ci mettiamo in questa linea siamo un paese finito ecco questo
3016760	3022560	è quello che io brutalmente penso non voglio usare mette parola perché è quello che penso fino in
3022560	3032180	fondo fino in fondo la terza domanda presidenza europea la presidenza europea ha il compito più
3032180	3040380	forte quello di cambiare la politica economica e cioè quello di cercare un'alleanza sufficiente
3040380	3045980	perché in politica non c'è da fare inoltre chiedere l'elemosina in politica perché politica
3045980	3052240	non ve la fanno cioè tutti gli appelli a dire la Merkel deve cambiare politica la politica
3052240	3061460	non la cambia perché perché ma spiegatemi voi come mai la germania è l'unico paese in cui gli
3061460	3070320	proscettici non hanno fatto strada e lei si è tenuta l'elettorato con leggerissima marcia indietro
3070320	3077420	ma tranquilla i partiti elettorali hanno tenuto benissimo rispetto agli altri paesi semplicemente
3077420	3086060	perché il ruolo di riassicurare diciamo così l'identità nazionale l'ha ricoperta il governo
3086060	3093740	e quindi pretendere che uno cambi politica da un giorno all'altro se non c'è una coalizione
3093740	3102040	che la fa cambiare è sbagliato è ideale ma è politicamente inadatto quindi quello che io chiedo
3102940	3105140	alla presidenza italiana è quella di
3140320	3144620	ecco rispondiamo subito a questa a questo
3146240	3154980	guardate state attenti perché in europa in tutta la fase fino a pochissimi anni fa si
3154980	3161780	sono sviluppati più le economie periferiche quelle povere che quelle ricche cioè c'è stata
3161780	3167020	un'intera generazione europea dall'altra parte l'italia ne è stata una prova quando
3167020	3175180	sono entrati nel mercato comune abbiamo avuto degli anni di fortissimo sviluppo quando c'è
3175180	3186520	sono cresciuti più degli altri quindi non è non è vero che c'erano delle più velocità virtuose
3186520	3193840	per un lungo periodo di tempo e anche proprio una dei vanti dell'europa era che quando si
3193840	3198740	mettono insieme zone ricche zone povere di solito i ricchi diventano più ricchi poveri
3199420	3207240	mentre l'europa le correzioni avevano evitato questo adesso non è più così ma in un modo
3207240	3213380	molto diverso perché quelle attorno alla germania anche se sono nuovi stanno crescendo ed è il sud
3213380	3230520	dell'europa che è a tassi di velocità molto molto più bassi ma però questo non non è un
3230520	3236140	fatto fatale questa nuova cosa è un fatto che deriva da una politica e per questo che vi dico
3236350	3244930	se c'è un raggruppamento politico che pone un'alternativa si cambiano i risultati della
3244930	3253190	si cambiano i risultati della politica e naturalmente ripeto ci vuole una volontà politica
3253190	3266330	quanto all'altra domanda investire sui giovani a livello europeo vedete negli ultimi tempi
3268630	3277290	questa idea di una politica comune di investimento sulle nuove generazioni si è affievolita fortemente
3277830	3287150	pensate che una ricordo forse l'ultimo dibattito nella commissione europea quando era ancora
3287150	3298790	presidente è stato un interesse quasi emotivo in cui da un lato soprattutto la parte britannica
3298790	3306170	si diceva ma in europa non si può andare avanti in comune perché manca il demos manca lo spirito
3306170	3313870	comune poi proseguendo nella decisione avevamo messo l'ordine del giorno l'aumento dei fondi
3313870	3323050	per l'erasmus che lo spirito comune lo si crea facendo incrociando gli studenti anzi volevo
3324410	3331470	estenderlo anche ai lavoratori no cioè a coloro che soprattutto i giovani che erano in via di
3331470	3338910	specializzazioni potessero ora si l'hanno fatto 10 anni dopo e poi ancora non è messo in atto e
3339190	3346430	immediatamente c'è stata un'opposizione totale del nord mi ricordo fu la svecia in quel momento
3346430	3355130	e la gran bretagna dicendo ma questi sono soldi sono soldi sprecati ora è chiaro che non era la
3355130	3362070	ragione della politica non era una ragione cioè di rallentare questo processo di integrazione
3362070	3368370	nuove generazioni questo è indispensabile e guardate che è una sfida difficile per cui ci vuole tempo
3368370	3375210	io non mi scandalino pensate solo al problema delle lingue anzi ci sono 22 adesso mi ricordo
3375210	3386290	più sono 22 23 lingue diverse quando c'è stato l'allargamento è improvvisamente da 12 lingue
3386290	3394050	siamo passati a 22 no da 14 a 22 lingue no e mi sono trovato immediatamente nella situazione
3394390	3404950	di non poter più usare gli interpreti bionicci perché avremmo avuto bisogno di 22 molti piccato
3404950	3414670	n molti piccato n-1 interpreti cioè ogni seduta parlamentare c'era bisogno di 21 per 20 o 22
3414670	3422250	per 21 420 interpreti non è più possibile allora abbiamo adottato pensate la difficoltà il sistema
3422250	3428790	sovietico della lingua pivu noi le unioni sovietiche quando facevano le assemblee c'era dal
3428790	3436130	casaco al russo e dal russo all'ucraino no abbiamo dovuto adottare questo sistema cioè dal maltese
3436130	3444570	all'inglese e dall'inglese allo svedese perché altrimenti non era più fattibile e queste sono
3444570	3451570	la grandezza d'europa e di dovere andare contro la storia delle divisioni io lo sforzo che abbiamo
3451570	3458990	fatto per avere un libro di storia europea non ci siamo riusciti perché per i ragazzi tedeschi
3458990	3465170	i ragazzi francesi non c'è possibilità di avere un libro di storia comune non c'è alcuna possibilità
3465810	3471010	noi abbiamo un passato così no è per quello che dobbiamo guardare dobbiamo guardare al futuro
3471010	3477530	anche il famoso problema che mi sono trovato di fronte alla al mettere nella costituzione
3477530	3485410	le radici cristiane non sono trovato di fronte all'opposizione breghe francese durissima ma non
3485410	3492510	per anticristianesimo ma perché erede della costituzione erede della rivoluzione francese
3492510	3500030	cioè il passato pesava in modo da non potere guardare al futuro mi ricordo quando diceva
3500030	3507690	proviamo questo emendamento in modo da poter e questo dice tiri in tasca queste emendamenti
3507690	3514650	perché la costituzione me le permette per fortuna poi con un gioco fatto con amato con
3514650	3521990	molta intelligenza abbiamo inserito nell'articolo 52 la cooperazione pratica delle crisi nessuno
3522070	3531970	opposto no cioè quando per venti secoli ci siamo scannati gli uni con gli altri non
3531970	3539190	possa mica pensare che sia facile il processo il processo di revisione ci vuole tempo ci vuole
3539750	3544230	appunto le nuove generazioni ci vuole il senso della cooperazione ci vuole e noi dobbiamo
3545150	3554390	questo perché se no ripeto veniamo cancellati dalla carta geografica ecco l'ultima risposta
3555710	3561790	è la difficoltà dei finanziamenti europei però gli altri paesi ci riescono quindi le
3561790	3568230	difficoltà sono sono della nostra burocratia qui dovrei aprire la parentesi perché io penso
3568230	3574850	fermamente che il più grande ostacolo allo sviluppo italiano sia la complessità delle
3574850	3585230	nostre leggi e la burocratia che impedisce di prendere decisioni in tutti i campi della
3585230	3595870	nostra economia cioè non è l'alto costo del lavoro il costo orario il costo orario
3595870	3601250	del lavoro è nettamente inferiore a quello tedesco ma molto inferiore un po' inferiore
3601250	3607030	a quello francese un po' superiore a quello spagnolo ma ci collochiamo bene è il problema
3607030	3613110	che anche lì ci sono strutture burocratiche sindacali difficoltà di confronto cioè il
3613110	3621770	paese è spezzato questo è il problema no quando per scusate e poi finisco davvero
3621770	3630210	quando per utilitare un fondo europeo per una ricerca la maggior parte del lavoro è compilare
3630210	3639510	i moduli perché noi abbiamo poi il tutto fatto in modo complicato e nella sfiducia rispetto
3639510	3649290	al cittadino è chiaro che questo rende vanno gli sforzo e nessuno straniero viene a investire
3649290	3655610	noi se non per comprare un marchio o una roba che già esiste ma nessuno fa le cose nuove in
3655610	3661810	italia perché troppo difficile troppo complicato quando la sentenza ci vogliono dieci anni ma chi
3661810	3668330	è che ha più questa pazienza quindi il problema in questo caso il problema è un problema nostro
3668330	3673710	proprio italico italiano speriamo che almeno di riscattarci contro l'uruguay
3683850	3687010	con questo con questa auspicio ma
