start	end	text
7580	15500	Grazie a tutti, un abbraccio a ciascuna di voi, grazie di cuore, è vero siamo in tanti,
15740	22160	siamo tantissimi, siamo qui con Forza Italia per dare forza all'Italia, per dare forza
22160	23340	alla libertà.
33420	41860	Ho il cuore pieno di commozione per gli abbracci, per i basci, per le strette di mano, per il
43100	45220	rossetto che mi avete regalato.
50100	58240	Ho sentito l'abbraccio e mani forti di chi ha tanto lavorato nella vita, di chi ha fatto
58240	64200	tanti sacrifici, di chi ha tanto sofferto e che oggi si trova per quel che la storia
64200	73400	ci propone ancora a dovere combattere per difendere il proprio benessere, il futuro
73400	78940	dei propri figli, dei propri nipoti per difendere la libertà.
79200	91760	Noi siamo qui oggi in questo abbraccio caloroso, forte, entusiasta, siamo qui per una giornata
91760	99880	di lavoro, di riflessione, per fare il punto sulla situazione del nostro Paese, per decidere
100480	109060	ciò che tutti insieme, ciò che tutte voi potrete fare, potremo fare per garantire al
109060	113120	nostro Paese un futuro diverso da quello che qualcuno vorrebbe dargli.
114140	122080	Abbiamo una giornata davanti a noi intensa, una giornata di lavoro, ma prima di cominciare,
122080	130900	visto che purtroppo questa nostra riunione è caduta in un momento terribile, prima di
130900	137860	cominciare dopo l'entusiasmo, dopo la gioia, dopo il sorriso che ha connotato questo nostro
137860	149200	inizio, questa fusione di tutti noi riscaldata da queste parole, da queste note di forza
149200	159820	e di libertà, io penso che noi non possiamo esimerci da riflettere per un minuto su ciò
159820	169720	che contro ogni aspettativa, contro ogni modernità, contro ogni sentimento di democrazia, di libertà
169720	182020	Oggi sta accadendo in una terra dove due milioni di persone vivono una situazione drammatica.
182340	191800	Quattrocento mila profughi, madri, nonne, figli, bambini, dispersi sui monti che strano tra
191800	202280	il Cosovo, la Macedonia, l'Albania. Quarantamila uomini della Serbia, trecento car armati ad
202280	208160	inseguirli, a cannoneggiare le loro case, a buttarli fuori dalle loro case, a distruggere
208160	213840	delle pattuglie che addirittura segnano, triste ricordo di quando si segnavano così le case
213840	220240	dellebrei, questa volta segnano le case della minoranza serba affinché quelle case con la
220240	228640	roccia ortodossa vengano rispettate, delle altre si può fare di tutto, campi di concentramento,
229540	240360	deportazioni, stupri, decapitazioni, violenze disumane ed inerrabili e dall'altra parte,
243020	251840	degli innocenti che subiscono la decisione di un dittatore nazionalista che ha un'idea folle
253420	259600	della sua volontà di fare della Serbia una grande nazione dominante dell'interio Jugoslavia e che
259600	266400	per questa idea folle compie questi misfatti, semina questo terrore, questo dolore, questa morte.
267160	276360	Io vi invito ad alzarci in piedi tutti insieme per un minuto di raccoglimento rispettoso di
276360	284960	quelle angosce, di quel dolore, così esprimiamo tutti insieme la nostra vicinanza a chi soffre,
286000	295180	la nostra pietà, la nostra promessa di adoperarci affinché questo non possa e non debba più succedere.
315380	321220	E terminiamo questo momento di riflessione con una promessa. Noi qui, quanti siamo tutti insieme,
321220	329680	tutti noi azzurri, azzurra di Forza Italia, quando ci sarà una migrazione di chi fugge dalla guerra e
329680	337420	dalla morte, noi faremo di tutto per accoglierli degnamente come si merita chi è in una situazione
337980	351200	così terribile. Ed ora riprendiamo, senza dimenticare che siamo qui anche
351200	357800	per combattere queste situazioni possibili dovunque, perché la libertà, ricordiamocelo
357800	366840	sempre, ce lo dobbiamo ricordare in ogni momento, la libertà non è qualcosa di cui si avverte
366840	372560	l'importanza interamente quando la libertà c'è, anche quando c'è una libertà minore,
372700	380800	una libertà condizionata, una libertà ferita. La libertà è come l'aria, si capisce l'importanza,
380800	389080	l'indispensabilità che è all'aria quando ci manca, questo vale anche per la libertà. E noi
389080	398360	oggi siamo qui proprio per dare un'altra spinta alla costruzione di questo nostro movimento civile
398360	407180	a cui il mondo femminile, a cui le donne hanno apportato un grande contributo già sin dall'inizio
407180	415080	con il richiamo ad un linguaggio diverso da quel linguaggio che si usava nella politica. Già nel
415080	423120	94 quando scendemo in campo il nostro linguaggio fu il linguaggio di tutti i giorni, fu il linguaggio
423120	436540	comprensibile, chiaro a tutti e venne rappresentato da chi a me stava vicino, da chi stava vicino a
436540	445020	le nostre madri, dalle nostre figlie. L'ancoraggio della politica, qualcuno disse la politica
445020	453660	declinata al femminile, l'ancoraggio della politica ai problemi concreti, ai problemi concreti della
453660	461860	gente, ai problemi della famiglia, delle madri, dei figli. Credo che sia stato un grande apporto,
461860	469420	credo che Forza Italia si distingua dalle altre forze politiche anche per questo, per la sua
469420	477820	concretezza, una concretezza che lo dico in maniera esplicita, in maniera chiara è dovuta al fatto che
477820	487620	Forza Italia sin dall'inizio ha avuto un'anima, un'anima che ha trovato nella partecipazione femminile
487620	508100	la sua espressione più profonda e più convinta. E Forza Italia oggi sta diventando, è già,
510060	516860	la forza politica più importante del Paese, non azzardo numeri, ma tutti i sondaggi che
516860	523780	facciamo con diversi istituti di ricerca ci dicono che siamo di gran lunga la prima forza politica
523780	536340	d'Italia e le elezioni europee del 13 giugno sanciranno questo primato e scolpiranno la differenza
536340	543980	che ci sarà tra noi e il secondo partito italiano e io credo che sarà una differenza importante che
544220	556060	autorizzerà a svolgere un ruolo di guida in questo Paese. Forza Italia si sta organizzando,
557000	566260	prima di voi abbiamo svolto un'altra assemblea, l'assemblea di coloro che hanno lasciato dietro di
566260	573880	sé 60 anni di vita che si inoltrano in quella che deve essere l'età della serenità, l'abbiamo chiamata
573880	582560	l'età d'oro, una volta a 60 anni non c'era un orizzonte davanti, oggi la biologia, la chirurgia,
583620	593040	la medicina danno a chi ha la mia età una prospettiva di vita per altri 40 anni. Nel passaggio
593040	602880	del secolo le prospettive per arrivare attivi ad essere centenari sono numerose, ci speriamo tutti,
603840	616200	e abbiamo chiuso quella assemblea dicendo non vogliamo soltanto aggiungere vitalità,
616800	623460	agli anni vogliamo aggiungere anni e agli anni vogliamo aggiungere i nostri anni anche tanta
623460	633040	serenità e tanta libertà. Abbiamo chiesto, ho chiesto ai tanti azzurri azzurre che ho chiamato
633040	641940	i ragazzi e le ragazze del 48, nel 48 noi c'eravamo e abbiamo nella nostra memoria storica preciso
641940	649180	il ricordo dei rischi che il nostro Paese corse si trattava di decidere se stare di là o di qua,
649980	655960	avremo per fortuna dei grandi italiani, i nomi li conoscete, dei Gasperi, i Naudi, la Malfa,
656180	662320	Saragata, Pacciardi, che si èppero stringere intorno a loro tutti gli italiani che non si
662320	667940	fidavano di chi non era mai stato uomo di libertà, non si fidavano in parole esplicite dei comunisti
667940	683460	e non volevano essere governati dai comunisti. E l'Italia, quel 18 aprile del 48, io lo ricordo
683460	690140	benissimo perché andavo ad attaccare dei manifesti che avevano su una parola magica, libertas,
691460	697840	una parola che mi è rimasta nel cuore, una parola che vale ancora adesso, come abbiamo visto e come
697840	704160	sentiamo nel profondo del nostro cuore, venne fuori una squadraccia degli altri, ci picchiarono,
704240	709660	mi picchiarono, tornai a casa, mi picchiò anche mia madre perché non credeva a quello che le
709660	720100	raccontavo. Da quella 1948 ad oggi la nostra memoria è rimasta molto precisa su questo punto e quindi
720100	726440	chi ha la mia età sa bene che non ci si può fidare di chi è rimasto nell'errore tutta la
726440	732320	vita perché guardate che costoro, non si sono fermati nemmeno un minuto, non si sono voltati
732320	740780	indietro a guardare il loro passato, altri hanno avuto un momento, un luogo di riflessione, hanno
741420	748980	criticato se stessi le loro posizioni, questo non è dei comunisti italiani e molti di loro ancora
749800	755520	orgogliosamente si vogliono chiamare comunisti, hanno ironizzato a lungo su di me quando per
755520	761300	primo, vi ricordate che la parola comunista nel 94 sembrava una bestemia, sembrava che chi la
761300	770060	pronunciasse fosse un uomo con la testa rivolta all'indietro, un uomo del passato, un retrogrado,
770860	776820	ebbene i fatti mi hanno dato ragione, ecco lì la scissione di rifondazione comunista, si parlava
776820	783700	sempre di rifondazione e non di comunista, ecco lì venì fuori un altro partito che si è orgogliosamente
783700	792020	ripeto, coerentemente chiaramente chiamato il partito dei comunisti italiani, ma anche chi oggi
792020	799580	milita in quel partito che continua a cambiare nomi, marchi, simboli, sigle, ma è costituito
799580	805460	sempre dagli stessi uomini che si incontrano sempre nelle stessi sedi, più vuote di prima
805460	814540	certamente, ma sono le stesse sedi quel PC, PDS, DS, anche gli uomini di questo partito che oggi
814540	822340	hanno la responsabilità massima nel governo del Paese, anche questi uomini hanno pochi mesi fa,
822540	831860	prima di assumere la responsabilità di governo, dichiarato di tenere orgogliosamente nel cuore il
831860	840060	simbolo che tutti noi invece sappiamo ha insanguinato il secolo, perché mai nella storia dell'uomo si era
840060	853340	dato di un'idea così folle che ogni volta che fosse al potere suscitasse addirittura la guerra
853340	860140	degli uomini di potere contro il loro popolo, nel desiderio di cancellare l'identità storica,
860140	867080	la memoria storica nel desiderio di forgiare l'uomo nuovo del comunismo e la montagna di morti che
867080	876860	questo è costante di morti innocenti la conosciamo e sappiamo bene che quest'idea è un'idea opposta
877520	888660	alla nostra idea dell'uomo, quella del valore infinito della persona umana, è un'idea che abbiamo
889860	897940	nel nostro intimo, nel nostro profondo, è l'idea liberale, è l'idea cristiana dell'uomo, della società e
897940	905660	dello state e questa sera prima di salutarci io vi chiederò qualche minuto di attenzione in più
905660	913720	proprio per ritornare tutti insieme su ciò che ci fa essere qui, su ciò che ci fa essere nel campo
914240	920120	degli interessi nel campo della cosa pubblica perché è proprio questo che a loro ci oppore, noi siamo
921020	927640	stati costretti a lasciare ciò che ci facevamo, che facevamo bene, che ci piaceva proprio perché
927640	934440	temevamo che una certa concezione dell'uomo, della società e dello stato potesse prevalere e imporsi
934440	942340	nel nostro Paese è una concezione, ripeto, opposta alla nostra, è una concezione che nega i diritti
942340	949440	fondamentali dell'uomo che vede nello stato il culmine della piramide della società e che fa sì
949440	955860	che lo stato sia il padrone dell'uomo, che i cittadini siano ridotti al grado di servitori
955860	963820	dello stato. Noi siamo in campo perché temevamo, temiamo che questo possa cadere, temiamo per noi,
963820	975300	per i nostri figli un futuro soffocante e illiberale. Abbiamo perciò con gioia dato il via all'organizzazione
975300	981140	del nostro movimento, vi ricordate che volevamo mantenerlo soltanto un movimento di opinione,
982180	988620	soltanto due anni fa dopo i risultati delle elezioni del 96 abbiamo preso, abbiamo dovuto
988620	998400	assumere la decisione di darci un'organizzazione. Perché? Perché vincemmo le elezioni sulla scheda
998400	1005680	proporzionale, le perdemmo, ma le perdemmo nel maggioritario perché ci furono annullate
1005680	1019160	1.705.000 schede. E comprendemmo allora che affinché non avvenissero distorsioni rispetto
1019160	1024680	al voto, alla volontà degli italiani, dovevamo essere presenti, attivamente presenti nelle
1024680	1031300	sezioni e nei seggi elettorali affinché l'antica professionalità degli altri nei
1032200	1043300	potesse prevalere e cambiare il risultato del voto degli elettori. E allora ecco la decisione
1043920	1053020	di organizzarsi, una decisione anche sofferta, perché molte volte Forza Italia si impersona
1053020	1060560	in una provincia, in un comune, in qualcuno che magari è lì e non è lì soltanto perché
1060560	1066560	crede nei principi, nei valori, nei programmi di Forza Italia, ma è lì magari spinto
1066560	1071640	da una sua personale ambizione. Qualche volta abbiamo anche temuto, ce lo siamo detti spesso
1071640	1077500	io e Claudio, Claudio Scaiola, i responsabili, attivissimo e validissimo, che lavora alla
1077500	1085600	organizzazione di Forza Italia. Non vogliamo che Forza Italia diventi un marchio quasi
1085600	1092160	un franchising che qualcuno possa utilizzare soltanto per proprie ragioni personali. Ma
1092920	1099740	attenzione, questo non sarà possibile, vigileremo, tutti insieme vigileremo e quando questo dovesse
1099740	1105400	succedere il nostro statuto ci dà la possibilità di intervenire, intervenire come fece Gesù
1105400	1115580	nel tempio cacciando i mercanti dal tempio, dove ve ne fossero e conservando integra l'idea
1116360	1123960	e il fondamento ideale di Forza Italia e questo vi assicuro siamo decisissimi a farlo e l'abbiamo
1123960	1134180	fatto già numerose volte. E allora ecco che Forza Italia si è data 113 congressi provinciali,
1134420	1140700	ecco che Forza Italia ha appena concluso 2000 congressi comunali per l'esigenza di avere
1140700	1147280	un'organizzazione localmente che lavori, che faccia respirare la presenza di Forza Italia
1147280	1153700	dai muri con delle campagne continuative, di manifesti che rappresentino le nostre idee,
1154020	1163760	i nostri programmi con una presenza di convincimento degli altri. Parleremo oggi pomeriggio di
1163760	1169280	ciò che si può fare, di ciò che io mi attendo che voi facciate con la vostra capacità di
1169280	1175340	l'organizzazione, con la vostra costanza, quei convegni che abbiamo chiamato convegni
1175340	1181480	permanenti in giro tra la gente, dove noi possiamo chiamare il numero più elevato di
1181480	1186980	cittadini possibile e a loro raccontare che cosa pensiamo noi, qual è la situazione in
1186980	1194940	Italia della scuola, della giustizia, del mondo del lavoro, delle tasse e dire a loro
1194940	1201940	i nostri programmi ciò che noi faremo, ciò che noi tradurremo in azione politica quando
1201940	1223040	torneremo a governare il Paese. E allora occorre organizzarci. Dopo i Signores avremo a maggio
1223040	1230380	a Napoli l'1 e il 2 maggio la prima Assemblea nazionale dei giovani di Forza Italia che
1230380	1237180	porteranno a Forza Italia il loro entusiasmo, la loro freschezza, perché no, la loro allegria.
1238440	1244200	E quindi concluderemo e questa manifestazione, questa prima manifestazione delle Azzurre
1244200	1252120	oggi qui tutti insieme che porta a Forza Italia lo sappiamo, lo sappiamo benissimo e io sono
1252120	1258800	qui oggi più che per dirvi cose, ve le dirò, perché credo che sia anche questa un'occasione,
1259160	1265220	per sapere bene che cosa intendiamo fare, qual è il giudizio che noi diamo della situazione
1265220	1271200	italiana, è così difficile comunicare, i giornali stanno quasi tutti dall'altra parte,
1271960	1279960	le televisioni rappresentano spicchi di frasi, è così difficile fare un discorso completo
1279960	1291200	articolato che cominci e finisca in maniera logica, completa e coerente. Ebbene, allora
1291200	1299600	oggi noi saremo qui, io profiterò di questa occasione per raccontarvi anche quali sono
1299600	1304920	le nostre visioni di ciò che sta succedendo in Italia, ciò che noi ci apprestiamo a fare,
1304920	1313240	ma anche sono qui, direi, sono qui soprattutto per ascoltare, per ascoltare, per approfondire,
1313680	1321100	per capire ciò che chi ha già tra voi posti di responsabilità. Quello che sta succedendo
1321100	1325820	da voi e voi lo vedete bene, tante parole, tante promesse, fatti pochissime, io vi riconoscio
1325820	1331480	niente, più roba è da comportarli veramente, grazie, grazie tanto, buonasera.
1338760	1343940	Buonasera, sono la coordinatrice delle donne azzure della Valle d'Aosta, sono qui da sola
1343940	1348900	perché la regione Valle d'Aosta è la regione più piccola d'Italia. Mi ero preparata un
1348900	1355880	lungo discorso sull'Unione Valdoteno che è il partito di maggioranza assoluta e despota,
1356660	1362720	voglio solo ricordarvi questo, noi siamo l'ultimo baluardo in Italia che cerca di combattere
1362720	1368220	un regime che da noi ormai è diventato filo comunista. Le crediamo solo una cosa signor
1368220	1375160	Presidente, l'onorevole Hermosino ci ha reso molto felici con le sue frequentazioni piuttosto
1375880	1381800	numerose in Valle d'Aosta, le chiederemmo il suo aiuto per non sentirci soli, perché
1381800	1386720	in Valle d'Aosta siamo completamente soli, veniamo tutti i giorni quotidianamente attaccati
1386720	1393820	da mass media e da coloro che, votando l'Unione Valdoteno, temono non votandola più di perdere
1393820	1398900	i privilegi, il chientelismo è il nostro male quotidiano. Le chiediamo un aiuto perché
1398900	1406020	siamo in pochi ma vogliamo lavorare seriamente per portare una cultura liberale e democratica
1406020	1415800	anche nella nostra regione. Vi ringrazio. Veneto, Letizia Ortica, era praticamente il
1415800	1424480	vostro coro, abbiamo chiuso. Grazie al Presidente che viene sempre in Veneto, vi faccio rabbia,
1424640	1430500	ecco finalmente. Sì, ma dobbiamo spiegare perché in Veneto abbiamo perso la maggioranza
1430500	1437260	per l'Italia, perché in Veneto la presenza della Lega ci ha fatto perdere tutti i deputati
1437260	1444440	e i senatori e sono stati quei numeri che erano nostri nel 94 che ci sono mancati per
1444440	1451260	ritornare ad essere maggioranza in Parlamento. Ora, siccome non c'è un'altra regione italiana
1451260	1460900	per la quale il nostro programma sembri così scritto, proprio come è scritto per l'economia
1460900	1467240	Veneta, per il modello Veneto, io non so darmi pace che i cittadini del Veneto non possono
1467240	1474420	rendersi conto di questo fatto, che i loro interessi sono difesi dal programma di forza
1474440	1480620	in Italia. Non posso davvero continuare ad accettare che siano obnumilati nella mente
1480620	1487360	al punto tale da continuare a dare alla Lega di Bossi una preferenza che ci fa perdere
1487360	1495480	le elezioni in Italia. Il Nord è una grande forza, la Lega ha diviso in due questa forza,
1495660	1499860	ha reso deboli moderati del Nord, abbiamo perso le elezioni. L'ho detto stamattina,
1499860	1506540	lo ricordo ancora, proprio per questo noi siamo minoranza e l'unico risultato che la
1506540	1511580	Lega con i voti dei Veneti ha riuscita a centrare è stato quello di consegnare il governo del
1511580	1516500	Paese alla sinistra. Io ho promesso in Veneto di essere là un giorno alla settimana, sinora
1516500	1524140	ho mantenuto la promessa. E noi donne con tutti i nostri contatti, perché noi ne abbiamo tanti,
1524220	1528740	tanti più degli uomini, perché noi abbiamo i contatti con la scuola, con i mercati, con
1528740	1535480	gli insegnanti, con i medici, andiamo a fare le spese. Noi possiamo diffondere questo messaggio
1535480	1540380	di Forza Italia e possiamo finalmente far capire alla gente della Lega che sta sbagliando.
1540620	1545940	Grazie Presidente e grazie Maria Teresa Armosino, perché loro hanno voluto lucidare la lampada
1545940	1552700	rosa e sono usciti tutti i geni e qui veramente noi vinceremo la prossima volta. Noi nel
1552700	1557040	Veneto stiamo facendo tantissimo, soprattutto dal punto del vista dell'entusiasmo. Ecco
1557040	1562040	qua il coro. Questo è importante, perché se non si ha un atteggiamento positivo dentro
1562040	1569200	non si riesce a ottenere niente. Per realizzare un sogno nella vita bisogna crederci. Crederci
1569200	1577320	e lo può fare. Credere da indefacere. Grazie a tutti, noi i progetti ne abbiamo fatto. Vogliamo
1577320	1584340	fare adesso il punto azzurro, cioè in tutte le città creare un locale piccolo in centro
1584340	1589260	in maniera che tutti possano avere un posto dove andare per Forza Italia, solo a chiedere
1589260	1596680	le tessere, a chiedere un'informazione. Noi l'abbiamo già fatto prima come assistenza
1596680	1602680	legale gratuita, come assistenza per il lavoro, eccetera. Ecco, non vi dico altro perché
1602680	1611180	il tempo non lo consente. Le mie responsabili tutte belle vestite in giacca blu, anche in
1611180	1615100	oro. Immagine Veneto. Il coro più elegante di Italia, diciamolo chiaro. Benissimo.
1620120	1628880	Non vi dico altro perché il tempo non lo consente. Le mie responsabili tutte belle
1628880	1635720	vestite in giacca blu, anche in oro. Immagine Veneto. Il coro più elegante di Italia,
1635720	1659660	diciamolo chiaro. Benissimo. Noi terminiamo questa assemblea. Io non credo che ci sia
1659660	1670300	altro da aggiungere di cose ne abbiamo dette tante. No, era solo un saluto. Il sindaco
1670300	1676440	si stava... una busta per chi? Ma io poi non scappo via, io non ho premure, io sono qui.
1677760	1684660	Quindi ci vediamo fra poco, ok? Benissimo. Lasciamo al nostro coro azzurro di concludere
1684660	1690080	questa bellissima giornata e io credo che lo concludiate proprio con Azzurra. È possibile?
1690740	1697060	Azzurra Libertà è una canzone, non sostituisce assolutamente il nostro coro, che rimane quello
1697060	1704020	di sempre. I giovani mi avevano chiesto un inno appositamente per Forza Giovani. Il maestro
1704860	1711780	che aveva per noi scritto, composto Forza Italia, si è cimentato, io ci ho messo le
1711780	1715760	parole ed ecco qui per tutti noi Azzurra Libertà.
1745720	1761520	Il cielo è dentro noi, Azzurro più che mai. E questa forza grande, così grande ormai,
1761840	1769900	dentro me, dentro te, più grande che mai, è come un fuoco acceso.
1782940	1798940	Il nostro canto va sui mari e nel città, sui campanili e giù, fino all'estremo su.
1801600	1801760	Il nostro canto va sui mari e nel città, sui campanili e giù, fino all'estremo su.
1802780	1816320	Sopra le verde e bianche, sulle onde blu, sopra noi, ci fa credere in noi, racconta di noi,
1816880	1831760	che insieme cantiamo per te. Azzurra Libertà è il sogno che c'è in noi, Azzurro più che mai.
1831780	1847320	Azzurra Libertà, per te ci va che il cuore è, Azzurra Libertà, liberi noi, ti difendiamo
1847320	1861760	noi, tutti insieme, e i doni che dai, sopparte di noi, ci danno forza, ti dà, ti dà, ti
1861780	1877220	dà, mi la mano dai, il canto insieme a me. La sfida è dura ma la vinceremo noi!
1879920	1899320	E questa forza grande è così grande ormai, dentro me, dentro te, dentro noi, più grande che mai, e vince su tutto per noi.
1899320	1912360	Azzurra libertà, il sogno che c'è in noi, azzurra libertà.
1958780	1959060	E' una forza grande ormai, dentro me, dentro te, più grande che mai, e vince su tutto per noi.
1988760	1989060	E' una forza grande ormai, dentro me, dentro te, più grande che mai, e vince su tutto per noi.
2004180	2019040	E' una forza grande ormai, dentro me, dentro te, più grande che mai, e vince su tutto per noi.
2048760	2049040	E' una forza grande ormai, dentro me, dentro te, più grande che mai, e vince su tutto per noi.
2078780	2079040	E' una forza grande ormai, dentro me, dentro te, più grande che mai, e vince su tutto per noi.
2108740	2109040	Sottotitoli creati dalla comunità Amara.org
2138720	2139040	Sottotitoli creati dalla comunità Amara.org
2168680	2169040	Sottotitoli creati dalla comunità Amara.org
2198720	2199040	Sottotitoli creati dalla comunità Amara.org
2228720	2229060	Sottotitoli creati dalla comunità Amara.org
2258780	2259060	Sottotitoli creati dalla comunità Amara.org
2288820	2289040	Sottotitoli creati dalla comunità Amara.org
2318800	2319060	Sottotitoli creati dalla comunità Amara.org
2348720	2349040	Sottotitoli creati dalla comunità Amara.org
2377480	2379040	Sottotitoli creati dalla comunità Amara.org
2408740	2409040	Sottotitoli creati dalla comunità Amara.org
2438800	2439040	Sottotitoli creati dalla comunità Amara.org
2458620	2460020	Sottotitoli creati dalla comunità Amara.org
