start	end	text
0	9040	credono più, ma non tanto per colpa dei petri dei promotori, per colpa del Parlamento che in Italia per tante e note ragioni non funziona.
9460	19220	Qualcuno parla di uno scontro sociale, della ricerca di uno scontro sociale da parte dei radicali, lei ritiene che questo sia vero e se sì che possa far bene al nostro paese.
19460	27460	La politica che i radicali fanno da quando faccio politica io ce la sempre, è una politica che punta anche allo strumento della provocazione,
27460	34360	non c'è dubbio della forzatura, della provocazione, anche per le grandi campagne poi condivise da altre.
34800	43020	Questo strumento è uno strumento della rotta politica radicale, cosa lo si scopre adesso, mi pare assurdo adesso, voglio dire. Grazie.
44020	47840	Se fosse letto Suarez cosa cambierebbe nella posizione?
48340	58340	Se fosse letto Suarez ci sarebbe una dominanza, una predominanza della sinistra che non avrebbe soltanto la commissione, ma avrebbe anche la guida del Parlamento,
58900	68680	quindi ci sarebbe una situazione che non aprirebbe la strada a un confronto sereno, perché il gruppo popolare si sentirebbe,
69600	80060	dato un accordo politico popolare che adesso vedremo, se non passa, no, non è che non si accetta, si accetta perché la democrazia è la democrazia,
80120	92180	ma questo non garantisce un atteggiamento di estrema responsabilità da parte del gruppo popolare in cui è forte la presenza tedesca,
92180	101180	quindi non certamente i tedeschi si sentirebbero messi in minoranza per quanto riguarda la commissione, messi in minoranza per quanto riguarda il Parlamento,
102280	110680	evidentemente ci sarebbe una voglia di rivincita che potrebbe anche esprimersi in un conflitto serio, in un contrasto serio nei confronti della commissione.
110680	114740	E' per questo che Frodi appoggia la commissione?
114940	123640	Frodi ha assolutamente la convenienza, come io ho cercato di esplicitare anche nei suoi confronti,
123920	129940	a che invece la commissione possa essere la commissione così come è stata formulata,
130180	138680	senza che ci siano poi attacchi anche ai singoli commissari, ma che soprattutto ci sia un voto che tutto il Parlamento dia a questa commissione,
138680	151120	nella sua interezza e sotto la sua guida, e invece ci sia un Parlamento che esprima dal suo seno un Presidente che sia espressione del gruppo di maggioranza relativa del Parlamento.
152020	157700	Presidente, lei al processo disse che lei comunque fa il tifo per l'Italia, quindi significa che anche qualora dovesse passare e pistolare,
157880	162540	se lei è la commissione, lei è il gruppo suo, comunque...
162540	169540	Io in quella situazione ho anche detto che mi sentivo naturalmente portato, ma vedete,
171100	180920	io spero che passi il nostro atteggiamento, che è un atteggiamento di moderazione e di responsabilità in Italia e in Europa,
181420	188900	ne parlavo ieri con la signora Latella, noi in Italia siamo stati oppositori che hanno dimostrato di guardare all'interesse generale,
188900	199300	non al proprio interesse, in diverse occasioni, ricordo la missione dei nostri in Albania, ricordo l'allargamento della NATO ai Paesi dell'Est,
199980	211660	ricordo la vicenda della guerra nel Kosovo, ricordo l'elezione del Presidente della Repubblica, abbiamo dimostrato di essere un'opposizione con senso dello Stato,
211660	226120	con senso di responsabilità, in Europa ci comportiamo con lo stesso senso di responsabilità, oggi nella situazione negativa dello sviluppo nell'Europa,
226240	235480	nella situazione che difende dalla scarso sviluppo della moneta europea, una moneta che è virtuale, quindi soffre anche di questa virtualità,
235480	247860	ma che comunque ha perso quel 15% che nessuno pensava potesse essere, se noi pensiamo a quanto abbiamo perso in tanti anni nei confronti del dollaro,
248020	258980	la moneta europea ha perso in sei mesi quello che l'alire italiana tanto disprezzata ha perso in sette anni nei confronti del dollaro, l'euro l'ha perso in sei mesi.
258980	267580	Scusi ma non è responsabilità nei confronti degli elettori, visto che in campagna elettorale avete chiesto il voto contro Prodi per un'Europa diversa
267580	271780	rispetto a quella proposta sia dai social democratici che dai democratici?
275600	282020	Non abbiamo detto una sola parola di questo tipo, noi abbiamo parlato sempre di cose concrete, non abbiamo chiesto il voto contro nessuno,
282020	289220	abbiamo chiesto il voto per l'Europa che è la patria del nostro futuro, la nostra patria è l'Italia, ma il nostro futuro è l'Europa.
289280	290800	Ma ci saranno bisogne contrapposte?
290800	301340	Noi stiamo dicendo una cosa che non corrisponde alla realtà dei fatti, io non ho mai pronunciato una parola contro nessuno, ho fatto dei messaggi soltanto positivi per l'Europa e per gli interessi dell'Italia in Europa.
301340	310200	Ma lei ha detto anche di chiedere il suo voto contro il partito socialista europeo che era maggioritario in seno al Parlamento?
310260	320820	Contro la politica del partito, contro una certa visione, come dicevano una volta le nostre sinistre, di un modello di sviluppo che ha portato i risultati che oggi verifichiamo,
320820	333760	cioè ha uno sviluppo che è meno della metà dello sviluppo americano, che è per la generalità degli stati europei meno della metà dello sviluppo di quei paesi come l'Irlanda e la Spagna che applicano la nostra ricetta,
333880	344160	quella del libero mercato, del libero sviluppo e su questo io appena ricordato che ci sarà dialettica in Parlamento, perché sono due visioni che si contrappongono molto precise,
344160	357180	quella della sinistra, una visione fiburocratica, di presenza secondo noi eccessiva dello Stato nell'economia, quindi alta spesa pubblica, conseguentemente alte tasse, conseguentemente basso sviluppo,
357360	367360	nessuna soluzione del problema della disoccupazione, la nostra ricetta è esattamente il contrario, lo Stato minimo, meno tasse, meno regole e rigidità nel mercato del lavoro,
367360	378360	spesa pubblica per quanto riguarda gli investimenti e non spesa pubblica di consumi corrente è uguale a maggiore sviluppo, a maggiore competitività,
379880	389600	risoluzione e dimezzamento in un periodo congruo di 5 anni, immagiamo noi, della disoccupazione e quindi risoluzione anche del problema del bilancio dello Stato.
389600	401600	Quindi sono due concezioni che si contrappongono molto con precisione, due schieramenti, mentre invece sulle istituzioni e sulle regole lì bisogna che la contrapposizione diventi concordia
401810	419570	per dare all'Europa nuove istituzioni e per scrivere le nuove regole importanti anche per quanto concerne ciò che l'Europa può determinare, su cui può legiferare e su ciò invece che deve restare nella competenza degli Stati e delle Regioni.
419570	437530	Quindi non ho capito una cosa, allora lei vota Prodi per il suo programma, io voto la Commissione europea, espressione dei governi d'Europa che sono, questa è la realtà che non ho determinato io ma che si è storicamente determinata per la decisione degli elettori europei, sono governi di sinistra.
437530	456130	Quindi non potevamo pretendere nonostante il successo del centro alle elezioni europee ultime che questa Commissione fosse un'espressione del voto ultimo, perché sono i governi che devono indicare che hanno la responsabilità di concordare con il Presidente della Commissione i membri della Commissione stessa.
456130	476950	Quindi noi in questo momento di crisi della moneta, di crisi dello sviluppo in Europa, riteniamo che sarebbe una partenza contro gli interessi di tutti i cittadini europei, mettere in crisi questa Commissione, aprire una crisi che si prolungerebbe certamente fino alla fine del mese di gennaio,
476950	489750	con il mantenimento della vecchia Commissione che ormai è stata in qualche modo delegittimata, con una guida della Commissione che sarebbe affidata a un Vice Presidente di quelli della vecchia Commissione.
489790	501910	Credo che non ci potrebbe essere inizio peggiore per la costruzione e per l'istituzione europea in un momento così delicato, ripeto, per gli sviluppi dell'economia e per la moneta.
501910	506330	Dipendentemente dal programma che Prodi ha proposto, per esempio nelle altre due sessioni.
506330	520570	Lo sapremo, noi lo voluteremo questo programma, e questo naturalmente noi ci auguriamo che il programma sia un programma che lo potremo provare, ma certamente sarà, io credo, perché credo che sia stata recepita tutte le nostre istanze.
520570	526150	Presidente, le riforme istituzionali qua, le riforme istituzionali in Italia, dovrebbero essere più ottimiste?
527570	530490	Ma io sono decisamente più ottimista qui in Europa.
534610	536390	E che tipo di riforma è auspica per l'Europa?
536590	540690	Beh, intanto ci sono tutte le riforme che riguardano le istituzioni europee.
540770	541410	Cioè quali?
541470	542650	Dal punto di vista dei continuti.
543990	552650	Il voto, per esempio, è una delle riforme più importanti, è quella di togliere l'unanimità nel voto, che questo porta alle non decisioni, porta...
553550	563390	Anche su argomenti come la fiscalità, al quale partito popolare si è sempre proposto togliere l'unanimità per le questioni che riguardano la fiscalità?
563390	565470	Beh, l'unanimità deve essere tolta su tutti...
565470	571750	In una democrazia non esiste il criterio dell'unanimità, questo poteva esistere all'inizio quando c'erano molti dubbi degli uni con gli altri.
572210	577430	Oggi bisogna fissare magari delle maggioranze qualificate.
577670	582270	Io non dico che si possa decidere sempre comunque su tutti gli argomenti a maggioranza semplice.
582470	587410	Maggioranze qualificate, ma bisogna recedere dalla situazione attuale che io ho provato,
587410	592310	quando si trattava anche di indicare, per esempio, il Presidente della Commissione, nei consigli d'Europa a cui ho partecipato,
592450	601110	c'era il blocco totale, c'era un signor no che si oponeva e lì buttava in nulla tutto il lavoro di tutti, quindi questo è sicuramente da evitare.
601210	603130	Poi ci sono tutti i vari problemi e il problema...
603130	613630	Mi sembra che il problema delle materie che possono essere assegnate alla competenza europea e delle materie che devono invece restare di competenza dei singoli Stati e anche delle regioni dentro gli Stati,
613630	620130	non sia un criterio importante, che non è stato affermato nelle precedenti legislature.
620610	629130	Troppe volte l'Europa si è interessata di cose che riguardano materie che sono peculiari dei singoli Stati e noi ne abbiamo subito le conseguenze,
629210	639610	ricordo tra tutti le norme per le piccole imprese, evidentemente nel centro Europa non esiste la dimensione familiare delle imprese che è la nostra forza in Italia
639610	646490	e quindi le regole che sono reberse, che sono state approvate dal Parlamento Europeo, sono le che ci hanno penalizzato, questo semplicemente per farlo.
646490	655890	Sì però, sono i capi di Stato e di governo, quindi anche lei che ha dato alcune materie all'Unione Europea sulle quali legiferare?
655910	664610	No, io no, su questo argomento non sono mai potuto intervenire, non ho avuto nessuna possibilità di intervenire, io sono stato al governo soltanto sei mesi e qualcosa,
664610	672350	ho fatto due scelte credo buone con due commessari come Monti e Labonino che si sono comportati bene e di più non potevo fare.
672610	679690	Poi il nostro gruppo qui è stato per molto tempo un gruppo che non era neppure dentro il gruppo del Partito Popolare, quindi non ha potuto pesare,
679850	690030	eravamo un gruppo che faceva parte a sua volta di un piccolo gruppo che credo abbia portato un contributo ma non è stato in grado di determinare la politica del gruppo maggiore,
690130	692190	cosa che invece non abbiamo l'ambizione di fare ora.
695730	709010	L'ultima volta che l'abbiamo vista a Bruxelles lei sperava che la Presidenza del Parlamento fosse eletta da un accordo PPS, in realtà le cose sono andate altrimenti e il PPS è eletto coi Liberali, lei ritiene che si possa recuperare?
709230	719490	Penso di sì, dipende dal legito di questa votazione, no no no, io ritengo che è difficile recuperare una concordia se ci sarà l'elezione del cambiato alla sinistra.
