start	end	text
0	10280	delle opinioni soprattutto quando sono chiaro, chiari e univoci. Nel 96 il centrosinistra ebbe
10280	17000	meno voti del Polo e più seggi. La maggioranza di seggi derivò da un accordo di desistenza con
18200	24480	rifondazione comunista, un accordo che la coalizione dell'Ulivo allora guidata da Romano
24740	32940	Prodi aveva negato e rinnegato puntigliosamente durante tutta la campagna elettorale, giungendo
32940	39120	anche attraverso proprio il candidato Prodi ad affermare solenemente in televisione che
39120	45680	non avrebbe neppure governato se per governare avesse dovuto ricorrere i voti di rifondazione
45680	53220	comunista. Dopo due anni e poco più, quella maggioranza parlamentare che era minoranza
53220	61300	nel paese andò in frantumi e questo è il primo fatto, la implosione dell'Ulivo e la
61300	69860	sua frammentazione in partiti e partitini. L'Ulivo era un cartello elettorale che si rivelò ben
69860	75400	presto come dicevamo noi dell'opposizione, una finzione scenica, una quinta di teatro,
75400	85020	meglio di teatrino, dietro la quale agiva da protagonista occulto come suggeritore e
85020	91660	burattinaio il partito degli ex, dei post, dei neocomunisti come veglio vi piace farvi
91660	105360	chiamare con il suo leader l'onorevole Massimo D'Alema. Già allora con il rispetto che la
105360	113680	finita una maggioranza di facciata da quale vera maggioranza intendessero essere governati,
114640	122500	invece si arrivò al più mediocre dei compromessi e al più insopportabile degli inganni. L'onorevole
122500	129880	Prodi che era il presidente eletto o meglio a cui gli italiani avevano dato il voto essendo
130720	138280	dalla vostra coalizione si ritirò in corruciato disordine e si mise in aspettativa europea.
139060	145940	Al suo posto arrivò dimenticandosi di chiedere agli elettori quell'autorizzazione che fino a un
145940	157140	minuto prima diceva di ritenere doverosa il vero capo della finzione scenica di centrosinistra e il
157140	166140	secondo fatto crollò la maggioranza aritmetica del 96 e con una manovra di palazzo fu sostituito
166140	171700	il presidente del consiglio che l'Ulivo aveva proposto e che gli elettori avevano votato.
172640	181500	Il terzo fatto è quello più grave per evitare le libere elezioni che vi fanno paura signori
181560	189640	della ex maggioranza e che non sono propriamente il nutrimento e il metodo della vostra tradizione
189640	198160	politica avete fatto letteralmente carte false puntando sull'ambizione di potere sulla voglia
198160	204600	di poltrone di alcuni eletti tra le file del polo che avevano ricevuto dagli elettori il mandato
204600	212220	di contrastare la sinistra vi siete costruiti una maggioranza parlamentare abusiva che non
212220	221580	soltanto differiva dal voto popolare del 96 ma che lo contraddiceva beffardamente nacque così quel
221580	228280	governo che gli storici quando finalmente si scriveranno nei manuali di storia veri per
228280	235920	nostre scuole chiameranno con buona pace del presidente dal emma il governo del trasformismo
235920	245440	non vedo qui il presidente dal emma ma considerato il silenzio ingeneroso della
245440	253020	sua maggioranza tardivamente interrotto soltanto due ore fa piace a me rivolgere a lui l'onore
255540	265620	il quarto e ultimo fatto è sotto gli occhi di tutti nel breve tempo racchiuso tra due primavera
266480	273000	dalle elezioni europee dell'anno passato a quelle regionali di quest'anno il trasformismo
273000	280020	politico e la logica dell'inganno sono stati valutati giudicati e condannati severamente
280280	287360	dalla grande maggioranza dei cittadini su quest'ultimo fatto la camera si pronuncerà
287360	297560	tra poco il ricorso a una persona certamente stimabile e stimata per guidare un governo che
297560	304220	merita e gode già della più severa disistima da parte degli italiani il professor giuliano
304220	312260	amato usato come ultima maschera del ballo trasformista di una sinistra ormai senza
312260	324560	anima e senza identità un governo che nasce male malamente raperciato per conseguire il
324560	331560	più scadente degli obiettivi politici mantenere il potere guadagnare tempo mettere alcuni partiti
331560	340120	al riparo dal giudizio degli elettori giocare in modo falloso stringersi in un inglorioso
340120	347960	catenaccio nella speranza di un contropiede che non potrà mai arrivare perché cari signori
347960	355180	della sinistra se contate su una pur debole ripresa economica per rifarvi una faccia avete
355180	363220	sbagliato i vostri calcoli quel poco di ripresa destinata a prodursi nei prossimi mesi è infatti
363220	370540	il frutto dell'ondata innovativa della nuova economia capitalistica ed è la mobilitazione
371780	377260	professionale e imprenditoriale del meglio di questo paese dai lavoratori alle piccole
377260	384580	e medie imprese quel tanto di competitività che ancora ci resta e che ci siamo guadagnati
384580	391860	in europa ce la siamo guadagnata nonostante il governo della sinistra e non grazie al governo
392940	402580	nonostante il vostro aberrante regime fiscale e burocratico e non grazie adesso le cose buone
403360	411080	che vi piace attribuirvi non sono opera vostra ma farina del sacco della globalizzazione e
411080	419300	europa il resto gli errori da matita blu e vincoli e sindacali e corporativi che impediscono il
419300	429940	decollo del paese quella sì è tutta farina del vostro sacco quando il professor amato fu candidato
429940	438080	al tesoro dopo l'elezione del suo predecessore alquilinale fumo tra i primi a spingere per
438080	446400	la soluzione e tra i primi a rallegrarci ora invece professor amato lei deve sapere che a
446400	452320	prescindere dal giudizio sulle sue qualità personali siamo convinti che lei stia compiendo
452860	461460	un clamoroso errore presentandosi per prestarsi ad un'ennesima manovra politica condotta alle
461460	472760	degli elettori e contraria ai più elementari principi della democrazia nessuno nessuno neppure
472760	479380	lei può salvare quel centro sinistra che gli elettori hanno già irrimediabilmente condannato
480240	488000	lei che ha scorrazzato notte tempo nei conti correnti dei cittadini imponendo loro la più
488000	496320	incredibile insopportabile e impopolare delle tasse dietro lo scudo del bene noi dopo che
496320	501800	tanti sostenevano che l'unica novità politica era che non si parlava più di politica abbiamo
501800	509240	fatto la cosa contrario anche guardando in giro uno guarda l'europa e avverte la crisi forte
509240	517160	ad esempio dell'euro progetto europeo cioè se la politica creava la moneta progetto inverso
517160	523080	magari facciamo la moneta creiamo la politica poi non ha funzionato sentite che c'è qualcosa ebbene
523080	529160	noi abbiamo anticipato i tempi probabilmente in tutta europa abbiamo detto che senza politica
529160	535960	senza che la gente non conti niente non ci si può stare ci devono essere ebbene abbiamo fatto
535960	538560	un progetto politico in un momento
545620	554140	dicevo un sacco di cose nessuna di queste era diciamo abbastanza vera esempio abbiamo risolto
554140	560160	il problema dell'economia ebbene si abbiamo visto che sono aumentate le tasse a dismisura nei primi
560340	568360	mesi di quest'anno sono entrati 24 mila miliardi in più rispetto ai due mesi dall'anno scorso certo
568360	576340	14 mila come per 12 per cento sul capital gain però insomma voglio dire un aumento di pressione
576340	583340	fiscale molto forte sapete bene che le cose che noi dobbiamo rispettare che i politici devono
583340	589640	rispettare se parlano per parlare di economia sono grosso modo tre differenziali quello fiscale
589640	598320	rispetto all'europe rispetto ai nostri mercati i nostri concorrenti quello dell'imposizione fiscale
598320	603640	deve essere la pressione fiscale del nostro paese pari a quella media
608700	621420	va bene allora non parlo però no voglio voglio ho fatto apposta a arrivare in ritardo per
628760	634920	applausi ebbene dicevo la pressione fiscale se non è fatalmente non c'è più la svalutazione
634920	640300	non si può più aiutare la nostra economia svalutando deve essere pari al massimo alla
640300	644660	media europea non dico la minima a quelli inglesi o quelli irlandesi ma almeno alla
644820	652560	media europea l'altra è il problema dell'inflazione anche lì si somma un punto un anno un punto
652560	660060	l'altro anno due punti dopo alla fine ti trovi una serie di punti percentuali in più che
660060	665460	devoluzione al coordinamento delle regioni sia al nord che al sud alla libertà nel
665460	673560	paese questo è il punto su cui dobbiamo fissare l'attenzione poi il resto lo dico dopo faccio
674380	679640	parlare il nostro amico che è appena arrivato poi magari facciamo il giro dalla torta grazie
703560	710600	cattivo gli facciamo tagliare non solo i baffi ma anche la barba io lo so il presidente perfetto
719880	727440	vi nomino missionari apostoli poi esagerati ho detto guerrieri di libertà allora col consenso
729000	736500	di ignazio e di umberto noi tre qui vi nominiamo tutti uomini e donne giovani e meno giovani ma
736500	741080	poi l'età lo sapete bene che è una condizione dello spirito non è un fatto fisico io mi
741080	744760	sento molto più giovane di quando avevo un anno anche perché allora non mi ricordo come
744760	756280	mi sentivo e quindi io credo davvero che il caso in questo momento con la storia della
756280	761600	caso davvero di essere tutti dei combattenti dei guerrieri per la libertà il compito da qui a
761600	767780	domenica di tutti voi che siete qui è di andare a convincere chi ancora non è convinto tutti i
767780	772680	familiari i parenti gli amici vedo dei bei ragazzi delle belle ragazze tutte le vecchie
772680	781640	fidanzate i vecchi fidanzati quante ne hai avuto tu 52 bossi 119 quindi hai insegnato bene spero
782710	791730	telefoniamo a tutti vedo è come chi ignazio ignazio mi avevi raccontato solo di 180 pensa
791730	798570	che però non ci si può fidare vedi l'alleanza non è ancora arrivata al punto vero in cui uno
798570	806010	deve seguire la norma per cui un gentiluomo muore ma non tacere e quindi ignazio ti abbiamo
806010	810790	colto in castagna a parte gli scherzi ma bisogna anche scherzare e poi vi devo dire che siamo alla
810790	814970	fine di un periodo di grande tensione anche oggi è stata una giornata di grande tensione in
814970	820630	parlamento davvero ci stiamo sfogando un poco perché credevamo di avere convinto anche tanti
820630	827790	altri deputati che a parole ci avevano detto che non mandavano giù questo fatto di trovarsi lì a
827790	835230	dover votare per una maggioranza che non è la maggioranza scelta dagli elettori nel 96 perché
835230	846650	è una maggioranza che si fa coi numeri di deputati eletti nel 96 col centrodestra e quindi deputati
846650	853130	che hanno ricevuto il mandato di opporsi alla sinistra bene questi deputati hanno calpestato
853130	858710	la prima regola morale della politica che è quella del rispetto del mandato degli elettori e sono
858710	864970	andati per un interesse molto basso molto preciso per sete di potere per appetito di poltrone
864970	878410	sono andate dall'altra parte quindi oggi oggi pensa che non lo sapevo oggi oggi in parlamento
878410	885570	si è consumata questa commedia tragica che il paese l'ha dimostrato in due tornate in due
885570	892810	passaggi elettorali il voto all'europee dell'anno scorso il voto politico non amministrativo delle
892810	898270	regioni perché noi abbiamo eletto dei governatori delle regioni dei consigli regionali che
898270	903790	cambieranno gli statuti regionali che quindi legificheranno costituzionalmente dandosi la
903790	910290	propria costituzione quindi è stato un voto politico ma non per questo noi chiedevamo di
910290	916310	tornare alle elezioni lo chiedevo lo chiedevamo e lo chiediamo perché quella maggioranza che oggi
916310	923170	ha avuto il numero in parlamento non è la maggioranza eletta nel 96 dai cittadini è una
923170	928830	maggioranza spuria che non corrisponde alla maggioranza che sta nel paese e il presidente
928830	935190	del consiglio con tutto quel riempirsi che fanno della loro bocca pensiamo a Veltroni a Musi a
935190	942630	Polena quante volte ci hanno parlato di bipolarismo bene hanno presentato e messo a capo del governo
942630	950210	un signore che sarà anche bravo ma che non è stato nemmeno presentato dal 92 agli elettori non
950210	957310	ha neppure il mandato degli elettori il mandato parlamentare quindi oggi si è consumato un
958050	964370	divorzio tra l'Italia della gente l'Italia della democrazia e la loro Italia e ancora una volta
964370	970130	si è confermata la giustezza del moto con cui abbiamo combattuto e vinto la campagna elettorale
970130	975270	per le regioni e che sarà il nostro motto di tutti noi insieme per le elezioni nazionali
975270	981870	prossime quello della scelta di campo si tratta davvero di scegliere da una parte o dall'altra
981870	989690	o di qua o di là o loro o noi o loro con la loro filosofia del potere dell'occupazione del potere
989690	994170	dello stato che è dappertutto che allunga le sue mani dappertutto quello che si chiama lo
994770	1004050	che produce soltanto regole divieti carta documenti burocrazia parenti posti per amici
1004050	1010770	per gli amici degli amici e via di questo passo e la nostra filosofia che tutti insieme noi
1010770	1017590	condividiamo che è la filosofia della libertà la filosofia del buon governo la filosofia di uno
1017590	1023890	stato che non è il padrone dei cittadini e dei loro diritti ma la filosofia di uno stato che
1023890	1028950	nei confronti dei cittadini come primo dovere quello di difendere di salvaguardare i loro
1028950	1035810	diritti e che è lui al servizio dei cittadini e non i cittadini al loro servizio o di là o di
1035810	1042650	qua o di là con loro con il pericolo il rischio di un regime o di qua con noi con la certezza
1042770	1056850	del benessere e della libertà allora adesso io prego di presentare i nostri candidati per pavia
1057490	1062050	per lodi e gli altri che sono qui uno per uno e prego anche a loro di venire qui di farsi
1062050	1067350	conoscere e ricordiamoci però che non votiamo per un candidato per una persona raccontiamo
1067350	1073830	votiamo per una scelta di campo tra la loro filosofia la loro filosofia che è la filosofia
1073830	1083450	del bravo del potere della occupazione del potere vedete noi non diremo mai andiamo al potere non
1083450	1088870	l'ho mai sentito dire a umberto noi diciamo andiamo al governo loro invece dicono andiamo
1088870	1095870	al potere perché la loro filosofia la loro religione è la conquista del potere il mantenimento
1095990	1099630	del potere la nostra religione è invece la
1106750	1112670	allora il partero l'onorevole francesco fiori nostra europarlamentare
1114970	1122050	e vicepresidente in europa della grande famiglia della libertà e della democrazia europea che è
1122050	1131730	partito popolare europeo nostro presidente italiano il guerriero candidato sindaco divisevano
1131730	1146070	professor ambrosio cotta rammusino non è candidato ma bisogna fargli un grande applauso perché
1146070	1152390	ultimamente è molto dimagrito il nostro vicepresidente del senato senatore contestabile
1154630	1162490	mimo contestabile mimo fatti vedere di profilo che possono apprezzare il dimagrimento un applauso
1162490	1172390	al profilo di mimo contestabile un uomo veramente dipeso appena eletto consigliere
1172470	1187110	il sindaco del polo più lega che ha vinto già a voi che era il primo turno aurelio toriani
1194090	1197670	il presidente provinciale della nazione nazionale ferdinando crovace
1203990	1208050	candidato sindaco di lodi dottor ernesto cafra
1217110	1219710	il prossimo sindaco di pavia gian paolo chirichelli
1230610	1236130	giusto due parole niente ricordatevi la domenica come detto tutti i leader della
1236130	1241650	coalizione venite andate a votare poi partita questa che ho definisco la opa offerta pubblica
1241650	1252010	alleanza per la libertà vi ringrazio gian paolo stai qui perché lui fa parte di quella
1252010	1260070	benemerita categoria dei dottori commercialisti perché benemerita è un collega perché se lo
1260070	1265870	porta tutte le volte dietro perché lui grida sempre è cosa una cosa quant'è la tarifa quant'è
1265870	1272350	gli scambiato gli scambiato dunque dico benemerita anche se come parcelli e mi tanto c'è andate
1272350	1281810	dentro salati perché con uno stato che prevarica con uno stato che ha messo in campo 3.000 leggi
1281810	1288750	fiscali 3.000 voi sapete che il nostro programma è quello di abolire tutte queste 3.000 leggi e
1288750	1296330	dare vita a un solo unico codice fiscale che porti le più di 100 tasse attuali alle soltanto
1296330	1304430	alle otto tasse principali l'abbiamo discusso con umberto giuglio tremonti è l'autore di questa
1304430	1309830	riforma tributaria che noi abbiamo intenzione di applicare cominciando da subito abbiamo
1309830	1317530	preso l'impegno umberto conferma ignazio no no aspetta non sai nemmeno cosa vengo a dire
1318090	1327790	avete visto che l'unità è certa e che io lo tengo per la barba nei primi 100 giorni ci siamo
1327790	1335910	presi un impegno assoluto per la parte fiscale 1 abolire quella tassa odiosa per cui non si capisce
1335910	1341730	perché lo stato debba mettere le sue mani sui risparmi di un padre di una madre magari risparmi
1341730	1347070	di tutta una vita che un padre e una madre vogliono passare ai propri figli la tassa di
1352290	1357250	successione guardate che i nostri avversari ci dicono ma come fate a parlare di abolire
1357250	1361790	questa tassa e beh bisogna più spendere come fate a diminuire questa entrata dello stato
1361790	1369690	errore errore perché lo stato spende di più per incassare i soldi delle imposte di successione
1369690	1375890	di quanto non incassi perché perché siccome il fisco ad appurare l'entità dell'imposta e siccome
1375890	1381950	gli eredi resistono si innestano dei procedimenti dei processi a consegnare allo stato tutte le
1381950	1387570	imprese tutti i mezzi di produzione perché soltanto lo stato dominato dal partito poteva
1388270	1393030	utilizzare quei mezzi nell'interesse di tutti sappiamo come è andata perché poi lo stato ha
1393030	1398790	voluto utilizzare quei mezzi soltanto per diventare grande potenza militare dimenticando completamente
1398790	1404590	le esigenze dei consumatori e ha consegnato non solo l'unione sovietica ma tutti i paesi che
1404590	1410410	sono caduti sotto il potere dei comunisti ad una condizione di sottosviluppo tanto che a un
1410410	1415910	certo punto per l'intrinseca razionalità di quel sistema tutto è finito per un implosione
1417010	1421730	propria come un castello di carte che cade senza che nessuno l'abbia toccato su se stesso e si
1421730	1426390	è capito che quel sistema quello dell'economia collettivizzata non era un sistema per creare
1426390	1432230	benessere ma era un sistema per distruggere risorse ma da quella scuola quel sistema e quella
1432230	1440150	scuola quel sistema che loro hanno per anni per decenni condiviso coltivato applaudito a
1440150	1445610	due mani quel sistema e i suoi protagonisti i misfatti le decine decine milioni di morti
1445610	1450110	di quel sistema tutto quello non l'hanno cambiato hanno cambiato il nome hanno cambiato il simbolo
1450110	1455690	del partito ma sono gli stessi uomini ho guardato nell'elenco dei ministri ne hanno nominati 32
1455690	1465230	dell'ex pc pds 32 ministri di cui 28 cioè scusate 28 più i due del partito di cossutta 30 sono
1465230	1472210	funzionari del vecchio pc vengono da quel pc che faceva le sfilate per sostenere pol pot che in
1472210	1483330	cambogia ha ammazzato metà dei cittadini cambogiani e allora ecco che una grande battaglia di libertà
1483430	1490870	è quello di combattere l'esosità di questo stato e questi signori che sono quei professionisti che
1490870	1495150	fanno parte di quell'ordine dei dottori commercialisti si trovano in questa situazione
1495150	1500630	ad essere gli unici difensori a cui ci possiamo rivolgere per contrastare l'esosità di questo
1500630	1507830	stato del fisco dello stato uno stato che ha delle norme penali che addirittura ti possono
1507830	1513670	portare a un procedimento penale se tu nell'interpretazione di una norma tributaria
1513670	1520790	hai addirittura osato andare verso l'interpretazione più favorevole a te contribuente uno stato che
1521310	1526270	a tutti noi potrebbe chiedere ciò che noi abbiamo dentro come sentimento di giustizia per diritto
1526270	1532770	naturale di tutto ciò che noi guadagniamo in un anno che cosa domandate ve lo rispondete non può
1533770	1539750	come succede in tutti gli altri stati in tutte le grandi democrazie dell'occidente come succede
1539750	1547050	negli stati uniti e invece ti chiede e questo è nascosto nei bilanci nei conti nelle buste paga
1547050	1551990	anche di soprattutto degli impiegati degli operari dei dirigenti ti porta via il 50% di
1551990	1556590	quello che tu guadagni e allora dentro di sé senti un sentimento di ribellione dici questo
1556590	1562370	non è uno stato giusto questa schiavitù fiscale questa servitù fiscale questo è un furto di stato
1563390	1571850	e se poi come giampaolo mi ha raccontato come tanti altri suoi colleghi che vogliono restare
1572730	1580170	sereni non avere paura dormire la notte rispettando tutte le infinite norme fiscali tutti gli infiniti
1580170	1586730	regolamenti fiscali sapete che i regolamenti in italia hanno superato il numero di 200.000 uno
1586730	1592670	che vuole stare tranquillo un professionista un dentista un medico un avvocato arriva a
1592670	1599910	60% noi dobbiamo avere il coraggio di resistere di dire tutti insieme questo non è uno stato
1599910	1610890	che ti chiede le tasse giuste questa è una rapina di stato e quindi a lui che spero speriamo sia
1610890	1616290	il prossimo sindaco di questa città e non sarà solo e dovrà fare bene perché siamo in tre
1617550	1625690	guardati non spero ne sono sicuro bravissimo allora a questo punto qua è finito continuo
1625690	1634110	ancora e vediamo un po adesso adesso entri tu no adesso ti lascio il microfono tutto tuo aspetta
1634110	1639410	che lui finisce di presentare chi c'è che daniele maggi segretario provinciale del ccd
1644880	1657200	vittorio braga il segretario provinciale della lega paolo romani segretario regionale di forte
1657200	1668580	italia della lombardia e roberto calderoli segretario regionale della lega nord voglio
1668580	1672580	ricordare un attimo solo poi cediamo la parola il professor giorgio rondini che è stato il nostro
1673120	1680140	candidato per il comune di pavia che si era in prima fila e vorrei dire umberto prima di
1680140	1687080	passarti il microfono un grazie al professor rondini un grazie perché noi quando ancora
1687080	1694660	stavamo trattando l'alleanza con la lega avevamo individuato in lui il nostro candidato quando
1694660	1702780	l'alleanza si è fatta e noi abbiamo preso in esame le situazioni delle varie città del nord per
1703400	1709440	una serie di motivi logistici e per accontentare diciamolo chiaro le esigenze di ciascuna delle
1709440	1715800	componenti di questa alleanza noi abbiamo dovuto chiedere al professor rondini di farsi da parte
1715800	1728820	perché la situazione era tale che portò a noi a decidere di indicare giampaolo come candidato
1728820	1734040	di pavia il professore venne da me è venuto ad arcole siamo stati insieme ci siamo conosciuti
1734040	1739980	meglio io ho apprezzato in lui una persona di straordinaria umanità di straordinario
1739980	1747960	gli ho chiesto essendosi lui dichiarato disponibile a farsi da parte di guidare come capolista la
1747960	1754840	lista nostra per il comune di pavia lui ha accettato gli dico grazie perché ha dato veramente
1754840	1766780	una dimostrazione di spirito di sacrificio di capacità di farsi da un lato a far sì che la
1766780	1777340	professore bene allora a umberto e posso fare un salutino credo che nessuno se ne abbia a male
1777340	1784040	se unisco nei saluti e nei ringraziamenti uno cui sono molto affezionato un saluto doveroso per
1784040	1790640	me perché carlo nola che è stato il più votato di alleanza nazionale non è stato eletto per la
1790640	1795180	strana legge elettorale mancò la fortuna non certo il valore grazie carletto
1801220	1806960	allora a umberto guardiamo l'orologo vedo che qualcuno lo guarda noi dobbiamo prepararci a
1806960	1814700	fare la cenerentola a mezzanotte tutti l'avete preparato i cavalli le zucche fuori a mezzanotte
1814700	1826500	bisogna smettere lo sappiamo a te fino a mezzanotte no io volevo un motivo di precisione
1826500	1832560	che la politica deve essere anche precisa io capisco forza italia che si chiamano forza italia
1832560	1840900	ma noi ci chiamiamo forza padagna no sapete come sono e allora l'accordo è stato fatto prevedendo
1841520	1849080	la grande trasformazione di un paese che adesso ancora centralista quindi non in grado di rispondere
1849080	1854700	alle sfide della globalizzazione con rischi di contrapposizione se non si fa le riforme
1855700	1862380	e non c'è il minimo dubbio che noi abbiamo investito in un grande progetto il passaggio
1862380	1868440	a un sistema paese dove c'è spazio per tutti quelli del nord del sud eccetera
1868440	1873400	eccetera quindi un grosso progetto non è che l'accordo l'abbiamo fatto sugli spiccioli o
1873400	1880200	sulle piccole cose un grandissimo progetto e poi al di là delle cose io non so le tasse
1880200	1888180	io per il gusto di penalizzare il commercialista lì della lega il candidato sindaco ad esempio
