start	end	text
1888180	1896580	lascerei l'irap così quasi cioè c'è visco fisco nome nomen sembra no ci sono degli uomini che
1896580	1910180	nascono con un destino uno che si chiama visco fai presto visco fisco era destinato a diciamo a
1910180	1918080	solo un problema diciamo di una singola tasse lì è tutto un sistema di rivedere ed è vero che il
1918080	1925280	nostro grande impegno è quello di preparare una serie di segni di legge probabilmente piglieremo
1925280	1932340	la via di annunciarli di preannunciarli preparandoli e presentandoli magari attraverso anche di segni
1932340	1937780	di legge di iniziativa popolare con la firma della gente in mezzo alle piazze quindi importanti
1937780	1945540	sicuramente anche nel campo del fisco dove evidentemente si gioca una partita importante
1945540	1953140	partita fondamentale se si vuole che le nostre imprese restino in qualche modo attive in un
1953140	1960220	mercato europeo dove siamo sicuramente penalizzati in una situazione di vetro assistenzialismo come
1960220	1965820	ha tirato fuori da lemma io non so se da lemma ci capisce di economia io ne ho sentito tanto il
1966140	1972900	vero anche ho sentito oggi l'aula che qualcuno ha riconosciuto che so il merito secondo me non
1972900	1979940	capiva niente di economia banalmente da tutte le certe che ho visto fare vi pare che fosse solo
1979940	1987220	un tentativo di vetro assistenzialismo che veramente non riescono a intravedere una via che è la via
1987220	1994460	del mercato o addirittura usano i metodi e i mezzi del mercato per ricostruire addirittura
1994650	2000350	il centralismo lo statalismo potrebbe esserci bene non penso che sarà un anno facile quello
2000350	2004930	a cui siamo davanti per cui vi dovete farci vincere il più possibile adesso per avere lo
2004930	2012630	slancio non molleremo mai sicuro però io temo che tra le parole di avere capito abbastanza bene
2012630	2020130	sembra di aver intuito il progetto sarebbe terribile per le nostre piccole imprese per esempio se il
2020130	2028550	dfr venisse dato al sindacato al trippice sindacato dire 20 mila miliardi all'anno a questi signori
2028550	2035110	da spendere con gli strumenti del mercato ricostruirebbero lo statalismo quindi siamo
2035110	2042030	in un momento estremamente difficile io penso che non voglio perché non è assolutamente qualcosa
2042030	2049570	che converrebbe a nessuno anzi sarebbe sconveniente per tutti noi se qualcuno dovesse pensare di
2049570	2056610	ilmeno quel raccorto ci sarebbe un patto chiaro e scritto che suonerebbe a sua condanna e quel
2057570	2063510	qualcuno sarebbe penalizzato da un discredito che io dico gli impedirebbe di poter continuare a fare
2063510	2070250	politica essendo qualcuno che manifestamente avrebbe rotto un patto un patto d'onore un patto
2071840	2083660	quindi io credo che la nostra alleanza che è un'alleanza importante per la libertà del paese sia
2083660	2090940	un'alleanza su cui tutti noi possiamo davvero davvero contare fino in fondo e chiedo a Umberto di
2090940	2098460	darmi questa possibilità chiedo anche a Ignazio di chiudere questa nostra serata lasciandomi
2098460	2104640	andare alla lettura di uno scritto di quella volta che io per la prima volta da imprenditore
2104640	2109820	che ero decisi che le cose del nostro paese si mettevano in modo tale che era necessario
2110340	2116100	che qualcuno si interessasse della cosa pubblica vi ricordate che ancora non c'era l'accordo tra
2116100	2121760	alleanza nazionale che era forte al centro al sud c'era la lega al nord si pensava che non
2121760	2126800	ci si potesse trovare un modo di collaborare c'era bisogno di una terza forza che fu appunto forza
2126800	2133680	che riuscì già allora a trovare un accordo un'intesa poi sapete quello che è successo ma oggi le
2133680	2138380	convenienze di tutti le convenienze del nostro paese della democrazia della libertà ci hanno
2138380	2143600	rimesso insieme bene io che non avevo mai parlato in pubblico se non di cose che riguardavano la
2143600	2151520	mia impresa incontrai chi con me si decise a scendere in campo e a dare vita a quel movimento e
2151520	2158260	dissi allora parlando col cuore senza nemmeno una preparazione così intensa ci avevo pensato
2158260	2165080	ma mi buttai così come veniva veniva e col cuore dissi quali erano i principi che io sentivo
2165080	2172280	dovevano essere alla base del mio e del nostro impegno politico ho ritirato fuori la trascrizione
2173900	2181200	del datillo scritto no di ciò che venì il datello scritto di ciò che dissi e ho trovato che quei
2181200	2185660	principi che mi vennero fuori spontaneamente allora dal cuore sono validi ancora oggi non c'è una
2185660	2191320	parola da cambiare approfitto per avere qui Ignazio per avere qui Umberto per prendere anche a loro un
2191320	2196580	minuto di tempo per leggere quello che dissi allora e poi alla fine chiederò a loro se
2196580	2201580	ritengono che ci sia qualcosa su cui non convengono se ci sia qualcosa da cambiare dissi allora noi
2201580	2207840	crediamo nella libertà in tutte le sue formi molteplici e vitali nella libertà di pensiero
2207840	2213460	e di opinione nella libertà di espressione nella libertà di culto di tutti i culti nella
2213460	2220420	libertà di associazione crediamo nella libertà di impresa nella libertà di mercato regolata
2220420	2227740	da norme certe chiare uguali per tutti ma la libertà non è graziosamente concessa dallo
2227980	2236060	perché adesso anteriore viene prima dello stato è un diritto naturale che ci appartiene in quanto
2236060	2243820	a esseri umani e che semmai essa sì fonda lo stato e lo stato deve riconoscerla e difenderla
2244500	2252180	proprio per essere uno stato legittimo libero e democratico e non un tiranno arbitrario crediamo
2252180	2257300	che lo stato debba essere al servizio dei cittadini e non i cittadini al servizio dello
2257300	2263860	stato per questo crediamo nell'individuo e riteniamo che ciascuno debba avere il diritto
2263860	2271340	di realizzare se stesso di aspirare al benessere e alla felicità di costruire con le proprie mani
2271340	2278100	il proprio futuro di poter educare i figli liberamente per questo crediamo nella famiglia
2278660	2286700	nucleo fondamentale della nostra società noi crediamo nei valori della nostra cultura nazionale
2286700	2293260	crediamo nei valori della nostra tradizione cristiana nei valori rinunciabili della vita
2293260	2299700	del bene comune della pace della solidarietà della giustizia della tolleranza verso tutti
2299700	2306600	a cominciare dai nostri avversari e crediamo soprattutto nel rispetto e nell'amore
2320600	2328360	a cominciare dai nostri avversari e crediamo soprattutto nel rispetto e nell'amore
2342900	2349320	l'altruismo la dedizione la passione per il nostro lavoro
2352900	2360840	questo è ciò che ispira la mia e la nostra azione politica io consegno questo foglio
2360840	2369700	a Umberto ne consegnerò una copia anche a Ignazio e loro mi diranno con tutta la segretezza
2369700	2375540	e la calma possibile che cosa c'è da cambiare secondo loro in quei valori che convincero
2375540	2381260	me imprenditore a smettere di fare l'imprenditore e a scendere in campo a battermi per la libertà
2381260	2391220	del mio paese una libertà lo ripeto che Umberto Bossi ha dentro il cuore che Gianfranco Fini
2393180	2401620	passando attraverso battaglie dure le ha ricordate Ignazio parlando delle sue battaglie da giovane
2402620	2408540	che anche Silvio Berlusconi in questi anni ha fatto e che oggi ci apprestiamo a fare
2408540	2413860	tutti insieme insieme a voi ricordandoci tutti insieme che questo grande sogno di libertà
2413860	2420000	e di benessere maggiore per il nostro paese se lo sogniamo soltanto io, Umberto per conto
2420000	2426240	suo, Ignazio, Gianfranco, ciascuno di voi per conto suo può darsi che resti soltanto
2426240	2432040	un sogno ma se ci mettiamo a sognarlo tutti insieme siamo certi che potrà diventare
2432040	2437500	una grande realtà per noi e per i nostri figli. Un abbraccio a tutti, domenica si
2437500	2444960	vota siete i guerrieri della libertà a casa e da domani tutti per far vincere la nostra
2444960	2449420	idea di libertà anche a Pavia. Un abbraccio a ciascuno di voi.
2504380	2504700	Sottotitoli creati dalla comunità Amara.org
2534220	2534680	Sottotitoli creati dalla comunità Amara.org
2564380	2564700	Sottotitoli creati dalla comunità Amara.org
2594360	2594700	Sottotitoli creati dalla comunità Amara.org
2624360	2624680	Sottotitoli creati dalla comunità Amara.org
2654380	2654700	Sottotitoli creati dalla comunità Amara.org
2684260	2684700	Sottotitoli creati dalla comunità Amara.org
2698700	2700100	Sottotitoli creati dalla comunità Amara.org
