start	end	text
1906180	1913840	ecco che allora lo Stato può e deve intervenire a prestare un aiuto, un sussidium, un sussidio
1913840	1921140	quindi da qui il nome, il principio di sussidiarietà, lo Stato liberale quindi è questo Stato minimo,
1921240	1928700	non è lo Stato massimo che interviene dappertutto e anzi c'è un passo da fare ancora in avanti
1928700	1938300	dentro lo Stato le istituzioni devono operare quelle che sono più vicine ai cittadini,
1938300	1944040	cioè non deve fare la provincia ciò che può essere meglio fatto dal comune, più vicine
1944040	1949260	ai cittadini, più controllabile dai cittadini, non deve fare la regione ciò che può essere
1949260	1953920	meglio fatto dalla provincia, non deve fare lo Stato nazionale ciò che può essere meglio
1953920	1960860	fatto dalle regioni e anche le unità sovranazionali come l'Unione Europea non devono fare ciò
1960860	1967840	che può essere meglio fatto dagli Stati nazionali e noi siamo in Europa anche per vigilare che
1967840	1973540	il Parlamento europeo non ecceda dai suoi poteri e non intervenga in materie che invece
1973540	1979860	sono materie che appartengono agli Stati nazionali, questa è la nostra concezione dello Stato
1979860	1985260	e da qui deriva anche la nostra concezione dell'economia, della libera iniziativa, della
1985260	1991780	libera economia, dell'economia di mercato che si basa sulla libertà, che si basa sulla
1991780	1999080	competizione, la libertà è il primo, il più grande dei nostri diritti e significa
1999080	2008260	che ciascuno di noi deve essere libero di usare di se stesso, dei suoi pensieri, dei
2008260	2014240	suoi beni, delle sue risorse come gli aggrada, avendo un unico limite, quello di non danneggiare
2014240	2020560	gli altri, di non ledere i diritti degli altri, questa è la libertà e la libertà si basa
2020560	2027180	e si costruisce sul rapporto tra di noi, che deve essere un rapporto di competizione, senza
2027180	2032340	competizione non c'è libertà, così come senza libertà non ci può essere benessere
2032340	2039140	e c'è il progresso scientifico perché esiste la competizione tra uomini alla ricerca della
2039140	2044600	verità, c'è la democrazia perché esiste il confronto tra idee e uomini alla ricerca
2044600	2051220	del miglior modo di stare insieme, c'è la prosperità perché esistono uomini, imprenditori
2051220	2057820	in competizione per cercare di fare il miglior prodotto al miglior prezzo possibile per offrirlo
2057820	2063180	ai padroni del mercato che sono i consumatori, c'è infine un grande principio che dice
2063180	2070360	in uno stato liberale tutto ciò che non è vietato è permesso, il loro principio opposto
2070360	2076580	al nostro è in uno stato, nel loro stato è permesso soltanto ciò che dallo stato
2076580	2083800	è espressamente consentito. Ecco vedete che si confrontano due filosofie opposte, due
2083800	2091840	filosofie alternative e credo che noi dobbiamo essere consapevoli che da questa opposizione
2091840	2099140	di ideali, di filosofie vengono fuori le diversità dei nostri programmi, il loro programma che
2099140	2106300	produce non benessere ma declino, che produce non libertà ma sudditanza, il loro programma
2107000	2113380	che li porta a giudicare il prossimo con occhi malevoli, a voler controllare tutto, a proibire,
2113460	2120120	a condannare e anche a odiare e dall'altra parte il nostro programma che ci porta così
2120120	2125320	come ha portato tutti gli Stati occidentali ad aumentare il nostro benessere, ad aumentare
2125320	2134580	la nostra libertà. Come vedete piove e non sto a trarre le conseguenze con un giudizio
2134580	2145380	sul governo e allora io credo che basti, non voglio assumermi la responsabilità grande
2145380	2151640	di un popolo azzurro, il popolo della libertà che sia ammalato, poi ci diranno che c'è
2151960	2157920	un malocchio che noi non l'abbiamo vinto. Mi basta avervi idealmente abbracciati tutti,
2158380	2164540	avervi raccontato quel che potete leggere in tanti miei interventi, di chi vuole difendere
2164540	2171680	la libertà e che dal 94 a oggi ha avuto il coraggio di guardare in faccia la realtà
2171680	2177180	di chi oggi non si chiama più comunista, si offende se lo chiamiamo comunista ma che
2177180	2182660	è rimasto da sempre comunista, che è più comunista di prima e noi come gli uomini nostri
2182660	2196500	padri e madri del 48 non ci fidiamo di costoro, non vogliamo i comunisti al governo. Un abbraccio
2196500	2203440	a tutti, un invito impegnate queste ore che mancano a domenica per cercare di convincere
2203440	2208280	più possibile i vostri familiari, i vostri amici, i vostri conoscenti, tutti coloro che
2208280	2214560	potete contattare. Se ancora non l'avete fatto non dimenticatevi di rappresentare le liste
2214560	2219940	della Casa della Libertà, là dove si apriranno le urne, perché la professionalità nei brogli
2219940	2226380	della sinistra è antica ed efficientissima, quindi bisogna oltre che votare difendere
2226380	2233420	il proprio voto e continuate a ricordarvi che domenica si vota sì per Enzo Ghigliano
2234280	2236500	e per un altro voto.
2242900	2251360	Questa è la trincea del lavoro e credo che quando la storia del nostro Paese mi ha chiamato
2251360	2256620	e io ho avuto bisogno di avere qualcuno dei miei collaboratori che rinunciasse a una posizione
2256620	2263000	di prestigio e assolutamente conveniente sul piano del benessere familiare, lui è stato
2263000	2268780	uno tra i primi, si è affacciato una sera alla mia porta e mi ha detto grande capo,
2268840	2273820	quando il capo chiama e la libertà chiama, Enzo Ghigo presente.
