start	end	text
8200	15020	e sono dovuto restare a rispondere alle domande dei giornalisti per avere nonostante tutto
15020	21400	domani uno spazio per Forza Italia, per la Casa della Libertà su tutti i giornali d'Italia.
24940	33480	Ho sentito arrivando qui questo inno che mi fa venire ancora oggi i brividi nella schiena,
33600	40640	l'inno della libertà, l'inno di Forza Italia, ma devo dirvi che c'è un altro inno che da sempre
40640	48940	mi fa venire il doppio ancora di brividi nella schiena, è il nostro inno nazionale, ascoltiamolo
48940	49400	e siamo!
113060	117760	è la vittoria, che porta la chioma,
118060	121440	in una viola e in una trioma.
121920	125120	Sviglianti attorche, se pronte alla morte,
125440	128780	se pronte alla morte, in Italia chiaro,
129040	132720	Sviglianti attorche, se pronte alla morte,
132880	136260	se pronte alla morte, in Italia chiaro.
153640	168000	Credo che di fronte a una sede storica, qui dove è nata la storia d'Italia, sia stato
168000	177680	giusto incontrarci per l'ultimo atto ufficiale di questa campagna elettorale, che è sempre
177680	183040	di più una campagna, non soltanto per il benessere, non soltanto per il cambiamento,
183460	193000	ma sempre di più una campagna per la libertà. Io ho incontrato più di centomila nostri
193000	199740	cittadini, ho incontrato molti più italiani di quanto non avessi fatto durante le altre
199740	211900	campagne elettorali, ho ascoltato tanti italiani raccontarmi i loro dispiaceri, le loro angosce,
212960	222000	le loro aspettative, le loro speranze. A tutti ho cercato di far conoscere le soluzioni
222730	232370	a questi problemi. Ho parlato ogni giorno a migliaia di cittadini del lavoro che non
232370	238950	c'è e di come invece lo si può creare, liberalizzando l'economia, sostenendo le piccole e piccolissime
238950	249850	imprese, formando meglio i nostri giovani, e via dicendo. Ho parlato di un altro grande
249850	258610	problema che interessa le persone anziane, quello di pensioni che non lasciano vivere
258610	265090	nella dignità e nella serenità e di come sia possibile aumentarle, da dove lo Stato
265090	277450	possa trarre i finanziamenti per poterli aumentare. Ho parlato del problema delle tasse, sempre
277450	283450	verso lo Stato. Siamo stati noi a costringere il ministro Visco a confessarlo finalmente
284070	294670	in Parlamento. Ha incassato per le tasse 40.500 miliardi di più dell'anno prima, soldi tolti
294670	301130	dalle tasche dei cittadini, dalle famiglie. Sapete bene che cos'è il caro vita e sapete
301130	308630	forse anche che più del 50% di quello che pagate per la luce, per l'acqua, per il
308630	315170	gas, va nelle tasche dell'erario perché è formato da tasse, così come sanno bene gli
315170	324130	automobilisti che quando pagano un pieno di benzina il 70% di quel che pagano va ancora
324260	331260	nelle casse dell'erario. Quindi molti soldi di meno nelle tasche dei cittadini che fanno
331900	338260	i conti di casa con sempre maggiore difficoltà, molti soldi di meno nei conti delle imprese
338260	343800	che avendo meno consumi perché i cittadini possono spendere meno e avendo meno soldi
343800	354240	possono espandersi di meno e non riescono a creare quei posti di lavoro di cui c'è così
354240	363220	l'anno scorso c'è stato un incremento del numero dei reati di ben il 18%. Ho parlato
363220	370440	quindi di cosa si deve fare per contrastare, per prevenire l'esercito del male che ha
370440	378120	ingrossato le sue fila con l'apporto di tante organizzazioni straniere dove trovano lavoro,
378120	387000	si fa per dire, molti immigrati clandestini. Ho parlato di scuola e di come i nostri giovani
387000	393980	devono uscire dalle scuole capaci di parlare benissimo l'inglese, di maneggiare benissimo
393980	402500	i computers, di navigare agilmente e facilmente su internet, di conoscere le regole che presiedono
402500	413260	la vita di ogni impresa. Ho parlato di sanità, di come sia giusto attribuire alla responsabilità
413260	418220	più vicina ai cittadini quella delle regioni, la responsabilità appunto della sanità.
418980	424000	Certamente chi governa vicino ai cittadini ha più sensibilità, ha più capacità di
424000	429100	conoscere i veri problemi degli ospedali, delle cliniche rispetto a un governo lontano
429100	436220	a Roma centralizzato. Ho parlato per la scuola e per la sanità di buono scuola e di buono
436220	442160	salute, quegli assegni che lo Stato dovrebbe dare alle famiglie più bisognose per dare
442160	446520	a loro la vera libertà, la possibilità di scegliere se mandare i propri cari a farsi
446520	452520	curare in un ospedale pubblico o di spendere questo buono in una clinica privata oppure
452520	456500	di mandare i loro figli alla scuola pubblica o alla scuola privata. Ho parlato di ambiente,
456500	462340	ho parlato di qualità della vita, ho parlato di giustizia civile. Ho parlato ogni giorno
462340	466060	a lungo per diverse ore di tutti questi problemi concreti.
466140	474020	Vi domando, a tutti voi che siete qui, domando se vi è giunta una lontana eco di tutto questo
474020	484300	sforzo che io ho fatto. È uscito fuori soltanto la cronaca della politica spicciola, soltanto
484300	490700	i battibecchi tra l'uno e l'altro capobastone, soltanto il teatrino, così l'ho chiamato
490700	496960	io, della politica, di quella politica che appare in televisione quasi incomprensibile
496960	503400	e che non può che allontanare da se stessa un gran numero di cittadini, che oltretutto
503400	510400	hanno anche il diritto di essere disgustati, perché chi non si ricorda quei referendum
510400	520960	per cui siamo andati a votare, che sono diventati carta straccia, chi non sa che il voto espresso
520960	527600	nel 1996 anche dagli elettori della sinistra è stato disatteso perché avevano eletto
527600	532820	Prodi come Presidente del Consiglio con un colpo di palazzo, l'hanno mandato a casa e
532820	539400	attraverso una maggioranza che si è formata, attraverso il trasformismo, il peggio della
539400	545300	vecchia e prima repubblica con l'acquisto di eletti che erano stati eletti nelle file
545300	549560	dell'opposizione per contrastare la sinistra, si è formata questa nuova maggioranza che
549560	555660	ha portato per la prima volta, dopo 50 anni di democrazia, senza passare dal voto degli
555660	562180	elettori un figlio del partito comunista a Capotavola, a Palazzo Chigi. Quindi capisco
563100	575540	che questi cittadini possano dire ma io non vado a votare, perché tanto poi il mio voto
575540	583400	non cambia nulla e io dico a loro se siete contenti di quello che succede, di come vanno
583400	590480	le cose, se siete contenti dei servizi pubblici che non funzionano, dei tanti scioperi incontrollati,
591000	596720	di questa criminalità e di questa immigrazione clandestina che ci assedia, se siete contenti
596720	605120	di come aumenta la vita delle famiglie, questo caro vita che avanza e se non pensate, io
605120	609680	lo penso, che questo governo della sinistra possa addirittura, dato che non sa governare
609680	618780	e che governa secondo certe vecchie de-stataliste che vengono purtroppo da molto lontano, questo
618780	626060	è una situazione, fate bene a non andare a votare, io credo invece che voi dovete
626060	631240	avere ancora fiducia e questo è il messaggio che tutti voi che siete qui e se siete qui
631240	637540	e perché credete nell'utilità ancora di un impegno civile, di una passione politica,
638500	645540	di un voto per mandare al governo delle regioni, del paese, degli uomini concreti che sappiano
645540	651180	con una politica concreta cambiare le cose, io dico anche a questi cittadini che non pensano
651180	656820	di essere utili ad andare a votare, io dico che dovete avere ancora fiducia, dovete però
656820	664320	scegliere bene a chi dare il vostro voto, dovete darlo a chi nella sua vita ha dimostrato
664320	670580	di non essere solo un uomo di parole ma di essere un uomo che ha saputo realizzare grandi
670580	684560	cose, grandi opere, ha saputo conquistare e raggiungere grandi traguardi. Purtroppo
684560	691100	i mezzi di comunicazione non ci hanno aiutato, sapete anche che è intervenuta questa legge,
691100	697580	la legge sulla cosiddetta par condizio che ha dato a noi, partito che ha avuto il 25%
697580	704100	nelle ultime elezioni europee, soltanto il 4% della presenza televisiva, a noi viene
704100	710200	lo stesso spazio in radio e in televisione che viene dato a qualunque degli altri 22
710200	716780	pur piccoli o piccolissimi partiti, credo che sia stata una mossa molto precisa, ne siamo
716780	722800	convinti tutti, per bloccare la nostra possibilità di mantenere quel consenso tra la gente,
722800	728340	perché sapete bene che c'è una regola che vale per tutti i campi, che chi ha un determinato
728340	734720	consenso per mantenerlo deve avere la stessa quota dentro tutta la comunicazione che riguarda
734720	740060	la politica, quindi noi per mantenere un consenso che negli ultimi mesi i sondaggi hanno rivolato
740060	747160	a essere intorno al 35, anche con punte al 36%, avremmo dovuto avere la possibilità
747160	752540	anche a spese nostre, anche a spese dei nostri sostenitori, di produrre una comunicazione
752540	760260	politica che arrivasse a un terzo almeno di tutta la comunicazione politica globale. Siamo
760260	767080	invece in una condizione completamente diversa, nelle trasmissioni cosiddette di comunicazione
767080	775000	elettorale abbiamo il 4%, nelle trasmissioni cosiddette per le coalizioni, noi che insieme
775000	781800	agli altri partiti del Polo e ai nostri alleati, abbiamo nei sondaggi ben più del 50% del
781800	787920	consenso, abbiamo soltanto un quarto stasera per esempio, ci sarà in televisione uno
787920	794240	spettacolo da Vespa sulle coalizioni, saremo noi da soli con solo Tremonti che ci rappresenterà
794240	803840	tutti quanti siamo contro tre avversari, un rappresentante del PCP di SDS, un rappresentante
803840	810860	dei Radicali, un rappresentante di quel partito fantasma che si è scoperto essere una coalizione
810860	819080	che è il partito umanista e noi siamo uno contro tre. Se a questo aggiungete la grande
819080	826320	stampa che sta molto più di là che di qua e se a questo aggiungete tutti i telegiornali
826320	833100	anche quelli delle televisioni private che danno alla sinistra il doppio dello spazio,
833100	840620	che danno a noi, vi accorgerete che è soltanto per la grande qualità del nostro messaggio
840620	851640	che noi possiamo sperare di vincere come vinceremo queste elezioni, perché i signori, mettendo
851640	856680	in campo una pratica quella di combattere l'avversario in ogni modo, in ogni maniera,
856680	863520	con ogni metodo sono riusciti con questa legge a limitare il nostro diritto ad informarvi
863520	873080	e il vostro diritto ad essere informati. E allora capite anche come in questa campagna
873080	879480	elettorale noi abbiamo cercato di parlare di programmi concreti, io ho parlato anche di
879480	886120	ideali, di valori, ho parlato molto di libertà e questa sera vorrei parlare a voi soprattutto
886120	893480	di libertà, ma non posso far a meno di ricordare che a ogni nostra iniziativa, la sinistra
893480	899000	che iniziative non ne ha avute, questa sinistra ha risposto con la mistificazione e con la
899000	909440	calunia. Abbiamo presentato una legge per rendere controllabile l'immigrazione aperta alla
909440	915400	solidarietà verso chi vuole venire in Italia a lavorare secondo le esigenze e le possibilità
915400	922480	della nostra economia e hanno inventato che avremmo invitato i nostri militari a sparare
922480	930760	contro donne e bambini inermi. Siamo andati al sud, a Teano, simbolo dell'unità d'Italia,
931160	937280	abbiamo presentato il nostro piano per il sud con delle norme molto concrete di detassazione
937280	943400	perché se vogliamo risolvere i problemi del sud bisogna che le imprese trovino conveniente
943400	948500	di installarsi al sud e allora bisogna cambiare la situazione attuale, ci hanno insultato
948500	955160	dicendo che il nostro atto era un insulto alla storia d'Italia. Io di fronte a una
955160	961900	domanda che equivaleva presa poco a un giochino tipo tra D'Alema e Veltroni chi preferisci,
962040	966140	è molto difficile dare una risposta, cioè chi vorrebbe buttare giù dalla torre, io
966140	972820	naturalmente ho risposto tutti e due, mi hanno stretto e mi ha detto sì ma chi per
972820	979320	il primo ha detto Veltroni e allora hanno scambiato questo come un mio invito al dialogo
979320	986360	rivolto a D'Alema, l'ho smentito subito dopo in giornata e D'Alema per cinque o sei
986360	993260	giorni è andato avanti a dire Berlusconi mi ha chiesto un dialogo, come si fa a confrontarsi
994240	1001260	con chi come metodo, come tecnica mistifica tutto, con chi ti fa dire cose che non hai
1001260	1008100	mai detto e mai neppure pensato, ieri sera Veltroni in televisione ha detto Berlusconi
1008100	1015380	ha paura di confrontarsi con me, io non ho paura di confrontarmi con nessuno tanto meno
1015380	1026960	con Veltroni ma trovo che sia assolutamente inutile di confrontarsi con chi si comporta
1026960	1034380	con chi agisce come agisce Veltroni e con lui gli altri capi di quel partito che oggi
1035120	1044180	è un partito che rappresenta soltanto un esercito di professionisti della politica che hanno
1044180	1051320	perso ogni utopia, ogni ideale che sono lì a fare politica perché non sanno fare altro
1051960	1062440	e cercano disperatamente un programma, un ideale che hanno soltanto una cosa sicura
1062440	1069880	in testa, loro devono fare politica, per vivere bene devono avere il potere, devono
1069880	1075440	fare i privilegiati del potere, per fare questo devono fare la guerra agli avversari anzi
1075440	1080240	per loro gli avversari non sono avversari ma sono soltanto nemici, il nemico l'hanno
1080240	1092380	trovato, eccolo qua Silvio Berlusconi presente, questo gli basta per camuffare l'enorme vuoto
1092380	1101240	di ideali, di programmi che ormai è la loro linea politica dopo il fallimento totale
1101240	1110220	della loro storia, della loro tradizione, del loro credo politico e allora io credo
1110240	1118480	che noi siamo avvisati anche dai loro comportamenti in questa campagna elettorale che questa gente
1119080	1128060	è pericolosa, è pericolosa per il nostro benessere, è pericolosa per la nostra libertà,
1128500	1137900	io credo che noi abbiamo il dovere di capire anche perché si comportano così, perché
1137900	1144240	utilizzano questi metodi che sono il metodo del discredito quotidiano dell'avversario,
1144660	1150920	della demonizzazione dell'avversario, della criminalizzazione dell'avversario, dell'eliminazione
1150920	1158140	dell'avversario attraverso i loro magistrati, i loro PM, la sinistra giudiziaria che si
1158140	1164360	è costituita all'interno della magistratura come un autentico soggetto politico che fa
1164360	1168940	una politica con le indagini, con i processi, con le sentenze politiche.
1174060	1183520	Allora, facciamo un rapidissimo escursus sulla loro storia perché questo ci fa capire perché
1183520	1193520	la loro mentalità è quella, è ancora quella ed è difficile che cambi. Vi ricordate che
1193520	1201380	quella ideologia partì secondo una concezione della storia che mirava a raggiungere attraverso
1201380	1210740	un lungo e difficile percorso il paradiso in terra, cioè una società senza ingiustizia,
1211080	1216920	senza differenza di classe, senza poveri, senza ricchi, una società in cui ciascuno
1216920	1223500	avrebbe dovuto dare secondo la propria capacità di lavoro e prendere dalla società, dallo
1223500	1233560	ai suoi bisogni. Questo è il comunismo. Per arrivare a quella meta i comunisti hanno
1233560	1240800	sempre detto che chi è comunista e ha il potere deve togliere di mezzo ogni ostacolo
1240800	1247980	ed ecco quindi che nei confronti di chi si oppone a quel percorso bisogna essere inflessibili.
1247980	1255700	Non c'è soltanto il diritto ad eliminarlo, c'è il dovere ad eliminarlo e questo spiega
1255700	1262600	la caterva di vittime innocenti di cui si è macchiato il comunismo lungo tutto l'arco
1262600	1272820	di questo secolo. La prima mossa importante da fare è di eliminare
1272820	1279840	la fonte di ogni male, che è la proprietà privata. La proprietà privata deve passare
1279840	1286660	nelle mani dello Stato a partire dai mezzi di produzione, dalle imprese. Gli imprenditori
1286660	1293200	agiscono secondo il loro proprio individuale interesse, lo Stato invece può fare l'interesse
1293200	1301440	di tutti. Ecco quindi che a poco a poco la proprietà privata a prezzi sanguinosi scompare,
1302120	1309780	lo Stato diventa il padrone di tutto, ma dietro lo Stato si erge come padrone assoluto il
1309780	1316600	partito, è il partito che prende il dominio sullo Stato, è il partito padrone, il partito
1316600	1322340	grande fratello, il partito che representa la verità, che domina lo Stato ed è a sua
1322340	1329780	volta questo partito dominato dai capi del partito, dai Lenin, dagli Stalin e via, che
1329780	1336180	presto fanno del partito una terribile arma per eliminare gli avversari politici, per
1336180	1343680	combattere con il sangue tutti coloro che a loro si oppongono. Ed ecco quindi che il
1343680	1349760	comunismo si appresta alla divisione della società in due poli, da una parte il polo
1349760	1355260	sterminato dei prolotari sempre più poveri, dall'altra parte il polo degli imprenditori
1355260	1362160	sempre più ricchi. Per fortuna la storia non è andata come volevano che andasse, per
1362160	1370940	fortuna è sorta in mezzo a queste due classi, la borghesea, i professionisti, i piccoli imprenditori,
1371060	1376340	i commercianti, gli operatori dei servizi pubblici e tutto questo con l'azione intelligente
1376340	1383920	anche dei sandacati socialisti ha fatto fallire la rivoluzione comunista nel mondo e poi tutto
1383920	1391340	il comunismo per implosione propria, perché è fondato sulla propria intrinseca irrazionalità
1391340	1401980	è caduto come cade un mazzo di carte che non sia stato da nessuno toccato, un castello
1401980	1412240	che si affloscia da solo ed è stato chiaro a tutti che quella ideologia, quel sistema
1412240	1417660	dell'economia nelle mani dello Stato era un sistema che non poteva produrre benessere
1417660	1423900	e ricchezza, che poteva produrre soltanto povertà, che poteva soltanto disperdere risorse,
1425080	1432500	ma gli uomini che oggi sono al governo, tutti quanti, quel sistema, i protagonisti di quel
1432500	1439400	sistema, le ferratezze di quel sistema le hanno tutte conosciute, tutte condivise,
1440520	1449160	tutte coltivate, tutte applaudite per tutta la loro vita e dentro di loro è rimasta
1450400	1458380	invincibile una carica, una mentalità che a quella tradizione, a quella cultura si
1458380	1466940	riferisce e quando io in Parlamento li sento alzarsi e puntare l'indice contro di me in
1466940	1474300	cui vedono il prototipo del libero imprenditore, sento che dentro di loro pensano di me che
1474300	1482860	io sono un asfruttatore degli altri, che io sono il famoso lupo all'uomo, che io sono
1482860	1489760	un signore furbo che fa profitti, che sono come il bottino di un furto, di un'azione
1489760	1496920	indegna, che loro ancora sentono come qualcosa da combattere, hanno dentro di sé una ostilità
1498000	1502680	invincibile nei confronti della proprietà privata, nei confronti di ciò che non possono
1502680	1508200	controllare e dominare, nei confronti dell'impresa privata, della scuola privata, dell'università
1508200	1518760	privata, di tutto ciò che sfugge al loro controllo e hanno dello Stato l'idea che
1518760	1525680	da quell'ideologia deriva. Lo Stato è qualcosa di superiore alla gente, i diritti della gente
1525680	1532000	che non appartengono ai cittadini, ma appartengono allo Stato, che è la fonte di questi diritti
1532000	1537120	che concede graziosamente ai cittadini e che quindi quando vuole può conculcarli, può
1537900	1543900	annularli. Hanno in mente uno Stato che diventa lo Stato maestro, lo Stato medico, lo Stato
1543900	1552620	imprenditore, lo Stato insomma invasivo che si innesta dappertutto e che mira a controllare
1552620	1558760	tutto. E tutto questo vi spiega perché sottraggono al Parlamento intere materie consegnandole
1558760	1564000	al loro governo, la sanità, la scuola, la materia importantissima delle imposte. Voi
1564000	1569320	sapete bene che i Parlamenti Democratici sono sorti nelle moderne democrazie occidentali
1569320	1574580	soprattutto per difendere i cittadini dalle richieste esose dello Stato in materia di
1574580	1581340	imposte. Da lì capite anche perché quel numero che abbiamo solo noi in Italia il 117
1582140	1587660	dove tutti possono vomitare la loro invidia di classe, il loro odio sociale, la loro
1587660	1593120	gelosia verso qualcuno e questo basta perché magistrati e polizia possono iniziare delle
1593120	1599260	indagini nei confronti di qualsiasi cittadino, numero che è retaggio di quei sistemi dove
1599260	1607140	più del 50% dei cittadini faceva la spia e l'altro 50%. Questo spiega la loro mania,
1607140	1613140	la loro smania di occupare il potere, di occupare tutto l'occupabile, istituzioni
1613140	1617920	comprese, compresa quell'altra istituzione come la Corte Costituzionale che dovrebbe
1617920	1623420	essere invece il sommo garante dei diritti dei cittadini. Questa è la loro ideologia,
1623900	1630380	questa è la loro mentalità, questo è il loro statalismo, il loro centralismo, hanno
1630380	1635440	raggiunto il potere, guai a cederne anche piccola parte ai governi delle regioni, guai
1635440	1641000	a cedere la responsabilità della scuola, della formazione, degli ospedali, delle opere pubbliche
1641000	1646180	al Piemonte che non è governato da loro, alla Lombardia, al Veneto che non sono governate
1646180	1651220	da loro e allora ecco la riforma centralista della sanità della Bindi, la riforma della
1651220	1658160	scuola di Berlinguer e via di questo passo. Ecco a cosa noi ci opponiamo con una concezione
1658760	1665800	dell'uomo, della società, dello Stato che è antitetica a questa loro concezione, è
1665800	1672640	la nostra concezione, direi la nostra filosofia della libertà, oserei dire la nostra religione
1672640	1680900	della libertà. Per noi l'uomo ha dei diritti che gli derivano dall'essere appunto uomo,
1681380	1686760	che appartengono a noi donne e uomini perché siamo esseri umani, che ci appartengono per
1686760	1692220	diritto naturale, diritti che vengono prima dello Stato perché noi tutti noi veniamo
1692220	1698180	prima dello Stato e lo Stato non è come per loro, lo Stato divinità, lo Stato superiore
1698180	1703540	ai cittadini, lo Stato che considera i cittadini al suo servizio, no, per noi lo Stato siamo
1703540	1708660	semplicemente tutti noi, lo Stato altro non è che un accordo, che è un contratto, che
1708660	1716740	è una convenzione tra di noi che insieme decidiamo di dare vita a uno Stato per crescere nell'ordine
1716740	1725560	per essere difesi verso l'esterno e nell'interno dall'esercito del male per crescere nel benessere,
1725640	1732740	questo è lo Stato, per noi non è il cittadino ad essere il servitore dello Stato ma è lo
1732740	1746300	Stato a essere servitore del cittadino. Per noi i nostri diritti ci appartengono, dicevo
1746300	1756640	per diritto naturale, lo Stato esiste per garantire questi diritti, per noi le imposte
1756640	1763940	non sono un diritto dello Stato, sono semplicemente ciò che lo Stato ci può chiedere non perché
1763940	1769260	è lo Stato, io sono lo Stato e tu sei il cittadino, tu mi paghi quel che ti chiedo
1769260	1776280	io, no, le imposte trovano la loro legittimazione morale soltanto perché sono la contropartita
1777100	1783020	che uno Stato liberale ci può chiedere per i servizi che ci dà in cambio e solo per quello
1783020	1792580	e sono legittime soltanto quando noi le sentiamo giuste, quando noi sentiamo che lo Stato può
1793320	1797800	chiederci per una norma che è scritta dentro di noi che è carne della nostra carne, un
1797800	1802880	terzo di quello che noi con tanta fatica, con tanto sacrificio abbiamo guadagnato durante
1802880	1809000	un anno, allora ci sembra giusto, ma se lo Stato ci chiede come questo Stato della sinistra
1809000	1817940	ci chiede il 50% di quello che abbiamo guadagnato, questo ci sembra un furto e se ci chiede come
1818680	1824520	chiede a quei professionisti che vogliono essere in regola con le 3000 leggi fiscali, con tutte
1824520	1829160	le regole, i regolamenti per dormire tranquilli la notte, per non sentirsi male se qualcuno
1829180	1834860	bussa la loro porta e dice siamo la guardia di finanza, se chiede come chiede oggi a quei
1834860	1840380	professionisti il 60 e più per cento di quello che guadagnano questo ci sembra una rapina,
1840540	1854740	una rapina di Stato. Per noi lo Stato non può occuparsi di tutto, lo Stato deve avere
1854740	1863400	una sua sfera di azione e non deve superare quella sfera, lo Stato deve avere la sua azione
1864540	1870640	delimitata da ciò che i cittadini possono fare da soli e questo è un grande principio
1870640	1877540	di libertà e di democrazia con cui soprattutto voi ragazzi dovete familiarizzare, si chiama
1877540	1884720	il principio di sussidiarietà, è un principio insieme cristiano e liberale e dice che il
1885840	1893240	Stato non deve intervenire là dove i cittadini da soli con le loro istituzioni che sono
1893240	1898740	la famiglia, l'impresa, le cooperative, le associazioni del volontariato possono raggiungere
1898740	1905660	da soli i loro fini, le loro finalità, soltanto quando i cittadini non ce la fanno da soli
