start	end	text
7580	15240	Alla nostra manifestazione, con due brevi interventi di saluto, uno del sindaco di Teano
15240	19240	e uno del presidente dell'amministrazione provinciale di Caserta.
21910	33510	Signor Presidente Berlusconi, onorevoli parlamentari, signore e signori, questa città, famosa
33510	38450	nell'antichità per la fiera difesa della sua indipendenza nelle guerre sannitiche,
39230	47730	ricordata nell'età di mezzo per il placido del 963, assurda nel risorgimento, al simpolo
47730	53790	dell'unità d'Italia, vi accoglio con grande calore e con viva gratitudine per essere oggi
53790	59890	qui convenuti a ricordare che Teano segna il punto d'avvio del cammino dell'Italia moderna.
65090	70190	Consentitemi di aggiungere un particolare benvenuto alla medaglia d'oro Gianfranco
70190	71990	Paglia che è qui con noi.
76730	84150	L'incontro di Teano avrebbe potuto essere uno scontro tra i disegni politico dinastici
84150	90610	del Piemonte e le spinte inserzionali protese alla conquista di Roma e all'istaurazione
90610	105870	repubblicana. Lo scontro tra monarchia e rivoluzione, che avrebbe infranto definitivamente il processo
106610	114230	unitario, divenne invece un incontro. Garibaldi, che aveva vinto di misura sul volturno ma
114230	120710	che non avrebbe potuto violare le fortezze che ancora saltamente resistevano, si guardò
120710	129050	intorno, vite il disordine dell'amministrazione dittatoriale, avvertì nel pullulare di migliaia
129050	137150	di camicie rosse i pericoli dall'essere attorniato da troppi eroi dell'ultima ora, comprese
137150	143770	realisticamente la necessità di rimettere tutto nelle mani del monarca Sabbaudo e lo
143770	151950	salutorre d'Italia. Quel mattino d'ottobre del 1860, sull'altare della Terza Italia,
152990	158970	fu immolata l'indipendenza del Regno fondato sette secoli prima da Ruggero in Normanno
158970	166970	e riscattato da Carlo III di Borbone. Quel giorno nessuno avrebbe osato esclamare Cristo
166970	175850	si è fermato a eboli. La Basilicata, le Calabrie, la Sicilia, la nostra Campania Felix non
175850	183630	erano lande dimenticate, erano terre sulle quali da millenni fiorivano cultura e ricchezza.
184530	190490	Se qualcuno, molto tempo dopo, ebbe emotivo di dire che Cristo si era fermato a eboli,
190490	202030	fu per ragioni estranea alla capacità, alle doti, all'indole di noi meridionali. Se Cristo
202030	207490	si fosse veramente fermato a eboli, di lì bisognerebbe partire per ogni ripensamento
207490	214210	delle strategie politiche del Mezzogiorno. Bisogna invece ripartire da Teano, perché
214210	221110	a sud e a nord di eboli c'è sempre stato un solo popolo, con la sua civiltà, la sua
221110	229030	dignità, i suoi primati. Un popolo che si è lungamente abbandonato alle lamentazioni,
229550	235210	delle quali può fare a meno se ritrova la coscienza e la memoria della sua identità.
236150	242390	E' lo stesso popolo che nelle acque del Piave mescolò il sangue dei suoi figli al sangue
242990	257110	che a Teano erano diventati suoi fratelli. Signori Presidente, signori buongiorno, il
257110	262110	benvenuto di terra di lavoro, il benvenuto a voi di una terra che si pone come cerniera
262110	271510	tra nord e sud. Una cerniera non soltanto geografica, ma una cerniera politica, una
271510	277630	cerniera mediterranea. Noi siamo contenti oggi, siamo orgogliosi che voi abbiate scelto
277630	284090	la nostra provincia, la nostra terra per un incontro che entrerà nella storia del
284090	291050	nostro Paese, nella storia del terzo millennio. Qui, come ha detto il sindaco, si fece l'unità
291050	296550	d'Italia, a cui si mettono le fondamenta, si mettono le basi per una nuova Italia che
296850	303990	nasce dalla diversità. Come in tutti gli ecosistemi, noi siamo persuasi che la ricchezza
303990	311690	nasca non dalla uniformità di molte cose, ma dalla unità di cose diverse. La ricchezza
311690	318530	dell'Italia, del nostro popolo, della nostra nazione consiste proprio in questa deformità,
319490	325390	in questa diversità, ma in un'unità di intento, un'unità di retroterraculturale.
325490	333930	Allora, noi approfittiamo della presenza di un esponente della Lega oggi per fare un appello,
333930	339990	per rivolgere un appello, per essere giudicati per ciò che siamo. Per troppo lungo tempo,
340070	346890	amici della Lega, voi avete giudicato il Mezzogiorno d'Italia, avete giudicato la provincia di Caserta
346890	353030	soltanto come terra di mafia, come terra di malaffare, come terra di camorra. C'è
353030	359590	anche mafia, c'è anche malaffare, c'è anche camorra in questa terra, ma c'è tanta ricchezza.
359630	369470	C'è un'immensa ricchezza umana, c'è un'immensa ricchezza naturale e noi immaginiamo attraverso
369470	374770	un progetto che la provincia, che io stesso ho lanciato di primavera a Caserta, di rinascita
374770	382210	delle coscienze, immaginiamo di dare a voi un esempio, un esempio concreto di ciò che
382210	386630	può terra di lavoro, di ciò che può il popolo meridionale.
387330	393110	Io vorrei fare omaggio a Presidente Berlusconi, ma nel farlo a Presidente Berlusconi lo faccio
393110	398610	a tutti quanti voi, di un mio ricordo personale, di un mio ricordo intimo, cosa a cui sono
398610	403810	estremamente legato. Quattro anni fa la popolazione di terra di
403810	412210	lavoro mi elesse Presidente di questa provincia. Ebbene l'anelito di congiunzione, che affinché
412210	418390	terra di lavoro fosse anello di congiunzione tra nord e sud, si manifestò già allora,
418490	424770	si concretizzò, si materializzò. Io chiesi ed ottenni agli ottimi amici Roberto Formigone
424770	430130	e Antonio Rastrelli di essere miei testimoni nel giuramento di fedeltà alla Repubblica.
433390	438970	E in questa foto che rappresenta uno dei miei ricordi più cari c'è tutto, c'è il Presidente
438970	444510	della Lombardia, il Presidente della Campania, cioè ci sono io Presidente di terra di lavoro
444510	452930	che giuro fedeltà allo Stato e alla Repubblica, c'è un prefetto della Repubblica, c'è il
452930	459810	bandiera d'Italia, ci sono tutti gli ingredienti per che si possa vivere in un Paese libero,
459890	465410	in un Paese civile, in un Paese prosperoso. Noi ci aspettiamo tante cose dal nord e siamo
465410	470490	disponibili a dare al nord tante cose, come abbiamo dato la nostra emigrazione, abbiamo
470490	475730	dato il nostro lavoro che è stata ricchezza per le regioni del nord, è stato uno dei
475730	482150	presupposti dello sviluppo e della ricchezza delle regioni del nord. Per cui vi ringraziamo
482150	487690	veramente da profondo del cuore e speriamo che sia la vostra presenza bene augurante
487690	492550	come lo fu quattro anni fa nella competizione elettorale che mi vide, la non coalizione
492550	499150	del polo vincitrice in questa difficile battaglia, lo sia anche oggi che siamo ancora una volta
499150	503350	impegnati nel rinnovo dell'amministrazione provinciale. Grazie.
521410	532970	Io prendo brevemente la parola anche a nome di Gustavo Selva, Presidente del Grupo Parlamentare
532970	540970	di Alleanza Nazionale e di Marco Follini, Presidente del Grupo Parlamentare del CCD,
541690	551870	che hanno promosso come questo incontro. Ma l'idea di trovarci a Teano non è nostra,
552670	565290	appartiene invece e a pieno titolo a un caro indimenticabile amico che fu ricco di intelligenza
565290	585470	politica e di passione meridionalista, Pinuccio Tattarello. Pinuccio ne parlò per primo con
585470	598630	un uomo del nord, con Giulio Tremonti. Avendo chiarissima la convinzione che soltanto un
598630	610570	progetto politico nuovo che legasse con fili nuovi le sorti del nord e del sud d'Italia
610570	620510	ci avrebbe consentito di riaccendere la speranza civile del Mezzogiorno e completare così,
620510	631050	anche sul piano sociale ed economico, l'opera del risorgimento. Ecco perché oggi noi parleremo
631400	643600	di secondo risorgimento. L'intesa tra il Polo e la Lega è uno di quei fili. Questa intesa,
644400	652280	voluta con particolare tenaccia dal Presidente Berlusconi, rientra a pieno titolo nell'alfeo
652660	662520	di quella geniale intuizione. Tra Polo e Lega, nel Parlamento italiano si è già stabilito
662520	673900	un rapporto fecondo di collaborazione intorno a obiettivi comuni. Tra questi obiettivi vi
673900	683300	è innanzitutto quello di vincere le prossime elezioni politiche per trasferire in programma
683300	692380	di governo ciò che oggi è programma di azione comune. Ma questa azione comune è già in
692380	701820	atto in Parlamento e si arricchirà anche nei prossimi giorni di ulteriori specifiche
701820	709020	iniziative per il rilancio dell'economia italiana in Europa per la ripresa, per la
709020	718760	rinascita del Mezzogiorno. Ma di tutto questo parleranno il Presidente Berlusconi, Gianfranco
718760	730460	Fini, Pier Ferdinando Casini e dopo di loro, seppure con brevi interventi, parleranno Giulio
730460	747860	Premonti, ne parlerà l'amico Maroni. Ne parleranno ancora l'amico Formigoni, candidato
747860	755000	alla Presidenza della Regione Lombardia, la Regione più importante del Nord Italia,
755000	769340	e Antonio Rastrelli, candidato alla Presidenza della Campania, la Regione più importante
769340	787200	del Sud. Il mio compito finisce qui, non mi resta che ringraziare il sindaco e il Presidente
787200	794660	della Provincia e la popolazione di Teano che ci ha accolti con tanta simpatia e di
794660	804160	ringraziare con loro però i nostri leader che hanno aderito con entusiasmo alla proposta
804160	812680	avanzata dai capi gruppo del Polo e tutti gli amici colleghi parlamentari che intervengono
812680	823200	alla riunione. Consentitemi per concludere una sola brevissima riflessione fatta da
823200	834760	meridionale, ma anche da meridionalista convinto, a tanti meridionali. Le sinistre hanno scelto
834760	845480	per questa campagna elettorale l'immagine letteraria di Cristo si è fermato ad eboli,
846880	856260	simbolo della disperazione dei meridionali e della rassegnazione al sottosilupo. Noi
856260	865200	abbiamo scelto il simbolo storico di Teano, ma se ci avessero chiamati a scegliere anche
865200	874520	noi un testo letterario allora avremmo scelto, senza ombra di dubbio, un libro assai più
874520	885960	intenso e più autenticamente meridionale, l'Uva Puttanella. Non solo per evocare la
887560	897460	toccante metafora che è insieme poetica e politica di Rocco Scotellaro, ma anche per
897460	906140	richiamare l'etimologia del termine, perché il sud è stanco, letteralmente stanco di
906140	914220	tante puttanelle del meridionalismo che si risvegliano in campagna elettorale e poi incassati
914220	923180	voti scompaiono e non si fanno trovare se non al successivo appuntamento. Noi siamo venuti
923180	931720	qui per prendere un impegno per l'Italia e per il Mezzogiorno, un impegno che intendiamo
931720	939240	mantenere fino in fondo e lo manterremo. La parola al Presidente Berlusconi.
956680	964060	Eccoci dunque qui, noi tutti congiurati del nord contro il sud, ve li ho portati tutti
964060	972220	congiurati, non c'è rimasto, non è rimasto fuori nessuno, siamo venuti qui con molto
972220	980360	piacere, abbiamo deciso di venire qui in tanti, abbiamo scelto Teano come fatto simbolico
980360	991580	per un gesto simbolico ma concretissimo. Durante una campagna elettorale che ci troviamo a
991580	998420	dover combattere noi con le armi dei valori, degli ideali e con le armi dei programmi,
1000480	1007580	ma con dall'altra parte delle armi che ci vengono puntate addosso, le armi della disinformazione
1007580	1015040	più totale. Ieri si è toccato l'apice ma la disinformazione ha costellato praticamente
1015040	1023420	tutta la campagna elettorale, ci hanno detto e in particolare questo a me che guardavo
1023420	1028680	al passato che ero un retrogrado, che volevo ritornare al proporzionale semplicemente
1028680	1033780	perché avevo detto alziamo gli occhi dalla situazione attuale che tanti guai ci ha portato,
1034140	1041500	guardiamo ad altri sistemi elettorali che possono andare dal sistema tedesco che ha
1041500	1048700	50 anni, 5 partiti, il bipolarismo, l'alternanza o anche quello che c'è sui nostri programmi,
1048840	1055000	un maggioritario vero con l'elezione diretta da parte di un presidente che sia anche il
1055000	1062000	capo dell'esecutivo. Abbiamo poi presentato una nostra proposta, una legge di iniziativa
1062000	1068140	popolare per cercare di risolvere un problema che deve essere risolto e che è completamente
1068700	1074880	di mano alla sinistra. Il problema dell'immigrazione non sappiamo ancora oggi nonostante le nostre
1074880	1080600	continue richieste quanti siano gli immigrati clandestini che sono entrati in Italia, quanto
1080600	1085200	ne sono usciti per altri paesi, quanti ce ne sono qui, quanti lavorano in nero, quanti
1085200	1090980	sono dediti alla delinquenza, sappiamo soltanto che l'anno passato rispetto all'anno precedente
1090980	1098780	i reati sono aumentati del 18% e che la preoccupazione della nostra gente del nord come del sud
1098780	1107040	per la propria sicurezza è sempre più elevata. Anche lì ci hanno detto che avevamo invitato
1107040	1117480	a sparare sulle donne e sui bambini. Io sono intervenuto scherzosamente contro chi raccontava
1117480	1124820	le barzellette spinte e ho citato le barzellette del humor nero e mi hanno detto che io sono
1125600	1136460	i malati di AIDS. Poi negli ultimi due giorni è venuta fuori un'altra fanfaluca, quella
1136460	1143160	della mia apertura ad Alema, addirittura avevo detto in dieci porti in nove giorni, nessun
1143430	1150150	dialogo con questa sinistra antidemocratica, una sinistra che usa dei suoi numeri in Parlamento
1150150	1155570	per approvare una legge che sia a proprio vantaggio contro l'opposizione, una legge
1155570	1161310	che riguarda le regole fondamentali del gioco democratico, le elezioni, la comunicazione
1161310	1170990	in periodo elettorale e è venuto fuori distinguendo io tra chi fosse peggio tra Veltroni e tra
1170990	1177110	Alema che io avendo considerato il peggio Veltroni rispetto ad Alema che io avevo fatto
1177110	1185430	un'apertura ad Alema e poi infine il tutto ieri si è concluso con addirittura l'accusa
1185430	1192190	fatta da sapete chi su un giornale che è la gazette ufficiale della sinistra che addirittura
1192990	1199230	ha affermato come cosa vera che ci sarebbe stato un patto segreto siglato tra il sottoscritto
1199230	1204550	e l'onorevole Bossi, un patto segreto che avrebbe fatto del nord qualcosa di staccato
1204550	1213150	di diverso dal sud che avrebbe addirittura attentato alla unità nazionale. Noi speriamo
1213150	1218990	anzi siamo certi che i cittadini sappiano sceverare con la loro intelligenza, con la
1218990	1229210	loro pespicacia le fandonie da ciò che è la verità. Anche se temiamo fortemente, questo
1229210	1234910	cittadini per la dominanza televisiva della sinistra, televisiva e giornalistica della
1234910	1239850	sinistra. Ieri sera ho avuto dei dati ancora non ufficiali, verranno fuori credo oggi o
1239850	1246770	domani, a un partito come Forza Italia che aveva prima dell'inizio della campagna dell'elettorale
1246770	1254430	intorno al 35% da tutti i sondaggi viene dato il 13% di presenza nei telegiornali, cioè
1254430	1260250	su 500 milioni di contatti noi abbiamo il 13% al mio amico Gianfranco Fini che stava
1260250	1270990	intorno al 15% viene dato il 7,5%. Alla signora Bonino che è stata elevata a coalizione
1270990	1276710	come un altro partito virtuale, il partito umanista a cui viene stato dato un altro 25%
1276710	1283310	bene nei telegiornali viene dato il 7,5% e voi conoscete le regole della comunicazione
1283310	1289030	che riguardano la quota di consenso parametrata alla quota di comunicazione, a lungo andare
1289030	1295790	la quota di comunicazione porta la quota di consenso a livello suo, quindi noi ci troviamo
1295790	1304750	già così nella comunicazione fuori da questa legge bavaglio che ci ha dato a ciascuno di
1304750	1312350	noi un 23esimo, quindi come il più piccolo dei partiti, ha inventato le coalizioni e
1312350	1320070	quindi si sono presi il 75% perché sommano la sinistra, sommano la lista Bonino, almeno
1320070	1325490	sarà chiaro credo definitivamente ai nostri elettori che chi vota Bonino vota Pannella
1325490	1331970	e vota soprattutto per la sinistra, questo credo che sia un fatto che ormai nessuno potrà
1331970	1339890	più discutere, ma ci troviamo là nelle coalizioni ad essere uno contro tre, perché sia radicali
1339890	1346050	che questo partito manista che naturalmente alla sinistra insieme sparano contro la casa
1346050	1352030	delle libertà, questo nei telegiornali poi c'è la parco ondice poi c'è la carta stampata,
1352210	1357750	quindi è veramente un miracolo se sopravvive la nostra maggioranza che è ancora assoluta,
1357890	1366330	eravamo al 57% siamo ancora al 54% è un miracolo perché naturalmente il buon senso degli italiani
1366330	1372750	sta sfidando le leggi scientifiche della maturazione della formazione del consenso,
1372990	1378710	dico per inciso che anche il risultato elettorale sarà un risultato distorto, ecco vorrei che
1378710	1385010	sia chiaro che non siamo che al sud è utile anche a quella parte del Paese che la Lega
1385570	1386450	rappresenta, grazie.
1411870	1418630	Questo è un giorno in cui è meglio ascoltare che parlare, è stato bellissimo il discorso
1418630	1424610	del sindaco, sono stati bellissimi in progressione tutti i discorsi, io devo fare una presentazione
1424610	1431190	tecnica, non un discorso, noi è stato detto dal Presidente Berlusconi presenteremo un
1431190	1436930	programma definito per articolati di legge, le dodici tavole della legge, una è questa
1436930	1443050	e riguarda gli aiuti fiscali per il sud, non sarà solo questo per il sud, è già stato
1443050	1454590	detto le opere pubbliche perché il Paese deve essere aperto all'Europa e unificato la nuova
1454590	1461590	è la proposta che presentiamo oggi, è una proposta in salita, è stato detto dall'onorevole
1462170	1468990	fini l'Europa ha cambiato la struttura della politica, gli Stati trasferiscono sovranità
1470470	1476990	a Bruxelles, Bruxelles domina ormai anche il campo fiscale, per fare uno sgravio fiscale
1476990	1481870	per il sud occorre chiedere il permesso a Bruxelles e bisogna rispettare i criteri di
1483630	1488870	Bruxelles, Bruxelles e l'Europa vietano gli aiuti di Stato, vietano gli aiuti fiscali
1489550	1496470	salvo eccezioni, si possono chiedere eccezioni come le chiede il Governo Dalema chiedendo
1497190	1503170	un premio per il lavoro nero, Dalema ragiona così, abbiamo il lavoro nero, facciamo finta
1503170	1510130	che il lavoro nero non esista quando diventa bianco, sono posti di lavoro nuovo ed è
1510130	1517890	la via sbagliata, probabilmente sarà bocciata. Noi abbiamo trovato e vogliamo seguire una
1517890	1526270	via diversa, nel ordinamento comunitario c'è la possibilità di aiuti alle regioni
1526270	1535650	d'Europa dove il tenore di vita è anormalmente basso o in cui è strutturata una grave forma
1535650	1542550	di sottocupazione. Questi due elementi, il tenore di vita basso e la sottocupazione strutturata
1542550	1551730	sono purtroppo caratteristici di molte parti del sud. Per le imprese che operano o si impiantano
1551730	1557890	in queste zone noi vogliamo una fiscalità abbattuta ad un terzo, per parlare in italiano
1557890	1560010	nel nord a cento lire, nel sud a cento lire, nel sud a cento lire, nel nord a cento lire,
