start	end	text
0	3420	basandoci sulle elezioni tratte da tale esperienza.
3720	11560	Signor Presidente, dal 1993 il Giappone ha riorganizzato il Ticada Tokyo International Conference on African Development,
12100	16180	il cui obiettivo è di attuare lo sviluppo sostenibile in Africa.
16520	25980	Nel 2003 il Ticada 3 avrà luogo in Giappone e parteciperanno a questo incontro vari leader di paesi africani.
25980	34860	Inoltre, sia al vertice dei G8 e al vertice di Johannesburg di quest'anno, lo sviluppo africano sarà un argomento importante.
35440	38980	In questo contesto il Giappone ha promosso l'aiuto agricolo all'Africa,
41240	46660	facendo meglio uso della sua esperienza per migliorare i prodotti alimentari in Asia.
47060	51080	Come parte di questi sforzi siamo stati coinvolti in una ricerca sperimentale
51080	61060	della NERICA, il nuovo riso per Africa, e la nostra ricerca ha contribuito al miglioramento della carestia in Africa.
61420	67560	Noi abbiamo l'intenzione di continuare ad aiutar attivamente l'Africa come abbiamo evidenziato nel caso della NERICA.
67920	76420	Inoltre, dal 2000 abbiamo iniziato ad attuare un aiuto con la FAO applicando il fondo di sicurezza umano ed altri
76420	84240	al fine di raggiungere la garanzia di sicurezza alimentare nei paesi africani laddove la situazione della malnutrizione è estremamente grave.
85380	94780	Inoltre, abbiamo appoggiato in modo fortissimo lo sviluppo delle risorse idriche dei paesi emergenti per un aumento nella produzione alimentare.
95140	104560	D'altro canto, date le risorse idriche limitate, è richiesto un controllo efficace del effettivo delle risorse idriche
104560	114240	al fine di abordare questi problemi. Ci sarà un forum sull'acqua mondiale, il 3 marzo, nel 2003 in Giappone.
114560	124440	Insieme a questo concesso ci sarà anche l'incontro dei Ministri dell'Agricoltura che avrà luogo in organizzazione congiunta tra Giappone e FAO.
124540	132560	Infine vorrei ribadire l'importanza e l'urgenza della cooperazione di ogni paese per raggiungere l'obiettivo di ridurre il numero di denutriti
132690	146690	non oltre il 2015. Come è stato concordato, il vertice del 1996 in Giappone aborderà in modo aggressivo il problema della malnutrizione insieme agli altri paesi a livello mondiale.
154590	159010	Vorrei ringraziare moltissimo della vostra attenzione. Grazie.
165090	182490	Grazie Signor Ministro. Nell'invitare tutti i delegati a spegnere i telefonini, sospendo la seduta per una breve pausa per permettere di cambiare il podio, vi prego di non lasciare l'aula. Grazie.
194890	211110	Buongiorno a tutti, buongiorno soprattutto ai superstiti, immagino interessati ai problemi della fame ma anche un po' innamorati di Roma, che in questi giorni ha offerto un tempo eccezionale e naturalmente tutto merito del governo italiano.
220750	230110	Chiudiamo quindi questo vertice che mi pare dai dati che ci hanno comunicato sia stato un successo di partecipazione.
231350	247650	Anzi, mi dice il direttore Diuff che questo vertice ha registrato la partecipazione più importante, più estesa di tutti i vertici intergovernativi del passato.
247650	268590	Ci sono stati 6.613 partecipanti, i Paesi sono stati in totale 181, 74 i capi di Stato e di governo, 248 i Ministri di Stato.
268590	281870	Ci sono state mille organizzazioni che si dividono in 450 organizzazioni governative e 550 organizzazioni non governative.
281870	302070	La stampa che è venuta qui a seguire i lavori e naturalmente facendo il suo mestiere, che è quello di criticare, ha avuto 1.600 rappresentanti tra carta stampata e televisione.
302070	327990	E infine i delegati sono stati 4.000. Quindi io credo che sia stato utile questo vertice, vedremo i suoi risultati, ma certamente cinque anni dopo il primo vertice sulla sicurezza alimentare era secondo me necessario, anzi forse indispensabile,
327990	344990	una maggiore presa di coscienza di questo problema nelle sue terribili dimensioni internazionali affinché ci fosse un rinnovato impegno politico di tutti i Paesi.
345250	367550	Dei Paesi anche occidentali di cui la stampa qui ha lamentato la mancanza di presenza dei leader, ma tutte le delegazioni c'erano e io posso dire che un leader ha impegni di governo rilevanti e si spaventa quando gli viene presentato un programma di 4 giorni,
367550	379550	ma d'altronde erano necessari 4 giorni affinché tutte le delegazioni potessero esporre la loro visione del tema su cui si discuteva.
379550	387770	Alla fine della prossima settimana ci saranno le registrazioni scritte di tutti gli interventi.
387770	407310	Io mi carico come Paese ospitante la responsabilità di conoscere, quindi di leggere e di far leggere tutti gli interventi, nessuno esclusi, di estrarre da questi interventi le idee più innovative, più pragmatiche, più concrete,
407310	419310	e di farmi portatore di queste idee nei confronti dei miei colleghi che avrò l'occasione di incontrare per quanto riguarda i colleghi europei al Consiglio.
419310	430530	Stesso tempo la qualità degli alimenti. In occasione del forum del settore privato svoltosi a Roma il 12 giugno gli organismi partecipanti hanno assunto alcuni puntuali impegni,
430710	447510	e in questo modo che abbiamo voluto manifestare il nostro contributo all'azione della FAO alla quale il settore privato dà la propria disponibilità a collaborare direttamente e indirettamente nel dialogo sulle politiche così come nell'impegno sul campo.
447510	460630	In sinergia con la cooperazione governativa o con quella decentrata. E' in questa maniera che aspiriamo a partecipare attivamente alla risoluzione del più grande problema che l'umanità deve fronteggiare all'inizio del III millennio,
460830	468750	in sintonia con le Nazioni Unite, con le altre organizzazioni internazionali e con i governi impegnati nella lotta contro la fame e la povertà.
468750	491110	A questo scopo le organizzazioni del settore privato hanno individuato i seguenti impegni, promuovere iniziative per la individuazione di interventi umanitari da realizzarsi con la disponibilità.
491110	513510	Sono soprattutto gli organi della rappresentanza, infatti, che danno legittimità politica all'azione dei governi, che assicurano che tale azione riscuota il sostegno popolare e che vegliano affinché gli impegni assunti dallo Stato,
513510	526030	quali quelli di Roma di 5 anni fa siano rispettati. Per tale ragione l'Unione Interparlamentare, dopo aver seguito da vicino il vertice mondiale sull'alimentazione del 96,
526030	544130	ha effettuato nel 1998 un primo monitoraggio sui risultati raggiunti ed ha sentito la necessità di contribuire con una giornata parlamentare alla verifica che è stata compiuta nei giorni scorsi dal summit della FAO qua a Roma.
544130	572530	Alla giornata parlamentare hanno partecipato, ospiti del Parlamento italiano, 200 parlamentari di oltre 80 paesi. I partecipanti alla riunione hanno espresso la loro preoccupazione in merito al fatto che, 5 anni dopo il vertice, l'obiettivo dichiarato di ridurre della metà il numero di persone denutrite nel mondo entro il 2015 sembra più distante che mai.
572530	593970	Il numero soltanto poche nazioni hanno dotato misure adeguate all'obiettivo da raggiungere. Il numero di persone denutrite rimane alto in modo inaccettabile, mentre il ritmo con il quale il loro numero diminuisce rimane basso in modo altrettanto inaccettabile.
595350	614070	Già nella sua ultima sessione di Marrakesh, l'Unione interparlamentare aveva dotato un messaggio speciale da rivolgere al vertice. I parlamenti, membri dell'Unione interparlamentare, riprendendo i contenuti di quel documento, considerano di primaria importanza.
614070	637550	Primo, riaffermare il diritto di ogni persona ad una alimentazione adeguata e dalla libertà dalla fame. Secondo, intraprendere con urgenza azioni a livello nazionale ed internazionale volte ad assicurare che l'obiettivo di ridurre della metà il numero delle persone denutrite entro il 2015 sia raggiunto.
638950	661230	Terzo, impegnare ulteriori risorse per ridurre la minaccia delle carestie, in particolare attraverso una migliore pianificazione dell'assistenza allo sviluppo. Quarto, convenire su misure che comportino agevolazione o la cancellazione del debito dei paesi in via di sviluppo, con particolare riguardo per paesi meno sviluppati.
672150	683550	Sesto, nell'ambito dei negoziati commerciali multilaterali sull'agricoltura, determinare termini e condizioni che conducono ad una migliore sicurezza alimentare.
684790	711850	Siamo lieti, signor Presidente, di vedere che molti di tale richieste sono contenute nel testo della Diclarazione del Vertice Alimentare Mondiale cinque anni dopo. Per parte nostra, ci impegniamo oggi, come cinque anni fa, ad incoraggiare i governi ad adottare politiche economiche e sociali che siano pienamente conformi con gli intendimenti e gli impegni del Vertice Mondiale Alimentare.
713590	730690	Vogliamo sottolineare il testo del paragrafo 10 della Diclarazione del Vertice Alimentare Mondiale, che chiede agli Stati l'elaborazione di linee guida dirette alla progressiva realizzazione del diritto per tutti ad una alimentazione adeguata.
730690	744050	Siamo convinti che tali linee guida dovranno ribadire l'obbligatorietà del diritto all'alimentazione e suggerire modalità concrete per la loro attuazione.
744050	763730	Esse dovranno anche specificare quali obblighi vengono assunti direttamente dagli Stati, sia a livello nazionale che internazionale, senza trascurare le responsabilità e il contributo di altri soggetti, quali le organizzazioni internazionali ed eventualmente private.
764730	778510	Signor Presidente, signori delegati, c'è bisogno dell'appassionato impegno di tutti per raggiungere l'obiettivo ambizioso e doveroso che il vertice dell'alimentazione sia dato.
778510	794510	I parlamenti e l'Unione interparlamentare sono pronti a fare la loro parte per assicurare ai popoli diseredati della terra una prospettiva di vita e una speranza di dignità. Grazie, signor Presidente.
803670	818270	Grazie, Presidente Casini. Credo che abbia ben sintetizzato con questo rapporto anche gli argomenti che sono usciti dalla maggioranza degli interventi di questo vertice.
818270	845510	Siamo arrivati alla fine dei lavori e credo che sia opportuno per dare anche la soddisfazione del tanto lavoro di organizzazione che è stato fatto, dare la parola al signor Diuffa, ma vi invito prima ancora di dargli la parola ad accogliere il suo intervento con un applauso.
861230	865270	Grazie al Consiglio.
867090	870230	Eccelense, signore e signori.
871770	880590	Tengo in primo luogo a ringraziarle voi che siete venuti così numerosi, così motivati a questo consesso.
881290	887230	Nonostante le vostre enormi responsabilità, avete trovato il tempo di partecipare a questa riunione
888130	896230	per aiutare 800 milioni di persone nel mondo a ritrovare la speranza in un futuro migliore.
899030	906850	Numerosissimi cape di Stato e governo, Premi e Ministri, Vice-Premi e Ministri,
906890	913350	i rappresentanti dei Stati sono venuti qui per lavorare insieme in uno spirito di solidarietà,
914070	918390	di universalità che caratterizza la famiglia delle Nazioni Unite.
919210	925970	Questo conferma che gli sforzi che abbiamo spiegato per preparare questo vertice non sono stativani.
926970	935950	Vuo a ricogliere questa occasione per ringraziare molto vivamente l'insieme del personale dell'affao
935950	941470	a tutti i livelli per la qualità e l'efficacia del lavoro svolto,
942230	946670	per assicurare il successo di questo vertice.
948250	954110	Questi quattro ultimi giorni sono stati per tutti noi una fase importante
954110	966790	verso il nostro obiettivo comune di eliminare la fame in un mondo in cui avrebbe dovuto essere ormai scomparsa da molto tempo.
967470	975510	Quello che doveva essere fatto per raggiungere l'obiettivo del vertice del 96 non è stato ancora realizzato.
977970	983750	Gli affamati sono lo stesso numero praticamente di cinque anni fa.
985170	991510	Questa triste realtà ci ha portato a convocare il vertice mondiale dell'alimentazione cinque anni dopo.
993450	1000910	Oggi la vostra presenza qui, la vostra dedizione, il vostro impegno,
1000910	1007370	sono tutte prove che oltre agli impegni internazionali,
1007810	1016910	ogni paese adotterà delle misure concrete al fine di attuare le azioni individuate
1017490	1024770	nella dichiarazione che avete adottato il primo giorno del vertice.
1025730	1031570	Al momento in cui si conclude questo vertice ho il grande piacere di annunciare
1031570	1039910	che 53 state e la comunità europea hanno approfittato della loro presenza a Roma
1039910	1049710	per firmare il trattato internazionale sulle risorse genetiche per l'alimentazione e l'agricoltura
1049710	1055210	che ha adottato la conferenza della FAO nel novembre 2001.
1056150	1061550	Inoltre 7 state l'hanno già ratificata.
1063070	1069130	Ribadisco quindi qui il mio appello affinché tutti i governi lo firmino
1069710	1076070	e intraprendano il più presto possibile le procedure necessarie per la ratifica.
1077750	1080050	Siete arrivati a un ampio consenso sulle...
