start	end	text
2122670	2146670	Bene questa mattina partendo da Roma io ho chiesto alla mia segreteria di darmi due paginate, una pagina e mezza per la verità del primo discorso con cui io nel 1994 decisi di lasciare la mia carriera che mi piaceva moltissimo di imprenditore per mettermi al servizio del Paese e della sua libertà.
2150050	2176590	Le ho letti questi passaggi e vi chiedo la pazienza di ascoltarne una rilettura perché questo è ciò che noi mettiamo in pratica ogni giorno sviluppando quel lavoro di cui gli italiani ci avevano dato la responsabilità con la loro fiducia.
2177350	2203850	Io al governo credo di poter affermare con orgoglio che mai se un provvedimento da presentare sul tavolo del Consiglio dei Ministri avesse in sé dei rischi per la libertà dei cittadini, avesse in sé qualche cosa che potesse diminuire la libertà dei cittadini quel provvedimento è stato lasciato nel cassetto, non è stato mai neppure presentato al Consiglio dei Ministri.
2203850	2230850	E la stessa cosa ho fatto quando c'erano i provvedimenti che alzavano la pressione fiscale, con noi la pressione fiscale è diminuita di due punti e anche qui non credete alle menzogne della sinistra, noi avemmo da loro, dal loro precedente governo dei conti dello Stato in disordine con un buco di 38 mila miliardi di livecchie lire, buco certificato dall'Unione Europea.
2230970	2255910	Loro hanno avuto da noi conti in ordine e un'entrata fiscale superiore alle previsioni di 28 mila miliardi, quindi non avevano e non hanno nessun bisogno di fare una finanziaria che aumenti di due punti la pressione fiscale togliendo dalle tasche dei cittadini ciò che loro si apprestano a togliere.
2255910	2270910	Bastava una finanziaria che diminuisse le inefficienze, che colpisse i privilegi, che abbattesse gli sprechi della spesa pubblica e improduttiva e questa era sufficiente per restare nei conti che pretende da noi l'Europa.
2275510	2296790	Michele, allora dissi, parlando a braccio, che dovevo rappresentare quali erano i valori che fondavano il nostro impegno civile e dissi sono gli stessi valori di tutte le grandi democrazie occidentali.
2296790	2309950	Subito pensai che quel movimento a cui io volevo dare vita doveva iscriversi nella grande famiglia europea della libertà e della democrazia il partito del popolo europeo.
2309950	2337230	Cosa che abbiamo fatto e devo dirvi che in queste settimane si stanno fondando in tutta Italia specie per impulso dei giovani, dei circoli della libertà che vogliono arrivare ad essere presenti in tutti i comuni italiani che sono più di 8 mila e che vogliono essere in Italia l'espressione del partito del popolo europeo.
2337230	2362230	E vi dico subito che per quanto mi riguarda, ci riguarda come Forza Italia se davvero dovesse nascere questo movimento spontaneo che ha come manifesto il manifesto del partito popolare europeo Forza Italia sarà lieta di aderire tutta quanta, tutto insieme a questo nuovo più grande partito della libertà.
2364090	2387450	Allora io dissi e ripeto, convinto, noi ripetiamo convinti, noi crediamo nella libertà in tutte le sue forme molteplici e vitali, nella libertà di pensiero e di opinione, nella libertà di espressione, nella libertà di culto di tutti i culti, nella libertà di associazione.
2388810	2412110	E oggi invece a Roma c'è stato uno sfregio la libertà, erano scesi in piazza a protestare i professionisti romani, sono stati circondati da un imponente schieramento di forze di polizia che impediva a chi era nella manifestazione di uscirne e chi era fuori e voleva entrarne di entrarci.
2412110	2419110	Non credo che i professionisti siano pericolosi delinquenti, pericolosi no global, pericolosi clandestini.
2421870	2446330	Dissi, noi crediamo nella libertà di impresa, nella libertà di mercato regolata da norme certe, chiare e uguali per tutti, ma avvertì, la libertà non è graziosamente concessa dallo Stato, come pensano i signori dalla sinistra, che dicono che tutti i diritti dei cittadini sono dati per gentile concessione dallo Stato.
2446330	2462510	Perché lo Stato è ad essa anteriore, la libertà viene prima dello Stato, la libertà è anteriore allo Stato, è un diritto naturale che ci appartiene in quanto siamo esseri umani e che semmai essa sì.
2462510	2477470	La libertà fonda lo Stato, cioè lo Stato, è uno Stato legittimo soltanto se riesce a garantire la libertà di tutti i suoi cittadini, sino all'ultimo dei suoi cittadini.
2477470	2487470	E lo Stato, questa libertà deve riconoscerla e difenderla proprio per essere uno Stato legittimo, libero e democratico e non un tiranno arbitrario.
2488970	2497590	Noi crediamo che lo Stato debba essere al servizio dei cittadini e che non debbano essere cittadini al servizio dello Stato.
2497590	2500770	E questo ci divide fondamentalmente da loro.
2501410	2521090	Per questo concretamente crediamo nell'individuo e riteniamo che ciascuno debba avere il diritto di realizzare se stesso, di aspirare al benessere e alla felicità, di costruire con le proprie mani il proprio futuro, di poter educare i figli liberamente.
2521090	2536090	Per questo crediamo nella famiglia che è il nucleo fondamentale della nostra società e crediamo che la famiglia possa esistere soltanto quando è formata da un uomo e una donna.
2539370	2562870	E crediamo anche nell'impresa a cui è demandato il grande valore sociale della creazione di lavoro, di benessere e di ricchezza, perché gli imprenditori che rischiano, che lavorano, che dedicano al lavoro, e io lo so perché l'ho fatto per vent'anni a fila, la notte, il sabato, la domenica,
2562870	2574110	ma certo lo fanno pensando al proprio benessere prima di tutto, a quello della propria famiglia, dei propri cari, ma così facendo producono lavoro per tutti, producono benessere per tutti.
2574110	2594570	E vedete, i signori della sinistra non hanno ancora capito che l'egoismo individuale si trasforma grazie a quella che è una magia del libero mercato, della libera iniziativa, del capitalismo, che l'egoismo individuale sa trasformarsi nel benessere collettivo.
2594570	2600410	È una cosa che ancora non gli è entrata in testa.
2600670	2616190	Noi crediamo nei valori della nostra tradizione cristiana, nei valori irrinunciabili della vita, della solidarietà, della giustizia, della tolleranza verso tutti, a cominciare dagli avversari.
2616190	2629630	E crediamo soprattutto nel rispetto e nell'amore verso chi è più debole, prima e tra tutti i malati, i bambini, gli anziani, gli emarginati.
2629630	2643910	Desideriamo vivere in un Paese moderno dove siano valori sentiti e condivisi la generosità, l'altruismo, la dedizione, la passione per il proprio lavoro.
2643910	2667030	E aggiungo oggi, dopo l'esperienza della sinistra al Governo, in un Paese dove nessuno abbia paura che vada al Governo il suo versario politico, dove nelle istituzioni, comune, province, regioni, governo centrale del Paese si veda qualcuno che è lì per aiutarti.
2667030	2680170	Dove ci sia, cioè, uno Stato amico e non uno Stato nemico, dei cittadini. Vogliamo vivere in un Paese dove nessuno resti emarginato nella povertà, nella malattia, nella vecchiaia.
2680170	2701170	Un Paese dove tutti i cittadini, nessuno escluso, possa tenere aperta alla speranza la sua porta. E' quello che avevamo cominciato a fare riducendo il numero dei poveri nel Paese in 5 anni di Governo, dando una pensione molto più elevata a quasi 2 milioni di pensionati,
2702130	2712210	riducendo le tasse per le famiglie meno abbienti, creando un milione e mezzo di posti di lavoro di cui 500 mila per le signore.
2712210	2721490	Bene, questo è ciò che abbiamo fatto nel nome di questi principi, nel nome della libertà, nel nome della nostra fede cristiana.
2721490	2735350	Loro si comportano in maniera esattamente diversa, abbeverandosi a una dottrina che ha creato soltanto dove è andata il Governo, in quei disgraziati Paesi, soltanto miseria, terrore e morte.
2735350	2750810	Non vogliamo fare la fine di quei Paesi, dobbiamo batterci tutti per mantenere in Italia una piena e completa libertà, cominciando da voi, dalla vostra piccola ma bellissima regione,
2750810	2769010	cominciando da voi che andrete per primi a votare dopo le elezioni taroccate che hanno portato la sinistra al Governo, tutti insieme, uomini e donne che amano la libertà, insieme per la libertà e il benessere del Molise e della nostra Italia.
2769410	2776290	Ci ritroviamo qui per la chiusura della campagna elettorale. Viva il Molise, viva l'Italia!
