start	end	text
1280	14840	Evviva! Sono preoccupato! Sono preoccupato! Avete lasciato a casa i vostri malati, i vostri
14840	28380	bambini piccoli, perché mi sembra che tutta Campobasso sia qui! Siete tantissimi! Le televisioni
28380	37220	sono piazzate a un terzo del partecipanti a questo abbraccio affettuoso. Voltatevi qualche volta
37220	44320	di là per vedere che la folla, che la partecipazione continua fino in fondo quasi
44320	57840	alla piazza. Bene, grazie di questa accoglienza. Sono veramente lieto di essere qui in Molise con
57840	68000	voi per questa elezione per il governo della vostra regione che cade in un momento particolarissimo
68000	78240	della nostra vita di italiani e che mette nelle mani a voi non soltanto una scelta di campo tra
78240	85640	una regione bene amministrata che va avanti nella voglia di modernità, nelle infrastrutture,
87570	93850	negli acquedotti, nel sostegno alle sue industrie, nella creazione di posti di lavoro come sono stati
93850	105550	questi cinque anni di governo di Michele Iorio e della sua giunta. Una scelta di campo tra una
105550	112390	regione che possa continuare il lavoro iniziato nella direzione del benessere, del progresso,
112390	121490	della modernità o una regione che si fermi, che dica di no a tutto come nelle abitudini dei
121490	129670	protagonisti della sinistra. Mi sono soffermato questa mattina a vedere una rassegna stampa dai
129670	140570	giornali della regione. Non ho potuto trovare durante i cinque anni della giunta di Michele
140570	154050	Iorio una sola proposta positiva e costruttiva della sinistra e quindi dovete scegliere per
154050	164830	il vostro immediato futuro di cinque anni per sapere quindi se potete contare su delle
164830	171930	infrastrutture che il mio governo aveva già deciso inserendole nella legge obiettivo, inserendole
171930	181630	nell'intesa firmata tra il governo e la giunta regionale come quella del collegamento tra San
181630	188970	Vittore e Termini, tra quindi l'Autostrada del Sole e l'Autostrada Adriatica e altre infrastrutture
188970	198190	ancora oppure restare nella situazione in cui il Molise era fino a cinque anni fa e questa è
198190	206530	una grande scelta di campo ma avete l'occasione di una scelta ancora più importante perché quelle
206530	221990	regionali saranno le prime elezioni che avvengono in Italia da quando questa sinistra è andata al
221990	236290	governo e quindi saranno il primo segnale di un'Italia che vota e che si ribellerà a un
236290	248210	di tutti ma che fanno invece il male di tutti. Quindi avete una grandissima responsabilità
248210	256810	perché il significato delle vostre elezioni andrà ben oltre quello regionale, sarà un
256810	264950	significato nazionale e io sono convinto che succederà qui quel che succede oggi in tutta
264950	273070	Italia e che i sondaggi ci dicono con chiarezza e cioè che l'Italia della libertà, l'Italia attuale
273070	279870	dell'opposizione, l'Italia del centrodestra ha superato già di sei punti l'Italia della sinistra.
286630	292110	Vedete, noi siamo oggi in una situazione molto particolare, direi anche pericolosa,
294150	302010	perché io avevo predetto noi della casa delle libertà, avevamo predetto quello che sarebbe
302010	308710	successo, che in Italia ancora esiste una sinistra che non è pienamente democratica,
308710	322510	che non ha compiuto il viaggio dal comunismo alla democrazia. Avevamo detto che la sinistra
322510	330830	al governo avrebbe risposto alle sue antiche radici, che la maggioranza, se tale si fosse
330830	337830	confermata nelle elezioni, sarebbe stata costretta ad accettare i diktat della sinistra radicale
337830	345710	massimalista, dei comunisti italiani, dei verdi, di rifondazione comunista e questo è puntualmente
346430	353370	accaduto ed accade. Il nostro governo, il governo della casa delle libertà, chiamiamoli il governo
353370	360550	delle libertà, in cinque anni ha fatto credo delle cose di cui dobbiamo andare tutti orgogliosi,
361090	367730	ha cominciato intanto a cambiare l'Italia con 36 importanti riforme, i cui effetti evidentemente
367730	374310	non sono ancora percettibili compiutamente, ma che si sono cominciati a vedere, ma che
374310	384290	si sarebbero potuti verificare man mano che queste riforme avessero trovato realizzazione.
384290	398710	Abbiamo aperto 106 cantieri di grandi opere, abbiamo fatto importantissime riforme nel settore
398710	406570	della scuola, nel settore del fisco, in molti altri settori, lo sapete anche voi, abbiamo creato
406570	413450	un milione e mezzo di nuovi posti di lavoro, si è ridotta la disoccupazione al 7%, abbiamo ridotto
413450	419710	la pressione fiscale, ma soprattutto su questo punto voglio attirare la vostra attenzione. In cinque
419710	431270	anni il nostro governo non ha prodotto una sola legge, un solo provvedimento che fosse contro
431270	440950	qualcuno, non ha alzato mai una sola tassa, non ha mai messo le mani nelle tasche degli italiani.
443870	453230	Questo governo, il governo di Prodi e compagni, con due soli provvedimenti, il decreto Visco
453230	465930	Bersani e la legge finanziaria, da un lato ha aperto la via del fisco ad un regime perché
465930	474330	con il contenuto del decreto Visco Bersani molti italiani, professionisti, artigiani,
474530	480790	commercianti, tutti coloro che percepiscono un reddito da lavoro, non potranno più pagare in
480790	486730	contanti le loro spese, i loro acquisti, dovranno farlo attraverso carte di credito, attraverso il
486730	493850	conto corrente bancario. Lo Stato diventa uno stato di polizia che avrà nella sua amministrazione
494840	501320	la fotografia precisa del vostro stile di vita, dello stile di vita di ciascuno e potrà quindi
505160	511480	intimidirvi, insidiarvi, potrà a ciascuno dire guardi che noi di lei sappiamo questo, questo e
511480	520180	quest'altro. Secondo, attraverso la finanziaria in una volta sola sono state aumentate le imposte
520180	531580	o sono state inserite nuove imposte in ben 67 punti, 67 aumenti di imposta, 67 nuove imposte
532220	542320	a smentire ciò che avevano garantito lungo tutto l'arco della campagna elettorale. Io mi sono
543540	550840	divertito, questa mattina sono venuto in auto da Roma e ho impiegato circa due ore e durante
550840	559500	queste due ore mi sono divertito a mettere giù delle domande da fare a voi, vi aspettavate che
559500	567280	parlassi solo io? Vorrei che voi foste i protagonisti di questo nostro incontro e allora vi ricordate
567280	574120	che cosa dicevamo noi prima delle elezioni e che cosa dicevano loro e vi ricordate che
574120	582420	mi accusarono ripetutamente con la loro solita gentilezza di essere un bugiardo? Allora io ho
582420	587400	messo giù una serie di piccolissime domande, vorrei che voi rispondeste con franchezza.
588700	597260	Chi diceva bugie tra me e Prodi quando ci accusò di criminalità politica perché avevamo affermato
597260	607920	che avrebbero alzato le tasse sui bot? Non ho sentito bene, così va meglio ma vorrei che
607920	616600	miglioraste. Chi diceva bugie tra me e Prodi quando lui assicurava che la tasse di successione
616600	627240	sarebbe partita da alcuni milioni di euro in su? Chi diceva bugie tra me e Prodi quando lui
627240	635660	negava che avrebbero aumentato la pressione fiscale? Chi diceva bugie tra il sottoscritto
635660	643320	e Prodi quando lui assicurava che non ci sarebbe stata alcuna politica punitiva verso le piccole
643320	652560	imprese, gli artigiani, i professionisti, il popolo delle partite IVA? Attenti con le
652560	657580	televisioni perché togliendo la prima parte della domanda le loro televisioni sarebbero
657580	671260	capaci di dire la piazza inneggia a Prodi. Chi diceva bugie tra me e Prodi quando lui
671260	678840	negava che il suo sarebbe stato il governo delle tasse? Chi diceva bugie tra me e Prodi
678840	684140	quando pre-annunciavo che avrebbero fatto una politica contro la crescita e contro
684140	702940	lo sviluppo del Paese? E allora chi ha dimostrato di essere un gran bugiardo? Io o Prodi? Complimenti,
703540	715600	avete risposto perfettamente, evidentemente vi siete preparati, avete studiato, il risultato
715600	721940	si vede e allora mi viene in mente di dire ricordatevi di queste risposte giuste quando
721940	736620	entrerete nella cabine elettorale per eleggere Michele Iorio. E' successo quindi qualcosa
737420	749880	che ho detto ci deve preoccupare. Noi siamo di fronte a una formazione politica, quella
749880	761700	che ha le sue antiche radici. Per loro la politica è l'occasione, lo strumento per
761700	768640	intervenire sulla società, per ridistribuire il reddito, per ridistribuire la ricchezza,
769420	775560	per affermare la sudditanza dei cittadini nei confronti dello Stato, esattamente il
775990	783910	di ciò che pensiamo noi, che sono non i cittadini ad essere i servitori dello Stato, ma è lo
783910	792510	Stato che deve essere al servizio dei cittadini. Tutto ciò che loro hanno fatto in questi
792510	801710	primi mesi di governo sta a dimostrare che la sinistra estrema comanda questa maggioranza
801710	808710	dentro questo governo. E questa maggioranza, nei suoi partiti più forti di esse e la Margherita,
810170	817650	dice sì a ogni ricatto della sinistra perché se dicesse no non ci sarebbe più la maggioranza
817650	825990	e cadrebbe il governo. E loro non potrebbero esercitare quel potere che è la loro unica
825990	832030	arigione, quella di conquistare il potere in qualsiasi modo, di gestire il potere e
832030	842410	di profittarne per loro stessi. Ed ecco che vedete gli scandali telecom e tante altre vicende
842410	848690	che dimostrano chiaramente di come si comportino nel loro rapporto con l'Italia libera delle
848690	854910	imprese nella maniera opposta rispetto a quella in cui ci siamo comportati noi. C'è anche
854910	864090	qualcosa di più preoccupante, c'è il fatto che hanno fermato in Senato la riforma che
864090	871390	noi abbiamo fatto dell'ordinamento giudiziario, della giustizia. Che cosa volevamo fare noi?
871990	879950	Volevamo avere finalmente un processo in cui ogni cittadino italiano a cui accadesse di
879950	886390	essere accusato da un pubblico ministero per aver commesso un reato potesse andare davanti
886390	898990	a un giudice ed essere sicuro della sua imparzialità. Questo oggi non accade. Oggi un giudice deve
898990	907950	fare un atto di coraggio, deve essere quasi un eroe per dire di no al teorema accusatorio
908250	915410	di un pubblico ministero. Perché? Perché i pubblici ministeri fanno parte della stessa categoria dei
916130	923390	magistrati, hanno la stessa carriera, lavorano negli stessi uffici, si danno del tuco ai magistrati,
923490	930250	ma soprattutto nelle commissioni che decidono la carriera, la vita, lo stipendio, i trasferimenti
930250	939450	dei giudici sono soprattutto i pubblici ministeri a contare. E quindi un giudice se vuole dire di no
939450	947050	a un puntiglio accusatorio di un pubblico ministero rischia la propria carriera. Che cosa volevamo noi
947050	955250	con la riforma a cui abbiamo lavorato? Volevamo che ci fosse una divisione tra i giudici e i pubblici ministeri
955450	963450	che io volevo si chiamassero avvocati dell'accusa, che gli avvocati dell'accusa facessero parte di
963450	970050	un'altra categoria, che non avessero nessun potere sulla carriera dei giudici, che lavorassero in altri
970050	976330	uffici, che quando dovessero andare a parlare con un giudice dovessero farlo esattamente come lo fanno
976330	984270	gli avvocati della difesa, telefonandogli prima, dandogli del lei ed entrando nell'ufficio dopo aver bussato
984270	995310	come col cappello in mano. La sinistra non ha voluto e non vuole questo perché conta sulla magistratura
995310	1002030	amica per sottomettere i protagonisti dell'opposizione, per eliminarli dalla scena politica
1002030	1010050	e per tenere sotto di sé i cittadini con la minaccia anche di una magistratura politicamente coinvolta.
1010050	1024310	E questo credo ancora non è democrazia. Il voto che c'è stato, e deve essere un'indicazione precisa anche per voi,
1024830	1033470	lo dico a Michele, lo dico a tutti gli amici della Casa delle Libertà, mettete dei difensori del voto dei cittadini
1033470	1043470	in ogni seggio, in ogni sezione, perché nelle ultime elezioni nazionali sono successo delle cose assolutamente incompatibili
1044010	1050630	con l'essenza della democrazia, che è il momento più alto e più nobile della vita di un popolo.
1051410	1063190	Abbiamo avuto perdute 150 mila schede, sono andati a votare 150 mila cittadini in più rispetto al numero delle schede
1063190	1070750	che sono poi risultate. Dove sono finite quelle schede? Qualcune l'abbiamo vista in scatoloni abbandonati nei parchi.
1071050	1075630	Non erano certamente schede che portavano un voto per un partito della sinistra.
1075630	1083030	Abbiamo avuto un calo incredibile di schede bianche rispetto alle precedenti elezioni.
1083430	1091010	In certi regioni, in Campania, in Calabria, siamo arrivati a un calo di oltre il 90%.
1091010	1099690	Come sono state utilizzate quelle schede? Probabilmente sono state utilizzate per un voto a un partito della sinistra.
1099690	1108550	E allora io dico a tutti voi, ai candidati, di restare domenica, lunedì, fino a quando non ci sarà fatto tutto lo scrutinio,
1108590	1117650	fino a quando lo scrutinio non sarà completato, per verificare che non si ripeta quello che si è verificato nelle elezioni nazionali.
1121890	1128830	Il risultato lo conoscete, soltanto 24 mila voti di differenza alla Camera.
1129290	1139150	In totale, 220 mila voti in più a noi, ma per i sistemi elettorali specie al Senato, anche al Senato, hanno due senatori di maggioranza.
1139150	1147150	Bene, cosa avrebbe fatto un democratico vero di fronte a un Paese diviso a metà?
1147950	1154330	Avrebbe accettato l'offerta che noi subito abbiamo fatto di fare ciò che si è fatto in Germania.
1154330	1166330	Sederci a un tavolo, le due parti, decidere quali erano i problemi più urgenti del Paese e decidere di lavorare insieme per risolvere questi problemi
1166990	1175270	per un periodo determinato, 12 mesi, 18 mesi, 24 mesi, per poi andare nuovamente alle elezioni.
1175270	1190270	Hanno chiuso arrogantemente, sbattendoci la porta in faccia, e hanno messo con arroganza, con prepotenza, con impudicizia le mani su tutte le istituzioni dello Stato.
1191190	1207270	Oggi controllano il governo, la Camera dei deputati, il Senato, controllano la Corte Costituzionale, il Presidente della Repubblica, controllano la grande totalità della stampa, la grande totalità della magistratura.
1208310	1223470	Oggi noi non abbiamo quel sistema di pesi e contrappesi, di check and balance, come dicono gli anglosassoni, che è un sistema fondamentale perché una democrazia sia veramente tale.
1223470	1243090	Quindi io credo che noi dobbiamo essere consapevoli che non possiamo lasciare a lungo il Paese nelle mani di Costoro, che applicano ancora i principi di una dottrina che è dovunque applicata nel mondo.
1244430	1262090	Il Comunismo è quella politica che ha coinvolto più Paesi al mondo, che è durata per più anni, che dura ancora adesso per un miliardo e trecento milioni di sfortunati cittadini del Pianeta, e che ha fatto soprattutto più vittime di tutta la storia.
1262090	1272190	Il Comunismo era, è e resta l'impresa più disumana e più criminale della storia dell'uomo.
1273130	1288990	E questi signori che oggi reggono il governo del Paese a seguito di queste elezioni che noi contestiamo, ancora affondano le loro decisioni nelle teorie che il Comunismo ha portato avanti.
1288990	1303030	Quindi voi del Molise, gente del Molise, voi Molisani, avete nelle prossime occasioni delle elezioni regionali una grande, grande responsabilità.
1303350	1314990	Già è grande la responsabilità di decidere per la Giunta che governerà la vostra regione e che quindi deciderà sulle infrastrutture, sui servizi sanitari, sulle scuole.
1315040	1329540	Io non credo che sia cosa da poco avere costretto il governo, in mezzo a mille difficoltà, a dotare il Molise di tre nuove facoltà, quella di medicina e chirurgia, quella di ingegneria, quella di lettere.
1329540	1351560	E dovete dire bravo al vostro Presidente che ha collaborato con me e si è trasformato con me in un cane da polpacci, perché tutte le sue richieste l'hanno visto a Roma ad insistere, ad insistere, ad insistere, fin quando non sono state recepite ed esaudite dal governo.
1353820	1365560	E credo che basti citare una sola cifra, una sola cifra per dire la differenza del rapporto, dell'approccio del nostro governo rispetto a quello attuale.
1366340	1379520	Per quanto riguarda i guasti delle grandi calamità naturali alluvione e terremoto, noi credo che abbiamo superato la cifra di mille miliardi di vecchie lire, Michele, 500 milioni di euro.
1379520	1390520	Solo nell'ultima finanziaria abbiamo inserito la cifra di 150 milioni di euro, 300 miliardi di vecchie lire, che voi avete già incassato.
1391830	1408870	Questo nuovo governo, nella nuova finanziaria, ha ridotto a un decimo questa cifra e ha stanziato soltanto 30 miliardi di vecchie lire, 15 milioni di euro, ma non in un anno, bensì in tre anni, 5, 5 e 5.
1408870	1421870	E quindi già da questo capite come l'orientamento di questo governo sia tutt'altro che quello del bene dei cittadini, che quello della modernità del Paese.
1421890	1442170	Quindi, dicevo, avete una grande occasione e mi sono anche qui preso la briga di darvi la possibilità di assumere un atteggiamento forte e convinto, perché anche qui ho scritto alcune domande per voi.
1443110	1453170	Avete fatto prima quasi l'orale. Qua sarebbe bello rispondere per iscritto, ma per iscritto risponderete nella cabine elettorale il giorno delle elezioni.
1456170	1468310	Volete che parta da qui, da voi, elettori molisani, il primo segnale contro il governo della sinistra massimalista e delle tazze in Italia?
1470610	1482310	Volete essere voi per primi a mettervi alla testa della protesta contro questa finanziaria che non toglie i cosiddetti ricchi per dare ai poveri, ma rende tutti poveri?
1482370	1498090	Lo volete? Volete essere i primi a votare contro questo governo che usa l'arma del fisco come un rasoio per tosare risparmiatori e assestare un colpo mortale a decine di migliaia di piccole imprese?
1499750	1515090	Volete essere i primi a votare contro le tasse sulla casa, sul risparmio, sulle pensioni, sugli stipendi, su ciò che un padre e una madre risparmiano con sacrificio dopo una vita di lavoro per passarlo ai loro figli?
1517250	1536750	E allora non perdete tempo con Berlusconi qui, andate a convincere tutti gli altri, i conoscenti, gli amici, le vecchie fidanzate, i vecchi fidanzati, vostro marito e vostra moglie vi perdoneranno perché lo fate per il bene comune.
1539390	1560750	E allora io continuo perché ho visto che questo che pare un gioco ma non è tanto gioco vi piace, Michele questo lo affido a te e se tu nei tuoi contatti e i tuoi collaboratori avranno i tanti contatti della campagna elettorale, a proposito io tornerò qui tutte le settimane.
1579730	1594590	La situazione non è tranquillizzante ma io continuo a dire che noi liberali abbiamo il dono dell'ironia e dell'autironia, quindi se volete che ritorni anche più spesso datemi il numero di telefono che ci fidanziamo.
1596990	1608610	Le domande, le domande, volete mettere il Molise nelle mani di una sinistra che dimostra ogni giorno di più la sua incapacità di governare?
1611530	1618710	Volete anche in Molise il governo dei comunisti, dei verdi, dei no global, dei no a tutto?
1621530	1627910	Volete col voto per la regione dare una mano a tenere in piedi il governo di Viscodi, di Pietro, di Rosibindi?
1630150	1633450	Ho citato solo i più simpatici.
1633450	1638230	Volete anche in Molise le tasse di Visco e di Prodi?
1640530	1648030	Volete che anche la regione collabori con Prodi per controllare la vostra vita e il vostro conto in banca?
1650190	1665030	Volete che in Molise vinca una persona come il candidato della sinistra che ho sentito parlare male della sua terra dicendo che tutto va male pur di conquistare qualche voto?
1666550	1675150	Volete invece per il Molise altri cinque anni di buon governo di Forza Italia della Casa del Libertà di Michele Iorio?
1677230	1686510	Volete per il Molise un governo guidato da una persona onesta, capace, esperta, simpatica e amico mio come Michele Iorio?
1687810	1691770	E allora Michele sali anche tu qua con me.
1691770	1700490	Io volevo portare da Roma uno spadone perché non pensavo che fosse così in tanti.
1700530	1708150	Volevo passare vicino a ciascuno di voi e nominarvi missionari guerrieri di libertà.
1722990	1732770	Tra l'altro abbiamo una congiunzione astrale non male. Io sono nato il 29 di settembre San Michele e lui festeggia il 29 di settembre il suo nomastico.
1738450	1754530	Allora dicevo sorridendo che la missione che abbiamo davanti è una missione seria, importante per la nostra vita, per la vita dei nostri figli, per il futuro del Molise, per il futuro del Paese.
1755530	1775490	Mancano ancora diversi giorni alle elezioni regionali. Bene, dovete trasformarvi tutti in missionari di libertà. Se non l'avete fatto fino ad ora, fatelo, vedrete che sarà un arricchimento per ciascuno di voi.
1777010	1798990	Studiate, guardate il programma che Michele ha preparato per il suo governo dei prossimi cinque anni, leggete il risultato, il rendiconto del lavoro che questo governo ha fatto nei cinque anni che ci stanno alle spalle e andate a parlare con chi sentite.
1798990	1812990	È stato istigato da una stampa molto spesso, troppo spesso, lontana della verità, a ritenere che invece sia positivo un cambiamento di conduzione della vostra regione.
1814390	1833950	Guardate tutto ciò che è stato fatto ed è tantissimo, non sto qui io a ripeterlo, già conoscevo molte cose, questa mattina con Michele abbiamo visto il rendiconto finale di tutte le cose fatte, devo dirvi che ha lavorato con determinazione, con pragmatismo, con grande passione.
1833950	1858690	Le cose fatte sono state moltissime. Questo governo fa delle cose e questa sinistra fa delle cose che sono incredibili, per esempio mi sembra incredibile che si sia approvata nella finanziaria una disposizione per la quale addirittura si vuole togliere a Termoli la prefettura,
1860250	1871650	il Tribunale e poi ancora il Comando Centrale dei Vigili del Fuoco e che in un altro paese, in un'altra importante cittadina del Molise si voglia togliere addirittura il Tribunale,
1872650	1877410	Allarino, dove io sono andato a visitare le vittime del terremoto di San Giuliano.
1879090	1904690	Ci sono delle cose che escono anche dalla mia capacità di comprendere, per esempio non capisco come si possa inserire in una legge dello Stato una disposizione che arriva a far sì che lo Stato possa chiudere un negozio soltanto se il commerciante di questo negozio ha sbagliato a dare via un solo scontrino.
1904690	1923610	Il primo errore, la pena è chiudere il negozio. Non capisco come si possa arrivare a dire che chi va in un pronto soccorso, se non è affetto da una cosa grave, deve pagare per le cure che riceve se non è ricoverato.
1924830	1939550	Non arrivo a capire come si possa cassare e abrogare quello 0,5 per mille che avevamo deciso di dare sull'entrata dell'erario alle associazioni del volontariato che fanno il bene della gente.
1940670	1951550	Pensate se l'avessimo fatto noi! Il pandemonio che sarebbe successo, cosa avrebbero scritto i giornali della sinistra?
1951590	1976030	Bene, io credo davvero che sono grandissimo, sono anche più alto di Michele, pensate. Anche qui di me ne hanno dette tante, ma anche che ero un nano. Altissimo non sono, ma nano mi sembra che sia esagerato.
1977490	1992450	E allora, noi avremo ancora l'occasione, se crederete, di incontrarci. Io ritornerò a Campobasso per chiudere qui la campagna elettorale il venerdì prima della domenica elettorale.
1995090	2005490	Con Michele prenderemo davanti a voi degli impegni comuni che io sottoscriverò di fronte a voi insieme a lui.
2005490	2030490	Io credo che noi possiamo essere certi che con quello che accade oggi in Italia, con il modo con cui questo governo della sinistra ha saputo illustrarsi in questi mesi, con la conoscenza che ciascuno di voi potrà avere andando a guardare dentro tutti i provvedimenti del governo centrale.
2030490	2057230	E la conoscenza che ciascuno di voi potrà farsi in più rispetto a quello che ci sa su ciò che è stato fatto da Iorio dalla sua giunta e sul programma futuro su cui ci impegneremo insieme, sarà assolutamente difficile per una persona di buon senso e di buona volontà, per un moderato vero, dare la sua preferenza ad una sinistra che finora in Molise si è segnalata soltanto come il partito dei no.
2057230	2067230	No a qualunque realizzazione e voi qui a Campo Passo lo sapete perché è la sinistra che governa il Comune, è la sinistra che governa la Provincia.
2072570	2094430	Io credo che da una filosofia come quella da cui partono questi signori che adesso vogliono farsi passare non più per comunisti ma vogliono di volta in volta si chiamano social democratici, socialisti europei, qualche volta osano addirittura chiamarsi liberali,
2094430	2122670	non possono venire cose negative come la storia ci insegna e allora quello che è importante non è soltanto verificare e decidere per il proprio voto guardando i programmi che le due parti presentano ma ciò che è importante è capire quali sono i valori che determinano le decisioni, l'azione politica di ciascuna parte.
