start	end	text
1713330	1718450	abbiamo parlato paolo il mio grandissimo bravissimo collaboratore ha una grande
1718450	1722250	pazienza perché mi sopporta da diversi anni ma devo dire che sono molto
1722250	1727650	paziente anch'io nei tuoi confronti è allenamento ci alleniamo alla conquista
1727650	1735410	del paradiso va bene e scusa puoi sentire qua senti ti piace e profumo di
1735410	1737050	santità
1747370	1754250	allora ci siamo visti giovanni è venuto anche qui una precisazione io non ho
1755090	1760850	chiesto io a giovanni galli di fare il candidato anzi se lui è onesto come è
1760850	1766610	onesto vi dirà che io ho cercato di dissuaderlo perché gli ho detto tu non
1766610	1772210	sai che cosa ti capiterà te ne pentirai ma te ne pentirai ma te ne pentirai non
1772210	1775650	sai quante volte lui invece è quella persona seria che
1775650	1781950	io ho avuto modo di conoscere in tanti anni di collaborazione al milan è stato
1781950	1789650	un grande campione dopo la vita gli ha inferto un grandissimo dolore e ha
1789650	1797350	deciso di dedicarsi ad aiutare gli altri ha saputo organizzare questo aiuto agli
1797350	1802630	altri in un modo splendido e i risultati di questa sua attività sociale sono
1802630	1807870	risultati veramente ed estremamente positivi quando lui è venuto da me gli
1807870	1811390	ho detto guarda che gli ho spiegato davvero che cos'è la politica e tutto
1811390	1815810	ciò che la politica ti porta addosso e le critiche che ti fanno e le
1815810	1821410	invenzioni malevole da cui sei fatto oggetto lui però ormai aveva pensato che
1821410	1827890	davvero non si potesse più assistere a una Firenze governata dalla solita banda
1827890	1834390	di persone che fanno della politica non un servizio ma un mestiere e che hanno
1834390	1845510	continuato per troppi anni a profittare delle sedie delle istituzioni locali per
1846050	1851030	soprattutto rendere favori alle loro clientele lasciando che Firenze a poco
1851030	1859030	a poco diventasse una città non al massimo dell'ordine e della civiltà
1859290	1864850	hanno lasciato degradare il sistema fioristico non hanno saputo intervenire
1865510	1871770	su quello che è indispensabile ed è una nuova pista per l'aeroporto non hanno
1873270	1879330	saputo dare il via alla rialzione della Barberino incisa in modo ad avere
1879330	1884390	l'ottuale autostrada che possa diventare la circunvalazione e la tangenziale di
1889630	1897190	Firenze e quindi lui ha detto in maniera molto franca a me non lo farei se si
1897190	1902750	fosse presentata un'altra personalità un'altra persona a cui avrei potuto dare
1902750	1907650	tutto il mio aiuto ho cercato ma in questo momento la situazione delle
1907650	1912570	persone tale per cui il Presidente mi creda non ce n'è un altro che con Denis
1912570	1918010	Verdini abbiamo fatto anche noi una ricerca io ho incontrato alcuni
1918010	1924690	possibili candidati però il 90 per cento di questi si è tirato indietro e quel
1924690	1929010	10 per cento che si offriva non aveva possibilità di paragone con giovanni
1929010	1930010	galli
1933550	1934270	giovanni
1938050	1946130	io posso garantire una cosa la sua assoluta lealtà e persona incapace di
1946130	1951990	avere a rier pan se cioè di dirti una cosa pensando in un'altra e persona
1951990	1956970	dotata anche per gli avvenimenti che hanno marcato la sua vita di una
1958250	1965050	umanità e quindi io sono orgoglioso oggi di essere qui come Presidente del
1965050	1970590	popolo della libertà a sostenere per la città dell'arte per la capitale
1970590	1974790	dell'arte in italia per la straordinaria meravigliosa città vostra città di
1974790	1980630	rense la candidatura di giovanni galli a sindaco di firenze
1986850	1990190	secondo e il terzo posto
2005390	2011050	poi giovanni racconta quando io ti ho detto che si che si aveva contro il
2011050	2014630	napoli e che ti ho detto guarda che il gol te lo fanno in quella posizione lì
2015310	2023730	e tutto è successo come sempre no è successo vabbè adesso anch'io e adesso
2023730	2029230	anch'io confido che ci sia una grande stranchezza nei cittadini di firenze
2029770	2034350	nei confronti di tutto ciò che è successo negli anni alle spalle e anche
2034350	2038170	i nostri sondaggi ci dicono che è assolutamente questa volta è
2038170	2043750	assolutamente possibile lasciare in disparte questa classe che per troppo
2043750	2048890	tempo senza nuovi progetti a nuove idee senza uomini nuovi ha semplicemente
2048890	2052970	mantenuto il potere per fare i propri vantaggi del potere locale
2052970	2059330	voglio dirvi due cose in più rispetto ai due problemi che giovanni ha citato il
2059330	2063390	problema della sicurezza bene noi abbiamo intenzione di fare una
2063390	2068410	grande riforma di tutta la sicurezza in italia perché abbiamo più di 100.000
2068410	2073790	uomini delle forze armate che abbiamo impiegato e sono stati bravissimi sono
2073790	2077970	bravissimi nelle operazioni di peacekeeping là dove si aprono delle
2077970	2085710	ferite nel mondo nel kosovo nel libano in afghanistan prima ancora in irak e in
2085710	2093090	questa direzione impiegamo circa 9.000 uomini che però richiedono per i
2094090	2099990	ci rimangono 70.000 bene noi riteniamo che questi uomini e lo sappiamo
2099990	2104690	direttamente da loro siano felici si sentono realizzati quando possono essere
2104690	2109750	più utili al paese e abbiamo utilizzati a napoli per quanto riguarda la
2109750	2115090	risoluzione del problema dei rifiuti abbiamo utilizzato loro per la raccolta
2115750	2120630	gli abbiamo messi a difendere le discariche dove prima non si riusciva ad
2121150	2124810	e abbiamo messi a difendere il sito dove è stato costruito e dove saranno
2124810	2130270	costruiti i termo valorizzatori poi abbiamo deciso in contrasto con la
2130270	2135710	sinistra di utilizzarli per la sicurezza delle città e abbiamo sperimentato
2135710	2141790	3.000 uomini che formano dei pattugliamenti a piedi nelle aree della
2141790	2146790	città periferia o centro cittadino l'esperimento è stato assolutamente
2146790	2150990	gradito dai militari ed è stato assolutamente gradito dalle popolazioni
2152070	2157290	là dove siamo riusciti a farlo e allora noi intendiamo proseguire in questa
2157290	2162610	direzione e quindi cercheremo ove con la tua amministrazione tu ci
2162610	2167650	sottoponessi una carenza di presenza delle forze dell'ordine perché la sola
2167650	2173110	presenza ha lontani malintenzionati da certi quartieri quindi noi saremo
2173200	2177800	certamente a disposizione della nuova amministrazione e sarà importante avere
2177800	2182400	una sintonia tra il governo nazionale questo è un altro motivo che deve
2182400	2188880	indurre a un voto convinto sintonia tra il governo nazionale e l'amministrazione
2189660	2194640	cittadina quindi potremo lavorare bene insieme e io prendo qui l'impegno ad
2194640	2200420	esaminare le esigenze riguardo alla sicurezza e dato che noi estenderemo
2200420	2205100	questa presenza dei militari nelle varie città a tenere in primissima
2205100	2210860	considerazione l'esigenza eventuale della vostra città e questo è uno.
2214380	2222600	2. Firenze città dell'arte. Firenze capace di attrarre il turismo
2222600	2227780	internazionale ma voi pensate che siamo stati così poco capaci di attrarre
2227980	2232680	il turismo che oggi siamo scesi giù nella classifica e mentre nel primo dopo
2232680	2237620	governo eravamo i primi al mondo adesso ci sono molti paesi che ci hanno
2237620	2245920	superato gli stati uniti la francia la cina la spagna è una cosa che credo
2245920	2252080	debba essere cambiata e allora abbiamo deciso di portare il turismo da essere
2252080	2255400	materia di un dipartimento della presidenza del consiglio con un
2255400	2261780	segretario di darlo dagli l'autorevalezza di un ministero abbiamo nominato a
2261780	2269120	ministro la nostra onorevole michela brambilla che è unire di dio capace di
2269120	2272080	telefonare al presidente del consiglio anche 11 volte in un giorno se non
2272080	2278680	riesce ad averlo al telefono per dare una risposta e siamo certi che metterà
2278730	2285030	in moto una grande campagna di promozione per l'italia nel mondo la
2285030	2289790	sinistra ancora una volta aveva sbagliato perché nel 2000 si nel no
2289790	2293990	nell'ultimo anno nel 2001 credo si con soli cinque voti di maggioranza aveva
2293990	2298990	cambiato la costituzione poi ci fanno la predica e dicono che la costituzione si
2298990	2302410	può cambiare soltanto quando sia d'accordo tutti loro con cinque voti
2302530	2312570	hanno cambiato il titolo quinto e hanno attribuito alle regioni il turismo in
2312570	2318550	tutte le sue dimensioni e le regioni hanno balbettato che come fa una
2318550	2323690	regione a fare una efficace campagna di richiamo dei turisti nel mondo c'è stato
2323690	2327730	qualcuno che ha letto con grande sorpresa in australia un viene a visitare il
2328090	2333650	ma il molise in australia non potevano sapere nemmeno che fosse in italia
2333650	2338310	quindi c'è bisogno di una nuova regia c'è bisogno di un nuovo investimento
2339170	2344270	mercoledì mercoledì o giovedì io farò con il ministro brambilla una conferenza
2345110	2350890	stampa in domani domani allora farò una conferenza stampa in cui annunceremo che
2350890	2354450	il sistema delle banche italiano mette a disposizione degli operatori del
2354450	2361890	turismo un miliardo e 400 milioni a dei tassi concordati e privilegiati perché
2361890	2368030	dobbiamo portare il turismo dall'undici 10 addirittura per cento che adesso in
2368030	2373850	rispetto al nostro pil ha molto di più io dico a raddoppiarlo quindi la spagna
2373850	2378430	per esempio ha il 18 per cento del suo pil rappresentato dal turismo allora un
2378950	2385970	che ha città come venezia come firenze come roma come napoli che ha avuto senza
2385970	2389670	merito perché il merito di coloro che ci hanno preceduto più di 100 mila chiese
2389670	2394710	monumenti 40 mila case storiche con tutti i tesori che contengono mobili
2394710	2400750	tappeti quadri 3500 musei con il trenta per cento di ciò che è nei musei che
2400750	2406190	non ha spazio espositivo e anche qui abbiamo preso un bravissimo manager
2407710	2415370	imprenditore che ha assunto su di sé la responsabilità di ammodernare tutto il
2415370	2423330	sistema dei licei in collaborazione con il nostro sandro bondi abbiamo 2500 siti
2423330	2429030	archeologici e più di mille teatri e con questo ben di dio e con quell'altro ben
2429030	2434070	di dio che rappresentato dalla bellezza naturale del nostro paese dal clima del
2434070	2438450	nostro paese dalle attrattive gastronomiche del nostro paese noi
2438450	2442070	continuiamo a scendere a scendere a scendere abbiamo delle percentuali di
2442070	2447130	riempimento degli alberghi che sono risibili quindi significa che dato che
2447130	2452390	poi questi siti questi beni artistici che rappresentano
2453150	2458930	lasciarsi ce lo dire con orgoglio il 50 per cento dei beni artistici catalogati
2458930	2465110	il 72 per cento dei beni artistici catalogati in europa con questo ben di
2465110	2470110	dio ci mancherebbe che non riuscissimo ad attirare qui quei turisti che le
2470110	2475850	nazioni unite indicano in grande aumento oggi ci sono 800 milioni di cittadini
2475850	2480090	nel mondo che si spostano per turismo si prevede che nei prossimi cinque anni
2480630	2485370	questi aumenteranno del 50 per cento saranno un miliardo e 200 milioni di
2485470	2490830	turisti che si muoveranno in più abbiamo fatto un sondaggio in cina e in india
2491430	2496150	ed è venuto fuori che questi nuovi turisti figli del nuovo benessere di
2496150	2501230	questi paesi hanno come prima meta quella di visitare la vecchia europa e
2501230	2507030	dentro l'europa come prima meta pongono il nostro paese quindi io credo che anche
2507030	2513230	in questa direzione noi dobbiamo fare di firenze una perla fare di firenze la
2513530	2521450	città dell'arte e accogliere qui i visitatori del mondo che porteranno qui
2521450	2527130	anche un supporto forte e importante alla nostra economia
2533370	2537130	io voglio anche ringraziare
2537130	2538730	devo fare però
2541330	2548410	sei dell'alleanza dai saluta e scusami scusami scusami
2573090	2578910	grazie presidente un'ultima un'ultima cosa noi abbiamo candidato a
2578910	2585750	chianciano presidente che lo dico io allora io ho soltanto una postilla da
2585750	2592410	aggiungere e vorrei spendere un augurio un in bocca al lupo al nostro candidato
2592730	2600730	sindaco a chianciano si chiama antonio guidi a chianciano le sinistre non lo
2600730	2607090	vogliano perché ha un'indica a un'indica così grave che lo condiziona
2607090	2613230	così tanto che noi abbiamo ritenuto di farlo ministro nel nostro governo ed è
2613230	2622610	stato un ottimo ministro vorrei ora sì anche ritornare all'argomento primo
2622610	2626950	con cui abbiamo iniziato quelli dell'europa per sottoporvi uno dei
2626950	2631130	giovani che abbiamo inserito nelle nostre liste cosa abbiamo fatto nelle
2631130	2634270	liste dell'europa sotto la regia di denis verdini
2634270	2640630	abbiamo cercato di rinnovare la nostra classe dirigente in europa bisogna
2640630	2644650	esserci per contare non soltanto essere il primo grande gruppo ma bisogna essere
2644650	2650250	lì tutte le volte che si discute nel parlamento e che si vota mentre quando
2650250	2654670	abbiamo guardato le percentuali di presenza di tutti i parlamentari italiani
2654670	2658170	abbiamo scoperto che i parlamentari italiani specie quelle della sinistra
2658170	2663030	erano pochissimo presenti allora abbiamo inserito tanti giovani qui
2663030	2667590	c'è ne uno che corre nella vostra circoscrizione per l'europa vorrei che
2667590	2670170	caro de romanis si facesse avanti
2682010	2692310	europeo e con altre persone come lui noi vogliamo rinnovare inserire delle
2692310	2696670	iniezioni di gioventù nella nostra classe dirigente che come sapete non
2696670	2701110	viene dalla politica ma viene soprattutto dal mondo e dalla trincea del
2701110	2712070	lavoro. Tanti auguri, vuoi ripetere il tuo nome? Carlo de romanis. De romanis per un'europa più giovane e per un'italia più forte in
2712210	2712570	Europa.
2721790	2729950	Dennis ha accennato prima che fuori ci sono più di 2 mila persone che non
2729950	2733530	hanno avuto la possibilità di entrare qui che però hanno seguito attraverso un
2733530	2739350	grande schermo quello che noi siamo venuti dicendo qui e quindi voglio
2739350	2745570	ringraziarli innanzitutto di avere dedicato il loro tempo a questa nostra
2745570	2750070	occasione di incontro mi scuso con loro se non
