start	end	text
16220	17620	Applausi
23000	24140	Buonasera a tutti!
28300	39040	E non c'è Galli qua? Allora mettiamo in tre. E cioè? No, aggiungiamo un'altra sedia, no?
41340	45820	Noi vogliamo il signor Galli, insieme in Denizio, rimane inquieto.
50800	56980	Siamo praticamente il 31 di maggio, come era nel piano cronologico che avevamo
56980	63920	aprontato, abbiamo chiuso i sei principali appalti per cui stiamo già
63920	70020	partendo per quelle piastre di cemento armato, 20 piastre da un lato che poi
71420	77980	subito 20 e poi 150 in totale, su cui si potranno realizzare delle case vere, non
77980	82240	solo con i sistemi prefabricati ma anche con le normali tecnologie, che noi
82240	93820	vogliamo consegnare il 15 di settembre a 3.000 persone, fino a continuare e
96020	100980	terminare entro il mese di novembre ad avere consegnato abitazioni vere
101800	107120	ammobiliate, quindi con tutti i mobili necessari, a un totale di 15.000 persone.
107540	115260	In Abruzzo le cose vanno bene, ho visto qualche tentativo di far uscire fuori dei
115940	121040	dissensi da parte di qualcuno, io quando vado e praticamente con la testa sono lì
121560	125520	e lavoro tutti i giorni a risolvere i problemi, a trovare soluzioni, però vi
125520	131500	garantisco che entrando nei campi siamo circondati da un grandissimo consenso, ci
131500	138140	chiamano i loro angeli, mettendo anche un diavoletto come me nel numero e c'è una
138140	144780	grande serenità da parte di coloro che sono ancora nelle tende, come
144780	148980	vogliamo velocissimamente perché è la prima volta che si affronta così il
149720	154980	terremoto, noi abbiamo circa il 53% di case che sono agibili, cominciando dalla
154980	160880	prossima settimana le famiglie potranno rientrare, perché non prima perché sono
160880	166500	continuate le scosse e quindi tutti hanno una giustificabilissima paura, ora
166500	172060	da 7-8 giorni le scosse non ci sono più, le previsioni sono che non ce ne siano
172060	178440	prossimamente quindi avremo la metà di quella città di 63.000 abitanti che
178440	183000	abbiamo messo sotto un tetto negli alberghi della costa o nelle tende 120
183000	187000	tendopoli, la metà di queste persone, di queste famiglie, ritornerà nelle proprie
187000	194040	case, poi abbiamo un altro 10% circa che potrà rientrare dopo lavori che sono tali
194040	200120	da poter essere terminati in 30 giorni e quindi cominceremo a spostare una parte
200120	205080	delle persone che sono nelle tende negli alberghi, saranno venuti liberi a seguito
205200	211560	del fatto che le famiglie saranno andate nelle loro case. A partire dal 15 di
211560	215900	settembre prima per ciò che arrivi il freddo ci sarà quindi la possibilità di
215900	220340	consegnare questi appartamenti alle case con priorità in quelli che sono ancora
220340	225480	nelle tende e entro la fine di novembre noi dovremo avere ancora sotto un tetto
225480	230760	vero 63.000 persone che il terremoto aveva lasciato praticamente senza casa.
230760	238880	Credo che non sia mai successo, è una sfida pericolosa anche perché potrebbe
238880	244380	anche essere che se non saremo capaci di realizzare le case in questi tempi che
244380	248940	abbiamo individuato potremmo anche fare delle gran brutte figure, sono convinto
248940	253140	invece che ci riusciremo e d'altronde quando uno si pone un traguardo deve
253140	257280	saperselo forse ambizioso e quello che abbiamo fatto credo che questo sia una
257550	265070	molto buona. Vorrei dare un'altra nota per ciò che siamo riusciti a fare
265070	270970	altrove a Napoli, funziona tutto lo smaltimento dei rifiuti nonostante le
270970	276550	cose che si dicono e qualche fotografia che è apparsa sui giornali di pacchetti
276550	281490	di immondizia li ho chiamati pacchetti di immondizia elettorale lasciati da gente
281490	285730	della sinistra per farli fotografare,
289330	295490	invece non c'è da preoccuparsi, lo smaltimento dei rifiuti continua, abbiamo
295490	300930	discariche capaci di accogliere tutti i rifiuti prossimi nei prossimi due anni e
300930	305230	abbiamo il primo termovalorizzatore, quello di Acerra, che funziona benissimo
305230	311390	ed è un prototipo che potremmo realizzare là nelle altre regioni d'Italia dove ci
311390	320630	sarà la necessità. Altra cosa G8, tutto procede con l'accordo, il consenso direi
320630	325450	di tutti gli altri paesi che interverranno nel G8 che poi via via
325450	330510	diventeranno G14 perché il secondo giorno si aggiungeranno ai principali
330510	335570	paesi anche la Cina, l'India, il Sudafrica, l'Egitto, il Messico, il
335570	339950	Brasile e successivamente altri sei paesi che sono l'Olanda, la Spagna, la
339950	349050	Chia e poi l'Indonesia, l'Australia e ultimo, ho un buco di memoria, è strano, si vede che
349050	351110	sto invecchiando.
356450	361550	Quindi arriveremo poi, il terzo giorno avremo lì i sei più paesi, i paesi più
361550	365610	importanti dell'Africa che sono quelli che subiscono di più il morso della
365610	370790	crisi con un aumento di decine di milioni di abitanti dell'Africa che soffrono la
370790	375270	fame, quindi sarà un G8 molto impegnativo che dovrà portare a che
375270	381750	cosa? Alla risoluzione di tanti temi, il pacchetto climatico, la pirateria, le armi
381750	387370	nucleari da stoppare, eccetera, ma c'è una cosa nuova ed è il codice delle nuove
387370	392710	norme per il funzionamento del mondo della finanza e del mondo dell'economia,
392710	399850	quindi il sistema globale delle nazioni guarda questo G8 come il momento in cui
399850	404350	darsi nuove regole affinché non si possa più cadere in ciò che è successo che
404350	409990	ancora accertanaglia questa grave crisi finanziaria ed economica. Come
409990	413110	Presidente del Consiglio in questi giorni ho dovuto affrontare un'altra
413110	418790	emergenza ed è stata l'emergenza rifiuti a Palermo, città da noi amministrata,
418790	424010	subito alla sinistra si è messa a fare programmi dicendo, ecco vedete, qua a
424010	428130	Palermo si rischia un'altra Napoli, un'altra Campania, era successo che per
428130	432450	motivi sindacali nei rapporti tra gli impiegati della società che raccoglie
432450	442490	rifiuti e il Comune si erano fermati coloro che sono dediti a raccolta dei
442490	446610	rifiuti, ieri il Governo si è recato nella persona del Sottosegretario Guido
446610	452150	Bertolaso a Palermo, abbiamo convocato tutti, abbiamo risolto tutti, a partire
452150	458230	da fra una settimana Palermo ritornerà all'accilità, all'ordine, alla polizia che
458230	463590	deve esserci in una così bella città. Quindi c'è un Governo che opera, c'è un
463590	470290	Governo che affronta tempestimamente tutto ciò che si pone come problema e
470290	474430	credo che sia esattamente il contrario di quel Governo delle chiacchere a cui
474430	482170	purtroppo nel passato abbiamo dovuto fare il callo. Campagna elettorale, c'è una
482170	489630	campagna elettorale in cui si registra una grande assenza dell'Europa, nessuno
489630	497390	parla dell'Europa, abbiamo invece una grande possibilità che possiamo
497390	503870	cogliere, qual è? La possibilità di portare in Europa, se le urne ci
503870	508370	consegneranno gli stessi voti che sono annunciati nei nostri sondaggi, siamo dal
508370	513550	43 al 45 per cento come popolo della libertà,
521770	527810	noi potremmo avere il gruppo numericamente più importante nella
527810	531810	grande famiglia della libertà e della democrazia che è il partito del popolo
531810	537270	europeo, cioè i popolari in Europa, che a loro volta sono il partito più
537270	541050	importante nel Parlamento europeo, hanno la maggioranza relativa con circa il
541050	547970	38 per cento di parlamentari europei. Che cosa vuol dire? Vuol dire che se avremo
547970	552990	davvero possibile, proprio davvero possibile, il gruppo numero uno nel
552990	557910	Partito popolare, intanto avremo di sicuro il Presidente del Parlamento europeo che
557910	563150	il nostro Mario Mauro che è oggi Vice Presidente del Parlamento europeo e che
563150	568850	dopo più di trent'anni porterebbe in vetta al Parlamento europeo un italiano.
569770	575350	Secondo, noi saremo i più influenti dentro il gruppo dei popolari nel
575350	580750	momento in cui questo gruppo assume delle posizioni su tutti gli argomenti,
580930	586150	quindi saremo decisivi per far assumere una posizione su tutti gli argomenti che
586490	592630	verranno all'esame del Partito popolare. E quindi successivamente sarà stata la
592630	596910	nostra decisione che varrà dentro il Parlamento e questa nostra
600830	612090	che si riassumisce anche in quelli che voi già conoscete. Stiamo andando avanti per la
612090	617250	costruzione dell'Abruzzo e abbiamo praticamente il 31 di maggio, come era
617890	624250	nel piano cronologico che avevamo aprontato, abbiamo chiuso i sei principali
625010	631110	appalti per cui stiamo già partendo per quelle piastre di cemento armato, venti
631110	636870	piastre da un lato che poi diventeranno subito venti e poi centocinquante in
636870	642070	totale, su cui si potranno realizzare delle case vere, non solo con i sistemi
642070	648990	prefabricati ma anche con le normali tecnologie che noi vogliamo consegnare il
648990	661490	15 di settembre a 3.000 persone fino a continuare e terminare entro il mese di
661490	668350	novembre ad avere consegnato abitazioni vere ammobiliate, quindi con tutti i
668910	677910	15.000 persone. In Abruzzo le cose vanno bene, ho visto qualche tentativo di far
677910	683010	uscire fuori dei dissensi da parte di qualcuno, io quando vado e
683010	686510	praticamente con la testa sono lì tutti i giorni e lavoro tutti i giorni a
686510	690530	risolvere i problemi, a trovare soluzioni, però vi garantisco che entrando nei
690530	696310	campi siamo circondati da un grandissimo consenso, ci chiamano i loro angeli
696310	703990	mettendo anche un diavoletto come me nel numero e c'è una grande serenità da
703990	709650	parte di coloro che sono ancora nelle tende, come vogliamo velocissimamente
709650	714250	perché è la prima volta che si affronta così il seguito di un terremoto, noi
714250	718690	abbiamo circa il 53% di case che sono agibili, cominciando dalla prossima
719550	724670	settimana le famiglie potranno rientrare, perché non prima perché sono continuate
724670	731210	le scosse e quindi tutti hanno una giustificabilissima paura, ora da 7-8
731210	735410	giorni le scosse non ci sono più, le previsioni sono che non ce ne siano
735410	741790	prossimamente quindi avremo la metà di quella città di 63.000 abitanti che
741790	746350	abbiamo messo sotto un tetto negli alberghi della costa o nelle tende 120
746350	750270	tendopoli, la metà di queste persone, di queste famiglie, ritornerà nelle proprie
750310	757570	poi abbiamo un altro 10% circa che potrà rientrare dopo lavori che sono tali da
757570	763470	poter essere terminati in 30 giorni e quindi cominceremo a spostare una parte
763470	768510	delle persone che sono nelle tende negli alberghi, saranno venuti liberi a seguito
769130	774950	del fatto che le famiglie saranno andate nelle loro case. A partire dal 15 di
774950	779250	settembre, prima per ciò che arrivi il freddo, ci sarà quindi la possibilità di
779250	783710	consegnare questi appartamenti alle case con priorità in quelli che sono ancora
783710	788850	nelle tende e entro la fine di novembre noi dovremo avere ancora sotto un tetto
788850	794150	vero 63.000 persone che il terremoto aveva lasciato praticamente senza casa.
794430	802230	Credo che non sia mai successo, è una sfida pericolosa anche perché potrebbe
802230	807750	anche essere che se non saremo capaci di realizzare le case in questi tempi che
807750	812290	abbiamo individuato potremmo anche fare delle gran brutte figure. Sono convinto
812290	816490	invece che ci riusciremo e d'altronde quando uno si pone un traguardo deve
816490	820730	saperselo forse ambizioso e quello che abbiamo fatto credo che questo sia una
820730	828430	cosa molto buona. Vorrei dare un'altra nota per ciò che siamo riusciti a fare
828430	834230	altrove. A Napoli funziona tutto, lo smaltimento dei rifiuti nonostante le
834490	840050	che si dicono e qualche fotografia che è apparsa sui giornali di pacchetti di
840050	844850	immondizia, li ho chiamati pacchetti di immondizia elettorale lasciati da gente
844850	848310	della sinistra per farli fotografare.
852490	858830	Invece non c'è da preoccuparsi, lo smaltimento dei rifiuti continua, abbiamo
858830	864270	discariche capaci di accogliere tutti i rifiuti prossimi nei prossimi due anni e
864270	868950	abbiamo il primo termovalorizzatore, quello di Acerra, che funziona benissimo ed
868950	874770	è un prototipo che potremmo realizzare là nelle altre regioni d'Italia dove ci
874770	883470	sarà la necessità. Altra cosa G8 è tutto procede con l'accordo, il consenso direi
883990	888810	di tutti gli altri paesi che interverranno nel G8 che poi via via
888810	894250	diventerà G14 perché il secondo giorno si aggiungeranno ai principali paesi
894250	899710	anche la Cina, l'India, il Sudafrica, l'Egitto, il Messico, il Brasile e
899710	904950	successivamente altri sei paesi che sono l'Olanda, la Spagna, la Turchia e poi
904950	912410	l'Indonesia, l'Australia e ultimo ho un buco di memoria, è strano, si vede che
912410	914170	sto invecchiando.
919590	924950	Quindi arriveremo poi, il terzo giorno avremo lì i sei più paesi, i paesi più
924950	928930	importanti dell'Africa che sono quelli che subiscono di più il morso della
928930	933450	crisi con un aumento di decine di milioni di abitanti dell'Africa che
933450	942370	soffrono la fame, quindi sarà un G8 molto impegnativo che dovrà portare a che
943810	948670	pirateria, le armi nucleari da stoppare eccetera, ma c'è una cosa nuova ed è il
948670	954750	codice delle nuove norme per il funzionamento del mondo della finanza e
954750	960610	del mondo dell'economia, quindi il sistema globale delle nazioni guarda
960610	965830	questo G8 come il momento in cui darsi nuove regole affinché non si possa più
965830	970690	cadere in ciò che è successo che ancora accertanaglia questa grave crisi
970690	972690	finanziaria ed economica.
973230	976470	Come Presidente del Consiglio in questi giorni ho dovuto affrontare un'altra
976990	982150	emergenza ed è stata l'emergenza rifiuti a Palermo, città da noi amministrata,
982310	987330	subito la sinistra si è messa a fare programmi dicendo ecco vedete qua a
987330	991490	Palermo si rischia un'altra Napoli, un'altra Campania, era successo che per
991490	995810	motivi sindacali nei rapporti tra gli impiegati della società che raccoglie
995810	1005830	rifiuti e il Comune si erano fermati coloro che sono dediti a raccolta dei
1005830	1009970	rifiuti, ieri il Governo si è recato nella persona del Sottosegretario Guido
1009970	1015510	Bertolaso a Palermo, abbiamo convocato tutti, abbiamo risolto tutti, a partire
1015510	1020930	da fra una settimana Palermo ritornerà alla civiltà, all'ordine alla polizia
1020930	1026890	che deve esserci in una così bella città. Quindi c'è un Governo che opera, c'è un
1026890	1033650	Governo che affronta tempestimamente tutto ciò che si pone come problema e
1033650	1037770	credo che sia esattamente il contrario di quel Governo delle chiacchere a cui
1037770	1049190	purtroppo nel passato abbiamo dovuto fare il callo. Campagna elettorale, c'è una
1049190	1056050	grande assenza e dell'Europa, nessuno parla dell'Europa, abbiamo invece una
1057790	1064450	grande possibilità che possiamo cogliere. Qual è la possibilità di
1064450	1069830	portare in Europa se le urne ci consegneranno gli stessi voti che sono
1069830	1074650	annunciati nei nostri sondaggi, siamo dal 43 al 45 per cento come popolo della
1084170	1091150	libertà? Noi potremmo avere il gruppo numericamente più importante nella
1091150	1095170	grande famiglia della libertà e della democrazia che è il partito del popolo
1095170	1100610	europeo, cioè i popolari in Europa, che a loro volta sono il partito più
1100610	1104630	importante nel Parlamento europeo, hanno la maggioranza relativa con circa il 38
1104630	1111310	per cento di parlamentari europei. Che cosa vuol dire? Vuol dire che se avremo
1111310	1116350	davvero possibile, proprio davvero possibile, il gruppo numero uno nel
1116350	1121290	partito popolare, intanto avremo di sicuro il presidente del Parlamento europeo che
1121290	1125990	è il nostro Mario Mauro che è oggi vicepresidente del Parlamento europeo e
1125990	1132170	che dopo più di trent'anni porterebbe in vetta al Parlamento europeo un italiano.
1133130	1138710	Secondo, noi saremo i più influenti dentro il gruppo dei popolari nel
1138710	1144110	momento in cui questo gruppo assume delle posizioni su tutti gli argomenti,
1144230	1149810	quindi saremo decisivi per far assumere una posizione su tutti gli argomenti che
1149810	1155990	verranno all'esame del partito popolare e quindi successivamente sarà stata la
1155990	1160790	nostra decisione che varrà dentro il Parlamento e questa nostra decisione
1160790	1166590	assunta come maggioritaria nel partito popolare sarà la decisione maggioritaria
1166590	1171350	con cui influenzeremo i lavori e le decisioni del Parlamento. Che è
1171930	1176930	importantissimo per quanto ci riguarda perché il 70 per cento delle leggi
1176930	1182470	italiani che impongono orneri o dettano comportamenti ai cittadini italiani
1182470	1188230	vengono dal Parlamento europeo che ha anzi la brutta abitudine di legiferare
1188230	1194250	tutto, ha legiferato sulla lunghezza del gambo dei carciofi per poter
1194250	1198330	commercializzare i carciofi, sulla curvatura delle zucchine, incredibile ma
1198330	1204110	vero e ha prodotto tutta una serie di norme che sono di inciampo, lacci e
1204110	1209110	laccioli veri e propri a tutti i nostri imprenditori. Quando io fui Presidente
1209650	1212170	del Consiglio di Capi di Stato e di Governo in Europa,
1212710	1216670	veni invitato dal Presidente della Confindustria europea con la
1216670	1219970	partecipazione di tutte le rappresentanze di tutte le confindustrie
1219970	1226490	dei vari Paesi. Salì sul palco e fui ricevuto da una
1226490	1230170	serie infinita di scatoloni, mi meraviglia e dico non è una gran bella
1230170	1236670	accoglienza e domandai di cosa si tratta, mi invitarono ad aprirli, li apri e
1236670	1246650	contenevano tutte le direttive che gli imprenditori d'Europa chiedevano e
1246650	1251550	la libertà di resistere alla competizione straniera, alla concorrenza
1251550	1257130	straniera di quei Paesi che non sono assolutamente sottoposti a queste norme
1257130	1263130	nei procedimenti produttivi. Quindi l'Europa ha creato una montagna
1263130	1268790	davvero di difficoltà per chi intraprende, per chi investe, per chi rischia e quindi
1268790	1273910	anche in questa direzione essere il più importante gruppo del Parlamento europeo
1273910	1281890	significa poter fare un lavoro fondato e organico per rimediare a questa
1281890	1287030	situazione. Infine bisogna dare un dirizone all'Europa perché oggi l'Europa
1287030	1291130	non svolge quello che dovrebbe essere il suo obiettivo, quello che era stato
1291130	1295730	indicato dai padri fondatori tra cui il nostro De Gasperi, Schumann, Adenauer e
1295730	1299190	tutti gli altri, che avevano detto l'Europa ha come primo fine quello di
1299190	1303890	mantenere la pace tra gli Stati che siano confrontati negli anni precedenti
1303890	1309350	in una guerra sanguinosa che è stata la Grande Guerra, diffondere la libertà,
1309410	1315830	diffondere e far aumentare il benessere, ma anche essere faro di democrazia, di
1315830	1322050	libertà, di benessere e di pace nel mondo. Questo oggi l'Europa non è in grado di
1322050	1328170	farlo. Perché? Perché intanto non c'è un Presidente che con continuità la
1328170	1332670	rappresenti. Oggi se Obama vuole sapere che cosa pensa l'Europa su un certo tema
1332670	1341850	non ha uno a cui telefonare. Non c'è unità nella politica estera, non c'è una
1341850	1345990	politica della difesa, non c'è un esercito unico. Tutti i calcoli nostri
1346670	1351270	stanno a dimostrare che noi potremmo risparmiare il 50% di ciò che ogni
1351270	1356210	Stato spende nelle forze armate se avessimo finalmente un esercito unico.
1356590	1360850	Poi non abbiamo un'unica politica per l'energia, non abbiamo un'unica politica
1360850	1364610	per l'ambiente, non abbiamo un'unica politica per l'immigrazione che viene
1364610	1370190	scaricata attualmente sulle spalle dei tre paesi mediterranei, noi, la Francia e
1370190	1374150	la Spagna, ed anzi qualche volta qualche portavoggio si prende anche il lusso di
1374150	1381490	criticarci. Apro una parentesi, ho riflettuto profondamente sul fatto di
1381490	1386690	attuare quei respingimenti di cui la sinistra ci ha accusato come fossero
1386690	1390050	delle cose disumane. Cos'era successo? Era successo che col
1390050	1394670	precedente governo la sinistra aveva diffuso in oriente e in Africa la
1394670	1399970	sensazione che l'Italia avesse le frontiere non aperte ma spalancate e
1399970	1406210	quindi c'era una pressione migratoria di migliaia di persone che si stava per
1407110	1412690	addensare su di noi. L'altro giorno il premier spagnolo mi ha detto che loro
1412690	1419890	l'anno scorso ha vinto 8.000 clandestini africani, 8.000. Noi ne abbiamo
1419890	1423990	spinti alcuni, molti li abbiamo presi qui, li abbiamo messi dove? Nei centri di
1423990	1430010	identificazione e di espulsione rimangono lì in condizioni certamente non felici,
1430450	1437130	in condizioni certamente non di libertà e poi alla fine fatto salvo quel 7% di
1437130	1441170	persone che hanno i requisiti per chiedere il diritto di asilo che noi
1441170	1446390	sempre concediamo quando qualcuno fugge da una situazione pericolosa per la sua
1447130	1451310	libertà e da un paese dove c'è uno stato di polizia eccetera e questo è
1451310	1456210	sempre concesso gli altri li riportiamo addirittura indietro ma hanno perso tre
1456210	1462830	quattro mesi di vita e allora abbiamo deciso proprio per dare un segnale
1462830	1468810	preciso di deterrenza di cercare di intercettare i barconi le imbarcazioni
1468810	1475090	su cui ci sono queste persone sfortunate le avviciniamo diamo tutto il conforto
1475090	1479090	dell'aiuto possibile dal punto di vista dei viveri dal punto di vista dei
1479090	1483050	liquidi dal punto di vista dell'assistenza medica e poi li scortiamo
1483050	1486050	in sicurezza sulle coste da dove sono partiti
1486050	1489990	li trovano in libia un'agenzia delle nazioni unite a cui si possono
1489990	1494370	rivolgere e se hanno i requisiti per richiedere il diritto di asilo queste
1494370	1499410	persone noi le prendiamo e a nostro spese con sicurezza in sicurezza li
1499410	1504590	trasportiamo in italia ma la deterrenza ha funzionato sono 15 giorni che non
1504590	1509350	barca un solo clandestino sulle nostre coste
1519830	1520830	vediamo
1524730	1532310	vediamo a firenze con giovanni che mi ha fatto lunghe telefonate al riguardo
1532310	1536690	ho venuto a trovarmi eccetera io avevo preso un impegno e siccome
1536690	1540130	sono uno che mantiene le promesse anche quando prometto di andare una festa di
1541050	1541490	compleanno
1553190	1558510	io sono riuscito a dedicare i tre pomeriggi di cui che si sono resi
1558510	1562450	disponibili al di fuori della mia attività a palazzo chigi e l'ho dedicato
1562450	1567590	uno ieri a bari uno oggi a firenze e uno il quattro a milano quindi sono state
1567590	1572110	soltanto tre le mete cosiddette di campagna elettorale e in mezzo a queste
1572110	1575950	tre ce n'è una che riguarda questa straordinaria vostra città la città
1575950	1580790	dell'arte che ho detto giovanni mi impegno a promuovere città dell'arte
1580790	1582790	con una legge speciale quanto prima
1600350	1606590	devo dire che in questa possibilità di essere qui a firenze non è stato
1606590	1610230	soltanto il rapporto con giovanni galli che mi ha portato il rapporto con
1610230	1615250	firenze il rapporto con denis verdini eccetera ma c'è stato un altro momento
1615250	1620130	emotivo di pressione e che io collaboro tutti i giorni con un signore che fa il
1620130	1625410	mio capo ufficio stampa questo signore ha disobbedito a me perché una volta
1625410	1630570	dopo una cena alle bermude con la signora margaret toucher io ebbe rispondere
1630570	1635270	a lei che era curiosa mi domandava quanto lavorassi e io dicevo mi alzo le
1635270	1639250	sette e mezza di mattina poi lavoro nel pomeriggio e poi alla
1639250	1643110	sera vado a letto la notte solo alle due e mezza dice come mai e perché aspetto
1643110	1648570	giornali del giorno dopo li leggo mi arrabbio però vado a dormire la mattina
1648570	1653870	dopo sono fresco come un fiore e comincio da capo dice no it's impossible
1653870	1658210	non si può governare e leggere i giornali contemporaneamente dico ma lei
1658210	1662870	come fa lei mi dice guardi molto semplice il mio capo ufficio stampa mi
1662870	1666890	porta soltanto gli articoli che parlano bene di me e del mio governo
1667710	1671890	io ho chiamato la mattina dopo che sono tornato in italia paolo buonaiuti
1671890	1676130	io ho detto paolino da domani sistema taccia non l'ho visto più per due mesi
1682670	1689850	e allora io devo dire che c'è stata da parte di paolo buonaiuti fiorentino doc
1689850	1693850	una pressione continuativa mi ha parlato non ne posso più della vostra trambia
1693850	1695830	non ne posso veramente più
1701890	1706110	e anche per questo appoggio il progetto di non farla ma di usare quel sistema
1706110	1713330	misto che porta nel centro storico attraverso i mezzi pubblici e poi via via
