start	end	text
0	5840	sicuramente fra i massimi del primo cinquantegno non avrebbero potuto scrivere sull'Avanti
7780	13320	o sul popolo d'Italia, non potevano, cioè il volontariato, questa cosa preziosa, chi
13320	19100	scrive, dettato dalla passione di comunicare, una tempo riciclostilare eccetera, è vietata
19100	29980	questa attività in Italia e l'attività vietata radio radicale non può esistere perché c'è
29980	34840	per la tutela di tutti i diritti di tutti, ma anche con il diritto del volontariato di
34840	40200	Benito Mussolini, di Pietro Nenni a 20-30 anni, di dare vita ai propri giornali, alle
40200	47040	proprie cose, facendogli la fame, senza dover essere delle imprese che devono avere quella
47040	52160	pubblicità e passare, questo è un sistema infetto, allora, una maggioranza, proprio
52160	57200	sulle cose sulle quali credono, di poterci colpire in nome i progressisti e gli altri
57200	63740	centristi, il problema del diritto e della giustizia, noi vogliamo una grande politica
63740	70980	criminale, noi vogliamo una grande riforma del diritto, noi vogliamo eleggere democraticamente
70980	80040	i nostri giudici, noi non vogliamo che possa essere giudice solo chi a 23 anni fa un concorso
80040	87780	e ha il monopano di giudicare per tutta la vita, mentre i saggi, i giusti che vengono
87780	95100	dal diritto, dall'insegnamento, non potranno, gli è vietato come al grande scrittore, al
95100	101460	grande giornalista, gli è vietato di fare il giornale se non a quello, al grande saggio,
101540	107100	al grande uomo di diritto, di giustizia, gli è vietato di giudicare, gli è vietato di
107100	112760	essere giudice, si entra, si fa un concorso, tu sei sacerdo, sei eterno o quell'altro,
112900	119940	tu sei giudice, magia, in eterno e non se ne fai, e siete zagebeschi, ma anche persone
119940	127420	di una nobiltà immensa, che adoro come non zagebeschi, ma come Galante Garrone, non Bobbio,
128220	135140	ma devo dire proprio anche Alessandolo Galante Garrone, che non è tollerabile che egli non
135140	142640	venga in campo, proprio all'opposto di come fa, perché la grande speranza di giustizia,
142760	148740	di diritto, di organizzazione democratica, anche del diritto, non è possibile, un'organizzazione
148740	157740	sacrale, sei unto dal Signore, a 23 anni e poi sei giudice, sei dimostro di essere un
157810	163970	trovoloso artista, di essere un imbecille, di essere un fannullone e via dicendo tu
163970	172270	giudichi i tuoi simili, non studi più, ma niente affatto, siete antidemocratici, ma nel
172270	179770	senso se volete più nobile della parola, discendete dall'idea dello Stato e del diritto
179770	186570	degli anni 30, da quello dello Stato etico e di una parte del fascismo, senza i complessi,
187490	196990	se non siamo legittimati ad essere portavoce anche del Governo, della maggioranza, spiegare
196990	202310	con umiltà e forza gli errori, le stronzate che facciamo, perché sennò non siamo gente
202310	211610	feria, anche quello. Siete poter parlare a nome di una vita, ma non a nome di una comprovata
211610	220470	capacità di fare questo invece che quello, la comprovata capacità di fare alcune cose.
220730	226070	Mi volete spiegare perché mai chi ha fatto tutta la vita altro? Dal liberale d'un tratto
226070	233790	può fare benissimo il liberale. Quindi bisogna riconcepire per carità due mesi, due anni,
233790	243090	ma bisogna riconcepire il Governo, la maggioranza, i programmi, i progetti. Avremo tempo, temo
243090	251150	di no. Perché siamo vincenti in questo Paese se andiamo con la chiarezza della parola niente
251930	258890	evangelica, ma comunque tre, quattro, quelle attorno alle quali noi che non ci organizziamo
258890	265630	per etnie, ma per progetti umili, siamo qui come costituente di un nuovo soggetto politico,
266030	272670	che vogliamo essere costituente di riformatori e di Forza Italia concepita in un certo modo,
272730	277290	te lo diciamo da Marto, vedi che non sono riusciti a costituirla. L'idea è una grande
278050	285250	federazione di partito federale che si costituisce. Noi siamo qui per accelerare e dare l'esempio
285250	289950	per osmosi, perché si creino e si accelino, perché è necessario che si organizzi il
289950	298090	partito, uno dei due o tre partiti. E se Antonio Martino ricomincia o le cose di Antonio Martino
298090	303850	ad essere quelle che nel Governo possono farci esporre alla crisi, ma allora vale la pena,
304470	311030	ma io ho paura di trovarmi sul condono, credimi, abbiamo fatto il possibile. Lo stiamo guardando
311030	316490	da tutte le parti, è stato un errore, così gran parte, puoi darsi che ho torto, ma sai,
316590	323230	il radice ha visto, ci stiamo lavorando, errori di ingenuità, errori di sconoscienza, per
323230	328190	cui si rilegittima un partitino verde che al di fuori degli errori degli altri non esiste
328190	335170	più, non dice nulla, perde solo, ma perché non c'eravamo? Noi siamo quelli che dicono
335170	339510	che l'ambiente, tu l'hai già detto anche tu signor, che l'ambiente può essere uno
339510	347370	dei motori di ripresa, della nuova economia, perché è un motore l'ambiente, ma se poi
347370	352630	in contraddizione invece perché bisogna pensare a tanti altri guai, perché la partitocrazia
352630	359870	non ti consente di lavorare a governare, ma sempre a comporre dissenze, vi diciamo, questi
359870	369030	sono riforma della giustizia, riforma della informazione, ma con quella attenzione. Ho
369030	373570	visto anche gli accenti di fedele, ma la verità italiana sul piano fenomenologico
373570	377930	è che in Italia è un casino, ce ne sono troppe, perché in nessun paese al mondo ne
377930	382710	abbiamo tante quante ne abbiamo noi. Dieci, quindici anni fa avevamo solo la televisione
382710	390490	due reti di regime, questa è la lealtà e quelli che hanno fatto violenza nella televisione
390490	396870	di regime di monopolio, quelli sono quelli che adesso ci insegnano, finiamo e termino
396870	402750	da avere. Ho fatto alcuni esempi, questi ricordate sono anche le ragioni associative
402750	409430	del nostro associarci, perché sono cose che o si fanno adesso in Parlamento con il referendum
409430	415190	o se no non si faranno. Degli autobus ci sono, già queste settimane sono state molto costose
415190	422390	per tutti. Silvio Berlusconi quando improvvisò, perché aveva un bel discorso, bellissimo,
422390	429590	aveva visto scritto all'altra sala, l'altra volta improvvisò e ci disse cose fondamentali
429590	435770	e le disse al paese a se stesso. Devo dire, onestamente, io un giorno voglio prendere
435770	444090	degli arbitri e mettere quel testo di Silvio e tutta l'immensa letteratura del kennegiano
444090	450190	per diffunizione di tutti i salotti televisivi italiani, il mio amico Walter Veltrone. Lì
450190	454770	c'era in quei 10 minuti e un quarto d'ora di intervento di Silvio Berlusconi da noi,
455430	463430	c'era la nuova frontiera, c'era il grande richiamo rusveltiano, non kennegiano, allumine
463430	467970	a un diritto che deve fondarsi e le riforme che con questo si giustificano, la libertà
467970	476470	che per questo si scelge. C'era anche l'indicazione voi avete questo compito e dovete assicurarlo.
476470	482470	I mesi sono passati, non ti è stato consentito in qualche misura di andare nella direzione
482470	488650	contraria nel senso che ha acconciarsi a non avere le grandi parole riformatrici, a non
488650	495590	avere le suggestive indicazioni referendarie di Antonio Martino, a non avere anche se vuoi
496510	502290	la possibilità di consentirci dopo 40 anni di convenzio a Descudendum che funziona solo
502290	508070	con noi, ha funzionato solo con noi di dire alla gente quelle cose sulla giustizia, non
508070	513770	possiamo dirle nelle carte dei universitari, forse andrebbero dette questa cosa semplice
513770	517590	che la politica criminale è il ministro della giustizia, il governo è che non è fascista,
517970	523790	non è sporco, non è ladro, questo che rivendica questo, che sono scemi pazzi come tutti coloro
523790	530970	che sono presuntuosi, a dire invece che è possibile che un sostituto procuratore sia
530970	537010	titolare dell'esercizio della politica criminale in termini proprio di organamento dello Stato.
541750	548270	Adesso vorrei terminare con una espermazione, amici, che dovrebbe essere chiara rispetto
548270	554370	a quella persecuzione oggettiva che ogni giorno fa che tanti di noi sono stati considerati,
554370	562470	vengono vissuti, anzi non vengono considerati, ma vengono esteriormente vissuti come traditori
564750	570850	venduti. Questo proprio consentitemi di ringraziare ancora di nuovo, ma in particolare, veramente
570850	576810	in particolare, perché poi ce l'ho sotto gli occhi, un amico che certo non ha tolto
576810	583910	in nulla e nulla le proprie idee e anzi che è Giancarlo Giglio, tesoriere nazionale confermato
583910	590790	di A.D., che è fra i firmatari del nostro appello, che è qui a seguirci, perché io
590790	596630	so benissimo che per lui, che per sé era non da Nando e Donato, eccetera, ma sentono
596630	601370	nell'area che sono anche loro sul punto di vendersi, sono traditori e vi dicendo, così
601370	611590	vanno le cose da noi, e invece non è così e lo sappiamo bene. C'è una prova, a contrario,
612470	619610	che noi, amici, abbiamo avuto ragione proprio nelle cose che oggi sono accadute, che esagerando,
619790	625650	ma in questo caso, come dire, adotto alle loro esagerazioni gli altri, i progressisti,
626230	641050	i centristi, eccetera. Se una democrazia vede la propria stampa al servizio delle maggioranze
641050	648790	dei governi, quella democrazia è fragile, debole, in realtà non vede nella stampa creazione
648790	659530	di democrazia. L'autonomia un po' fiera della stampa nei confronti dell'altro potere e degli
659530	665810	altri poteri, anche nei confronti del giudiziario, però, signori giornalisti, mentre invece
665810	670710	volte il Mediterrestre, che sarebbe giusto, per esempio, che siate iscritti nei ruoli
670710	676630	delle procure delle Repubbliche, non in quelle del vostro giornale, ma è un fatto professionale,
677350	687510	è un fatto di professionalità, non di tradimento di essere venditi. Noi abbiamo una situazione
687510	693090	italiana nella quale abbiamo tutta la stampa che è contro il Governo, o molto contro,
693950	700270	devo dire, non so, tutti i vostri loschi traffici, se stai ancora a Montanelli e vi dicendo, no
700270	705690	Montanelli non è più con te, no? Bene, non è più con te mi pare nemmeno l'indipendente,
706870	713530	mi pare proprio di no. Se è con te il giornale, tanti auguri perché ce n'è proprio bisogno,
713670	720710	no, siamo d'accordo, come vedete abbiamo lo stesso riflesso. Mi volete dire un giornale,
720710	728470	il tempo non è antico, ma insomma è fini, non sei tu, no? Diciamo così come a fare.
729090	735570	Un mosto per dire una cattiveria e la dico perché è vera. Se al Messaggero non ci fosse
735570	746110	Marcello Pera che ti striglia in nome del diritto, in nome del rifiuto, dei linciaggi,
746630	751930	dei conformisti e dei conservatori e lo fa con sempre maggiore difficoltà, ho l'impressione
751930	756250	se vedo dove mettono i fondi suoi e quelli degli altri, però il Messaggero è ancora
756250	763150	al meglio che c'è in circolazione, pensate un po' di nuovo, no, eccetera, bisogna sapersi
763150	768310	acconciare insomma le altre cose. Volevo dire, sono tutti con te, quindi vabbè, io non mi
768310	773670	allarmerei. Il problema, amici, è che non è che questa stampa, la stampa deve essere
773670	779390	se volete contro, vigile, non contro, vigile rispetto al momento politico, rispetto alle
779390	784590	tentazioni del potere, deve tagliare le uglie, ma le tentazioni del potere sono anche quelle
784590	791170	dei partiti di opposizione. Noi in Italia invece, guardate la voce, guardate il mio amico Federico
791170	800550	Orlando, sono giornali che stanno con l'opposizione, non è che sono non dipendenti del governo,
801430	808550	sono, è il partito della stampa, è un partito in gran parte progressista con spazi che aumentano
808550	814690	centristi perché nella strategia progressista lo spazio centrista deve aumentare e quindi
814690	820630	Mariotto deve tornare a parlare e Nicola o Rocco chiunché sia, non importa ma ci avranno
820630	830530	Galli della Loggia eccetera eccetera, aumenteranno. Vabbè, allora, quindi se il Berlusca, se
830550	837190	vuole fare il colpo di Stato, si stuffa, prepara con previdi servizi segreti. Con Giuliano
837770	844970	Ferrara, in mass media, l'uso ghebbelsiano della televisione, pare che il mio amico Giuliano
844970	853210	come sgradimento sia al vertice, quindi che ghebbelsiano è, no? Ecco, quindi voglio
853210	860530	dire, c'è contro la stampa, il blocco sociale che si era conservatore creato attorno, quindi
860550	866610	mi avviso, alle 10 milioni di tessere che noi paghiamo in qualche misura di quali siamo
866610	871890	i settori per il sindacato, io sono convinto, la roba importa, la cosa più importante in
871890	879950	Italia di continuità sono questa stronzatina, 5 milioni di pensionati devono essere iscritti
879950	885610	al sindacato perché è trattenuta sulla pensione e 5 milioni di lavoratori devono essere,
885610	892090	io non so fare bene i conti, ma 10 milioni di tessere amici all'anno, non so quanto
892090	898510	fa, dipende a quanto è, quanto fa 10 milioni, ma scherzi, le cifre sono altre 10 milioni
898510	903950	di tessere, quindi immagino c'è un pochettino una cosa, con le proprietà e via dicendo,
904290	908870	ma comunque noi vediamo, allora voglio invitare a fare questa riflessione.
929790	945590	L' Margherita della Quantità
945610	959750	L'altro motivo è perché noi siamo dei liberali e vogliamo i pesi e i contrapesi, cari amici
959750	972690	se il 27 e il 28 marzo vincevano loro la stampa come sarebbe stata? Qualsiasi cosa fatta
972690	982510	da loro? La Rai TV come sarebbe stata? Scusatemi e Mentana e Funari e Costanzo e tutti gli
982510	987670	altri come sarebbero stati? Probabilmente il mio amico Enrico Mentana avrebbe continuato
987670	992790	a credere, allora aveva ragione, che la politica fa delle buone audience e non avrebbe scoperto
992790	996970	come ha scoperto che in fondo quando sono cambiati certi soggetti politici meglio la
997210	1003650	monaca nera che è la politica, che l'ha scoperto e lo pratica, infatti il gap tra
1003650	1010370	TG1 e TG5 sta aumentando, 34 e 24, Fedele non legge a nocciaggiorno, gli manderò al
1010370	1016450	centro una scolta radicale, così si convince anche lui, ma guai se uno se provenesse, perché
1016450	1022690	sarebbe discriminazione politica, non il fatto che c'è il 34 e il 24, quindi forse ci vuole
1022850	1030290	qualcuno che tende a portare al 39 e al 29. Allora noi ci siamo mossi da liberali amici,
1030350	1035410	la nostra posizione è difficile, ma nel momento in cui però rivendichiamo, adesso
1035410	1042050	basta, adesso queste battaglie si fanno, con precisione, si impongono, vogliono discutere
1042050	1048830	di Paolo, per carità fanno bene, si deve fare, però devono discutere anche adesso
1048830	1055770	della presidenzialismo americano, del lunturno e del federalismo americano e dobbiamo ridere,
1056470	1062430	chiediamo ai cittadini di formare, questa è l'organizzazione nostra. Abbiamo avuto
1062430	1069410	circa 2.200 adesioni dopo questi annunci sul giornale, un centinaio di ordinari di università,
1069670	1076010	cominciamo quindi anche nel mondo, come dire, il più snob, e forse avere alcuni sintomi
1076010	1079990	di ripresa, ma è urgente, niente fretta, ma le urgenze
