start	end	text
0	6220	sistema ancora non ha quelle due riforme che in particolare noi ospichiamo, cioè, ripeto,
6400	15360	il presidenzialismo e il sistema uninominale maggioritario ad un solo turno. Credo che Lenon
15360	21200	è ancora grandissimo nel senso dell'età, ma ha già raggiunto l'età per poterci dare
21200	23240	una risposta. La ringrazio.
39920	47060	Bene, innanzitutto, molte grazie per l'accoglienza che è stata calorosa a dispetto di questo
47060	54260	avvertimento circa la cattiveria e la presenza di cattivi che fanno i cattivi, soprattutto
54260	62420	nei miei confronti. Bene, ho fatto proprio una bella scelta, scendendo in campo l'anno
63320	68160	passato. Cattivi di là, speravo almeno comprensione di qui, cattivi da una parte e cattivi di
68160	80160	l'altra, mi resta solo la mia mamma. E, tra l'altro, i buoni sono oggi pomeriggio e sono
80160	89400	dall'altra parte, secondo lei. Bene, sapremo essere avvisati e sapremo discernere ciò
89400	95800	che appare da ciò che è. Io mi scuso anche tanto per l'interruzione precedente, non
95800	101580	è colpa mia, ma in effetti sono un elemento di disordine pubblico, l'avete notato. Forse
101580	106740	quelli dall'altra parte non hanno tutti i torti, ma mi scuso perché avevo programmato
106740	114220	per tutta la giornata, quando gli amici della convenzione per la riforma liberale mi hanno
114220	121100	anticipato il giorno dell'incontro. Avrei voluto restare qui, io vengo non dalla politica,
121140	126040	lo sapete, non vengo dalla filosofia della politica, dalla filosofia del diritto, ho
126040	132380	sempre molto da approfondire ed era questo un'occhiasione ghiotta per poterlo fare. Garantisco
132380	139740	tuttavia a tutti coloro che sono intervenuti, a tutti gli illustri, a professori, gli illustri
139740	145340	amici che sono intervenuti, che io leggerò parola per parola gli atti di questo convegno
145340	153560	e lo farò con la voglia di chi sa che deve ancora imparare molto e soprattutto con quella
153560	160020	spinta a utilizzare le migliori intelligenze che ci fanno l'onore di stare in questa battaglia
160020	165200	con noi per carpire a loro tutto ciò che potrà servire a renderci più sicuri nel
165200	175600	cammino che dobbiamo ancora proseguire. Vorrei cominciare con il porre ad alta voce delle
175600	185580	domande perché so che molti di voi, come d'altronde devo confessare anch'io, sono in questi ultimi
185580	193640	tempi pungolati da una serie di tubi. Si è esaurita la carica liberale che ha portato
193640	199600	il Paese dal referendum in cui fu condannata la vecchia legge elettorale proporzionale
199600	206260	alle elezioni politiche del 27 di marzo. Ha vinto o sta vincendo ancora una volta un'Italia
206260	212800	pigra che non vuole cambiare, che non vuole lasciare le vecchie care abitudini del consociativismo
212800	219280	parlamentare, del rinvio, del non governo. Le ideologie di cui un memorabile saggio del
219280	225580	professor Colletti ci raccontò il tramonto sono di nuovo all'attacco, con tutta la forza
225580	233300	di illusione che ancora posseggono. Dobbiamo essere chiari nella risposta a questi interrogativi.
233740	242780	Il pericolo che questo accada esiste, ma le energie per impedire questa deriva, questo
242780	249480	è fortissime. E dunque, come dimostra anche il vostro lavoro di costruzione di un'associazione
249480	255420	per la riforma liberale dentro il polo delle libertà e a fianco del movimento politico
255420	263920	di Forza Italia, la partita è tutt'altro che chiusa. Anzi, è apertissima e possiamo
263920	271060	giocarla fino alla fine senza arroganza, ma sapendo con certezza che la possiamo vincere.
271820	278540	I segnali di allarme li conoscete meglio di me. Il governo uscito dal 27 marzo ha proposto
278540	284900	con determinazione al Paese una serie di questioni che sono il cardine di una riforma liberale.
285600	292200	Abbiamo legiferato per evitare un nuovo aumento della pressione fiscale, per ricostruire le
292200	299200	condizioni di una effettiva libertà economica, per ridurre la disoccupazione senza creare
299200	306480	posti di lavoro artificiali, per riformare il fisco in senso federalista, per restituire
306480	312540	al cittadino le giuste garanzie legate ai diritti della persona, per riformare infine
312540	319080	a fondo il sistema previdenziale, il vero grande buco nero che inghiotte il bilancio
319080	325600	dello Stato e fa gravare sul debito pubblico qualcosa che non ci consente di appartenere
325600	331260	al grande concerto delle nazioni europee. Eppure, ecco il primo segnale allarmante,
331380	338360	le forze della disgregazione e della faziosità politica sono riuscite a bloccare questo processo
338900	346300	di riforma, un processo di riforma ancora in fascia. Non siamo stati sbalzati di sella
346300	352600	per volere del popolo, ciò che è perfettamente normale in ogni democrazia liberale, ma solo
352600	360140	ed esclusivamente per volere di pezzi della nuova e vecchia nomenclatura, in ragione,
360180	365760	cioè di un espedente parlamentare senza riscontro con la volontà degli elettori, quello che
365760	373120	ormai tutti conoscono come il famoso ribaltone. La giusta, sacrosanta questione della regolazione
373120	379700	del conflitto potenziale di interessi legato alla mia leadership del governo è stata agitata
379700	386240	contro di noi in una forma del tutto impropria, come una crociata contro la libertà di impresa,
386360	394100	come un tentativo distruttivo di negare legittimazione fino allo splendido voto del referendum dell'11
394100	409680	giugno, fino alla nostra vittoria elettorale. Nei mesi successivi alla Costituzione, per
409680	415700	questo tecnico, si è assistito a un ballo in maschera di vecchie figure della scena
415700	422100	politica italiana dell'ultimo cinquantennio e di vecchie idee che abitavano nella Prima
422100	429100	Repubblica. Nuovi segnali di allarme ci hanno indotto a dubitare della possibilità di difendere
429100	436000	la novità introdotta dal voto del 27 marzo e prima di esso dal cromuroso risultato anticonsociativo
437000	443520	del referendum del 18 aprile del 1993. Si è fatta una legge elettorale per le elezioni
443520	450260	regionali che è un pasticcio compromissorio tra proporzionalismo e spirito maggioritario,
452960	459300	si è decretata una legge sulla par condicio che è venata di una sottile cultura della
459300	466420	censura e soprattutto della esclusione della gente dalla comunicazione politica. Si è
466420	473540	cercato di rimettere in discussione, in modo spesso pretestuoso e direi anche partigiano,
473980	480140	la legge elettorale fino a spingere il Presidente della Corte Costituzionale a ricordare che
480140	487760	non si può cambiare la legge elettorale ogni due anni. Si sono fatti innegabilmente dei
487760	494200	passi indietro sul terreno del fisco che è tornato a premere sull'economia e a generare
494200	501160	inflazione in misura eccessiva e sulla stessa questione della riforma delle pensioni è
501160	508660	stata scelta una via mediana che è comunque un risultato ma non il buon risultato che
508660	516860	sarebbe stato possibile senza il plebiscito sindacale e glassista a cui assistemmo nel
516860	521720	corso del primo sciopero, quello che qualcuno definì, contro i nostri figli, il primo sciopero
521720	528960	contro i nostri figli della nostra storia. Tutto questo oscillare reso possibile dalla
528960	537240	forzata interruzione del primo esperimento veramente liberale dopo decenni di paternalismo
537240	545840	e statalismo ha rimesso all'onore del mondo un'idea di stato che avevamo colpito e che
545840	555180	si presenta comunque nonostante tutto come un brutto anacronismo. È lo stato impiccione
555180	562480	che dirige dal centro, che non accetta l'autogoverno locale, che non delega, che sorvegli i cittadini
562480	567800	e si lascia a sua volta sorvegliare dai settori meno moderni della pubblica amministrazione.
568420	574860	È lo stato dei divieti che sono così diversi dalle regole accettate e riconosciute dalla
574860	581860	comunità. È lo stato della legiferazione impazzita, della norma che figlia altre norme
582380	589300	senza criterio e senza costrutto. È lo stato che sta con il fiato sul collo dell'economia,
590440	596840	che sta con il fiato sul collo alla cultura, alla vita civile di cittadini adulti, trattati
596840	604300	spesso come minorenni. Per la verità, ed è questa l'opinione espressa da storici e opinionisti
604300	611300	molto seri, il tentativo di introdurre in Italia un sistema politico maggioritario
612300	620620	ha davvero qualcosa di rivoluzionario. L'Italia monarchica e prefascista ha sperimentato un
620620	627400	liberalismo spesso polveroso e asfittico. C'era qualche grandezza nella destra storica,
627540	633180	nel giolittismo, ma complessivamente quel sistema politico era condizionato da baratti
633180	639260	infranotabili, da esclusivismi e gelosie di parte, da una burocrazia dello Stato unitario
639260	646260	che cresceva a dismisura e rindeva il liberalismo sabaudo, una variante meno dinamica e forte
646260	654300	del liberalismo anglosassone. Sta di fatto, e questo è un dato indiscutibile, che in Italia
654300	661220	non abbiamo avuto mai l'alternanza di forze diverse alla guida dello Stato e contemporaneamente
662430	669970	la stabilità politica. L'idea di un governo di legislatura, che attui un programma scelto
669970	677030	dai cittadini e insedi al governo una classe dirigente da essi votata, è un'idea che
677030	683850	deve ancora tradursi in realtà. Le alchimie del vecchio notabilato liberale, le follie
683850	690710	corporative del fascismo e poi la lunga stagione del Partito Stato, quella democrazia cristiana
690710	698590	inamoribile che se ne stava al centro del sistema, tutto questo ci ha tolto il piacere
698590	707490	di essere un normale Paese europeo. Ho cercato, cari amici, fino ad ora di essere
707490	715430	sincero e realista, di ripercorrere con voi dubbi che abbiamo in comune. Ma vorrei anche
715430	722150	essere chiaro su un punto decisivo. Io non credo che sia in alcun modo possibile far
722150	728330	tornare indietro questo Paese dalla strada che ci è scelta. Non credo che sia in alcun
728330	735170	modo possibile tornare alla girandola notabilare dei partiti che sequestrono la politica e
735170	740970	decidono tutto. Sono certo che l'acquisizione di fondo di questo ultimo anno, il diritto
740970	747450	di votare per eleggere un governo e un'opposizione e per scegliersi un programma a fare due proposte
747450	763230	alternative, questa conquista non ce la può portare via nessuno. L'evoluzione del mondo
763230	770950	moderno non sopporta le residue e prevalenti procedure di decisione che si devono fare
772190	778330	in maniera ottocentesca. Lo sviluppo tecnologico e la diffusione dell'informazione e della
778330	785050	cultura richiedono un potere politico sempre più trasparente, sempre più di servizio,
785410	791830	sempre meno gravato dai rituali della vecchia politica. Credo che anche tra i nostri avversari
791830	798710	le forze di cultura statalista e di orientamento non garantista infatti dei diritti civili,
798710	806310	si stia diffondendo l'idea che la grande sfida del 27 marzo deve essere raccolta e che l'affermazione
806310	812710	definitiva di un modello politico totalmente diverso da quello che ha portato il Paese
812710	820850	sull'orlo della bancarotta è assolutamente indispensabile. Non mi faccio illusioni, ma
820850	827750	accanto ai segnali di allarme che ho cercato di elencare puntigliosamente, vedo anche
827930	837030	i segnali positivi che danno fiducia e speranza. Per prima cosa bisogna osservare che il soggetto
837030	843810	politico costruito il 27 marzo si è arricchito di nuovi contributi. Il polo delle libertà
844690	853390	non ha ceduto alle lusinghe, alle intimidazioni, ai tentativi di colonizzazione dall'esterno
853390	859090	che abbiamo visto si sono moltiplicati in questi mesi. E questo è un punto politico
859090	865870	importantissimo. Siamo uno schieramento di uomini liberi, riflettiamo mille sensibilità
865870	873190	diverse e mille culture, ma non cediamo e non consentiamo che si ceda sulle questioni
873190	883370	fondamentali sui punti cardinali della nostra rotta. In secondo luogo, il paese è un paese
883390	886830	che ha bisogno di essere rilanciato. Bisogna dire che nell'opinione pubblica si va facendo
886830	893870	largo, in modo sempre più pressante ed evidente, un sentimento laico e liberale, una consapevolezza
893870	899750	del fatto che il paese ha bisogno di essere rilanciato e che il rilancio è possibile
899750	906470	se si esce dall'accupezza autolesionistica, da una visione chiusa e provinciale della
906470	912130	vita civile, da un'idea vindicativa e greta dell'amministrazione e della giustizia.
913050	920450	La gente non sopporta più i luoghi comuni, vuole vederci davvero chiaro, difende l'opera
920450	926450	di moralizzazione intrapresa dalla magistratura, ma comincia a distinguere, a scegliere, a
926450	933590	valutare caso per caso. Ed è sempre più disposta a quella funzione di controllo critico
933590	939950	senza la quale il potere di alcuni settori della magistratura inquirente rischia di straripare
939950	963570	con gravi danni per l'assetto democratico e liberale dello Stato. Inoltre, anche i nostri
963570	972410	e che un agile accordo su certe regole e garanzie, su uno statuto delle opposizioni e sull'accesso
972410	979090	ai mezzi di comunicazioni di massa, deve poter favorire la imminente scelta da parte del
979090	993550	corpo elettorale di un governo politico di legislatura stabile e autorevole. Ma i problemi
993550	1000950	hanno vinto le elezioni con un programma di radicale rinnovamento dello Stato. Avevamo
1000950	1009370	parlato di un tetto costituzionale all'aumento della spesa pubblica, di un incremento dell'occupazione
1009370	1018190	attraverso una politica serie di agevolazioni alle imprese e di decongestionamento della
1018190	1025490	spesa di norme e autorizzazioni di tipo burocratico. E tutti i punti che sono stati da poco ricordati
1025490	1031990	dal Professor Brunonetta hanno fatto oggetto di indagine e di decisioni al tavolo del Consiglio
1031990	1037930	dei Ministri. Ma, come tutti sapete, è molto difficile passare dalle decisioni da quel
1037930	1041770	poco di potere che ha il Capo del Governo, che è soltanto un potere di coordinamento
1041770	1048870	di indirizzo alla norma finale e alla norma efficace. Eppure, tuttavia, tutte le disposizioni
1048870	1053690	che abbiamo potuto assumere anche attraverso la forma del decreto legge nei primi tre mesi
1053690	1058290	di vita del nostro Governo, quando ancora sembrava che la coalizione fosse una coalizione
1058290	1063930	non incrinata dall'interno, da una volontà distruttiva, tutte quelle norme hanno provocato
1063930	1069510	delle cose benefiche, tanto è vero che il Governo è riuscito a fare quello che aveva
1069510	1075490	usato sorrisi sulla labbra dei nostri avversari, è riuscito ad avere una cosa che sembrava
1075490	1082430	impossibile conseguire insieme, meno spesa pubblica, meno tasse e una riduzione del deficit
1083070	1089150	annuale dello Stato. A questo si aggiunge il rilancio della produzione, quello che è
1089150	1097530	successo nella bilancia commerciale che ha chiuso con 45.000 miliardi di surplus attivo,
1097530	1105870	quello che è accaduto nell'ambito dell'occupazione, con una base occupazionale che si è allargata
1105870	1110610	e in questi primi mesi dell'anno, certamente non a causa di interventi che non ci sono
1110610	1115730	stati del Governo dei Tecnici, abbiamo avuto un incremento superiore alle 300.000 unità
1115730	1122890	che ha confermato, come quei conteggi precisi che noi avevamo fatto, indicando in almeno
1122890	1127750	un milione di posti di lavoro, ciò che si poteva conseguire operando questi interventi
1127750	1133970	che abbiamo in parte operati, non fosse una parola al vento, non fosse una promessa vana
1133970	1139430	che avevamo buttato lì per conseguire dei vantaggi elettorali. C'è la possibilità
1139430	1144630	di aumentare il numero dei posti reali, il numero dei posti effettivi, l'ha ricordato
1144630	1150750	il Professor Brunonetta, non so se arrivare a 25 milioni di posti di lavoro sia in effetti
1150750	1157150	possibile, questo mi sembra che sia un poco ottimistico, ma certamente dando slancio,
1157350	1163990	dando fiducia, dando certezze alle imprese, è possibile che questi nostri grandi talenti
1163990	1168490	imprenditoriali che costituiscono una delle grandissime diversità del nostro Paese nei
1168490	1174350	confronti agli altri si rimettano ad intraprendere con fiducia, avendo delle certezze e si possa
1174350	1180710	qui sviluppare nel nostro Paese quel miracolo di ripresa che avevamo indicato come possibile
1180710	1187150	e che ancora riteniamo possibile. Avevamo parlato di tutte quelle cose che possono
1187150	1195010	appunto cambiare, che possono appunto cambiare e noi ci sentiamo ancora depositari della
1195010	1202190	speranza del cambiamento e io in nessun momento mi dimentico che ci hanno eletto, che ci hanno
1202190	1208470	andato al governo, dandoci il diritto di governare, considerandoci i depositari della
1208470	1216270	speranza di cambiamento. Lo siamo ancora, ce lo ricordiamo sempre, cercheremo di procedere
1216270	1225330	secondo quanto ci è stato indicato dai nostri elettori. Avevamo quindi parlato di tutte
1226330	1234890	che possono cambiare uno stato dei partiti in uno stato dei cittadini, in cui la rappresentanza
1234890	1241590	politica in Parlamento e nel governo assolve un ruolo di spinte e di guida senza prevaricare.
1242190	1248930	In parte abbiamo realizzato il nostro programma, in piccola parte forse, e il perché lo sappiamo
1249130	1256730	di tutti. Certo c'è stata, come ho ricordato, l'azione disgregatrice e dinamitarda dell'onorevole
1256730	1262830	Bossi, il quale ha ormai scelto per sé il ruolo, non sprechiamo neppure gli applausi
1262830	1269610	su di lui, che ha scelto ormai per sé un ruolo preciso, il ruolo dell'ufficiale esattore
1269610	1275450	dell'economia e della politica italiana, nel senso che il prezzo che intende far pagare
1275450	1281350	ai cittadini, a chi si vuole alleare con lui in termini di stabilità politica, mi
1281350	1288230	pare che diventi ogni giorno più alto. Ma un Bossi da solo non spiega nulla e non determina
1288230	1295990	nulla. Il vero problema è che noi siamo saliti su una macchina, la macchina dello stato di
1295990	1304630	cui non avevamo nelle mani il volante. Anzi, probabilmente il volante non esiste proprio.
1305830	1312470	Infatti il problema di assicurare in tempi certi la possibilità di decidere e poi di
1312470	1317930	tradurre in pratica quel che si è deciso, quello problema che ho appena ricordato, è
1317930	1327890	il problema dei problemi della democrazia italiana oggi. Un Paese democratico moderno non è
1327890	1333670	quel Paese in cui tutti partecipano in un modo o nell'altro alle decisioni e ne condividono
1333670	1341250	ambiguamente le responsabilità. Un Paese democratico è invece quel Paese in cui chi
1341250	1349130	governa governa e chi controlla controlla, ed entrambi governo ed opposizione hanno
1349130	1356270	gli strumenti giusti e efficaci per svolgere il ruolo assegnato loro dal corpo elettorale.
1357750	1368690	Dobbiamo, cari amici, impegnarci pubblicamente davanti al Paese sulla via delle riforme costituzionari.
1369510	1375970	Dobbiamo far capire nel modo più sereno e persuasivo che la democrazia italiana ha
1375970	1383630	bisogno di istituzioni nuove e che il dovere della prossima legislatura repubblicana è
1383630	1390690	quella di produrre queste nuove istituzioni. Bisogna mettere chi governa in condizione
1390690	1397950	di governare e chi si oppone in condizione di controllare. La centralità del Parlamento
1397950	1404610	è il frutto di una vecchia tradizione politico culturale, la quale è estremamente rispettabile
1404610	1410370	e ha dato al nostro Paese tante cose giuste e buone, ma è una dotrine invecchiata che
1410370	1418010	genera un sistema di veti e di paralisi reciproche, non un governo stabile ed efficace, come dimostra
1418010	1424430	la tremenda statistica sulla vita media dei governi nell'Italia repubblicana e la mancata
1424430	1433890	attuazione per molti decenni di un serio ricambio nel governo del Paese. Occorre un nuovo rapporto
1433890	1441670	tra potere esecutivo e potere legislativo. Il primo deve avere gli strumenti per poter
1441670	1448190	governare. Il secondo, tutte le possibilità di controllare l'attività dell'esecutivo.
1449190	1457150	Sia il Parlamento, sia l'esecutivo devono ricevere un'investitura diretta da parte degli
1457150	1486910	elettori. Devo dirvi che questa convinzione è ormai
1486910	1493370	in me forte e radicata, soprattutto dopo il tempo che abbiamo passato a Palazzo Chigi.
1493890	1499670	Questo Paese è ingovernabile. Si potrà governare soltanto se si cambieranno le istituzioni e
1499670	1505610	quindi questo che noi annunciamo è frutto di un lungo lavoro di approfondimento ed è
1505610	1515170	diventato oggi un convencimento assoluto. Questa fondamentale innovazione costituzionale naturalmente
1515170	1522690	si deve accompagnare a un'altrettanto importante innovazione nei poteri del Parlamento che
1522690	1528790	vanno accresciuti quanto alle funzioni di autorizzazione e di controllo secondo le indicazioni del
1528790	1537570	miglior costituzionalismo europeo e americano. L'intervento riformatore in materia di costituzione
1537570	1544910	è certamente un aspetto delicato del fare politica. In teoria la nostra carta costituzionale
1545170	1551950	dice che basta la maggioranza semplice per cambiarla in tutto o in parte. In realtà
1551950	1558730	è previsto il potere abrogativo del popolo via referendum costituzionale e certamente
1558730	1564690	esistono le ragioni di chi osserva che la costituzione è nata in sintonia con la scelta
1564690	1571750	di una legge elettorale proporzionale. Andrebbe dunque sollecitato, e noi lo sollecitiamo
1571750	1578310	apertamente come materia di confronto politico davanti al popolo elettore, un consenso il
1578310	1583970	più largo possibile sulle riforme urgenti e necessarie per dare al Paese stabilità
1583970	1588990	democratica e una cultura davvero liberale delle istituzioni.
1589850	1598170	È possibile prevedere che le riforme costituzionali approvate dal Parlamento non diventino legge
1598170	1605010	per la sola scelta di una maggioranza semplice, ma debbano invece essere sottoposte, se non
1605010	1611650	è raggiunto il quorum dei due terzi, a un referendum consultivo che dia direttamente
1611650	1619350	agli italiani il potere di scegliersi la forma di governo. Una sola cosa deve essere esclusa,
1619610	1625810	la possibilità di procedere sulla strada su cui già si sono registrati tanti fallimenti.
1625810	1631590	Se la discussione sul mutamento delle forme di governo, sulla riforma delle istituzioni
1631590	1637230	per rendere più atorevole e forte il potere esecutivo e il potere di controllo delle camere
1637230	1643950	dovesse di nuovo impantanarsi nelle sabbie mobili dell'unanimismo consorciativo, questo
1643950	1650490	sarebbe un pessimo servizio reso al Paese. I cittadini avvertono come ineluttabile il
1650760	1656720	cambiamento che è in atto. Bisogna che la classe dirigente che essi sceglieranno di
1656720	1663760	governo e di opposizione faccia la sua parte nel libero confronto parlamentare tra maggioranza
1663760	1673740	e minoranza e poi affidi a loro, ai cittadini, la funzione di protagonisti che scelgono. Se
1673740	1679980	vogliamo governi che lavorino e realizzino i programmi voluti e votati dagli elettori.
