start	end	text
0	6000	che va molto molto al di là degli impegni elettorali, vi è innanzitutto una ragione
6000	18460	che consiste nella necessità di affrancare il Meridione, di liberarlo, di riconsegnarlo
19920	25260	a quella concreta possibilità che il Meridione ha di essere protagonista del suo futuro.
26140	37800	Il Meridione ha bisogno di libertà, libertà dalle mafie e da quelle mafie ancor più pericolose,
38420	44800	ancor più insinuanti, ancor più offensive, perché meno tragiche, meno sanguinose,
44880	52060	meno violente, quelle mafie rappresentate per tanti anni dalle losche clientele che
52060	58940	hanno messo il Meridione in ginocchio. Libertà del sud dalla criminalità e dalla clientela,
60080	69720	libertà del sud dal sottosviluppo economico, dalla disoccupazione, dalla perenne emergenza sociale,
70720	78220	dalla miseria, dall'angoscia che in tante circostanze è protagonista della vita di tanti
78370	86210	giovani meridionali e di tante famiglie di giovani meridionali. Libertà del Meridione dalla mafia,
86330	93450	dalla clientela, dal sottosviluppo economico, dalla miseria, libertà del Meridione dalla
94770	100950	subalternità culturale e geografica. E se il Meridione per davvero ha necessità innanzitutto
100950	110890	di essere liberato, diventa naturale che l'alleanza tra il sud e le forze politiche sia innanzitutto
110890	117330	l'alleanza tra il Meridione e quel polo delle libertà che è nato innanzitutto come coalizione.
118030	124670	I uomini di forze, di idee volte a raggiungere un identico e unico obiettivo, dare all'Italia
124670	132510	la libertà perduta che non è soltanto libertà di produrre ma è anche libertà di poter respirare,
132650	140830	di poter vivere, di poter pensare e programmare il futuro. Ecco perché abbiamo scelto Napoli per
141510	148470	aprire la campagna elettorale nel Meridione, ecco perché seppur rapidamente è doveroso ripetere
148470	158890	quelli che sono i punti salienti del programma che il Polo presenta da Napoli all'attenzione di
158890	164550	tutto il Meridione e, come è stato detto, all'attenzione di tutta l'Italia perché vi è
164550	174910	anche questo aspetto che rende il patto tra il sud e il Polo un patto assai più forte di quelle
174910	180250	che possono essere le intese che di volta in volta si raggiungono tra alcuni elettori e i partiti
180250	188830	quando si è chiamati alle urne. Il Polo delle libertà è anche il Polo della Unità nazionale
188830	196310	e anche il Polo che ha ben chiaro ed evidente che mai e poi mai si potrà prendere nemmeno in
196310	203270	considerazione l'ipotesi di far venir meno quella Unità nazionale che è stata conquistata anche,
203270	212190	direi soprattutto, dal sacrificio di tantissimi meridionali e se in queste ore qualcuno pensa
212190	218690	che da parte del Polo vi possano essere nei confronti dell'Unità nazionale declamazioni
218690	228830	solemne e al tempo stesso piccole e perché no magari apparentemente innocue desidenze sappia
228830	235230	che non soltanto questo non accadrà ma che nei confronti del meridione in particolar modo
235850	242510	si sentiremmo in qualche modo intorto e in colpa se per avere un pugno di parlamentari in più
242510	258810	facessimo venir meno quello che è un impegno solenne che in particolar modo alleanza nazionale
258810	268030	Per il meridione e per l'Italia, programma che è incentrato innanzitutto sulla necessità di liberare
268030	276490	il sud indicando modalità precise, proposte concrete, strategie vincenti e convincenti.
277810	288790	Liberare il meridione e battere la mafia significa innanzitutto essere consapevoli del fatto che la
288790	297530	legge più severe ma anche con una migliore presenza delle forze dell'ordine sul territorio e io voglio
298910	307730	rivendicare a merito del governo di centrodestra, a merito del governo Berlusconi, la finanziaria che
307730	315270	fu presentata e che pur in presenza di una politica di rigore e di equità, pur in presenza di taglia
315270	324550	la spesa non tolse un solo centesimo al ministero degli interni ma anzi ne rafforzò gli istanziamenti
325290	330970	perché era ed è evidente al centrodestra che la lotta alla mafia non si fa con le chiacchiere,
331230	338410	non si fa con i proclami, non si fa con gli impegni ma si fa aiutando concretamente la
338410	345250	polizia e i carabinieri a presidiare il territorio. Lotta alla mafia significa potenziamento delle
345250	353350	strutture, lotta alla mafia significa potenziamento degli uffici giudiziari affinché i processi
353350	362870	possano farsi in tempi brevi, affinché coloro e sono tanti che collaborano con la giustizia
362870	370350	abbiano la certezza di vedere condannare a pene giuste e severe i camorristi che denunciano,
370350	377610	affinché gli italiani del meridione avvertano che lo Stato non è soltanto l'esattore ma è al
377610	383490	contrario il garante dei diritti ed in particolar modo dei diritti dei più deboli. Lotta alla mafia
383490	391950	e alla camorra, aggredendo i patrimoni illecitamente accumulati dai mafiosi come dai camorristi,
392890	399790	mafiosi e camorristi che non hanno timore né di proclami né di impegni, hanno timore
400550	405810	unicamente di poliziotti e carabinieri che possano arrestare, di magistrati che possano
405810	412570	condannare e di uno Stato che possa sequestrare quelle che sono le ricchezze accumulate in tanti
412570	420610	anni di disattenzione e in alcuni casi di complicità e di omertà da parte delle istituzioni. Lotta
420610	429530	alla mafia facendo in modo che chi oggi è costretto ad avvicinare ambienti mafiosi o camorristici
430170	435970	abbia domani la possibilità di non farlo, abbia la libertà sufficiente per denunciarne l'esistenza.
436970	444490	Lotta alla camorra significa anche una riforma del sistema creditizio italiano ed in particolar
444490	452930	modo meridionale perché quanti sono, quanti siete coloro che posti di fronte ad una piccola
454110	461530	emergenza e in molti casi nel sud non si tratta di un'emergenza di liquidità per investimenti. Nel
461530	468490	meridione in alcuni casi manca il denaro per poter curare i bambini ammalati, manca il denaro
468490	476050	per comprare libri di scuola, manca il denaro per la quotidiana sopravvivenza, quanti sono coloro
476050	484190	che si avvicinano all'usura che è controllata dalla camorra trovando le porte sbarrate nelle
484190	492710	banche e trovando in molti casi banche che hanno dilapidato autentiche ricchezze perché erano le
492710	502210	complici di un potere politico e di un potere economico che nel passato si è fatto forte di
502210	509910	un rapporto privilegiato con le banche. Ecco perché non deve sembrare paradossale se nella
509910	516470	parte del mio discorso relativa alla lotta alla criminalità trova seppur rapidamente sparte il
516470	522930	riferimento indispensabile non solo alla lotta all'usura e qualche passo è stato fatto in
522930	529150	Parlamento poco prima dello scioglimento della legislatura ma trova anche un passo importante
529150	536990	di riferimento alla necessità di salvare le banche del meridione ma soprattutto di renderle
537850	544730	trasparenti per evitare che il sud di venga colonia anche da questo punto di vista oggi è
544730	551410	necessità del meridione tutto quanto che è un istituto glorioso quale è il banco di napoli
551410	558530	possa risorgere la nuova vita dopo essersi liberato non soltanto di alcune mappie ma anche
558530	565170	soprattutto dopo essere stato risanato a seguito delle politiche suicide che nel passato
566090	572590	videro protagonisti vertici di quell'istituto. Lotta alla criminalità e alla mafia e alla
572590	579890	camorra significa anche e soprattutto lotta al disagio sociale, lotta alla disoccupazione,
580950	588050	lotta alla miseria perché non siamo così ingenui da pensare che la lotta alla criminalità
588730	595990	sarebbe automaticamente vinta soltanto dopo aver meglio controllato i quartieri, meglio controllato
595990	601890	il territorio, dopo aver bonificato il sistema bancario, dopo aver garantito il diritto del
601890	609190	cittadino che è un diritto innanzitutto alla sicurezza, importanti tasselli del mosaico ai
609190	615430	quali va necessariamente aggiunto il più importante garantire il lavoro a chi non ce l'ha.
615490	621910	Fino a quando vi saranno percentuali di disoccupazione nel sud a due cifre fino a
621910	626530	quando il meridione avrà una percentuale di disoccupati che in alcuni casi raggiunge il
626530	633330	25 o il 30 per cento non avremo mai alcuna possibilità di sconfiggere la camorra perché
633330	639310	in molti casi la camorra appare come l'unica possibilità concreta di non morire di fame,
639830	650430	di non essere sottoposti a quella umiliazione che in tante circostanze prende e stringe il
650430	659970	cuore di tanti giovani e giovanissimi, lotta alla disoccupazione non soltanto come indispensabile,
662170	667950	doveroso impegno di tutti coloro che credono nell'autentica solidarietà, ma lotta alla
667950	672290	disoccupazione anche come indispensabile antidoto al dilagare della criminalità.
674590	683070	E a tale riguardo il programma del Polo si presenta non soltanto come innovativo ma ha
683070	690870	presunzione di indicare quelle che sono le uniche possibilità del Sud Italia per riprendersi
690870	696910	quanto prima, per poter camminare a testa alta e in modo autonomo come abbiamo detto
696910	704850	mille mille altre volte. Non sono mai mancate nel passato le analisi più o meno dotte su
704850	710710	quello che è il vero motivo per cui il Sud Italia soffre in termini economici, né sono
710830	719010	mai mancate nel passato gli istanziamenti. E diciamo a Napoli esattamente ciò che abbiamo
719010	726830	detto a Milano e a Torino e possiamo serenamente dire in ogni parte d'Italia, il Sud non ha
728290	740810	bisogno di istanziamenti a pioggia, di istanziamenti più o meno clientelari, non ha bisogno di
742130	752030	di nuovi e ulteriori contributi se non in quella misura di equità, di solidarietà che
752030	757790	è stata garantita nel recente passato e che deve essere assicurata anche nel prossimo
757790	764210	futuro. Voglio cedere in termini ancora più espliciti che al Polo delle Libertà non sfugge
764210	769870	quella che è stata la drammatica realtà del Meridione negli anni passati. Non sono venuti
769870	777130	meno gli istanziamenti, è venuta meno innanzitutto l'onestà di una classe dirigente che non
777130	786250	è stata capace di amministrare e di governare se fossero state realizzate tutte le opere
786250	794830	pubbliche promesse, se fossero state completate le opere pubbliche avviate, se fosse stato
795670	802690	portato a compimento anche la decima parte di quello che era stato assunto come impegno
802690	809650	nei confronti del Sud, oggi sicuramente l'economia meridionale si troverebbe in condizioni assai
809650	817750	diverse e sarebbe anche in condizione di poter pilotare una politica di ripresa. È che nel
817750	824310	passato è mancata non la possibilità di istanziamenti, ma è mancata al contrario la trasparenza,
824310	829630	l'onestà, la moralità indispensabili per fare in modo che quegli istanziamenti producessero
829630	837570	ricchezze, producessero condizioni sociali idone ad una politica di sviluppo. È mancato
837570	843230	nel passato qualsiasi lucido disegno volto a mettere il Meridione in condizione di camminare
843230	853610	da solo. Quante sono le opere pubbliche che nel Meridione sono rimaste incompiute? Quanti
857710	865730	sono stati al contrario i monumenti alla incapacità che hanno ornato e ornano le nostre zone e
865730	873010	le vostre terre? Quale vergogna più grande può esservi sulla pelle di una classe dirigente
873010	879050	quale quella meridionale, se non quanto è accaduto dopo l'immane sciagura del terremoto
879050	885270	che divenne non già occasione per una grande gara di solidarietà, ma al contrario occasione
885270	893010	per pochi al fine di costituire patrimoni di inestimabile ricchezza? Ecco perché comprendiamo
893010	899190	una amarezza, una rabbia, comprendiamo in certi momenti un desiderio che può sfociare
899190	907190	anche in forme clamorose di protesta. Quando il Presidente della Regione, Rastrelli, mi
907190	916910	ha detto che vi era in città un imbarazzo profondo, vi era in città per molti aspetti
916910	923690	un sentimento di dolore ma anche di indignazione, per la insensibilità dimostrata dai massimi
923690	929070	vertici istituzionali, di fronte a una delle tante tragedie che hanno colpito la vostra
929630	935070	città, quando cioè mi è stato detto che per la tragedia di Secondigliano non c'era
935070	944850	stato un solo momento di effettiva presenza da parte dello Stato, non ho potuto far altro
944850	952970	che dire a me stesso che era la maledizione che continuava a gravare sul Meridione, maledizione
952970	958870	che non era presentata dalla mancanza dei denari, ma è stata rappresentata dalla mancanza
958870	969770	di attenzione, di rispetto, di sensibilità. E allora ecco perché va innanzitutto ribadito
969770	978590	che nel Sud sarebbe sufficiente per determinare una vera e propria rivoluzione, garantire
978590	984850	una classe dirigente onesta, così come già è accaduto nelle ultime elezioni amministrative
985490	991310	nelle tre più grandi regioni meridionali, una classe dirigente onesta che sappia amministrare
992210	998310	distanziamenti, che sappia utilizzare i fondi a disposizione, che sappia attivare i tanti
998310	1005470	contributi che l'Europa mette a disposizione del Meridione, una classe dirigente che possa
1005470	1013650	avviare una politica di ripresa accompagnandola da idee chiare circa la necessità di quegli
1014370	1020110	interventi che devono essere garantiti da parte del Governo centrale e che devono essere
1020110	1024950	per l'appunto finalizzati a mettere il Sud in condizioni paritarie rispetto al Nord,
1025970	1033230	il che vuol dire grandi opere pubbliche, il che vuol dire infrastrutture, il che vuol
1034950	1043490	dire acquedotti, autostrade, ferrovie, aeroporti. Il Meridione d'Italia non potrà mai competere
1043490	1049950	alla pari con il resto del territorio nazionale fino a quando vi sarà una situazione infrastrutturale
1049950	1057630	deficitaria e grave, fino a quando la Napoli-Reggio Calabria sarà un'autostrada che offende
1057630	1070970	l'Italia che è pur sempre una grande potenza economica e finanziaria, fino a quando gli
1070970	1077770	imprenditori meridionali dovranno pagare rispetto ai loro colleghi del settentrione, non soltanto
1077770	1086650	le stesse identiche tasse ma in più quelle tasse aggiunte derivanti dal pizzo e derivanti
1086650	1093270	dai costi eccessivi che per i loro prodotti si ricaricano e si riversano in assenza di
1093270	1100950	infrastrutture degne di un grande popolo, di un grande paese, di un'economia che è
1100950	1107950	un'estate dell'Occidente. E allora quando il Polo dice investimenti nel Meridione non
1108510	1114470	vuole ne riportare in auge i tempi della cassa del Mezzogiorno, ne tanto meno prefigurare
1114470	1121910	una nuova stagione di presenza dell'economia gestita dallo Stato nel Sud, ma vuole unicamente
1121910	1128830	al contrario far comprendere che nel Sud Italia è ancora necessaria la presenza dello Stato
1129870	1135210	non già per dare denaro ai clienti ma al contrario per garantire alla imprenditoria
1135210	1141590	meridionale e in particolar modo a quella più sana di poter competere a parità di
1141590	1150730	condizioni con l'economia del nord e del centro Italia. Una politica delle infrastrutture,
1151190	1158470	una politica di investimenti finalizzata a raggiungimento di nuovi posti di lavoro,
1158990	1165910	in quei settori che sono stati traditi e in molti casi negati nel recente passato. Il
1165910	1176210	Polo, cari amici di Napoli, non ha rinunciato alla ambizione di poter davvero, se sarà
1176210	1188970	in condizione di governare in modo stabile, in modo duraturo per 5 anni, il Polo non ha
1188970	1194950	si è tanto ironizzato nei mesi scorsi su quello che era stato l'impegno assunto in
1194950	1201970	prima persona da Berlusconi, il milione di posti di lavoro. Un'ironia che non soltanto
1201970	1210030	è stata fuori di luogo e in molti casi usata a sproposito ma che oggi si ritorce contro
1210030	1218450	coloro che all'ironia avevano fatto riferimento perché pochi sanno che qualche tempo dopo
1218450	1226970	la fine del governo Berlusconi fu proprio l'Istat a rendere noto che i primi effetti
1226970	1233170	positivi di quella inversione di tendenza che il centrodestra aveva messo in opera anche
1233170	1240750	nell'economia e anche nel meridione stavano determinando i primi risultati, 300-350 mila
1240750	1248430	nuovi occupati, molti dei quali nel sud, perché finalmente si era avviata una stagione
1248450	1256810	nella quale l'obiettivo primario del governo non era quello di aiutare il grande capitale
1256810	1265150	assistito, non era quello di sanare i bilanci a fine anno degli enti pubblici mal amministrati
1265150	1271590	ma era diventato quello di mettere chi vuole investire nella condizione di poterlo fare
1271590	1278430	e oggi che si fa un gran parlare di cosa occorre fare, si è avviato un'opinione di
1278450	1284730	fare per il sistema fiscale, ma credo che tutti abbiano compreso che ci si deve innanzitutto
1285450	1291390	confrontare con le proposte innovative e vincenti che il Polo lanciò con il ministro delle
1291390	1298950	finanze del governo Berlusconi, l'amico Tremonti, che con quella politica soltanto accennata
1298950	1304070	riuscì innanzitutto a mettere il piccolo e il medio imprenditore in condizione di accettare
1304070	1308510	il rischio di un nuovo investimento perché in cambio di quel rischio aveva la garanzia
1308510	1313630	da parte dello Stato di una diminuzione del prelievo fiscale e allora la politica di investimento
1313630	1319870	nel sud significa anche soprattutto avere le idee chiare circa i settori in cui va investito
1319870	1325730	il denaro, settori che sono le vere grandi ricchezze del meridione perché il meridione
1325730	1333130	è ricco innanzitutto per quello che riguarda l'enorme potenzialità che può dare il turismo
1333850	1341190	che può dare il commercio che può dare un'agricoltura finalmente elevata a dignità che può dare
1341190	1348090	il terziario che possono dare le piccole medie industrie di trasformazione il meridione è
1348090	1355370	ricco anche soprattutto per l'enorme patrimonio culturale che il sud può vantare non solo
1355370	1361530	nei confronti del resto d'Italia ma nei confronti del resto dell'Europa e del tutto inutile
1361530	1367810	quante volte lo abbiamo detto pensare di risolvere la tragedia della disoccupazione giovanile
1367810	1374550	a due cifre nel sud promettendo impossibili assunzioni in una pubblica amministrazione
1374550	1380730	che è stata riempita a dismisura nel passato dai tanti clienti del vecchio assetto partitocratico
1380730	1387310	o peggio ancora promettere che saranno le grandi industrie del nord a calare nel meridione
1387310	1392790	magari utilizzando il denaro del contribuente e magari chiudendo qualche anno o qualche
1392790	1400170	mese dopo e lasciando esasperazione e in molti casi miseria ancora maggiori il meridione
1400170	1405990	ha la possibilità di vivere una stagione del tutto nuova si ha finalmente una classe
1405990	1413870	dirigente un governo centrale ma anche governi regionali e amministrazioni locali che sappiano
1413870	1418810	investire su quelle che sono le ricchezze potenziali dal sud turismo l'agricoltura
1418810	1424230	il commercio le piccole le medie industrie di trasformazione perché non manca certo
1424230	1431630	la fantasia non mancano certe le capacità non manca certo la professionalità che pur
1431630	1438310	va difesa e aumentata perché la lotta alla disoccupazione nel sud e anche la lotta
1438310	1439990	alla politica per dare alle...
