start	end	text
2966040	2968560	io credo che questo possa venire
2968560	2971520	che si possa aumentare, ricordatevi che siamo il partito
2972220	2974260	che ha il tetto più alto
2974260	2976980	voi vedete alleanza nazionale
2977520	2980500	tante attese ma poi non è mai riuscita a superare
2980500	2983500	un tetto preciso, quel 15 che forse potrà diventare
2983500	2986300	il 16, il 17, il 18%
2986300	2988340	ma quello è un tetto, è un limite
2988340	2991340	che per ragioni storiche sarà difficile per loro superare
2991940	2993740	e ne sono coscienti
2993740	2998580	il PDS, anche lui ha questo limite del 21, 22, 23%
2998580	3000320	in tutte le elezioni
3000320	3003680	è successo che quello è stato il tetto
3003680	3006120	a cui il PDS si è fermato, l'intera sinistra
3006120	3008860	con rifondazione comunista non è mai andata
3008860	3011840	nemmeno nelle ultime elezioni, guardate che non è aumentata
3011840	3013960	la sinistra nelle ultime elezioni
3013960	3016960	il risultato che è venuto, è venuto per i motivi
3017520	3018980	a cui ho accennato prima
3020360	3023180	hanno saputo aggregare delle forze
3023180	3025680	che ancora portavano dietro di sé dei voti
3025680	3028140	storicamente vicini a loro, il partito socialista
3028140	3030320	sono riusciti a fare un miracolo per quello
3030320	3034180	ha messo insieme un partito post comunista, un partito comunista ancora
3034180	3037200	che è rifondazione comunista, un partito post democristiano
3037200	3040120	un partito post socialista, un partito post liberale
3040120	3042160	un partito post repubblicano
3042160	3045500	e un nuovo partito della sedia che è quello di Dini
3046120	3049320	e con questa
3053700	3054700	ammucchiata
3054700	3057100	abile, intelligente
3057100	3062460	sono riusciti a avere nel passaggio un inominale
3062460	3063900	più seggi di noi
3063900	3066660	che invece siamo aumentati davvero
3066660	3068400	loro sono rimasti dove erano
3068400	3071640	noi siamo aumentati, vi ho ricordato prima il risultato di Forza Italia
3071640	3075580	è aumentata l'Alleanza nazionale che due anni fa le politiche aveva avuto il 12
3075580	3077900	e qualche cosa, ha avuto il 15 e qualcosa
3077900	3081580	il CCD insieme al CDU ha fatto il 5,6
3081580	3084160	quindi credo che noi siamo andati al 43%
3084160	3087300	e in termini di voti li abbiamo superati
3087300	3090660	quindi abbiamo da lavorare su fatti marginali
3091220	3093220	dobbiamo avvicinare a noi persone
3093220	3096100	che non sono convinte, anche tutto quel mondo cattolico
3096100	3099280	che stranamente ha ritenuto di mettersi insieme
3099280	3102160	a chi ha sempre combattuto, dovunque è stato al governo
3102160	3104980	in tutti i paesi dell'est, la chiesa cattolica
3104980	3108220	le istituzioni cattoliche, la scuola cattolica
3112680	3114300	come lo possiamo fare?
3114800	3118560	non possiamo certamente contare sull'aiuto dei mass media
3118560	3120720	avete visto e l'ho ricordato prima
3120720	3124140	come ci siano ovazioni
3124140	3127200	nei confronti dei nuovi governanti
3127200	3129100	possiamo farlo ancora una volta
3129720	3132340	attingendo alle nostre coscienze
3132340	3135480	e traendo dalle nostre coscienze
3135480	3139160	la decisione di lavorare per un ideale grande
3139160	3142300	che è quello di avere per il nostro futuro
3142300	3146620	un paese più giusto, un paese più libero
3146620	3148920	un paese che conosca maggiore benessere
3148920	3152180	che possa dare risposte a quei giovani
3152180	3154020	che oggi non hanno nemmeno speranza
3154020	3156220	perché non vedono come potersi trovare un lavoro
3156220	3159180	come poter aspirare a farsi una famiglia
3159180	3163340	io credo che questo noi lo potremo fare soltanto se sapremo
3163340	3168400	tutti quanti siamo qui impegnarci a lavorare nel concreto
3168400	3171520	dal vertice, dal centro verranno indicazioni
3171520	3174100	su ciò che si deve fare in questo mese
3174100	3175540	piuttosto che in quell'altro
3175540	3178540	ci saranno possibilità di stimoli notevolissimi
3179360	3183320	ma è all'interno di ogni realtà locale
3183320	3186260	che bisogna trovare lo stimolo principale
3186260	3188040	le ragioni di stare insieme
3188040	3191300	le ragioni per operare come una forza nuova
3191300	3192760	all'interno della società
3192760	3195980	per uno stato, ve lo ricordo, che non è lo stato
3195980	3197600	che hanno in mente loro
3197600	3200680	uno stato padrone, uno stato partito
3200680	3202680	al cui servizio sono i cittadini
3202680	3205560	per uno stato invece che veda il primato dell'individuo
3205560	3207560	il primato della società civile
3207560	3212500	che veda i cittadini che considerano lo stato al loro servizio
3212500	3214100	e non servitori dello stato
3214100	3217540	e questa è la grande distanza che ci separa da loro
3217540	3221260	e questa è la diversa filosofia, il diverso modello di stato
3221260	3224680	che noi abbiamo in mente che vogliamo sia applicato nel nostro paese
3225220	3227680	e per il quale noi vigiliamo e vigileremo
3227680	3230680	quindi intanto
3232020	3235060	un lavoro anche qui generoso
3235060	3239180	per queste scadenze delle elezioni regionali
3239180	3239440	per queste scadenze delle elezioni regionali
3239440	3243000	ci sono tante liste, andiamo soprattutto a convincere
3243000	3245580	chi vuole andare dietro a questo o quel candidato
3245580	3248080	perché è o amico o vicino o conosciuto
3248080	3249720	che sono voti sprecati
3249720	3253680	che sono voti che potranno dare agli altri
3253680	3257860	una responsabilità di governo che non si vuole dare agli altri
3257860	3261980	probabilmente chi vota per delle liste che si riferiscono al principio dell'autonomia
3261980	3262220	probabilmente chi vota per delle liste che si riferiscono al principio dell'autonomia
3262220	3265680	non vuole dare la Sicilia in mano alla sinistra
3266260	3269180	bene, si può verificare il pericolo
3269180	3271440	che è diventato cosa vera al nord
3271440	3275180	dove chi ha votato la Lega certamente non era di sinistra
3275180	3277680	ma ha consegnato il paese alla sinistra
3279240	3281480	e questo può accadere anche qui
3281480	3284480	se troppe cittadini crederanno
3285180	3287520	a queste liste autonome che non hanno in effetti
3287520	3291140	nessuna possibilità di incidere nel governo della regione
3291140	3293520	e quindi questo è un grande compito
3293520	3295940	di attivarvi quanti siete
3295940	3299180	nei confronti di parenti, di amici, di conoscenti
3299180	3301720	di persona, telefonando, scrivendo
3301720	3304320	in maniera tale che a tutti sia chiaro
3304320	3308700	che imballa un fatto importante, imballa il destino della vostra regione
3308700	3311700	e questo destino merita di essere consegnato
3312340	3313940	nelle mani di chi
3314660	3317020	crede di potersi impegnare
3317020	3320960	per un rinnovamento morale, economico, politico
3320960	3323820	sulla base di quella direzione che i nostri programmi
3323820	3326700	illustrano con chiarezza. Ecco, io credo che questo sia
3326700	3330000	il compito primo, immediato, nei prossimi giorni
3330000	3332700	fino alla scadenza elettorale dell'altra domenica
3333600	3335880	credo che tutti dobbiate tirare sulle maniche
3335880	3338680	e lavorare in quella direzione
3338680	3342100	e poi il lavoro per il futuro
3342100	3345260	per poter arrivare non alla seconda repubblica
3345260	3347280	nella quale ormai nessuno di noi crede più
3347280	3350860	c'è ancora per la verità una lenta agonia
3350860	3354200	della prima repubblica, questa seconda repubblica
3354200	3357840	nelle mani di chi ha prodotto
3357840	3359940	lo sfacelo che abbiamo ereditato
3359940	3362420	pensate che questi signori che sono al governo
3362420	3367880	sono i protagonisti del periodo 1980-1993
3367880	3369560	periodo nel quale
3369560	3371400	il famoso consociativismo
3371400	3375400	è riuscito a moltiplicare per otto volte il debito dello Stato
3375400	3377600	lasciandoci quel cumulo immenso di macerie
3377600	3380640	costituito da 2.200.000 miliardi
3380640	3383620	di debito pubblico, il passato che mangia
3383620	3386100	non solo il presente ma che mangia il futuro
3386100	3389820	e io non vedo come chi ha portato la nave sugli scogli
3389820	3392340	non possa ritenere di poterla portare
3392340	3394440	fuori dagli scogli in mare aperto
3394440	3397460	quindi noi qui a lavorare per una nuova Sicilia
3397460	3399340	a lavorare per una nuova Italia
3399340	3402500	a lavorare per la terza repubblica che è quella
3402500	3406060	a cui noi ci dobbiamo preparare per affermare i nostri principi
3406060	3409060	di libertà, i nostri principi di giustizia
3409060	3411300	i nostri principi che tendono al ben essere
3411300	3414820	attraverso non una politica delle tasse delle imposte
3414820	3417880	anche qui io non so davvero come possiamo
3417880	3419980	ancora tollerare che uno Stato...
