start	end	text
28840	29980	Sottotitoli creati dalla comunità Amara.org
58580	59980	Sottotitoli creati dalla comunità Amara.org
74140	75780	Sottotitoli creati dalla comunità Amara.org
75780	89980	Sottotitoli creati dalla comunità Amara.org
148580	149980	Sottotitoli creati dalla comunità Amara.org
179420	179800	Sottotitoli creati dalla comunità Amara.org
193340	194760	Sottotitoli creati dalla comunità Amara.org
199360	209240	Sottotitoli creati dalla comunità Amara.org
210000	212000	Non c'è in gioco una cosa qualsiasi,
212660	214860	non c'è in gioco una forza politica,
214900	218540	non c'è in gioco il posto in Parlamento di qualcuno,
218620	221420	ma qui c'è in gioco l'avvenere nostro,
221460	223860	delle nostre famiglie, del nostro Paese,
224040	225600	la nostra libertà.
225760	228180	Noi saremo qui tutti insieme,
228480	229800	quanti siamo stati eletti,
230160	233160	quanti siamo come Forza Italia, in tutta Italia,
233980	235000	a combattere, a vigilare,
236180	238320	perché nel nostro Paese non si possa instaurare
238320	241380	qualcosa di negativo lontano da ciò che noi vogliamo
241380	244320	che sia per noi e per i nostri figli.
244900	248280	Certo che il panorama che ci si presenta davanti
248280	251640	non è un panorama molto ottimistico.
252080	254680	Abbiamo di fronte una crisi
254680	257060	che si annuncia come importante.
257560	260540	C'è una crisi innanzitutto di entusiasmo, di fiducia.
260940	263320	L'elezione che abbiamo avuto,
264080	266320	il fatto che il Governo sia andato nelle mani della sinistra,
266320	269640	ha provocato in molti imprenditori,
269760	270680	in molti manager,
271680	274500	una delusione che si è trasformata anche
274500	277600	in una visione pessimistica del futuro.
278140	281780	Ecco, io credo che ora dobbiamo tutti quanti
281780	283600	fare i conti con questa realtà,
284540	286320	non lasciarci prendere dal pessimismo
287040	290700	e evitare che possa instaurarsi nel nostro Paese
290700	293520	un periodo negativo, un periodo di recessione.
293920	296200	Certo che i segnali sono forti
296200	298840	è diminuito la spinta per quanto riguarda
298840	300120	la voglia di intraprendere,
300660	304160	è diminuita la spinta ai consumi,
304480	307440	l'avvaloramento della lira per un certo verso positivo
307440	310280	per un altro verso rende più difficili
310280	312020	le nostre esportazioni
312020	316140	e quindi noi prevediamo,
316140	318240	insieme con tutti gli analisti finanziari
318240	320540	che su questo si stanno cimentando,
320540	323640	che invece di quello aumento,
323760	326040	di quello sviluppo che aveva portato
326040	329700	quando eravamo stati incaricati di governare il Paese
329700	332900	ad oltre il 3% del prodotto interno lordo
332900	335440	di quello che tutti insieme, con la nostra fatica,
335680	337440	riusciamo a produrre in un anno,
338000	340780	credo che ormai non si possa prevedere
340780	343340	un grande aumento dello sviluppo
343340	347760	e che saremo sotto l'1% per quanto riguarda
347760	350540	il 1996. Questo significherà
350540	352860	purtroppo difficoltà enormi
352860	354660	per quel che attiene la disoccupazione,
355000	358440	che è il male grande di cui tutta l'Italia soffre
358440	361500	ma massimamente soffrono alcune zone
361500	365820	anche qui in Sicilia. Quindi io credo
365820	368760	che le prospettive siano prospettive non rosee,
369940	372340	speriamo che le cose si mettano meglio
372340	373820	di quanto non si annunciano ora,
373820	376520	ma credo che noi, a seguito di quel che è successo
376520	379780	alle elezioni, andremo incontro a un periodo
379780	382700	difficile per quanto riguarda il lavoro, per quanto riguarda
382700	386380	l'economia. E questo appare ancora più difficile
386380	389000	se pensiamo a come si è presentato
389000	391780	il nuovo governo. Io personalmente in Parlamento
391780	395140	ho rivolto al Presidente del Consiglio tutta una sede
395140	397800	di domande che non hanno avuto
397800	400820	praticamente risposta. Gli ho chiesto come intendesse
401940	405160	affrontare il buco finanziario nelle casse dello Stato
405160	407420	che si è creato col precedente governo Dini
407420	410060	sostenuto dalle sinistre, anche qui
410060	413440	la risposta non c'è stata e non c'è, speriamo
413440	416040	che non si voglia ancora una volta portare via soldi
416040	418960	dalle tasche delle persone, delle famiglie, delle imprese.
419260	421820	Gli ho chiesto come pensava di fare la manovra finanziaria
422680	425580	per l'anno prossimo, anche qui
425580	429000	nessuna risposta, è una manovra finanziaria pesante,
429000	432000	speriamo che non si trasformi ancora in nuove tasse,
432200	434200	in nuove imposte per tutti noi.
434880	437600	Gli ho chiesto anche quale fosse l'idea del governo
437600	441660	su quella rivoluzione morale,
441960	444920	economica, politica che si deve fare in Italia
444920	447680	per cambiare l'attuale situazione,
447760	450020	per non avviarci al traccollo finanziario
450020	453960	e anche qui la risposta non c'è stata. Voi sapete bene
453960	456320	credo che se siete qui tutti voi
456320	458440	non siete perché credete in Forza Italia,
458820	462660	perché l'avete votata, perché conoscete quindi il programma
462660	465220	che Forza Italia proponeva per risolvere i problemi
465220	468220	del Paese, bene, c'è stata
468220	471360	una ricetta molto precisa che era quella
471360	474440	dello sviluppo economico, del sostegno all'economia
474440	476960	attraverso l'uso del fisco con una riduzione
476960	480380	progressiva delle imposte per far nascere nuove imprese,
480560	483320	per far crescere le imprese che ci sono,
483320	485800	per creare nuovi posti di lavoro, ecco,
486000	488600	noi abbiamo domandato al Presidente del Consiglio
488600	491740	se intendesse seguire questa direzione di marcia,
491840	494240	non abbiamo avuto risposta al riguardo
494240	497140	e non ci è stata data neppure risposta
497140	501000	quando abbiamo chiesto in che modo
501000	503740	si sarebbe comportato il governo
503740	507500	per quanto riguarda le riforme al nostro Paese.
507720	510560	Ora, le riforme dette così
510560	512680	sembrano non essere importanti, invece
512680	515480	sono importantissime e sono la premessa
515480	519220	indispensabile per poter davvero cambiare il Paese,
519240	521700	riorganizzando tutto quello che
521700	524520	attiene alla presenza pubblica,
525560	527720	ribaltando il modo di fare dello Stato
527720	530860	nel confronto dei cittadini e tutto questo
530860	534040	io credo che si possa fare, si possa ottenere
534560	537260	soltanto se si darà più spazio ai cittadini
537260	539580	facendoli partecipare direttamente
539580	542540	alla vita politica, concedendo cioè ai cittadini
542540	545240	attraverso una riforma della Costituzione
545240	549140	di eleggere direttamente il capo dello Stato
549140	551180	che avesse anche poteri di governo
551180	555000	in modo finalmente di avere un Presidente del Consiglio,
555020	559020	un governo capace di durare in carica 5 anni.
559500	562160	Io sono stato a Palazzo Chigi
562160	564260	per 8 mesi, credo,
565340	568640	nella storia della Repubblica in 50 anni
568640	571260	abbiamo avuto 55 governi,
572520	574080	ciascun governo è durato in media
574080	577660	meno di 9 mesi, in 9 mesi anche il più bravo,
577800	579700	anche il più capace, anche il più esperto,
579840	582740	non può fare nulla, non può trasformare
582740	586260	nessun progetto, anche il più giusto dei progetti
586260	589280	in una cosa vera, in una realtà concreta.
589460	592260	Quindi la prima cosa di cui il nostro Paese ha bisogno
592260	595440	è di avere una forma di governo
595440	598660	che possa consentire al Paese
598660	601420	di avere un governo che duri in carica
601420	604880	il tempo di una legislatura, 5 anni.
605260	607400	E guardate, non c'è un altro sistema da quello
607400	610260	che noi abbiamo proposto, l'elezione diretta
610260	613240	del capo dello Stato, da ottenersi attraverso
613240	615840	un'assemblea che coinvolga tutti i cittadini
615840	619040	con nuove elezioni secondo il sistema proporzionale
619040	621380	con un dibattito grande di fronte ai cittadini
621380	624820	dicendo a tutti come intendiamo rifare
624820	627180	l'architettura istituzionale dello Stato,
627580	630220	con il conferimento al capo della Repubblica,
630280	632560	che è anche presidente del Consiglio,
632760	636260	di poteri forti per governare in maniera tale
636260	640020	che abbia forza, autorevolezza, nervo,
640140	642500	che gli derivi questa forza, autorevolezza
642500	646400	dall'essere stato eletto direttamente dai cittadini
646400	650280	e dare ai cittadini anche la possibilità
650280	652680	di incidere di più sulle comunità locali,
652820	655800	i comuni, le regioni, in modo da poter
655800	659040	controllare realmente da vicino come vengono
659040	661280	amministrati i loro soldi, come vengono spesi
661280	664300	i loro soldi, attribuendo alle comunità locali
664300	666760	tutta una serie di poteri, il potere impositivo,
666820	669540	quello di fare imposte, il potere finanziario,
669680	671800	il potere amministrativo, in maniera tale
671800	674840	che veramente si applichi un grande principio
674840	677800	di libertà con cui tutti dobbiamo imparare
677800	680760	a fare i conti e a ragionare, che è il principio
680760	684280	di sussidiarietà, che sembra una parola difficile,
684900	686980	non è forse facile da capire, ma invece
686980	689720	è un principio semplicissimo, è un principio
689720	693100	secondo il quale si articolano
693100	696240	e si organizzano tutti gli Stati veramente democratici.
696380	698180	Ed è un principio che dice la seguente cosa,
698180	703620	lo Stato deve fare soltanto ciò
703620	705360	che i cittadini come privati
705360	708200	non possono fare o che non possono fare
708200	710180	le comunità locali.
710900	713360	Se una cosa la può fare il comune,
713480	715660	non deve farla lo Stato.
715900	717780	Se una cosa la può fare il comune,
717940	719800	non deve farlo la provincia.
720140	722480	Se una cosa la può fare la provincia,
722480	724240	non deve farla la regione.
724680	728380	L'istituzione superiore deve intervenire
728380	730820	soltanto quando l'istituzione inferiore
730820	733800	più vicina ai cittadini non è in grado
733800	735620	di fare bene quella determinata cosa.
736000	739280	Questa è la vera democrazia, questo è il futuro
739280	741820	della democrazia, è un principio adottato
741820	744780	da tutte le democrazie europee, è un principio
744780	747200	adottato nella costruzione dell'Europa,
747200	749460	è un principio che deve essere adottato
749460	751060	anche nel nostro Paese.
751340	755560	Queste riforme, che sono le madri
755560	757580	di tutte le altre riforme,
757700	759360	quelle che devono andare nella direzione
759360	760760	dell'organizzazione dello Stato,
761060	764140	il rifacimento di tutti i pubblici uffici
764140	766000	dove adesso c'è l'immobilismo,
766200	767700	dove adesso c'è l'incompetenza,
767700	769300	dove adesso c'è l'arroganza,
769600	771420	dove adesso c'è l'inefficienza,
771720	774380	devono essere trasformati introducendo
774380	776260	in questi uffici che risentono ancora
776260	780100	di una formula di Stato che è stata introdotta tantissimi anni fa,
780240	783280	addirittura la forma e lo schema napoleonico di Stato,
783440	785900	devono introdurre quelli che sono i principi
785900	788840	della pratica e della cultura che presiede
788840	790800	a tutte le aziende del mondo.
790800	792880	Ci sono i principi della responsabilità,
793400	796280	dell'efficienza, della rapidità delle decisioni,
796460	799960	del merito, della pena se qualcuno sbaglia,
800120	802400	se qualcuno ha delle responsabilità gravi.
802540	806140	Quindi una grande rivoluzione per tutto ciò
806140	809320	che attiene alla nostra amministrazione dello Stato,
809600	811720	delle Regioni, delle Province, dei Comuni,
811900	814800	una grande rivoluzione che non possiamo rimandare
814800	818000	se non vogliamo perdere la competizione con l'Europa,
818000	821000	siamo già troppo in ritardo, siamo già troppo indietro
821520	823580	rispetto agli altri Stati d'Europa,
823960	826180	è qualche cosa in cui noi crediamo fermamente.
826460	829720	Per fare questo cambiamento abbiamo chiesto nei giorni scorsi
829720	832420	la istituzione di una assemblea costituente,
832420	835080	come ho appena ricordato, con la partecipazione
835080	838120	di tutti i cittadini, il Governo su questo
838120	841480	non ha dato risposte. L'impressione è
842000	845060	che non si voglia cambiare, che si cerchino alte strade,
845060	847040	anche quelle di un lavoro parlamentare,
847120	850140	non so se avete sentito mai parlare delle commissioni bicamerali,
850400	852760	significa commissioni fatte da deputati della Camera,
853160	855660	da senatori, che si mettono insieme, discutono,
855960	860140	l'hanno fatto negli anni precedenti, non sono mai arrivati
860140	861400	a nessuna conclusione.
861900	864420	E quindi noi siamo preoccupati,
864640	868420	crediamo che questo Governo voglia galleggiare sui problemi,
868560	872060	crediamo che, come tutti i Governi di estrazione marzista,
872340	875500	nella storia si sono dimostrati
875500	878740	pessimi governanti, pessimi gestori dell'economia,
878780	880420	basta guardare a cosa è successo,
880520	884280	la miseria di tutti i Paesi che hanno avuto
884280	887560	dei Governi di tradizione, di dotrina marzista,
888000	890560	sono certamente invece grandissimi
890560	892060	gestori del potere.
892620	896160	E qui è una preoccupazione in più, quindi
896160	899340	per quel che ci appare oggi, una situazione di Governo
899400	902820	che non affronta con decisione
902820	905520	i problemi, una
905520	908580	compagine di Governo, tra l'altro, divisa,
908920	911120	sostenuta da una maggioranza che praticamente non c'è,
911200	913880	con rifondazione comunista che professa
913880	916620	dotrine totalmente opposte a quelle dell'Ulivo,
916940	919780	ricordatevi che nella competizione elettorale hanno presentato
919780	923600	non un programma come le forze del Polo della Libertà,
923720	926040	ma hanno presentato tre programmi, uno dell'Ulivo,
926040	929040	uno di rinnovamento italiano di Dini, l'altro di rifondazione comunista,
929880	932140	ricordatevi anche che per quanto riguarda la riforma
932140	935040	dello Stato, il Partito Popolare vuole il cancellierato tedesco,
935760	938040	rifondazione comunista vuole mantenere la proporzionale
938680	940920	e ciò che succede oggi, e soltanto l'Ulivo
940920	944440	timidamente ha accennato, per poi rimangiarseli subito,
944740	947040	delle soluzioni nella direzione
947040	950040	di un cambiamento vero dell'architettura costituzionale,
951320	953300	così come noi avevamo indicato.
953300	956300	Quindi un governo, una maggioranza,
957340	960940	divisa, ma unita sulla gestione del potere,
961240	964060	e intanto tutta una serie di segnali
964060	966840	molto preoccupanti. Credo che tutti voi
966840	968300	siate stati di fronte alle televisioni
969380	970960	da dopo le elezioni ad oggi,
971560	973840	avete visto il conformismo dilagante,
974300	978460	le apparizioni agogo di tutti i leader di questo governo,
979080	980600	avrete letto i giornali,
980600	982740	avrete visto su questi giornali
982740	986660	come dilagano gli applausi, i consensi,
986780	989180	gli encomi alla nuova classe dirigente,
989520	991700	sembra che abbiano già fatto, chissà che cosa,
991780	994000	non hanno ancora fatto alcunché.
994380	996180	Nulla è stato fatto sinora,
996960	1000600	e le lovi si sono sprecate.
1000900	1004600	Questo è qualcosa che obiettivamente ci preoccupa,
1005720	1007520	è qualcosa che ci preoccupa
1007520	1009820	così come ci sono altri segnali
1009820	1011400	che cominciano a preoccupare.
1011640	1013960	I plotoni organizzati di fischiatori
1013960	1017300	quando passa questo o quel leader di Forza Italia
1017300	1020180	o del Polo, gli applausi smodati
1020180	1022700	quando passa quello o quell'altro
1022700	1024540	dei leader del nuovo governo,
1025020	1027240	che non sono nemmeno così tanto conosciuti dalla gente,
1028580	1030940	quindi una serie di claqueurs,
1030940	1034440	di persone organizzate per fischiare
1034440	1035760	o per applaudire.
1035960	1039820	E poi non parliamo delle persecuzioni giudiziarie
1039820	1042940	che si indirizzano nei confronti dei responsabili dell'opposizione,
1047960	1051140	delle persecuzioni che non hanno cittadinanza
1051140	1053380	in una democrazia, in uno stato di diritto
1053380	1056580	dove ad ogni cittadino deve essere consentito
1056580	1059100	di non essere inquisito o giudicato
1059100	1061300	da chi si denuncia e si professa
1061300	1064180	come un suo nemico ideologico e politico.
1064620	1068100	Credo che questo sia il minimo di una democrazia.
1070420	1073460	Per quello che mi concerne, state sereni,
1073660	1077120	perché io non ho nulla, nulla, nulla
1077120	1078860	da riproverarmi sul piano morale,
1079220	1080780	l'ho dichiarato da tutte le parti,
1080820	1084880	voglio riconfermarlo ancora a chi, tra coloro che mi stanno vicini,
1084880	1087960	teme per me, non c'è niente
1087960	1089720	che possa uscire da queste inchieste,
1089780	1092140	nonostante abbiano guardato milioni di carte,
1092640	1094920	non so quanti magistrati siano impegnati,
1095180	1098080	non so quanti centinaia di persone di Forza dell'Ordine,
1098360	1100640	praticamente un esercito schiarato tutto
1100640	1102600	contro un cittadino e contro un gruppo,
1102660	1106080	non c'è niente che sia moralmente condannabile
1106080	1108240	che mi possa toccare da vicino.
1108240	1109580	Statene certo.
1119080	1123240	E poi, in questo panorama preoccupante,
1124940	1128480	tra questi avvisi che ci devono far riflettere,
1128580	1132260	far pensare, che ci devono far sentire uniti
1132260	1135180	per un'opposizione che non può essere soltanto in Parlamento,
1135480	1137780	ma che deve essere in tutto il Paese,
1137780	1140780	anche un tema profondo di preoccupazione,
1142560	1145340	una tensione forte e pericolosa
1145340	1149160	costituita da quella voglia di secessione
1149160	1151820	appalesata da Bossi e dalla Lega.
1156080	1159780	Ecco, io credo che sia un problema
1159780	1162040	che si deve affrontare seriamente,
1162480	1164220	credo che non sia un problema da poco,
1164220	1168580	credo che le parole possano andare bene di là
1168580	1170900	dei discorsi e soltanto di quelli,
1171180	1173800	credo che certe situazioni di cui abbiamo avuto
1173800	1176220	esempi vicini molto negativi,
1177020	1178780	anzi direi assolutamente tragici,
1178960	1182220	devono far riflettere tutti a non prendere sotto gamba
1182780	1186160	certe dichiarazioni, a non prendere sotto gamba
1186160	1187580	certe volontà.
1187780	1191360	L'Italia non sarebbe l'Italia
1191360	1193180	se fosse divisa,
1193560	1197280	io so bene quanto anche in Sicilia
1197280	1199360	ha contato la voglia di autonomia,
1200260	1203040	a volte anche la voglia belleitaria forse,
1203260	1205960	di un certo separatismo e poi il buonsenso
1205960	1209700	ha prevalso, la Sicilia è rimasta unita all'Italia,
1210080	1213380	l'Italia non sarebbe una grande nazione europea
1213380	1215220	se fosse priva della Sicilia.
1222860	1226520	E ve lo dice un cittadino convinto del nord,
1227360	1228360	un cittadino di Milano
1229280	1231360	che conosce in Milano tanti siciliani
1232200	1234440	che hanno reso grande Milano
1234440	1237480	e onorato il nome della Sicilia con la loro sapienza,
1238040	1239680	con la loro voglia di lavorare,
1239980	1243600	con il loro talento, con la loro creatività,
1244720	1246860	ve lo dice un italiano comune
1246860	1249560	che ha per la Sicilia lo stesso amore
1249560	1250900	di tutti gli altri italiani.
1251100	1253800	Noi conosciamo della Sicilia tante cose,
1253900	1255220	non solo perché le abbiamo studiate,
1255880	1258800	perché abbiamo visto, guardato da vicino
1258800	1261480	tutte le opere dell'ingegno, della poesia,
1261720	1264600	di questa terra libera in cui si vedono
1264600	1267060	in tutti i modi, si percepiscono
1267060	1270240	dovunque si giri lo sguardo,
1270780	1272200	quello che è stato il punto di incontro
1272200	1275600	di tutte le culture del Mediterraneo.
1275740	1278200	E qui anche io devo dire che sono lietissimo
1279040	1281660	per questa occasione delle elezioni regionali
1281660	1284380	di avere deciso, dopo il grande risultato
1284380	1286460	che abbiamo avuto come Forza Italia dalla Sicilia,
1286740	1290200	quasi il 33% dei voti.
1293100	1296400	Ecco io, dicendo un grazie
1296400	1298340	che viene dal profondo del cuore
1298340	1300240	a tutti i siciliani che ci hanno votato,
1300240	1302100	mi sono preso l'impegno,
1302200	1305720	veramente col cuore contento di venire in Sicilia,
1305760	1308640	di passare qui molti giorni per questa campagna elettorale
1308640	1311360	della Regione, di andare in tutte le province
1311360	1314880	della Sicilia a dire il mio grazie
1314880	1318080	e a prospettare un impegno di Forza Italia
1318080	1320300	per il futuro della Regione.
1321500	1323740	Ora voi so che avete dentro di voi
1323740	1326960	un grande orgoglio per quello che è stato il vostro passato,
1326960	1328420	per quello che è il vostro presente
1328420	1331180	e una grande speranza per quello che sarà
1331180	1332820	e deve essere il vostro futuro.
1333520	1336580	Ecco, io credo che noi cercheremo
1336580	1339720	di interpretare le vostre speranze con i candidati
1339720	1342700	che abbiamo scelto e che vi presentiamo per Forza Italia.
1343540	1347620	E' in gioco il futuro della vostra Regione,
1348180	1350880	una Regione che ha conosciuto
1350880	1353360	una politica negativa
1353360	1356060	che è stata molto spesso abbandonata
1356060	1359380	a una gestione che forse
1359380	1361920	non poteva essere più negativa ad un certo momento,
1363080	1366140	con la testa politica al centro dell'Italia
1366140	1369480	e i prolungamenti di potere qui nell'isola
1369480	1371720	che certamente non hanno fatto ciò che l'isola
1371720	1372980	meritava si facesse.
1373500	1376160	Una politica dell'assistenzialismo che voi conoscete,
1376240	1378700	delle grandi cattedrali nel deserto,
1378700	1381640	della distruzione di certe bellezze naturali
1381640	1384900	e oggi con il cambiamento
1384900	1388380	che pur in un momento di transizione che ancora non è compiuto
1388380	1389800	si è attuato,
1390140	1393680	la necessità veramente di trovare una strada nuova.
1393800	1396680	Cosa proponiamo noi di Forza Italia?
1397220	1401780	Noi proponiamo una nuova classe dirigente.
1402040	1404980	Noi abbiamo cercato di lasciare fuori
1404980	1407520	dall'elenco dei nostri candidati
1407520	1409800	i professionisti della politica
1409800	1412300	che in qualche modo si fossero segnalati
1412300	1415520	per essere dei politici politicanti,
1415820	1418660	di coloro cioè che non facevano politica
1418660	1421300	per spirito di servizio, ma che facevano politica
1421300	1424920	per inseguire interessi diversi dalla politica vera,
1425000	1426260	dal servizio alla gente.
1426540	1428340	Speriamo di esserci riusciti.
1428540	1431980	Abbiamo scelto tra professori di università,
1431980	1433500	professionisti,
1434500	1436140	imprenditori, manager
1436140	1440480	e noi riteniamo che i nostri candidati
1440480	1443340	e quelli che voi sceglierete con le vostre preferenze
1443340	1446160	possano davvero portare un cambiamento,
1446180	1448540	un cambiamento profondo nel modo di essere,
1448620	1453980	nel modo di pensare e di fare dell'organismo regionale.
1454280	1457040	Credo che questo sia il traguardo
1457040	1458980	a cui bisogna mirare
1459820	1462260	portando anche nell'organismo della regione
1462260	1464000	quel cambiamento a cui accennavo prima,
1464300	1468060	quella riorganizzazione profonda della regione,
1468160	1470380	del modo di lavorare di tutti coloro
1470380	1472900	che fanno parte dell'organo regione,
1473000	1475260	affinché non debba essere un organismo in più
1475260	1478580	che crea magari problemi in più ai cittadini,
1478700	1480740	ma che invece i problemi dei cittadini
1480740	1482780	è lì per risolverli.
1482780	1486120	Io credo che noi saremo capaci,
1486120	1488480	se avremo voti sufficienti,
1489300	1492660	noi saremo capaci di introdurre questo cambiamento.
1493440	1494580	A questo proposito,
1494820	1497780	noi guardando allo statuto della regione,
1499140	1501020	abbiamo anche inteso avanzare
1501020	1503240	una proposta di cambiamento dello statuto.
1503700	1506820	Qui sarà forse necessario trovare l'accordo di altre forze.
1506960	1509560	Io spero di no, spero che saremo premiati
1509560	1510940	per avere una forza sufficiente
1510940	1513640	per poter dettare noi la direzione di marcia.
1513980	1517520	Ma certamente nella regione bisogna anche qui applicare
1517520	1519380	quei principi che ho ricordato prima
1519380	1521760	di partecipazione più diretta dei cittadini.
1521900	1523540	Credo che un cambiamento dello statuto
1523540	1526000	dovrebbe prevedere la elezione diretta
1526000	1529920	da parte dei cittadini del presidente della regione.
1530140	1532840	Una elezione diretta da attuarsi anche
1532840	1535860	con il cambiamento del sistema elettorale,
1536200	1538840	con l'introduzione anche qui di quel sistema maggioritario
1539880	1542980	che consente di avere governi stabili,
1543100	1545360	governi duraturi, che sono necessari
1545360	1547400	così come al centro del Paese,
1547480	1550040	anche in tutte le sue regioni.
1550200	1552680	E qui ci sono anche tante proposte
1552680	1554300	che probabilmente voi conoscerete,
1554360	1559340	la riduzione dei parlamentari da 90 a 60,
1559340	1563500	la possibilità di scioglimento anticipato del Parlamento
1563500	1566940	e via via tutta una serie di innovazioni
