start	end	text
1566940	1570360	che sono necessarie per poter dare un nuovo impulso
1570360	1573120	per poter far decollare l'economia
1573120	1574340	e la gestione della regione.
1575180	1578680	E qui nel nostro programma voi credo
1578680	1580340	abbiate trovato già tante risposte
1581020	1583460	a tante domande di buon senso
1583460	1584700	che sorgono da tutti voi.
1584700	1586920	La necessità di chiamare lo Stato
1586920	1588680	alle sue responsabilità.
1589000	1592700	Lo Stato che deve tornare a fare lo Stato.
1592780	1596540	Affinché si possa instaurare un periodo di sviluppo
1596540	1600340	non ci può più essere l'assenza della legalità.
1600500	1602460	Lo Stato deve garantire innanzitutto
1602460	1606060	e prima di tutto che il fenomeno della criminalità
1606060	1608660	organizzata sparisca, che il territorio
1608660	1611700	e l'economia ritornino totalmente liberi.
1613100	1615400	Anche con azioni di emergenza,
1615720	1618780	anche con interventi straordinari e decisivi
1618780	1622020	che possano finalmente cancellare
1622020	1625140	una manifestazione negativa di uno quasi Stato
1625140	1627700	contro lo Stato, che non incentiva certamente
1628680	1631920	i capitali nazionali o i capitali stranieri
1631920	1633700	a insediarsi sul territorio.
1633720	1636560	Non incertiva certamente nemmeno chi
1636560	1639040	tra i siciliani abbia voglia di iniziare
1639040	1641340	una nuova attività imprenditoriale a farlo veramente.
1642000	1644680	Perché la prima cosa è avere garantita la libertà di mercato,
1644960	1648460	la libertà di impresa, la propria proprietà sulle cose,
1648960	1652560	la possibilità di utilizzare i propri utili
1652560	1654840	al fine di sviluppare la propria impresa
1654840	1658000	senza pagare nulla a nessuno in nessun modo.
1658820	1660580	Io credo che questo sia un fatto
1660580	1663040	che viene prima di tutto
1663040	1666240	e lo Stato deve intensificare
1666240	1668880	la sua presenza, la sua azione,
1669020	1671260	che già negli ultimi anni ha avuto
1671260	1674240	e ha conseguito dei successi rilevanti.
1674400	1676720	La seconda cosa a cui deve essere chiamata lo Stato
1676720	1680900	è colmare quella distanza tra le attrezzature,
1681080	1684240	tra le infrastrutture della regione
1684820	1686420	rispetto al resto dell'Italia.
1686820	1689900	Tutti gli studi che conosciamo ci dicono
1689900	1693560	che in Sicilia esistono aeroporti,
1693560	1696480	ferrovie, porti, strade
1696480	1699800	che sono al 70%
1699800	1703820	di quello che esiste in media nelle altre regioni italiane.
1704060	1705720	È una distanza, un gap
1705720	1707860	che non può essere tollerato,
1708240	1710580	che condiziona moltissimo lo sviluppo
1713200	1714820	di tutte le attività,
1714820	1716580	delle attività imprenditoriali,
1716720	1719880	delle attività nell'agricoltura, delle attività vivaistiche.
1719880	1722180	Se condiziona lo sviluppo
1722180	1725240	di tutta l'intrapresa siciliana,
1726200	1728100	questo è qualcosa che non può essere tollerato.
1728320	1730520	Lo Stato qui si deve impegnare
1730520	1734240	e magari attivandosi per avere la partecipazione
1734240	1737540	anche dei privati, vedere di fare un grande piano
1737540	1740800	insieme alla regione Sicilia affinché in pochi anni
1740800	1743200	possano essere completate tutte le opere
1743200	1744800	che sono già state iniziate,
1744800	1749300	migliorate le opere esistenti su cui si può intervenire
1750400	1751600	e iniziate
1751600	1754160	e condotte a termine le altre opere
1754160	1757140	che tutti voi conoscete, che sono esplicitate nel nostro piano
1757140	1759740	e che sono ritenuti da tutti come delle opere
1759740	1761920	assolutamente indispensabili.
1764900	1768380	Grazie a una nuova classe dirigente
1768380	1771960	e tra l'altro qui vi ricordo anche un'altra richiesta
1771960	1775040	che noi abbiamo inserito nella nostra proposta di nuovo statuto
1775040	1778760	la possibilità per il Presidente eletto dai cittadini
1778760	1782920	dove non reperisse, dentro la compagine consigliare
1782920	1785600	gli uomini adatti a sostenere
1785600	1788020	i singoli settori, la possibilità
1788020	1790860	anche di rivolgersi a persone non elette
1790860	1793540	a professionisti validi, a manager
1793540	1796300	che portassero nella Giunta
1796300	1799180	la loro specifica competenza per risolvere
1799180	1802400	e managerialmente i problemi di quello specifico assessorato
1802400	1804280	di quello specifico settore.
1804700	1809340	Bene, e infine naturalmente con questa nuova classe dirigente
1809340	1812120	fare tutto ciò che non è stato fatto
1812120	1813500	e che si può fare
1815300	1817300	per incentivare la nascita
1817300	1819160	di una imprenditorialità diffusa.
1819460	1822480	Non i grandi interventi, non le grandi aziende
1822480	1825160	in nessuna parte ormai d'Europa
1825160	1826660	si ritiene che le grandi aziende
1826660	1829220	con l'incremento qualitativo della tecnologia
1829220	1832440	possano portare alla formazione di nuovi posti di lavoro
1832440	1836460	si ritiene invece che siano le piccole, piccolissime aziende
1836460	1841460	che possano veramente portare nuova occupazione in più
1841460	1843740	e tutto questo si può fare
1843740	1846500	si può fare incrementando
1846500	1848980	e sfruttando e utilizzando
1848980	1852280	quel grande capitale che è proprio della vostra regione
1852280	1854160	un capitale straordinario
1854160	1857580	che ha poche possibilità di paragone con quello di altre regioni
1857580	1861020	pensate allo splendore del paesaggio
1861020	1864200	pensate al clima eccezionale
1864200	1867540	pensate al patrimonio archeologico
1867540	1870460	artistico di cui la Sicilia
1870460	1874400	è ricca e pensate infine al grande capitale umano
1874400	1876280	dei tanti giovani, delle tante intelligenze
1876880	1880160	dei tanti talenti che escono dalle vostre università
1882820	1885200	ho parlato qualche giorno fa
1886280	1888820	con un tecnico americano che mi ha presentato
1888820	1892520	uno studio sul Mediterraneo
1892520	1895200	bene in tutta l'area del Mediterraneo
1895200	1898260	dove tutti ci auguriamo che possa finalmente giungere
1898260	1901280	a composizione il conflitto e il contrasto
1902760	1904280	tra il mondo arabo
1904840	1907100	e il mondo ebraico
1907100	1910280	dove questo si potesse
1911800	1914060	completare e realizzare
1914060	1917460	beh allora il Mediterraneo potrebbe conoscere
1917460	1920520	nei 15 anni avvenire uno sviluppo
1920520	1923780	di intensità maggiore a quello di certe zone dell'Asia
1923780	1925680	che hanno conosciuto negli ultimi anni
1925680	1929640	uno sviluppo che mai si era visto in nessuna ragione al mondo prima di ora
1930760	1932500	chi mi ha parlato
1932500	1934740	ha portato un'immagine, ha detto
1935280	1937640	la Sicilia è in grado
1937640	1940500	se veramente potrà sfruttare
1940500	1943340	la sua posizione centrale nel Mediterraneo
1943340	1946420	se veramente si compisse questa pace
1946420	1949900	se come sarà l'Unione Europea
1949900	1952640	dovesse aprirsi alla partecipazione dei paesi del Mediterraneo
1953540	1956040	così come si è aperta
1956040	1958800	alla partecipazione nell'Unione Europea
1958800	1959820	dei paesi dell'est
1959820	1963340	se questo avvenisse ci sono forti probabilità
1963340	1965160	che questo avvenga
1965160	1967580	la Sicilia potrebbe trasformarsi
1967580	1969980	dalla Sicilia dove nulla cambia
1969980	1972100	dalla Sicilia del gatto pardo
1972100	1977180	in una tigre che va con i suoi artigli ad afferrare lo sviluppo
1977180	1980880	l'immagine non è straordinaria, non è mia
1980880	1984720	il ricercatore si chiama
1985720	1986520	Pellanda
1986520	1988920	è un ricercatore di un'università americana
1988920	1991340	mi ha detto ieri che va in Cina
1991340	1994440	a spiegare quale sarà lo sviluppo della Cina nei prossimi 20 anni
1994440	1997300	bene, pigliamolo ottimisticamente per buono
1997920	1999560	e vediamo che cosa lui dice
1999560	2004300	c'è nella Sicilia una possibilità enorme
2004300	2006380	di sviluppo per esempio del turismo
2006380	2008880	la Sicilia non deve essere come qualcuno ha detto
2008880	2011940	la Florida dell'Europa ma può essere
2011940	2015420	a buon diritto la California dell'Europa
2015420	2018420	una regione che può incrementare
2019140	2022200	le presenze turistiche ma non soltanto del turismo
2022200	2024780	che viene dall'Europa nelle stagioni invernali
2024780	2027260	in chi cerca il sole, il turismo colto
2027260	2030620	il turismo di chi cerca non soltanto la bellezza
2030620	2033780	dei luoghi ma di chi cerca di potersi abbeverare
2033780	2036180	ai tesori di cultura e di arte
2036180	2039400	che la Sicilia può offrire e intorno al turismo
2039400	2042720	ecco che può migliorarsi
2042720	2045720	può rinforzarsi la struttura alberghiera
2046500	2048800	un conto che io non conoscevo prima
2048800	2051620	di impegnarmi nell'attività di chi
2051620	2053960	amministra la cosa pubblica, un letto
2053960	2057340	un posto letto in un albergo significa due posti
2057340	2061220	di lavoro in più diretti e due posti nell'indotto
2061220	2063920	quindi un posto letto che riesce a funzionare
2063920	2066720	sono 4 persone in più che trovano lavoro
2066720	2069600	e attraverso un'organizzazione
2069600	2072120	di circuiti alberghieri
2072120	2075580	attraverso il lavoro sui grandi sindacati tedeschi
2075580	2078920	sui grandi sindacati dei paesi della Svezia
2078920	2080860	della Norvegia, dell'Olanda
2080860	2083840	c'è la possibilità di avere eserciti di persone
2083840	2087280	una volta che qui non ci fossero dubbi
2087280	2090740	non ci fossero paure ma ci fosse soltanto lo splendore del sole
2090740	2093700	la magnificenza di ciò che la Sicilia può offrire
2093700	2096960	come beni patrimoniali, come beni culturali
2096960	2100520	bene, sarebbe facile incrementare il turismo
2100520	2103360	avere anche un turismo che guarda
2103360	2105960	alle offerte di cultura, alle meravigliose
2106920	2109460	possibilità di rappresentazioni teatrali
2109460	2112120	a tutta quella serie di situazioni che voi
2112120	2114380	ben conoscete e di cui andate orgogliosi
2114960	2118060	io credo che ci siano tante possibilità per il futuro
2118060	2120800	tra l'altro tutto sta cambiando in maniera
2120800	2124000	assolutamente veloce nel mondo dell'economia
2124000	2127100	c'è una globalizzazione, cioè tutti i mercati
2127100	2129560	diventano mercati mondiali
2129560	2132960	mi sto interessando in questi giorni delle possibilità future
2132960	2135860	di un sistema di comunicazione che è internet
2135860	2139820	credo che voi lo conosciate, pensate che fra qualche anno
2139820	2142560	nel 2000 si calcola che saranno
2142560	2145000	collegati a internet più di
2145700	2148440	300 milioni di soggetti nel mondo
2148440	2150800	300 milioni di soggetti
2150800	2153800	significa che uno in qualunque zona del mondo sia
2154380	2156600	può attraverso questo sistema
2156600	2159900	in pochissimi minuti andare a prendere informazioni
2159900	2162360	in tutto il mondo, in tutti i settori
2162360	2164980	nel settore dell'industria, nel settore del commercio naturalmente
2164980	2167200	nel settore degli studi e della cultura
2167200	2170720	e ordinare qualunque cosa o vendere
2170720	2173380	qualunque cosa egli produca in tutto il mondo
2173380	2176200	quindi vengono superati in una volta sola
2176200	2179420	anche tutti quelli che sono i difficili
2179420	2182200	percorsi commerciali, le difficoltà commerciali
2182740	2185660	attraverso un collegamento globale
2185660	2188180	mondiale che è alle porte di cui
2188180	2191200	nessuno di noi riesce oggi a individuare
2191720	2194260	le regole e i confini e le possibilità
2194260	2196920	credo che anche qui ci sia molto da fare
2196920	2200480	ci sono nuove aziende nel settore quindi dell'informatica
2200480	2203500	nel settore della comunicazione
2203500	2206500	gli anni 2000 sono già sicuramente
2207240	2209340	la civiltà della comunicazione
2209340	2212640	ecco quindi che si aprono degli orizzonti
2212640	2215520	sconfinati a chi abbia voglia di fare
2215520	2218260	ove chi sarà al governo
2219120	2222520	mantenga le promesse, si è in grado naturalmente
2222520	2224940	per il numero di voti su cui potrà contare
2224940	2227140	di mantenere le sue promesse
2227140	2229720	andando a diffondere quell'imprenditorialità
2229720	2232720	a sostenere chi abbia voglia di cimentarsi
2233840	2235900	in un rischio di impresa
2235900	2238940	a dargli un aiuto iniziale
2238940	2241580	e qui anche voi sapete che noi proponiamo
2241580	2244040	nel nostro programma quelle zone franche
2244040	2247220	di libertà totale per il lavoro e per l'impresa
2247220	2251040	in cui chi inizia una nuova attività
2251800	2253960	imprenditoriale, abbia la possibilità
2253960	2256820	di non pagare nessuna imposta, nessun contributo
2256820	2260140	né fiscale, né assicurativo, né previdenziale
2260140	2261380	per i primi 5 anni
2261380	2263680	è una misura che noi abbiamo l'orgoglio di dire
2263680	2265980	è stata da noi per la prima volta avanzata
2265980	2268080	nel programma nostro di 2 anni fa
2268080	2272120	è stata presa e fatta propria dal governo francese
2272120	2275660	che ha ottenuto anche l'approvazione da parte delle autorità europee
2275660	2278720	in Francia ci sono 20 zone franche
2278720	2280860	che stanno per essere varate
2280860	2283960	credo che la regione Sicilia possa pretendere
2283960	2286900	di farlo anche qui, individuando le zone
2286900	2288960	dove c'è maggiore disoccupazione
2288960	2291520	dove c'è soprattutto maggiore disoccupazione giovanile
2291520	2294100	per poter dire a chi ha voglia di intraprendere
2294100	2297920	venite qui, vi garantiamo condizioni che altrove non esistono
2297920	2301380	venite qui a lavorare con noi insieme a noi
2301380	2304860	per poter iniziare a far decollare la nostra regione
2305560	2308120	in un futuro che deve assolutamente essere
2308120	2311120	un futuro in linea con le grandi potenzialità
2311940	2317840	che qui ci sono, che voi avete, che tutti vi riconoscono
2327740	2330580	ho avuto modo, prima di venire qui
2330580	2335320	di scambiare delle parole con Giovanni Mauro
2335320	2337620	il presidente della vostra provincia
2344440	2348540	mi sembra che rappresenti bene Forza Italia
2348540	2351120	forse ha un po' troppi capelli rispetto a me
2352640	2354120	mi sembra che abbia lavorato bene
2354780	2359620	mi ha raccontato con orgoglio tutti gli interventi
2359620	2362580	che la provincia è riuscita a fare in questi anni
2362580	2365620	ho promesso a lui il sostegno per le richieste
2365620	2369040	che ha presentato al governo centrale
2369040	2371120	credo che questa sia la strada giusta
2371120	2375000	credo che sia una strada che dalla provincia di Lagusa
2375000	2378620	debba passare ad essere la strada di tutte le province della Sicilia
2379400	2383620	bene auguri, avanti tutta con determinazione
2386260	2390040	perché andando a rischiare facendo i cani da polpacci
2390040	2392320	normalmente si riescono a fare le cose
2392920	2397180	e poi non bisogna mai avere limiti nei traguardi
2397180	2399360	se si vuole arrivare a 8 bisogna appuntare a 10
2399360	2401520	se si vuole arrivare a 6 bisogna appuntare a 8
2401520	2405560	se no ci si ferma lì, lei ha fatto benissimo, tu hai fatto benissimo
2405560	2407540	e quindi avanti così
2409920	2413060	io credo che come Forza Italia
2413060	2416260	noi siamo già sulla buona strada
2416260	2418840	con il consenso che il Paese ci ha confermato
2418840	2422140	che è stato superiore in termini di voti a quello di 2 anni
2422140	2425320	ti ricordo che allora noi avevamo il 21
2425320	2428800	ma c'erano con noi gli amici del CCD
2428800	2430580	e quindi noi abbiamo avuto il 26
2431260	2434140	nonostante ciò che è successo durante la campagna elettorale
2434660	2437760	le valangate di fango che ci sono
2437760	2440160	e mi sono state buttate addosso
2440160	2444300	tutto quello che si è fatto per non farci apparire in televisione
2444300	2448280	dove abbiamo avuto un 23esimo dello spazio
2448280	2450320	un 23esimo dello spazio
2450320	2452480	io sono andato una volta da Costanzo
2452480	2454580	sono stato trasmesso le 12 e un quarto
2454580	2457720	per questa legge cosiddetta della par condicio
2457720	2460220	che è una legge illiberale
2460220	2464980	che ha dato a un partito che aveva avuto nelle ultime elezioni nazionali
2464980	2468300	il nostro il 30,6% per le europee
2468300	2471760	ha dato lo stesso spazio di partiti che avevano l'1%
2471760	2474880	o che addirittura non erano presenti nelle precedenti elezioni
2474880	2478240	questo non esiste in nessun paese del mondo
2478240	2480980	in nessun paese del mondo durante le elezioni
2480980	2484540	si vieta a una forza politica o a una coalizione
2484540	2487660	di far conoscere ai cittadini il proprio programma
2487660	2489220	e soprattutto il proprio marchio
2489220	2493060	voi dovete sapere che il marchio del polo per le libertà
2493060	2496240	non ha potuto avere una campagna promozionale pubblicitaria
2496240	2499800	in televisione, il 33% delle persone
2499800	2501620	che volevano votare per Forza Italia
2501620	2505000	soprattutto le persone anziane, sono entrate nella cabine elettorale
2505000	2507140	senza avere mai potuto vedere
2507140	2509740	il marchio del polo per le libertà
2509740	2512780	e questo spiega come la nostra vittoria
2512780	2517480	in termini di voti con 200 e passa 1000 voti in più
2517480	2519420	della coalizione delle sinistre
2519420	2522000	ci abbia portato poi ad avere un numero minore
2522000	2524100	di seggi in Parlamento
2524100	2527360	ma attenzione dobbiamo essere orgogliosi della nostra forza
2527360	2530140	siamo qui a rappresentare per quanto riguarda Forza Italia
2530140	2534540	8 milioni e 600 mila elettori italiani
2534540	2537900	siamo con le schede che ci hanno annullato
2537900	2539620	da professionisti della presenza
2539620	2541600	nei seggi e nelle sezioni
2541600	2544420	siamo largamente di sopra a un partito antico
2544420	2547220	annoso, organizzato come il PDS
2547220	2550720	e dobbiamo essere orgogliosi, è stato un miracolo
2550720	2554140	un miracolo arrivare
2555000	2556740	senza conoscersi prima
2556740	2558480	senza un'organizzazione
2558480	2561380	senza la possibilità di avere delle presenze
2561380	2566060	sul territorio a tenere insieme lungo tutto l'arco di queste elezioni
2566060	2567440	quella politica del marzo
2567440	2570900	poi la successiva elezione europea
2570900	2573340	e poi la elezione per le regionali
2573340	2575480	e poi il referendum sulle televisioni
2575480	2577520	e poi queste elezioni politiche
2577520	2581900	noi siamo sempre riusciti ad avere questo grande numero
2581900	2584520	di sostenitori che ci hanno dato il voto
2584520	2586640	crediamo che questa sia la nostra forza
2586640	2589520	un voto badate bene, di coscienza
2589520	2593200	perché se questi 8 milioni di persone avessero dovuto
2593200	2595640	stare a guardare il clamore delle televisioni
2595640	2598560	o ciò che ha apportato i giornali, tutta la grande stampa
2598560	2601820	che è stata contro di noi, dove avrebbero trovato
2601820	2604180	il modo per convincersi a darci il voto
2604180	2607400	è stato un voto di coscienza, un voto di libertà
2613300	2615840	ed ora a noi incombe
2615840	2617760	una grande responsabilità
2617760	2621480	la responsabilità di rappresentare bene questi voti
2621480	2624120	di rappresentarli, come ricordavo prima, in Parlamento
2624120	2626820	con una posizione ferma e precisa
2627900	2630240	ma incombe anche la responsabilità
2630240	2633900	di rappresentare questi voti con una organizzazione sul territorio
2634520	2637760	che faccia sentire a tutti coloro
2637760	2638980	che ci hanno votati
2638980	2641240	che noi siamo intenzionati
2641980	2644120	a dare seguito a questa responsabilità
2644120	2646780	che loro ci hanno dato, siamo intenzionati a lavorare
2646780	2649600	e credo che se siete qui, e perché tutti credete
2649600	2653520	in Forza Italia, perché forse tutti avete lavorato
2653520	2655820	nelle passate elezioni per Forza Italia
2655820	2658980	che io vi invito davvero
2658980	2662840	ad un lavoro serio, ad un lavoro generoso
2662840	2664160	per Forza Italia
2664160	2667240	noi non saremo mai e non dovremo mai essere
2667240	2670180	il partito del potere, il partito delle tessere
2670180	2672820	questo mai, noi dobbiamo
2672820	2675580	continuare ad essere il partito dell'agente
2675580	2680280	non un partito di potere, ma un partito al servizio dell'agente
2680280	2681860	c'è uno schema organizzativo
2681860	2685000	che vi ricordo sommariamente, che sta marciando
2685000	2689040	e che io spero possa trovare applicazione anche qui da voi
2689040	2691560	noi abbiamo ripartito il nostro partito
2691560	2693360	nelle regioni, nelle province
2693360	2697220	nei 475 collegi elettorali
2697220	2700640	abbiamo determinato di avere un coordinatore in ogni regione
2700640	2705860	in ogni provincia, in ciascuno dei 475 collegi elettorali
2705860	2706560	vicino all'organizzazione
2707900	2710620	di questo partito fatta tutta di volontari
2710620	2713380	è importante che ci sia l'organizzazione
2713380	2715220	dei club di Forza Italia
2715220	2718780	i club che devono nascere in tutti i comuni
2718780	2721200	se i comuni sono piccoli naturalmente
2721200	2724780	ci può essere un club che raggruppa alcuni comuni adiacenti
2725480	2728560	e dentro questi club deve svolgersi una vita
2728560	2732200	che testimoni la nostra presenza nell'interesse del Paese
2732200	2735460	abbiamo diviso il nostro movimento
2735460	2737160	e le responsabilità
2737160	2740240	in tutti questi passaggi organizzativi
2740240	2742780	in settori, in ogni regione, in ogni provincia
2743800	2747020	in ogni collegio e in ogni club
2747020	2750000	accanto al Presidente e al coordinatore
2750000	2752840	ci deve essere un direttivo con dentro
2752840	2755680	i responsabili di tutti i vari settori
2755680	2758580	il primo settore è quello della politica degli enti locali
2758580	2762860	con i candidati che a partire dal marzo dell'anno prossimo
2762860	2764260	dovranno essere scelti
2765020	2767060	attraverso delle elezioni primarie
2767060	2770520	che si devono ottenere in ogni comune italiano
2770520	2773460	abbiamo fissato la data
2773460	2776140	la fausta per noi del 27 di marzo
2776140	2779460	come data per il nostro congresso nazionale
2779460	2781840	ebbene, allora, ogni coordinatore
2781840	2785500	e ripeto, nella regione, nella provincia
2785500	2788880	nel collegio elettorale e nel club
2788880	2791940	nel comune, deve avere di fianco a sé un direttivo
2791940	2795320	con il responsabile vicario del coordinamento
2795320	2798640	che deve dedicarsi alla politica e agli enti locali
2798640	2799960	di fianco a lui ci deve essere
2799960	2803340	il responsabile di tutta l'organizzazione dei club
2803340	2805960	poi il responsabile dei problemi ambientali
2806720	2810100	con un'organizzazione che si chiama Ambiente Italia
2810100	2812920	il responsabile dei rapporti con l'istituzione
2812920	2814920	del mondo cattolico, con il mondo
2814920	2817080	del non profite, del volontariato
2817080	2821140	e qui è molto importante lavorare con altruismo, con dedizione
2821140	2824060	perché non dobbiamo permettere
2824060	2827240	che sia lasciato il monopolio
2827240	2830000	alle sinistre, per quanto riguarda
2830000	2832720	il lavoro di aiuto nei confronti degli altri
2832720	2836020	ne stiamo già facendo molto, è importante
2836020	2839240	che lo facciamo in modo completo ed organizzato
2839800	2842300	e poi l'organizzazione per la cultura
2842300	2844620	per le tante manifestazioni culturali
2844620	2848740	anche di formazione politica, per formare una nuova classe dirigente
2848740	2851160	non soltanto per Roma
2851160	2853080	non soltanto per il vertice regionale
2853080	2856020	ma anche per tutte le altre istituzioni locali
2856020	2857800	che con l'applicazione di quel principio
2857800	2860720	di cui ho parlato prima, il principio di sussidiarietà
2860720	2864900	diventeranno sempre più importanti, avranno sempre più funzioni
2864900	2868120	sempre più poteri e quindi dobbiamo preparare
2868120	2870060	una nuova classe dirigente
2870060	2874160	che possa entrare con competenza
2874160	2876940	dentro queste istituzioni al momento venuto
2876940	2880900	poi il rappresentante di Forza Giovani
2880900	2883180	il rappresentante di Universo Donna
2883180	2886220	il rappresentante di quello che noi chiamiamo
2887000	2889700	l'Ettadoro, il rappresentante dei pensionati
2889700	2892140	e poi alla fine naturalmente anche chi
2892140	2894520	ha la responsabilità di raccogliere i fondi
2894520	2897720	perché la politica non si può fare, queste manifestazioni
2897720	2901000	non si possono fare se non si hanno anche dei fondi
2901000	2904080	che saranno raccolti in modo trasparente
2904080	2907120	in modo chiaro per sostenere
2907120	2909180	la nostra attività sociale e politica
2909180	2913140	questo è l'impegno che mi piacerebbe avere da voi
2913140	2916160	la preghiera che io vi rivolgo di dedicarvi
2916160	2919120	tutti ad una presenza partecipe
2919780	2923320	con tensione morale, con passione civile
2923320	2926020	per far nascere da questo idea
2926020	2928620	da questo movimento che ha saputo interpretare
2928620	2931420	le attese e le speranze di tanti di noi
2931420	2934120	un qualche cosa di stabile che possa stabilmente
2935660	2937160	contribuire alla organizzazione
2938400	2940160	del nostro Paese
2953380	2956120	che possa avvicinare a noi tante persone
2956120	2959540	che non sono ancora noi vicine, che non conoscono
2959540	2962520	i nostri programmi, che non conoscono
2962520	2966040	ciò che ci spinge ad operare per il bene di tutti
