start	end	text
0	7280	Allora, buonasera a tutti. Benvenuti in Palazzo Medici. Un benvenuto particolare, di cuore,
7380	11520	visto anche il momento che stiamo vivendo ricco di appuntamenti per aver voluto onorare
11520	16440	un impegno che aveva preso con noi al ministro Paolo Gentiloni, che è qui assieme a noi
16440	26020	quest'oggi e che ringrazio di cuore. Ringrazio naturalmente anche tutte le autorità presenti,
26020	32460	per non fare torto a nessuno. Le ringrazio tutte nella persona di signor Prefetto, del
32460	36660	signor Questore, del comandante provinciale dei Carabinieri e mi scuso per tutti gli altri
36660	42040	che non riesco a vedere un grazie di cuore per essere qua, oltre che naturalmente per
42040	46000	i vari amici del Consiglio provinciale e dopo di me prenderà la parola del Presidente del
46000	51180	Consiglio Massimo Mattei. Molto rapidamente, sapete che io faccio finta di fare politica,
51200	56000	ma il mio sogno è quello di fare il presentatore, l'onorevole Gentiloni lo sa, e quindi il
57720	64680	di presentare la giornata e la serata, che è per noi molto importante. Probabilmente
64680	70440	qualcuno di voi è cresciuto in un momento nel quale si diceva che tutto è politica,
70440	76260	che tutto fosse politica. Non so se è mai stato così. Oggi senza dubbio questo tipo
76260	82180	di idea non è considerata vincente, però tutto è comunicazione. Tutto è comunicazione
82180	87220	anche nella politica, nell'economia, nella realtà sociale, persino nello sport. Abbiamo
87220	91980	visto che se c'è una cosa che ha dato un grande valore ai mondiali di calcio è stata
91980	97500	molto di più tutta l'enfasi comunicativa sulla testata di Zidane a Materazzi che non
97500	101800	il valore sportivo. Perché? Perché siamo ormai assolutamente inseriti in un contesto
101800	108740	nel quale tutto è comunicazione. E il fatto che tutto sia comunicazione impone alle realtà,
108740	114460	anche alle realtà locali, di fare i conti con un cambiamento che corre velocissimo.
115320	121520	Se penso al mondo della comunicazione e della politica soltanto dieci anni fa, penso a un
121520	128420	mondo profondamente diverso. 11 anni fa Google non c'era. Se penso a ciò che la politica
128420	134160	oggi è costretta a rincorrere, credo che larga parte di questi fenomeni derivino dalla comunicazione
134160	139880	e dai meccanismi di profonda trasformazione che essa sta imponendo alla società. E allora
139880	145120	può non suonare strano il fatto che nel salone Luca Giordano del Palazzo Medici Riccardi
145120	152100	oggi siamo chiamati a confrontarci con colui il quale non soltanto ha appena presentato
152100	159280	qualche settimana un ambizioso progetto di riforma del sistema televisivo, ma anche
159280	165680	soprattutto con il rappresentante del Governo in un momento nel quale le trasformazioni
165680	172100	vanno davvero a 360 gradi. E basta vedere la presenza di molti di voi, amici che conosciamo
172100	177320	in sala, realtà del mondo delle aziende, del mondo dell'information technology, realtà
177320	182040	profondamente diverse anche rispetto a quelle di qualche anno fa. La sintesi è che abbiamo
182040	186840	immaginato di muoversi così. Un brevissimo saluto da parte del Presidente del Consiglio
186840	191280	del Massimo Mattei, un brevissimo saluto da parte del Vice Presidente della Regione Federico
191280	195520	Gelli in rappresentanza di tutte le realtà territoriali. L'assessore del Comune di Firenze
195520	202380	vedo dei sindaci, vedo quindi una nutrita presenza di amministratori del territorio
202380	209480	e poi un primo intervento del Ministro Gentiloni al quale seguiranno alcuni brevissimi spunti
210440	215880	dal pubblico per poi una replica e in modo tale da riuscire in un'ora a non dico a
215880	219380	discerare l'argomento di discussione di stasera, perché sarebbe esattamente il contrario
219380	223600	della premessa, ma a tornare a casa probabilmente un po' arricchiti tutti.
224100	230880	Io ho soltanto di nuovo da dire un grazie non formale a Paolo Gentiloni, onorevole Ministro,
231020	236000	questo palazzo è un palazzo dove il passato si fa sentire con grande forza, il primo palazzo
236000	241320	della famiglia Medici e questo è il salone che rappresenta se vogliamo anche la straordinaria
241320	244720	ed epopea della famiglia Medici.
245420	250080	Eppure noi siamo convinti che il miglior modo specie a Firenze per onorare il passato
250080	254680	è quello di costruire un pezzo di futuro, perché altrimenti il nostro è semplicemente
254680	260000	il ricordo da centro studio da museo e siamo convinti che con il suo aiuto oggi ci sarà
260000	265380	un modo di poter fare un piccolo passettino in questo tipo di progetto ambizioso che deve
265380	271300	riguardare tutti e che riguarda naturalmente anche il Consiglio provinciale, per cui a
271300	272080	un brevissimo saluto.
