start	end	text
1553180	1560500	che noi abbiamo mai pensato e contemporaneamente pensiamo che sia stucchevole e anche squallido
1560500	1566200	giocare sulla pelle di queste persone per prendere mezzo voto in più raccontando che
1566200	1572560	sono loro i responsabili di tutto, raccontando che il problema dell'Italia è l'immigrazione,
1572800	1577220	chiedendo tutti i giorni le dimissioni di Alfano come fa Salvini, ignorando che poi
1577220	1582460	lui ci fa l'accordo in Umbria e in Liguria con Alfano Salvini, perché questo vuol dire
1583220	1588100	strumentalizzare la vita umana e noi non lo possiamo consentire, c'è una terza via
1588620	1595080	tra il buonismo che è cattivismo e la biega strumentalizzazione, ed è quello di chiamare
1595080	1603380	le cose per come sono, problemi complessi. Oggi il 91% degli immigrati arriva dalla Libia,
1603480	1608460	perché? Perché si è bombardato in Libia senza preoccuparci del dopo, lo vogliamo dire
1608460	1612680	o non lo vogliamo dire? Vogliamo avere il coraggio di raccontarlo o di non raccontarlo?
1613820	1620180	Oggi il 23% di quegli immigrati viene dall'Eritrea e la seconda nazionalità è la Somalia, perché?
1620200	1625820	Perché per anni la politica internazionale dell'Africa non si è mai occupata, perché
1625820	1632580	l'Africa l'ha lasciata in un angolino e l'unico modo per bloccare questo traffico di scafisti
1632580	1638480	che anche schiavisti è quello di intervenire in modo radicale in Africa, perché l'Africa
1638480	1644440	è un continente che nei prossimi vent'anni crescerà a livello economico, negli ultimi
1644440	1648760	due anni l'Africa sta facendo, l'Africa sub-sahariana, delle percentuali di crescita
1648760	1655860	al pari dei paesi dell'estremo oriente. Sta cambiando, vent'anni fa erano gli albanesi,
1657060	1661220	ve lo ricordate quello che accadde vent'anni fa? Ci lo ricordiamo che cosa accadde venticinque,
1661220	1669580	ma no vent'anni fa. Con situazioni analoghe, barconi affondati, con problemi, crisi, oggi
1669580	1674700	la situazione è che l'Albania è tornata ad essere un paese solido, è un paese che
1674700	1677940	vuole entrare nell'Unione Europea e io dico è bene che centri l'Albania nell'Unione
1678540	1683260	Europea ed è fondamentale che in Albania, come pure in tanti paesi dei Balcani, si vada
1683260	1689060	a combattere il rischio di estremismo che può esserci. Edi Rama, il presidente dell'Albania,
1689880	1694540	ha detto delle parole incredibili, ha detto quando l'Europa ci ha rinviato di sei mesi
1694540	1703500	lo status di Paese Membro, gli estremisti religiosi islamici dell'Albania hanno utilizzato nelle
1703500	1710480	moschee il taglio, la comunicazione negativa per far crescere il proselitismo contro l'Europa.
1710620	1714860	Dicendo, vedete che non ci vogliono? Allora, io lo so che è difficile fare questi discorsi
1714860	1718920	che in campagna elettorale bisognerebbe non parlarne, ma noi siamo persone ragionevoli,
1719620	1725820	io credo nel buonsenso dei Veneti e del buonsenso degli italiani, non racconto barzellette e
1725820	1731280	frottele di italiani. Certo, c'è il problema dell'immigrazione, è complesso, lo affrontiamo,
1731640	1738120	lo stiamo affrontando e quando viene arrestato un presunto responsabile, io capisco che uno
1738120	1745480	si debba lamentare, ma è stato arrestato, cioè in tutto il mondo quando viene arrestato
1746160	1752420	un elemento pericoloso e non si può dire era meglio se non l'arrestavamo o almeno non
1752420	1758560	sapevamo che era qui, perché questa no, voi applaudite ma è roba da raccontare, tu hai
1758560	1763220	preso uno che è un potenzia, può darsi che non lo sia, per carità di Dio, saranno i magistrati,
1763280	1766960	io sono sempre per presunzione di nocenza, ci dicono i magistrati, questo potrebbe essere
1766960	1771940	il modo dei responsabili e lo mandano tutto dopo, noi andiamo lo prendiamo, era meglio
1771940	1776160	se non lo prendevamo, io vorrei trovare quello che ha detto era meglio se non lo prendevamo,
1776500	1784720	stenderlo sul lettino e farmi raccontare che ha fatto da piccolo, perché vedete lo so
1784720	1789260	che è complicato, lo so che bisognerebbe non parlarne, però quello che vorrei dire
1789260	1795760	a ciascuno di noi è che vinceremo questo grande sfida culturale e poi anche le elezioni,
1795760	1802600	se oltre a mettere in moto il cuore, metteremo anche in moto il cervello e il cervello serve
1802600	1807880	per vedere la realtà dei fatti per com'è e la realtà dei fatti è che di fronte a problemi
1807880	1814280	complessi non c'è slogan che tenga, l'Italia non è un paese slegato dal resto del mondo,
1814420	1818100	l'Italia è un paese pienamente nel mondo, ha i suoi elementi di forte e i suoi elementi
1818100	1825420	di debolezza, in questo scenario il Veneto ha una grande possibilità, prendere per mano
1825420	1832940	questo paese e farlo crescere a velocità doppia, il Veneto cresce più della Germania, il Veneto
1832940	1838900	ha le condizioni per... se le imprese Veneti, i piccoli e i medi imprenditori Veneti sono
1838900	1844000	riusciti a resistere nonostante tutto quello che ha combinato a livello internazionale
1844000	1849640	in termini di credibilità a qualche governo precedente, è del tutto evidente che sono
1849640	1855020	delle persone tenaci, toste, forti, però noi dobbiamo avere il coraggio di crederci anche
1855020	1861600	noi, e allora Alessandra ha fatto una scommessa, Alessandra, io ve lo dico con tutto il rispetto
1861600	1869260	per quelli che stanno a Bruxelles e Strasburgo, stava bene eh lassù, cioè i 574 comuni sono
1869260	1875840	più belli di Bruxelles e di Strasburgo, però insomma con tutto l'affetto per i parlamentari
1876800	1882040	europei secondo me di lavoro proprio proprio proprio non si ammazzano, no fermi che ridere,
1882040	1890440	no, ora mi tocca andare a Bruxelles a far pace anche lì. La Mogherini viene il lunedì,
1890480	1895240	sa perché viene la Mogherini? Qui il lunedì dove la facciamo? Io ho chiesto alla Federica
1895820	1899920	Mogherini, alla Maria Elena Boschia, alla Debora Seracchiana, alla Maria Anna Madia,
1900120	1905080	cioè a quattro donne del PD che hanno un ruolo importante, ho detto fate una cosa scusate,
1906520	1910080	diamo una dimostrazione che tutti i luoghi comuni sulle donne, che sicuramente non abbiamo
1910080	1914540	fatto, però sono un sacco di donne, e tutte insieme, tutte per ale, lunedì sera dove,
1914580	1920080	a che ora? A Verona faccio anche, dopo la conferenza stampa faccio anche, verranno
1921020	1926500	Federica, Debora, Maria Elena e Maria Anna, tutte per ale per dimostrare che questa sfida
1926500	1930840	non è soltanto la sfida di una giovane donna, ma è la sfida di una nuova generazione di
1930840	1935260	donne che sta guidando l'Italia e l'Europa e questo non lo aveva mai fatto nessuno,
1935720	1944260	lo stiamo facendo noi, lo fa il PD, lo fa il PD, però stavo dicendo che ho il sospetto
1944260	1949600	che lei sia la zia della Mogherini, stavo facendo la conclusione, sono bloccato, allora
1950360	1956820	chiudiamo, com'è? Che è la nonna? Meno male che le giovani donne dovrebbero andare d'accordo,
1957000	1963360	bravi siete, vabbè, lasciamo stare, è la cugina, vai, ora mi puoi dare la Mogherini,
1963360	1967800	allora finiamo il quadro perché è importante, al Parlamento Europeo si lavora, certo, c'è
1967800	1972580	anche chi ha tempo per stare dalla mattina alla sera a giro in televisione, quindi,
1972840	1978620	io prima o poi, no, fermi lì, quando torna Salvini regalata di una ferpa con scritto
1984120	1994020	Strasburgo, Strasburgo, è carina, e mentre questi vanno in TV con la faccia triste, erano
1994020	1998800	tutti arrabbiati, noi rispondiamo sempre con un sorriso, mi hanno detto ma tu non vieni
1998800	2003540	a parlare male di Zaya? No, non vengo a parlare male di Zaya, io non parlo male degli altri,
2003540	2013440	io ho fatto tutta la mia scommessa, basta Zaya, basta Zaya fa anche, potrebbe essere
2013440	2017500	un astag, direbbe qualcuno, però io non vengo a parlare male degli altri, come non vado
2017500	2021920	domani a parlare male di Caldoro, come non ho parlato male, e mi avete anche molto accusato
2021920	2027460	di Berlusconi, io non sono uno che parla male degli altri, perché penso che le nostre idee
2027460	2033920	siano talmente forti che gli italiani devono votare per noi se vogliono, non perché parliamo
2033920	2042560	male degli altri, ma perché abbiamo qualcosa da proporre. Il centrosinistra ha vinto e non
2042560	2048140	ha governato a lungo perché è stato insieme parlando male di Berlusconi, abbiamo fatto
2048140	2054880	le grandi alleanze, tutti insieme, abbiamo creato l'Unione, ci siamo litigati il giorno
2054880	2062080	dopo, perché dal giorno dopo il problema non è più parlare male di un altro, noi
2062080	2066160	dobbiamo parlare bene del Paese e lo dico anche pensando a qualcuno che al nostro interno
2066160	2072000	sogna che le elezioni regionali vadano male per poi aprire qualche polemica interna, lasciateli
2072000	2079360	fare, noi pensiamo a parlare del futuro dell'Italia, del Veneto e del Pd, e allora, dicevo, Alessandra
2079360	2085800	ha fatto la sua scelta, dicevo che al Parlamento europeo si lavora tanto, tantissimo, però
2085800	2090600	insomma aveva anche un po' più di tempo libero di quello che ha avuto in questi mesi. Io
2090600	2095620	credo che a lei vada chiesto l'ultimo sforzo, non soltanto gli ultimi quattro comuni, ma
2095620	2100920	di mantenere forte la voglia e il desiderio di andare incontro alle persone, andate incontro
2100920	2107120	alle persone, prendetele una per uno, svuotate le rubriche telefoniche, raccontate che questa
2107120	2111340	è la campagna elettorale che non è soltanto di Alessandra Moretti, però poi molto dipende
2111340	2118400	anche da voi, e dipende da voi, io l'augurio che voglio dirvi e che voglio farvi è lo
2118400	2123460	stesso augurio che ci hanno fatto e che ci siamo andati a prendere a proposito dell'Expo,
2123660	2132040	per questo ho fatto saltare la slide. All'Expo non ci credeva nessuno, sono arrivato e mi
2134980	2140560	è stato difficile. Abbiamo dovuto cacciare qualche mercante dal tempio, diciamo così,
2140760	2145420	qualcuno che ci ha mangiato, perché il tema era la nutrizione del pianeta, qualcuno ha
2145420	2153600	nutrito altro e l'abbiamo cacciato, aveva capito male il titolo, succede, abbiamo creato
2153600	2158580	un'autorità nazionale anticorruzione, quando Alessandra ha insistito sull'onestà io credo
2158580	2164460	che abbia fatto benissimo perché questa non è un requisito della politica, è il pre-requisito
2164460	2169380	della politica, con quel politico non ci capisce niente ma è onesto, è caspita, è il minimo,
2170220	2174540	cioè questa dovrebbe essere la regola del gioco. E l'Expo oggi è una realtà che funziona,
2174700	2178960	che è bella, che fa discutere, anche che mette in campo delle contraddizioni, c'è
2178960	2184880	un miliardo di persone che muore di fame oggi nel mondo, ma non vi fa sguassare il cuore
2184940	2188800	di questa cosa, e tra l'altro c'è un miliardo di persone che rischiano all'obesità, tra
2188800	2193020	cui il sottoscritto, la Moretti no, ma io sì. Allora di fronte a questo ci rendiamo
2193020	2196860	conto che ci sono delle grandi questioni, eppure l'Italia li ha mostrato il volto migliore,
2197100	2201420	grazie anche alle piccole e medie imprese, anche Venete che si sono spaccate la schiena
2201420	2206200	e hanno dimostrato che si poteva fare, lo dico anche a voi, oggi, qui, adesso, ci sono
2206200	2210640	imprese che sono difficili, ci sono imprese che non sono semplici, ma non si vincono
2210640	2214400	parlando male degli avversari, si vincono provando a dare il meglio di noi stessi,
2214400	2219400	io non vi chiedo di fare meglio degli altri, vi chiedo in questi ultimi giorni di dare
2219400	2224740	il meglio di voi stessi, è una partita che è una partita difficile, ma non c'è sfida
2224740	2229800	più difficile di quella di uno che non ci prova neanche, non c'è sfida più bella
2229800	2235100	di una partita che sembra impossibile in partenza, mancano dieci giorni, decidono i prossimi cinque
2235100	2244380	anni della vostra legione, Alessandra ha dato tutto e darà ancora di più negli ultimi
2244380	2251360	con il tono di quelli arrabbiati che urlano, ci sono due Italie in campo anche in questa
2251360	2256620	campagna elettorale, c'è l'Italia che protesta, che è arrabbiata, che dà sempre la colpa
2256620	2261400	a qualcun altro, che trova sempre un alibi e poi c'è l'Italia che prova a trovare le
2261400	2266360	soluzioni, che ci crede, che dice da qui ai prossimi vent'anni se ce la mettiamo tutta
2266360	2271580	a questo Paese torna a essere quello che deve essere, il Paese guida dell'Europa e se il
2271720	2276940	Veneto prende la mano l'Italia, prende per la mano l'Italia e prova a dimostrare che
2276940	2281880	queste sfide di cui abbiamo visto nelle slide sono sfide vincibili, beh io credo che non
2281880	2289220	ce ne sia davvero per nessuno e allora dieci giorni al traguardo Alessandra deve finire
2289220	2294340	i quattro comuni e ormai ce la fa, quindi chi avesse dei dubbi sul fatto che non regge
2294340	2301700	è stato smentito, però se tornando a casa senza rabbia, senza grida, senza polemica
2301720	2308100	e senza sputare sangue e senza sputare sentenze, senza sputare vendette, ciascuno di noi prova
2308100	2313680	a fare un pezzettino di questa campagna elettorale, spero che ce la faremo ma sono assolutamente
2313680	2319760	certo che nel fare questo tentativo darete ai vostri figli, ai vostri nipoti, ai vostri
2319760	2324840	genitori l'idea che la politica è una cosa bella, che l'Italia è un grande Paese e che
2324840	2328860	noi non ci rassegniamo alla paura, in bocca a l'uva Alessandra, in bocca a l'uva a tutti
2328860	2329060	voi.
