start	end	text
0	7860	Io vi devo dire con grande onestà che siamo un partito di fantasisti, sono molto contento
7860	12480	di essere a Vicenza, tra l'altro l'ultima volta eravamo stati proprio insieme in piazza
12480	20800	per il momento in cui Achille si ricandidava con il bel risultato che allora ottenne, quindi
20800	28220	torniamo sul luogo del delitto dove tu sei cresciuto amministrativamente, dove insieme
28220	31940	abbiamo anche in piazza fatto una bella iniziativa di campagna elettorale, ma siamo un partito
31940	37200	di fantasisti, è inutile che la giri intondo perché vi racconto come è nato questo incontro.
37400	44460	Tanto inutile fare grandi discorsi, poi mi chiamano dal Veneto dicendo Matteo, ma come?
45000	50360	Tutti i giornali sono pieni del fatto che sei contento se finisce 6 a 1.
51460	56820	Ora, io, vorrei che vi, perché me la racconto tutta qui, devi per forza venire a fare un'iniziativa
56820	61580	in Veneto e io ci mettiamo d'accordo, dico va bene vengo giovedì mattina c'è la segreteria,
61780	65100	prima c'è Cantone, devo fare un incontro con il sottosegretario, poi vado in Lettonia
65100	69340	perché stasera c'è il vertice dei paesi in Lettonia, ci fermiamo, mi dicono fai una
69340	74240	conferenza stampa con Alessandra sul Jobs Act in Veneto, un pranzo da un nostro comune
74240	79800	amico imprenditore e poi riparti, voi siete la conferenza stampa, occhio, io mi sono preparato
79800	86260	per le slide, per la conferenza stampa, e vabbè, però, bello, positivo, ma tra di
86260	93040	noi non puoi dire che finisce 6 a 1, cioè, io ho soltanto detto che se finisce 6 a 1
93040	97700	il segretario del PD è contento, ora ne abbiamo 3 dei candidati uscenti che stanno dall'altra
97700	104280	parte, se da 3 passano a 1 il PD è contento, ora il PD ragazzi è in una fase in cui non
104280	109780	ne vuole perdere neanche mezza, mi piace questa cosa eh, siamo stati anni a perdere, adesso
110820	117340	non c'è proprio verso, uno dice 6 a 1, no, non siamo contenti, non siamo mai contenti,
117840	123460	e poi stai dicendo che quindi l'Alessandra è quella che ha la partita più difficile,
124420	130420	sì, sì, il Veneto è la partita più difficile, poi magari si perde in Toscana, non lo so,
131380	137380	però, ora, domani mi tocca andare in Toscana da Rossi a dire, no, non dicevo a te, dicevo
137380	143520	a Sombria, eh, però battute a parte, è chiaro che questa è una sfida difficile, è molto
143520	149720	difficile, sono tanti anni che siete governati adesso da Zaire, prima da Galan, è normale
149720	156400	che questa sia una partita molto molto molto complicata, però questo non vuol dire che
156400	162860	non sia una partita entusiasmante da giocare, e questo non vuol dire che Alessandra abbia
162860	167880	vinto la sua partita, poi bisogna vincere le elezioni, ma quando ha fatto un piccolo
167880	174400	gesto che la rende diversa da tutti gli altri candidati, non in Veneto, ma anche in altre
174400	182700	regioni, quando ha detto io per correre in Veneto lascio la mia poltrona di parlamentare
183900	194160	europeo, ditelo ai Salvini, ditelo ai Toti, ditelo ai Pastorino, qui c'è una ragazza
194160	199660	che si è messa in gioco, ha lasciato l'incarico perché per fare il parlamentare europeo era
199660	204580	necessario che ci fosse un'altra persona a tempo pieno per cercare di difendere l'Italia
204580	209780	in Europa, tra parentesi, poi ne parliamo un attimo, ma per difendere l'Italia in Europa
210540	216440	non si parla male dell'Italia dalla mattina alla sera nelle televisioni italiane europee,
216740	221960	perché chi vuole bene all'Italia non parla male dell'Italia, prova a cambiare l'Italia,
222160	224720	ma non spara contro il nostro paese tutti i giorni.
225640	231880	Allora Alessandra ha già vinto la sua partita, ha dimostrato che c'è una serietà nel modo
231880	237980	di presentarsi e di fare politica che è bella, che va sottolineata, però adesso la sfida
237980	244520	è quella del PD, ed è una sfida bella difficile, bella complicata, però abbiamo il problema
244520	251760	che io mi ero preparato le slide per la conferenza stampa, io ve le presento, facciamo una finta
251760	256320	conferenza stampa tra di noi, poi però a questo punto visto che siamo, e poi si va a
256320	260400	fare campagna, figurate se alle 11 e mezzo del mattino vengono i Veneti, voi se avete
260400	265460	una fama di gente operosa che sta a lavorare e ci fate qui, se proprio non volete lavorare
265460	270160	mettetevi a fare campagna elettorale, però facciamo veloce così che poi possiamo recuperare
270160	275720	il tempo. Allora vediamo se le, ah dove sono le slide? Ce le abbiamo le slide Franco se
275720	281760	riesci a mandarle, dove le stai mandando? Non ce le ha, eh ce le abbiamo le slide, avete
281760	289280	visto che c'erano, allora io vorrei raccontare molto semplicemente qual è il messaggio
289280	295000	che il PD del Veneto vuole dare da questa campagna elettorale, che Alessandra Moretti
295000	300740	sarà un'ottima Presidente, sì lo sapete, lo sapete, ci credete, ci state lavorando,
301120	308600	però qual è il punto? Il punto è che tipo di scommessa facciamo, grazie al Veneto sull'Italia,
308920	315560	perché voi siete un paese, una regione, un territorio, che ha dimostrato nel giro di
315560	324880	un secolo di passare da terra da cui si scappava, da terra di emigrazione, i nonni dei vostri
324880	333020	padri lasciavano il Veneto per andare in Belgio, negli Stati Uniti, in tante parti
333020	339980	del nostro pianeta, a terra che è una regione che può essere la guida d'Europa, la locomotiva
339980	348620	d'Europa. Da qui, alle prossime elezioni regionali, al 2020, la classe media nel mondo
348620	354520	aumenterà di 800 milioni di persone. Capite che la prima regola del gioco di
354520	360120	quelli che io li chiamo gufi, però di quelli che ce l'hanno con l'Italia, di quelli che
360120	365560	non vogliono bene all'Italia, è dire, mamma mia, siamo in condizioni atroci, il mondo
365560	370980	globale è una minaccia, non è vero niente, certo ci sono dei pericoli, poi parleremo
370980	374820	anche di immigrazione e del resto, certo ci sono tante questioni che non vanno, ma il
374820	384220	mondo globale è la più grande opportunità che noi abbiamo. Perché? Perché il mondo
386140	393780	saranno consumatori, tuisti, visitatori, sono persone che credono che l'Italia sia uno
393780	399960	dei posti più belli del mondo. Soltanto chi guarda costantemente in modo compulsivo i talk
399960	406580	show pensa che l'Italia sia il paese della disperazione. Siamo uno dei paesi più belli
406580	414480	del mondo con la longevità, con viviamo più a lungo, stiamo meglio, siamo questo, l'Italia
414480	418880	è questo. Poi certo abbiamo un sacco di cose da cambiare, eh, non credete che va tutto
418880	423400	bene madama Marchesa? Anzi, dobbiamo fare di più. Però di fronte è questo, allora guardiamo
423400	430820	alcuni dati. Anche nel periodo di crisi l'export cresce e guardate questo ultimo dato, 1,9
430820	440220	è l'export nel momento della crisi. Ma nell'ultimo trimestre, marzo 2015 rispetto al marzo del
440220	447760	2014, lo vedete lì vi sto coprendo io, i dati sono più 9,2%. Cioè negli anni della crisi
447760	460800	è cresciuto in totale dell'1,9, del 2%. Solo nell'ultimo anno più 9,2%. Vai avanti, vai
463580	471640	area, diciamo nell'eurozona per le acquisizioni delle aziende. L'Italia che finalmente prova
471640	477100	a semplificare il sistema fiscale, l'Italia che, anche perché ditemi come si fa a renderlo
477100	482880	più complicato, il sistema dice, voi vorrei semplificare il sistema fiscale, trovatemene
482880	487200	uno che vi dice, io lo vorrei complicare. Se qui dentro c'è uno che riesce a complicare
487200	491680	il sistema fiscale, oddio, oddio, qualcuno ci è anche riuscito, andiamo avanti. Evitiamo,
491700	497200	magari si scopre che c'è. Vai avanti, Franco. A questo punto che cosa ne abbiamo deciso di fare
497200	503580	noi a livello centrale? E poi vedremo gli effetti che questa cosa può avere nel Veneto. Il lavoro
503580	509300	a tempo indeterminato lo facciamo accostare meno del lavoro precario. È una cosa banale,
509780	516100	è una cosa semplice. Io potrei dire agli elettori di voi che sono più di sinistra radicale,
516100	520380	a quelli che mi vedono un po' con il fumo negli occhi, sono anche qui dentro, fanno
520380	524280	finta di niente. Dicono, facciamo finta di niente, siamo in campagna elettorale, bisogna
524280	528120	sopportare anche Renzi, però facciamo finta di nulla. Ma voglio dire a quelli che sono
528120	534540	un pochino più di sinistra radicale, che non c'è cosa più di sinistra di far diventare
534540	541640	il lavoro a tempo indeterminato una possibilità in più rispetto al lavoro precario. Per vent'anni
541640	548520	la classe dirigente italiana si è dimenticata del fatto che ci fosse una generazione che
548520	553440	era una generazione tagliata fuori dai diritti, tagliata fuori dal mutuo, tagliata fuori dalle
553440	559540	ferie. Abbiamo il tasso di maternità più basso d'Europa per questo, anche per questo.
561360	568360	Questa per me è la cosa più di sinistra che si potesse fare. Aggiungo, per quelli
568360	575480	che magari vengono dal mondo moderato, è la cosa più giusta che si dovesse fare. Voi
575480	581120	siete prima ancora che cittadini, prima ancora che Veneti, prima ancora che Vicentini, voi
581120	588200	siete delle donne, degli uomini, dei genitori, siete dei nonni. L'avete visto che cosa ha
588200	593980	comportato in questi anni una politica che non ha pensato ai vostri nipoti? Lo dico a
593980	600860	chi è nonno qui dentro. Lo stato sociale lo avete mandato avanti voi, allungando un
600860	605600	foglio da 50 euro al nipote quando dovevo uscire magari venerdì sera, o più semplicemente
605600	611800	cercando di farsi carico della situazione familiare, anche e non soltanto a livello
611800	618160	economico. Lo stato sociale in Italia lo ha tenuto in piedi la famiglia. Perché? Perché
618160	623700	non si è pensato a dare diritti a tutti. Questo tentativo che noi stiamo facendo è
623700	628800	un tentativo che naturalmente può essere considerato più o meno valido, più o meno
628800	635060	discutibile. Ma in questi mesi, in queste settimane sta accadendo che tante persone che erano precarie
635060	640380	prendono un contratto che si chiama Tutele Crescenti. È questo quello che è accaduto
640380	647980	con lo scambio articolo 18 contratto a Tutele Crescenti. Oggi questo meccanismo provoca
647980	653000	un aumento dell'occupazione. Se a questo si somma, al di là delle operazioni degli
653000	659200	80 euro, poi uno diceva a me non si è piaciuto l'operazione 80 euro. Ho capito, tra averli
659200	664060	e non averli, come diceva il mio zio, sono 160, cioè la discussione è che in un momento
664060	669740	in cui per anni sono aumentate le bollette, sono aumentati tutti i vari tipi di costi
669740	675680	da pagare, tutte le tariffe dalle autostrade alla tariffa dei rifiuti, è naturale che
675680	680540	se tu puoi dare al ceto medio, cioè 10 milioni di italiani, non dico mica la soluzione di
680540	685780	tutti i problemi, ma una piccola parte di quello che è stato tolto partendo dalla
685780	690240	riduzione sui costi della politica è un fatto di buon senso. Tutte queste misure hanno
691000	697300	portato al più 24,1% di assunzioni a tempo indeterminato. E questo vale a livello nazionale,
697360	701140	vai avanti veloce che voglio andare in Veneto. Vabbè, il taglio dell'IRAP, la legge era
701780	709140	per conferenza stampa, tutte cose importanti ma non definitive. Quella dell'Expolaco andiamo
709140	716660	dopo, vai avanti ancora, a quella dopo ancora, voglio arrivare al Veneto. Perfetto. Questo
716660	722580	tipo di interventi che stiamo cercando di fare hanno in Veneto il luogo naturale. Non
722580	727100	a caso l'ha detto ben Alessandra. Alessandra ha detto ragazzi, se c'è una regione che
727100	733280	in questo periodo sta finalmente funzionando in termini di recupero di posti di lavoro è
733280	738620	proprio questo, perché? Perché se il Veneto tira, il Veneto cresce più della Germania,
738620	744380	è quello che sta accadendo e che può accadere ancora. Questo vale sull'export, vai avanti
744380	752140	a quella dopo per piacere. Nell'export siamo tornati finalmente ai livelli precrisi. Abbiamo
752140	756060	l'export più o meno della Romania o del Portogallo, ora si arrabberanno i rumeni e
756060	762460	i portoghesi, cioè il solo Veneto da solo, nella graduatoria delle nazioni. Se fosse
762460	767620	una nazione, ora non vorrei che la Liga Veneta dicesse ha detto. Tanto la Liga Veneta non
767620	772400	conta niente perché fa tutto Salvini notoriamente, per cui gli ha commissariati, quindi non c'è
772400	782880	problemi. La Liga era un'intuizione, ormai. Vi hanno scambiato, i Veneto, l'Iguria, l'ombardiera.
784860	788540	Alla fine saremo noi gli unici federalisti, Achille, ma ti rendi conto, siamo arrivati
788540	794360	a questo livello. Se non lo facciamo noi, sono vent'anni che la Lega diceva Roma ladrona,
794360	798880	appena sono arrivati a Roma come si sono trovati bene. Roma ladrona, si sono trovati
798880	805660	di un bene, ma di un bene si sono trovati. Abbiamo fatto più cose noi in un anno che
805660	810340	loro inventi per rimettere a posto questo benedetto Paese. Lasciamo stare. Allora, in
810340	816680	questo quadro noi abbiamo una produzione industriale che nel primo trimestre del 2015 sta crescendo
816680	820720	più 1,7 e ha ragione Alessandra quando vi parla delle micro imprese, quelle che sono
821480	827000	vostre, di gente che si tira sulle mani che ci prova, che non sta soltanto a lamentarsi,
827220	831980	di gente bella che ci crede, quella che ha salvato l'Italia dalla crisi e che continua
831980	837760	a portare avanti il Veneto, vai avanti all'ultima pagina, e che porta oggi ad avere nei primi
837760	846100	tre mesi 34.609 assunzioni, 9.800 stabilizzazioni, un saldo positivo di 11.900 posti di lavoro,
846100	853120	40% in Veneto di assunzioni a tempo indeterminato. Questo è stato fatto grazie alle misure del
853120	858460	Governo centrale, grazie allo sgravio della stabilità, questo è stato fatto grazie
858460	864120	alle nuove misure del Jobs Act, questo però, e abbiamo finito la parte della conferenza
864120	870420	stampa, giusto? Cambia, gira pagina, finita, vero? Questo grazie al PD, bellissimo finale
870420	877420	lungamente studiato, eravamo molto preparati come avete visto. Però tutto questo sono numeri,
878520	885540	poi ti devi mettere il cuore, ci devi mettere l'anima, perché noi guardiamo i numeri ma
885540	900400	nel suo viaggio in quanti comuni hai fatto? Le mancano i quattro comuni finali, 570 milioni
900400	916700	su 574. Non so come funziona la campagna elettorale se c'è anche un contributo per la benzina
916700	923700	voi, perché hanno girellato abbastanza, ma quando vai nei comuni le persone le vedi
923700	929280	in faccia. Chi è presenza fissa dei talk show? Io lo so bene, è la televisione importante,
929280	939720	chi però pensa che la politica sia urlare nei talk show, pensare che l'investimento sia sulla
939720	948180	paura delle persone, andare nei TG e nei talk show a dire che va tutto male, che arriveranno,
948280	953780	vi prenderanno, vi distruggeranno, che il mostro mondo non ha futuro, che si stava meglio quando
954420	961840	è molto facile in campagna elettorale farlo. Funzione? La paura è una moneta che paga,
962420	967820	in particolar modo in tempi in cui siamo rannicchiati, in cui la vita ci ha provato,
968100	975500	ma andando a giro in tutti i comuni uno incrocia le sguardi delle persone e lo sa che la lista
975500	982600	d'attesa non è una slide ma è una persona che in quel momento ha una malattia e che quella malattia
982600	989300	è la preoccupazione principale. Lo sa che i numeri della cassa integrazione, dimezzati in
989300	994880	questo anno, mi piacerebbe che ci fosse più soddisfazione anche da parte del mondo sindacale
994880	1000180	perché uno può detestare me, ma il fatto che ci sia la metà della cassa integrazione è segno
1000180	1007520	che ci sono persone che tornano a casa e possono tornare a lavorare, perché quando fai il sindaco,
1008180	1014260	quando corri per le comuni, per i 570 comuni, lo capisci che il cassa integrato non è un numero
1014260	1020180	delle tue slide, sono due occhi che ti guardano e quando a me capitava da sindaco di sentirmi dire
1020180	1026640	dalle persone io non riesco più a incrociare lo sguardo di mio figlio perché perché ho paura di
1026640	1031340	non poter provvedere a lui, ti rendi conto che c'è molto di più del principio costituzionale l'Italia
1031340	1037140	è una repubblica democratica fondata sul lavoro, c'è l'idea che un patto nelle famiglie, tra le
1037140	1042580	persone si tenga insieme accanto alla dignità del lavoro. Bene, di fronte a questo grandioso
1042580	1048860	lavoro che ha svolto Alessandra, adesso si tratta di capire che avete una settimana,
1048940	1055460	10 giorni, per scegliere i prossimi 5 anni, partono i 10 giorni che decidono i prossimi 5 anni e non
1055460	1062740	vi racconterò che giocare sulla paura non porta voti perché può darsi che porti voti giocare
1062740	1067520	sulla paura, ma io credo che ci sia una moneta che vale di più della paura, è la moneta del
1067520	1074420	coraggio perché se tu hai il coraggio di dire la verità, di offrire una strategia, di provare a
1074420	1079200	camminare insieme, puoi perdere un'elezione ma non perdi la faccia, non perdi la dignità,
1079320	1085060	non perdi la speranza, io credo che si possa persino vincere l'elezione, però c'è bisogno
1085060	1091480	di uno sforzo che non è uno sforzo del candidato, c'è bisogno di andare giorno dopo giorno, casa
1091480	1098000	per casa, porta a porta, comune per comune, a dire qual è il nostro sogno e il nostro sogno è quello
1098000	1103100	di un paese che si rimette in mosso, è quello che stiamo cercando di fare a livello nazionale con
1103100	1110380	mille limiti, in molti casi sbagliamo, potremmo fare meglio, non raccontiamoci quelli che dicevano
1110380	1116740	sono perfetto è finito il loro tempo, torneranno alla carica ma non è così, lo sappiamo che non
1116740	1122660	è così, si può sbagliare facendo politica, ma quello che è accaduto in quest'ultimo anno è che
1122660	1127500	si è totalmente rovesciato l'approccio verso la politica, prima la politica era solo chiacchiera,
1128600	1133300	nell'ultimo anno fate il conto dei provvedimenti che abbiamo approvato, alcuni magari non vi vedranno
1133300	1139840	d'accordo, ieri mi è venuto il crampo alla mano a forza di firmare i nuovi provvedimenti, la legge
1139840	1146440	sui reati ambientali per la prima volta mettiamo dentro il codice penale il principio che l'ambiente
1146440	1154200	è un valore da difendere, è un valore da difendere, e poi qualcuno dice eh ma hanno
1154200	1159420	votato anche i grillini, ma meno male, ma prego prego, venghino signori venghino, prima firma
1159420	1163760	e mettere là, ci vogliono venire anche loro, sono i benvenuti, che problemi c'è? Noi non abbiamo
1163760	1172860	paura ad accogliere altri, domani la legge sulla corruzione con l'aumento delle pene, la sostanziale
1173580	1179960	della prescrizione, l'abbiamo fatta noi, non voglio dire che da noi ci sono gli onesti
1179960	1185100	e da loro i ladri, io voglio dire che noi i ladri li mandiamo a casa, punto, questo è
1185100	1192400	il punto fondamentale, e con questa norma non sarà possibile nella prescrizione neanche
1192400	1201920	delle forme di patteggiamento che secondo me sono un po' discutibili e anche in questa
1201920	1211200	legge elettorale, il bonus bebé, la riorganizzazione dell'IRAP, la cancellazione dell'IRAP del costo
1211200	1220000	del lavoro della parte IRAP, una cosa di principio secondo me enorme, 27 anni fa e qualche giorno
1220000	1227500	il 18 di maggio, 18 di maggio, noi abbiamo ricordato il 27° anniversario della morte
1227500	1238460	di un grande italiano, si chiamava Enzo Tortora, fu ingiustamente detenuto in una vergognosa
1238460	1246160	vicenda giudiziaria, a me piace pensare che 27 anni dopo, e tutto questo è accaduto nell'ultimo
1246160	1252620	anno, abbiamo messo due leggi, ve le ho messe dopo il tema degli ecoreati della corruzione
1252620	1257940	dell'autoriciclaggio, ma sono due leggi alle quali io tengo, che sono 1 la responsabilità
1257940	1265120	civile dei magistrati, 2 la custodia cautelare, noi siamo per la giustizia ma chi opera la
1265120	1270940	giustizia deve operare per la giustizia, se sbaglia deve pagare come tutti, e allora
1270940	1276800	tutte queste cose che piano piano stiamo cercando di fare, una legge, la portata Alessandra
1276800	1281420	avanti non c'era più, so che è una discussione che divide i cattolici da non cattolici e
1281420	1284940	non soltanto, ma io credo che sia un principio serio, che è quello del divorzio breve,
1285240	1290340	nel momento in cui accetti il principio della possibilità del divorzio è naturale che
1290340	1296340	non può essere il modo per fare arricchire gli avvocati e per continuare procedure burocratiche
1296340	1301960	assurde, e potrai continuare con i temi del terzo settore, della pubblica amministrazione,
1302120	1306460	certo ci sono anche discussioni aperte sulla scuola per esempio, è aperta la discussione,
1306660	1311340	qualcuno non è contento, dovremo ascoltare sempre di più, abbiamo però messo un miliardo
1311340	1314980	di euro in più sulla scuola quest'anno per andare al prossimo anno, abbiamo detto che
1314980	1322140	ci vuole un'attenzione a chi per anni è stato precario e facendo il precario è stato frustrato
1322140	1327460	nel suo sogno di diventare insegnante, la pagina più bella, la critica più bella,
1327560	1332160	più cattiva, più feroce ma più bella che io ho ricevuto sul progetto della buona scuola
1332160	1337240	sapete di chi è? Non di un sindacalista, non di un parlamentare, non di un insegnante,
1337240	1345000	me l'ha fatta un ragazzo, si chiama Federico, a 17 anni, normalmente non vota no? Vabbè,
1345160	1351180	il prossimo anno vota Lombardo, ha detto sai che cosa c'è signor Presidente del Consiglio?
1351400	1355640	Questa riforma, me lo disse sei mesi fa, perché ora ce lo dimentichiamo, ma la consultazione
1355640	1360440	è iniziata sei mesi fa, poi i media sono arrivati dopo, ha detto sai cosa c'è? Questa
1361240	1365820	riforma è fatta bene, tante questioni eccetera, ma c'è un punto che non mi piace, e cioè
1365820	1374140	io quando vedo la scuola vorrei che il mio governo mi desse la voglia di sognare di diventare
1374140	1380820	un insegnante. Guardate che fa pensare questo, vuol dire che sognare di tornare a educare
1380820	1386700	le persone è una cosa bella, e noi abbiamo avuto decenni di precariato di TFA, di SIS,
1387020	1394840	di graduatori, che hanno distrutto anche la speranza di questi nostri aspiranti professori
1394840	1398940	e professoresse. Allora le cose si stanno facendo, però c'è bisogno, e arrivo alla
1398940	1404780	conclusione che queste cose non le facciamo soltanto noi, non le possono fare i politici,
1405400	1408680	i politici devono avere il coraggio della franchezza, mi hanno detto vieni in Veneto
1408680	1415580	non parlare di immigrazione, non si può parlare di immigrazione, voglio giocare a carte scoperte
1415580	1423940	con voi, non è possibile non avere parole chiare su questo tema, ho fatto una scelta
1423940	1431020	in questi, magari non sarà una scelta positiva per qualcuno di voi, ho scelto, dopo averne
1431020	1436200	parlato con l'abiraglio De Giorgi, che è il capo della Marina italiana, di mantenere
1436200	1441260	un impegno che mi era venuto spontaneo dal cuore il giorno della strage dei Barconi,
1441300	1445120	tra l'altro dovevo essere con Alessandra a fare un'iniziativa proprio in Veneto e
1445120	1450320	giustamente Alessandra interruppe la campagna elettorale per quel giorno, io ho scelto
1450320	1459120	di dire, allora lo dissi in un momento di impeto, ma l'ho detto ragionato avendo visto
1459120	1465860	i costi proprio ieri l'altro, che l'idea che noi possiamo far finta di non vedere
1466400	1472380	è di lasciare quel barcone dove ci sono chiusi a chiave nella stiva centinaia di corpi
1472380	1477340	tra cui donne e bambini, abbiamo visto con un robot, è andato un robottino a vedere
1477340	1481240	dove è, quindi l'abbiamo trovato, abbiamo capito quale, l'idea è che noi ci togliamo
1481240	1486940	il pensiero e facciamo finta che quelle storie, quelle persone non siano mai esistite e che
1486940	1493320	l'Europa si possa permettere di tenere a 400 metri di profondità, facendo finta di
1493320	1501140	non vedere i cadaveri di nostre sorelle e di nostri fratelli che sono morti e che sicuramente
1501140	1505160	noi abbiamo il compito e il dovere, a cui abbiamo il compito e il dovere di dare una
1505920	1510700	ecco io ho fatto una scelta, noi tireremo su quel barcone, tireremo su quel barcone
1510700	1516240	perché lo dobbiamo a quelle storie, a quelle famiglie e perché vogliamo mostrare all'Europa
1516240	1525820	che questo problema non è un problema sul quale si può chiudere gli occhi e voglio
1525820	1534880	dirlo anche qui, la nostra posizione sul tema è chiara, noi non pensiamo che si possa
1534880	1540580	trasformare l'Italia in un luogo che accoglie tutti indiscriminatamente, lo abbiamo sempre
1540580	1547240	detto, noi non pensiamo che questo sia buonismo, questo è cattivismo, non è buonismo, l'idea
1547240	1553180	di dare il principio per cui vogliamoci bene prego venghino, signori venghino non è quello
