start	end	text
0	6040	come combustibile proprio e dall'altra parte al carbone e all'orimulsion per una quantità
6040	17640	più importante in impianti assolutamente ambientalizzati. Questo è il piano generale di trasformazione,
17640	39180	poi ci sarà un aumento importante. Mi viene una battutaccia ma non so se la posso fare,
40040	44100	nel senso che ho alzato la testa pensando di vedere Letta e invece ho visto Dantonino.
56880	60660	Vedevo che la battutaccia era un'altra, che era sportiva, che lui ha vinto lo scudetto
63600	83560	per l'anno prossimo. Questo è un punto molto importante. Certo la dipendenza del petrolio
83560	90660	diceva dal petrolio dai combustibili fossili nel suo assieme, lo diceva bene il professor
90660	103620	Ranci, benissimo, ci provoca delle tensioni sui prezzi più che per altri paesi. Sono
103620	111120	d'accordo con Ranci, vedremo come è andato il 2000, ma Alberto, io posso citare solo
111120	121920	i dati italiani, dal 1996 al 1999 le tariffe elettriche sono scese del 6,3%, è poco?
122340	127240	Può essere poco. Ti faccio presente che è la diminuzione più importante di tutto il
127240	132160	sistema dei prezzi italiani, superiore a quella delle tariffe telefoniche, che sono diminuite
132160	137740	per non parlare. E' un argomento che ripeto ogni volta che riesco ad incontrare il presidente
137740	143580	dal commerce, il quale ogni volta che c'è un po' di inflazione strilla contro le tariffe
143580	147660	elettriche, le tariffe telefoniche, eccetera eccetera. Le tariffe elettriche e le tariffe
147660	154100	telefoniche sono diminuite, i prezzi al consumo nei mercati liberalizzati e pienamente concorrenziali
154100	158780	sono aumentati e continuano ad aumentare ad un tasso superiore a quello delle tariffe
158780	164640	elettriche. Quindi non siamo noi che generiamo inflazione, o noi generiamo pari del settore
164640	170380	elettrico, o comunque generiamo inflazione in misura molto ridotta e inferiore a quella
170380	178120	che generano altri sistemi produttivi. Oggi il petrolio sta a 30 dollari e tutti ci stracciamo
178120	183340	le vesti. Dimentichiamo però che abbiamo avuto il petrolio per un lungo periodo a 10 dollari
183340	191060	e che questo ha consentito per esempio all'autorità non solo di ridurre i ricavi tarifari di Enel,
191060	196440	perché peraltro, come è stato opportunamente ricordato, erano già stati decurtati di 1.200
196440	201940	miliardi dalla manovra sulle quote prezzo. Ma vado da diuvandum dire, anzi, dovremmo anche
201940	209300	ricordare che in quel biennio l'autorità ha smaltito tutto il pregresso del credito
209300	214080	di Enel nei confronti della cassa con Guagli, che ammontava a qualche migliaio di miliardi,
214080	234460	ed è stato accelerato in maniera... Grazie. Stavo ricordando che il periodo abbastanza
234460	241080	lungo di prezzi bassi del petrolio ha consentito fra l'altro lo smaltimento di un credito
241080	247920	di Enel nei confronti della cassa con Guagli e nei confronti del debito accumulato del credito
247920	252500	del debito sul nucleare, molto molto importante che oggi non viene poi fatto transitare come
252500	262240	avrebbe dovuto essere sul sistema tarifario nel suo insieme. Ora, 10 dollari era sicuramente
262240	268160	un prezzo troppo basso, 30 dollari è probabilmente un prezzo troppo alto, io credo che se il
268160	274020	prezzo del petrolio riuscisse ad attestarsi su quello che nelle previsioni, tu Alberto
274020	279500	sei consigliere dell'amministrazione dell'ENI, quello che voi considerate un prezzo giusto,
279500	288920	diciamo 20, 21, 22, 23 dollari, le variazioni ci sono, le statistiche vanno fatte sul periodo
288920	298140	un pochino più lunghi, il fatto di un sistema energetico che dipende in grado di un prezzo
298160	303340	che dipende per la parte che abbiamo detto da combustibili e fossili potrebbe anche diventare
303340	309480	in alcuni momenti un fattore di competitività o comunque di maggiore flessibilità rispetto
309480	318720	ad altri sistemi che hanno costi fissi importantissimi. Ci sono anche altre cose che occorre ricordare,
319660	327400	i nostri imprenditori, i nostri utenti finali per esempio ci fanno presente che loro potrebbero
327400	332680	utilizzare in maniera molto più ampia l'offerta di energia elettrica proveniente dall'estero
332680	338520	se il sistema di interconnessioni fosse più esteso e non vi è dubbio che oggi sul mercato
338520	345440	internazionale si trovano quote di energia elettrica a prezzi relativamente basse, ma
345440	350200	primo il sistema di interconnessione è quello che è, noi non abbiamo nulla in contrario
350200	356540	a rafforzare il sistema di interconnessione, non credo però che vadano come dire diffuse
356540	362020	o propagandate illusioni perché con i tempi che corrono vedo con molta difficoltà la
362020	368020	possibilità di realizzare nuovi elettrodotti che scavalchino le Alpi. Ingegner Macchi che
368020	371820	oggi è presidente e gestore della Rete ha fatto questo lavoro per tanti anni in Enel
371820	379540	e si ricorda, sa benissimo, è cronaca dell'altro ieri quali sudori freddi ha dovuto sudare
380160	386020	per riuscire a completare le linee di collegamento nuove che provenivano dagli altri paesi.
386020	391460	In secondo luogo credo che ci sia un fattore che nessuno prende mai in considerazione che
391460	400060	è quello della reddittività delle imprese, ed è che inonda l'Europa con energia nucleare
400060	411240	a basso costo, scusate onorevoli colleghi, ed è che inonda l'Europa con elettricità
411240	419100	a basso costo. Nella classifica delle grandi imprese mondiali produtrici e distributrici
419100	425360	di energia elettrica risulta per fatturato e per kilowattora venduti al primo posto,
425440	432820	è la più grande azienda del mondo. Le aziende classificate sono venti ed EF risulta al
432820	439120	diciannovesimo posto per reddittività sul capitale investito e sul proprio patrimonio netto.
439120	445320	In altri termini questo vuol dire che se EF dovesse rifornirsi di capitali sul mercato
445320	451480	privato anziché all'interno del sistema sussidiato francese non troverebbe a quelle condizioni
451480	459700	un investitore disposto a mettere i propri soldi nel capitale di EF. Questa è la situazione.
459740	466000	Noi del nostro 11% di ritorno sul fatturato siamo orgogliosi, è uno degli obiettivi
466000	470000	che non so se tanto o se poco. Certamente è allineato con le imprese internazionali
470660	475880	sotto le migliori imprese internazionali e ha fatto sì che oggi Enel sia un'azienda
476800	482260	finalmente, forse per la prima volta dalla storia della nazionalizzazione che partì
482260	488220	senza fondo di dotazione, patrimonialmente solida e in grado di attrare capitali sul
488220	494100	mercato internazionale. Questa è un'altra delle grandi differenze che dobbiamo mettere
494100	503620	in campo. Vengo ad alcune questioni, ancora un punto per quanto riguarda invece il processo
503620	509560	di liberalizzazione che ripeto secondo me ha caratteri di equilibrio e di coraggio importanti
509560	514660	e che dobbiamo attuare. Certamente un punto delicato, anche questo non è la prima volta
514660	521420	che lo dico, è invece quello che io chiamo il groviglio istituzionale. Il groviglio istituzionale
522060	528320	offerta da una parte, domanda dall'altra, al centro c'è un sistema di smissioni della
528320	532080	capacità produttiva, al centro c'è un sistema fatto dal gestore della rete, l'operatore
532080	538420	di mercato e l'acquirente unico che è un sistema complesso, decisivo per le sorti future
539300	545840	del sistema elettrico, probabilmente un po' ridondante, sono d'accordo con te Alberto
545840	552880	l'acquirente unico è sopravvissuto più come ideologia della prima impostazione della
552880	559180	riforma che come necessità effettiva, su questo sono in disaccordo con Carosi. Ecco,
559200	563900	ma qui le imprese e l'autorità possono fare poco, questa è una questione sulla quale
563900	571060	si deve esercitare con molta forza e con molta decisione il ministero dell'industria perché
571060	577800	fare andare a regime questo sistema ci consente di avere la borsa dell'energia elettrica
577800	585060	e ci consente di avere un software generale del sistema competitivo adeguato alle necessità.
586160	601040	Vengo ad alcune questioni rapidamente sollevate invece da Carosi per quanto riguarda i problemi
601040	607220	sono diminuiti e stanno diminuendo e continueranno a diminuire.
613780	618720	E che devo dirvi ragazzi, ma non capisco cosa c'è, l'ha detto Carosi nella relazione, conoscete
618720	623040	tutti i numeri, sono tutti esposti e annunciati pubblicamente, non sto mica facendo un annuncio,
623480	627040	no? Volete che vi dica il contrario così stiamo più allegri e più tranquilli poi andiamo
627040	634040	insieme e siamo felici e contenti. Il problema è capire...
638700	642780	Eh mi pare che ci sono tanti azionisti dell'ener qui, no? Avete comprato le azioni?
646420	652040	Vai su, si sta scherzando ragazzi, me lo sto provocando. No, lo dico perché sicuramente
652040	658400	avete letto il prospetto per il collocamento in borsa di Enel in cui questi dati erano
658400	665640	tutti contenuti. Non c'è nessuna novità, sto dicendo delle cose scontate. Il problema
667820	672840	è, il caso si dice, ma sono tanti o sono pochi? E oggi c'è solo uno strumento per misurare
672840	676940	se sono tanti o sono pochi, che è quello di guardare che cosa fanno le altre imprese,
676940	682280	quelle con cui ti devi confrontare, fare il cosiddetto, parolaccia inglese che avete
682280	688740	sentito ripetere in Enel 1500 volte, il cosiddetto benchmarking. E allora ci sono imprese ancora
688740	696180	oggi in Europa, per esempio le imprese spagnole citate da Chloe, le quali hanno la produttività
696180	701560	dentro Enel per addetti, per kilowattora venduti, per cliente eccetera eccetera è aumentata
701560	705240	e questo è un contributo che abbiamo dato all'azienda tutti insieme, ma ci sono aziende
705240	711320	che stanno ancora molto meglio di noi, che hanno indici di produttività molto importanti.
711660	716180	E su questo voi sapete meglio di me, che lo sapete meglio di me, perché poi vi siete
716180	719000	comportati coerentemente in tutti questi anni.
733420	740340	Perché in questo modo noi continuiamo a produrre ricchezza per l'azienda e a mantenere comunque
740340	762140	decine di migliaia di posti di lavoro. Contemporaneamente però c'è una cosa che dobbiamo dire, che
762140	770180	in Enel, salvo per qualche voce dal sen sfuggita, non sono mai state usate tre parole che ho
770180	776160	visto invece abbondantemente usare in altre aziende, cassa integrazione, mobilità, piano
776160	781320	di smaltimento degli esuberi strumenti straordinari eccetera eccetera, stiamo facendo tutto con
781320	786820	gli strumenti ordinari, non dico in accordo ma in costante relazione con le organizzazioni
787800	793020	senza tensioni sociali e con la condivisione di molti di coloro che hanno deciso di prendere
793020	798800	un'altra strada e questo mi sembra un risultato importante per la stabilità e l'equilibrio
798800	809140	delle nostre relazioni. Su un punto voglio dire una cosa, poi inviterò Carosi nell'ufficio
809140	816800	per guardare insieme i dati, a me non risulta che ci sia stato in Enel un aumento dell'incidentalità
816800	823920	da lavoro, il numero degli incidenti assoluti tende a diminuire, c'è stato tra il 98 e
823920	829080	il 99 una leggera modifica della percentuale di incidenti per milioni di ore lavorate,
829140	836320	l'indice è passato da 12,53 a 13,30 è una modificazione quasi impercettibile che riguarda
836320	843500	prevalentemente piccoli incidenti nelle aree impiegatizie di diciamo scarso significato
843500	851140	per quanto riguarda l'incolumità e la salute dei lavoratori. Infine una parola per quanto
852360	862400	riguarda il contratto, sono d'accordo con Carosi che bisogna accelerare, stiamo però
862400	869820	facendo una modifica, stiamo per quanto un'impostazione che ha caratteristiche strutturalmente nuove,
869820	876800	stiamo cercando di passare dai tre contratti precedenti, municipalizzate Enel e privati,
876960	883080	ad un contratto unico di settore, cosa assolutamente necessaria sia per eliminare spericuazioni
883080	887920	sia soprattutto assolutamente necessaria nel momento in cui finiscono i regimi giuridici
887920	898300	separati di queste tre categorie di aziende. Quindi l'importanza dell'impresa ha forse
898300	908540	complicato l'iter procedurale, ma per quanto ci riguarda come Carosi ben sa abbiamo l'intenzione
908540	916660	e la volontà migliore di concludere al più presto questo processo, non solo ma non abbiamo
916660	921720	nessuna intenzione all'interno di questo processo del contratto unico, lo dico con molta chiarezza,
921720	928020	di cercare improbabili o assurde rivincite nei confronti delle organizzazioni sindacali.
928140	933860	Anzi, io penso che il sistema delle relazioni sindacali, che io considero positivo, al di
933860	938300	là di qualche alto e basso che dubbiamente c'è stato, qualche volta forse anche per
938300	944420	responsabilità nostra, ma il sistema delle relazioni sindacali, che è tradizione e storia
944420	949720	dell'industria elettrica e che porta fondamentalmente ad una condivisione sui destini dell'impresa
949960	955960	debba restare uno dei cardini di questo nuovo contratto. Vi ringrazio.
966240	979940	Ringraziamo il Presidente Testa. Salutiamo, come avete visto, li avete già salutati con
979940	986300	i nostri lavori. Diamo la parola prima di passare poi al Ministro dell'Industria e le
986300	991840	conclusioni all'ingegner Capra, Presidente della SM di Brescia.
1007320	1013440	Forse va bene. Grazie per l'invito, è molto caldo. E anche per le relazioni che ho apprezzate
1013440	1017700	tutte a cominciare da quelle del relatore di base Carosi.
