start	end	text
0	6220	Vi ringrazio dell'attenzione e invito il Ministro dell'Industria e Comercio Estro in
6220	9220	Nicoletta per il suo intervento.
25040	31840	Ringrazio il Presidente Ziche, era un impegno che avevo preso quando sono venuto a Vicenza,
31860	38640	l'ho voluto rispettare e anzi a maggior ragione, perché sono giorni difficili nei quali l'ascolto
38640	44540	è uno degli elementi essenziali delle scelte che si devono fare. Il prossimo DPF sarà
44540	54860	un DPF nel quale le scelte di quest'anno e le scelte dell'anno prossimo dovranno trovare
54860	61360	una concretizzazione che sia una concretizzazione legata molto alle parole che abbiamo sentito
61360	68740	o almeno questo è l'impegno, la volontà, le scelte che vogliamo assumerci. Le parole
68740	75360	in questi anni ne abbiamo dette, ne abbiamo sentite molte, io credo che in questa occasione
75360	83840	almeno da parte mia sia necessario soprattutto soffermarmi su poche fatti, su poche considerazioni
83840	90980	che siano legate soprattutto a quest'appuntamento. Il problema competitività, che è il problema
90980	97140	più grosso del nostro Paese, del nostro sistema imprenditoriale, è un problema che necessita
98320	105720	di scelte da parte delle istituzioni, da parte del Governo nazionale, da parte del sistema
105720	112540	delle autonomie, che siano delle scelte in cui l'obiettivo competitività rappresenti
112540	123780	la priorità. Cito tre che sembrano a me essere i punti sui quali è possibile nei prossimi
123780	131000	mesi, nelle prossime settimane e cito soprattutto i punti ovviamente sui quali posso parlare
131000	137960	sapendo di scelte delle quali poi anche personalmente verrò giudicato, perché sono le scelte legate
137960	143680	alle competenze che mi sono state affidate, credo che possiamo fare i maggiori passi in
143680	151720	avanti. Il primo punto, noi abbiamo bisogno di correre più degli altri Paesi europei
151720	157760	e degli altri Paesi occidentali sulla strada delle liberalizzazioni. Abbiamo fatto dei
158640	165320	passi, abbiamo impostato delle liberalizzazioni, devono essere completate, dobbiamo mettere
165320	171780	dei punti di non ritorno essenziali in liberalizzazioni che sono la condizione perché il sistema
171780	177760	imprenditoriale riesca a sviluppare al massimo le proprie capacità di generare ricchezza
177760	184920	e di generare benessere e occupazione. Le liberalizzazioni soprattutto nei settori
184920	191960	nei quali più ingessato in questi anni è stato il nostro sistema. Parlo soprattutto
191960	196340	delle liberalizzazioni nelle quali siamo maggiormente impegnati in questo periodo,
196440	201860	liberalizzazione dei settori dell'energia per esempio. Se io dovessi dire quale secondo
201860	208140	me è uno dei problemi più grossi della difficoltà di competitività che abbiamo rispetto agli
208140	212700	altri Paesi europei, sicuramente quello dei costi dell'energia, quello di un aggravio
212700	219720	di costi di energia rispetto ai nostri concorrenti della stessa area dell'Euro. Questo rappresenta
219720	226320	sicuramente uno dei punti critici. Credo che noi dobbiamo applicare su liberalizzazioni
226320	234600	di settori complessi, difficili, l'energia elettrica, il gas, la distribuzione dei prodotti
235460	242440	petroliferi, il commercio. Dobbiamo applicare delle scelte che sono delle scelte molto più
242440	246600	coraggiosi di quelle che hanno fatto altri Paesi europei, di quelle che possono permettersi
246600	254620	di fare altri Paesi europei. Questa è la settimana in cui chiudiamo il percorso decisionale
254620	261280	sulla liberalizzazione del mercato del gas. Questi sono i giorni nei quali proveremo a
261280	267560	mettere i punti di non ritorno sull'accelerazione della liberalizzazione elettrica. Tutti i temi
267560	272640	essenziali per essere in condizioni di dare alle nostre imprese un ambiente che sia un
272890	283410	ambiente in cui si possa produrre a costi che siano costi più bassi, a costi competitivi.
285570	292670	Il secondo punto, abbiamo un problema di istituzioni. Il Presidente Zicche ne ha parlato prima con
292670	298650	molto coraggio, un coraggio che ho apprezzato molto. Un problema di istituzioni legato a
298650	305490	trasformazioni che fanno sì che le cose dell'economia vadano più veloce di quanto
305490	312470	le cose dell'istituzione e della politica riescano a star dietro. Abbiamo tutti ben presente
312470	320410	il fatto che oggi la necessità più profonda è quella di un passaggio di poteri dal livello
320410	328630	nazionale sopra e sotto. Abbiamo tutti fortissima la sensazione che l'economia non può essere
329650	336650	che questi passaggi fanno parte delle condizioni perché il nostro Paese possa riacquistare
337870	343650	e far crescere la propria competitività. Ovviamente la consapevolezza è una cosa,
343690	350710	poi la capacità di mettere in pratica è un'altra. Se dovessi indicare gli obiettivi
350710	358630	prioritari da questo punto di vista, questi sono sicuramente sopra verso l'Unione Europea
358650	364170	il fatto che lo spostamento di competenze verso Bruxelles non rappresenti un meccanismo
364170	370350	nel quale le competenze crescono, salgono ma poi si disperdono. Noi dobbiamo essere
370350	376310	in grado di costruire un sistema Paese che sappia a Bruxelles rappresentare quelli che
376310	381790	giustamente dobbiamo definire come interessi nazionali attraverso un sistema di concertazioni
381790	388170	tra i diversi attori che rappresentano l'Italia che sia efficace, che faccia sì che le decisioni
388170	393330	che vengono prese lì siano decisioni rispetto alle quali le peculiarità e le specificità
393330	401290	degli interessi del nostro Paese non ci vedano impegnati a considerarle come importanti soltanto
401290	405090	nel momento in cui dobbiamo applicare nel nostro ordinamento nazionale queste decisioni
405090	411150	una volta che magari sono state già prese. È necessario da questo punto di vista uno
411150	418150	sforzo di fare sistema Paese complesso, complicato, ma nel quale dobbiamo vederci tutti i nostri
418170	424550	impegnati, tutti coloro che rappresentano il Paese nelle diverse istituzioni europee,
424810	431950	nel Consiglio Europeo, nel Parlamento Europeo, nel Comitato delle Regioni. Credo che questo
431950	437190	sia uno degli obiettivi che ci fa essere più forti e che sicuramente fa sì che i nostri
437190	443510	interessi siano meglio tutelati, ma dobbiamo essere più forti nell'essere in grado di
443560	450700	far sì che le decisioni vengano prese il più vicino possibili a dove queste decisioni
450700	456540	servono. Il Ministero dell'Industria da questo punto di vista in questi mesi sta cercando
456540	463160	di fare di tutto, di fare di tutto perché in prospettiva, lo dico come una provocazione,
463900	468200	quindi prendetela come tale, ma per farvi capire lo spirito con cui stiamo cercando di
469010	475890	lavorare. Il problema del perché negli Stati Uniti non esiste, nell'articolazione di Governo
475890	482670	degli Stati Uniti non esiste un Ministero dell'Industria ci veda pronti a dare questa
482670	489390	domanda che sia una risposta efficace, perché un'azione di governo nazionale su questi
489390	494750	temi deve essere un'azione che si libera dagli aspetti di gestione, dagli aspetti di intervento
495610	503410	diretto nell'economia e che riesce invece a lasciarsi un'azione di strategie e un'azione
503410	509330	di internazionalizzazione che solo con la regia di un governo nazionale degli strumenti
509330	514330	che il governo nazionale può avere, può mettere in campo si può svolgere in modo efficace.
514630	524350	Ecco perché in queste ultime settimane il passaggio alle regioni di una prima tranche
524750	532510	di competenza e di finanziamenti, io ho girato un assegno di 680 miliardi di incentivi alle
532510	539390	imprese che le regioni dovranno gestire da questo anno finanziario in poi, è nelle nostre
540130	547090	intenzioni una prima tappa, una tappa che consenta di far sì che questo legame tra
547090	553110	le politiche di sostegno alle imprese e le imprese stesse sia un legame che avvenne il
553110	558230	più vicino possibile alle imprese e soprattutto una scelta, una serie di scelte che consentano
558230	565190	al governo nazionale di ritagliarsi un ruolo, una strategia che sia una strategia moderna
565790	575730	che un governo nazionale può e deve mettere in campo. Terzo, noi dobbiamo con coraggio
575730	581830	fare dei passi importanti sul terreno della net economy, dobbiamo farlo perché crediamo
581830	587450	che attorno a questi temi la discontinuità, e io condivido pienamente le parole che il
587450	592710	presidente Zige diceva prima, sia una discontinuità che non passa tra new e old, che non passa
592710	599910	tra ciò che si tocca e ciò che non si tocca, la discontinuità passa tra chi è nel futuro
599910	610770	e chi nel futuro non ha intenzione di esserci, tra chi decide di usare e di applicare le
610770	614830	dire Barbie著 gamer con lacontinuo su tutta la filiera del sistema produttivo i se stri
615990	624110	uated di non farlo. Qui un ruolo della istituzione pubblica è essenziale, è un ruolo di incitamento,
624110	635690	un ruolo di premiare le best practices, o un ne Cheryl o altri Protect individuals應該
635690	642630	il sistema delle piccole e medie imprese di cui l'Italia è modello nel mondo, possa
642630	648910	essere modello anche nel momento di questa discontinuità, una discontinuità che a questi
648910	653290	livelli probabilmente non si è mai realizzata nell'aspetto tecnologico. In fondo, la cosa
653290	658370	che colpisce di più nella Net Economy è che, mentre eravamo abituati a pensare che le macchine
658370	664930	cambiavano il lavoro, ma nel senso di come lo cambiavano nel film di Charlie Chaplin,
664930	671810	in tempi moderni, e cioè che per fare una cosa con le macchine serviva basta una persona
671810	676690	che aziona una macchina e senza le macchine sono necessari un numero maggiore di persone.
676990	683130	La Net Economy cambia nel senso che non è questo il punto essenziale. La Net Economy
683130	689490	cambia soprattutto il lavoro della classe dirigente, cambia soprattutto il lavoro di chi dirige,
689490	695870	di chi fa strategia, di chi comanda l'impresa. Questo è un cambiamento che necessita di
695870	704030	una fortissima discontinuità anche culturale. Questo è un cambiamento che necessita di
704030	710110	una volontà di voler essere modello anche da questo punto di vista. Noi avremo, e concludo
710110	716150	ringraziandovi per l'invito, avremo a giugno questo grande appuntamento che vedrà l'Italia
716150	721790	protagonista, a Bologna la conferenza dei ministri dell'industria e dell'OXE, i 50
721790	727350	ministri dell'industria e dell'OXE dei Paesi in via di sviluppo insieme a 50 delegazioni
728490	733890	imprenditoriali che discuteranno di piccole e medie imprese e sfide della globalizzazione.
734550	740110	È stata scelta l'Italia per questo appuntamento così fondamentale proprio perché, così
740110	747650	come noi siamo stati il modello della piccola e media impresa, da tutto il mondo ci viene
748290	754590	rivolto uno sguardo per capire come noi supereremo, come noi proporremo di superare questo passaggio
754590	759430	di discontinuità. Qui veramente c'è una sfida alta, una sfida che vede il sistema Paese
759430	765910	e il suo mondo imprenditoriale in prima linea. Credo che sarà un appuntamento che ci vedrà
765910	772250	tutti insieme a rispondere a questa sfida. Sarà una sfida che io credo che ci darà
772250	778710	le condizioni di capire quali sono i modelli di sviluppo sui quali muoversi nel modo più
778710	784370	efficace possibile. Grazie.
792210	805670	Ringrazio il Ministro del suo intervento. Aggiungo incoraggiante e speriamo che la velocità
805670	813430	che noi abbiamo dichiarato prima essere diversa dalla nostra si accorci e che tutti i provvedimenti
813430	820150	che noi ripetutamente chiediamo da tempo vengano realizzati. A questo punto chiamo
820150	830390	il Presidente di ICON Intermatrix, Gadi Shenaid, ad esporci i risultati della sua ricerca.
