start	end	text
0	6340	dall'affetto di questa sera, per me dire di sì a fare la lista unica e andare insieme
6340	29980	alle europee mi viene dal fatto che lo dico banalmente e non è retorica, mi sento qui
29980	37600	è successa Massimo D'Alema quando è venuto dieci giorni fa, quindici giorni fa a Lerici
37600	42480	ed è venuto alla festa della Margherita, c'era il popolo della Margherita, il popolo
42480	56860	della Margherita non l'ha fatto andar via dagli applausi. Questo è il vero senso, lo spiego
56860	62860	in due parole di più e anche il motivo per il quale io credo fortemente a questa proposta,
63200	68080	credo che noi dobbiamo far sì che questa proposta diventi realtà, non dobbiamo perdere
68080	75360	troppo tempo nelle decisioni perché si è già visto che la proposta della lista unica
75360	86320	appena dall'altra parte hanno capito che era una roba un po' seria, hanno cominciato a
86320	92180	fare rispetto a questa vicenda. A me ricorda la cosa forse migliore che abbiamo fatto
92180	99480	negli ultimi mesi ed è stata la vicenda della candidatura di Riccardo Illi a Presidente
99480	110440	del Friuli Venezia Giulia. Perché mi ricorda quella cosa? Perché in Friuli dove il centrodestra
110440	117200	alle elezioni politiche ha preso 27 seggi contro i tre del centrosinistra, questo per
117200	123540	capirci sul fatto che se hanno vinto loro vincerete anche voi qui, perché se hanno
123540	130340	vinto in Friuli è possibilissimo che si riesca a intercettare l'opinione pubblica di questo
130340	134760	Paese dopo due anni di governo Berlusconi e riuscire a rovesciarla e a rovesciarla in
134760	140200	modo significativo e non in modo astratto. Lì perché sono riusciti a vincere? Perché
140200	147240	hanno individuato per tempo una proposta unitaria che ha avuto una figura, una persona
147240	153780	fisica e nel momento nel quale dall'altra parte hanno visto l'unità della nostra coalizione
153780	159700	si sono sfasciati immediatamente. Questo per dire che alle volte questa è la precondizione,
160520	167620	la lista unitaria, che senso ha come la vedo io, come la vediamo noi? È ovvio che la Margherita
167620	176780	sta discutendo come gli altri partiti. Vengo da due giorni di discussioni accese, accanite,
178040	182600	ma sono molto contento che la prima tappa di queste discussioni ha portato a far sì
182600	191240	che ieri sera è arrivata un via libera sostanziale. A larga maggioranza ci sarà l'assemblea della
191240	198220	Margherita che si svolgerà a ottobre, decideremo lì. Se posso dire come la vedo e come prevedo
198220	205620	le cose io credo che il consenso attorno a questa proposta non soltanto c'è, è un consenso
205620	211860	entusiasta, è un consenso che sta crescendo e soprattutto se c'è bisogno di qualche giorno
211860	217180	di tempo in più per arrivare a una decisione il motivo secondo me è un motivo legato al
217180	222960	fatto che è una proposta molto complessa e molto importante, ma soprattutto, permettetemi
222960	229460	di dire, lo dico anche rispetto a tutti coloro che ci devono essere dentro, io vorrei che
229460	237600	in questa lista noi non compissimo errori del passato, cioè dobbiamo far sì che ci
237600	244460	sia il maggior numero di amici dell'ulivo dentro. Se quindi i nostri partiti nelle loro
244460	250400	discussioni fossero dei partiti che cominciano in modo tranchant a dire chi c'è c'è chi
250400	256880	non c'è non c'è subito, secondo me la politica è fatta di intelligenza, di pazienza, io vorrei,
256920	262340	lo dico molto sinceramente, che ci fossero tutti della Margherita e qualcosa di più
264500	271620	e quindi se c'è bisogno di un giorno in più per convincere tutti, sono convinto che alla
271620	280160	stata più utile per tutti. Credo che sia importante, lo dico per rispondere alla questione,
280200	288440	per non essere evasivo sul tema che è un tema partito unico, lista unica, non sono
288440	293780	questioni, sono questioni decisive e soprattutto sono questioni sulle quali noi non decidiamo
293780	301600	tra una bottiglia di champagne e l'altra, noi su queste decisioni, siccome siamo l'ulivo
301600	308080	per fatto di milioni di cittadini italiani e sono loro, siamo noi che decidiamo, sono
308080	316200	decisioni che hanno bisogno di questa partecipazione corale, la proposta di Prodi, la fatta Prodi
316200	325080	in quanto Presidente della Commissione Europea ed è una proposta che ha la sua forza nel
325080	332180	fatto che è una proposta legata all'Europa. Lo dico perché quello che sta accadendo in
332180	337160	questi giorni ci fa capire quanto su questa vicenda si gioca il nostro futuro. Guardate,
337400	344920	l'Europa si sta sfasciando, l'Europa si sta sfasciando tra le sue difficoltà e si sta
344920	350640	sfasciando perché non riesce a gestire i processi complessi di allargamento, di approfondimento
350640	356640	in una logica che non sia frenante e perché, diciamo la verità, le leadership europee
356640	364780	in questo periodo non sono le leadership illuminate di 10 anni fa. 10 anni fa, io sono un nostalgico,
365020	371900	Mitterrand e Kohl hanno fatto un'Europa che guardava lontano. Oggi abbiamo delle leadership
371900	377300	europee che a partire da chi oggi sta presidendo il Consiglio Europeo, cioè il nostro capo
377500	384520	del governo, guardano alle vicende europee con fastidio o al massimo l'obiettivo è
384520	392760	quello di una grandissima manifestazione pubblica nella quale far firmare, tra quelli di Trompa,
392920	398840	Canti di Bocelli, Cactus, la Costituzione Europea e Spiega era gli italiani che l'hanno
400260	406200	fatta. Allora, il punto qual è? Prodi, in questi giorni, la Commissione, altri paesi
406200	412040	europei, una fetta importante di mondo politico e culturale a livello europeo, sta alzando
412040	417620	il tiro, sta dicendo non va la discussione sulla Costituzione Europea, così non va,
417740	423160	c'è bisogno di più, c'è bisogno di fare dei passi avanti in più e l'Italia è il
423160	429400	Paese che ha più bisogno di questo. Una riflessione su questo punto perché sennò non capiamo
429400	434500	l'importanza del perché la lista unica, però, della proposta sull'Europa. Perché se non
434700	440060	c'è in Europa, in questo momento, una svolta, se non diamo ognuno di noi un contributo a
440060	446840	che l'Europa non vada a finire come Berlusconi, Tremonti, Bossi e altri la stanno portando,
449140	454500	vi cito due esempi, due esempi banali così anticipo alcune delle discussioni sulle quali
454500	460460	vogliamo intrattenerci questa sera. Noi veniamo, e guardate che sui giornali italiani trovare
460460	466220	queste cose è difficile sulla televisione impossibile, noi veniamo da un weekend nel
466220	473300	quale sono arrivati due ceffoni, due ceffoni all'Europa e all'Italia che non ce ne rendiamo
473300	480420	conto adesso bene di cosa vogliono dire. Due ceffoni che se ci fosse un'Europa più forte,
480800	489480	non ci sarebbero stati, due decisioni che avrebbero portato risultati diverse. Ci sono
489480	496940	deciso tra di loro quali sono i corridoi, cioè le direttrici, le infrastrutture europee
496940	501700	sulle quali investire e hanno deciso che la cosa più importante è investire sulla direttrice
501700	507760	che va da Parigi a Strasburgo, Francoforte e i francesi hanno detto che in fondo quella
507760	513620	è più importante piuttosto che passare dal Lione, andare a Torino, Milano e tutto il
513620	519620	resto. Una decisione di questo genere che voi trovate nelle brevi dei giornali italiani
519620	526640	di ieri e di oggi taglia fuori l'Italia per i prossimi trent'anni dalle direttrici di
526640	534920	sviluppo europea. Su questi temi non possono essere due paesi a decidere, deve essere l'Europa
534920	540080	a decidere e guardate che questo lo dico anche se in questo momento mi sarebbe facile dire
540080	552920	che l'Europa è l'Europa. Io faccio parte, io sono iscritto allo stesso partito socialista
552920	565160	europeo al quale è iscritto Tony Blair e io sono uno che non rinego questa appartenenza,
565680	571940	però se devo pensare che stare in un partito nasce da una comunanza di identità ci sono
571940	575460	più ragioni per fare un partito con lui che per farlo con Tony Blair allo stato delle
575460	581080	cose. Allora ne approfitto subito e passiamo il microfono a letta che ci spiega perché
581080	587660	la Margherita ha come obiezione principale di fronte a questa prospettiva anche del partito
587660	595140	riformista questo disagio al pensiero di appartenere al partito socialista europeo.
595160	601860	Cioè quello stesso albeo al quale faceva riferimento adesso. Danema, questo è un elemento forte
601860	607800	che è uscito nella discussione vostra interna ed è un elemento irrisolto. Lo spiego in
607800	614440	un minuto perché l'Europa politica oggi è un'Europa nella quale siamo miopi se non
614440	622840	ci rendiamo conto che tutte le famiglie politiche sono in crisi. Lo dico francamente, la famiglia
622840	629220	politica dalla quale provengo io è una casa in fiamme, il partito popolare europeo che
629220	636200	è stato fondato da chi ha voluto l'Europa ha avuto un virus e questo virus ha completamente
637480	644400	distrutto il corpo e questo virus si sta diffondendo è un virus che si chiama destra conservatrice
645080	652820	che si è unita alle posizioni cristiano democratiche e poi è arrivato Berlusconi con tutto il
652840	658680	quello che è. Quella è una casa in fiamme, è una casa infatti che l'europeismo non
658680	665860	sa più cos'è, oggi sono lì quelli che stanno frenando sull'Europa. Però onestamente
666480	671620	non si può dire che oggi il partito socialista europeo sia un partito di successo in Europa
672980	673540	...
684460	692140	...prospera uno che era il nipotino di Franco, adesso non voglio ma Hasnar è il suo partito,
692140	697720	un partito che proviene da quella storia lì, se prospera in quella continuità vuol dire
697720	704260	che la sinistra in Spagna, la sinistra socialista è incapace di dare una risposta forte. La
704260	710400	stessa cosa in fondo è capitata in Francia, in Gran Bretagna le difficoltà di Blair ieri
710400	717140	ha perso quella suppletiva dimostrando in un collegio che la difficoltà c'è in Germania,
717160	723240	se non c'era Fischer, Schroeder e i social democratici tedeschi probabilmente perdevano
723240	730700	le elezioni. Quello che voglio dire è rivendico, con orgoglio, perché noi tante volte siamo
730700	740380	provinciali e esterofili, che è l'unica novità a livello europeo, importante e vincente nel
741940	753780	sinistra e nel centro sinistra, è avvenuta con l'ulivo in Italia. Se le due cose sono
753780	761000	vere, cioè una difficoltà della sinistra europea, oggettiva data dalla difficoltà
761000	767520	nei diversi Paesi e questa che è stata una grande novità che ci ha consentito finché
767520	773620	l'abbiamo fatta di governare, l'abbiamo perso, rivinceremo e rigoverneremo, io credo che
773620	780680	questo sia il tema su quale discutere e far discutere in Europa. Io sono convinto che
780680	787920	noi ai nostri amici europei dobbiamo spiegare che in Europa e anche negli altri Paesi si
787920	795940	vince con il modello ulivo, lo dico molto banalmente, ma sono convinto che questo tipo di evoluzione
795940	801480	è l'evoluzione che potrà far vincere la sinistra a livello europeo.
801580	807400	Cos'è successo nel resto d'Europa e nel Parlamento europeo? È successo che il Partito Popolare
807400	813700	Europeo se n'è fregato della sua storia, dell'attaccamento ai suoi valori e ha semplicemente
813700	819920	aperto la porta a tutti quelli che non erano socialisti, ha imbarcato tutti, cioè dentro
819920	824000	il Partito Popolare Europeo c'è di tutto, c'è di tutto, è ovvio che poi è un partito
824000	830300	che non ha più nessuna identità. Il problema è che con questo metodo alle prossime elezioni
830300	838100	europee questa roba rischia di essere molto molto molto superiore nel Parlamento europeo.
838360	842960	Allora noi dobbiamo riuscire a smontare questa vicenda, non dobbiamo essere difensivi ed
842960	848900	ecco perché io sono convinto che dobbiamo con forza dire in Europa il modello vincente
848900	854880	è quello dell'Ulivo, ovviamente non dobbiamo soltanto dirlo ma dobbiamo applicarlo in
854880	860160	Italia e applicarlo bene perché è vincente se vince le elezioni, perché se le perde
860160	864820	poi non è più nemmeno ovviamente vincente e questa è la proposta che dobbiamo fare
864820	871900	in Europa. Ecco perché io lego le due vicende, elezione europea, lista unica che alla fine
872460	878540	poi si la chiameremo forse in un altro modo ma è la lista dell'Ulivo e io sono convinto
878540	884720	che la vittoria di questo processo sarà importantissima non soltanto perché noi daremo
884720	890380	lì la spallata vera al governo Berlusconi ma sarà importantissima perché faremo svoltare
890380	895960	una vicenda europea che ha visto la sinistra nell'angolo in questi anni, ha visto noi nell'angolo
895960	905480	in questi anni e ha visto prosperare le destre. L'egoismo scandinavo o è una sensata difesa
905480	911380	di un modello di welfare, di un modello sociale che altrimenti alle condizioni attuali entrando
911380	918280	nell'Euro potrebbe correre dei rischi molto seri. Io parlavo qualche giorno fa con un
918860	927540	mio amico svedese e un po' ingenuamente sgranavo gli occhi rispetto a questo risultato che
927540	935360	sembra così incredibile ma come? Con tutto quello rimanete fuori, il ragionamento che
935360	943640	mi faceva mi ha colpito. Il ragionamento che mi faceva è dove dobbiamo entrare? Dobbiamo
943640	952380	entrare dentro un'area che in questo momento ha al contrario di noi che siamo fuori dall'Euro
952380	958780	cioè Svezia e Gran Bretagna, questo per venire anche alle vicende poi inglesi. Dobbiamo
958780	964780	entrare dentro un'area che vede Francia, Germania e Italia che insieme fanno l'80%
964780	969820	di questa area che hanno la crescita a zero perché Francia, Germania e Italia sono a
969820	977740	crescita a zero. Il deficit esplode, nessuno di questi paesi riesce a trovare il bandolo
977740	984800	della matassa. L'Italia in più rispetto a tutte queste difficoltà c'ha il debito pubblico
984800	989880	che tutti sappiamo e quindi le difficoltà che abbiamo noi sono moltiplicate rispetto
989880	995020	a quei degli altri paesi e mentre gli altri hanno provato e stanno provando a fare delle
995820	1003280	riforme, Schröder ha lanciato l'agenda 2010 per lo sviluppo del suo paese. L'Italia l'unica
1003280	1008040	cosa che riesce a fare è fare il condono edilizio, questa è l'unica tipo di riforma
1008040	1015480	che il governo propone per il rilancio dell'economia del mattone, diciamo così, perché immagino
1016400	1022900	che vediate anche voi uno strano movimento di nuove costruzioni che nascono dovunque,
1022900	1030540	garage, eccetera, questo perché purtroppo quello che capita a Siracusa con l'alluvione
1030540	1036700	che trascina giù tutti, quello che è capitato con il terremoto in Molise che ha fatto, tirato
1036700	1043560	giù costruzioni in gran parte fatte in modo non corretto rispetto alle normative antisismiche
1043880	1049940	eccetera, continua a non spiegare niente, ma insomma il primo problema è questo, perché
1049940	1056640	l'Europa non cresce? Se l'Europa non cresce è ovvio che diventa una cosa assolutamente
1056640	1061340	non attrattiva, se poi facciamo sì che l'Euro faccia crescere solo i prezzi come è accaduto
1061340	1073700	nel nostro paese è evidente che noi stiamo costruendo alla rovescia un percorso che invece
1073700	1081900	l'Estezia è il paese, lo dico da cattolico, da chi pensa che nel nostro paese, paese
1082680	1089000	di tradizione cattolica, per i 50 anni della storia repubblicana che abbiamo alle spalle
1089000	1097140	ancora oggi tranne i tentativi e i cambiamenti fatti durante i nostri governi dalle riforme
1097140	1104780	di Livia Turco e di Rosi Bindi, noi ci troviamo in una situazione in cui l'Italia, paese
1104780	1110840	cattolico per eccellenza, paese latino, paese che faceva figlie, tutto quello che sappiamo
1110840	1119040	è alla crescita a zero anche dal punto di vista demografico e la Svezia, paese che consideravamo
1119040	1126960	il paese del libertinaggio a suo tempo, è un paese che ha trovato il giusto mix di politiche
1126960	1134960	sociali e di sviluppo per essere un paese che ha un futuro demografico. Guardate che
1134960	1140320	il problema forse più importante è questo, se noi non capiamo che il nostro welfare dobbiamo
1140320	1147420	rinnovarlo per dare un futuro al nostro paese, un futuro vuol dire riuscire a far sì che
1147420	1152440	i ragazzi e le ragazze di oggi, quelli della mia età, quando si mettono insieme non si
1152730	1161870	trovino a dover dire il figlio vedremo o non si trovino a dover dire soltanto per decidere
1161870	1166750	di fare un figlio che l'unica condizione perché lo si faccia è avere quattro nonni
1167470	1171930	sessantenni che siano in condizioni di tenerlo, perché guardate che questo non è un welfare,
1172250	1182710	questo è qualcosa che non va da questo punto di vista, mi ha colpito una battuta che ha
1183610	1190630	inglese a Londra, quindi un personaggio per noi che diceva, perché non investite in Italia?
1190730	1196230	E lui diceva molto semplice, perché non investo in Italia, io investo in Spagna, perché la
1196230	1202350	Spagna ci sarà crisi anche lì e tutto, ma la Spagna ha un aspetto fondamentale, in Spagna
1202350	1208010	si parla spagnolo, uno dirà vabbè è ovvio, no non è ovvio perché lo spagnolo è parlato
1208010	1213850	in metà del mondo praticamente e quindi investire in Spagna diceva lui vuol dire creare
1213850	1218090	le condizioni per cui ogni prodotto che io faccio scritto in spagnolo, quello stesso
1218090	1225250	prodotto ha un mercato mondiale enorme, investo in Germania perché la Germania è un paese
1225250	1230710	larghissimo e dalla Germania poi vado nei paesi dell'est, perché non investo in Italia?
1231110	1236370	Perché voi siete un paese che ha una popolazione che parla una lingua che parlate soltanto
1237010	1242750	2, perché siete un paese che non fa più figli, quindi un paese che vuole cercare di
1242750	1248570	star bene, volete cercare di star bene tra di voi ma non guardate il futuro, 3, siete
1248570	1254290	un paese che parlate soltanto la vostra lingua, che non fate figli quindi non volete il futuro,
1254770	1261150	3, non volete nemmeno gli immigrati, pensate di avere un futuro in questo senso, sarete
1261150	1271490	un paese che fra qualche anno di 40 milioni di abitanti e poi ancora più giù, questo
1271490	1275970	è il modello di chi governa oggi, guardate se mi chiedete di dire in una parola qual
1275970	1282590	è la differenza vera tra noi e il centrodestra? Io non ho dubbi, la differenza vera tra noi
1282590	1291050	e il centrodestra è questa, noi non pensiamo di risolvere i nostri problemi di oggi mettendo
1291050	1298250	un'ipoteca sul futuro dei nostri figli, come sta facendo il centrodestra, guardando esclusivamente
1298250	1304730	all'oggi e alla migliore redistribuzione tra di loro di ciò che oggi c'è, a noi quello
1304730	1310570	che interessa di più è il futuro del nostro paese e il futuro dei nostri figli, questa
1310570	1316210	è una politica per quale vale la pena oggi battersi, mi rendo conto che se oggi diciamo
1316210	1324510	queste cose in giro, queste sono cose che fanno fremere noi, ma lei è una domanda a risposta
1324510	1335590	impossibile questa, la dico subito, io dico come la penso io, penso questo, che noi nel
1335590	1343830	2001 per una serie di motivi di cui è ovvio, io ero in quel periodo avevo delle responsabilità
1343830	1348710	quindi sono il primo che si carica questa responsabilità sulle spalle, non le voglio
1348710	1356090	dare ad altri, non abbiamo, non siamo stati in grado di dare all'ulivo e alla proposta
1356090	1364410	di governo che abbiamo fatto, quella capacità di dare agli italiani, agli italiani che intraprendono,
1364750	1371710	che non sono solo, che non sono i vecchi padroni appunto dell'industria del 900 perché ormai
1371800	1376960	sappiamo tutti che l'economia è totalmente diversa, gli italiani che intraprendono sono
1377620	1383720	milioni, sono piccoli, sono grandi, sono medi, noi non siamo stati in grado di parlare
1383720	1391960	a questi italiani che intraprendono, che rischiano in proprio, che sono tanti, non siamo stati
1391960	1396980	in grado di dare a questi italiani l'idea che lo sviluppo che proponevamo era uno sviluppo
1396980	1401960	incredibile e migliore di quello di Berlusconi, non siamo stati in grado di spiegare nemmeno
1401960	1409940	quello che abbiamo fatto bene, D'Alema non lo dice fino in fondo perché ne è stato
1409940	1419700	lui protagonista, quindi lo dico io, ma noi abbiamo fatto fronte nel 99, nel 2000 alla
1420540	1426960	crescita di inflazione più pesante della storia recente del nostro Paese, attenzione perché
1426960	1434080	oggi giustamente mettiamo l'attenzione sul tema dell'Euro e giustamente le difficoltà
1434080	1440200	che ognuno di noi ha rispetto alla sua vita personale, rispetto alla crescita dei prezzi,
1440420	1445840	il legame eccetera, ma l'inflazione del 99 e del 2000 ricordiamoci fu dovuta al fatto
1445840	1451600	che il prezzo del petrolio per motivi internazionali e sui quali nessuno di noi poteva farci niente
1451600	1461660	è cresciuto in 18 mesi da 8 dollari al barile a 35 dollari al barile, siccome l'Italia,
1462040	1467220	il petrolio a differenza degli altri Paesi europei per motivi storici sui quali non voglio
1467220	1472920	entrare qui, il petrolio non lo usa solamente per mettere nella macchina e per andare in
1472920	1477700	giro per strada, ma il petrolio lo usa sostanzialmente per fare energia elettrica, tutta l'energia
1477800	1485440	elettrica o meglio il 65% dell'energia elettrica che noi usiamo è fatta col petrolio, per
1485440	1491220	capirci questa percentuale in Francia, in Germania e in Spagna non supera il 10%, che vuol dire
1491220	1498020	che quando il petrolio sale dall'8 dollari a 35 dollari a noi ci carica due volte rispetto
1498020	1503720	agli altri. Quando rispetto a questa crisi, che era una crisi rispetto a quella non avrei
1503800	1508900	dubbio che Tremonti sarebbe andato in televisione accusando gli Arabi, così come rispetto
1508900	1515960	agli ultimi giorni ha spiegato che la colpa era tutta dei cinesi. Noi abbiamo semplicemente
1515960	1521980	il governo d'Alema affrontò il tema, lo affrontò attraverso un pacchetto di misure complessive,
1522160	1527800	misure anche coraggiose, non so se ci ricordiamo sulle assicurazioni cosa successe, quindi
1527800	1533140	misure difficili, complesse, però insomma quelle misure hanno fatto sì che nonostante
1533140	1541460	quello che ho detto sul prezzo del petrolio, noi abbiamo lasciato nel 2001 questo paese,
1541880	1547560	questo governo del paese l'abbiamo lasciato con, non dico le cifre assolute, perché le
1547560	1554940	cifre assolute ormai non servono più, dico il paragone con la media europea e dico com'è
1554940	1561400	la situazione oggi, due cifre semplici. Abbiamo lasciato un paese con un'inflazione, vado
1561400	1567860	più in là di quello che diceva d'Alema, che per la prima volta nella storia italiana
1568540	1577440	era un punto percentuale sotto la media europea, non siamo stati capaci di dire questo agli
1577440	1582960	italiani, lo diciamo adesso che non ci serve a niente dircelo, ma è così, nel giugno
1582960	1588880	del 2001 noi abbiamo lasciato il paese con un'inflazione che era un punto percentuale
1588880	1597140	sotto la media europea. Oggi due anni di governo Berlusconi, non di Euro, hanno portato l'inflazione
1597140	1603660	italiana 0,8 punti percentuali sopra la media europea, cioè vuol dire che in due anni ci
1603660	1612040	siamo mangiati 1,8 di inflazione rispetto alla media europea e non sul 10% di inflazione,
1612900	1618560	ma sull'inflazione del 2% io credo che ognuno di noi fa i suoi conti e capisce che cosa
1618560	1625340	vuol dire. La crescita, noi abbiamo lasciato il governo di questo paese con una crescita
1625340	1634440	italiana che era 0,2% meno della media europea, quindi eravamo sostanzialmente sulla media
1634440	1645880	europea. Oggi nelle mani di Berlusconi e di Tremonti la crescita del nostro paese è un
1645880	1652140	po' più. Poi il resto non mi interessa, queste sono le cifre. Allora rispetto a queste cose,
1653260	1659920	gli imprenditori di questo paese, se lo Confindustria lo farà bene, se non lo farà credo che sarà
1659920	1665100	torto suo perché alla fine perderà credibilità nei confronti dei tanti imprenditori che ci
1665100	1669860	sono e che non sono i padroni delle ferriere, gente che rischia improprio ed è gente alla
1669860	1674100	quale noi dobbiamo parlare, dobbiamo chiedere il loro consenso perché dobbiamo aiutarli
1674100	1679520	a fare sviluppo perché lo sviluppo serve a tutti noi. Allora di fronte a una cosa di
1679520	1685760	questo genere l'unica cosa seria che un imprenditore che ha votato per Berlusconi dovrebbe essere
1685760	1694300	quella di mettersi un po' di cenere sul capo e di dire a se stesso ho creduto al gatto
1694300	1702040	e alla volpe. Io non so se vi ricordate la cosa forse più amara di tutta la storia di
1702040	1708580	Pinocchio è quando il gatto e la volpe spiegano a Pinocchio che se lui mette la moneta d'oro
1708580	1714380	sotto terra poi nasce nella notte un albero e quest'albero è pieno di monete d'oro. Qualunque
1714380	1719440	imprenditore serio sa che se lui mette la sua moneta per terra e l'annaffia poi il giorno
