start	end	text
1719440	1724340	dopo non è che viene l'albero da quale pendono tutte le monete d'oro e se ha creduto a uno
1724340	1729900	che gli ha proposto questo faccia una serie analisi di coscienza. Noi facciamo la nostra,
1729900	1735700	non siamo stati abbastanza in grado di spiegare quello che abbiamo fatto e forse non abbiamo
1735700	1741300	fatto intravedere bene il futuro di sviluppo al quale pensavamo. Sono convinto che abbiamo
1741300	1746160	imparato la lezione e sono convinto che in vista delle prossime lezioni fatemi dire
1746160	1751720	sommessamente che se c'è una cosa che è cambiata nell'economia mondiale non sono
1751720	1758320	i cambiamenti, le quantità dei cambiamenti, ma i tempi nei quali questi avvengono. Le
1758320	1763300	cose cambiano in modo tale che in sei mesi se non ti sei adeguato a un certo cambiamento
1764520	1771920	sei fuori, ma non per colpa di noi consumatori, perché siamo noi i primi a cambiare, a prendere
1771920	1786240	un'altra cosa perché costa meno e perché la qualità è di un certo tipo. Allora se
1786240	1792620	questo è vero fatemi dire che non siamo i primi a cambiare, a prendere un'altra
1792620	1796940	cosa perché costa meno e perché la qualità è di un certo tipo. Se questo è vero fatemi
1796940	1797200	dire.
