start	end	text
0	8700	Non è che erano attaccati all'Europa, all'italiano, era attaccato a un altro concetto che entrando
8700	14460	in Europa e adottando l'Euro si sarebbero risolte tutti i mali di questo Paese.
14680	20540	In realtà questo non è accaduto, non è accaduto e oggi non voglio dire che c'è una disaffezione
20540	26080	per l'Europa, anzi dobbiamo fare in maniera tale che questa non avvenga, ma certo la gente
26080	27120	è rimasta delusa.
27280	32960	L'Europa non è una parola o un distintivo, l'Europa è un qualcosa che la gente pensa
32960	38140	va meglio per me, va meglio per i miei figli, va meglio per i miei nipoti, trovo un problema
38140	39240	che mi...
39240	45820	Questo poi si è accomunato alla crisi mondiale dopo l'11 settembre, a una crisi mondiale
45820	51440	e ha portato a questa situazione, quindi ci sono degli errori iniziali e degli errori
51500	56740	attuali che riguardano un po', certamente non riguardano il colore politico di chi li
56740	59320	ha fatti, sono errori che si sono commesse.
59920	65040	Ecco, sugli errori io genererei una parola, allora avevo letta che, se non ricordo male,
65160	71320	in un libro molto brillante scritto qualche tempo fa spiegava che Europa sì, ci conviene,
71480	76920	l'euro non tocca sana ma sicuramente voleva importante un vincolo esterno, cosa ce dovrebbero
76920	80320	essere più virtuosi, sei ancora in quale idea?
83780	92340	Io nell'idea di Mirta Merlino devo fare l'euroentusiasta, quindi farò la mia parte anche
92340	101540	perché ne sono convinto, non per un ruolo prestabilito, ne sono convinto perché io
101540	108440	penso questo, che la globalizzazione come la stiamo conoscendo oggi è arrivata, ha fatto
108440	112840	irruzione nella seconda metà degli anni 90 nella nostra vita, nella vita dell'economia
112840	119340	del mondo, se nel momento nel quale arrivava la globalizzazione avessimo dovuto dire come
119880	127220	il modo più efficace col quale noi, piccoli paesi europei, possiamo resistere a un sistema
127220	137780	rispetto al quale arriva la Cina, arriva l'India, paesi che oggi hanno dentro di loro cinque
139000	147120	volte la quantità di ricchi che ha l'Italia, la Cina e l'India che noi guardiamo sempre
147120	153580	come paesi di secondaria o di basso livello direi, sono cinque Italia dal punto di vista
153580	162900	del reddito pro capita, 250 milioni di cinesi e indiani che sono ricchi come noi, arrivano
162900	170240	prepotentemente nel mercato, nel mercato globale, gli Stati Uniti ripartono, qual è il modo
170240	177220	col quale noi europei ce la facciamo? La risposta a mio avviso è una sola, mettendoci insieme,
177360	183280	cercando di metterci insieme non solo come mercato ma cercando di avere anche un unico
183280	189680	strumento monetario che diventi nel mondo uno strumento monetario che sia al pari della
189680	196000	nostra capacità commerciale, l'Europa è un gigante commerciale, l'Europa è importante
196000	203180	per la sua industria, l'Europa ma io credo che abbiamo avuto la fortuna che prima che
203180	208480	partisse la globalizzazione come la stiamo conoscendo adesso gli europei hanno deciso
208480	214880	di farla questa moneta che è partita nel 1991-1992, è stata una fortuna perché partendo
214880	220420	per tempo noi ci siamo trovati nel 2001 ad averla concretamente utilizzabile, ripeto
220420	225400	se oggi ragionassimo di globalizzazione e dicessimo di cosa abbiamo bisogno noi piccoli
225400	230860	Stati Europei di fronte alla grande Cina, alla grande India, non ho dubbi avremo bisogno
230860	236800	di una moneta, di una moneta comune, di un unico mercato, di un'unica capacità commerciale.
237720	245120	Il problema di tutte queste vicende è che, i problemi sono due, il primo è che una volta
245120	252520	fatta la moneta a mio avviso bisognava e bisogna essere conseguenti, qual è il problema che
252520	259840	oggi fa sorridere molti quando si parla dell'Euro come strumento per battere la Cina e l'India,
260020	265500	è che è successo esattamente all'inverso, nel senso che l'Euro è talmente cresciuto
265500	271960	come forza rispetto al dollaro, che oggi per i nostri esportatori un Euro che è improvvisamente
271960	277740	diventato così forte è diventato quasi un handicap, perché così forte non è in grado
277740	283480	di reggere la concorrenza con un dollaro che invece è esattamente all'opposto e noi ci
283480	289700	troviamo in una situazione per cui la concorrenza degli indiani la viviamo con una moneta troppo
289740	296240	forte, noi italiani poi per noi è una novità assoluta ovviamente e quindi risentiamo ancora
296240	302580	di più di questa difficoltà. Il punto è che è colpa dell'Euro, secondo me è colpa
302580	308040	del poco Europa che abbiamo fatto attorno all'Euro, perché se accanto all'Euro non
308040	314660	facciamo una politica economica, una politica europea che siamo in grado di bilanciare le
314660	321700	proprie vicende, c'è bisogno di un Euro forte? C'è una politica che riesce a rendere
321700	326300	l'Euro forte, ma in un momento come questo c'è bisogno di un Euro più debole e non
326300	331580	c'è nessuno strumento politico, perché c'è poca Europa che renda possibile avere l'Euro
332180	336580	debole. Credo che il nostro problema oggi sia soprattutto questa contraddizione tra
336580	342240	l'aver fatto il massimo di integrazione sul piano monetario e un'integrazione a mezzo
342240	347620	sul piano politico, sul piano del resto delle vicende economiche, per cui siamo con questo
347620	354480	Euro ormai fortissimo che va a viaggio e poi con il problema serio di renderlo compatibile
354480	361000	con l'esigenza che oggi abbiamo. Io credo che per l'Italia sia stato, se mettiamo in
361000	365880	fila tutte le vicende che hanno a che fare con l'Euro, un grande vantaggio e che dobbiamo
365880	372880	gestire oggi intelligentemente. Il problema è che noi italiani siamo pigri e quando abbiamo
373400	380440	bisogno di fare degli sforzi clamorosi abbiamo bisogno o di essere fuori dai campionati mondiali
380440	388180	di calcio al novantesimo e allora ci inventiamo il gol al novantunesimo, oppure abbiamo bisogno
388180	395860	di essere vicino sul burrone, sul ciglio del burrone delle esclusioni. Allora tradizionale
396560	401780	tiriamo fuori il massimo delle nostre, se non avessimo avuto quella rincorsa da fare,
402100	407140	quella rincorsa così calcistica in fondo, fuori o dentro e non ci sono vie di mezzo,
407520	412860	ho l'impressione che il debito pubblico non sarebbe sceso, il deficit oggi non sarebbe
412860	418460	comunque sotto il 3% come lo è, i tassi di interesse non sarebbero bassi, l'inflazione
418460	423760	non sarebbe tutto sommato un'inflazione di cui discutiamo di 0 virgola. Noi ricordiamoci
423760	429800	quando c'era quella riunione di Valencia di cui parlava in modo molto opportuno Cesare
429800	437020	Romiti prima, quella riunione di Valencia accadde quando in Italia l'inflazione era
437020	443460	tre volte quella di oggi, quando in Italia il deficit era quattro volte quello di oggi
443460	448740	e il debito pubblico non aveva ancora realizzato quella discesa importante che ha realizzato
448740	454380	oggi. Uno può dire che c'è proprio bisogno di stare così attenti a questi criteri, sono
454380	461720	così importanti, forse 10 anni fa, 20 anni fa no, oggi con la globalizzazione sì, perché
461720	465920	oggi noi non siamo chiusi nel nostro mondo, per cui i debiti ce li facciamo tra di noi
466460	471620	e abbiamo risolto i problemi, siamo noi debitori e creditori di noi stessi, siamo a posto e
471620	476320	no dentro un mercato ormai globalizzato non possiamo essere in una situazione in cui
476320	482420	abbiamo il debito che è il 120% della nostra capacità di produrre ricchezza o il deficit
482420	488900	che è ogni anno come era l'8 e il 9% della nostra capacità di produrre ricchezza, sono
488900	494820	cose che portano al collasso. Prima in una situazione in cui eravamo tutti un po' chiusi
494820	500240	potevamo permetterci perché i debiti erano tra di noi e allora tutto sommato, oggi no
500240	504940	secondo me non potevamo nemmeno permetterci di prima, oggi no e allora è concludo su
507380	515800	questo quella rincorsa è stato un modo virtuoso, è stato appunto un po' il modello campionati
515800	520880	del mondo di calcio fuori al novantesimo, alla fine ce l'abbiamo fatta, se non avessimo
520880	527100	avuto quello stimolo per la nostra atavica pigrizia forse non ce l'avremmo fatta, così
527100	534420	ce l'abbiamo fatta e oggi godiamo di quei privilegi, lo dico perché se oggi noi giustamente
534420	539100	guardiamo i lati negativi ma guardiamo anche i lati positivi, se oggi abbiamo una situazione
539100	544120	di stabilità, se oggi siamo in grado di reggere alla vicenda Parmalat in una situazione in
544120	550680	cui tutto sommato non crolliamo come è crollata l'Argentina sulla vicenda dei Bond e se
552520	559260	oggi siamo in grado di comprare il denaro a poco, a fare dei mutui, io ricordo sempre
559260	565540	a me stesso che oggi si fanno i mutui a un terzo di quello che si faceva soltanto otto
565540	572620	anni fa, un terzo, un terzo, questo è dovuto esclusivamente a questi aspetti qui, dopodiché
572620	579720	abbiamo due problemi oggi che dobbiamo affrontare però io vorrei dei governanti che si assumono
579720	585400	le responsabilità che hanno, chi ha governato prima si assume le sue responsabilità, chi
585400	589520	si candida al governare si assume le sue responsabilità ma chi sta al governo non può essere governo
589520	593760	e opposizione allo stesso tempo, chi sta al governo è governo, allora i due problemi sono
593760	599480	come facciamo in modo che ci siano politiche europee che rendano l'euro, il valore dell'euro
599480	606520	più funzionale all'economia, alle esportazioni e non totalmente scisso come adesso che in
606700	610920	una situazione come questa abbiamo un euro fortissimo e grossi problemi e in secondo
610920	621320	luogo come potevamo fare per rendere l'euro non un elemento che nel nostro Paese ha aiutato
621320	626940	le tendenze furbe a aggiungere aumento di prezzi che hanno portato l'inflazione così alta,
627460	632580	Romiti faceva riferimento prima a esempi fatti da altri Paesi, io e lui condividiamo
632580	637880	grande amore per la Spagna, Paese che non a caso non ha avuto quei picchi di crescita
637880	644360	dei prezzi, perché? Anche perché ha fatto un'azione di monitoraggio attentissima nel
644360	649340	momento di passaggio, ha usato i soldi della pubblicità a progresso, non come li usiamo
649340	654900	noi ma li ha usati per mettere a paragone i prezzi, all'inizio quello che oggi propone
654900	659380	Tremonti ma loro l'hanno fatto quando ha cambiato la moneta, oggi sinceramente...
661060	667120	Padozchiopa che diceva, il declino di questo Paese andando fuori dalle coleniche immediate,
667160	672800	il declino colpa di Berlusconi, esatto, sì sì, no il declino italiano c'è Padozchiopa,
673000	676360	andando fuori dalle coleniche Berlusconi e non Berlusconi è un declino che è cominciato
676840	682940	moltissimo tempo fa, Padozchiopa lo colloca più o meno all'inizio degli anni 90 e siccome
682940	689780	l'abbiamo investito se non sui vincoli esterni, fare l'euro ma non sulle risorse, la ricerca,
689860	694500	l'innovazione, i giovani, la capacità produttiva forte, l'innovazione di prodotti non sono
694500	700080	quelle di processo, allora questo declino ce lo trasciniamo e siamo noi marginali rispetto
700080	705780	alla stessa Europa, dunque non solo euro se il declino è così e se Padozchiopa ha ragione
705780	711640	ma anche molto di più. Io concordo, non si può non concordare in questa
711640	716720	diagno di Padozchiopa, ripartiamo sempre qui lo sviluppo, lo sviluppo è fatto di tante
716720	724820	cose, per sviluppare un paese ci sono quindi la ricerca, gli investimenti, ma qui manca
724820	730740	uno dei punti principali, ricordiamoci che la Germania che è stata quella che ha voluto
730740	736860	soprattutto lei questo problema del mantenimento dei prezzi, che la banca si occupasse del
736860	742520	prezzo e non ci occupasse della banca centrale e non ci occupasse dello sviluppo, la Germania
742520	747760	è in crisi, oggi è in crisi e non riesce a sviluppare e non rispetta i parametri che
747760	754480	ce l'avamo dati, quindi siamo in una situazione in cui non si può continuare a litigare o
754480	759660	a batibeccare l'un con l'altro all'interno dei paesi e all'interno dell'Europa, andrebbe
759660	765460	visto un qualche cosa, io vi dico con molta sincerità, io avrei visto molto più volentieri
766200	772420	fare uno sforzo di tutti i paesi europei per arrivare a questi equilibri nuovi che ancora
772420	778620	non ci sono piuttosto che consumarci in un sforzo che poi non sia raggiunto quello della
778620	782680	Costituzione Europea, è prioriario l'altro rispetto alla Costituzione.
784860	789800	Dette una sola frase, come si costruisce una politica economica europea?
792620	800560	Noi dobbiamo secondo me dare una risposta a una domanda molto difficile, la domanda è questa
800560	806920	Noi pensiamo che di fronte alla Cina e all'India, scusate se torno lì, l'industria
806920	814320	manufacturiera italiana e l'industria manufacturiera europea abbia un futuro, se pensiamo che abbia
814320	819340	un futuro, pensiamo che questo futuro vada indirizzato in una direzione in un'altra
819340	822360	o pensiamo che si possa andare per forza di inerzia?
824440	831920	Io vi cito un dato che a me ha colpito molto, stiamo facendo un viaggio nei distretti industriali
832640	839440	in questo mese insieme a Pierluisi Persani, siamo stati Ministri dell'Industria, uno
839440	845480	è seguito all'altro e abbiamo deciso in questo mese e mezzo di incontrare gli operatori
845480	850960	nei diversi distretti industriali italiani, tra i distretti 24 tappe, ieri eravamo a Como,
851100	856940	a Biella, tra le varie tappe ci siamo fermati a Sassuolo dove fanno la ceramica, la più
856940	867500	bella ceramica del mondo e soprattutto l'Italia è leader nella ceramica, 550 milioni di metri
867500	875060	quadrati di ceramica, di mattonelle prodotte nel 2001 dall'Italia, la Spagna seconda 400
875620	885500	milioni, la Cina terza 200 milioni, nel 2003 ci hanno dato i dati ultimi, l'Italia con
885500	894040	un grande sforzo è passata da 550 a 595 milioni di metri quadrati di mattonelle, la Spagna
894040	900560	anche ha accelerato, è passata da 400 a 430 milioni di metri quadrati di mattonelle e
900560	908480	anche la Cina ha accelerato, è passata da 200 milioni a 2 miliardi. Cito queste cose
908480	915420	perché dialogare su questi temi con Cesare Romiti è facile, perché Cesare Romiti è
915420	922480	uno degli imprenditori italiani che ha capito per primo che oggi il nostro tema principale
922480	928720	è come ci rapportiamo a questo colosso che è entrato nel mercato mondiale, lui è presidente
928720	934440	da qualche anno di questa associazione che cura i rapporti con la Cina e noi abbiamo un
934440	940220	problema perché, vedete ritorno alla questione delle mattonelle, scusatemi se sono, se parlo
940220	950820	di cose terra terra, allora noi eravamo leader nelle mattonelle, guardate questo discorso
950820	959900	potrei farlo per altre questioni, ieri a Como ci occupavamo di arredamento, il legno
959900	966740	e noi abbiamo ancora la leadership in termini di fatturato della nostra industria di arredamento,
967200	976600	la Cina oggi nel 2003 ci ha superato in termini di chili, di quantità di mobili prodotti,
976600	981300	per non parlare del fatto che è arrivata l'IKEA e tutti sappiamo che cosa questo vuol
981300	985260	dire per la nostra industria di arredamento, ma al di là dell'IKEA, allora qual è il
985260	990120	concetto essenziale? Il concetto essenziale è che questi cambiamenti sono avvenuti in
990120	998680	24 mesi, cioè la Cina è passata da 200 milioni a 2 miliardi in 24 mesi, 24 mesi vuol dire
998680	1006580	che o noi la nostra industria della mattonella reagisce rapidamente e cerca di spostare il
1007120	1013000	suo, la sua produzione, le sue forme, i modi, sceglie, oppure nel giro di poco tempo siamo
1013000	1019280	fuori e non siamo fuori perché sono cattivi cinesi, siamo fuori per noi consumatori, per
1019280	1027220	noi consumatori, io vorrei che ognuno di noi pensasse ai suoi comportamenti da consumatore
1027760	1036580	quando uno c'ha da arredare il monoloquiale, il monoloquiale, il monoloquiale, la città
1036600	1041120	è il monoloquiale che il figlio ha affittato per andare a fare la università fuori sede
1041120	1047800	e deve mettere rapidamente delle cose, insomma, senza spenderci tanto, va a vedere se c'è
1047800	1053440	scritto Made in China o se c'è scritto Made in Italy, facciamo ognuno l'esame di come
1053440	1062780	si comporta da consumatore, allora il punto è o noi capiamo che soldi pubblici, parlo
1062780	1068180	per questo caso rispetto alle funzioni che la politica può svolgere, che soldi pubblici
1068180	1075480	dati, torno all'esempio delle mattonelle, all'imprenditore che fa mattonelle di bassa
1077720	1085640	qualità sulle quali la concorrenza del cinese è clamorosamente superiore alla nostra,
1085800	1090600	nel senso che bassa qualità anche la loro ma il costo è sicuramente inferiore al loro,
1091240	1096320	dare soldi pubblici, incentivi pubblici attraverso leggi di incentivazione indifferenziate che
1096320	1102940	danno soldi pubblici a tutti, a mio avviso vuol dire scegliere di far morire inerzialmente
1102940	1107000	la nostra industria manufacturiera, qual è il nostro futuro in quel settore? Noi abbiamo
1107000	1112120	un'unica possibilità, i cinesi ci fanno concorrenza fino a circa, non lo so se sbaglio
1112120	1118760	Dottor Romiti, fino a circa il 60-70% del livello qualitativo delle nostre cose, sopra
1118760	1133880	in quella fascia alta non ci arrivano. Ancora, ancora. Allora il punto è o noi spostiamo
1133880	1139160	la nostra produzione di ceramiche, torno alla mattonella, quasi esclusivamente su
1139160	1145040	quel settore alto oppure quella parte bassa la perderemo comunque e io credo che questo
1145040	1150040	vuol dire fare scelta di politica industriale e questo vale per l'Italia ma vale per l'Europa,
1150160	1156380	il che vuol dire investimenti selettivi, incentivi selettivi, solo chi immette elementi di innovazione,
1156640	1162880	pensate ai tessuti, il tessile, il tessile di bassa qualità a mio avviso tanto vale
1162880	1169660	che lo molliamo subito, è inutile, guardate è inutile mettere soldi, è inutile il tessile
1169660	1176760	di bassa qualità, noi dobbiamo lavorare sulla innovazione di prodotto, di processo, ci sono
1176760	1181340	molti margini per innovare da questo punto di vista e lì possiamo essere eccellenza
1181340	1188040	ma c'è bisogno di imprenditori lungimiranti che si spostino su quel settore, che lavorino
1188040	1195280	sul marchio, sul brand e di una politica pubblica italiana ed europea che lavori perché tutto
1195280	1201120	questo non muoie, guardate che abbiamo veramente di fronte un bivio, il bivio è tra la Gran
1201120	1210040	Bretagna degli anni 80 e fare una grande Disneyland archeologica dell'Italia, mi spiego, negli
1210040	1214920	anni 80 la Gran Bretagna fece una scelta, aveva la più grande industria manifatturale del
1214920	1220620	mondo, la chiuse, perché scelse di diventare il più grande polo finanziario del mondo,
1221060	1224860	hanno fatto questa scelta e hanno vinto perché oggi Londra è la capitale finanziaria del
1224860	1230320	mondo e la Gran Bretagna è il paese europeo di gran lunga che corre di più, hanno fatto
1230320	1234280	una scelta dei costi sociali alti ma l'hanno fatta questa scelta, hanno scelto di fare
1234280	1241780	ciò nel quale potevano eccellere, il nostro rischio è che noi non facciamo niente per
1241780	1248820	modificare il nostro modulo produttivo, i cinesi e gli indiani ci mangeranno, inerzialmente
1248820	1253600	usciamo dall'industria manifatturale senza aver scelto e se uno esce senza aver scelto
1253600	1258140	la mia impressione, scusatemi la battuta, è che gli rimane quello che ha, cos'è che
1258140	1265160	abbiamo? Siamo il più grande patrimonio archeologico del mondo, io scusatemi ma l'idea che l'Italia
1265160	1270340	perché non fa le scelte drastiche dovute per riuscire a dare un futuro alla propria
1270340	1276020	industria e un futuro soltanto attraverso scelte nette può arrivare, che diventi una
1276020	1282360	grande Disneyland archeologica nella quale tutto il mondo viene a vedere le nostre bellezze
1282360	1288440	e noi produciamo quello, io ho l'impressione che sia una scelta un po' inerziale, nella
1288440	1293420	quale soltanto perché siamo nati in questa terra e chi è venuto prima di noi in questa
1293420	1299160	terra, in queste terre ha fatto quello che ha fatto, possiamo immaginare di vivere, di
1299160	1303580	vivere bene, io non credo che questa sia una scelta lungimirante e questo guardate vale
1304100	1308400	per l'Europa dello stesso modo, leggetevi quello che dicono i francesi di loro stessi
1308400	1328580	in questo periodo, un paese in difficoltà, un paese che sa quello che non fa, molto molto
1328580	1338380	drastici nelle scelte, molto netti, ci sono alcuni paesi che io apprezzo molto, la Gran
1338380	1342300	Italia, che hanno perseguito quelle scelte e le hanno portate avanti, sono paesi che
1342300	1347020	però hanno nei confronti dell'Europa questo atteggiamento per cui prendono più che dare,
1347420	1352320	invece dell'Europa bisogna starci dentro, prendere e dare, cercare di renderla un qualcosa
1352320	1358120	di unitario che dia un futuro alla nostra industria se vogliamo e crediamo che la nostra
1358120	1364020	inventiva possa avere ancora da dire molto nel mondo, io credo che questo sia in fondo
1364020	1368440	la cosa più importante da fare, grazie al fatto che abbiamo anche la moneta, che in
1368440	1371660	questo ci aiuta se facciamo le cose che abbiamo appena detto
1379640	1386340	Però anche un non farcela, lo stesso vertice di Bo Caraton l'altro giorno si conclude
1386340	1392160	con una dichiarazione generica di intento di buona volontà nel tenere il dollaro un po'
1392160	1396980	meno debole e l'euro un po' meno forte, ma di là della buona volontà non si va,
1397220	1402600	però questo miraggio dell'ordine economico monetario internazionale, continuare a essere
1402600	1406500	un miraggio si possono fare o fossero già fatti dei passi avanti, lei che ne pensa?
1407080	1413580	Passi avanti se ne possono certamente fare, lei ha citato proprio la conferenza di pochi
1413580	1420440	giorni o sono in Florida, io voglio ricordare questo fatto che il dollaro oggi è molto
1420440	1428140	debole, la moneta cinese segue il dollaro e vanno d'accordo perfettamente alla faccia
1428140	1437000	dell'Europa, alla faccia degli altri, l'America si fa la sua politica e si entra in pipa delle
1437000	1444300	difficoltà in cui si trova l'Europa e l'Europa non reagisce e l'Europa continua a accettare
1444300	1450040	questa situazione senza neanche lamentarsi, lamentarsi non serve a niente ma senza neanche
1450040	1457260	lamentarsi, allora il discorso di, teniamo presente che oggi i più grandi sottoscrittori
1457260	1462900	di buoni del tesoro americani sono proprio i cinesi, un tempo erano i giapponesi e oggi
1462900	1470040	sono i cinesi e gli americani, l'America se li tiene molto cari, cioè noi da questi giochi
1470580	1475400	l'Europa nel suo complesso proprio perché non è un'Europa unita, perché continuiamo
1475400	1480640	a fare questo, ma fare questo siamo tirati fuori, quindi oggi come oggi è ancora un
1480640	1487700	miraggio e io mi augurerei che l'Europa a un certo momento riuscisse, non so quanto avendo
1487700	1493240	la Gran Bretagna dentro politiche del genere ci riuscirebbero perché la Gran Bretagna poi
1493240	1499000	è sempre più proiettata al di là dell'Atlantico che non al di qua della Manica, quindi non
1499000	1505200	so quanto riuscirebbe, ma l'Europa dovrebbe essere un pochino più ferma, due paesi europei
1505200	1511000	che dividiamo, chi striscia ai piedi dell'America, chi considera l'America la peggiore agliatura,
1512140	1518220	ma facciamo una politica comune, è un grave guai, quindi miraggio no, ancora è un miraggio.
1520620	1528500	Io penso che sia veramente un miraggio, è molto lontano ed è lontano perché noi vediamo
1528500	1535700	quanto è difficile che le monete tra di loro abbiano dei rapporti di forze utili,
1536840	1542500	sono rapporti di forza, gli americani prima della campagna elettorale terranno il dollaro
1542500	1549500	come piace di più alle loro imprese, hanno un rapporto di forza che gli consente coi
1549500	1555420	cinesi di avere una migliore capacità di consonanza, a chi ci rimette siamo noi europei,
1555420	1561420	se a questo aggiungiamo che le istituzioni finanziarie non riescono a tenere un uomo
1561420	1567160	politico molto attento a queste cose, proprio perché possa spronare anche l'attuale maggioranza
1567160	1572860	su un pericolo che sta avvenendo e di cui se ne parla solo perché ci sono gli scioperi.
1573100	1578160	Noi abbiamo perso in questo Paese tantissimi settori industriali, abbiamo perso di fatto
1578160	1584560	l'elettronica, abbiamo perso la chimica, abbiamo perso... stiamo perdendo un altro settore
1584560	1589860	industriale che è quello del trasportaereo, non è che qui siamo di fronte a una crisi
1589860	1595560	di un'azienda che si chiama l'Italia, stiamo di fronte alla perdita di un settore importantissimo
1596480	1602040	quale il trasportaereo per un Paese come l'Italia che è un Paese di transito, un Paese turistico
1602040	1608640	che accoglie moltissimi anche se l'età ha un po' criticato, non si può vivere sui beni
