start	end	text
1608640	1613900	archeologici, ma anche su quelli, la Spagna ci insegna che anche su quelli, sulle spiagge,
1614040	1615200	sul sole, sul mare...
1615200	1616620	La polemica era sul sole.
1616740	1622780	Sul sole, ecco, sul sole, esattamente. E noi stiamo perdendo, la simifica come se a un corpo
1622780	1630800	umano a un certo punto gli esce il sangue dalle vene, senza un Paese che perde il trasportaereo,
1630900	1636240	era l'Italia oggi in questa condizione, che se va avanti in questa maniera fallisce. Se
1636240	1641060	fa l'accordo con le Franze o con le Chelehem o quegli accordi, sparisce lo stesso, perché
1641060	1646240	viene inglobata. Allora qui ci vuole un atto di coraggio, ci vorrebbe anche voi dell'opposizione.
1647440	1652920	Io che sarei, che sono un privatizzatore per l'eccellenza, io privatizzerei tutto, pure
1652920	1657860	la sedia che sta a Palazzo Chigi del Presidente del Consiglio, direi se è privata è meglio
1657860	1664220	che sia pubblica. Io credo che in questo momento l'Italia andrebbe nazionalizzata, cioè andrebbe
1664220	1669840	riportato tutto il capitale in mano allo Stato. E questo è consentito anche dai regolamenti
1669840	1675880	comunitari, una società in cui lo Stato deve investire attraverso gli aumenti di capitale,
1676200	1682160	deve ricostituire la flotta, deve rimettere a posto l'azienda. Dicono i banchieri inglesi,
1682340	1691000	i risparmiatori informati sono forti, i risparmiatori non informati perdono. Posso aggiungere, i
1691000	1695700	risparmiatori vanno informati da se stessi, ma anche da coloro che vendono i titoli e
1695700	1701900	così abbiamo chiuso il quadro. Ma quella è una anomalia che ha a che fare con un portamento
1701900	1707640	criminale su cui giustamente indaga la magistratura, ma è fuori dalla dialettica dei mercati.
1707980	1717760	Allora, ottoromiti, corruzione e speculazione, partendo dalle indicazioni del libro di Mirta,
1717760	1725240	quali sono le cautele per evitare di finire dentro gli ingranaggi di un meccanismo di
1725240	1732760	euforia finanziaria e crack finanziario? Io intanto devo dire specialmente il riferimento
1733320	1743020	a questi drammatici, perché quando si assistono a fenomeni come quelli a cui siamo assistendo,
1743020	1748380	sia per la durata in cui questi fenomeni ci sono verificati e sia per l'entità, è
1748380	1758320	chiaro che si rimane sbalorditi. Ci sono evidentemente i delinquenti, colori quali sono dei malfattori,
1758420	1763380	dei criminali, è una banda, io dico uno, e evidentemente questo può capitare in casa
1763380	1768580	in cui lei può organizzare un'azienda o anche la sua famiglia in maniera perfetta. Si prende
1768580	1774600	due domestiche o una domestica che hanno fatto tutto bene, poi se un giorno lei lascia
1774600	1779660	un pacchetto di banconote nel cassetto e la sua domestica prende il pacchetto e se ne va
1779660	1784660	lei con tutti i controlli che fa non ci riesce. In un'azienda quindi c'è sempre un limite
1784660	1790740	oltre il quale c'è un problema di onestà, di eticità, lì no, lì sono mancati, nel
1790740	1797640	caso di cui parliamo, sono mancati i controlli più elementari e più che andarsela a prendere
1797640	1802560	con coloro, certamente bisogna prendersela anche con coloro quali hanno organizzato,
1803140	1809080	ma bisogna prendersela con chi aveva l'obbligo, aveva il dovere di controllare. Sono i primi
1809080	1814640	che dovrebbero essere messe da parte della magistratura, da parte degli organi di controllo,
1814820	1819320	da parte degli organi che devono prendere provvedimenti in confronto a quello. Adesso
1819320	1825420	per esempio il provvedimento che è stato varato dal Consiglio dei Ministri, che penso
1825420	1830740	in Parlamento subirà probabilmente anche delle modifiche, sotto questo punto di vista
1830740	1835860	a me non mi accontenta ancora, non mi accontenta assolutamente, non perché, non è che uno
1835860	1841620	possa dire, io elimino, posso fare qualunque legge, la più bella qualunque non posso eliminare
1841620	1848100	al 100% le malversazioni e le cattive. E quindi questo però è un fenomeno che guardi che
1848100	1854760	danni ha provocato non solo al Paese Italia, certamente l'intità e la misura del danno
1854760	1860120	era enorme, ma ha creato la sfiducia della gente. La sfiducia della gente, io sono sicuro
1860120	1865980	che molta gente oggi se c'ha 10 mila euro e se li tiene a casa nel cassetto piuttosto
1865980	1871640	che portarli, che darli, sfiducia verso le banche, sfiducia verso la borsa, sfiducia
1871640	1877640	verso tutti. È un danno incredibile e che bisogna fare moltissimo perché poi la fiducia
1877640	1881980	non è che uno dice devi avere fiducia, la fiducia hai come o uno ce l'ha o uno non ce
1881980	1885560	l'ha, ma che glielo puoi ordinare a fare. Quindi è un fatto molto grave.
1886480	1892460	Olaura, il procedimento in discussione, il frutto di una sorta di patto dell'ASPEN, come
1892460	1898180	si dice sui giornali forse esagerando, comunque il frutto di una ricerca comune di regole
1898180	1902980	che tenono i risparmiatori, va avanti e come può essere migliorato, come suggeriva il
1903080	1916160	dottor Romiti. L'onorevole Romiti ha detto... sono brevissima
1916160	1920080	perché dobbiamo sentire anche Mirtha su queste cose perché siamo venuti...
