start	end	text
2100	10380	Buonasera a tutti, grazie al nome dell'AREL a tutti i presenti e grazie ai relatori che
10380	17840	sono accanto a me al tavolo per aver accettato di discutere insieme su un argomento quantomai
17840	25660	di attualità alla luce di un libro che l'AREL qualche tempo fa ha pubblicato che è in libreria,
26580	33840	un libro con un titolo molto provocatorio, Europa senza prospettive partendo dall'idea
33840	39820	delle prospettive finanziarie che sono il bilancio europeo 2007-2013, un nome un po'
40120	46100	particolare, prospettive finanziarie approvate definitivamente nel momento nel quale è scoppiata
46100	53420	la crisi europea, forse la più grave, una delle più grave degli ultimi tempi con i no al referendum
53420	61020	francese e olandese sulla costituzione e l'impasse che poi è seguita. Un lavoro impegnativo
61020	66740	e importante che ha curato Alessia Mosca che è qui presente al quale hanno partecipato
66740	82440	vari autori, alcuni degli autori sono qui presenti, è un lavoro complesso, penso di
83440	90480	delle prospettive finanziarie 2007-2013 e soprattutto quindi sul tema sul quale abbiamo voluto calibrare
90480	95080	l'incontro di questa sera, cioè quello dei fondi strutturali europei, dei nuovi fondi
95080	103560	strutturali europei per quanto riguarda quindi il nostro Paese, riguardano le Regioni Obiettivo
103560	114100	1. Ieri abbiamo fatto un dibattito a Milano, ospiti dell'ISPI, di presentazione sempre
114100	120500	di questo volume. Abbiamo lì in quell'occasione, erano presenti Boris Spiancheri e Renato Ruggero
120500	129220	oltre al sottoscritto e lì abbiamo centrato di più l'attenzione sul legame tra il tema
129220	136540	del bilancio comunitario e la crisi dell'Unione Europea, le prospettive di rilancio. Abbiamo
136540	142880	toccato un argomento forse con un eccesso di ottimismo, ma siamo inguaribilmente ottimisti,
142960	151160	o meglio siamo inguaribilmente euroottimisti, per cui la valutazione del fatto che forse
151160	159220	l'Unione Europea ha elaborato il lutto, il lutto iniziato con i no ai referendum francese
159220	168620	e olandese forse il 25 marzo di quest'anno con il vertice di Berlino e con la dichiarazione
168620	174640	di Berlino che la Presidenza tedesca dell'Unione Europea sta preparando, l'Unione Europea
174640	181980	può uscire dal lutto, può rilanciarsi, l'Italia sta giocando un ruolo molto importante, Renato
181980	190720	Ruggero è stato indicato come, dire scerpa di Renato Ruggero è un termine probabilmente
190720	200000	poco adatto, comunque come punto di riferimento italiano per la discussione su questa dichiarazione
200000	207120	di Berlino, dichiarazione che credo, lo dico con una punta di ottimismo, credo possa effettivamente
207120	213560	sancire un momento di rilancio fondamentale in questa fase. A questo si aggiunge il fatto
215300	223400	che l'altro grande Paese europeo probabilmente uscirà presto da una fase di battito interno,
224160	232880	e quindi la somma di questi eventi potrebbe mettere insieme, unita a questo l'impegno
232880	244960	italiano, le condizioni per il rilancio con l'obiettivo di darsi il 2009 come tempo entro
244960	252560	il quale fare quella revisione costituzionale, quella revisione istituzionale a livello europeo
252560	259240	che non è riuscita per via del blocco francese e olandese. Le condizioni ci sono tutte perché
259240	265480	in due anni e mezzo si può fare questa operazione e soprattutto perché oggi c'è una maggiore
265480	270620	consapevolezza del fatto che la crisi che è intervenuta è una crisi che noi europei
270620	279960	non possiamo permetterci. In fondo il titolo stesso del libro, Europa senza prospettive,
279960	286060	è un titolo provocatorio ma che dice con chiarezza che mentre l'Europa fa l'accordo
286060	293620	sul bilancio 2007-2013, bilancio che tocca la vita di tanti di noi e alcuni dei protagonisti
293620	299400	sono qui presenti e uno dei protagonisti è qui al tavolo e sarà uno degli interventi
299400	306280	credo più ottesi di questa sera, quello del presidente della regione italiana più famosa
306280	311840	in Europa sul tema dei fondi strutturali europei, cioè Vito de Filippo, presidente della Basilicata,
312140	323740	la regione italiana che ha meglio storicamente organizzato la sua istituzione per essere
323740	331040	effettivamente in linea con le regole e le normative comunitarie in campo di fondi strutturali
331040	336220	che ha usato e quindi ha usato molto bene e in modo molto positivo per l'appunto.
336560	341240	Ora questo passaggio è un passaggio chiave nel momento nel quale il rilancio effettivamente
342260	350580	avviene. L'impegno c'è, il 2009 è un tempo possibile, dico 2009 perché le elezioni
350580	360660	europee rappresentano naturalmente uno spartiacque. Se il prossimo Parlamento europeo, ormai i
360660	366980	partiti europei sono condizionati anche dal clima della loro elezione. La legislatura
367660	376760	2004-2009 è una legislatura appesantita dalla crisi. La legislatura 2009-2014 sarà una
376760	383660	legislatura che dipenderà da che cosa accadrà da oggi ad allora in termini di possibile
384800	390400	rilancio della discussione istituzionale e tutto questo dipenderà ovviamente dalla dichiarazione
390400	396300	di Berlino e dalle condizioni di rilancio di questa dichiarazione. Ecco perché penso,
396340	404500	ritengo che questo tema oggi sia un tema intimamente connesso con la sua applicazione poi concreta.
405060	409960	Idealmente appunto voglio unire il dibattito che abbiamo fatto ieri, tutto sulla parte
409960	416880	europea di questo lavoro, con il dibattito che facciamo oggi che parte dalla parte europea
417120	423000	però atterra molto concretamente sulla nostra partita nazionale, perché la nostra partita
423000	432280	nazionale è una partita che io sintetizzo così, per una serie di motivi si è riusciti
432280	438080	a uscire dal negoziato salvando quello che non era scontato all'inizio del negoziato,
438120	447100	cioè la completezza della politica di coesione, della politica di coesione, della politica
447120	453180	dentro il bilancio comunitario. Non era scontato perché la politica di coesione, cioè i fondi
453180	461400	strutturali europei, potevano benissimo essere oggetto di quei tagli che nella fase tra la
462000	467960	proposta della Commissione e l'approvazione finale sono intervenuti, tagli pesantissimi,
468400	476300	dico solo la cifra per capirci perché, la cifra che separa la proposta da cui si è
476300	483720	partiti, e proposta della quale Mario Nava ci parlerà subito dopo la mia introduzione,
484400	492560	Mario Nava direttore alla Commissione europea ed è una delle persone che ha insieme alla
492560	501780	Commissione Prodi dato l'avvio a questo metodo innovativo del 2007-2013 delle prospettive
502420	512660	finanziarie, innovativo rispetto ai precedenti quadri comunitari di sostegno. Ebbene qui
512660	519280	il tema è un tema molto chiaro e molto evidente, l'Unione è partita con la proposta della
519280	528580	Commissione che ha fatto, ha alzato la sticella alto, ma diciamo la verità nemmeno tantissimo
528580	539020	alto, era una proposta ragionevolmente ambiziosa e poi alla fine la lancetta si è affermata
539020	547320	su una cifra finale che vale 128 miliardi meno in meno rispetto alla cifra di partenza,
547720	554580	questo per dire quanto si è perso per strada nel dibattito dei Paesi membri, nel dibattito
554580	560520	in Parlamento europeo, nel confronto quindi nel Consiglio e nel confronto politico tra
560520	584560	i Paesi europei e il passaggio pesante dall'1,24% al 1,045, dall'1,24% del PIL europeo al
584580	593480	1,045, quindi un passaggio pesante, è caduto sul campo quasi appunto lo 0,20% del PIL
593480	600100	comunitario, quindi una cifra molto significativa. Perché e quale parte è caduta sul campo?
600280	604760	Siamo qui a discutere del fatto che se Dio vuole non è stata intaccata la politica di
604760	609860	coesione o non è stata intaccata in modo particolare, sono state altre le voce di bilancio
609860	618100	che sono stati oggetto di tagli pesanti, quello che colpisce di più è che alla fine i tagli
618100	624700	peggiori li ha subiti la strategia di Lisbona, cioè la parte del bilancio comunitario che
624700	639840	la Commissione aveva lanciato con l'idea di lisbonizzare il bilancio comunitario, brutta
639840	647860	un po' burocratica e anche un po' stantia anche del passato nel quale il bilancio comunitario
647860	655760	è sempre stato e sempre era un bilancio molto molto rigido, quindi legato molto a regole
655760	662080	precedenti senza grandi guizzi innovativi, ha una logica invece in cui il bilancio si
662080	669020	piegava alle scelte che l'Unione stava facendo. L'Unione ha lanciato la strategia di Lisbona
669020	676880	ma come a tutti è noto la strategia di Lisbona o diventa cuore del processo comunitario oppure
676880	684340	la strategia di Lisbona diventa lettera morta. L'idea della Commissione era quella di lisbonizzare
684340	689540	il bilancio, quindi di permeare il bilancio di tutto ciò che la strategia di Lisbona
689540	698700	comporta, dalle questioni legate alla ricerca, tutti quegli aspetti così importanti. Ebbene
698700	706100	quella è la parte competitività che è stata più duramente toccata nel passaggio appunto
706100	717600	dall'1,24 al 1,045. Credo che nel ragionamento che oggi faremo sulla politica di coesione
717600	728680	che è stata salvata, dobbiamo quindi fare un ragionamento che tenga conto di questo
728680	734120	ragionamento, dire che quella politica di coesione che è faticosamente salvata è
734120	741160	una politica di coesione che per l'ultima volta darà all'Italia una montagna di risorse
741900	749840	enorme, una cifra veramente impressionante di risorse che arriverà in Italia, sarà
749840	757620	usata dalle regioni obiettivo 1, sarà usata dai facing out delle altre regioni, sarà
757620	764680	usata anche dalla Basilicata e dalla Sardegna che in modo encomiabile hanno scavallato
764680	774240	lo 75%, quindi sarà uno dei temi principali dei prossimi sette anni. Allora il tema qui
774240	781060	chiave, e così comincio a porre anche qualche domanda perché gli interventi possano subito
781880	788540	svilupparsi, il tema chiave che l'AREL e attraverso questo lavoro curato da Alessia Mosca abbiamo
788540	797140	voluto lanciare e le provocazioni che abbiamo avuto lanciare è intanto come essere consapevoli
797140	804060	che è l'ultimo treno che passa per le regioni obiettivo 1, come essere consapevoli che quest'ultimo
804200	813060	treno non va utilizzato tranne che per la Basilicata come sono stati utilizzati treni
813060	817740	precedenti, nel senso che i treni precedenti alla fine sono stati utilizzati molto spesso
817740	824460	per coprire carenza di risorse, alle volte anche correnti proprio di spese minute, non
824460	829660	di spese strutturali, però la fondi strutturali la dice lunga perché cosa dovrebbero essere
829660	839680	utilizzate queste risorse, come far sì che fino in fondo si riesca a comunitarizzare
839680	846820	la mentalità delle nostre strutture regionali oltre che quelle nazionali ovviamente perché
846820	853400	l'utilizzo dei fondi tenga conto di quelle logiche di moltiplicazione di fondi privati
853400	859400	che si aggiungano a quelli pubblici, di partenariato istituzionale, tutti quegli aspetti che sono
859400	868220	assolutamente fondamentali perché si parli di una storia di successo. Siamo molto grati
868220	875340	ovviamente a Pierluigi Bersani per aver accettato l'invito ad aggiungere la sua parola a queste
875340	880900	riflessioni perché Bersani in questo momento è il titolare massimo delle responsabilità
880900	886560	italiane in questo campo perché il nuovo Ministero dello sviluppo economico, questa è la novità
886560	890780	forse più interessante dell'architettura istituzionale del nuovo governo, il nuovo
890780	898660	Ministero dello sviluppo economico assomma alle competenze del vecchio Ministero dell'industria
898660	907680	prima dell'attività produttiva e poi le competenze del Dipartimento politica di coesione che
907680	916300	in tutti i quadri comunitari di sostegno precedente erano invece legate al Ministero del Tesoro.
917440	924200	Non è un passaggio da poco perché il fatto che lo sviluppo lo faccia il Ministero del
924200	930460	Tesoro o il fatto che lo sviluppo dei territori e dei territori in questo caso del Mezzogiorno
930460	937880	lo faccia il Ministero dello sviluppo economico che ha le altre leve per gestire queste partite
937880	944000	ovviamente è una partita molto molto importante, molto rilevante che credo quindi che la parola
944000	948860	di Pierluigi su queste materie sarà molto utile anche perché stiamo parlando di fatti
948860	954980	che in queste ore, in questi giorni sono in divenire. A Caserta il governo ha presentato
954980	961340	ufficialmente appunto il suo piano per l'utilizzo delle risorse per il Mezzogiorno, è cominciato
961340	967360	un negoziato con la Commissione Europea, al termine di questo negoziato questo piano
967360	973980	diventerà poi efficace e fattivo fino in fondo. Mi fa piacere anche sostenere il fatto
973980	980760	che queste vicende Pierluigi e Dio con l'aiuto di Alessia, di Federico e di altri, le abbiamo
982340	988180	vissute nella fase in cui per un paio d'anni siamo stati all'inizio di questa legislatura
988180	997340	al Parlamento Europeo, stati anni un po' più tranquilli dell'ultimo, e quindi abbiamo
998380	1007200	vissuto da lì, diciamo da quella tribuna, la discussione su un tema che oggi stiamo
1007200	1013660	vivendo invece nella sua fase di applicazione e gestione, quindi aver visto quanto è stato
1013660	1020700	faticoso salvare la politica di coesione dentro tutti i tagli del bilancio 2007-2013 oggi
1020700	1026060	è un elemento che è una sferzata per chiunque di noi deve gestire questi passaggi in fase
1026060	1033060	di trattuativa. L'idea che un solo euro venga disperso, venga buttato via dopo averlo faticosamente
1035920	1040520	strappato con le unghie e con i denti di una trattativa difficilissima ritengo che sia
1040520	1047380	un aspetto non da poco. Mi fermo qui perché faccio semplicemente da padrone di casa,
1047500	1054440	da introduttore, chiederei appunto Mario di raccontare alla luce della storia appunto
1054440	1060640	di come la commissione Prodi nella fase finale della sua esperienza ha lanciato quest'idea
1060640	1068320	del 2007-2013, un'idea importante, aggiungo anche che in tutta questa vicenda la storia
1068320	1073020	di cui qui dentro parliamo ha corso un grandissimo rischio, perché siamo arrivati vicinissimi
1073020	1080700	al fallimento del negoziato sul 2007-2013 e se si fosse arrivati al fallimento si sarebbe
1080700	1086360	passati sostanzialmente alla logica del bilancio annuale. La logica del bilancio annuale è
1086360	1091280	la sconfitta, è la fine dell'idea stessa di Europa, perché l'idea stessa di Europa
1091280	1097220	è un'idea di programmazione di lungo periodo, di obiettivi di lungo periodo, ecco perché
1097220	1103260	su questo tema il rischio corso è stato un rischio assolutamente terribile e rispetto
1103260	1110080	all'ambizione iniziale credo che oggi forse possiamo guardare le cose indietro con appunto
1110080	1115280	la dovuta attenzione quasi storica ma soprattutto guardare con grande attenzione davanti mi fermo
1115280	1123340	subito dalla parola a Mario Navarro. Finanziarie che durano per 7 anni e però dicono sì però
1123340	1130360	fra due anni ci ritroviamo e magari ne riparliamo. Ecco questo secondo me è una componente
1131460	1137400	critica all'interno della decisione delle prospettive finanziarie fondamentale e credo
1137400	1142940	che sia importantissimo che i governi soprattutto quelli più illuminati e quelli più europeisti
1142940	1148440	colgano quest'occasione cioè l'occasione del 2008-2009 non è un'occasione vuota,
1148600	1154460	è un'occasione piena, è un'occasione credo totale c'è scritto chiaramente nelle prospettive
1154460	1159440	finanziarie che l'idea è quella di rinnovare le entrate, le spese e le procedure quindi
1159440	1164960	direi che questa è assolutamente una occasione da cogliere per cui il mio giudizio finale
1165960	1171300	poteva andare meglio ma contentiamoci così. Grazie.
1175180	1182020	E sapere dove li metti perché sennò possono far male. Ecco questo io credo che in questi
1182020	1191760	sette anni centro, perferire regioni, governo eccetera siamo di fronte veramente a questa
1191760	1198840	sfida perché da un bilancio così tribolato e da questo rischio che abbiamo corso però
1201540	1208820	noi possiamo dire che l'Unione Superiore ha dato un'occasione ancora su queste politiche
1208820	1214880	di coesione, un'occasione straordinaria, veramente straordinaria e quindi dobbiamo sentirsi impegnati
1214880	1221280	a coglierla. Grazie e complimenti all'Alessia perché sennò...
1222640	1228280	Grazie per Luigi, adesso il tempo è praticamente finito, dobbiamo lasciare la sala però...
