start	end	text
2840	6740	Enrico Letta, deputato europeo, è scritto il gruppo dell'Alleanza dei Democratici e
6740	11320	Liberali per l'Europa. Con lui vogliamo parlare di patto di stabilità. Ieri c'è stato questo
11320	18000	Consiglio Ecofin da cui si è usciti con nulla di fatto rispetto all'accordo sulla riforma
18000	26360	del patto. Qual è il suo commento? Mi sembra un passo indietro molto preoccupante. L'Europa
26360	33400	ha bisogno di un patto per la crescita. Ne abbiamo bisogno, i numeri lo dicono. L'Europa
33400	41600	è ferma, arranca, fatica rispetto al resto del mondo. La differenza è così abbissale
41600	46840	di tassi di crescita che non possiamo non porci il problema. Allora, l'idea che la discussione
46840	52780	sulla riforma del patto si sia fermata sui veti incrociati a me sembra una pessima notizia
52780	57580	per il futuro dell'Europa. Abbiamo bisogno, tra l'altro, di una politica economica e monetaria
57580	62580	che sia in grado di gestire il tasso di cambio in modo diverso da come fino ad adesso è
62580	73240	gestito. Paghiamo una tassa pesantissima per colpa di cosa succede con le monete, con il
73240	77760	tasso di cambio dell'Euro. Abbiamo bisogno di una politica monetaria e economica diversa
77760	81460	da quella che abbiamo fino ad adesso. Quindi, grande preoccupazione, la speranza che qualcosa
81460	88500	si muova dopo questo nulla di fatto di ieri. Questa lista di 16 eccezioni, in base alle
88500	95780	quali si potrebbe superare temporaneamente e limitatamente il deficit del 3%, è un'iniziativa
95780	102900	positiva da parte della Presidenza lussemburghese? Sicuramente, qualunque ipotesi che muovesse
102900	107900	la discussione era positiva. Il problema è molto banale se tutto questo si tramuta in
107900	112100	una scelta che poi si ritorce contro gli italiani, perché sono quelli con il debito più alto.
113600	120580	Per noi è inaccettabile il credo che sia giusto alzare la voce su questi temi. A suo avviso
120580	125400	non c'è il rischio, con una riforma così ampia, con tante eccezioni, non c'è il rischio
126160	130980	che sia rimessa in discussione la credibilità del patto? Credo che il patto sia già non
130980	134760	più credibile, quindi l'idea, oltretutto, che rimanga in vita un patto che non ha più
134760	144160	alcuna credibilità, perché è stato bucato dalla non applicazione in questo ultimo anno
144160	150080	in tantissimi casi, già dall'idea di una situazione di estrema difficoltà. A suo
150080	155000	avviso si può ancora arrivare a un accordo per il Consiglio europeo del 22-23 marzo?
155680	163140	Mi auguro di sì, spesso in una casa europea quando ci sono poi delle cose che fanno male
164440	171320	delle impasse, dei blocchi, poi questi sono un modo per spingere tutti a muoversi, mi
171320	174960	auguro di arrivare a una soluzione finale positiva all'ultimo minuto, mi auguro che questo sia
174960	180260	il caso. Su tutt'altro fronte, una battuta sulla candidatura
180260	186320	di Emma Bonino ad alto Commissario delle Nazioni Unite per i Rifugiati, qual è il suo commento?
186420	193120	Io sono entusiasta di questa candidatura, Emma Bonino candidato a Commissario per le Nazioni
193120	199400	Unite per i Rifugiati, mi sembra veramente la persona giusta al posto giusto, un tentativo
199400	205780	di ridare credibilità a una istituzione gravemente danneggiata dagli scandali che hanno portato
205780	212360	poi alla dimissione del precedente Commissario. Verifichiamo che il governo italiano, almeno
212360	217160	formalmente, questo appoggio lo ha manifestato, vorrei approfittare di questa occasione per
217240	226580	dire con grande forza e grande esistenza se è un appoggio vero, se è soltanto una cortina
226580	230900	fumogena o il governo italiano ha l'intenzione di spendersi, perché a me sembra una bella
230900	235600	candidatura, una candidatura attorno alla quale sicuramente il Paese intero può ritrovarsi
235600	239360	e un modo per rendere l'Italia anche più forte all'interno delle Nazioni Unite nel
239360	243640	momento nel quale le Nazioni Unite stanno affrontando il tema della riforma e il Consiglio
243740	249100	di sicurezza, dalla quale l'Italia dà una soluzione da un'altra è come la vita o la
249100	250740	morte per la nostra politica estera.
