start	end	text
9340	17120	Allora buonasera a tutti e grazie di questa partecipazione così qualificata
17120	29980	questa sera grazie innanzitutto all'Istituto Sturzo che ci ospita con la
29980	36740	diciamo presentare anche se il libro ormai è in libreria da qualche tempo un
37420	44480	volume e un lavoro una ricerca che l'AREL ha svolto ha sviluppato credo
44480	51900	particolarmente stimolante e interessante, io ovviamente sono
51900	55260	particolarmente contento che siamo riusciti come AREL, lo dico anche al
55260	61040	di Franco Merloni che è qui in prima fila presidente della nostra
61040	69460	associazione, siamo riusciti a completare un lavoro condotto appunto da
70040	77940	Pammolli e Salerno, due giovani studiosi che sono presenti oggi, un lavoro credo
77940	86440	di grande attualità su temi che sono i temi centrali del dibattito istituzionale
86440	89940	nel nostro Paese e che sono i temi centrali anche nel dibattito tra
90600	96860	studiosi e addetti ai lavori, il libro è un libro molto articolato credo che lo
96860	101740	abbiate visto, gli abbiamo dato un'occhiata, è un libro che presenta alcune
101740	109700	proposte, una in particolare e cerca di interloquire con alcune delle dinamiche
109700	117860	principali che sono in corso, come vedete Raffaele Fitto e Giuliano Amato
117860	125520	hanno accettato la nostra proposta di dialogare, di discutere su questo
125520	131560	tema, sul libro, sulle proposte che dal libro escono, quindi io le ringrazio al
132620	139000	Pammolli, sicuramente credo che siano le persone adatte per l'esperienza, per la
139000	146120	competenza, per i ruoli istituzionali, Raffaele in quanto ministro per delle
146120	155020	regioni è oggi colui che sta guidando il rapporto appunto tra governo nazionale e
155020	161540	governi regionali su molti degli aspetti che nel libro sono trattati, prima di
161540	167180	dare la parola a loro vorrei indicare quelli che secondo me sono i motivi che
167180	172860	ci hanno spinto innanzitutto a questo lavoro, questo lavoro è un po' di tempo
172860	178820	che ci stavamo dietro proprio perché abbiamo considerato che questo tema
178820	185700	fosse uno dei temi che più di ogni altro avrebbe accompagnato questa
185700	192120	legislatura. Il tema ovviamente è legato da una parte alle esigenze
192120	200440	assolutamente in evoluzione della società italiana e delle società europee,
200740	206140	quindi esigenze di servizi, di prestazioni che chiamano in causa il
206140	212000	mondo della sanità in modo diverso dal passato e quindi la necessità su questo
212000	219440	di essere molto profondi nella riflessione e nello studio dei dati per
219440	223880	quanto ci riguarda, questo è una continuità, l'analisi di questo filone
224460	230100	con altri studi che in Arel abbiamo svolto sul tema sostanzialmente di quella
230100	233840	che con una brutta parola in Italia viene chiamato invecchiamento della
233840	239220	popolazione che invece credo noi possiamo chiamare ringiovanimento delle
239220	257860	persone, che è un po' la stessa cosa, però nel senso che l'impatto della
257860	266420	demografia ovviamente porta grandi cambiamenti sul sistema economico,
266420	272560	sulla richiesta di servizi, sul mercato, sulle spese, sulle spese del settore
272560	279220	pubblico, sulle spese del settore privato, sono cambiamenti che sono in corso e ci
279220	285220	sentiamo di dire che mai come in questo caso e in questo campo, dato che il
285220	291400	cambiamento della demografia è un cambiamento assolutamente più rapido di
291400	298000	potessimo immaginare, la necessità di interventi normativi nella tempistica
298000	303460	giusta consente di poter evitare quello che invece intervenire con anni di
303460	310340	ritardo poi rischia di comportare, falle gigantesche nei conti pubblici, credo che
310340	314100	questo sia il tema chiave, tutti sappiamo che cosa questo vuol dire,
314380	320100	l'accelerazione dell'impatto della demografia che sempre per rimanere
320100	326020	all'esempio che facevo prima vuol dire che all'incirca, detta così è una cosa
326020	331480	che fa sorridere, ma è la verità ogni settimana della nostra vita che passiamo,
332440	337500	ogni settimana che viviamo guadagniamo un weekend in più di vita, che detta così
337500	341700	fa una certa impressione, ma è la verità nel senso che l'evoluzione della
341700	347680	demografia e dell'aumento della speranza di vita è tale che alla fine
348720	353900	riguarda le nostre vite in corso e se riguarda le nostre vite in corso riguarda
353900	359740	il modo in cui abbiamo organizzato la società italiana e quindi se riguarda
359740	364020	le nostre vite, riguarda anche le vite di tutti coloro che già sono in pensione e
364020	371140	quindi vedono modificare, ovviamente a scapito dei conti pubblici, una
371820	375960	dinamica di costi, di impatto sulla spesa previdenziale.
375960	381580	Cito questo punto perché questo è un punto a mio e al nostro avviso, ne abbiamo
382300	386820	parlato in varie occasioni e abbiamo prodotto altri libri su questo.
387260	394000	Questa è la prima parte della riflessione, la parte che fa da sfondo al lavoro di
394000	399360	Pammolli e Salerno, tra l'altro su questo tema abbiamo in corso anche altri
399360	404980	lavori, alcuni degli autori e dei collaboratori che stanno lavorando
404980	410900	insieme all'AREL su questi temi, sono qui presenti, io li ringrazio e confermo la
410900	415860	nostra volontà di andare avanti molto profondamente su questi temi.
416100	420060	E poi c'è la seconda dinamica, la seconda dinamica che invece riguarda
420060	434960	più specificamente la spesa sanitaria, il suo impatto sulla spesa sociale e la
435560	441520	Qui dentro ci sta tutta una riflessione che prescinde dal primo ragionamento che
441520	444920	abbiamo fatto, dal primo pilastro della nostra riflessione, ci sta tutta una
444920	450000	riflessione che è di per sé importante, un tema di disuguaglianze molto profonde
450000	457120	che in Italia sono presenti, il libro le affronta, la questione dell'out of
457120	464940	pocket che alla fine è la questione più rilevante ed è la questione che
464940	469300	il sistema sanitario italiano è perfetto così e non va modificato perché è
469300	476600	perfetto così e siamo convinti che vada bene perché sennò non si spiegherebbe
476600	481980	perché ogni settimana che passa guadagniamo un weekend di vita, la
481980	486500	speranza di vita che aumenta è figlia sicuramente di un sistema sanitario che
486500	494920	funziona anche, ma qui il problema è secondo me più, secondo noi, più
494920	503840	le famiglie italiane hanno delle spese ogni anno che sono all'incirca di 30
504760	511420	miliardi, ordine di grandezza di euro, l'anno che escono dalle loro tasche e
511420	516760	che vanno a pagare le prestazioni, appunto le spese out of pocket andando
516760	521180	a pagare le prestazioni sono spese che è difficile anche andare a capire quali
521260	529280	tipi di famiglie appunto spendono questi 30 miliardi di euro ed è molto
529280	536040	molto difficile andare a fare ragionamenti su, diciamo, i temi della
536040	540420	redistribuzione dell'uguaglianza in un Paese come il nostro quando esistono
540420	545080	appunto questi 30 miliardi di euro che gravano sulle famiglie italiane di spesa
545230	551750	out of pocket per le prestazioni sanitarie. Questo tema si unisce
551750	556970	ovviamente alla discussione in corso sul federalismo fiscale e su questo siamo
556970	562750	molto ovviamente interessati a sentire che cosa il ministro Fitto ci dirà, è
562750	567170	noto a tutti che la cassaforte del federalismo fiscale è la spesa sanitaria
567950	572090	quindi crediamo che questo sia un punto chiave ed è difficile parlare
572090	576090	strattamento di federalismo senza avere i conti della sanità.
576370	581950	Ecco, lo dico brutalmente, questo è uno dei temi del dibattito politico anche di
581950	588330	questo tempo. Accanto a questo c'è la questione del rapporto Nord-Sud in
588330	602070	particolare di alcune regioni del Sud e del resto del Paese e l'applicazione, le
603070	608350	si è istituito il meccanismo di commissariamento delle regioni in
608350	614130	adempienti. Vedo in sala e sono molto grato per la loro presenza, insomma le
614130	622110	persone che hanno in mano il cacciavite vero di queste vicende e quindi credo
622110	626330	che se apriremo un dibattito sarà anche molto interessante sentire il loro
626330	635930	punto di vista, insomma le persone che portano al ministro dell'economia i
635930	642450	conti che obbligano a commissariare una regione oppure che consentono di
642450	647750	evitare il commissariamento di una regione. Tutti ovviamente hanno capito a
647750	653570	chi mi riferisco, al mitico dottor Massicci che è qui presente insieme a
653570	661590	noi. Cito questo tema per dire che il tema delle modalità delle forme di
661590	667450	applicazione di quella norma, che è una norma benvenuta e giusta, però i temi
667450	671970	delle forme di applicazione è secondo me una delle discussioni
671970	678750	diciamo di governance del sistema più importante perché la fatica che i
678750	683150	governi di vario colore fanno e hanno fatto ad applicare queste forme di
683150	686670	commissariamento è un tema molto profondo perché alla fine la
686670	691570	discrezionalità politica è comunque molto forte ancora in questi campi, si
691570	698190	tratta di capire se si può riuscire a rendere invece automatici questi
698190	703230	meccanismi veramente automatici attraverso forme di appunto di soggetti
703230	708990	terzi, di valutazioni indipendenti, tutti i temi che conosciamo però indico
708990	715010	questo punto e lo invito alla riflessione sia fitto e amato su questo
715010	719430	punto perché mi sembra una delle questioni chiave nelle discussioni tra
719430	727730	Regioni e Roma, alla fine questo punto dei punti chiave. Mi fermo qui, credo
727730	733110	che insomma la discussione su questi temi sia una discussione che
733110	740290	naturalmente oggi ci coglie in un certo momento, che evolve perché qui l'evoluzione
740290	746950	su questi temi è continua, però ritengo, spero, ecco che Larell e attraverso
746950	753930	questo lavoro di Pammolli e Salerno che ringrazio molto, si sia inserito dentro
753930	761790	questa discussione dando un contributo, un contributo che consenta ad attori
762370	767790	istituzionali, a esperti, a detti e lavori di approfondire, di fare qualche passo
767790	772610	avanti in questo approfondimento e riuscire a far sì che attorno a questi
772610	776910	nodi si riescano a trovare soluzioni perché è quello che sia nell'interesse di
776910	785990	tutti perché una cosa è certa, e termino e do la parola al Ministro Fitto, una cosa
785990	791670	è certa, il bisogno di sanità è una delle cose che siamo sicuri che
791670	799010	crescerà nel nostro Paese e credo che questa sia una certezza e immaginare che
799010	806190	si possa contrarre questo bisogno artificiosamente penso che sia uno
806190	811910	sbaglio profondo perché la nostra è una società ricca ed è una società di
812150	821630	persone sempre di più diversamente giovani e se questo è credo che
821630	826790	queste due caratteristiche aumenteranno in prospettiva il
826790	833990	bisogno di salute e questo aumento di bisogno di salute per forza di cose deve
833990	837910	trovare delle risposte istituzionali che siano all'altezza, risposte
838050	844710	istituzionali certo, risposte anche da parte del sistema privato in altre
844710	851110	occasioni abbiamo coinvolto i soggetti dell'industria farmaceutica e dei
851110	857410	servizi alla persona nel nostro Paese che è l'altro attore di questa vicenda mi
857410	861270	permetto soltanto di dire in conclusione che in un momento nel quale stiamo
861270	867190	ragionando sull'impatto della crisi economica globale sul nostro Paese
867190	871710	sono tra quelli che ritiene che il grande pericolo che noi corriamo è sì
871710	877690	un pericolo di contrazione di consumi, un pericolo sul mondo del lavoro ma in
877690	883170	prospettiva il grande pericolo è che noi usciamo fra un anno due anni dalla
883170	890510	crisi con un Paese toccato nella sua caratteristica principale cioè la sua
890510	894750	caratteristica di potenza industriale cioè un Paese che rischia di uscire
894750	902350	industrializzato che rischia di vedere molte imprese, diciamo preferire la strada
902350	909210	di una chiusura dignitosa piuttosto che tenere in un mare in tempesta come
909210	914250	quello che abbiamo di fronte e siccome il nostro Paese, il sistema produttivo
914250	919390	italiano si regge su questi 4 milioni di imprenditori molti di questi sono nel
919390	924230	campo dei servizi alla persona, nel campo dell'industria farmaceutica
925310	929770	credo che se aumenta il bisogno di salute automaticamente sappiamo che
929770	934870	questo è uno dei settori del futuro e immaginare quindi che andiamo incontro
934870	939370	invece a situazioni di difficoltà, a un rischio di industrializzazione a me
939370	943190	sembra uno dei temi che forse vanno appena di affrontare semmai anzi c'è
943190	946770	bisogno di un investimento, di un investimento molto forte, la cosa
946770	951290	riguarda sia i crediti di imposta sulla ricerca, riguarda il tema della
951290	956190	stabilità delle norme che è uno dei grandi motivi che l'industria
956190	960990	farmaceutica è sempre al contrario, l'instabilità delle norme nel nostro Paese.
