start	end	text
0	6520	dalla stampa est eradiamo come segnale nei confronti degli altri Paesi, ma come una sfida
6520	12980	a noi stessi. Ci misureremo come sempre sui fatti, nel senso che le buone intenzioni
12980	18000	ci sono, a me non piace il detto di buone intenzioni e l'astricato eccetera eccetera
18000	24240	e quindi cerchiamo di lavorare su questo. Grazie ancora. No grazie, lei deve anche andare
24240	34240	via. Esatto, cioè bottiglione che sta fremendo. Grazie, buon lavoro. Allora, Ericoletta, ovviamente
35220	41880	su questi problemi non è che si può pensare che soltanto lo Stato abbia compito di intervento,
42020	54220	c'è anche il ruolo che il mondo delle imprese deve fare. Allora io ho un dato che ho letto
54220	61640	che l'Inei ha fondi di finanziamento che arrivano dalle imprese per poco più dell'1%. L'INSEAD
61640	68200	a Parigi, ovviamente anche se è molto più prestigioso per alcuni aspetti, però è quello
68200	74940	più paragonabile, il 30%. C'è una latitanza quindi anche del mondo capitalistico. Ma io
74940	82400	credo che la filosofia complessiva di queste proposte è una filosofia che riguarda il
82400	88740	pubblico e il privato. Il tema di fondo è quello di invertire la tendenza. Oggi la tendenza
88740	95500	è all'esodo dall'Italia. Le persone che vogliono farsi una formazione di qualità e che hanno
95500	102540	i mezzi per farlo e che hanno il talento per farlo se ne vanno dall'Italia e la quantità
102540	107120	di persone che se ne vanno dall'Italia non è minimamente compensata dalla quantità
107120	112720	di persone che noi riusciamo ad attrarre. Il nostro è un Paese le cui migliori università,
112840	119020	io penso a quella nella quale mi sono formato che ha mille anni di storia, la seconda più
119020	124380	vecchia d'Italia, l'Università di Pisa, è un'università e sono state università che
124380	134220	nel 200, nel 300, nel 400 accoglievano i migliori che venivano dal mondo e che nel curriculum
134220	142740	di quel tempo dovevano mettere che facevano una tappa nelle nostre università, nei centri
142740	151940	di formazione italiani. Oggi purtroppo non è così, oggi in molti campi se vuoi fare
151940	157900	una carriera importante devi mettere che hai fatto tappa a Londra, che hai fatto tappa
157900	163080	in università americana, che hai fatto tappa a Parigi o che hai fatto tappa in qualche
163080	169200	università tedesca, in altri campi, ma noi abbiamo delle specificità che ci portano
169200	177640	a dire che invece il tentativo di invertire questa tendenza e quindi le due proposte che
177640	182500	grossi che fanno parte di questo ventaglio di proposte, la prima, consentire a quelli
182500	189360	che stanno emigrando dall'Italia di tornare e la seconda è quella di fare delle nostre
189360	194980	università, dei luoghi nei quali ci sia il mondo e non soltanto l'Italia come oggi
194980	201420	capita. Il vero tema è questo qui, fare delle nostre università, dei luoghi cosmopoliti,
201600	208300	questo serve intanto ai nostri studenti che si trovano dentro luoghi cosmopoliti, serve
208300	216160	ovviamente alla maggiore competitività delle nostre università e questo vale sia per il
216160	221460	privato, cioè la capacità di far sì che, e queste saranno anche passaggi successivi
221460	228200	del lavoro che faremo, si riesca sempre di più a andare nella direzione di una defiscalizzazione
228200	235520	di ciò che il privato mette per tutto ciò che ha a che fare con la formazione, il futuro,
235680	241580	l'internazionalizzazione dei luoghi di formazione. Questo credo sia un'indicazione di marcia
241580	248580	che noi con questo corpo di proposte, di iniziative vogliamo dare per fare delle nostre università
249660	256780	dei luoghi che siano come i luoghi nei quali oggi si incontra il mondo, che oggi sono soprattutto
257420	262220	Londra, soprattutto le università americane, Parigi, ma cominciano per esempio ad essere,
262220	267940	l'è stato citato, le università cinesi che stanno cominciando ad attrarre molta gente
267940	275840	che viene da fuori e noi non riusciamo invece in questo. Pensiamo che questa iniziativa
275840	282620	debba essere quindi un'iniziativa che trova sia il pubblico attento, trovi anche il privato
282620	286580	attento, perché poi il privato è quello che c'ha più da guadagnarci da tutto questo,
287040	293680	perché ovviamente il rientro, il ritorno in termini di alta formazione e di occasioni
293680	300620	che si possano creare è fondamentale. Questo va da sé e legato al fatto che ci siano università
300620	306700	italiane che siano in grado di far vivere comunità internazionali al loro interno,
307000	312420	questo vuol dire che noi dobbiamo sempre di più considerare che bisogna fare un investimento
312420	318200	sulle università italiane che siano in grado di vivere questa comunità e non di essere
318200	324860	università provinciali piccole legate soltanto agli studenti che riescono a muoversi da quella
324860	329400	provincia, se non riusciamo a giocare una partita più grande credo che tutto questo sia molto
329400	340560	difficile. Quindi in conclusione credo che il tema di fondo sia questo, fare delle nostre
340560	348180	università luoghi nei quali si incontra il mondo da noi per sprovincializzare questo paese
348200	354880	che rischia per via della globalizzazione di essere marginalizzato e di provincializzarsi
354880	358940	molto, noi ci troviamo in questa condizione in cui il nostro sforzo deve essere quello
358940	367640	di invertire non più gli italiani che possono che se ne vanno ma un gioco invece sulle due
367640	373220	direttrici e tante persone che riusciamo ad attrarre e che riusciamo quindi a portare
373220	380220	qui in modo da rendere le nostre università i luoghi nei quali la logica del cosmopolitanismo
380220	384240	e dell'internazionalizzazione possa funzionare. Ancora una considerazione però perché in
384240	389900	questa unica quando mi è stato chiesto di in qualche modo moderare questo incontro,
390420	396340	ho fatto un piccolo giro dentro il mondo della blogosfera con un gran miliarde di social
396460	401740	gruppi che ci sono di italiani in giro per il mondo e mi ha colpito una cosa, la domanda
401740	410200	era ma cosa mi farebbe tornare ed era rivolta a ciascuno dei soggetti ai quali in qualche
410200	415300	modo le proposte di regge si rivolgono, cosa mi hanno risposto e allora dice non è un
415300	422040	problema tanto economico certo anche quello, però il regime fiscale favorevole, la militeorocazia
422040	428200	in Italia è uno spazio per cambiare le cose, cioè sapere che se io torno in Italia posso
428200	433360	in qualche modo incidere per un cambiamento positivo, in fondo in qualche modo è un po'
433520	438840	anche quel costruire una cattedrale. Forse un po' sì ma insomma io credo che l'ha
438840	444620	detto anche Maurizio Lupi e io confermo il suo ragionamento, mi fa piacere che ci sia
444620	450320	accanto a me l'onorevole Salta Martini, l'impegno che stiamo mettendo in questa direzione non
450320	458100	è quello di iniziative fatte tanto per fare, fatte tanto per mettersi un bollino di quelli
458100	465440	che hanno, quante proposte di legge si presentano che rimangono lì e che vengono presentate
465440	470760	in una conferenza stampa e si finisce lì. No, il metterci insieme a ragionare su questi
470760	477140	temi è che c'è una volontà determinata da parte dei presentatori di queste iniziative
477140	483320	ad arrivare a dei risultati che poi siano targati dagli uni, dagli altri, di un colore
483320	488640	di un altro credo che a chi beneficerà di tutto questo non conterà assolutamente nulla
488640	494720	e l'importante è anche quello di dare un segnale, un messaggio che ripeto siamo tra
494720	502340	di noi mischiati quindi questo secondo me rende più forte il messaggio rispetto alle
502340	506600	persone che lo dicono ed è questo quello che noi vogliamo, cioè che questo messaggio
507380	513520	passi, cioè il messaggio di una voglia, di una voglia molto molto forte e determinata
513520	520540	di andare in controtendenza con questa provincializzazione che l'Italia sta vivendo è invece una logica
520540	526480	in cui il nostro Paese possa attrarre pezzi del mondo perché oggi soltanto stando nel
526480	533580	mondo che riusciamo a essere in questa dinamica, in questa dinamica positiva dalla quale poi
533580	537980	alla fine tutto il Paese ha da attrarre il meglio, non dimentichiamoci che il meglio
537980	542640	di sé l'Italia l'ha sempre dato quando è stata parte del mondo, quando è stata al
542640	550460	centro dei flussi, quando le persone hanno potuto avere l'opportunità di venire in Italia,
550460	556980	di dare qualcosa all'Italia, di prendere qualcosa dall'Italia, questo secondo me è questo cosmopolitismo
556980	563980	tipico del nostro Paese e della nostra cultura e credo il sostrato culturale che sta dietro
564700	571480	a queste proposte e credo che il nostro impegno sia molto forte, molto determinato e come
571480	578160	giustamente lei diceva prima c'è un dialogo che ci porterà anche a modificarle, a migliorarle,
578160	585980	a cambiarle, è un modo anche interattivo di costruire percorsi legislativi che credo
585980	591000	debbano anche soprattutto tener conto delle esperienze di queste persone, delle esperienze
591000	597840	degli altri Paesi, perché non è che per forza dobbiamo inventarci noi la pietra filosofale,
598580	600980	ci sono tante altre esperienze in Francia, in Italia, in Italia, in Italia, in Italia,
