start	end	text
7220	15400	Abbiamo preso questa posizione unitaria molto forte sulla spinta franco-tedesca di richiesta
15400	24600	di informazioni e di andare da qui alle prossime settimane a un chiarimento, una cooperazione
24600	29480	con gli Stati Uniti per capire quello che è successo e per soprattutto evitare che
29480	35120	possa risuccedere. Credo che sia stata una posizione unitaria molto netta, molto forte,
35840	43080	che è giustificata dagli eventi che sono accaduti, che non è una posizione che vuole
43080	48560	creare un antagonismo, ma una posizione che vuole trovare soluzioni, perché non è concepibile
48560	54820	che non ci sia chiarezza su questi temi. Ci è stato un buon lavoro unitario da parte
54820	62780	di tutti, mi sembra che sia stato un fatto positivo. No, è stata un'iniziativa portata
62780	67240	da francesi e tedeschi alla quale ci siamo uniti e poi c'è una dichiarazione finale
67240	73940	che verrà annessa alle conclusioni del Consiglio che conferma che da parte degli europei unitariamente
73940	78580	c'è voglia di verità. Questa è la cosa principale, lo chiediamo per i nostri cittadini
78580	83040	e naturalmente lo chiediamo anche perché in futuro le cose funzionino, perché se non
83040	88720	c'è chiarezza su questi punti è ovviamente molto difficile fare le cose insieme. Sono
88720	94420	assolutamente confidente e fiducioso del fatto che questa nettezza di posizione porterà
94420	98660	poi grande chiarezza. L'ho chiesto anche al Primo Ministro britannico David Cameron,
98700	101920	visto che il Regno Unito partecipa ad alcuni di questi programmi. Ma infatti c'è stata
101920	109200	anche da parte sua un atteggiamento molto costruttivo e positivo. Non c'è nessun legame
109200	113820	tra questa vicenda e negoziati sul TTIP, che sono negoziati che devono assolutamente andare
113820	118780	avanti. Tra l'altro per l'Italia sono negoziati molto importanti, quindi l'accordo commerciale
118780	123600	deve andare avanti a prescindere dal chiarimento che deve avvenire su questa vicenda, ma sono
123600	129180	due questioni che sono staccate. Poi abbiamo parlato tutta la serata e poi andato avanti
129180	136580	sulla discussione sui passi avanti sull'Unione bancaria. È stato un punto della situazione.
136960	144140	L'obiettivo al Consiglio europeo di dicembre è verificare che sia effettivamente fatta
144140	148980	la svolta e che sia andata avanti sulla posizione dell'Unione bancaria, che è decisiva per
148980	156480	evitare le prossime, speriamo non avvengano mai, crisi europee. Quindi un piccolo passo
156480	161520	avanti in più, ma soprattutto a dicembre il Consiglio europeo su questo dovrà discutere
162100	166520	in modo molto più forte perché è un punto sul quale noi non vogliamo minimamente arretrare.
167320	172380	Questa è stata una tappa intermedia quella di dicembre e poi domani parleremo della questione
172380	178120	dei flussi migratori. Un'altra giornata difficile per lei anche in Italia, ne possiamo parlare?
178120	180160	No, è andato tutto molto bene.
