start	end	text
0	6040	Mi auguro che andremo in questa direzione anche nel mondo della magistratura, perché
6040	10860	un magistrato che sbaglia è più pericoloso di un medico che sbaglia, perché un magistrato
10860	15040	che sbaglia può rovinare e distruggere vite intere.
20880	30820	E vorrei poter parlare ancora tanto, ma sono felice di poter anche ascoltare tutti questi
30820	38040	amici oggi presenti, perché è questo che sento in convegni organizzati dalla nostra
38040	44900	alleanza nazionale, soprattutto una grande amicizia tra tutte le persone che vi partecipano.
44980	51540	Però posso dire che la direzione di alleanza nazionale, quindi della destra, deve andare
51540	55520	sempre più verso una politica globale.
55820	63360	C'è l'economia globale, ci sono le lobby internazionali, ci sono i grandi problemi internazionali.
63360	71160	Ci deve essere una visione globale della politica, ci deve essere una politica globale della destra.
71340	79700	E' una politica dunque che si occupi, ma globale non nell'accezione del pensare soltanto
79700	88180	ai grandi problemi, ma alla risoluzione dei grandi problemi nel piccolo, anche negli
88180	92320	comuni, negli enti territoriali più piccoli, quindi nei comuni, nella provincia, nella
92320	99440	regione, noi dobbiamo individuare il problema che si riflette poi globalmente, per esempio
99440	105440	il problema della povertà, che è uno dei primi problemi che deve essere affrontato
105440	114940	dalla destra, nel solco di una lunga tradizione di vicinanza a chi più sta male e a chi più
114940	115840	ha bisogno.
116260	116980	Grazie.
120760	125760	Grazie a De Perna, Totaro e poi la Presidente di Azione Giovani, Giorgia Meloni, che ha
125760	128700	già recuperato il suo posto sul palco.
129740	130740	Dov'è a chi l'è Totaro?
132040	132520	Scappato.
133080	136200	Dov'è Totaro?
139780	140860	Si intende che abbia rinunciato?
144300	151040	Giorgia, Giorgia le tocca.
152900	165720	Giorgia, canto, sì dunque ovviamente consentitemi di partire dai ringraziamenti, da ringraziamento
165720	174120	a tutta questa classe dirigente, alla capacità che ha di fermarsi ogni tanto, per confrontarsi,
174180	178320	per tirare le somme di un anno d'operato, per immaginare anche i nuovi obiettivi.
178760	182600	Consentitemi un ringraziamento particolare ovviamente a Maurizio Caspari, a Ignazio la
182600	188260	Russa, per quello che rappresentano, per questa comunità, per quello che rappresentano anche
188260	193200	in termini di sostegno al mondo giovanile d'Alleanza Nazionale, direi di pazienza nei
193200	194320	nostri confronti.
194320	199320	Io per quello che è il mio ruolo non posso che portare qui l'esperienza di Azione Giovani
200160	206320	e un ringraziamento qui lo voglio fare anche e sincero a Francesco Grillo e a questa comunità
206880	214120	con la quale noi abbiamo vinto delle sfide importanti e ci accengiamo a vincerne delle
214120	214320	altre.
215980	224300	Noi ci siamo lasciati lo scorso anno con un mondo giovanile che era imbavagliato da un
226120	231160	congresso celebrato, con una classe dirigente definita di nuovo e con un mondo che ha avuto
231160	236300	la forza all'indomani del risultato di quel congresso di ricompattarsi, di tornare a lanciare
236940	241720	le sue sfide, di tornare a dilagare nelle piazze, nelle scuole, nelle università, con
241720	248900	quella capacità di essere autenticamente ribelli che è patrimonio storico del nostro impegno
248900	249360	politico.
249360	256560	Noi abbiamo lanciato negli ultimi sette mesi tante, tante iniziative, tante campagne, sarebbe
256560	262540	impossibile citarle tutte quante, ma tra le tante iniziative che abbiamo portato avanti
262540	268760	quello che a me preme portare qui è la passione di un mondo che si è guardato dentro, è
268760	275440	la passione di un mondo che ha saputo rigenerarsi, è la passione di un mondo che ha saputo tornare
275440	281380	ad essere un laboratorio politico e culturale per rappresentare di nuovo quel valore aggiunto
281380	288220	che il mondo giovanile del nostro movimento ha sempre rappresentato per alleanza nazionale.
288660	294780	Ecco io credo che noi oggi siamo pronti per tornare a lanciare come diceva ieri Maurizio
294780	300300	Caspari la nostra sfida alle stelle. Credo che siamo pronti per affrontare la stagione
300300	304960	difficile e entusiasmante che ci si presenta di fronte, per cui adiuare alleanza nazionale
304960	310260	anche nelle prossime competizioni elettorali, spingendo l'acceleratore sui due elementi
310260	316700	che sono il patrimonio di alleanza nazionale, sono quello che rende alleanza nazionale unica
316700	321860	e cioè il radicamento da una parte, la capacità di concepire l'impegno politico tra la nostra
321860	327720	gente e l'identità, perché siamo consapevoli di come quel bipolarismo che abbiamo proiettato
327720	333740	anche nei video non sia semplicemente per noi un meccanismo elettorale, ma una sana
334620	340380	contrapposizione sul piano dei valori. Ogni singola iniziativa del nostro mondo è lo
340380	344860	strumento attraverso il quale noi portiamo nella realtà, nella quotidianità l'affermazione
344860	349720	di un valore di riferimento contro i disvalori dilaganti. Non a caso Azione Giovani ha voluto
350260	355420	in occasione della sua ultima festa nazionale produrre una mostra dal titolo Versus, elogio
355420	361500	del contrasto. Mettevamo in contrapposizione su ogni pannello ciò che siamo e ciò che
361500	366200	combattiamo, per chiedere al nostro popolo, anche nelle prossime consultazioni elettorali
366200	371360	di stabilire sulla base di questa contrapposizione valoriale da che parte vuole stare, per chiedere
371360	376780	il coraggio di schierarsi. Tutto quello che facciamo è riconducibile a questo. Così
376780	381700	ad esempio abbiamo sempre in occasione alla nostra festa nazionale lanciato un confronto
381700	387680	con il nostro governo anche critico, serrato, produttivo sui temi legati al mondo giovanile.
387800	392780	Abbiamo rivendicato le nostre proposte sui temi dell'aggregazione, sull'abbassamento
392780	397260	del costo della musica, sulla valorizzazione della cultura di impresa a livello giovanile,
397420	401760	sulla valorizzazione dei beni culturali, sulla riqualificazione delle periferie metropolitane
401760	408700	e l'abbiamo fatto per stabilire questa contrapposizione valoriale. E cioè quella che vede da una
408700	414040	parte una forza politica autenticamente popolare interclassista che si pone i bisogni della
414040	419120	gente e la necessità di affrontare e risolvere i bisogni della gente e dall'altra parte quelli
419120	424720	che sostengono di combattere l'aumento del costo della vita facendo le spese proletarie
424720	429860	che poi non sono altro che fregarsi i computer per portarseli a casa ma contestualmente
429860	434700	distribuire scatolette di tonno per coprire una rapina con presunti moventi di carattere
434950	439770	sociale, che è la stessa distinzione che noi abbiamo visto sul tema dell'immigrazione.
440430	446130	Da una parte c'è chi chiama solidarietà, accogliere valanghe di immigrati per fargli
446130	451130	pulire i vetri delle nostre macchine ai semafori e dall'altra chi preferisce dedicarsi
451130	456630	alla cooperazione internazionale e allo sviluppo, chi crede realmente nella dignità e nel rispetto
456630	460950	della dignità dei popoli e lo dico perché voglio ringraziare sinceramente le nostre
460950	466550	organizzazioni di volontariato, in particolare il Modavi che con azioni giovani molte battaglie
466550	470950	sta portando avanti sul fronte della cooperazione internazionale in difesa dei bambini argentini
471730	478090	a tutela del Sahara occidentale, in difesa anche dei bambini delle fogne di Bucarest
478090	482950	che essendo vittime di un regime comunista non hanno mai trovato diritto di cittadinanza
483730	488950	nella agenda delle iniziative di un ponte per o di ginostrada. Ecco la differenza su questo
489150	497050	la facciamo noi e consentitemi di ricordare anche le tante battaglie, le tante battaglie
497050	502930	di prevenzione nei confronti della droga, dell'aborto, al sostegno delle giovani coppie, della famiglia
503550	509110	tradizionale, anche qui per stabilire una differenza in termini valoriali tra chi come
509110	515690	noi incarna una visione spirituale dell'esistenza, chi crede che il diritto alla vita sia elemento
515690	520630	fondamentale del nostro agire, della nostra visione del mondo e dall'altra il materialismo
520630	526590	dilagante, il materialismo di chi concepisce e vuole convincerci del fatto che droga, aborto,
526930	530430	possibilità di matrimonio e di adozione da parte delle coppie gay sono grandi battaglie
530430	535610	di libertà, chi pensa che anche la vita umana possa essere in qualche maniera mercificabile
535610	542190	ecco su questo noi abbiamo voluto avanzare un grande scontro perché questa contrapposizione
542190	546650	del spirito, contro materia sta anche travalicando i nostri confini nazionali, noi l'abbiamo
546650	551490	visto con la vicenda a Buttiglione, qualcuno la citava ieri e l'abbiamo percepita in tanti
551490	556430	campanelli d'allarme che stanno suonando negli ultimi anni. Abbiamo voluto lanciare,
556450	562210	Azione Giovani ha voluto per questo lanciare una campagna nazionale che ci ha visto sfilare
562210	566610	tra le strade di Roma all'atto della firma della Costituzione Europea per rivendicare
566610	571330	il necessario richiamo alle radici cristiane dell'Europa e l'abbiamo fatto non perché
571330	575530	vogliamo in qualche maniera come qualcuno ha stupidamente detto limitare la laicità
575530	582030	delle istituzioni. L'abbiamo fatto perché ci interessa che l'Europa delle piazze, delle
582030	589650	cattedrali, dei santi e dei poeti non rinunci a se stessa per ridursi a mero mercato, è
589650	595950	indiscutibile che l'elemento unificante dei popoli europei sta nei valori spirituali che
595950	602030	raccomunano il percorso dei suoi popoli e se l'Europa non ha il coraggio oggi di rivendicare
602030	607670	questo, non ha il coraggio di guardarsi dentro il rischio che si corre di costruire un'Europa
607670	613130	incapace di andare oltre i semplici interessi economici. Vedete anche qui si confrontano
613130	619270	due anime, quella che rivendica l'Europa di Giulio Cesare e di Carlo Magno, di Jan Palac,
619430	624830	quella che vorrebbe oggi un'Europa fiera della sua identità e capace di essere soggetto politico
624830	631070	forte e coeso da una parte, e quella di chi si accontenta di un'Europa delle banche, di
631070	637830	un'Europa dei burocrati, di un'Europa che non riesce ad andare oltre gli interessi economici.
638450	644490	Però vedete io credo che né i ragazzi di Budapest, né quelli di Praga, né i giovani
644490	649190	ingegneri italiani che costruivano passaggi sotto il muro di Berlino, né tanto meno i nostri
649190	654070	ragazzi con le loro campagne decennali si sono battuti per vedere vincere l'Europa
654070	660750	di Gliacca dei Romanoprodi ed è esattamente per questo che noi su questa battaglia non
660750	667670	getteremo la spugna. E consentitemi di ricordare, è stato fatto in più di un'occasione all'interno
667670	671870	di questa manifestazione le battaglie che Azione Giovani, le tante iniziative che ha
671870	676070	portato avanti il ricordo del cinquantesimo anniversario del ritorno di Trieste all'Italia.
677710	681430	Noi abbiamo voluto raccontare quella storia al di là della semplice commemorazione,
681430	686210	l'abbiamo raccontata nelle strade, nelle scuole, nelle università, l'abbiamo raccontata
686210	692910	alla nostra generazione, perché riteniamo che quella storia rappresenti un grande insegnamento
692910	699870	per i giovani. Vedete non fu la diplomazia a riportare Trieste all'Italia, non fu la
699870	705030	classe politica, Roberto, a riportare Trieste all'Italia. Trieste all'Italia l'hanno riportata
705030	710770	ai Triestini, l'ha riportata a un popolo fiero della sua identità, ce l'hanno riportata
710770	715130	agli studenti italiani con il loro amore, con le loro battaglie, con i loro eroi e con
715130	720910	i loro martiri. Quella storia racconta di un modello, che è il modello del patriota,
721190	724810	che è il modello di chi si batte da sempre per difendere gli interessi della propria
724810	730530	comunità nazionale, perché contro quel modello in Italia se ne contrappone da sempre un altro,
731050	736730	che è quello di chi fa finta di difendere i bisogni della comunità nazionale, ma poi
736730	741090	non riesce a perseguire altro interesse che non sia un interesse di bottega, che sia
741090	746950	esso affaristico o piuttosto ideologico. Perché noi non ce lo dimentichiamo, non ce
746950	751730	l'ha dimentichiamo la vergogna di un partito comunista italiano, di un palmiro Togliatti
752270	757390	che mentre le truppe comuniste del maresciallo Tito entravano a Trieste, pubblicava i manifesti
757390	760730	per dire ai cittadini Triestini che dovevano accogliere quelle truppe come liberatrici.
760730	767030	Sono morte 6000 persone durante i 40 giorni dell'occupazione di Trieste e qualcuno voleva
767030	774010	convincerci che quelle truppe erano liberatrici. Noi non ce la dimentichiamo la vergogna di
774010	779730	un Presidente della Repubblica, come Pertini, che ai funerali dello stesso Tito bacia vergognosamente
780290	788450	la bandiera iucoslava per rendere omaggio ad un massacratore di italiani. Su questo noi
788450	793930	dobbiamo mantenere una consapevolezza, perché poi così come non ci siamo dimenticati questa
794970	802130	storia, dobbiamo avere oggi la forza anche di non accettare, di non rimanere fermi di
802130	807150	fronte ad una classe politica che continua a riempirsi di belle parole sventolando sempre
807150	812090	la stessa bandiera rossa, ma poi rimane seduta a leggere il giornale mentre in Parlamento
812090	818350	si commemorano i martiri di Nasseria. Noi dobbiamo rispondere di fronte ad una classe
818350	822870	politica che si candida a rappresentare gli italiani all'estero nelle istituzioni, nel
822870	828370	Parlamento europeo e poi da parlamentari europei italiani eletti con i voti degli italiani
828370	832490	tentano il linciaggio di un candidato italiano alla Commissione Europea di fronte a tutti
832490	837550	i Paesi dell'Unione. Perché tanto che gliene frega a loro se questo mina la credibilità
837550	841970	dell'Italia all'estero, se mina la sua dignità, l'importante per loro è indebolire il Governo
841970	848030	Berlusconi, l'importante per loro è garantirsi una poltrona. Io credo che noi rappresentiamo
848030	854250	l'antitodo a questa grande, grave e antica malattia dell'Italia. E la nomina del nostro
854250	859490	presidente nazionale Gianfranco Fini a Ministro degli Esteri non è solamente una vittoria
859490	865130	per noi, per questo mondo, per la sua storia. È il riscatto di tutto il popolo italiano
865690	870690	perché dopo 60 anni per la prima volta a rappresentare l'Italia all'estero è un uomo
870690	875710	che riconosce tra i suoi valori fondamentali, tra i suoi valori fondanti il perseguimento
875710	883930	dell'interesse nazionale. Cioè noi oggi abbiamo la possibilità di dimostrare che non siamo
883930	888690	il popolo simpatico ma imbelle che qualcuno ha tentato disperatamente di disegnare per
888690	894310	60 anni, ma che siamo un popolo fiero con una storia costellata di eroi e con figli
894310	898230	degni che ogni giorno lo rappresentano in giro per il mondo nelle missioni di pace.
898950	904790	È una grande vittoria, lui è per noi, lui è per il nostro futuro. Ecco io credo, perché
904790	911410	vado verso la conclusione, credo che sia questa la destra del futuro. Credo che la destra del
911410	917710	futuro sia quella che riesce a mettere insieme identità e modernità, quella che riesce
917710	928210	ad affrontare le grandi sfide della modernità senza dimenticare da dove viene, quella che
928210	933370	sa da quale parte della barricata vuole stare e non è disposta a saltare dall'altra parte
933370	939750	della barricata per fare un interesse di bottega. Questo siamo, questo vogliamo essere.
939870	949270	Consentitemi di chiudere con una citazione di Ernest Junger che dice, noi non vogliamo
949270	958190	un mondo pacifico e ben costruito, vogliamo un mondo con la sua melodia infinita, con la
958190	959410	sua tonalità di colore.
