start	end	text
0	5600	realizzando le grandi infrastrutture, il corridoio 5, portando la nostra cultura,
5860	11020	la nostra imprenditoria, da dove l'Italia c'era, e la nostra lingua, la
11020	21520	nostra scuola. Per me poi questo vale più del tutto il resto. Solo retorica? Io non
22640	33500	credo. Ezra Pound, e così concludo, ci disse, quello che ami veramente rimane,
34220	40020	tutto il resto escoria. Quello che ami non ti verrà strappato, quello che ami è
40020	64180	la tua eredità. Grazie. Abbiamo ancora due interventi di Giacomo Lisse e Francesco Cananzi,
64180	71840	perché ritengo che Rampelli non ci sia, Mussolini non sia presente, De Gregorio non è presente,
72380	80020	Bettamio non è presente. Giacomo Lisse, al quale io chiedo di rimanere nei cinque minuti, per favore,
80860	87880	e poi concluderemo con Francesco Cananzi. Grazie, Presidente. Mi sono scritto alcune
87880	94360	considerazioni per rimanere nei tempi. Anzi, utilizzerò meno dei cinque minuti a disposizione.
94700	101600	Amiche ed amici del popolo della libertà, io porto il saluto del Molise, la mia regione,
102920	109800	a tutti i delegati, agli amministratori locali, ai parlamentari, ai rappresentanti di governo.
111060	117660	Una regione piccola, ma con un cuore grande, nata sul lavoro duro nei campi e sulle aspre
117660	123280	montagne dell'Appennino italiano, ma che da qualche anno, sotto la guida di amministratori
123280	130260	responsabili e, aggiungo, anche competenti, sta faticosamente costruendo le basi per un futuro
130260	137160	migliore per i nostri figli. E' la regione che prima, in Italia, ha varato un piano di sostegno
137160	144620	alle famiglie con un impegno di 20 milioni di euro all'anno. Ha affrontato la crisi economica,
144620	149960	sostenendo con risorse proprie le aziende che rappresentano la spina dorsale dell'economia
149960	156400	regionale, convinta che è proprio nei momenti di crisi e di difficoltà che bisogna investire sul
156400	163200	futuro. E' la regione che, con un proprio fondo, ha raddoppiato la disponibilità di spesa della
163200	169140	social card e prepara il proprio territorio ad accogliere la grande sfida dell'autostrada
169140	176400	Termoli-San Vittore, inserita dal governo Berlusconi nel piano strategico delle grandi opere
177480	183600	infrastrutturali. Ma soprattutto è la regione che, dopo appena sei mesi dalla vittoria di Prodi e
183600	189560	della Sinistra in questo Paese alle elezioni politiche del 2006, con il candidato della
189560	194940	Casa delle Libertà, l'onorevole Michele Iorio, è riuscito a vincere le elezioni regionali.
194940	201620	Fu allora che il Presidente Berlusconi, che in quelle elezioni si spese personalmente,
202780	207780	capì che era iniziato un nuovo corso storico per il nostro Paese e per la nostra parte politica,
207900	215680	un percorso che sarebbe stato da lì successivamente lastricato dalle vittorie alle politiche e alle
215680	221640	regionali, prima in Abruzzo e recentemente in Sardegna. E' stato già ripetuto più volte,
221640	227720	in questi due giorni, che noi tutti siamo testimoni di un evento eccezionale, storico e
227720	233260	ripetibile, la nascita di un nuovo soggetto politico che unisca la maggioranza degli italiani,
233840	239940	quella parte del nostro Paese che si riconosce nei valori della libertà, della democrazia e del
239940	247600	riformismo. Un nuovo partito che affonda le radici nella magica sera del 2 dicembre 2006 in Piazza
248180	255220	Giovanni, quando due milioni di persone si sono ritrovate spontaneamente a Roma a gridare al
255220	261200	Paese la voglia di appartenere a un solo movimento, al di là delle bandiere, degli slogan e della
261200	267220	storia di ciascuno di noi. E' allora che è nato il popolo della libertà. E da quel momento gli
267220	274140	italiani sono diventati protagonisti della scena politica del nostro Paese, spingendo i dirigenti
274140	280380	ad accelerare il processo di semplificazione e di unificazione, a presentarsi in liste unitarie,
281240	287180	a cominciare a pensare con la stessa mente e con lo stesso cuore. E questo non è successo a sinistra
287740	293300	dove, non avendo ideali comuni su cui costruire, si è deciso di dar vita al partito democratico,
293420	299900	che democratico non è, che non è un soggetto politico nuovo, bensì la somma dei comunisti e
300080	306280	degli ex democristiani di sinistra con i risultati che sono davanti agli occhi di tutti, vale a
306280	313000	dire un'operazione senza passato e quello che è più grave senza futuro. Lo constatiamo ogni giorno
313000	319120	nelle aule parlamentari e recentemente lo abbiamo vissuto nell'Aula del Senato durante la discussione
319120	324960	sul testamento biologico. Si è evidenziato in maniera netta come ogni qualvolta il partito
324990	331770	democratico si trovi a dover affrontare temi di grande rilevanza inerenti alle grandi riforme e
331770	337030	quelli legati ai temi etici. Al suo interno esplodono le contraddizioni che da sempre
337030	344970	hanno diviso e distinto i comunisti dai cattolici. In nessuna delle oltre 250 votazioni effettuate
344970	350810	in Aula c'è stata una linea comune tra i senatori del partito democratico, contrariamente a quanto
350810	356330	successo nel nostro schieramento. Questo è quello che vogliono e chiedono i cittadini e
356330	361930	i loro governanti ed amministratori, che si governi, si amministri, si faccia nell'interesse
361930	367110	comune e nell'interesse generale. Ed è quello che il nostro Presidente Berlusconi sta facendo
367110	372630	nell'azione di governo, nell'economia, nelle opere infrastrutturali, nella scuola e nell'università,
373170	380030	nel lavoro, nella sanità. In questo momento di festa e di celebrazione però, permettetemi
380030	385810	un attimo di commosione. Commosione di un dirigente di Forza Italia che ha vissuto tutta
385810	390350	la storia di questo grande movimento, che ha cambiato la politica e la storia del nostro
390350	396610	Paese. Il mio pensiero va ai dirigenti, ai sostenitori, agli elettori di Forza Italia,
397250	403790	a quanti hanno creduto in questo partito dedicando se stessi, le loro passioni, le loro aspettative,
403790	411890	i loro sogni. Il mio pensiero va a quanti hanno trascorso molte domeniche ai gazebo, sotto la
411890	418590	pioggia spesso, a raccogliere firme e a distribuire volantini. A quanti si sono spesi in tutte le
418590	423670	campagne elettorali senza nessun tornacondo personale, ma con la sola idea di partecipare
423670	428930	ad un grande evento e un grande progetto. A quanti hanno atteso per mesi una visita del
428930	433930	presidente Berlusconi con la sola speranza di dirgli di andare avanti perché la gente
433930	440090	sarebbe stata al suo fianco. Questi ricordi, questi pensieri rimarranno per sempre nel
440090	445390	mio cuore e nella mia mente. Io li conserverò in un cassetto insieme alla spilla di Forza
445390	453050	Italia che in un'occasione per me importante mi fu regalata da Berlusconi e che ho portato
453050	458330	con l'orgoglio sempre che si riserva alle cose veramente importanti. Auguri a tutti
461090	472610	Grazie, grazie. Abbiamo l'ultimo intervento, Francesco Cananzi, cinque minuti, due minuti.
473150	478970	Grazie Presidente. Per rispetto a quelli che sono qui, io non userò i cinque minuti,
479010	485390	non userò appena due. Voglio ricordare a me stesso e a tutti che quest'anno ricorre un
485390	490410	anniversario, quello del futurismo. Un evento che oggi noi in Italia riconosciamo tutti
490410	494650	essere stato forse il più grande fermento degli inizi del secolo scorso e per tutto
494650	501290	il secolo scorso. Un fermento che ancora oggi trova, agisce come lievito in quelle che sono
501290	506730	anche tante delle vigistudie nelle vita moderne, nell'arte, nella cultura, ma anche nella tecnologia,
506930	515370	nella musica. Un grande evento che ha stigmatizzato comportamenti, idee, culture, arte e comportamenti.
518510	524690	Oggi, all'inizio del nuovo secolo, noi viviamo un altro grande evento. Un evento che è destinato
524690	532910	a cambiare la storia di quest'Italia nel rinnovamento e nella modernizzazione. Un evento
532910	538270	che è destinato a costruire quella nuova Italia di cui tutti oggi abbiamo noi parlato. Un evento
538270	543750	che è la spida epocale che ci attende. Un evento che caratterizzarà, come il futurismo
544450	550350	caratterizzato il secolo scorso, i prossimi decenni, se non l'intero secolo. Un evento che
551690	558110	costituirà il percorso della nuova Italia, che sarà un'Italia moderna, innovatrice, forte delle
558110	563890	proprie cultura, forte delle proprie tradizioni, forte delle proprie radici che trovano nella
564710	571490	cristianità la capacità di tradurre nel senso di portare, oltre di andare avanti, di portare
571490	580050	attraverso, di tradere i valori della nostra natura. Ragione, volontà, amore sono una persona
580050	586970	che ci rende libera, ricordato il benedetto XVI in questo ultimo messaggio ai Vescovi.
588150	593410	Questo partito è destinato ad essere, in questo secolo, il vero e corrente strumento del
593410	600530	cambiamento. Noi costruiamo qui oggi il soggetto che unisce quanti amano la propria patria,
601830	606750	nel senso e nel ricordo che Pocanzi Menia ha voluto richiamare l'attenzione di noi tutti,
607270	611910	il terreno dei nostri padri, il terreno delle nostre radici, il terreno che noi amiamo,
612010	618850	il terreno delle nostre tradizioni. Ma sarebbe illusorio non ricordarsi che tradizione non
618870	625330	vuol dire immobilità, tradizione vuol dire conservare i valori ma adattarli e propagandarli
625330	630650	con gli strumenti che l'epoca moderna ci danno, tutti gli strumenti, compresi quelli della
630650	636230	comunicazione, compresi quelli che le strutture sociali in evoluzione ci garantiscono, purche
636230	640850	siano fermi i principi da cui si parte, purche siano fermi gli obiettivi che si vogliono
641590	646290	raggiungere. E quindi riforma dello Stato, riaffermazione del merito e di dignità della
647630	652850	persona. Libertà avo cercando che si cara come sa chi per lei vita rifiuta. Quante
652850	658270	volte abbiamo letto e ripetuto queste frasi? Noi vogliamo che nessuno più debba rifiutare
658270	663750	la propria vita per la libertà e con questo vado col pensiero a quei tanti militanti,
664390	668710	a quei tanti giovani che anche negli ultimi decenni hanno sacrificato la propria vita
668710	673730	per garantire a noi oggi qui la libertà di essere in questo consesso e di poter gridare
674610	681970	il nostro amore per la nostra patria. Noi vogliamo difendere la vita come un bene indispensabile,
682790	688430	indispensabile e indissolubile, un bene dell'intera società, in tutti i suoi momenti, come è
688430	694190	stato più volte detto, dal primo momento del concepimento fino alla sua naturale estinzione.
696070	703710	Questo partito dovrà, se vorrà, ma io credo che lo vorrà, nella esaltazione e sintesi
703730	710730	delle singole specificità, far sì che l'Italia divenga finalmente una e possa guardare l'Europa
710730	718890	con rinnovato orgoglio e con capacità di costruire o di partecipare ad una costruzione
718890	725550	dell'Europa così come noi l'abbiamo agognata e in altre epoche forse anche vissuta. In
725550	732870	un rinnovato afflato, nazionale e popolare, noi rappresentiamo il grande popolo degli
732870	735190	italiani. I simboli...
