start	end	text
1748100	1757820	nomi, tre nomi, ne sceglie uno, si votano in blocco. Ogni partito mette il suo componente,
1758020	1766040	laico al CSM nell'attuale sistema. Come funziona domani? Il Parlamento contribuisce a stilare
1766040	1772800	una lunga lista di persone che ovviamente hanno le competenze e in quella lunga lista
1772800	1780320	poi qualcuno verrà sorteggiato. Di grazia, secondo voi, qual è il sistema che garantisce
1780320	1786640	minore dipendenza dalla politica dei due tra quello attuale e quello che stiamo costruendo?
1787440	1793700	Anche qui a me non sembra una cosa molto difficile. Chiaramente voglio anche dare un'altra risposta
1793700	1802780	che qui si dice va beh, ma la lista se la fa la maggioranza. Non si può fare, ma non
1802780	1807960	condividendo la scelta con tutti i partiti, ma non perché siamo gentili noi, perché altrimenti
1807960	1815120	sarebbe banalmente incostituzionale e quindi non si potrebbe fare. Quindi anche questo
1815120	1823580	non corrisponde a verità e comunque signori, io vorrei ricordare i nomi di alcuni vicepresidenti
1823580	1834060	del CSM, perché sembra che la politica finora, Virgigno Rognoni, Nicola Mancino, Michele
1834060	1841680	Evietti, Giovanni Legnini, Davide Ermini, tutte persone degnissime, ma vi sembra che
1841680	1849560	fossero estranea la politica. Allora guardate, vi dico di più. Io penso che la legge attuativa
1849560	1855340	della riforma debba addirittura prevedere un periodo di decantazione, cioè qualche
1855340	1862340	anno deve passare, prima che chi è stato in politica possa aspirare a entrare tra
1862340	1875080	i laci del CSM, cosa che non si è ritenuto di fare fino ad oggi. Terza e ultima novità
1875080	1879100	nella riforma c'è l'introduzione di un nuovo organismo, è forse la cosa che io considero
1879100	1886160	più importante che è l'alta corte disciplinare per giudicare i magistrati che sbaglia. Finalmente
1886160	1891160	dopo 80 anni anche i magistrati che non si dedicano al proprio dovere come impongono
1891160	1897160	la legge e l'etica dovranno vedersela con un organismo disciplinare terzo e imparziale
1897160	1903260	che valuterà il loro operato nel merito e non più con un CSM eletto su base correntizia.
1903260	1910080	Grazie a questo sistema forse noi non vedremo più le cose che io vi ho raccontato in apertura
1910080	1917320	di questo intervento, cioè casi di magistrati palesemente negligenti che non hanno risposto
1917320	1924660	davanti a nessuno della loro negligenza. Perché se c'è qualcosa di più odioso di un sistema
1924660	1929100	che non garantisce che un magistrato come tutti gli altri cittadini, particolarmente
1929100	1934840	come tutti gli altri che hanno delle responsabilità paghi per i propri errori è un sistema che
1934840	1941320	chiude gli occhi davanti a quegli errori e che consente che quei magistrati negligenti
1941320	1950140	ricevano valutazioni positive per fare carriera. In uno stato che si definisce giusto e serio
1950140	1956180	e che vuole dare il buon esempio questo non è accettabile. Chiunque sbagli si deve assumere
1956180	1961620	la responsabilità di quegli errori e chiunque non faccia bene il proprio mestiere non merita
1961620	1968560	di essere promosso esattamente come chi fa bene il proprio lavoro merita di essere valorizzato
1968560	1981360	e non di restare al palo perché non aveva le amicizie giuste. Anche per la Corte disciplinare
1981360	1989840	dove è che si realizzerebbe questa tanto, diciamo così, allarmistica subordinazione
1989840	1997920	della magistratura alla politica? Non si capisce. Oggi la sezione disciplinare del CSM è composta
1997920	2005160	da sei togati e da tre laici eletti dal Parlamento, quindi il rapporto è due terzi, un terzo.
2006320	2013340	Parlamento incide per un terzo. Invece nella Corte disciplinare la quota eletta dal Parlamento
2013340	2020580	sarà di tre membri su quindici, quindi un quinto che mi pare meno di un terzo. I partiti
2020580	2025460	secondo voi incideranno di più o incideranno di meno perché anche mia figlia di nove anni
2025460	2035020	sa fare questo calcolo banale. Questi sono i contenuti veri della riforma, non altri,
2036040	2041100	contenuti che non sono di destra, non sono di sinistra, non sono di centro, sono contenuti
2041100	2047100	di banale buon senso, talmente di buon senso che le stesse soluzioni sono state ampiamente
2047100	2053140	proposte e sostenute in passato anche da molti di coloro che oggi dicono di essere per il
2053140	2058940	Parlamento gente che ha cambiato idea non perché sia convinta come noi delle proprie
2058940	2064720	tesi e si batte per affermarle, ma perché ha un altro obiettivo che però non c'entra
2064720	2068960	niente con la Costituzione, non c'entra niente con la giustizia, non c'entra niente con gli
2068960	2075080	interessi dei cittadini, c'entra con l'interesse delle correnti e dei partiti che sperano
2075080	2080980	di poter continuare a piegare lo stato della giustizia ai loro interessi di par. Ma è
2081140	2091520	un'altra cosa. Però che non è una riforma di parte è confermato dai molti esponenti
2091520	2097740	che voglio ringraziare della sinistra che hanno affiancato in questa campagna la loro
2097740	2104880	voce alla nostra a sostegno del sì. Non hanno votato, non voteranno mai per questo governo,
2104880	2112240	non voteranno mai per me, ma manifestano la convinzione che hanno con argomenti di merito
2112240	2118080	e questo dimostra chiaramente come, diciamo, su questa riforma ci sia una condivisione
2118080	2125840	che va ben oltre i confini dell'attuale maggioranza. Allora io consiglio di non cadere nella trappola
2125840	2133480	di chi dice non importa il merito, bisogna andare a votare no contro la Meloni. Lo consiglio
2133480	2140740	soprattutto a coloro che mi detestano. Perché allora intanto non c'è alcuna possibilità
2140740	2158760	che io mi dimetta in nessun caso. Io voglio arrivare alla fine della legislatura
2160000	2169020	e voglio farmi giudicare sul complesso del mio lavoro. Quindi se non amate questo governo
2169020	2175900	ma condividete la riforma, io consiglio di votare sì, anche se il governo non vi piace.
2176100	2181980	Tra un anno, quando si andrà a votare alle elezioni politiche, avrete comunque l'occasione
2181980	2187800	di mandare a casa il governo. Però intanto, indipendentemente da chi guiderà il prossimo
2187800	2193500	governo, avrete portato a casa una giustizia riformata, più giusta, più efficiente, più
2193500	2199540	meritocratica e più libera. Se invece voi votate no, vi tenete questo governo e vi tenete
2199650	2229630	pura una giustizia che non funziona. Non mi pare un affarone, posso dire. Non è un grande
2229630	2237530	a me, non serve al governo, la riforma serve ai cittadini, a tutti i cittadini, anche a
2237530	2242010	quelli che non mi votano, anche a quelli che appunto mi detestano e se non passa stavolta,
2242290	2247750	molto probabilmente noi non avremo un'altra occasione e allora ci ritroveremo correnti
2247750	2254370	ancora più potenti, magistrati ancora più negligenti che fanno carriera, decisioni ancora
2254370	2258650	più surreali sulla pelle dei cittadini che incideranno sulla vostra vita ogni giorno,
2259670	2264470	immigrati illegali, stupratori, pedofili, spacciatori rimessi in libertà che mettono
2264470	2275530	al repentaglio la vostra sicurezza, antagonisti che devastano le vostre stazioni senza alcuna
2275530	2282110	conseguenza giudiziaria, milioni di euro risarciti per ingiusta detenzione o spesi
2282110	2288250	per processi mediatici e inutili che vengono pagati con i proventi delle vostre tasse,
2288470	2294230	figli che vengono strappati alle madri perché i giudici non condividono il loro stile di
2294230	2301270	vita se vivono in un bosco, quando nessuno dice o fa nulla di fronte alla realtà di
2301270	2307890	bambini mandati a rubare o a fare accattonaggio. Penso che il referendum sia anche l'unica
2307890	2313010	occasione che i cittadini hanno e per i cittadini intendo tutte le persone di buon senso di
2313010	2319070	destra e di sinistra di dire a gran voce che non sono d'accordo con queste sentenze surreali
2319070	2324410	che mettono al repentaglio la loro sicurezza e che disegnano uno Stato che pretende di
2324410	2328770	essere perfino proprietario dei tuoi figli, perché quando non siete d'accordo con la
2328770	2335230	politica lo potete dire, lo dite in libere elezioni, colpite i partiti politici ma lo
2335230	2339930	potete dire, quando pensate invece che la giustizia non sia funzionando non potete fare
2339930	2353930	niente, nessuno può fare niente. Salvo stavolta, salvo stavolta, quella che noi abbiamo il
2353930	2362690	22 e il 23 di marzo è un'occasione straordinaria. Allora non dovete voltarvi dall'altra parte,
2362690	2371730	non stavolta, non restate a casa, non disinteressatevi, vi riguarda tutti, vi riguarda come singoli,
2371830	2377010	vi riguarda come cittadini, vi riguarda come comunità, perché noi ce la stiamo mettendo
2377010	2382950	tutta per modernizzare questa nazione, per farle voltare pagina, per consentirle di tornare
2382950	2389050	a stupire il mondo, però stavolta non ce la facciamo da soli, stavolta c'è bisogno
2389050	2396150	di voi, 5 minuti, il 22 e il 23 di marzo, per entrare in una cabina elettorale, prendere
2396150	2402630	una matita e tracciare una croce sul sì, perché in quel segno c'è molto di più di una croce
2402630	2407850	su un foglio, c'è l'idea di giustizia in cui crediamo, c'è il futuro che vogliamo
2407850	2413250	lasciare ai nostri figli, c'è la fiducia nel fatto che noi possiamo cambiare quello che
2413250	2420330	non funziona, c'è il messaggio che non accetteremo che tutto rimanga sempre uguale, ci sono momenti
2420330	2426270	nei quali una nazione deve sapersi guardare allo specchio e decidere se restare com'è
2426270	2431110	o se provare a diventare migliore, questo è esattamente uno di quei momenti, e allora
2431110	2437250	non restate a guardare e non giratevi dall'altra parte, 5 minuti, una croce sul sì e insieme
2437250	2442750	possiamo aprire una pagina nuova per la giustizia italiana e per la nostra nazione e dimostrare
2442750	2453790	ancora una volta che quando gli italiani decidono di scrivere il proprio futuro, beh signori,
2454910	2457950	non c'è niente che li possa fermare, mi ringrazio.
