start	end	text
0	6080	È chiaro anche a livello europeo che uno dei problemi della scarsa occupazione in Europa
6080	12680	è la scarsa produttività del capitale rispetto a quello che avviene negli Stati Uniti, la
12680	19280	quale dipende molto dai modi in cui sono organizzati i sistemi finanziari, essi stessi troppo poco
19280	27840	flessibili e troppo orientati alla conservazione. L'Unione Europea ha deciso di mettere in atto,
27840	33960	così come già si è fatto, lo dicevo un attimo fa per il mercato del lavoro, analoghe procedure
33960	41540	di monitoraggio e di peer pressure sugli Stati membri per stimolarli alle riforme strutturali
41540	47920	nei mercati dei beni, dei servizi, dei capitali che sono altrettanto cruciali per l'occupazione
47920	55340	e per il lavoro. L'altro aspetto nel quale la dimensione lavoro non è stata tanto vista
55340	62660	è stata nella condotta della fiscalità anche sul piano europeo e come è noto l'Europa
62660	69600	si sta adesso impegnando per un tipo di coordinamento della fiscalità che magari non menziona esplicitamente
69600	74600	il lavoro quando si tratta di coordinare la fiscalità sui capitali ma che è condizione
74600	82220	strettamente indispensabile perché non prosegua ma si inverta la tendenza al gravame fiscale
82220	87860	sempre maggiore sul lavoro e al favore fiscale sempre maggiore sulla rendita finanziaria.
88460	97600	L'altro esempio, l'ultimo che porto di occasione in cui il lavoro non è stato visto come sufficientemente
97600	112200	in gioco in altre decisioni è quello dei sistemi previdenziali che hanno portato e porteranno
113200	120380	lavoro in futuro soprattutto del lavoro dei giovani. Io credo che abbia profondamente
120380	128100	ragione Sergio Coferati nel richiamare ad una maggiore prudenza e articolazione nel
128100	137860	trattare questo tema importante e quasi esplosivo dei giovani e credo che abbia ragione nell'osservare
137860	143960	che nel centro nord non c'è un problema di disoccupazione giovanile ma è verissimo
143960	149360	tuttavia che nel mezzogiorno come gli stesso ha accennato il problema della disoccupazione
149360	154560	è in misura largamente prevalente un problema di disoccupazione giovanile il che significa
154560	176820	che la dimensione per età è in misura largamente prevalente un problema di disoccupazione giovanile
176820	201300	il che significa che la dimensione per età, cioè se anche non si trovano i giovani del
201300	209300	centro nord in una situazione di disoccupazione o vi si trovano in misura moderata rimane
209300	219900	vero che il non affrontare tempestivamente questa tematica strutturale delle pensioni
219900	226500	comporterà ove potesse persistere una situazione di piena occupazione dei giovani nel centro
226500	234880	nord comunque ad una situazione in cui dovranno dedicare una quota crescente del loro reddito
234880	240720	e molto maggiore di quella dei loro coetanei di altri paesi a servire il debito pensionistico
240720	251140	delle generazioni precedenti. Concludo con un'osservazione che è un semplice auspicio
251140	257420	su un aspetto che però a me sembra fondamentale al di là dell'esempio è solo un esempio
257420	264640	delle pensioni cioè l'auspicio che nel giorno in cui speriamo si avvia il percorso di un
264640	272780	nuovo governo dall'antica dottrina del valore lavoro passando per questa riflessione di
272780	281940	oggi sul lavoro come valore l'Italia possa fare il passo decisivo per combattere davvero
281940	289560	la disoccupazione e per permettere a tutti di vivere il lavoro come valore e non la mancanza
289560	297740	del lavoro come frustrazione o come disperazione. Il passo decisivo semplice e certamente politicamente
297740	304420	difficile e spero che il nuovo governo ne abbia la convinzione e la forza è quello
304420	310420	di uscire da una politica economica che è stata negli ultimi anni finalmente disciplinata
310420	319700	sul piano macroeconomico ma che a me pare è ancora troppo conservatrice sul piano strutturale
319700	328080	finché la conservazione è essa di fatto vissuta come un valore è impossibile affermare
328080	331740	veramente e per tutti il lavoro come valore grazie.
339280	348620	Grazie al professor Monti concludiamo la nostra tavola rotonda dando la parola al ministro
348620	354820	Treu che potrà in qualche modo anche riassumere alcuni degli auspici che ha introdotto il
354820	360580	commissario Monti anche se credo che non potrà sciogliere l'interrogativo se la formazione
360580	366560	di un nuovo governo senza l'appoggio di rifondazione comunista tenga in piedi le 35 ore oppure
366560	368680	no domanda che non ti rivolgio.
368680	382960	Non accetto battute così compromettenti invece mi inserisco in questa riflessione veramente
382960	390960	un'occasione molto preziosa in periodi di tale turbolenza è molto importante riflettere
390960	402340	cercando di guardare un orizzonte ampio quindi mi cimento con questo mi si scuserà se non
402340	411520	appunto scendo a discutere di coincidenze certamente importanti la prima osservazione
411520	416760	che vorrei fare che è stata appena toccata qui a proposito di valori è di richiamare
416760	427320	l'importanza del rapporto tra sviluppo e lavoro anche se volete il valore dello sviluppo come
428140	436080	fonte di lavoro e come anche ovviamente attivato dal valore io lì spesso trovo su questo una
436080	444700	tensione squilibrata magari quando invece mi trovo a discutere con colleghi americani
444700	451960	ho sempre l'impressione che loro lo affrontino molto più a fondo poi non è detto che arrivino
451960	462960	a risultati giusti ma perché questo è decisivo l'europa negli ultimi anni si è occupata molto
462960	475320	di stabilità e poco di sviluppo e io credo che un nuovo equilibrio più coraggioso se
475320	482560	si vuole adesso tra stabilità e sviluppo sia essenziale per se vogliamo affrontare
482560	491340	e anche vivere il lavoro in modo meno drammatico. Questa è un'associazione che mi sento fare
491340	499460	dai colleghi di altri paesi perché è una situazione di sviluppo bloccato o di sviluppo
500360	505860	squilibrato il lavoro viene vissuto come un dramma tutti i temi si drammatizzano c'è un
505860	512400	accenno anche in qualche relazione forse in quella scritta di Deritta questa è un'affermazione
512400	519620	generica si deve precisare naturalmente ma io mi limito qualche spunto anzitutto
522480	531160	la qualità dello sviluppo è importante oltre che l'intensità naturalmente per gli effetti
531160	535980	che ha su la quantità e la qualità di lavoro. L'ultimo rapporto c'è è molto bello secondo
535980	542220	me che abbiamo discusso qualche giorno fa mostra facendo anche delle analisi comparate
542220	546360	dentro l'europa poi bisognerebbe farlo con il resto del mondo ma è ancora più evidente
546360	556680	come noi e anche l'europa abbiamo avuto poco coraggio nell'innovare e sia lo spettro
556680	570460	delle specializzazioni produttive sia affrontare i temi dei servizi innovativi. Nelle giudizi
570460	576340	che la commissione europea ci ha trasmesso proprio in questi giorni in cui si sono esaminati
576340	583400	in modo incrociato i piani nazionali del lavoro ci sono molte osservazioni importanti infatti
583400	590700	noi siamo in un processo di impegno congiunto tra i paesi molto importante ma c'è anche
590700	596880	un osservazione generale che appunto l'europa una delle ragioni per cui noi abbiamo questo
596880	599920	deficit di creazione di occupazione e che abbiamo avuto.
