start	end	text
0	8100	mandando in campo una squadra forse troppo debole rispetto a chi gioca duro e non viene neanche ammonito?
11720	21980	Risponderò al suo interrogativo prendendolo un po' alla larga perché ho trovato attraenti le acute riflessioni del professor Scarpa
21980	31280	che ha connotato le tre grandi precedenti fasi di globalizzazione, ciascuna con il nome di un sovrano in effetti.
31700	39200	Oggi è difficile fare altrettanto e, dice Scarpa, dovessi scegliere un nome forse Soros.
40580	46760	Io non mi ero mai posto il problema di un nome evocativo della globalizzazione di oggi.
46760	57260	Non credo che sceglierei Soros anche perché, se mai lo è, sarebbe degli aspetti finanziari della globalizzazione.
58680	67220	Mentre Scarpa parlava io pensavo che nome indicherei, ne indicherei due.
68660	75660	Uno, non nomi di sovrani a conferma del fatto che non è un processo molto governato oggi quello della globalizzazione.
75660	81620	Ne indicherei due di nomi, uno più recente e uno meno recente.
81800	86160	Quello più recente al posto di Soros secondo me è Bill Gates.
87980	93160	Non lo dico perché io sia sempre soggiogato dalla sua forza e dal suo fascino.
96700	101300	Ma questa globalizzazione ha avuto grandi conseguenze finanziarie,
101300	109800	ma diamole il merito, è stata trascinata soprattutto dall'innovazione tecnologica e soprattutto nella tecnologia dell'informazione.
111280	117520	Quindi dovessi scegliere una punta di diamante, è il software ed è il signor Bill Gates.
119900	129000	Ma c'è anche un nome che è di 50 anni più vecchio, vi farà sorridere seppure ve lo ricordate.
129000	133500	Jean Monnet, l'inventore dell'integrazione europea.
134480	139920	Perché? Perché in questi ultimi 20-30 anni stiamo avendo la globalizzazione,
140040	148760	ma da 50 anni abbiamo una globalizzazione a livello continentale in Europa, inventata da Jean Monnet.
149040	155500	E quella con un metodo di governo, quella è stata una globalizzazione condotta largamente con successo
155870	161390	che ha riguardato una grande parte del mondo, anche se piccola l'Europa,
161650	170350	e che è stata fondata con grande genialità sull'intuizione che per globalizzare in modo armonioso e sostenibile
170350	175530	bisogna contemporaneamente smantellare ostacoli e integrare i mercati,
175690	179370	ma anche coordinare certi strumenti di politica economica.
182170	185870	Insisterei su questi due nomi anche perché appartengono a due continenti,
186890	189870	sono uno un imprenditore e l'altro un visionario politico,
192010	198210	e se vado avanti nella riflessione forse ci offrono lo spunto per capire come andare avanti nella globalizzazione.
198290	203910	Io ho sostenuto molte volte che non è più l'America,
203910	211710	ma non sono gli Stati Uniti che possono essere i leader di un processo di globalizzazione accettabile
211710	215850	che porti più economia di mercato e più democrazia nel mondo.
216410	223830	No, è necessariamente destinato a scontrarsi con reazioni forti che vinceranno
223830	231410	un processo di globalizzazione affidato a poche imprese multinazionali e a una sola superpotenza politica.
233190	238130	La globalizzazione per durare, per migliorare, per essere accettata
238730	243130	ha bisogno di un ruolo di governance multilaterale
244510	249690	e se deve trovare delle ispirazioni, malgrado molte debolezze dell'Europa,
249930	255470	non c'è in giro un modello che abbia fatto le sue prove concrete così soddisfacentemente
255470	260030	come il modello dell'integrazione europea, quindi jamonet.
260030	264190	Ecco perché è così importante che l'Europa si rafforzi,
264930	270530	trovi la capacità di emendare i suoi molti difetti ma di essere orgogliosa dei suoi pregi
271450	274530	perché non c'è in giro nel mondo qualcuno che abbia nel proprio DNA
275390	278190	qualche cosa che è unito alla forza degli Stati Uniti
278190	281930	e speriamo sempre di più dell'Asia possa governare la globalizzazione.
283910	288270	Chiudo rapidamente rispondendo più direttamente alla sua domanda.
288270	293770	È vero che l'Europa ha costruito un sistema in cui c'è un mercato,
294430	297250	per carità quanto lontano dall'essere perfetto,
297570	302750	ma un mercato abbastanza regolato e che funziona
302750	307210	e non l'ha fatto per sfizio di simpatia per il mercato
307770	309770	come costruzione sadico intellettuale,
311090	315770	l'ha fatto perché la scommessa era quella di unire degli Stati
315770	320270	e di creare un grande campo di gioco per le loro economie
320910	324750	perché non si combattessero più nel campo della guerra
325270	330650	e per fare questo ha dovuto stabilire delle regole che hanno portato,
330650	333270	non dimentichiamolo, certamente a certi eccessi,
333910	337390	certamente a qualche direttiva più del dovuto,
337490	340270	speriamo che anche nei singoli paesi si faccia,
340270	342270	so che la Confindustria ha in animo di farlo,
343800	346340	una revisione attenta sul piano nazionale
346340	349480	se non vi sia un eccesso di regolamentazione,
350280	356860	ma ha creato un modello che funziona piuttosto bene.
357460	361000	È verissimo, l'ho detto anche ieri sera per quelli di voi che erano al teatro,
361700	363880	che c'è un elemento di squilibrio in questo
363880	370100	perché l'Europa ha un mercato abbastanza duro da osservare nella sua disciplina
370100	372760	che limita comportamenti di imprese,
373140	376040	che limita comportamenti di sindacati,
377140	379920	che limita comportamenti degli Stati
379920	383560	che quando ci provano ad avere manifestazioni di nazionalismo economico
383560	387860	vengono regolarmente bacchettati dopo qualche mese dalla Commissione
387860	390600	o dopo qualche anno dalla Corte di Giustizia,
392980	395600	ma psicologicamente per i politici europei,
396900	398740	per gli imprenditori europei,
398740	400240	per i sindacati europei,
401540	404300	sarà sempre meno accettabile che
404300	408060	noi si debba essere costretti al rispetto di certe regole
408060	411240	anche se se ne vede la finalità ultima e la si condivide,
412440	417240	mentre altri nel mondo sono più liberi di seguire la loro discrezionalità.
418380	421240	Ecco perché io credo che sia compito di un'Europa
422720	424240	che smetta di autoflaggerlarsi
424320	429480	se 20.000 cittadini in un certo paese votano noi in un certo referendum
429480	431820	la loro scelta sovrana, ci lasciano
432580	438040	e che invece trovi la forza per migliorare i propri comportamenti
438040	439820	per essere più incisiva sul piano internazionale
440600	444300	per portare nelle sedi WTO ed altre
444820	448140	la proposta di regole simili alle nostre
448140	452580	e faccia poi, chieda che quelle sedi come il WTO comincia a fare
452580	455400	facciano l'enforcement di queste regole.
455600	459080	Per questo non ci vuole un'Europa
460800	466320	che si paralizzi come la lepre che attraversa la strada
466320	471240	sotto gli abbaglianti delle critiche di questo o quel politico degli Stati membri.
471480	474200	Ci vuole un'Europa che al contrario sappia,
474240	480220	con l'aiuto degli Stati membri, essere più assertiva sul piano globale.
480220	486720	E concludo, là dove l'Europa si è data i mezzi per decidere unitariamente
487540	490620	oggi non è seconda rispetto agli Stati Uniti.
490800	495160	Nel campo del governo della moneta e nel campo del governo della concorrenza
495160	497880	i due soli campi oltre a quello del commercio estero
497880	501720	dove si è data il potere di decidere unitariamente
502980	508060	oggi negli Stati Uniti stanno studiando il modello della politica monetaria europea
508060	514600	che stanno studiando come possano rimediare al caos del loro sistema antitrust interno
515560	519740	e i paesi emergenti stanno guardando al modello europeo
519740	522520	nell'introdurre nuove legislazioni di concorrenza.
522940	525200	Quindi abbiamo un grande potenziale,
525220	528560	siamo paralizzati dalle nostre regole dell'unanimità,
529240	531620	dal fatto di avere procedure di decisione lente.
531940	535600	Il trattato di Lisbona rimedia in parte a questo.
535600	541100	Io vedo un ruolo, temo indispensabile,
541740	544100	una responsabilità grande per l'Europa
544100	550260	per consentire non solo un migliore stato di se stessa nella vicenda della globalizzazione.
550260	555560	Contro la globalizzazione, questo influisca rispetto alla politica e alle scelte della politica
555560	560100	e allora la domanda è, è possibile che la globalizzazione sia una porta girevole
561600	563100	che noi teniamo aperta
564220	567800	quando entrano i commerci, i flussi economici, i flussi finanziari
568740	571740	e chiudiamo però, e possiamo chiudere
571740	573800	con politiche restrittive
575600	577200	per quello che riguarda l'immigrazione
577200	580220	quando arriva il diverso, l'indesiderato.
580260	582800	Non c'è il rischio che la globalizzazione piaccia molto
583480	586280	alla classe alta, forse un po' snob
586280	588800	e piaccia sempre di meno
589520	591500	alla gente comune, alla popolazione.
591500	594320	Non c'è un rischio di una diverica azione, come governarlo?
597980	601000	L'attacco della sua domanda alla caduta del muro di Berlino
602480	607000	mi induce a sottolineare la grande importanza di avere un nemico.
609800	614000	È stato un evento storico e positivo la caduta del muro di Berlino
615300	619440	ma ci ha fatto vedere che non è finita la storia
619440	623320	e sono cominciate le insidie per il capitalismo.
624160	627940	Quando il capitalismo aveva lo sfidante quotidiano
629380	633160	capace di attrarre consensi in certe parti del mondo
633160	638220	sul suo modello, magari in modo illusorio, anziché sul capitalismo
638220	643860	il capitalismo era contendibile, si trovava in un mercato concorrenziale
643860	646400	direbbe il professor Scarpa, era contendibile.
647360	652900	La caduta del muro di Berlino ha privato, almeno apparentemente,
654180	656400	il capitalismo di un'alternativa.
657360	660940	Come avviene quando non c'è un nemico esterno
660940	664220	è più facile abbassare la guardia all'interno,
664460	667880	deteriorarsi dall'interno, perdere rigore
667880	670900	e abbiamo visto molte derive del capitalismo.
671190	677930	Non sto auspicando la risorgenza di muri
677930	682690	ma sto sottolineando che l'assenza di avversari visibili
684570	687950	fa sì che l'avversario sia in noi stessi
687950	690430	del resto è così in ogni circostanza della vita
690430	693690	e accresce la necessità della consapevolezza
694850	700010	della presa di conoscenza per tempo dei problemi
700010	704650	quindi anche della comprensione, del dibattito.
704950	707890	Io vedo l'iniziativa del festival di Trento
707890	711490	come molto utile in questo senso
711490	716590	nel senso di aiutare tutti noi a cogliere problemi
716590	718650	anche prima che si manifestino
718650	723510	e a vedere come anticorpi possano essere messi in circolo.
724830	727510	La globalizzazione porta a girevole
727510	732050	il rischio che venga vista la globalizzazione
732050	735050	come qualcosa di positivo da parte
736890	741210	di coloro che sono globalizzati nel loro modo di vita.
743510	748010	C'è questo rischio però non sottovaluterei
748630	754010	la grande popolarità che la globalizzazione ha conquistato.
756730	760090	Parlavo l'altro giorno con il presidente
760090	762770	di una università di Singapore, Kishore Mabubani
763810	765790	che ha appena scritto un libro
766770	768630	sull'Asia e la globalizzazione
769650	774850	l'Asia trova strano che in questi paesi lontani
774850	777970	e tutto insomma piccoli che sono gli Stati Uniti e l'Europa
777970	781750	ci sia un rigurgito critico sulla globalizzazione.
783210	785550	Ma anche in Europa
785550	789210	noi dobbiamo tenere presente che siamo un Paese
789210	793110	che non ha ancora completamente compiuto
793110	795610	anche se l'industria italiana sul piano micro
795610	798750	ha fatto grandissimi sforzi di ristrutturazione in questi anni
798750	801250	non ha ancora compiuto il transito
802310	806130	verso produzioni che avendo maggiore valore aggiunto
806130	808710	siano al riparo dalla mera competitività
808710	810470	di prezzo dei Paesi emergenti.
811750	814990	Buona parte d'Europa ha compiuto questo tragitto
814990	818250	ci sono paesi nell'Europa centrale, settentrionale
819610	822950	dove i cittadini, non le elite, direbbero
822950	825090	non toccateci la globalizzazione
825090	828250	non imponeteci dazi o anti-dumping
828250	833530	ci importa poco se i produttori del tessile, della calzatura
833530	836310	di Italia, Francia, Spagna, Grecia
836310	838830	sono in difficoltà, dovevano pensarci prima
838830	841330	sono giudizi sommari e che non condivido
842090	847730	ma il consumatore ha una voce sempre più forte
847730	850330	in quei Paesi che non avendo produzioni
850930	854050	che offrono il fianco alla diretta concorrenza
854050	855670	cinese, indiana o di altri
856330	858330	godono molto i benefici della globalizzazione
859110	862330	però mi sembra che dappertutto ci siano perdenti
863430	865670	alcuni Paesi del mondo, ma soprattutto
865670	868530	alcune categorie all'interno di ciascun Paese
868830	872330	ed è su questo che io
873050	875870	pur avendo espresso varie volte un'opinione
875870	878330	molto positiva sul ruolo del mercato
879070	883330	sono convinto che il ruolo arcaico
884030	888330	dello stato ridistributore attraverso le tasse
888990	891470	sia un ruolo di accompagnamento importante
892330	896030	per la globalizzazione
898830	902190	dodici anni fa discutendo di questi problemi
902190	904330	quando ero commissario europeo alla fiscalità
906590	909330	mi chiedevo, siamo sicuri che l'integrazione
909870	912670	globale ed europea continuerà senza limite
913330	915630	sospinta dalla tecnologia e dalla ideologia
916330	918950	o anche in questo ci saranno cicli nel giro
918950	923090	di 10-20 anni, vedo a lungo andare un fattore
923090	926310	possibile di rigetto dell'integrazione internazionale
926310	928470	è il vecchio tema della ridistribuzione
928830	932270	e della ricchezza, ma questo anche in Europa
932270	935630	deve fare riflettere, non vogliamo una
936330	938130	opprimente armonizzazione fiscale
938130	940430	impossibile con la regola dell'unanimità
940430	943510	e che assomiglierebbe comunque a un cartello
943510	945730	degli Stati contro i contribuenti
945730	949150	una certa concorrenza fiscale può fare piacere
949150	952250	ma se si lascia briglia sciolta sulla concorrenza
952250	956150	fiscale senza limiti in Europa e nel mondo
957150	960410	questo è il momento di decidere
960410	961650	ritenete opportuno
963490	966030	che si formuli una sorta di
966030	968030	appello alla classe politica
968030	970870	le elezioni ci sono state da poco
971650	973610	dopo molti anni c'è un quadro politico
973610	976490	in Italia semplificato e chiaro
976490	978810	dove c'è una maggioranza chiara che può governare
978810	983050	è una opposizione di tipo riformista
983650	986130	ma l'appello dovrebbe essere
986150	989690	a inverare uno spirito costituente
989690	991650	come quello dei padri della Costituzione
993650	996190	dopo il secondo dopoguerra
996190	998890	si è parlato di una sorta di guerra civile
998890	1002470	italiana che forse è finita con questo voto
1002470	1004670	se non ora a quando e quale dovrebbe essere
1004670	1006770	il senso di uno spirito costituente
1006770	1010050	per quali riforme da fare insieme
1010050	1013890	il rischio di non farle quale sarebbe per il paese
1013890	1015870	Monti e poi conclude Marcia Gallia
1018170	1020650	io in genere sono contrario agli appelli
1021810	1025490	e credo che oggi un appello non serva
1025490	1030050	abbiamo una maggioranza forte numericamente
1030050	1032650	più coesa lei l'ha rilevato
1033170	1035770	che in passato nell'ambito di un sistema
1035770	1038650	che da entrambi i lati è semplificato
1039870	1043570	abbiamo molti membri dell'attuale governo
1043570	1045450	se posso permettermi di dire
1046150	1048650	che sono più maturi che nelle loro esperienze
1049190	1051550	governative precedenti
1051550	1054650	il fattore tempo è cruciale
1055710	1057270	per l'urgenza dei problemi
1057270	1059410	ma anche perché sappiamo tutti che
1059410	1063190	certe riforme sono politicamente più fattibili
1063190	1065990	nella prima fase di una legislatura
1065990	1069570	che quando i pensieri cominciano ad avviarsi
1069570	1072630	alle nuove elezioni
1072630	1078290	io credo che sarebbe molto importante
1079130	1083250	che si riuscisse a dare con uno sforzo
1083250	1085910	anche di spiegazione da parte del governo
1085910	1088270	ma direi della classe dirigente
1088270	1093390	una maggiore visibilità ad emergenze poco visibili
1093390	1096030	dicevamo ieri sera che il pregio
1096030	1099890	della drammatica situazione dell'immondizia a Napoli
1099890	1102910	è che l'emergenza che purtroppo c'è
1102910	1105730	è ben visibile, non può sfuggire
1105730	1108470	non è un'emergenza meno grave
1108470	1111570	forse lo è di più la perdita quotidiana
1111570	1113910	di competitività giorno dopo giorno
1113910	1115410	dell'economia italiana
1115410	1117570	ma quella è meno visibile
1117570	1122430	ecco allora uno sforzo di chiarimento
1122430	1125270	sul rischio grave
1125270	1128390	nel non avere una rottura
1129890	1131830	in questo punto di vista
1131830	1137170	e credo che molto debba consistere
1137170	1138990	non solo nelle infrastrutture
