start	end	text
720	5840	eternamente, se non siamo insieme, uniti come europei, quindi non è un'opzione,
5940	11320	una scelta di essere europei oltre a essere patriotici, no, è una necessità
11320	16300	vitale se vogliamo quindi difendere i nostri interessi e valori insieme al
16300	20840	mercato unico e partecipare a un nuovo ordine mondiale che penso che abbia
20840	25420	veramente bisogno di una via europea, duratura. Grazie dell'ascolto.
31260	35540	Mario Monti è stato non solo, ma non ve lo devo ricordare, uno dei protagonisti
35540	38740	della costruzione europea, ma è stato anche protagonista l'anno scorso di
38740	42840	questo storico accordo sull'unione bancaria e non possiamo non chiedergli
42840	47800	prima di naturalmente lui ha preparato un discorso però voglio accompagnarlo con
47800	54640	una domanda perché è tempo di bilancio ovviamente, no, e quell'accordo prometteva
54640	58960	due cose sostanziali, una era l'unione bancaria appunto su tre pilastri che
59220	63260	e l'altra è la ricapitalizzazione diretta delle banche che era in quel
63260	66840	momento il problema prioritario in alcuni paesi come la Spagna. Non possiamo
66840	71120	non chiederle a distanza di un anno e di un altro Consiglio europeo importante se
71120	76820	i risultati, se questo Consiglio ultimo che ha stabilito dei passi ulteriori ma
76820	80740	con molte titubanze e soprattutto che sulla ricapitalizzazione diretta delle
80740	85340	banche sembra aver fatto dei passi un po' indietro, che bilancio trae? Se in
85560	89400	modo, quell'accordo che lei ha faticosamente negoziato, lei è stato uno
89400	94100	dei protagonisti di quell'accordo l'anno fa assieme alla Spagna e alla Francia, non
95200	99260	è, è del tutto all'altezza delle sue aspettative quello che ne è uscito fuori
99260	100480	un anno dopo?
104280	106800	Pendante che io riflessi a vostra questione,
111000	115060	Mentre rifletto alla sua domanda vorrei ringraziare moltissimo l'ambasciatore
115060	120620	Leroy che mi ha invitato a partecipare a questa occasione così importante, tanto
120620	126020	più apprezzata da parte mia perché mi permette di rivedere una personalità
126020	133720	francese e europea per la quale ho enorme stima e ammirazione, stima e
133720	140320	ammirazione che, come ha detto il Commissario Barnier, è stata nutrita da
140320	147080	un lavoro comune per cinque anni. Ha parlato di un'amicizia duratura, ha usato
147080	153000	questa espressione e non avevo mai sentito questa espressione proprio
153000	158460	sull'amicizia, cioè invece di parlare di sviluppo sostenibile, parlare di
158460	163980	amicizia sostenibile nel tempo, ad ogni modo senz'altro duratura. Duratura nel
163980	170420	tempo è nutrita da un rispetto reciproco forte e è stato veramente bello
170420	176580	ritrovarci. Questa è un'occasione importante, quella del mercato unico
177660	185440	europeo e l'unione bancaria che è un argomento particolarmente sensibile e
185440	192560	che se ne occupi proprio il Commissario Barnier. Come ha ricordato l'Abbasciatore,
192660	198360	Su Excellenza l'Abbasciatore, c'è stata una bella collaborazione franco-italiana
198360	205820	che è stata rinnovata, è stata molto intensa e è molto produttiva, efficace.
206100	210920	Si è parlato più volte del Consiglio Europeo del 28-29 giugno dell'anno
212480	217640	E' una delle tappe cruciali di preparazione di quel
218780	225580	Consiglio, è stata una tappa multilaterale, una tappa multilaterale che
225580	230760	forse poteva essere criticata perché considerata come intergovernativa, ma
230760	235200	anzi invece no, è stata portata avanti in uno spirito veramente comunitario.
235340	241020	C'è stata una riunione prima dell'incontro dei capi di stato e di
241020	246640	governo della Francia, la Germania, la Spagna e l'Italia e questa riunione ha
246640	254860	permesso di fare notevoli passi avanti nell'ottica di un accordo a Bruxelles il
254860	262860	28-29 giugno dell'anno scorso. Signora, abbiamo parlato di unione
262860	267580	bancaria ma anche di molto di più perché come è stato ricordato c'era il
267940	275480	risultato di crescita, di stabilità e per una volta abbiamo parlato di
277160	283800	crescita che non era sprovvista di strumenti o di risorse, c'è stato un
283800	291540	accordo di principio di massima sull'unione bancaria ma dopo una buona
291540	302660	notte di lavoro, mentre gli italiani erano soddisfattissimi della vittoria
303820	308720	storica sulla Germania, la partita di calcio che c'era contemporaneamente
308720	313960	quella notte, quindi è stata una notte particolarmente intensa per tutti, ma
313960	318700	proprio in quella notte abbiamo ottenuto un accordo anche su un qualcosa che ha
318700	324420	fatto una maggiore credibilità tutto l'insieme perché un patto di crescita
324940	334080	senza una roadmap sull'unione bancaria sarebbe stato meno credibile anche dal
334080	344740	punto di vista della crescita soltanto e che credibilità avrebbe avuto se già
344740	354880	il giorno dopo, i mercati che erano molto agitati, molto preoccupati e se
354880	362140	avessero accolto questo risultato del vertice europeo in modo negativo, quindi
362140	369420	diciamo che questo patto di stabilità, un accordo per stabilizzare il
370020	375160	dei titoli sovrani è stato necessario per dare maggiore credibilità a tutto
375160	379920	l'insieme, ecco quindi per una volta degli elementi che si integravano bene
379920	385560	tra di loro e sono molto lieto di poter dire che non solo le istituzioni
385560	390820	comunitarie che naturalmente sono la Commissione, il Presidente del Consiglio
390820	398620	che sono naturalmente i più responsabili e che redigono gli accordi
398620	403480	ma il gioco di questi quattro paesi che ho citato e quindi delle quattro
403480	412580	economie maggiori della zona euro ha permesso di dire che non c'è stato un
412580	419260	vincitore un perdente e gli accordi migliori hanno proprio questa
419260	425700	caratteristica, cioè siamo diventati tutti un po' più tedeschi e la Germania
425700	435880	lei è diventata un po' più, devo stare attento alle parole che scelgo, non
435880	440660	vorrei dire più latina, non è che è diventata di più un paese del sud della
440660	451900	Germania, però ha abbracciato una impostazione più vasta diciamo che ha
451900	457880	considerato il valore di più strumenti di stabilità al di là degli Stati
457880	462920	membri che dovevano fare tutti i loro compiti come tutti quanti e poi la
462920	469360	Germania faceva quello che voleva, no? Vedete che ho dei limiti nella lingua
469360	475700	francese quando l'espressione diventa difficile passo all'inglese, ad ogni
476360	477000	modo.
479640	483960	Getto la maschera per venire più direttamente al tema dell'Unione
483960	490660	bancaria anche la domanda della nostra moderatrice, un anno fa evidentemente
490660	496360	l'Unione Europea era nell'occhio del ciclone di una crisi senza precedenti
496360	501760	nata nel 2008 al di fuori dell'Unione Europea e per circa un anno abbiamo
501760	506300	tutti pensato che noi saremmo stati immuni nell'Unione Europea da questa
506300	513200	crisi poi non è stato così e quella crisi ha costretto tutti a prendere atto
513200	518980	della intrinseca debolezza della componente più ambiziosa del progetto
518980	525280	europeo l'Unione economica monetaria costruita su un impianto affetto da
525520	531840	importanti gravi carenze e in particolare insufficienti strumenti di
531840	538580	controllo e di prevenzione sulle politiche di bilancio, l'assenza di
538580	543520	meccanismi efficaci per il coordinamento delle politiche economiche nazionali
544220	550180	dal punto di vista dei disequilibri macroeconomici, l'assenza di meccanismi di
552100	556660	solidarietà, l'assenza di regole efficaci per il settore delle banche e
556660	561900	dei servizi finanziari. La conseguenza di questa debolezza del
561900	568340	sistema di gestione e di controllo aveva innescato una crisi di fiducia verso
568340	577060	l'euro che ha amplificato i problemi reali e avviato una spirale che rischiava
577060	585200	di fuggire di mano. Trovo anch'io come è stato già detto lentissima da un
585200	590520	certo punto di vista ma straordinariamente veloce se compariamo
590520	595620	con altre situazioni storiche del cammino dell'Unione europea la risposta
597700	601580	alla crisi. Basta pensare il fatto che la commissione
601580	606640	della quale entrambi abbiamo fatto parte già negli anni in cui eravamo colleghi
606640	614700	aveva più volte proposto che gli stati membri sottoponessero alla commissione
614700	624760	il bilancio pubblico del loro stato, un draft del bilancio per l'anno successivo
624760	630420	perché ci potesse essere un vaglio sulla compatibilità a brussel ma questo era
631760	639120	considerato una richiesta poco seria e sempre rigettata così come quando la
639120	645480	commissione di cui entrambi facevamo parte aveva chiesto che venissero
645480	650380	rafforzati i poteri di Eurostat per verificare la fondatezza delle cifre
651100	655260	della finanza pubblica dei singoli paesi
655260	661580	soprattutto i grandi stati membri non è escluso che ci fosse qualcuno dei nostri
662140	668000	si pronunciarono risolutamente contro ebbene sia su un fronte che sull'altro
669320	677280	fronte poco dopo la crisi greca è stata adatta la piena adesione alle proposte di
677280	684620	fare questo e quindi questo in realtà è avvenuto abbastanza rapidamente
684620	690260	purtroppo però sempre con la necessità della crisi che però non è sorprendente
690880	696320	perché i progressi nell'integrazione europea si fanno quando ogni paese
696320	701680	accetta di cedere un po della sua sovranità perché la messa in comune della
701680	708400	sovranità sia più abbondante faccia dei passi avanti siccome il costo politico
708400	714480	del cedere spicchi di sovranità è molto grande lo si fa solo quando si è
714480	721500	costretti cioè quando solo solo quando la evidenza di una crisi non infieri ma
721500	726120	già conclamata mostra che il costo politico del non mettere insieme le
726120	734860	sovranità supera il costo politico del metterle insieme e tutta la vicenda
734860	743480	europea io credo stia nel graduale sforzo per avere sempre meno bisogno di crisi
743480	747480	drammatiche per fare quei passi avanti che le crisi drammatiche rendono
748720	754740	particolarmente evidenti ma avendo avuto l'occasione di vivere per un anno e mezzo
754740	761020	proprio dall'interno del consiglio europeo i progressi devo dire che sono
761020	769080	stati defatiganti sì ma anche un esempio straordinario di come 27 o 17 stati
769080	776660	membri per una parte tuttora sovrani possano trovare degli accordi e lì devo
776660	783500	dire il ruolo di propulsore e di promotore della commissione e il ruolo
783500	789660	che io ho molto ammirato del presidente van rompoi nel arrivare ad accordi che
789660	793440	sembravano impossibili meritano di essere segnalati
793440	800400	commissario barnier e il vicepresidente barnier ha un ruolo veramente
800400	804680	essenziale non solo per gli aspetti relativi alle banche agli strumenti
804680	811380	finanziari ma perché come responsabile del mercato unico ha a sua disposizione in
811380	817520	fondo la leva più importante per agire a favore della crescita che è fare una
817520	823300	grande politica dell'offerta in europa fondendo davvero le numerose
823300	827160	economie nazionali che ne fanno che ne fanno parte
829080	834520	il patto per la crescita adottato un anno fa si basa molto sulla volontà di
834520	840620	approfondire e ampliare la politica dell'offerta e il mercato unico che ne è
840620	846440	manifestazione e i due atti sul mercato unico approvati dalla commissione sul
846440	852360	proposta di michel barnier ridisegnano l'inquadramento di molti settori
852360	859000	offrendo più opportunità agli scambi alla competitività purtroppo però i
859000	863260	progressi concreti nell'adozione di molte di queste misure non sono così
863260	871020	rapidi come avremmo sperato io ho qualche volta proposto e molto in accordo
871020	875260	in questo caso col primo ministro britannico nelle riunioni del consiglio
875260	882280	europeo europeo che si trovassero modi per costringere i capi di governo come si
882280	887280	dice con orrenda espressione a mettere la faccia sulle misure del mercato unico
887280	895040	perché è troppo facile adottare in solenne riunione grandi principi e poi
895040	899980	lasciare liberi i singoli ministri settoriali nei vari consigli dei
899980	906460	ministri di essere talmente esigenti pignoli e ritardatari da non consentire
906460	911460	la realizzazione di tutto il progresso che i capi di governo hanno dichiarato
911460	921580	come strettamente indispensabile il futuro dell'unione economica e monetaria
921580	928160	compreso la messa in pari dei vari aspetti che devono segnarne il progresso
928160	933220	perché è stato giustamente rilevato che in alcuni aspetti siamo rimasti più
933220	945180	io credo che l'unione economica e monetaria abbia bisogno anche di qualche
945180	957760	avanzamento istituzionale dal punto di vista dei trattati e devo dire io sono
957760	963360	fermamente convinto che la presidenza italiana nel secondo semestre del 2014
963360	969720	come ho detto recentemente in senato intervenendo sulla relazione che ha
969720	975480	tenuto al riguardo il presidente Letta le cui idee sull'europa mi sento di
975480	984160	condividere almeno al cento per cento la presidenza italiana si trova nella
984160	989060	fortunata occasione di poter dare un contributo importante come già
989060	996180	avvenuto nella storia perché voglio ricordare che tre passi fondamentali come
996180	1002920	la decisione di eleggere il Parlamento europeo direttamente a soffraggio
1002920	1009780	universale e direttamente e poi la decisione di fondo per il mercato unico
1009780	1018500	nel consiglio europeo di milano 1985 e la decisione che è stata il preludio del
1018500	1024960	trattato di Maastricht presa a Roma nel consiglio europeo del dicembre 1990
1024960	1030160	sono state tutte e tre prese sotto presidenza italiana è vero che allora la
1030160	1034920	presidenza aveva un ruolo più pregnante di oggi perché non c'era il presidente
1034920	1040300	permanente del consiglio europeo ma sappiamo e gli ambasciatori sanno benissimo
1040300	1046000	quanto ancora è importante e onerosa una presidenza semestrale e quanto può
1046000	1051620	contribuire bene tutto questo per dire che naturalmente mi iscrivo anch'io nel
1051620	1058040	pensiero italiano molto ambizioso o volontarista direbbero i francesi per
1058040	1065360	quanto riguarda gli stati uniti d'europa benissimo benissimo ma io credo che
1065360	1072200	nella generalità degli stati membri sia più difficile ottenere il consenso non
1072200	1079540	dico l'entusiasmo ma il consenso su avanzamenti istituzionali se se ne
1079540	1085820	presenta la bellezza estetica ed etica in sé come se fosse un imperativo
1085820	1095900	categorico che impone di fare questi avanzamenti e in molti paesi che sono più
1095900	1104000	pragmatici del nostro secondo me è più pagante la dimostrazione concreta che
1104000	1112320	senza qualche progresso istituzionale la parte che nel bene o nel male farà il
1112320	1117280	successo storico dell'unione europea cioè l'unione economica e monetaria non
1117280	1125680	potrà essere ben gestita quindi qualche leva in più concreta attraverso
1125680	1132880	meccanismi istituzionali non necessariamente presentata come il grande
1132880	1139240	disegno degli stati uniti d'europa può avvicinare alla realizzazione degli
1139240	1146480	stati uniti d'europa più del contrario a mio parere ma sono sicuro che la
1146480	1156840	presidenza italiana dopo le presidenze lituana di appena iniziata e quella non
1156840	1166600	mi ricordo più di chi confesso nel grecca nel primo nel primo semestre del 2014
1166600	1177420	prepareranno molto molto bene la strada e quindi suggerirei agli stati unitisti
1177420	1185840	d'europa di usare l'unione economica e monetaria come chiavistello per
1185840	1192560	avanzamenti istituzionali senza dire ad altri meno amanti degli stati uniti
1192560	1199400	d'europa che questa è l'operazione e dicendo agli altri che si fa il minimo
1199400	1207140	indispensabile per consentire all'unione economica e monetaria di essere home and
1207140	1216320	dry e al riparo da future crisi il bello dell'europa secondo me da commissario
1216320	1227040	ho molto cercato di esercitarmi è la assoluta necessità di trovare modi
1227040	1232800	diversi di presentazione dell'idee in cui ciascuno crede perché le
1232800	1238660	sensibilità sono talmente diverse non che poi abbia scoperto quando mi è
1238660	1243900	toccato di cimentarmi soltanto sul campo nazionale che sia molto ma molto più
1243900	1250540	facile persuadere le psicologie di un solo paese ma in aggiunta le psicologie
1250540	1261020	europee hanno anche quest'aspetto di affascinante composizione una ultima
1261020	1271140	considerazione vorrei fare anche il vicepresidente barnier ha menzionato il
1274960	1282100	credo che sia una tendenza quasi inarrestabile se non ci sarà un grande
1283880	1291020	sforzo alla affermazione di posizioni di destra e di sinistra concetti del resto
1291020	1298860	forse meno decisivi che in passato nazionaliste e populiste che secondo me
1298860	1305580	non deriva tanto dai problemi della globalizzazione eccetera quanto dal
1306240	1313700	modo in cui avviene il dibattito politico sempre più schiacciato anche a
1313700	1320960	causa dei media sul brevissimo periodo via via che invece i problemi ai quali
1320960	1326660	i politici devono con i quali devono cimentarsi sono come sappiamo problemi
1326660	1333460	che richiedono tempi sempre più lunghi perché le azioni producano effetti un
1333460	1338220	campo come quello dell'unione bancaria un campo come quello della integrazione
1338760	1345880	economica in generale sono per definizione campi complessi in cui è
1345880	1353540	difficile prendere le anime dei cittadini e
1354720	1363460	si richiedono argomenti razionali prendendo le menti ma sono effetti che
1363460	1372400	si manifestano lentamente nel tempo sarà sempre più facile la posizione di chi si
1372400	1378120	pronuncia per il protezionismo per la chiusura contro le differenze e via
1378120	1383820	dicendo posizioni assolutamente antitetiche al mercato unico che è la
1383820	1394620	ecco perché secondo me visto che il vicepresidente barnier è oggi e gli
1394620	1399260	auguro ancora di più domani in posizioni molto importante nella
1399260	1409280	conduzione politica dell'europa mentre si lavora tanto sotto il profilo tecnico e
1409280	1415880	la commissione lo fa con grandissima preparazione ed efficacia secondo me
1415880	1421780	questa almeno è la lezione che ho tratto durante i miei 18 mesi di appartenenza al
1421780	1427220	consiglio europeo sarebbe bene che i capi di stato di governo prendessero un
1427220	1435820	approccio più politico e affrontassero qualche volta non i temi del bailing out
1436580	1442800	che certamente i loro ministri delle finanze capiscono molto molto meglio di
1442800	1450940	loro ma i temi fondamentali di come fare per mandare avanti il consenso sull'
1450940	1457520	integrazione europea pur in un habitat che diventerà sempre più naturalmente
1457520	1464520	ostile per le ragioni che ho appena citato e moltissimo dipenderà dal fatto
1464520	1469460	che costruzioni tecniche e sofisticate come l'unione bancaria
