start	end	text
2090460	2098920	Allora la prima osservazione è, per me, lo dica Barbera, che ha la nostalgia referentaria.
2100220	2106320	Barbera, se io non avessi avuto la colpa di raccogliere le firme, avreste discusso poco di referendum.
2106940	2112700	Solo che allora, insieme a te, spiegavo che il referendum era una sollecitazione.
2112700	2132080	Io non ho mai immaginato che le riforme si fanno col referendum, perché il giorno in cui accettiamo la democrazia referentaria, dovremmo definire, io sono contrario, ma se si fa, la dovremmo definire bene, perché non si possono fare le riforme per allusione.
2132080	2147020	Io non mi sento di dire che gli elettori volevano il maggioritario quando hanno votato, come gli elettori non è che volessero una o due preferenze, gli elettori hanno protestato congordemente rispetto ad un sistema che non funzionava.
2147340	2159880	Adesso leggere che avevano un meccanismo, io rispetto, ma lo rispetto per ragioni diverse, non formali, rispetto il maggioritario perché funzionava al governo di un processo politico.
2159880	2167820	E' una cosa che dicono sempre gli elettori, che tutti, tutti quanti, troppi partiti, l'espressione troppi partiti, per quanto il mentale significa maggioritario.
2168480	2173420	Poi il paradosso qual è, che volevamo ridurre i partiti e col maggioritario ne abbiamo fatti di più.
2175940	2178520	Per quale ragione? Non è che abbiamo fatto più partiti.
2178520	2189460	Quando le coalizioni non s'aggregano in virtù di motivazioni politiche, ma di convenienze episodiche, che sono quelle elettorali, cresce la frammentazione, non si riduce.
2189820	2198240	Noi facciamo confusione tra frammentazione e pluralismo. E se non discutiamo politicamente su questo, abbiamo voglia di inventare meccanismi.
2198240	2203280	L'intervento di Rufillo avrebbe detto, ragazzo, su questa strada non si va a lontanare.
2203440	2210040	Allora il discorso adesso secondo me andrebbe fatto in maniera più serena. Abbiamo introdotto il maggioritario.
2210240	2218300	Allora il partito o la coalizione di partiti, che ha la maggioranza dei seggi nelle elezioni, ha la maggioranza parlamentare.
2218520	2225000	Quelli che perdono hanno la presenza in parlamento col criterio proporzionale. Questo garantisce il pluralismo.
2225000	2229940	Il sistema rimane il collegione nominale. Quindi la spinta alla convergenza c'è.
2230080	2234340	Poi siccome non possono vincere tutti, ma vince uno, ci sarà una maggioranza.
2234840	2238840	Il maggioritario è funzionale a garantire chi governa.
2239080	2249900	Immaginare che debba essere maggioritario per forza pure la rappresentanza della minoranza, mi pare un concetto democratico al limite della sofisticazione.
2249900	2257900	Veda fisichella con quanto garbo io esprimo il mio dissenso. Quindi nonno, è in maniera molto problematica.
2259100	2267920	Perché il problema è garantire il pluralismo e però consentire che si individui una maggioranza.
2267920	2284940	Ma io emerge una questione diversa. Che come per le riforme, la difficoltà è la cultura costituente, nonno i lavori della bicamerale.
2289680	2300280	Io non sono socio di quelli che immaginano che siccome la bicamerale ha difficoltà, poi facciamo la costituente.
2300280	2307000	No, secondo me è peggio. Non nel senso che io non voglio o non vorrei la costituente.
2307280	2312300	Io ritengo che il difetto è altrove. Il difetto è nella carenza di cultura costituente.
2312560	2325020	Quindi valutiamo le difficoltà, ma con la consapevolezza, come dire, che il difetto non è nel modo di affrontare questo problema, così sull'alternanza.
2325960	2330020	Io stasera ho ascoltato cose strane, ma che mi piacciono.
2330760	2337380	Il professor Berberer, che è una persona che io stimo e lui lo sa, ma che ha grande onestà intellettuale.
2337400	2343440	Lui ha dato contributi enormi alla bicamerale. Non alla Bozzi, ma alla bicamerale.
2344200	2350420	Perché da questo punto di vista avevi qualche similitudine con l'azione di Ruffill.
2350420	2356420	Quando noi entravamo in difficoltà lui ci faceva una lezione sulla questione.
2357760	2371200	Era così, ha aiutato alla bicamerale, dove io per la verità sono stato presente un po' anche in questo, ma ero stato presente nell'altra, a dire come è il problema in maniera che si potesse discutere come era.
2371200	2392260	Io adesso ho una grande preoccupazione, che da un sistema ad alternativa impossibile, Berbera, non io, ci ha detto che nell'87, non nel 48, l'alternativa era difficile nel nostro Paese per il modo dell'organizzazione della presenza della sinistra.
2392260	2399260	E che è così. Però anche per il modo dell'organizzazione della destra, questo è l'altro difetto che c'è.
2400400	2409260	Perché anzi, che ripensare chi più di me è favorevole alla liberalizzazione del dialogo tra le forze politiche.
2409460	2413580	Sembra, per natura direi, prima che per scelte intellettuali.
2413580	2421800	Però l'errore sta nell'aver immaginato che le difficoltà storiche si risolvono dicendo che non ci sono più.
2422240	2430580	E viceversa, le difficoltà storiche si risolvono non con l'ingonro violante e fini, ma col ripensamento delle storie.
2431860	2433480	Per quale altra ragione?
2433480	2443640	Qua io evidentemente convesso il mio limite culturale, come posizione culturale, recuperando un'affermazione di Fisichella.
2443960	2453420	Io credo che i comportamenti culturali e politici all'interno di una comunità hanno bisogno sempre di un riferimento storico.
2453920	2462860	Questa lettura della scombarsa della storia sul piano dei comportamenti politici nel Paese è vera ma solo apparentemente.
2462860	2467860	Perché le culture politiche che hanno segnato la storia di questo Paese, le rimangono.
2469080	2471860	L'intervento del compagno ce l'ho testimonia.
2472680	2480860	Così ce ne sono tante. E così io non sarei distratto sulla presenza larga della cultura cattolico popolare.
2482000	2486860	Per cui la lettura che adesso dopo non c'è più perché non ci sono più i comunisti.
2488100	2492940	Insomma non è manco una spiegazione post-occo, proprio terocco. Non è vero.
2494000	2499320	Il problema della crisi del sistema politico in Italia è prima della caduta del muro.
2499500	2506980	Direi che il fallimento dell'esperienza comunista, noi l'abbiamo vissuto in Italia prima che ci fosse il fallimento del comunismo nel mondo.
2507300	2512760	Perché il PC non è rimasto il PC vetero-marsista-stalinista.
2512760	2519960	Il PC è stato attraversato negli ultimi anni da un processo non secondario di revisione,
2520120	2528820	però con una revisione che non è riuscito a liberare questo partito della sinistra all'interno di un contesto di democrazia possibile.
2529340	2538680	E quando Barbera dice con grande onestà Demita voleva, la legge elettorale che consentiva per la verità non è così.
2538680	2546120	Non è così perché io ritenevo che l'evoluzione c'era e voglio dire a Barbera che quando io ho forzato su quel sistema
2546120	2554680	l'onorevole Occhetto alla mia presenza si sforzò di spiegare a Natta che era vero che in quella circostanza quel meccanismo
2555660	2564020	poteva dare l'impressione che favorisse una coalizione, però poi era il sistema che avrebbe consentito l'evoluzione.
2564020	2569420	Perché l'evoluzione non avvengono per benedizione, avvengono introducenti elementi.
2569660	2579020	Secondo Barbera, questo mettetelo nella memoria, io avendo la consapevolezza della difficoltà dell'alternanza sul piano politico generale
2579980	2586040	avevo proposta a Berlinguer nel 1984 un accordo politico per l'alternanza negli antilocati.
2586160	2592800	Mi dissero lo stesso, con questa motivazione che l'opposizione è il diritto dovere di rovesciare la maggioranza.
2592800	2600800	Quando dico questo lo dico per recuperare un'analisi storica un po' meno strumentale.
2601840	2612200	Quando dico questo non lo dico per attaccare o censurare, lo dico per renderci conto che negli anni passati abbiamo avuto delle difficoltà.
2612200	2619200	Io ritengo che erano le difficoltà del sistema, non solo del PC, nell'accettare.
2620960	2626160	E a Fisichella devo dire che non è vero che l'ADC ha avuto ritardi.
2626460	2635640	L'ADC per tutti gli anni 80, certo che c'erano delle resistenze, ma non c'è nessun partito dove non ci siano resistenze.
2636580	2643260	Un partito decide all'unanimità, tranne che per Forza Italia, perché non decidono e quindi sono unanimi.
2643840	2647740	C'è sempre il problema e delle classi dirigenti che guidano.
2647860	2656600	Noi, come Democrazia cristiana, abbiamo avanzato proposte precise sul piano della modifica del sistema elettorale e del riordino.
2657080	2658820	Era tardi nell'80, era tardi.
2659760	2661360	Ma come era tardi? L'avessimo fatto all'84.
2661360	2664300	Era ritardato rispetto ai problemi, io lo so bene.
2664300	2666700	Era tardi, però l'abbiamo fatto prima di voi.
2666920	2669800	Insomma, almeno questo era un prima tardi.
2671560	2673740	Ma non è questo, il problema non è questo.
2674240	2678300	Adesso il difetto è altrove e lo dico con molta stima.
2679260	2683320	Fisichella, quando risponde a me, sembra un po' risentito.
2684020	2689660	Sì, non è vero, perché Fisichella, no, Fisichella deve sapere.
2689820	2692540	Non solo che lo stiva, ma che io ho letto pure i suoi libri.
2692540	2698980	Quindi, insomma, ho aiutato mia figlia a preparare l'esame con Fisichella.
2699460	2705540	C'è tutto questo e le cose che scriveva non erano cose sciocche.
2706520	2709340	Le ho lette, quindi vuol dire che le ho apprezzate.
2709860	2716020	Però temo, temo che indipendentemente dalla vostra volontà, questo serve,
2716020	2723020	perché dico, siamo passati dall'alternativa impossibile all'alternativa obbligatoria.
2723940	2729360	No, l'alternanza non è l'alternanza di schieramenti.
2729660	2732660	Questo è l'errore, Barbera.
2732880	2736960	L'alternanza è l'alternanza di proposte politiche.
2737520	2739020	E allora qua sì che vi sconvolgo.
2739980	2743020	Io non credo all'alternanza destra-sinistra.
2743020	2748200	Non nel senso che la destra e la sinistra abbiano difficoltà.
2748360	2753020	Credo che la società moderna ha un tipo di competizione diversa,
2754080	2757940	ha un tipo di competizione al governo andando in avanti.
2758140	2764100	Non ci sono mai due coalizioni allo stesso livello che offrono lo stesso prodotto.
2764760	2767020	Competono, è un po' come in una gara ciclistica.
2767800	2772040	Tra chi può vincere la corsa e chi la perde, ma chi la vince è più bravo.
2772040	2779420	Io non credo più, Barbera, alla conservazione dei partiti come erano.
2779540	2781200	Manco io ci ho mai creduto.
2781520	2787080	Ma credo che è ugualmente astratto l'idea, questa sì molto professorale,
2787280	2791500	e noi potremmo fare anche una ricostruzione psicologica su questo.
2791780	2797240	Tutti quelli che sono contro i partiti sono in realtà quelli che non hanno storie politiche.
2797360	2799840	Ma questa è la descrizione di un fatto.
2799840	2809040	Nell'ingoscio c'è la consapevolezza che probabilmente fare i partiti dove ci siano solo quelli che non li conoscono
2809040	2811620	è molto meglio che farlo con gli altri.
2812040	2816940	Viceversa, io ritengo che la crisi politica del Paese esigge,
2816960	2821840	tra le altre risposte, anche quello del recupero del ruolo politico dei partiti,
2821920	2825940	che è un problema che noi non affrontiamo, non risolviamo.
2825940	2830940	L'ultima, e questo lo dico per il prossimo dibattito,
2833820	2841000	io credo che la competizione sarà organizzata sulla vita del pluralismo istituzionale.
2842140	2847040	La competizione ai livelli culturali, ai livelli dell'organizzazione civile.
2847500	2851940	Il governo delle autonomie, altro che il federalismo, è la risposta nuova.
2852940	2856800	C'è l'ultimo libro di Torem, lui dice il soggetto.
2857060	2863860	Noi dovremmo riflettere che tutte le culture politiche tradizionali fanno riferimento all'individuo,
2864400	2867320	che è il figlio della cultura dell'illuminismo e del marxismo.
2868040	2871740	E' questa cultura che è venuta meno, non l'unità politica dei cattolici.
2871820	2874380	L'unità politica dei cattolici è una cosa vecchia, superata.
2874680	2876260	Non è questo il problema.
2876260	2882320	Non a caso, io ho la sensazione che voi, rispetto alle difficoltà che incontrate,
2882460	2885680	lo dico in maniera provocatoria e cordiale,
2886280	2891420	preferiate più cristallizzare questa illusione,
2891780	2894000	che mettendo alcuni di qua e altri di là,
2894040	2901260	ma soprattutto facendo scombarire quelli che culturalmente vi porrebbero una qualche curiosità,
2901600	2904160	si risolve il meccanismo politico.
2904160	2910360	Io non sarei così tranquillo, Barbera, che l'elezione diretta dei sindici ha risolto i problemi.
2910720	2912980	Lo vedremo alle prossime elezioni.
2913080	2916100	L'elezione diretta dei sindici ha risolto una difficoltà,
2916140	2920460	ma non ha risolto il problema dell'autogoverno delle comunità.
2920840	2924980	Noi nelle comunità non ancora abbiamo trasmesso la consapevolezza
2924980	2929280	che l'autogoverno fa riferimento anche al concorso
2929280	2931720	nel reperimento delle risorse delle comunità.
2931720	2937520	Con tutti i problemi connessi alle diversità delle comunità che esiste.
2937660	2940020	Quindi non basta dire, fare questo,
2940760	2947320	senza immaginare, inventare istituzioni che accompandino questo processo.
2947440	2950040	Secondo me l'alternativa è su queste cose.
2950420	2952920	E io su queste cose non vedo nessuna riflessione.
2953060	2955100	E chiudendo, quando ho detto Ruffilli,
2955240	2959980	la cosa più interessante della sua riflessione non era la legge elettorale,
2959980	2963300	ma era il riordino dello stato sociale,
2963420	2964980	non il sanitometro,
2965940	2969980	ma una forma di autoresponsabilizzazione dei cittadini
2970820	2973020	organizzando forme di autogoverno
2973020	2976900	a livello della scuola, della sanità, del servizio, dell'assistenza,
2977160	2983040	in realtà aveva capito i problemi che sono scoppiati dentro la società italiana.
2984540	2987840	Quindi io direi che dobbiamo recuperare insieme alla cultura costituente,
2987840	2990260	la cultura politica dell'alternanza,
2990480	2995420	non illudendoci che il sistema elettorale possa supplire alla manganza di idee.
2996060	3001080	Prima fu la parola e poi ci furono i comportamenti.
3001180	3003500	Senza la parola i comportamenti no.
3003820	3005580	Come diceva Ruffilli?
3006600	3007480	Sono apputanato.
3011940	3016560	Le diamo la parola subito. Un attimo che il presidente Fisichella deve fare una precisazione.
3016560	3020560	No, no, volevo soltanto dire una cosa in tre secondi.
3021320	3028500	Mi dispiace molto che il presidente De Vita abbia immaginato una qualche animosità nei suoi confronti da parte mia.
3028880	3030560	Questa è l'ultima cosa alla quale...
3031660	3033200	Presidente, tu mi hai sentito?
3033560	3035560	Alla quale...
3038000	3041640	Io ho così poca animosità nei tuoi confronti
3041640	3045900	che non posso dimenticare quando tu presidente del Consiglio
3045900	3047900	ed io professore all'università,
3049080	3051900	avendo io scritto un articolo, tu hai voluto incontrarmi,
3053380	3054420	per parlare,
3054560	3057380	per parlare di quello che io avevo scritto in quell'articolo,
3058280	3062160	per illustrarmi meglio le cose che tu facevi
3062160	3066660	sulle quali ritenevi che ci fosse da parte mia qualche fraintendimento e così via.
3067080	3070860	Quindi immaginare da parte mia una animosità nei tuoi confronti
3070860	3072820	mi sembrerebbe, francamente,
3073940	3077760	anche perché io non porto malanimo nei confronti di nessuno,
3078420	3079580	mai per temperamento.
3079900	3083260	Detto questo, una cosa invece di sostanza,
3084040	3087840	i partiti, ma tutto il lavoro che stiamo cercando di fare
3087840	3095280	è il tentativo di restituire, dopo la grave crisi dei partiti,
3095740	3098000	un ruolo ai medesimi,
3098000	3100200	un ruolo ai medesimi,
3102380	3107340	naturalmente considerate le mutate condizioni del sistema politico italiano
3107340	3112200	e quindi anche le caratteristiche diverse che probabilmente i partiti assumeranno
3112960	3117180	rispetto a quelle che erano state le configurazioni strutturali e culturali
3117180	3119120	del sistema partitico precedente.
