start	end	text
0	28240	Però quando mi capita di leggere, io leggo questo periodo, professori che un giorno si o un giorno non pure ci spiegano come si risolve il mondo con il referendum o senza il referendum, con la proporzionale, senza la proporzionale, Ruffili era un'altra cosa.
30160	55240	Secondo me, io rifletterei molto su questo, anche con riferimento alle preoccupazioni a cui lei ha dato voce sui lavori della bicameralia, i lavori della bicameralia ingondano difficoltà nonno per le procedure adottate, per le ipotesi avanzate, ma per la carenza di cultura costituente che c'è.
55400	75740	Direi nel mondo accademico prima e di riflesso nel mondo politico. Questa è una constatazione che dobbiamo fare. Io credo che il limite sia un po' più delle forze politiche, nonno per non incorrere nelle ire dei professori.
76960	101980	Ma lo dico con serena consapevolezza, perché il compito della politica secondo me non è risolto un problema di fondo, questo lo voglio dire ai miei due interlocutori, perché credo che avremo diversità di opinioni su alcune questioni, non stasera, noi ci conosciamo, abbiamo discusso, parliamo.
101980	128980	Perché in gioco non è questa o quella misura, in gioco è la concezione della democrazia, in gioco è la concezione del potere, c'è una sorta di spazio indistinto tra il potere funzionale a se stesso, cioè il potere, condizione di dominio,
129220	150220	e il potere strutturato come funzione di una facoltà democraticamente legittimata. Diversamente tutte le discussioni che facciamo si toglie, si aggiunge alla quota proporzionale, che è una cosa di una confusione enorme, non avrebbe significato.
151540	170280	Ruffillo aveva una cultura diversa, ho letto che qualcuno l'ha battezzato nell'olivo, non lo so, certamente sarebbe stato con noi, però quando Ruffillo ha pensato le condizioni storico-politiche del Paese erano diverse.
173180	187800	Nel 1987 l'ipotesi sulla quale lavoravamo era costruire l'alternanza tra la democrazia cristiana e il Partito Comunista, era diversa, era così.
187800	215720	E su questa ipotesi, cioè analizzando la realtà sociopolitica del Paese, che si è sviluppata la riflessione istituzionale di Ruffillo, non si ritirò qua nella sua forlido, scappava spessissimo tutte le volte che poteva per inventare un marchingeglio.
218540	235000	Lui ha accompagnato, ma direi proprio nella sua formazione, in mondo potremmo dire che era un po' più lo storico che un giurista, non nel senso che non fosse giurista, ma la sua preoccupazione era prima analizzare il fatto, capire la vicenda,
235000	248000	e poi rindracciare la norma a garanzia del fatto da tutelare o a inrodurre meccanismi di sollecitazione a comportamenti che cambiassero i fatti.
248450	275350	Direi che la sua straordinarietà dal punto di vista dell'intelligenza, ma anche dal punto di vista del carattere, lui ha lavorato dall'82 all'87 in un contesto molto difficile, scaramente dialogante, la cultura delle riformi istituzionali direi che è una conquista recente,
275350	297350	e si vede, non l'abbiamo digerita, abbiamo cominciato a parlare come forze politiche, l'abbiamo scoperta con enorme ritardo, direi che se facessimo un referendum tra i parlamentari,
297350	316390	lo dico in maniera molto serena, per capire che valore l'attuale dirigenza parlamentare attribuisce alle istituzioni, potremmo avere qualche sorpresa, cioè nel senso che la consapevolezza che sia il problema politico principale non c'è,
316390	334690	si immagina come una cosa di cui si potrebbe fare anche a meno, non lo si dice, ma perché la moda è così, ma che ci sia la consapevolezza che il problema politico principale sia il riordino istituzionale, questo non c'è.
335690	352450	E direi che questo spiega, spiega anche poi le soluzioni che si indicano, le istituzioni sono la continuazione di un processo, sono l'evoluzione della storia, sono la capacità di prevedere il futuro,
352450	375150	quando manca questa consapevolezza, i modelli istituzionali diventano un discorso fatto a caso, un po' come quelli che giocano a 3-7 senza capire le carte che ha l'avversario, io non faccio nessun riferimento al giocatore, tirano la prima carta che hanno, non è che c'è il gioco, la comprensione,
376790	393150	allora, io direi che vorrei ricordare due cose, perché lui poi si è caratterizzato nella fase finale della sua attività su due questioni, e io le ripropongo, la legge elettorale,
394270	413150	lo devo dire a Barbera, perché mi ha detto, era buona allora, mi ha detto in un'altra circostanza dopo, non è così, perché la riforma elettorale proposta da Ruffilli non era l'invenzione di un meccanismo per far vincere qualcuno,
414250	432150	adesso il difetto, adesso ne parla pure di Pietro, di legge elettorale, quindi siamo proprio al limite dell'ingomprensione, lui ragionava per vedere, hai ragione che di fronte ai professori sono sempre timoroso,
434390	452310	quando ha discusso di legge elettorale, lui discusse prima, capì prima dove il sistema politico si era ingeppato, e per la verità, io farei una distinzione che vale ancora adesso,
452310	469650	quando diciamo che la Costituzione è vecchia, parte dalla banalità di un'affermazione del genere delle Costituzioni, in un certo senso hanno il carattere dell'eternità, perché evolvono, non è che si consumano,
469650	482690	poi noi siamo un Paese che inventa le mode, la nostra Costituzione sarebbe vecchia perché ha 50 anni e poi vogliamo importare la Costituzione americana che anni ha 200, quindi si capirebbe questa fretta,
482690	504470	in realtà la Costituzione italiana non risolse due problemi, non sono risolti nella vecchia Costituzione, la stabilità dell'esecutivo non è risolta, e direi che i Costituenti ebbero consapevolezza di non aver risolto questo problema nel 1948,
504470	522950	poi questo problema fu risolto, professor Barbera, dalla grande induizione politica di De Gasperi, visto che adesso se ne appropriano tutti, pare che sia al congresso di Assago in questo momento, noi potremmo ritamarlo,
522950	542770	De Gasperi non inventò il meccanismo della maggioranza, De Gasperi inventò il meccanismo della coalizione che è una cosa diversa dalla raccolta della maggioranza ritmetica,
542770	565770	De Gasperi con la coalizione si fece carico di conservare il pluralismo che è la condizione di ricchezza della democrazia all'interno di una società evoluta, però poi si adoperò anche perché formazioni politiche con identità diverse potessero collaborare,
566530	587910	evitando alla tentazione che c'è oggi, qualche volta anche nel mio amico Barbera, di omologare per forza le forze politiche diverse, un meccanismo elettorale che anziché raccogliere la pluralità dei soggetti politici semplifica specie di purificazione di razza,
597310	617170	De Gasperi no, anzi veniva esaltata la diversa identità e recuperata la omogeneità sui comportamenti finalizzati all'attività di governo comune, perciò le coalizioni erano forti, è stato così col centrismo, è stato così col centrosinistra,
617170	634170	poi è cambiata la storia, allora Ruffilli discutendo su questa condizione ipotizzò un modello elettorale che da una parte salvaguardava la identità dei diversi soggetti politici,
635590	660250	e lo dica tutti quelli che pensano di farle saltare, questi poi si ripropongono, è vero che oggi non hanno valenza sommersi da questa ondata movimentista inconcludente, però poi dovremmo anche riflettere che più ci spingiamo a dire che semplifichiamo col bipolarismo, più scopriamo che non funziona, io sono per il bipolarismo,
660250	677590	però i meccanismi istituzionali sono un po' come le indicazioni stradali, se le indicazioni stradali aiutano a raggiungere la meta verso la quale si è diretti uno li segue,
677590	699070	ma se ci fossero cartelli imbazziti per cui la gente sarebbe costretta a far gira volta, a tornare indietro senza aiutarli a raggiungere la meta prefissa non la seguirebbero, e lo dica tutti quelli che discettano di sistemi elettorali, Ruffilli ha ragionato su due elementi molto semplici,
699070	721070	da una parte il recupero dell'identità dei soggetti politici, i partiti sono gli strumenti della lotta politica in una democrazia moderna, perché poi diventa molto strano, dopo aver affermato questo immaginiamo che non ci sono, stiamo attenti perché sotto questa affermazione stiamo dando vita ad una sorta di oligarchia preoccupante,
721070	745570	altro che la partitocrazia, cresce una forma di oligarchia irresponsabile, dall'altra però introduceva un incendivo, non un obbligo, un incendivo di convergenza, tra forze politiche che pur avendo identità diverse,
746290	775550	perseguivano un programma di governo comune, col premio le ingoraggiava a creare le condizioni per poter governare, ma l'obiettivo era dare stabilità all'esecutivo, non autorità all'esecutivo, l'autorità dell'esecutivo è legata agli atti di governo e questo non può essere scritto in nessuna Costituzione, come per i professori, dopo che hanno vinto, se poi le elezioni hanno voglia di dire che hanno vinto il concorso,
775570	788670	sulle elezioni prima serve vincere il concorso, ma una volta che hanno vinto il concorso i ragazzi li valutano per le elezioni che fanno, è così, io credo che sia così.
788670	812510	E Ruffilli fece questo, con molta duttilità, anche nel contesto di allora, Barbera lo sa, dopo aver avanzato la prima ipotesi proporzionale col premio, faccia fare una ricerca ai suoi alumni per scoprire come rispetto al principio maggioritario,
812510	825670	fino a qualche anno fa, tutti quelli che adesso predicano la rivoluzione sostenevano tesi a Berrandi prima, sembrava che un qualche elemento di maggioritario fosse la negazione della democrazia,
825670	846670	che alla fine degli anni 80 onestamente non doveva creare grandi preoccupazioni, perché le condizioni politiche per una competizione tra soggetti politici diversi, alla fine degli anni 80 era una cosa prevedibile, non eravamo all'inizio degli anni 50, quando il sistema era politicamente bloccato,
846670	864050	nonno elettoralmente bloccato, la rigidità nella contrapposizione dei blocchi interni e gli internazionali non lasciava prevedere una mobilità possibile, per cui quando si dice perché non v'ho fatto allora il maggioritario, le condizioni politiche credo che fossero diverse.
864050	878530	E' grande disponibilità eppe con tutte le forze, ma è l'idea che il bipolarismo doveva passare attraverso la semplificazione del sistema politico.
878530	899530	Per cui oggi assistiamo alla tesi a Berrandi che è sostenuta all'interno del PDS, è la maggioranza relativa, ha il diritto relativo, se non tradotta dentro un meccanismo giuridico che legittime i processi.
902590	918310	Il maggioritario che ho sempre condiviso, sostenuto, io ho sostenuto l'opinione di Ruffilli del premio, per la verità io ero per il premio comunque, per quale ragione?
918310	929510	Perché in un sistema democratico è maggioranza, anche la maggioranza relativa, perché tutte le altre forze sono sommabili aritmeticamente ma non politicamente.
929970	943730	Quindi mettere insieme una quantità di minoranzi in un sistema democratico non in astratto professore, perché le istituzioni giuridiche non sono valori assoluti, sono valori strumentali.
943730	956970	Eravamo in presenza negli anni 80 in una condizione di evoluzione prevedibile del quadro politico, del resto nella sinistra, le novità che erano intervenute non ancora nella destra,
957210	972610	però la sinistra occupava uno spazio immenso nell'equilibrio politico del Paese, lasciava prevedere una evoluzione anche in tempi rapidi, non è che si prevedesse una cosa astratta.
972610	986670	Questa è stata la sua posizione. La seconda questione, lui si fece carico del limite del bicameralismo perfetto, perché le due questioni non risolte.
986810	993890	Nella Costituente furono queste, la stabilità dell'esecutivo, però la stabilità dell'esecutivo, la risolta dei gasperi con la coalizione.
993890	1015090	Poi l'abbiamo persa quando alla fine degli anni 60, dopo l'esaurimento dell'esperienza di centro-sinistra, gran parte degli scienziati che oggi si spiegano come si fa politica sostenevano che dovessimo garantire il pluralismo politico irresponsabile.
1015090	1033350	Io ricordo che c'era la teorizzazione che prima si votava e poi si sceglieva e io avevo letto da ragazzo che il rapporto democratico è fatto tra una opinione ed una quantità che la legittima, ma non la quantità comunque.
1033350	1050670	Il voto non indorme ad un disegno politico è solo la raccolta di una quantità e noi per tutti gli anni 80 siamo stati tormentati dagli scienziati del diritto e della politica che si sarebbe creata libertà se tutte le forze si liberavano.
1050690	1059850	Ognuno stava per conto proprio questa sorta di teorizzazione della solitudine come condizione della evoluzione politica.
1059850	1072030	Fisichella credo che anche il professor Sartori, così celebrato adesso come il maestro di tutte le ricette possibili, sostene una tesi del genere.
1072030	1083350	Io so quanti viaggi ho fatto negli Stati Uniti per persuaderlo a sostenevere la modifica del sistema elettorale non avendo avuto mai conforto sulla proposta.
1084090	1091430	Io sono stato tra quelli che aveva messo al centro dell'impegno politico la riforma della legge elettorale.
1091610	1098930	Per quale ragione? Perché il problema della stabilità dell'esecutivo era un problema che poi metteva in gris un po' tutto il resto.
1098930	1118030	Sul bicameralismo perfetto, l'altro problema irrisolto, Rufile andò oltre la proposta perché il Senato approvò una forma di bicameralismo operativo.
1118030	1129290	Anzi, realizzando una condizione di chinastratto, adesso il problema diventa diverso per la composizione del Senato, però dal punto di vista del funzionamento,
1129570	1146290	stabilendo che ogni camera deliberava e la doppia lettura tra le casi particolari era legata ad una particolare esigenza di richiesta, paradossalmente stabilivo il principio che due camere funzionavano in contemporanea.
1146290	1158250	Queste erano le questioni istituzionali risolte e su queste Rufile avanzò una proposta che secondo me ha ancora un suo valore.
1158250	1176390	Se non ci fosse stata la frammentazione delle forze politiche, se le forze politiche fossero rimaste ridotte, sostanzialmente quelle dell'inizio degli anni 80, io avrei sostenuto questa stessa proposta.
1176390	1194550	La mia opinione adesso è diversa, non è diversa da Rufile, purtroppo Rufile è morto, che il sistema uninominale maggioritario, io lo spiego solo così, è una sollecitazione oggettiva agli accorpamenti di maggioranza.
1194550	1216550	Direi che è qualcosa in più di quello che era il premio all'inizio degli anni 80, quindi l'introduzione della proporzionale pur e semplice secondo me non risolverebbe il problema perché sarebbe almeno nell'immediato un incendio alla frammentazione, non una condizione di recupero dell'identità.
1218850	1241710	Rufile non si occupò di un problema, perché allora non aveva la valenza di adesso quella della costruzione del federalismo, ma anche questo io trovo molto singolare, lo dico a tutti quelli che si occupano di questa questione, io non riesco a capirla.
1241710	1253350	Infatti non ho nessuna tentazione di fare l'alleanza con la Lega. Il federalismo è una forma di integrazione di comunità diverse.
1254970	1269450	Molino l'ha ripubblicato, dovrebbe essere diffuso in posto nelle scuole, spiegato. Mentre noi diamo del federalismo una versione in termini di anticipo della frammentazione.
1271290	1298490	Io non vorrei insultare nessuno, però Fisichella non può approfittare della sua intelligenza, che è notevole in maniera così disinvolta, fino ad immaginare che il principio della devoluzione sia la soluzione semplice.
1298490	1315870	Questo è un problema molto complesso, perché insieme è il problema del recupero delle autonomie. In questa questione si inrecciano due questioni. Una è il recupero dell'autogoverno delle autonomie e non solo quelle territoriali.
1315870	1331910	L'altro è quello che è con riferimento alla prospettiva di integrazione europea. Quindi diciamo che l'orizzonte è opposto di trovare forme che garantiscano questo processo di integrazione.
1331910	1356190	Nell'analisi di Ruffillo, quando se ne è occupato, questa questione non era affrontata, era affrontata a quelle delle autonomie. Però lui si occupò moltissimo, e io direi che la cosa che mi preme di più ricordare stasera è questa, della riforma dello stato sociale, delle istituzioni della solidarietà.
1356190	1377810	Professor Barbera, dovremmo riprendere una elaborazione che lui ha fatto in un convegno a Padova in maniera molto acuta. E lo dico per tutti quelli che affermano il cittadino arbitro, il cittadino che conta, che è una grande mistificazione.
1377810	1388310	Perché il cittadino conta se è libero e autonomo. Se il cittadino non è libero e autonomo, che i voti non hanno nessuna importanza. Questo lo dica il professor Fisichella.
1388310	1401510	Quello che mi turba a volte nelle vostre osservazioni è che saltate le ragioni storiche che hanno prodotto poi la crisi delle istituzioni liberal-democratiche.
1401510	1424430	Non possiamo immaginare che il semplice voto sia la condizione per contare in realtà e non conoscere la storia. Perché il diritto di cittadinanza, che nasce con la cittadinanza civile, si accresce con la cittadinanza politica, col voto, e diventa più consistente con la cittadinanza sociale,
1424430	1442090	che ha il riferimento nell'ordinamento dello stato sociale. E l'altra grande questione che abbiamo di fronte, e Ruffilli affrontò queste questioni, direi in maniera completamente opposta a quella che sta facendo questo governo.
1442090	1466670	A me dispiace dirlo, c'è un autorevole rappresentante del governo. Il sanitometro è quando di più stravagante ci possa essere. Per quale ragione? Perché mantiene insieme un meccanismo della spesa pubblica che è la cosa da correggere.
1466670	1492830	Perché noi abbiamo organizzato la risposta alla domanda di salute, non tutelando il bisogno della salute, ma organizzando le prestazioni. E diventa davvero singolare che mentre tutti ormai hanno il credo del libero mercato, non si dice più credo in Dio, credo nel libero mercato.
1492830	1507830	E poi quando si va nel concreto delle strutture, perché sono queste poi che condizionano i comportamenti, si conservano delle strutture inutili di intervento pubblico.
1507940	1529160	Noi abbiamo un'organizzazione, non solo della sanità, ma anche della scuola, che è l'altra grande questione, che non compare, scompare, dell'assistenza, della solidarietà, che conservano questi meccanismi vetero burogratici.
1529160	1548500	Io non dico vetero massisti, sono vetero burogratici, che immaginano che le prestazioni possano recuperare un grado di efficienza definendo i meccanismi di organizzazione, i rendimenti di produttività, che è una delle cose che io non ho mai capito.
1548500	1554660	Non è che non ho capito perché non si capissero, ma perché io non riuscivo a capirlo.
1554660	1571420	Oggi si conserva l'efficienza delle prestazioni burogratiche e siccome non funziona, perché la cosa che non funziona è il modo di organizzare la prestazione, si introduce una tassa per la conservazione dell'inefficienza.
1571420	1595820	Perché il contributo, l'interessa, la contribuzione di gran parte dei cittadini per la sopravvivenza di questo sistema non è il recupero delle risorse per l'amministrazione della tutela di un bisogno, ma è per la conservazione di questo oggetto misterioso.
1595820	1617560	E poi scopriamo ogni giorno che non funziona. Rufilli ci aveva spiegato, e Barbera sarebbe opportuno, ridiscutere questa questione, perché noi finalmente risaniamo il bilancio pubblico, perché c'è l'avvento di forze politiche.
1618780	1633260	Noi abbiamo ingrociato il massimo delle difficoltà all'inizio degli anni 80 perché la sola idea, e io questo lo voglio dire con molta serenità, non ho il risentimento.
1633260	1661720	Io avevo avanzato dal governo un ticket, in significante erano 10.000 lire, ma non perché si pensava di risolvere il problema con la contribuzione degli ammalati, ma perché era necessario in attesa della riforma, perché si era scoperto che avendo messo il contributo per gli accertamenti sanitari nelle cliniche private,
1661720	1675920	gli ammalati andavano in ospedale, per cui facevano le analisi e si facevano pure ricoverare gratis, per cui si disse, vabbè, introduciamo un deterrente che aveva una logica, perché chi non ha proprio bisogno non ci va.
1675920	1696920	E allora io ebbi tutti contro. Non mi preoccupo tanto di ristabilire la verità storica, che sarebbe perfettamente inutile, ma la cosa è che non mi persuade che noi su questa questione, anziché discutere come riordinare la spesa pubblica.
1696920	1717340	Il problema è questo. Poi vediamo se i parametri funzionano o non funzionano. Lei vuole che finisca? Due secondi? Ha ragione? No, è loro che c'entrano. No, non è rivolta a loro.
1718720	1747320	Secondo me questa era la proposta più innovativa di Ruffilli. Il diritto al voto era legato alla conservazione del diritto di cittadinanza forte. E viceversa adesso noi corriamo lungo due direttrici apparentemente forti, ma in realtà molto deboli, perché illudiamo l'elettore che per il fatto che vota risolve e non è vero.
1747340	1763800	Perché il problema della democrazia moderna è legato alla possibilità che il voto condi anche dopo che è stato espresso. Cioè che chi esercita attività di governo sia condizionato, io non ho nessuna difficoltà ad usare questo, da chi ha votato.
1763800	1782680	E i partiti sono la invenzione moderna, i partiti popolari. Turzo e De Gasperi, i massisti l'hanno fatto lungo un conversante diverso, avevano inventato questi strumenti della democrazia moderna.
1783660	1811080	Chiudo con una mezza provocazione, poi la ripiglierò dopo. Beh no, ho ricostruito, adesso la provocazione la faccio. Chiederci se il Parlamento fa o no le riforme, mi sembra molto zioso. Perché in realtà la difficoltà del Parlamento non sta attando nei tempi della decisione, eppure contano.
1811080	1836520	Io sono uno che è entrato in una fase di difficoltà. Fisichella dirà prima di te io. Io ci avevo creduto un po' di più. Però credo che la difficoltà non è perché uno un giorno dice una cosa, l'altro condiziona prima perché c'era il patto da Lema Berlusconi, adesso Fimi da Lema.
1836520	1864820	In un processo convergente e costituente non ci sono mai patti, direi che sembra positiva la convergenza. La difficoltà vera è il venir meno, o meglio il non apparire di una cultura costituente. E credo che Ruffilli oggi, se fosse qua, ci direbbe come faceva con me ragazzo, abbiamo sbagliato strada.
1872100	1890500	Grazie a voi Demita. Per il molto materiale che ha dato a un professore, quale sono io, che guarda le cose e cerca di guardarle un pochino da fuori. Ecco, io ora darei la parola al professor Barbera, visto che è stato chiamato in causa.
1899920	1916300	Mi sento chiamato in causa perché i tempi della commissione Bozzi abbiamo avuto modo di inizio anni 80 di collaborare, dialogare, polemizzare con Roberto Ruffilli e Ciro Codemita.
1916300	1931700	Io ero stato, ero collega di Roberto Ruffilli nella Facoltà di Scienze Politiche di Bologna e ci siamo ritrovati poi insieme nella commissione Bozzi, la prima delle tre commissioni, tra virgolette costituente, all'inizio degli anni 80.
1931700	1950160	In quell'occasione fu presentata una proposta, la proposta di Ruffilli, che prevedeva il superamento, la correzione della legge elettorale proporzionale con un premio di maggioranza.
1952040	1979560	Era entrata in crisi tutte le formule politiche, prima era entrata in crisi la metà degli anni 70, 1975 e il centro-sinistra. Successivamente si era tentato l'esperimento di grande coalizione, la cosiddetta solidarietà nazionale, che è entrata in crisi nel 1979, dopo la morte di Moro e dopo le elezioni del 1979, era ripreso.
1980800	1994560	Di conservare l'uninominale maggioritario, mi fermo qua però, per quale ragione? Perché l'uninominale maggioritario è un sistema di sollecitazione alle aggregazioni.
1996580	2005220	Detto questo, poi dica Barbera, perché è singolare, lui dovrebbe essere d'accordo, io non l'ho detto, ma io dirò una cosa che lui mi ha spiegato in bicamerale.
2005220	2023720	Il sistema utile, che per la verità lui ha proposto e io ho difeso nell'indifferenza generale della bicamerale, che è il sistema utile, a parte tutte le discussioni molto strumentali che si fanno, poteva essere il sistema uninominale maggioritario.
2023720	2033560	Proprio perché abbiamo introdotto il maggioritario, perché questo poi è singolare, non possiamo ragionare ancora con i criteri della proporzionale.
2033740	2052600	E Barbera non è l'accordo di Casaletta che conserva la proporzionale, la melendalità proporzionale è nei dirigenti di partito che ipotizzano le alleanze, non in funzione della coesione o della complementarietà, ma della quota aggiunta per vincere.
2052600	2062340	Per cui adesso Berlusconi apra la Lega, non è che gli interessi tanto il problema della Lega, anche perché a Berlusconi i problemi politici interessano poco.
2062880	2078820	Affatti Conti, perché lui poi Conti, li sa fare che aggiungendo gli elettori della Lega quelli del Polo, ma ignorando i voti che il Polo perderebbe quando e se si alleassi alla Lega, questo evidentemente non lo fa, può vincere le elezioni.
2078820	2090460	Che è un modo di discutere che mi preoccupa, non perché i partiti non debbano combattere per vincere, ma i partiti hanno il dovere di combattere per vincere, ma sulle proposte che fanno.
