start	end	text
0	400	che è la nuova stagione sul
400	2800	centrodestra. Io non so quale.
2960	4480	Non voglio citare come ha fatto
4480	7940	meglio di me Franceschini eh la
7940	9460	la nuova stagione dei doveri,
9500	13160	la fase nuova, il insomma però
13160	15720	ci credo che tutti quanti noi
15720	17240	capiamo benissimo qual è la
17240	18900	stagione che stiamo vivendo e
18900	20980	con quali gambe e con quali
20980	22360	decisioni ci dobbiamo andare.
22620	23600	Dopodichè possiamo anche
23600	25240	tornare indietro e fare quello
25240	26840	che vi dicevo prima cioè rifare
26840	28280	il partito centrista perché
28280	30200	credo che qui le intelligenze
30200	31920	non mancherebbero e anche le
31920	34140	volontà. Se lo volete fare ci
34140	35960	abbiamo abbiamo a disposizione
35960	37800	un una decisione da prendere
37800	39720	insieme altrimenti non c'è che
39720	42860	andare avanti dicendo un sì ma
42860	45780	vero meno tattico e più animato
45780	47820	alla lista unica e poi non aver
47820	49700	paura del dopo. Grazie.
55240	55240	
60480	63460	Carra mi conseglierà una battuta
63460	65800	ed un ricordo poi farò un
65800	68880	discorso serio. Eh quando
68880	70920	Tamroni stava per fare il
70920	75480	governo e e la la previsione che
75480	83240	fosse una vendura eh Forlani mi
83240	86040	diceva lui lo guarda con lo
86040	89120	sguardo sospeso e dice come
89120	94060	Orwell lontano. E e credo che il
94060	96180	discorso di Carra
96180	96180	
96180	102700	no non l'hanno sentito
106660	113320	cosa debba alzare? Perfetto.
117180	122820	Cari amici io vorrei del
122820	134760	lunghissimo elenco di cose dette darutelle nuclearne 3, tentando di ragionare. Io faccio
134760	146280	fatica a seguire l'elenco dei desideri. Io so che l'intelligenza umana deve fare uno
146280	153620	sforzo per capire gli eventi e tentare di regolarli. Poi ci riesce, non ci riesce, questo è un altro
153620	162880	discorso, ma combito della politica è questo. Rutelli ha indicato tre obiettivi. L'Europa,
165860	175140	l'impegno di Prodi in questo disegno di ripresa del processo di integrazione europea, no al partito
175140	186400	unico. Io voglio usare considerazioni, lo dico nonno in maniera strumentale, a volte i nostri
186400	194380	discorsi sono un po' avvocateschi. Si costruisce la motivazione avendo adottato già la decisione.
194700	203720	Io ho un processo in testa diverso. Se mi consentite anche alla esperienza che abbiamo fatto alcuni di
203720	215600	noi in questa ultima legislatura nel Parlamento europeo. Qual è la considerazione che i gruppi
216780	221320	costituiti, quelli tradizionali, io parlo di quelli più consistenti, il Partito Popolare
221920	230500	Europeo, quello socialista, quello liberale, sono andati avanti non aggregando intorno ad
230500	238980	un'analisi, ad una proposta, ma ad una quantità. Chi ha avuto più esperienza di me un giorno
238980	247980	potrebbe spiegarci come questo processo è avvenuto. C'era una ragione perché nel passato
247980	260480	l'attenzione maggiore dei gruppi era funzionale alla gestione dell'Assemblea. Il ruolo del
260480	269840	non era così. L'obiettivo di essere il primo partito era un obiettivo strumentale a questo.
270300	277320	Con lo paradosso, visto che poi qua si fanno riferimenti, che il Partito Popolare ha fatto
277320	282420	del tutto per diventare il primo partito in questa legislatura, c'è riuscito ed ha fatto
282420	289880	l'alleanza con i liberali per la spartizione delle cariche. Quindi la logica della organizzazione
289880	297600	dei gruppi era una logica di aggregazione per quantità. Credo che questo fenomeno ormai
297600	305320	fa imblodere i gruppi. La difficoltà, non il Partito Popolare. I gruppi, tutti i gruppi
305320	312120	numerosi all'interno, cioè consistenti di maggiore quantità all'interno del Parlamento
312760	321160	hanno una vitagrama. Il disegno politico appassiona meno. E questo voglio dirlo in maniera che
321160	327540	abbiamo un riferimento concreto quando discutiamo. Siccome noi affermiamo, io di questo sono
327540	337240	convinto, se non altro per una lunga militanza e un impegno lungo questo disegno nel processo
337240	345280	di integrazione europea si è notevolmente affievolito. Nell'ultimo dibattito che l'Assemblea
345280	351000	ha fatto, Rutella ha detto io sostengo le opinioni del Presidente della Commissione,
351040	358340	anch'io Francesco, però ci dobbiamo dire con molta serenità che le opinioni che io condivido
358340	365420	del Presidente della Commissione nell'Assemblea che ha votato non è che gli abbia dato grande
365420	372420	solidarietà, non i popolari, tutti, il PSE, il Liberto, perché la logica è stata diversa.
373720	380800	Conclusione, noi siamo in presenza in Europa di questa implosione. Direi che il modo di
380800	387140	organizzazione dei gruppi parlamentari, stiamo attenti a non ipotizzare internazionali nuove
387140	395400	senza motivazione unificante, i gruppi cominciano a registrare l'insufficienza dell'aggregazione
396060	403940	per quantità. Io insisto su questo, stiamo attenti a non commettere questo errore. Di
403940	412280	qua la convenienza, io non ho nessuna difficoltà a dirla, che se nel Parlamento europeo, io
412280	420240	non ho la suggestione di Franceschini di prefigurare la storia, io ho sempre qualche difficoltà
420240	426820	a misurarmi con questi disegni. Sono un po' più attento alle cose che cominciano, sapendo
426820	433340	però che le cose che cominciano poi devono avere un fine possibile. C'è stata una dichiarazione
433340	441700	di Baron Grespo quando è venuto Ciambi che usando Seneca ha detto che quando si conosce
441700	449200	il porto la velocità è più spedita, quindi attenti a non muoverci pensando che si possa
449200	458060	essere spediti. Oggi costruire nel Parlamento europeo, questo dobbiamo essere molto chiari,
459560	467120	io se ho capito bene il ragionamento di Zanone mi trovo molto d'accordo, costruire nel Parlamento
467120	474460	europeo un'aggregazione che indipendentemente dai punti di partenza si aggreghi intorno
474460	484280	a sostegno alla ripresa del processo federativo che è scomparso, perché la logica dei governi
484280	492840	da nizza in boicche che se ne dica ha avviato un processo inverso a quello dell'aggregazione.
494560	501160	Io non sono, lo dico con molta franchezza, entusiasta della conclusione della convenzione,
501840	508460	perché ritengo che tutto sommato la convenzione è un rinvio più che un'accelerazione del
508460	514260	processo, ma io qua stasera non voglio parlare di questo. Nel Parlamento europeo c'è questa
514260	523240	esigenza, quindi se persone che vengono da storie diverse, Demita, Rutelli, Napolitano,
530560	537940	Bosselli, partecipassero ad un gruppo unico non inventano niente di straordinario, perché
537940	545120	già nel percorso che si è compiuto si è registrata una notevole convergenza, sulle
545120	553160	questioni delicate e importanti la convergenza di questi c'è già. Allora amici miei, la
553160	564300	convergenza non è, mi dispiace Monaco, ma questa categoria di pseudo-concetti, il pluralismo,
564400	572120	le culture, ogni forza politica ha una proposta che fa riferimento a determinate culture,
572440	577400	ma non esiste un partito che ha più culture, perché un partito che ha più cultura, più
577400	583760	progetti, è un partito che ha più progetti, non è un partito. Una forza politica vincente
583760	593380	è quella che sulla scorta delle culture esistenti definisce un grande disegno politico comune,
593580	600660	De Gasperi e Moro hanno vinto, non per una monocultura, ma De Gasperi e Moro hanno vinto
600660	607880	tenendo conto del pluralismo politico del Paese e indicando l'equilibrio possibile tra
607880	613460	le diverse culture. Quindi la proposta politica è una, non è la divagazione o la ricerca
613460	621380	di varie cose. Noi in Europa potremmo realizzare questo, io sarei molto favorevole se questo
621380	629840	fosse possibile e quindi la proposta contenuta nelle prime due indicazioni della relazione
629840	640020	di Luttele, obiettivo Europa, lista unitaria per costruire dopo il gruppo parlamentare
640020	647200	unito mi trova consensiente. Certo che in questa proposta io non ho nessuna difficoltà
647200	655520	a dirla, esistono anche, non dobbiamo scandalizzarci, anche la raccolta di alcune esigenze nostre,
655520	663260	perché la politica non è un disegno tra teoremi astrati, la politica è il disegno dei comportamenti
663260	670000	umani complessi e nei comportamenti umani ci sono anche delle miserie che vanno recuperate
670000	677080	in un disegno, quindi io lo dico con molta serenità, quindi se questo fosse possibile
677080	684340	io non sarei contrario, ma non sono contrario per una motivazione che poi è l'esatto
684340	690440	imposto delle conseguenze che Franceschini dice, gli due atto stasera ha detto con grande
690440	697520	chiarezza quello che lui pensa che è la motivazione esatta per la quale io sono contro, sono
697520	707440	reciproche, le cose ambigue vedremo che si fa la coalizione, qua il discorso è divento
707440	714320	un po' più serio, io chiedo a Luttele che su questa questione anche in vista della
714320	722760	del congresso, la Margherita finalmente trovi occasione di riflessione, di definizione
722760	729680	del proprio ruolo, la coalizione, io credo che tra di noi c'è un po' di confusione,
731740	736780	tra il pluralismo politico e la coalizione, la coalizione è il modo di mettere insieme
736780	742640	esperienze politiche diverse, non il partito unico, il partito unico è la ricchezza, cioè
743480	750980	la coalizione fa riferimento alla ricchezza del pluralismo politico e la democrazia italiana
750980	758120	è stata forte in tanti momenti proprio perché ha garantito il pluralismo politico indipendentemente
759200	767280	dalla qualità salvaguardando ciò che le motivazioni culturali raccoglievano dentro i fermenti
767280	774320	culturali, politici, sociali della comunità per garantirne questa ricchezza. La coalizione
774900	781880	è che noi non l'abbiamo mai praticata e questo problema che esiste non è risolvibile
782760	791660	come Franceschini dice perché ha messo, e io sono d'accordo, che la coesione della coalizione
791660	798960	è scarsa, insomma è abbastanza scarsa, tranne che nei momenti di opposizione la coalizione
798960	805600	non ha vigore antagonista, la esigenza di Zanone di contrapporre alla maggioranza a
805600	810620	proposte alternative dell'opposizione non è che non si fanno pepigrizia, non si fanno
810620	817340	perché su una quantità di questioni la convergenza è molto più complicata di quando non lo
818160	826120	immagini, però pur convenendo, io credo che è l'unico che non debba mai dirlo, essendo
826120	833660	convinto della coalizione di centro-sinistra, l'ho fatto, l'ho fatto che credo con grande
833660	838700	coerenza anche in momenti di difficoltà, non perché fosse un sacrificio ma perché era
838700	847320	un comportamento conseguente alle mie opinioni, detto questo però io avverto che l'aspirazione
847340	855340	pinta alla coesione dentro la coalizione non può partire attraverso un processo di
855340	865920	coercizione e quando Monaco indica come modello di coesione quello personale berlusconiano
865920	872480	io dico con molta franchezza anche se in termini personali, se questo fosse la prospettiva
872480	879220	di me perché ne devo inventare un altro, c'è, il problema è altro, la coesione nasce
879220	887440	dalla capacità di guida, non dalla disciplina, la disciplina è conseguenza delle motivazioni
887440	895600	della coesione e noi in una coalizione larga, che è larga ma da rifondazione a Mastella
895600	902940	faccio riferimento anche ad una considerazione fisica, ci illudiamo che concentrando la spinta
902940	910200	in un punto solo del movimento alla velocità sia maggiore, sottraendo alle altre forze
910200	916700	quel poco di spinta che è necessario per rafforzare la coalizione, io lo dico in termini
916700	922840	paradossali per farmi capire, io troverei insensato mettere insieme tutti quelli che
923220	928900	sono d'accordo per accenduare la differenza con quelli che non sono d'accordo, mi parebbe
928900	937380	più di buon senso per non usare altre categorie fare in modo che le spinde alla convergenza
937380	943720	che esistono anche in quelli che prevedibilmente con noi non si associano perché poi il processo
943720	950460	complessivo registri la convergenza, ma dal punto di vista operativo politico questa sorta
950460	957180	di presupposto, tutto da dimostrare, che l'alternativa è fatta tra due blocchi, insomma Derita ha
957180	966020	fatto un bel saggio su questa sorta di astrazione, io credo che se dovessimo disegnare un'ipotesi
966020	971600	di modello di comportamenti, il ruolo della sinistra e lo dico con molta serenità da
971600	978080	Lema, che è una grande intelligenza d'Henry 50 metri, al sessantesimo metro si perde sempre,
978080	986520	io oggi dirigente di Essino impegnerei tutte le energie per ricondurre la sinistra intorno
986520	992400	ad un processo di coalizione, riducendo le spinde altro che fare il partito di salvi.
993160	998620	Insomma Harry è molto disinvolto nel dichiarare il futuro indipendentemente dalla storia,
998620	1003860	eppure la sua storia dovrebbe aiutarla a capire che insomma le cose frettolose non portano
1003860	1013640	sempre nella direzione giusta. Oggi se c'è un problema è far maturare dentro la sinistra
1013640	1020640	una spinda all'organizzazione del processo democratico sfuggendo alla tentazione che
1020640	1027180	dentro la sinistra c'è. La Biura ha una grande motivazione, comunismo non era cosa da poco,
1027180	1032140	era una grande motivazione, ma la Biura ha la grande motivazione e la conservazione
1032140	1040240	dell'arroganza di chi ha immaginato di possedere i riferimenti della verità. Questo è un
1040240	1048180	problema che loro debbono risolvere, noi possiamo aiutarli a risolverli ma non con l'ostillità
1048180	1055240	nascosta o con tipi di operazioni di cattura, noi li possiamo aiutare a recuperare rispetto
1055240	1063760	a queste difficoltà organizzando, secondo la grande tradizione laico-democratica delle
1063760	1070300	forze politiche del nostro Paese, una forza in condizione non solo di aggregarsi nei
1071460	1076900	momenti organizzativi, questo mi interessa meno, ma di essere soggetto di riferimento
1076900	1083460	per questa larga fascia della pubblica opinione verso la quale c'è bisogno di costruire
1083460	1092940	un soggetto che intercette l'attenzione. Io confesso, se è sbagliata come dire, l'indicazione
1092940	1100360	del presupposto è sbagliata anche alla conseguenza, io per quello che capisco, a differenza del
1100360	1107320	Professor Paris, io non sono un esperto di sondaggi, di conoscenza della pubblica opinione,
1107320	1116920	di quantificazione, lo dico senza ironia Arturo, lo dico perché io non ho questa... e aspetta
1116920	1129620	che c'è pure la seconda parte, però credo che nella mia esperienza ho una qualche capacità
1129620	1136440	di intercettare gli umori, le ragioni dei movimenti che non sono solo fatti umorali,
1137320	1144820	sono il risultato del governo dei processi che la realtà ha. Io descrivo il mercato
1144820	1150780	elettorale non nobipartitico, poi la scelta è di qua o di là, questo è vero, quando
1150780	1155780	uno va a scegliere sceglie o per l'uno o per l'altro, ma il comportamento non è
1155780	1161940	bibipartitico, il comportamento è un po' più articolato, più complesso, andate in giro,
1161940	1169560	parlate con le persone e scoprirete che c'è una quota di elettori che comincia a ridursi,
1169680	1175040	almeno sul piano dell'endusiasmo, comincia a ridursi che vota per la destra, vota per
1175040	1181240	Berlusconi, c'è una fetta di elettorato un po' più rianimata rispetto al passato,
1181320	1187280	non mi interessa la quantità, ma rianimata rispetto al passato che vota per la sinistra,
1187280	1194780	ma sono due posizioni non maggioritarie, la posizione maggioritaria è quella intermedia,
1195040	1203980	è quella che è attraversata dall'uno e dall'altro fronte, che pone una domanda di politica
1203980	1211500	responsabile, che si misura con l'interlocutore politico sul piano della spiegazione delle
1211500	1219060	indicazioni possibili, non della cattura emotiva, noi rispetto a questa dovremmo costruire una
1219060	1226180	risposta e quando sento dire non ci sono più partiti identitari si dice una cosa vera e
1226180	1231620	farsi insieme, perché se si fa riferimento ai partiti ideologici questa identità non
1231620	1236580	c'è più, tra l'altro non ci sono questi riferimenti culturali neppure per organizzarli,
1237140	1244860	ma caro Monaco senza la costruzione di una motivazione condivisa rispetto ai problemi
1244860	1251140	della collettività l'interlocuzione su che la costruisce, questo è il punto vero della
1251140	1258020	crisi del sistema politico, altro che liste uniche e parole senza senso che noi pronunciamo,
1258340	1265220	noi abbiamo il dovere di battere il rischio di conservazione democratica del Paese, perché
1265220	1271740	su questo punto della crisi Berlusconi, e lo sta facendo con straordinaria capacità,
1272120	1278440	tenta di catturare l'attenzione della pubblica opinione discutendo emotivamente del problema
1278440	1287660	e noi rispetto a questo non siamo ancora in condizione di costruire una motivazione consapevole
1287660	1293340	e appagante per l'elettore che investe su un percorso diverso ma con la speranza di
1293340	1300160	risolvere il problema. Noi dobbiamo costruire il riferimento politico per questo tipo di
1300160	1308140	domanda dentro il centrosinistra, ma ci mancherebbe, l'abbiamo scritto, può essere abbastanza
1308140	1313720	stucchevole dire che noi siamo nel centrosinistra, perché se qualcuno di noi cambiasse opinione
1313720	1318620	la dice e se ne va se sta qua vuol dire che ci crede, allora dobbiamo discutere su quello,
1318620	1326600	non basta dire che ci stiamo se poi non siamo capaci di organizzare quel minimo di risposte
1326600	1335040	possibili per recuperare il processo democratico nel Paese. Io non vorrei apparirvi più allarmato
1335040	1346980	di quando non sia necessario, ma assistere, ma la cosa che mi ha colpito di più Arturo
1347540	1355540	non era che votassero contro, o votassero, era l'indifferenza all'argomento, si poteva
1355540	1361540	dire quello che si voleva, su una questione delicatissima come la libertà dell'informazione
1361540	1368580	c'era il no preventivo o il si preventivo a secondo la logica di appartenenza, guardate
1368580	1376420	che se non rompiamo questo circuito infernale, se noi involandariamente l'arricchiamo non
1376420	1382960	contribuiamo ad arrestare il processo di ripresa democratica nel Paese. Innanzi a noi c'è
1382960	1389180	questa questione chiudo, cari amici della Margherita, su questo dobbiamo vedere come
1389180	1395340	organizzarci e allora non basta dire no alla Margherita rimane no al partito unico Rutelli,
1395460	1401940	perché io su questo so d'accordo, se noi ci orientiamo a dire la lista unitaria per il
1402280	1409260	gruppo unitario, perché in Europa un gruppo unitario che riprenda la politica di tradizione
1409260	1416200	federalista, lasciatemelo dire, perché su questo programma io ci sono nato e quindi non
1416200	1422700	ho nessuna difficoltà a registrare larghe convergenze su una prospettiva politica che
1422700	1428900	ha accompagnato la nostra esperienza, però è là, poi qua, è il problema esattamente
1428900	1435660	proposto, perché se là registriamo che i processi di integrazione quantitativa non
1435660	1440440	hanno portato a risultati positivi, mi volete dire perché la dovremo praticare qua, qua
1440440	1446120	dovremo fare una cosa diversa, realizzare l'obiettivo che in Europa c'è e qua non c'è, cominciare
1446120	1454300	a discutere, non per imborre, ma prima da parte nostra a elaborare proposte politico-programmatiche
1454300	1461180	intorno al quale aggregare il consenso, questa è la sola via per far crescere la solidarietà,
1461420	1470080	non il giuramento che non si rompe, credo che sia difficile giurare che non si rompe,
1470920	1476180	io l'ho fatto già, io mi sono rifiutato Rutelli quando mi sono dovuto laureare di fare il
1476180	1482400	giuramento che sarei rimasto sempre cattolico, e se perdo la fede, come faccio ad impegnarmi
1482400	1488420	e troviamo un compromesso alla cattolica che siccome il codice di diritto canonico ci
1488420	1495320	obbligava noi lo facevamo ma loro riconoscevano che era sbagliato ed un mio amico, un coltore
1495920	1503900	di studi storici ricordò che nell'epoca medievale chi era soggettato a giuramento non essendo
1503900	1510640	convinto bastava che giurasse in forma non rispettosa e giurammo col piedalzato, no dico
1510640	1521440	che cavolo significa, cosa significa, no la coesione sta se noi siamo capaci di organizzare
1521440	1530020	risposte politico programmatiche forti. Concludendo, Franceschini dice ma dobbiamo sapere la prospettiva,
1530400	1538060	la prospettiva, io non condivido questa lettura della storia come un processo lineare.
1550960	1557800	E a volte li costruisci in maniera esattamente opposta a come noi li avevamo immaginato,
1558080	1560000	il problema è un altro, è serato come una storia.
