start	end	text
0	9480	Quindi i servizi pubblici che però possono integrarsi, possono essere arricchiti da questa
9480	16240	generosità che la nostra società esprime. Amici, non è quindi un programma rinunciatario
16240	24100	quello della democrazia cristiana, è il programma di un partito che guarda lontano, è il programma
24100	30160	di un partito che sa che in questo momento c'è anche un grande potenziale politico.
30280	36100	Perché, amici, non è più come una volta non c'è una contestazione a prioristica
36100	43740	delle istituzioni. Quando le istituzioni, chi le rincarna, chi le rappresenta, sa essere
43740	53480	coerente, lineare e conclusivo, allora si crea consenso intorno alle istituzioni e noi
53480	62340	questa potenzialità vogliamo coglierla, vogliamo coglierla esprimendo con convinzione il massimo,
62340	70040	il meglio di noi stessi, perché anche qui in un documento non politico, ma in un documento
70040	77100	bellissimo c'è una definizione della storia che mi ha sempre affascinato, la storia vista
77700	85620	come evento di libertà. Noi, che siamo i figli dei liberi e i forti, vogliamo contribuire
85620	94700	a costruire la storia come evento di libertà caratterizzata da un altissimo grado di solidarietà.
94800	101140	Per questo vi chiediamo voti per la nostra lista, per questo ringraziamo il capolista,
101140	108660	gli 80 candidati che con lui hanno corso, i 400 circoscrizionali, non ce li dimentichiamo
108660	118940	perché quelli sono una ricchezza e ci auguriamo, anzi siamo sicuri di poter essere ancora
118940	124940	tutti qui intorno al segretario politico e al Presidente del Consiglio a festeggiare
124940	150300	la vittoria della democrazia cristiana. E ora la parola a chi ha seguito l'impegno,
151300	160020	le ansie ma anche la grande determinazione di condurre alla vittoria il nostro partito
160020	165020	il 29 e il 30 ottobre, l'amico Arnaldo Forlani.
185660	190100	Credevo che parlasse Andreotti, perché ho bisogno di raccogliermi un momento.
200280	208360	Ma lo facciamo parlare dopo, perché è giusto che sia Andreotti a concludere questa campagna
208360	228600	elettorale romana per la democrazia cristiana. Voglio dire alla Rosetta che ieri al Parlamento
228600	235600	europeo di Strasburgo sulla droga ha parlato il Presidente della Repubblica francese Mitterrand,
238880	253240	e ha esposto delle idee, con la chiarezza così cartesiana che è proprio dei francesi,
254140	268340	ha esposto delle idee e di una filosofia complessiva che sono assolutamente i diritti del Presidente
268360	276620	dell'Italia, identiche a quelle che stanno alla base del provvedimento presentato dal
276620	289580	Governo italiano e perfezionato poi in sede di Commissione al Senato. E ha insistito
289580	298340	sul fatto che non è possibile rendere il Presidente della Repubblica francese Mitterrand
300800	310880	credibile la illiceità del consumer della droga se questo principio non viene in qualche
310880	323980	modo sanzionato da un intervento, da un provvedimento. Alla luce delle cose dette da Mitterrand,
323980	333180	che ha fatto poi un quadro veramente terribile, tragico della situazione per questo aspetto,
333220	351100	della situazione nel mondo, in Francia e in Europa, non è possibile dare una coscienza
351100	371880	esatta, una consapevolezza severa a tutta l'opinione, che nella responsabilità dello
371880	381080	Stato, dei governi e dei legislatori non si determina una svolta significativa nell'impegno
381100	390840	operativo, la lotta ai traficanti, ai commercianti, agli intermediari e se non si interviene anche
390840	401700	con provvedimenti che acquiscano la intelligenza, la sensibilità e la consapevolezza della
401700	410800	gente in ordine a questo dramma. Direi che questa linea che abbiamo adottato e che viene
410800	419780	così chiasosamente contrastata da alcuni settori, da alcuni gruppi, è la linea che
419780	426800	sta prevalendo ovunque, in tutte le società democratiche. Non parlo dei paesi totalitari
427700	437380	nei quali le possibilità di intervento, di repressione sono di natura diversa e il problema
437380	444380	quindi ha caratteri meno drammatici di quanto non li assume invece nella società democratica.
446740	454340	Quindi, tu hai ringraziato noi, siamo noi che esprimiamo gratitudine come democrazia
454340	467360	cristiana al tuo impegno, all'impegno del Presidente del Consiglio, per la linea che
467360	488280	ci ha preso. Ringrazio Jubilo per il suo saluto e dico a lui che nel corso di questa ricenda
488280	497340	elettorale mi ha fatto piacere. Vederlo impegnato in modo che, in modo che il Presidente del
497360	505880	Consiglio, in modo più entusiasta ed attivo di quanto non lo sarebbe stato se avesse guidato
505880	521300	la lista della democrazia cristiana. Questa è stata ed è una prova di grande responsabilità
521300	533320	e di grande attaccamento al Partito. Una delle cose che mi ha colpito di più e che
533320	543720	è stupefacente è la continua lamentazione dei comunisti per le risposte della democrazia
543720	551280	cristiana. I comunisti hanno impostato tutta la campagna elettorale, sono un'ultima campagna
551300	560520	e hanno partito così con propositi chiari, enunciati, di diffamazione, di calugna nei
560520	573740	confronti degli uomini della democrazia cristiana. E si lamentano perché la democrazia cristiana
573740	581280	risponde. Si ricordano quel personaggio della commedia napoletana che voleva fare una campagna
581300	593000	e fare il duello ma si lamentava perché l'altro si muoveva e non riusciva ad infilzare. In
593000	604540	realtà noi non abbiamo insistito molto su queste cose. Ho visto che oggi si lamentano
604540	633580	perché sul popolo è stato riprodotto un articolo di Reiklin del 1956 in cui approvava
633580	646400	l'invasione dell'Ungheria. Io dico la verità, non l'avrei nemmeno pubblicato perché non
646400	662900	era soltanto Reiklin, era il partito comunista che nel 1956 approvavano. E non voglio dire
662900	672260	nemmeno con Montanelli quello che dice stamattina il Reiklin. Arriverebbe a fare il sindaco
672260	683920	a Roma solo se ci fossero i cari armati, queste sono cose che io non so. Ma non è questo.
686000	692180	Qui il tema era quello della solidarietà. Io credo che la linea forte anche politica
692180	701480	della democrazia cristiana, non soltanto la linea sociale proiettata programmaticamente
701480	708940	sui problemi della società, ma anche la linea politica della democrazia cristiana si ispira
708940	721920	alla solidarietà. Io credo che se vogliamo realizzare una possibilità reale di governo
726480	735540	efficace credo che sia difficile farlo prescindendo dalla forza centrale e coesiva della democrazia
735540	744580	cristiana. E non è facile, non è facile perché l'abbiamo visto con le ultime amministrazioni.
744960	751320	E' vero, qui è stato detto assai bene, Garacci poi lo ha ricordato con un riferimento
751320	763620	preciso. C'è una impostazione artificiosa, falsa, nella polemica che viene condotta contro
763620	777540	la democrazia cristiana. In realtà sia Signorello che Giubilo hanno operato bene alla guida
777540	791940	delle giunte e che nella situazione attuale è difficile il governo delle città. Io capisco
791940	798220	quello che ha detto in questi giorni con la consueta pungente ironia l'amico Andreotti
798220	807520	in ordine al dibattito in corso sui sistemi elettorali e ha detto giustamente che lui preferisce
808300	820060	delle lezioni con venti liste piuttosto che delle lezioni con una lista sola. E stiamo
820060	827680	discutendo di questo, è un dibattito aperto perché io credo che Andreotti sia d'accordo
827680	834080	con me che però fra una lista sola e venti forse c'è una via di mezzo un po' ragionevole.
838320	846780	E allora la situazione non è di Roma, è il governo delle grandi città che non solo
846780	857440	è diventato difficile ma addirittura spesso con gli attuali meccanismi impossibile. Diciamo
857440	865620	la verità, ad un certo punto Signorello se voleva difendere almeno una possibilità
865620	874280	di normale amministrazione ha dovuto praticamente fermarsi perché come si muoveva chi lo condizionava
874280	878500	dalla parte e chi lo ricattava da un'altra e quindi si andava alla crisi e poi si è
878500	889140	andato allo stesso alla crisi. Poi è arrivato Giubilo, Giubilo ha cercato di fare qualche
889140	897320	cosa nuovo e ha intrapreso la via delle decisioni del governo reale e ha cercato di decidere
897320	905060	e di governare. Non è che lui non amministrava bene, lui amministrava bene è che è venuta
905060	912240	meno anche con lui la possibilità di governo oltre che la solidarietà, diciamo, degli
912240	922380	alleati. C'è una difficoltà, una impossibilità di governo. La Rosetta ha ricordato Sturzo
923200	934640	e lo ricordiamo insieme nel trentesimo anniversario della sua morte, io sono stato l'altro giorno
934640	942220	in occasione dell'Assemblea Nazionale dell'Associazione dei Comuni d'Italia a Caltagirone e ho preso
942240	951900	a rendere omaggio alla sua tomba. Sturzo era un proporzionalista convinto, convinto e tuttavia
951900	960140	voi lo ricordate poi dopo una lunga esperienza, una conoscenza delle cose dell'Italia e del
960140	971620	mondo anche qui, qui a Roma negli ultimi anni della sua vita quando scriveva spesso sul
971620	983120	Giornale d'Italia già allora ci diceva che se non avessimo adottato qualche correttivo
983120	992620	nei meccanismi della proporzionale la realtà dei comuni delle nostre città e dei nostri
992620	1001280	paesi sarebbe diventata una realtà difficilmente governabile. Allora noi abbiamo posto il problema
1001280	1008280	in questi termini e anche nelle grandi città che cos'è che ci ha colpito in questi giorni,
1009500	1015920	scusatemi il carattere così famigliare, confidenziale che voglio dare a questa nostra conclusione
1015920	1022980	tanto dopo c'è Andreotti che rialzerà il tono della conclusione, ma cos'è che ci
1022980	1031260	ha colpito? Diciamo la verità anche la grande confusione, la grande demagogia, la grande
1032280	1042000	demagogia, la straordinaria retorica e questo è un po' il portato anche della proliferazione
1042000	1049880	così ricca delle liste e dei partiti nel confronto elettorale, perché ogni lista,
1050160	1056920	ogni partito, ogni gruppuscolo che si presenta ha bisogno in qualche modo di differenziarsi,
1056920	1064200	di legittimare la sua presenza e quindi deve inventare delle cose che in realtà non stanno
1064200	1072920	né in cielo né in terra. Quindi è un guaio grosso per la democrazia se non riusciamo
1072920	1080000	rispetto alle spinte dissociative, rispetto alla frammentazione del quadro politico non
1080140	1089760	riusciamo a far prevalere elementi di aggregazione, di sintesi e di essenzialità. C'è stata
1089760	1099920	molta retorica e molta demagogia in queste giornate attorno ai colli fatali di Roma e
1099920	1105580	anche molta ipocrisia e con questo lasciatemi concludere perché del resto non voglio parlare.
1106340	1112720	Ho ascoltato Garacci anche stasera, l'ho ascoltato in altre occasioni nei diversi quartieri
1112720	1121180	di Roma dove siamo andati, ecco una cosa che mi ha colpito favorevolmente, mi sono messo
1121180	1129860	nei panni del cittadino di fronte a tutta questa demagogia rampante, a questa retorica sconfinata
1129860	1139800	su Roma. Noi abbiamo avuto un capolista che circondato da una corona di amici altamente
1139800	1147180	qualificati dal punto di vista professionale della loro preparazione, abbiamo avuto in
1147180	1158180	Garacci un uomo che con grande freddezza in modo pacato, con una documentazione scientifica
1158180	1165340	ha trattato in modo concreto e sul serio dei problemi di Roma e come sia possibile
1165340	1173560	affrontare questi problemi in modo razionale e portarli a soluzione. Questa mi pare che
1173560	1180380	sia stata una risposta importante della democrazia cristiana. Gli altri partiti in definitiva
1181400	1189920	hanno presentato le loro liste, i loro uomini risolvendo tutto all'interno della nomenclatura
1189920	1198300	di partito, soprattutto con qualche piccola eccezione direi che hanno presentato uomini
1198300	1205840	che hanno maturato la loro esperienza, la loro anche preparazione, ma attraverso una
1205840	1214480	prevalente militanza di partito. Noi abbiamo presentato una lista che sia aperta in modo
1214480	1226840	significativo ai valori della società civile, come era richiesto nel nostro Paese. E allora
1226840	1233760	è stata una campagna elettorale seria che ha fatto riferimento puntuale ai problemi
1235210	1244550	del traffico, al problema dei servizi, al problema della difesa, della natura, dell'ambiente,
1244850	1252010	del patrimonio artistico, culturale e storico della città di Roma. Con la consapevolezza
1252010	1258130	che i problemi delle grandi città, non soltanto quello di Roma, i problemi delle grandi città
1258130	1264790	non si risolvono ormai soltanto per l'impegno, per la capacità di iniziativa, di proposta
1264790	1270570	e di governo degli amministratori locali. Non basta neppure questo. Ormai è evidente
1270570	1277370	che i problemi delle grandi città, non solo in Italia, ma in tutto il mondo, coinvolgono
1278970	1285190	una responsabilità nazionale e quindi un impegno anche di legislazione e di governo
1285190	1291790	rispetto al quale occorre dare delle garanzie. Chi li può dare meglio di noi in questo momento,
1291990	1298770	tra le altre cose assurde che ho ascoltato, è che si è rimproverato a Garaci, non sapendo
1298770	1307050	che cosa inventare di Garaci, per dirne male, ha detto che è troppo amico di Andreotti.
1307270	1309450	È come se questo fosse una colpa.
1316010	1322710	Andreotti è il Presidente del Consiglio, è romano e certamente l'uomo politico più
1322710	1337950	popolare e più amato a Roma, bene, che Andreotti sia per la circostanza e io mi auguro il più
1337950	1343450	a lungo possibile per tutta la durata della legislatura che sia il Presidente del Consiglio,
1343450	1350750	il Capo del Governo. Bene, questo, caro Garaci, è una garanzia forte, autorevole e d'ulteriore
1350750	1356690	che il programma che tu hai presentato noi lo porteremo a computer realizzazione.
1364850	1373330	Poi un'altra cosa e concludo perché mi sta qui un po' a proposito dell'ipocrisia.
1377210	1388290	Se la prendono con noi perché cercano il voto dei cattolici, ma se guardiamo bene i discorsi
1388290	1397810	a quello che stanno facendo in giro, bisognerà dire con chiarezza che se qui c'è un partito
1397810	1404370	che veramente rispetta la libertà di coscienza di tutti e quindi anche dei cattolici, questa
1404370	1418290	è proprio la democrazia cristiana. Che poi il voto dei cattolici venga alla democrazia
1418290	1427790	cristiana e ci abbia consentito questo nostro voto cattolico, ci abbia consentito di vivere
1427810	1437250	e vincere le battaglie decisive per la democrazia, per la libertà e per il progresso della nostra
1437250	1443050	società nazionale, ma questo è un voto che è venuto liberamente alla democrazia cristiana
1443050	1453350	e di questo voto noi siamo fieri ed orgogliosi. Ma io che ho questa consuetudine di rimprovere
1453350	1460070	una volta che sono troppo collaborativo con gli altri partiti, beh c'è anche un vantaggio
1460070	1466990	nell'essere collaborativi, nel cercare i punti di raccordo e di solidarietà anche qui perché
1467630	1473890	senza di questo poi il nostro Paese diventa ingovernabile, non si concluderebbe niente,
1474090	1482730	abbiamo ricordato Sturzo ma dobbiamo ricordare anche, direi allo stesso modo, ma la esperienza
1482730	1493750	più vicina dobbiamo ricordare soprattutto De Gasperi, se De Gasperi non avesse dato
1493750	1500450	questa svolta decisiva rispetto alla tradizione così politica del nostro Paese, anche la
1500450	1505990	tradizione democratica che era improntata soprattutto alla credine, alla litigiosità,
1505990	1513070	alla incapacità di incontrarsi e di collaborare dei partiti, De Gasperi ha dato una svolta
1513070	1519830	in questo senso e ha fatto capire a tutti e in primo luogo a noi che il compito essenziale
1519830	1526470	era quello di trovare linee di collaborazione e di raccordo anche con partiti che venivano
1526470	1535970	da una diversa esperienza o avevano diverso orientamento. Nella secondare questa esperienza
1535990	1544410	politica c'è anche un vantaggio, che finiamo per conoscere meglio anche gli altri, allora
1544410	1553970	lasciatemi dire che io ho conosciuto bene gli altri partiti in tutti questi anni, fa
1553970	1559970	un po' meraviglia vedere, ci sono eterna in loro diritto, in loro diritto, in loro diritto
