start	end	text
8920	22000	I nostri ospiti, signore e signori, sono particolarmente lieto di poter inaugurare questa dodicesima
22000	32060	sessione dell'Italy-Japan Business Group. Questo foro rappresenta un punto privilegiato
32060	40280	di incontro non soltanto per approfondire le tematiche relative ai flussi commerciali
40280	49100	e agli investimenti tra i nostri due Paesi, ma anche e soprattutto per approfondire attraverso
49100	55960	lo scambio di esperienze reciproche, una più profonda conoscenza di due società amiche
55960	64180	e sotto molto versi complementari. Desidero, anzitutto, esprimere il positivo apprezzamento
64180	74560	del governo italiano al co-presidente giapponese, Dott. Yoshihara Fukuhara, di cui conosco bene
74560	83980	i sentimenti di amicizia che egli nutre verso l'Italia. Saluto altresì il viceministro
83980	91680	dell'Economia e dell'Industria, Dott. Nariaki Nakayama, che ha profuso tutto il suo impegno
91680	99380	per il rilancio di questa iniziativa. Ringrazio infine il co-presidente italiano, Dott. Umberto
99380	106400	Mignelli, cui va tutta la mia ammirazione per il costante sforzo che va di spiegando
106400	116220	quale presidente della fondazione Italia in Giappone 2001. La nostra positiva visione
116220	123740	del futuro dei rapporti tra Giappone e l'Italia è rafforzata dallo sviluppo parallelo delle
123740	132220	due culture e dei progressi dell'economia e della tecnologia. Mi piace qui ricordare
132220	140660	al canto al miracolo italiano degli anni 50 e 60 l'impulso che il Giappone seppe dare
140660	149380	durante quel periodo alla sua crescita economica, in perfetta concordanza con l'impegno assunto
149380	157040	nel 1960 dall'allora ministro del Comercio Internazionale dell'Industria, Hayato Ikeda,
158280	165140	con l'obiettivo di raddoppiare il reddito dei suoi concittadini. Fu così che alla vigilia
165140	176220	delle Olimpiadi di Tokyo del 1964, succedute a quelle di Roma del 1960, lo stesso Ikeda,
176220	183140	diventato nel frantempo Primo Ministro, potegli dichiarare con orgoglio che il reddito nazionale
183140	189900	giapponese si avvicinava ormai ai livelli di quello dell'Europa occidentale e che si
189900	195640	stava tentando di realizzare, a vent'anni dalla fine della guerra, ciò che non era
195640	202700	stato possibile conseguire negli 80 anni che avevano proceduto il secondo conflitto
202700	211260	mondiale. A partire da quegli anni e nonostante le note difficoltà, altri traguardi sono
211260	217880	stati raggiunti. Lo scorso mese di luglio il Giappone e l'Unione Europea hanno deciso
217880	224880	di conferire alle loro reciproche relazioni la stessa ampiezza e la stessa ricchezza di
225220	231300	contenuti da tempo esistenti nel rispettivo rapporto con gli Stati Uniti d'America.
232640	239460	L'Italia è stata l'antisegnana di un simile progetto. Io stesso, nella mia qualità di
239460	246920	Presidente di turno dell'Unione Europea, avevo inaugurato a Bangkok nel 1996 il primo
246920	255200	foro dell'ASEM. Ci sentiamo dunque pienamente coinvolti in un programma che si propone di
255200	262680	realizzare nel corso di un decennio un elevato livello di convergenza. In tutti i settori
262680	271140	nei quali individueremo l'opportunità e la necessità di un Idem sentire che tocchi
271140	277040	gli aspetti politici, economici e finanziari delle nostre relazioni, non dovremmo avere
277040	284920	esitazioni nel superare l'ambito angusto delle consultazioni sporadiche e delle concertazioni
284920	290720	episodiche per sviluppare invece un dialogo continuo e strutturato.
292340	298960	Come Unione Europea, e ancora prima come italiani, siamo consapevoli del ruolo fondamentale
298960	305940	del Giappone, seconda potenza economica del nostro pianeta, per il rafforzamento dell'equilibrio
305940	314440	multipolare e per la riforma delle istituzioni internazionali create per assicurare il mantenimento
314440	323660	della pace e della sicurezza a livello mondiale. Conosciamo i punti di forza della società
324520	330500	giapponese e abbiamo seguito da vicino gli sforzi profusi dal Giappone per superare le
330500	337500	recenti difficoltà della sua economia. Ma questi problemi, lo sappiamo, interessano
337500	344460	i sistemi sociali ed economici di molti altri Paesi e stimolano riflessioni sul corretto
344460	349760	funzionamento dei modelli di società nei quali siamo abituati a vivere, dal peso del
350040	355800	seguito pubblico, alla modernizzazione del sistema bancario, dal costante e progressivo
355800	363020	invecchiamento della popolazione, alla riforma dei sistemi di sicurezza sociale, dalla ristrutturazione
363020	369020	della pubblica amministrazione, alla necessità di ripensare il ruolo dello Stato nell'economia
369020	374080	e, più in generale, nel regolamento dei rapporti sociali.
374080	381160	Signore e signori, anche la società italiana si rinnova nelle sue strutture e nei suoi
381160	388020	costumi per inserirsi da protagonista nel processo di integrazione europea, da noi percepito
388020	394360	da sempre quale motore di sviluppo del benessere dei nostri popoli, quale fattore di pace e
394360	400240	di sicurezza a livello planetario. All'inizio di quest'anno l'Italia ha
400540	408360	avuto, succedendo al Giappone, la presidenza del G8. Noi intendiamo operare lungo una
408360	415840	linea di continuità con la presidenza precedente e affrontare le tematiche più cruciali che
415840	423820	abbiamo davanti a noi, e cioè dalla prevenzione dei conflitti all'allargamento degli spazi
423820	431380	di democrazia, dai problemi posti dalle migrazioni alle riduzioni delle disparità sociali, dalla
431380	435160	tutela della salute umana, alla protezione dell'ambiente.
435880	442420	Vogliamo condurre i nostri lavori tenendo presente la necessità che da Genova escano
442420	453180	conclusioni che prendano nel dovuto conto, attraverso le opportune consultazioni, gli
453180	456780	consigli o il numero possibile di attori sulla scena internazionale.
458280	463780	Proprio grazie all'azione del Giappone e maturata nel gruppo dei paesi più industrializzati,
465000	471620	la consapevolezza che la soluzione delle grandi sfide del nostro millennio, in un mondo diventato
471620	479300	multipolare, passa attraverso il convochimento attivo di tutti. Di questa esperienza sapremo
479300	487080	far tesoro durante la nostra Presidenza. Sono certo che questi miei propositi potranno
487080	493600	concretizzarsi se il Giappone e l'Italia, attraverso l'intelligente apporto delle rispettive
493600	501040	classi politiche e delle rispettive parti sociali, sapranno dar prova di costanza, e
501040	506920	ciò che più conta, di credere nella validità dei risultati da conseguire.
507760	514760	Da questo punto di vista, la dodicesima sessione del Forum può costituire un momento di riflessione
515720	518600	ricco di significato. Grazie.
536920	539980	Grazie al Presidente Fuquara, al Presidente Agnelli, alle industrie partecipanti.
