start	end	text
11220	17000	Presidente Costiga, l'intervento che ha tenuto due giorni fa nell'Aula di Palazzo
17000	23560	Madama fa ancora discutere, fa ancora discutere la sua proposta di una bicamerale sulla giustizia
23560	30640	ma fa discutere anche quello che ha detto e che evidentemente ha provocato con queste
30640	37480	parole già nella stessa Aula del Senato tra chi le sedeva attorno. Partiamo dalla bicamerale
37480	42600	sulla giustizia, che cosa è la bicamerale sulla giustizia, cosa vuole proporre lei Presidente
42600	51700	Costiga? Guardi io ho proposto che dato che il Governo trovandosi il Presidente del Consiglio
51700	58020	dei Ministri sottoschiaffo dei magistrati non ha la forza e la voglia di portare avanti
58020	65100	e non potrebbe un discorso sulla giustizia, tanto che ha dovuto rinunciare a far presentare
65100	75860	in Aula il progetto originario e nel tentativo lodevole di trovare una soluzione lieve nei
75860	82960	processi in corso per l'onorevole Berlusconi e per i suoi amici e sodali ha fatto presentare
82960	92680	quella cosa ridicola che è il disegno di legge a castelli. E tenga conto che come ho detto,
92960	99820	la gravità dello sciopero, cosiddetto sciopero, è la gravità delle inaudite dichiarazioni
100650	107350	di un uomo equilibrato come è che io ho sempre ammirato per il suo equilibrio, per la sua
107970	115990	prudenza, conoscendo la fede fermamente comunista ai suoi tempi, ma è nascosta persona di altezza
115990	123670	morale ben più ampia di quella di Borrelli, un po' per un torello, e cioè d'Ambrosio.
123670	133630	La lutta, l'aggressione era non per la legge, al disegno di legge a castelli, ma era un
133630	141010	avvertimento, non toccate le nostre prerogative che in questi anni, soprattutto grazie alla
141010	148230	democrazia cristiana che ha tentato di comprarci con i favori, perché comprissimo molte delle
148230	154370	brucherie, non tentate di toccarci nelle nostre prerogative di potere politico, perché noi
154370	161050	se reagiamo così per una stupidagine, reagiamo ancora di più fondamentalmente. Ora, non
161050	165490	si può continuare in questo modo, perché della riforma della giustizia c'è bisogno,
165650	172470	noi siamo il paese d'Europa dove la giustizia è peggio amministratta e ne fanno fede le
172470	179490	sentenze continue di condanna delle corte europee per denegata giustizia, per rincarcerimento
179490	185830	arbitrario, per lunghezza di processi e così via. Abbiamo bisogno di una riforma del codice
185830	191330	penale, ormai anche il codice di procedura penale. Allora, poiché il governo non può,
192070	198350	fino a che pende sul Presidente del Consiglio dei Ministri l'accusa di essere un corruttore
198350	202970	del giudice del proprio interesse, lui non può sostenere i tesi relativi alla giustizia.
202970	206850	Insomma si paga il conflitto di interessi in questo senso? Molto più che il conflitto
206850	212810	di interessi. Il conflitto di interessi è un fatto di un conflitto tra interessi economici,
213010	218150	questo è un crimine contro lo Stato per il corrotto dei magistrati. Io penso che lui
218150	224350	non lo abbia fatto e che sia oggetto anche di una attenzione esagerata da parte della
225010	230050	giustizia. Allora, noi togliamolo dall'agenda del governo, che intanto non lo può fare,
231790	237670	e immettiamolo in una commissione. Io ho fatto un nome come Presidente di una persona di
238270	243070	sinistra, un democratico, un grande giurista, un grande avvocato, un garantista, anche se
243790	249130	riscalco il Presidente della Commissione dell'autorizzazione a procedere, che con la sua relazione sul
249130	255010	caso dei due deputati di cui era stato chiesto un arresto è stato esemplare. Facciamo una
255010	260990	commissione bicamerale che affronti questi problemi e poi passi i suoi lavori alle commissioni
260990	266030	di giustizia della Cama del Senato e del governo. Presidente, permette una domanda su questo
266030	271750	punto, lei ha citato giustamente il caso del voto della Camera e lo stesso Rossini Scalchi
271750	277350	ci diceva in un'intervista, non abbiamo lavorato poco per limare, per ottenere questa unanimità,
277350	284770	ma è possibile che quel voto unanime dipendesse dal fatto che c'era di mezzo anche un esponente
284770	291890	DDS? E che esponente? L'ex segretario regionale in Basilicata? Certo, siccome se si fosse
291890	302350	trattato soltanto di sanza non avrebbe avuto la limità, come se si fosse trattato soltanto
302380	310740	dell'ex comunista non avrebbe avuto certamente ad esempio per dichiarazione fatta a mezzo
310740	317600	di loro i voti dell'ala anti dalemiana dei DDS. E quindi come fare a costruire questa
317600	324380	bicamerale? La bicamerale di persone sagge, ce ne sono tante dell'uno e dell'altro schieramento
324980	332360	e io vedo, oggi ci mettiamo una persona che a suo tempo Berlusconi scelse come Presidente
332360	339360	della bicamerale, cioè da Lema, ma è un personaggio politico che dimostrò grande prudenza
340120	345880	e grande capacità nel dirige della bicamerale oppure scegliamo uno, diciamo, meno politico
345880	352300	di spicco ma certamente molto più tecnico, grande avvocato e grande professore di diritto
352300	358640	penale con le 6 scarche insomma. Presidente, intanto sappiamo che lei a proposito di giustizia
358640	365220	di magistratura di magistrati ha preso un'iniziativa nei confronti del magistrato Mancuso? Il magistrato
365220	371560	libero Mancuso sul quale non posso esprimere giudizi, in realtà questa è mia iniziativa,
371760	380460	ho fatto esaminare ai miei legali le cose che lui ha detto nei miei confronti e passiamo
380460	387180	le vie giudiziarie e io lo denuncerò anche al ministro della giustizia in serie disciplinare,
389180	394960	e devo dire che io sono stato soddisfatto anche dell'atteggiamento della stampa, la
394960	402420	stampa una parte mi ha criticato, una parte poca mi ha allodato, ma tutti hanno ammesso
402420	408760	la mia buona fede, vi è stato un grave episodio di censura, cioè nulla ha pubblicato nel
409800	418620	mattino né il messaggero. Allo stesso editor? Esatto, e conoscendo i due direttori mi sono
418640	425140	piaciuto, di cui specialmente il nuovo direttore del Gambesci, il nuovo direttore del messaggero
425140	430920	e un comunista, è stato un comunista militante, un sostenitore fermissimo della libertà
430920	437940	di stampa, che quindi anche libertà di informazione, la censura non si deve, non dovesse dovuto
437940	448200	a lui, ma l'atteggiamento è probabilmente ispirato anche dal futuro genero della proprietà,
449200	457240	che sta assumendo questo atteggiamento super partes, futuro socia, facciamo gli auguri
457240	464600	fin di qua ai futuri sposi, però devo dire che non è nuovo il messaggero, gli atteggiamenti
464600	475280	del genere, ricordiamo la censura, quell'episodio scuro di quella gentildonna che fu rapita,
475280	483520	portata in macchina per tutta Italia, poi liberata dal presunto sequestratore Filippino,
483840	491100	Filippino che poi è entrato in Slovenia, fu ucciso da un reparto, del reparto speciale
491100	498680	della polizia slovena, anche in quel caso la censura del giornale. E si è un caso brutto
498680	505540	per la famiglia del giornale fra l'altro. Mi chiedo, come si chiama il vino lunghi,
505700	517760	come si chiama il serventi lunghi, che sempre è pronta a denunciare le censure, mi aspetto
517760	524660	che denunzi questo episodio grave di censura politica. Insomma è possibile che, vista
524660	530660	l'attenzione che il messaggero dà ai riflessi anche, oltre che di casino, di Ciampi immaginiamo
531240	539240	che ci fosse anche una... Di Ciampi soltanto... Ciampi poi ha espresso il compiacimento, non
539240	547260	a me. Certo, certo, certo. Non a me, non a me. Non a me che abbia detto, esprimiamo
547260	553460	il compiacimento perché il seratore Corsiga rimane al Senato. No, ha espresso il compiacimento
554660	561840	del Senato, insomma. Però io di Ciampi non parto perché io sono un, come si dice, un
561840	569500	sede vacantista, insomma. Presidente Corsiga, dunque, diciamo, nel complesso però la stampa
569500	574640	ha dato un buon resoconto. Absolutamente. Ci che criticano, neanche violentemente, ma
574640	580220	nessuno ha alterato il mio pensiero. Molti hanno così, e si capisce, è un fatto che
581220	592260	la libertà di stampa implica la pubblicazione dei fatti, non la omogeneità dei... La ricostruzione.
592420	598680	No, non la omogeneità dei giudizi, altrimenti non ci sarebbe pluralismo solo. Quindi si
598680	606780	può dire che affermare che Cesare, bisogna dire che Cesare è stato ucciso da brutto.
606780	615480	Se uno dice che Cesare è stato ucciso da Antonio è contro la libertà di formazione.
616720	624260	Però poi uno può dire bene ha fatto brutto Cesare, oppure può dire male ha fatto brutto
624780	631340	a uccidere Cesare. Allora, nel secondo caso è libera manifestazione del giudizio e serve
631340	637320	per il pluralismo dell'opinione. Nel primo caso dire Cesare è ucciso brutto, o il frutto
637320	643520	di ignoranza è una manipolazione dei fatti, insomma. Presidente Cossiga, ci abbiamo una
643520	650860	conclusione, però partiamo proprio dall'ultima sua risposta, cioè partiamo da Biers Ferdinando
650860	657360	Casini, perché in queste ore, come lei sa, davanti a Montecitorio c'è un presidio fisso
657360	663780	dei radicali che stanno in sciopero della seta staffetta e che stanno parlando ininterrottamente
664360	670720	ormai da più di 24 ore. E su questo punto è ovviamente la vicenda riguarda proprio
670720	678140	la Camera, riguarda la mancanza di Parlamento? No, riguarda il Parlamento perché siccome
678140	686200	nel nostro sistema costituzionale specie riguarda la Camera rigide il principio della legalità
686200	692900	e della completezza dell'organo e quindi bisogna interpretare le leggi in modo tale
692900	700140	che se la Costituzione dice che i deputati sono 630, bisogna integrarli fino a raggiungere
700760	708340	630. Però Pier Ferdinando Casini, che sta ponendo con grande intelligenza la sua candidatura
708340	713200	alla successione di Berlusconi o alla Presidenza della Repubblica, cui è la spia, o alla Presidenza
713200	719980	del Consiglio nel caso di un incidente giudiziario che capita a Berlusconi e lascia libero il
719980	726000	posto, in questo sostenuto ovviamente dal suo futuro suocero e dei giornali, e non solo
726000	734940	dei giornali del suo futuro suocero, non ha interesse a far decidere un'aggiunta del
734940	741740	regolamento delle elezioni che probabilmente aumenterebbe il numero di quelle di Forza Italia
741740	749300	senza nessun'utilità al suo piccolo partito e scontentandola a sinistra. Quindi lei dice
749300	755120	che Casini non vuole... Il vero ostacolo è Casini, questo me lo dissero anche i membri,
755260	762400	che impedisce ogni volta l'aggiunta delle elezioni di decidere comunque in un senso o
762400	768360	nell'altro e notoriamente il Presidente della Cana per Pier Ferdinando Casini. Speriamo che
768360	775400	prima o poi questa vicenda volga al termine, perché altrimenti c'è uno sciopero della
775400	780000	sede in corso a Stafetta e Marco Pannella... Questo è una cosa che mi dispiace, però voi
780000	784980	che siete su questa linea, lo sono anch'io ma essendo Presidente dell'Altra Zona del
784980	795940	Parlamento mi tengo un po' distante, voi avete un avversario intelligente, onesto, forte,
795940	803440	che non ha interessi propri se non di carattere politico, educato alla scuola a Dorotea di
803440	814060	Forlani e di Todbisaglia, Pier Ferdinando Casini, è un avversario forte, insomma.
814380	825920	Certo. Presidente, noi la ringraziamo davvero tanto per...
825920	830000	Che mi sembra che sia partito nella gara l'associazione...
830000	830800	E non è presto.
830980	835060	Ecco sì, io credo, glielo ho mandato anche a dire, mi ha avviso un po' troppo presto,
835260	839980	ma può darsi che qui voglia affrettare i tempi il suo futuro sforzerò.
