start	end	text
0	14580	l'aereo, ho restituito il passaporto diplomatico e il serato mi ha fatto sapere che non avrò
14580	18960	più un seggio ma mi devo portare una piccola segna da casa.
26560	35860	Mi puoi chiamare professore che la cosa come sa Gianni de Michelis che ha tutti e due
35860	42880	costata di più perché diventare deputato, serattore, ministro, presidente repubblica
42880	49440	che è stata la sciocchezza. Poi facendo o rompendo questi tambù della Costituzione
49440	54820	mi puoi chiamare Francesco come mi chiami nella vita normale ma per carità io non voglio
54820	61560	andare contro le grida del presidente Prodi e aspettiamo quando arriveranno quelle del
61690	75230	Presidente, quelle del Presidente Veltroni quando scritte in caratteri gottici. Allora
75230	86350	se in questi giorni sei l'unico sardo che non ottiene sconti quindi senti, io ti chiamo
86350	92030	Presidente, va bene, andrò in conto ai rigori della legge, non c'è problema. Facciamo una
92030	98690	cosa, chiamami Presidente con la P minuscola. Senti Presidente con la P minuscola e non
98690	103770	so se hai, penso di sì, hai avuto modo di vedere il filmato, il bel documento che ci
103770	110370	ha preceduti. Quello che dicevo introducendo adesso questo incontro è che nessuno di noi
110370	115990	probabilmente ha le fisiche du rôle per fare il postulatore di una causa di beatificazione
115990	122050	e dicevo che nella vita di Marisa Bellisario così precocemente conclusa c'è stato anche
122050	128930	conflitto, ci sono state tenacia e battaglie vinte o perse. Il ricordo di Francesco Cossiga.
130390	142450	Io ho conosciuto la Marisa Bellisario attraverso quelle che viene considerati da alcuni miei
143990	155010	hobby, da altre una mia fissazione, come la vuoi chiamare, e cioè la tecnologia. In
155010	161090	un suo bel libro lei ricorda che mi portò una volta, quando ero ancora Presidente del
161090	169690	Senato, un telefono. Io ci l'ho già. Come ci l'ho già? Se l'abbiamo prodotto soltanto
169690	176670	adesso non c'è altro nulla. Io ce l'ho già, me l'hanno dato i tuoi prima che me lo portassi
176670	184370	tu. Un'altra volta, lo ricorda sempre lei del libro, mi portò uno dei primi telefonini
184370	194070	dell'Italtelle, che forse con lei si sarebbe salvata, ma non ci sarebbe stata lei perché
194070	200430	sarebbe stata socialista e quindi sarebbe stata colpita come tanti altri dalla damnazio
200430	211370	memoria. Certamente. Io non sono socialista, sono liberale, però devo dire che quello che
212530	221730	al Partito Socialista è stata proprio la damnazio memoria. Forse se Bettino avesse fatto dei
221730	232170	Gulag in Italia forse si sarebbe salvato, come se avesse applaudito con articoli encomiastici
232170	239990	all'invasione sovietica dell'Ungheria e alla repressione della ribellione ungherese,
241270	246810	chiamandola una grande vittoria del socialismo e della libertà, oggi sarebbe presidente
246810	255510	della Repubblica. Allora lei si mise a ridere e racconta del libro, che è un bellissimo
255510	265030	molto semplice, molto umano e molto modesto, non credo che nessuno riesca ad essere modesto
265030	273330	come è stata lei oggi, che mi portò un telefonino e io due o tre giorni dopo lo rimandai con
273330	284330	un elenco di 11 difetti che lei passò all'azienda e ricorre a essere difetti. E un giorno arrivò,
284330	290190	io ero presidente del Senato, accompagnata da un buffo personaggio che era vestito da
291450	300270	Coldboy, aveva una di quelle reticelle rosse con cui un tempo si faceva, le signore facevano
301110	309950	la spesa e questo buffo personaggio era Steve Jobs, l'inventore della Apple, di Macintosh,
310870	317810	che mi regalò un computer ed è il primo computer che io avevo. Adesso in casa credo di averle
317810	325550	sette, otto, perché è una delle cose che più... poi l'amico Mentana che altre volte
325550	332810	è venuto a casa sa che c'è il grande pericolo di prendersi il cadro cerebrale per le onde
332810	340570	elettromagnetiche, ecco. Una delle cose che vedo che non si ricorda, ma c'è qui l'amico
340570	350210	carissimo Giorgio de Michalis, l'amico Gianni de Michalis, l'uomo a cui io riuscì a far
350890	359710	tagliare e a far lavare i capelli, quando ero presidente della Repubblica, ponendo questo
359710	364570	come condizione per la contrafirma del suo decreto. La parità uomo-donna no, ma il pareggiamento
364570	372070	dei capelli di Gianni? No, un momento, c'è qui Gianni, può chiedere se è vero o no,
372470	378550	che sotto il mio indicazione, la mattina, la sera poi venne a giurare, a no, si tagliò
378550	387730	i capelli e sei in labore. Perché io gli dicevo, senti Gianni, vai a tagliarti dagli inizi,
387730	393610	mi sono stati sottoposti dal presidente del Consiglio dei Ministri, Giulio Andriot, i due
393610	399830	nomi che gli aveva fatto Bettino, e mi hanno detto sceglielo tu e io, forse per motivi
399830	407470	accademici avevamo scelto lui, no? E gli ho detto, non gli ho detto dell'hotel dove abitava
407470	413630	attraverso il famosissimo portiere Esposito, guarda che sarà, Esposito, guarda che sarà
413630	420490	dominato il ministro del Signore, ho detto, senti Gianni, va subito a tagliarti i capelli
420490	430930	e ai lavarti, perché se no questo pomeriggio tu non vieni. Allora, noi tutti insieme, Gianni,
431130	439770	l'idea è stata a dir il vero di Gianni, Gianni, io, la nostra cara amica che non c'è più,
440610	448250	Sergio Benninguer, reviglio della Vederia, aggiungo della Vederia perché quando io lo
448250	454950	dominai ministro lui nascose di chiamarsi della Vederia e dovremmo stracciare il decreto
454950	460030	e riscriverlo perché lo vengono proprio al reviglio della Vederia insomma. Siamo quelli
460030	469610	che abbiamo costituito in Italia l'Haspen Institute, esisteva una sezione britannica
469610	477850	inglese dell'Haspen, poi esisteva l'Haspen Berlin e noi abbiamo fatto l'Haspen Institute
478390	486830	che diciamo era l'alla democratica e di sinistra della trilaterale insomma, e lei è stata una
486830	492070	dei membri del comitato esecutivo, io sono stato il primo presidente e poi gli altri
492070	496890	sono stati tutti i presidenti, lo sarebbe diventato anche lei se non avesse avuto questa
496890	501590	sorte triste. Lei aveva due caratteristiche, era una donna
501590	510730	trecardista, intelligentissima, che aveva il cipiglio di manager che niente toglieva la
510730	518650	sua femminilità ed era una donna di una semplicità assoluta che tutto ha dato al
518650	522690	suo impegno professionale senza niente togliere la sua famiglia.
524630	533190	Beh non è poco effettivamente, è semplice da raccontare ma quella semplicità, quell'andare
533190	539010	dritto al sodo dei problemi è forse una caratteristica che è molto poco italiana, non delle donne
539010	545870	italiane, molto poco italiana in assoluto. Assolutamente non c'entriamo nulla noi con
545870	552430	questa semplicità, probabilmente era nata in un altro pianeta non lo so insomma.
552550	557850	Oppure anche la formazione new yorkese in un passaggio così importante l'aveva aiutata
557850	564430	a saltare alcuni passaggi. Sì però era una che non faceva finta di
564430	570690	aver dimenticato la produzione dell'italiano e che questa formazione new yorkese non te
570690	577930	la sbatteva in faccia come sono soliti fare quelli che passano 15 giorni a new york al
577930	581770	bergo di lusso, ma lui era profondamente italiano.
581950	585490	Senti, visto che non sei più presidente per poco.
585630	586890	No, con la P minuscola.
586890	591750	Sei presidente con la P minuscola, faccio un atto di insubordinazione e ti tolgo provvisoriamente
591750	596310	una parola perché per dartela l'avevo tolta a margherita boniver e non è stato elegante
596310	597210	da parte mia.
597690	606410	Un momento, un momento, margherita boniver, io ho nei suoi confronti un debito e un credito,
606770	614230	un debito perché ho corso di farla ammazzare, perché siccome lo stato maggiore della difesa
614230	621730	non volle che andassi io a portare i vivi a Dubrovnik, la gente non lo sa ma lei a Dubrovnik
621750	628410	è una eroina, gli dice che ci deve andare tu e ha corso la pella, ha corso il pericolo,
628510	634970	ha la vita, però allora gli ho concesso la medaglia d'argento ed è l'unica donna che
634970	637850	in tempo di pace ha avuto la medaglia d'argento.
645390	650970	Allora corroborato da questo tuo ricordo chiedo la medaglia d'argento, margherita boniver,
651790	662770	appunto trent'anni fa mi ricordo l'avvicinamento alla politica e poi ai ruoli nello stato,
662790	669470	nel governo, forse un attimo, un momento, voglio aggiungere una cosa, è quello che
669470	678710	temevo, ecco che margherita boniver è anche un'eccellente cuoca, ecco di questo, di questo
678710	684370	è da parecchio che non mi invita più a cena, ma quando ci andavo era un'ottima cuoca.
685230	691130	Presidente grazie ma sono di giuno, io sono di giuno, questo discorso mi coglie impreparato
691130	701990	e con un vuoto, proviamo a vedere se riesci a rispondere, è quel tipo di percorso che
701990	707490	tu hai fatto, un percorso che avrebbe potuto fare anche la bellisario, adesso che c'è
707490	715410	un intreccio molto maggiore tra le diverse esperienze. No credo che marisa bellisario
715410	722430	abbia scelto immediatamente con grande carezza un percorso che non l'ha portata fuori dalla
722430	734950	politica ma che non l'ha neppure impegnata o avvicinata più di tanto, credo che la sua
734950	734950	
