start	end	text
7980	12340	presentiamo il testo del messaggio ha trasmesso all'inizio della settimana dal primo ministro
12340	17460	italiano Shamir al presidente Bush in risposta alla lettera del presidente spedita ai vari
17460	23240	leader medio orientali la reazione americana al messaggio di Shamir verrà resa nota nell'incontro
23240	27540	previsto domani a Washington tra il segretario di stato Baker e il ministro degli esseri
29280	35460	scrive il primo ministro Shamir sono completamente d'accordo con lei per quanto riguarda l'importanza
35460	41040	storica del salvataggio dell'ebraismo etiope in effetti si tratta di un ennesimo passo verso
41040	46040	la realizzazione del sogno sionista inoltre si tratta di un'altra prova di ciò che possiamo
46040	52560	ottenere quando lavoriamo assieme per raggiungere uno scopo degno lei signor presidente ha personalmente
52560	58020	svolto un grande ruolo in tale vittoria e la nostra gratitudine per il suo aiuto è incisa
58020	63640	nei nostri cuori noi desideriamo che i presenti sforzi americani per giungere alla pace siano
63640	69240	coronati da successo poiché non c'è cosa cui noi agogniamo più che una pace veritiera coi
69240	75820	nostri vicini la pace aprirà delle nuove opportunità immense per noi e per i nostri vicini e ci
75820	80700	permetterà di affrontare in un'atmosfera più serena la gigantesca operazione di assorbimento
80700	86760	nel nostro paese dei nuovi migranti giunti dall'etiopia e dalla russia mi riferirò
86760	91840	ai punti sollevati nella sua lettera concernenti il processo di pace con la sincerità e la
91840	97820	franchezza che merita il rapporto particolare tra di noi la nostra posizione che si basa
97820	103300	su una lunga esperienza è che il negoziato diretto con tutti i paesi arabi separatamente
103860	109560	non è solo un fatto tecnico procedurale si tratta di un esame delle intenzioni degli
109560	114560	paesi arabi che per ora non sono cambiate riguarda l'accettazione di israele e la
114560	121760	riappacificazione con essa nella logica specifica che caratterizza questa parte di mondo i nostri
121760	127260	vicini insegono ancora un processo che gli permetta in conclusione di affermare che non
127260	132720	riconoscono il diritto di israele ad esistere come un'entità legittima nella zona questo
132720	137120	è il motivo per cui esigono una partecipazione internazionale più ampia più simile negli
137840	142880	e la partecipazione dell'onu questo è anche il motivo per cui vogliono definire lo scopo
142880	148900	del processo di pace in termini di accordo globale e non in termini di trattato di pace
148900	156080	con israele queste sono le ragioni della nostra posizione costante negli anni secondo la quale
156080	161080	qualsiasi governo arabo interessato ad essere coinvolto nel processo di pace deve impegnarsi
161080	166800	a discutere direttamente con israele quindi una conferenza internazionale danneggerebbe
166800	173340	i negoziati diretti e diminuirebbe le loro probabilità di successo qualsiasi tipo di
173340	179480	riconvocazione o rinnovato riferimento alla conferenza creerà gli stessi risultati negativi
179480	185780	e allontanerà il centro dello sforzo dai dialoghi diretti sappiamo per certo che questa
185780	191000	è la ragione che spinge gli arabi ad esigere la riconvocazione della conferenza e la partecipazione
191000	197140	dell'onno nell'ambito della nostra proposta di pace e negli scambi di opinione col segretario
197140	203340	baker abbiamo cercato di prendere in considerazione le sensibilità degli arabi ci siamo detti
203340	209840	d'accordo ad una sponsorizzazione comune per cominciare negoziati diretti solo per soddisfare
209840	215480	la richiesta araba di ciò che definiscono aperte virgolette legittimità internazionale
216600	223280	ci siamo detti d'accordo ad una sponsorizzazione comune e ad un ruolo per l'onno sebbene temessimo
223280	227980	che venendo ad un'intesa su questo punto avremmo aperto la strada a ciò che diventerà
227980	233820	una conferenza internazionale con la partecipazione dell'onno siamo impazienti di iniziare dei
233820	239080	colloqui di pace con i nostri vicini arabi sebbene continuino ad armarsi ininterrottamente
239080	246180	e non nascondano il fatto che tali armi saranno rivolte contro di noi siamo pienamente d'accordo
246180	251900	con lei sul bisogno di aiutare Reu Sein a incoraggiarlo ad inserirsi nel processo di
251900	256800	pace io continuo ad essere convinto che la Giordania è l'interlocutore più logico
256800	261960	e ragionevole per dei negoziati di pace con noi qualsiasi aiuto che possa essere utile
261960	269060	in questa direzione verrà accettato con slancio è stato definito che i rappresentanti arabi
269080	275540	palestinesi saranno della regione che accetteranno il negoziato su due binari paralleli il concetto
275540	282100	di avvicinamento graduale e che si impegneranno a vivere in pace con israele ma tali condizioni
282100	287540	da sole non garantiscono la necessità di nominare dei rappresentanti che siano credibili
287540	292960	e non siano in alcun modo legati all'olpe ciò è indispensabile poiché non ci può
292960	298920	essere un processo verso la pace con israele se l'olpe è coinvolto siamo convinti che
298920	304020	la maniera migliore di affrontare il problema della rappresentanza degli arabi palestinesi
304020	308620	sia nell'ambito di una delegazione congiunta giordano palestinese che discuta con noi
308620	315200	la soluzione del problema degli arabi palestinesi inoltre la parte palestinese nella delegazione
315200	328900	giordano palestinese deve essere per noi accettabile conformamente alle sue caratteristiche l'olpe
329780	335340	nella settimana scorsa per esempio sono stati assassinati sette uomini e lei si può immaginare
335340	341920	cosa ciò significa per coloro che considerano la possibilità di partecipare negoziati non
341920	347080	possiamo ignorare la posizione e l'opinione degli stati arabi compresi quelli più lontani
347080	353140	da noi la posizione degli stati del golfo in particolare dell'arabia saudita è ai nostri
353200	359000	occhi deludente la siria ha trasformato il libano in un protettorato e il mondo guarda
359000	364860	in silenzio tale sviluppo aumenta il rischio di problemi lungo il nostro confine settentrionale
364860	370000	anche l'egitto ha contribuito alla nostra sensazione di delusione il presidente Mubarak
370000	376560	ha adottato il metodo di attaccare ogni secondo giorno sia israele che me personalmente sembra
376560	381600	che sostenga le posizioni estremistiche siriane invece di adoperare la sua influenza per
381600	387660	raggiungere alla moderazione e ad un dialogo di pace con israele non ha fatto nessun passo
387660	392880	per migliorare o normalizzare i rapporti con israele e si rifiuta di dialogare con noi
392880	399420	a livello ministeriale elevato so bene signor presidente che parte delle opinioni che ho
399420	403900	espresso in questa lettera rischiano di non rappresentare in pieno le risposte che avrebbe
404700	409120	desiderato noi facciamo del nostro meglio per garantire il successo degli sforzi suoi
409120	414700	del segretario baker ma l'incontro di apertura del negoziato di pace deve essere elaborato
414700	421740	preparato e concordato prima che vengano emessi gli inviti voglio ricordare che noi abbiamo
421740	426360	inteso che l'unione sovietica intratterrà rapporti diplomatici completi con israele
426360	431960	prima dell'inizio del processo in conclusione signor presidente abbiamo davanti ancora del
431960	439000	lavoro significativo e complicato sono lontano dal sentirmi disperato vero dei segni incoraggianti
439120	444400	sulla base dei quali possiamo costruire il processo il raggiungimento dello scopo comune
444400	450680	impone un'estrema pazienza e una salda costanza noi continuiamo a sentirci impegnati nel tentativo
450680	456020	di conseguire lo scopo e seguiteremo a collaborare con lei fino a che i nostri sforzi saranno
456020	462020	coronati da successo avvicinandosi tra pochi giorni il suo sessantesimo compleanno sulla
462020	467100	amizia giunge a me nell'augurare a lei e a sua moglie lunghi anni di buona salute e felicità
467100	473720	alla guida degli stati uniti con il rispetto il haksha mir questo dunque il testo del messaggio
473720	478840	del premier israeliano che conferma i punti di contrasto con washington primo riconvocazione
478840	485260	della conferenza secondo ruolo e partecipazione dell'onu e terzo veto di israele alla scelta
485260	490180	dei rappresentanti palestinesi da giurisalemme manuel canza
492680	503000	2 persone girano per il paese a dire di non votare di andare al mare certo nei posti in
503000	508780	cui non è inquinato non c'è la mucillagine non ci sono le alghe è un invito piacevole
508780	516260	ma non si capisce in che cosa contratti il tempo di 3 4 10 minuti del voto con l'andare
516420	525540	ma bene ma comunque dicono questi figuri che rispondono al nome del senatore bossi e di
525540	536100	bettino craxi dicono di non votare e curiosamente quello che dice di non votare alla referendum
536960	544800	cioè non il segretario del partito socialista è proprio quello che minaccia fuoco e fiamme
544800	553320	se non gli si concederà un referendum sul tipo di repubblica sul tipo di seconda o terza o
553320	562300	quarta repubblica per l'italia ma come c'è un referendum che può decidere una cosa limitata
562300	572100	parziale ma su cui i cittadini possono decidere invece si dice no perché costa troppo come se
572100	579660	il referendum di orientamento dei cittadini che dovrebbero dire se vogliono la repubblica
579660	587060	presidenziale o il cancellierato tedesco o la repubblica delle banane o quella sudamericana
587060	594880	quel referendum come se quel referendum fosse gratuito non costarse ma in compenso quello
594880	602080	comunque non fa decidere i cittadini ora sorge il sospetto che forse proprio questo che non
602080	611580	si vuol far decidere i cittadini e questo noi verdi ambientalisti l'abbiamo pagato a caro prezzo
611580	620560	l'anno scorso quando già c'erano referendum come quello sulla caccia sui pesticidi che avrebbero
620560	628680	finalmente fatto decidere e risolvere una questione che è da anni sul tappeto quella
628680	640200	caccia si è scatenato l'ira di dio per il paese dai fabbricanti di armi di brescia fino a
640200	648400	tutte le organizzazioni corporative a dire di non votare perché il referendum era inutile non
648400	656600	serviva costava anche quello ma quando un referendum indetto comunque costa comunque il
656800	665440	costo per gli escrutatori sia che ci siano gli elettori o no comunque c'è e bene l'anno scorso
665440	673300	si è detto di no perché tanto si sarebbe fatta la legge sulla caccia non c'era bisogno perché
673300	680620	il quesito non avrebbe risolto completamente i problemi e quindi tanto valeva far fare al
681220	689820	e ve lo sapete è passato un anno un anno un anno lungo la legge sulla caccia non c'è ancora se
691180	699080	se invece di arrivare al filo di lana del quo ziente del 50 per cento fossimo arrivate al
699080	706700	51 per cento di partecipazione l'anno scorso il problema della caccia sarebbe stato risolto e
706700	714780	il problema dell'agricoltura avvelenata e invece siamo così condizionati culturalmente
716140	723940	dalla televisione dalla rai lottizzata che disinforma invece che informare da questa
723940	732400	società dell'informazione in cui in realtà sappiamo molto meno di quanto si sapeva 20
732400	739860	50 anni fa sicuramente in questa società dell'informazione su certe cose che
739860	747020	riguardano la vita si sa meno si sa meno sulla natura sulle piante sugli animali di
747020	753340	quanto se ne sapeva prima che ci fosse l'impombardamento dell'informazione ebbene
753340	761100	insomma quello che noi oggi sappiamo è questo che l'anno scorso il referendum c'erano si sono
761100	768620	seguiti quei consigli non si sono fatti referendum i soldi per il referendum ovviamente si sono
768620	776560	spesi il problema della caccia dell'agricoltura avvelenata c'è ancora oggi si dice di non andare
776560	784480	a votare perché un referendum inutile perché tanto bisogna fare la grande riforma in realtà
784480	792320	probabilmente poi non se ne farà niente oppure si farà la riforma che deve andare a vantaggio
792320	799740	dei partiti responsabili del disastro di questa repubblica perché veramente un grande successo
799740	807160	per pirandello in questo momento in italia da una parte c'è il paradosso che un presidente
807160	813820	della repubblica che è stato al centro del potere del maggior partito della democrazia
814980	826300	avendo le maggiori cariche ufficiali e ufficiose da quelle del governo del ministero dell'interno
826300	834960	a tutte le altre responsabilità avute che oggi si tira fuori e dice io non centro con questa
834960	843120	massa di banditi e comincia a proclamare la seconda repubblica e poi abbiamo gli stessi
843120	852160	partiti che vorrebbero fare in modo da essere loro a governare e a candidarsi alla rifondazione
852160	858940	della nuova repubblica dopo che non sono stati capaci di governare bene la prima e anzi hanno
858940	867200	solo pensato ai propri affari ma ancora paradossi qui in sigilia per cui io mi sento continuamente
867360	877020	dire da giornalisti che qui il risultato è scontato che qui vinceranno la democrazia
877020	884260	cristiana e il partito socialista le elezioni cioè i partiti che hanno governato fino ad oggi ma
884260	897340	allora io mi domando ma perché allora ci si deve lamentare perché la gente tutto sommato non è
897940	906700	che vinceranno i responsabili del mogugno ecco questo è un paradosso che se fosse rotto non
906700	914240	sarebbe male anche perché e torniamo al senatore bossi senatore bossi ha presentato una lista
914240	922180	anche qui in sigilia ma lui sa che non piglierà voti ma non se ne preoccupa anzi pare ben contento
922180	936700	perché perché lui sta pensando a dividere l'italia a dividere la repubblica sta pensando che i doveri
936700	948880	di solidarietà verso le regioni più povere che hanno bisogno di solidarietà che hanno bisogno
948880	958400	di non essere sfruttate come colonie ma di avere delle possibilità di progresso in tutti i sensi
958980	970420	bene invece senatore bossi vol fare la repubblica lombarda o del nord e quindi lui pensa che il
970420	978340	risultato negativo per la sua lega in sigilia gli farà aumentare i voti al nord perché perché
978340	986460	potrà dire che i siciliani sono da considerare irrimediabilmente persi ed è meglio perderli
987360	993260	tante vero che avendo la possibilità di votare la sua lega non l'hanno votata hanno votato i
993260	1003500	partiti romani della partitocrazia e quindi lui sarà ben felice di pigliare pochi voti qua perché
1003570	1010750	sa che così ne piglierà di più e allora io dico che di fronte a questi disegni ci sono delle
1010750	1018250	buone possibilità ci sono soprattutto le possibilità di votare per i verdi di votare
1018250	1033550	domenica per il sì e di votare la domenica dopo il 16 per i verdi perché i verdi sono in questa
1034670	1043070	io non dico un'alternativa perché poi non so bene in questa regione che è stato il regno
1043070	1052510	anche degli esperimenti di milazzo che cosa voglia dire oggi l'alternativa testa sinistra
1052510	1068190	noi verdi rappresentiamo il superamento delle divisioni ideologiche di un tempo
1068770	1082450	perché sono caduti molti muri non cadono certi muri della cementificazione selvaggia ma poi
1082450	1095890	centro europa cadono le barriere ideologiche e poi devo dire che è difficile dire se c'è una
1095890	1105130	differenza tra destra e sinistra per esempio in sicilia nel momento in cui il modello dello
1107120	1116280	industriale è stato sostenuto indifferentemente un po da tutti e quindi noi diciamo noi verdi che
1116280	1126680	c'è bisogno in sicilia l'assemblea regionale di ristabilire regole nuove di ristabilire certezza
1126680	1137120	del diritto della democrazia soprattutto di restabilire un rapporto fra i cittadini e i
1137120	1140000	politici e la classe politica e il governo che
