start	end	text
0	8720	con il
8720	10120	Francesco Cosiglia, l'ex
10120	11320	presidente della Repubblica,
11460	13500	stamane a Monte Citorio per
13500	15820	commentare la formazione del
15820	17860	nuovo governo e per esprimere un
17860	20540	giudizio sul messaggio inviato
20540	22400	dal capo dello stato Berlusconi
22400	23580	e sulla risposta allo stesso
23580	25740	presidente del Consiglio al
25740	33280	Presidente della Repubblica. Con i giornalisti sentiamo dunque Cossigga che comincia leggendo
33280	38020	una dichiarazione che parte proprio dalla questione delle lettere.
39960	48700	Presidente della Repubblica, nella formazione del Governo con la sua lettera trattino direttiva
48700	56900	l'onorevole Berlusconi, incaricato della formazione del nuovo esecutivo, è corretta e legittima.
58360	68940	Così come corretti e legittimi sarebbero stati, se mai effettuati, altri suoi eventuali non pubblici
68940	78680	interventi a monumenti messe in guardia nell'iter di formazione del Governo. Naturalmente,
78700	86180	occorre inquadrare tutto questo, come altri interventi e altre esternazioni del Presidente
86180	94720	Scalfaro, virgola, non nello schema di un regime parlamentare che si è da tempo
94720	102240	dissolto, prima nel regime assembliare e associativo e ha lasciato ora il posto ad
102240	110240	un regime provvisorio e di transizione. Si può parlare da un punto di vista strettamente
110240	120360	istituzionale di continuità nei governi Amato, Ciampi, Berlusconi. Anche il Governo Berlusconi
121020	131840	è un governo di transizione. Il governo Amato è stato il governo che ha iniziato il passaggio
132480	139760	dalla prima alla seconda Repubblica o, se Veltroni preferisce, dalla prima fase alla seconda fase
139760	148640	della Repubblica. Il governo Ciampi ha cercato di essere, ma non è stato, per sue insufficienze
148640	155660	programmatiche istituzionali il governo del traghettamento dalla prima alla seconda fase,
155660	163340	il governo Berlusconi non è più il governo della prima Repubblica ma non è neanche il primo governo
163340	172940	della seconda Repubblica perché manca il rinnovato quadro istituzionale. Ripeto, un regime provvisore
172940	181420	di transizione con forti caratteri presidenzialistici o semi presidenzialistici. Sono lieto di averne
181570	191850	ultimi anni del mio setennato, anche se l'ho pagato con di persona, contribuito a questa
191850	200770	evoluzione più in vero prendendo atto dei mutamenti della costituzione materiale che non provocandoli
200770	211610	ma al massimo seguendoli ed assecondandole. In questa fase in cui più che le norme scritte,
211850	220430	ormai ampiamente dissuette, valgono le convenzioni costituzionali e gli atti di ruttura dell'ordinamento
220430	230690	formale, certo la declamata centralità del Parlamento specie ora che esso è stato
230690	237990	eletto con il sistema maggioritario e non si è ancora raggiunta la piena reciproca
237990	246970	legitimazione della maggioranza e dell'opposizione è venuta meno e la funzione istituzionale
246970	254470	e il ruolo della rappresentanza nazionale deve anche per motivi di garanzia coniugarsi
254470	262710	con un ruolo attivo e con funzioni più incisive del capo dello Stato. Il suo comportamento
262710	270950	ha la mia provazione, il mio consenso come cittadino e come parlamentare e la sua persona
270950	278190	ha la mia stima, la mia amicizia e la mia solidarietà. Ringrazio il senatore Cesare
278190	284790	Salvi, presidente del gruppo dei senatori del Partito Democratico della Sinistra per
284790	296170	i giudizi ieri espressi sul caso e che suonano come mai tardiva, ma anzi si può ben dire
296170	304090	gradita correzione ai giudizi prima espressi dal suo partito nei confronti del mio comportamento
305090	314170	quale presidente della Repubblica. Oggi possiamo gridare insieme a Salvi e se Scalfaro fosse
314170	322650	in Parlamento insieme a Scalfaro e vive il Parlamento e vive il presidente senza timore
322650	331430	di essere incriminati davanti alla Corte Costituzionale in sede penale. A parte la
331430	339310	velia affettuosa non posso che essere lietto di tutto questo istituzionalmente, politicamente
339310	345190	e se me lo consentite perché la politica è fatta di queste cose anche umanamente.
355230	359050	Al momento del voto sulla fiducia, come si esprimerà?
359050	364850	Al momento del voto della fiducia, poiché io non faccio parte di questa maggioranza anche
364850	372210	per mia storia politica e tradizione personale e familiare e non posso essere omologato
372210	378790	adesso, ma siccome mi sono battuto perché si raggiungesse la democrazia compiuta ed
378790	385910	in dubbio che lo schieramento guidato da Berlusconi ha vinto è solo per effetto dei giochetti
385910	393110	di questa, come si chiama, del pastroglio, cioè del pastrocchio e dell'imbroglio dell'onorevole
393110	400630	Sergio Mattarella. Il Mattarella, insomma, al Senato non ho avuto la maggioranza assoluta
400630	407490	Se il mio voto fosse necessario perché il governo passasse, allora io voterò a favore
407490	410190	del governo, altrimenti io mi astarrò.
412930	418190	Molti dicevano che lei sarebbe soddisfatto per l'ingresso di Don Ofrio e Berlinguele,
418230	420710	si è detto che il partito di Cossiga è rappresentato.
420770	427930	Il partito di Cossiga non esiste e non ha esistito, se non nei timori di molti ex amici
427930	435850	della democrazia cristiana, non degli amici del PDS che mi conoscono meglio di molti extranocristiani.
436810	441830	Sono contento per l'amico Francesco Don Ofrio che è stato nominato certamente per i suoi
441830	447230	meriti e non perché rappresenti me, perché io non faccio parte anche della maggioranza.
447930	452850	L'ambasciatore Berlinguer è stato nominato come un tecnico, ricordo che gli è stato
452850	460950	ambasciatore di carriera, consigliere di stato, è stato direttore generale prima dell'immigrazione
460950	466730	e poi direttore generale degli affari economici, consigliere diplomatico mio come presidente
466730	471650	del Consiglio, del presidente Forlani, del presidente Spadolini, consigliere diplomatico
471650	476590	del presidente della Repubblica, segretario generale della Presidenza Repubblica. Mi sembra
476590	483110	che si tratti di un intelligente, d'altronde così gli è la motivata scelta di fini che
483110	492250	si dimostra sempre di più un politico dotato di grosso senso dello stato, il quale ha voluto
492250	499230	dimostrare come alleanza nazionale privilegiasse l'istituzione di questo incarico rispetto al
499230	505110	titolare di esso. Tanto è vero che ottenuto l'incarico ha lasciato che Berlusconi scegliesse
505110	511090	un tecnico puro come Sergio Berlinguer. Sergio Berlinguer è molto conosciuto all'estero
511090	517470	oltre che per queste cariche per essere stato per ben due volte Sherpa, cioè il rappresentante
517470	523790	personale dei presidenti del Consiglio nella preparazione, nella gestione dei vertici dei
523790	533990	sette paesi più industrializzati. Al posto di preparazione presidente, invece Martino,
534990	540210	che preparazione ha per fare il ministro degli esteri secondo lei? Io sono convinto che il
540210	549010	patrimonio, che la cultura fa parte e l'esperienza entrano nel patrimonio genetico. Io non conosco
549010	555950	lui, conoscevo bene il padre che mi onorava della sua amicizia come io, mi onoravo di
555950	562610	essere suo amico, non ho l'onore e la fortuna di conoscere Martino, mi dicono tutti che
562610	573770	ha ereditato molte doti del padre, che è una persona squisitta, ha conoscenza dei
573770	579550	problemi economici interni e internazionali, io credo che possa degnissimamente essere il
579550	586570	capo della diplomazia del nostro Paese. La lettera di scafo è corretta condivisa nella
586570	591650	forma e anche nella sostanza, lei l'avrebbe fatto in un argomento così particolare? Questo
591650	596470	non si può mai dire, non si può mai chiedere a un politico che cosa avrebbe fatto se fosse
596470	603210	stato in un posto in cui non è. Lei però non è parso soddisfatto della scelta per
603210	610930	il titolare del ministro delle riforme istituzionali, ha avuto delle battute ironiche? Ripeto, lui
610930	619950	mi ha detto, ho detto semplicemente che mi sembrava un contributo significativo, tutto
619950	627430	italiano alla disputa non ancora soppita da Trashmit e Kelser sulla funzione di garanzia
627430	634510	nella costituzione scritta e che finalmente avremo un contributo tutto italiano alla disputa
634510	641310	sul neo federalismo che finora era stata alimentata solo dai contributi canadesi e nord americani.
642450	647590	Lui mi ha risposto che gli scienziati della politica ne abbiamo avuto troppi e io gli
647590	654950	rispondo che con la sua nomina non solo pareggiamo il conto ma andiamo in rosso. Presidente,
655130	665770	anche Presidente, Presidente, Presidente, Presidente, entro. Io frasi come quelle che
665770	670950	ha rivolto a lui, mi fa schifo, mi fa venire il vomito eccetera non ne so dire, perché
670950	678050	io non faccio parte della borghesia industriale tecnologica del nord, ma i miei antenatti
678050	684390	molto vicini erano pastori, quindi noi abbiamo un modo di esprimerci diverso da quello delle
684390	693310	popolazioni evolute del nord insomma. Posso fare una domanda Presidente, intravede anche
693310	700530	in termini problematici, così futuribili, una minaccia all'unità d'Italia? L'unità
700530	707990	d'Italia ha fondamenti nella storia, nella cultura, nel sacrificio di tutti i italiani
707990	716510	dalla prima guerra del vecchio regno di Sardegna alla resistenza, perché io sono ancora di
716510	722290	quelli che parlo di resistenza, come di antifascismo, ma questo è un vizio mentale cosa volete
722290	728550	che faccia, pur essendo di quelli che hanno lavorato perché fosse evitato il ghetto del
728550	736870	movimento sociale, forse perché non ho avuto mai bisogno nello nella mia famiglia di convertirci
736870	749870	tardivamente all'antifascismo, forse per questo. Pericolarità d'Italia, nessuno. Vorrei che
749870	756670	tutti noi avessimo il senso della nazione che hanno i tedeschi, gli austriaci, gli svizzeri
757010	763690	e gli americani, il cui sistema di governo è federale. Vorrei che avessimo tutti quel
763690	773130	senso della nazione. Non confondiamo l'unità d'Italia col centralismo, che sono cose diverse
773130	779390	e non dimentichiamo, questo non si vede che io sia federalista, ma non dimentichiamo che
779390	786990	l'origine del risorgimento è stata della sua componente cattolica, Gioberti, Giacomo
787010	795830	Balbo, Rosmini e nella sua componente laica. Cattanio è stata federalista e che solo poi
795830	805190	è prevalso sulla sponda repubblicana con Mazzini e sulla sponda non repubblicana, Cavur e la
805190	810890	società nazionale, i repubblicani che avevano addiritto a Vittorio Emanuele e Re d'Italia
810890	817930	e prevalso il disegno centralista, diventato poi disegno centralizzatore con la morte prematura
818450	828750	di Cavur che fece ritirare il disegno di legge Minghetti che rispettava le formazioni storiche
828750	834350	della nostra nazione. Minghetti cattolico liberale, quindi non sarebbe stato iscritto
834350	837570	al partito popolare, gli avrebbero respinto la domanda.
